מספר קופה/קרן/ח.פ. עבור חברת ביטוח,מספר מסלול,שם מנפיק,מספר מנפיק,סוג מספר מזהה מנפיק,שם נייר ערך,מספר נייר ערך,סוג מספר נייר ערך,מאפיין עיקרי,"ישראל/חו""ל",מדינה לפי חשיפה כלכלית,ענף מסחר,נכס בסיס,תאריך פקיעה,בעל עניין/צד קשור,תאריך רכישה,מטבע פעילות,סוג גורם משערך,תלות/אי-תלות המשערך,תאריך שערוך אחרון,שער מימוש,יחס המרה,ערך נקוב (יחידות),שער נייר הערך,שער חליפין,"שווי הוגן (בש""ח)",שיעור מנכסי אפיק ההשקעה,שיעור מסך נכסי ההשקעה
209,12119.0,"קבוצת אקרו בע""מ",511996803,ח.פ.,אפ לס אקרו 05.08.2026,IL0011849028,ISIN,מניה,ישראל,ישראל,בנייה,מניות לרבות מדדי מניות,2026-08-05,לא,2025-04-07,ILS,אחר,אי-תלות,2025-09-30,70.0,0.01,765.45,123.307002,1.0,0.94386,1.5e-05,0.0
209,12119.0,"אנלייט אנרגיה מתחדשת בע""מ",520041146,ח.פ.,CALL001 אנלייט 17.12.2025,IL0007200111,ISIN,מניה,ישראל,ישראל,אנרגיה מתחדשת,מניות לרבות מדדי מניות,2025-12-17,לא,2024-12-18,ILS,אחר,אי-תלות,2025-09-30,5869.0,1.0,16442.39,10190.0,1.0,1675.47915,0.02724,0.000149
209,12119.0,"טופ גאם תעשיות בע""מ",513561399,ח.פ.,אפ לס טופ גאם 31.01.2027,IL0011791428,ISIN,מניה,ישראל,ישראל,פודטק,מניות לרבות מדדי מניות,2027-01-31,לא,2025-07-31,ILS,אחר,אי-תלות,2025-09-30,1025.0,0.01,23173.2,125.559153,1.0,29.09607,0.000473,2e-06
209,12119.0,"אחים דוניץ בע""מ",520038605,ח.פ.,אפ לס דוניץ 31.12.25,IL0004000100,ISIN,מניה,ישראל,ישראל,בנייה,מניות לרבות מדדי מניות,2025-12-31,לא,2025-01-24,ILS,אחר,אי-תלות,2025-09-30,272.5,0.01,1243.05,1076.583553,1.0,13.38249,0.000217,1e-06
209,12119.0,"רוטשטיין נדל""ן בע""מ",520039959,ח.פ.,אפ לס בכספת-רוטשטין 26.07.2026,IL0005390153,ISIN,מניה,ישראל,ישראל,בנייה,מניות לרבות מדדי מניות,2026-07-26,לא,2025-01-28,ILS,אחר,אי-תלות,2025-09-30,73.0,0.01,6082.07,2363.490861,1.0,143.74922,0.002337,1.2e-05
209,12119.0,"אנלייט אנרגיה מתחדשת בע""מ",520041146,ח.פ.,CALL001 אנלייט 17.12.2025,IL0007200111,ISIN,מניה,ישראל,ישראל,אנרגיה מתחדשת,מניות לרבות מדדי מניות,2025-12-17,לא,2024-12-31,ILS,אחר,אי-תלות,2025-09-30,5869.0,1.0,50313.98,10190.0,1.0,5126.9944,0.083356,0.000457
209,12119.0,"אשדוד אנרגיה בע""מ",513846667,ח.פ.,אשדוד  ורמת נגב אנרגיה-קיקר 31.12.34,1004533,טיקר,מניה,ישראל,ישראל,אנרגיה,אחר,2034-12-31,לא,2019-03-06,ILS,מומחה בלתי תלוי,אי-תלות,2025-09-30,0.0,1.0,89849.58,108.8916,1.0,97.83865,0.00159,8e-06
209,12119.0,תחנות כח רמת חובב שותפות מוגבלת,540285947,ח.פ.,קיקר רמת חובב 30.06.40,10047344,טיקר,מניה,ישראל,ישראל,אנרגיה,אחר,2040-06-30,לא,2020-12-02,ILS,מומחה בלתי תלוי,אי-תלות,2025-09-30,0.0,1.0,75890.21,372.846983,1.0,282.95437,0.0046,2.5e-05
209,12119.0,"איי.פי.סי. ירושלים בע""מ",513731554,ח.פ.,איי.פי.סי-קיקר 03.09.29,10046044,טיקר,מניה,ישראל,ישראל,מלונאות ותיירות,אחר,2029-09-03,לא,2019-09-03,USD,מומחה בלתי תלוי,אי-תלות,2025-09-30,0.0,1.0,3798.47,239.875582,3.306,30.12294,0.000489,2e-06
209,12119.0,"אשדוד התפלה בע""מ",514357060,ח.פ.,אשדוד התפלה קיקר,84666750,טיקר,מניה,ישראל,ישראל,תשתיות,אחר,2038-09-08,לא,2022-08-22,ILS,מומחה בלתי תלוי,אי-תלות,2025-09-30,0.0,1.0,160027.86,110.369898,1.0,176.62259,0.002871,1.5e-05
209,12119.0,Avo,515658912,ח.פ.,אופציה תכנית 43,34026,טיקר,מניה,ישראל,"ארה""ב",השקעות בהיי-טק,אחר,2027-12-31,לא,2022-12-31,USD,מומחה בלתי תלוי,אי-תלות,2025-09-30,0.0,1.0,6799.27,2050.9348,3.306,461.01705,0.007495,4.1e-05
209,12119.0,"סולאיר אנרגיות מתחדשות בע""מ",516046307,ח.פ.,אפ לס סולאיר סדרה א 25.12.2025,11722872,פנימי,מניה,ישראל,ישראל,אנרגיה מתחדשת,מניות לרבות מדדי מניות,2025-12-25,לא,2024-04-30,ILS,אחר,אי-תלות,2025-09-30,38.52,0.01,3192.57,788.722208,1.0,25.18051,0.000409,2e-06
209,12119.0,PowerGen,10128,פנימי,PowerGen Option,34100,פנימי,מניה,ישראל,ישראל,תשתיות,תשתיות,2027-01-24,לא,2024-03-18,ILS,מומחה בלתי תלוי,אי-תלות,2025-09-30,0.0,1.0,17.53,100.0,1.0,0.01753,0.0,0.0
209,12119.0,"סולאיר אנרגיות מתחדשות בע""מ",516046307,ח.פ.,אפ לס סולאיר סדרה ב 25.12.2027,11722873,פנימי,מניה,ישראל,ישראל,אנרגיה מתחדשת,מניות לרבות מדדי מניות,2027-12-25,לא,2024-04-30,ILS,אחר,אי-תלות,2025-09-30,45.63,0.01,3192.57,1109.37802,1.0,35.41767,0.000575,3e-06
209,12119.0,CITI Bank,549300U8H3KN0K301B23,LEI,FXVOpt 145.0000 PUT USD-JPY 20.10.25,100120170,פנימי,"מט""ח",ישראל,ישראל,אחר,"מט""ח",2025-10-20,לא,2025-09-18,USD,אחר,אי-תלות,2025-09-30,145.0,1.0,-2265427.27,0.2748,3.306,-20.58715,-0.000334,-1e-06
209,12119.0,CITI Bank,549300U8H3KN0K301B23,LEI,FXVOpt 3.6800 CALL USD-PLN 30.10.25,100120432,פנימי,"מט""ח",ישראל,ישראל,אחר,"מט""ח",2025-10-30,לא,2025-09-29,USD,אחר,אי-תלות,2025-09-30,3.68,1.0,-1116764.81,0.5646,3.306,-20.84775,-0.000338,-1e-06
209,12119.0,"מאיר חברה למכוניות ומשאיות בע""מ",510485261,ח.פ.,קבוצת מאיר-אופציה לא סחירה,340271,פנימי,מניה,ישראל,ישראל,השקעה ואחזקות,אחר,2026-06-30,לא,2023-12-31,ILS,מומחה בלתי תלוי,אי-תלות,2025-09-30,0.0,1.0,3810.82,8069.8607,1.0,307.52786,0.004999,2.7e-05
209,12119.0,"בנק הפועלים בע""מ",520000118,ח.פ.,עסקת CALL001 פועלים 12.08.2026,IL0006625771,ISIN,מניה,"חו""ל",ישראל,בנקים,מניות לרבות מדדי מניות,2026-08-12,לא,2025-08-13,ILS,אחר,אי-תלות,2025-09-30,6389.0,1.0,62892.47,6732.0,1.0,4233.92128,0.068836,0.000377
209,12119.0,"בנק לאומי לישראל בע""מ",520018078,ח.פ.,עסקת CALL001 לאומי 12.08.2026,IL0006046119,ISIN,מניה,"חו""ל",ישראל,אשראי חוץ בנקאי,מניות לרבות מדדי מניות,2026-08-12,לא,2025-08-13,ILS,אחר,אי-תלות,2025-09-30,6157.0,1.0,60702.34,6529.0,1.0,3963.25546,0.064436,0.000353
209,12119.0,"בנק דיסקונט לישראל בע""מ",520007030,ח.פ.,CALL001 דיסקונט 26.5.26,IL0006912120,ISIN,מניה,"חו""ל",ישראל,אשראי חוץ בנקאי,מניות לרבות מדדי מניות,2026-05-26,לא,2025-05-27,ILS,אחר,אי-תלות,2025-09-30,2952.0,1.0,79517.54,3274.0,1.0,2603.40437,0.042327,0.000232
209,12119.0,"בנק הפועלים בע""מ",520000118,ח.פ.,עסקת פועלים CALL 18.09.26,IL0006625771,ISIN,מניה,"חו""ל",ישראל,בנקים,מניות לרבות מדדי מניות,2026-09-18,לא,2025-09-18,ILS,אחר,אי-תלות,2025-09-30,6415.0,1.0,63114.45,6732.0,1.0,4248.86454,0.069079,0.000379
209,12119.0,"כלל החזקות עסקי ביטוח בע""מ",520036120,ח.פ.,CALL001 כלל 17.12.25,IL0002240146,ISIN,מניה,"חו""ל",ישראל,אשראי חוץ בנקאי,מניות לרבות מדדי מניות,2025-12-17,לא,2024-12-22,ILS,אחר,אי-תלות,2025-09-30,8629.0,1.0,7399.11,16970.0,1.0,1255.62973,0.020414,0.000112
209,12119.0,"בנק הפועלים בע""מ",520000118,ח.פ.,פועלים 03.07.2026 CALL001,IL0006625771,ISIN,מניה,"חו""ל",ישראל,בנקים,מניות לרבות מדדי מניות,2026-07-03,לא,2025-07-03,ILS,אחר,אי-תלות,2025-09-30,6300.0,1.0,37809.47,6732.0,1.0,2545.33385,0.041382,0.000227
209,12119.0,"בנק לאומי לישראל בע""מ",520018078,ח.פ.,עסקת לאומי CALL 18.09.26,IL0006046119,ISIN,מניה,"חו""ל",ישראל,אשראי חוץ בנקאי,מניות לרבות מדדי מניות,2026-09-18,לא,2025-09-18,ILS,אחר,אי-תלות,2025-09-30,6235.0,1.0,64742.25,6529.0,1.0,4227.02161,0.068724,0.000377
209,12119.0,בזק,520031931,ח.פ.,CALL001 בזק 26/05/2026,IL0002300114,ISIN,מניה,"חו""ל",ישראל,אשראי חוץ בנקאי,מניות לרבות מדדי מניות,2026-05-26,לא,2025-05-27,ILS,אחר,אי-תלות,2025-09-30,551.6,1.0,335712.62,634.7,1.0,2130.76801,0.034642,0.00019
209,12119.0,בזק,520031931,ח.פ.,עסקת CALL בזק 29.01.26,IL0002300114,ISIN,מניה,"חו""ל",ישראל,אשראי חוץ בנקאי,מניות לרבות מדדי מניות,2026-01-29,לא,2025-01-30,ILS,אחר,אי-תלות,2025-09-30,1357.5756,1.0,466144.21,634.7,1.0,2958.61731,0.048102,0.000264
209,12119.0,"מימון ישיר מקבוצת ישיר(2006) בע""מ",513893123,ח.פ.,מימון ישיר 21.09.2026 CALL001,IL0001168186,ISIN,מניה,"חו""ל",ישראל,אשראי חוץ בנקאי,מניות לרבות מדדי מניות,2026-09-21,לא,2025-09-21,ILS,אחר,אי-תלות,2025-09-30,45160.0,1.0,739.91,49390.0,1.0,365.44226,0.005941,3.2e-05
209,12119.0,"בנק הפועלים בע""מ",520000118,ח.פ.,CALL001 פועלים 26.05.26,IL0006625771,ISIN,מניה,"חו""ל",ישראל,בנקים,מניות לרבות מדדי מניות,2026-05-26,לא,2025-05-27,ILS,אחר,אי-תלות,2025-09-30,5784.0,1.0,18068.64,6732.0,1.0,1216.38068,0.019776,0.000108
209,12119.0,"כלל החזקות עסקי ביטוח בע""מ",520036120,ח.פ.,CALL001 כלל 15.07.26,IL0002240146,ISIN,מניה,"חו""ל",ישראל,אשראי חוץ בנקאי,מניות לרבות מדדי מניות,2026-07-14,לא,2025-07-15,ILS,אחר,אי-תלות,2025-09-30,8629.0,1.0,9100.91,16970.0,1.0,1544.42456,0.025109,0.000137
209,12119.0,"בנק הפועלים בע""מ",520000118,ח.פ.,CALL001 פועלים 23.07.26,IL0006625771,ISIN,מניה,"חו""ל",ישראל,בנקים,מניות לרבות מדדי מניות,2026-07-23,לא,2025-07-24,ILS,אחר,אי-תלות,2025-09-30,6465.76,1.0,29596.46,6732.0,1.0,1992.43355,0.032393,0.000177
209,12119.0,"בנק לאומי לישראל בע""מ",520018078,ח.פ.,26.11.25 עסקת CALL לאומי,IL0006046119,ISIN,מניה,"חו""ל",ישראל,אשראי חוץ בנקאי,מניות לרבות מדדי מניות,2025-11-26,לא,2024-12-31,ILS,אחר,אי-תלות,2025-09-30,4259.0,1.0,93820.77,6529.0,1.0,6125.55817,0.099591,0.000546
209,12119.0,"ישראכרט בע""מ",510706153,ח.פ.,ישראכרט 07.05.2026 CALL001,IL0011574030,ISIN,מניה,"חו""ל",ישראל,אשראי חוץ בנקאי,מניות לרבות מדדי מניות,2026-05-07,לא,2025-05-07,ILS,אחר,אי-תלות,2025-09-30,1699.0,1.0,16905.79,1338.0,1.0,226.19951,0.003677,2e-05
209,12119.0,"בנק לאומי לישראל בע""מ",520018078,ח.פ.,26.09.26 עסקת CALL לאומי,IL0006046119,ISIN,מניה,"חו""ל",ישראל,אשראי חוץ בנקאי,מניות לרבות מדדי מניות,2026-09-26,לא,2025-09-26,ILS,אחר,אי-תלות,2025-09-30,5965.0,1.0,76218.1,6529.0,1.0,4976.27979,0.080906,0.000444
209,12119.0,"בנק הפועלים בע""מ",520000118,ח.פ.,26.11.25 עסקת CALL פועלים,IL0006625771,ISIN,מניה,"חו""ל",ישראל,בנקים,מניות לרבות מדדי מניות,2025-11-26,לא,2024-11-30,ILS,אחר,אי-תלות,2025-09-30,4272.0,1.0,59829.24,6732.0,1.0,4027.70441,0.065483,0.000359
209,12119.0,"בנק הפועלים בע""מ",520000118,ח.פ.,26.09.2026 עסקת CALL פועלים,IL0006625771,ISIN,מניה,"חו""ל",ישראל,בנקים,מניות לרבות מדדי מניות,2026-09-26,לא,2025-09-26,ILS,אחר,אי-תלות,2025-09-30,6172.0,1.0,41242.66,6732.0,1.0,2776.45615,0.04514,0.000247
209,12119.0,"מימון ישיר מקבוצת ישיר(2006) בע""מ",513893123,ח.פ.,מימון ישיר 26.03.2026 CALL001,IL0001168186,ISIN,מניה,"חו""ל",ישראל,אשראי חוץ בנקאי,מניות לרבות מדדי מניות,2026-03-26,לא,2025-03-26,ILS,אחר,אי-תלות,2025-09-30,53970.0,1.0,111.73,49390.0,1.0,55.18178,0.000897,4e-06
209,12119.0,נאוויטס פטרוליום שותפות מוגבלת,550263107,ח.פ.,קיקר נאוויטס פטרוליום שותפות מוגבל,10048041,פנימי,מניה,"חו""ל","ארה""ב","Oil, Gas & Consumable Fuels",אחר,2027-04-01,לא,2022-11-24,USD,מומחה בלתי תלוי,אי-תלות,2025-09-30,0.0,1.0,77558.85,107.832586,3.306,276.49305,0.004495,2.4e-05
209,12119.0,ECO SUN ORADEA S.R.L,7659,פנימי,Ecoenergy Romania option  Melinesti,34139,פנימי,מניה,"חו""ל",רומניה,אנרגיה מתחדשת,תשתיות,2025-12-31,לא,2024-08-20,EUR,מומחה בלתי תלוי,אי-תלות,2025-09-30,0.0,1.0,0.75,2646000.0,3.8807,77.01249,0.001252,6e-06
209,12119.0,ECO SUN ORADEA S.R.L,7659,פנימי,אקואנרגי רומניה 7.25% אירו 31.03.24-אופ ל.ס אורדאה,340292,פנימי,מניה,"חו""ל",רומניה,אנרגיה מתחדשת,תשתיות,2025-12-31,לא,2023-12-31,EUR,מומחה בלתי תלוי,אי-תלות,2025-09-30,0.0,1.0,103995.06,54.089135,3.8807,218.28948,0.003549,1.9e-05
209,12119.0,יבולי שמש,515689198,ח.פ.,יבולי שמש אופציה,34140,פנימי,מניה,"חו""ל",רומניה,אנרגיה מתחדשת,תשתיות,2025-12-31,לא,2024-08-20,EUR,מומחה בלתי תלוי,אי-תלות,2025-09-30,0.0,1.0,0.17,148000000.0,3.8807,965.82378,0.015702,8.6e-05
209,12119.0,Odysight.ai Inc,549300FBP1ANSJE5TE25,LEI,אפ לס ODYS US 31/03/2026,620080903,פנימי,מניה,"חו""ל","ארה""ב","Electronic Equipment, Instruments & Components",מניות לרבות מדדי מניות,2026-03-31,לא,2023-03-27,USD,אחר,אי-תלות,2025-09-30,1.15,1.0,11838.58,0.608,3.306,0.23798,3e-06,0.0
209,12119.0,ECO SUN ORADEA S.R.L,7659,פנימי,Ecoenergy Romania option Scurtu Mare,34137,פנימי,מניה,"חו""ל",רומניה,אנרגיה מתחדשת,תשתיות,2025-12-31,לא,2024-08-20,EUR,מומחה בלתי תלוי,אי-תלות,2025-09-30,0.0,1.0,0.75,2807000.0,3.8807,81.69843,0.001328,7e-06
209,12119.0,ECO SUN ORADEA S.R.L,7659,פנימי,Ecoenergy Romania Bobisecti,34138,פנימי,מניה,"חו""ל",רומניה,אנרגיה מתחדשת,תשתיות,2025-12-31,לא,2024-08-20,EUR,מומחה בלתי תלוי,אי-תלות,2025-09-30,0.0,1.0,0.75,1700000.0,3.8807,49.47892,0.000804,4e-06
209,12119.0,Odysight.ai Inc,549300FBP1ANSJE5TE25,LEI,אפ לס ODYS US 31/03/2026,620080901,פנימי,מניה,"חו""ל","ארה""ב","Electronic Equipment, Instruments & Components",מניות לרבות מדדי מניות,2026-03-31,לא,2022-03-18,USD,אחר,אי-תלות,2025-09-30,5.5,1.0,8540.95,0.0,3.306,0.0,0.0,0.0
209,14285.0,"אנלייט אנרגיה מתחדשת בע""מ",520041146,ח.פ.,CALL001 אנלייט 17.12.2025,IL0007200111,ISIN,מניה,ישראל,ישראל,אנרגיה מתחדשת,מניות לרבות מדדי מניות,2025-12-17,לא,2024-12-31,ILS,אחר,אי-תלות,2025-09-30,5869.0,1.0,358.33,10190.0,1.0,36.51408,0.087646,0.000795
209,14285.0,"טופ גאם תעשיות בע""מ",513561399,ח.פ.,אפ לס טופ גאם 31.01.2027,IL0011791428,ISIN,מניה,ישראל,ישראל,פודטק,מניות לרבות מדדי מניות,2027-01-31,לא,2025-07-31,ILS,אחר,אי-תלות,2025-09-30,1025.0,0.01,165.04,125.559153,1.0,0.20722,0.000497,4e-06
209,14285.0,"רוטשטיין נדל""ן בע""מ",520039959,ח.פ.,אפ לס בכספת-רוטשטין 26.07.2026,IL0005390153,ISIN,מניה,ישראל,ישראל,בנייה,מניות לרבות מדדי מניות,2026-07-26,לא,2025-01-28,ILS,אחר,אי-תלות,2025-09-30,73.0,0.01,43.32,2363.490861,1.0,1.02377,0.002457,2.2e-05
209,14285.0,"אנלייט אנרגיה מתחדשת בע""מ",520041146,ח.פ.,CALL001 אנלייט 17.12.2025,IL0007200111,ISIN,מניה,ישראל,ישראל,אנרגיה מתחדשת,מניות לרבות מדדי מניות,2025-12-17,לא,2024-12-18,ILS,אחר,אי-תלות,2025-09-30,5869.0,1.0,117.1,10190.0,1.0,11.93264,0.028642,0.00026
209,14285.0,"קבוצת אקרו בע""מ",511996803,ח.פ.,אפ לס אקרו 05.08.2026,IL0011849028,ISIN,מניה,ישראל,ישראל,בנייה,מניות לרבות מדדי מניות,2026-08-05,לא,2025-04-07,ILS,אחר,אי-תלות,2025-09-30,70.0,0.01,5.45,123.307002,1.0,0.00672,1.6e-05,0.0
209,14285.0,"אחים דוניץ בע""מ",520038605,ח.פ.,אפ לס דוניץ 31.12.25,IL0004000100,ISIN,מניה,ישראל,ישראל,בנייה,מניות לרבות מדדי מניות,2025-12-31,לא,2025-01-24,ILS,אחר,אי-תלות,2025-09-30,272.5,0.01,8.85,1076.583553,1.0,0.09531,0.000228,2e-06
209,14285.0,"סולאיר אנרגיות מתחדשות בע""מ",516046307,ח.פ.,אפ לס סולאיר סדרה ב 25.12.2027,11722873,פנימי,מניה,ישראל,ישראל,אנרגיה מתחדשת,מניות לרבות מדדי מניות,2027-12-25,לא,2024-04-30,ILS,אחר,אי-תלות,2025-09-30,45.63,0.01,22.74,1109.37802,1.0,0.25224,0.000605,5e-06
209,14285.0,CITI Bank,549300U8H3KN0K301B23,LEI,FXVOpt 145.0000 PUT USD-JPY 20.10.25,100120170,פנימי,"מט""ח",ישראל,ישראל,אחר,"מט""ח",2025-10-20,לא,2025-09-18,USD,אחר,אי-תלות,2025-09-30,145.0,1.0,-18745.36,0.2748,3.306,-0.17035,-0.000408,-3e-06
209,14285.0,CITI Bank,549300U8H3KN0K301B23,LEI,FXVOpt 3.6800 CALL USD-PLN 30.10.25,100120432,פנימי,"מט""ח",ישראל,ישראל,אחר,"מט""ח",2025-10-30,לא,2025-09-29,USD,אחר,אי-תלות,2025-09-30,3.68,1.0,-1176.48,0.5646,3.306,-0.02196,-5.2e-05,0.0
209,14285.0,"סולאיר אנרגיות מתחדשות בע""מ",516046307,ח.פ.,אפ לס סולאיר סדרה א 25.12.2025,11722872,פנימי,מניה,ישראל,ישראל,אנרגיה מתחדשת,מניות לרבות מדדי מניות,2025-12-25,לא,2024-04-30,ILS,אחר,אי-תלות,2025-09-30,38.52,0.01,22.74,788.722208,1.0,0.17933,0.00043,3e-06
209,14285.0,"מימון ישיר מקבוצת ישיר(2006) בע""מ",513893123,ח.פ.,מימון ישיר 21.09.2026 CALL001,IL0001168186,ISIN,מניה,"חו""ל",ישראל,אשראי חוץ בנקאי,מניות לרבות מדדי מניות,2026-09-21,לא,2025-09-21,ILS,אחר,אי-תלות,2025-09-30,45160.0,1.0,5.27,49390.0,1.0,2.60265,0.006247,5.6e-05
209,14285.0,"בנק הפועלים בע""מ",520000118,ח.פ.,CALL001 פועלים 26.05.26,IL0006625771,ISIN,מניה,"חו""ל",ישראל,בנקים,מניות לרבות מדדי מניות,2026-05-26,לא,2025-05-27,ILS,אחר,אי-תלות,2025-09-30,5784.0,1.0,128.68,6732.0,1.0,8.66297,0.020794,0.000188
209,14285.0,"בנק לאומי לישראל בע""מ",520018078,ח.פ.,26.09.26 עסקת CALL לאומי,IL0006046119,ISIN,מניה,"חו""ל",ישראל,אשראי חוץ בנקאי,מניות לרבות מדדי מניות,2026-09-26,לא,2025-09-26,ILS,אחר,אי-תלות,2025-09-30,5965.0,1.0,542.82,6529.0,1.0,35.4407,0.085069,0.000772
209,14285.0,"בנק לאומי לישראל בע""מ",520018078,ח.פ.,עסקת לאומי CALL 18.09.26,IL0006046119,ISIN,מניה,"חו""ל",ישראל,אשראי חוץ בנקאי,מניות לרבות מדדי מניות,2026-09-18,לא,2025-09-18,ILS,אחר,אי-תלות,2025-09-30,6235.0,1.0,461.09,6529.0,1.0,30.10454,0.072261,0.000656
209,14285.0,"מימון ישיר מקבוצת ישיר(2006) בע""מ",513893123,ח.פ.,מימון ישיר 26.03.2026 CALL001,IL0001168186,ISIN,מניה,"חו""ל",ישראל,אשראי חוץ בנקאי,מניות לרבות מדדי מניות,2026-03-26,לא,2025-03-26,ILS,אחר,אי-תלות,2025-09-30,53970.0,1.0,0.8,49390.0,1.0,0.393,0.000943,8e-06
209,14285.0,"ישראכרט בע""מ",510706153,ח.פ.,ישראכרט 07.05.2026 CALL001,IL0011574030,ISIN,מניה,"חו""ל",ישראל,אשראי חוץ בנקאי,מניות לרבות מדדי מניות,2026-05-07,לא,2025-05-07,ILS,אחר,אי-תלות,2025-09-30,1699.0,1.0,120.4,1338.0,1.0,1.61098,0.003866,3.5e-05
209,14285.0,"בנק הפועלים בע""מ",520000118,ח.פ.,CALL001 פועלים 23.07.26,IL0006625771,ISIN,מניה,"חו""ל",ישראל,בנקים,מניות לרבות מדדי מניות,2026-07-23,לא,2025-07-24,ILS,אחר,אי-תלות,2025-09-30,6465.76,1.0,210.78,6732.0,1.0,14.18997,0.03406,0.000309
209,14285.0,בזק,520031931,ח.פ.,עסקת CALL בזק 29.01.26,IL0002300114,ISIN,מניה,"חו""ל",ישראל,אשראי חוץ בנקאי,מניות לרבות מדדי מניות,2026-01-29,לא,2025-01-30,ILS,אחר,אי-תלות,2025-09-30,1357.5756,1.0,3319.84,634.7,1.0,21.07106,0.050577,0.000459
209,14285.0,"בנק הפועלים בע""מ",520000118,ח.פ.,עסקת CALL001 פועלים 12.08.2026,IL0006625771,ISIN,מניה,"חו""ל",ישראל,בנקים,מניות לרבות מדדי מניות,2026-08-12,לא,2025-08-13,ILS,אחר,אי-תלות,2025-09-30,6389.0,1.0,447.92,6732.0,1.0,30.15368,0.072379,0.000657
209,14285.0,"בנק לאומי לישראל בע""מ",520018078,ח.פ.,עסקת CALL001 לאומי 12.08.2026,IL0006046119,ISIN,מניה,"חו""ל",ישראל,אשראי חוץ בנקאי,מניות לרבות מדדי מניות,2026-08-12,לא,2025-08-13,ILS,אחר,אי-תלות,2025-09-30,6157.0,1.0,432.32,6529.0,1.0,28.22602,0.067752,0.000615
209,14285.0,"בנק הפועלים בע""מ",520000118,ח.פ.,26.09.2026 עסקת CALL פועלים,IL0006625771,ISIN,מניה,"חו""ל",ישראל,בנקים,מניות לרבות מדדי מניות,2026-09-26,לא,2025-09-26,ILS,אחר,אי-תלות,2025-09-30,6172.0,1.0,293.73,6732.0,1.0,19.77372,0.047463,0.00043
209,14285.0,"בנק דיסקונט לישראל בע""מ",520007030,ח.פ.,CALL001 דיסקונט 26.5.26,IL0006912120,ISIN,מניה,"חו""ל",ישראל,אשראי חוץ בנקאי,מניות לרבות מדדי מניות,2026-05-26,לא,2025-05-27,ILS,אחר,אי-תלות,2025-09-30,2952.0,1.0,566.32,3274.0,1.0,18.54126,0.044505,0.000404
209,14285.0,"בנק הפועלים בע""מ",520000118,ח.פ.,26.11.25 עסקת CALL פועלים,IL0006625771,ISIN,מניה,"חו""ל",ישראל,בנקים,מניות לרבות מדדי מניות,2025-11-26,לא,2024-11-30,ILS,אחר,אי-תלות,2025-09-30,4272.0,1.0,426.1,6732.0,1.0,28.68502,0.068853,0.000625
209,14285.0,"כלל החזקות עסקי ביטוח בע""מ",520036120,ח.פ.,CALL001 כלל 15.07.26,IL0002240146,ISIN,מניה,"חו""ל",ישראל,אשראי חוץ בנקאי,מניות לרבות מדדי מניות,2026-07-14,לא,2025-07-15,ILS,אחר,אי-תלות,2025-09-30,8629.0,1.0,64.82,16970.0,1.0,10.99928,0.026402,0.000239
209,14285.0,בזק,520031931,ח.פ.,CALL001 בזק 26/05/2026,IL0002300114,ISIN,מניה,"חו""ל",ישראל,אשראי חוץ בנקאי,מניות לרבות מדדי מניות,2026-05-26,לא,2025-05-27,ILS,אחר,אי-תלות,2025-09-30,551.6,1.0,2390.92,634.7,1.0,15.17517,0.036425,0.00033
209,14285.0,"בנק הפועלים בע""מ",520000118,ח.פ.,עסקת פועלים CALL 18.09.26,IL0006625771,ISIN,מניה,"חו""ל",ישראל,בנקים,מניות לרבות מדדי מניות,2026-09-18,לא,2025-09-18,ILS,אחר,אי-תלות,2025-09-30,6415.0,1.0,449.5,6732.0,1.0,30.2601,0.072634,0.000659
209,14285.0,"בנק לאומי לישראל בע""מ",520018078,ח.פ.,26.11.25 עסקת CALL לאומי,IL0006046119,ISIN,מניה,"חו""ל",ישראל,אשראי חוץ בנקאי,מניות לרבות מדדי מניות,2025-11-26,לא,2024-12-31,ILS,אחר,אי-תלות,2025-09-30,4259.0,1.0,668.18,6529.0,1.0,43.62578,0.104716,0.00095
209,14285.0,"כלל החזקות עסקי ביטוח בע""מ",520036120,ח.פ.,CALL001 כלל 17.12.25,IL0002240146,ISIN,מניה,"חו""ל",ישראל,אשראי חוץ בנקאי,מניות לרבות מדדי מניות,2025-12-17,לא,2024-12-22,ILS,אחר,אי-תלות,2025-09-30,8629.0,1.0,52.7,16970.0,1.0,8.9425,0.021465,0.000194
209,14285.0,"בנק הפועלים בע""מ",520000118,ח.פ.,פועלים 03.07.2026 CALL001,IL0006625771,ISIN,מניה,"חו""ל",ישראל,בנקים,מניות לרבות מדדי מניות,2026-07-03,לא,2025-07-03,ILS,אחר,אי-תלות,2025-09-30,6300.0,1.0,269.28,6732.0,1.0,18.12768,0.043512,0.000395
209,14285.0,Odysight.ai Inc,549300FBP1ANSJE5TE25,LEI,אפ לס ODYS US 31/03/2026,620080901,פנימי,מניה,"חו""ל","ארה""ב","Electronic Equipment, Instruments & Components",מניות לרבות מדדי מניות,2026-03-31,לא,2022-03-18,USD,אחר,אי-תלות,2025-09-30,5.5,1.0,60.83,0.0,3.306,0.0,0.0,0.0
209,14285.0,Odysight.ai Inc,549300FBP1ANSJE5TE25,LEI,אפ לס ODYS US 31/03/2026,620080903,פנימי,מניה,"חו""ל","ארה""ב","Electronic Equipment, Instruments & Components",מניות לרבות מדדי מניות,2026-03-31,לא,2023-03-27,USD,אחר,אי-תלות,2025-09-30,1.15,1.0,84.31,0.608,3.306,0.00169,4e-06,0.0
209,15217.0,"אנלייט אנרגיה מתחדשת בע""מ",520041146,ח.פ.,CALL001 אנלייט 17.12.2025,IL0007200111,ISIN,מניה,ישראל,ישראל,אנרגיה מתחדשת,מניות לרבות מדדי מניות,2025-12-17,לא,2024-12-18,ILS,אחר,אי-תלות,2025-09-30,5869.0,1.0,59.13,10190.0,1.0,6.02509,0.028629,0.000352
209,15217.0,"טופ גאם תעשיות בע""מ",513561399,ח.פ.,אפ לס טופ גאם 31.01.2027,IL0011791428,ISIN,מניה,ישראל,ישראל,פודטק,מניות לרבות מדדי מניות,2027-01-31,לא,2025-07-31,ILS,אחר,אי-תלות,2025-09-30,1025.0,0.01,83.33,125.559153,1.0,0.10463,0.000497,6e-06
209,15217.0,"אחים דוניץ בע""מ",520038605,ח.פ.,אפ לס דוניץ 31.12.25,IL0004000100,ISIN,מניה,ישראל,ישראל,בנייה,מניות לרבות מדדי מניות,2025-12-31,לא,2025-01-24,ILS,אחר,אי-תלות,2025-09-30,272.5,0.01,4.47,1076.583553,1.0,0.04812,0.000228,2e-06
209,15217.0,"קבוצת אקרו בע""מ",511996803,ח.פ.,אפ לס אקרו 05.08.2026,IL0011849028,ISIN,מניה,ישראל,ישראל,בנייה,מניות לרבות מדדי מניות,2026-08-05,לא,2025-04-07,ILS,אחר,אי-תלות,2025-09-30,70.0,0.01,2.75,123.307002,1.0,0.00339,1.6e-05,0.0
209,15217.0,"רוטשטיין נדל""ן בע""מ",520039959,ח.פ.,אפ לס בכספת-רוטשטין 26.07.2026,IL0005390153,ISIN,מניה,ישראל,ישראל,בנייה,מניות לרבות מדדי מניות,2026-07-26,לא,2025-01-28,ILS,אחר,אי-תלות,2025-09-30,73.0,0.01,21.87,2363.490861,1.0,0.51693,0.002456,3e-05
209,15217.0,"אנלייט אנרגיה מתחדשת בע""מ",520041146,ח.פ.,CALL001 אנלייט 17.12.2025,IL0007200111,ISIN,מניה,ישראל,ישראל,אנרגיה מתחדשת,מניות לרבות מדדי מניות,2025-12-17,לא,2024-12-31,ILS,אחר,אי-תלות,2025-09-30,5869.0,1.0,180.93,10190.0,1.0,18.43689,0.087605,0.001077
209,15217.0,"סולאיר אנרגיות מתחדשות בע""מ",516046307,ח.פ.,אפ לס סולאיר סדרה א 25.12.2025,11722872,פנימי,מניה,ישראל,ישראל,אנרגיה מתחדשת,מניות לרבות מדדי מניות,2025-12-25,לא,2024-04-30,ILS,אחר,אי-תלות,2025-09-30,38.52,0.01,11.48,788.722208,1.0,0.09055,0.00043,5e-06
209,15217.0,"סולאיר אנרגיות מתחדשות בע""מ",516046307,ח.פ.,אפ לס סולאיר סדרה ב 25.12.2027,11722873,פנימי,מניה,ישראל,ישראל,אנרגיה מתחדשת,מניות לרבות מדדי מניות,2027-12-25,לא,2024-04-30,ILS,אחר,אי-תלות,2025-09-30,45.63,0.01,11.48,1109.37802,1.0,0.12736,0.000605,7e-06
209,15217.0,"בנק הפועלים בע""מ",520000118,ח.פ.,פועלים 03.07.2026 CALL001,IL0006625771,ISIN,מניה,"חו""ל",ישראל,בנקים,מניות לרבות מדדי מניות,2026-07-03,לא,2025-07-03,ILS,אחר,אי-תלות,2025-09-30,6300.0,1.0,135.96,6732.0,1.0,9.15313,0.043492,0.000534
209,15217.0,"בנק הפועלים בע""מ",520000118,ח.פ.,עסקת פועלים CALL 18.09.26,IL0006625771,ISIN,מניה,"חו""ל",ישראל,בנקים,מניות לרבות מדדי מניות,2026-09-18,לא,2025-09-18,ILS,אחר,אי-תלות,2025-09-30,6415.0,1.0,226.96,6732.0,1.0,15.2791,0.072601,0.000892
209,15217.0,"בנק הפועלים בע""מ",520000118,ח.פ.,עסקת CALL001 פועלים 12.08.2026,IL0006625771,ISIN,מניה,"חו""ל",ישראל,בנקים,מניות לרבות מדדי מניות,2026-08-12,לא,2025-08-13,ILS,אחר,אי-תלות,2025-09-30,6389.0,1.0,226.16,6732.0,1.0,15.22536,0.072345,0.000889
209,15217.0,"כלל החזקות עסקי ביטוח בע""מ",520036120,ח.פ.,CALL001 כלל 15.07.26,IL0002240146,ISIN,מניה,"חו""ל",ישראל,אשראי חוץ בנקאי,מניות לרבות מדדי מניות,2026-07-14,לא,2025-07-15,ILS,אחר,אי-תלות,2025-09-30,8629.0,1.0,32.73,16970.0,1.0,5.55382,0.026389,0.000324
209,15217.0,"בנק לאומי לישראל בע""מ",520018078,ח.פ.,26.09.26 עסקת CALL לאומי,IL0006046119,ISIN,מניה,"חו""ל",ישראל,אשראי חוץ בנקאי,מניות לרבות מדדי מניות,2026-09-26,לא,2025-09-26,ILS,אחר,אי-תלות,2025-09-30,5965.0,1.0,274.08,6529.0,1.0,17.89491,0.08503,0.001045
209,15217.0,בזק,520031931,ח.פ.,CALL001 בזק 26/05/2026,IL0002300114,ISIN,מניה,"חו""ל",ישראל,אשראי חוץ בנקאי,מניות לרבות מדדי מניות,2026-05-26,לא,2025-05-27,ILS,אחר,אי-תלות,2025-09-30,551.6,1.0,1207.24,634.7,1.0,7.66233,0.036408,0.000447
209,15217.0,"ישראכרט בע""מ",510706153,ח.פ.,ישראכרט 07.05.2026 CALL001,IL0011574030,ISIN,מניה,"חו""ל",ישראל,אשראי חוץ בנקאי,מניות לרבות מדדי מניות,2026-05-07,לא,2025-05-07,ILS,אחר,אי-תלות,2025-09-30,1699.0,1.0,60.79,1338.0,1.0,0.81342,0.003865,4.7e-05
209,15217.0,"בנק לאומי לישראל בע""מ",520018078,ח.פ.,26.11.25 עסקת CALL לאומי,IL0006046119,ISIN,מניה,"חו""ל",ישראל,אשראי חוץ בנקאי,מניות לרבות מדדי מניות,2025-11-26,לא,2024-12-31,ILS,אחר,אי-תלות,2025-09-30,4259.0,1.0,337.38,6529.0,1.0,22.02777,0.104668,0.001287
209,15217.0,"בנק לאומי לישראל בע""מ",520018078,ח.פ.,עסקת לאומי CALL 18.09.26,IL0006046119,ISIN,מניה,"חו""ל",ישראל,אשראי חוץ בנקאי,מניות לרבות מדדי מניות,2026-09-18,לא,2025-09-18,ILS,אחר,אי-תלות,2025-09-30,6235.0,1.0,232.82,6529.0,1.0,15.20055,0.072227,0.000888
209,15217.0,"בנק הפועלים בע""מ",520000118,ח.פ.,CALL001 פועלים 26.05.26,IL0006625771,ISIN,מניה,"חו""ל",ישראל,בנקים,מניות לרבות מדדי מניות,2026-05-26,לא,2025-05-27,ILS,אחר,אי-תלות,2025-09-30,5784.0,1.0,64.98,6732.0,1.0,4.37416,0.020784,0.000255
209,15217.0,"כלל החזקות עסקי ביטוח בע""מ",520036120,ח.פ.,CALL001 כלל 17.12.25,IL0002240146,ISIN,מניה,"חו""ל",ישראל,אשראי חוץ בנקאי,מניות לרבות מדדי מניות,2025-12-17,לא,2024-12-22,ILS,אחר,אי-תלות,2025-09-30,8629.0,1.0,26.61,16970.0,1.0,4.5153,0.021455,0.000263
209,15217.0,"בנק הפועלים בע""מ",520000118,ח.פ.,26.11.25 עסקת CALL פועלים,IL0006625771,ISIN,מניה,"חו""ל",ישראל,בנקים,מניות לרבות מדדי מניות,2025-11-26,לא,2024-11-30,ILS,אחר,אי-תלות,2025-09-30,4272.0,1.0,215.15,6732.0,1.0,14.4838,0.068822,0.000846
209,15217.0,"בנק דיסקונט לישראל בע""מ",520007030,ח.פ.,CALL001 דיסקונט 26.5.26,IL0006912120,ISIN,מניה,"חו""ל",ישראל,אשראי חוץ בנקאי,מניות לרבות מדדי מניות,2026-05-26,לא,2025-05-27,ILS,אחר,אי-תלות,2025-09-30,2952.0,1.0,285.95,3274.0,1.0,9.36195,0.044484,0.000547
209,15217.0,בזק,520031931,ח.פ.,עסקת CALL בזק 29.01.26,IL0002300114,ISIN,מניה,"חו""ל",ישראל,אשראי חוץ בנקאי,מניות לרבות מדדי מניות,2026-01-29,לא,2025-01-30,ILS,אחר,אי-תלות,2025-09-30,1357.5756,1.0,1676.27,634.7,1.0,10.63931,0.050554,0.000621
209,15217.0,"מימון ישיר מקבוצת ישיר(2006) בע""מ",513893123,ח.פ.,מימון ישיר 21.09.2026 CALL001,IL0001168186,ISIN,מניה,"חו""ל",ישראל,אשראי חוץ בנקאי,מניות לרבות מדדי מניות,2026-09-21,לא,2025-09-21,ILS,אחר,אי-תלות,2025-09-30,45160.0,1.0,2.66,49390.0,1.0,1.31415,0.006244,7.6e-05
209,15217.0,"בנק הפועלים בע""מ",520000118,ח.פ.,26.09.2026 עסקת CALL פועלים,IL0006625771,ISIN,מניה,"חו""ל",ישראל,בנקים,מניות לרבות מדדי מניות,2026-09-26,לא,2025-09-26,ILS,אחר,אי-תלות,2025-09-30,6172.0,1.0,148.31,6732.0,1.0,9.98425,0.047441,0.000583
209,15217.0,"בנק לאומי לישראל בע""מ",520018078,ח.פ.,עסקת CALL001 לאומי 12.08.2026,IL0006046119,ISIN,מניה,"חו""ל",ישראל,אשראי חוץ בנקאי,מניות לרבות מדדי מניות,2026-08-12,לא,2025-08-13,ILS,אחר,אי-תלות,2025-09-30,6157.0,1.0,218.29,6529.0,1.0,14.25203,0.06772,0.000832
209,15217.0,"מימון ישיר מקבוצת ישיר(2006) בע""מ",513893123,ח.פ.,מימון ישיר 26.03.2026 CALL001,IL0001168186,ISIN,מניה,"חו""ל",ישראל,אשראי חוץ בנקאי,מניות לרבות מדדי מניות,2026-03-26,לא,2025-03-26,ILS,אחר,אי-תלות,2025-09-30,53970.0,1.0,0.4,49390.0,1.0,0.19844,0.000942,1.1e-05
209,15217.0,"בנק הפועלים בע""מ",520000118,ח.פ.,CALL001 פועלים 23.07.26,IL0006625771,ISIN,מניה,"חו""ל",ישראל,בנקים,מניות לרבות מדדי מניות,2026-07-23,לא,2025-07-24,ILS,אחר,אי-תלות,2025-09-30,6465.76,1.0,106.43,6732.0,1.0,7.16488,0.034045,0.000418
209,15217.0,Odysight.ai Inc,549300FBP1ANSJE5TE25,LEI,אפ לס ODYS US 31/03/2026,620080903,פנימי,מניה,"חו""ל","ארה""ב","Electronic Equipment, Instruments & Components",מניות לרבות מדדי מניות,2026-03-31,לא,2023-03-27,USD,אחר,אי-תלות,2025-09-30,1.15,1.0,42.57,0.608,3.306,0.00086,4e-06,0.0
209,15217.0,Odysight.ai Inc,549300FBP1ANSJE5TE25,LEI,אפ לס ODYS US 31/03/2026,620080901,פנימי,מניה,"חו""ל","ארה""ב","Electronic Equipment, Instruments & Components",מניות לרבות מדדי מניות,2026-03-31,לא,2022-03-18,USD,אחר,אי-תלות,2025-09-30,5.5,1.0,30.71,0.0,3.306,0.0,0.0,0.0
209,15218.0,"אחים דוניץ בע""מ",520038605,ח.פ.,אפ לס דוניץ 31.12.25,IL0004000100,ISIN,מניה,ישראל,ישראל,בנייה,מניות לרבות מדדי מניות,2025-12-31,לא,2025-01-24,ILS,אחר,אי-תלות,2025-09-30,272.5,0.01,486.49,1076.583553,1.0,5.2375,0.000228,1e-05
209,15218.0,"טופ גאם תעשיות בע""מ",513561399,ח.פ.,אפ לס טופ גאם 31.01.2027,IL0011791428,ISIN,מניה,ישראל,ישראל,פודטק,מניות לרבות מדדי מניות,2027-01-31,לא,2025-07-31,ILS,אחר,אי-תלות,2025-09-30,1025.0,0.01,9069.29,125.559153,1.0,11.38732,0.000497,2.2e-05
209,15218.0,"קבוצת אקרו בע""מ",511996803,ח.פ.,אפ לס אקרו 05.08.2026,IL0011849028,ISIN,מניה,ישראל,ישראל,בנייה,מניות לרבות מדדי מניות,2026-08-05,לא,2025-04-07,ILS,אחר,אי-תלות,2025-09-30,70.0,0.01,299.58,123.307002,1.0,0.3694,1.6e-05,0.0
209,15218.0,"רוטשטיין נדל""ן בע""מ",520039959,ח.פ.,אפ לס בכספת-רוטשטין 26.07.2026,IL0005390153,ISIN,מניה,ישראל,ישראל,בנייה,מניות לרבות מדדי מניות,2026-07-26,לא,2025-01-28,ILS,אחר,אי-תלות,2025-09-30,73.0,0.01,2380.34,2363.490861,1.0,56.25907,0.002456,0.00011
209,15218.0,"אנלייט אנרגיה מתחדשת בע""מ",520041146,ח.פ.,CALL001 אנלייט 17.12.2025,IL0007200111,ISIN,מניה,ישראל,ישראל,אנרגיה מתחדשת,מניות לרבות מדדי מניות,2025-12-17,לא,2024-12-18,ILS,אחר,אי-תלות,2025-09-30,5869.0,1.0,6435.05,10190.0,1.0,655.7316,0.028629,0.001289
209,15218.0,"אנלייט אנרגיה מתחדשת בע""מ",520041146,ח.פ.,CALL001 אנלייט 17.12.2025,IL0007200111,ISIN,מניה,ישראל,ישראל,אנרגיה מתחדשת,מניות לרבות מדדי מניות,2025-12-17,לא,2024-12-31,ILS,אחר,אי-תלות,2025-09-30,5869.0,1.0,19691.36,10190.0,1.0,2006.54973,0.087605,0.003946
209,15218.0,"סולאיר אנרגיות מתחדשות בע""מ",516046307,ח.פ.,אפ לס סולאיר סדרה א 25.12.2025,11722872,פנימי,מניה,ישראל,ישראל,אנרגיה מתחדשת,מניות לרבות מדדי מניות,2025-12-25,לא,2024-04-30,ILS,אחר,אי-תלות,2025-09-30,38.52,0.01,1249.47,788.722208,1.0,9.85489,0.00043,1.9e-05
209,15218.0,"סולאיר אנרגיות מתחדשות בע""מ",516046307,ח.פ.,אפ לס סולאיר סדרה ב 25.12.2027,11722873,פנימי,מניה,ישראל,ישראל,אנרגיה מתחדשת,מניות לרבות מדדי מניות,2027-12-25,לא,2024-04-30,ILS,אחר,אי-תלות,2025-09-30,45.63,0.01,1249.47,1109.37802,1.0,13.8614,0.000605,2.7e-05
209,15218.0,"כלל החזקות עסקי ביטוח בע""מ",520036120,ח.פ.,CALL001 כלל 15.07.26,IL0002240146,ISIN,מניה,"חו""ל",ישראל,אשראי חוץ בנקאי,מניות לרבות מדדי מניות,2026-07-14,לא,2025-07-15,ILS,אחר,אי-תלות,2025-09-30,8629.0,1.0,3561.82,16970.0,1.0,604.44082,0.026389,0.001188
209,15218.0,"בנק לאומי לישראל בע""מ",520018078,ח.פ.,26.11.25 עסקת CALL לאומי,IL0006046119,ISIN,מניה,"חו""ל",ישראל,אשראי חוץ בנקאי,מניות לרבות מדדי מניות,2025-11-26,לא,2024-12-31,ILS,אחר,אי-תלות,2025-09-30,4259.0,1.0,36718.6,6529.0,1.0,2397.35723,0.104668,0.004715
209,15218.0,"בנק לאומי לישראל בע""מ",520018078,ח.פ.,עסקת CALL001 לאומי 12.08.2026,IL0006046119,ISIN,מניה,"חו""ל",ישראל,אשראי חוץ בנקאי,מניות לרבות מדדי מניות,2026-08-12,לא,2025-08-13,ILS,אחר,אי-תלות,2025-09-30,6157.0,1.0,23757.05,6529.0,1.0,1551.09769,0.06772,0.00305
209,15218.0,"בנק לאומי לישראל בע""מ",520018078,ח.פ.,26.09.26 עסקת CALL לאומי,IL0006046119,ISIN,מניה,"חו""ל",ישראל,אשראי חוץ בנקאי,מניות לרבות מדדי מניות,2026-09-26,לא,2025-09-26,ILS,אחר,אי-תלות,2025-09-30,5965.0,1.0,29829.45,6529.0,1.0,1947.56461,0.08503,0.00383
209,15218.0,"בנק הפועלים בע""מ",520000118,ח.פ.,פועלים 03.07.2026 CALL001,IL0006625771,ISIN,מניה,"חו""ל",ישראל,בנקים,מניות לרבות מדדי מניות,2026-07-03,לא,2025-07-03,ILS,אחר,אי-תלות,2025-09-30,6300.0,1.0,14797.48,6732.0,1.0,996.16628,0.043492,0.001959
209,15218.0,"בנק דיסקונט לישראל בע""מ",520007030,ח.פ.,CALL001 דיסקונט 26.5.26,IL0006912120,ISIN,מניה,"חו""ל",ישראל,אשראי חוץ בנקאי,מניות לרבות מדדי מניות,2026-05-26,לא,2025-05-27,ILS,אחר,אי-תלות,2025-09-30,2952.0,1.0,31120.75,3274.0,1.0,1018.89332,0.044484,0.002004
209,15218.0,בזק,520031931,ח.פ.,CALL001 בזק 26/05/2026,IL0002300114,ISIN,מניה,"חו""ל",ישראל,אשראי חוץ בנקאי,מניות לרבות מדדי מניות,2026-05-26,לא,2025-05-27,ILS,אחר,אי-תלות,2025-09-30,551.6,1.0,131387.71,634.7,1.0,833.91782,0.036408,0.00164
209,15218.0,"בנק הפועלים בע""מ",520000118,ח.פ.,CALL001 פועלים 26.05.26,IL0006625771,ISIN,מניה,"חו""ל",ישראל,בנקים,מניות לרבות מדדי מניות,2026-05-26,לא,2025-05-27,ILS,אחר,אי-תלות,2025-09-30,5784.0,1.0,7071.52,6732.0,1.0,476.05441,0.020784,0.000936
209,15218.0,בזק,520031931,ח.פ.,עסקת CALL בזק 29.01.26,IL0002300114,ISIN,מניה,"חו""ל",ישראל,אשראי חוץ בנקאי,מניות לרבות מדדי מניות,2026-01-29,לא,2025-01-30,ILS,אחר,אי-תלות,2025-09-30,1357.5756,1.0,182434.67,634.7,1.0,1157.91286,0.050554,0.002277
209,15218.0,"בנק הפועלים בע""מ",520000118,ח.פ.,עסקת פועלים CALL 18.09.26,IL0006625771,ISIN,מניה,"חו""ל",ישראל,בנקים,מניות לרבות מדדי מניות,2026-09-18,לא,2025-09-18,ILS,אחר,אי-תלות,2025-09-30,6415.0,1.0,24701.08,6732.0,1.0,1662.8764,0.072601,0.00327
209,15218.0,"בנק הפועלים בע""מ",520000118,ח.פ.,26.11.25 עסקת CALL פועלים,IL0006625771,ISIN,מניה,"חו""ל",ישראל,בנקים,מניות לרבות מדדי מניות,2025-11-26,לא,2024-11-30,ILS,אחר,אי-תלות,2025-09-30,4272.0,1.0,23415.35,6732.0,1.0,1576.32105,0.068822,0.0031
209,15218.0,"מימון ישיר מקבוצת ישיר(2006) בע""מ",513893123,ח.פ.,מימון ישיר 26.03.2026 CALL001,IL0001168186,ISIN,מניה,"חו""ל",ישראל,אשראי חוץ בנקאי,מניות לרבות מדדי מניות,2026-03-26,לא,2025-03-26,ILS,אחר,אי-תלות,2025-09-30,53970.0,1.0,43.73,49390.0,1.0,21.59647,0.000942,4.2e-05
209,15218.0,"בנק הפועלים בע""מ",520000118,ח.פ.,עסקת CALL001 פועלים 12.08.2026,IL0006625771,ISIN,מניה,"חו""ל",ישראל,בנקים,מניות לרבות מדדי מניות,2026-08-12,לא,2025-08-13,ILS,אחר,אי-תלות,2025-09-30,6389.0,1.0,24614.2,6732.0,1.0,1657.02806,0.072345,0.003259
209,15218.0,"בנק הפועלים בע""מ",520000118,ח.פ.,26.09.2026 עסקת CALL פועלים,IL0006625771,ISIN,מניה,"חו""ל",ישראל,בנקים,מניות לרבות מדדי מניות,2026-09-26,לא,2025-09-26,ILS,אחר,אי-תלות,2025-09-30,6172.0,1.0,16141.12,6732.0,1.0,1086.62052,0.047441,0.002137
209,15218.0,"מימון ישיר מקבוצת ישיר(2006) בע""מ",513893123,ח.פ.,מימון ישיר 21.09.2026 CALL001,IL0001168186,ISIN,מניה,"חו""ל",ישראל,אשראי חוץ בנקאי,מניות לרבות מדדי מניות,2026-09-21,לא,2025-09-21,ILS,אחר,אי-תלות,2025-09-30,45160.0,1.0,289.58,49390.0,1.0,143.02299,0.006244,0.000281
209,15218.0,"כלל החזקות עסקי ביטוח בע""מ",520036120,ח.פ.,CALL001 כלל 17.12.25,IL0002240146,ISIN,מניה,"חו""ל",ישראל,אשראי חוץ בנקאי,מניות לרבות מדדי מניות,2025-12-17,לא,2024-12-22,ILS,אחר,אי-תלות,2025-09-30,8629.0,1.0,2895.79,16970.0,1.0,491.4153,0.021455,0.000966
209,15218.0,"בנק הפועלים בע""מ",520000118,ח.פ.,CALL001 פועלים 23.07.26,IL0006625771,ISIN,מניה,"חו""ל",ישראל,בנקים,מניות לרבות מדדי מניות,2026-07-23,לא,2025-07-24,ILS,אחר,אי-תלות,2025-09-30,6465.76,1.0,11583.15,6732.0,1.0,779.77791,0.034045,0.001533
209,15218.0,"ישראכרט בע""מ",510706153,ח.פ.,ישראכרט 07.05.2026 CALL001,IL0011574030,ISIN,מניה,"חו""ל",ישראל,אשראי חוץ בנקאי,מניות לרבות מדדי מניות,2026-05-07,לא,2025-05-07,ILS,אחר,אי-תלות,2025-09-30,1699.0,1.0,6616.41,1338.0,1.0,88.52761,0.003865,0.000174
209,15218.0,"בנק לאומי לישראל בע""מ",520018078,ח.פ.,עסקת לאומי CALL 18.09.26,IL0006046119,ISIN,מניה,"חו""ל",ישראל,אשראי חוץ בנקאי,מניות לרבות מדדי מניות,2026-09-18,לא,2025-09-18,ILS,אחר,אי-תלות,2025-09-30,6235.0,1.0,25338.15,6529.0,1.0,1654.32774,0.072227,0.003254
209,15218.0,Odysight.ai Inc,549300FBP1ANSJE5TE25,LEI,אפ לס ODYS US 31/03/2026,620080901,פנימי,מניה,"חו""ל","ארה""ב","Electronic Equipment, Instruments & Components",מניות לרבות מדדי מניות,2026-03-31,לא,2022-03-18,USD,אחר,אי-תלות,2025-09-30,5.5,1.0,3342.67,0.0,3.306,0.0,0.0,0.0
209,15218.0,Odysight.ai Inc,549300FBP1ANSJE5TE25,LEI,אפ לס ODYS US 31/03/2026,620080903,פנימי,מניה,"חו""ל","ארה""ב","Electronic Equipment, Instruments & Components",מניות לרבות מדדי מניות,2026-03-31,לא,2023-03-27,USD,אחר,אי-תלות,2025-09-30,1.15,1.0,4633.26,0.608,3.306,0.09314,4e-06,0.0
209,2187.0,"רוטשטיין נדל""ן בע""מ",520039959,ח.פ.,אפ לס בכספת-רוטשטין 26.07.2026,IL0005390153,ISIN,מניה,ישראל,ישראל,בנייה,מניות לרבות מדדי מניות,2026-07-26,לא,2025-01-28,ILS,אחר,אי-תלות,2025-09-30,73.0,0.01,25527.0,2363.490861,1.0,603.3282,0.002456,4.5e-05
209,2187.0,"אנלייט אנרגיה מתחדשת בע""מ",520041146,ח.פ.,CALL001 אנלייט 17.12.2025,IL0007200111,ISIN,מניה,ישראל,ישראל,אנרגיה מתחדשת,מניות לרבות מדדי מניות,2025-12-17,לא,2024-12-31,ILS,אחר,אי-תלות,2025-09-30,5869.0,1.0,211172.23,10190.0,1.0,21518.44974,0.087625,0.001622
209,2187.0,"אנלייט אנרגיה מתחדשת בע""מ",520041146,ח.פ.,CALL001 אנלייט 17.12.2025,IL0007200111,ISIN,מניה,ישראל,ישראל,אנרגיה מתחדשת,מניות לרבות מדדי מניות,2025-12-17,לא,2024-12-18,ILS,אחר,אי-תלות,2025-09-30,5869.0,1.0,69010.15,10190.0,1.0,7032.13444,0.028635,0.00053
209,2187.0,"קבוצת אקרו בע""מ",511996803,ח.פ.,אפ לס אקרו 05.08.2026,IL0011849028,ISIN,מניה,ישראל,ישראל,בנייה,מניות לרבות מדדי מניות,2026-08-05,לא,2025-04-07,ILS,אחר,אי-תלות,2025-09-30,70.0,0.01,3212.67,123.307002,1.0,3.96145,1.6e-05,0.0
209,2187.0,"אחים דוניץ בע""מ",520038605,ח.פ.,אפ לס דוניץ 31.12.25,IL0004000100,ISIN,מניה,ישראל,ישראל,בנייה,מניות לרבות מדדי מניות,2025-12-31,לא,2025-01-24,ILS,אחר,אי-תלות,2025-09-30,272.5,0.01,5217.2,1076.583553,1.0,56.16748,0.000228,4e-06
209,2187.0,"טופ גאם תעשיות בע""מ",513561399,ח.פ.,אפ לס טופ גאם 31.01.2027,IL0011791428,ISIN,מניה,ישראל,ישראל,פודטק,מניות לרבות מדדי מניות,2027-01-31,לא,2025-07-31,ILS,אחר,אי-תלות,2025-09-30,1025.0,0.01,97259.96,125.559153,1.0,122.11879,0.000497,9e-06
209,2187.0,PowerGen,10128,פנימי,PowerGen Option,34100,פנימי,מניה,ישראל,ישראל,תשתיות,תשתיות,2027-01-24,לא,2024-03-18,ILS,מומחה בלתי תלוי,אי-תלות,2025-09-30,0.0,1.0,30.05,100.0,1.0,0.03005,0.0,0.0
209,2187.0,"סולאיר אנרגיות מתחדשות בע""מ",516046307,ח.פ.,אפ לס סולאיר סדרה ב 25.12.2027,11722873,פנימי,מניה,ישראל,ישראל,אנרגיה מתחדשת,מניות לרבות מדדי מניות,2027-12-25,לא,2024-04-30,ILS,אחר,אי-תלות,2025-09-30,45.63,0.01,13399.5,1109.37802,1.0,148.65109,0.000605,1.1e-05
209,2187.0,CITI Bank,549300U8H3KN0K301B23,LEI,FXVOpt 145.0000 PUT USD-JPY 20.10.25,100120170,פנימי,"מט""ח",ישראל,ישראל,אחר,"מט""ח",2025-10-20,לא,2025-09-18,USD,אחר,אי-תלות,2025-09-30,145.0,1.0,-5921149.63,0.2748,3.306,-53.80864,-0.000219,-4e-06
209,2187.0,"סולאיר אנרגיות מתחדשות בע""מ",516046307,ח.פ.,אפ לס סולאיר סדרה א 25.12.2025,11722872,פנימי,מניה,ישראל,ישראל,אנרגיה מתחדשת,מניות לרבות מדדי מניות,2025-12-25,לא,2024-04-30,ILS,אחר,אי-תלות,2025-09-30,38.52,0.01,13399.5,788.722208,1.0,105.68482,0.00043,7e-06
209,2187.0,"ישראכרט בע""מ",510706153,ח.פ.,ישראכרט 07.05.2026 CALL001,IL0011574030,ISIN,מניה,"חו""ל",ישראל,אשראי חוץ בנקאי,מניות לרבות מדדי מניות,2026-05-07,לא,2025-05-07,ILS,אחר,אי-תלות,2025-09-30,1699.0,1.0,70955.11,1338.0,1.0,949.37937,0.003865,7.1e-05
209,2187.0,"בנק לאומי לישראל בע""מ",520018078,ח.פ.,עסקת CALL001 לאומי 12.08.2026,IL0006046119,ISIN,מניה,"חו""ל",ישראל,אשראי חוץ בנקאי,מניות לרבות מדדי מניות,2026-08-12,לא,2025-08-13,ILS,אחר,אי-תלות,2025-09-30,6157.0,1.0,254773.08,6529.0,1.0,16634.13431,0.067735,0.001253
209,2187.0,"בנק הפועלים בע""מ",520000118,ח.פ.,26.11.25 עסקת CALL פועלים,IL0006625771,ISIN,מניה,"חו""ל",ישראל,בנקים,מניות לרבות מדדי מניות,2025-11-26,לא,2024-11-30,ILS,אחר,אי-תלות,2025-09-30,4272.0,1.0,251108.62,6732.0,1.0,16904.63226,0.068837,0.001274
209,2187.0,בזק,520031931,ח.פ.,CALL001 בזק 26/05/2026,IL0002300114,ISIN,מניה,"חו""ל",ישראל,אשראי חוץ בנקאי,מניות לרבות מדדי מניות,2026-05-26,לא,2025-05-27,ILS,אחר,אי-תלות,2025-09-30,551.6,1.0,1409015.62,634.7,1.0,8943.02212,0.036416,0.000674
209,2187.0,"בנק לאומי לישראל בע""מ",520018078,ח.פ.,26.11.25 עסקת CALL לאומי,IL0006046119,ISIN,מניה,"חו""ל",ישראל,אשראי חוץ בנקאי,מניות לרבות מדדי מניות,2025-11-26,לא,2024-12-31,ILS,אחר,אי-תלות,2025-09-30,4259.0,1.0,393774.09,6529.0,1.0,25709.51036,0.104691,0.001937
209,2187.0,בזק,520031931,ח.פ.,עסקת CALL בזק 29.01.26,IL0002300114,ISIN,מניה,"חו""ל",ישראל,אשראי חוץ בנקאי,מניות לרבות מדדי מניות,2026-01-29,לא,2025-01-30,ILS,אחר,אי-תלות,2025-09-30,1357.5756,1.0,1956448.56,634.7,1.0,12417.57899,0.050565,0.000936
209,2187.0,"בנק הפועלים בע""מ",520000118,ח.פ.,CALL001 פועלים 26.05.26,IL0006625771,ISIN,מניה,"חו""ל",ישראל,בנקים,מניות לרבות מדדי מניות,2026-05-26,לא,2025-05-27,ILS,אחר,אי-תלות,2025-09-30,5784.0,1.0,75835.67,6732.0,1.0,5105.25748,0.020789,0.000384
209,2187.0,"בנק לאומי לישראל בע""מ",520018078,ח.פ.,26.09.26 עסקת CALL לאומי,IL0006046119,ISIN,מניה,"חו""ל",ישראל,אשראי חוץ בנקאי,מניות לרבות מדדי מניות,2026-09-26,לא,2025-09-26,ILS,אחר,אי-תלות,2025-09-30,5965.0,1.0,319894.12,6529.0,1.0,20885.88716,0.085049,0.001574
209,2187.0,"בנק הפועלים בע""מ",520000118,ח.פ.,CALL001 פועלים 23.07.26,IL0006625771,ISIN,מניה,"חו""ל",ישראל,בנקים,מניות לרבות מדדי מניות,2026-07-23,לא,2025-07-24,ILS,אחר,אי-תלות,2025-09-30,6465.76,1.0,124218.96,6732.0,1.0,8362.42012,0.034052,0.00063
209,2187.0,"מימון ישיר מקבוצת ישיר(2006) בע""מ",513893123,ח.פ.,מימון ישיר 21.09.2026 CALL001,IL0001168186,ISIN,מניה,"חו""ל",ישראל,אשראי חוץ בנקאי,מניות לרבות מדדי מניות,2026-09-21,לא,2025-09-21,ILS,אחר,אי-תלות,2025-09-30,45160.0,1.0,3105.47,49390.0,1.0,1533.79356,0.006245,0.000115
209,2187.0,"כלל החזקות עסקי ביטוח בע""מ",520036120,ח.פ.,CALL001 כלל 17.12.25,IL0002240146,ISIN,מניה,"חו""ל",ישראל,אשראי חוץ בנקאי,מניות לרבות מדדי מניות,2025-12-17,לא,2024-12-22,ILS,אחר,אי-תלות,2025-09-30,8629.0,1.0,31054.74,16970.0,1.0,5269.98921,0.021459,0.000397
209,2187.0,"מימון ישיר מקבוצת ישיר(2006) בע""מ",513893123,ח.פ.,מימון ישיר 26.03.2026 CALL001,IL0001168186,ISIN,מניה,"חו""ל",ישראל,אשראי חוץ בנקאי,מניות לרבות מדדי מניות,2026-03-26,לא,2025-03-26,ILS,אחר,אי-תלות,2025-09-30,53970.0,1.0,468.93,49390.0,1.0,231.60283,0.000943,1.7e-05
209,2187.0,"בנק הפועלים בע""מ",520000118,ח.פ.,עסקת פועלים CALL 18.09.26,IL0006625771,ISIN,מניה,"חו""ל",ישראל,בנקים,מניות לרבות מדדי מניות,2026-09-18,לא,2025-09-18,ILS,אחר,אי-תלות,2025-09-30,6415.0,1.0,264896.92,6732.0,1.0,17832.8609,0.072617,0.001344
209,2187.0,"בנק דיסקונט לישראל בע""מ",520007030,ח.פ.,CALL001 דיסקונט 26.5.26,IL0006912120,ISIN,מניה,"חו""ל",ישראל,אשראי חוץ בנקאי,מניות לרבות מדדי מניות,2026-05-26,לא,2025-05-27,ILS,אחר,אי-תלות,2025-09-30,2952.0,1.0,333742.17,3274.0,1.0,10926.71879,0.044494,0.000823
209,2187.0,"בנק הפועלים בע""מ",520000118,ח.פ.,פועלים 03.07.2026 CALL001,IL0006625771,ISIN,מניה,"חו""ל",ישראל,בנקים,מניות לרבות מדדי מניות,2026-07-03,לא,2025-07-03,ILS,אחר,אי-תלות,2025-09-30,6300.0,1.0,158689.72,6732.0,1.0,10682.9917,0.043502,0.000805
209,2187.0,"בנק הפועלים בע""מ",520000118,ח.פ.,26.09.2026 עסקת CALL פועלים,IL0006625771,ISIN,מניה,"חו""ל",ישראל,בנקים,מניות לרבות מדדי מניות,2026-09-26,לא,2025-09-26,ILS,אחר,אי-תלות,2025-09-30,6172.0,1.0,173099.12,6732.0,1.0,11653.03243,0.047452,0.000878
209,2187.0,"כלל החזקות עסקי ביטוח בע""מ",520036120,ח.פ.,CALL001 כלל 15.07.26,IL0002240146,ISIN,מניה,"חו""ל",ישראל,אשראי חוץ בנקאי,מניות לרבות מדדי מניות,2026-07-14,לא,2025-07-15,ILS,אחר,אי-תלות,2025-09-30,8629.0,1.0,38197.33,16970.0,1.0,6482.08672,0.026395,0.000488
209,2187.0,"בנק הפועלים בע""מ",520000118,ח.פ.,עסקת CALL001 פועלים 12.08.2026,IL0006625771,ISIN,מניה,"חו""ל",ישראל,בנקים,מניות לרבות מדדי מניות,2026-08-12,לא,2025-08-13,ILS,אחר,אי-תלות,2025-09-30,6389.0,1.0,263965.28,6732.0,1.0,17770.14275,0.072361,0.001339
209,2187.0,"בנק לאומי לישראל בע""מ",520018078,ח.פ.,עסקת לאומי CALL 18.09.26,IL0006046119,ISIN,מניה,"חו""ל",ישראל,אשראי חוץ בנקאי,מניות לרבות מדדי מניות,2026-09-18,לא,2025-09-18,ILS,אחר,אי-תלות,2025-09-30,6235.0,1.0,271728.97,6529.0,1.0,17741.1842,0.072243,0.001337
209,2187.0,Odysight.ai Inc,549300FBP1ANSJE5TE25,LEI,אפ לס ODYS US 31/03/2026,620080901,פנימי,מניה,"חו""ל","ארה""ב","Electronic Equipment, Instruments & Components",מניות לרבות מדדי מניות,2026-03-31,לא,2022-03-18,USD,אחר,אי-תלות,2025-09-30,5.5,1.0,35847.14,0.0,3.306,0.0,0.0,0.0
209,2187.0,Odysight.ai Inc,549300FBP1ANSJE5TE25,LEI,אפ לס ODYS US 31/03/2026,620080903,פנימי,מניה,"חו""ל","ארה""ב","Electronic Equipment, Instruments & Components",מניות לרבות מדדי מניות,2026-03-31,לא,2023-03-27,USD,אחר,אי-תלות,2025-09-30,1.15,1.0,49687.58,0.608,3.306,0.99882,4e-06,0.0
209,2188.0,"אנלייט אנרגיה מתחדשת בע""מ",520041146,ח.פ.,CALL001 אנלייט 17.12.2025,IL0007200111,ISIN,מניה,ישראל,ישראל,אנרגיה מתחדשת,מניות לרבות מדדי מניות,2025-12-17,לא,2024-12-18,ILS,אחר,אי-תלות,2025-09-30,5869.0,1.0,1.47,10190.0,1.0,0.14944,0.001768,0.0
209,2188.0,"אחים דוניץ בע""מ",520038605,ח.פ.,אפ לס דוניץ 31.12.25,IL0004000100,ISIN,מניה,ישראל,ישראל,בנייה,מניות לרבות מדדי מניות,2025-12-31,לא,2025-01-24,ILS,אחר,אי-תלות,2025-09-30,272.5,0.01,0.11,1076.583553,1.0,0.00119,1.4e-05,0.0
209,2188.0,"רוטשטיין נדל""ן בע""מ",520039959,ח.פ.,אפ לס בכספת-רוטשטין 26.07.2026,IL0005390153,ISIN,מניה,ישראל,ישראל,בנייה,מניות לרבות מדדי מניות,2026-07-26,לא,2025-01-28,ILS,אחר,אי-תלות,2025-09-30,73.0,0.01,0.54,2363.490861,1.0,0.01282,0.000151,0.0
209,2188.0,"קבוצת אקרו בע""מ",511996803,ח.פ.,אפ לס אקרו 05.08.2026,IL0011849028,ISIN,מניה,ישראל,ישראל,בנייה,מניות לרבות מדדי מניות,2026-08-05,לא,2025-04-07,ILS,אחר,אי-תלות,2025-09-30,70.0,0.01,0.07,123.307002,1.0,8e-05,0.0,0.0
209,2188.0,"אנלייט אנרגיה מתחדשת בע""מ",520041146,ח.פ.,CALL001 אנלייט 17.12.2025,IL0007200111,ISIN,מניה,ישראל,ישראל,אנרגיה מתחדשת,מניות לרבות מדדי מניות,2025-12-17,לא,2024-12-31,ILS,אחר,אי-תלות,2025-09-30,5869.0,1.0,4.49,10190.0,1.0,0.45728,0.00541,2e-06
209,2188.0,"טופ גאם תעשיות בע""מ",513561399,ח.פ.,אפ לס טופ גאם 31.01.2027,IL0011791428,ISIN,מניה,ישראל,ישראל,פודטק,מניות לרבות מדדי מניות,2027-01-31,לא,2025-07-31,ILS,אחר,אי-תלות,2025-09-30,1025.0,0.01,2.07,125.559153,1.0,0.0026,3e-05,0.0
209,2188.0,"אשדוד אנרגיה בע""מ",513846667,ח.פ.,אשדוד  ורמת נגב אנרגיה-קיקר 31.12.34,1004533,טיקר,מניה,ישראל,ישראל,אנרגיה,אחר,2034-12-31,לא,2019-03-06,ILS,מומחה בלתי תלוי,אי-תלות,2025-09-30,0.0,1.0,3973.31,108.8916,1.0,4.3266,0.051196,2.1e-05
209,2188.0,תחנות כח רמת חובב שותפות מוגבלת,540285947,ח.פ.,קיקר רמת חובב 30.06.40,10047344,טיקר,מניה,ישראל,ישראל,אנרגיה,אחר,2040-06-30,לא,2020-12-02,ILS,מומחה בלתי תלוי,אי-תלות,2025-09-30,0.0,1.0,3356.0,372.846983,1.0,12.51275,0.148061,6.1e-05
209,2188.0,"אשדוד התפלה בע""מ",514357060,ח.פ.,אשדוד התפלה קיקר,84666750,טיקר,מניה,ישראל,ישראל,תשתיות,אחר,2038-09-08,לא,2022-08-22,ILS,מומחה בלתי תלוי,אי-תלות,2025-09-30,0.0,1.0,7076.72,110.369898,1.0,7.81057,0.092421,3.8e-05
209,2188.0,"איי.פי.סי. ירושלים בע""מ",513731554,ח.פ.,איי.פי.סי-קיקר 03.09.29,10046044,טיקר,מניה,ישראל,ישראל,מלונאות ותיירות,אחר,2029-09-03,לא,2019-09-03,USD,מומחה בלתי תלוי,אי-תלות,2025-09-30,0.0,1.0,167.98,239.875582,3.306,1.33209,0.015762,6e-06
209,2188.0,CITI Bank,549300U8H3KN0K301B23,LEI,FXVOpt 3.6800 CALL USD-PLN 30.10.25,100120432,פנימי,"מט""ח",ישראל,ישראל,אחר,"מט""ח",2025-10-30,לא,2025-09-29,USD,אחר,אי-תלות,2025-09-30,3.68,1.0,-20378.6,0.5646,3.306,-0.38043,-0.004501,-1e-06
209,2188.0,"סולאיר אנרגיות מתחדשות בע""מ",516046307,ח.פ.,אפ לס סולאיר סדרה ב 25.12.2027,11722873,פנימי,מניה,ישראל,ישראל,אנרגיה מתחדשת,מניות לרבות מדדי מניות,2027-12-25,לא,2024-04-30,ILS,אחר,אי-תלות,2025-09-30,45.63,0.01,0.28,1109.37802,1.0,0.00316,3.7e-05,0.0
209,2188.0,"סולאיר אנרגיות מתחדשות בע""מ",516046307,ח.פ.,אפ לס סולאיר סדרה א 25.12.2025,11722872,פנימי,מניה,ישראל,ישראל,אנרגיה מתחדשת,מניות לרבות מדדי מניות,2025-12-25,לא,2024-04-30,ILS,אחר,אי-תלות,2025-09-30,38.52,0.01,0.28,788.722208,1.0,0.00225,2.6e-05,0.0
209,2188.0,CITI Bank,549300U8H3KN0K301B23,LEI,FXVOpt 145.0000 PUT USD-JPY 20.10.25,100120170,פנימי,"מט""ח",ישראל,ישראל,אחר,"מט""ח",2025-10-20,לא,2025-09-18,USD,אחר,אי-תלות,2025-09-30,145.0,1.0,-31447.52,0.2748,3.306,-0.28578,-0.00338,-1e-06
209,2188.0,"בנק לאומי לישראל בע""מ",520018078,ח.פ.,26.11.25 עסקת CALL לאומי,IL0006046119,ISIN,מניה,"חו""ל",ישראל,אשראי חוץ בנקאי,מניות לרבות מדדי מניות,2025-11-26,לא,2024-12-31,ILS,אחר,אי-תלות,2025-09-30,4259.0,1.0,8.37,6529.0,1.0,0.54634,0.006464,2e-06
209,2188.0,"בנק לאומי לישראל בע""מ",520018078,ח.פ.,26.09.26 עסקת CALL לאומי,IL0006046119,ISIN,מניה,"חו""ל",ישראל,אשראי חוץ בנקאי,מניות לרבות מדדי מניות,2026-09-26,לא,2025-09-26,ILS,אחר,אי-תלות,2025-09-30,5965.0,1.0,6.8,6529.0,1.0,0.44384,0.005251,2e-06
209,2188.0,"בנק לאומי לישראל בע""מ",520018078,ח.פ.,עסקת CALL001 לאומי 12.08.2026,IL0006046119,ISIN,מניה,"חו""ל",ישראל,אשראי חוץ בנקאי,מניות לרבות מדדי מניות,2026-08-12,לא,2025-08-13,ILS,אחר,אי-תלות,2025-09-30,6157.0,1.0,5.41,6529.0,1.0,0.35348,0.004182,1e-06
209,2188.0,בזק,520031931,ח.פ.,CALL001 בזק 26/05/2026,IL0002300114,ISIN,מניה,"חו""ל",ישראל,אשראי חוץ בנקאי,מניות לרבות מדדי מניות,2026-05-26,לא,2025-05-27,ILS,אחר,אי-תלות,2025-09-30,551.6,1.0,29.94,634.7,1.0,0.19004,0.002248,0.0
209,2188.0,"בנק לאומי לישראל בע""מ",520018078,ח.פ.,עסקת לאומי CALL 18.09.26,IL0006046119,ISIN,מניה,"חו""ל",ישראל,אשראי חוץ בנקאי,מניות לרבות מדדי מניות,2026-09-18,לא,2025-09-18,ILS,אחר,אי-תלות,2025-09-30,6235.0,1.0,5.77,6529.0,1.0,0.37701,0.004461,1e-06
209,2188.0,"בנק הפועלים בע""מ",520000118,ח.פ.,26.11.25 עסקת CALL פועלים,IL0006625771,ISIN,מניה,"חו""ל",ישראל,בנקים,מניות לרבות מדדי מניות,2025-11-26,לא,2024-11-30,ILS,אחר,אי-תלות,2025-09-30,4272.0,1.0,5.34,6732.0,1.0,0.35923,0.00425,1e-06
209,2188.0,"בנק הפועלים בע""מ",520000118,ח.פ.,26.09.2026 עסקת CALL פועלים,IL0006625771,ISIN,מניה,"חו""ל",ישראל,בנקים,מניות לרבות מדדי מניות,2026-09-26,לא,2025-09-26,ILS,אחר,אי-תלות,2025-09-30,6172.0,1.0,3.68,6732.0,1.0,0.24763,0.00293,1e-06
209,2188.0,"ישראכרט בע""מ",510706153,ח.פ.,ישראכרט 07.05.2026 CALL001,IL0011574030,ISIN,מניה,"חו""ל",ישראל,אשראי חוץ בנקאי,מניות לרבות מדדי מניות,2026-05-07,לא,2025-05-07,ILS,אחר,אי-תלות,2025-09-30,1699.0,1.0,1.51,1338.0,1.0,0.02017,0.000238,0.0
209,2188.0,"בנק הפועלים בע""מ",520000118,ח.פ.,פועלים 03.07.2026 CALL001,IL0006625771,ISIN,מניה,"חו""ל",ישראל,בנקים,מניות לרבות מדדי מניות,2026-07-03,לא,2025-07-03,ILS,אחר,אי-תלות,2025-09-30,6300.0,1.0,3.37,6732.0,1.0,0.22702,0.002686,1e-06
209,2188.0,"בנק הפועלים בע""מ",520000118,ח.פ.,עסקת CALL001 פועלים 12.08.2026,IL0006625771,ISIN,מניה,"חו""ל",ישראל,בנקים,מניות לרבות מדדי מניות,2026-08-12,לא,2025-08-13,ILS,אחר,אי-תלות,2025-09-30,6389.0,1.0,5.61,6732.0,1.0,0.37762,0.004468,1e-06
209,2188.0,"בנק הפועלים בע""מ",520000118,ח.פ.,עסקת פועלים CALL 18.09.26,IL0006625771,ISIN,מניה,"חו""ל",ישראל,בנקים,מניות לרבות מדדי מניות,2026-09-18,לא,2025-09-18,ILS,אחר,אי-תלות,2025-09-30,6415.0,1.0,5.63,6732.0,1.0,0.37896,0.004484,1e-06
209,2188.0,"מימון ישיר מקבוצת ישיר(2006) בע""מ",513893123,ח.פ.,מימון ישיר 21.09.2026 CALL001,IL0001168186,ISIN,מניה,"חו""ל",ישראל,אשראי חוץ בנקאי,מניות לרבות מדדי מניות,2026-09-21,לא,2025-09-21,ILS,אחר,אי-תלות,2025-09-30,45160.0,1.0,0.07,49390.0,1.0,0.03259,0.000385,0.0
209,2188.0,"כלל החזקות עסקי ביטוח בע""מ",520036120,ח.פ.,CALL001 כלל 17.12.25,IL0002240146,ISIN,מניה,"חו""ל",ישראל,אשראי חוץ בנקאי,מניות לרבות מדדי מניות,2025-12-17,לא,2024-12-22,ILS,אחר,אי-תלות,2025-09-30,8629.0,1.0,0.66,16970.0,1.0,0.11199,0.001325,0.0
209,2188.0,בזק,520031931,ח.פ.,עסקת CALL בזק 29.01.26,IL0002300114,ISIN,מניה,"חו""ל",ישראל,אשראי חוץ בנקאי,מניות לרבות מדדי מניות,2026-01-29,לא,2025-01-30,ILS,אחר,אי-תלות,2025-09-30,1357.5756,1.0,41.58,634.7,1.0,0.26388,0.003122,1e-06
209,2188.0,"מימון ישיר מקבוצת ישיר(2006) בע""מ",513893123,ח.פ.,מימון ישיר 26.03.2026 CALL001,IL0001168186,ISIN,מניה,"חו""ל",ישראל,אשראי חוץ בנקאי,מניות לרבות מדדי מניות,2026-03-26,לא,2025-03-26,ILS,אחר,אי-תלות,2025-09-30,53970.0,1.0,0.01,49390.0,1.0,0.00492,5.8e-05,0.0
209,2188.0,"בנק הפועלים בע""מ",520000118,ח.פ.,CALL001 פועלים 26.05.26,IL0006625771,ISIN,מניה,"חו""ל",ישראל,בנקים,מניות לרבות מדדי מניות,2026-05-26,לא,2025-05-27,ILS,אחר,אי-תלות,2025-09-30,5784.0,1.0,1.61,6732.0,1.0,0.10849,0.001283,0.0
209,2188.0,"בנק הפועלים בע""מ",520000118,ח.פ.,CALL001 פועלים 23.07.26,IL0006625771,ISIN,מניה,"חו""ל",ישראל,בנקים,מניות לרבות מדדי מניות,2026-07-23,לא,2025-07-24,ILS,אחר,אי-תלות,2025-09-30,6465.76,1.0,2.64,6732.0,1.0,0.17771,0.002102,0.0
209,2188.0,"בנק דיסקונט לישראל בע""מ",520007030,ח.פ.,CALL001 דיסקונט 26.5.26,IL0006912120,ISIN,מניה,"חו""ל",ישראל,אשראי חוץ בנקאי,מניות לרבות מדדי מניות,2026-05-26,לא,2025-05-27,ILS,אחר,אי-תלות,2025-09-30,2952.0,1.0,7.09,3274.0,1.0,0.2322,0.002747,1e-06
209,2188.0,"כלל החזקות עסקי ביטוח בע""מ",520036120,ח.פ.,CALL001 כלל 15.07.26,IL0002240146,ISIN,מניה,"חו""ל",ישראל,אשראי חוץ בנקאי,מניות לרבות מדדי מניות,2026-07-14,לא,2025-07-15,ILS,אחר,אי-תלות,2025-09-30,8629.0,1.0,0.81,16970.0,1.0,0.13775,0.001629,0.0
209,2188.0,Odysight.ai Inc,549300FBP1ANSJE5TE25,LEI,אפ לס ODYS US 31/03/2026,620080901,פנימי,מניה,"חו""ל","ארה""ב","Electronic Equipment, Instruments & Components",מניות לרבות מדדי מניות,2026-03-31,לא,2022-03-18,USD,אחר,אי-תלות,2025-09-30,5.5,1.0,0.76,0.0,3.306,0.0,0.0,0.0
209,2188.0,יבולי שמש,515689198,ח.פ.,יבולי שמש אופציה,34140,פנימי,מניה,"חו""ל",רומניה,אנרגיה מתחדשת,תשתיות,2025-12-31,לא,2024-08-20,EUR,מומחה בלתי תלוי,אי-תלות,2025-09-30,0.0,1.0,0.01,148000000.0,3.8807,42.71047,0.505386,0.000209
209,2188.0,Odysight.ai Inc,549300FBP1ANSJE5TE25,LEI,אפ לס ODYS US 31/03/2026,620080903,פנימי,מניה,"חו""ל","ארה""ב","Electronic Equipment, Instruments & Components",מניות לרבות מדדי מניות,2026-03-31,לא,2023-03-27,USD,אחר,אי-תלות,2025-09-30,1.15,1.0,1.06,0.608,3.306,2e-05,0.0,0.0
209,2188.0,נאוויטס פטרוליום שותפות מוגבלת,550263107,ח.פ.,קיקר נאוויטס פטרוליום שותפות מוגבל,10048041,פנימי,מניה,"חו""ל","ארה""ב","Oil, Gas & Consumable Fuels",אחר,2027-04-01,לא,2022-11-24,USD,מומחה בלתי תלוי,אי-תלות,2025-09-30,0.0,1.0,3159.8,107.832586,3.306,11.26451,0.133291,5.5e-05
209,9974.0,"קבוצת אקרו בע""מ",511996803,ח.פ.,אפ לס אקרו 05.08.2026,IL0011849028,ISIN,מניה,ישראל,ישראל,בנייה,מניות לרבות מדדי מניות,2026-08-05,לא,2025-04-07,ILS,אחר,אי-תלות,2025-09-30,70.0,0.01,10836.37,123.307002,1.0,13.362,1.5e-05,0.0
209,9974.0,"טופ גאם תעשיות בע""מ",513561399,ח.פ.,אפ לס טופ גאם 31.01.2027,IL0011791428,ISIN,מניה,ישראל,ישראל,פודטק,מניות לרבות מדדי מניות,2027-01-31,לא,2025-07-31,ILS,אחר,אי-תלות,2025-09-30,1025.0,0.01,328058.43,125.559153,1.0,411.90738,0.000475,7e-06
209,9974.0,"אחים דוניץ בע""מ",520038605,ח.פ.,אפ לס דוניץ 31.12.25,IL0004000100,ISIN,מניה,ישראל,ישראל,בנייה,מניות לרבות מדדי מניות,2025-12-31,לא,2025-01-24,ILS,אחר,אי-תלות,2025-09-30,272.5,0.01,17597.63,1076.583553,1.0,189.45322,0.000218,3e-06
209,9974.0,"אנלייט אנרגיה מתחדשת בע""מ",520041146,ח.פ.,CALL001 אנלייט 17.12.2025,IL0007200111,ISIN,מניה,ישראל,ישראל,אנרגיה מתחדשת,מניות לרבות מדדי מניות,2025-12-17,לא,2024-12-31,ILS,אחר,אי-תלות,2025-09-30,5869.0,1.0,712285.15,10190.0,1.0,72581.85642,0.083722,0.00124
209,9974.0,"רוטשטיין נדל""ן בע""מ",520039959,ח.פ.,אפ לס בכספת-רוטשטין 26.07.2026,IL0005390153,ISIN,מניה,ישראל,ישראל,בנייה,מניות לרבות מדדי מניות,2026-07-26,לא,2025-01-28,ILS,אחר,אי-תלות,2025-09-30,73.0,0.01,86102.7,2363.490861,1.0,2035.02955,0.002347,3.4e-05
209,9974.0,"אנלייט אנרגיה מתחדשת בע""מ",520041146,ח.פ.,CALL001 אנלייט 17.12.2025,IL0007200111,ISIN,מניה,ישראל,ישראל,אנרגיה מתחדשת,מניות לרבות מדדי מניות,2025-12-17,לא,2024-12-18,ILS,אחר,אי-תלות,2025-09-30,5869.0,1.0,232771.64,10190.0,1.0,23719.43046,0.02736,0.000405
209,9974.0,"אשדוד התפלה בע""מ",514357060,ח.פ.,אשדוד התפלה קיקר,84666750,טיקר,מניה,ישראל,ישראל,תשתיות,אחר,2038-09-08,לא,2022-08-22,ILS,מומחה בלתי תלוי,אי-תלות,2025-09-30,0.0,1.0,1515003.06,110.369898,1.0,1672.10733,0.001928,2.8e-05
209,9974.0,"אשדוד אנרגיה בע""מ",513846667,ח.פ.,אשדוד  ורמת נגב אנרגיה-קיקר 31.12.34,1004533,טיקר,מניה,ישראל,ישראל,אנרגיה,אחר,2034-12-31,לא,2019-03-06,ILS,מומחה בלתי תלוי,אי-תלות,2025-09-30,0.0,1.0,850616.83,108.8916,1.0,926.25028,0.001068,1.5e-05
209,9974.0,"איי.פי.סי. ירושלים בע""מ",513731554,ח.פ.,איי.פי.סי-קיקר 03.09.29,10046044,טיקר,מניה,ישראל,ישראל,מלונאות ותיירות,אחר,2029-09-03,לא,2019-09-03,USD,מומחה בלתי תלוי,אי-תלות,2025-09-30,0.0,1.0,35960.55,239.875582,3.306,285.17747,0.000328,4e-06
209,9974.0,תחנות כח רמת חובב שותפות מוגבלת,540285947,ח.פ.,קיקר רמת חובב 30.06.40,10047344,טיקר,מניה,ישראל,ישראל,אנרגיה,אחר,2040-06-30,לא,2020-12-02,ILS,מומחה בלתי תלוי,אי-תלות,2025-09-30,0.0,1.0,718461.81,372.846983,1.0,2678.76319,0.003089,4.5e-05
209,9974.0,Avo,515658912,ח.פ.,אופציה תכנית 43,34026,טיקר,מניה,ישראל,"ארה""ב",השקעות בהיי-טק,אחר,2027-12-31,לא,2022-12-31,USD,מומחה בלתי תלוי,אי-תלות,2025-09-30,0.0,1.0,45378.81,2050.9348,3.306,3076.86049,0.003549,5.2e-05
209,9974.0,"סולאיר אנרגיות מתחדשות בע""מ",516046307,ח.פ.,אפ לס סולאיר סדרה א 25.12.2025,11722872,פנימי,מניה,ישראל,ישראל,אנרגיה מתחדשת,מניות לרבות מדדי מניות,2025-12-25,לא,2024-04-30,ILS,אחר,אי-תלות,2025-09-30,38.52,0.01,45196.59,788.722208,1.0,356.47552,0.000411,6e-06
209,9974.0,PowerGen,10128,פנימי,PowerGen Option,34100,פנימי,מניה,ישראל,ישראל,תשתיות,תשתיות,2027-01-24,לא,2024-03-18,ILS,מומחה בלתי תלוי,אי-תלות,2025-09-30,0.0,1.0,250.44,100.0,1.0,0.25044,0.0,0.0
209,9974.0,CITI Bank,549300U8H3KN0K301B23,LEI,FXVOpt 145.0000 PUT USD-JPY 20.10.25,100120170,פנימי,"מט""ח",ישראל,ישראל,אחר,"מט""ח",2025-10-20,לא,2025-09-18,USD,אחר,אי-תלות,2025-09-30,145.0,1.0,-15404968.44,0.2748,3.306,-139.99316,-0.000161,-2e-06
209,9974.0,"מאיר חברה למכוניות ומשאיות בע""מ",510485261,ח.פ.,קבוצת מאיר-אופציה לא סחירה,340271,פנימי,מניה,ישראל,ישראל,השקעה ואחזקות,אחר,2026-06-30,לא,2023-12-31,ILS,מומחה בלתי תלוי,אי-תלות,2025-09-30,0.0,1.0,83990.47,8069.8607,1.0,6777.91393,0.007818,0.000115
209,9974.0,"קינג סטור בע""מ",514340884,ח.פ.,אופציה רכיב המרה הלואה קינג סטור,10043141,פנימי,מניה,ישראל,ישראל,רשתות שיווק,אחר,2025-12-31,לא,2019-01-01,ILS,מומחה בלתי תלוי,אי-תלות,2025-09-30,0.0,1.0,2972717.0,78.61,1.0,2336.85286,0.002695,3.9e-05
209,9974.0,"סולאיר אנרגיות מתחדשות בע""מ",516046307,ח.פ.,אפ לס סולאיר סדרה ב 25.12.2027,11722873,פנימי,מניה,ישראל,ישראל,אנרגיה מתחדשת,מניות לרבות מדדי מניות,2027-12-25,לא,2024-04-30,ILS,אחר,אי-תלות,2025-09-30,45.63,0.01,45196.59,1109.37802,1.0,501.40101,0.000578,8e-06
209,9974.0,בזק,520031931,ח.פ.,CALL001 בזק 26/05/2026,IL0002300114,ISIN,מניה,"חו""ל",ישראל,אשראי חוץ בנקאי,מניות לרבות מדדי מניות,2026-05-26,לא,2025-05-27,ILS,אחר,אי-תלות,2025-09-30,551.6,1.0,4752617.89,634.7,1.0,30164.86576,0.034794,0.000515
209,9974.0,"כלל החזקות עסקי ביטוח בע""מ",520036120,ח.פ.,CALL001 כלל 15.07.26,IL0002240146,ISIN,מניה,"חו""ל",ישראל,אשראי חוץ בנקאי,מניות לרבות מדדי מניות,2026-07-14,לא,2025-07-15,ILS,אחר,אי-תלות,2025-09-30,8629.0,1.0,128839.81,16970.0,1.0,21864.11631,0.02522,0.000373
209,9974.0,"בנק הפועלים בע""מ",520000118,ח.פ.,עסקת CALL001 פועלים 12.08.2026,IL0006625771,ISIN,מניה,"חו""ל",ישראל,בנקים,מניות לרבות מדדי מניות,2026-08-12,לא,2025-08-13,ILS,אחר,אי-תלות,2025-09-30,6389.0,1.0,890356.43,6732.0,1.0,59938.79507,0.069139,0.001024
209,9974.0,"בנק הפועלים בע""מ",520000118,ח.פ.,CALL001 פועלים 26.05.26,IL0006625771,ISIN,מניה,"חו""ל",ישראל,בנקים,מניות לרבות מדדי מניות,2026-05-26,לא,2025-05-27,ILS,אחר,אי-תלות,2025-09-30,5784.0,1.0,255794.17,6732.0,1.0,17220.06324,0.019863,0.000294
209,9974.0,"ישראכרט בע""מ",510706153,ח.פ.,ישראכרט 07.05.2026 CALL001,IL0011574030,ISIN,מניה,"חו""ל",ישראל,אשראי חוץ בנקאי,מניות לרבות מדדי מניות,2026-05-07,לא,2025-05-07,ILS,אחר,אי-תלות,2025-09-30,1699.0,1.0,239332.0,1338.0,1.0,3202.26215,0.003693,5.4e-05
209,9974.0,"בנק לאומי לישראל בע""מ",520018078,ח.פ.,26.09.26 עסקת CALL לאומי,IL0006046119,ISIN,מניה,"חו""ל",ישראל,אשראי חוץ בנקאי,מניות לרבות מדדי מניות,2026-09-26,לא,2025-09-26,ILS,אחר,אי-תלות,2025-09-30,5965.0,1.0,1079004.74,6529.0,1.0,70448.21915,0.081261,0.001204
209,9974.0,"בנק הפועלים בע""מ",520000118,ח.פ.,CALL001 פועלים 23.07.26,IL0006625771,ISIN,מניה,"חו""ל",ישראל,בנקים,מניות לרבות מדדי מניות,2026-07-23,לא,2025-07-24,ILS,אחר,אי-תלות,2025-09-30,6465.76,1.0,418991.26,6732.0,1.0,28206.4918,0.032536,0.000482
209,9974.0,"מימון ישיר מקבוצת ישיר(2006) בע""מ",513893123,ח.פ.,מימון ישיר 26.03.2026 CALL001,IL0001168186,ISIN,מניה,"חו""ל",ישראל,אשראי חוץ בנקאי,מניות לרבות מדדי מניות,2026-03-26,לא,2025-03-26,ILS,אחר,אי-תלות,2025-09-30,53970.0,1.0,1581.69,49390.0,1.0,781.19769,0.000901,1.3e-05
209,9974.0,"בנק הפועלים בע""מ",520000118,ח.פ.,26.11.25 עסקת CALL פועלים,IL0006625771,ISIN,מניה,"חו""ל",ישראל,בנקים,מניות לרבות מדדי מניות,2025-11-26,לא,2024-11-30,ILS,אחר,אי-תלות,2025-09-30,4272.0,1.0,846990.84,6732.0,1.0,57019.42317,0.065771,0.000974
209,9974.0,"בנק לאומי לישראל בע""מ",520018078,ח.פ.,עסקת CALL001 לאומי 12.08.2026,IL0006046119,ISIN,מניה,"חו""ל",ישראל,אשראי חוץ בנקאי,מניות לרבות מדדי מניות,2026-08-12,לא,2025-08-13,ILS,אחר,אי-תלות,2025-09-30,6157.0,1.0,859351.08,6529.0,1.0,56107.03199,0.064719,0.000959
209,9974.0,"בנק לאומי לישראל בע""מ",520018078,ח.פ.,26.11.25 עסקת CALL לאומי,IL0006046119,ISIN,מניה,"חו""ל",ישראל,אשראי חוץ בנקאי,מניות לרבות מדדי מניות,2025-11-26,לא,2024-12-31,ILS,אחר,אי-תלות,2025-09-30,4259.0,1.0,1328202.3,6529.0,1.0,86718.32833,0.100029,0.001482
209,9974.0,"בנק לאומי לישראל בע""מ",520018078,ח.פ.,עסקת לאומי CALL 18.09.26,IL0006046119,ISIN,מניה,"חו""ל",ישראל,אשראי חוץ בנקאי,מניות לרבות מדדי מניות,2026-09-18,לא,2025-09-18,ILS,אחר,אי-תלות,2025-09-30,6235.0,1.0,916543.39,6529.0,1.0,59841.11774,0.069026,0.001022
209,9974.0,"בנק דיסקונט לישראל בע""מ",520007030,ח.פ.,CALL001 דיסקונט 26.5.26,IL0006912120,ISIN,מניה,"חו""ל",ישראל,אשראי חוץ בנקאי,מניות לרבות מדדי מניות,2026-05-26,לא,2025-05-27,ILS,אחר,אי-תלות,2025-09-30,2952.0,1.0,1125714.3,3274.0,1.0,36855.88618,0.042513,0.00063
209,9974.0,"כלל החזקות עסקי ביטוח בע""מ",520036120,ח.פ.,CALL001 כלל 17.12.25,IL0002240146,ISIN,מניה,"חו""ל",ישראל,אשראי חוץ בנקאי,מניות לרבות מדדי מניות,2025-12-17,לא,2024-12-22,ILS,אחר,אי-תלות,2025-09-30,8629.0,1.0,104747.82,16970.0,1.0,17775.70432,0.020504,0.000303
209,9974.0,"בנק הפועלים בע""מ",520000118,ח.פ.,עסקת פועלים CALL 18.09.26,IL0006625771,ISIN,מניה,"חו""ל",ישראל,בנקים,מניות לרבות מדדי מניות,2026-09-18,לא,2025-09-18,ILS,אחר,אי-תלות,2025-09-30,6415.0,1.0,893498.87,6732.0,1.0,60150.34376,0.069383,0.001028
209,9974.0,"בנק הפועלים בע""מ",520000118,ח.פ.,פועלים 03.07.2026 CALL001,IL0006625771,ISIN,מניה,"חו""ל",ישראל,בנקים,מניות לרבות מדדי מניות,2026-07-03,לא,2025-07-03,ILS,אחר,אי-תלות,2025-09-30,6300.0,1.0,535261.34,6732.0,1.0,36033.79327,0.041564,0.000615
209,9974.0,"בנק הפועלים בע""מ",520000118,ח.פ.,26.09.2026 עסקת CALL פועלים,IL0006625771,ISIN,מניה,"חו""ל",ישראל,בנקים,מניות לרבות מדדי מניות,2026-09-26,לא,2025-09-26,ILS,אחר,אי-תלות,2025-09-30,6172.0,1.0,583864.32,6732.0,1.0,39305.74632,0.045338,0.000671
209,9974.0,"מימון ישיר מקבוצת ישיר(2006) בע""מ",513893123,ח.פ.,מימון ישיר 21.09.2026 CALL001,IL0001168186,ISIN,מניה,"חו""ל",ישראל,אשראי חוץ בנקאי,מניות לרבות מדדי מניות,2026-09-21,לא,2025-09-21,ILS,אחר,אי-תלות,2025-09-30,45160.0,1.0,10474.78,49390.0,1.0,5173.49462,0.005967,8.8e-05
209,9974.0,בזק,520031931,ח.פ.,עסקת CALL בזק 29.01.26,IL0002300114,ISIN,מניה,"חו""ל",ישראל,אשראי חוץ בנקאי,מניות לרבות מדדי מניות,2026-01-29,לא,2025-01-30,ILS,אחר,אי-תלות,2025-09-30,1357.5756,1.0,6599112.39,634.7,1.0,41884.56632,0.048313,0.000715
209,9974.0,Odysight.ai Inc,549300FBP1ANSJE5TE25,LEI,אפ לס ODYS US 31/03/2026,620080903,פנימי,מניה,"חו""ל","ארה""ב","Electronic Equipment, Instruments & Components",מניות לרבות מדדי מניות,2026-03-31,לא,2023-03-27,USD,אחר,אי-תלות,2025-09-30,1.15,1.0,167596.51,0.608,3.306,3.36904,3e-06,0.0
209,9974.0,ECO SUN ORADEA S.R.L,7659,פנימי,Ecoenergy Romania Bobisecti,34138,פנימי,מניה,"חו""ל",רומניה,אנרגיה מתחדשת,תשתיות,2025-12-31,לא,2024-08-20,EUR,מומחה בלתי תלוי,אי-תלות,2025-09-30,0.0,1.0,16.53,1700000.0,3.8807,1090.5155,0.001257,1.8e-05
209,9974.0,נאוויטס פטרוליום שותפות מוגבלת,550263107,ח.פ.,קיקר נאוויטס פטרוליום שותפות מוגבל,10048041,פנימי,מניה,"חו""ל","ארה""ב","Oil, Gas & Consumable Fuels",אחר,2027-04-01,לא,2022-11-24,USD,מומחה בלתי תלוי,אי-תלות,2025-09-30,0.0,1.0,636844.34,107.832586,3.306,2270.31523,0.002618,3.8e-05
209,9974.0,Odysight.ai Inc,549300FBP1ANSJE5TE25,LEI,אפ לס ODYS US 31/03/2026,620080901,פנימי,מניה,"חו""ל","ארה""ב","Electronic Equipment, Instruments & Components",מניות לרבות מדדי מניות,2026-03-31,לא,2022-03-18,USD,אחר,אי-תלות,2025-09-30,5.5,1.0,120912.62,0.0,3.306,0.0,0.0,0.0
209,9974.0,ECO SUN ORADEA S.R.L,7659,פנימי,אקואנרגי רומניה 7.25% אירו 31.03.24-אופ ל.ס אורדאה,340292,פנימי,מניה,"חו""ל",רומניה,אנרגיה מתחדשת,תשתיות,2025-12-31,לא,2023-12-31,EUR,מומחה בלתי תלוי,אי-תלות,2025-09-30,0.0,1.0,2292049.9,54.089135,3.8807,4811.09768,0.005549,8.2e-05
209,9974.0,יבולי שמש,515689198,ח.פ.,יבולי שמש אופציה,34140,פנימי,מניה,"חו""ל",רומניה,אנרגיה מתחדשת,תשתיות,2025-12-31,לא,2024-08-20,EUR,מומחה בלתי תלוי,אי-תלות,2025-09-30,0.0,1.0,1.59,148000000.0,3.8807,9143.57017,0.010547,0.000156
209,9974.0,ECO SUN ORADEA S.R.L,7659,פנימי,Ecoenergy Romania option Scurtu Mare,34137,פנימי,מניה,"חו""ל",רומניה,אנרגיה מתחדשת,תשתיות,2025-12-31,לא,2024-08-20,EUR,מומחה בלתי תלוי,אי-תלות,2025-09-30,0.0,1.0,16.53,2807000.0,3.8807,1800.63354,0.002077,3e-05
209,9974.0,ECO SUN ORADEA S.R.L,7659,פנימי,Ecoenergy Romania option  Melinesti,34139,פנימי,מניה,"חו""ל",רומניה,אנרגיה מתחדשת,תשתיות,2025-12-31,לא,2024-08-20,EUR,מומחה בלתי תלוי,אי-תלות,2025-09-30,0.0,1.0,16.53,2646000.0,3.8807,1697.35531,0.001957,2.9e-05
209,9975.0,"טופ גאם תעשיות בע""מ",513561399,ח.פ.,אפ לס טופ גאם 31.01.2027,IL0011791428,ISIN,מניה,ישראל,ישראל,פודטק,מניות לרבות מדדי מניות,2027-01-31,לא,2025-07-31,ILS,אחר,אי-תלות,2025-09-30,1025.0,0.01,65198.35,125.559153,1.0,81.8625,0.000478,5e-06
209,9975.0,"קבוצת אקרו בע""מ",511996803,ח.פ.,אפ לס אקרו 05.08.2026,IL0011849028,ISIN,מניה,ישראל,ישראל,בנייה,מניות לרבות מדדי מניות,2026-08-05,לא,2025-04-07,ILS,אחר,אי-תלות,2025-09-30,70.0,0.01,2153.62,123.307002,1.0,2.65557,1.5e-05,0.0
209,9975.0,"אחים דוניץ בע""מ",520038605,ח.פ.,אפ לס דוניץ 31.12.25,IL0004000100,ISIN,מניה,ישראל,ישראל,בנייה,מניות לרבות מדדי מניות,2025-12-31,לא,2025-01-24,ILS,אחר,אי-תלות,2025-09-30,272.5,0.01,3497.35,1076.583553,1.0,37.65195,0.00022,2e-06
209,9975.0,"אנלייט אנרגיה מתחדשת בע""מ",520041146,ח.פ.,CALL001 אנלייט 17.12.2025,IL0007200111,ISIN,מניה,ישראל,ישראל,אנרגיה מתחדשת,מניות לרבות מדדי מניות,2025-12-17,לא,2024-12-18,ILS,אחר,אי-תלות,2025-09-30,5869.0,1.0,46261.05,10190.0,1.0,4714.00111,0.027572,0.000344
209,9975.0,"רוטשטיין נדל""ן בע""מ",520039959,ח.פ.,אפ לס בכספת-רוטשטין 26.07.2026,IL0005390153,ISIN,מניה,ישראל,ישראל,בנייה,מניות לרבות מדדי מניות,2026-07-26,לא,2025-01-28,ILS,אחר,אי-תלות,2025-09-30,73.0,0.01,17112.06,2363.490861,1.0,404.4419,0.002365,2.9e-05
209,9975.0,"אנלייט אנרגיה מתחדשת בע""מ",520041146,ח.פ.,CALL001 אנלייט 17.12.2025,IL0007200111,ISIN,מניה,ישראל,ישראל,אנרגיה מתחדשת,מניות לרבות מדדי מניות,2025-12-17,לא,2024-12-31,ILS,אחר,אי-תלות,2025-09-30,5869.0,1.0,141559.6,10190.0,1.0,14424.92273,0.084372,0.001053
209,9975.0,"איי.פי.סי. ירושלים בע""מ",513731554,ח.פ.,איי.פי.סי-קיקר 03.09.29,10046044,טיקר,מניה,ישראל,ישראל,מלונאות ותיירות,אחר,2029-09-03,לא,2019-09-03,USD,מומחה בלתי תלוי,אי-תלות,2025-09-30,0.0,1.0,7646.79,239.875582,3.306,60.64127,0.000354,4e-06
209,9975.0,Avo,515658912,ח.פ.,אופציה תכנית 43,34026,טיקר,מניה,ישראל,"ארה""ב",השקעות בהיי-טק,אחר,2027-12-31,לא,2022-12-31,USD,מומחה בלתי תלוי,אי-תלות,2025-09-30,0.0,1.0,7378.46,2050.9348,3.306,500.28839,0.002926,3.6e-05
209,9975.0,"אשדוד אנרגיה בע""מ",513846667,ח.פ.,אשדוד  ורמת נגב אנרגיה-קיקר 31.12.34,1004533,טיקר,מניה,ישראל,ישראל,אנרגיה,אחר,2034-12-31,לא,2019-03-06,ILS,מומחה בלתי תלוי,אי-תלות,2025-09-30,0.0,1.0,180878.55,108.8916,1.0,196.96154,0.001152,1.4e-05
209,9975.0,"אשדוד התפלה בע""מ",514357060,ח.פ.,אשדוד התפלה קיקר,84666750,טיקר,מניה,ישראל,ישראל,תשתיות,אחר,2038-09-08,לא,2022-08-22,ILS,מומחה בלתי תלוי,אי-תלות,2025-09-30,0.0,1.0,322156.28,110.369898,1.0,355.56356,0.002079,2.5e-05
209,9975.0,תחנות כח רמת חובב שותפות מוגבלת,540285947,ח.פ.,קיקר רמת חובב 30.06.40,10047344,טיקר,מניה,ישראל,ישראל,אנרגיה,אחר,2040-06-30,לא,2020-12-02,ILS,מומחה בלתי תלוי,אי-תלות,2025-09-30,0.0,1.0,152776.58,372.846983,1.0,569.62286,0.003331,4.1e-05
209,9975.0,PowerGen,10128,פנימי,PowerGen Option,34100,פנימי,מניה,ישראל,ישראל,תשתיות,תשתיות,2027-01-24,לא,2024-03-18,ILS,מומחה בלתי תלוי,אי-תלות,2025-09-30,0.0,1.0,51.34,100.0,1.0,0.05134,0.0,0.0
209,9975.0,"סולאיר אנרגיות מתחדשות בע""מ",516046307,ח.פ.,אפ לס סולאיר סדרה ב 25.12.2027,11722873,פנימי,מניה,ישראל,ישראל,אנרגיה מתחדשת,מניות לרבות מדדי מניות,2027-12-25,לא,2024-04-30,ILS,אחר,אי-תלות,2025-09-30,45.63,0.01,8982.37,1109.37802,1.0,99.64847,0.000582,7e-06
209,9975.0,CITI Bank,549300U8H3KN0K301B23,LEI,FXVOpt 3.6800 CALL USD-PLN 30.10.25,100120432,פנימי,"מט""ח",ישראל,ישראל,אחר,"מט""ח",2025-10-30,לא,2025-09-29,USD,אחר,אי-תלות,2025-09-30,3.68,1.0,-753011.2,0.5646,3.306,-14.05721,-8.2e-05,-1e-06
209,9975.0,"מאיר חברה למכוניות ומשאיות בע""מ",510485261,ח.פ.,קבוצת מאיר-אופציה לא סחירה,340271,פנימי,מניה,ישראל,ישראל,השקעה ואחזקות,אחר,2026-06-30,לא,2023-12-31,ILS,מומחה בלתי תלוי,אי-תלות,2025-09-30,0.0,1.0,12550.3,8069.8607,1.0,1012.79172,0.005923,7.3e-05
209,9975.0,CITI Bank,549300U8H3KN0K301B23,LEI,FXVOpt 145.0000 PUT USD-JPY 20.10.25,100120170,פנימי,"מט""ח",ישראל,ישראל,אחר,"מט""ח",2025-10-20,לא,2025-09-18,USD,אחר,אי-תלות,2025-09-30,145.0,1.0,-4018997.22,0.2748,3.306,-36.52277,-0.000213,-2e-06
209,9975.0,"סולאיר אנרגיות מתחדשות בע""מ",516046307,ח.פ.,אפ לס סולאיר סדרה א 25.12.2025,11722872,פנימי,מניה,ישראל,ישראל,אנרגיה מתחדשת,מניות לרבות מדדי מניות,2025-12-25,לא,2024-04-30,ILS,אחר,אי-תלות,2025-09-30,38.52,0.01,8982.37,788.722208,1.0,70.84597,0.000414,5e-06
209,9975.0,"כלל החזקות עסקי ביטוח בע""מ",520036120,ח.פ.,CALL001 כלל 17.12.25,IL0002240146,ISIN,מניה,"חו""ל",ישראל,אשראי חוץ בנקאי,מניות לרבות מדדי מניות,2025-12-17,לא,2024-12-22,ILS,אחר,אי-תלות,2025-09-30,8629.0,1.0,20817.59,16970.0,1.0,3532.7446,0.020663,0.000258
209,9975.0,"בנק דיסקונט לישראל בע""מ",520007030,ח.פ.,CALL001 דיסקונט 26.5.26,IL0006912120,ISIN,מניה,"חו""ל",ישראל,אשראי חוץ בנקאי,מניות לרבות מדדי מניות,2026-05-26,לא,2025-05-27,ILS,אחר,אי-תלות,2025-09-30,2952.0,1.0,223724.53,3274.0,1.0,7324.74115,0.042843,0.000535
209,9975.0,"ישראכרט בע""מ",510706153,ח.פ.,ישראכרט 07.05.2026 CALL001,IL0011574030,ISIN,מניה,"חו""ל",ישראל,אשראי חוץ בנקאי,מניות לרבות מדדי מניות,2026-05-07,לא,2025-05-07,ILS,אחר,אי-תלות,2025-09-30,1699.0,1.0,47564.86,1338.0,1.0,636.41778,0.003722,4.6e-05
209,9975.0,"מימון ישיר מקבוצת ישיר(2006) בע""מ",513893123,ח.פ.,מימון ישיר 21.09.2026 CALL001,IL0001168186,ISIN,מניה,"חו""ל",ישראל,אשראי חוץ בנקאי,מניות לרבות מדדי מניות,2026-09-21,לא,2025-09-21,ILS,אחר,אי-תלות,2025-09-30,45160.0,1.0,2081.76,49390.0,1.0,1028.18065,0.006013,7.5e-05
209,9975.0,בזק,520031931,ח.פ.,עסקת CALL בזק 29.01.26,IL0002300114,ISIN,מניה,"חו""ל",ישראל,אשראי חוץ בנקאי,מניות לרבות מדדי מניות,2026-01-29,לא,2025-01-30,ILS,אחר,אי-תלות,2025-09-30,1357.5756,1.0,1311508.01,634.7,1.0,8324.14136,0.048688,0.000608
209,9975.0,"בנק הפועלים בע""מ",520000118,ח.פ.,עסקת פועלים CALL 18.09.26,IL0006625771,ISIN,מניה,"חו""ל",ישראל,בנקים,מניות לרבות מדדי מניות,2026-09-18,לא,2025-09-18,ILS,אחר,אי-תלות,2025-09-30,6415.0,1.0,177574.02,6732.0,1.0,11954.28312,0.069921,0.000873
209,9975.0,"בנק לאומי לישראל בע""מ",520018078,ח.פ.,עסקת לאומי CALL 18.09.26,IL0006046119,ISIN,מניה,"חו""ל",ישראל,אשראי חוץ בנקאי,מניות לרבות מדדי מניות,2026-09-18,לא,2025-09-18,ILS,אחר,אי-תלות,2025-09-30,6235.0,1.0,182153.89,6529.0,1.0,11892.82752,0.069562,0.000868
209,9975.0,"בנק לאומי לישראל בע""מ",520018078,ח.פ.,26.09.26 עסקת CALL לאומי,IL0006046119,ISIN,מניה,"חו""ל",ישראל,אשראי חוץ בנקאי,מניות לרבות מדדי מניות,2026-09-26,לא,2025-09-26,ILS,אחר,אי-תלות,2025-09-30,5965.0,1.0,214441.47,6529.0,1.0,14000.88353,0.081892,0.001022
209,9975.0,"בנק הפועלים בע""מ",520000118,ח.פ.,CALL001 פועלים 26.05.26,IL0006625771,ISIN,מניה,"חו""ל",ישראל,בנקים,מניות לרבות מדדי מניות,2026-05-26,לא,2025-05-27,ILS,אחר,אי-תלות,2025-09-30,5784.0,1.0,50836.55,6732.0,1.0,3422.31646,0.020017,0.00025
209,9975.0,"בנק הפועלים בע""מ",520000118,ח.פ.,26.11.25 עסקת CALL פועלים,IL0006625771,ISIN,מניה,"חו""ל",ישראל,בנקים,מניות לרבות מדדי מניות,2025-11-26,לא,2024-11-30,ILS,אחר,אי-תלות,2025-09-30,4272.0,1.0,168331.01,6732.0,1.0,11332.04377,0.066282,0.000827
209,9975.0,"בנק הפועלים בע""מ",520000118,ח.פ.,CALL001 פועלים 23.07.26,IL0006625771,ISIN,מניה,"חו""ל",ישראל,בנקים,מניות לרבות מדדי מניות,2026-07-23,לא,2025-07-24,ILS,אחר,אי-תלות,2025-09-30,6465.76,1.0,83270.35,6732.0,1.0,5605.75996,0.032788,0.000409
209,9975.0,"בנק הפועלים בע""מ",520000118,ח.פ.,26.09.2026 עסקת CALL פועלים,IL0006625771,ISIN,מניה,"חו""ל",ישראל,בנקים,מניות לרבות מדדי מניות,2026-09-26,לא,2025-09-26,ILS,אחר,אי-תלות,2025-09-30,6172.0,1.0,116037.23,6732.0,1.0,7811.62651,0.04569,0.00057
209,9975.0,"מימון ישיר מקבוצת ישיר(2006) בע""מ",513893123,ח.פ.,מימון ישיר 26.03.2026 CALL001,IL0001168186,ISIN,מניה,"חו""ל",ישראל,אשראי חוץ בנקאי,מניות לרבות מדדי מניות,2026-03-26,לא,2025-03-26,ILS,אחר,אי-תלות,2025-09-30,53970.0,1.0,314.35,49390.0,1.0,155.25528,0.000908,1.1e-05
209,9975.0,"כלל החזקות עסקי ביטוח בע""מ",520036120,ח.פ.,CALL001 כלל 15.07.26,IL0002240146,ISIN,מניה,"חו""ל",ישראל,אשראי חוץ בנקאי,מניות לרבות מדדי מניות,2026-07-14,לא,2025-07-15,ILS,אחר,אי-תלות,2025-09-30,8629.0,1.0,25605.63,16970.0,1.0,4345.27586,0.025415,0.000317
209,9975.0,"בנק הפועלים בע""מ",520000118,ח.פ.,עסקת CALL001 פועלים 12.08.2026,IL0006625771,ISIN,מניה,"חו""ל",ישראל,בנקים,מניות לרבות מדדי מניות,2026-08-12,לא,2025-08-13,ILS,אחר,אי-תלות,2025-09-30,6389.0,1.0,176949.49,6732.0,1.0,11912.23992,0.069675,0.00087
209,9975.0,"בנק לאומי לישראל בע""מ",520018078,ח.פ.,עסקת CALL001 לאומי 12.08.2026,IL0006046119,ISIN,מניה,"חו""ל",ישראל,אשראי חוץ בנקאי,מניות לרבות מדדי מניות,2026-08-12,לא,2025-08-13,ILS,אחר,אי-תלות,2025-09-30,6157.0,1.0,170787.49,6529.0,1.0,11150.71508,0.065221,0.000814
209,9975.0,"בנק לאומי לישראל בע""מ",520018078,ח.פ.,26.11.25 עסקת CALL לאומי,IL0006046119,ISIN,מניה,"חו""ל",ישראל,אשראי חוץ בנקאי,מניות לרבות מדדי מניות,2025-11-26,לא,2024-12-31,ILS,אחר,אי-תלות,2025-09-30,4259.0,1.0,263967.01,6529.0,1.0,17234.40605,0.100805,0.001259
209,9975.0,בזק,520031931,ח.פ.,CALL001 בזק 26/05/2026,IL0002300114,ISIN,מניה,"חו""ל",ישראל,אשראי חוץ בנקאי,מניות לרבות מדדי מניות,2026-05-26,לא,2025-05-27,ILS,אחר,אי-תלות,2025-09-30,551.6,1.0,944535.58,634.7,1.0,5994.96733,0.035065,0.000437
209,9975.0,"בנק הפועלים בע""מ",520000118,ח.פ.,פועלים 03.07.2026 CALL001,IL0006625771,ISIN,מניה,"חו""ל",ישראל,בנקים,מניות לרבות מדדי מניות,2026-07-03,לא,2025-07-03,ILS,אחר,אי-תלות,2025-09-30,6300.0,1.0,106377.87,6732.0,1.0,7161.35835,0.041887,0.000523
209,9975.0,ECO SUN ORADEA S.R.L,7659,פנימי,Ecoenergy Romania Bobisecti,34138,פנימי,מניה,"חו""ל",רומניה,אנרגיה מתחדשת,תשתיות,2025-12-31,לא,2024-08-20,EUR,מומחה בלתי תלוי,אי-תלות,2025-09-30,0.0,1.0,2.47,1700000.0,3.8807,162.95059,0.000953,1.1e-05
209,9975.0,Odysight.ai Inc,549300FBP1ANSJE5TE25,LEI,אפ לס ODYS US 31/03/2026,620080901,פנימי,מניה,"חו""ל","ארה""ב","Electronic Equipment, Instruments & Components",מניות לרבות מדדי מניות,2026-03-31,לא,2022-03-18,USD,אחר,אי-תלות,2025-09-30,5.5,1.0,24030.18,0.0,3.306,0.0,0.0,0.0
209,9975.0,ECO SUN ORADEA S.R.L,7659,פנימי,Ecoenergy Romania option  Melinesti,34139,פנימי,מניה,"חו""ל",רומניה,אנרגיה מתחדשת,תשתיות,2025-12-31,לא,2024-08-20,EUR,מומחה בלתי תלוי,אי-תלות,2025-09-30,0.0,1.0,2.47,2646000.0,3.8807,253.6278,0.001483,1.8e-05
209,9975.0,Odysight.ai Inc,549300FBP1ANSJE5TE25,LEI,אפ לס ODYS US 31/03/2026,620080903,פנימי,מניה,"חו""ל","ארה""ב","Electronic Equipment, Instruments & Components",מניות לרבות מדדי מניות,2026-03-31,לא,2023-03-27,USD,אחר,אי-תלות,2025-09-30,1.15,1.0,33308.14,0.608,3.306,0.66956,3e-06,0.0
209,9975.0,ECO SUN ORADEA S.R.L,7659,פנימי,אקואנרגי רומניה 7.25% אירו 31.03.24-אופ ל.ס אורדאה,340292,פנימי,מניה,"חו""ל",רומניה,אנרגיה מתחדשת,תשתיות,2025-12-31,לא,2023-12-31,EUR,מומחה בלתי תלוי,אי-תלות,2025-09-30,0.0,1.0,342490.23,54.089135,3.8807,718.89968,0.004204,5.2e-05
209,9975.0,יבולי שמש,515689198,ח.פ.,יבולי שמש אופציה,34140,פנימי,מניה,"חו""ל",רומניה,אנרגיה מתחדשת,תשתיות,2025-12-31,לא,2024-08-20,EUR,מומחה בלתי תלוי,אי-תלות,2025-09-30,0.0,1.0,0.34,148000000.0,3.8807,1944.32514,0.011372,0.000142
209,9975.0,ECO SUN ORADEA S.R.L,7659,פנימי,Ecoenergy Romania option Scurtu Mare,34137,פנימי,מניה,"חו""ל",רומניה,אנרגיה מתחדשת,תשתיות,2025-12-31,לא,2024-08-20,EUR,מומחה בלתי תלוי,אי-תלות,2025-09-30,0.0,1.0,2.47,2807000.0,3.8807,269.06018,0.001573,1.9e-05
209,9975.0,נאוויטס פטרוליום שותפות מוגבלת,550263107,ח.פ.,קיקר נאוויטס פטרוליום שותפות מוגבל,10048041,פנימי,מניה,"חו""ל","ארה""ב","Oil, Gas & Consumable Fuels",אחר,2027-04-01,לא,2022-11-24,USD,מומחה בלתי תלוי,אי-תלות,2025-09-30,0.0,1.0,88474.54,107.832586,3.306,315.40689,0.001844,2.3e-05
209,9976.0,"אחים דוניץ בע""מ",520038605,ח.פ.,אפ לס דוניץ 31.12.25,IL0004000100,ISIN,מניה,ישראל,ישראל,בנייה,מניות לרבות מדדי מניות,2025-12-31,לא,2025-01-24,ILS,אחר,אי-תלות,2025-09-30,272.5,0.01,681.94,1076.583553,1.0,7.34165,0.000213,1e-06
209,9976.0,"אנלייט אנרגיה מתחדשת בע""מ",520041146,ח.פ.,CALL001 אנלייט 17.12.2025,IL0007200111,ISIN,מניה,ישראל,ישראל,אנרגיה מתחדשת,מניות לרבות מדדי מניות,2025-12-17,לא,2024-12-31,ILS,אחר,אי-תלות,2025-09-30,5869.0,1.0,27602.31,10190.0,1.0,2812.67501,0.081701,0.000501
209,9976.0,"קבוצת אקרו בע""מ",511996803,ח.פ.,אפ לס אקרו 05.08.2026,IL0011849028,ISIN,מניה,ישראל,ישראל,בנייה,מניות לרבות מדדי מניות,2026-08-05,לא,2025-04-07,ILS,אחר,אי-תלות,2025-09-30,70.0,0.01,419.93,123.307002,1.0,0.5178,1.5e-05,0.0
209,9976.0,"רוטשטיין נדל""ן בע""מ",520039959,ח.פ.,אפ לס בכספת-רוטשטין 26.07.2026,IL0005390153,ISIN,מניה,ישראל,ישראל,בנייה,מניות לרבות מדדי מניות,2026-07-26,לא,2025-01-28,ILS,אחר,אי-תלות,2025-09-30,73.0,0.01,3336.63,2363.490861,1.0,78.86099,0.00229,1.4e-05
209,9976.0,"אנלייט אנרגיה מתחדשת בע""מ",520041146,ח.פ.,CALL001 אנלייט 17.12.2025,IL0007200111,ISIN,מניה,ישראל,ישראל,אנרגיה מתחדשת,מניות לרבות מדדי מניות,2025-12-17,לא,2024-12-18,ILS,אחר,אי-תלות,2025-09-30,5869.0,1.0,9020.31,10190.0,1.0,919.16979,0.026699,0.000163
209,9976.0,"טופ גאם תעשיות בע""מ",513561399,ח.פ.,אפ לס טופ גאם 31.01.2027,IL0011791428,ISIN,מניה,ישראל,ישראל,פודטק,מניות לרבות מדדי מניות,2027-01-31,לא,2025-07-31,ILS,אחר,אי-תלות,2025-09-30,1025.0,0.01,12712.84,125.559153,1.0,15.96214,0.000463,2e-06
209,9976.0,"איי.פי.סי. ירושלים בע""מ",513731554,ח.פ.,איי.פי.סי-קיקר 03.09.29,10046044,טיקר,מניה,ישראל,ישראל,מלונאות ותיירות,אחר,2029-09-03,לא,2019-09-03,USD,מומחה בלתי תלוי,אי-תלות,2025-09-30,0.0,1.0,3349.11,239.875582,3.306,26.55941,0.000771,4e-06
209,9976.0,"אשדוד אנרגיה בע""מ",513846667,ח.פ.,אשדוד  ורמת נגב אנרגיה-קיקר 31.12.34,1004533,טיקר,מניה,ישראל,ישראל,אנרגיה,אחר,2034-12-31,לא,2019-03-06,ILS,מומחה בלתי תלוי,אי-תלות,2025-09-30,0.0,1.0,79220.42,108.8916,1.0,86.26438,0.002505,1.5e-05
209,9976.0,תחנות כח רמת חובב שותפות מוגבלת,540285947,ח.פ.,קיקר רמת חובב 30.06.40,10047344,טיקר,מניה,ישראל,ישראל,אנרגיה,אחר,2040-06-30,לא,2020-12-02,ILS,מומחה בלתי תלוי,אי-תלות,2025-09-30,0.0,1.0,66912.44,372.846983,1.0,249.48101,0.007246,4.4e-05
209,9976.0,"אשדוד התפלה בע""מ",514357060,ח.פ.,אשדוד התפלה קיקר,84666750,טיקר,מניה,ישראל,ישראל,תשתיות,אחר,2038-09-08,לא,2022-08-22,ILS,מומחה בלתי תלוי,אי-תלות,2025-09-30,0.0,1.0,141096.64,110.369898,1.0,155.72822,0.004523,2.7e-05
209,9976.0,"סולאיר אנרגיות מתחדשות בע""מ",516046307,ח.פ.,אפ לס סולאיר סדרה ב 25.12.2027,11722873,פנימי,מניה,ישראל,ישראל,אנרגיה מתחדשת,מניות לרבות מדדי מניות,2027-12-25,לא,2024-04-30,ILS,אחר,אי-תלות,2025-09-30,45.63,0.01,1751.45,1109.37802,1.0,19.43017,0.000564,3e-06
209,9976.0,"סולאיר אנרגיות מתחדשות בע""מ",516046307,ח.פ.,אפ לס סולאיר סדרה א 25.12.2025,11722872,פנימי,מניה,ישראל,ישראל,אנרגיה מתחדשת,מניות לרבות מדדי מניות,2025-12-25,לא,2024-04-30,ILS,אחר,אי-תלות,2025-09-30,38.52,0.01,1751.45,788.722208,1.0,13.81406,0.000401,2e-06
209,9976.0,"מאיר חברה למכוניות ומשאיות בע""מ",510485261,ח.פ.,קבוצת מאיר-אופציה לא סחירה,340271,פנימי,מניה,ישראל,ישראל,השקעה ואחזקות,אחר,2026-06-30,לא,2023-12-31,ILS,מומחה בלתי תלוי,אי-תלות,2025-09-30,0.0,1.0,4420.55,8069.8607,1.0,356.73222,0.010362,6.3e-05
209,9976.0,CITI Bank,549300U8H3KN0K301B23,LEI,FXVOpt 3.6800 CALL USD-PLN 30.10.25,100120432,פנימי,"מט""ח",ישראל,ישראל,אחר,"מט""ח",2025-10-30,לא,2025-09-29,USD,אחר,אי-תלות,2025-09-30,3.68,1.0,-375539.0,0.5646,3.306,-7.01056,-0.000203,-1e-06
209,9976.0,PowerGen,10128,פנימי,PowerGen Option,34100,פנימי,מניה,ישראל,ישראל,תשתיות,תשתיות,2027-01-24,לא,2024-03-18,ILS,מומחה בלתי תלוי,אי-תלות,2025-09-30,0.0,1.0,25.04,100.0,1.0,0.02504,0.0,0.0
209,9976.0,CITI Bank,549300U8H3KN0K301B23,LEI,FXVOpt 145.0000 PUT USD-JPY 20.10.25,100120170,פנימי,"מט""ח",ישראל,ישראל,אחר,"מט""ח",2025-10-20,לא,2025-09-18,USD,אחר,אי-תלות,2025-09-30,145.0,1.0,-1156006.38,0.2748,3.306,-10.50525,-0.000304,-1e-06
209,9976.0,"מימון ישיר מקבוצת ישיר(2006) בע""מ",513893123,ח.פ.,מימון ישיר 21.09.2026 CALL001,IL0001168186,ISIN,מניה,"חו""ל",ישראל,אשראי חוץ בנקאי,מניות לרבות מדדי מניות,2026-09-21,לא,2025-09-21,ILS,אחר,אי-תלות,2025-09-30,45160.0,1.0,405.92,49390.0,1.0,200.48205,0.005823,3.5e-05
209,9976.0,"מימון ישיר מקבוצת ישיר(2006) בע""מ",513893123,ח.פ.,מימון ישיר 26.03.2026 CALL001,IL0001168186,ISIN,מניה,"חו""ל",ישראל,אשראי חוץ בנקאי,מניות לרבות מדדי מניות,2026-03-26,לא,2025-03-26,ILS,אחר,אי-תלות,2025-09-30,53970.0,1.0,61.29,49390.0,1.0,30.27279,0.000879,5e-06
209,9976.0,"בנק הפועלים בע""מ",520000118,ח.פ.,עסקת CALL001 פועלים 12.08.2026,IL0006625771,ISIN,מניה,"חו""ל",ישראל,בנקים,מניות לרבות מדדי מניות,2026-08-12,לא,2025-08-13,ILS,אחר,אי-תלות,2025-09-30,6389.0,1.0,34502.88,6732.0,1.0,2322.73408,0.067469,0.000414
209,9976.0,"בנק הפועלים בע""מ",520000118,ח.פ.,26.09.2026 עסקת CALL פועלים,IL0006625771,ISIN,מניה,"חו""ל",ישראל,בנקים,מניות לרבות מדדי מניות,2026-09-26,לא,2025-09-26,ILS,אחר,אי-תלות,2025-09-30,6172.0,1.0,22625.77,6732.0,1.0,1523.16703,0.044244,0.000271
209,9976.0,"בנק דיסקונט לישראל בע""מ",520007030,ח.פ.,CALL001 דיסקונט 26.5.26,IL0006912120,ISIN,מניה,"חו""ל",ישראל,אשראי חוץ בנקאי,מניות לרבות מדדי מניות,2026-05-26,לא,2025-05-27,ILS,אחר,אי-תלות,2025-09-30,2952.0,1.0,43623.42,3274.0,1.0,1428.23063,0.041486,0.000254
209,9976.0,בזק,520031931,ח.פ.,CALL001 בזק 26/05/2026,IL0002300114,ISIN,מניה,"חו""ל",ישראל,אשראי חוץ בנקאי,מניות לרבות מדדי מניות,2026-05-26,לא,2025-05-27,ILS,אחר,אי-תלות,2025-09-30,551.6,1.0,184172.33,634.7,1.0,1168.94178,0.033954,0.000208
209,9976.0,"כלל החזקות עסקי ביטוח בע""מ",520036120,ח.פ.,CALL001 כלל 17.12.25,IL0002240146,ISIN,מניה,"חו""ל",ישראל,אשראי חוץ בנקאי,מניות לרבות מדדי מניות,2025-12-17,לא,2024-12-22,ILS,אחר,אי-תלות,2025-09-30,8629.0,1.0,4059.16,16970.0,1.0,688.83991,0.020009,0.000122
209,9976.0,"בנק לאומי לישראל בע""מ",520018078,ח.פ.,26.09.26 עסקת CALL לאומי,IL0006046119,ISIN,מניה,"חו""ל",ישראל,אשראי חוץ בנקאי,מניות לרבות מדדי מניות,2026-09-26,לא,2025-09-26,ILS,אחר,אי-תלות,2025-09-30,5965.0,1.0,41813.34,6529.0,1.0,2729.9928,0.079299,0.000487
209,9976.0,"בנק הפועלים בע""מ",520000118,ח.פ.,CALL001 פועלים 26.05.26,IL0006625771,ISIN,מניה,"חו""ל",ישראל,בנקים,מניות לרבות מדדי מניות,2026-05-26,לא,2025-05-27,ILS,אחר,אי-תלות,2025-09-30,5784.0,1.0,9912.48,6732.0,1.0,667.30784,0.019383,0.000119
209,9976.0,"בנק לאומי לישראל בע""מ",520018078,ח.פ.,26.11.25 עסקת CALL לאומי,IL0006046119,ISIN,מניה,"חו""ל",ישראל,אשראי חוץ בנקאי,מניות לרבות מדדי מניות,2025-11-26,לא,2024-12-31,ILS,אחר,אי-תלות,2025-09-30,4259.0,1.0,51470.18,6529.0,1.0,3360.48825,0.097614,0.000599
209,9976.0,"ישראכרט בע""מ",510706153,ח.פ.,ישראכרט 07.05.2026 CALL001,IL0011574030,ISIN,מניה,"חו""ל",ישראל,אשראי חוץ בנקאי,מניות לרבות מדדי מניות,2026-05-07,לא,2025-05-07,ILS,אחר,אי-תלות,2025-09-30,1699.0,1.0,9274.54,1338.0,1.0,124.09331,0.003604,2.2e-05
209,9976.0,"בנק לאומי לישראל בע""מ",520018078,ח.פ.,עסקת CALL001 לאומי 12.08.2026,IL0006046119,ISIN,מניה,"חו""ל",ישראל,אשראי חוץ בנקאי,מניות לרבות מדדי מניות,2026-08-12,לא,2025-08-13,ILS,אחר,אי-תלות,2025-09-30,6157.0,1.0,33301.37,6529.0,1.0,2174.2465,0.063156,0.000387
209,9976.0,"כלל החזקות עסקי ביטוח בע""מ",520036120,ח.פ.,CALL001 כלל 15.07.26,IL0002240146,ISIN,מניה,"חו""ל",ישראל,אשראי חוץ בנקאי,מניות לרבות מדדי מניות,2026-07-14,לא,2025-07-15,ILS,אחר,אי-תלות,2025-09-30,8629.0,1.0,4992.77,16970.0,1.0,847.27309,0.024611,0.000151
209,9976.0,"בנק הפועלים בע""מ",520000118,ח.פ.,26.11.25 עסקת CALL פועלים,IL0006625771,ISIN,מניה,"חו""ל",ישראל,בנקים,מניות לרבות מדדי מניות,2025-11-26,לא,2024-11-30,ILS,אחר,אי-תלות,2025-09-30,4272.0,1.0,32822.39,6732.0,1.0,2209.60326,0.064183,0.000394
209,9976.0,בזק,520031931,ח.פ.,עסקת CALL בזק 29.01.26,IL0002300114,ISIN,מניה,"חו""ל",ישראל,אשראי חוץ בנקאי,מניות לרבות מדדי מניות,2026-01-29,לא,2025-01-30,ILS,אחר,אי-תלות,2025-09-30,1357.5756,1.0,255727.25,634.7,1.0,1623.10085,0.047147,0.000289
209,9976.0,"בנק הפועלים בע""מ",520000118,ח.פ.,עסקת פועלים CALL 18.09.26,IL0006625771,ISIN,מניה,"חו""ל",ישראל,בנקים,מניות לרבות מדדי מניות,2026-09-18,לא,2025-09-18,ILS,אחר,אי-תלות,2025-09-30,6415.0,1.0,34624.66,6732.0,1.0,2330.93196,0.067707,0.000415
209,9976.0,"בנק הפועלים בע""מ",520000118,ח.פ.,CALL001 פועלים 23.07.26,IL0006625771,ISIN,מניה,"חו""ל",ישראל,בנקים,מניות לרבות מדדי מניות,2026-07-23,לא,2025-07-24,ILS,אחר,אי-תלות,2025-09-30,6465.76,1.0,16236.65,6732.0,1.0,1093.05133,0.03175,0.000195
209,9976.0,"בנק לאומי לישראל בע""מ",520018078,ח.פ.,עסקת לאומי CALL 18.09.26,IL0006046119,ISIN,מניה,"חו""ל",ישראל,אשראי חוץ בנקאי,מניות לרבות מדדי מניות,2026-09-18,לא,2025-09-18,ILS,אחר,אי-תלות,2025-09-30,6235.0,1.0,35517.67,6529.0,1.0,2318.94891,0.067359,0.000413
209,9976.0,"בנק הפועלים בע""מ",520000118,ח.פ.,פועלים 03.07.2026 CALL001,IL0006625771,ISIN,מניה,"חו""ל",ישראל,בנקים,מניות לרבות מדדי מניות,2026-07-03,לא,2025-07-03,ILS,אחר,אי-תלות,2025-09-30,6300.0,1.0,20742.32,6732.0,1.0,1396.37307,0.040561,0.000249
209,9976.0,יבולי שמש,515689198,ח.פ.,יבולי שמש אופציה,34140,פנימי,מניה,"חו""ל",רומניה,אנרגיה מתחדשת,תשתיות,2025-12-31,לא,2024-08-20,EUR,מומחה בלתי תלוי,אי-תלות,2025-09-30,0.0,1.0,0.15,148000000.0,3.8807,851.56729,0.024735,0.000151
209,9976.0,ECO SUN ORADEA S.R.L,7659,פנימי,אקואנרגי רומניה 7.25% אירו 31.03.24-אופ ל.ס אורדאה,340292,פנימי,מניה,"חו""ל",רומניה,אנרגיה מתחדשת,תשתיות,2025-12-31,לא,2023-12-31,EUR,מומחה בלתי תלוי,אי-תלות,2025-09-30,0.0,1.0,120634.21,54.089135,3.8807,253.21567,0.007355,4.5e-05
209,9976.0,ECO SUN ORADEA S.R.L,7659,פנימי,Ecoenergy Romania option Scurtu Mare,34137,פנימי,מניה,"חו""ל",רומניה,אנרגיה מתחדשת,תשתיות,2025-12-31,לא,2024-08-20,EUR,מומחה בלתי תלוי,אי-תלות,2025-09-30,0.0,1.0,0.87,2807000.0,3.8807,94.77018,0.002752,1.6e-05
209,9976.0,Odysight.ai Inc,549300FBP1ANSJE5TE25,LEI,אפ לס ODYS US 31/03/2026,620080901,פנימי,מניה,"חו""ל","ארה""ב","Electronic Equipment, Instruments & Components",מניות לרבות מדדי מניות,2026-03-31,לא,2022-03-18,USD,אחר,אי-תלות,2025-09-30,5.5,1.0,4685.58,0.0,3.306,0.0,0.0,0.0
209,9976.0,ECO SUN ORADEA S.R.L,7659,פנימי,Ecoenergy Romania Bobisecti,34138,פנימי,מניה,"חו""ל",רומניה,אנרגיה מתחדשת,תשתיות,2025-12-31,לא,2024-08-20,EUR,מומחה בלתי תלוי,אי-תלות,2025-09-30,0.0,1.0,0.87,1700000.0,3.8807,57.39555,0.001667,1e-05
209,9976.0,נאוויטס פטרוליום שותפות מוגבלת,550263107,ח.פ.,קיקר נאוויטס פטרוליום שותפות מוגבל,10048041,פנימי,מניה,"חו""ל","ארה""ב","Oil, Gas & Consumable Fuels",אחר,2027-04-01,לא,2022-11-24,USD,מומחה בלתי תלוי,אי-תלות,2025-09-30,0.0,1.0,32747.07,107.832586,3.306,116.74151,0.003391,2e-05
209,9976.0,ECO SUN ORADEA S.R.L,7659,פנימי,Ecoenergy Romania option  Melinesti,34139,פנימי,מניה,"חו""ל",רומניה,אנרגיה מתחדשת,תשתיות,2025-12-31,לא,2024-08-20,EUR,מומחה בלתי תלוי,אי-תלות,2025-09-30,0.0,1.0,0.87,2646000.0,3.8807,89.33449,0.002594,1.5e-05
209,9976.0,Odysight.ai Inc,549300FBP1ANSJE5TE25,LEI,אפ לס ODYS US 31/03/2026,620080903,פנימי,מניה,"חו""ל","ארה""ב","Electronic Equipment, Instruments & Components",מניות לרבות מדדי מניות,2026-03-31,לא,2023-03-27,USD,אחר,אי-תלות,2025-09-30,1.15,1.0,6494.66,0.608,3.306,0.13056,3e-06,0.0
325,325.0,"קבוצת אקרו בע""מ",511996803,ח.פ.,אפ לס אקרו 05.08.2026,IL0011849028,ISIN,מניה,ישראל,ישראל,בנייה,מניות לרבות מדדי מניות,2026-08-05,לא,2025-04-07,ILS,אחר,אי-תלות,2025-09-30,70.0,0.01,39.85,123.307002,1.0,0.04914,1.5e-05,0.0
325,325.0,"אחים דוניץ בע""מ",520038605,ח.פ.,אפ לס דוניץ 31.12.25,IL0004000100,ISIN,מניה,ישראל,ישראל,בנייה,מניות לרבות מדדי מניות,2025-12-31,לא,2025-01-24,ILS,אחר,אי-תלות,2025-09-30,272.5,0.01,64.72,1076.583553,1.0,0.69678,0.000223,1e-06
325,325.0,"רוטשטיין נדל""ן בע""מ",520039959,ח.פ.,אפ לס בכספת-רוטשטין 26.07.2026,IL0005390153,ISIN,מניה,ישראל,ישראל,בנייה,מניות לרבות מדדי מניות,2026-07-26,לא,2025-01-28,ILS,אחר,אי-תלות,2025-09-30,73.0,0.01,316.67,2363.490861,1.0,7.48452,0.002403,1.3e-05
325,325.0,"אנלייט אנרגיה מתחדשת בע""מ",520041146,ח.פ.,CALL001 אנלייט 17.12.2025,IL0007200111,ISIN,מניה,ישראל,ישראל,אנרגיה מתחדשת,מניות לרבות מדדי מניות,2025-12-17,לא,2024-12-31,ILS,אחר,אי-תלות,2025-09-30,5869.0,1.0,2619.67,10190.0,1.0,266.94483,0.085736,0.000469
325,325.0,"טופ גאם תעשיות בע""מ",513561399,ח.פ.,אפ לס טופ גאם 31.01.2027,IL0011791428,ISIN,מניה,ישראל,ישראל,פודטק,מניות לרבות מדדי מניות,2027-01-31,לא,2025-07-31,ILS,אחר,אי-תלות,2025-09-30,1025.0,0.01,1206.55,125.559153,1.0,1.51493,0.000486,2e-06
325,325.0,"אנלייט אנרגיה מתחדשת בע""מ",520041146,ח.פ.,CALL001 אנלייט 17.12.2025,IL0007200111,ISIN,מניה,ישראל,ישראל,אנרגיה מתחדשת,מניות לרבות מדדי מניות,2025-12-17,לא,2024-12-18,ILS,אחר,אי-תלות,2025-09-30,5869.0,1.0,856.1,10190.0,1.0,87.23639,0.028018,0.000153
325,325.0,"אשדוד התפלה בע""מ",514357060,ח.פ.,אשדוד התפלה קיקר,84666750,טיקר,מניה,ישראל,ישראל,תשתיות,אחר,2038-09-08,לא,2022-08-22,ILS,מומחה בלתי תלוי,אי-תלות,2025-09-30,0.0,1.0,4686.4,110.369898,1.0,5.17237,0.001661,9e-06
325,325.0,"איי.פי.סי. ירושלים בע""מ",513731554,ח.פ.,איי.פי.סי-קיקר 03.09.29,10046044,טיקר,מניה,ישראל,ישראל,מלונאות ותיירות,אחר,2029-09-03,לא,2019-09-03,USD,מומחה בלתי תלוי,אי-תלות,2025-09-30,0.0,1.0,111.24,239.875582,3.306,0.88215,0.000283,1e-06
325,325.0,"אשדוד אנרגיה בע""מ",513846667,ח.פ.,אשדוד  ורמת נגב אנרגיה-קיקר 31.12.34,1004533,טיקר,מניה,ישראל,ישראל,אנרגיה,אחר,2034-12-31,לא,2019-03-06,ILS,מומחה בלתי תלוי,אי-תלות,2025-09-30,0.0,1.0,2631.24,108.8916,1.0,2.86519,0.00092,5e-06
325,325.0,תחנות כח רמת חובב שותפות מוגבלת,540285947,ח.פ.,קיקר רמת חובב 30.06.40,10047344,טיקר,מניה,ישראל,ישראל,אנרגיה,אחר,2040-06-30,לא,2020-12-02,ILS,מומחה בלתי תלוי,אי-תלות,2025-09-30,0.0,1.0,2222.44,372.846983,1.0,8.28629,0.002661,1.4e-05
325,325.0,CITI Bank,549300U8H3KN0K301B23,LEI,FXVOpt 145.0000 PUT USD-JPY 20.10.25,100120170,פנימי,"מט""ח",ישראל,ישראל,אחר,"מט""ח",2025-10-20,לא,2025-09-18,USD,אחר,אי-תלות,2025-09-30,145.0,1.0,-61808.2,0.2748,3.306,-0.56168,-0.00018,0.0
325,325.0,"סולאיר אנרגיות מתחדשות בע""מ",516046307,ח.פ.,אפ לס סולאיר סדרה א 25.12.2025,11722872,פנימי,מניה,ישראל,ישראל,אנרגיה מתחדשת,מניות לרבות מדדי מניות,2025-12-25,לא,2024-04-30,ILS,אחר,אי-תלות,2025-09-30,38.52,0.01,166.23,788.722208,1.0,1.31106,0.000421,2e-06
325,325.0,"סולאיר אנרגיות מתחדשות בע""מ",516046307,ח.פ.,אפ לס סולאיר סדרה ב 25.12.2027,11722873,פנימי,מניה,ישראל,ישראל,אנרגיה מתחדשת,מניות לרבות מדדי מניות,2027-12-25,לא,2024-04-30,ILS,אחר,אי-תלות,2025-09-30,45.63,0.01,166.23,1109.37802,1.0,1.84408,0.000592,3e-06
325,325.0,"כלל החזקות עסקי ביטוח בע""מ",520036120,ח.פ.,CALL001 כלל 15.07.26,IL0002240146,ISIN,מניה,"חו""ל",ישראל,אשראי חוץ בנקאי,מניות לרבות מדדי מניות,2026-07-14,לא,2025-07-15,ILS,אחר,אי-תלות,2025-09-30,8629.0,1.0,473.85,16970.0,1.0,80.41284,0.025826,0.000141
325,325.0,בזק,520031931,ח.פ.,CALL001 בזק 26/05/2026,IL0002300114,ISIN,מניה,"חו""ל",ישראל,אשראי חוץ בנקאי,מניות לרבות מדדי מניות,2026-05-26,לא,2025-05-27,ILS,אחר,אי-תלות,2025-09-30,551.6,1.0,17479.39,634.7,1.0,110.94171,0.035631,0.000194
325,325.0,"בנק הפועלים בע""מ",520000118,ח.פ.,פועלים 03.07.2026 CALL001,IL0006625771,ISIN,מניה,"חו""ל",ישראל,בנקים,מניות לרבות מדדי מניות,2026-07-03,לא,2025-07-03,ILS,אחר,אי-תלות,2025-09-30,6300.0,1.0,1968.61,6732.0,1.0,132.52671,0.042564,0.000232
325,325.0,"בנק הפועלים בע""מ",520000118,ח.פ.,26.11.25 עסקת CALL פועלים,IL0006625771,ISIN,מניה,"חו""ל",ישראל,בנקים,מניות לרבות מדדי מניות,2025-11-26,לא,2024-11-30,ILS,אחר,אי-תלות,2025-09-30,4272.0,1.0,3115.1,6732.0,1.0,209.70861,0.067353,0.000368
325,325.0,"מימון ישיר מקבוצת ישיר(2006) בע""מ",513893123,ח.פ.,מימון ישיר 21.09.2026 CALL001,IL0001168186,ISIN,מניה,"חו""ל",ישראל,אשראי חוץ בנקאי,מניות לרבות מדדי מניות,2026-09-21,לא,2025-09-21,ILS,אחר,אי-תלות,2025-09-30,45160.0,1.0,38.52,49390.0,1.0,19.02731,0.006111,3.3e-05
325,325.0,"מימון ישיר מקבוצת ישיר(2006) בע""מ",513893123,ח.פ.,מימון ישיר 26.03.2026 CALL001,IL0001168186,ISIN,מניה,"חו""ל",ישראל,אשראי חוץ בנקאי,מניות לרבות מדדי מניות,2026-03-26,לא,2025-03-26,ILS,אחר,אי-תלות,2025-09-30,53970.0,1.0,5.82,49390.0,1.0,2.87312,0.000922,5e-06
325,325.0,"כלל החזקות עסקי ביטוח בע""מ",520036120,ח.פ.,CALL001 כלל 17.12.25,IL0002240146,ISIN,מניה,"חו""ל",ישראל,אשראי חוץ בנקאי,מניות לרבות מדדי מניות,2025-12-17,לא,2024-12-22,ILS,אחר,אי-תלות,2025-09-30,8629.0,1.0,385.25,16970.0,1.0,65.37629,0.020997,0.000114
325,325.0,"בנק הפועלים בע""מ",520000118,ח.פ.,CALL001 פועלים 26.05.26,IL0006625771,ISIN,מניה,"חו""ל",ישראל,בנקים,מניות לרבות מדדי מניות,2026-05-26,לא,2025-05-27,ILS,אחר,אי-תלות,2025-09-30,5784.0,1.0,940.77,6732.0,1.0,63.33273,0.020341,0.000111
325,325.0,"בנק לאומי לישראל בע""מ",520018078,ח.פ.,עסקת CALL001 לאומי 12.08.2026,IL0006046119,ISIN,מניה,"חו""ל",ישראל,אשראי חוץ בנקאי,מניות לרבות מדדי מניות,2026-08-12,לא,2025-08-13,ILS,אחר,אי-תלות,2025-09-30,6157.0,1.0,3160.56,6529.0,1.0,206.35298,0.066275,0.000362
325,325.0,"בנק לאומי לישראל בע""מ",520018078,ח.פ.,עסקת לאומי CALL 18.09.26,IL0006046119,ISIN,מניה,"חו""ל",ישראל,אשראי חוץ בנקאי,מניות לרבות מדדי מניות,2026-09-18,לא,2025-09-18,ILS,אחר,אי-תלות,2025-09-30,6235.0,1.0,3370.9,6529.0,1.0,220.08637,0.070686,0.000386
325,325.0,"בנק הפועלים בע""מ",520000118,ח.פ.,עסקת פועלים CALL 18.09.26,IL0006625771,ISIN,מניה,"חו""ל",ישראל,בנקים,מניות לרבות מדדי מניות,2026-09-18,לא,2025-09-18,ILS,אחר,אי-תלות,2025-09-30,6415.0,1.0,3286.15,6732.0,1.0,221.22365,0.071052,0.000388
325,325.0,"בנק הפועלים בע""מ",520000118,ח.פ.,26.09.2026 עסקת CALL פועלים,IL0006625771,ISIN,מניה,"חו""ל",ישראל,בנקים,מניות לרבות מדדי מניות,2026-09-26,לא,2025-09-26,ILS,אחר,אי-תלות,2025-09-30,6172.0,1.0,2147.36,6732.0,1.0,144.56045,0.046429,0.000254
325,325.0,"בנק דיסקונט לישראל בע""מ",520007030,ח.פ.,CALL001 דיסקונט 26.5.26,IL0006912120,ISIN,מניה,"חו""ל",ישראל,אשראי חוץ בנקאי,מניות לרבות מדדי מניות,2026-05-26,לא,2025-05-27,ILS,אחר,אי-תלות,2025-09-30,2952.0,1.0,4140.2,3274.0,1.0,135.55024,0.043535,0.000238
325,325.0,"בנק הפועלים בע""מ",520000118,ח.פ.,עסקת CALL001 פועלים 12.08.2026,IL0006625771,ISIN,מניה,"חו""ל",ישראל,בנקים,מניות לרבות מדדי מניות,2026-08-12,לא,2025-08-13,ILS,אחר,אי-תלות,2025-09-30,6389.0,1.0,3274.59,6732.0,1.0,220.44561,0.070802,0.000387
325,325.0,"בנק לאומי לישראל בע""מ",520018078,ח.פ.,26.11.25 עסקת CALL לאומי,IL0006046119,ISIN,מניה,"חו""ל",ישראל,אשראי חוץ בנקאי,מניות לרבות מדדי מניות,2025-11-26,לא,2024-12-31,ILS,אחר,אי-תלות,2025-09-30,4259.0,1.0,4884.92,6529.0,1.0,318.93659,0.102435,0.00056
325,325.0,"ישראכרט בע""מ",510706153,ח.פ.,ישראכרט 07.05.2026 CALL001,IL0011574030,ISIN,מניה,"חו""ל",ישראל,אשראי חוץ בנקאי,מניות לרבות מדדי מניות,2026-05-07,לא,2025-05-07,ILS,אחר,אי-תלות,2025-09-30,1699.0,1.0,880.23,1338.0,1.0,11.77742,0.003782,2e-05
325,325.0,בזק,520031931,ח.פ.,עסקת CALL בזק 29.01.26,IL0002300114,ISIN,מניה,"חו""ל",ישראל,אשראי חוץ בנקאי,מניות לרבות מדדי מניות,2026-01-29,לא,2025-01-30,ILS,אחר,אי-תלות,2025-09-30,1357.5756,1.0,24270.51,634.7,1.0,154.04495,0.049475,0.00027
325,325.0,"בנק הפועלים בע""מ",520000118,ח.פ.,CALL001 פועלים 23.07.26,IL0006625771,ISIN,מניה,"חו""ל",ישראל,בנקים,מניות לרבות מדדי מניות,2026-07-23,לא,2025-07-24,ILS,אחר,אי-תלות,2025-09-30,6465.76,1.0,1540.99,6732.0,1.0,103.73911,0.033318,0.000182
325,325.0,"בנק לאומי לישראל בע""מ",520018078,ח.פ.,26.09.26 עסקת CALL לאומי,IL0006046119,ISIN,מניה,"חו""ל",ישראל,אשראי חוץ בנקאי,מניות לרבות מדדי מניות,2026-09-26,לא,2025-09-26,ILS,אחר,אי-תלות,2025-09-30,5965.0,1.0,3968.41,6529.0,1.0,259.09764,0.083216,0.000455
325,325.0,Odysight.ai Inc,549300FBP1ANSJE5TE25,LEI,אפ לס ODYS US 31/03/2026,620080901,פנימי,מניה,"חו""ל","ארה""ב","Electronic Equipment, Instruments & Components",מניות לרבות מדדי מניות,2026-03-31,לא,2022-03-18,USD,אחר,אי-תלות,2025-09-30,5.5,1.0,444.7,0.0,3.306,0.0,0.0,0.0
325,325.0,נאוויטס פטרוליום שותפות מוגבלת,550263107,ח.פ.,קיקר נאוויטס פטרוליום שותפות מוגבל,10048041,פנימי,מניה,"חו""ל","ארה""ב","Oil, Gas & Consumable Fuels",אחר,2027-04-01,לא,2022-11-24,USD,מומחה בלתי תלוי,אי-תלות,2025-09-30,0.0,1.0,6032.35,107.832586,3.306,21.50499,0.006906,3.7e-05
325,325.0,יבולי שמש,515689198,ח.פ.,יבולי שמש אופציה,34140,פנימי,מניה,"חו""ל",רומניה,אנרגיה מתחדשת,תשתיות,2025-12-31,לא,2024-08-20,EUR,מומחה בלתי תלוי,אי-תלות,2025-09-30,0.0,1.0,0.0,148000000.0,3.8807,28.28404,0.009084,4.9e-05
325,325.0,Odysight.ai Inc,549300FBP1ANSJE5TE25,LEI,אפ לס ODYS US 31/03/2026,620080903,פנימי,מניה,"חו""ל","ארה""ב","Electronic Equipment, Instruments & Components",מניות לרבות מדדי מניות,2026-03-31,לא,2023-03-27,USD,אחר,אי-תלות,2025-09-30,1.15,1.0,616.39,0.608,3.306,0.01239,3e-06,0.0
347,347.0,"קבוצת אקרו בע""מ",511996803,ח.פ.,אפ לס אקרו 05.08.2026,IL0011849028,ISIN,מניה,ישראל,ישראל,בנייה,מניות לרבות מדדי מניות,2026-08-05,לא,2025-04-07,ILS,אחר,אי-תלות,2025-09-30,70.0,0.01,145.02,123.307002,1.0,0.17881,1.4e-05,0.0
347,347.0,"אנלייט אנרגיה מתחדשת בע""מ",520041146,ח.פ.,CALL001 אנלייט 17.12.2025,IL0007200111,ISIN,מניה,ישראל,ישראל,אנרגיה מתחדשת,מניות לרבות מדדי מניות,2025-12-17,לא,2024-12-18,ILS,אחר,אי-תלות,2025-09-30,5869.0,1.0,3115.08,10190.0,1.0,317.42674,0.026018,0.00016
347,347.0,"טופ גאם תעשיות בע""מ",513561399,ח.פ.,אפ לס טופ גאם 31.01.2027,IL0011791428,ISIN,מניה,ישראל,ישראל,פודטק,מניות לרבות מדדי מניות,2027-01-31,לא,2025-07-31,ILS,אחר,אי-תלות,2025-09-30,1025.0,0.01,4390.26,125.559153,1.0,5.51237,0.000451,2e-06
347,347.0,"אנלייט אנרגיה מתחדשת בע""מ",520041146,ח.פ.,CALL001 אנלייט 17.12.2025,IL0007200111,ISIN,מניה,ישראל,ישראל,אנרגיה מתחדשת,מניות לרבות מדדי מניות,2025-12-17,לא,2024-12-31,ILS,אחר,אי-תלות,2025-09-30,5869.0,1.0,9532.2,10190.0,1.0,971.33118,0.079616,0.000491
347,347.0,"רוטשטיין נדל""ן בע""מ",520039959,ח.פ.,אפ לס בכספת-רוטשטין 26.07.2026,IL0005390153,ISIN,מניה,ישראל,ישראל,בנייה,מניות לרבות מדדי מניות,2026-07-26,לא,2025-01-28,ILS,אחר,אי-תלות,2025-09-30,73.0,0.01,1152.28,2363.490861,1.0,27.23391,0.002231,1.3e-05
347,347.0,"אחים דוניץ בע""מ",520038605,ח.פ.,אפ לס דוניץ 31.12.25,IL0004000100,ISIN,מניה,ישראל,ישראל,בנייה,מניות לרבות מדדי מניות,2025-12-31,לא,2025-01-24,ILS,אחר,אי-תלות,2025-09-30,272.5,0.01,235.51,1076.583553,1.0,2.53537,0.000207,1e-06
347,347.0,"אשדוד אנרגיה בע""מ",513846667,ח.פ.,אשדוד  ורמת נגב אנרגיה-קיקר 31.12.34,1004533,טיקר,מניה,ישראל,ישראל,אנרגיה,אחר,2034-12-31,לא,2019-03-06,ILS,מומחה בלתי תלוי,אי-תלות,2025-09-30,0.0,1.0,38749.13,108.8916,1.0,42.19454,0.003457,2e-05
347,347.0,"אשדוד התפלה בע""מ",514357060,ח.פ.,אשדוד התפלה קיקר,84666750,טיקר,מניה,ישראל,ישראל,תשתיות,אחר,2038-09-08,לא,2022-08-22,ILS,מומחה בלתי תלוי,אי-תלות,2025-09-30,0.0,1.0,69014.68,110.369898,1.0,76.17143,0.006243,3.8e-05
347,347.0,"איי.פי.סי. ירושלים בע""מ",513731554,ח.פ.,איי.פי.סי-קיקר 03.09.29,10046044,טיקר,מניה,ישראל,ישראל,מלונאות ותיירות,אחר,2029-09-03,לא,2019-09-03,USD,מומחה בלתי תלוי,אי-תלות,2025-09-30,0.0,1.0,1638.15,239.875582,3.306,12.99102,0.001063,6e-06
347,347.0,תחנות כח רמת חובב שותפות מוגבלת,540285947,ח.פ.,קיקר רמת חובב 30.06.40,10047344,טיקר,מניה,ישראל,ישראל,אנרגיה,אחר,2040-06-30,לא,2020-12-02,ILS,מומחה בלתי תלוי,אי-תלות,2025-09-30,0.0,1.0,32728.91,372.846983,1.0,122.02878,0.010001,6.1e-05
347,347.0,Avo,515658912,ח.פ.,אופציה תכנית 43,34026,טיקר,מניה,ישראל,"ארה""ב",השקעות בהיי-טק,אחר,2027-12-31,לא,2022-12-31,USD,מומחה בלתי תלוי,אי-תלות,2025-09-30,0.0,1.0,1712.41,2050.9348,3.306,116.10808,0.009516,5.8e-05
347,347.0,CITI Bank,549300U8H3KN0K301B23,LEI,FXVOpt 145.0000 PUT USD-JPY 20.10.25,100120170,פנימי,"מט""ח",ישראל,ישראל,אחר,"מט""ח",2025-10-20,לא,2025-09-18,USD,אחר,אי-תלות,2025-09-30,145.0,1.0,-444285.34,0.2748,3.306,-4.03746,-0.000329,-1e-06
347,347.0,"קינג סטור בע""מ",514340884,ח.פ.,אופציה רכיב המרה הלואה קינג סטור,10043141,פנימי,מניה,ישראל,ישראל,רשתות שיווק,אחר,2025-12-31,לא,2019-01-01,ILS,מומחה בלתי תלוי,אי-תלות,2025-09-30,0.0,1.0,304433.11,78.61,1.0,239.31487,0.019615,0.000121
347,347.0,PowerGen,10128,פנימי,PowerGen Option,34100,פנימי,מניה,ישראל,ישראל,תשתיות,תשתיות,2027-01-24,לא,2024-03-18,ILS,מומחה בלתי תלוי,אי-תלות,2025-09-30,0.0,1.0,1.25,100.0,1.0,0.00125,0.0,0.0
347,347.0,"סולאיר אנרגיות מתחדשות בע""מ",516046307,ח.פ.,אפ לס סולאיר סדרה א 25.12.2025,11722872,פנימי,מניה,ישראל,ישראל,אנרגיה מתחדשת,מניות לרבות מדדי מניות,2025-12-25,לא,2024-04-30,ILS,אחר,אי-תלות,2025-09-30,38.52,0.01,604.84,788.722208,1.0,4.77056,0.00039,2e-06
347,347.0,"סולאיר אנרגיות מתחדשות בע""מ",516046307,ח.פ.,אפ לס סולאיר סדרה ב 25.12.2027,11722873,פנימי,מניה,ישראל,ישראל,אנרגיה מתחדשת,מניות לרבות מדדי מניות,2027-12-25,לא,2024-04-30,ILS,אחר,אי-תלות,2025-09-30,45.63,0.01,604.84,1109.37802,1.0,6.71003,0.000549,3e-06
347,347.0,"מאיר חברה למכוניות ומשאיות בע""מ",510485261,ח.פ.,קבוצת מאיר-אופציה לא סחירה,340271,פנימי,מניה,ישראל,ישראל,השקעה ואחזקות,אחר,2026-06-30,לא,2023-12-31,ILS,מומחה בלתי תלוי,אי-תלות,2025-09-30,0.0,1.0,254.06,8069.8607,1.0,20.50228,0.00168,1e-05
347,347.0,CITI Bank,549300U8H3KN0K301B23,LEI,FXVOpt 3.6800 CALL USD-PLN 30.10.25,100120432,פנימי,"מט""ח",ישראל,ישראל,אחר,"מט""ח",2025-10-30,לא,2025-09-29,USD,אחר,אי-תלות,2025-09-30,3.68,1.0,-200063.87,0.5646,3.306,-3.73479,-0.000305,-1e-06
347,347.0,"מימון ישיר מקבוצת ישיר(2006) בע""מ",513893123,ח.פ.,מימון ישיר 21.09.2026 CALL001,IL0001168186,ISIN,מניה,"חו""ל",ישראל,אשראי חוץ בנקאי,מניות לרבות מדדי מניות,2026-09-21,לא,2025-09-21,ILS,אחר,אי-תלות,2025-09-30,45160.0,1.0,140.18,49390.0,1.0,69.23461,0.005674,3.4e-05
347,347.0,"ישראכרט בע""מ",510706153,ח.פ.,ישראכרט 07.05.2026 CALL001,IL0011574030,ISIN,מניה,"חו""ל",ישראל,אשראי חוץ בנקאי,מניות לרבות מדדי מניות,2026-05-07,לא,2025-05-07,ILS,אחר,אי-תלות,2025-09-30,1699.0,1.0,3202.88,1338.0,1.0,42.85447,0.003511,2.1e-05
347,347.0,"בנק הפועלים בע""מ",520000118,ח.פ.,CALL001 פועלים 23.07.26,IL0006625771,ISIN,מניה,"חו""ל",ישראל,בנקים,מניות לרבות מדדי מניות,2026-07-23,לא,2025-07-24,ILS,אחר,אי-תלות,2025-09-30,6465.76,1.0,5607.18,6732.0,1.0,377.47512,0.03094,0.00019
347,347.0,בזק,520031931,ח.פ.,עסקת CALL בזק 29.01.26,IL0002300114,ISIN,מניה,"חו""ל",ישראל,אשראי חוץ בנקאי,מניות לרבות מדדי מניות,2026-01-29,לא,2025-01-30,ILS,אחר,אי-תלות,2025-09-30,1357.5756,1.0,88313.03,634.7,1.0,560.5228,0.045943,0.000283
347,347.0,"בנק דיסקונט לישראל בע""מ",520007030,ח.פ.,CALL001 דיסקונט 26.5.26,IL0006912120,ISIN,מניה,"חו""ל",ישראל,אשראי חוץ בנקאי,מניות לרבות מדדי מניות,2026-05-26,לא,2025-05-27,ILS,אחר,אי-תלות,2025-09-30,2952.0,1.0,15064.95,3274.0,1.0,493.22618,0.040427,0.000249
347,347.0,"בנק הפועלים בע""מ",520000118,ח.פ.,26.09.2026 עסקת CALL פועלים,IL0006625771,ISIN,מניה,"חו""ל",ישראל,בנקים,מניות לרבות מדדי מניות,2026-09-26,לא,2025-09-26,ILS,אחר,אי-תלות,2025-09-30,6172.0,1.0,7813.6,6732.0,1.0,526.01158,0.043115,0.000265
347,347.0,"כלל החזקות עסקי ביטוח בע""מ",520036120,ח.פ.,CALL001 כלל 15.07.26,IL0002240146,ISIN,מניה,"חו""ל",ישראל,אשראי חוץ בנקאי,מניות לרבות מדדי מניות,2026-07-14,לא,2025-07-15,ILS,אחר,אי-תלות,2025-09-30,8629.0,1.0,1724.2,16970.0,1.0,292.59789,0.023983,0.000147
347,347.0,"בנק הפועלים בע""מ",520000118,ח.פ.,עסקת פועלים CALL 18.09.26,IL0006625771,ISIN,מניה,"חו""ל",ישראל,בנקים,מניות לרבות מדדי מניות,2026-09-18,לא,2025-09-18,ILS,אחר,אי-תלות,2025-09-30,6415.0,1.0,11957.31,6732.0,1.0,804.9657,0.06598,0.000407
347,347.0,"בנק הפועלים בע""מ",520000118,ח.פ.,CALL001 פועלים 26.05.26,IL0006625771,ISIN,מניה,"חו""ל",ישראל,בנקים,מניות לרבות מדדי מניות,2026-05-26,לא,2025-05-27,ILS,אחר,אי-תלות,2025-09-30,5784.0,1.0,3423.18,6732.0,1.0,230.44856,0.018889,0.000115
347,347.0,"בנק לאומי לישראל בע""מ",520018078,ח.פ.,עסקת CALL001 לאומי 12.08.2026,IL0006046119,ISIN,מניה,"חו""ל",ישראל,אשראי חוץ בנקאי,מניות לרבות מדדי מניות,2026-08-12,לא,2025-08-13,ILS,אחר,אי-תלות,2025-09-30,6157.0,1.0,11500.32,6529.0,1.0,750.85582,0.061544,0.000379
347,347.0,בזק,520031931,ח.פ.,CALL001 בזק 26/05/2026,IL0002300114,ISIN,מניה,"חו""ל",ישראל,אשראי חוץ בנקאי,מניות לרבות מדדי מניות,2026-05-26,לא,2025-05-27,ILS,אחר,אי-תלות,2025-09-30,551.6,1.0,63602.2,634.7,1.0,403.68318,0.033087,0.000204
347,347.0,"בנק לאומי לישראל בע""מ",520018078,ח.פ.,עסקת לאומי CALL 18.09.26,IL0006046119,ISIN,מניה,"חו""ל",ישראל,אשראי חוץ בנקאי,מניות לרבות מדדי מניות,2026-09-18,לא,2025-09-18,ILS,אחר,אי-תלות,2025-09-30,6235.0,1.0,12265.69,6529.0,1.0,800.82746,0.06564,0.000405
347,347.0,"בנק הפועלים בע""מ",520000118,ח.פ.,פועלים 03.07.2026 CALL001,IL0006625771,ISIN,מניה,"חו""ל",ישראל,בנקים,מניות לרבות מדדי מניות,2026-07-03,לא,2025-07-03,ILS,אחר,אי-תלות,2025-09-30,6300.0,1.0,7163.16,6732.0,1.0,482.22447,0.039526,0.000243
347,347.0,"מימון ישיר מקבוצת ישיר(2006) בע""מ",513893123,ח.פ.,מימון ישיר 26.03.2026 CALL001,IL0001168186,ISIN,מניה,"חו""ל",ישראל,אשראי חוץ בנקאי,מניות לרבות מדדי מניות,2026-03-26,לא,2025-03-26,ILS,אחר,אי-תלות,2025-09-30,53970.0,1.0,21.17,49390.0,1.0,10.45443,0.000856,4e-06
347,347.0,"בנק לאומי לישראל בע""מ",520018078,ח.פ.,26.11.25 עסקת CALL לאומי,IL0006046119,ISIN,מניה,"חו""ל",ישראל,אשראי חוץ בנקאי,מניות לרבות מדדי מניות,2025-11-26,לא,2024-12-31,ILS,אחר,אי-תלות,2025-09-30,4259.0,1.0,17774.75,6529.0,1.0,1160.51338,0.095122,0.000587
347,347.0,"בנק הפועלים בע""מ",520000118,ח.פ.,עסקת CALL001 פועלים 12.08.2026,IL0006625771,ISIN,מניה,"חו""ל",ישראל,בנקים,מניות לרבות מדדי מניות,2026-08-12,לא,2025-08-13,ILS,אחר,אי-תלות,2025-09-30,6389.0,1.0,11915.25,6732.0,1.0,802.13463,0.065747,0.000405
347,347.0,"בנק הפועלים בע""מ",520000118,ח.פ.,26.11.25 עסקת CALL פועלים,IL0006625771,ISIN,מניה,"חו""ל",ישראל,בנקים,מניות לרבות מדדי מניות,2025-11-26,לא,2024-11-30,ILS,אחר,אי-תלות,2025-09-30,4272.0,1.0,11334.91,6732.0,1.0,763.06595,0.062545,0.000386
347,347.0,"בנק לאומי לישראל בע""מ",520018078,ח.פ.,26.09.26 עסקת CALL לאומי,IL0006046119,ISIN,מניה,"חו""ל",ישראל,אשראי חוץ בנקאי,מניות לרבות מדדי מניות,2026-09-26,לא,2025-09-26,ILS,אחר,אי-תלות,2025-09-30,5965.0,1.0,14439.85,6529.0,1.0,942.77764,0.077275,0.000476
347,347.0,"כלל החזקות עסקי ביטוח בע""מ",520036120,ח.פ.,CALL001 כלל 17.12.25,IL0002240146,ISIN,מניה,"חו""ל",ישראל,אשראי חוץ בנקאי,מניות לרבות מדדי מניות,2025-12-17,לא,2024-12-22,ILS,אחר,אי-תלות,2025-09-30,8629.0,1.0,1401.79,16970.0,1.0,237.88446,0.019498,0.00012
347,347.0,Odysight.ai Inc,549300FBP1ANSJE5TE25,LEI,אפ לס ODYS US 31/03/2026,620080901,פנימי,מניה,"חו""ל","ארה""ב","Electronic Equipment, Instruments & Components",מניות לרבות מדדי מניות,2026-03-31,לא,2022-03-18,USD,אחר,אי-תלות,2025-09-30,5.5,1.0,1618.13,0.0,3.306,0.0,0.0,0.0
347,347.0,ECO SUN ORADEA S.R.L,7659,פנימי,אקואנרגי רומניה 7.25% אירו 31.03.24-אופ ל.ס אורדאה,340292,פנימי,מניה,"חו""ל",רומניה,אנרגיה מתחדשת,תשתיות,2025-12-31,לא,2023-12-31,EUR,מומחה בלתי תלוי,אי-תלות,2025-09-30,0.0,1.0,6933.12,54.089135,3.8807,14.55287,0.001192,7e-06
347,347.0,יבולי שמש,515689198,ח.פ.,יבולי שמש אופציה,34140,פנימי,מניה,"חו""ל",רומניה,אנרגיה מתחדשת,תשתיות,2025-12-31,לא,2024-08-20,EUR,מומחה בלתי תלוי,אי-תלות,2025-09-30,0.0,1.0,0.08,148000000.0,3.8807,416.52756,0.03414,0.00021
347,347.0,Odysight.ai Inc,549300FBP1ANSJE5TE25,LEI,אפ לס ODYS US 31/03/2026,620080903,פנימי,מניה,"חו""ל","ארה""ב","Electronic Equipment, Instruments & Components",מניות לרבות מדדי מניות,2026-03-31,לא,2023-03-27,USD,אחר,אי-תלות,2025-09-30,1.15,1.0,2242.87,0.608,3.306,0.04508,3e-06,0.0
347,347.0,ECO SUN ORADEA S.R.L,7659,פנימי,Ecoenergy Romania option Scurtu Mare,34137,פנימי,מניה,"חו""ל",רומניה,אנרגיה מתחדשת,תשתיות,2025-12-31,לא,2024-08-20,EUR,מומחה בלתי תלוי,אי-תלות,2025-09-30,0.0,1.0,0.05,2807000.0,3.8807,5.44656,0.000446,2e-06
347,347.0,ECO SUN ORADEA S.R.L,7659,פנימי,Ecoenergy Romania Bobisecti,34138,פנימי,מניה,"חו""ל",רומניה,אנרגיה מתחדשת,תשתיות,2025-12-31,לא,2024-08-20,EUR,מומחה בלתי תלוי,אי-תלות,2025-09-30,0.0,1.0,0.05,1700000.0,3.8807,3.29859,0.00027,1e-06
347,347.0,ECO SUN ORADEA S.R.L,7659,פנימי,Ecoenergy Romania option  Melinesti,34139,פנימי,מניה,"חו""ל",רומניה,אנרגיה מתחדשת,תשתיות,2025-12-31,לא,2024-08-20,EUR,מומחה בלתי תלוי,אי-תלות,2025-09-30,0.0,1.0,0.05,2646000.0,3.8807,5.13416,0.00042,2e-06
347,347.0,נאוויטס פטרוליום שותפות מוגבלת,550263107,ח.פ.,קיקר נאוויטס פטרוליום שותפות מוגבל,10048041,פנימי,מניה,"חו""ל","ארה""ב","Oil, Gas & Consumable Fuels",אחר,2027-04-01,לא,2022-11-24,USD,מומחה בלתי תלוי,אי-תלות,2025-09-30,0.0,1.0,12926.48,107.832586,3.306,46.08219,0.003776,2.3e-05
389,389.0,"אנלייט אנרגיה מתחדשת בע""מ",520041146,ח.פ.,CALL001 אנלייט 17.12.2025,IL0007200111,ISIN,מניה,ישראל,ישראל,אנרגיה מתחדשת,מניות לרבות מדדי מניות,2025-12-17,לא,2024-12-31,ILS,אחר,אי-תלות,2025-09-30,5869.0,1.0,3546.24,10190.0,1.0,361.36185,0.08501,0.000461
389,389.0,"אנלייט אנרגיה מתחדשת בע""מ",520041146,ח.פ.,CALL001 אנלייט 17.12.2025,IL0007200111,ISIN,מניה,ישראל,ישראל,אנרגיה מתחדשת,מניות לרבות מדדי מניות,2025-12-17,לא,2024-12-18,ILS,אחר,אי-תלות,2025-09-30,5869.0,1.0,1158.9,10190.0,1.0,118.09146,0.027781,0.00015
389,389.0,"טופ גאם תעשיות בע""מ",513561399,ח.פ.,אפ לס טופ גאם 31.01.2027,IL0011791428,ISIN,מניה,ישראל,ישראל,פודטק,מניות לרבות מדדי מניות,2027-01-31,לא,2025-07-31,ILS,אחר,אי-תלות,2025-09-30,1025.0,0.01,1633.3,125.559153,1.0,2.05076,0.000482,2e-06
389,389.0,"אחים דוניץ בע""מ",520038605,ח.פ.,אפ לס דוניץ 31.12.25,IL0004000100,ISIN,מניה,ישראל,ישראל,בנייה,מניות לרבות מדדי מניות,2025-12-31,לא,2025-01-24,ILS,אחר,אי-תלות,2025-09-30,272.5,0.01,87.61,1076.583553,1.0,0.94323,0.000221,1e-06
389,389.0,"קבוצת אקרו בע""מ",511996803,ח.פ.,אפ לס אקרו 05.08.2026,IL0011849028,ISIN,מניה,ישראל,ישראל,בנייה,מניות לרבות מדדי מניות,2026-08-05,לא,2025-04-07,ILS,אחר,אי-תלות,2025-09-30,70.0,0.01,53.95,123.307002,1.0,0.06653,1.5e-05,0.0
389,389.0,"רוטשטיין נדל""ן בע""מ",520039959,ח.פ.,אפ לס בכספת-רוטשטין 26.07.2026,IL0005390153,ISIN,מניה,ישראל,ישראל,בנייה,מניות לרבות מדדי מניות,2026-07-26,לא,2025-01-28,ILS,אחר,אי-תלות,2025-09-30,73.0,0.01,428.68,2363.490861,1.0,10.13176,0.002383,1.2e-05
389,389.0,"איי.פי.סי. ירושלים בע""מ",513731554,ח.פ.,איי.פי.סי-קיקר 03.09.29,10046044,טיקר,מניה,ישראל,ישראל,מלונאות ותיירות,אחר,2029-09-03,לא,2019-09-03,USD,מומחה בלתי תלוי,אי-תלות,2025-09-30,0.0,1.0,215.18,239.875582,3.306,1.70645,0.000401,2e-06
389,389.0,"אשדוד התפלה בע""מ",514357060,ח.פ.,אשדוד התפלה קיקר,84666750,טיקר,מניה,ישראל,ישראל,תשתיות,אחר,2038-09-08,לא,2022-08-22,ILS,מומחה בלתי תלוי,אי-תלות,2025-09-30,0.0,1.0,9065.5,110.369898,1.0,10.00558,0.002353,1.2e-05
389,389.0,תחנות כח רמת חובב שותפות מוגבלת,540285947,ח.פ.,קיקר רמת חובב 30.06.40,10047344,טיקר,מניה,ישראל,ישראל,אנרגיה,אחר,2040-06-30,לא,2020-12-02,ILS,מומחה בלתי תלוי,אי-תלות,2025-09-30,0.0,1.0,4299.14,372.846983,1.0,16.02922,0.00377,2e-05
389,389.0,"אשדוד אנרגיה בע""מ",513846667,ח.פ.,אשדוד  ורמת נגב אנרגיה-קיקר 31.12.34,1004533,טיקר,מניה,ישראל,ישראל,אנרגיה,אחר,2034-12-31,לא,2019-03-06,ILS,מומחה בלתי תלוי,אי-תלות,2025-09-30,0.0,1.0,5089.93,108.8916,1.0,5.54251,0.001303,7e-06
389,389.0,CITI Bank,549300U8H3KN0K301B23,LEI,FXVOpt 3.6800 CALL USD-PLN 30.10.25,100120432,פנימי,"מט""ח",ישראל,ישראל,אחר,"מט""ח",2025-10-30,לא,2025-09-29,USD,אחר,אי-תלות,2025-09-30,3.68,1.0,-7066.93,0.5646,3.306,-0.13193,-3.1e-05,0.0
389,389.0,CITI Bank,549300U8H3KN0K301B23,LEI,FXVOpt 145.0000 PUT USD-JPY 20.10.25,100120170,פנימי,"מט""ח",ישראל,ישראל,אחר,"מט""ח",2025-10-20,לא,2025-09-18,USD,אחר,אי-תלות,2025-09-30,145.0,1.0,-91871.54,0.2748,3.306,-0.83489,-0.000196,0.0
389,389.0,"סולאיר אנרגיות מתחדשות בע""מ",516046307,ח.פ.,אפ לס סולאיר סדרה א 25.12.2025,11722872,פנימי,מניה,ישראל,ישראל,אנרגיה מתחדשת,מניות לרבות מדדי מניות,2025-12-25,לא,2024-04-30,ILS,אחר,אי-תלות,2025-09-30,38.52,0.01,225.02,788.722208,1.0,1.77478,0.000417,2e-06
389,389.0,"סולאיר אנרגיות מתחדשות בע""מ",516046307,ח.פ.,אפ לס סולאיר סדרה ב 25.12.2027,11722873,פנימי,מניה,ישראל,ישראל,אנרגיה מתחדשת,מניות לרבות מדדי מניות,2027-12-25,לא,2024-04-30,ILS,אחר,אי-תלות,2025-09-30,45.63,0.01,225.02,1109.37802,1.0,2.49632,0.000587,3e-06
389,389.0,"ישראכרט בע""מ",510706153,ח.פ.,ישראכרט 07.05.2026 CALL001,IL0011574030,ISIN,מניה,"חו""ל",ישראל,אשראי חוץ בנקאי,מניות לרבות מדדי מניות,2026-05-07,לא,2025-05-07,ILS,אחר,אי-תלות,2025-09-30,1699.0,1.0,1191.56,1338.0,1.0,15.94304,0.00375,2e-05
389,389.0,"בנק לאומי לישראל בע""מ",520018078,ח.פ.,26.11.25 עסקת CALL לאומי,IL0006046119,ISIN,מניה,"חו""ל",ישראל,אשראי חוץ בנקאי,מניות לרבות מדדי מניות,2025-11-26,לא,2024-12-31,ILS,אחר,אי-תלות,2025-09-30,4259.0,1.0,6612.69,6529.0,1.0,431.74283,0.101567,0.000551
389,389.0,"מימון ישיר מקבוצת ישיר(2006) בע""מ",513893123,ח.פ.,מימון ישיר 26.03.2026 CALL001,IL0001168186,ISIN,מניה,"חו""ל",ישראל,אשראי חוץ בנקאי,מניות לרבות מדדי מניות,2026-03-26,לא,2025-03-26,ILS,אחר,אי-תלות,2025-09-30,53970.0,1.0,7.87,49390.0,1.0,3.88933,0.000914,4e-06
389,389.0,"בנק הפועלים בע""מ",520000118,ח.פ.,עסקת CALL001 פועלים 12.08.2026,IL0006625771,ISIN,מניה,"חו""ל",ישראל,בנקים,מניות לרבות מדדי מניות,2026-08-12,לא,2025-08-13,ILS,אחר,אי-תלות,2025-09-30,6389.0,1.0,4432.8,6732.0,1.0,298.41609,0.070202,0.000381
389,389.0,בזק,520031931,ח.פ.,עסקת CALL בזק 29.01.26,IL0002300114,ISIN,מניה,"חו""ל",ישראל,אשראי חוץ בנקאי,מניות לרבות מדדי מניות,2026-01-29,לא,2025-01-30,ILS,אחר,אי-תלות,2025-09-30,1357.5756,1.0,32854.87,634.7,1.0,208.52986,0.049056,0.000266
389,389.0,"בנק הפועלים בע""מ",520000118,ח.פ.,פועלים 03.07.2026 CALL001,IL0006625771,ISIN,מניה,"חו""ל",ישראל,בנקים,מניות לרבות מדדי מניות,2026-07-03,לא,2025-07-03,ILS,אחר,אי-תלות,2025-09-30,6300.0,1.0,2664.9,6732.0,1.0,179.40073,0.042203,0.000229
389,389.0,"בנק דיסקונט לישראל בע""מ",520007030,ח.פ.,CALL001 דיסקונט 26.5.26,IL0006912120,ISIN,מניה,"חו""ל",ישראל,אשראי חוץ בנקאי,מניות לרבות מדדי מניות,2026-05-26,לא,2025-05-27,ILS,אחר,אי-תלות,2025-09-30,2952.0,1.0,5604.57,3274.0,1.0,183.49367,0.043166,0.000234
389,389.0,"בנק הפועלים בע""מ",520000118,ח.פ.,עסקת פועלים CALL 18.09.26,IL0006625771,ISIN,מניה,"חו""ל",ישראל,בנקים,מניות לרבות מדדי מניות,2026-09-18,לא,2025-09-18,ILS,אחר,אי-תלות,2025-09-30,6415.0,1.0,4448.45,6732.0,1.0,299.46933,0.07045,0.000382
389,389.0,"בנק הפועלים בע""מ",520000118,ח.פ.,CALL001 פועלים 26.05.26,IL0006625771,ISIN,מניה,"חו""ל",ישראל,בנקים,מניות לרבות מדדי מניות,2026-05-26,לא,2025-05-27,ILS,אחר,אי-תלות,2025-09-30,5784.0,1.0,1273.52,6732.0,1.0,85.73319,0.020168,0.000109
389,389.0,"בנק הפועלים בע""מ",520000118,ח.פ.,CALL001 פועלים 23.07.26,IL0006625771,ISIN,מניה,"חו""ל",ישראל,בנקים,מניות לרבות מדדי מניות,2026-07-23,לא,2025-07-24,ILS,אחר,אי-תלות,2025-09-30,6465.76,1.0,2086.02,6732.0,1.0,140.4311,0.033036,0.000179
389,389.0,"בנק הפועלים בע""מ",520000118,ח.פ.,26.09.2026 עסקת CALL פועלים,IL0006625771,ISIN,מניה,"חו""ל",ישראל,בנקים,מניות לרבות מדדי מניות,2026-09-26,לא,2025-09-26,ILS,אחר,אי-תלות,2025-09-30,6172.0,1.0,2906.87,6732.0,1.0,195.69074,0.046036,0.000249
389,389.0,"בנק הפועלים בע""מ",520000118,ח.פ.,26.11.25 עסקת CALL פועלים,IL0006625771,ISIN,מניה,"חו""ל",ישראל,בנקים,מניות לרבות מדדי מניות,2025-11-26,לא,2024-11-30,ILS,אחר,אי-תלות,2025-09-30,4272.0,1.0,4216.9,6732.0,1.0,283.88148,0.066783,0.000362
389,389.0,"כלל החזקות עסקי ביטוח בע""מ",520036120,ח.פ.,CALL001 כלל 17.12.25,IL0002240146,ISIN,מניה,"חו""ל",ישראל,אשראי חוץ בנקאי,מניות לרבות מדדי מניות,2025-12-17,לא,2024-12-22,ILS,אחר,אי-תלות,2025-09-30,8629.0,1.0,521.51,16970.0,1.0,88.49955,0.020819,0.000113
389,389.0,"מימון ישיר מקבוצת ישיר(2006) בע""מ",513893123,ח.פ.,מימון ישיר 21.09.2026 CALL001,IL0001168186,ISIN,מניה,"חו""ל",ישראל,אשראי חוץ בנקאי,מניות לרבות מדדי מניות,2026-09-21,לא,2025-09-21,ILS,אחר,אי-תלות,2025-09-30,45160.0,1.0,52.15,49390.0,1.0,25.75718,0.006059,3.2e-05
389,389.0,"בנק לאומי לישראל בע""מ",520018078,ח.פ.,26.09.26 עסקת CALL לאומי,IL0006046119,ISIN,מניה,"חו""ל",ישראל,אשראי חוץ בנקאי,מניות לרבות מדדי מניות,2026-09-26,לא,2025-09-26,ILS,אחר,אי-תלות,2025-09-30,5965.0,1.0,5372.02,6529.0,1.0,350.73916,0.082511,0.000447
389,389.0,"בנק לאומי לישראל בע""מ",520018078,ח.פ.,עסקת לאומי CALL 18.09.26,IL0006046119,ISIN,מניה,"חו""ל",ישראל,אשראי חוץ בנקאי,מניות לרבות מדדי מניות,2026-09-18,לא,2025-09-18,ILS,אחר,אי-תלות,2025-09-30,6235.0,1.0,4563.18,6529.0,1.0,297.92979,0.070087,0.00038
389,389.0,"כלל החזקות עסקי ביטוח בע""מ",520036120,ח.פ.,CALL001 כלל 15.07.26,IL0002240146,ISIN,מניה,"חו""ל",ישראל,אשראי חוץ בנקאי,מניות לרבות מדדי מניות,2026-07-14,לא,2025-07-15,ILS,אחר,אי-תלות,2025-09-30,8629.0,1.0,641.45,16970.0,1.0,108.85444,0.025607,0.000138
389,389.0,"בנק לאומי לישראל בע""מ",520018078,ח.פ.,עסקת CALL001 לאומי 12.08.2026,IL0006046119,ISIN,מניה,"חו""ל",ישראל,אשראי חוץ בנקאי,מניות לרבות מדדי מניות,2026-08-12,לא,2025-08-13,ILS,אחר,אי-תלות,2025-09-30,6157.0,1.0,4278.43,6529.0,1.0,279.33897,0.065714,0.000356
389,389.0,בזק,520031931,ח.פ.,CALL001 בזק 26/05/2026,IL0002300114,ISIN,מניה,"חו""ל",ישראל,אשראי חוץ בנקאי,מניות לרבות מדדי מניות,2026-05-26,לא,2025-05-27,ILS,אחר,אי-תלות,2025-09-30,551.6,1.0,23661.76,634.7,1.0,150.18122,0.03533,0.000191
389,389.0,Odysight.ai Inc,549300FBP1ANSJE5TE25,LEI,אפ לס ODYS US 31/03/2026,620080903,פנימי,מניה,"חו""ל","ארה""ב","Electronic Equipment, Instruments & Components",מניות לרבות מדדי מניות,2026-03-31,לא,2023-03-27,USD,אחר,אי-תלות,2025-09-30,1.15,1.0,834.41,0.608,3.306,0.01677,3e-06,0.0
389,389.0,Odysight.ai Inc,549300FBP1ANSJE5TE25,LEI,אפ לס ODYS US 31/03/2026,620080901,פנימי,מניה,"חו""ל","ארה""ב","Electronic Equipment, Instruments & Components",מניות לרבות מדדי מניות,2026-03-31,לא,2022-03-18,USD,אחר,אי-תלות,2025-09-30,5.5,1.0,601.99,0.0,3.306,0.0,0.0,0.0
389,389.0,יבולי שמש,515689198,ח.פ.,יבולי שמש אופציה,34140,פנימי,מניה,"חו""ל",רומניה,אנרגיה מתחדשת,תשתיות,2025-12-31,לא,2024-08-20,EUR,מומחה בלתי תלוי,אי-תלות,2025-09-30,0.0,1.0,0.01,148000000.0,3.8807,54.71344,0.012871,6.9e-05
389,389.0,נאוויטס פטרוליום שותפות מוגבלת,550263107,ח.פ.,קיקר נאוויטס פטרוליום שותפות מוגבל,10048041,פנימי,מניה,"חו""ל","ארה""ב","Oil, Gas & Consumable Fuels",אחר,2027-04-01,לא,2022-11-24,USD,מומחה בלתי תלוי,אי-תלות,2025-09-30,0.0,1.0,10915.69,107.832586,3.306,38.91383,0.009154,4.9e-05
671,12120.0,"רוטשטיין נדל""ן בע""מ",520039959,ח.פ.,אפ לס בכספת-רוטשטין 26.07.2026,IL0005390153,ISIN,מניה,ישראל,ישראל,בנייה,מניות לרבות מדדי מניות,2026-07-26,לא,2025-01-28,ILS,אחר,אי-תלות,2025-09-30,73.0,0.01,188.58,2363.490861,1.0,4.45706,0.002214,1.1e-05
671,12120.0,"קבוצת אקרו בע""מ",511996803,ח.פ.,אפ לס אקרו 05.08.2026,IL0011849028,ISIN,מניה,ישראל,ישראל,בנייה,מניות לרבות מדדי מניות,2026-08-05,לא,2025-04-07,ILS,אחר,אי-תלות,2025-09-30,70.0,0.01,23.73,123.307002,1.0,0.02927,1.4e-05,0.0
671,12120.0,"אנלייט אנרגיה מתחדשת בע""מ",520041146,ח.פ.,CALL001 אנלייט 17.12.2025,IL0007200111,ISIN,מניה,ישראל,ישראל,אנרגיה מתחדשת,מניות לרבות מדדי מניות,2025-12-17,לא,2024-12-31,ILS,אחר,אי-תלות,2025-09-30,5869.0,1.0,1560.02,10190.0,1.0,158.96655,0.078997,0.000423
671,12120.0,"אנלייט אנרגיה מתחדשת בע""מ",520041146,ח.פ.,CALL001 אנלייט 17.12.2025,IL0007200111,ISIN,מניה,ישראל,ישראל,אנרגיה מתחדשת,מניות לרבות מדדי מניות,2025-12-17,לא,2024-12-18,ILS,אחר,אי-תלות,2025-09-30,5869.0,1.0,509.81,10190.0,1.0,51.94957,0.025815,0.000138
671,12120.0,"טופ גאם תעשיות בע""מ",513561399,ח.פ.,אפ לס טופ גאם 31.01.2027,IL0011791428,ISIN,מניה,ישראל,ישראל,פודטק,מניות לרבות מדדי מניות,2027-01-31,לא,2025-07-31,ILS,אחר,אי-תלות,2025-09-30,1025.0,0.01,718.5,125.559153,1.0,0.90215,0.000448,2e-06
671,12120.0,"אחים דוניץ בע""מ",520038605,ח.פ.,אפ לס דוניץ 31.12.25,IL0004000100,ISIN,מניה,ישראל,ישראל,בנייה,מניות לרבות מדדי מניות,2025-12-31,לא,2025-01-24,ILS,אחר,אי-תלות,2025-09-30,272.5,0.01,38.54,1076.583553,1.0,0.41493,0.000206,1e-06
671,12120.0,"איי.פי.סי. ירושלים בע""מ",513731554,ח.פ.,איי.פי.סי-קיקר 03.09.29,10046044,טיקר,מניה,ישראל,ישראל,מלונאות ותיירות,אחר,2029-09-03,לא,2019-09-03,USD,מומחה בלתי תלוי,אי-תלות,2025-09-30,0.0,1.0,472.14,239.875582,3.306,3.74418,0.00186,9e-06
671,12120.0,תחנות כח רמת חובב שותפות מוגבלת,540285947,ח.פ.,קיקר רמת חובב 30.06.40,10047344,טיקר,מניה,ישראל,ישראל,אנרגיה,אחר,2040-06-30,לא,2020-12-02,ILS,מומחה בלתי תלוי,אי-תלות,2025-09-30,0.0,1.0,9432.89,372.846983,1.0,35.17026,0.017477,9.3e-05
671,12120.0,"אשדוד אנרגיה בע""מ",513846667,ח.פ.,אשדוד  ורמת נגב אנרגיה-קיקר 31.12.34,1004533,טיקר,מניה,ישראל,ישראל,אנרגיה,אחר,2034-12-31,לא,2019-03-06,ILS,מומחה בלתי תלוי,אי-תלות,2025-09-30,0.0,1.0,11168.0,108.8916,1.0,12.16101,0.006043,3.2e-05
671,12120.0,"אשדוד התפלה בע""מ",514357060,ח.פ.,אשדוד התפלה קיקר,84666750,טיקר,מניה,ישראל,ישראל,תשתיות,אחר,2038-09-08,לא,2022-08-22,ILS,מומחה בלתי תלוי,אי-תלות,2025-09-30,0.0,1.0,19890.92,110.369898,1.0,21.95359,0.010909,5.8e-05
671,12120.0,CITI Bank,549300U8H3KN0K301B23,LEI,FXVOpt 3.6800 CALL USD-PLN 30.10.25,100120432,פנימי,"מט""ח",ישראל,ישראל,אחר,"מט""ח",2025-10-30,לא,2025-09-29,USD,אחר,אי-תלות,2025-09-30,3.68,1.0,-36208.08,0.5646,3.306,-0.67593,-0.000335,-1e-06
671,12120.0,"סולאיר אנרגיות מתחדשות בע""מ",516046307,ח.פ.,אפ לס סולאיר סדרה א 25.12.2025,11722872,פנימי,מניה,ישראל,ישראל,אנרגיה מתחדשת,מניות לרבות מדדי מניות,2025-12-25,לא,2024-04-30,ILS,אחר,אי-תלות,2025-09-30,38.52,0.01,98.99,788.722208,1.0,0.78074,0.000387,2e-06
671,12120.0,CITI Bank,549300U8H3KN0K301B23,LEI,FXVOpt 145.0000 PUT USD-JPY 20.10.25,100120170,פנימי,"מט""ח",ישראל,ישראל,אחר,"מט""ח",2025-10-20,לא,2025-09-18,USD,אחר,אי-תלות,2025-09-30,145.0,1.0,-88919.39,0.2748,3.306,-0.80806,-0.000401,-1e-06
671,12120.0,"סולאיר אנרגיות מתחדשות בע""מ",516046307,ח.פ.,אפ לס סולאיר סדרה ב 25.12.2027,11722873,פנימי,מניה,ישראל,ישראל,אנרגיה מתחדשת,מניות לרבות מדדי מניות,2027-12-25,לא,2024-04-30,ILS,אחר,אי-תלות,2025-09-30,45.63,0.01,98.99,1109.37802,1.0,1.09815,0.000545,2e-06
671,12120.0,בזק,520031931,ח.פ.,CALL001 בזק 26/05/2026,IL0002300114,ISIN,מניה,"חו""ל",ישראל,אשראי חוץ בנקאי,מניות לרבות מדדי מניות,2026-05-26,לא,2025-05-27,ILS,אחר,אי-תלות,2025-09-30,551.6,1.0,10409.04,634.7,1.0,66.06616,0.032831,0.000176
671,12120.0,"מימון ישיר מקבוצת ישיר(2006) בע""מ",513893123,ח.פ.,מימון ישיר 21.09.2026 CALL001,IL0001168186,ISIN,מניה,"חו""ל",ישראל,אשראי חוץ בנקאי,מניות לרבות מדדי מניות,2026-09-21,לא,2025-09-21,ILS,אחר,אי-תלות,2025-09-30,45160.0,1.0,22.94,49390.0,1.0,11.33083,0.00563,3e-05
671,12120.0,"בנק הפועלים בע""מ",520000118,ח.פ.,CALL001 פועלים 26.05.26,IL0006625771,ISIN,מניה,"חו""ל",ישראל,בנקים,מניות לרבות מדדי מניות,2026-05-26,לא,2025-05-27,ILS,אחר,אי-תלות,2025-09-30,5784.0,1.0,560.23,6732.0,1.0,37.71485,0.018742,0.0001
671,12120.0,"בנק הפועלים בע""מ",520000118,ח.פ.,עסקת פועלים CALL 18.09.26,IL0006625771,ISIN,מניה,"חו""ל",ישראל,בנקים,מניות לרבות מדדי מניות,2026-09-18,לא,2025-09-18,ILS,אחר,אי-תלות,2025-09-30,6415.0,1.0,1956.91,6732.0,1.0,131.73943,0.065467,0.000351
671,12120.0,"ישראכרט בע""מ",510706153,ח.פ.,ישראכרט 07.05.2026 CALL001,IL0011574030,ISIN,מניה,"חו""ל",ישראל,אשראי חוץ בנקאי,מניות לרבות מדדי מניות,2026-05-07,לא,2025-05-07,ILS,אחר,אי-תלות,2025-09-30,1699.0,1.0,524.18,1338.0,1.0,7.0135,0.003485,1.8e-05
671,12120.0,"בנק הפועלים בע""מ",520000118,ח.פ.,פועלים 03.07.2026 CALL001,IL0006625771,ISIN,מניה,"חו""ל",ישראל,בנקים,מניות לרבות מדדי מניות,2026-07-03,לא,2025-07-03,ILS,אחר,אי-תלות,2025-09-30,6300.0,1.0,1172.31,6732.0,1.0,78.9201,0.039218,0.00021
671,12120.0,"מימון ישיר מקבוצת ישיר(2006) בע""מ",513893123,ח.פ.,מימון ישיר 26.03.2026 CALL001,IL0001168186,ISIN,מניה,"חו""ל",ישראל,אשראי חוץ בנקאי,מניות לרבות מדדי מניות,2026-03-26,לא,2025-03-26,ILS,אחר,אי-תלות,2025-09-30,53970.0,1.0,3.46,49390.0,1.0,1.71096,0.00085,4e-06
671,12120.0,"כלל החזקות עסקי ביטוח בע""מ",520036120,ח.פ.,CALL001 כלל 17.12.25,IL0002240146,ISIN,מניה,"חו""ל",ישראל,אשראי חוץ בנקאי,מניות לרבות מדדי מניות,2025-12-17,לא,2024-12-22,ILS,אחר,אי-תלות,2025-09-30,8629.0,1.0,229.42,16970.0,1.0,38.9318,0.019346,0.000103
671,12120.0,"כלל החזקות עסקי ביטוח בע""מ",520036120,ח.פ.,CALL001 כלל 15.07.26,IL0002240146,ISIN,מניה,"חו""ל",ישראל,אשראי חוץ בנקאי,מניות לרבות מדדי מניות,2026-07-14,לא,2025-07-15,ILS,אחר,אי-תלות,2025-09-30,8629.0,1.0,282.18,16970.0,1.0,47.88611,0.023796,0.000127
671,12120.0,"בנק דיסקונט לישראל בע""מ",520007030,ח.פ.,CALL001 דיסקונט 26.5.26,IL0006912120,ISIN,מניה,"חו""ל",ישראל,אשראי חוץ בנקאי,מניות לרבות מדדי מניות,2026-05-26,לא,2025-05-27,ILS,אחר,אי-תלות,2025-09-30,2952.0,1.0,2465.5,3274.0,1.0,80.72063,0.040113,0.000215
671,12120.0,"בנק לאומי לישראל בע""מ",520018078,ח.פ.,עסקת לאומי CALL 18.09.26,IL0006046119,ISIN,מניה,"חו""ל",ישראל,אשראי חוץ בנקאי,מניות לרבות מדדי מניות,2026-09-18,לא,2025-09-18,ILS,אחר,אי-תלות,2025-09-30,6235.0,1.0,2007.39,6529.0,1.0,131.06217,0.06513,0.000349
671,12120.0,"בנק הפועלים בע""מ",520000118,ח.פ.,26.09.2026 עסקת CALL פועלים,IL0006625771,ISIN,מניה,"חו""ל",ישראל,בנקים,מניות לרבות מדדי מניות,2026-09-26,לא,2025-09-26,ILS,אחר,אי-תלות,2025-09-30,6172.0,1.0,1278.76,6732.0,1.0,86.08623,0.042779,0.000229
671,12120.0,בזק,520031931,ח.פ.,עסקת CALL בזק 29.01.26,IL0002300114,ISIN,מניה,"חו""ל",ישראל,אשראי חוץ בנקאי,מניות לרבות מדדי מניות,2026-01-29,לא,2025-01-30,ILS,אחר,אי-תלות,2025-09-30,1357.5756,1.0,14453.17,634.7,1.0,91.73429,0.045586,0.000244
671,12120.0,"בנק הפועלים בע""מ",520000118,ח.פ.,26.11.25 עסקת CALL פועלים,IL0006625771,ISIN,מניה,"חו""ל",ישראל,בנקים,מניות לרבות מדדי מניות,2025-11-26,לא,2024-11-30,ILS,אחר,אי-תלות,2025-09-30,4272.0,1.0,1855.05,6732.0,1.0,124.88218,0.062059,0.000333
671,12120.0,"בנק לאומי לישראל בע""מ",520018078,ח.פ.,עסקת CALL001 לאומי 12.08.2026,IL0006046119,ISIN,מניה,"חו""ל",ישראל,אשראי חוץ בנקאי,מניות לרבות מדדי מניות,2026-08-12,לא,2025-08-13,ILS,אחר,אי-תלות,2025-09-30,6157.0,1.0,1882.12,6529.0,1.0,122.88389,0.061066,0.000327
671,12120.0,"בנק הפועלים בע""מ",520000118,ח.פ.,CALL001 פועלים 23.07.26,IL0006625771,ISIN,מניה,"חו""ל",ישראל,בנקים,מניות לרבות מדדי מניות,2026-07-23,לא,2025-07-24,ILS,אחר,אי-תלות,2025-09-30,6465.76,1.0,917.66,6732.0,1.0,61.77699,0.030699,0.000164
671,12120.0,"בנק לאומי לישראל בע""מ",520018078,ח.פ.,26.09.26 עסקת CALL לאומי,IL0006046119,ISIN,מניה,"חו""ל",ישראל,אשראי חוץ בנקאי,מניות לרבות מדדי מניות,2026-09-26,לא,2025-09-26,ILS,אחר,אי-תלות,2025-09-30,5965.0,1.0,2363.2,6529.0,1.0,154.29352,0.076675,0.000411
671,12120.0,"בנק הפועלים בע""מ",520000118,ח.פ.,עסקת CALL001 פועלים 12.08.2026,IL0006625771,ISIN,מניה,"חו""ל",ישראל,בנקים,מניות לרבות מדדי מניות,2026-08-12,לא,2025-08-13,ILS,אחר,אי-תלות,2025-09-30,6389.0,1.0,1950.03,6732.0,1.0,131.2761,0.065236,0.00035
671,12120.0,"בנק לאומי לישראל בע""מ",520018078,ח.פ.,26.11.25 עסקת CALL לאומי,IL0006046119,ISIN,מניה,"חו""ל",ישראל,אשראי חוץ בנקאי,מניות לרבות מדדי מניות,2025-11-26,לא,2024-12-31,ILS,אחר,אי-תלות,2025-09-30,4259.0,1.0,2908.99,6529.0,1.0,189.92781,0.094383,0.000506
671,12120.0,Odysight.ai Inc,549300FBP1ANSJE5TE25,LEI,אפ לס ODYS US 31/03/2026,620080903,פנימי,מניה,"חו""ל","ארה""ב","Electronic Equipment, Instruments & Components",מניות לרבות מדדי מניות,2026-03-31,לא,2023-03-27,USD,אחר,אי-תלות,2025-09-30,1.15,1.0,367.06,0.608,3.306,0.00738,3e-06,0.0
671,12120.0,נאוויטס פטרוליום שותפות מוגבלת,550263107,ח.פ.,קיקר נאוויטס פטרוליום שותפות מוגבל,10048041,פנימי,מניה,"חו""ל","ארה""ב","Oil, Gas & Consumable Fuels",אחר,2027-04-01,לא,2022-11-24,USD,מומחה בלתי תלוי,אי-תלות,2025-09-30,0.0,1.0,1723.53,107.832586,3.306,6.14429,0.003053,1.6e-05
671,12120.0,Odysight.ai Inc,549300FBP1ANSJE5TE25,LEI,אפ לס ODYS US 31/03/2026,620080901,פנימי,מניה,"חו""ל","ארה""ב","Electronic Equipment, Instruments & Components",מניות לרבות מדדי מניות,2026-03-31,לא,2022-03-18,USD,אחר,אי-תלות,2025-09-30,5.5,1.0,264.82,0.0,3.306,0.0,0.0,0.0
671,12120.0,יבולי שמש,515689198,ח.פ.,יבולי שמש אופציה,34140,פנימי,מניה,"חו""ל",רומניה,אנרגיה מתחדשת,תשתיות,2025-12-31,לא,2024-08-20,EUR,מומחה בלתי תלוי,אי-תלות,2025-09-30,0.0,1.0,0.02,148000000.0,3.8807,120.0486,0.059657,0.00032
671,14288.0,"קבוצת אקרו בע""מ",511996803,ח.פ.,אפ לס אקרו 05.08.2026,IL0011849028,ISIN,מניה,ישראל,ישראל,בנייה,מניות לרבות מדדי מניות,2026-08-05,לא,2025-04-07,ILS,אחר,אי-תלות,2025-09-30,70.0,0.01,0.44,123.307002,1.0,0.00055,1.6e-05,0.0
671,14288.0,"רוטשטיין נדל""ן בע""מ",520039959,ח.פ.,אפ לס בכספת-רוטשטין 26.07.2026,IL0005390153,ISIN,מניה,ישראל,ישראל,בנייה,מניות לרבות מדדי מניות,2026-07-26,לא,2025-01-28,ILS,אחר,אי-תלות,2025-09-30,73.0,0.01,3.53,2363.490861,1.0,0.08353,0.002457,2.7e-05
671,14288.0,"טופ גאם תעשיות בע""מ",513561399,ח.פ.,אפ לס טופ גאם 31.01.2027,IL0011791428,ISIN,מניה,ישראל,ישראל,פודטק,מניות לרבות מדדי מניות,2027-01-31,לא,2025-07-31,ILS,אחר,אי-תלות,2025-09-30,1025.0,0.01,13.47,125.559153,1.0,0.01691,0.000497,5e-06
671,14288.0,"אחים דוניץ בע""מ",520038605,ח.פ.,אפ לס דוניץ 31.12.25,IL0004000100,ISIN,מניה,ישראל,ישראל,בנייה,מניות לרבות מדדי מניות,2025-12-31,לא,2025-01-24,ILS,אחר,אי-תלות,2025-09-30,272.5,0.01,0.72,1076.583553,1.0,0.00778,0.000228,2e-06
671,14288.0,"אנלייט אנרגיה מתחדשת בע""מ",520041146,ח.פ.,CALL001 אנלייט 17.12.2025,IL0007200111,ISIN,מניה,ישראל,ישראל,אנרגיה מתחדשת,מניות לרבות מדדי מניות,2025-12-17,לא,2024-12-18,ILS,אחר,אי-תלות,2025-09-30,5869.0,1.0,9.55,10190.0,1.0,0.97361,0.028641,0.000318
671,14288.0,"אנלייט אנרגיה מתחדשת בע""מ",520041146,ח.פ.,CALL001 אנלייט 17.12.2025,IL0007200111,ISIN,מניה,ישראל,ישראל,אנרגיה מתחדשת,מניות לרבות מדדי מניות,2025-12-17,לא,2024-12-31,ILS,אחר,אי-תלות,2025-09-30,5869.0,1.0,29.24,10190.0,1.0,2.97926,0.087643,0.000975
671,14288.0,"סולאיר אנרגיות מתחדשות בע""מ",516046307,ח.פ.,אפ לס סולאיר סדרה א 25.12.2025,11722872,פנימי,מניה,ישראל,ישראל,אנרגיה מתחדשת,מניות לרבות מדדי מניות,2025-12-25,לא,2024-04-30,ILS,אחר,אי-תלות,2025-09-30,38.52,0.01,1.86,788.722208,1.0,0.01463,0.00043,4e-06
671,14288.0,CITI Bank,549300U8H3KN0K301B23,LEI,FXVOpt 145.0000 PUT USD-JPY 20.10.25,100120170,פנימי,"מט""ח",ישראל,ישראל,אחר,"מט""ח",2025-10-20,לא,2025-09-18,USD,אחר,אי-תלות,2025-09-30,145.0,1.0,-1153.17,0.2748,3.306,-0.01048,-0.000307,-2e-06
671,14288.0,CITI Bank,549300U8H3KN0K301B23,LEI,FXVOpt 3.6800 CALL USD-PLN 30.10.25,100120432,פנימי,"מט""ח",ישראל,ישראל,אחר,"מט""ח",2025-10-30,לא,2025-09-29,USD,אחר,אי-תלות,2025-09-30,3.68,1.0,-215.4,0.5646,3.306,-0.00402,-0.000118,-1e-06
671,14288.0,"סולאיר אנרגיות מתחדשות בע""מ",516046307,ח.פ.,אפ לס סולאיר סדרה ב 25.12.2027,11722873,פנימי,מניה,ישראל,ישראל,אנרגיה מתחדשת,מניות לרבות מדדי מניות,2027-12-25,לא,2024-04-30,ILS,אחר,אי-תלות,2025-09-30,45.63,0.01,1.86,1109.37802,1.0,0.02058,0.000605,6e-06
671,14288.0,"כלל החזקות עסקי ביטוח בע""מ",520036120,ח.פ.,CALL001 כלל 17.12.25,IL0002240146,ISIN,מניה,"חו""ל",ישראל,אשראי חוץ בנקאי,מניות לרבות מדדי מניות,2025-12-17,לא,2024-12-22,ILS,אחר,אי-תלות,2025-09-30,8629.0,1.0,4.3,16970.0,1.0,0.72964,0.021464,0.000238
671,14288.0,"בנק לאומי לישראל בע""מ",520018078,ח.פ.,26.09.26 עסקת CALL לאומי,IL0006046119,ISIN,מניה,"חו""ל",ישראל,אשראי חוץ בנקאי,מניות לרבות מדדי מניות,2026-09-26,לא,2025-09-26,ILS,אחר,אי-תלות,2025-09-30,5965.0,1.0,44.29,6529.0,1.0,2.89168,0.085066,0.000947
671,14288.0,"בנק הפועלים בע""מ",520000118,ח.פ.,עסקת CALL001 פועלים 12.08.2026,IL0006625771,ISIN,מניה,"חו""ל",ישראל,בנקים,מניות לרבות מדדי מניות,2026-08-12,לא,2025-08-13,ILS,אחר,אי-תלות,2025-09-30,6389.0,1.0,36.55,6732.0,1.0,2.4603,0.072376,0.000805
671,14288.0,בזק,520031931,ח.פ.,עסקת CALL בזק 29.01.26,IL0002300114,ISIN,מניה,"חו""ל",ישראל,אשראי חוץ בנקאי,מניות לרבות מדדי מניות,2026-01-29,לא,2025-01-30,ILS,אחר,אי-תלות,2025-09-30,1357.5756,1.0,270.87,634.7,1.0,1.71923,0.050575,0.000563
671,14288.0,"בנק לאומי לישראל בע""מ",520018078,ח.פ.,עסקת CALL001 לאומי 12.08.2026,IL0006046119,ISIN,מניה,"חו""ל",ישראל,אשראי חוץ בנקאי,מניות לרבות מדדי מניות,2026-08-12,לא,2025-08-13,ILS,אחר,אי-תלות,2025-09-30,6157.0,1.0,35.27,6529.0,1.0,2.30302,0.067749,0.000754
671,14288.0,בזק,520031931,ח.פ.,CALL001 בזק 26/05/2026,IL0002300114,ISIN,מניה,"חו""ל",ישראל,אשראי חוץ בנקאי,מניות לרבות מדדי מניות,2026-05-26,לא,2025-05-27,ILS,אחר,אי-תלות,2025-09-30,551.6,1.0,195.08,634.7,1.0,1.23817,0.036424,0.000405
671,14288.0,"בנק הפועלים בע""מ",520000118,ח.פ.,26.09.2026 עסקת CALL פועלים,IL0006625771,ISIN,מניה,"חו""ל",ישראל,בנקים,מניות לרבות מדדי מניות,2026-09-26,לא,2025-09-26,ILS,אחר,אי-תלות,2025-09-30,6172.0,1.0,23.97,6732.0,1.0,1.61338,0.047462,0.000528
671,14288.0,"בנק הפועלים בע""מ",520000118,ח.פ.,עסקת פועלים CALL 18.09.26,IL0006625771,ISIN,מניה,"חו""ל",ישראל,בנקים,מניות לרבות מדדי מניות,2026-09-18,לא,2025-09-18,ILS,אחר,אי-תלות,2025-09-30,6415.0,1.0,36.68,6732.0,1.0,2.46899,0.072632,0.000808
671,14288.0,"בנק הפועלים בע""מ",520000118,ח.פ.,CALL001 פועלים 26.05.26,IL0006625771,ISIN,מניה,"חו""ל",ישראל,בנקים,מניות לרבות מדדי מניות,2026-05-26,לא,2025-05-27,ILS,אחר,אי-תלות,2025-09-30,5784.0,1.0,10.5,6732.0,1.0,0.70683,0.020793,0.000231
671,14288.0,"כלל החזקות עסקי ביטוח בע""מ",520036120,ח.פ.,CALL001 כלל 15.07.26,IL0002240146,ISIN,מניה,"חו""ל",ישראל,אשראי חוץ בנקאי,מניות לרבות מדדי מניות,2026-07-14,לא,2025-07-15,ILS,אחר,אי-תלות,2025-09-30,8629.0,1.0,5.29,16970.0,1.0,0.89745,0.026401,0.000293
671,14288.0,"בנק הפועלים בע""מ",520000118,ח.פ.,פועלים 03.07.2026 CALL001,IL0006625771,ISIN,מניה,"חו""ל",ישראל,בנקים,מניות לרבות מדדי מניות,2026-07-03,לא,2025-07-03,ILS,אחר,אי-תלות,2025-09-30,6300.0,1.0,21.97,6732.0,1.0,1.47908,0.043511,0.000484
671,14288.0,"מימון ישיר מקבוצת ישיר(2006) בע""מ",513893123,ח.פ.,מימון ישיר 21.09.2026 CALL001,IL0001168186,ISIN,מניה,"חו""ל",ישראל,אשראי חוץ בנקאי,מניות לרבות מדדי מניות,2026-09-21,לא,2025-09-21,ILS,אחר,אי-תלות,2025-09-30,45160.0,1.0,0.43,49390.0,1.0,0.21236,0.006247,6.9e-05
671,14288.0,"בנק הפועלים בע""מ",520000118,ח.פ.,26.11.25 עסקת CALL פועלים,IL0006625771,ISIN,מניה,"חו""ל",ישראל,בנקים,מניות לרבות מדדי מניות,2025-11-26,לא,2024-11-30,ILS,אחר,אי-תלות,2025-09-30,4272.0,1.0,34.77,6732.0,1.0,2.34047,0.068851,0.000766
671,14288.0,"בנק לאומי לישראל בע""מ",520018078,ח.פ.,עסקת לאומי CALL 18.09.26,IL0006046119,ISIN,מניה,"חו""ל",ישראל,אשראי חוץ בנקאי,מניות לרבות מדדי מניות,2026-09-18,לא,2025-09-18,ILS,אחר,אי-תלות,2025-09-30,6235.0,1.0,37.62,6529.0,1.0,2.45629,0.072258,0.000804
671,14288.0,"בנק לאומי לישראל בע""מ",520018078,ח.פ.,26.11.25 עסקת CALL לאומי,IL0006046119,ISIN,מניה,"חו""ל",ישראל,אשראי חוץ בנקאי,מניות לרבות מדדי מניות,2025-11-26,לא,2024-12-31,ILS,אחר,אי-תלות,2025-09-30,4259.0,1.0,54.52,6529.0,1.0,3.55952,0.104713,0.001165
671,14288.0,"בנק הפועלים בע""מ",520000118,ח.פ.,CALL001 פועלים 23.07.26,IL0006625771,ISIN,מניה,"חו""ל",ישראל,בנקים,מניות לרבות מדדי מניות,2026-07-23,לא,2025-07-24,ILS,אחר,אי-תלות,2025-09-30,6465.76,1.0,17.2,6732.0,1.0,1.15779,0.034059,0.000379
671,14288.0,"ישראכרט בע""מ",510706153,ח.פ.,ישראכרט 07.05.2026 CALL001,IL0011574030,ISIN,מניה,"חו""ל",ישראל,אשראי חוץ בנקאי,מניות לרבות מדדי מניות,2026-05-07,לא,2025-05-07,ILS,אחר,אי-תלות,2025-09-30,1699.0,1.0,9.82,1338.0,1.0,0.13144,0.003866,4.3e-05
671,14288.0,"בנק דיסקונט לישראל בע""מ",520007030,ח.פ.,CALL001 דיסקונט 26.5.26,IL0006912120,ISIN,מניה,"חו""ל",ישראל,אשראי חוץ בנקאי,מניות לרבות מדדי מניות,2026-05-26,לא,2025-05-27,ILS,אחר,אי-תלות,2025-09-30,2952.0,1.0,46.21,3274.0,1.0,1.51282,0.044503,0.000495
671,14288.0,"מימון ישיר מקבוצת ישיר(2006) בע""מ",513893123,ח.פ.,מימון ישיר 26.03.2026 CALL001,IL0001168186,ISIN,מניה,"חו""ל",ישראל,אשראי חוץ בנקאי,מניות לרבות מדדי מניות,2026-03-26,לא,2025-03-26,ILS,אחר,אי-תלות,2025-09-30,53970.0,1.0,0.06,49390.0,1.0,0.03207,0.000943,1e-05
671,14288.0,Odysight.ai Inc,549300FBP1ANSJE5TE25,LEI,אפ לס ODYS US 31/03/2026,620080901,פנימי,מניה,"חו""ל","ארה""ב","Electronic Equipment, Instruments & Components",מניות לרבות מדדי מניות,2026-03-31,לא,2022-03-18,USD,אחר,אי-תלות,2025-09-30,5.5,1.0,4.96,0.0,3.306,0.0,0.0,0.0
671,14288.0,Odysight.ai Inc,549300FBP1ANSJE5TE25,LEI,אפ לס ODYS US 31/03/2026,620080903,פנימי,מניה,"חו""ל","ארה""ב","Electronic Equipment, Instruments & Components",מניות לרבות מדדי מניות,2026-03-31,לא,2023-03-27,USD,אחר,אי-תלות,2025-09-30,1.15,1.0,6.88,0.608,3.306,0.00014,4e-06,0.0
671,15220.0,"רוטשטיין נדל""ן בע""מ",520039959,ח.פ.,אפ לס בכספת-רוטשטין 26.07.2026,IL0005390153,ISIN,מניה,ישראל,ישראל,בנייה,מניות לרבות מדדי מניות,2026-07-26,לא,2025-01-28,ILS,אחר,אי-תלות,2025-09-30,73.0,0.01,2.94,2363.490861,1.0,0.06946,0.002456,2.9e-05
671,15220.0,"אנלייט אנרגיה מתחדשת בע""מ",520041146,ח.פ.,CALL001 אנלייט 17.12.2025,IL0007200111,ISIN,מניה,ישראל,ישראל,אנרגיה מתחדשת,מניות לרבות מדדי מניות,2025-12-17,לא,2024-12-18,ILS,אחר,אי-תלות,2025-09-30,5869.0,1.0,7.94,10190.0,1.0,0.80959,0.028629,0.000338
671,15220.0,"אנלייט אנרגיה מתחדשת בע""מ",520041146,ח.פ.,CALL001 אנלייט 17.12.2025,IL0007200111,ISIN,מניה,ישראל,ישראל,אנרגיה מתחדשת,מניות לרבות מדדי מניות,2025-12-17,לא,2024-12-31,ILS,אחר,אי-תלות,2025-09-30,5869.0,1.0,24.31,10190.0,1.0,2.47736,0.087605,0.001035
671,15220.0,"קבוצת אקרו בע""מ",511996803,ח.פ.,אפ לס אקרו 05.08.2026,IL0011849028,ISIN,מניה,ישראל,ישראל,בנייה,מניות לרבות מדדי מניות,2026-08-05,לא,2025-04-07,ILS,אחר,אי-תלות,2025-09-30,70.0,0.01,0.37,123.307002,1.0,0.00046,1.6e-05,0.0
671,15220.0,"אחים דוניץ בע""מ",520038605,ח.פ.,אפ לס דוניץ 31.12.25,IL0004000100,ISIN,מניה,ישראל,ישראל,בנייה,מניות לרבות מדדי מניות,2025-12-31,לא,2025-01-24,ILS,אחר,אי-תלות,2025-09-30,272.5,0.01,0.6,1076.583553,1.0,0.00647,0.000228,2e-06
671,15220.0,"טופ גאם תעשיות בע""מ",513561399,ח.פ.,אפ לס טופ גאם 31.01.2027,IL0011791428,ISIN,מניה,ישראל,ישראל,פודטק,מניות לרבות מדדי מניות,2027-01-31,לא,2025-07-31,ILS,אחר,אי-תלות,2025-09-30,1025.0,0.01,11.2,125.559153,1.0,0.01406,0.000497,5e-06
671,15220.0,"סולאיר אנרגיות מתחדשות בע""מ",516046307,ח.פ.,אפ לס סולאיר סדרה ב 25.12.2027,11722873,פנימי,מניה,ישראל,ישראל,אנרגיה מתחדשת,מניות לרבות מדדי מניות,2027-12-25,לא,2024-04-30,ILS,אחר,אי-תלות,2025-09-30,45.63,0.01,1.54,1109.37802,1.0,0.01711,0.000605,7e-06
671,15220.0,"סולאיר אנרגיות מתחדשות בע""מ",516046307,ח.פ.,אפ לס סולאיר סדרה א 25.12.2025,11722872,פנימי,מניה,ישראל,ישראל,אנרגיה מתחדשת,מניות לרבות מדדי מניות,2025-12-25,לא,2024-04-30,ILS,אחר,אי-תלות,2025-09-30,38.52,0.01,1.54,788.722208,1.0,0.01217,0.00043,5e-06
671,15220.0,"בנק הפועלים בע""מ",520000118,ח.פ.,פועלים 03.07.2026 CALL001,IL0006625771,ISIN,מניה,"חו""ל",ישראל,בנקים,מניות לרבות מדדי מניות,2026-07-03,לא,2025-07-03,ILS,אחר,אי-תלות,2025-09-30,6300.0,1.0,18.27,6732.0,1.0,1.2299,0.043492,0.000513
671,15220.0,"בנק הפועלים בע""מ",520000118,ח.פ.,CALL001 פועלים 23.07.26,IL0006625771,ISIN,מניה,"חו""ל",ישראל,בנקים,מניות לרבות מדדי מניות,2026-07-23,לא,2025-07-24,ILS,אחר,אי-תלות,2025-09-30,6465.76,1.0,14.3,6732.0,1.0,0.96274,0.034045,0.000402
671,15220.0,"בנק לאומי לישראל בע""מ",520018078,ח.פ.,26.09.26 עסקת CALL לאומי,IL0006046119,ISIN,מניה,"חו""ל",ישראל,אשראי חוץ בנקאי,מניות לרבות מדדי מניות,2026-09-26,לא,2025-09-26,ILS,אחר,אי-תלות,2025-09-30,5965.0,1.0,36.83,6529.0,1.0,2.40454,0.08503,0.001004
671,15220.0,"ישראכרט בע""מ",510706153,ח.פ.,ישראכרט 07.05.2026 CALL001,IL0011574030,ISIN,מניה,"חו""ל",ישראל,אשראי חוץ בנקאי,מניות לרבות מדדי מניות,2026-05-07,לא,2025-05-07,ILS,אחר,אי-תלות,2025-09-30,1699.0,1.0,8.17,1338.0,1.0,0.1093,0.003865,4.5e-05
671,15220.0,"בנק דיסקונט לישראל בע""מ",520007030,ח.פ.,CALL001 דיסקונט 26.5.26,IL0006912120,ISIN,מניה,"חו""ל",ישראל,אשראי חוץ בנקאי,מניות לרבות מדדי מניות,2026-05-26,לא,2025-05-27,ILS,אחר,אי-תלות,2025-09-30,2952.0,1.0,38.42,3274.0,1.0,1.25796,0.044484,0.000525
671,15220.0,"בנק הפועלים בע""מ",520000118,ח.פ.,עסקת פועלים CALL 18.09.26,IL0006625771,ISIN,מניה,"חו""ל",ישראל,בנקים,מניות לרבות מדדי מניות,2026-09-18,לא,2025-09-18,ILS,אחר,אי-תלות,2025-09-30,6415.0,1.0,30.5,6732.0,1.0,2.05305,0.072601,0.000857
671,15220.0,בזק,520031931,ח.פ.,CALL001 בזק 26/05/2026,IL0002300114,ISIN,מניה,"חו""ל",ישראל,אשראי חוץ בנקאי,מניות לרבות מדדי מניות,2026-05-26,לא,2025-05-27,ILS,אחר,אי-תלות,2025-09-30,551.6,1.0,162.22,634.7,1.0,1.02959,0.036409,0.00043
671,15220.0,"בנק הפועלים בע""מ",520000118,ח.פ.,CALL001 פועלים 26.05.26,IL0006625771,ISIN,מניה,"חו""ל",ישראל,בנקים,מניות לרבות מדדי מניות,2026-05-26,לא,2025-05-27,ILS,אחר,אי-תלות,2025-09-30,5784.0,1.0,8.73,6732.0,1.0,0.58775,0.020784,0.000245
671,15220.0,"מימון ישיר מקבוצת ישיר(2006) בע""מ",513893123,ח.פ.,מימון ישיר 21.09.2026 CALL001,IL0001168186,ISIN,מניה,"חו""ל",ישראל,אשראי חוץ בנקאי,מניות לרבות מדדי מניות,2026-09-21,לא,2025-09-21,ILS,אחר,אי-תלות,2025-09-30,45160.0,1.0,0.36,49390.0,1.0,0.17658,0.006244,7.3e-05
671,15220.0,"בנק הפועלים בע""מ",520000118,ח.פ.,עסקת CALL001 פועלים 12.08.2026,IL0006625771,ISIN,מניה,"חו""ל",ישראל,בנקים,מניות לרבות מדדי מניות,2026-08-12,לא,2025-08-13,ILS,אחר,אי-תלות,2025-09-30,6389.0,1.0,30.39,6732.0,1.0,2.04583,0.072345,0.000854
671,15220.0,"בנק לאומי לישראל בע""מ",520018078,ח.פ.,עסקת לאומי CALL 18.09.26,IL0006046119,ISIN,מניה,"חו""ל",ישראל,אשראי חוץ בנקאי,מניות לרבות מדדי מניות,2026-09-18,לא,2025-09-18,ILS,אחר,אי-תלות,2025-09-30,6235.0,1.0,31.28,6529.0,1.0,2.04249,0.072227,0.000853
671,15220.0,"בנק לאומי לישראל בע""מ",520018078,ח.פ.,עסקת CALL001 לאומי 12.08.2026,IL0006046119,ISIN,מניה,"חו""ל",ישראל,אשראי חוץ בנקאי,מניות לרבות מדדי מניות,2026-08-12,לא,2025-08-13,ILS,אחר,אי-תלות,2025-09-30,6157.0,1.0,29.33,6529.0,1.0,1.91504,0.06772,0.0008
671,15220.0,בזק,520031931,ח.פ.,עסקת CALL בזק 29.01.26,IL0002300114,ISIN,מניה,"חו""ל",ישראל,אשראי חוץ בנקאי,מניות לרבות מדדי מניות,2026-01-29,לא,2025-01-30,ILS,אחר,אי-תלות,2025-09-30,1357.5756,1.0,225.24,634.7,1.0,1.4296,0.050554,0.000597
671,15220.0,"מימון ישיר מקבוצת ישיר(2006) בע""מ",513893123,ח.פ.,מימון ישיר 26.03.2026 CALL001,IL0001168186,ISIN,מניה,"חו""ל",ישראל,אשראי חוץ בנקאי,מניות לרבות מדדי מניות,2026-03-26,לא,2025-03-26,ILS,אחר,אי-תלות,2025-09-30,53970.0,1.0,0.05,49390.0,1.0,0.02666,0.000942,1.1e-05
671,15220.0,"בנק לאומי לישראל בע""מ",520018078,ח.פ.,26.11.25 עסקת CALL לאומי,IL0006046119,ISIN,מניה,"חו""ל",ישראל,אשראי חוץ בנקאי,מניות לרבות מדדי מניות,2025-11-26,לא,2024-12-31,ILS,אחר,אי-תלות,2025-09-30,4259.0,1.0,45.33,6529.0,1.0,2.95987,0.104668,0.001236
671,15220.0,"בנק הפועלים בע""מ",520000118,ח.פ.,26.11.25 עסקת CALL פועלים,IL0006625771,ISIN,מניה,"חו""ל",ישראל,בנקים,מניות לרבות מדדי מניות,2025-11-26,לא,2024-11-30,ILS,אחר,אי-תלות,2025-09-30,4272.0,1.0,28.91,6732.0,1.0,1.94618,0.068822,0.000813
671,15220.0,"כלל החזקות עסקי ביטוח בע""מ",520036120,ח.פ.,CALL001 כלל 15.07.26,IL0002240146,ISIN,מניה,"חו""ל",ישראל,אשראי חוץ בנקאי,מניות לרבות מדדי מניות,2026-07-14,לא,2025-07-15,ILS,אחר,אי-תלות,2025-09-30,8629.0,1.0,4.4,16970.0,1.0,0.74627,0.02639,0.000311
671,15220.0,"בנק הפועלים בע""מ",520000118,ח.פ.,26.09.2026 עסקת CALL פועלים,IL0006625771,ISIN,מניה,"חו""ל",ישראל,בנקים,מניות לרבות מדדי מניות,2026-09-26,לא,2025-09-26,ILS,אחר,אי-תלות,2025-09-30,6172.0,1.0,19.93,6732.0,1.0,1.34158,0.047441,0.00056
671,15220.0,"כלל החזקות עסקי ביטוח בע""מ",520036120,ח.פ.,CALL001 כלל 17.12.25,IL0002240146,ISIN,מניה,"חו""ל",ישראל,אשראי חוץ בנקאי,מניות לרבות מדדי מניות,2025-12-17,לא,2024-12-22,ILS,אחר,אי-תלות,2025-09-30,8629.0,1.0,3.58,16970.0,1.0,0.60672,0.021455,0.000253
671,15220.0,Odysight.ai Inc,549300FBP1ANSJE5TE25,LEI,אפ לס ODYS US 31/03/2026,620080901,פנימי,מניה,"חו""ל","ארה""ב","Electronic Equipment, Instruments & Components",מניות לרבות מדדי מניות,2026-03-31,לא,2022-03-18,USD,אחר,אי-תלות,2025-09-30,5.5,1.0,4.13,0.0,3.306,0.0,0.0,0.0
671,15220.0,Odysight.ai Inc,549300FBP1ANSJE5TE25,LEI,אפ לס ODYS US 31/03/2026,620080903,פנימי,מניה,"חו""ל","ארה""ב","Electronic Equipment, Instruments & Components",מניות לרבות מדדי מניות,2026-03-31,לא,2023-03-27,USD,אחר,אי-תלות,2025-09-30,1.15,1.0,5.72,0.608,3.306,0.00011,3e-06,0.0
671,15221.0,"רוטשטיין נדל""ן בע""מ",520039959,ח.פ.,אפ לס בכספת-רוטשטין 26.07.2026,IL0005390153,ISIN,מניה,ישראל,ישראל,בנייה,מניות לרבות מדדי מניות,2026-07-26,לא,2025-01-28,ILS,אחר,אי-תלות,2025-09-30,73.0,0.01,275.26,2363.490861,1.0,6.50564,0.002456,0.000138
671,15221.0,"טופ גאם תעשיות בע""מ",513561399,ח.פ.,אפ לס טופ גאם 31.01.2027,IL0011791428,ISIN,מניה,ישראל,ישראל,פודטק,מניות לרבות מדדי מניות,2027-01-31,לא,2025-07-31,ILS,אחר,אי-תלות,2025-09-30,1025.0,0.01,1048.75,125.559153,1.0,1.3168,0.000497,2.7e-05
671,15221.0,"אנלייט אנרגיה מתחדשת בע""מ",520041146,ח.פ.,CALL001 אנלייט 17.12.2025,IL0007200111,ISIN,מניה,ישראל,ישראל,אנרגיה מתחדשת,מניות לרבות מדדי מניות,2025-12-17,לא,2024-12-18,ILS,אחר,אי-תלות,2025-09-30,5869.0,1.0,744.13,10190.0,1.0,75.82693,0.028629,0.001612
671,15221.0,"קבוצת אקרו בע""מ",511996803,ח.פ.,אפ לס אקרו 05.08.2026,IL0011849028,ISIN,מניה,ישראל,ישראל,בנייה,מניות לרבות מדדי מניות,2026-08-05,לא,2025-04-07,ILS,אחר,אי-תלות,2025-09-30,70.0,0.01,34.64,123.307002,1.0,0.04272,1.6e-05,0.0
671,15221.0,"אחים דוניץ בע""מ",520038605,ח.פ.,אפ לס דוניץ 31.12.25,IL0004000100,ISIN,מניה,ישראל,ישראל,בנייה,מניות לרבות מדדי מניות,2025-12-31,לא,2025-01-24,ILS,אחר,אי-תלות,2025-09-30,272.5,0.01,56.26,1076.583553,1.0,0.60565,0.000228,1.2e-05
671,15221.0,"אנלייט אנרגיה מתחדשת בע""מ",520041146,ח.פ.,CALL001 אנלייט 17.12.2025,IL0007200111,ISIN,מניה,ישראל,ישראל,אנרגיה מתחדשת,מניות לרבות מדדי מניות,2025-12-17,לא,2024-12-31,ILS,אחר,אי-תלות,2025-09-30,5869.0,1.0,2277.05,10190.0,1.0,232.03169,0.087605,0.004933
671,15221.0,"סולאיר אנרגיות מתחדשות בע""מ",516046307,ח.פ.,אפ לס סולאיר סדרה א 25.12.2025,11722872,פנימי,מניה,ישראל,ישראל,אנרגיה מתחדשת,מניות לרבות מדדי מניות,2025-12-25,לא,2024-04-30,ILS,אחר,אי-תלות,2025-09-30,38.52,0.01,144.49,788.722208,1.0,1.13959,0.00043,2.4e-05
671,15221.0,"סולאיר אנרגיות מתחדשות בע""מ",516046307,ח.פ.,אפ לס סולאיר סדרה ב 25.12.2027,11722873,פנימי,מניה,ישראל,ישראל,אנרגיה מתחדשת,מניות לרבות מדדי מניות,2027-12-25,לא,2024-04-30,ILS,אחר,אי-תלות,2025-09-30,45.63,0.01,144.49,1109.37802,1.0,1.60289,0.000605,3.4e-05
671,15221.0,"בנק הפועלים בע""מ",520000118,ח.פ.,CALL001 פועלים 23.07.26,IL0006625771,ISIN,מניה,"חו""ל",ישראל,בנקים,מניות לרבות מדדי מניות,2026-07-23,לא,2025-07-24,ILS,אחר,אי-תלות,2025-09-30,6465.76,1.0,1339.44,6732.0,1.0,90.17129,0.034045,0.001917
671,15221.0,"כלל החזקות עסקי ביטוח בע""מ",520036120,ח.פ.,CALL001 כלל 15.07.26,IL0002240146,ISIN,מניה,"חו""ל",ישראל,אשראי חוץ בנקאי,מניות לרבות מדדי מניות,2026-07-14,לא,2025-07-15,ILS,אחר,אי-תלות,2025-09-30,8629.0,1.0,411.88,16970.0,1.0,69.89581,0.026389,0.001486
671,15221.0,"בנק הפועלים בע""מ",520000118,ח.פ.,עסקת CALL001 פועלים 12.08.2026,IL0006625771,ISIN,מניה,"חו""ל",ישראל,בנקים,מניות לרבות מדדי מניות,2026-08-12,לא,2025-08-13,ILS,אחר,אי-תלות,2025-09-30,6389.0,1.0,2846.32,6732.0,1.0,191.614,0.072345,0.004074
671,15221.0,בזק,520031931,ח.פ.,CALL001 בזק 26/05/2026,IL0002300114,ISIN,מניה,"חו""ל",ישראל,אשראי חוץ בנקאי,מניות לרבות מדדי מניות,2026-05-26,לא,2025-05-27,ILS,אחר,אי-תלות,2025-09-30,551.6,1.0,15193.3,634.7,1.0,96.43188,0.036408,0.00205
671,15221.0,"בנק הפועלים בע""מ",520000118,ח.פ.,עסקת פועלים CALL 18.09.26,IL0006625771,ISIN,מניה,"חו""ל",ישראל,בנקים,מניות לרבות מדדי מניות,2026-09-18,לא,2025-09-18,ILS,אחר,אי-תלות,2025-09-30,6415.0,1.0,2856.36,6732.0,1.0,192.29029,0.072601,0.004088
671,15221.0,"מימון ישיר מקבוצת ישיר(2006) בע""מ",513893123,ח.פ.,מימון ישיר 21.09.2026 CALL001,IL0001168186,ISIN,מניה,"חו""ל",ישראל,אשראי חוץ בנקאי,מניות לרבות מדדי מניות,2026-09-21,לא,2025-09-21,ILS,אחר,אי-תלות,2025-09-30,45160.0,1.0,33.49,49390.0,1.0,16.53877,0.006244,0.000351
671,15221.0,"בנק הפועלים בע""מ",520000118,ח.פ.,פועלים 03.07.2026 CALL001,IL0006625771,ISIN,מניה,"חו""ל",ישראל,בנקים,מניות לרבות מדדי מניות,2026-07-03,לא,2025-07-03,ILS,אחר,אי-תלות,2025-09-30,6300.0,1.0,1711.14,6732.0,1.0,115.19383,0.043492,0.002449
671,15221.0,"ישראכרט בע""מ",510706153,ח.פ.,ישראכרט 07.05.2026 CALL001,IL0011574030,ISIN,מניה,"חו""ל",ישראל,אשראי חוץ בנקאי,מניות לרבות מדדי מניות,2026-05-07,לא,2025-05-07,ILS,אחר,אי-תלות,2025-09-30,1699.0,1.0,765.1,1338.0,1.0,10.23708,0.003865,0.000217
671,15221.0,"בנק הפועלים בע""מ",520000118,ח.פ.,26.11.25 עסקת CALL פועלים,IL0006625771,ISIN,מניה,"חו""ל",ישראל,בנקים,מניות לרבות מדדי מניות,2025-11-26,לא,2024-11-30,ILS,אחר,אי-תלות,2025-09-30,4272.0,1.0,2707.68,6732.0,1.0,182.28127,0.068822,0.003875
671,15221.0,"בנק לאומי לישראל בע""מ",520018078,ח.פ.,עסקת CALL001 לאומי 12.08.2026,IL0006046119,ISIN,מניה,"חו""ל",ישראל,אשראי חוץ בנקאי,מניות לרבות מדדי מניות,2026-08-12,לא,2025-08-13,ILS,אחר,אי-תלות,2025-09-30,6157.0,1.0,2747.2,6529.0,1.0,179.36451,0.06772,0.003813
671,15221.0,"מימון ישיר מקבוצת ישיר(2006) בע""מ",513893123,ח.פ.,מימון ישיר 26.03.2026 CALL001,IL0001168186,ISIN,מניה,"חו""ל",ישראל,אשראי חוץ בנקאי,מניות לרבות מדדי מניות,2026-03-26,לא,2025-03-26,ILS,אחר,אי-תלות,2025-09-30,53970.0,1.0,5.06,49390.0,1.0,2.49735,0.000942,5.3e-05
671,15221.0,"בנק לאומי לישראל בע""מ",520018078,ח.פ.,26.11.25 עסקת CALL לאומי,IL0006046119,ISIN,מניה,"חו""ל",ישראל,אשראי חוץ בנקאי,מניות לרבות מדדי מניות,2025-11-26,לא,2024-12-31,ILS,אחר,אי-תלות,2025-09-30,4259.0,1.0,4246.03,6529.0,1.0,277.22355,0.104668,0.005894
671,15221.0,"בנק הפועלים בע""מ",520000118,ח.פ.,26.09.2026 עסקת CALL פועלים,IL0006625771,ISIN,מניה,"חו""ל",ישראל,בנקים,מניות לרבות מדדי מניות,2026-09-26,לא,2025-09-26,ILS,אחר,אי-תלות,2025-09-30,6172.0,1.0,1866.51,6732.0,1.0,125.6537,0.047441,0.002671
671,15221.0,"בנק לאומי לישראל בע""מ",520018078,ח.פ.,עסקת לאומי CALL 18.09.26,IL0006046119,ISIN,מניה,"חו""ל",ישראל,אשראי חוץ בנקאי,מניות לרבות מדדי מניות,2026-09-18,לא,2025-09-18,ILS,אחר,אי-תלות,2025-09-30,6235.0,1.0,2930.03,6529.0,1.0,191.30174,0.072227,0.004067
671,15221.0,בזק,520031931,ח.פ.,עסקת CALL בזק 29.01.26,IL0002300114,ISIN,מניה,"חו""ל",ישראל,אשראי חוץ בנקאי,מניות לרבות מדדי מניות,2026-01-29,לא,2025-01-30,ILS,אחר,אי-תלות,2025-09-30,1357.5756,1.0,21096.23,634.7,1.0,133.89774,0.050554,0.002846
671,15221.0,"בנק לאומי לישראל בע""מ",520018078,ח.פ.,26.09.26 עסקת CALL לאומי,IL0006046119,ISIN,מניה,"חו""ל",ישראל,אשראי חוץ בנקאי,מניות לרבות מדדי מניות,2026-09-26,לא,2025-09-26,ILS,אחר,אי-תלות,2025-09-30,5965.0,1.0,3449.39,6529.0,1.0,225.21082,0.08503,0.004788
671,15221.0,"בנק הפועלים בע""מ",520000118,ח.פ.,CALL001 פועלים 26.05.26,IL0006625771,ISIN,מניה,"חו""ל",ישראל,בנקים,מניות לרבות מדדי מניות,2026-05-26,לא,2025-05-27,ILS,אחר,אי-תלות,2025-09-30,5784.0,1.0,817.73,6732.0,1.0,55.04958,0.020784,0.00117
671,15221.0,"בנק דיסקונט לישראל בע""מ",520007030,ח.פ.,CALL001 דיסקונט 26.5.26,IL0006912120,ISIN,מניה,"חו""ל",ישראל,אשראי חוץ בנקאי,מניות לרבות מדדי מניות,2026-05-26,לא,2025-05-27,ILS,אחר,אי-תלות,2025-09-30,2952.0,1.0,3598.71,3274.0,1.0,117.82192,0.044484,0.002505
671,15221.0,"כלל החזקות עסקי ביטוח בע""מ",520036120,ח.פ.,CALL001 כלל 17.12.25,IL0002240146,ISIN,מניה,"חו""ל",ישראל,אשראי חוץ בנקאי,מניות לרבות מדדי מניות,2025-12-17,לא,2024-12-22,ILS,אחר,אי-תלות,2025-09-30,8629.0,1.0,334.86,16970.0,1.0,56.82586,0.021455,0.001208
671,15221.0,Odysight.ai Inc,549300FBP1ANSJE5TE25,LEI,אפ לס ODYS US 31/03/2026,620080903,פנימי,מניה,"חו""ל","ארה""ב","Electronic Equipment, Instruments & Components",מניות לרבות מדדי מניות,2026-03-31,לא,2023-03-27,USD,אחר,אי-תלות,2025-09-30,1.15,1.0,535.78,0.608,3.306,0.01077,4e-06,0.0
671,15221.0,Odysight.ai Inc,549300FBP1ANSJE5TE25,LEI,אפ לס ODYS US 31/03/2026,620080901,פנימי,מניה,"חו""ל","ארה""ב","Electronic Equipment, Instruments & Components",מניות לרבות מדדי מניות,2026-03-31,לא,2022-03-18,USD,אחר,אי-תלות,2025-09-30,5.5,1.0,386.54,0.0,3.306,0.0,0.0,0.0
671,15224.0,"אנלייט אנרגיה מתחדשת בע""מ",520041146,ח.פ.,CALL001 אנלייט 17.12.2025,IL0007200111,ISIN,מניה,ישראל,ישראל,אנרגיה מתחדשת,מניות לרבות מדדי מניות,2025-12-17,לא,2024-12-18,ILS,אחר,אי-תלות,2025-09-30,5869.0,1.0,10.17,10190.0,1.0,1.0362,0.028642,0.000303
671,15224.0,"אנלייט אנרגיה מתחדשת בע""מ",520041146,ח.פ.,CALL001 אנלייט 17.12.2025,IL0007200111,ISIN,מניה,ישראל,ישראל,אנרגיה מתחדשת,מניות לרבות מדדי מניות,2025-12-17,לא,2024-12-31,ILS,אחר,אי-תלות,2025-09-30,5869.0,1.0,31.12,10190.0,1.0,3.17079,0.087646,0.000927
671,15224.0,"טופ גאם תעשיות בע""מ",513561399,ח.פ.,אפ לס טופ גאם 31.01.2027,IL0011791428,ISIN,מניה,ישראל,ישראל,פודטק,מניות לרבות מדדי מניות,2027-01-31,לא,2025-07-31,ILS,אחר,אי-תלות,2025-09-30,1025.0,0.01,14.33,125.559153,1.0,0.01799,0.000497,5e-06
671,15224.0,"קבוצת אקרו בע""מ",511996803,ח.פ.,אפ לס אקרו 05.08.2026,IL0011849028,ISIN,מניה,ישראל,ישראל,בנייה,מניות לרבות מדדי מניות,2026-08-05,לא,2025-04-07,ILS,אחר,אי-תלות,2025-09-30,70.0,0.01,0.47,123.307002,1.0,0.00058,1.6e-05,0.0
671,15224.0,"רוטשטיין נדל""ן בע""מ",520039959,ח.פ.,אפ לס בכספת-רוטשטין 26.07.2026,IL0005390153,ISIN,מניה,ישראל,ישראל,בנייה,מניות לרבות מדדי מניות,2026-07-26,לא,2025-01-28,ILS,אחר,אי-תלות,2025-09-30,73.0,0.01,3.76,2363.490861,1.0,0.0889,0.002457,2.6e-05
671,15224.0,"אחים דוניץ בע""מ",520038605,ח.פ.,אפ לס דוניץ 31.12.25,IL0004000100,ISIN,מניה,ישראל,ישראל,בנייה,מניות לרבות מדדי מניות,2025-12-31,לא,2025-01-24,ILS,אחר,אי-תלות,2025-09-30,272.5,0.01,0.77,1076.583553,1.0,0.00828,0.000228,2e-06
671,15224.0,CITI Bank,549300U8H3KN0K301B23,LEI,FXVOpt 3.6800 CALL USD-PLN 30.10.25,100120432,פנימי,"מט""ח",ישראל,ישראל,אחר,"מט""ח",2025-10-30,לא,2025-09-29,USD,אחר,אי-תלות,2025-09-30,3.68,1.0,-203.41,0.5646,3.306,-0.0038,-0.000105,-1e-06
671,15224.0,"סולאיר אנרגיות מתחדשות בע""מ",516046307,ח.פ.,אפ לס סולאיר סדרה א 25.12.2025,11722872,פנימי,מניה,ישראל,ישראל,אנרגיה מתחדשת,מניות לרבות מדדי מניות,2025-12-25,לא,2024-04-30,ILS,אחר,אי-תלות,2025-09-30,38.52,0.01,1.97,788.722208,1.0,0.01557,0.00043,4e-06
671,15224.0,CITI Bank,549300U8H3KN0K301B23,LEI,FXVOpt 145.0000 PUT USD-JPY 20.10.25,100120170,פנימי,"מט""ח",ישראל,ישראל,אחר,"מט""ח",2025-10-20,לא,2025-09-18,USD,אחר,אי-תלות,2025-09-30,145.0,1.0,-1442.12,0.2748,3.306,-0.0131,-0.000361,-3e-06
671,15224.0,"סולאיר אנרגיות מתחדשות בע""מ",516046307,ח.פ.,אפ לס סולאיר סדרה ב 25.12.2027,11722873,פנימי,מניה,ישראל,ישראל,אנרגיה מתחדשת,מניות לרבות מדדי מניות,2027-12-25,לא,2024-04-30,ILS,אחר,אי-תלות,2025-09-30,45.63,0.01,1.97,1109.37802,1.0,0.0219,0.000605,6e-06
671,15224.0,בזק,520031931,ח.פ.,CALL001 בזק 26/05/2026,IL0002300114,ISIN,מניה,"חו""ל",ישראל,אשראי חוץ בנקאי,מניות לרבות מדדי מניות,2026-05-26,לא,2025-05-27,ILS,אחר,אי-תלות,2025-09-30,551.6,1.0,207.62,634.7,1.0,1.31777,0.036425,0.000385
671,15224.0,"בנק הפועלים בע""מ",520000118,ח.פ.,פועלים 03.07.2026 CALL001,IL0006625771,ISIN,מניה,"חו""ל",ישראל,בנקים,מניות לרבות מדדי מניות,2026-07-03,לא,2025-07-03,ILS,אחר,אי-תלות,2025-09-30,6300.0,1.0,23.38,6732.0,1.0,1.57416,0.043512,0.00046
671,15224.0,"כלל החזקות עסקי ביטוח בע""מ",520036120,ח.פ.,CALL001 כלל 17.12.25,IL0002240146,ISIN,מניה,"חו""ל",ישראל,אשראי חוץ בנקאי,מניות לרבות מדדי מניות,2025-12-17,לא,2024-12-22,ILS,אחר,אי-תלות,2025-09-30,8629.0,1.0,4.58,16970.0,1.0,0.77654,0.021465,0.000227
671,15224.0,"ישראכרט בע""מ",510706153,ח.פ.,ישראכרט 07.05.2026 CALL001,IL0011574030,ISIN,מניה,"חו""ל",ישראל,אשראי חוץ בנקאי,מניות לרבות מדדי מניות,2026-05-07,לא,2025-05-07,ILS,אחר,אי-תלות,2025-09-30,1699.0,1.0,10.46,1338.0,1.0,0.13989,0.003866,4e-05
671,15224.0,"בנק לאומי לישראל בע""מ",520018078,ח.פ.,26.09.26 עסקת CALL לאומי,IL0006046119,ISIN,מניה,"חו""ל",ישראל,אשראי חוץ בנקאי,מניות לרבות מדדי מניות,2026-09-26,לא,2025-09-26,ILS,אחר,אי-תלות,2025-09-30,5965.0,1.0,47.14,6529.0,1.0,3.07758,0.08507,0.0009
671,15224.0,"בנק הפועלים בע""מ",520000118,ח.פ.,עסקת פועלים CALL 18.09.26,IL0006625771,ISIN,מניה,"חו""ל",ישראל,בנקים,מניות לרבות מדדי מניות,2026-09-18,לא,2025-09-18,ILS,אחר,אי-תלות,2025-09-30,6415.0,1.0,39.03,6732.0,1.0,2.62771,0.072635,0.000768
671,15224.0,"בנק דיסקונט לישראל בע""מ",520007030,ח.פ.,CALL001 דיסקונט 26.5.26,IL0006912120,ISIN,מניה,"חו""ל",ישראל,אשראי חוץ בנקאי,מניות לרבות מדדי מניות,2026-05-26,לא,2025-05-27,ILS,אחר,אי-תלות,2025-09-30,2952.0,1.0,49.18,3274.0,1.0,1.61008,0.044505,0.00047
671,15224.0,"מימון ישיר מקבוצת ישיר(2006) בע""מ",513893123,ח.פ.,מימון ישיר 26.03.2026 CALL001,IL0001168186,ISIN,מניה,"חו""ל",ישראל,אשראי חוץ בנקאי,מניות לרבות מדדי מניות,2026-03-26,לא,2025-03-26,ILS,אחר,אי-תלות,2025-09-30,53970.0,1.0,0.07,49390.0,1.0,0.03413,0.000943,9e-06
671,15224.0,"בנק לאומי לישראל בע""מ",520018078,ח.פ.,עסקת לאומי CALL 18.09.26,IL0006046119,ISIN,מניה,"חו""ל",ישראל,אשראי חוץ בנקאי,מניות לרבות מדדי מניות,2026-09-18,לא,2025-09-18,ILS,אחר,אי-תלות,2025-09-30,6235.0,1.0,40.04,6529.0,1.0,2.6142,0.072261,0.000764
671,15224.0,"בנק הפועלים בע""מ",520000118,ח.פ.,CALL001 פועלים 26.05.26,IL0006625771,ISIN,מניה,"חו""ל",ישראל,בנקים,מניות לרבות מדדי מניות,2026-05-26,לא,2025-05-27,ILS,אחר,אי-תלות,2025-09-30,5784.0,1.0,11.17,6732.0,1.0,0.75227,0.020794,0.00022
671,15224.0,"בנק הפועלים בע""מ",520000118,ח.פ.,CALL001 פועלים 23.07.26,IL0006625771,ISIN,מניה,"חו""ל",ישראל,בנקים,מניות לרבות מדדי מניות,2026-07-23,לא,2025-07-24,ILS,אחר,אי-תלות,2025-09-30,6465.76,1.0,18.3,6732.0,1.0,1.23222,0.03406,0.00036
671,15224.0,"בנק הפועלים בע""מ",520000118,ח.פ.,26.11.25 עסקת CALL פועלים,IL0006625771,ISIN,מניה,"חו""ל",ישראל,בנקים,מניות לרבות מדדי מניות,2025-11-26,לא,2024-11-30,ILS,אחר,אי-תלות,2025-09-30,4272.0,1.0,37.0,6732.0,1.0,2.49093,0.068854,0.000728
671,15224.0,"כלל החזקות עסקי ביטוח בע""מ",520036120,ח.פ.,CALL001 כלל 15.07.26,IL0002240146,ISIN,מניה,"חו""ל",ישראל,אשראי חוץ בנקאי,מניות לרבות מדדי מניות,2026-07-14,לא,2025-07-15,ILS,אחר,אי-תלות,2025-09-30,8629.0,1.0,5.63,16970.0,1.0,0.95515,0.026402,0.000279
671,15224.0,"מימון ישיר מקבוצת ישיר(2006) בע""מ",513893123,ח.פ.,מימון ישיר 21.09.2026 CALL001,IL0001168186,ISIN,מניה,"חו""ל",ישראל,אשראי חוץ בנקאי,מניות לרבות מדדי מניות,2026-09-21,לא,2025-09-21,ILS,אחר,אי-תלות,2025-09-30,45160.0,1.0,0.46,49390.0,1.0,0.22601,0.006247,6.6e-05
671,15224.0,"בנק הפועלים בע""מ",520000118,ח.פ.,26.09.2026 עסקת CALL פועלים,IL0006625771,ISIN,מניה,"חו""ל",ישראל,בנקים,מניות לרבות מדדי מניות,2026-09-26,לא,2025-09-26,ILS,אחר,אי-תלות,2025-09-30,6172.0,1.0,25.51,6732.0,1.0,1.7171,0.047464,0.000502
671,15224.0,"בנק הפועלים בע""מ",520000118,ח.פ.,עסקת CALL001 פועלים 12.08.2026,IL0006625771,ISIN,מניה,"חו""ל",ישראל,בנקים,מניות לרבות מדדי מניות,2026-08-12,לא,2025-08-13,ILS,אחר,אי-תלות,2025-09-30,6389.0,1.0,38.9,6732.0,1.0,2.61847,0.072379,0.000765
671,15224.0,בזק,520031931,ח.פ.,עסקת CALL בזק 29.01.26,IL0002300114,ISIN,מניה,"חו""ל",ישראל,אשראי חוץ בנקאי,מניות לרבות מדדי מניות,2026-01-29,לא,2025-01-30,ILS,אחר,אי-תלות,2025-09-30,1357.5756,1.0,288.29,634.7,1.0,1.82976,0.050578,0.000535
671,15224.0,"בנק לאומי לישראל בע""מ",520018078,ח.פ.,26.11.25 עסקת CALL לאומי,IL0006046119,ISIN,מניה,"חו""ל",ישראל,אשראי חוץ בנקאי,מניות לרבות מדדי מניות,2025-11-26,לא,2024-12-31,ILS,אחר,אי-תלות,2025-09-30,4259.0,1.0,58.02,6529.0,1.0,3.78835,0.104717,0.001108
671,15224.0,"בנק לאומי לישראל בע""מ",520018078,ח.פ.,עסקת CALL001 לאומי 12.08.2026,IL0006046119,ISIN,מניה,"חו""ל",ישראל,אשראי חוץ בנקאי,מניות לרבות מדדי מניות,2026-08-12,לא,2025-08-13,ILS,אחר,אי-תלות,2025-09-30,6157.0,1.0,37.54,6529.0,1.0,2.45108,0.067752,0.000716
671,15224.0,Odysight.ai Inc,549300FBP1ANSJE5TE25,LEI,אפ לס ODYS US 31/03/2026,620080903,פנימי,מניה,"חו""ל","ארה""ב","Electronic Equipment, Instruments & Components",מניות לרבות מדדי מניות,2026-03-31,לא,2023-03-27,USD,אחר,אי-תלות,2025-09-30,1.15,1.0,7.32,0.608,3.306,0.00015,4e-06,0.0
671,15224.0,Odysight.ai Inc,549300FBP1ANSJE5TE25,LEI,אפ לס ODYS US 31/03/2026,620080901,פנימי,מניה,"חו""ל","ארה""ב","Electronic Equipment, Instruments & Components",מניות לרבות מדדי מניות,2026-03-31,לא,2022-03-18,USD,אחר,אי-תלות,2025-09-30,5.5,1.0,5.28,0.0,3.306,0.0,0.0,0.0
671,7234.0,"אנלייט אנרגיה מתחדשת בע""מ",520041146,ח.פ.,CALL001 אנלייט 17.12.2025,IL0007200111,ISIN,מניה,ישראל,ישראל,אנרגיה מתחדשת,מניות לרבות מדדי מניות,2025-12-17,לא,2024-12-18,ILS,אחר,אי-תלות,2025-09-30,5869.0,1.0,12326.5,10190.0,1.0,1256.06993,0.027728,0.000445
671,7234.0,"אנלייט אנרגיה מתחדשת בע""מ",520041146,ח.פ.,CALL001 אנלייט 17.12.2025,IL0007200111,ISIN,מניה,ישראל,ישראל,אנרגיה מתחדשת,מניות לרבות מדדי מניות,2025-12-17,לא,2024-12-31,ILS,אחר,אי-תלות,2025-09-30,5869.0,1.0,37719.28,10190.0,1.0,3843.59513,0.084849,0.001362
671,7234.0,"אחים דוניץ בע""מ",520038605,ח.פ.,אפ לס דוניץ 31.12.25,IL0004000100,ISIN,מניה,ישראל,ישראל,בנייה,מניות לרבות מדדי מניות,2025-12-31,לא,2025-01-24,ILS,אחר,אי-תלות,2025-09-30,272.5,0.01,931.89,1076.583553,1.0,10.03256,0.000221,3e-06
671,7234.0,"טופ גאם תעשיות בע""מ",513561399,ח.פ.,אפ לס טופ גאם 31.01.2027,IL0011791428,ISIN,מניה,ישראל,ישראל,פודטק,מניות לרבות מדדי מניות,2027-01-31,לא,2025-07-31,ILS,אחר,אי-תלות,2025-09-30,1025.0,0.01,17372.44,125.559153,1.0,21.81269,0.000481,7e-06
671,7234.0,"קבוצת אקרו בע""מ",511996803,ח.פ.,אפ לס אקרו 05.08.2026,IL0011849028,ISIN,מניה,ישראל,ישראל,בנייה,מניות לרבות מדדי מניות,2026-08-05,לא,2025-04-07,ILS,אחר,אי-תלות,2025-09-30,70.0,0.01,573.84,123.307002,1.0,0.70759,1.5e-05,0.0
671,7234.0,"רוטשטיין נדל""ן בע""מ",520039959,ח.פ.,אפ לס בכספת-רוטשטין 26.07.2026,IL0005390153,ISIN,מניה,ישראל,ישראל,בנייה,מניות לרבות מדדי מניות,2026-07-26,לא,2025-01-28,ILS,אחר,אי-תלות,2025-09-30,73.0,0.01,4559.6,2363.490861,1.0,107.76563,0.002378,3.8e-05
671,7234.0,תחנות כח רמת חובב שותפות מוגבלת,540285947,ח.פ.,קיקר רמת חובב 30.06.40,10047344,טיקר,מניה,ישראל,ישראל,אנרגיה,אחר,2040-06-30,לא,2020-12-02,ILS,מומחה בלתי תלוי,אי-תלות,2025-09-30,0.0,1.0,38133.15,372.846983,1.0,142.17829,0.003138,5e-05
671,7234.0,"אשדוד התפלה בע""מ",514357060,ח.פ.,אשדוד התפלה קיקר,84666750,טיקר,מניה,ישראל,ישראל,תשתיות,אחר,2038-09-08,לא,2022-08-22,ILS,מומחה בלתי תלוי,אי-תלות,2025-09-30,0.0,1.0,80410.45,110.369898,1.0,88.74893,0.001959,3.1e-05
671,7234.0,"איי.פי.סי. ירושלים בע""מ",513731554,ח.פ.,איי.פי.סי-קיקר 03.09.29,10046044,טיקר,מניה,ישראל,ישראל,מלונאות ותיירות,אחר,2029-09-03,לא,2019-09-03,USD,מומחה בלתי תלוי,אי-תלות,2025-09-30,0.0,1.0,1908.65,239.875582,3.306,15.13611,0.000334,5e-06
671,7234.0,"אשדוד אנרגיה בע""מ",513846667,ח.פ.,אשדוד  ורמת נגב אנרגיה-קיקר 31.12.34,1004533,טיקר,מניה,ישראל,ישראל,אנרגיה,אחר,2034-12-31,לא,2019-03-06,ILS,מומחה בלתי תלוי,אי-תלות,2025-09-30,0.0,1.0,45147.42,108.8916,1.0,49.16175,0.001085,1.7e-05
671,7234.0,"סולאיר אנרגיות מתחדשות בע""מ",516046307,ח.פ.,אפ לס סולאיר סדרה ב 25.12.2027,11722873,פנימי,מניה,ישראל,ישראל,אנרגיה מתחדשת,מניות לרבות מדדי מניות,2027-12-25,לא,2024-04-30,ILS,אחר,אי-תלות,2025-09-30,45.63,0.01,2393.4,1109.37802,1.0,26.55185,0.000586,9e-06
671,7234.0,"מאיר חברה למכוניות ומשאיות בע""מ",510485261,ח.פ.,קבוצת מאיר-אופציה לא סחירה,340271,פנימי,מניה,ישראל,ישראל,השקעה ואחזקות,אחר,2026-06-30,לא,2023-12-31,ILS,מומחה בלתי תלוי,אי-תלות,2025-09-30,0.0,1.0,2947.03,8069.8607,1.0,237.82121,0.00525,8.4e-05
671,7234.0,CITI Bank,549300U8H3KN0K301B23,LEI,FXVOpt 145.0000 PUT USD-JPY 20.10.25,100120170,פנימי,"מט""ח",ישראל,ישראל,אחר,"מט""ח",2025-10-20,לא,2025-09-18,USD,אחר,אי-תלות,2025-09-30,145.0,1.0,-1189616.13,0.2748,3.306,-10.81067,-0.000237,-2e-06
671,7234.0,CITI Bank,549300U8H3KN0K301B23,LEI,FXVOpt 3.6800 CALL USD-PLN 30.10.25,100120432,פנימי,"מט""ח",ישראל,ישראל,אחר,"מט""ח",2025-10-30,לא,2025-09-29,USD,אחר,אי-תלות,2025-09-30,3.68,1.0,-216480.7,0.5646,3.306,-4.04126,-8.9e-05,-1e-06
671,7234.0,"סולאיר אנרגיות מתחדשות בע""מ",516046307,ח.פ.,אפ לס סולאיר סדרה א 25.12.2025,11722872,פנימי,מניה,ישראל,ישראל,אנרגיה מתחדשת,מניות לרבות מדדי מניות,2025-12-25,לא,2024-04-30,ILS,אחר,אי-תלות,2025-09-30,38.52,0.01,2393.4,788.722208,1.0,18.87727,0.000416,6e-06
671,7234.0,PowerGen,10128,פנימי,PowerGen Option,34100,פנימי,מניה,ישראל,ישראל,תשתיות,תשתיות,2027-01-24,לא,2024-03-18,ILS,מומחה בלתי תלוי,אי-תלות,2025-09-30,0.0,1.0,8.77,100.0,1.0,0.00877,0.0,0.0
671,7234.0,"בנק הפועלים בע""מ",520000118,ח.פ.,26.09.2026 עסקת CALL פועלים,IL0006625771,ISIN,מניה,"חו""ל",ישראל,בנקים,מניות לרבות מדדי מניות,2026-09-26,לא,2025-09-26,ILS,אחר,אי-תלות,2025-09-30,6172.0,1.0,30918.72,6732.0,1.0,2081.44821,0.045948,0.000738
671,7234.0,בזק,520031931,ח.פ.,CALL001 בזק 26/05/2026,IL0002300114,ISIN,מניה,"חו""ל",ישראל,אשראי חוץ בנקאי,מניות לרבות מדדי מניות,2026-05-26,לא,2025-05-27,ILS,אחר,אי-תלות,2025-09-30,551.6,1.0,251676.38,634.7,1.0,1597.38999,0.035263,0.000566
671,7234.0,"כלל החזקות עסקי ביטוח בע""מ",520036120,ח.פ.,CALL001 כלל 15.07.26,IL0002240146,ISIN,מניה,"חו""ל",ישראל,אשראי חוץ בנקאי,מניות לרבות מדדי מניות,2026-07-14,לא,2025-07-15,ILS,אחר,אי-תלות,2025-09-30,8629.0,1.0,6822.75,16970.0,1.0,1157.82118,0.025559,0.00041
671,7234.0,"בנק הפועלים בע""מ",520000118,ח.פ.,26.11.25 עסקת CALL פועלים,IL0006625771,ISIN,מניה,"חו""ל",ישראל,בנקים,מניות לרבות מדדי מניות,2025-11-26,לא,2024-11-30,ILS,אחר,אי-תלות,2025-09-30,4272.0,1.0,44852.67,6732.0,1.0,3019.48156,0.066656,0.00107
671,7234.0,"בנק הפועלים בע""מ",520000118,ח.פ.,פועלים 03.07.2026 CALL001,IL0006625771,ISIN,מניה,"חו""ל",ישראל,בנקים,מניות לרבות מדדי מניות,2026-07-03,לא,2025-07-03,ILS,אחר,אי-תלות,2025-09-30,6300.0,1.0,28344.93,6732.0,1.0,1908.1809,0.042123,0.000676
671,7234.0,"בנק הפועלים בע""מ",520000118,ח.פ.,עסקת פועלים CALL 18.09.26,IL0006625771,ISIN,מניה,"חו""ל",ישראל,בנקים,מניות לרבות מדדי מניות,2026-09-18,לא,2025-09-18,ILS,אחר,אי-תלות,2025-09-30,6415.0,1.0,47315.51,6732.0,1.0,3185.28045,0.070316,0.001129
671,7234.0,"בנק לאומי לישראל בע""מ",520018078,ח.פ.,עסקת CALL001 לאומי 12.08.2026,IL0006046119,ISIN,מניה,"חו""ל",ישראל,אשראי חוץ בנקאי,מניות לרבות מדדי מניות,2026-08-12,לא,2025-08-13,ILS,אחר,אי-תלות,2025-09-30,6157.0,1.0,45507.21,6529.0,1.0,2971.1656,0.065589,0.001053
671,7234.0,בזק,520031931,ח.פ.,עסקת CALL בזק 29.01.26,IL0002300114,ISIN,מניה,"חו""ל",ישראל,אשראי חוץ בנקאי,מניות לרבות מדדי מניות,2026-01-29,לא,2025-01-30,ILS,אחר,אי-תלות,2025-09-30,1357.5756,1.0,349458.08,634.7,1.0,2218.01044,0.048963,0.000786
671,7234.0,"בנק הפועלים בע""מ",520000118,ח.פ.,עסקת CALL001 פועלים 12.08.2026,IL0006625771,ISIN,מניה,"חו""ל",ישראל,בנקים,מניות לרבות מדדי מניות,2026-08-12,לא,2025-08-13,ILS,אחר,אי-תלות,2025-09-30,6389.0,1.0,47149.11,6732.0,1.0,3174.07782,0.070069,0.001125
671,7234.0,"כלל החזקות עסקי ביטוח בע""מ",520036120,ח.פ.,CALL001 כלל 17.12.25,IL0002240146,ISIN,מניה,"חו""ל",ישראל,אשראי חוץ בנקאי,מניות לרבות מדדי מניות,2025-12-17,לא,2024-12-22,ILS,אחר,אי-תלות,2025-09-30,8629.0,1.0,5546.95,16970.0,1.0,941.31804,0.02078,0.000333
671,7234.0,"בנק הפועלים בע""מ",520000118,ח.פ.,CALL001 פועלים 26.05.26,IL0006625771,ISIN,מניה,"חו""ל",ישראל,בנקים,מניות לרבות מדדי מניות,2026-05-26,לא,2025-05-27,ILS,אחר,אי-תלות,2025-09-30,5784.0,1.0,13545.66,6732.0,1.0,911.89389,0.02013,0.000323
671,7234.0,"בנק לאומי לישראל בע""מ",520018078,ח.פ.,26.11.25 עסקת CALL לאומי,IL0006046119,ISIN,מניה,"חו""ל",ישראל,אשראי חוץ בנקאי,מניות לרבות מדדי מניות,2025-11-26,לא,2024-12-31,ILS,אחר,אי-תלות,2025-09-30,4259.0,1.0,70335.37,6529.0,1.0,4592.19646,0.101374,0.001628
671,7234.0,"מימון ישיר מקבוצת ישיר(2006) בע""מ",513893123,ח.פ.,מימון ישיר 21.09.2026 CALL001,IL0001168186,ISIN,מניה,"חו""ל",ישראל,אשראי חוץ בנקאי,מניות לרבות מדדי מניות,2026-09-21,לא,2025-09-21,ILS,אחר,אי-תלות,2025-09-30,45160.0,1.0,554.7,49390.0,1.0,273.96404,0.006047,9.7e-05
671,7234.0,"בנק דיסקונט לישראל בע""מ",520007030,ח.פ.,CALL001 דיסקונט 26.5.26,IL0006912120,ISIN,מניה,"חו""ל",ישראל,אשראי חוץ בנקאי,מניות לרבות מדדי מניות,2026-05-26,לא,2025-05-27,ILS,אחר,אי-תלות,2025-09-30,2952.0,1.0,59612.56,3274.0,1.0,1951.71509,0.043085,0.000692
671,7234.0,"בנק לאומי לישראל בע""מ",520018078,ח.פ.,עסקת לאומי CALL 18.09.26,IL0006046119,ISIN,מניה,"חו""ל",ישראל,אשראי חוץ בנקאי,מניות לרבות מדדי מניות,2026-09-18,לא,2025-09-18,ILS,אחר,אי-תלות,2025-09-30,6235.0,1.0,48535.84,6529.0,1.0,3168.90529,0.069955,0.001123
671,7234.0,"מימון ישיר מקבוצת ישיר(2006) בע""מ",513893123,ח.פ.,מימון ישיר 26.03.2026 CALL001,IL0001168186,ISIN,מניה,"חו""ל",ישראל,אשראי חוץ בנקאי,מניות לרבות מדדי מניות,2026-03-26,לא,2025-03-26,ILS,אחר,אי-תלות,2025-09-30,53970.0,1.0,83.76,49390.0,1.0,41.36857,0.000913,1.4e-05
671,7234.0,"בנק הפועלים בע""מ",520000118,ח.פ.,CALL001 פועלים 23.07.26,IL0006625771,ISIN,מניה,"חו""ל",ישראל,בנקים,מניות לרבות מדדי מניות,2026-07-23,לא,2025-07-24,ILS,אחר,אי-תלות,2025-09-30,6465.76,1.0,22187.81,6732.0,1.0,1493.68368,0.032973,0.000529
671,7234.0,"ישראכרט בע""מ",510706153,ח.פ.,ישראכרט 07.05.2026 CALL001,IL0011574030,ISIN,מניה,"חו""ל",ישראל,אשראי חוץ בנקאי,מניות לרבות מדדי מניות,2026-05-07,לא,2025-05-07,ILS,אחר,אי-תלות,2025-09-30,1699.0,1.0,12673.9,1338.0,1.0,169.5768,0.003743,6e-05
671,7234.0,"בנק לאומי לישראל בע""מ",520018078,ח.פ.,26.09.26 עסקת CALL לאומי,IL0006046119,ISIN,מניה,"חו""ל",ישראל,אשראי חוץ בנקאי,מניות לרבות מדדי מניות,2026-09-26,לא,2025-09-26,ILS,אחר,אי-תלות,2025-09-30,5965.0,1.0,57139.04,6529.0,1.0,3730.60769,0.082354,0.001322
671,7234.0,ECO SUN ORADEA S.R.L,7659,פנימי,Ecoenergy Romania option  Melinesti,34139,פנימי,מניה,"חו""ל",רומניה,אנרגיה מתחדשת,תשתיות,2025-12-31,לא,2024-08-20,EUR,מומחה בלתי תלוי,אי-תלות,2025-09-30,0.0,1.0,0.58,2646000.0,3.8807,59.55632,0.001314,2.1e-05
671,7234.0,נאוויטס פטרוליום שותפות מוגבלת,550263107,ח.פ.,קיקר נאוויטס פטרוליום שותפות מוגבל,10048041,פנימי,מניה,"חו""ל","ארה""ב","Oil, Gas & Consumable Fuels",אחר,2027-04-01,לא,2022-11-24,USD,מומחה בלתי תלוי,אי-תלות,2025-09-30,0.0,1.0,25852.95,107.832586,3.306,92.16435,0.002034,3.2e-05
671,7234.0,Odysight.ai Inc,549300FBP1ANSJE5TE25,LEI,אפ לס ODYS US 31/03/2026,620080903,פנימי,מניה,"חו""ל","ארה""ב","Electronic Equipment, Instruments & Components",מניות לרבות מדדי מניות,2026-03-31,לא,2023-03-27,USD,אחר,אי-תלות,2025-09-30,1.15,1.0,8875.13,0.608,3.306,0.17841,3e-06,0.0
671,7234.0,ECO SUN ORADEA S.R.L,7659,פנימי,Ecoenergy Romania Bobisecti,34138,פנימי,מניה,"חו""ל",רומניה,אנרגיה מתחדשת,תשתיות,2025-12-31,לא,2024-08-20,EUR,מומחה בלתי תלוי,אי-תלות,2025-09-30,0.0,1.0,0.58,1700000.0,3.8807,38.2637,0.000844,1.3e-05
671,7234.0,ECO SUN ORADEA S.R.L,7659,פנימי,Ecoenergy Romania option Scurtu Mare,34137,פנימי,מניה,"חו""ל",רומניה,אנרגיה מתחדשת,תשתיות,2025-12-31,לא,2024-08-20,EUR,מומחה בלתי תלוי,אי-תלות,2025-09-30,0.0,1.0,0.58,2807000.0,3.8807,63.18012,0.001394,2.2e-05
671,7234.0,Odysight.ai Inc,549300FBP1ANSJE5TE25,LEI,אפ לס ODYS US 31/03/2026,620080901,פנימי,מניה,"חו""ל","ארה""ב","Electronic Equipment, Instruments & Components",מניות לרבות מדדי מניות,2026-03-31,לא,2022-03-18,USD,אחר,אי-תלות,2025-09-30,5.5,1.0,6402.97,0.0,3.306,0.0,0.0,0.0
671,7234.0,יבולי שמש,515689198,ח.פ.,יבולי שמש אופציה,34140,פנימי,מניה,"חו""ל",רומניה,אנרגיה מתחדשת,תשתיות,2025-12-31,לא,2024-08-20,EUR,מומחה בלתי תלוי,אי-תלות,2025-09-30,0.0,1.0,0.08,148000000.0,3.8807,485.30502,0.010713,0.000172
671,7234.0,ECO SUN ORADEA S.R.L,7659,פנימי,אקואנרגי רומניה 7.25% אירו 31.03.24-אופ ל.ס אורדאה,340292,פנימי,מניה,"חו""ל",רומניה,אנרגיה מתחדשת,תשתיות,2025-12-31,לא,2023-12-31,EUR,מומחה בלתי תלוי,אי-תלות,2025-09-30,0.0,1.0,80422.85,54.089135,3.8807,168.81054,0.003726,5.9e-05
671,7235.0,"אנלייט אנרגיה מתחדשת בע""מ",520041146,ח.פ.,CALL001 אנלייט 17.12.2025,IL0007200111,ISIN,מניה,ישראל,ישראל,אנרגיה מתחדשת,מניות לרבות מדדי מניות,2025-12-17,לא,2024-12-18,ILS,אחר,אי-תלות,2025-09-30,5869.0,1.0,2434.52,10190.0,1.0,248.07789,0.028148,0.000394
671,7235.0,"אנלייט אנרגיה מתחדשת בע""מ",520041146,ח.פ.,CALL001 אנלייט 17.12.2025,IL0007200111,ISIN,מניה,ישראל,ישראל,אנרגיה מתחדשת,מניות לרבות מדדי מניות,2025-12-17,לא,2024-12-31,ILS,אחר,אי-תלות,2025-09-30,5869.0,1.0,7449.68,10190.0,1.0,759.12252,0.086135,0.001206
671,7235.0,"טופ גאם תעשיות בע""מ",513561399,ח.פ.,אפ לס טופ גאם 31.01.2027,IL0011791428,ISIN,מניה,ישראל,ישראל,פודטק,מניות לרבות מדדי מניות,2027-01-31,לא,2025-07-31,ILS,אחר,אי-תלות,2025-09-30,1025.0,0.01,3431.11,125.559153,1.0,4.30808,0.000488,6e-06
671,7235.0,"אחים דוניץ בע""מ",520038605,ח.פ.,אפ לס דוניץ 31.12.25,IL0004000100,ISIN,מניה,ישראל,ישראל,בנייה,מניות לרבות מדדי מניות,2025-12-31,לא,2025-01-24,ILS,אחר,אי-תלות,2025-09-30,272.5,0.01,184.05,1076.583553,1.0,1.98146,0.000224,3e-06
671,7235.0,"רוטשטיין נדל""ן בע""מ",520039959,ח.פ.,אפ לס בכספת-רוטשטין 26.07.2026,IL0005390153,ISIN,מניה,ישראל,ישראל,בנייה,מניות לרבות מדדי מניות,2026-07-26,לא,2025-01-28,ILS,אחר,אי-תלות,2025-09-30,73.0,0.01,900.53,2363.490861,1.0,21.28406,0.002415,3.3e-05
671,7235.0,"קבוצת אקרו בע""מ",511996803,ח.פ.,אפ לס אקרו 05.08.2026,IL0011849028,ISIN,מניה,ישראל,ישראל,בנייה,מניות לרבות מדדי מניות,2026-08-05,לא,2025-04-07,ILS,אחר,אי-תלות,2025-09-30,70.0,0.01,113.34,123.307002,1.0,0.13975,1.5e-05,0.0
671,7235.0,"אשדוד אנרגיה בע""מ",513846667,ח.פ.,אשדוד  ורמת נגב אנרגיה-קיקר 31.12.34,1004533,טיקר,מניה,ישראל,ישראל,אנרגיה,אחר,2034-12-31,לא,2019-03-06,ILS,מומחה בלתי תלוי,אי-תלות,2025-09-30,0.0,1.0,7895.02,108.8916,1.0,8.59701,0.000975,1.3e-05
671,7235.0,"איי.פי.סי. ירושלים בע""מ",513731554,ח.פ.,איי.פי.סי-קיקר 03.09.29,10046044,טיקר,מניה,ישראל,ישראל,מלונאות ותיירות,אחר,2029-09-03,לא,2019-09-03,USD,מומחה בלתי תלוי,אי-תלות,2025-09-30,0.0,1.0,333.77,239.875582,3.306,2.64688,0.0003,4e-06
671,7235.0,תחנות כח רמת חובב שותפות מוגבלת,540285947,ח.פ.,קיקר רמת חובב 30.06.40,10047344,טיקר,מניה,ישראל,ישראל,אנרגיה,אחר,2040-06-30,לא,2020-12-02,ILS,מומחה בלתי תלוי,אי-תלות,2025-09-30,0.0,1.0,6668.42,372.846983,1.0,24.863,0.002821,3.9e-05
671,7235.0,"אשדוד התפלה בע""מ",514357060,ח.פ.,אשדוד התפלה קיקר,84666750,טיקר,מניה,ישראל,ישראל,תשתיות,אחר,2038-09-08,לא,2022-08-22,ILS,מומחה בלתי תלוי,אי-תלות,2025-09-30,0.0,1.0,14061.53,110.369898,1.0,15.5197,0.00176,2.4e-05
671,7235.0,"סולאיר אנרגיות מתחדשות בע""מ",516046307,ח.פ.,אפ לס סולאיר סדרה ב 25.12.2027,11722873,פנימי,מניה,ישראל,ישראל,אנרגיה מתחדשת,מניות לרבות מדדי מניות,2027-12-25,לא,2024-04-30,ILS,אחר,אי-תלות,2025-09-30,45.63,0.01,472.7,1109.37802,1.0,5.24408,0.000595,8e-06
671,7235.0,"סולאיר אנרגיות מתחדשות בע""מ",516046307,ח.פ.,אפ לס סולאיר סדרה א 25.12.2025,11722872,פנימי,מניה,ישראל,ישראל,אנרגיה מתחדשת,מניות לרבות מדדי מניות,2025-12-25,לא,2024-04-30,ILS,אחר,אי-תלות,2025-09-30,38.52,0.01,472.7,788.722208,1.0,3.72832,0.000423,5e-06
671,7235.0,CITI Bank,549300U8H3KN0K301B23,LEI,FXVOpt 145.0000 PUT USD-JPY 20.10.25,100120170,פנימי,"מט""ח",ישראל,ישראל,אחר,"מט""ח",2025-10-20,לא,2025-09-18,USD,אחר,אי-תלות,2025-09-30,145.0,1.0,-261347.15,0.2748,3.306,-2.375,-0.000268,-3e-06
671,7235.0,CITI Bank,549300U8H3KN0K301B23,LEI,FXVOpt 3.6800 CALL USD-PLN 30.10.25,100120432,פנימי,"מט""ח",ישראל,ישראל,אחר,"מט""ח",2025-10-30,לא,2025-09-29,USD,אחר,אי-תלות,2025-09-30,3.68,1.0,-84811.2,0.5646,3.306,-1.58325,-0.000179,-2e-06
671,7235.0,"בנק הפועלים בע""מ",520000118,ח.פ.,עסקת פועלים CALL 18.09.26,IL0006625771,ISIN,מניה,"חו""ל",ישראל,בנקים,מניות לרבות מדדי מניות,2026-09-18,לא,2025-09-18,ILS,אחר,אי-תלות,2025-09-30,6415.0,1.0,9344.97,6732.0,1.0,629.10323,0.071382,0.000999
671,7235.0,"בנק לאומי לישראל בע""מ",520018078,ח.פ.,עסקת CALL001 לאומי 12.08.2026,IL0006046119,ISIN,מניה,"חו""ל",ישראל,אשראי חוץ בנקאי,מניות לרבות מדדי מניות,2026-08-12,לא,2025-08-13,ILS,אחר,אי-תלות,2025-09-30,6157.0,1.0,8987.82,6529.0,1.0,586.81485,0.066584,0.000932
671,7235.0,"בנק הפועלים בע""מ",520000118,ח.פ.,26.11.25 עסקת CALL פועלים,IL0006625771,ISIN,מניה,"חו""ל",ישראל,בנקים,מניות לרבות מדדי מניות,2025-11-26,לא,2024-11-30,ILS,אחר,אי-תלות,2025-09-30,4272.0,1.0,8858.55,6732.0,1.0,596.35741,0.067667,0.000947
671,7235.0,"בנק הפועלים בע""מ",520000118,ח.פ.,CALL001 פועלים 26.05.26,IL0006625771,ISIN,מניה,"חו""ל",ישראל,בנקים,מניות לרבות מדדי מניות,2026-05-26,לא,2025-05-27,ILS,אחר,אי-תלות,2025-09-30,5784.0,1.0,2675.31,6732.0,1.0,180.102,0.020435,0.000286
671,7235.0,"בנק לאומי לישראל בע""מ",520018078,ח.פ.,26.09.26 עסקת CALL לאומי,IL0006046119,ISIN,מניה,"חו""ל",ישראל,אשראי חוץ בנקאי,מניות לרבות מדדי מניות,2026-09-26,לא,2025-09-26,ILS,אחר,אי-תלות,2025-09-30,5965.0,1.0,11285.15,6529.0,1.0,736.80713,0.083603,0.00117
671,7235.0,"בנק הפועלים בע""מ",520000118,ח.פ.,CALL001 פועלים 23.07.26,IL0006625771,ISIN,מניה,"חו""ל",ישראל,בנקים,מניות לרבות מדדי מניות,2026-07-23,לא,2025-07-24,ILS,אחר,אי-תלות,2025-09-30,6465.76,1.0,4382.17,6732.0,1.0,295.00738,0.033473,0.000468
671,7235.0,בזק,520031931,ח.פ.,עסקת CALL בזק 29.01.26,IL0002300114,ISIN,מניה,"חו""ל",ישראל,אשראי חוץ בנקאי,מניות לרבות מדדי מניות,2026-01-29,לא,2025-01-30,ILS,אחר,אי-תלות,2025-09-30,1357.5756,1.0,69019.11,634.7,1.0,438.06426,0.049706,0.000696
671,7235.0,"בנק לאומי לישראל בע""מ",520018078,ח.פ.,26.11.25 עסקת CALL לאומי,IL0006046119,ISIN,מניה,"חו""ל",ישראל,אשראי חוץ בנקאי,מניות לרבות מדדי מניות,2025-11-26,לא,2024-12-31,ILS,אחר,אי-תלות,2025-09-30,4259.0,1.0,13891.46,6529.0,1.0,906.97371,0.102912,0.001441
671,7235.0,"בנק לאומי לישראל בע""מ",520018078,ח.פ.,עסקת לאומי CALL 18.09.26,IL0006046119,ISIN,מניה,"חו""ל",ישראל,אשראי חוץ בנקאי,מניות לרבות מדדי מניות,2026-09-18,לא,2025-09-18,ILS,אחר,אי-תלות,2025-09-30,6235.0,1.0,9585.99,6529.0,1.0,625.86908,0.071015,0.000994
671,7235.0,"כלל החזקות עסקי ביטוח בע""מ",520036120,ח.פ.,CALL001 כלל 15.07.26,IL0002240146,ISIN,מניה,"חו""ל",ישראל,אשראי חוץ בנקאי,מניות לרבות מדדי מניות,2026-07-14,לא,2025-07-15,ILS,אחר,אי-תלות,2025-09-30,8629.0,1.0,1347.52,16970.0,1.0,228.67344,0.025947,0.000363
671,7235.0,בזק,520031931,ח.פ.,CALL001 בזק 26/05/2026,IL0002300114,ISIN,מניה,"חו""ל",ישראל,אשראי חוץ בנקאי,מניות לרבות מדדי מניות,2026-05-26,לא,2025-05-27,ILS,אחר,אי-תלות,2025-09-30,551.6,1.0,49706.9,634.7,1.0,315.48971,0.035797,0.000501
671,7235.0,"בנק הפועלים בע""מ",520000118,ח.פ.,26.09.2026 עסקת CALL פועלים,IL0006625771,ISIN,מניה,"חו""ל",ישראל,בנקים,מניות לרבות מדדי מניות,2026-09-26,לא,2025-09-26,ILS,אחר,אי-תלות,2025-09-30,6172.0,1.0,6106.55,6732.0,1.0,411.09278,0.046645,0.000653
671,7235.0,"מימון ישיר מקבוצת ישיר(2006) בע""מ",513893123,ח.פ.,מימון ישיר 21.09.2026 CALL001,IL0001168186,ISIN,מניה,"חו""ל",ישראל,אשראי חוץ בנקאי,מניות לרבות מדדי מניות,2026-09-21,לא,2025-09-21,ILS,אחר,אי-תלות,2025-09-30,45160.0,1.0,109.55,49390.0,1.0,54.10879,0.006139,8.5e-05
671,7235.0,"בנק הפועלים בע""מ",520000118,ח.פ.,פועלים 03.07.2026 CALL001,IL0006625771,ISIN,מניה,"חו""ל",ישראל,בנקים,מניות לרבות מדדי מניות,2026-07-03,לא,2025-07-03,ILS,אחר,אי-תלות,2025-09-30,6300.0,1.0,5598.22,6732.0,1.0,376.87192,0.042762,0.000598
671,7235.0,"ישראכרט בע""מ",510706153,ח.פ.,ישראכרט 07.05.2026 CALL001,IL0011574030,ISIN,מניה,"חו""ל",ישראל,אשראי חוץ בנקאי,מניות לרבות מדדי מניות,2026-05-07,לא,2025-05-07,ILS,אחר,אי-תלות,2025-09-30,1699.0,1.0,2503.14,1338.0,1.0,33.49197,0.0038,5.3e-05
671,7235.0,"בנק הפועלים בע""מ",520000118,ח.פ.,עסקת CALL001 פועלים 12.08.2026,IL0006625771,ISIN,מניה,"חו""ל",ישראל,בנקים,מניות לרבות מדדי מניות,2026-08-12,לא,2025-08-13,ILS,אחר,אי-תלות,2025-09-30,6389.0,1.0,9312.1,6732.0,1.0,626.89068,0.071131,0.000996
671,7235.0,"בנק דיסקונט לישראל בע""מ",520007030,ח.פ.,CALL001 דיסקונט 26.5.26,IL0006912120,ISIN,מניה,"חו""ל",ישראל,אשראי חוץ בנקאי,מניות לרבות מדדי מניות,2026-05-26,לא,2025-05-27,ILS,אחר,אי-תלות,2025-09-30,2952.0,1.0,11773.67,3274.0,1.0,385.47007,0.043738,0.000612
671,7235.0,"כלל החזקות עסקי ביטוח בע""מ",520036120,ח.פ.,CALL001 כלל 17.12.25,IL0002240146,ISIN,מניה,"חו""ל",ישראל,אשראי חוץ בנקאי,מניות לרבות מדדי מניות,2025-12-17,לא,2024-12-22,ILS,אחר,אי-תלות,2025-09-30,8629.0,1.0,1095.54,16970.0,1.0,185.91337,0.021095,0.000295
671,7235.0,"מימון ישיר מקבוצת ישיר(2006) בע""מ",513893123,ח.פ.,מימון ישיר 26.03.2026 CALL001,IL0001168186,ISIN,מניה,"חו""ל",ישראל,אשראי חוץ בנקאי,מניות לרבות מדדי מניות,2026-03-26,לא,2025-03-26,ILS,אחר,אי-תלות,2025-09-30,53970.0,1.0,16.54,49390.0,1.0,8.17043,0.000927,1.2e-05
671,7235.0,Odysight.ai Inc,549300FBP1ANSJE5TE25,LEI,אפ לס ODYS US 31/03/2026,620080901,פנימי,מניה,"חו""ל","ארה""ב","Electronic Equipment, Instruments & Components",מניות לרבות מדדי מניות,2026-03-31,לא,2022-03-18,USD,אחר,אי-תלות,2025-09-30,5.5,1.0,1264.61,0.0,3.306,0.0,0.0,0.0
671,7235.0,נאוויטס פטרוליום שותפות מוגבלת,550263107,ח.פ.,קיקר נאוויטס פטרוליום שותפות מוגבל,10048041,פנימי,מניה,"חו""ל","ארה""ב","Oil, Gas & Consumable Fuels",אחר,2027-04-01,לא,2022-11-24,USD,מומחה בלתי תלוי,אי-תלות,2025-09-30,0.0,1.0,4308.82,107.832586,3.306,15.3607,0.001742,2.4e-05
671,7235.0,Odysight.ai Inc,549300FBP1ANSJE5TE25,LEI,אפ לס ODYS US 31/03/2026,620080903,פנימי,מניה,"חו""ל","ארה""ב","Electronic Equipment, Instruments & Components",מניות לרבות מדדי מניות,2026-03-31,לא,2023-03-27,USD,אחר,אי-תלות,2025-09-30,1.15,1.0,1752.87,0.608,3.306,0.03524,3e-06,0.0
671,7235.0,יבולי שמש,515689198,ח.פ.,יבולי שמש אופציה,34140,פנימי,מניה,"חו""ל",רומניה,אנרגיה מתחדשת,תשתיות,2025-12-31,לא,2024-08-20,EUR,מומחה בלתי תלוי,אי-תלות,2025-09-30,0.0,1.0,0.01,148000000.0,3.8807,84.86624,0.009629,0.000134
671,7236.0,"אנלייט אנרגיה מתחדשת בע""מ",520041146,ח.פ.,CALL001 אנלייט 17.12.2025,IL0007200111,ISIN,מניה,ישראל,ישראל,אנרגיה מתחדשת,מניות לרבות מדדי מניות,2025-12-17,לא,2024-12-31,ILS,אחר,אי-תלות,2025-09-30,5869.0,1.0,1429.1,10190.0,1.0,145.62518,0.08201,0.000702
671,7236.0,"רוטשטיין נדל""ן בע""מ",520039959,ח.פ.,אפ לס בכספת-רוטשטין 26.07.2026,IL0005390153,ISIN,מניה,ישראל,ישראל,בנייה,מניות לרבות מדדי מניות,2026-07-26,לא,2025-01-28,ILS,אחר,אי-תלות,2025-09-30,73.0,0.01,172.75,2363.490861,1.0,4.083,0.002299,1.9e-05
671,7236.0,"אנלייט אנרגיה מתחדשת בע""מ",520041146,ח.פ.,CALL001 אנלייט 17.12.2025,IL0007200111,ISIN,מניה,ישראל,ישראל,אנרגיה מתחדשת,מניות לרבות מדדי מניות,2025-12-17,לא,2024-12-18,ILS,אחר,אי-תלות,2025-09-30,5869.0,1.0,467.02,10190.0,1.0,47.58967,0.0268,0.000229
671,7236.0,"טופ גאם תעשיות בע""מ",513561399,ח.פ.,אפ לס טופ גאם 31.01.2027,IL0011791428,ISIN,מניה,ישראל,ישראל,פודטק,מניות לרבות מדדי מניות,2027-01-31,לא,2025-07-31,ILS,אחר,אי-תלות,2025-09-30,1025.0,0.01,658.2,125.559153,1.0,0.82643,0.000465,3e-06
671,7236.0,"אחים דוניץ בע""מ",520038605,ח.פ.,אפ לס דוניץ 31.12.25,IL0004000100,ISIN,מניה,ישראל,ישראל,בנייה,מניות לרבות מדדי מניות,2025-12-31,לא,2025-01-24,ILS,אחר,אי-תלות,2025-09-30,272.5,0.01,35.31,1076.583553,1.0,0.38011,0.000214,1e-06
671,7236.0,"קבוצת אקרו בע""מ",511996803,ח.פ.,אפ לס אקרו 05.08.2026,IL0011849028,ISIN,מניה,ישראל,ישראל,בנייה,מניות לרבות מדדי מניות,2026-08-05,לא,2025-04-07,ILS,אחר,אי-תלות,2025-09-30,70.0,0.01,21.74,123.307002,1.0,0.02681,1.5e-05,0.0
671,7236.0,תחנות כח רמת חובב שותפות מוגבלת,540285947,ח.פ.,קיקר רמת חובב 30.06.40,10047344,טיקר,מניה,ישראל,ישראל,אנרגיה,אחר,2040-06-30,לא,2020-12-02,ILS,מומחה בלתי תלוי,אי-תלות,2025-09-30,0.0,1.0,5113.84,372.846983,1.0,19.0668,0.010737,9.1e-05
671,7236.0,"אשדוד אנרגיה בע""מ",513846667,ח.פ.,אשדוד  ורמת נגב אנרגיה-קיקר 31.12.34,1004533,טיקר,מניה,ישראל,ישראל,אנרגיה,אחר,2034-12-31,לא,2019-03-06,ILS,מומחה בלתי תלוי,אי-תלות,2025-09-30,0.0,1.0,6054.49,108.8916,1.0,6.59283,0.003712,3.1e-05
671,7236.0,"אשדוד התפלה בע""מ",514357060,ח.פ.,אשדוד התפלה קיקר,84666750,טיקר,מניה,ישראל,ישראל,תשתיות,אחר,2038-09-08,לא,2022-08-22,ILS,מומחה בלתי תלוי,אי-תלות,2025-09-30,0.0,1.0,10783.43,110.369898,1.0,11.90166,0.006702,5.7e-05
671,7236.0,"איי.פי.סי. ירושלים בע""מ",513731554,ח.פ.,איי.פי.סי-קיקר 03.09.29,10046044,טיקר,מניה,ישראל,ישראל,מלונאות ותיירות,אחר,2029-09-03,לא,2019-09-03,USD,מומחה בלתי תלוי,אי-תלות,2025-09-30,0.0,1.0,255.96,239.875582,3.306,2.02983,0.001143,9e-06
671,7236.0,"סולאיר אנרגיות מתחדשות בע""מ",516046307,ח.פ.,אפ לס סולאיר סדרה א 25.12.2025,11722872,פנימי,מניה,ישראל,ישראל,אנרגיה מתחדשת,מניות לרבות מדדי מניות,2025-12-25,לא,2024-04-30,ILS,אחר,אי-תלות,2025-09-30,38.52,0.01,90.68,788.722208,1.0,0.71522,0.000402,3e-06
671,7236.0,CITI Bank,549300U8H3KN0K301B23,LEI,FXVOpt 145.0000 PUT USD-JPY 20.10.25,100120170,פנימי,"מט""ח",ישראל,ישראל,אחר,"מט""ח",2025-10-20,לא,2025-09-18,USD,אחר,אי-תלות,2025-09-30,145.0,1.0,-38480.23,0.2748,3.306,-0.34969,-0.000196,-1e-06
671,7236.0,CITI Bank,549300U8H3KN0K301B23,LEI,FXVOpt 3.6800 CALL USD-PLN 30.10.25,100120432,פנימי,"מט""ח",ישראל,ישראל,אחר,"מט""ח",2025-10-30,לא,2025-09-29,USD,אחר,אי-תלות,2025-09-30,3.68,1.0,-6896.35,0.5646,3.306,-0.12874,-7.2e-05,0.0
671,7236.0,"סולאיר אנרגיות מתחדשות בע""מ",516046307,ח.פ.,אפ לס סולאיר סדרה ב 25.12.2027,11722873,פנימי,מניה,ישראל,ישראל,אנרגיה מתחדשת,מניות לרבות מדדי מניות,2027-12-25,לא,2024-04-30,ILS,אחר,אי-תלות,2025-09-30,45.63,0.01,90.68,1109.37802,1.0,1.00599,0.000566,4e-06
671,7236.0,בזק,520031931,ח.פ.,עסקת CALL בזק 29.01.26,IL0002300114,ISIN,מניה,"חו""ל",ישראל,אשראי חוץ בנקאי,מניות לרבות מדדי מניות,2026-01-29,לא,2025-01-30,ILS,אחר,אי-תלות,2025-09-30,1357.5756,1.0,13240.18,634.7,1.0,84.03543,0.047325,0.000405
671,7236.0,"מימון ישיר מקבוצת ישיר(2006) בע""מ",513893123,ח.פ.,מימון ישיר 21.09.2026 CALL001,IL0001168186,ISIN,מניה,"חו""ל",ישראל,אשראי חוץ בנקאי,מניות לרבות מדדי מניות,2026-09-21,לא,2025-09-21,ILS,אחר,אי-תלות,2025-09-30,45160.0,1.0,21.02,49390.0,1.0,10.37988,0.005845,5e-05
671,7236.0,"בנק לאומי לישראל בע""מ",520018078,ח.פ.,עסקת לאומי CALL 18.09.26,IL0006046119,ISIN,מניה,"חו""ל",ישראל,אשראי חוץ בנקאי,מניות לרבות מדדי מניות,2026-09-18,לא,2025-09-18,ILS,אחר,אי-תלות,2025-09-30,6235.0,1.0,1838.91,6529.0,1.0,120.0627,0.067614,0.000579
671,7236.0,"ישראכרט בע""מ",510706153,ח.פ.,ישראכרט 07.05.2026 CALL001,IL0011574030,ISIN,מניה,"חו""ל",ישראל,אשראי חוץ בנקאי,מניות לרבות מדדי מניות,2026-05-07,לא,2025-05-07,ILS,אחר,אי-תלות,2025-09-30,1699.0,1.0,480.19,1338.0,1.0,6.42488,0.003618,3e-05
671,7236.0,"בנק לאומי לישראל בע""מ",520018078,ח.פ.,עסקת CALL001 לאומי 12.08.2026,IL0006046119,ISIN,מניה,"חו""ל",ישראל,אשראי חוץ בנקאי,מניות לרבות מדדי מניות,2026-08-12,לא,2025-08-13,ILS,אחר,אי-תלות,2025-09-30,6157.0,1.0,1724.17,6529.0,1.0,112.57079,0.063395,0.000542
671,7236.0,"בנק לאומי לישראל בע""מ",520018078,ח.פ.,26.09.26 עסקת CALL לאומי,IL0006046119,ISIN,מניה,"חו""ל",ישראל,אשראי חוץ בנקאי,מניות לרבות מדדי מניות,2026-09-26,לא,2025-09-26,ILS,אחר,אי-תלות,2025-09-30,5965.0,1.0,2164.87,6529.0,1.0,141.34434,0.079599,0.000681
671,7236.0,"בנק הפועלים בע""מ",520000118,ח.פ.,פועלים 03.07.2026 CALL001,IL0006625771,ISIN,מניה,"חו""ל",ישראל,בנקים,מניות לרבות מדדי מניות,2026-07-03,לא,2025-07-03,ILS,אחר,אי-תלות,2025-09-30,6300.0,1.0,1073.93,6732.0,1.0,72.29669,0.040714,0.000348
671,7236.0,"בנק הפועלים בע""מ",520000118,ח.פ.,26.09.2026 עסקת CALL פועלים,IL0006625771,ISIN,מניה,"חו""ל",ישראל,בנקים,מניות לרבות מדדי מניות,2026-09-26,לא,2025-09-26,ILS,אחר,אי-תלות,2025-09-30,6172.0,1.0,1171.44,6732.0,1.0,78.86139,0.044411,0.00038
671,7236.0,בזק,520031931,ח.פ.,CALL001 בזק 26/05/2026,IL0002300114,ISIN,מניה,"חו""ל",ישראל,אשראי חוץ בנקאי,מניות לרבות מדדי מניות,2026-05-26,לא,2025-05-27,ILS,אחר,אי-תלות,2025-09-30,551.6,1.0,9535.45,634.7,1.0,60.52152,0.034083,0.000291
671,7236.0,"בנק הפועלים בע""מ",520000118,ח.פ.,עסקת פועלים CALL 18.09.26,IL0006625771,ISIN,מניה,"חו""ל",ישראל,בנקים,מניות לרבות מדדי מניות,2026-09-18,לא,2025-09-18,ILS,אחר,אי-תלות,2025-09-30,6415.0,1.0,1792.68,6732.0,1.0,120.68312,0.067964,0.000582
671,7236.0,"בנק הפועלים בע""מ",520000118,ח.פ.,26.11.25 עסקת CALL פועלים,IL0006625771,ISIN,מניה,"חו""ל",ישראל,בנקים,מניות לרבות מדדי מניות,2025-11-26,לא,2024-11-30,ILS,אחר,אי-תלות,2025-09-30,4272.0,1.0,1699.37,6732.0,1.0,114.40137,0.064426,0.000551
671,7236.0,"בנק לאומי לישראל בע""מ",520018078,ח.פ.,26.11.25 עסקת CALL לאומי,IL0006046119,ISIN,מניה,"חו""ל",ישראל,אשראי חוץ בנקאי,מניות לרבות מדדי מניות,2025-11-26,לא,2024-12-31,ILS,אחר,אי-תלות,2025-09-30,4259.0,1.0,2664.85,6529.0,1.0,173.988,0.097983,0.000839
671,7236.0,"מימון ישיר מקבוצת ישיר(2006) בע""מ",513893123,ח.פ.,מימון ישיר 26.03.2026 CALL001,IL0001168186,ISIN,מניה,"חו""ל",ישראל,אשראי חוץ בנקאי,מניות לרבות מדדי מניות,2026-03-26,לא,2025-03-26,ILS,אחר,אי-תלות,2025-09-30,53970.0,1.0,3.17,49390.0,1.0,1.56736,0.000882,7e-06
671,7236.0,"כלל החזקות עסקי ביטוח בע""מ",520036120,ח.פ.,CALL001 כלל 15.07.26,IL0002240146,ISIN,מניה,"חו""ל",ישראל,אשראי חוץ בנקאי,מניות לרבות מדדי מניות,2026-07-14,לא,2025-07-15,ILS,אחר,אי-תלות,2025-09-30,8629.0,1.0,258.5,16970.0,1.0,43.86724,0.024704,0.000211
671,7236.0,"כלל החזקות עסקי ביטוח בע""מ",520036120,ח.פ.,CALL001 כלל 17.12.25,IL0002240146,ISIN,מניה,"חו""ל",ישראל,אשראי חוץ בנקאי,מניות לרבות מדדי מניות,2025-12-17,לא,2024-12-22,ILS,אחר,אי-תלות,2025-09-30,8629.0,1.0,210.16,16970.0,1.0,35.66442,0.020084,0.000171
671,7236.0,"בנק הפועלים בע""מ",520000118,ח.פ.,CALL001 פועלים 23.07.26,IL0006625771,ISIN,מניה,"חו""ל",ישראל,בנקים,מניות לרבות מדדי מניות,2026-07-23,לא,2025-07-24,ILS,אחר,אי-תלות,2025-09-30,6465.76,1.0,840.65,6732.0,1.0,56.59232,0.03187,0.000272
671,7236.0,"בנק דיסקונט לישראל בע""מ",520007030,ח.פ.,CALL001 דיסקונט 26.5.26,IL0006912120,ISIN,מניה,"חו""ל",ישראל,אשראי חוץ בנקאי,מניות לרבות מדדי מניות,2026-05-26,לא,2025-05-27,ILS,אחר,אי-תלות,2025-09-30,2952.0,1.0,2258.59,3274.0,1.0,73.9461,0.041643,0.000356
671,7236.0,"בנק הפועלים בע""מ",520000118,ח.פ.,עסקת CALL001 פועלים 12.08.2026,IL0006625771,ISIN,מניה,"חו""ל",ישראל,בנקים,מניות לרבות מדדי מניות,2026-08-12,לא,2025-08-13,ILS,אחר,אי-תלות,2025-09-30,6389.0,1.0,1786.37,6732.0,1.0,120.25868,0.067725,0.000579
671,7236.0,"בנק הפועלים בע""מ",520000118,ח.פ.,CALL001 פועלים 26.05.26,IL0006625771,ISIN,מניה,"חו""ל",ישראל,בנקים,מניות לרבות מדדי מניות,2026-05-26,לא,2025-05-27,ILS,אחר,אי-תלות,2025-09-30,5784.0,1.0,513.21,6732.0,1.0,34.54961,0.019457,0.000166
671,7236.0,יבולי שמש,515689198,ח.פ.,יבולי שמש אופציה,34140,פנימי,מניה,"חו""ל",רומניה,אנרגיה מתחדשת,תשתיות,2025-12-31,לא,2024-08-20,EUR,מומחה בלתי תלוי,אי-תלות,2025-09-30,0.0,1.0,0.01,148000000.0,3.8807,65.08176,0.036651,0.000313
671,7236.0,Odysight.ai Inc,549300FBP1ANSJE5TE25,LEI,אפ לס ODYS US 31/03/2026,620080901,פנימי,מניה,"חו""ל","ארה""ב","Electronic Equipment, Instruments & Components",מניות לרבות מדדי מניות,2026-03-31,לא,2022-03-18,USD,אחר,אי-תלות,2025-09-30,5.5,1.0,242.59,0.0,3.306,0.0,0.0,0.0
671,7236.0,Odysight.ai Inc,549300FBP1ANSJE5TE25,LEI,אפ לס ODYS US 31/03/2026,620080903,פנימי,מניה,"חו""ל","ארה""ב","Electronic Equipment, Instruments & Components",מניות לרבות מדדי מניות,2026-03-31,לא,2023-03-27,USD,אחר,אי-תלות,2025-09-30,1.15,1.0,336.26,0.608,3.306,0.00676,3e-06,0.0
671,7236.0,נאוויטס פטרוליום שותפות מוגבלת,550263107,ח.פ.,קיקר נאוויטס פטרוליום שותפות מוגבל,10048041,פנימי,מניה,"חו""ל","ארה""ב","Oil, Gas & Consumable Fuels",אחר,2027-04-01,לא,2022-11-24,USD,מומחה בלתי תלוי,אי-תלות,2025-09-30,0.0,1.0,2585.29,107.832586,3.306,9.21641,0.00519,4.4e-05
671,8318.0,"טופ גאם תעשיות בע""מ",513561399,ח.פ.,אפ לס טופ גאם 31.01.2027,IL0011791428,ISIN,מניה,ישראל,ישראל,פודטק,מניות לרבות מדדי מניות,2027-01-31,לא,2025-07-31,ILS,אחר,אי-תלות,2025-09-30,1025.0,0.01,15396.61,125.559153,1.0,19.33185,0.000497,1.2e-05
671,8318.0,"קבוצת אקרו בע""מ",511996803,ח.פ.,אפ לס אקרו 05.08.2026,IL0011849028,ISIN,מניה,ישראל,ישראל,בנייה,מניות לרבות מדדי מניות,2026-08-05,לא,2025-04-07,ILS,אחר,אי-תלות,2025-09-30,70.0,0.01,508.58,123.307002,1.0,0.62711,1.6e-05,0.0
671,8318.0,"אנלייט אנרגיה מתחדשת בע""מ",520041146,ח.פ.,CALL001 אנלייט 17.12.2025,IL0007200111,ISIN,מניה,ישראל,ישראל,אנרגיה מתחדשת,מניות לרבות מדדי מניות,2025-12-17,לא,2024-12-18,ILS,אחר,אי-תלות,2025-09-30,5869.0,1.0,10924.56,10190.0,1.0,1113.21244,0.028635,0.000735
671,8318.0,"אנלייט אנרגיה מתחדשת בע""מ",520041146,ח.פ.,CALL001 אנלייט 17.12.2025,IL0007200111,ISIN,מניה,ישראל,ישראל,אנרגיה מתחדשת,מניות לרבות מדדי מניות,2025-12-17,לא,2024-12-31,ILS,אחר,אי-תלות,2025-09-30,5869.0,1.0,33429.33,10190.0,1.0,3406.44881,0.087625,0.00225
671,8318.0,"רוטשטיין נדל""ן בע""מ",520039959,ח.פ.,אפ לס בכספת-רוטשטין 26.07.2026,IL0005390153,ISIN,מניה,ישראל,ישראל,בנייה,מניות לרבות מדדי מניות,2026-07-26,לא,2025-01-28,ILS,אחר,אי-תלות,2025-09-30,73.0,0.01,4041.02,2363.490861,1.0,95.50905,0.002456,6.3e-05
671,8318.0,"אחים דוניץ בע""מ",520038605,ח.פ.,אפ לס דוניץ 31.12.25,IL0004000100,ISIN,מניה,ישראל,ישראל,בנייה,מניות לרבות מדדי מניות,2025-12-31,לא,2025-01-24,ILS,אחר,אי-תלות,2025-09-30,272.5,0.01,825.9,1076.583553,1.0,8.89152,0.000228,5e-06
671,8318.0,CITI Bank,549300U8H3KN0K301B23,LEI,FXVOpt 145.0000 PUT USD-JPY 20.10.25,100120170,פנימי,"מט""ח",ישראל,ישראל,אחר,"מט""ח",2025-10-20,לא,2025-09-18,USD,אחר,אי-תלות,2025-09-30,145.0,1.0,-931613.41,0.2748,3.306,-8.46607,-0.000217,-5e-06
671,8318.0,"סולאיר אנרגיות מתחדשות בע""מ",516046307,ח.פ.,אפ לס סולאיר סדרה ב 25.12.2027,11722873,פנימי,מניה,ישראל,ישראל,אנרגיה מתחדשת,מניות לרבות מדדי מניות,2027-12-25,לא,2024-04-30,ILS,אחר,אי-תלות,2025-09-30,45.63,0.01,2121.19,1109.37802,1.0,23.53201,0.000605,1.5e-05
671,8318.0,"סולאיר אנרגיות מתחדשות בע""מ",516046307,ח.פ.,אפ לס סולאיר סדרה א 25.12.2025,11722872,פנימי,מניה,ישראל,ישראל,אנרגיה מתחדשת,מניות לרבות מדדי מניות,2025-12-25,לא,2024-04-30,ILS,אחר,אי-תלות,2025-09-30,38.52,0.01,2121.19,788.722208,1.0,16.73029,0.00043,1.1e-05
671,8318.0,"בנק לאומי לישראל בע""מ",520018078,ח.פ.,26.11.25 עסקת CALL לאומי,IL0006046119,ISIN,מניה,"חו""ל",ישראל,אשראי חוץ בנקאי,מניות לרבות מדדי מניות,2025-11-26,לא,2024-12-31,ILS,אחר,אי-תלות,2025-09-30,4259.0,1.0,62335.87,6529.0,1.0,4069.90895,0.104691,0.002688
671,8318.0,בזק,520031931,ח.פ.,עסקת CALL בזק 29.01.26,IL0002300114,ISIN,מניה,"חו""ל",ישראל,אשראי חוץ בנקאי,מניות לרבות מדדי מניות,2026-01-29,לא,2025-01-30,ILS,אחר,אי-תלות,2025-09-30,1357.5756,1.0,309712.92,634.7,1.0,1965.74789,0.050565,0.001298
671,8318.0,"ישראכרט בע""מ",510706153,ח.פ.,ישראכרט 07.05.2026 CALL001,IL0011574030,ISIN,מניה,"חו""ל",ישראל,אשראי חוץ בנקאי,מניות לרבות מדדי מניות,2026-05-07,לא,2025-05-07,ILS,אחר,אי-תלות,2025-09-30,1699.0,1.0,11232.45,1338.0,1.0,150.29021,0.003865,9.9e-05
671,8318.0,"בנק לאומי לישראל בע""מ",520018078,ח.פ.,עסקת לאומי CALL 18.09.26,IL0006046119,ISIN,מניה,"חו""ל",ישראל,אשראי חוץ בנקאי,מניות לרבות מדדי מניות,2026-09-18,לא,2025-09-18,ILS,אחר,אי-תלות,2025-09-30,6235.0,1.0,43015.68,6529.0,1.0,2808.49395,0.072243,0.001855
671,8318.0,"בנק הפועלים בע""מ",520000118,ח.פ.,עסקת CALL001 פועלים 12.08.2026,IL0006625771,ISIN,מניה,"חו""ל",ישראל,בנקים,מניות לרבות מדדי מניות,2026-08-12,לא,2025-08-13,ILS,אחר,אי-תלות,2025-09-30,6389.0,1.0,41786.66,6732.0,1.0,2813.07819,0.072361,0.001858
671,8318.0,"בנק הפועלים בע""מ",520000118,ח.פ.,CALL001 פועלים 26.05.26,IL0006625771,ISIN,מניה,"חו""ל",ישראל,בנקים,מניות לרבות מדדי מניות,2026-05-26,לא,2025-05-27,ILS,אחר,אי-תלות,2025-09-30,5784.0,1.0,12005.06,6732.0,1.0,808.18082,0.020789,0.000533
671,8318.0,"בנק הפועלים בע""מ",520000118,ח.פ.,CALL001 פועלים 23.07.26,IL0006625771,ISIN,מניה,"חו""ל",ישראל,בנקים,מניות לרבות מדדי מניות,2026-07-23,לא,2025-07-24,ILS,אחר,אי-תלות,2025-09-30,6465.76,1.0,19664.31,6732.0,1.0,1323.8015,0.034052,0.000874
671,8318.0,בזק,520031931,ח.פ.,CALL001 בזק 26/05/2026,IL0002300114,ISIN,מניה,"חו""ל",ישראל,אשראי חוץ בנקאי,מניות לרבות מדדי מניות,2026-05-26,לא,2025-05-27,ILS,אחר,אי-תלות,2025-09-30,551.6,1.0,223052.29,634.7,1.0,1415.71291,0.036416,0.000935
671,8318.0,"בנק הפועלים בע""מ",520000118,ח.פ.,26.09.2026 עסקת CALL פועלים,IL0006625771,ISIN,מניה,"חו""ל",ישראל,בנקים,מניות לרבות מדדי מניות,2026-09-26,לא,2025-09-26,ILS,אחר,אי-תלות,2025-09-30,6172.0,1.0,27402.22,6732.0,1.0,1844.71739,0.047452,0.001218
671,8318.0,"כלל החזקות עסקי ביטוח בע""מ",520036120,ח.פ.,CALL001 כלל 15.07.26,IL0002240146,ISIN,מניה,"חו""ל",ישראל,אשראי חוץ בנקאי,מניות לרבות מדדי מניות,2026-07-14,לא,2025-07-15,ILS,אחר,אי-תלות,2025-09-30,8629.0,1.0,6046.78,16970.0,1.0,1026.13789,0.026395,0.000677
671,8318.0,"מימון ישיר מקבוצת ישיר(2006) בע""מ",513893123,ח.פ.,מימון ישיר 26.03.2026 CALL001,IL0001168186,ISIN,מניה,"חו""ל",ישראל,אשראי חוץ בנקאי,מניות לרבות מדדי מניות,2026-03-26,לא,2025-03-26,ILS,אחר,אי-תלות,2025-09-30,53970.0,1.0,74.23,49390.0,1.0,36.66357,0.000943,2.4e-05
671,8318.0,"בנק דיסקונט לישראל בע""מ",520007030,ח.פ.,CALL001 דיסקונט 26.5.26,IL0006912120,ISIN,מניה,"חו""ל",ישראל,אשראי חוץ בנקאי,מניות לרבות מדדי מניות,2026-05-26,לא,2025-05-27,ILS,אחר,אי-תלות,2025-09-30,2952.0,1.0,52832.6,3274.0,1.0,1729.7393,0.044494,0.001142
671,8318.0,"כלל החזקות עסקי ביטוח בע""מ",520036120,ח.פ.,CALL001 כלל 17.12.25,IL0002240146,ISIN,מניה,"חו""ל",ישראל,אשראי חוץ בנקאי,מניות לרבות מדדי מניות,2025-12-17,לא,2024-12-22,ILS,אחר,אי-תלות,2025-09-30,8629.0,1.0,4916.08,16970.0,1.0,834.25845,0.021459,0.000551
671,8318.0,"בנק הפועלים בע""מ",520000118,ח.פ.,עסקת פועלים CALL 18.09.26,IL0006625771,ISIN,מניה,"חו""ל",ישראל,בנקים,מניות לרבות מדדי מניות,2026-09-18,לא,2025-09-18,ILS,אחר,אי-תלות,2025-09-30,6415.0,1.0,41934.15,6732.0,1.0,2823.0067,0.072616,0.001864
671,8318.0,"בנק הפועלים בע""מ",520000118,ח.פ.,פועלים 03.07.2026 CALL001,IL0006625771,ISIN,מניה,"חו""ל",ישראל,בנקים,מניות לרבות מדדי מניות,2026-07-03,לא,2025-07-03,ILS,אחר,אי-תלות,2025-09-30,6300.0,1.0,25121.16,6732.0,1.0,1691.15642,0.043502,0.001117
671,8318.0,"מימון ישיר מקבוצת ישיר(2006) בע""מ",513893123,ח.פ.,מימון ישיר 21.09.2026 CALL001,IL0001168186,ISIN,מניה,"חו""ל",ישראל,אשראי חוץ בנקאי,מניות לרבות מדדי מניות,2026-09-21,לא,2025-09-21,ILS,אחר,אי-תלות,2025-09-30,45160.0,1.0,491.61,49390.0,1.0,242.8051,0.006245,0.00016
671,8318.0,"בנק לאומי לישראל בע""מ",520018078,ח.פ.,עסקת CALL001 לאומי 12.08.2026,IL0006046119,ISIN,מניה,"חו""ל",ישראל,אשראי חוץ בנקאי,מניות לרבות מדדי מניות,2026-08-12,לא,2025-08-13,ILS,אחר,אי-תלות,2025-09-30,6157.0,1.0,40331.5,6529.0,1.0,2633.24393,0.067735,0.001739
671,8318.0,"בנק לאומי לישראל בע""מ",520018078,ח.פ.,26.09.26 עסקת CALL לאומי,IL0006046119,ISIN,מניה,"חו""ל",ישראל,אשראי חוץ בנקאי,מניות לרבות מדדי מניות,2026-09-26,לא,2025-09-26,ILS,אחר,אי-תלות,2025-09-30,5965.0,1.0,50640.4,6529.0,1.0,3306.31186,0.085049,0.002184
671,8318.0,"בנק הפועלים בע""מ",520000118,ח.פ.,26.11.25 עסקת CALL פועלים,IL0006625771,ISIN,מניה,"חו""ל",ישראל,בנקים,מניות לרבות מדדי מניות,2025-11-26,לא,2024-11-30,ILS,אחר,אי-תלות,2025-09-30,4272.0,1.0,39751.41,6732.0,1.0,2676.06474,0.068837,0.001767
671,8318.0,Odysight.ai Inc,549300FBP1ANSJE5TE25,LEI,אפ לס ODYS US 31/03/2026,620080903,פנימי,מניה,"חו""ל","ארה""ב","Electronic Equipment, Instruments & Components",מניות לרבות מדדי מניות,2026-03-31,לא,2023-03-27,USD,אחר,אי-תלות,2025-09-30,1.15,1.0,7865.72,0.608,3.306,0.15812,4e-06,0.0
671,8318.0,Odysight.ai Inc,549300FBP1ANSJE5TE25,LEI,אפ לס ODYS US 31/03/2026,620080901,פנימי,מניה,"חו""ל","ארה""ב","Electronic Equipment, Instruments & Components",מניות לרבות מדדי מניות,2026-03-31,לא,2022-03-18,USD,אחר,אי-תלות,2025-09-30,5.5,1.0,5674.73,0.0,3.306,0.0,0.0,0.0
671,8319.0,CITI Bank,549300U8H3KN0K301B23,LEI,FXVOpt 145.0000 PUT USD-JPY 20.10.25,100120170,פנימי,"מט""ח",ישראל,ישראל,אחר,"מט""ח",2025-10-20,לא,2025-09-18,USD,אחר,אי-תלות,2025-09-30,145.0,1.0,-2152.1,0.2748,3.306,-0.01956,0.39364,-2e-06
671,8319.0,CITI Bank,549300U8H3KN0K301B23,LEI,FXVOpt 3.6800 CALL USD-PLN 30.10.25,100120432,פנימי,"מט""ח",ישראל,ישראל,אחר,"מט""ח",2025-10-30,לא,2025-09-29,USD,אחר,אי-תלות,2025-09-30,3.68,1.0,-1614.07,0.5646,3.306,-0.03013,0.606359,-3e-06
209,13335.0,,,,,,,,,,,,,,,,,,,,,,,,,,
209,14286.0,,,,,,,,,,,,,,,,,,,,,,,,,,
209,15219.0,,,,,,,,,,,,,,,,,,,,,,,,,,
209,2189.0,,,,,,,,,,,,,,,,,,,,,,,,,,
209,2201.0,,,,,,,,,,,,,,,,,,,,,,,,,,
209,9979.0,,,,,,,,,,,,,,,,,,,,,,,,,,
209,9984.0,,,,,,,,,,,,,,,,,,,,,,,,,,
209,9987.0,,,,,,,,,,,,,,,,,,,,,,,,,,
671,13465.0,,,,,,,,,,,,,,,,,,,,,,,,,,
671,14082.0,,,,,,,,,,,,,,,,,,,,,,,,,,
671,14287.0,,,,,,,,,,,,,,,,,,,,,,,,,,
671,15222.0,,,,,,,,,,,,,,,,,,,,,,,,,,
671,15223.0,,,,,,,,,,,,,,,,,,,,,,,,,,
671,2202.0,,,,,,,,,,,,,,,,,,,,,,,,,,
671,8320.0,,,,,,,,,,,,,,,,,,,,,,,,,,
סיום מידע טבלה,,,,,,,,,,,,,,,,,,,,,,,,,,,
