מספר קופה/קרן/ח.פ. עבור חברת ביטוח,מספר מסלול,שם מנפיק,מספר מנפיק,סוג מספר מזהה מנפיק,שם נייר ערך,מספר נייר ערך,סוג מספר נייר ערך,מאפיין עיקרי,"ישראל/חו""ל",מדינה לפי חשיפה כלכלית,סטאטוס סחירות,ענף מסחר,בעל עניין/צד קשור,תאריך רכישה,דירוג,שם מדרג,דירוג נייר הערך/המנפיק,מטבע פעילות,"מח""מ",מועד פדיון,תשואה לפדיון,שיעור ריבית,נחיתות חוזית,האם סווג כחוב בעייתי,סוג גורם משערך,תלות/אי-תלות המשערך,תאריך שערוך אחרון,תאריך אחרון בו נבחנה בפועל ירידת ערך,ערך נקוב (יחידות),שער חליפין,שער נייר הערך,"שווי הוגן (באלפי ש""ח)","עלות מופחתת (באלפי ש""ח)",עלות מופחתת (במטבע הפעילות),השיטה שיושמה בדוח הכספי,שיעור מנכסי אפיק ההשקעה,שיעור מסך נכסי ההשקעה
209,12119.0,חברת החשמל,520000472,ח.פ.,חברת חשמל 6.00% צמוד 07.05.29,IL0060001869,ISIN,"צמוד למט""ח",ישראל,ישראל,לא סחיר,אנרגיה,לא,2014-05-07,Aaa.il,מידרוג Moodys,נייר ערך,ILS,1.95,2029-05-07,0.0356,0.06,החוב לא נחות,,חברת ציטוט,אי-תלות,2025-09-30,2025-09-30,1915237.62,1.0,129.32,2476.7853,,,,0.035334,0.00022
209,12119.0,"מכלול מימון נדל""ן בע""מ",515759777,ח.פ.,מכלול נדלן אגח 1 1.00% פריים 30.11.26,IL0012071416,ISIN,לא צמוד למדד המחירים לצרכן,ישראל,ישראל,לא סחיר,אשראי חוץ בנקאי,לא,2024-06-03,NR,NR,NR,ILS,1.12,2026-11-30,0.0633,0.0816,החוב לא נחות,,חברת ציטוט,אי-תלות,2025-09-30,2025-09-30,266285.71,1.0,103.36,286.89079,,,,0.004092,2.5e-05
209,12119.0,"בנק לאומי לישראל בע""מ",520018078,ח.פ.,"בנק לאומי סדרה 2 2.30% ב""י 24.08.30",IL0012058975,ISIN,לא צמוד למדד המחירים לצרכן,ישראל,ישראל,לא סחיר,בנקים,לא,2024-04-17,NR,NR,NR,ILS,4.17,2030-08-24,0.0705,0.113,החוב לא נחות,,חברת ציטוט,אי-תלות,2025-09-30,2025-09-30,1077717.86,1.0,101.46,1093.45254,,,,0.015599,9.7e-05
209,12119.0,"בנק לאומי לישראל בע""מ",520018078,ח.פ.,בנק לאומי סדרה 3 3.69% צמוד 24.05.35,IL0012150293,ISIN,צמוד למדד המחירים לצרכן,ישראל,ישראל,לא סחיר,בנקים,לא,2024-12-23,NR,NR,NR,ILS,3.73,2035-05-24,0.037,0.0369,החוב לא נחות,,חברת ציטוט,אי-תלות,2025-09-30,2025-09-30,2757283.77,1.0,103.39,2850.75569,,,,0.040669,0.000254
209,12119.0,"מימון ישיר מקבוצת ישיר(2006) בע""מ",513893123,ח.פ.,מימון ישיר אגח 16 4.25% צמוד 12.05.28,IL0011983405,ISIN,"צמוד למט""ח",ישראל,ישראל,לא סחיר,אשראי חוץ בנקאי,לא,2023-07-31,Aa2.il,מידרוג Moodys,נייר ערך,ILS,1.81,2028-05-12,0.0605,0.0425,החוב לא נחות,,חברת ציטוט,אי-תלות,2025-09-30,2025-09-30,291491.46,1.0,108.68,316.79291,,,,0.004519,2.8e-05
209,12119.0,"מימון ישיר נדלן ומשכנתאות הנפקות (סד 1) בע""מ",516100153,ח.פ.,מימון ישיר נדלן אגח 1 5.00% צמוד 20.02.54,IL0012152687,ISIN,"צמוד למט""ח",ישראל,ישראל,לא סחיר,אשראי חוץ בנקאי,לא,2024-12-26,Aa1.il,מידרוג Moodys,נייר ערך,ILS,10.61,2054-02-20,0.0456,0.05,החוב לא נחות,,חברת ציטוט,אי-תלות,2025-09-30,2025-09-30,436131.7,1.0,106.71,465.39613,,,,0.006639,4.1e-05
209,12119.0,"קרדיטו הנפקות בע""מ",516804499,ח.פ.,קרדיטו אגח ב 10% שקלי 15.03.51,IL0012162744,ISIN,צמוד למדד המחירים לצרכן,ישראל,ישראל,לא סחיר,אשראי חוץ בנקאי,לא,2025-01-12,NR,NR,NR,ILS,9.22,2051-03-13,0.105,0.1,החוב לא נחות,,אחר,אי-תלות,2025-09-30,2025-09-30,457106.21,1.0,93.57,427.71428,,,,0.006101,3.8e-05
209,12119.0,"בנק לאומי לישראל בע""מ",520018078,ח.פ.,"בנק לאומי סדרה 4 2.2% ב""י 24.6.29",IL0012219288,ISIN,לא צמוד למדד המחירים לצרכן,ישראל,ישראל,לא סחיר,בנקים,לא,2025-05-22,NR,NR,NR,ILS,3.32,2029-06-24,0.0642,0.112,החוב לא נחות,,חברת ציטוט,אי-תלות,2025-09-30,2025-09-30,1375438.82,1.0,99.38,1366.9111,,,,0.0195,0.000121
209,12119.0,"מימון ישיר נדל""ן ומשכנתאות הנפקות (סדרה 2) בע""מ",517112074,ח.פ.,מימון ישיר נדלן אגח (סדרה 2) 5.25% צמוד 20.06.54,IL0012257882,ISIN,"צמוד למט""ח",ישראל,ישראל,לא סחיר,אשראי חוץ בנקאי,לא,2025-07-29,Aa1.il,מידרוג Moodys,נייר ערך,ILS,10.31,2054-06-20,0.0489,0.0525,החוב לא נחות,,חברת ציטוט,אי-תלות,2025-09-30,2025-09-30,623678.34,1.0,103.96,648.37601,,,,0.009249,5.7e-05
209,12119.0,אורמת טכנולוגיות אינק,520036716,ח.פ.,אורמת סדרה 4 3.35% שקלי 15.06.31,IL0011672123,ISIN,צמוד למדד המחירים לצרכן,ישראל,ישראל,לא סחיר,אנרגיה מתחדשת,לא,2020-07-01,ilAA-,S&P מעלות,נייר ערך,ILS,2.9457,2031-06-15,0.0518,0.0335,החוב לא נחות,,אחר,אי-תלות,2025-09-30,2025-09-30,300688.34,1.0,95.91,288.39018,,,,0.004114,2.5e-05
209,12119.0,"גב-ים נגב בע""מ",514189596,ח.פ.,גב ים אגח ב 3.84% צמוד 31.12.28,IL0012084534,ISIN,"צמוד למט""ח",ישראל,ישראל,לא סחיר,"נדל""ן מניב בישראל",לא,2024-07-11,ilA+,S&P מעלות,נייר ערך,ILS,2.89,2028-12-31,0.0422,0.0384,החוב לא נחות,,חברת ציטוט,אי-תלות,2025-09-30,2025-09-30,874464.06,1.0,106.65,932.61592,,,,0.013304,8.3e-05
209,12119.0,"מימון ישיר נדל""ן ומשכנתאות הנפקות (סדרה 2) בע""מ",517112074,ח.פ.,"מימון ישיר נדלן אגח (סדרה 2) 3.3%+ ב""י 20.06.54",IL0012257965,ISIN,צמוד למדד המחירים לצרכן,ישראל,ישראל,לא סחיר,אשראי חוץ בנקאי,לא,2025-07-29,Aa1.il,מידרוג Moodys,נייר ערך,ILS,7.4,2054-06-20,0.0739,0.078,החוב לא נחות,,אחר,אי-תלות,2025-09-30,2025-09-30,338797.33,1.0,100.1,339.13613,,,,0.004838,3e-05
209,12119.0,"בנק הפועלים בע""מ",520000118,ח.פ.,"פועלים אגח 2 2.25% ב""י 07.11.28",IL0012275454,ISIN,לא צמוד למדד המחירים לצרכן,ישראל,ישראל,לא סחיר,בנקים,לא,2025-08-27,NR,NR,NR,ILS,2.83,2028-11-07,0.0711,0.0675,החוב לא נחות,,חברת ציטוט,אי-תלות,2025-09-30,2025-09-30,1192450.99,1.0,99.52,1186.72723,,,,0.01693,0.000105
209,12119.0,"ביטוח ישיר - השקעות פיננסיות בע""מ",520044439,ח.פ.,ביטוח ישיר אגח יא 4.60% שקלי 30.06.28,IL0011388258,ISIN,צמוד למדד המחירים לצרכן,ישראל,ישראל,לא סחיר,השקעה ואחזקות,לא,2016-07-19,A2.il,מידרוג Moodys,נייר ערך,ILS,1.99,2028-06-30,0.0599,0.046,החוב לא נחות,,אחר,אי-תלות,2025-09-30,2025-09-30,372131.11,1.0,99.93,371.87062,,,,0.005305,3.3e-05
209,12119.0,נתיבי הגז הטבעי לישראל,513436394,ח.פ.,נתיבי גז אגח ג 4.80% צמוד 31.12.31,IL0011255093,ISIN,"צמוד למט""ח",ישראל,ישראל,לא סחיר,תשתיות,לא,2012-01-02,Aaa.il,מידרוג Moodys,נייר ערך,ILS,3.03,2031-12-31,0.0312,0.048,החוב לא נחות,,חברת ציטוט,אי-תלות,2025-09-30,2025-09-30,1442315.06,1.0,131.46,1896.06738,,,,0.027049,0.000168
209,12119.0,מקורות,520010869,ח.פ.,מקורות אגח 8 4.10% צמוד 14.07.48,IL0011243461,ISIN,"צמוד למט""ח",ישראל,ישראל,לא סחיר,תשתיות,לא,2011-07-14,ilAAA,S&P מעלות,נייר ערך,ILS,9.36,2048-07-14,0.0298,0.041,החוב לא נחות,,חברת ציטוט,אי-תלות,2025-09-30,2025-09-30,22693383.11,1.0,139.55,31668.61613,,,,0.451792,0.002825
209,12119.0,"רפאל מערכות לחימה מתקדמות בע""מ",520042185,ח.פ.,רפאל אגח ד 3.74% שקלי 15.09.34,IL0011402844,ISIN,צמוד למדד המחירים לצרכן,ישראל,ישראל,לא סחיר,ביטחוניות,לא,2017-03-01,AA+,פנימי,נייר ערך,ILS,4.4,2034-09-15,0.0478,0.0374,החוב לא נחות,,אחר,אי-תלות,2025-09-30,2025-09-30,593906.21,1.0,96.46,572.88193,,,,0.008172,5.1e-05
209,12119.0,"גמול חברה להשקעות בע""מ",520018136,ח.פ.,"גמול אג""ח ב- הסדר",IL0011167553,ISIN,צמוד למדד המחירים לצרכן,ישראל,ישראל,לא סחיר,"נדל""ן מניב בישראל",לא,2009-07-01,NR,NR,NR,ILS,0.01,2021-09-30,0.0001,0.045,החוב לא נחות,,אחר,אי-תלות,2025-09-30,2025-09-30,10.27,1.0,39.0,0.004,,,,0.0,0.0
209,12119.0,נתיבי הגז הטבעי לישראל,513436394,ח.פ.,נתיבי גז אגח א 5.60% צמוד 29.12.26,IL0011030843,ISIN,"צמוד למט""ח",ישראל,ישראל,לא סחיר,תשתיות,לא,2007-01-02,Aaa.il,מידרוג Moodys,נייר ערך,ILS,0.57,2026-12-29,0.0991,0.056,החוב לא נחות,,חברת ציטוט,אי-תלות,2025-09-30,2025-09-30,1408697.61,1.0,147.67,2080.22376,,,,0.029676,0.000184
209,12119.0,כלל תעשיות,520021874,ח.פ.,כלל תעשיות אגח טז 4.47% שקלי 30.06.27,6080238,פנימי,צמוד למדד המחירים לצרכן,ישראל,ישראל,לא סחיר,השקעה ואחזקות,לא,2019-12-29,A2.il,מידרוג Moodys,נייר ערך,ILS,1.45,2027-06-30,0.0535,0.0447,החוב לא נחות,,אחר,אי-תלות,2025-09-30,2025-09-30,414157.77,1.0,100.02,414.24061,,,,0.005909,3.6e-05
209,12119.0,"מכלול מימון נדל""ן בע""מ",515759777,ח.פ.,מכלול נדלן אגח 2 1% פריים 01.01.28,1215193,פנימי,לא צמוד למדד המחירים לצרכן,ישראל,ישראל,לא סחיר,אשראי חוץ בנקאי,לא,2024-12-25,NR,NR,NR,ILS,2.1,2028-01-01,0.0641,0.07,החוב לא נחות,,חברת ציטוט,אי-תלות,2025-09-30,2025-09-30,960888.12,1.0,101.45,984.12751,,,,0.014039,8.7e-05
209,12119.0,תמר אריאל קפיטל,516612256,ח.פ.,"COCO תמר אריאל קפיטל 3.06% ב""י 31.05.32",2004862,פנימי,לא צמוד למדד המחירים לצרכן,ישראל,ישראל,לא סחיר,אשראי חוץ בנקאי,לא,2022-05-25,NR,NR,NR,ILS,5.3932,2032-05-31,0.0651,0.0756,החוב לא נחות,,חברת ציטוט,אי-תלות,2025-09-30,2025-09-30,49392.87,1.0,108.11,53.39863,,,,0.000761,4e-06
209,12119.0,בנק ירושלים בע''מ,520025636,ח.פ.,בנק ירושלים COCO 5.13% צמוד 05.12.32,2004863,פנימי,צמוד למדד המחירים לצרכן,ישראל,ישראל,לא סחיר,בנקים,לא,2022-12-05,ilA-,S&P מעלות,נייר ערך,ILS,6.0943,2032-12-05,0.0443,0.0513,החוב לא נחות,,אחר,אי-תלות,2025-09-30,2025-09-30,840806.6,1.0,114.54,963.05988,,,,0.013739,8.5e-05
209,12119.0,"בנק הפועלים בע""מ",520000118,ח.פ.,"פועלים אגח 1 2.25% ב""י 30.09.27",1211747,פנימי,לא צמוד למדד המחירים לצרכן,ישראל,ישראל,לא סחיר,בנקים,לא,2024-09-25,NR,NR,NR,ILS,1.9,2027-09-30,0.0689,0.1125,החוב לא נחות,,חברת ציטוט,אי-תלות,2025-09-30,2025-09-30,1537738.89,1.0,101.09,1554.50025,,,,0.022176,0.000138
209,12119.0,"נתיבים אג""ח בע""מ",513502229,ח.פ.,נתיבים אגח א 7.97% דולרי 04.07.27,10902810,פנימי,"צמוד למט""ח",ישראל,ישראל,לא סחיר,השקעה ואחזקות,כן,2004-03-28,Aa1.il,מידרוג Moodys,נייר ערך,USD,0.9755,2027-07-04,0.045,0.0797,החוב לא נחות,,חברת ציטוט,אי-תלות,2025-09-30,2025-09-30,96541.83,3.306,105.33,336.17892,,,,0.004796,3e-05
209,12119.0,"בנק לאומי לישראל בע""מ",520018078,ח.פ.,"בנק לאומי סדרה 1 2.3% ב""י 24.12.26",1198639,פנימי,לא צמוד למדד המחירים לצרכן,ישראל,ישראל,לא סחיר,בנקים,לא,2023-08-07,NR,NR,NR,ILS,1.18,2026-12-24,0.0715,0.113,החוב לא נחות,,חברת ציטוט,אי-תלות,2025-09-30,2025-09-30,270710.22,1.0,100.51,272.09084,,,,0.003881,2.4e-05
209,12119.0,"מימון ישיר נדל""ן ומשכנתאות בע""מ",516100153,ח.פ.,מ. ישיר משכנתאות א 4.45% צמוד 31.12.31,1208818,פנימי,"צמוד למט""ח",ישראל,ישראל,לא סחיר,אשראי חוץ בנקאי,לא,2024-07-14,A3.il,מידרוג Moodys,נייר ערך,ILS,2.96,2031-12-31,0.0443,0.0445,החוב לא נחות,,חברת ציטוט,אי-תלות,2025-09-30,2025-09-30,447169.12,1.0,105.78,473.0155,,,,0.006748,4.2e-05
209,12119.0,מקורות,520010869,ח.פ.,מקורות אגח 6 4.90% צמוד 25.12.36,1100908,פנימי,צמוד למדד המחירים לצרכן,ישראל,ישראל,לא סחיר,תשתיות,לא,2006-12-25,AA,פנימי,נייר ערך,ILS,4.96,2036-12-25,0.0283,0.049,החוב לא נחות,,חברת ציטוט,אי-תלות,2025-09-30,2025-09-30,7973510.01,1.0,164.64,13127.58688,,,,0.187281,0.001171
209,12119.0,"אגרקסקו חברה ליצוא חקלאי בע""מ",510155625,ח.פ.,אגרקסקו אגח א חש4/12,1126770,פנימי,צמוד למדד המחירים לצרכן,ישראל,ישראל,לא סחיר,מסחר,לא,2007-12-27,NR,NR,NR,ILS,0.0,2017-04-30,0.0,0.0615,החוב לא נחות,,אחר,אי-תלות,2025-09-30,2025-09-30,989.18,1.0,0.0001,0.0,,,,0.0,0.0
209,12119.0,"מת""ם - מרכז תעשיות מדע חיפה בע""מ",510687403,ח.פ.,"מת""ם  אגח א 3.10% שקלי 30.06.27",11389991,פנימי,צמוד למדד המחירים לצרכן,ישראל,ישראל,לא סחיר,"נדל""ן מניב בישראל",לא,2016-08-16,Aa2.il,מידרוג Moodys,נייר ערך,ILS,1.2213,2027-06-30,0.0466,0.031,החוב לא נחות,,אחר,אי-תלות,2025-09-30,2025-09-30,311871.8,1.0,98.25,306.41404,,,,0.004371,2.7e-05
209,12119.0,"גדות מסופים לכימיקלים (1985) בע""מ",520040775,ח.פ.,גדות אגח א 4.30% שקלי 30.06.26,11623202,פנימי,צמוד למדד המחירים לצרכן,ישראל,ישראל,לא סחיר,מסחר,לא,2020-05-10,A3.il,מידרוג Moodys,נייר ערך,ILS,0.6561,2026-06-30,0.0539,0.043,החוב לא נחות,,אחר,אי-תלות,2025-09-30,2025-09-30,379846.75,1.0,100.43,381.48009,,,,0.005442,3.4e-05
209,12119.0,מקורות,520010869,ח.פ.,מקורות אגח 6 4.90% צמוד 25.12.36,11009081,פנימי,"צמוד למט""ח",ישראל,ישראל,לא סחיר,תשתיות,לא,2010-12-25,ilAAA,S&P מעלות,נייר ערך,ILS,4.9814,2036-12-25,0.0273,0.049,החוב לא נחות,,חברת ציטוט,אי-תלות,2025-09-30,2025-09-30,772687.78,1.0,164.64,1272.15316,,,,0.018148,0.000113
209,12119.0,מירלנד דיוולופמנט קורפריישן פי אל סי,1502,פנימי,מירלנד שטר הון 1.00% 01.01.2027,1182963,פנימי,צמוד למדד המחירים לצרכן,ישראל,רוסיה,לא סחיר,בנייה,לא,2021-11-26,NR,NR,NR,ILS,0.0,2027-01-01,0.0,0.01,החוב לא נחות,,אחר,אי-תלות,2025-09-30,2025-09-30,173859.82,1.0,0.0,0.0,,,,0.0,0.0
209,12119.0,"איילון חברת לביטוח בע""מ",520030677,ח.פ.,איילון אגח ג 7.75% שקלי 31.12.27,11955771,פנימי,צמוד למדד המחירים לצרכן,ישראל,ישראל,לא סחיר,ביטוח,לא,2022-11-22,A3.il,מידרוג Moodys,נייר ערך,ILS,2.0754,2027-12-31,0.0638,0.0775,החוב לא נחות,,אחר,אי-תלות,2025-09-30,2025-09-30,310991.04,1.0,104.94,326.354,,,,0.004655,2.9e-05
209,12119.0,"עוגן- אג""ח חברתית 2 בע""מ (חל""צ)",516556545,ח.פ.,"עוגן אג""ח רגילה 2.35% פריים 15.7.27",1196849,פנימי,צמוד למדד המחירים לצרכן,ישראל,ישראל,לא סחיר,שירותים פיננסיים,לא,2023-06-15,NR,NR,NR,ILS,1.15,2027-06-15,0.0901,0.1435,החוב לא נחות,,אחר,אי-תלות,2025-09-30,2025-09-30,252241.98,1.0,101.23,255.34456,,,,0.003642,2.2e-05
209,12119.0,י.ח.ק להשקעות- שותפות מוגבלת,550016091,ח.פ.,י.ח.ק השקעות אגח ב 2.86% שקלי 31.12.28,1181783,פנימי,צמוד למדד המחירים לצרכן,ישראל,ישראל,לא סחיר,השקעה ואחזקות,לא,2021-11-14,ilA+,S&P מעלות,נייר ערך,ILS,1.63,2028-12-31,0.068,0.0286,החוב לא נחות,,אחר,אי-תלות,2025-09-30,2025-09-30,73838.29,1.0,98.48,72.71595,,,,0.001037,6e-06
209,12119.0,"עוגן- אג""ח חברתית 2 בע""מ (חל""צ)",516556545,ח.פ.,"עוגן אג""ח בכיר 0.5% פריים 15.03.26",1196831,פנימי,צמוד למדד המחירים לצרכן,ישראל,ישראל,לא סחיר,שירותים פיננסיים,לא,2023-06-15,Aa2.il,מידרוג Moodys,נייר ערך,ILS,0.32,2026-03-15,0.0777,0.125,החוב לא נחות,,אחר,אי-תלות,2025-09-30,2025-09-30,32844.23,1.0,100.62,33.04786,,,,0.000471,2e-06
209,12119.0,DEAN FOODS CO,5RGFDMYH829UYJH0KY29,LEI,DF 6.5 03/15/23,US242370AD62,ISIN,צמוד למדד המחירים לצרכן,"חו""ל","ארה""ב",לא סחיר,Food Products,לא,2015-02-20,D,S&P,נייר ערך,USD,0.0,2023-03-15,0.0,0.065,החוב לא נחות,,אחר,אי-תלות,2025-09-30,2025-09-30,36483.89,3.306,0.0883,0.1065,,,,1e-06,0.0
209,12119.0,Endo International PLC,549300KK5WR4MGN4YT97,LEI,ENDO 7.5% 04/27,72961956,פנימי,צמוד למדד המחירים לצרכן,"חו""ל","ארה""ב",לא סחיר,Health Care Equipment & Supplies,לא,2019-03-14,D,S&P,נייר ערך,USD,100.0,2027-04-01,2.0,0.075,החוב לא נחות,,אחר,אי-תלות,2025-09-30,2025-09-30,7374.73,3.306,1e-06,0.0,,,,0.0,0.0
209,14285.0,"מכלול מימון נדל""ן בע""מ",515759777,ח.פ.,מכלול נדלן אגח 1 1.00% פריים 30.11.26,IL0012071416,ISIN,לא צמוד למדד המחירים לצרכן,ישראל,ישראל,לא סחיר,אשראי חוץ בנקאי,לא,2024-06-03,NR,NR,NR,ILS,1.12,2026-11-30,0.0633,0.0816,החוב לא נחות,,חברת ציטוט,אי-תלות,2025-09-30,2025-09-30,3895.05,1.0,103.36,4.19645,,,,0.012519,9e-05
209,14285.0,"בנק לאומי לישראל בע""מ",520018078,ח.פ.,"בנק לאומי סדרה 2 2.30% ב""י 24.08.30",IL0012058975,ISIN,לא צמוד למדד המחירים לצרכן,ישראל,ישראל,לא סחיר,בנקים,לא,2024-04-17,NR,NR,NR,ILS,4.17,2030-08-24,0.0705,0.113,החוב לא נחות,,חברת ציטוט,אי-תלות,2025-09-30,2025-09-30,15764.15,1.0,101.46,15.99431,,,,0.047718,0.000348
209,14285.0,"מימון ישיר מקבוצת ישיר(2006) בע""מ",513893123,ח.פ.,מימון ישיר אגח 16 4.25% צמוד 12.05.28,IL0011983405,ISIN,"צמוד למט""ח",ישראל,ישראל,לא סחיר,אשראי חוץ בנקאי,לא,2023-07-31,Aa2.il,מידרוג Moodys,נייר ערך,ILS,1.81,2028-05-12,0.0605,0.0425,החוב לא נחות,,חברת ציטוט,אי-תלות,2025-09-30,2025-09-30,4263.75,1.0,108.68,4.63384,,,,0.013824,0.0001
209,14285.0,"מימון ישיר נדלן ומשכנתאות הנפקות (סד 1) בע""מ",516100153,ח.פ.,מימון ישיר נדלן אגח 1 5.00% צמוד 20.02.54,IL0012152687,ISIN,"צמוד למט""ח",ישראל,ישראל,לא סחיר,אשראי חוץ בנקאי,לא,2024-12-26,Aa1.il,מידרוג Moodys,נייר ערך,ILS,10.61,2054-02-20,0.0456,0.05,החוב לא נחות,,חברת ציטוט,אי-תלות,2025-09-30,2025-09-30,6379.45,1.0,106.71,6.80751,,,,0.020309,0.000148
209,14285.0,"קרדיטו הנפקות בע""מ",516804499,ח.פ.,קרדיטו אגח ב 10% שקלי 15.03.51,IL0012162744,ISIN,צמוד למדד המחירים לצרכן,ישראל,ישראל,לא סחיר,אשראי חוץ בנקאי,לא,2025-01-12,NR,NR,NR,ILS,9.22,2051-03-13,0.105,0.1,החוב לא נחות,,אחר,אי-תלות,2025-09-30,2025-09-30,6686.25,1.0,93.57,6.25633,,,,0.018665,0.000136
209,14285.0,אורמת טכנולוגיות אינק,520036716,ח.פ.,אורמת סדרה 4 3.35% שקלי 15.06.31,IL0011672123,ISIN,צמוד למדד המחירים לצרכן,ישראל,ישראל,לא סחיר,אנרגיה מתחדשת,לא,2020-07-01,ilAA-,S&P מעלות,נייר ערך,ILS,2.9457,2031-06-15,0.0518,0.0335,החוב לא נחות,,אחר,אי-תלות,2025-09-30,2025-09-30,4398.27,1.0,95.91,4.21838,,,,0.012585,9.1e-05
209,14285.0,"מימון ישיר נדל""ן ומשכנתאות הנפקות (סדרה 2) בע""מ",517112074,ח.פ.,"מימון ישיר נדלן אגח (סדרה 2) 3.3%+ ב""י 20.06.54",IL0012257965,ISIN,צמוד למדד המחירים לצרכן,ישראל,ישראל,לא סחיר,אשראי חוץ בנקאי,לא,2025-07-29,Aa1.il,מידרוג Moodys,נייר ערך,ILS,7.4,2054-06-20,0.0739,0.078,החוב לא נחות,,אחר,אי-תלות,2025-09-30,2025-09-30,4955.71,1.0,100.1,4.96066,,,,0.014799,0.000108
209,14285.0,נתיבי הגז הטבעי לישראל,513436394,ח.פ.,נתיבי גז אגח ג 4.80% צמוד 31.12.31,IL0011255093,ISIN,"צמוד למט""ח",ישראל,ישראל,לא סחיר,תשתיות,לא,2012-01-02,Aaa.il,מידרוג Moodys,נייר ערך,ILS,3.03,2031-12-31,0.0312,0.048,החוב לא נחות,,חברת ציטוט,אי-תלות,2025-09-30,2025-09-30,2686.04,1.0,131.46,3.53106,,,,0.010533,7.6e-05
209,14285.0,מקורות,520010869,ח.פ.,מקורות אגח 8 4.10% צמוד 14.07.48,IL0011243461,ISIN,"צמוד למט""ח",ישראל,ישראל,לא סחיר,תשתיות,לא,2011-07-14,ilAAA,S&P מעלות,נייר ערך,ILS,9.36,2048-07-14,0.0298,0.041,החוב לא נחות,,חברת ציטוט,אי-תלות,2025-09-30,2025-09-30,57357.54,1.0,139.55,80.04245,,,,0.238801,0.001743
209,14285.0,נתיבי הגז הטבעי לישראל,513436394,ח.פ.,נתיבי גז אגח א 5.60% צמוד 29.12.26,IL0011030843,ISIN,"צמוד למט""ח",ישראל,ישראל,לא סחיר,תשתיות,לא,2007-01-02,Aaa.il,מידרוג Moodys,נייר ערך,ILS,0.57,2026-12-29,0.0991,0.056,החוב לא נחות,,חברת ציטוט,אי-תלות,2025-09-30,2025-09-30,2930.49,1.0,147.67,4.32745,,,,0.01291,9.3e-05
209,14285.0,"מימון ישיר נדל""ן ומשכנתאות הנפקות (סדרה 2) בע""מ",517112074,ח.פ.,מימון ישיר נדלן אגח (סדרה 2) 5.25% צמוד 20.06.54,IL0012257882,ISIN,"צמוד למט""ח",ישראל,ישראל,לא סחיר,אשראי חוץ בנקאי,לא,2025-07-29,Aa1.il,מידרוג Moodys,נייר ערך,ILS,10.31,2054-06-20,0.0489,0.0525,החוב לא נחות,,חברת ציטוט,אי-תלות,2025-09-30,2025-09-30,9122.76,1.0,103.96,9.48402,,,,0.028295,0.000206
209,14285.0,"גב-ים נגב בע""מ",514189596,ח.פ.,גב ים אגח ב 3.84% צמוד 31.12.28,IL0012084534,ISIN,"צמוד למט""ח",ישראל,ישראל,לא סחיר,"נדל""ן מניב בישראל",לא,2024-07-11,ilA+,S&P מעלות,נייר ערך,ILS,2.89,2028-12-31,0.0422,0.0384,החוב לא נחות,,חברת ציטוט,אי-תלות,2025-09-30,2025-09-30,12791.09,1.0,106.65,13.6417,,,,0.040699,0.000297
209,14285.0,"בנק הפועלים בע""מ",520000118,ח.פ.,"פועלים אגח 2 2.25% ב""י 07.11.28",IL0012275454,ISIN,לא צמוד למדד המחירים לצרכן,ישראל,ישראל,לא סחיר,בנקים,לא,2025-08-27,NR,NR,NR,ILS,2.83,2028-11-07,0.0711,0.0675,החוב לא נחות,,חברת ציטוט,אי-תלות,2025-09-30,2025-09-30,17442.39,1.0,99.52,17.35867,,,,0.051788,0.000378
209,14285.0,חברת החשמל,520000472,ח.פ.,חברת חשמל 6.00% צמוד 07.05.29,IL0060001869,ISIN,"צמוד למט""ח",ישראל,ישראל,לא סחיר,אנרגיה,לא,2014-05-07,Aaa.il,מידרוג Moodys,נייר ערך,ILS,1.95,2029-05-07,0.0356,0.06,החוב לא נחות,,חברת ציטוט,אי-תלות,2025-09-30,2025-09-30,1698.22,1.0,129.32,2.19614,,,,0.006552,4.7e-05
209,14285.0,"בנק לאומי לישראל בע""מ",520018078,ח.פ.,"בנק לאומי סדרה 4 2.2% ב""י 24.6.29",IL0012219288,ISIN,לא צמוד למדד המחירים לצרכן,ישראל,ישראל,לא סחיר,בנקים,לא,2025-05-22,NR,NR,NR,ILS,3.32,2029-06-24,0.0642,0.112,החוב לא נחות,,חברת ציטוט,אי-תלות,2025-09-30,2025-09-30,20119.02,1.0,99.38,19.99428,,,,0.059651,0.000435
209,14285.0,"בנק לאומי לישראל בע""מ",520018078,ח.פ.,בנק לאומי סדרה 3 3.69% צמוד 24.05.35,IL0012150293,ISIN,צמוד למדד המחירים לצרכן,ישראל,ישראל,לא סחיר,בנקים,לא,2024-12-23,NR,NR,NR,ILS,3.73,2035-05-24,0.037,0.0369,החוב לא נחות,,חברת ציטוט,אי-תלות,2025-09-30,2025-09-30,40331.75,1.0,103.39,41.69899,,,,0.124406,0.000908
209,14285.0,"מכלול מימון נדל""ן בע""מ",515759777,ח.פ.,מכלול נדלן אגח 2 1% פריים 01.01.28,1215193,פנימי,לא צמוד למדד המחירים לצרכן,ישראל,ישראל,לא סחיר,אשראי חוץ בנקאי,לא,2024-12-25,NR,NR,NR,ILS,2.1,2028-01-01,0.0641,0.07,החוב לא נחות,,חברת ציטוט,אי-תלות,2025-09-30,2025-09-30,14055.24,1.0,101.45,14.39518,,,,0.042947,0.000312
209,14285.0,מירלנד דיוולופמנט קורפריישן פי אל סי,1502,פנימי,מירלנד שטר הון 1.00% 01.01.2027,1182963,פנימי,צמוד למדד המחירים לצרכן,ישראל,רוסיה,לא סחיר,בנייה,לא,2021-11-26,NR,NR,NR,ILS,0.0,2027-01-01,0.0,0.01,החוב לא נחות,,אחר,אי-תלות,2025-09-30,2025-09-30,2543.11,1.0,0.0,0.0,,,,0.0,0.0
209,14285.0,"מימון ישיר נדל""ן ומשכנתאות בע""מ",516100153,ח.פ.,מ. ישיר משכנתאות א 4.45% צמוד 31.12.31,1208818,פנימי,"צמוד למט""ח",ישראל,ישראל,לא סחיר,אשראי חוץ בנקאי,לא,2024-07-14,A3.il,מידרוג Moodys,נייר ערך,ILS,2.96,2031-12-31,0.0443,0.0445,החוב לא נחות,,חברת ציטוט,אי-תלות,2025-09-30,2025-09-30,6540.9,1.0,105.78,6.91896,,,,0.020642,0.00015
209,14285.0,"בנק לאומי לישראל בע""מ",520018078,ח.פ.,"בנק לאומי סדרה 1 2.3% ב""י 24.12.26",1198639,פנימי,לא צמוד למדד המחירים לצרכן,ישראל,ישראל,לא סחיר,בנקים,לא,2023-08-07,NR,NR,NR,ILS,1.18,2026-12-24,0.0715,0.113,החוב לא נחות,,חברת ציטוט,אי-תלות,2025-09-30,2025-09-30,3959.77,1.0,100.51,3.97997,,,,0.011874,8.6e-05
209,14285.0,"איילון חברת לביטוח בע""מ",520030677,ח.פ.,איילון אגח ג 7.75% שקלי 31.12.27,11955771,פנימי,צמוד למדד המחירים לצרכן,ישראל,ישראל,לא סחיר,ביטוח,לא,2022-11-22,A3.il,מידרוג Moodys,נייר ערך,ILS,2.0754,2027-12-31,0.0638,0.0775,החוב לא נחות,,אחר,אי-תלות,2025-09-30,2025-09-30,4548.97,1.0,104.94,4.77369,,,,0.014242,0.000104
209,14285.0,י.ח.ק להשקעות- שותפות מוגבלת,550016091,ח.פ.,י.ח.ק השקעות אגח ב 2.86% שקלי 31.12.28,1181783,פנימי,צמוד למדד המחירים לצרכן,ישראל,ישראל,לא סחיר,השקעה ואחזקות,לא,2021-11-14,ilA+,S&P מעלות,נייר ערך,ILS,1.63,2028-12-31,0.068,0.0286,החוב לא נחות,,אחר,אי-תלות,2025-09-30,2025-09-30,1080.06,1.0,98.48,1.06364,,,,0.003173,2.3e-05
209,14285.0,"מת""ם - מרכז תעשיות מדע חיפה בע""מ",510687403,ח.פ.,"מת""ם  אגח א 3.10% שקלי 30.06.27",11389991,פנימי,צמוד למדד המחירים לצרכן,ישראל,ישראל,לא סחיר,"נדל""ן מניב בישראל",לא,2016-08-16,Aa2.il,מידרוג Moodys,נייר ערך,ILS,1.2213,2027-06-30,0.0466,0.031,החוב לא נחות,,אחר,אי-תלות,2025-09-30,2025-09-30,4561.86,1.0,98.25,4.48202,,,,0.013371,9.7e-05
209,14285.0,מקורות,520010869,ח.פ.,מקורות אגח 6 4.90% צמוד 25.12.36,11009081,פנימי,"צמוד למט""ח",ישראל,ישראל,לא סחיר,תשתיות,לא,2010-12-25,ilAAA,S&P מעלות,נייר ערך,ILS,4.9814,2036-12-25,0.0273,0.049,החוב לא נחות,,חברת ציטוט,אי-תלות,2025-09-30,2025-09-30,2010.69,1.0,164.64,3.31041,,,,0.009876,7.1e-05
209,14285.0,מקורות,520010869,ח.פ.,מקורות אגח 6 4.90% צמוד 25.12.36,1100908,פנימי,צמוד למדד המחירים לצרכן,ישראל,ישראל,לא סחיר,תשתיות,לא,2006-12-25,AA,פנימי,נייר ערך,ILS,4.96,2036-12-25,0.0283,0.049,החוב לא נחות,,חברת ציטוט,אי-תלות,2025-09-30,2025-09-30,20748.76,1.0,164.64,34.16076,,,,0.101916,0.000744
209,14285.0,"בנק הפועלים בע""מ",520000118,ח.פ.,"פועלים אגח 1 2.25% ב""י 30.09.27",1211747,פנימי,לא צמוד למדד המחירים לצרכן,ישראל,ישראל,לא סחיר,בנקים,לא,2024-09-25,NR,NR,NR,ILS,1.9,2027-09-30,0.0689,0.1125,החוב לא נחות,,חברת ציטוט,אי-תלות,2025-09-30,2025-09-30,22493.04,1.0,101.09,22.73821,,,,0.067838,0.000495
209,14285.0,DEAN FOODS CO,5RGFDMYH829UYJH0KY29,LEI,DF 6.5 03/15/23,US242370AD62,ISIN,צמוד למדד המחירים לצרכן,"חו""ל","ארה""ב",לא סחיר,Food Products,לא,2015-02-20,D,S&P,נייר ערך,USD,0.0,2023-03-15,0.0,0.065,החוב לא נחות,,אחר,אי-תלות,2025-09-30,2025-09-30,6152.49,3.306,0.0883,0.01796,,,,5.3e-05,0.0
209,14285.0,Endo International PLC,549300KK5WR4MGN4YT97,LEI,ENDO 7.5% 04/27,72961956,פנימי,צמוד למדד המחירים לצרכן,"חו""ל","ארה""ב",לא סחיר,Health Care Equipment & Supplies,לא,2019-03-14,D,S&P,נייר ערך,USD,100.0,2027-04-01,2.0,0.075,החוב לא נחות,,אחר,אי-תלות,2025-09-30,2025-09-30,1243.64,3.306,1e-06,0.0,,,,0.0,0.0
209,15217.0,"בנק לאומי לישראל בע""מ",520018078,ח.פ.,בנק לאומי סדרה 3 3.69% צמוד 24.05.35,IL0012150293,ISIN,צמוד למדד המחירים לצרכן,ישראל,ישראל,לא סחיר,בנקים,לא,2024-12-23,NR,NR,NR,ILS,3.73,2035-05-24,0.037,0.0369,החוב לא נחות,,חברת ציטוט,אי-תלות,2025-09-30,2025-09-30,52080.22,1.0,103.39,53.84574,,,,0.124509,0.003146
209,15217.0,"מכלול מימון נדל""ן בע""מ",515759777,ח.פ.,מכלול נדלן אגח 1 1.00% פריים 30.11.26,IL0012071416,ISIN,לא צמוד למדד המחירים לצרכן,ישראל,ישראל,לא סחיר,אשראי חוץ בנקאי,לא,2024-06-03,NR,NR,NR,ILS,1.12,2026-11-30,0.0633,0.0816,החוב לא נחות,,חברת ציטוט,אי-תלות,2025-09-30,2025-09-30,5029.67,1.0,103.36,5.41886,,,,0.01253,0.000315
209,15217.0,"מימון ישיר נדלן ומשכנתאות הנפקות (סד 1) בע""מ",516100153,ח.פ.,מימון ישיר נדלן אגח 1 5.00% צמוד 20.02.54,IL0012152687,ISIN,"צמוד למט""ח",ישראל,ישראל,לא סחיר,אשראי חוץ בנקאי,לא,2024-12-26,Aa1.il,מידרוג Moodys,נייר ערך,ILS,10.61,2054-02-20,0.0456,0.05,החוב לא נחות,,חברת ציטוט,אי-תלות,2025-09-30,2025-09-30,8237.76,1.0,106.71,8.79051,,,,0.020326,0.000513
209,15217.0,"גב-ים נגב בע""מ",514189596,ח.פ.,גב ים אגח ב 3.84% צמוד 31.12.28,IL0012084534,ISIN,"צמוד למט""ח",ישראל,ישראל,לא סחיר,"נדל""ן מניב בישראל",לא,2024-07-11,ilA+,S&P מעלות,נייר ערך,ILS,2.89,2028-12-31,0.0422,0.0384,החוב לא נחות,,חברת ציטוט,אי-תלות,2025-09-30,2025-09-30,16517.08,1.0,106.65,17.61547,,,,0.040732,0.001029
209,15217.0,"קרדיטו הנפקות בע""מ",516804499,ח.פ.,קרדיטו אגח ב 10% שקלי 15.03.51,IL0012162744,ISIN,צמוד למדד המחירים לצרכן,ישראל,ישראל,לא סחיר,אשראי חוץ בנקאי,לא,2025-01-12,NR,NR,NR,ILS,9.22,2051-03-13,0.105,0.1,החוב לא נחות,,אחר,אי-תלות,2025-09-30,2025-09-30,8633.93,1.0,93.57,8.07877,,,,0.01868,0.000472
209,15217.0,חברת החשמל,520000472,ח.פ.,חברת חשמל 6.00% צמוד 07.05.29,IL0060001869,ISIN,"צמוד למט""ח",ישראל,ישראל,לא סחיר,אנרגיה,לא,2014-05-07,Aaa.il,מידרוג Moodys,נייר ערך,ILS,1.95,2029-05-07,0.0356,0.06,החוב לא נחות,,חברת ציטוט,אי-תלות,2025-09-30,2025-09-30,2188.47,1.0,129.32,2.83013,,,,0.006544,0.000165
209,15217.0,"מימון ישיר נדל""ן ומשכנתאות הנפקות (סדרה 2) בע""מ",517112074,ח.פ.,מימון ישיר נדלן אגח (סדרה 2) 5.25% צמוד 20.06.54,IL0012257882,ISIN,"צמוד למט""ח",ישראל,ישראל,לא סחיר,אשראי חוץ בנקאי,לא,2025-07-29,Aa1.il,מידרוג Moodys,נייר ערך,ILS,10.31,2054-06-20,0.0489,0.0525,החוב לא נחות,,חברת ציטוט,אי-תלות,2025-09-30,2025-09-30,11780.18,1.0,103.96,12.24668,,,,0.028318,0.000715
209,15217.0,"מימון ישיר נדל""ן ומשכנתאות הנפקות (סדרה 2) בע""מ",517112074,ח.פ.,"מימון ישיר נדלן אגח (סדרה 2) 3.3%+ ב""י 20.06.54",IL0012257965,ISIN,צמוד למדד המחירים לצרכן,ישראל,ישראל,לא סחיר,אשראי חוץ בנקאי,לא,2025-07-29,Aa1.il,מידרוג Moodys,נייר ערך,ILS,7.4,2054-06-20,0.0739,0.078,החוב לא נחות,,אחר,אי-תלות,2025-09-30,2025-09-30,6399.28,1.0,100.1,6.40568,,,,0.014812,0.000374
209,15217.0,"בנק הפועלים בע""מ",520000118,ח.פ.,"פועלים אגח 2 2.25% ב""י 07.11.28",IL0012275454,ISIN,לא צמוד למדד המחירים לצרכן,ישראל,ישראל,לא סחיר,בנקים,לא,2025-08-27,NR,NR,NR,ILS,2.83,2028-11-07,0.0711,0.0675,החוב לא נחות,,חברת ציטוט,אי-תלות,2025-09-30,2025-09-30,22523.29,1.0,99.52,22.41518,,,,0.051831,0.001309
209,15217.0,"בנק לאומי לישראל בע""מ",520018078,ח.פ.,"בנק לאומי סדרה 2 2.30% ב""י 24.08.30",IL0012058975,ISIN,לא צמוד למדד המחירים לצרכן,ישראל,ישראל,לא סחיר,בנקים,לא,2024-04-17,NR,NR,NR,ILS,4.17,2030-08-24,0.0705,0.113,החוב לא נחות,,חברת ציטוט,אי-תלות,2025-09-30,2025-09-30,20356.19,1.0,101.46,20.65339,,,,0.047757,0.001206
209,15217.0,"בנק לאומי לישראל בע""מ",520018078,ח.פ.,"בנק לאומי סדרה 4 2.2% ב""י 24.6.29",IL0012219288,ISIN,לא צמוד למדד המחירים לצרכן,ישראל,ישראל,לא סחיר,בנקים,לא,2025-05-22,NR,NR,NR,ILS,3.32,2029-06-24,0.0642,0.112,החוב לא נחות,,חברת ציטוט,אי-תלות,2025-09-30,2025-09-30,25979.61,1.0,99.38,25.81853,,,,0.0597,0.001508
209,15217.0,"מימון ישיר מקבוצת ישיר(2006) בע""מ",513893123,ח.פ.,מימון ישיר אגח 16 4.25% צמוד 12.05.28,IL0011983405,ISIN,"צמוד למט""ח",ישראל,ישראל,לא סחיר,אשראי חוץ בנקאי,לא,2023-07-31,Aa2.il,מידרוג Moodys,נייר ערך,ILS,1.81,2028-05-12,0.0605,0.0425,החוב לא נחות,,חברת ציטוט,אי-תלות,2025-09-30,2025-09-30,5505.76,1.0,108.68,5.98366,,,,0.013836,0.000349
209,15217.0,אורמת טכנולוגיות אינק,520036716,ח.פ.,אורמת סדרה 4 3.35% שקלי 15.06.31,IL0011672123,ISIN,צמוד למדד המחירים לצרכן,ישראל,ישראל,לא סחיר,אנרגיה מתחדשת,לא,2020-07-01,ilAA-,S&P מעלות,נייר ערך,ILS,2.9457,2031-06-15,0.0518,0.0335,החוב לא נחות,,אחר,אי-תלות,2025-09-30,2025-09-30,5679.47,1.0,95.91,5.44718,,,,0.012595,0.000318
209,15217.0,נתיבי הגז הטבעי לישראל,513436394,ח.פ.,נתיבי גז אגח א 5.60% צמוד 29.12.26,IL0011030843,ISIN,"צמוד למט""ח",ישראל,ישראל,לא סחיר,תשתיות,לא,2007-01-02,Aaa.il,מידרוג Moodys,נייר ערך,ILS,0.57,2026-12-29,0.0991,0.056,החוב לא נחות,,חברת ציטוט,אי-תלות,2025-09-30,2025-09-30,3776.48,1.0,147.67,5.57673,,,,0.012895,0.000325
209,15217.0,מקורות,520010869,ח.פ.,מקורות אגח 8 4.10% צמוד 14.07.48,IL0011243461,ISIN,"צמוד למט""ח",ישראל,ישראל,לא סחיר,תשתיות,לא,2011-07-14,ilAAA,S&P מעלות,נייר ערך,ILS,9.36,2048-07-14,0.0298,0.041,החוב לא נחות,,חברת ציטוט,אי-תלות,2025-09-30,2025-09-30,73915.8,1.0,139.55,103.14951,,,,0.238515,0.006027
209,15217.0,נתיבי הגז הטבעי לישראל,513436394,ח.פ.,נתיבי גז אגח ג 4.80% צמוד 31.12.31,IL0011255093,ISIN,"צמוד למט""ח",ישראל,ישראל,לא סחיר,תשתיות,לא,2012-01-02,Aaa.il,מידרוג Moodys,נייר ערך,ILS,3.03,2031-12-31,0.0312,0.048,החוב לא נחות,,חברת ציטוט,אי-תלות,2025-09-30,2025-09-30,3461.45,1.0,131.46,4.55043,,,,0.010521,0.000265
209,15217.0,"בנק לאומי לישראל בע""מ",520018078,ח.פ.,"בנק לאומי סדרה 1 2.3% ב""י 24.12.26",1198639,פנימי,לא צמוד למדד המחירים לצרכן,ישראל,ישראל,לא סחיר,בנקים,לא,2023-08-07,NR,NR,NR,ILS,1.18,2026-12-24,0.0715,0.113,החוב לא נחות,,חברת ציטוט,אי-תלות,2025-09-30,2025-09-30,5113.24,1.0,100.51,5.13932,,,,0.011883,0.0003
209,15217.0,"איילון חברת לביטוח בע""מ",520030677,ח.פ.,איילון אגח ג 7.75% שקלי 31.12.27,11955771,פנימי,צמוד למדד המחירים לצרכן,ישראל,ישראל,לא סחיר,ביטוח,לא,2022-11-22,A3.il,מידרוג Moodys,נייר ערך,ILS,2.0754,2027-12-31,0.0638,0.0775,החוב לא נחות,,אחר,אי-תלות,2025-09-30,2025-09-30,5874.07,1.0,104.94,6.16425,,,,0.014253,0.00036
209,15217.0,מקורות,520010869,ח.פ.,מקורות אגח 6 4.90% צמוד 25.12.36,11009081,פנימי,"צמוד למט""ח",ישראל,ישראל,לא סחיר,תשתיות,לא,2010-12-25,ilAAA,S&P מעלות,נייר ערך,ILS,4.9814,2036-12-25,0.0273,0.049,החוב לא נחות,,חברת ציטוט,אי-תלות,2025-09-30,2025-09-30,2591.16,1.0,164.64,4.26607,,,,0.009864,0.000248
209,15217.0,"מכלול מימון נדל""ן בע""מ",515759777,ח.פ.,מכלול נדלן אגח 2 1% פריים 01.01.28,1215193,פנימי,לא צמוד למדד המחירים לצרכן,ישראל,ישראל,לא סחיר,אשראי חוץ בנקאי,לא,2024-12-25,NR,NR,NR,ILS,2.1,2028-01-01,0.0641,0.07,החוב לא נחות,,חברת ציטוט,אי-תלות,2025-09-30,2025-09-30,18149.48,1.0,101.45,18.58843,,,,0.042982,0.001085
209,15217.0,מקורות,520010869,ח.פ.,מקורות אגח 6 4.90% צמוד 25.12.36,1100908,פנימי,צמוד למדד המחירים לצרכן,ישראל,ישראל,לא סחיר,תשתיות,לא,2006-12-25,AA,פנימי,נייר ערך,ILS,4.96,2036-12-25,0.0283,0.049,החוב לא נחות,,חברת ציטוט,אי-תלות,2025-09-30,2025-09-30,26738.62,1.0,164.64,44.02246,,,,0.101794,0.002572
209,15217.0,"בנק הפועלים בע""מ",520000118,ח.פ.,"פועלים אגח 1 2.25% ב""י 30.09.27",1211747,פנימי,לא צמוד למדד המחירים לצרכן,ישראל,ישראל,לא סחיר,בנקים,לא,2024-09-25,NR,NR,NR,ILS,1.9,2027-09-30,0.0689,0.1125,החוב לא נחות,,חברת ציטוט,אי-תלות,2025-09-30,2025-09-30,29045.17,1.0,101.09,29.36176,,,,0.067894,0.001715
209,15217.0,"מימון ישיר נדל""ן ומשכנתאות בע""מ",516100153,ח.פ.,מ. ישיר משכנתאות א 4.45% צמוד 31.12.31,1208818,פנימי,"צמוד למט""ח",ישראל,ישראל,לא סחיר,אשראי חוץ בנקאי,לא,2024-07-14,A3.il,מידרוג Moodys,נייר ערך,ILS,2.96,2031-12-31,0.0443,0.0445,החוב לא נחות,,חברת ציטוט,אי-תלות,2025-09-30,2025-09-30,8446.23,1.0,105.78,8.93443,,,,0.020659,0.000522
209,15217.0,י.ח.ק להשקעות- שותפות מוגבלת,550016091,ח.פ.,י.ח.ק השקעות אגח ב 2.86% שקלי 31.12.28,1181783,פנימי,צמוד למדד המחירים לצרכן,ישראל,ישראל,לא סחיר,השקעה ואחזקות,לא,2021-11-14,ilA+,S&P מעלות,נייר ערך,ILS,1.63,2028-12-31,0.068,0.0286,החוב לא נחות,,אחר,אי-תלות,2025-09-30,2025-09-30,1394.67,1.0,98.48,1.37348,,,,0.003175,8e-05
209,15217.0,מירלנד דיוולופמנט קורפריישן פי אל סי,1502,פנימי,מירלנד שטר הון 1.00% 01.01.2027,1182963,פנימי,צמוד למדד המחירים לצרכן,ישראל,רוסיה,לא סחיר,בנייה,לא,2021-11-26,NR,NR,NR,ILS,0.0,2027-01-01,0.0,0.01,החוב לא נחות,,אחר,אי-תלות,2025-09-30,2025-09-30,3283.91,1.0,0.0,0.0,,,,0.0,0.0
209,15217.0,"מת""ם - מרכז תעשיות מדע חיפה בע""מ",510687403,ח.פ.,"מת""ם  אגח א 3.10% שקלי 30.06.27",11389991,פנימי,צמוד למדד המחירים לצרכן,ישראל,ישראל,לא סחיר,"נדל""ן מניב בישראל",לא,2016-08-16,Aa2.il,מידרוג Moodys,נייר ערך,ILS,1.2213,2027-06-30,0.0466,0.031,החוב לא נחות,,אחר,אי-תלות,2025-09-30,2025-09-30,5890.71,1.0,98.25,5.78762,,,,0.013382,0.000338
209,2187.0,DEAN FOODS CO,5RGFDMYH829UYJH0KY29,LEI,DF 6.5 03/15/23,US242370AD62,ISIN,צמוד למדד המחירים לצרכן,"חו""ל","ארה""ב",לא סחיר,Food Products,לא,2015-02-20,D,S&P,נייר ערך,USD,0.0,2023-03-15,0.0,0.065,החוב לא נחות,,אחר,אי-תלות,2025-09-30,2025-09-30,6371.53,3.306,0.0883,0.0186,,,,1.0,0.0
209,2187.0,Endo International PLC,549300KK5WR4MGN4YT97,LEI,ENDO 7.5% 04/27,72961956,פנימי,צמוד למדד המחירים לצרכן,"חו""ל","ארה""ב",לא סחיר,Health Care Equipment & Supplies,לא,2019-03-14,D,S&P,נייר ערך,USD,100.0,2027-04-01,2.0,0.075,החוב לא נחות,,אחר,אי-תלות,2025-09-30,2025-09-30,1287.92,3.306,1e-06,0.0,,,,0.0,0.0
209,2188.0,"ביטוח ישיר - השקעות פיננסיות בע""מ",520044439,ח.פ.,ביטוח ישיר אגח יא 4.60% שקלי 30.06.28,IL0011388258,ISIN,צמוד למדד המחירים לצרכן,ישראל,ישראל,לא סחיר,השקעה ואחזקות,לא,2016-07-19,A2.il,מידרוג Moodys,נייר ערך,ILS,1.99,2028-06-30,0.0599,0.046,החוב לא נחות,,אחר,אי-תלות,2025-09-30,2025-09-30,16456.31,1.0,99.93,16.44479,,,,0.002959,8e-05
209,2188.0,"קרדיטו הנפקות בע""מ",516804499,ח.פ.,קרדיטו אגח ב 10% שקלי 15.03.51,IL0012162744,ISIN,צמוד למדד המחירים לצרכן,ישראל,ישראל,לא סחיר,אשראי חוץ בנקאי,לא,2025-01-12,NR,NR,NR,ILS,9.22,2051-03-13,0.105,0.1,החוב לא נחות,,אחר,אי-תלות,2025-09-30,2025-09-30,92757.02,1.0,93.57,86.79274,,,,0.015619,0.000426
209,2188.0,"רפאל מערכות לחימה מתקדמות בע""מ",520042185,ח.פ.,רפאל אגח ד 3.74% שקלי 15.09.34,IL0011402844,ISIN,צמוד למדד המחירים לצרכן,ישראל,ישראל,לא סחיר,ביטחוניות,לא,2017-03-01,AA+,פנימי,נייר ערך,ILS,4.4,2034-09-15,0.0478,0.0374,החוב לא נחות,,אחר,אי-תלות,2025-09-30,2025-09-30,26263.6,1.0,96.46,25.33387,,,,0.004559,0.000124
209,2188.0,"מימון ישיר נדלן ומשכנתאות הנפקות (סד 1) בע""מ",516100153,ח.פ.,מימון ישיר נדלן אגח 1 5.00% צמוד 20.02.54,IL0012152687,ISIN,"צמוד למט""ח",ישראל,ישראל,לא סחיר,אשראי חוץ בנקאי,לא,2024-12-26,Aa1.il,מידרוג Moodys,נייר ערך,ILS,10.61,2054-02-20,0.0456,0.05,החוב לא נחות,,חברת ציטוט,אי-תלות,2025-09-30,2025-09-30,88500.82,1.0,106.71,94.43923,,,,0.016995,0.000464
209,2188.0,אורמת טכנולוגיות אינק,520036716,ח.פ.,אורמת סדרה 4 3.35% שקלי 15.06.31,IL0011672123,ISIN,צמוד למדד המחירים לצרכן,ישראל,ישראל,לא סחיר,אנרגיה מתחדשת,לא,2020-07-01,ilAA-,S&P מעלות,נייר ערך,ILS,2.9457,2031-06-15,0.0518,0.0335,החוב לא נחות,,אחר,אי-תלות,2025-09-30,2025-09-30,61016.35,1.0,95.91,58.52078,,,,0.010531,0.000287
209,2188.0,"מימון ישיר מקבוצת ישיר(2006) בע""מ",513893123,ח.פ.,מימון ישיר אגח 16 4.25% צמוד 12.05.28,IL0011983405,ISIN,"צמוד למט""ח",ישראל,ישראל,לא סחיר,אשראי חוץ בנקאי,לא,2023-07-31,Aa2.il,מידרוג Moodys,נייר ערך,ILS,1.81,2028-05-12,0.0605,0.0425,החוב לא נחות,,חברת ציטוט,אי-תלות,2025-09-30,2025-09-30,59150.1,1.0,108.68,64.28433,,,,0.011569,0.000316
209,2188.0,"בנק לאומי לישראל בע""מ",520018078,ח.פ.,"בנק לאומי סדרה 4 2.2% ב""י 24.6.29",IL0012219288,ISIN,לא צמוד למדד המחירים לצרכן,ישראל,ישראל,לא סחיר,בנקים,לא,2025-05-22,NR,NR,NR,ILS,3.32,2029-06-24,0.0642,0.112,החוב לא נחות,,חברת ציטוט,אי-תלות,2025-09-30,2025-09-30,279107.13,1.0,99.38,277.37667,,,,0.049918,0.001363
209,2188.0,"גב-ים נגב בע""מ",514189596,ח.פ.,גב ים אגח ב 3.84% צמוד 31.12.28,IL0012084534,ISIN,"צמוד למט""ח",ישראל,ישראל,לא סחיר,"נדל""ן מניב בישראל",לא,2024-07-11,ilA+,S&P מעלות,נייר ערך,ILS,2.89,2028-12-31,0.0422,0.0384,החוב לא נחות,,חברת ציטוט,אי-תלות,2025-09-30,2025-09-30,177448.21,1.0,106.65,189.24852,,,,0.034058,0.00093
209,2188.0,"בנק לאומי לישראל בע""מ",520018078,ח.פ.,בנק לאומי סדרה 3 3.69% צמוד 24.05.35,IL0012150293,ISIN,צמוד למדד המחירים לצרכן,ישראל,ישראל,לא סחיר,בנקים,לא,2024-12-23,NR,NR,NR,ILS,3.73,2035-05-24,0.037,0.0369,החוב לא נחות,,חברת ציטוט,אי-תלות,2025-09-30,2025-09-30,559514.21,1.0,103.39,578.48175,,,,0.104107,0.002844
209,2188.0,נתיבי הגז הטבעי לישראל,513436394,ח.פ.,נתיבי גז אגח ג 4.80% צמוד 31.12.31,IL0011255093,ISIN,"צמוד למט""ח",ישראל,ישראל,לא סחיר,תשתיות,לא,2012-01-02,Aaa.il,מידרוג Moodys,נייר ערך,ILS,3.03,2031-12-31,0.0312,0.048,החוב לא נחות,,חברת ציטוט,אי-תלות,2025-09-30,2025-09-30,68089.9,1.0,131.46,89.51097,,,,0.016108,0.000439
209,2188.0,"מימון ישיר נדל""ן ומשכנתאות הנפקות (סדרה 2) בע""מ",517112074,ח.פ.,"מימון ישיר נדלן אגח (סדרה 2) 3.3%+ ב""י 20.06.54",IL0012257965,ISIN,צמוד למדד המחירים לצרכן,ישראל,ישראל,לא סחיר,אשראי חוץ בנקאי,לא,2025-07-29,Aa1.il,מידרוג Moodys,נייר ערך,ILS,7.4,2054-06-20,0.0739,0.078,החוב לא נחות,,אחר,אי-תלות,2025-09-30,2025-09-30,68749.51,1.0,100.1,68.81826,,,,0.012385,0.000338
209,2188.0,"גמול חברה להשקעות בע""מ",520018136,ח.פ.,"גמול אג""ח ב- הסדר",IL0011167553,ISIN,צמוד למדד המחירים לצרכן,ישראל,ישראל,לא סחיר,"נדל""ן מניב בישראל",לא,2009-07-01,NR,NR,NR,ILS,0.01,2021-09-30,0.0001,0.045,החוב לא נחות,,אחר,אי-תלות,2025-09-30,2025-09-30,181.42,1.0,39.0,0.07075,,,,1.2e-05,0.0
209,2188.0,חברת החשמל,520000472,ח.פ.,חברת חשמל 6.00% צמוד 07.05.29,IL0060001869,ISIN,"צמוד למט""ח",ישראל,ישראל,לא סחיר,אנרגיה,לא,2014-05-07,Aaa.il,מידרוג Moodys,נייר ערך,ILS,1.95,2029-05-07,0.0356,0.06,החוב לא נחות,,חברת ציטוט,אי-תלות,2025-09-30,2025-09-30,87419.03,1.0,129.32,113.05028,,,,0.020344,0.000555
209,2188.0,מקורות,520010869,ח.פ.,מקורות אגח 8 4.10% צמוד 14.07.48,IL0011243461,ISIN,"צמוד למט""ח",ישראל,ישראל,לא סחיר,תשתיות,לא,2011-07-14,ilAAA,S&P מעלות,נייר ערך,ILS,9.36,2048-07-14,0.0298,0.041,החוב לא נחות,,חברת ציטוט,אי-תלות,2025-09-30,2025-09-30,1095537.77,1.0,139.55,1528.82295,,,,0.275136,0.007514
209,2188.0,"בנק הפועלים בע""מ",520000118,ח.פ.,"פועלים אגח 2 2.25% ב""י 07.11.28",IL0012275454,ISIN,לא צמוד למדד המחירים לצרכן,ישראל,ישראל,לא סחיר,בנקים,לא,2025-08-27,NR,NR,NR,ILS,2.83,2028-11-07,0.0711,0.0675,החוב לא נחות,,חברת ציטוט,אי-תלות,2025-09-30,2025-09-30,241974.83,1.0,99.52,240.81335,,,,0.043338,0.001183
209,2188.0,"מכלול מימון נדל""ן בע""מ",515759777,ח.פ.,מכלול נדלן אגח 1 1.00% פריים 30.11.26,IL0012071416,ISIN,לא צמוד למדד המחירים לצרכן,ישראל,ישראל,לא סחיר,אשראי חוץ בנקאי,לא,2024-06-03,NR,NR,NR,ILS,1.12,2026-11-30,0.0633,0.0816,החוב לא נחות,,חברת ציטוט,אי-תלות,2025-09-30,2025-09-30,54035.29,1.0,103.36,58.21652,,,,0.010476,0.000285
209,2188.0,"מימון ישיר נדל""ן ומשכנתאות הנפקות (סדרה 2) בע""מ",517112074,ח.פ.,מימון ישיר נדלן אגח (סדרה 2) 5.25% צמוד 20.06.54,IL0012257882,ISIN,"צמוד למט""ח",ישראל,ישראל,לא סחיר,אשראי חוץ בנקאי,לא,2025-07-29,Aa1.il,מידרוג Moodys,נייר ערך,ILS,10.31,2054-06-20,0.0489,0.0525,החוב לא נחות,,חברת ציטוט,אי-תלות,2025-09-30,2025-09-30,126558.21,1.0,103.96,131.56991,,,,0.023678,0.000646
209,2188.0,נתיבי הגז הטבעי לישראל,513436394,ח.פ.,נתיבי גז אגח א 5.60% צמוד 29.12.26,IL0011030843,ISIN,"צמוד למט""ח",ישראל,ישראל,לא סחיר,תשתיות,לא,2007-01-02,Aaa.il,מידרוג Moodys,נייר ערך,ILS,0.57,2026-12-29,0.0991,0.056,החוב לא נחות,,חברת ציטוט,אי-תלות,2025-09-30,2025-09-30,66995.34,1.0,147.67,98.93202,,,,0.017803,0.000484
209,2188.0,"בנק לאומי לישראל בע""מ",520018078,ח.פ.,"בנק לאומי סדרה 2 2.30% ב""י 24.08.30",IL0012058975,ISIN,לא צמוד למדד המחירים לצרכן,ישראל,ישראל,לא סחיר,בנקים,לא,2024-04-17,NR,NR,NR,ILS,4.17,2030-08-24,0.0705,0.113,החוב לא נחות,,חברת ציטוט,אי-תלות,2025-09-30,2025-09-30,218692.93,1.0,101.46,221.88584,,,,0.039932,0.00109
209,2188.0,בנק ירושלים בע''מ,520025636,ח.פ.,בנק ירושלים COCO 5.13% צמוד 05.12.32,2004863,פנימי,צמוד למדד המחירים לצרכן,ישראל,ישראל,לא סחיר,בנקים,לא,2022-12-05,ilA-,S&P מעלות,נייר ערך,ILS,6.0943,2032-12-05,0.0443,0.0513,החוב לא נחות,,אחר,אי-תלות,2025-09-30,2025-09-30,37181.99,1.0,114.54,42.58825,,,,0.007664,0.000209
209,2188.0,"מכלול מימון נדל""ן בע""מ",515759777,ח.פ.,מכלול נדלן אגח 2 1% פריים 01.01.28,1215193,פנימי,לא צמוד למדד המחירים לצרכן,ישראל,ישראל,לא סחיר,אשראי חוץ בנקאי,לא,2024-12-25,NR,NR,NR,ILS,2.1,2028-01-01,0.0641,0.07,החוב לא נחות,,חברת ציטוט,אי-תלות,2025-09-30,2025-09-30,194985.57,1.0,101.45,199.70137,,,,0.035938,0.000981
209,2188.0,"בנק הפועלים בע""מ",520000118,ח.פ.,"פועלים אגח 1 2.25% ב""י 30.09.27",1211747,פנימי,לא צמוד למדד המחירים לצרכן,ישראל,ישראל,לא סחיר,בנקים,לא,2024-09-25,NR,NR,NR,ILS,1.9,2027-09-30,0.0689,0.1125,החוב לא נחות,,חברת ציטוט,אי-תלות,2025-09-30,2025-09-30,312041.43,1.0,101.09,315.44268,,,,0.056769,0.00155
209,2188.0,"פרופיט תעשיות בניה בע""מ",520040650,ח.פ.,הפרשי שווי-פרופיט אגח ד' - הסדר חוב,54901234,פנימי,צמוד למדד המחירים לצרכן,ישראל,ישראל,לא סחיר,בנייה,לא,2016-10-19,NR,NR,NR,ILS,0.01,2025-12-31,0.0001,1e-05,החוב לא נחות,,אחר,אי-תלות,2025-09-30,2025-09-30,-17224.65,1.0,100.0,-17.22465,,,,-0.003098,-8.3e-05
209,2188.0,"מימון ישיר נדל""ן ומשכנתאות בע""מ",516100153,ח.פ.,מ. ישיר משכנתאות א 4.45% צמוד 31.12.31,1208818,פנימי,"צמוד למט""ח",ישראל,ישראל,לא סחיר,אשראי חוץ בנקאי,לא,2024-07-14,A3.il,מידרוג Moodys,נייר ערך,ILS,2.96,2031-12-31,0.0443,0.0445,החוב לא נחות,,חברת ציטוט,אי-תלות,2025-09-30,2025-09-30,90740.56,1.0,105.78,95.98537,,,,0.017274,0.000471
209,2188.0,כלל תעשיות,520021874,ח.פ.,כלל תעשיות אגח טז 4.47% שקלי 30.06.27,6080238,פנימי,צמוד למדד המחירים לצרכן,ישראל,ישראל,לא סחיר,השקעה ואחזקות,לא,2019-12-29,A2.il,מידרוג Moodys,נייר ערך,ILS,1.45,2027-06-30,0.0535,0.0447,החוב לא נחות,,אחר,אי-תלות,2025-09-30,2025-09-30,18314.8,1.0,100.02,18.31847,,,,0.003296,9e-05
209,2188.0,"פרופיט תעשיות בניה בע""מ",520040650,ח.פ.,פרופיט אגח ד' ד-הסדר חוב,54901233,פנימי,צמוד למדד המחירים לצרכן,ישראל,ישראל,לא סחיר,בנייה,לא,2016-10-19,NR,NR,NR,ILS,0.0,2025-12-31,0.0,0.04,החוב לא נחות,,אחר,אי-תלות,2025-09-30,2025-09-30,14568.35,1.0,169.762176,19.35072,,,,0.003482,9.4e-05
209,2188.0,"עוגן- אג""ח חברתית 2 בע""מ (חל""צ)",516556545,ח.פ.,"עוגן אג""ח בכיר 0.5% פריים 15.03.26",1196831,פנימי,צמוד למדד המחירים לצרכן,ישראל,ישראל,לא סחיר,שירותים פיננסיים,לא,2023-06-15,Aa2.il,מידרוג Moodys,נייר ערך,ILS,0.32,2026-03-15,0.0777,0.125,החוב לא נחות,,אחר,אי-תלות,2025-09-30,2025-09-30,1452.43,1.0,100.62,1.46144,,,,0.000263,7e-06
209,2188.0,"עוגן- אג""ח חברתית 2 בע""מ (חל""צ)",516556545,ח.פ.,"עוגן אג""ח רגילה 2.35% פריים 15.7.27",1196849,פנימי,צמוד למדד המחירים לצרכן,ישראל,ישראל,לא סחיר,שירותים פיננסיים,לא,2023-06-15,NR,NR,NR,ILS,1.15,2027-06-15,0.0901,0.1435,החוב לא נחות,,אחר,אי-תלות,2025-09-30,2025-09-30,11154.6,1.0,101.23,11.2918,,,,0.002032,5.5e-05
209,2188.0,"בנק לאומי לישראל בע""מ",520018078,ח.פ.,"בנק לאומי סדרה 1 2.3% ב""י 24.12.26",1198639,פנימי,לא צמוד למדד המחירים לצרכן,ישראל,ישראל,לא סחיר,בנקים,לא,2023-08-07,NR,NR,NR,ILS,1.18,2026-12-24,0.0715,0.113,החוב לא נחות,,חברת ציטוט,אי-תלות,2025-09-30,2025-09-30,54933.13,1.0,100.51,55.21328,,,,0.009936,0.000271
209,2188.0,מקורות,520010869,ח.פ.,מקורות אגח 6 4.90% צמוד 25.12.36,1100908,פנימי,צמוד למדד המחירים לצרכן,ישראל,ישראל,לא סחיר,תשתיות,לא,2006-12-25,AA,פנימי,נייר ערך,ILS,4.96,2036-12-25,0.0283,0.049,החוב לא נחות,,חברת ציטוט,אי-תלות,2025-09-30,2025-09-30,385881.82,1.0,164.64,635.31582,,,,0.114335,0.003123
209,2188.0,מקורות,520010869,ח.פ.,מקורות אגח 6 4.90% צמוד 25.12.36,11009081,פנימי,"צמוד למט""ח",ישראל,ישראל,לא סחיר,תשתיות,לא,2010-12-25,ilAAA,S&P מעלות,נייר ערך,ILS,4.9814,2036-12-25,0.0273,0.049,החוב לא נחות,,חברת ציטוט,אי-תלות,2025-09-30,2025-09-30,37394.59,1.0,164.64,61.56646,,,,0.011079,0.000302
209,2188.0,"אגרקסקו חברה ליצוא חקלאי בע""מ",510155625,ח.פ.,אגרקסקו אגח א חש4/12,1126770,פנימי,צמוד למדד המחירים לצרכן,ישראל,ישראל,לא סחיר,מסחר,לא,2007-12-27,NR,NR,NR,ILS,0.0,2017-04-30,0.0,0.0615,החוב לא נחות,,אחר,אי-תלות,2025-09-30,2025-09-30,43.74,1.0,0.0001,0.0,,,,0.0,0.0
209,2188.0,"נתיבים אג""ח בע""מ",513502229,ח.פ.,נתיבים אגח א 7.97% דולרי 04.07.27,10902810,פנימי,"צמוד למט""ח",ישראל,ישראל,לא סחיר,השקעה ואחזקות,כן,2004-03-28,Aa1.il,מידרוג Moodys,נייר ערך,USD,0.9755,2027-07-04,0.045,0.0797,החוב לא נחות,,חברת ציטוט,אי-תלות,2025-09-30,2025-09-30,4269.25,3.306,105.33,14.86644,,,,0.002675,7.3e-05
209,2188.0,"גדות מסופים לכימיקלים (1985) בע""מ",520040775,ח.פ.,גדות אגח א 4.30% שקלי 30.06.26,11623202,פנימי,צמוד למדד המחירים לצרכן,ישראל,ישראל,לא סחיר,מסחר,לא,2020-05-10,A3.il,מידרוג Moodys,נייר ערך,ILS,0.6561,2026-06-30,0.0539,0.043,החוב לא נחות,,אחר,אי-תלות,2025-09-30,2025-09-30,16797.51,1.0,100.43,16.86974,,,,0.003035,8.2e-05
209,2188.0,י.ח.ק להשקעות- שותפות מוגבלת,550016091,ח.פ.,י.ח.ק השקעות אגח ב 2.86% שקלי 31.12.28,1181783,פנימי,צמוד למדד המחירים לצרכן,ישראל,ישראל,לא סחיר,השקעה ואחזקות,לא,2021-11-14,ilA+,S&P מעלות,נייר ערך,ILS,1.63,2028-12-31,0.068,0.0286,החוב לא נחות,,אחר,אי-תלות,2025-09-30,2025-09-30,14983.43,1.0,98.48,14.75568,,,,0.002655,7.2e-05
209,2188.0,מירלנד דיוולופמנט קורפריישן פי אל סי,1502,פנימי,מירלנד שטר הון 1.00% 01.01.2027,1182963,פנימי,צמוד למדד המחירים לצרכן,ישראל,רוסיה,לא סחיר,בנייה,לא,2021-11-26,NR,NR,NR,ILS,0.0,2027-01-01,0.0,0.01,החוב לא נחות,,אחר,אי-תלות,2025-09-30,2025-09-30,35280.02,1.0,0.0,0.0,,,,0.0,0.0
209,2188.0,"איילון חברת לביטוח בע""מ",520030677,ח.פ.,איילון אגח ג 7.75% שקלי 31.12.27,11955771,פנימי,צמוד למדד המחירים לצרכן,ישראל,ישראל,לא סחיר,ביטוח,לא,2022-11-22,A3.il,מידרוג Moodys,נייר ערך,ILS,2.0754,2027-12-31,0.0638,0.0775,החוב לא נחות,,אחר,אי-תלות,2025-09-30,2025-09-30,63107.0,1.0,104.94,66.22449,,,,0.011918,0.000325
209,2188.0,"מת""ם - מרכז תעשיות מדע חיפה בע""מ",510687403,ח.פ.,"מת""ם  אגח א 3.10% שקלי 30.06.27",11389991,פנימי,צמוד למדד המחירים לצרכן,ישראל,ישראל,לא סחיר,"נדל""ן מניב בישראל",לא,2016-08-16,Aa2.il,מידרוג Moodys,נייר ערך,ILS,1.2213,2027-06-30,0.0466,0.031,החוב לא נחות,,אחר,אי-תלות,2025-09-30,2025-09-30,63285.73,1.0,98.25,62.17823,,,,0.01119,0.000305
209,2188.0,DEAN FOODS CO,5RGFDMYH829UYJH0KY29,LEI,DF 6.5 03/15/23,US242370AD62,ISIN,צמוד למדד המחירים לצרכן,"חו""ל","ארה""ב",לא סחיר,Food Products,לא,2015-02-20,D,S&P,נייר ערך,USD,0.0,2023-03-15,0.0,0.065,החוב לא נחות,,אחר,אי-תלות,2025-09-30,2025-09-30,20903.37,3.306,0.0883,0.06102,,,,1e-05,0.0
209,2188.0,Endo International PLC,549300KK5WR4MGN4YT97,LEI,ENDO 7.5% 04/27,72961956,פנימי,צמוד למדד המחירים לצרכן,"חו""ל","ארה""ב",לא סחיר,Health Care Equipment & Supplies,לא,2019-03-14,D,S&P,נייר ערך,USD,100.0,2027-04-01,2.0,0.075,החוב לא נחות,,אחר,אי-תלות,2025-09-30,2025-09-30,4225.34,3.306,1e-06,0.0,,,,0.0,0.0
209,9974.0,מקורות,520010869,ח.פ.,מקורות אגח 8 4.10% צמוד 14.07.48,IL0011243461,ISIN,"צמוד למט""ח",ישראל,ישראל,לא סחיר,תשתיות,לא,2011-07-14,ilAAA,S&P מעלות,נייר ערך,ILS,9.36,2048-07-14,0.0298,0.041,החוב לא נחות,,חברת ציטוט,אי-תלות,2025-09-30,2025-09-30,6168213.06,1.0,139.55,8607.74133,,,,0.131264,0.000147
209,9974.0,נתיבי הגז הטבעי לישראל,513436394,ח.פ.,נתיבי גז אגח ג 4.80% צמוד 31.12.31,IL0011255093,ISIN,"צמוד למט""ח",ישראל,ישראל,לא סחיר,תשתיות,לא,2012-01-02,Aaa.il,מידרוג Moodys,נייר ערך,ILS,3.03,2031-12-31,0.0312,0.048,החוב לא נחות,,חברת ציטוט,אי-תלות,2025-09-30,2025-09-30,3882488.98,1.0,131.46,5103.92001,,,,0.077832,8.7e-05
209,9974.0,"ביטוח ישיר - השקעות פיננסיות בע""מ",520044439,ח.פ.,ביטוח ישיר אגח יא 4.60% שקלי 30.06.28,IL0011388258,ISIN,צמוד למדד המחירים לצרכן,ישראל,ישראל,לא סחיר,השקעה ואחזקות,לא,2016-07-19,A2.il,מידרוג Moodys,נייר ערך,ILS,1.99,2028-06-30,0.0599,0.046,החוב לא נחות,,אחר,אי-תלות,2025-09-30,2025-09-30,3523010.1,1.0,99.93,3520.54399,,,,0.053686,6e-05
209,9974.0,נתיבי הגז הטבעי לישראל,513436394,ח.פ.,נתיבי גז אגח א 5.60% צמוד 29.12.26,IL0011030843,ISIN,"צמוד למט""ח",ישראל,ישראל,לא סחיר,תשתיות,לא,2007-01-02,Aaa.il,מידרוג Moodys,נייר ערך,ILS,0.57,2026-12-29,0.0991,0.056,החוב לא נחות,,חברת ציטוט,אי-תלות,2025-09-30,2025-09-30,2674874.96,1.0,147.67,3949.98786,,,,0.060235,6.7e-05
209,9974.0,"גמול חברה להשקעות בע""מ",520018136,ח.פ.,"גמול אג""ח ב- הסדר",IL0011167553,ISIN,צמוד למדד המחירים לצרכן,ישראל,ישראל,לא סחיר,"נדל""ן מניב בישראל",לא,2009-07-01,NR,NR,NR,ILS,0.01,2021-09-30,0.0001,0.045,החוב לא נחות,,אחר,אי-תלות,2025-09-30,2025-09-30,3720.93,1.0,39.0,1.45116,,,,2.2e-05,0.0
209,9974.0,"חבס השקעות (1960) בע""מ",520039017,ח.פ.,חבס אגח 4,IL0041501243,ISIN,צמוד למדד המחירים לצרכן,ישראל,ישראל,לא סחיר,בנייה,לא,2010-08-04,NR,NR,NR,ILS,0.0,2018-08-05,0.0,0.05,החוב לא נחות,,אחר,אי-תלות,2025-09-30,2025-09-30,8616.8,1.0,35.72,3.07792,,,,4.6e-05,0.0
209,9974.0,"רפאל מערכות לחימה מתקדמות בע""מ",520042185,ח.פ.,רפאל אגח ד 3.74% שקלי 15.09.34,IL0011402844,ISIN,צמוד למדד המחירים לצרכן,ישראל,ישראל,לא סחיר,ביטחוניות,לא,2017-03-01,AA+,פנימי,נייר ערך,ILS,4.4,2034-09-15,0.0478,0.0374,החוב לא נחות,,אחר,אי-תלות,2025-09-30,2025-09-30,5622581.73,1.0,96.46,5423.54233,,,,0.082707,9.2e-05
209,9974.0,"אידיבי חברה לפתוח בע""מ",520032285,ח.פ.,אידיבי-חוס מסופק,IL0079801549,ISIN,צמוד למדד המחירים לצרכן,ישראל,ישראל,לא סחיר,השקעה ואחזקות,לא,2023-12-31,NR,NR,NR,ILS,0.01,2025-12-18,0.0001,0.0,החוב לא נחות,,אחר,אי-תלות,2025-09-30,2025-09-30,-253351.14,1.0,100.0,-253.35114,,,,-0.003863,-4e-06
209,9974.0,חברת החשמל,520000472,ח.פ.,חברת חשמל 6.00% צמוד 07.05.29,IL0060001869,ISIN,"צמוד למט""ח",ישראל,ישראל,לא סחיר,אנרגיה,לא,2014-05-07,Aaa.il,מידרוג Moodys,נייר ערך,ILS,1.95,2029-05-07,0.0356,0.06,החוב לא נחות,,חברת ציטוט,אי-תלות,2025-09-30,2025-09-30,11953487.63,1.0,129.32,15458.25021,,,,0.235732,0.000264
209,9974.0,בנק ירושלים בע''מ,520025636,ח.פ.,בנק ירושלים COCO 5.13% צמוד 05.12.32,2004863,פנימי,צמוד למדד המחירים לצרכן,ישראל,ישראל,לא סחיר,בנקים,לא,2022-12-05,ilA-,S&P מעלות,נייר ערך,ILS,6.0943,2032-12-05,0.0443,0.0513,החוב לא נחות,,אחר,אי-תלות,2025-09-30,2025-09-30,7960017.46,1.0,114.54,9117.404,,,,0.139037,0.000155
209,9974.0,"פרופיט תעשיות בניה בע""מ",520040650,ח.פ.,פרופיט אגח ד' ד-הסדר חוב,54901233,פנימי,צמוד למדד המחירים לצרכן,ישראל,ישראל,לא סחיר,בנייה,לא,2016-10-19,NR,NR,NR,ILS,0.0,2025-12-31,0.0,0.04,החוב לא נחות,,אחר,אי-תלות,2025-09-30,2025-09-30,748713.71,1.0,119.91,897.7826,,,,0.01369,1.5e-05
209,9974.0,תמר אריאל קפיטל,516612256,ח.פ.,"COCO תמר אריאל קפיטל 3.06% ב""י 31.05.32",2004862,פנימי,לא צמוד למדד המחירים לצרכן,ישראל,ישראל,לא סחיר,אשראי חוץ בנקאי,לא,2022-05-25,NR,NR,NR,ILS,5.3932,2032-05-31,0.0651,0.0756,החוב לא נחות,,חברת ציטוט,אי-תלות,2025-09-30,2025-09-30,692911.4,1.0,108.11,749.10651,,,,0.011423,1.2e-05
209,9974.0,כלל תעשיות,520021874,ח.פ.,כלל תעשיות אגח טז 4.47% שקלי 30.06.27,6080238,פנימי,צמוד למדד המחירים לצרכן,ישראל,ישראל,לא סחיר,השקעה ואחזקות,לא,2019-12-29,A2.il,מידרוג Moodys,נייר ערך,ILS,1.45,2027-06-30,0.0535,0.0447,החוב לא נחות,,אחר,אי-תלות,2025-09-30,2025-09-30,3920881.6,1.0,100.02,3921.66577,,,,0.059803,6.7e-05
209,9974.0,"עוגן- אג""ח חברתית 2 בע""מ (חל""צ)",516556545,ח.פ.,"עוגן אג""ח רגילה 2.35% פריים 15.7.27",1196849,פנימי,צמוד למדד המחירים לצרכן,ישראל,ישראל,לא סחיר,שירותים פיננסיים,לא,2023-06-15,NR,NR,NR,ILS,1.15,2027-06-15,0.0901,0.1435,החוב לא נחות,,אחר,אי-תלות,2025-09-30,2025-09-30,2388005.24,1.0,101.23,2417.3777,,,,0.036864,4.1e-05
209,9974.0,"פרופיט תעשיות בניה בע""מ",520040650,ח.פ.,הפרשי שווי-פרופיט אגח ד' - הסדר חוב,54901234,פנימי,צמוד למדד המחירים לצרכן,ישראל,ישראל,לא סחיר,בנייה,לא,2016-10-19,NR,NR,NR,ILS,0.01,2025-12-31,0.0001,1e-05,החוב לא נחות,,אחר,אי-תלות,2025-09-30,2025-09-30,-816321.81,1.0,100.0,-816.32181,,,,-0.012448,-1.3e-05
209,9974.0,"אלון חברת הדלק לישראל בע""מ",520041690,ח.פ.,חוב מסופק -אלון דלק סד' 1,45411567,פנימי,צמוד למדד המחירים לצרכן,ישראל,ישראל,לא סחיר,השקעה ואחזקות,לא,2015-12-31,NR,NR,NR,ILS,0.01,2023-01-22,0.0001,0.0,החוב לא נחות,,אחר,אי-תלות,2025-09-30,2025-09-30,-4143037.64,1.0,100.0,-4143.03764,,,,-0.063179,-7e-05
209,9974.0,"עוגן- אג""ח חברתית 2 בע""מ (חל""צ)",516556545,ח.פ.,"עוגן אג""ח בכיר 0.5% פריים 15.03.26",1196831,פנימי,צמוד למדד המחירים לצרכן,ישראל,ישראל,לא סחיר,שירותים פיננסיים,לא,2023-06-15,Aa2.il,מידרוג Moodys,נייר ערך,ILS,0.32,2026-03-15,0.0777,0.125,החוב לא נחות,,אחר,אי-תלות,2025-09-30,2025-09-30,310940.25,1.0,100.62,312.86808,,,,0.004771,5e-06
209,9974.0,"גדות מסופים לכימיקלים (1985) בע""מ",520040775,ח.פ.,גדות אגח א 4.30% שקלי 30.06.26,11623202,פנימי,צמוד למדד המחירים לצרכן,ישראל,ישראל,לא סחיר,מסחר,לא,2020-05-10,A3.il,מידרוג Moodys,נייר ערך,ILS,0.6561,2026-06-30,0.0539,0.043,החוב לא נחות,,אחר,אי-תלות,2025-09-30,2025-09-30,3596054.95,1.0,100.43,3611.51799,,,,0.055074,6.1e-05
209,9974.0,"אגרקסקו חברה ליצוא חקלאי בע""מ",510155625,ח.פ.,אגרקסקו אגח א חש4/12,1126770,פנימי,צמוד למדד המחירים לצרכן,ישראל,ישראל,לא סחיר,מסחר,לא,2007-12-27,NR,NR,NR,ILS,0.0,2017-04-30,0.0,0.0615,החוב לא נחות,,אחר,אי-תלות,2025-09-30,2025-09-30,9364.73,1.0,0.0001,1e-05,,,,0.0,0.0
209,9974.0,"אגרקסקו חברה ליצוא חקלאי בע""מ",510155625,ח.פ.,אגרקסקו אגח א,1109180,פנימי,צמוד למדד המחירים לצרכן,ישראל,ישראל,לא סחיר,מסחר,לא,2011-04-30,NR,NR,NR,ILS,0.0,2017-04-30,0.0,0.099,החוב לא נחות,,אחר,אי-תלות,2025-09-30,2025-09-30,150031.75,1.0,1e-05,1e-05,,,,0.0,0.0
209,9974.0,"אלון חברת הדלק לישראל בע""מ",520041690,ח.פ.,אלון חברת הדלק 06.17,11015672,פנימי,צמוד למדד המחירים לצרכן,ישראל,ישראל,לא סחיר,השקעה ואחזקות,לא,2017-07-23,NR,NR,NR,ILS,0.0,2023-12-31,0.0,0.056,החוב לא נחות,,אחר,אי-תלות,2025-09-30,2025-09-30,3304890.07,1.0,136.44,4509.19201,,,,0.068763,7.7e-05
209,9974.0,"נתיבים אג""ח בע""מ",513502229,ח.פ.,נתיבים אגח א 7.97% דולרי 04.07.27,10902810,פנימי,"צמוד למט""ח",ישראל,ישראל,לא סחיר,השקעה ואחזקות,כן,2004-03-28,Aa1.il,מידרוג Moodys,נייר ערך,USD,0.9755,2027-07-04,0.045,0.0797,החוב לא נחות,,חברת ציטוט,אי-תלות,2025-09-30,2025-09-30,913973.19,3.306,105.33,3182.64638,,,,0.048534,5.4e-05
209,9975.0,אורמת טכנולוגיות אינק,520036716,ח.פ.,אורמת סדרה 4 3.35% שקלי 15.06.31,IL0011672123,ISIN,צמוד למדד המחירים לצרכן,ישראל,ישראל,לא סחיר,אנרגיה מתחדשת,לא,2020-07-01,ilAA-,S&P מעלות,נייר ערך,ILS,2.9457,2031-06-15,0.0518,0.0335,החוב לא נחות,,אחר,אי-תלות,2025-09-30,2025-09-30,389442.5,1.0,95.91,373.5143,,,,0.005516,2.7e-05
209,9975.0,"מימון ישיר מקבוצת ישיר(2006) בע""מ",513893123,ח.פ.,מימון ישיר אגח 16 4.25% צמוד 12.05.28,IL0011983405,ISIN,"צמוד למט""ח",ישראל,ישראל,לא סחיר,אשראי חוץ בנקאי,לא,2023-07-31,Aa2.il,מידרוג Moodys,נייר ערך,ILS,1.81,2028-05-12,0.0605,0.0425,החוב לא נחות,,חברת ציטוט,אי-תלות,2025-09-30,2025-09-30,377530.97,1.0,108.68,410.30066,,,,0.00606,2.9e-05
209,9975.0,"בנק לאומי לישראל בע""מ",520018078,ח.פ.,"בנק לאומי סדרה 2 2.30% ב""י 24.08.30",IL0012058975,ISIN,לא צמוד למדד המחירים לצרכן,ישראל,ישראל,לא סחיר,בנקים,לא,2024-04-17,NR,NR,NR,ILS,4.17,2030-08-24,0.0705,0.113,החוב לא נחות,,חברת ציטוט,אי-תלות,2025-09-30,2025-09-30,1395827.78,1.0,101.46,1416.20686,,,,0.020917,0.000103
209,9975.0,"מכלול מימון נדל""ן בע""מ",515759777,ח.פ.,מכלול נדלן אגח 1 1.00% פריים 30.11.26,IL0012071416,ISIN,לא צמוד למדד המחירים לצרכן,ישראל,ישראל,לא סחיר,אשראי חוץ בנקאי,לא,2024-06-03,NR,NR,NR,ILS,1.12,2026-11-30,0.0633,0.0816,החוב לא נחות,,חברת ציטוט,אי-תלות,2025-09-30,2025-09-30,344885.24,1.0,103.36,371.57232,,,,0.005488,2.7e-05
209,9975.0,"גב-ים נגב בע""מ",514189596,ח.פ.,גב ים אגח ב 3.84% צמוד 31.12.28,IL0012084534,ISIN,"צמוד למט""ח",ישראל,ישראל,לא סחיר,"נדל""ן מניב בישראל",לא,2024-07-11,ilA+,S&P מעלות,נייר ערך,ILS,2.89,2028-12-31,0.0422,0.0384,החוב לא נחות,,חברת ציטוט,אי-תלות,2025-09-30,2025-09-30,1132579.57,1.0,106.65,1207.89611,,,,0.01784,8.8e-05
209,9975.0,"מימון ישיר נדלן ומשכנתאות הנפקות (סד 1) בע""מ",516100153,ח.פ.,מימון ישיר נדלן אגח 1 5.00% צמוד 20.02.54,IL0012152687,ISIN,"צמוד למט""ח",ישראל,ישראל,לא סחיר,אשראי חוץ בנקאי,לא,2024-12-26,Aa1.il,מידרוג Moodys,נייר ערך,ILS,10.61,2054-02-20,0.0456,0.05,החוב לא נחות,,חברת ציטוט,אי-תלות,2025-09-30,2025-09-30,564864.66,1.0,106.71,602.76708,,,,0.008902,4.4e-05
209,9975.0,"בנק לאומי לישראל בע""מ",520018078,ח.פ.,"בנק לאומי סדרה 4 2.2% ב""י 24.6.29",IL0012219288,ISIN,לא צמוד למדד המחירים לצרכן,ישראל,ישראל,לא סחיר,בנקים,לא,2025-05-22,NR,NR,NR,ILS,3.32,2029-06-24,0.0642,0.112,החוב לא נחות,,חברת ציטוט,אי-תלות,2025-09-30,2025-09-30,1781427.01,1.0,99.38,1770.38216,,,,0.026148,0.000129
209,9975.0,"רפאל מערכות לחימה מתקדמות בע""מ",520042185,ח.פ.,רפאל אגח ד 3.74% שקלי 15.09.34,IL0011402844,ISIN,צמוד למדד המחירים לצרכן,ישראל,ישראל,לא סחיר,ביטחוניות,לא,2017-03-01,AA+,פנימי,נייר ערך,ILS,4.4,2034-09-15,0.0478,0.0374,החוב לא נחות,,אחר,אי-תלות,2025-09-30,2025-09-30,1195608.15,1.0,96.46,1153.28362,,,,0.017033,8.4e-05
209,9975.0,"מימון ישיר נדל""ן ומשכנתאות הנפקות (סדרה 2) בע""מ",517112074,ח.פ.,מימון ישיר נדלן אגח (סדרה 2) 5.25% צמוד 20.06.54,IL0012257882,ISIN,"צמוד למט""ח",ישראל,ישראל,לא סחיר,אשראי חוץ בנקאי,לא,2025-07-29,Aa1.il,מידרוג Moodys,נייר ערך,ILS,10.31,2054-06-20,0.0489,0.0525,החוב לא נחות,,חברת ציטוט,אי-תלות,2025-09-30,2025-09-30,807769.44,1.0,103.96,839.75711,,,,0.012403,6.1e-05
209,9975.0,"מימון ישיר נדל""ן ומשכנתאות הנפקות (סדרה 2) בע""מ",517112074,ח.פ.,"מימון ישיר נדלן אגח (סדרה 2) 3.3%+ ב""י 20.06.54",IL0012257965,ISIN,צמוד למדד המחירים לצרכן,ישראל,ישראל,לא סחיר,אשראי חוץ בנקאי,לא,2025-07-29,Aa1.il,מידרוג Moodys,נייר ערך,ILS,7.4,2054-06-20,0.0739,0.078,החוב לא נחות,,אחר,אי-תלות,2025-09-30,2025-09-30,438800.12,1.0,100.1,439.23892,,,,0.006487,3.2e-05
209,9975.0,"בנק הפועלים בע""מ",520000118,ח.פ.,"פועלים אגח 2 2.25% ב""י 07.11.28",IL0012275454,ISIN,לא צמוד למדד המחירים לצרכן,ישראל,ישראל,לא סחיר,בנקים,לא,2025-08-27,NR,NR,NR,ILS,2.83,2028-11-07,0.0711,0.0675,החוב לא נחות,,חברת ציטוט,אי-תלות,2025-09-30,2025-09-30,1544426.68,1.0,99.52,1537.01343,,,,0.022701,0.000112
209,9975.0,חברת החשמל,520000472,ח.פ.,חברת חשמל 6.00% צמוד 07.05.29,IL0060001869,ISIN,"צמוד למט""ח",ישראל,ישראל,לא סחיר,אנרגיה,לא,2014-05-07,Aaa.il,מידרוג Moodys,נייר ערך,ILS,1.95,2029-05-07,0.0356,0.06,החוב לא נחות,,חברת ציטוט,אי-תלות,2025-09-30,2025-09-30,3013276.27,1.0,129.32,3896.76887,,,,0.057553,0.000284
209,9975.0,"קרדיטו הנפקות בע""מ",516804499,ח.פ.,קרדיטו אגח ב 10% שקלי 15.03.51,IL0012162744,ISIN,צמוד למדד המחירים לצרכן,ישראל,ישראל,לא סחיר,אשראי חוץ בנקאי,לא,2025-01-12,NR,NR,NR,ILS,9.22,2051-03-13,0.105,0.1,החוב לא נחות,,אחר,אי-תלות,2025-09-30,2025-09-30,592030.23,1.0,93.57,553.96268,,,,0.008181,4e-05
209,9975.0,"ביטוח ישיר - השקעות פיננסיות בע""מ",520044439,ח.פ.,ביטוח ישיר אגח יא 4.60% שקלי 30.06.28,IL0011388258,ISIN,צמוד למדד המחירים לצרכן,ישראל,ישראל,לא סחיר,השקעה ואחזקות,לא,2016-07-19,A2.il,מידרוג Moodys,נייר ערך,ILS,1.99,2028-06-30,0.0599,0.046,החוב לא נחות,,אחר,אי-תלות,2025-09-30,2025-09-30,749146.89,1.0,99.93,748.62248,,,,0.011056,5.4e-05
209,9975.0,"בנק לאומי לישראל בע""מ",520018078,ח.פ.,בנק לאומי סדרה 3 3.69% צמוד 24.05.35,IL0012150293,ISIN,צמוד למדד המחירים לצרכן,ישראל,ישראל,לא סחיר,בנקים,לא,2024-12-23,NR,NR,NR,ILS,3.73,2035-05-24,0.037,0.0369,החוב לא נחות,,חברת ציטוט,אי-תלות,2025-09-30,2025-09-30,3571151.05,1.0,103.39,3692.21307,,,,0.054533,0.000269
209,9975.0,נתיבי הגז הטבעי לישראל,513436394,ח.פ.,נתיבי גז אגח ג 4.80% צמוד 31.12.31,IL0011255093,ISIN,"צמוד למט""ח",ישראל,ישראל,לא סחיר,תשתיות,לא,2012-01-02,Aaa.il,מידרוג Moodys,נייר ערך,ILS,3.03,2031-12-31,0.0312,0.048,החוב לא נחות,,חברת ציטוט,אי-תלות,2025-09-30,2025-09-30,1571253.04,1.0,131.46,2065.56925,,,,0.030506,0.000149
209,9975.0,נתיבי הגז הטבעי לישראל,513436394,ח.פ.,נתיבי גז אגח א 5.60% צמוד 29.12.26,IL0011030843,ISIN,"צמוד למט""ח",ישראל,ישראל,לא סחיר,תשתיות,לא,2007-01-02,Aaa.il,מידרוג Moodys,נייר ערך,ILS,0.57,2026-12-29,0.0991,0.056,החוב לא נחות,,חברת ציטוט,אי-תלות,2025-09-30,2025-09-30,1382323.9,1.0,147.67,2041.2777,,,,0.030147,0.000148
209,9975.0,מקורות,520010869,ח.פ.,מקורות אגח 8 4.10% צמוד 14.07.48,IL0011243461,ISIN,"צמוד למט""ח",ישראל,ישראל,לא סחיר,תשתיות,לא,2011-07-14,ilAAA,S&P מעלות,נייר ערך,ILS,9.36,2048-07-14,0.0298,0.041,החוב לא נחות,,חברת ציטוט,אי-תלות,2025-09-30,2025-09-30,17234547.6,1.0,139.55,24050.81116,,,,0.355223,0.001755
209,9975.0,"גמול חברה להשקעות בע""מ",520018136,ח.פ.,"גמול אג""ח ב- הסדר",IL0011167553,ISIN,צמוד למדד המחירים לצרכן,ישראל,ישראל,לא סחיר,"נדל""ן מניב בישראל",לא,2009-07-01,NR,NR,NR,ILS,0.01,2021-09-30,0.0001,0.045,החוב לא נחות,,אחר,אי-תלות,2025-09-30,2025-09-30,459.38,1.0,39.0,0.17915,,,,2e-06,0.0
209,9975.0,"מת""ם - מרכז תעשיות מדע חיפה בע""מ",510687403,ח.פ.,"מת""ם  אגח א 3.10% שקלי 30.06.27",11389991,פנימי,צמוד למדד המחירים לצרכן,ישראל,ישראל,לא סחיר,"נדל""ן מניב בישראל",לא,2016-08-16,Aa2.il,מידרוג Moodys,נייר ערך,ILS,1.2213,2027-06-30,0.0466,0.031,החוב לא נחות,,אחר,אי-תלות,2025-09-30,2025-09-30,403926.98,1.0,98.25,396.85826,,,,0.005861,2.8e-05
209,9975.0,"מכלול מימון נדל""ן בע""מ",515759777,ח.פ.,מכלול נדלן אגח 2 1% פריים 01.01.28,1215193,פנימי,לא צמוד למדד המחירים לצרכן,ישראל,ישראל,לא סחיר,אשראי חוץ בנקאי,לא,2024-12-25,NR,NR,NR,ILS,2.1,2028-01-01,0.0641,0.07,החוב לא נחות,,חברת ציטוט,אי-תלות,2025-09-30,2025-09-30,1244513.41,1.0,101.45,1274.61236,,,,0.018825,9.2e-05
209,9975.0,"נתיבים אג""ח בע""מ",513502229,ח.פ.,נתיבים אגח א 7.97% דולרי 04.07.27,10902810,פנימי,"צמוד למט""ח",ישראל,ישראל,לא סחיר,השקעה ואחזקות,כן,2004-03-28,Aa1.il,מידרוג Moodys,נייר ערך,USD,0.9755,2027-07-04,0.045,0.0797,החוב לא נחות,,חברת ציטוט,אי-תלות,2025-09-30,2025-09-30,194350.89,3.306,105.33,676.77059,,,,0.009995,4.9e-05
209,9975.0,"אגרקסקו חברה ליצוא חקלאי בע""מ",510155625,ח.פ.,אגרקסקו אגח א חש4/12,1126770,פנימי,צמוד למדד המחירים לצרכן,ישראל,ישראל,לא סחיר,מסחר,לא,2007-12-27,NR,NR,NR,ILS,0.0,2017-04-30,0.0,0.0615,החוב לא נחות,,אחר,אי-תלות,2025-09-30,2025-09-30,1991.35,1.0,0.0001,0.0,,,,0.0,0.0
209,9975.0,"בנק הפועלים בע""מ",520000118,ח.פ.,"פועלים אגח 1 2.25% ב""י 30.09.27",1211747,פנימי,לא צמוד למדד המחירים לצרכן,ישראל,ישראל,לא סחיר,בנקים,לא,2024-09-25,NR,NR,NR,ILS,1.9,2027-09-30,0.0689,0.1125,החוב לא נחות,,חברת ציטוט,אי-תלות,2025-09-30,2025-09-30,1991633.19,1.0,101.09,2013.34199,,,,0.029736,0.000147
209,9975.0,"פרופיט תעשיות בניה בע""מ",520040650,ח.פ.,פרופיט אגח ד' ד-הסדר חוב,54901233,פנימי,צמוד למדד המחירים לצרכן,ישראל,ישראל,לא סחיר,בנייה,לא,2016-10-19,NR,NR,NR,ILS,0.0,2025-12-31,0.0,0.04,החוב לא נחות,,אחר,אי-תלות,2025-09-30,2025-09-30,18872.36,1.0,180.769461,34.11546,,,,0.000503,2e-06
209,9975.0,"פרופיט תעשיות בניה בע""מ",520040650,ח.פ.,הפרשי שווי-פרופיט אגח ד' - הסדר חוב,54901234,פנימי,צמוד למדד המחירים לצרכן,ישראל,ישראל,לא סחיר,בנייה,לא,2016-10-19,NR,NR,NR,ILS,0.01,2025-12-31,0.0001,1e-05,החוב לא נחות,,אחר,אי-תלות,2025-09-30,2025-09-30,-27279.86,1.0,100.0,-27.27986,,,,-0.000402,-1e-06
209,9975.0,כלל תעשיות,520021874,ח.פ.,כלל תעשיות אגח טז 4.47% שקלי 30.06.27,6080238,פנימי,צמוד למדד המחירים לצרכן,ישראל,ישראל,לא סחיר,השקעה ואחזקות,לא,2019-12-29,A2.il,מידרוג Moodys,נייר ערך,ILS,1.45,2027-06-30,0.0535,0.0447,החוב לא נחות,,אחר,אי-תלות,2025-09-30,2025-09-30,833751.86,1.0,100.02,833.91861,,,,0.012316,6e-05
209,9975.0,תמר אריאל קפיטל,516612256,ח.פ.,"COCO תמר אריאל קפיטל 3.06% ב""י 31.05.32",2004862,פנימי,לא צמוד למדד המחירים לצרכן,ישראל,ישראל,לא סחיר,אשראי חוץ בנקאי,לא,2022-05-25,NR,NR,NR,ILS,5.3932,2032-05-31,0.0651,0.0756,החוב לא נחות,,חברת ציטוט,אי-תלות,2025-09-30,2025-09-30,148531.42,1.0,108.11,160.57731,,,,0.002371,1.1e-05
209,9975.0,"מימון ישיר נדל""ן ומשכנתאות בע""מ",516100153,ח.פ.,מ. ישיר משכנתאות א 4.45% צמוד 31.12.31,1208818,פנימי,"צמוד למט""ח",ישראל,ישראל,לא סחיר,אשראי חוץ בנקאי,לא,2024-07-14,A3.il,מידרוג Moodys,נייר ערך,ILS,2.96,2031-12-31,0.0443,0.0445,החוב לא נחות,,חברת ציטוט,אי-תלות,2025-09-30,2025-09-30,579160.01,1.0,105.78,612.63545,,,,0.009048,4.4e-05
209,9975.0,בנק ירושלים בע''מ,520025636,ח.פ.,בנק ירושלים COCO 5.13% צמוד 05.12.32,2004863,פנימי,צמוד למדד המחירים לצרכן,ישראל,ישראל,לא סחיר,בנקים,לא,2022-12-05,ilA-,S&P מעלות,נייר ערך,ILS,6.0943,2032-12-05,0.0443,0.0513,החוב לא נחות,,אחר,אי-תלות,2025-09-30,2025-09-30,1692649.78,1.0,114.54,1938.76106,,,,0.028635,0.000141
209,9975.0,מקורות,520010869,ח.פ.,מקורות אגח 6 4.90% צמוד 25.12.36,11009081,פנימי,"צמוד למט""ח",ישראל,ישראל,לא סחיר,תשתיות,לא,2010-12-25,ilAAA,S&P מעלות,נייר ערך,ILS,4.9814,2036-12-25,0.0273,0.049,החוב לא נחות,,חברת ציטוט,אי-תלות,2025-09-30,2025-09-30,558185.69,1.0,164.64,918.99693,,,,0.013572,6.6e-05
209,9975.0,מקורות,520010869,ח.פ.,מקורות אגח 6 4.90% צמוד 25.12.36,1100908,פנימי,צמוד למדד המחירים לצרכן,ישראל,ישראל,לא סחיר,תשתיות,לא,2006-12-25,AA,פנימי,נייר ערך,ILS,4.96,2036-12-25,0.0283,0.049,החוב לא נחות,,חברת ציטוט,אי-תלות,2025-09-30,2025-09-30,5760022.81,1.0,164.64,9483.30156,,,,0.140066,0.000692
209,9975.0,"גדות מסופים לכימיקלים (1985) בע""מ",520040775,ח.פ.,גדות אגח א 4.30% שקלי 30.06.26,11623202,פנימי,צמוד למדד המחירים לצרכן,ישראל,ישראל,לא סחיר,מסחר,לא,2020-05-10,A3.il,מידרוג Moodys,נייר ערך,ILS,0.6561,2026-06-30,0.0539,0.043,החוב לא נחות,,אחר,אי-תלות,2025-09-30,2025-09-30,764679.43,1.0,100.43,767.96755,,,,0.011342,5.6e-05
209,9975.0,י.ח.ק להשקעות- שותפות מוגבלת,550016091,ח.פ.,י.ח.ק השקעות אגח ב 2.86% שקלי 31.12.28,1181783,פנימי,צמוד למדד המחירים לצרכן,ישראל,ישראל,לא סחיר,השקעה ואחזקות,לא,2021-11-14,ilA+,S&P מעלות,נייר ערך,ILS,1.63,2028-12-31,0.068,0.0286,החוב לא נחות,,אחר,אי-תלות,2025-09-30,2025-09-30,95633.14,1.0,98.48,94.17951,,,,0.001391,6e-06
209,9975.0,מירלנד דיוולופמנט קורפריישן פי אל סי,1502,פנימי,מירלנד שטר הון 1.00% 01.01.2027,1182963,פנימי,צמוד למדד המחירים לצרכן,ישראל,רוסיה,לא סחיר,בנייה,לא,2021-11-26,NR,NR,NR,ILS,0.0,2027-01-01,0.0,0.01,החוב לא נחות,,אחר,אי-תלות,2025-09-30,2025-09-30,225178.01,1.0,0.0,0.0,,,,0.0,0.0
209,9975.0,"עוגן- אג""ח חברתית 2 בע""מ (חל""צ)",516556545,ח.פ.,"עוגן אג""ח בכיר 0.5% פריים 15.03.26",1196831,פנימי,צמוד למדד המחירים לצרכן,ישראל,ישראל,לא סחיר,שירותים פיננסיים,לא,2023-06-15,Aa2.il,מידרוג Moodys,נייר ערך,ILS,0.32,2026-03-15,0.0777,0.125,החוב לא נחות,,אחר,אי-תלות,2025-09-30,2025-09-30,66119.57,1.0,100.62,66.52951,,,,0.000982,4e-06
209,9975.0,"איילון חברת לביטוח בע""מ",520030677,ח.פ.,איילון אגח ג 7.75% שקלי 31.12.27,11955771,פנימי,צמוד למדד המחירים לצרכן,ישראל,ישראל,לא סחיר,ביטוח,לא,2022-11-22,A3.il,מידרוג Moodys,נייר ערך,ILS,2.0754,2027-12-31,0.0638,0.0775,החוב לא נחות,,אחר,אי-תלות,2025-09-30,2025-09-30,402786.25,1.0,104.94,422.68389,,,,0.006242,3e-05
209,9975.0,"בנק לאומי לישראל בע""מ",520018078,ח.פ.,"בנק לאומי סדרה 1 2.3% ב""י 24.12.26",1198639,פנימי,לא צמוד למדד המחירים לצרכן,ישראל,ישראל,לא סחיר,בנקים,לא,2023-08-07,NR,NR,NR,ILS,1.18,2026-12-24,0.0715,0.113,החוב לא נחות,,חברת ציטוט,אי-תלות,2025-09-30,2025-09-30,350615.74,1.0,100.51,352.40388,,,,0.005204,2.5e-05
209,9975.0,"עוגן- אג""ח חברתית 2 בע""מ (חל""צ)",516556545,ח.פ.,"עוגן אג""ח רגילה 2.35% פריים 15.7.27",1196849,פנימי,צמוד למדד המחירים לצרכן,ישראל,ישראל,לא סחיר,שירותים פיננסיים,לא,2023-06-15,NR,NR,NR,ILS,1.15,2027-06-15,0.0901,0.1435,החוב לא נחות,,אחר,אי-תלות,2025-09-30,2025-09-30,507794.94,1.0,101.23,514.04081,,,,0.007592,3.7e-05
209,9975.0,DEAN FOODS CO,5RGFDMYH829UYJH0KY29,LEI,DF 6.5 03/15/23,US242370AD62,ISIN,צמוד למדד המחירים לצרכן,"חו""ל","ארה""ב",לא סחיר,Food Products,לא,2015-02-20,D,S&P,נייר ערך,USD,0.0,2023-03-15,0.0,0.065,החוב לא נחות,,אחר,אי-תלות,2025-09-30,2025-09-30,38339.61,3.306,0.0883,0.11192,,,,1e-06,0.0
209,9975.0,Endo International PLC,549300KK5WR4MGN4YT97,LEI,ENDO 7.5% 04/27,72961956,פנימי,צמוד למדד המחירים לצרכן,"חו""ל","ארה""ב",לא סחיר,Health Care Equipment & Supplies,לא,2019-03-14,D,S&P,נייר ערך,USD,100.0,2027-04-01,2.0,0.075,החוב לא נחות,,אחר,אי-תלות,2025-09-30,2025-09-30,7749.84,3.306,1e-06,0.0,,,,0.0,0.0
209,9976.0,"בנק לאומי לישראל בע""מ",520018078,ח.פ.,"בנק לאומי סדרה 4 2.2% ב""י 24.6.29",IL0012219288,ISIN,לא צמוד למדד המחירים לצרכן,ישראל,ישראל,לא סחיר,בנקים,לא,2025-05-22,NR,NR,NR,ILS,3.32,2029-06-24,0.0642,0.112,החוב לא נחות,,חברת ציטוט,אי-תלות,2025-09-30,2025-09-30,1327692.38,1.0,99.38,1319.46069,,,,0.022174,0.000235
209,9976.0,"מכלול מימון נדל""ן בע""מ",515759777,ח.פ.,מכלול נדלן אגח 1 1.00% פריים 30.11.26,IL0012071416,ISIN,לא צמוד למדד המחירים לצרכן,ישראל,ישראל,לא סחיר,אשראי חוץ בנקאי,לא,2024-06-03,NR,NR,NR,ILS,1.12,2026-11-30,0.0633,0.0816,החוב לא נחות,,חברת ציטוט,אי-תלות,2025-09-30,2025-09-30,257041.97,1.0,103.36,276.93177,,,,0.004653,4.9e-05
209,9976.0,"ביטוח ישיר - השקעות פיננסיות בע""מ",520044439,ח.פ.,ביטוח ישיר אגח יא 4.60% שקלי 30.06.28,IL0011388258,ISIN,צמוד למדד המחירים לצרכן,ישראל,ישראל,לא סחיר,השקעה ואחזקות,לא,2016-07-19,A2.il,מידרוג Moodys,נייר ערך,ILS,1.99,2028-06-30,0.0599,0.046,החוב לא נחות,,אחר,אי-תלות,2025-09-30,2025-09-30,328108.18,1.0,99.93,327.87851,,,,0.00551,5.8e-05
209,9976.0,"מימון ישיר נדלן ומשכנתאות הנפקות (סד 1) בע""מ",516100153,ח.פ.,מימון ישיר נדלן אגח 1 5.00% צמוד 20.02.54,IL0012152687,ISIN,"צמוד למט""ח",ישראל,ישראל,לא סחיר,אשראי חוץ בנקאי,לא,2024-12-26,Aa1.il,מידרוג Moodys,נייר ערך,ILS,10.61,2054-02-20,0.0456,0.05,החוב לא נחות,,חברת ציטוט,אי-תלות,2025-09-30,2025-09-30,420992.0,1.0,106.71,449.24056,,,,0.007549,8e-05
209,9976.0,"קרדיטו הנפקות בע""מ",516804499,ח.פ.,קרדיטו אגח ב 10% שקלי 15.03.51,IL0012162744,ISIN,צמוד למדד המחירים לצרכן,ישראל,ישראל,לא סחיר,אשראי חוץ בנקאי,לא,2025-01-12,NR,NR,NR,ILS,9.22,2051-03-13,0.105,0.1,החוב לא נחות,,אחר,אי-תלות,2025-09-30,2025-09-30,441238.41,1.0,93.57,412.86678,,,,0.006938,7.3e-05
209,9976.0,"גב-ים נגב בע""מ",514189596,ח.פ.,גב ים אגח ב 3.84% צמוד 31.12.28,IL0012084534,ISIN,"צמוד למט""ח",ישראל,ישראל,לא סחיר,"נדל""ן מניב בישראל",לא,2024-07-11,ilA+,S&P מעלות,נייר ערך,ILS,2.89,2028-12-31,0.0422,0.0384,החוב לא נחות,,חברת ציטוט,אי-תלות,2025-09-30,2025-09-30,844108.26,1.0,106.65,900.24146,,,,0.015128,0.00016
209,9976.0,נתיבי הגז הטבעי לישראל,513436394,ח.פ.,נתיבי גז אגח ג 4.80% צמוד 31.12.31,IL0011255093,ISIN,"צמוד למט""ח",ישראל,ישראל,לא סחיר,תשתיות,לא,2012-01-02,Aaa.il,מידרוג Moodys,נייר ערך,ILS,3.03,2031-12-31,0.0312,0.048,החוב לא נחות,,חברת ציטוט,אי-תלות,2025-09-30,2025-09-30,1197448.13,1.0,131.46,1574.16531,,,,0.026453,0.000279
209,9976.0,"בנק לאומי לישראל בע""מ",520018078,ח.פ.,בנק לאומי סדרה 3 3.69% צמוד 24.05.35,IL0012150293,ISIN,צמוד למדד המחירים לצרכן,ישראל,ישראל,לא סחיר,בנקים,לא,2024-12-23,NR,NR,NR,ILS,3.73,2035-05-24,0.037,0.0369,החוב לא נחות,,חברת ציטוט,אי-תלות,2025-09-30,2025-09-30,2661568.52,1.0,103.39,2751.79569,,,,0.046244,0.00049
209,9976.0,"רפאל מערכות לחימה מתקדמות בע""מ",520042185,ח.פ.,רפאל אגח ד 3.74% שקלי 15.09.34,IL0011402844,ISIN,צמוד למדד המחירים לצרכן,ישראל,ישראל,לא סחיר,ביטחוניות,לא,2017-03-01,AA+,פנימי,נייר ערך,ILS,4.4,2034-09-15,0.0478,0.0374,החוב לא נחות,,אחר,אי-תלות,2025-09-30,2025-09-30,523647.4,1.0,96.46,505.11028,,,,0.008488,9e-05
209,9976.0,אורמת טכנולוגיות אינק,520036716,ח.פ.,אורמת סדרה 4 3.35% שקלי 15.06.31,IL0011672123,ISIN,צמוד למדד המחירים לצרכן,ישראל,ישראל,לא סחיר,אנרגיה מתחדשת,לא,2020-07-01,ilAA-,S&P מעלות,נייר ערך,ILS,2.9457,2031-06-15,0.0518,0.0335,החוב לא נחות,,אחר,אי-תלות,2025-09-30,2025-09-30,290250.36,1.0,95.91,278.37912,,,,0.004678,4.9e-05
209,9976.0,מקורות,520010869,ח.פ.,מקורות אגח 8 4.10% צמוד 14.07.48,IL0011243461,ISIN,"צמוד למט""ח",ישראל,ישראל,לא סחיר,תשתיות,לא,2011-07-14,ilAAA,S&P מעלות,נייר ערך,ILS,9.36,2048-07-14,0.0298,0.041,החוב לא נחות,,חברת ציטוט,אי-תלות,2025-09-30,2025-09-30,18423410.27,1.0,139.55,25709.86903,,,,0.432062,0.004586
209,9976.0,"מימון ישיר נדל""ן ומשכנתאות הנפקות (סדרה 2) בע""מ",517112074,ח.פ.,"מימון ישיר נדלן אגח (סדרה 2) 3.3%+ ב""י 20.06.54",IL0012257965,ISIN,צמוד למדד המחירים לצרכן,ישראל,ישראל,לא סחיר,אשראי חוץ בנקאי,לא,2025-07-29,Aa1.il,מידרוג Moodys,נייר ערך,ILS,7.4,2054-06-20,0.0739,0.078,החוב לא נחות,,אחר,אי-תלות,2025-09-30,2025-09-30,327036.45,1.0,100.1,327.36349,,,,0.005501,5.8e-05
209,9976.0,נתיבי הגז הטבעי לישראל,513436394,ח.פ.,נתיבי גז אגח א 5.60% צמוד 29.12.26,IL0011030843,ISIN,"צמוד למט""ח",ישראל,ישראל,לא סחיר,תשתיות,לא,2007-01-02,Aaa.il,מידרוג Moodys,נייר ערך,ILS,0.57,2026-12-29,0.0991,0.056,החוב לא נחות,,חברת ציטוט,אי-תלות,2025-09-30,2025-09-30,1161050.89,1.0,147.67,1714.52385,,,,0.028812,0.000304
209,9976.0,"מימון ישיר מקבוצת ישיר(2006) בע""מ",513893123,ח.פ.,מימון ישיר אגח 16 4.25% צמוד 12.05.28,IL0011983405,ISIN,"צמוד למט""ח",ישראל,ישראל,לא סחיר,אשראי חוץ בנקאי,לא,2023-07-31,Aa2.il,מידרוג Moodys,נייר ערך,ILS,1.81,2028-05-12,0.0605,0.0425,החוב לא נחות,,חברת ציטוט,אי-תלות,2025-09-30,2025-09-30,281372.74,1.0,108.68,305.79589,,,,0.005139,5.4e-05
209,9976.0,"גמול חברה להשקעות בע""מ",520018136,ח.פ.,"גמול אג""ח ב- הסדר",IL0011167553,ISIN,צמוד למדד המחירים לצרכן,ישראל,ישראל,לא סחיר,"נדל""ן מניב בישראל",לא,2009-07-01,NR,NR,NR,ILS,0.01,2021-09-30,0.0001,0.045,החוב לא נחות,,אחר,אי-תלות,2025-09-30,2025-09-30,208.81,1.0,39.0,0.08143,,,,1e-06,0.0
209,9976.0,חברת החשמל,520000472,ח.פ.,חברת חשמל 6.00% צמוד 07.05.29,IL0060001869,ISIN,"צמוד למט""ח",ישראל,ישראל,לא סחיר,אנרגיה,לא,2014-05-07,Aaa.il,מידרוג Moodys,נייר ערך,ILS,1.95,2029-05-07,0.0356,0.06,החוב לא נחות,,חברת ציטוט,אי-תלות,2025-09-30,2025-09-30,1641727.36,1.0,129.32,2123.08182,,,,0.035678,0.000377
209,9976.0,"בנק לאומי לישראל בע""מ",520018078,ח.פ.,"בנק לאומי סדרה 2 2.30% ב""י 24.08.30",IL0012058975,ISIN,לא צמוד למדד המחירים לצרכן,ישראל,ישראל,לא סחיר,בנקים,לא,2024-04-17,NR,NR,NR,ILS,4.17,2030-08-24,0.0705,0.113,החוב לא נחות,,חברת ציטוט,אי-תלות,2025-09-30,2025-09-30,1040306.39,1.0,101.46,1055.49486,,,,0.017737,0.000188
209,9976.0,"בנק הפועלים בע""מ",520000118,ח.פ.,"פועלים אגח 2 2.25% ב""י 07.11.28",IL0012275454,ISIN,לא צמוד למדד המחירים לצרכן,ישראל,ישראל,לא סחיר,בנקים,לא,2025-08-27,NR,NR,NR,ILS,2.83,2028-11-07,0.0711,0.0675,החוב לא נחות,,חברת ציטוט,אי-תלות,2025-09-30,2025-09-30,1151056.72,1.0,99.52,1145.53165,,,,0.019251,0.000204
209,9976.0,"מימון ישיר נדל""ן ומשכנתאות הנפקות (סדרה 2) בע""מ",517112074,ח.פ.,מימון ישיר נדלן אגח (סדרה 2) 5.25% צמוד 20.06.54,IL0012257882,ISIN,"צמוד למט""ח",ישראל,ישראל,לא סחיר,אשראי חוץ בנקאי,לא,2025-07-29,Aa1.il,מידרוג Moodys,נייר ערך,ILS,10.31,2054-06-20,0.0489,0.0525,החוב לא נחות,,חברת ציטוט,אי-תלות,2025-09-30,2025-09-30,602028.22,1.0,103.96,625.86854,,,,0.010517,0.000111
209,9976.0,"פרופיט תעשיות בניה בע""מ",520040650,ח.פ.,הפרשי שווי-פרופיט אגח ד' - הסדר חוב,54901234,פנימי,צמוד למדד המחירים לצרכן,ישראל,ישראל,לא סחיר,בנייה,לא,2016-10-19,NR,NR,NR,ILS,0.01,2025-12-31,0.0001,1e-05,החוב לא נחות,,אחר,אי-תלות,2025-09-30,2025-09-30,-10661.71,1.0,100.0,-10.66171,,,,-0.000179,-1e-06
209,9976.0,"מכלול מימון נדל""ן בע""מ",515759777,ח.פ.,מכלול נדלן אגח 2 1% פריים 01.01.28,1215193,פנימי,לא צמוד למדד המחירים לצרכן,ישראל,ישראל,לא סחיר,אשראי חוץ בנקאי,לא,2024-12-25,NR,NR,NR,ILS,2.1,2028-01-01,0.0641,0.07,החוב לא נחות,,חברת ציטוט,אי-תלות,2025-09-30,2025-09-30,927532.23,1.0,101.45,949.9649,,,,0.015963,0.000168
209,9976.0,בנק ירושלים בע''מ,520025636,ח.פ.,בנק ירושלים COCO 5.13% צמוד 05.12.32,2004863,פנימי,צמוד למדד המחירים לצרכן,ישראל,ישראל,לא סחיר,בנקים,לא,2022-12-05,ilA-,S&P מעלות,נייר ערך,ILS,6.0943,2032-12-05,0.0443,0.0513,החוב לא נחות,,אחר,אי-תלות,2025-09-30,2025-09-30,741339.59,1.0,114.54,849.13036,,,,0.014269,0.000151
209,9976.0,"בנק הפועלים בע""מ",520000118,ח.פ.,"פועלים אגח 1 2.25% ב""י 30.09.27",1211747,פנימי,לא צמוד למדד המחירים לצרכן,ישראל,ישראל,לא סחיר,בנקים,לא,2024-09-25,NR,NR,NR,ILS,1.9,2027-09-30,0.0689,0.1125,החוב לא נחות,,חברת ציטוט,אי-תלות,2025-09-30,2025-09-30,1484358.44,1.0,101.09,1500.53794,,,,0.025217,0.000267
209,9976.0,תמר אריאל קפיטל,516612256,ח.פ.,"COCO תמר אריאל קפיטל 3.06% ב""י 31.05.32",2004862,פנימי,לא צמוד למדד המחירים לצרכן,ישראל,ישראל,לא סחיר,אשראי חוץ בנקאי,לא,2022-05-25,NR,NR,NR,ILS,5.3932,2032-05-31,0.0651,0.0756,החוב לא נחות,,חברת ציטוט,אי-תלות,2025-09-30,2025-09-30,79028.59,1.0,108.11,85.4378,,,,0.001435,1.5e-05
209,9976.0,כלל תעשיות,520021874,ח.פ.,כלל תעשיות אגח טז 4.47% שקלי 30.06.27,6080238,פנימי,צמוד למדד המחירים לצרכן,ישראל,ישראל,לא סחיר,השקעה ואחזקות,לא,2019-12-29,A2.il,מידרוג Moodys,נייר ערך,ILS,1.45,2027-06-30,0.0535,0.0447,החוב לא נחות,,אחר,אי-תלות,2025-09-30,2025-09-30,365163.11,1.0,100.02,365.23614,,,,0.006137,6.5e-05
209,9976.0,"פרופיט תעשיות בניה בע""מ",520040650,ח.פ.,פרופיט אגח ד' ד-הסדר חוב,54901233,פנימי,צמוד למדד המחירים לצרכן,ישראל,ישראל,לא סחיר,בנייה,לא,2016-10-19,NR,NR,NR,ILS,0.0,2025-12-31,0.0,0.04,החוב לא נחות,,אחר,אי-תלות,2025-09-30,2025-09-30,7375.83,1.0,180.769461,13.33324,,,,0.000224,2e-06
209,9976.0,"מימון ישיר נדל""ן ומשכנתאות בע""מ",516100153,ח.פ.,מ. ישיר משכנתאות א 4.45% צמוד 31.12.31,1208818,פנימי,"צמוד למט""ח",ישראל,ישראל,לא סחיר,אשראי חוץ בנקאי,לא,2024-07-14,A3.il,מידרוג Moodys,נייר ערך,ILS,2.96,2031-12-31,0.0443,0.0445,החוב לא נחות,,חברת ציטוט,אי-תלות,2025-09-30,2025-09-30,431646.27,1.0,105.78,456.59543,,,,0.007673,8.1e-05
209,9976.0,"עוגן- אג""ח חברתית 2 בע""מ (חל""צ)",516556545,ח.פ.,"עוגן אג""ח רגילה 2.35% פריים 15.7.27",1196849,פנימי,צמוד למדד המחירים לצרכן,ישראל,ישראל,לא סחיר,שירותים פיננסיים,לא,2023-06-15,NR,NR,NR,ILS,1.15,2027-06-15,0.0901,0.1435,החוב לא נחות,,אחר,אי-תלות,2025-09-30,2025-09-30,222401.88,1.0,101.23,225.13742,,,,0.003783,4e-05
209,9976.0,"נתיבים אג""ח בע""מ",513502229,ח.פ.,נתיבים אגח א 7.97% דולרי 04.07.27,10902810,פנימי,"צמוד למט""ח",ישראל,ישראל,לא סחיר,השקעה ואחזקות,כן,2004-03-28,Aa1.il,מידרוג Moodys,נייר ערך,USD,0.9755,2027-07-04,0.045,0.0797,החוב לא נחות,,חברת ציטוט,אי-תלות,2025-09-30,2025-09-30,85120.98,3.306,105.33,296.40912,,,,0.004981,5.2e-05
209,9976.0,מקורות,520010869,ח.פ.,מקורות אגח 6 4.90% צמוד 25.12.36,1100908,פנימי,צמוד למדד המחירים לצרכן,ישראל,ישראל,לא סחיר,תשתיות,לא,2006-12-25,AA,פנימי,נייר ערך,ILS,4.96,2036-12-25,0.0283,0.049,החוב לא נחות,,חברת ציטוט,אי-תלות,2025-09-30,2025-09-30,6456753.98,1.0,164.64,10630.39975,,,,0.178647,0.001896
209,9976.0,מקורות,520010869,ח.פ.,מקורות אגח 6 4.90% צמוד 25.12.36,11009081,פנימי,"צמוד למט""ח",ישראל,ישראל,לא סחיר,תשתיות,לא,2010-12-25,ilAAA,S&P מעלות,נייר ערך,ILS,4.9814,2036-12-25,0.0273,0.049,החוב לא נחות,,חברת ציטוט,אי-תלות,2025-09-30,2025-09-30,625703.72,1.0,164.64,1030.15861,,,,0.017311,0.000183
209,9976.0,"אגרקסקו חברה ליצוא חקלאי בע""מ",510155625,ח.פ.,אגרקסקו אגח א חש4/12,1126770,פנימי,צמוד למדד המחירים לצרכן,ישראל,ישראל,לא סחיר,מסחר,לא,2007-12-27,NR,NR,NR,ILS,0.0,2017-04-30,0.0,0.0615,החוב לא נחות,,אחר,אי-תלות,2025-09-30,2025-09-30,872.16,1.0,0.0001,0.0,,,,0.0,0.0
209,9976.0,"מת""ם - מרכז תעשיות מדע חיפה בע""מ",510687403,ח.פ.,"מת""ם  אגח א 3.10% שקלי 30.06.27",11389991,פנימי,צמוד למדד המחירים לצרכן,ישראל,ישראל,לא סחיר,"נדל""ן מניב בישראל",לא,2016-08-16,Aa2.il,מידרוג Moodys,נייר ערך,ILS,1.2213,2027-06-30,0.0466,0.031,החוב לא נחות,,אחר,אי-תלות,2025-09-30,2025-09-30,301045.6,1.0,98.25,295.77731,,,,0.00497,5.2e-05
209,9976.0,"בנק לאומי לישראל בע""מ",520018078,ח.פ.,"בנק לאומי סדרה 1 2.3% ב""י 24.12.26",1198639,פנימי,לא צמוד למדד המחירים לצרכן,ישראל,ישראל,לא סחיר,בנקים,לא,2023-08-07,NR,NR,NR,ILS,1.18,2026-12-24,0.0715,0.113,החוב לא נחות,,חברת ציטוט,אי-תלות,2025-09-30,2025-09-30,261312.89,1.0,100.51,262.64559,,,,0.004413,4.6e-05
209,9976.0,י.ח.ק להשקעות- שותפות מוגבלת,550016091,ח.פ.,י.ח.ק השקעות אגח ב 2.86% שקלי 31.12.28,1181783,פנימי,צמוד למדד המחירים לצרכן,ישראל,ישראל,לא סחיר,השקעה ואחזקות,לא,2021-11-14,ilA+,S&P מעלות,נייר ערך,ILS,1.63,2028-12-31,0.068,0.0286,החוב לא נחות,,אחר,אי-תלות,2025-09-30,2025-09-30,71275.1,1.0,98.48,70.19172,,,,0.001179,1.2e-05
209,9976.0,מירלנד דיוולופמנט קורפריישן פי אל סי,1502,פנימי,מירלנד שטר הון 1.00% 01.01.2027,1182963,פנימי,צמוד למדד המחירים לצרכן,ישראל,רוסיה,לא סחיר,בנייה,לא,2021-11-26,NR,NR,NR,ILS,0.0,2027-01-01,0.0,0.01,החוב לא נחות,,אחר,אי-תלות,2025-09-30,2025-09-30,167824.52,1.0,0.0,0.0,,,,0.0,0.0
209,9976.0,"איילון חברת לביטוח בע""מ",520030677,ח.פ.,איילון אגח ג 7.75% שקלי 31.12.27,11955771,פנימי,צמוד למדד המחירים לצרכן,ישראל,ישראל,לא סחיר,ביטוח,לא,2022-11-22,A3.il,מידרוג Moodys,נייר ערך,ILS,2.0754,2027-12-31,0.0638,0.0775,החוב לא נחות,,אחר,אי-תלות,2025-09-30,2025-09-30,300195.42,1.0,104.94,315.02507,,,,0.005294,5.6e-05
209,9976.0,"גדות מסופים לכימיקלים (1985) בע""מ",520040775,ח.פ.,גדות אגח א 4.30% שקלי 30.06.26,11623202,פנימי,צמוד למדד המחירים לצרכן,ישראל,ישראל,לא סחיר,מסחר,לא,2020-05-10,A3.il,מידרוג Moodys,נייר ערך,ILS,0.6561,2026-06-30,0.0539,0.043,החוב לא נחות,,אחר,אי-תלות,2025-09-30,2025-09-30,334911.06,1.0,100.43,336.35118,,,,0.005652,6e-05
209,9976.0,"עוגן- אג""ח חברתית 2 בע""מ (חל""צ)",516556545,ח.פ.,"עוגן אג""ח בכיר 0.5% פריים 15.03.26",1196831,פנימי,צמוד למדד המחירים לצרכן,ישראל,ישראל,לא סחיר,שירותים פיננסיים,לא,2023-06-15,Aa2.il,מידרוג Moodys,נייר ערך,ILS,0.32,2026-03-15,0.0777,0.125,החוב לא נחות,,אחר,אי-תלות,2025-09-30,2025-09-30,28958.77,1.0,100.62,29.13831,,,,0.000489,5e-06
209,9976.0,DEAN FOODS CO,5RGFDMYH829UYJH0KY29,LEI,DF 6.5 03/15/23,US242370AD62,ISIN,צמוד למדד המחירים לצרכן,"חו""ל","ארה""ב",לא סחיר,Food Products,לא,2015-02-20,D,S&P,נייר ערך,USD,0.0,2023-03-15,0.0,0.065,החוב לא נחות,,אחר,אי-תלות,2025-09-30,2025-09-30,114669.35,3.306,0.0883,0.33474,,,,5e-06,0.0
209,9976.0,Endo International PLC,549300KK5WR4MGN4YT97,LEI,ENDO 7.5% 04/27,72961956,פנימי,צמוד למדד המחירים לצרכן,"חו""ל","ארה""ב",לא סחיר,Health Care Equipment & Supplies,לא,2019-03-14,D,S&P,נייר ערך,USD,100.0,2027-04-01,2.0,0.075,החוב לא נחות,,אחר,אי-תלות,2025-09-30,2025-09-30,23178.88,3.306,1e-06,0.0,,,,0.0,0.0
325,325.0,"בנק לאומי לישראל בע""מ",520018078,ח.פ.,בנק לאומי סדרה 3 3.69% צמוד 24.05.35,IL0012150293,ISIN,צמוד למדד המחירים לצרכן,ישראל,ישראל,לא סחיר,בנקים,לא,2024-12-23,NR,NR,NR,ILS,3.73,2035-05-24,0.037,0.0369,החוב לא נחות,,חברת ציטוט,אי-תלות,2025-09-30,2025-09-30,17336.89,1.0,103.39,17.92461,,,,0.000853,3.1e-05
325,325.0,"ביטוח ישיר - השקעות פיננסיות בע""מ",520044439,ח.פ.,ביטוח ישיר אגח יא 4.60% שקלי 30.06.28,IL0011388258,ISIN,צמוד למדד המחירים לצרכן,ישראל,ישראל,לא סחיר,השקעה ואחזקות,לא,2016-07-19,A2.il,מידרוג Moodys,נייר ערך,ILS,1.99,2028-06-30,0.0599,0.046,החוב לא נחות,,אחר,אי-תלות,2025-09-30,2025-09-30,10897.82,1.0,99.93,10.89019,,,,0.000518,1.9e-05
325,325.0,"מכלול מימון נדל""ן בע""מ",515759777,ח.פ.,מכלול נדלן אגח 1 1.00% פריים 30.11.26,IL0012071416,ISIN,לא צמוד למדד המחירים לצרכן,ישראל,ישראל,לא סחיר,אשראי חוץ בנקאי,לא,2024-06-03,NR,NR,NR,ILS,1.12,2026-11-30,0.0633,0.0816,החוב לא נחות,,חברת ציטוט,אי-תלות,2025-09-30,2025-09-30,1674.32,1.0,103.36,1.80387,,,,8.5e-05,3e-06
325,325.0,נתיבי הגז הטבעי לישראל,513436394,ח.פ.,נתיבי גז אגח ג 4.80% צמוד 31.12.31,IL0011255093,ISIN,"צמוד למט""ח",ישראל,ישראל,לא סחיר,תשתיות,לא,2012-01-02,Aaa.il,מידרוג Moodys,נייר ערך,ILS,3.03,2031-12-31,0.0312,0.048,החוב לא נחות,,חברת ציטוט,אי-תלות,2025-09-30,2025-09-30,6991343.46,1.0,131.46,9190.8201,,,,0.437713,0.016152
325,325.0,מקורות,520010869,ח.פ.,מקורות אגח 8 4.10% צמוד 14.07.48,IL0011243461,ISIN,"צמוד למט""ח",ישראל,ישראל,לא סחיר,תשתיות,לא,2011-07-14,ilAAA,S&P מעלות,נייר ערך,ILS,9.36,2048-07-14,0.0298,0.041,החוב לא נחות,,חברת ציטוט,אי-תלות,2025-09-30,2025-09-30,8230011.01,1.0,139.55,11484.98037,,,,0.546972,0.020184
325,325.0,נתיבי הגז הטבעי לישראל,513436394,ח.פ.,נתיבי גז אגח א 5.60% צמוד 29.12.26,IL0011030843,ISIN,"צמוד למט""ח",ישראל,ישראל,לא סחיר,תשתיות,לא,2007-01-02,Aaa.il,מידרוג Moodys,נייר ערך,ILS,0.57,2026-12-29,0.0991,0.056,החוב לא נחות,,חברת ציטוט,אי-תלות,2025-09-30,2025-09-30,10442.61,1.0,147.67,15.42061,,,,0.000732,2.5e-05
325,325.0,"גב-ים נגב בע""מ",514189596,ח.פ.,גב ים אגח ב 3.84% צמוד 31.12.28,IL0012084534,ISIN,"צמוד למט""ח",ישראל,ישראל,לא סחיר,"נדל""ן מניב בישראל",לא,2024-07-11,ilA+,S&P מעלות,נייר ערך,ILS,2.89,2028-12-31,0.0422,0.0384,החוב לא נחות,,חברת ציטוט,אי-תלות,2025-09-30,2025-09-30,5498.34,1.0,106.65,5.86398,,,,0.000279,1e-05
325,325.0,חברת החשמל,520000472,ח.פ.,חברת חשמל 6.00% צמוד 07.05.29,IL0060001869,ISIN,"צמוד למט""ח",ישראל,ישראל,לא סחיר,אנרגיה,לא,2014-05-07,Aaa.il,מידרוג Moodys,נייר ערך,ILS,1.95,2029-05-07,0.0356,0.06,החוב לא נחות,,חברת ציטוט,אי-תלות,2025-09-30,2025-09-30,38232.6,1.0,129.32,49.44239,,,,0.002354,8.6e-05
325,325.0,"בנק לאומי לישראל בע""מ",520018078,ח.פ.,"בנק לאומי סדרה 2 2.30% ב""י 24.08.30",IL0012058975,ISIN,לא צמוד למדד המחירים לצרכן,ישראל,ישראל,לא סחיר,בנקים,לא,2024-04-17,NR,NR,NR,ILS,4.17,2030-08-24,0.0705,0.113,החוב לא נחות,,חברת ציטוט,אי-תלות,2025-09-30,2025-09-30,6776.33,1.0,101.46,6.87527,,,,0.000327,1.2e-05
325,325.0,"רפאל מערכות לחימה מתקדמות בע""מ",520042185,ח.פ.,רפאל אגח ד 3.74% שקלי 15.09.34,IL0011402844,ISIN,צמוד למדד המחירים לצרכן,ישראל,ישראל,לא סחיר,ביטחוניות,לא,2017-03-01,AA+,פנימי,נייר ערך,ILS,4.4,2034-09-15,0.0478,0.0374,החוב לא נחות,,אחר,אי-תלות,2025-09-30,2025-09-30,17392.48,1.0,96.46,16.77679,,,,0.000798,2.9e-05
325,325.0,"מימון ישיר נדלן ומשכנתאות הנפקות (סד 1) בע""מ",516100153,ח.פ.,מימון ישיר נדלן אגח 1 5.00% צמוד 20.02.54,IL0012152687,ISIN,"צמוד למט""ח",ישראל,ישראל,לא סחיר,אשראי חוץ בנקאי,לא,2024-12-26,Aa1.il,מידרוג Moodys,נייר ערך,ILS,10.61,2054-02-20,0.0456,0.05,החוב לא נחות,,חברת ציטוט,אי-תלות,2025-09-30,2025-09-30,2742.25,1.0,106.71,2.92626,,,,0.000139,5e-06
325,325.0,"קרדיטו הנפקות בע""מ",516804499,ח.פ.,קרדיטו אגח ב 10% שקלי 15.03.51,IL0012162744,ISIN,צמוד למדד המחירים לצרכן,ישראל,ישראל,לא סחיר,אשראי חוץ בנקאי,לא,2025-01-12,NR,NR,NR,ILS,9.22,2051-03-13,0.105,0.1,החוב לא נחות,,אחר,אי-תלות,2025-09-30,2025-09-30,2874.13,1.0,93.57,2.68933,,,,0.000128,4e-06
325,325.0,"מימון ישיר מקבוצת ישיר(2006) בע""מ",513893123,ח.פ.,מימון ישיר אגח 16 4.25% צמוד 12.05.28,IL0011983405,ISIN,"צמוד למט""ח",ישראל,ישראל,לא סחיר,אשראי חוץ בנקאי,לא,2023-07-31,Aa2.il,מידרוג Moodys,נייר ערך,ILS,1.81,2028-05-12,0.0605,0.0425,החוב לא נחות,,חברת ציטוט,אי-תלות,2025-09-30,2025-09-30,1832.8,1.0,108.68,1.99189,,,,9.4e-05,3e-06
325,325.0,"בנק לאומי לישראל בע""מ",520018078,ח.פ.,"בנק לאומי סדרה 4 2.2% ב""י 24.6.29",IL0012219288,ISIN,לא צמוד למדד המחירים לצרכן,ישראל,ישראל,לא סחיר,בנקים,לא,2025-05-22,NR,NR,NR,ILS,3.32,2029-06-24,0.0642,0.112,החוב לא נחות,,חברת ציטוט,אי-תלות,2025-09-30,2025-09-30,8648.3,1.0,99.38,8.59468,,,,0.000409,1.5e-05
325,325.0,"מימון ישיר נדל""ן ומשכנתאות הנפקות (סדרה 2) בע""מ",517112074,ח.פ.,מימון ישיר נדלן אגח (סדרה 2) 5.25% צמוד 20.06.54,IL0012257882,ISIN,"צמוד למט""ח",ישראל,ישראל,לא סחיר,אשראי חוץ בנקאי,לא,2025-07-29,Aa1.il,מידרוג Moodys,נייר ערך,ILS,10.31,2054-06-20,0.0489,0.0525,החוב לא נחות,,חברת ציטוט,אי-תלות,2025-09-30,2025-09-30,3921.48,1.0,103.96,4.07677,,,,0.000194,7e-06
325,325.0,"מימון ישיר נדל""ן ומשכנתאות הנפקות (סדרה 2) בע""מ",517112074,ח.פ.,"מימון ישיר נדלן אגח (סדרה 2) 3.3%+ ב""י 20.06.54",IL0012257965,ISIN,צמוד למדד המחירים לצרכן,ישראל,ישראל,לא סחיר,אשראי חוץ בנקאי,לא,2025-07-29,Aa1.il,מידרוג Moodys,נייר ערך,ILS,7.4,2054-06-20,0.0739,0.078,החוב לא נחות,,אחר,אי-תלות,2025-09-30,2025-09-30,2130.25,1.0,100.1,2.13238,,,,0.000101,3e-06
325,325.0,"בנק הפועלים בע""מ",520000118,ח.פ.,"פועלים אגח 2 2.25% ב""י 07.11.28",IL0012275454,ISIN,לא צמוד למדד המחירים לצרכן,ישראל,ישראל,לא סחיר,בנקים,לא,2025-08-27,NR,NR,NR,ILS,2.83,2028-11-07,0.0711,0.0675,החוב לא נחות,,חברת ציטוט,אי-תלות,2025-09-30,2025-09-30,7497.74,1.0,99.52,7.46175,,,,0.000355,1.3e-05
325,325.0,אורמת טכנולוגיות אינק,520036716,ח.פ.,אורמת סדרה 4 3.35% שקלי 15.06.31,IL0011672123,ISIN,צמוד למדד המחירים לצרכן,ישראל,ישראל,לא סחיר,אנרגיה מתחדשת,לא,2020-07-01,ilAA-,S&P מעלות,נייר ערך,ILS,2.9457,2031-06-15,0.0518,0.0335,החוב לא נחות,,אחר,אי-תלות,2025-09-30,2025-09-30,1890.63,1.0,95.91,1.8133,,,,8.6e-05,3e-06
325,325.0,"בנק לאומי לישראל בע""מ",520018078,ח.פ.,"בנק לאומי סדרה 1 2.3% ב""י 24.12.26",1198639,פנימי,לא צמוד למדד המחירים לצרכן,ישראל,ישראל,לא סחיר,בנקים,לא,2023-08-07,NR,NR,NR,ILS,1.18,2026-12-24,0.0715,0.113,החוב לא נחות,,חברת ציטוט,אי-תלות,2025-09-30,2025-09-30,1702.14,1.0,100.51,1.71082,,,,8.1e-05,3e-06
325,325.0,בנק ירושלים בע''מ,520025636,ח.פ.,בנק ירושלים COCO 5.13% צמוד 05.12.32,2004863,פנימי,צמוד למדד המחירים לצרכן,ישראל,ישראל,לא סחיר,בנקים,לא,2022-12-05,ilA-,S&P מעלות,נייר ערך,ILS,6.0943,2032-12-05,0.0443,0.0513,החוב לא נחות,,אחר,אי-תלות,2025-09-30,2025-09-30,24622.93,1.0,114.54,28.2031,,,,0.001343,4.9e-05
325,325.0,"מימון ישיר נדל""ן ומשכנתאות בע""מ",516100153,ח.פ.,מ. ישיר משכנתאות א 4.45% צמוד 31.12.31,1208818,פנימי,"צמוד למט""ח",ישראל,ישראל,לא סחיר,אשראי חוץ בנקאי,לא,2024-07-14,A3.il,מידרוג Moodys,נייר ערך,ILS,2.96,2031-12-31,0.0443,0.0445,החוב לא נחות,,חברת ציטוט,אי-תלות,2025-09-30,2025-09-30,2811.65,1.0,105.78,2.97416,,,,0.000141,5e-06
325,325.0,כלל תעשיות,520021874,ח.פ.,כלל תעשיות אגח טז 4.47% שקלי 30.06.27,6080238,פנימי,צמוד למדד המחירים לצרכן,ישראל,ישראל,לא סחיר,השקעה ואחזקות,לא,2019-12-29,A2.il,מידרוג Moodys,נייר ערך,ILS,1.45,2027-06-30,0.0535,0.0447,החוב לא נחות,,אחר,אי-תלות,2025-09-30,2025-09-30,12128.57,1.0,100.02,12.13099,,,,0.000577,2.1e-05
325,325.0,"עוגן- אג""ח חברתית 2 בע""מ (חל""צ)",516556545,ח.פ.,"עוגן אג""ח רגילה 2.35% פריים 15.7.27",1196849,פנימי,צמוד למדד המחירים לצרכן,ישראל,ישראל,לא סחיר,שירותים פיננסיים,לא,2023-06-15,NR,NR,NR,ILS,1.15,2027-06-15,0.0901,0.1435,החוב לא נחות,,אחר,אי-תלות,2025-09-30,2025-09-30,7386.88,1.0,101.23,7.47774,,,,0.000356,1.3e-05
325,325.0,"בנק הפועלים בע""מ",520000118,ח.פ.,"פועלים אגח 1 2.25% ב""י 30.09.27",1211747,פנימי,לא צמוד למדד המחירים לצרכן,ישראל,ישראל,לא סחיר,בנקים,לא,2024-09-25,NR,NR,NR,ILS,1.9,2027-09-30,0.0689,0.1125,החוב לא נחות,,חברת ציטוט,אי-תלות,2025-09-30,2025-09-30,9668.79,1.0,101.09,9.77418,,,,0.000465,1.7e-05
325,325.0,"מכלול מימון נדל""ן בע""מ",515759777,ח.פ.,מכלול נדלן אגח 2 1% פריים 01.01.28,1215193,פנימי,לא צמוד למדד המחירים לצרכן,ישראל,ישראל,לא סחיר,אשראי חוץ בנקאי,לא,2024-12-25,NR,NR,NR,ILS,2.1,2028-01-01,0.0641,0.07,החוב לא נחות,,חברת ציטוט,אי-תלות,2025-09-30,2025-09-30,6041.75,1.0,101.45,6.18787,,,,0.000293,1e-05
325,325.0,"איילון חברת לביטוח בע""מ",520030677,ח.פ.,איילון אגח ג 7.75% שקלי 31.12.27,11955771,פנימי,צמוד למדד המחירים לצרכן,ישראל,ישראל,לא סחיר,ביטוח,לא,2022-11-22,A3.il,מידרוג Moodys,נייר ערך,ILS,2.0754,2027-12-31,0.0638,0.0775,החוב לא נחות,,אחר,אי-תלות,2025-09-30,2025-09-30,1955.41,1.0,104.94,2.05201,,,,9.7e-05,3e-06
325,325.0,מירלנד דיוולופמנט קורפריישן פי אל סי,1502,פנימי,מירלנד שטר הון 1.00% 01.01.2027,1182963,פנימי,צמוד למדד המחירים לצרכן,ישראל,רוסיה,לא סחיר,בנייה,לא,2021-11-26,NR,NR,NR,ILS,0.0,2027-01-01,0.0,0.01,החוב לא נחות,,אחר,אי-תלות,2025-09-30,2025-09-30,1093.17,1.0,0.0,0.0,,,,0.0,0.0
325,325.0,"עוגן- אג""ח חברתית 2 בע""מ (חל""צ)",516556545,ח.פ.,"עוגן אג""ח בכיר 0.5% פריים 15.03.26",1196831,פנימי,צמוד למדד המחירים לצרכן,ישראל,ישראל,לא סחיר,שירותים פיננסיים,לא,2023-06-15,Aa2.il,מידרוג Moodys,נייר ערך,ILS,0.32,2026-03-15,0.0777,0.125,החוב לא נחות,,אחר,אי-תלות,2025-09-30,2025-09-30,961.84,1.0,100.62,0.9678,,,,4.6e-05,1e-06
325,325.0,התפלת מי אשקלון,513365098,ח.פ.,וי. אי. די התפלה 7.75% צמוד 22.01.26,10876831,פנימי,"צמוד למט""ח",ישראל,ישראל,לא סחיר,תשתיות,לא,2003-01-22,ilAA+,S&P מעלות,נייר ערך,ILS,0.0618,2026-01-22,0.0319,0.0775,החוב לא נחות,,חברת ציטוט,אי-תלות,2025-09-30,2025-09-30,28489.91,1.0,148.14,42.20495,,,,0.00201,7.4e-05
325,325.0,"נתיבים אג""ח בע""מ",513502229,ח.פ.,נתיבים אגח א 7.97% דולרי 04.07.27,10902810,פנימי,"צמוד למט""ח",ישראל,ישראל,לא סחיר,השקעה ואחזקות,כן,2004-03-28,Aa1.il,מידרוג Moodys,נייר ערך,USD,0.9755,2027-07-04,0.045,0.0797,החוב לא נחות,,חברת ציטוט,אי-תלות,2025-09-30,2025-09-30,2827.22,3.306,105.33,9.84496,,,,0.000468,1.7e-05
325,325.0,מקורות,520010869,ח.פ.,מקורות אגח 6 4.90% צמוד 25.12.36,11009081,פנימי,"צמוד למט""ח",ישראל,ישראל,לא סחיר,תשתיות,לא,2010-12-25,ilAAA,S&P מעלות,נייר ערך,ILS,4.9814,2036-12-25,0.0273,0.049,החוב לא נחות,,חברת ציטוט,אי-תלות,2025-09-30,2025-09-30,1487.77,1.0,164.64,2.44947,,,,0.000116,3e-06
325,325.0,מקורות,520010869,ח.פ.,מקורות אגח 6 4.90% צמוד 25.12.36,1100908,פנימי,צמוד למדד המחירים לצרכן,ישראל,ישראל,לא סחיר,תשתיות,לא,2006-12-25,AA,פנימי,נייר ערך,ILS,4.96,2036-12-25,0.0283,0.049,החוב לא נחות,,חברת ציטוט,אי-תלות,2025-09-30,2025-09-30,15352.59,1.0,164.64,25.2765,,,,0.001203,4.4e-05
325,325.0,"מת""ם - מרכז תעשיות מדע חיפה בע""מ",510687403,ח.פ.,"מת""ם  אגח א 3.10% שקלי 30.06.27",11389991,פנימי,צמוד למדד המחירים לצרכן,ישראל,ישראל,לא סחיר,"נדל""ן מניב בישראל",לא,2016-08-16,Aa2.il,מידרוג Moodys,נייר ערך,ILS,1.2213,2027-06-30,0.0466,0.031,החוב לא נחות,,אחר,אי-תלות,2025-09-30,2025-09-30,1960.95,1.0,98.25,1.92663,,,,9.1e-05,3e-06
325,325.0,"גדות מסופים לכימיקלים (1985) בע""מ",520040775,ח.פ.,גדות אגח א 4.30% שקלי 30.06.26,11623202,פנימי,צמוד למדד המחירים לצרכן,ישראל,ישראל,לא סחיר,מסחר,לא,2020-05-10,A3.il,מידרוג Moodys,נייר ערך,ILS,0.6561,2026-06-30,0.0539,0.043,החוב לא נחות,,אחר,אי-תלות,2025-09-30,2025-09-30,11123.77,1.0,100.43,11.1716,,,,0.000532,1.9e-05
325,325.0,י.ח.ק להשקעות- שותפות מוגבלת,550016091,ח.פ.,י.ח.ק השקעות אגח ב 2.86% שקלי 31.12.28,1181783,פנימי,צמוד למדד המחירים לצרכן,ישראל,ישראל,לא סחיר,השקעה ואחזקות,לא,2021-11-14,ilA+,S&P מעלות,נייר ערך,ILS,1.63,2028-12-31,0.068,0.0286,החוב לא נחות,,אחר,אי-תלות,2025-09-30,2025-09-30,464.27,1.0,98.48,0.45721,,,,2.1e-05,0.0
325,325.0,"אגרקסקו חברה ליצוא חקלאי בע""מ",510155625,ח.פ.,אגרקסקו אגח א חש4/12,1126770,פנימי,צמוד למדד המחירים לצרכן,ישראל,ישראל,לא סחיר,מסחר,לא,2007-12-27,NR,NR,NR,ILS,0.0,2017-04-30,0.0,0.0615,החוב לא נחות,,אחר,אי-תלות,2025-09-30,2025-09-30,28.97,1.0,0.0001,0.0,,,,0.0,0.0
347,347.0,"בנק לאומי לישראל בע""מ",520018078,ח.פ.,בנק לאומי סדרה 3 3.69% צמוד 24.05.35,IL0012150293,ISIN,צמוד למדד המחירים לצרכן,ישראל,ישראל,לא סחיר,בנקים,לא,2024-12-23,NR,NR,NR,ILS,3.73,2035-05-24,0.037,0.0369,החוב לא נחות,,חברת ציטוט,אי-תלות,2025-09-30,2025-09-30,983986.58,1.0,103.39,1017.34373,,,,0.066504,0.000514
347,347.0,מקורות,520010869,ח.פ.,מקורות אגח 8 4.10% צמוד 14.07.48,IL0011243461,ISIN,"צמוד למט""ח",ישראל,ישראל,לא סחיר,תשתיות,לא,2011-07-14,ilAAA,S&P מעלות,נייר ערך,ILS,9.36,2048-07-14,0.0298,0.041,החוב לא נחות,,חברת ציטוט,אי-תלות,2025-09-30,2025-09-30,3518448.93,1.0,139.55,4909.99549,,,,0.320968,0.002483
347,347.0,נתיבי הגז הטבעי לישראל,513436394,ח.פ.,נתיבי גז אגח ג 4.80% צמוד 31.12.31,IL0011255093,ISIN,"צמוד למט""ח",ישראל,ישראל,לא סחיר,תשתיות,לא,2012-01-02,Aaa.il,מידרוג Moodys,נייר ערך,ILS,3.03,2031-12-31,0.0312,0.048,החוב לא נחות,,חברת ציטוט,אי-תלות,2025-09-30,2025-09-30,328472.79,1.0,131.46,431.81032,,,,0.028225,0.000215
347,347.0,"ביטוח ישיר - השקעות פיננסיות בע""מ",520044439,ח.פ.,ביטוח ישיר אגח יא 4.60% שקלי 30.06.28,IL0011388258,ISIN,צמוד למדד המחירים לצרכן,ישראל,ישראל,לא סחיר,השקעה ואחזקות,לא,2016-07-19,A2.il,מידרוג Moodys,נייר ערך,ILS,1.99,2028-06-30,0.0599,0.046,החוב לא נחות,,אחר,אי-תלות,2025-09-30,2025-09-30,160487.73,1.0,99.93,160.37538,,,,0.010483,8e-05
347,347.0,"מכלול מימון נדל""ן בע""מ",515759777,ח.פ.,מכלול נדלן אגח 1 1.00% פריים 30.11.26,IL0012071416,ISIN,לא צמוד למדד המחירים לצרכן,ישראל,ישראל,לא סחיר,אשראי חוץ בנקאי,לא,2024-06-03,NR,NR,NR,ILS,1.12,2026-11-30,0.0633,0.0816,החוב לא נחות,,חברת ציטוט,אי-תלות,2025-09-30,2025-09-30,95028.87,1.0,103.36,102.38216,,,,0.006691,4.9e-05
347,347.0,אורמת טכנולוגיות אינק,520036716,ח.פ.,אורמת סדרה 4 3.35% שקלי 15.06.31,IL0011672123,ISIN,צמוד למדד המחירים לצרכן,ישראל,ישראל,לא סחיר,אנרגיה מתחדשת,לא,2020-07-01,ilAA-,S&P מעלות,נייר ערך,ILS,2.9457,2031-06-15,0.0518,0.0335,החוב לא נחות,,אחר,אי-תלות,2025-09-30,2025-09-30,107306.07,1.0,95.91,102.91725,,,,0.006726,5.1e-05
347,347.0,"גב-ים נגב בע""מ",514189596,ח.פ.,גב ים אגח ב 3.84% צמוד 31.12.28,IL0012084534,ISIN,"צמוד למט""ח",ישראל,ישראל,לא סחיר,"נדל""ן מניב בישראל",לא,2024-07-11,ilA+,S&P מעלות,נייר ערך,ILS,2.89,2028-12-31,0.0422,0.0384,החוב לא נחות,,חברת ציטוט,אי-תלות,2025-09-30,2025-09-30,312068.32,1.0,106.65,332.82086,,,,0.021755,0.000168
347,347.0,"גמול חברה להשקעות בע""מ",520018136,ח.פ.,"גמול אג""ח ב- הסדר",IL0011167553,ISIN,צמוד למדד המחירים לצרכן,ישראל,ישראל,לא סחיר,"נדל""ן מניב בישראל",לא,2009-07-01,NR,NR,NR,ILS,0.01,2021-09-30,0.0001,0.045,החוב לא נחות,,אחר,אי-תלות,2025-09-30,2025-09-30,655.18,1.0,39.0,0.25551,,,,1.6e-05,0.0
347,347.0,"בנק לאומי לישראל בע""מ",520018078,ח.פ.,"בנק לאומי סדרה 2 2.30% ב""י 24.08.30",IL0012058975,ISIN,לא צמוד למדד המחירים לצרכן,ישראל,ישראל,לא סחיר,בנקים,לא,2024-04-17,NR,NR,NR,ILS,4.17,2030-08-24,0.0705,0.113,החוב לא נחות,,חברת ציטוט,אי-תלות,2025-09-30,2025-09-30,384603.11,1.0,101.46,390.21831,,,,0.025508,0.000196
347,347.0,"רפאל מערכות לחימה מתקדמות בע""מ",520042185,ח.פ.,רפאל אגח ד 3.74% שקלי 15.09.34,IL0011402844,ISIN,צמוד למדד המחירים לצרכן,ישראל,ישראל,לא סחיר,ביטחוניות,לא,2017-03-01,AA+,פנימי,נייר ערך,ILS,4.4,2034-09-15,0.0478,0.0374,החוב לא נחות,,אחר,אי-תלות,2025-09-30,2025-09-30,256131.93,1.0,96.46,247.06485,,,,0.01615,0.000124
347,347.0,נתיבי הגז הטבעי לישראל,513436394,ח.פ.,נתיבי גז אגח א 5.60% צמוד 29.12.26,IL0011030843,ISIN,"צמוד למט""ח",ישראל,ישראל,לא סחיר,תשתיות,לא,2007-01-02,Aaa.il,מידרוג Moodys,נייר ערך,ILS,0.57,2026-12-29,0.0991,0.056,החוב לא נחות,,חברת ציטוט,אי-תלות,2025-09-30,2025-09-30,287258.87,1.0,147.67,424.19516,,,,0.027726,0.000211
347,347.0,"מימון ישיר מקבוצת ישיר(2006) בע""מ",513893123,ח.פ.,מימון ישיר אגח 16 4.25% צמוד 12.05.28,IL0011983405,ISIN,"צמוד למט""ח",ישראל,ישראל,לא סחיר,אשראי חוץ בנקאי,לא,2023-07-31,Aa2.il,מידרוג Moodys,נייר ערך,ILS,1.81,2028-05-12,0.0605,0.0425,החוב לא נחות,,חברת ציטוט,אי-תלות,2025-09-30,2025-09-30,104023.99,1.0,108.68,113.05328,,,,0.00739,5.6e-05
347,347.0,"קרדיטו הנפקות בע""מ",516804499,ח.פ.,קרדיטו אגח ב 10% שקלי 15.03.51,IL0012162744,ISIN,צמוד למדד המחירים לצרכן,ישראל,ישראל,לא סחיר,אשראי חוץ בנקאי,לא,2025-01-12,NR,NR,NR,ILS,9.22,2051-03-13,0.105,0.1,החוב לא נחות,,אחר,אי-תלות,2025-09-30,2025-09-30,163126.62,1.0,93.57,152.63758,,,,0.009977,7.7e-05
347,347.0,"בנק לאומי לישראל בע""מ",520018078,ח.פ.,"בנק לאומי סדרה 4 2.2% ב""י 24.6.29",IL0012219288,ISIN,לא צמוד למדד המחירים לצרכן,ישראל,ישראל,לא סחיר,בנקים,לא,2025-05-22,NR,NR,NR,ILS,3.32,2029-06-24,0.0642,0.112,החוב לא נחות,,חברת ציטוט,אי-תלות,2025-09-30,2025-09-30,490850.21,1.0,99.38,487.80695,,,,0.031887,0.000246
347,347.0,"מימון ישיר נדל""ן ומשכנתאות הנפקות (סדרה 2) בע""מ",517112074,ח.פ.,מימון ישיר נדלן אגח (סדרה 2) 5.25% צמוד 20.06.54,IL0012257882,ISIN,"צמוד למט""ח",ישראל,ישראל,לא סחיר,אשראי חוץ בנקאי,לא,2025-07-29,Aa1.il,מידרוג Moodys,נייר ערך,ILS,10.31,2054-06-20,0.0489,0.0525,החוב לא נחות,,חברת ציטוט,אי-תלות,2025-09-30,2025-09-30,222570.89,1.0,103.96,231.38471,,,,0.015124,0.000116
347,347.0,חברת החשמל,520000472,ח.פ.,חברת חשמל 6.00% צמוד 07.05.29,IL0060001869,ISIN,"צמוד למט""ח",ישראל,ישראל,לא סחיר,אנרגיה,לא,2014-05-07,Aaa.il,מידרוג Moodys,נייר ערך,ILS,1.95,2029-05-07,0.0356,0.06,החוב לא נחות,,חברת ציטוט,אי-תלות,2025-09-30,2025-09-30,640384.38,1.0,129.32,828.14508,,,,0.054135,0.000416
347,347.0,"מימון ישיר נדל""ן ומשכנתאות הנפקות (סדרה 2) בע""מ",517112074,ח.פ.,"מימון ישיר נדלן אגח (סדרה 2) 3.3%+ ב""י 20.06.54",IL0012257965,ISIN,צמוד למדד המחירים לצרכן,ישראל,ישראל,לא סחיר,אשראי חוץ בנקאי,לא,2025-07-29,Aa1.il,מידרוג Moodys,נייר ערך,ILS,7.4,2054-06-20,0.0739,0.078,החוב לא נחות,,אחר,אי-תלות,2025-09-30,2025-09-30,120905.96,1.0,100.1,121.02686,,,,0.007911,6e-05
347,347.0,"בנק הפועלים בע""מ",520000118,ח.פ.,"פועלים אגח 2 2.25% ב""י 07.11.28",IL0012275454,ISIN,לא צמוד למדד המחירים לצרכן,ישראל,ישראל,לא סחיר,בנקים,לא,2025-08-27,NR,NR,NR,ILS,2.83,2028-11-07,0.0711,0.0675,החוב לא נחות,,חברת ציטוט,אי-תלות,2025-09-30,2025-09-30,425547.7,1.0,99.52,423.50507,,,,0.027684,0.000214
347,347.0,"מימון ישיר נדלן ומשכנתאות הנפקות (סד 1) בע""מ",516100153,ח.פ.,מימון ישיר נדלן אגח 1 5.00% צמוד 20.02.54,IL0012152687,ISIN,"צמוד למט""ח",ישראל,ישראל,לא סחיר,אשראי חוץ בנקאי,לא,2024-12-26,Aa1.il,מידרוג Moodys,נייר ערך,ILS,10.61,2054-02-20,0.0456,0.05,החוב לא נחות,,חברת ציטוט,אי-תלות,2025-09-30,2025-09-30,155641.48,1.0,106.71,166.08503,,,,0.010856,8.3e-05
347,347.0,"מכלול מימון נדל""ן בע""מ",515759777,ח.פ.,מכלול נדלן אגח 2 1% פריים 01.01.28,1215193,פנימי,לא צמוד למדד המחירים לצרכן,ישראל,ישראל,לא סחיר,אשראי חוץ בנקאי,לא,2024-12-25,NR,NR,NR,ILS,2.1,2028-01-01,0.0641,0.07,החוב לא נחות,,חברת ציטוט,אי-תלות,2025-09-30,2025-09-30,342910.31,1.0,101.45,351.2037,,,,0.022957,0.000176
347,347.0,תמר אריאל קפיטל,516612256,ח.פ.,"COCO תמר אריאל קפיטל 3.06% ב""י 31.05.32",2004862,פנימי,לא צמוד למדד המחירים לצרכן,ישראל,ישראל,לא סחיר,אשראי חוץ בנקאי,לא,2022-05-25,NR,NR,NR,ILS,5.3932,2032-05-31,0.0651,0.0756,החוב לא נחות,,חברת ציטוט,אי-תלות,2025-09-30,2025-09-30,19757.15,1.0,108.11,21.35945,,,,0.001396,1e-05
347,347.0,"בנק הפועלים בע""מ",520000118,ח.פ.,"פועלים אגח 1 2.25% ב""י 30.09.27",1211747,פנימי,לא צמוד למדד המחירים לצרכן,ישראל,ישראל,לא סחיר,בנקים,לא,2024-09-25,NR,NR,NR,ILS,1.9,2027-09-30,0.0689,0.1125,החוב לא נחות,,חברת ציטוט,אי-תלות,2025-09-30,2025-09-30,548769.93,1.0,101.09,554.75153,,,,0.036264,0.00028
347,347.0,בנק ירושלים בע''מ,520025636,ח.פ.,בנק ירושלים COCO 5.13% צמוד 05.12.32,2004863,פנימי,צמוד למדד המחירים לצרכן,ישראל,ישראל,לא סחיר,בנקים,לא,2022-12-05,ilA-,S&P מעלות,נייר ערך,ILS,6.0943,2032-12-05,0.0443,0.0513,החוב לא נחות,,אחר,אי-תלות,2025-09-30,2025-09-30,362611.83,1.0,114.54,415.33558,,,,0.02715,0.000209
347,347.0,"אלון חברת הדלק לישראל בע""מ",520041690,ח.פ.,חוב מסופק -אלון דלק סד' 1,45411567,פנימי,צמוד למדד המחירים לצרכן,ישראל,ישראל,לא סחיר,השקעה ואחזקות,לא,2015-12-31,NR,NR,NR,ILS,0.01,2023-01-22,0.0001,0.0,החוב לא נחות,,אחר,אי-תלות,2025-09-30,2025-09-30,-588484.14,1.0,100.0,-588.48414,,,,-0.038469,-0.000297
347,347.0,"פרופיט תעשיות בניה בע""מ",520040650,ח.פ.,הפרשי שווי-פרופיט אגח ד' - הסדר חוב,54901234,פנימי,צמוד למדד המחירים לצרכן,ישראל,ישראל,לא סחיר,בנייה,לא,2016-10-19,NR,NR,NR,ILS,0.01,2025-12-31,0.0001,1e-05,החוב לא נחות,,אחר,אי-תלות,2025-09-30,2025-09-30,-140132.43,1.0,100.0,-140.13243,,,,-0.00916,-7e-05
347,347.0,כלל תעשיות,520021874,ח.פ.,כלל תעשיות אגח טז 4.47% שקלי 30.06.27,6080238,פנימי,צמוד למדד המחירים לצרכן,ישראל,ישראל,לא סחיר,השקעה ואחזקות,לא,2019-12-29,A2.il,מידרוג Moodys,נייר ערך,ILS,1.45,2027-06-30,0.0535,0.0447,החוב לא נחות,,אחר,אי-תלות,2025-09-30,2025-09-30,178612.42,1.0,100.02,178.64815,,,,0.011677,8.9e-05
347,347.0,"מימון ישיר נדל""ן ומשכנתאות בע""מ",516100153,ח.פ.,מ. ישיר משכנתאות א 4.45% צמוד 31.12.31,1208818,פנימי,"צמוד למט""ח",ישראל,ישראל,לא סחיר,אשראי חוץ בנקאי,לא,2024-07-14,A3.il,מידרוג Moodys,נייר ערך,ILS,2.96,2031-12-31,0.0443,0.0445,החוב לא נחות,,חברת ציטוט,אי-תלות,2025-09-30,2025-09-30,159580.39,1.0,105.78,168.80413,,,,0.011034,8.5e-05
347,347.0,"בנק לאומי לישראל בע""מ",520018078,ח.פ.,"בנק לאומי סדרה 1 2.3% ב""י 24.12.26",1198639,פנימי,לא צמוד למדד המחירים לצרכן,ישראל,ישראל,לא סחיר,בנקים,לא,2023-08-07,NR,NR,NR,ILS,1.18,2026-12-24,0.0715,0.113,החוב לא נחות,,חברת ציטוט,אי-תלות,2025-09-30,2025-09-30,96607.83,1.0,100.51,97.10054,,,,0.006346,4.8e-05
347,347.0,"פרופיט תעשיות בניה בע""מ",520040650,ח.פ.,פרופיט אגח ד' ד-הסדר חוב,54901233,פנימי,צמוד למדד המחירים לצרכן,ישראל,ישראל,לא סחיר,בנייה,לא,2016-10-19,NR,NR,NR,ILS,0.0,2025-12-31,0.0,0.04,החוב לא נחות,,אחר,אי-תלות,2025-09-30,2025-09-30,128526.61,1.0,119.91,154.11624,,,,0.010073,7.7e-05
347,347.0,"עוגן- אג""ח חברתית 2 בע""מ (חל""צ)",516556545,ח.פ.,"עוגן אג""ח בכיר 0.5% פריים 15.03.26",1196831,פנימי,צמוד למדד המחירים לצרכן,ישראל,ישראל,לא סחיר,שירותים פיננסיים,לא,2023-06-15,Aa2.il,מידרוג Moodys,נייר ערך,ILS,0.32,2026-03-15,0.0777,0.125,החוב לא נחות,,אחר,אי-תלות,2025-09-30,2025-09-30,14164.61,1.0,100.62,14.25244,,,,0.00093,6e-06
347,347.0,"נתיבים אג""ח בע""מ",513502229,ח.פ.,נתיבים אגח א 7.97% דולרי 04.07.27,10902810,פנימי,"צמוד למט""ח",ישראל,ישראל,לא סחיר,השקעה ואחזקות,כן,2004-03-28,Aa1.il,מידרוג Moodys,נייר ערך,USD,0.9755,2027-07-04,0.045,0.0797,החוב לא נחות,,חברת ציטוט,אי-תלות,2025-09-30,2025-09-30,41635.28,3.306,105.33,144.98275,,,,0.009477,7.3e-05
347,347.0,מקורות,520010869,ח.פ.,מקורות אגח 6 4.90% צמוד 25.12.36,1100908,פנימי,צמוד למדד המחירים לצרכן,ישראל,ישראל,לא סחיר,תשתיות,לא,2006-12-25,AA,פנימי,נייר ערך,ILS,4.96,2036-12-25,0.0283,0.049,החוב לא נחות,,חברת ציטוט,אי-תלות,2025-09-30,2025-09-30,1171133.02,1.0,164.64,1928.1534,,,,0.126045,0.000975
347,347.0,מקורות,520010869,ח.פ.,מקורות אגח 6 4.90% צמוד 25.12.36,11009081,פנימי,"צמוד למט""ח",ישראל,ישראל,לא סחיר,תשתיות,לא,2010-12-25,ilAAA,S&P מעלות,נייר ערך,ILS,4.9814,2036-12-25,0.0273,0.049,החוב לא נחות,,חברת ציטוט,אי-תלות,2025-09-30,2025-09-30,113490.81,1.0,164.64,186.85128,,,,0.012212,9.3e-05
347,347.0,"אלון חברת הדלק לישראל בע""מ",520041690,ח.פ.,אלון חברת הדלק 06.17,11015672,פנימי,צמוד למדד המחירים לצרכן,ישראל,ישראל,לא סחיר,השקעה ואחזקות,לא,2017-07-23,NR,NR,NR,ILS,0.0,2023-12-31,0.0,0.056,החוב לא נחות,,אחר,אי-תלות,2025-09-30,2025-09-30,469432.24,1.0,136.44,640.49334,,,,0.041869,0.000323
347,347.0,"אגרקסקו חברה ליצוא חקלאי בע""מ",510155625,ח.פ.,אגרקסקו אגח א חש4/12,1126770,פנימי,צמוד למדד המחירים לצרכן,ישראל,ישראל,לא סחיר,מסחר,לא,2007-12-27,NR,NR,NR,ILS,0.0,2017-04-30,0.0,0.0615,החוב לא נחות,,אחר,אי-תלות,2025-09-30,2025-09-30,426.6,1.0,0.0001,0.0,,,,0.0,0.0
347,347.0,"עוגן- אג""ח חברתית 2 בע""מ (חל""צ)",516556545,ח.פ.,"עוגן אג""ח רגילה 2.35% פריים 15.7.27",1196849,פנימי,צמוד למדד המחירים לצרכן,ישראל,ישראל,לא סחיר,שירותים פיננסיים,לא,2023-06-15,NR,NR,NR,ILS,1.15,2027-06-15,0.0901,0.1435,החוב לא נחות,,אחר,אי-תלות,2025-09-30,2025-09-30,108783.55,1.0,101.23,110.12158,,,,0.007197,5.5e-05
347,347.0,"גדות מסופים לכימיקלים (1985) בע""מ",520040775,ח.פ.,גדות אגח א 4.30% שקלי 30.06.26,11623202,פנימי,צמוד למדד המחירים לצרכן,ישראל,ישראל,לא סחיר,מסחר,לא,2020-05-10,A3.il,מידרוג Moodys,נייר ערך,ILS,0.6561,2026-06-30,0.0539,0.043,החוב לא נחות,,אחר,אי-תלות,2025-09-30,2025-09-30,163815.23,1.0,100.43,164.51962,,,,0.010754,8.2e-05
347,347.0,י.ח.ק להשקעות- שותפות מוגבלת,550016091,ח.פ.,י.ח.ק השקעות אגח ב 2.86% שקלי 31.12.28,1181783,פנימי,צמוד למדד המחירים לצרכן,ישראל,ישראל,לא סחיר,השקעה ואחזקות,לא,2021-11-14,ilA+,S&P מעלות,נייר ערך,ILS,1.63,2028-12-31,0.068,0.0286,החוב לא נחות,,אחר,אי-תלות,2025-09-30,2025-09-30,26350.53,1.0,98.48,25.95,,,,0.001695,1.3e-05
347,347.0,מירלנד דיוולופמנט קורפריישן פי אל סי,1502,פנימי,מירלנד שטר הון 1.00% 01.01.2027,1182963,פנימי,צמוד למדד המחירים לצרכן,ישראל,רוסיה,לא סחיר,בנייה,לא,2021-11-26,NR,NR,NR,ILS,0.0,2027-01-01,0.0,0.01,החוב לא נחות,,אחר,אי-תלות,2025-09-30,2025-09-30,62045.02,1.0,0.0,0.0,,,,0.0,0.0
347,347.0,"איילון חברת לביטוח בע""מ",520030677,ח.פ.,איילון אגח ג 7.75% שקלי 31.12.27,11955771,פנימי,צמוד למדד המחירים לצרכן,ישראל,ישראל,לא סחיר,ביטוח,לא,2022-11-22,A3.il,מידרוג Moodys,נייר ערך,ILS,2.0754,2027-12-31,0.0638,0.0775,החוב לא נחות,,אחר,אי-תלות,2025-09-30,2025-09-30,110982.78,1.0,104.94,116.46532,,,,0.007612,5.8e-05
347,347.0,"מת""ם - מרכז תעשיות מדע חיפה בע""מ",510687403,ח.פ.,"מת""ם  אגח א 3.10% שקלי 30.06.27",11389991,פנימי,צמוד למדד המחירים לצרכן,ישראל,ישראל,לא סחיר,"נדל""ן מניב בישראל",לא,2016-08-16,Aa2.il,מידרוג Moodys,נייר ערך,ILS,1.2213,2027-06-30,0.0466,0.031,החוב לא נחות,,אחר,אי-תלות,2025-09-30,2025-09-30,111297.09,1.0,98.25,109.3494,,,,0.007147,5.4e-05
347,347.0,DEAN FOODS CO,5RGFDMYH829UYJH0KY29,LEI,DF 6.5 03/15/23,US242370AD62,ISIN,צמוד למדד המחירים לצרכן,"חו""ל","ארה""ב",לא סחיר,Food Products,לא,2015-02-20,D,S&P,נייר ערך,USD,0.0,2023-03-15,0.0,0.065,החוב לא נחות,,אחר,אי-תלות,2025-09-30,2025-09-30,158373.41,3.306,0.0883,0.46232,,,,2.9e-05,0.0
347,347.0,Endo International PLC,549300KK5WR4MGN4YT97,LEI,ENDO 7.5% 04/27,72961956,פנימי,צמוד למדד המחירים לצרכן,"חו""ל","ארה""ב",לא סחיר,Health Care Equipment & Supplies,לא,2019-03-14,D,S&P,נייר ערך,USD,100.0,2027-04-01,2.0,0.075,החוב לא נחות,,אחר,אי-תלות,2025-09-30,2025-09-30,32013.08,3.306,1e-06,0.0,,,,0.0,0.0
389,389.0,נתיבי הגז הטבעי לישראל,513436394,ח.פ.,נתיבי גז אגח א 5.60% צמוד 29.12.26,IL0011030843,ISIN,"צמוד למט""ח",ישראל,ישראל,לא סחיר,תשתיות,לא,2007-01-02,Aaa.il,מידרוג Moodys,נייר ערך,ILS,0.57,2026-12-29,0.0991,0.056,החוב לא נחות,,חברת ציטוט,אי-תלות,2025-09-30,2025-09-30,44356.1,1.0,147.67,65.50066,,,,0.007556,8.2e-05
389,389.0,מקורות,520010869,ח.פ.,מקורות אגח 8 4.10% צמוד 14.07.48,IL0011243461,ISIN,"צמוד למט""ח",ישראל,ישראל,לא סחיר,תשתיות,לא,2011-07-14,ilAAA,S&P מעלות,נייר ערך,ILS,9.36,2048-07-14,0.0298,0.041,החוב לא נחות,,חברת ציטוט,אי-תלות,2025-09-30,2025-09-30,4904299.32,1.0,139.55,6843.94969,,,,0.789716,0.008737
389,389.0,נתיבי הגז הטבעי לישראל,513436394,ח.פ.,נתיבי גז אגח ג 4.80% צמוד 31.12.31,IL0011255093,ISIN,"צמוד למט""ח",ישראל,ישראל,לא סחיר,תשתיות,לא,2012-01-02,Aaa.il,מידרוג Moodys,נייר ערך,ILS,3.03,2031-12-31,0.0312,0.048,החוב לא נחות,,חברת ציטוט,אי-תלות,2025-09-30,2025-09-30,49217.34,1.0,131.46,64.70111,,,,0.007465,8.1e-05
389,389.0,"רפאל מערכות לחימה מתקדמות בע""מ",520042185,ח.פ.,רפאל אגח ד 3.74% שקלי 15.09.34,IL0011402844,ISIN,צמוד למדד המחירים לצרכן,ישראל,ישראל,לא סחיר,ביטחוניות,לא,2017-03-01,AA+,פנימי,נייר ערך,ILS,4.4,2034-09-15,0.0478,0.0374,החוב לא נחות,,אחר,אי-תלות,2025-09-30,2025-09-30,33644.49,1.0,96.46,32.45348,,,,0.003744,4.1e-05
389,389.0,"גב-ים נגב בע""מ",514189596,ח.פ.,גב ים אגח ב 3.84% צמוד 31.12.28,IL0012084534,ISIN,"צמוד למט""ח",ישראל,ישראל,לא סחיר,"נדל""ן מניב בישראל",לא,2024-07-11,ilA+,S&P מעלות,נייר ערך,ILS,2.89,2028-12-31,0.0422,0.0384,החוב לא נחות,,חברת ציטוט,אי-תלות,2025-09-30,2025-09-30,63300.41,1.0,106.65,67.50989,,,,0.007789,8.6e-05
389,389.0,"מכלול מימון נדל""ן בע""מ",515759777,ח.פ.,מכלול נדלן אגח 1 1.00% פריים 30.11.26,IL0012071416,ISIN,לא צמוד למדד המחירים לצרכן,ישראל,ישראל,לא סחיר,אשראי חוץ בנקאי,לא,2024-06-03,NR,NR,NR,ILS,1.12,2026-11-30,0.0633,0.0816,החוב לא נחות,,חברת ציטוט,אי-תלות,2025-09-30,2025-09-30,19275.8,1.0,103.36,20.76736,,,,0.002395,2.6e-05
389,389.0,אורמת טכנולוגיות אינק,520036716,ח.פ.,אורמת סדרה 4 3.35% שקלי 15.06.31,IL0011672123,ISIN,צמוד למדד המחירים לצרכן,ישראל,ישראל,לא סחיר,אנרגיה מתחדשת,לא,2020-07-01,ilAA-,S&P מעלות,נייר ערך,ILS,2.9457,2031-06-15,0.0518,0.0335,החוב לא נחות,,אחר,אי-תלות,2025-09-30,2025-09-30,21766.13,1.0,95.91,20.87589,,,,0.002408,2.6e-05
389,389.0,"בנק לאומי לישראל בע""מ",520018078,ח.פ.,"בנק לאומי סדרה 2 2.30% ב""י 24.08.30",IL0012058975,ISIN,לא צמוד למדד המחירים לצרכן,ישראל,ישראל,לא סחיר,בנקים,לא,2024-04-17,NR,NR,NR,ILS,4.17,2030-08-24,0.0705,0.113,החוב לא נחות,,חברת ציטוט,אי-תלות,2025-09-30,2025-09-30,78013.48,1.0,101.46,79.15247,,,,0.009133,0.000101
389,389.0,"ביטוח ישיר - השקעות פיננסיות בע""מ",520044439,ח.פ.,ביטוח ישיר אגח יא 4.60% שקלי 30.06.28,IL0011388258,ISIN,צמוד למדד המחירים לצרכן,ישראל,ישראל,לא סחיר,השקעה ואחזקות,לא,2016-07-19,A2.il,מידרוג Moodys,נייר ערך,ILS,1.99,2028-06-30,0.0599,0.046,החוב לא נחות,,אחר,אי-תלות,2025-09-30,2025-09-30,21081.04,1.0,99.93,21.06629,,,,0.00243,2.6e-05
389,389.0,"בנק לאומי לישראל בע""מ",520018078,ח.פ.,בנק לאומי סדרה 3 3.69% צמוד 24.05.35,IL0012150293,ISIN,צמוד למדד המחירים לצרכן,ישראל,ישראל,לא סחיר,בנקים,לא,2024-12-23,NR,NR,NR,ILS,3.73,2035-05-24,0.037,0.0369,החוב לא נחות,,חברת ציטוט,אי-תלות,2025-09-30,2025-09-30,199593.33,1.0,103.39,206.35954,,,,0.023811,0.000263
389,389.0,"קרדיטו הנפקות בע""מ",516804499,ח.פ.,קרדיטו אגח ב 10% שקלי 15.03.51,IL0012162744,ISIN,צמוד למדד המחירים לצרכן,ישראל,ישראל,לא סחיר,אשראי חוץ בנקאי,לא,2025-01-12,NR,NR,NR,ILS,9.22,2051-03-13,0.105,0.1,החוב לא נחות,,אחר,אי-תלות,2025-09-30,2025-09-30,33088.85,1.0,93.57,30.96124,,,,0.003572,3.9e-05
389,389.0,"מימון ישיר נדל""ן ומשכנתאות הנפקות (סדרה 2) בע""מ",517112074,ח.פ.,"מימון ישיר נדלן אגח (סדרה 2) 3.3%+ ב""י 20.06.54",IL0012257965,ISIN,צמוד למדד המחירים לצרכן,ישראל,ישראל,לא סחיר,אשראי חוץ בנקאי,לא,2025-07-29,Aa1.il,מידרוג Moodys,נייר ערך,ILS,7.4,2054-06-20,0.0739,0.078,החוב לא נחות,,אחר,אי-תלות,2025-09-30,2025-09-30,24524.75,1.0,100.1,24.54927,,,,0.002832,3.1e-05
389,389.0,"מימון ישיר נדלן ומשכנתאות הנפקות (סד 1) בע""מ",516100153,ח.פ.,מימון ישיר נדלן אגח 1 5.00% צמוד 20.02.54,IL0012152687,ISIN,"צמוד למט""ח",ישראל,ישראל,לא סחיר,אשראי חוץ בנקאי,לא,2024-12-26,Aa1.il,מידרוג Moodys,נייר ערך,ILS,10.61,2054-02-20,0.0456,0.05,החוב לא נחות,,חברת ציטוט,אי-תלות,2025-09-30,2025-09-30,31570.55,1.0,106.71,33.68894,,,,0.003887,4.3e-05
389,389.0,"מימון ישיר מקבוצת ישיר(2006) בע""מ",513893123,ח.פ.,מימון ישיר אגח 16 4.25% צמוד 12.05.28,IL0011983405,ISIN,"צמוד למט""ח",ישראל,ישראל,לא סחיר,אשראי חוץ בנקאי,לא,2023-07-31,Aa2.il,מידרוג Moodys,נייר ערך,ILS,1.81,2028-05-12,0.0605,0.0425,החוב לא נחות,,חברת ציטוט,אי-תלות,2025-09-30,2025-09-30,21100.39,1.0,108.68,22.9319,,,,0.002646,2.9e-05
389,389.0,"בנק לאומי לישראל בע""מ",520018078,ח.פ.,"בנק לאומי סדרה 4 2.2% ב""י 24.6.29",IL0012219288,ISIN,לא צמוד למדד המחירים לצרכן,ישראל,ישראל,לא סחיר,בנקים,לא,2025-05-22,NR,NR,NR,ILS,3.32,2029-06-24,0.0642,0.112,החוב לא נחות,,חברת ציטוט,אי-תלות,2025-09-30,2025-09-30,99564.8,1.0,99.38,98.9475,,,,0.011417,0.000126
389,389.0,"מימון ישיר נדל""ן ומשכנתאות הנפקות (סדרה 2) בע""מ",517112074,ח.פ.,מימון ישיר נדלן אגח (סדרה 2) 5.25% צמוד 20.06.54,IL0012257882,ISIN,"צמוד למט""ח",ישראל,ישראל,לא סחיר,אשראי חוץ בנקאי,לא,2025-07-29,Aa1.il,מידרוג Moodys,נייר ערך,ILS,10.31,2054-06-20,0.0489,0.0525,החוב לא נחות,,חברת ציטוט,אי-תלות,2025-09-30,2025-09-30,45146.62,1.0,103.96,46.93442,,,,0.005415,5.9e-05
389,389.0,"בנק הפועלים בע""מ",520000118,ח.פ.,"פועלים אגח 2 2.25% ב""י 07.11.28",IL0012275454,ISIN,לא צמוד למדד המחירים לצרכן,ישראל,ישראל,לא סחיר,בנקים,לא,2025-08-27,NR,NR,NR,ILS,2.83,2028-11-07,0.0711,0.0675,החוב לא נחות,,חברת ציטוט,אי-תלות,2025-09-30,2025-09-30,86318.74,1.0,99.52,85.90441,,,,0.009912,0.000109
389,389.0,חברת החשמל,520000472,ח.פ.,חברת חשמל 6.00% צמוד 07.05.29,IL0060001869,ISIN,"צמוד למט""ח",ישראל,ישראל,לא סחיר,אנרגיה,לא,2014-05-07,Aaa.il,מידרוג Moodys,נייר ערך,ILS,1.95,2029-05-07,0.0356,0.06,החוב לא נחות,,חברת ציטוט,אי-תלות,2025-09-30,2025-09-30,87956.36,1.0,129.32,113.74516,,,,0.013124,0.000145
389,389.0,"בנק לאומי לישראל בע""מ",520018078,ח.פ.,"בנק לאומי סדרה 1 2.3% ב""י 24.12.26",1198639,פנימי,לא צמוד למדד המחירים לצרכן,ישראל,ישראל,לא סחיר,בנקים,לא,2023-08-07,NR,NR,NR,ILS,1.18,2026-12-24,0.0715,0.113,החוב לא נחות,,חברת ציטוט,אי-תלות,2025-09-30,2025-09-30,19596.08,1.0,100.51,19.69602,,,,0.002272,2.5e-05
389,389.0,כלל תעשיות,520021874,ח.פ.,כלל תעשיות אגח טז 4.47% שקלי 30.06.27,6080238,פנימי,צמוד למדד המחירים לצרכן,ישראל,ישראל,לא סחיר,השקעה ואחזקות,לא,2019-12-29,A2.il,מידרוג Moodys,נייר ערך,ILS,1.45,2027-06-30,0.0535,0.0447,החוב לא נחות,,אחר,אי-תלות,2025-09-30,2025-09-30,23461.83,1.0,100.02,23.46652,,,,0.002707,2.9e-05
389,389.0,"בנק הפועלים בע""מ",520000118,ח.פ.,"פועלים אגח 1 2.25% ב""י 30.09.27",1211747,פנימי,לא צמוד למדד המחירים לצרכן,ישראל,ישראל,לא סחיר,בנקים,לא,2024-09-25,NR,NR,NR,ILS,1.9,2027-09-30,0.0689,0.1125,החוב לא נחות,,חברת ציטוט,אי-תלות,2025-09-30,2025-09-30,111313.32,1.0,101.09,112.52664,,,,0.012984,0.000143
389,389.0,"מכלול מימון נדל""ן בע""מ",515759777,ח.פ.,מכלול נדלן אגח 2 1% פריים 01.01.28,1215193,פנימי,לא צמוד למדד המחירים לצרכן,ישראל,ישראל,לא סחיר,אשראי חוץ בנקאי,לא,2024-12-25,NR,NR,NR,ILS,2.1,2028-01-01,0.0641,0.07,החוב לא נחות,,חברת ציטוט,אי-תלות,2025-09-30,2025-09-30,69556.45,1.0,101.45,71.23869,,,,0.008219,9e-05
389,389.0,"מימון ישיר נדל""ן ומשכנתאות בע""מ",516100153,ח.פ.,מ. ישיר משכנתאות א 4.45% צמוד 31.12.31,1208818,פנימי,"צמוד למט""ח",ישראל,ישראל,לא סחיר,אשראי חוץ בנקאי,לא,2024-07-14,A3.il,מידרוג Moodys,נייר ערך,ILS,2.96,2031-12-31,0.0443,0.0445,החוב לא נחות,,חברת ציטוט,אי-תלות,2025-09-30,2025-09-30,32369.53,1.0,105.78,34.24049,,,,0.00395,4.3e-05
389,389.0,בנק ירושלים בע''מ,520025636,ח.פ.,בנק ירושלים COCO 5.13% צמוד 05.12.32,2004863,פנימי,צמוד למדד המחירים לצרכן,ישראל,ישראל,לא סחיר,בנקים,לא,2022-12-05,ilA-,S&P מעלות,נייר ערך,ILS,6.0943,2032-12-05,0.0443,0.0513,החוב לא נחות,,אחר,אי-תלות,2025-09-30,2025-09-30,47631.27,1.0,114.54,54.55686,,,,0.006295,6.9e-05
389,389.0,"עוגן- אג""ח חברתית 2 בע""מ (חל""צ)",516556545,ח.פ.,"עוגן אג""ח רגילה 2.35% פריים 15.7.27",1196849,פנימי,צמוד למדד המחירים לצרכן,ישראל,ישראל,לא סחיר,שירותים פיננסיים,לא,2023-06-15,NR,NR,NR,ILS,1.15,2027-06-15,0.0901,0.1435,החוב לא נחות,,אחר,אי-תלות,2025-09-30,2025-09-30,14289.38,1.0,101.23,14.46514,,,,0.001669,1.8e-05
389,389.0,"איילון חברת לביטוח בע""מ",520030677,ח.פ.,איילון אגח ג 7.75% שקלי 31.12.27,11955771,פנימי,צמוד למדד המחירים לצרכן,ישראל,ישראל,לא סחיר,ביטוח,לא,2022-11-22,A3.il,מידרוג Moodys,נייר ערך,ILS,2.0754,2027-12-31,0.0638,0.0775,החוב לא נחות,,אחר,אי-תלות,2025-09-30,2025-09-30,22511.91,1.0,104.94,23.624,,,,0.002725,3e-05
389,389.0,מקורות,520010869,ח.פ.,מקורות אגח 6 4.90% צמוד 25.12.36,11009081,פנימי,"צמוד למט""ח",ישראל,ישראל,לא סחיר,תשתיות,לא,2010-12-25,ilAAA,S&P מעלות,נייר ערך,ILS,4.9814,2036-12-25,0.0273,0.049,החוב לא נחות,,חברת ציטוט,אי-תלות,2025-09-30,2025-09-30,19451.88,1.0,164.64,32.02557,,,,0.003694,4e-05
389,389.0,מירלנד דיוולופמנט קורפריישן פי אל סי,1502,פנימי,מירלנד שטר הון 1.00% 01.01.2027,1182963,פנימי,צמוד למדד המחירים לצרכן,ישראל,רוסיה,לא סחיר,בנייה,לא,2021-11-26,NR,NR,NR,ILS,0.0,2027-01-01,0.0,0.01,החוב לא נחות,,אחר,אי-תלות,2025-09-30,2025-09-30,12585.31,1.0,0.0,0.0,,,,0.0,0.0
389,389.0,י.ח.ק להשקעות- שותפות מוגבלת,550016091,ח.פ.,י.ח.ק השקעות אגח ב 2.86% שקלי 31.12.28,1181783,פנימי,צמוד למדד המחירים לצרכן,ישראל,ישראל,לא סחיר,השקעה ואחזקות,לא,2021-11-14,ilA+,S&P מעלות,נייר ערך,ILS,1.63,2028-12-31,0.068,0.0286,החוב לא נחות,,אחר,אי-תלות,2025-09-30,2025-09-30,5344.98,1.0,98.48,5.26374,,,,0.000607,6e-06
389,389.0,"גדות מסופים לכימיקלים (1985) בע""מ",520040775,ח.פ.,גדות אגח א 4.30% שקלי 30.06.26,11623202,פנימי,צמוד למדד המחירים לצרכן,ישראל,ישראל,לא סחיר,מסחר,לא,2020-05-10,A3.il,מידרוג Moodys,נייר ערך,ILS,0.6561,2026-06-30,0.0539,0.043,החוב לא נחות,,אחר,אי-תלות,2025-09-30,2025-09-30,21518.13,1.0,100.43,21.61066,,,,0.002493,2.7e-05
389,389.0,"מת""ם - מרכז תעשיות מדע חיפה בע""מ",510687403,ח.פ.,"מת""ם  אגח א 3.10% שקלי 30.06.27",11389991,פנימי,צמוד למדד המחירים לצרכן,ישראל,ישראל,לא סחיר,"נדל""ן מניב בישראל",לא,2016-08-16,Aa2.il,מידרוג Moodys,נייר ערך,ILS,1.2213,2027-06-30,0.0466,0.031,החוב לא נחות,,אחר,אי-תלות,2025-09-30,2025-09-30,22575.67,1.0,98.25,22.1806,,,,0.002559,2.8e-05
389,389.0,"אגרקסקו חברה ליצוא חקלאי בע""מ",510155625,ח.פ.,אגרקסקו אגח א חש4/12,1126770,פנימי,צמוד למדד המחירים לצרכן,ישראל,ישראל,לא סחיר,מסחר,לא,2007-12-27,NR,NR,NR,ILS,0.0,2017-04-30,0.0,0.0615,החוב לא נחות,,אחר,אי-תלות,2025-09-30,2025-09-30,56.04,1.0,0.0001,0.0,,,,0.0,0.0
389,389.0,מקורות,520010869,ח.פ.,מקורות אגח 6 4.90% צמוד 25.12.36,1100908,פנימי,צמוד למדד המחירים לצרכן,ישראל,ישראל,לא סחיר,תשתיות,לא,2006-12-25,AA,פנימי,נייר ערך,ILS,4.96,2036-12-25,0.0283,0.049,החוב לא נחות,,חברת ציטוט,אי-תלות,2025-09-30,2025-09-30,200727.58,1.0,164.64,330.47789,,,,0.038133,0.000421
389,389.0,"נתיבים אג""ח בע""מ",513502229,ח.פ.,נתיבים אגח א 7.97% דולרי 04.07.27,10902810,פנימי,"צמוד למט""ח",ישראל,ישראל,לא סחיר,השקעה ואחזקות,כן,2004-03-28,Aa1.il,מידרוג Moodys,נייר ערך,USD,0.9755,2027-07-04,0.045,0.0797,החוב לא נחות,,חברת ציטוט,אי-תלות,2025-09-30,2025-09-30,5469.05,3.306,105.33,19.04437,,,,0.002197,2.4e-05
389,389.0,"עוגן- אג""ח חברתית 2 בע""מ (חל""צ)",516556545,ח.פ.,"עוגן אג""ח בכיר 0.5% פריים 15.03.26",1196831,פנימי,צמוד למדד המחירים לצרכן,ישראל,ישראל,לא סחיר,שירותים פיננסיים,לא,2023-06-15,Aa2.il,מידרוג Moodys,נייר ערך,ILS,0.32,2026-03-15,0.0777,0.125,החוב לא נחות,,אחר,אי-תלות,2025-09-30,2025-09-30,1860.61,1.0,100.62,1.87214,,,,0.000216,2e-06
389,389.0,DEAN FOODS CO,5RGFDMYH829UYJH0KY29,LEI,DF 6.5 03/15/23,US242370AD62,ISIN,צמוד למדד המחירים לצרכן,"חו""ל","ארה""ב",לא סחיר,Food Products,לא,2015-02-20,D,S&P,נייר ערך,USD,0.0,2023-03-15,0.0,0.065,החוב לא נחות,,אחר,אי-תלות,2025-09-30,2025-09-30,12139.48,3.306,0.0883,0.03544,,,,4e-06,0.0
389,389.0,Endo International PLC,549300KK5WR4MGN4YT97,LEI,ENDO 7.5% 04/27,72961956,פנימי,צמוד למדד המחירים לצרכן,"חו""ל","ארה""ב",לא סחיר,Health Care Equipment & Supplies,לא,2019-03-14,D,S&P,נייר ערך,USD,100.0,2027-04-01,2.0,0.075,החוב לא נחות,,אחר,אי-תלות,2025-09-30,2025-09-30,2453.83,3.306,1e-06,0.0,,,,0.0,0.0
671,12120.0,אורמת טכנולוגיות אינק,520036716,ח.פ.,אורמת סדרה 4 3.35% שקלי 15.06.31,IL0011672123,ISIN,צמוד למדד המחירים לצרכן,ישראל,ישראל,לא סחיר,אנרגיה מתחדשת,לא,2020-07-01,ilAA-,S&P מעלות,נייר ערך,ILS,2.9457,2031-06-15,0.0518,0.0335,החוב לא נחות,,אחר,אי-תלות,2025-09-30,2025-09-30,28469.8,1.0,95.91,27.30538,,,,0.005109,7.2e-05
671,12120.0,"בנק לאומי לישראל בע""מ",520018078,ח.פ.,בנק לאומי סדרה 3 3.69% צמוד 24.05.35,IL0012150293,ISIN,צמוד למדד המחירים לצרכן,ישראל,ישראל,לא סחיר,בנקים,לא,2024-12-23,NR,NR,NR,ILS,3.73,2035-05-24,0.037,0.0369,החוב לא נחות,,חברת ציטוט,אי-תלות,2025-09-30,2025-09-30,261065.38,1.0,103.39,269.9155,,,,0.050503,0.000719
671,12120.0,"רפאל מערכות לחימה מתקדמות בע""מ",520042185,ח.פ.,רפאל אגח ד 3.74% שקלי 15.09.34,IL0011402844,ISIN,צמוד למדד המחירים לצרכן,ישראל,ישראל,לא סחיר,ביטחוניות,לא,2017-03-01,AA+,פנימי,נייר ערך,ILS,4.4,2034-09-15,0.0478,0.0374,החוב לא נחות,,אחר,אי-תלות,2025-09-30,2025-09-30,73820.52,1.0,96.46,71.20727,,,,0.013323,0.000189
671,12120.0,נתיבי הגז הטבעי לישראל,513436394,ח.פ.,נתיבי גז אגח א 5.60% צמוד 29.12.26,IL0011030843,ISIN,"צמוד למט""ח",ישראל,ישראל,לא סחיר,תשתיות,לא,2007-01-02,Aaa.il,מידרוג Moodys,נייר ערך,ILS,0.57,2026-12-29,0.0991,0.056,החוב לא נחות,,חברת ציטוט,אי-תלות,2025-09-30,2025-09-30,107530.67,1.0,147.67,158.79053,,,,0.029709,0.000422
671,12120.0,מקורות,520010869,ח.פ.,מקורות אגח 8 4.10% צמוד 14.07.48,IL0011243461,ISIN,"צמוד למט""ח",ישראל,ישראל,לא סחיר,תשתיות,לא,2011-07-14,ilAAA,S&P מעלות,נייר ערך,ILS,9.36,2048-07-14,0.0298,0.041,החוב לא נחות,,חברת ציטוט,אי-תלות,2025-09-30,2025-09-30,1498269.95,1.0,139.55,2090.83573,,,,0.391214,0.005574
671,12120.0,נתיבי הגז הטבעי לישראל,513436394,ח.פ.,נתיבי גז אגח ג 4.80% צמוד 31.12.31,IL0011255093,ISIN,"צמוד למט""ח",ישראל,ישראל,לא סחיר,תשתיות,לא,2012-01-02,Aaa.il,מידרוג Moodys,נייר ערך,ILS,3.03,2031-12-31,0.0312,0.048,החוב לא נחות,,חברת ציטוט,אי-תלות,2025-09-30,2025-09-30,117345.37,1.0,131.46,154.26224,,,,0.028863,0.00041
671,12120.0,"מכלול מימון נדל""ן בע""מ",515759777,ח.פ.,מכלול נדלן אגח 1 1.00% פריים 30.11.26,IL0012071416,ISIN,לא צמוד למדד המחירים לצרכן,ישראל,ישראל,לא סחיר,אשראי חוץ בנקאי,לא,2024-06-03,NR,NR,NR,ILS,1.12,2026-11-30,0.0633,0.0816,החוב לא נחות,,חברת ציטוט,אי-תלות,2025-09-30,2025-09-30,25212.49,1.0,103.36,27.16342,,,,0.005082,7.1e-05
671,12120.0,"מימון ישיר מקבוצת ישיר(2006) בע""מ",513893123,ח.פ.,מימון ישיר אגח 16 4.25% צמוד 12.05.28,IL0011983405,ISIN,"צמוד למט""ח",ישראל,ישראל,לא סחיר,אשראי חוץ בנקאי,לא,2023-07-31,Aa2.il,מידרוג Moodys,נייר ערך,ILS,1.81,2028-05-12,0.0605,0.0425,החוב לא נחות,,חברת ציטוט,אי-תלות,2025-09-30,2025-09-30,27599.02,1.0,108.68,29.99461,,,,0.005612,7.9e-05
671,12120.0,"בנק הפועלים בע""מ",520000118,ח.פ.,"פועלים אגח 2 2.25% ב""י 07.11.28",IL0012275454,ISIN,לא צמוד למדד המחירים לצרכן,ישראל,ישראל,לא סחיר,בנקים,לא,2025-08-27,NR,NR,NR,ILS,2.83,2028-11-07,0.0711,0.0675,החוב לא נחות,,חברת ציטוט,אי-תלות,2025-09-30,2025-09-30,112903.75,1.0,99.52,112.36181,,,,0.021024,0.000299
671,12120.0,"בנק לאומי לישראל בע""מ",520018078,ח.פ.,"בנק לאומי סדרה 2 2.30% ב""י 24.08.30",IL0012058975,ISIN,לא צמוד למדד המחירים לצרכן,ישראל,ישראל,לא סחיר,בנקים,לא,2024-04-17,NR,NR,NR,ILS,4.17,2030-08-24,0.0705,0.113,החוב לא נחות,,חברת ציטוט,אי-תלות,2025-09-30,2025-09-30,102040.58,1.0,101.46,103.53037,,,,0.019371,0.000276
671,12120.0,"ביטוח ישיר - השקעות פיננסיות בע""מ",520044439,ח.פ.,ביטוח ישיר אגח יא 4.60% שקלי 30.06.28,IL0011388258,ISIN,צמוד למדד המחירים לצרכן,ישראל,ישראל,לא סחיר,השקעה ואחזקות,לא,2016-07-19,A2.il,מידרוג Moodys,נייר ערך,ILS,1.99,2028-06-30,0.0599,0.046,החוב לא נחות,,אחר,אי-תלות,2025-09-30,2025-09-30,46254.63,1.0,99.93,46.22225,,,,0.008648,0.000123
671,12120.0,"מימון ישיר נדל""ן ומשכנתאות הנפקות (סדרה 2) בע""מ",517112074,ח.פ.,"מימון ישיר נדלן אגח (סדרה 2) 3.3%+ ב""י 20.06.54",IL0012257965,ISIN,צמוד למדד המחירים לצרכן,ישראל,ישראל,לא סחיר,אשראי חוץ בנקאי,לא,2025-07-29,Aa1.il,מידרוג Moodys,נייר ערך,ILS,7.4,2054-06-20,0.0739,0.078,החוב לא נחות,,אחר,אי-תלות,2025-09-30,2025-09-30,32078.04,1.0,100.1,32.11012,,,,0.006008,8.5e-05
671,12120.0,"מימון ישיר נדל""ן ומשכנתאות הנפקות (סדרה 2) בע""מ",517112074,ח.פ.,מימון ישיר נדלן אגח (סדרה 2) 5.25% צמוד 20.06.54,IL0012257882,ISIN,"צמוד למט""ח",ישראל,ישראל,לא סחיר,אשראי חוץ בנקאי,לא,2025-07-29,Aa1.il,מידרוג Moodys,נייר ערך,ILS,10.31,2054-06-20,0.0489,0.0525,החוב לא נחות,,חברת ציטוט,אי-תלות,2025-09-30,2025-09-30,59051.17,1.0,103.96,61.38959,,,,0.011486,0.000163
671,12120.0,"בנק לאומי לישראל בע""מ",520018078,ח.פ.,"בנק לאומי סדרה 4 2.2% ב""י 24.6.29",IL0012219288,ISIN,לא צמוד למדד המחירים לצרכן,ישראל,ישראל,לא סחיר,בנקים,לא,2025-05-22,NR,NR,NR,ILS,3.32,2029-06-24,0.0642,0.112,החוב לא נחות,,חברת ציטוט,אי-תלות,2025-09-30,2025-09-30,130229.42,1.0,99.38,129.42199,,,,0.024216,0.000345
671,12120.0,"קרדיטו הנפקות בע""מ",516804499,ח.פ.,קרדיטו אגח ב 10% שקלי 15.03.51,IL0012162744,ISIN,צמוד למדד המחירים לצרכן,ישראל,ישראל,לא סחיר,אשראי חוץ בנקאי,לא,2025-01-12,NR,NR,NR,ILS,9.22,2051-03-13,0.105,0.1,החוב לא נחות,,אחר,אי-תלות,2025-09-30,2025-09-30,43279.77,1.0,93.57,40.49688,,,,0.007577,0.000108
671,12120.0,"מימון ישיר נדלן ומשכנתאות הנפקות (סד 1) בע""מ",516100153,ח.פ.,מימון ישיר נדלן אגח 1 5.00% צמוד 20.02.54,IL0012152687,ISIN,"צמוד למט""ח",ישראל,ישראל,לא סחיר,אשראי חוץ בנקאי,לא,2024-12-26,Aa1.il,מידרוג Moodys,נייר ערך,ILS,10.61,2054-02-20,0.0456,0.05,החוב לא נחות,,חברת ציטוט,אי-תלות,2025-09-30,2025-09-30,41293.86,1.0,106.71,44.06468,,,,0.008244,0.000117
671,12120.0,חברת החשמל,520000472,ח.פ.,חברת חשמל 6.00% צמוד 07.05.29,IL0060001869,ISIN,"צמוד למט""ח",ישראל,ישראל,לא סחיר,אנרגיה,לא,2014-05-07,Aaa.il,מידרוג Moodys,נייר ערך,ILS,1.95,2029-05-07,0.0356,0.06,החוב לא נחות,,חברת ציטוט,אי-תלות,2025-09-30,2025-09-30,198903.24,1.0,129.32,257.22167,,,,0.048128,0.000685
671,12120.0,"גב-ים נגב בע""מ",514189596,ח.פ.,גב ים אגח ב 3.84% צמוד 31.12.28,IL0012084534,ISIN,"צמוד למט""ח",ישראל,ישראל,לא סחיר,"נדל""ן מניב בישראל",לא,2024-07-11,ilA+,S&P מעלות,נייר ערך,ILS,2.89,2028-12-31,0.0422,0.0384,החוב לא נחות,,חברת ציטוט,אי-תלות,2025-09-30,2025-09-30,82796.08,1.0,106.65,88.30202,,,,0.016522,0.000235
671,12120.0,כלל תעשיות,520021874,ח.פ.,כלל תעשיות אגח טז 4.47% שקלי 30.06.27,6080238,פנימי,צמוד למדד המחירים לצרכן,ישראל,ישראל,לא סחיר,השקעה ואחזקות,לא,2019-12-29,A2.il,מידרוג Moodys,נייר ערך,ILS,1.45,2027-06-30,0.0535,0.0447,החוב לא נחות,,אחר,אי-תלות,2025-09-30,2025-09-30,51478.4,1.0,100.02,51.4887,,,,0.009634,0.000137
671,12120.0,"בנק הפועלים בע""מ",520000118,ח.פ.,"פועלים אגח 1 2.25% ב""י 30.09.27",1211747,פנימי,לא צמוד למדד המחירים לצרכן,ישראל,ישראל,לא סחיר,בנקים,לא,2024-09-25,NR,NR,NR,ILS,1.9,2027-09-30,0.0689,0.1125,החוב לא נחות,,חברת ציטוט,אי-תלות,2025-09-30,2025-09-30,145596.33,1.0,101.09,147.18333,,,,0.027539,0.000392
671,12120.0,"מכלול מימון נדל""ן בע""מ",515759777,ח.פ.,מכלול נדלן אגח 2 1% פריים 01.01.28,1215193,פנימי,לא צמוד למדד המחירים לצרכן,ישראל,ישראל,לא סחיר,אשראי חוץ בנקאי,לא,2024-12-25,NR,NR,NR,ILS,2.1,2028-01-01,0.0641,0.07,החוב לא נחות,,חברת ציטוט,אי-תלות,2025-09-30,2025-09-30,90978.89,1.0,101.45,93.17925,,,,0.017433,0.000248
671,12120.0,בנק ירושלים בע''מ,520025636,ח.פ.,בנק ירושלים COCO 5.13% צמוד 05.12.32,2004863,פנימי,צמוד למדד המחירים לצרכן,ישראל,ישראל,לא סחיר,בנקים,לא,2022-12-05,ilA-,S&P מעלות,נייר ערך,ILS,6.0943,2032-12-05,0.0443,0.0513,החוב לא נחות,,אחר,אי-תלות,2025-09-30,2025-09-30,104509.39,1.0,114.54,119.70506,,,,0.022397,0.000319
671,12120.0,"מימון ישיר נדל""ן ומשכנתאות בע""מ",516100153,ח.פ.,מ. ישיר משכנתאות א 4.45% צמוד 31.12.31,1208818,פנימי,"צמוד למט""ח",ישראל,ישראל,לא סחיר,אשראי חוץ בנקאי,לא,2024-07-14,A3.il,מידרוג Moodys,נייר ערך,ILS,2.96,2031-12-31,0.0443,0.0445,החוב לא נחות,,חברת ציטוט,אי-תלות,2025-09-30,2025-09-30,42338.91,1.0,105.78,44.78609,,,,0.008379,0.000119
671,12120.0,"עוגן- אג""ח חברתית 2 בע""מ (חל""צ)",516556545,ח.פ.,"עוגן אג""ח רגילה 2.35% פריים 15.7.27",1196849,פנימי,צמוד למדד המחירים לצרכן,ישראל,ישראל,לא סחיר,שירותים פיננסיים,לא,2023-06-15,NR,NR,NR,ILS,1.15,2027-06-15,0.0901,0.1435,החוב לא נחות,,אחר,אי-תלות,2025-09-30,2025-09-30,31352.82,1.0,101.23,31.73846,,,,0.005938,8.4e-05
671,12120.0,"בנק לאומי לישראל בע""מ",520018078,ח.פ.,"בנק לאומי סדרה 1 2.3% ב""י 24.12.26",1198639,פנימי,לא צמוד למדד המחירים לצרכן,ישראל,ישראל,לא סחיר,בנקים,לא,2023-08-07,NR,NR,NR,ILS,1.18,2026-12-24,0.0715,0.113,החוב לא נחות,,חברת ציטוט,אי-תלות,2025-09-30,2025-09-30,25631.41,1.0,100.51,25.76213,,,,0.00482,6.8e-05
671,12120.0,"איילון חברת לביטוח בע""מ",520030677,ח.פ.,איילון אגח ג 7.75% שקלי 31.12.27,11955771,פנימי,צמוד למדד המחירים לצרכן,ישראל,ישראל,לא סחיר,ביטוח,לא,2022-11-22,A3.il,מידרוג Moodys,נייר ערך,ILS,2.0754,2027-12-31,0.0638,0.0775,החוב לא נחות,,אחר,אי-תלות,2025-09-30,2025-09-30,29445.28,1.0,104.94,30.89988,,,,0.005781,8.2e-05
671,12120.0,מקורות,520010869,ח.פ.,מקורות אגח 6 4.90% צמוד 25.12.36,1100908,פנימי,צמוד למדד המחירים לצרכן,ישראל,ישראל,לא סחיר,תשתיות,לא,2006-12-25,AA,פנימי,נייר ערך,ILS,4.96,2036-12-25,0.0283,0.049,החוב לא נחות,,חברת ציטוט,אי-תלות,2025-09-30,2025-09-30,512694.96,1.0,164.64,844.10098,,,,0.157939,0.002251
671,12120.0,מקורות,520010869,ח.פ.,מקורות אגח 6 4.90% צמוד 25.12.36,11009081,פנימי,"צמוד למט""ח",ישראל,ישראל,לא סחיר,תשתיות,לא,2010-12-25,ilAAA,S&P מעלות,נייר ערך,ILS,4.9814,2036-12-25,0.0273,0.049,החוב לא נחות,,חברת ציטוט,אי-תלות,2025-09-30,2025-09-30,49683.66,1.0,164.64,81.79917,,,,0.015304,0.000217
671,12120.0,"אגרקסקו חברה ליצוא חקלאי בע""מ",510155625,ח.פ.,אגרקסקו אגח א חש4/12,1126770,פנימי,צמוד למדד המחירים לצרכן,ישראל,ישראל,לא סחיר,מסחר,לא,2007-12-27,NR,NR,NR,ILS,0.0,2017-04-30,0.0,0.0615,החוב לא נחות,,אחר,אי-תלות,2025-09-30,2025-09-30,122.95,1.0,0.0001,0.0,,,,0.0,0.0
671,12120.0,"מת""ם - מרכז תעשיות מדע חיפה בע""מ",510687403,ח.פ.,"מת""ם  אגח א 3.10% שקלי 30.06.27",11389991,פנימי,צמוד למדד המחירים לצרכן,ישראל,ישראל,לא סחיר,"נדל""ן מניב בישראל",לא,2016-08-16,Aa2.il,מידרוג Moodys,נייר ערך,ILS,1.2213,2027-06-30,0.0466,0.031,החוב לא נחות,,אחר,אי-תלות,2025-09-30,2025-09-30,29528.67,1.0,98.25,29.01192,,,,0.005428,7.7e-05
671,12120.0,"נתיבים אג""ח בע""מ",513502229,ח.פ.,נתיבים אגח א 7.97% דולרי 04.07.27,10902810,פנימי,"צמוד למט""ח",ישראל,ישראל,לא סחיר,השקעה ואחזקות,כן,2004-03-28,Aa1.il,מידרוג Moodys,נייר ערך,USD,0.9755,2027-07-04,0.045,0.0797,החוב לא נחות,,חברת ציטוט,אי-תלות,2025-09-30,2025-09-30,11999.82,3.306,105.33,41.78589,,,,0.007818,0.000111
671,12120.0,י.ח.ק להשקעות- שותפות מוגבלת,550016091,ח.פ.,י.ח.ק השקעות אגח ב 2.86% שקלי 31.12.28,1181783,פנימי,צמוד למדד המחירים לצרכן,ישראל,ישראל,לא סחיר,השקעה ואחזקות,לא,2021-11-14,ilA+,S&P מעלות,נייר ערך,ILS,1.63,2028-12-31,0.068,0.0286,החוב לא נחות,,אחר,אי-תלות,2025-09-30,2025-09-30,6991.16,1.0,98.48,6.8849,,,,0.001288,1.8e-05
671,12120.0,"גדות מסופים לכימיקלים (1985) בע""מ",520040775,ח.פ.,גדות אגח א 4.30% שקלי 30.06.26,11623202,פנימי,צמוד למדד המחירים לצרכן,ישראל,ישראל,לא סחיר,מסחר,לא,2020-05-10,A3.il,מידרוג Moodys,נייר ערך,ILS,0.6561,2026-06-30,0.0539,0.043,החוב לא נחות,,אחר,אי-תלות,2025-09-30,2025-09-30,47213.66,1.0,100.43,47.41667,,,,0.008872,0.000126
671,12120.0,"עוגן- אג""ח חברתית 2 בע""מ (חל""צ)",516556545,ח.פ.,"עוגן אג""ח בכיר 0.5% פריים 15.03.26",1196831,פנימי,צמוד למדד המחירים לצרכן,ישראל,ישראל,לא סחיר,שירותים פיננסיים,לא,2023-06-15,Aa2.il,מידרוג Moodys,נייר ערך,ILS,0.32,2026-03-15,0.0777,0.125,החוב לא נחות,,אחר,אי-תלות,2025-09-30,2025-09-30,4082.43,1.0,100.62,4.10774,,,,0.000768,1e-05
671,12120.0,מירלנד דיוולופמנט קורפריישן פי אל סי,1502,פנימי,מירלנד שטר הון 1.00% 01.01.2027,1182963,פנימי,צמוד למדד המחירים לצרכן,ישראל,רוסיה,לא סחיר,בנייה,לא,2021-11-26,NR,NR,NR,ILS,0.0,2027-01-01,0.0,0.01,החוב לא נחות,,אחר,אי-תלות,2025-09-30,2025-09-30,16461.41,1.0,0.0,0.0,,,,0.0,0.0
671,12120.0,DEAN FOODS CO,5RGFDMYH829UYJH0KY29,LEI,DF 6.5 03/15/23,US242370AD62,ISIN,צמוד למדד המחירים לצרכן,"חו""ל","ארה""ב",לא סחיר,Food Products,לא,2015-02-20,D,S&P,נייר ערך,USD,0.0,2023-03-15,0.0,0.065,החוב לא נחות,,אחר,אי-תלות,2025-09-30,2025-09-30,2558.48,3.306,0.0883,0.00747,,,,1e-06,0.0
671,12120.0,Endo International PLC,549300KK5WR4MGN4YT97,LEI,ENDO 7.5% 04/27,72961956,פנימי,צמוד למדד המחירים לצרכן,"חו""ל","ארה""ב",לא סחיר,Health Care Equipment & Supplies,לא,2019-03-14,D,S&P,נייר ערך,USD,100.0,2027-04-01,2.0,0.075,החוב לא נחות,,אחר,אי-תלות,2025-09-30,2025-09-30,517.16,3.306,1e-06,0.0,,,,0.0,0.0
671,14288.0,נתיבי הגז הטבעי לישראל,513436394,ח.פ.,נתיבי גז אגח ג 4.80% צמוד 31.12.31,IL0011255093,ISIN,"צמוד למט""ח",ישראל,ישראל,לא סחיר,תשתיות,לא,2012-01-02,Aaa.il,מידרוג Moodys,נייר ערך,ILS,3.03,2031-12-31,0.0312,0.048,החוב לא נחות,,חברת ציטוט,אי-תלות,2025-09-30,2025-09-30,283.82,1.0,131.46,0.37311,,,,0.010007,0.000122
671,14288.0,מקורות,520010869,ח.פ.,מקורות אגח 8 4.10% צמוד 14.07.48,IL0011243461,ISIN,"צמוד למט""ח",ישראל,ישראל,לא סחיר,תשתיות,לא,2011-07-14,ilAAA,S&P מעלות,נייר ערך,ILS,9.36,2048-07-14,0.0298,0.041,החוב לא נחות,,חברת ציטוט,אי-תלות,2025-09-30,2025-09-30,6060.66,1.0,139.55,8.45765,,,,0.226842,0.002769
671,14288.0,"מימון ישיר מקבוצת ישיר(2006) בע""מ",513893123,ח.פ.,מימון ישיר אגח 16 4.25% צמוד 12.05.28,IL0011983405,ISIN,"צמוד למט""ח",ישראל,ישראל,לא סחיר,אשראי חוץ בנקאי,לא,2023-07-31,Aa2.il,מידרוג Moodys,נייר ערך,ILS,1.81,2028-05-12,0.0605,0.0425,החוב לא נחות,,חברת ציטוט,אי-תלות,2025-09-30,2025-09-30,488.88,1.0,108.68,0.53131,,,,0.01425,0.000174
671,14288.0,"בנק לאומי לישראל בע""מ",520018078,ח.פ.,"בנק לאומי סדרה 2 2.30% ב""י 24.08.30",IL0012058975,ISIN,לא צמוד למדד המחירים לצרכן,ישראל,ישראל,לא סחיר,בנקים,לא,2024-04-17,NR,NR,NR,ILS,4.17,2030-08-24,0.0705,0.113,החוב לא נחות,,חברת ציטוט,אי-תלות,2025-09-30,2025-09-30,1807.5,1.0,101.46,1.83389,,,,0.049186,0.0006
671,14288.0,"מכלול מימון נדל""ן בע""מ",515759777,ח.פ.,מכלול נדלן אגח 1 1.00% פריים 30.11.26,IL0012071416,ISIN,לא צמוד למדד המחירים לצרכן,ישראל,ישראל,לא סחיר,אשראי חוץ בנקאי,לא,2024-06-03,NR,NR,NR,ILS,1.12,2026-11-30,0.0633,0.0816,החוב לא נחות,,חברת ציטוט,אי-תלות,2025-09-30,2025-09-30,446.6,1.0,103.36,0.48116,,,,0.012904,0.000157
671,14288.0,"גב-ים נגב בע""מ",514189596,ח.פ.,גב ים אגח ב 3.84% צמוד 31.12.28,IL0012084534,ISIN,"צמוד למט""ח",ישראל,ישראל,לא סחיר,"נדל""ן מניב בישראל",לא,2024-07-11,ilA+,S&P מעלות,נייר ערך,ILS,2.89,2028-12-31,0.0422,0.0384,החוב לא נחות,,חברת ציטוט,אי-תלות,2025-09-30,2025-09-30,1466.61,1.0,106.65,1.56414,,,,0.041951,0.000512
671,14288.0,נתיבי הגז הטבעי לישראל,513436394,ח.פ.,נתיבי גז אגח א 5.60% צמוד 29.12.26,IL0011030843,ISIN,"צמוד למט""ח",ישראל,ישראל,לא סחיר,תשתיות,לא,2007-01-02,Aaa.il,מידרוג Moodys,נייר ערך,ILS,0.57,2026-12-29,0.0991,0.056,החוב לא נחות,,חברת ציטוט,אי-תלות,2025-09-30,2025-09-30,309.65,1.0,147.67,0.45726,,,,0.012263,0.000149
671,14288.0,"מימון ישיר נדלן ומשכנתאות הנפקות (סד 1) בע""מ",516100153,ח.פ.,מימון ישיר נדלן אגח 1 5.00% צמוד 20.02.54,IL0012152687,ISIN,"צמוד למט""ח",ישראל,ישראל,לא סחיר,אשראי חוץ בנקאי,לא,2024-12-26,Aa1.il,מידרוג Moodys,נייר ערך,ILS,10.61,2054-02-20,0.0456,0.05,החוב לא נחות,,חברת ציטוט,אי-תלות,2025-09-30,2025-09-30,731.46,1.0,106.71,0.78054,,,,0.020934,0.000255
671,14288.0,חברת החשמל,520000472,ח.פ.,חברת חשמל 6.00% צמוד 07.05.29,IL0060001869,ISIN,"צמוד למט""ח",ישראל,ישראל,לא סחיר,אנרגיה,לא,2014-05-07,Aaa.il,מידרוג Moodys,נייר ערך,ILS,1.95,2029-05-07,0.0356,0.06,החוב לא נחות,,חברת ציטוט,אי-תלות,2025-09-30,2025-09-30,179.44,1.0,129.32,0.23205,,,,0.006223,7.5e-05
671,14288.0,אורמת טכנולוגיות אינק,520036716,ח.פ.,אורמת סדרה 4 3.35% שקלי 15.06.31,IL0011672123,ISIN,צמוד למדד המחירים לצרכן,ישראל,ישראל,לא סחיר,אנרגיה מתחדשת,לא,2020-07-01,ilAA-,S&P מעלות,נייר ערך,ILS,2.9457,2031-06-15,0.0518,0.0335,החוב לא נחות,,אחר,אי-תלות,2025-09-30,2025-09-30,504.3,1.0,95.91,0.48367,,,,0.012972,0.000158
671,14288.0,"קרדיטו הנפקות בע""מ",516804499,ח.פ.,קרדיטו אגח ב 10% שקלי 15.03.51,IL0012162744,ISIN,צמוד למדד המחירים לצרכן,ישראל,ישראל,לא סחיר,אשראי חוץ בנקאי,לא,2025-01-12,NR,NR,NR,ILS,9.22,2051-03-13,0.105,0.1,החוב לא נחות,,אחר,אי-תלות,2025-09-30,2025-09-30,766.64,1.0,93.57,0.71734,,,,0.019239,0.000234
671,14288.0,"בנק לאומי לישראל בע""מ",520018078,ח.פ.,"בנק לאומי סדרה 4 2.2% ב""י 24.6.29",IL0012219288,ISIN,לא צמוד למדד המחירים לצרכן,ישראל,ישראל,לא סחיר,בנקים,לא,2025-05-22,NR,NR,NR,ILS,3.32,2029-06-24,0.0642,0.112,החוב לא נחות,,חברת ציטוט,אי-תלות,2025-09-30,2025-09-30,2306.82,1.0,99.38,2.29252,,,,0.061487,0.00075
671,14288.0,"בנק לאומי לישראל בע""מ",520018078,ח.פ.,בנק לאומי סדרה 3 3.69% צמוד 24.05.35,IL0012150293,ISIN,צמוד למדד המחירים לצרכן,ישראל,ישראל,לא סחיר,בנקים,לא,2024-12-23,NR,NR,NR,ILS,3.73,2035-05-24,0.037,0.0369,החוב לא נחות,,חברת ציטוט,אי-תלות,2025-09-30,2025-09-30,4624.39,1.0,103.39,4.78115,,,,0.128235,0.001565
671,14288.0,"מימון ישיר נדל""ן ומשכנתאות הנפקות (סדרה 2) בע""מ",517112074,ח.פ.,מימון ישיר נדלן אגח (סדרה 2) 5.25% צמוד 20.06.54,IL0012257882,ISIN,"צמוד למט""ח",ישראל,ישראל,לא סחיר,אשראי חוץ בנקאי,לא,2025-07-29,Aa1.il,מידרוג Moodys,נייר ערך,ILS,10.31,2054-06-20,0.0489,0.0525,החוב לא נחות,,חברת ציטוט,אי-תלות,2025-09-30,2025-09-30,1046.0,1.0,103.96,1.08743,,,,0.029166,0.000356
671,14288.0,"מימון ישיר נדל""ן ומשכנתאות הנפקות (סדרה 2) בע""מ",517112074,ח.פ.,"מימון ישיר נדלן אגח (סדרה 2) 3.3%+ ב""י 20.06.54",IL0012257965,ISIN,צמוד למדד המחירים לצרכן,ישראל,ישראל,לא סחיר,אשראי חוץ בנקאי,לא,2025-07-29,Aa1.il,מידרוג Moodys,נייר ערך,ILS,7.4,2054-06-20,0.0739,0.078,החוב לא נחות,,אחר,אי-תלות,2025-09-30,2025-09-30,568.22,1.0,100.1,0.56878,,,,0.015255,0.000186
671,14288.0,"בנק הפועלים בע""מ",520000118,ח.פ.,"פועלים אגח 2 2.25% ב""י 07.11.28",IL0012275454,ISIN,לא צמוד למדד המחירים לצרכן,ישראל,ישראל,לא סחיר,בנקים,לא,2025-08-27,NR,NR,NR,ILS,2.83,2028-11-07,0.0711,0.0675,החוב לא נחות,,חברת ציטוט,אי-תלות,2025-09-30,2025-09-30,1999.92,1.0,99.52,1.99032,,,,0.053382,0.000651
671,14288.0,"מכלול מימון נדל""ן בע""מ",515759777,ח.פ.,מכלול נדלן אגח 2 1% פריים 01.01.28,1215193,פנימי,לא צמוד למדד המחירים לצרכן,ישראל,ישראל,לא סחיר,אשראי חוץ בנקאי,לא,2024-12-25,NR,NR,NR,ILS,2.1,2028-01-01,0.0641,0.07,החוב לא נחות,,חברת ציטוט,אי-תלות,2025-09-30,2025-09-30,1611.56,1.0,101.45,1.65053,,,,0.044268,0.00054
671,14288.0,"בנק לאומי לישראל בע""מ",520018078,ח.פ.,"בנק לאומי סדרה 1 2.3% ב""י 24.12.26",1198639,פנימי,לא צמוד למדד המחירים לצרכן,ישראל,ישראל,לא סחיר,בנקים,לא,2023-08-07,NR,NR,NR,ILS,1.18,2026-12-24,0.0715,0.113,החוב לא נחות,,חברת ציטוט,אי-תלות,2025-09-30,2025-09-30,454.02,1.0,100.51,0.45634,,,,0.012239,0.000149
671,14288.0,"מימון ישיר נדל""ן ומשכנתאות בע""מ",516100153,ח.פ.,מ. ישיר משכנתאות א 4.45% צמוד 31.12.31,1208818,פנימי,"צמוד למט""ח",ישראל,ישראל,לא סחיר,אשראי חוץ בנקאי,לא,2024-07-14,A3.il,מידרוג Moodys,נייר ערך,ILS,2.96,2031-12-31,0.0443,0.0445,החוב לא נחות,,חברת ציטוט,אי-תלות,2025-09-30,2025-09-30,749.97,1.0,105.78,0.79332,,,,0.021277,0.000259
671,14288.0,"איילון חברת לביטוח בע""מ",520030677,ח.פ.,איילון אגח ג 7.75% שקלי 31.12.27,11955771,פנימי,צמוד למדד המחירים לצרכן,ישראל,ישראל,לא סחיר,ביטוח,לא,2022-11-22,A3.il,מידרוג Moodys,נייר ערך,ILS,2.0754,2027-12-31,0.0638,0.0775,החוב לא נחות,,אחר,אי-תלות,2025-09-30,2025-09-30,521.58,1.0,104.94,0.54735,,,,0.01468,0.000179
671,14288.0,"בנק הפועלים בע""מ",520000118,ח.פ.,"פועלים אגח 1 2.25% ב""י 30.09.27",1211747,פנימי,לא צמוד למדד המחירים לצרכן,ישראל,ישראל,לא סחיר,בנקים,לא,2024-09-25,NR,NR,NR,ILS,1.9,2027-09-30,0.0689,0.1125,החוב לא נחות,,חברת ציטוט,אי-תלות,2025-09-30,2025-09-30,2579.02,1.0,101.09,2.60714,,,,0.069926,0.000853
671,14288.0,י.ח.ק להשקעות- שותפות מוגבלת,550016091,ח.פ.,י.ח.ק השקעות אגח ב 2.86% שקלי 31.12.28,1181783,פנימי,צמוד למדד המחירים לצרכן,ישראל,ישראל,לא סחיר,השקעה ואחזקות,לא,2021-11-14,ilA+,S&P מעלות,נייר ערך,ILS,1.63,2028-12-31,0.068,0.0286,החוב לא נחות,,אחר,אי-תלות,2025-09-30,2025-09-30,123.84,1.0,98.48,0.12196,,,,0.003271,3.9e-05
671,14288.0,"מת""ם - מרכז תעשיות מדע חיפה בע""מ",510687403,ח.פ.,"מת""ם  אגח א 3.10% שקלי 30.06.27",11389991,פנימי,צמוד למדד המחירים לצרכן,ישראל,ישראל,לא סחיר,"נדל""ן מניב בישראל",לא,2016-08-16,Aa2.il,מידרוג Moodys,נייר ערך,ILS,1.2213,2027-06-30,0.0466,0.031,החוב לא נחות,,אחר,אי-תלות,2025-09-30,2025-09-30,523.06,1.0,98.25,0.5139,,,,0.013783,0.000168
671,14288.0,מקורות,520010869,ח.פ.,מקורות אגח 6 4.90% צמוד 25.12.36,11009081,פנימי,"צמוד למט""ח",ישראל,ישראל,לא סחיר,תשתיות,לא,2010-12-25,ilAAA,S&P מעלות,נייר ערך,ILS,4.9814,2036-12-25,0.0273,0.049,החוב לא נחות,,חברת ציטוט,אי-תלות,2025-09-30,2025-09-30,212.46,1.0,164.64,0.34979,,,,0.009381,0.000113
671,14288.0,מקורות,520010869,ח.פ.,מקורות אגח 6 4.90% צמוד 25.12.36,1100908,פנימי,צמוד למדד המחירים לצרכן,ישראל,ישראל,לא סחיר,תשתיות,לא,2006-12-25,AA,פנימי,נייר ערך,ILS,4.96,2036-12-25,0.0283,0.049,החוב לא נחות,,חברת ציטוט,אי-תלות,2025-09-30,2025-09-30,2192.41,1.0,164.64,3.60958,,,,0.096812,0.001182
671,14288.0,מירלנד דיוולופמנט קורפריישן פי אל סי,1502,פנימי,מירלנד שטר הון 1.00% 01.01.2027,1182963,פנימי,צמוד למדד המחירים לצרכן,ישראל,רוסיה,לא סחיר,בנייה,לא,2021-11-26,NR,NR,NR,ILS,0.0,2027-01-01,0.0,0.01,החוב לא נחות,,אחר,אי-תלות,2025-09-30,2025-09-30,291.59,1.0,0.0,0.0,,,,0.0,0.0
671,14288.0,DEAN FOODS CO,5RGFDMYH829UYJH0KY29,LEI,DF 6.5 03/15/23,US242370AD62,ISIN,צמוד למדד המחירים לצרכן,"חו""ל","ארה""ב",לא סחיר,Food Products,לא,2015-02-20,D,S&P,נייר ערך,USD,0.0,2023-03-15,0.0,0.065,החוב לא נחות,,אחר,אי-תלות,2025-09-30,2025-09-30,645.55,3.306,0.0883,0.00188,,,,5e-05,0.0
671,14288.0,Endo International PLC,549300KK5WR4MGN4YT97,LEI,ENDO 7.5% 04/27,72961956,פנימי,צמוד למדד המחירים לצרכן,"חו""ל","ארה""ב",לא סחיר,Health Care Equipment & Supplies,לא,2019-03-14,D,S&P,נייר ערך,USD,100.0,2027-04-01,2.0,0.075,החוב לא נחות,,אחר,אי-תלות,2025-09-30,2025-09-30,130.49,3.306,1e-06,0.0,,,,0.0,0.0
671,15220.0,"מימון ישיר מקבוצת ישיר(2006) בע""מ",513893123,ח.פ.,מימון ישיר אגח 16 4.25% צמוד 12.05.28,IL0011983405,ISIN,"צמוד למט""ח",ישראל,ישראל,לא סחיר,אשראי חוץ בנקאי,לא,2023-07-31,Aa2.il,מידרוג Moodys,נייר ערך,ILS,1.81,2028-05-12,0.0605,0.0425,החוב לא נחות,,חברת ציטוט,אי-תלות,2025-09-30,2025-09-30,1134.47,1.0,108.68,1.23294,,,,0.015782,0.000515
671,15220.0,"בנק לאומי לישראל בע""מ",520018078,ח.פ.,"בנק לאומי סדרה 2 2.30% ב""י 24.08.30",IL0012058975,ISIN,לא צמוד למדד המחירים לצרכן,ישראל,ישראל,לא סחיר,בנקים,לא,2024-04-17,NR,NR,NR,ILS,4.17,2030-08-24,0.0705,0.113,החוב לא נחות,,חברת ציטוט,אי-תלות,2025-09-30,2025-09-30,4194.42,1.0,101.46,4.25566,,,,0.054474,0.001778
671,15220.0,"מכלול מימון נדל""ן בע""מ",515759777,ח.פ.,מכלול נדלן אגח 1 1.00% פריים 30.11.26,IL0012071416,ISIN,לא צמוד למדד המחירים לצרכן,ישראל,ישראל,לא סחיר,אשראי חוץ בנקאי,לא,2024-06-03,NR,NR,NR,ILS,1.12,2026-11-30,0.0633,0.0816,החוב לא נחות,,חברת ציטוט,אי-תלות,2025-09-30,2025-09-30,1036.37,1.0,103.36,1.11656,,,,0.014291,0.000465
671,15220.0,אורמת טכנולוגיות אינק,520036716,ח.פ.,אורמת סדרה 4 3.35% שקלי 15.06.31,IL0011672123,ISIN,צמוד למדד המחירים לצרכן,ישראל,ישראל,לא סחיר,אנרגיה מתחדשת,לא,2020-07-01,ilAA-,S&P מעלות,נייר ערך,ILS,2.9457,2031-06-15,0.0518,0.0335,החוב לא נחות,,אחר,אי-תלות,2025-09-30,2025-09-30,1170.26,1.0,95.91,1.1224,,,,0.014367,0.000468
671,15220.0,"גב-ים נגב בע""מ",514189596,ח.פ.,גב ים אגח ב 3.84% צמוד 31.12.28,IL0012084534,ISIN,"צמוד למט""ח",ישראל,ישראל,לא סחיר,"נדל""ן מניב בישראל",לא,2024-07-11,ilA+,S&P מעלות,נייר ערך,ILS,2.89,2028-12-31,0.0422,0.0384,החוב לא נחות,,חברת ציטוט,אי-תלות,2025-09-30,2025-09-30,3403.36,1.0,106.65,3.62969,,,,0.046461,0.001516
671,15220.0,"מימון ישיר נדלן ומשכנתאות הנפקות (סד 1) בע""מ",516100153,ח.פ.,מימון ישיר נדלן אגח 1 5.00% צמוד 20.02.54,IL0012152687,ISIN,"צמוד למט""ח",ישראל,ישראל,לא סחיר,אשראי חוץ בנקאי,לא,2024-12-26,Aa1.il,מידרוג Moodys,נייר ערך,ILS,10.61,2054-02-20,0.0456,0.05,החוב לא נחות,,חברת ציטוט,אי-תלות,2025-09-30,2025-09-30,1697.4,1.0,106.71,1.8113,,,,0.023185,0.000756
671,15220.0,"קרדיטו הנפקות בע""מ",516804499,ח.פ.,קרדיטו אגח ב 10% שקלי 15.03.51,IL0012162744,ISIN,צמוד למדד המחירים לצרכן,ישראל,ישראל,לא סחיר,אשראי חוץ בנקאי,לא,2025-01-12,NR,NR,NR,ILS,9.22,2051-03-13,0.105,0.1,החוב לא נחות,,אחר,אי-תלות,2025-09-30,2025-09-30,1779.03,1.0,93.57,1.66464,,,,0.021308,0.000695
671,15220.0,"בנק לאומי לישראל בע""מ",520018078,ח.פ.,"בנק לאומי סדרה 4 2.2% ב""י 24.6.29",IL0012219288,ISIN,לא צמוד למדד המחירים לצרכן,ישראל,ישראל,לא סחיר,בנקים,לא,2025-05-22,NR,NR,NR,ILS,3.32,2029-06-24,0.0642,0.112,החוב לא נחות,,חברת ציטוט,אי-תלות,2025-09-30,2025-09-30,5353.13,1.0,99.38,5.31994,,,,0.068097,0.002222
671,15220.0,"מימון ישיר נדל""ן ומשכנתאות הנפקות (סדרה 2) בע""מ",517112074,ח.פ.,מימון ישיר נדלן אגח (סדרה 2) 5.25% צמוד 20.06.54,IL0012257882,ISIN,"צמוד למט""ח",ישראל,ישראל,לא סחיר,אשראי חוץ בנקאי,לא,2025-07-29,Aa1.il,מידרוג Moodys,נייר ערך,ILS,10.31,2054-06-20,0.0489,0.0525,החוב לא נחות,,חברת ציטוט,אי-תלות,2025-09-30,2025-09-30,2427.32,1.0,103.96,2.52344,,,,0.032301,0.001054
671,15220.0,"מימון ישיר נדל""ן ומשכנתאות הנפקות (סדרה 2) בע""מ",517112074,ח.פ.,"מימון ישיר נדלן אגח (סדרה 2) 3.3%+ ב""י 20.06.54",IL0012257965,ISIN,צמוד למדד המחירים לצרכן,ישראל,ישראל,לא סחיר,אשראי חוץ בנקאי,לא,2025-07-29,Aa1.il,מידרוג Moodys,נייר ערך,ILS,7.4,2054-06-20,0.0739,0.078,החוב לא נחות,,אחר,אי-תלות,2025-09-30,2025-09-30,1318.58,1.0,100.1,1.3199,,,,0.016895,0.000551
671,15220.0,"בנק הפועלים בע""מ",520000118,ח.פ.,"פועלים אגח 2 2.25% ב""י 07.11.28",IL0012275454,ISIN,לא צמוד למדד המחירים לצרכן,ישראל,ישראל,לא סחיר,בנקים,לא,2025-08-27,NR,NR,NR,ILS,2.83,2028-11-07,0.0711,0.0675,החוב לא נחות,,חברת ציטוט,אי-תלות,2025-09-30,2025-09-30,4640.95,1.0,99.52,4.61868,,,,0.05912,0.001929
671,15220.0,חברת החשמל,520000472,ח.פ.,חברת חשמל 6.00% צמוד 07.05.29,IL0060001869,ISIN,"צמוד למט""ח",ישראל,ישראל,לא סחיר,אנרגיה,לא,2014-05-07,Aaa.il,מידרוג Moodys,נייר ערך,ILS,1.95,2029-05-07,0.0356,0.06,החוב לא נחות,,חברת ציטוט,אי-תלות,2025-09-30,2025-09-30,304.67,1.0,129.32,0.394,,,,0.005043,0.000164
671,15220.0,"בנק לאומי לישראל בע""מ",520018078,ח.פ.,בנק לאומי סדרה 3 3.69% צמוד 24.05.35,IL0012150293,ISIN,צמוד למדד המחירים לצרכן,ישראל,ישראל,לא סחיר,בנקים,לא,2024-12-23,NR,NR,NR,ILS,3.73,2035-05-24,0.037,0.0369,החוב לא נחות,,חברת ציטוט,אי-תלות,2025-09-30,2025-09-30,10731.19,1.0,103.39,11.09498,,,,0.14202,0.004635
671,15220.0,מקורות,520010869,ח.פ.,מקורות אגח 8 4.10% צמוד 14.07.48,IL0011243461,ISIN,"צמוד למט""ח",ישראל,ישראל,לא סחיר,תשתיות,לא,2011-07-14,ilAAA,S&P מעלות,נייר ערך,ILS,9.36,2048-07-14,0.0298,0.041,החוב לא נחות,,חברת ציטוט,אי-תלות,2025-09-30,2025-09-30,10290.34,1.0,139.55,14.36017,,,,0.183815,0.005999
671,15220.0,נתיבי הגז הטבעי לישראל,513436394,ח.פ.,נתיבי גז אגח ג 4.80% צמוד 31.12.31,IL0011255093,ISIN,"צמוד למט""ח",ישראל,ישראל,לא סחיר,תשתיות,לא,2012-01-02,Aaa.il,מידרוג Moodys,נייר ערך,ILS,3.03,2031-12-31,0.0312,0.048,החוב לא נחות,,חברת ציטוט,אי-תלות,2025-09-30,2025-09-30,481.89,1.0,131.46,0.6335,,,,0.008108,0.000264
671,15220.0,נתיבי הגז הטבעי לישראל,513436394,ח.פ.,נתיבי גז אגח א 5.60% צמוד 29.12.26,IL0011030843,ISIN,"צמוד למט""ח",ישראל,ישראל,לא סחיר,תשתיות,לא,2007-01-02,Aaa.il,מידרוג Moodys,נייר ערך,ILS,0.57,2026-12-29,0.0991,0.056,החוב לא נחות,,חברת ציטוט,אי-תלות,2025-09-30,2025-09-30,525.75,1.0,147.67,0.77637,,,,0.009936,0.000323
671,15220.0,מקורות,520010869,ח.פ.,מקורות אגח 6 4.90% צמוד 25.12.36,11009081,פנימי,"צמוד למט""ח",ישראל,ישראל,לא סחיר,תשתיות,לא,2010-12-25,ilAAA,S&P מעלות,נייר ערך,ILS,4.9814,2036-12-25,0.0273,0.049,החוב לא נחות,,חברת ציטוט,אי-תלות,2025-09-30,2025-09-30,360.74,1.0,164.64,0.59391,,,,0.007601,0.000248
671,15220.0,"מכלול מימון נדל""ן בע""מ",515759777,ח.פ.,מכלול נדלן אגח 2 1% פריים 01.01.28,1215193,פנימי,לא צמוד למדד המחירים לצרכן,ישראל,ישראל,לא סחיר,אשראי חוץ בנקאי,לא,2024-12-25,NR,NR,NR,ILS,2.1,2028-01-01,0.0641,0.07,החוב לא נחות,,חברת ציטוט,אי-תלות,2025-09-30,2025-09-30,3739.72,1.0,101.45,3.83017,,,,0.049027,0.0016
671,15220.0,"בנק הפועלים בע""מ",520000118,ח.פ.,"פועלים אגח 1 2.25% ב""י 30.09.27",1211747,פנימי,לא צמוד למדד המחירים לצרכן,ישראל,ישראל,לא סחיר,בנקים,לא,2024-09-25,NR,NR,NR,ILS,1.9,2027-09-30,0.0689,0.1125,החוב לא נחות,,חברת ציטוט,אי-תלות,2025-09-30,2025-09-30,5984.79,1.0,101.09,6.05003,,,,0.077442,0.002527
671,15220.0,"בנק לאומי לישראל בע""מ",520018078,ח.פ.,"בנק לאומי סדרה 1 2.3% ב""י 24.12.26",1198639,פנימי,לא צמוד למדד המחירים לצרכן,ישראל,ישראל,לא סחיר,בנקים,לא,2023-08-07,NR,NR,NR,ILS,1.18,2026-12-24,0.0715,0.113,החוב לא נחות,,חברת ציטוט,אי-תלות,2025-09-30,2025-09-30,1053.59,1.0,100.51,1.05896,,,,0.013555,0.000442
671,15220.0,"איילון חברת לביטוח בע""מ",520030677,ח.פ.,איילון אגח ג 7.75% שקלי 31.12.27,11955771,פנימי,צמוד למדד המחירים לצרכן,ישראל,ישראל,לא סחיר,ביטוח,לא,2022-11-22,A3.il,מידרוג Moodys,נייר ערך,ILS,2.0754,2027-12-31,0.0638,0.0775,החוב לא נחות,,אחר,אי-תלות,2025-09-30,2025-09-30,1210.36,1.0,104.94,1.27015,,,,0.016258,0.00053
671,15220.0,"מימון ישיר נדל""ן ומשכנתאות בע""מ",516100153,ח.פ.,מ. ישיר משכנתאות א 4.45% צמוד 31.12.31,1208818,פנימי,"צמוד למט""ח",ישראל,ישראל,לא סחיר,אשראי חוץ בנקאי,לא,2024-07-14,A3.il,מידרוג Moodys,נייר ערך,ILS,2.96,2031-12-31,0.0443,0.0445,החוב לא נחות,,חברת ציטוט,אי-תלות,2025-09-30,2025-09-30,1740.36,1.0,105.78,1.84095,,,,0.023564,0.000769
671,15220.0,י.ח.ק להשקעות- שותפות מוגבלת,550016091,ח.פ.,י.ח.ק השקעות אגח ב 2.86% שקלי 31.12.28,1181783,פנימי,צמוד למדד המחירים לצרכן,ישראל,ישראל,לא סחיר,השקעה ואחזקות,לא,2021-11-14,ilA+,S&P מעלות,נייר ערך,ILS,1.63,2028-12-31,0.068,0.0286,החוב לא נחות,,אחר,אי-תלות,2025-09-30,2025-09-30,287.37,1.0,98.48,0.28301,,,,0.003622,0.000118
671,15220.0,"מת""ם - מרכז תעשיות מדע חיפה בע""מ",510687403,ח.פ.,"מת""ם  אגח א 3.10% שקלי 30.06.27",11389991,פנימי,צמוד למדד המחירים לצרכן,ישראל,ישראל,לא סחיר,"נדל""ן מניב בישראל",לא,2016-08-16,Aa2.il,מידרוג Moodys,נייר ערך,ILS,1.2213,2027-06-30,0.0466,0.031,החוב לא נחות,,אחר,אי-תלות,2025-09-30,2025-09-30,1213.79,1.0,98.25,1.19255,,,,0.015265,0.000498
671,15220.0,מקורות,520010869,ח.פ.,מקורות אגח 6 4.90% צמוד 25.12.36,1100908,פנימי,צמוד למדד המחירים לצרכן,ישראל,ישראל,לא סחיר,תשתיות,לא,2006-12-25,AA,פנימי,נייר ערך,ILS,4.96,2036-12-25,0.0283,0.049,החוב לא נחות,,חברת ציטוט,אי-תלות,2025-09-30,2025-09-30,3722.47,1.0,164.64,6.12868,,,,0.078449,0.00256
671,15220.0,מירלנד דיוולופמנט קורפריישן פי אל סי,1502,פנימי,מירלנד שטר הון 1.00% 01.01.2027,1182963,פנימי,צמוד למדד המחירים לצרכן,ישראל,רוסיה,לא סחיר,בנייה,לא,2021-11-26,NR,NR,NR,ILS,0.0,2027-01-01,0.0,0.01,החוב לא נחות,,אחר,אי-תלות,2025-09-30,2025-09-30,676.65,1.0,0.0,0.0,,,,0.0,0.0
671,15224.0,"מכלול מימון נדל""ן בע""מ",515759777,ח.פ.,מכלול נדלן אגח 1 1.00% פריים 30.11.26,IL0012071416,ISIN,לא צמוד למדד המחירים לצרכן,ישראל,ישראל,לא סחיר,אשראי חוץ בנקאי,לא,2024-06-03,NR,NR,NR,ILS,1.12,2026-11-30,0.0633,0.0816,החוב לא נחות,,חברת ציטוט,אי-תלות,2025-09-30,2025-09-30,476.06,1.0,103.36,0.5129,,,,0.012865,0.000149
671,15224.0,נתיבי הגז הטבעי לישראל,513436394,ח.פ.,נתיבי גז אגח ג 4.80% צמוד 31.12.31,IL0011255093,ISIN,"צמוד למט""ח",ישראל,ישראל,לא סחיר,תשתיות,לא,2012-01-02,Aaa.il,מידרוג Moodys,נייר ערך,ILS,3.03,2031-12-31,0.0312,0.048,החוב לא נחות,,חברת ציטוט,אי-תלות,2025-09-30,2025-09-30,305.05,1.0,131.46,0.40101,,,,0.010059,0.000117
671,15224.0,אורמת טכנולוגיות אינק,520036716,ח.פ.,אורמת סדרה 4 3.35% שקלי 15.06.31,IL0011672123,ISIN,צמוד למדד המחירים לצרכן,ישראל,ישראל,לא סחיר,אנרגיה מתחדשת,לא,2020-07-01,ilAA-,S&P מעלות,נייר ערך,ILS,2.9457,2031-06-15,0.0518,0.0335,החוב לא נחות,,אחר,אי-תלות,2025-09-30,2025-09-30,537.57,1.0,95.91,0.51558,,,,0.012933,0.00015
671,15224.0,"מימון ישיר מקבוצת ישיר(2006) בע""מ",513893123,ח.פ.,מימון ישיר אגח 16 4.25% צמוד 12.05.28,IL0011983405,ISIN,"צמוד למט""ח",ישראל,ישראל,לא סחיר,אשראי חוץ בנקאי,לא,2023-07-31,Aa2.il,מידרוג Moodys,נייר ערך,ILS,1.81,2028-05-12,0.0605,0.0425,החוב לא נחות,,חברת ציטוט,אי-תלות,2025-09-30,2025-09-30,521.13,1.0,108.68,0.56636,,,,0.014207,0.000165
671,15224.0,חברת החשמל,520000472,ח.פ.,חברת חשמל 6.00% צמוד 07.05.29,IL0060001869,ISIN,"צמוד למט""ח",ישראל,ישראל,לא סחיר,אנרגיה,לא,2014-05-07,Aaa.il,מידרוג Moodys,נייר ערך,ILS,1.95,2029-05-07,0.0356,0.06,החוב לא נחות,,חברת ציטוט,אי-תלות,2025-09-30,2025-09-30,192.86,1.0,129.32,0.24941,,,,0.006256,7.2e-05
671,15224.0,"בנק הפועלים בע""מ",520000118,ח.פ.,"פועלים אגח 2 2.25% ב""י 07.11.28",IL0012275454,ISIN,לא צמוד למדד המחירים לצרכן,ישראל,ישראל,לא סחיר,בנקים,לא,2025-08-27,NR,NR,NR,ILS,2.83,2028-11-07,0.0711,0.0675,החוב לא נחות,,חברת ציטוט,אי-תלות,2025-09-30,2025-09-30,2131.85,1.0,99.52,2.12162,,,,0.053223,0.00062
671,15224.0,"מימון ישיר נדל""ן ומשכנתאות הנפקות (סדרה 2) בע""מ",517112074,ח.פ.,"מימון ישיר נדלן אגח (סדרה 2) 3.3%+ ב""י 20.06.54",IL0012257965,ISIN,צמוד למדד המחירים לצרכן,ישראל,ישראל,לא סחיר,אשראי חוץ בנקאי,לא,2025-07-29,Aa1.il,מידרוג Moodys,נייר ערך,ILS,7.4,2054-06-20,0.0739,0.078,החוב לא נחות,,אחר,אי-תלות,2025-09-30,2025-09-30,605.7,1.0,100.1,0.6063,,,,0.015209,0.000177
671,15224.0,"בנק לאומי לישראל בע""מ",520018078,ח.פ.,"בנק לאומי סדרה 4 2.2% ב""י 24.6.29",IL0012219288,ISIN,לא צמוד למדד המחירים לצרכן,ישראל,ישראל,לא סחיר,בנקים,לא,2025-05-22,NR,NR,NR,ILS,3.32,2029-06-24,0.0642,0.112,החוב לא נחות,,חברת ציטוט,אי-תלות,2025-09-30,2025-09-30,2459.0,1.0,99.38,2.44375,,,,0.061304,0.000714
671,15224.0,"קרדיטו הנפקות בע""מ",516804499,ח.פ.,קרדיטו אגח ב 10% שקלי 15.03.51,IL0012162744,ISIN,צמוד למדד המחירים לצרכן,ישראל,ישראל,לא סחיר,אשראי חוץ בנקאי,לא,2025-01-12,NR,NR,NR,ILS,9.22,2051-03-13,0.105,0.1,החוב לא נחות,,אחר,אי-תלות,2025-09-30,2025-09-30,817.21,1.0,93.57,0.76466,,,,0.019182,0.000223
671,15224.0,מקורות,520010869,ח.פ.,מקורות אגח 8 4.10% צמוד 14.07.48,IL0011243461,ISIN,"צמוד למט""ח",ישראל,ישראל,לא סחיר,תשתיות,לא,2011-07-14,ilAAA,S&P מעלות,נייר ערך,ILS,9.36,2048-07-14,0.0298,0.041,החוב לא נחות,,חברת ציטוט,אי-תלות,2025-09-30,2025-09-30,6514.0,1.0,139.55,9.09029,,,,0.22804,0.002658
671,15224.0,"מימון ישיר נדלן ומשכנתאות הנפקות (סד 1) בע""מ",516100153,ח.פ.,מימון ישיר נדלן אגח 1 5.00% צמוד 20.02.54,IL0012152687,ISIN,"צמוד למט""ח",ישראל,ישראל,לא סחיר,אשראי חוץ בנקאי,לא,2024-12-26,Aa1.il,מידרוג Moodys,נייר ערך,ILS,10.61,2054-02-20,0.0456,0.05,החוב לא נחות,,חברת ציטוט,אי-תלות,2025-09-30,2025-09-30,779.71,1.0,106.71,0.83203,,,,0.020872,0.000243
671,15224.0,"בנק לאומי לישראל בע""מ",520018078,ח.פ.,בנק לאומי סדרה 3 3.69% צמוד 24.05.35,IL0012150293,ISIN,צמוד למדד המחירים לצרכן,ישראל,ישראל,לא סחיר,בנקים,לא,2024-12-23,NR,NR,NR,ILS,3.73,2035-05-24,0.037,0.0369,החוב לא נחות,,חברת ציטוט,אי-תלות,2025-09-30,2025-09-30,4929.45,1.0,103.39,5.09656,,,,0.127853,0.00149
671,15224.0,"גב-ים נגב בע""מ",514189596,ח.פ.,גב ים אגח ב 3.84% צמוד 31.12.28,IL0012084534,ISIN,"צמוד למט""ח",ישראל,ישראל,לא סחיר,"נדל""ן מניב בישראל",לא,2024-07-11,ilA+,S&P מעלות,נייר ערך,ILS,2.89,2028-12-31,0.0422,0.0384,החוב לא נחות,,חברת ציטוט,אי-תלות,2025-09-30,2025-09-30,1563.36,1.0,106.65,1.66732,,,,0.041826,0.000487
671,15224.0,"מימון ישיר נדל""ן ומשכנתאות הנפקות (סדרה 2) בע""מ",517112074,ח.פ.,מימון ישיר נדלן אגח (סדרה 2) 5.25% צמוד 20.06.54,IL0012257882,ISIN,"צמוד למט""ח",ישראל,ישראל,לא סחיר,אשראי חוץ בנקאי,לא,2025-07-29,Aa1.il,מידרוג Moodys,נייר ערך,ILS,10.31,2054-06-20,0.0489,0.0525,החוב לא נחות,,חברת ציטוט,אי-תלות,2025-09-30,2025-09-30,1115.01,1.0,103.96,1.15916,,,,0.029078,0.000339
671,15224.0,נתיבי הגז הטבעי לישראל,513436394,ח.פ.,נתיבי גז אגח א 5.60% צמוד 29.12.26,IL0011030843,ISIN,"צמוד למט""ח",ישראל,ישראל,לא סחיר,תשתיות,לא,2007-01-02,Aaa.il,מידרוג Moodys,נייר ערך,ILS,0.57,2026-12-29,0.0991,0.056,החוב לא נחות,,חברת ציטוט,אי-תלות,2025-09-30,2025-09-30,332.81,1.0,147.67,0.49146,,,,0.012327,0.000143
671,15224.0,"בנק לאומי לישראל בע""מ",520018078,ח.פ.,"בנק לאומי סדרה 2 2.30% ב""י 24.08.30",IL0012058975,ISIN,לא צמוד למדד המחירים לצרכן,ישראל,ישראל,לא סחיר,בנקים,לא,2024-04-17,NR,NR,NR,ILS,4.17,2030-08-24,0.0705,0.113,החוב לא נחות,,חברת ציטוט,אי-תלות,2025-09-30,2025-09-30,1926.74,1.0,101.46,1.95487,,,,0.04904,0.000571
671,15224.0,מקורות,520010869,ח.פ.,מקורות אגח 6 4.90% צמוד 25.12.36,11009081,פנימי,"צמוד למט""ח",ישראל,ישראל,לא סחיר,תשתיות,לא,2010-12-25,ilAAA,S&P מעלות,נייר ערך,ILS,4.9814,2036-12-25,0.0273,0.049,החוב לא נחות,,חברת ציטוט,אי-תלות,2025-09-30,2025-09-30,228.35,1.0,164.64,0.37595,,,,0.009431,0.000109
671,15224.0,מקורות,520010869,ח.פ.,מקורות אגח 6 4.90% צמוד 25.12.36,1100908,פנימי,צמוד למדד המחירים לצרכן,ישראל,ישראל,לא סחיר,תשתיות,לא,2006-12-25,AA,פנימי,נייר ערך,ILS,4.96,2036-12-25,0.0283,0.049,החוב לא נחות,,חברת ציטוט,אי-תלות,2025-09-30,2025-09-30,2356.4,1.0,164.64,3.87958,,,,0.097323,0.001134
671,15224.0,"מכלול מימון נדל""ן בע""מ",515759777,ח.פ.,מכלול נדלן אגח 2 1% פריים 01.01.28,1215193,פנימי,לא צמוד למדד המחירים לצרכן,ישראל,ישראל,לא סחיר,אשראי חוץ בנקאי,לא,2024-12-25,NR,NR,NR,ILS,2.1,2028-01-01,0.0641,0.07,החוב לא נחות,,חברת ציטוט,אי-תלות,2025-09-30,2025-09-30,1717.87,1.0,101.45,1.75942,,,,0.044136,0.000513
671,15224.0,"בנק הפועלים בע""מ",520000118,ח.פ.,"פועלים אגח 1 2.25% ב""י 30.09.27",1211747,פנימי,לא צמוד למדד המחירים לצרכן,ישראל,ישראל,לא סחיר,בנקים,לא,2024-09-25,NR,NR,NR,ILS,1.9,2027-09-30,0.0689,0.1125,החוב לא נחות,,חברת ציטוט,אי-תלות,2025-09-30,2025-09-30,2749.16,1.0,101.09,2.77912,,,,0.069717,0.000812
671,15224.0,"בנק לאומי לישראל בע""מ",520018078,ח.פ.,"בנק לאומי סדרה 1 2.3% ב""י 24.12.26",1198639,פנימי,לא צמוד למדד המחירים לצרכן,ישראל,ישראל,לא סחיר,בנקים,לא,2023-08-07,NR,NR,NR,ILS,1.18,2026-12-24,0.0715,0.113,החוב לא נחות,,חברת ציטוט,אי-תלות,2025-09-30,2025-09-30,483.97,1.0,100.51,0.48644,,,,0.012202,0.000142
671,15224.0,"איילון חברת לביטוח בע""מ",520030677,ח.פ.,איילון אגח ג 7.75% שקלי 31.12.27,11955771,פנימי,צמוד למדד המחירים לצרכן,ישראל,ישראל,לא סחיר,ביטוח,לא,2022-11-22,A3.il,מידרוג Moodys,נייר ערך,ILS,2.0754,2027-12-31,0.0638,0.0775,החוב לא נחות,,אחר,אי-תלות,2025-09-30,2025-09-30,555.99,1.0,104.94,0.58345,,,,0.014636,0.00017
671,15224.0,מירלנד דיוולופמנט קורפריישן פי אל סי,1502,פנימי,מירלנד שטר הון 1.00% 01.01.2027,1182963,פנימי,צמוד למדד המחירים לצרכן,ישראל,רוסיה,לא סחיר,בנייה,לא,2021-11-26,NR,NR,NR,ILS,0.0,2027-01-01,0.0,0.01,החוב לא נחות,,אחר,אי-תלות,2025-09-30,2025-09-30,310.82,1.0,0.0,0.0,,,,0.0,0.0
671,15224.0,"מימון ישיר נדל""ן ומשכנתאות בע""מ",516100153,ח.פ.,מ. ישיר משכנתאות א 4.45% צמוד 31.12.31,1208818,פנימי,"צמוד למט""ח",ישראל,ישראל,לא סחיר,אשראי חוץ בנקאי,לא,2024-07-14,A3.il,מידרוג Moodys,נייר ערך,ILS,2.96,2031-12-31,0.0443,0.0445,החוב לא נחות,,חברת ציטוט,אי-תלות,2025-09-30,2025-09-30,799.45,1.0,105.78,0.84565,,,,0.021214,0.000247
671,15224.0,"מת""ם - מרכז תעשיות מדע חיפה בע""מ",510687403,ח.פ.,"מת""ם  אגח א 3.10% שקלי 30.06.27",11389991,פנימי,צמוד למדד המחירים לצרכן,ישראל,ישראל,לא סחיר,"נדל""ן מניב בישראל",לא,2016-08-16,Aa2.il,מידרוג Moodys,נייר ערך,ILS,1.2213,2027-06-30,0.0466,0.031,החוב לא נחות,,אחר,אי-תלות,2025-09-30,2025-09-30,557.56,1.0,98.25,0.5478,,,,0.013742,0.00016
671,15224.0,י.ח.ק להשקעות- שותפות מוגבלת,550016091,ח.פ.,י.ח.ק השקעות אגח ב 2.86% שקלי 31.12.28,1181783,פנימי,צמוד למדד המחירים לצרכן,ישראל,ישראל,לא סחיר,השקעה ואחזקות,לא,2021-11-14,ilA+,S&P מעלות,נייר ערך,ILS,1.63,2028-12-31,0.068,0.0286,החוב לא נחות,,אחר,אי-תלות,2025-09-30,2025-09-30,132.01,1.0,98.48,0.13,,,,0.003261,3.8e-05
671,15224.0,DEAN FOODS CO,5RGFDMYH829UYJH0KY29,LEI,DF 6.5 03/15/23,US242370AD62,ISIN,צמוד למדד המחירים לצרכן,"חו""ל","ארה""ב",לא סחיר,Food Products,לא,2015-02-20,D,S&P,נייר ערך,USD,0.0,2023-03-15,0.0,0.065,החוב לא נחות,,אחר,אי-תלות,2025-09-30,2025-09-30,644.54,3.306,0.0883,0.00188,,,,4.7e-05,0.0
671,15224.0,Endo International PLC,549300KK5WR4MGN4YT97,LEI,ENDO 7.5% 04/27,72961956,פנימי,צמוד למדד המחירים לצרכן,"חו""ל","ארה""ב",לא סחיר,Health Care Equipment & Supplies,לא,2019-03-14,D,S&P,נייר ערך,USD,100.0,2027-04-01,2.0,0.075,החוב לא נחות,,אחר,אי-תלות,2025-09-30,2025-09-30,130.28,3.306,1e-06,0.0,,,,0.0,0.0
671,7234.0,"מימון ישיר נדל""ן ומשכנתאות הנפקות (סדרה 2) בע""מ",517112074,ח.פ.,מימון ישיר נדלן אגח (סדרה 2) 5.25% צמוד 20.06.54,IL0012257882,ISIN,"צמוד למט""ח",ישראל,ישראל,לא סחיר,אשראי חוץ בנקאי,לא,2025-07-29,Aa1.il,מידרוג Moodys,נייר ערך,ILS,10.31,2054-06-20,0.0489,0.0525,החוב לא נחות,,חברת ציטוט,אי-תלות,2025-09-30,2025-09-30,394519.97,1.0,103.96,410.14296,,,,0.017221,0.000145
671,7234.0,מקורות,520010869,ח.פ.,מקורות אגח 8 4.10% צמוד 14.07.48,IL0011243461,ISIN,"צמוד למט""ח",ישראל,ישראל,לא סחיר,תשתיות,לא,2011-07-14,ilAAA,S&P מעלות,נייר ערך,ILS,9.36,2048-07-14,0.0298,0.041,החוב לא נחות,,חברת ציטוט,אי-תלות,2025-09-30,2025-09-30,5425994.41,1.0,139.55,7571.97518,,,,0.317932,0.002684
671,7234.0,"ביטוח ישיר - השקעות פיננסיות בע""מ",520044439,ח.פ.,ביטוח ישיר אגח יא 4.60% שקלי 30.06.28,IL0011388258,ISIN,צמוד למדד המחירים לצרכן,ישראל,ישראל,לא סחיר,השקעה ואחזקות,לא,2016-07-19,A2.il,מידרוג Moodys,נייר ערך,ILS,1.99,2028-06-30,0.0599,0.046,החוב לא נחות,,אחר,אי-תלות,2025-09-30,2025-09-30,186987.63,1.0,99.93,186.85673,,,,0.007845,6.6e-05
671,7234.0,"רפאל מערכות לחימה מתקדמות בע""מ",520042185,ח.פ.,רפאל אגח ד 3.74% שקלי 15.09.34,IL0011402844,ISIN,צמוד למדד המחירים לצרכן,ישראל,ישראל,לא סחיר,ביטחוניות,לא,2017-03-01,AA+,פנימי,נייר ערך,ILS,4.4,2034-09-15,0.0478,0.0374,החוב לא נחות,,אחר,אי-תלות,2025-09-30,2025-09-30,298424.69,1.0,96.46,287.86046,,,,0.012086,0.000102
671,7234.0,אורמת טכנולוגיות אינק,520036716,ח.פ.,אורמת סדרה 4 3.35% שקלי 15.06.31,IL0011672123,ISIN,צמוד למדד המחירים לצרכן,ישראל,ישראל,לא סחיר,אנרגיה מתחדשת,לא,2020-07-01,ilAA-,S&P מעלות,נייר ערך,ILS,2.9457,2031-06-15,0.0518,0.0335,החוב לא נחות,,אחר,אי-תלות,2025-09-30,2025-09-30,190206.31,1.0,95.91,182.42687,,,,0.007659,6.4e-05
671,7234.0,"מימון ישיר מקבוצת ישיר(2006) בע""מ",513893123,ח.פ.,מימון ישיר אגח 16 4.25% צמוד 12.05.28,IL0011983405,ISIN,"צמוד למט""ח",ישראל,ישראל,לא סחיר,אשראי חוץ בנקאי,לא,2023-07-31,Aa2.il,מידרוג Moodys,נייר ערך,ILS,1.81,2028-05-12,0.0605,0.0425,החוב לא נחות,,חברת ציטוט,אי-תלות,2025-09-30,2025-09-30,184388.64,1.0,108.68,200.39357,,,,0.008414,7.1e-05
671,7234.0,חברת החשמל,520000472,ח.פ.,חברת חשמל 6.00% צמוד 07.05.29,IL0060001869,ISIN,"צמוד למט""ח",ישראל,ישראל,לא סחיר,אנרגיה,לא,2014-05-07,Aaa.il,מידרוג Moodys,נייר ערך,ILS,1.95,2029-05-07,0.0356,0.06,החוב לא נחות,,חברת ציטוט,אי-תלות,2025-09-30,2025-09-30,785402.01,1.0,129.32,1015.68188,,,,0.042645,0.000359
671,7234.0,"מכלול מימון נדל""ן בע""מ",515759777,ח.פ.,מכלול נדלן אגח 1 1.00% פריים 30.11.26,IL0012071416,ISIN,לא צמוד למדד המחירים לצרכן,ישראל,ישראל,לא סחיר,אשראי חוץ בנקאי,לא,2024-06-03,NR,NR,NR,ILS,1.12,2026-11-30,0.0633,0.0816,החוב לא נחות,,חברת ציטוט,אי-תלות,2025-09-30,2025-09-30,168444.25,1.0,103.36,181.47839,,,,0.007619,6.3e-05
671,7234.0,"בנק הפועלים בע""מ",520000118,ח.פ.,"פועלים אגח 2 2.25% ב""י 07.11.28",IL0012275454,ISIN,לא צמוד למדד המחירים לצרכן,ישראל,ישראל,לא סחיר,בנקים,לא,2025-08-27,NR,NR,NR,ILS,2.83,2028-11-07,0.0711,0.0675,החוב לא נחות,,חברת ציטוט,אי-תלות,2025-09-30,2025-09-30,754308.27,1.0,99.52,750.68759,,,,0.03152,0.000266
671,7234.0,"גב-ים נגב בע""מ",514189596,ח.פ.,גב ים אגח ב 3.84% צמוד 31.12.28,IL0012084534,ISIN,"צמוד למט""ח",ישראל,ישראל,לא סחיר,"נדל""ן מניב בישראל",לא,2024-07-11,ilA+,S&P מעלות,נייר ערך,ILS,2.89,2028-12-31,0.0422,0.0384,החוב לא נחות,,חברת ציטוט,אי-תלות,2025-09-30,2025-09-30,553159.4,1.0,106.65,589.9445,,,,0.02477,0.000209
671,7234.0,"מימון ישיר נדל""ן ומשכנתאות הנפקות (סדרה 2) בע""מ",517112074,ח.פ.,"מימון ישיר נדלן אגח (סדרה 2) 3.3%+ ב""י 20.06.54",IL0012257965,ISIN,צמוד למדד המחירים לצרכן,ישראל,ישראל,לא סחיר,אשראי חוץ בנקאי,לא,2025-07-29,Aa1.il,מידרוג Moodys,נייר ערך,ILS,7.4,2054-06-20,0.0739,0.078,החוב לא נחות,,אחר,אי-תלות,2025-09-30,2025-09-30,214312.9,1.0,100.1,214.52721,,,,0.009007,7.6e-05
671,7234.0,"גמול חברה להשקעות בע""מ",520018136,ח.פ.,"גמול אג""ח ב- הסדר",IL0011167553,ISIN,צמוד למדד המחירים לצרכן,ישראל,ישראל,לא סחיר,"נדל""ן מניב בישראל",לא,2009-07-01,NR,NR,NR,ILS,0.01,2021-09-30,0.0001,0.045,החוב לא נחות,,אחר,אי-תלות,2025-09-30,2025-09-30,282.06,1.0,39.0,0.11,,,,4e-06,0.0
671,7234.0,"בנק לאומי לישראל בע""מ",520018078,ח.פ.,בנק לאומי סדרה 3 3.69% צמוד 24.05.35,IL0012150293,ISIN,צמוד למדד המחירים לצרכן,ישראל,ישראל,לא סחיר,בנקים,לא,2024-12-23,NR,NR,NR,ILS,3.73,2035-05-24,0.037,0.0369,החוב לא נחות,,חברת ציטוט,אי-תלות,2025-09-30,2025-09-30,1744173.93,1.0,103.39,1803.30143,,,,0.075717,0.000639
671,7234.0,"מימון ישיר נדלן ומשכנתאות הנפקות (סד 1) בע""מ",516100153,ח.פ.,מימון ישיר נדלן אגח 1 5.00% צמוד 20.02.54,IL0012152687,ISIN,"צמוד למט""ח",ישראל,ישראל,לא סחיר,אשראי חוץ בנקאי,לא,2024-12-26,Aa1.il,מידרוג Moodys,נייר ערך,ILS,10.61,2054-02-20,0.0456,0.05,החוב לא נחות,,חברת ציטוט,אי-תלות,2025-09-30,2025-09-30,275883.66,1.0,106.71,294.39545,,,,0.012361,0.000104
671,7234.0,"קרדיטו הנפקות בע""מ",516804499,ח.פ.,קרדיטו אגח ב 10% שקלי 15.03.51,IL0012162744,ISIN,צמוד למדד המחירים לצרכן,ישראל,ישראל,לא סחיר,אשראי חוץ בנקאי,לא,2025-01-12,NR,NR,NR,ILS,9.22,2051-03-13,0.105,0.1,החוב לא נחות,,אחר,אי-תלות,2025-09-30,2025-09-30,289151.5,1.0,93.57,270.55906,,,,0.01136,9.5e-05
671,7234.0,"בנק לאומי לישראל בע""מ",520018078,ח.פ.,"בנק לאומי סדרה 4 2.2% ב""י 24.6.29",IL0012219288,ISIN,לא צמוד למדד המחירים לצרכן,ישראל,ישראל,לא סחיר,בנקים,לא,2025-05-22,NR,NR,NR,ILS,3.32,2029-06-24,0.0642,0.112,החוב לא נחות,,חברת ציטוט,אי-תלות,2025-09-30,2025-09-30,870060.8,1.0,99.38,864.66643,,,,0.036305,0.000306
671,7234.0,"בנק לאומי לישראל בע""מ",520018078,ח.פ.,"בנק לאומי סדרה 2 2.30% ב""י 24.08.30",IL0012058975,ISIN,לא צמוד למדד המחירים לצרכן,ישראל,ישראל,לא סחיר,בנקים,לא,2024-04-17,NR,NR,NR,ILS,4.17,2030-08-24,0.0705,0.113,החוב לא נחות,,חברת ציטוט,אי-תלות,2025-09-30,2025-09-30,681731.57,1.0,101.46,691.68485,,,,0.029042,0.000245
671,7234.0,נתיבי הגז הטבעי לישראל,513436394,ח.פ.,נתיבי גז אגח א 5.60% צמוד 29.12.26,IL0011030843,ISIN,"צמוד למט""ח",ישראל,ישראל,לא סחיר,תשתיות,לא,2007-01-02,Aaa.il,מידרוג Moodys,נייר ערך,ILS,0.57,2026-12-29,0.0991,0.056,החוב לא נחות,,חברת ציטוט,אי-תלות,2025-09-30,2025-09-30,402468.26,1.0,147.67,594.3249,,,,0.024953,0.00021
671,7234.0,נתיבי הגז הטבעי לישראל,513436394,ח.פ.,נתיבי גז אגח ג 4.80% צמוד 31.12.31,IL0011255093,ISIN,"צמוד למט""ח",ישראל,ישראל,לא סחיר,תשתיות,לא,2012-01-02,Aaa.il,מידרוג Moodys,נייר ערך,ILS,3.03,2031-12-31,0.0312,0.048,החוב לא נחות,,חברת ציטוט,אי-תלות,2025-09-30,2025-09-30,444833.67,1.0,131.46,584.77835,,,,0.024552,0.000206
671,7234.0,"אלון חברת הדלק לישראל בע""מ",520041690,ח.פ.,אלון חברת הדלק 06.17,11015672,פנימי,צמוד למדד המחירים לצרכן,ישראל,ישראל,לא סחיר,השקעה ואחזקות,לא,2017-07-23,NR,NR,NR,ILS,0.0,2023-12-31,0.0,0.056,החוב לא נחות,,אחר,אי-תלות,2025-09-30,2025-09-30,91626.81,1.0,136.44,125.01561,,,,0.005249,4.4e-05
671,7234.0,"עוגן- אג""ח חברתית 2 בע""מ (חל""צ)",516556545,ח.פ.,"עוגן אג""ח רגילה 2.35% פריים 15.7.27",1196849,פנימי,צמוד למדד המחירים לצרכן,ישראל,ישראל,לא סחיר,שירותים פיננסיים,לא,2023-06-15,NR,NR,NR,ILS,1.15,2027-06-15,0.0901,0.1435,החוב לא נחות,,אחר,אי-תלות,2025-09-30,2025-09-30,126746.0,1.0,101.23,128.30497,,,,0.005387,4.5e-05
671,7234.0,"פרופיט תעשיות בניה בע""מ",520040650,ח.פ.,פרופיט אגח ד' ד-הסדר חוב,54901233,פנימי,צמוד למדד המחירים לצרכן,ישראל,ישראל,לא סחיר,בנייה,לא,2016-10-19,NR,NR,NR,ILS,0.0,2025-12-31,0.0,0.04,החוב לא נחות,,אחר,אי-תלות,2025-09-30,2025-09-30,45492.78,1.0,119.91,54.55039,,,,0.00229,1.9e-05
671,7234.0,"בנק לאומי לישראל בע""מ",520018078,ח.פ.,"בנק לאומי סדרה 1 2.3% ב""י 24.12.26",1198639,פנימי,לא צמוד למדד המחירים לצרכן,ישראל,ישראל,לא סחיר,בנקים,לא,2023-08-07,NR,NR,NR,ILS,1.18,2026-12-24,0.0715,0.113,החוב לא נחות,,חברת ציטוט,אי-תלות,2025-09-30,2025-09-30,171243.06,1.0,100.51,172.1164,,,,0.007226,6.1e-05
671,7234.0,"אלון חברת הדלק לישראל בע""מ",520041690,ח.פ.,חוב מסופק -אלון דלק סד' 1,45411567,פנימי,צמוד למדד המחירים לצרכן,ישראל,ישראל,לא סחיר,השקעה ואחזקות,לא,2015-12-31,NR,NR,NR,ILS,0.01,2023-01-22,0.0001,0.0,החוב לא נחות,,אחר,אי-תלות,2025-09-30,2025-09-30,-114864.13,1.0,100.0,-114.86413,,,,-0.004822,-4e-05
671,7234.0,"עוגן- אג""ח חברתית 2 בע""מ (חל""צ)",516556545,ח.פ.,"עוגן אג""ח בכיר 0.5% פריים 15.03.26",1196831,פנימי,צמוד למדד המחירים לצרכן,ישראל,ישראל,לא סחיר,שירותים פיננסיים,לא,2023-06-15,Aa2.il,מידרוג Moodys,נייר ערך,ILS,0.32,2026-03-15,0.0777,0.125,החוב לא נחות,,אחר,אי-תלות,2025-09-30,2025-09-30,16503.49,1.0,100.62,16.60582,,,,0.000697,5e-06
671,7234.0,בנק ירושלים בע''מ,520025636,ח.פ.,בנק ירושלים COCO 5.13% צמוד 05.12.32,2004863,פנימי,צמוד למדד המחירים לצרכן,ישראל,ישראל,לא סחיר,בנקים,לא,2022-12-05,ilA-,S&P מעלות,נייר ערך,ILS,6.0943,2032-12-05,0.0443,0.0513,החוב לא נחות,,אחר,אי-תלות,2025-09-30,2025-09-30,422486.66,1.0,114.54,483.91622,,,,0.020318,0.000171
671,7234.0,"מימון ישיר נדל""ן ומשכנתאות בע""מ",516100153,ח.פ.,מ. ישיר משכנתאות א 4.45% צמוד 31.12.31,1208818,פנימי,"צמוד למט""ח",ישראל,ישראל,לא סחיר,אשראי חוץ בנקאי,לא,2024-07-14,A3.il,מידרוג Moodys,נייר ערך,ILS,2.96,2031-12-31,0.0443,0.0445,החוב לא נחות,,חברת ציטוט,אי-תלות,2025-09-30,2025-09-30,282865.6,1.0,105.78,299.21523,,,,0.012563,0.000106
671,7234.0,"בנק הפועלים בע""מ",520000118,ח.פ.,"פועלים אגח 1 2.25% ב""י 30.09.27",1211747,פנימי,לא צמוד למדד המחירים לצרכן,ישראל,ישראל,לא סחיר,בנקים,לא,2024-09-25,NR,NR,NR,ILS,1.9,2027-09-30,0.0689,0.1125,החוב לא נחות,,חברת ציטוט,אי-תלות,2025-09-30,2025-09-30,972726.9,1.0,101.09,983.32962,,,,0.041288,0.000348
671,7234.0,תמר אריאל קפיטל,516612256,ח.פ.,"COCO תמר אריאל קפיטל 3.06% ב""י 31.05.32",2004862,פנימי,לא צמוד למדד המחירים לצרכן,ישראל,ישראל,לא סחיר,אשראי חוץ בנקאי,לא,2022-05-25,NR,NR,NR,ILS,5.3932,2032-05-31,0.0651,0.0756,החוב לא נחות,,חברת ציטוט,אי-תלות,2025-09-30,2025-09-30,49392.87,1.0,108.11,53.39863,,,,0.002242,1.8e-05
671,7234.0,"מכלול מימון נדל""ן בע""מ",515759777,ח.פ.,מכלול נדלן אגח 2 1% פריים 01.01.28,1215193,פנימי,לא צמוד למדד המחירים לצרכן,ישראל,ישראל,לא סחיר,אשראי חוץ בנקאי,לא,2024-12-25,NR,NR,NR,ILS,2.1,2028-01-01,0.0641,0.07,החוב לא נחות,,חברת ציטוט,אי-תלות,2025-09-30,2025-09-30,607828.63,1.0,101.45,622.52915,,,,0.026138,0.00022
671,7234.0,מקורות,520010869,ח.פ.,מקורות אגח 6 4.90% צמוד 25.12.36,11009081,פנימי,"צמוד למט""ח",ישראל,ישראל,לא סחיר,תשתיות,לא,2010-12-25,ilAAA,S&P מעלות,נייר ערך,ILS,4.9814,2036-12-25,0.0273,0.049,החוב לא נחות,,חברת ציטוט,אי-תלות,2025-09-30,2025-09-30,178734.31,1.0,164.64,294.26816,,,,0.012354,0.000104
671,7234.0,מירלנד דיוולופמנט קורפריישן פי אל סי,1502,פנימי,מירלנד שטר הון 1.00% 01.01.2027,1182963,פנימי,צמוד למדד המחירים לצרכן,ישראל,רוסיה,לא סחיר,בנייה,לא,2021-11-26,NR,NR,NR,ILS,0.0,2027-01-01,0.0,0.01,החוב לא נחות,,אחר,אי-תלות,2025-09-30,2025-09-30,109978.44,1.0,0.0,0.0,,,,0.0,0.0
671,7234.0,"איילון חברת לביטוח בע""מ",520030677,ח.פ.,איילון אגח ג 7.75% שקלי 31.12.27,11955771,פנימי,צמוד למדד המחירים לצרכן,ישראל,ישראל,לא סחיר,ביטוח,לא,2022-11-22,A3.il,מידרוג Moodys,נייר ערך,ILS,2.0754,2027-12-31,0.0638,0.0775,החוב לא נחות,,אחר,אי-תלות,2025-09-30,2025-09-30,196723.48,1.0,104.94,206.44162,,,,0.008668,7.3e-05
671,7234.0,כלל תעשיות,520021874,ח.פ.,כלל תעשיות אגח טז 4.47% שקלי 30.06.27,6080238,פנימי,צמוד למדד המחירים לצרכן,ישראל,ישראל,לא סחיר,השקעה ואחזקות,לא,2019-12-29,A2.il,מידרוג Moodys,נייר ערך,ILS,1.45,2027-06-30,0.0535,0.0447,החוב לא נחות,,אחר,אי-תלות,2025-09-30,2025-09-30,208105.09,1.0,100.02,208.14671,,,,0.008739,7.3e-05
671,7234.0,"נתיבים אג""ח בע""מ",513502229,ח.פ.,נתיבים אגח א 7.97% דולרי 04.07.27,10902810,פנימי,"צמוד למט""ח",ישראל,ישראל,לא סחיר,השקעה ואחזקות,כן,2004-03-28,Aa1.il,מידרוג Moodys,נייר ערך,USD,0.9755,2027-07-04,0.045,0.0797,החוב לא נחות,,חברת ציטוט,אי-תלות,2025-09-30,2025-09-30,48510.13,3.306,105.33,168.92245,,,,0.007092,5.9e-05
671,7234.0,י.ח.ק להשקעות- שותפות מוגבלת,550016091,ח.פ.,י.ח.ק השקעות אגח ב 2.86% שקלי 31.12.28,1181783,פנימי,צמוד למדד המחירים לצרכן,ישראל,ישראל,לא סחיר,השקעה ואחזקות,לא,2021-11-14,ilA+,S&P מעלות,נייר ערך,ILS,1.63,2028-12-31,0.068,0.0286,החוב לא נחות,,אחר,אי-תלות,2025-09-30,2025-09-30,46707.86,1.0,98.48,45.9979,,,,0.001931,1.6e-05
671,7234.0,"אגרקסקו חברה ליצוא חקלאי בע""מ",510155625,ח.פ.,אגרקסקו אגח א חש4/12,1126770,פנימי,צמוד למדד המחירים לצרכן,ישראל,ישראל,לא סחיר,מסחר,לא,2007-12-27,NR,NR,NR,ILS,0.0,2017-04-30,0.0,0.0615,החוב לא נחות,,אחר,אי-תלות,2025-09-30,2025-09-30,497.04,1.0,0.0001,0.0,,,,0.0,0.0
671,7234.0,"אגרקסקו חברה ליצוא חקלאי בע""מ",510155625,ח.פ.,אגרקסקו אגח א,1109180,פנימי,צמוד למדד המחירים לצרכן,ישראל,ישראל,לא סחיר,מסחר,לא,2011-04-30,NR,NR,NR,ILS,0.0,2017-04-30,0.0,0.099,החוב לא נחות,,אחר,אי-תלות,2025-09-30,2025-09-30,100000.0,1.0,1e-05,1e-05,,,,0.0,0.0
671,7234.0,מקורות,520010869,ח.פ.,מקורות אגח 6 4.90% צמוד 25.12.36,1100908,פנימי,צמוד למדד המחירים לצרכן,ישראל,ישראל,לא סחיר,תשתיות,לא,2006-12-25,AA,פנימי,נייר ערך,ILS,4.96,2036-12-25,0.0283,0.049,החוב לא נחות,,חברת ציטוט,אי-תלות,2025-09-30,2025-09-30,1844392.8,1.0,164.64,3036.60831,,,,0.127501,0.001076
671,7234.0,"גדות מסופים לכימיקלים (1985) בע""מ",520040775,ח.פ.,גדות אגח א 4.30% שקלי 30.06.26,11623202,פנימי,צמוד למדד המחירים לצרכן,ישראל,ישראל,לא סחיר,מסחר,לא,2020-05-10,A3.il,מידרוג Moodys,נייר ערך,ILS,0.6561,2026-06-30,0.0539,0.043,החוב לא נחות,,אחר,אי-תלות,2025-09-30,2025-09-30,190864.56,1.0,100.43,191.68528,,,,0.008048,6.7e-05
671,7234.0,"פרופיט תעשיות בניה בע""מ",520040650,ח.פ.,הפרשי שווי-פרופיט אגח ד' - הסדר חוב,54901234,פנימי,צמוד למדד המחירים לצרכן,ישראל,ישראל,לא סחיר,בנייה,לא,2016-10-19,NR,NR,NR,ILS,0.01,2025-12-31,0.0001,1e-05,החוב לא נחות,,אחר,אי-תלות,2025-09-30,2025-09-30,-49600.73,1.0,100.0,-49.60073,,,,-0.002082,-1.7e-05
671,7234.0,"מת""ם - מרכז תעשיות מדע חיפה בע""מ",510687403,ח.פ.,"מת""ם  אגח א 3.10% שקלי 30.06.27",11389991,פנימי,צמוד למדד המחירים לצרכן,ישראל,ישראל,לא סחיר,"נדל""ן מניב בישראל",לא,2016-08-16,Aa2.il,מידרוג Moodys,נייר ערך,ILS,1.2213,2027-06-30,0.0466,0.031,החוב לא נחות,,אחר,אי-תלות,2025-09-30,2025-09-30,197280.62,1.0,98.25,193.82821,,,,0.008138,6.8e-05
671,7234.0,DEAN FOODS CO,5RGFDMYH829UYJH0KY29,LEI,DF 6.5 03/15/23,US242370AD62,ISIN,צמוד למדד המחירים לצרכן,"חו""ל","ארה""ב",לא סחיר,Food Products,לא,2015-02-20,D,S&P,נייר ערך,USD,0.0,2023-03-15,0.0,0.065,החוב לא נחות,,אחר,אי-תלות,2025-09-30,2025-09-30,4882.12,3.306,0.0883,0.01425,,,,0.0,0.0
671,7234.0,Endo International PLC,549300KK5WR4MGN4YT97,LEI,ENDO 7.5% 04/27,72961956,פנימי,צמוד למדד המחירים לצרכן,"חו""ל","ארה""ב",לא סחיר,Health Care Equipment & Supplies,לא,2019-03-14,D,S&P,נייר ערך,USD,100.0,2027-04-01,2.0,0.075,החוב לא נחות,,אחר,אי-תלות,2025-09-30,2025-09-30,986.86,3.306,1e-06,0.0,,,,0.0,0.0
671,7235.0,"בנק הפועלים בע""מ",520000118,ח.פ.,"פועלים אגח 2 2.25% ב""י 07.11.28",IL0012275454,ISIN,לא צמוד למדד המחירים לצרכן,ישראל,ישראל,לא סחיר,בנקים,לא,2025-08-27,NR,NR,NR,ILS,2.83,2028-11-07,0.0711,0.0675,החוב לא נחות,,חברת ציטוט,אי-תלות,2025-09-30,2025-09-30,222589.22,1.0,99.52,221.52079,,,,0.029878,0.000352
671,7235.0,"מימון ישיר נדל""ן ומשכנתאות הנפקות (סדרה 2) בע""מ",517112074,ח.פ.,"מימון ישיר נדלן אגח (סדרה 2) 3.3%+ ב""י 20.06.54",IL0012257965,ISIN,צמוד למדד המחירים לצרכן,ישראל,ישראל,לא סחיר,אשראי חוץ בנקאי,לא,2025-07-29,Aa1.il,מידרוג Moodys,נייר ערך,ILS,7.4,2054-06-20,0.0739,0.078,החוב לא נחות,,אחר,אי-תלות,2025-09-30,2025-09-30,63241.7,1.0,100.1,63.30495,,,,0.008538,0.0001
671,7235.0,חברת החשמל,520000472,ח.פ.,חברת חשמל 6.00% צמוד 07.05.29,IL0060001869,ISIN,"צמוד למט""ח",ישראל,ישראל,לא סחיר,אנרגיה,לא,2014-05-07,Aaa.il,מידרוג Moodys,נייר ערך,ILS,1.95,2029-05-07,0.0356,0.06,החוב לא נחות,,חברת ציטוט,אי-תלות,2025-09-30,2025-09-30,166388.95,1.0,129.32,215.17419,,,,0.029021,0.000341
671,7235.0,"מימון ישיר נדל""ן ומשכנתאות הנפקות (סדרה 2) בע""מ",517112074,ח.פ.,מימון ישיר נדלן אגח (סדרה 2) 5.25% צמוד 20.06.54,IL0012257882,ISIN,"צמוד למט""ח",ישראל,ישראל,לא סחיר,אשראי חוץ בנקאי,לא,2025-07-29,Aa1.il,מידרוג Moodys,נייר ערך,ILS,10.31,2054-06-20,0.0489,0.0525,החוב לא נחות,,חברת ציטוט,אי-תלות,2025-09-30,2025-09-30,116419.1,1.0,103.96,121.0293,,,,0.016324,0.000192
671,7235.0,"גב-ים נגב בע""מ",514189596,ח.פ.,גב ים אגח ב 3.84% צמוד 31.12.28,IL0012084534,ISIN,"צמוד למט""ח",ישראל,ישראל,לא סחיר,"נדל""ן מניב בישראל",לא,2024-07-11,ilA+,S&P מעלות,נייר ערך,ILS,2.89,2028-12-31,0.0422,0.0384,החוב לא נחות,,חברת ציטוט,אי-תלות,2025-09-30,2025-09-30,163232.1,1.0,106.65,174.08703,,,,0.02348,0.000276
671,7235.0,"קרדיטו הנפקות בע""מ",516804499,ח.פ.,קרדיטו אגח ב 10% שקלי 15.03.51,IL0012162744,ISIN,צמוד למדד המחירים לצרכן,ישראל,ישראל,לא סחיר,אשראי חוץ בנקאי,לא,2025-01-12,NR,NR,NR,ILS,9.22,2051-03-13,0.105,0.1,החוב לא נחות,,אחר,אי-תלות,2025-09-30,2025-09-30,85325.87,1.0,93.57,79.83941,,,,0.010768,0.000126
671,7235.0,מקורות,520010869,ח.פ.,מקורות אגח 8 4.10% צמוד 14.07.48,IL0011243461,ISIN,"צמוד למט""ח",ישראל,ישראל,לא סחיר,תשתיות,לא,2011-07-14,ilAAA,S&P מעלות,נייר ערך,ILS,9.36,2048-07-14,0.0298,0.041,החוב לא נחות,,חברת ציטוט,אי-תלות,2025-09-30,2025-09-30,1929824.41,1.0,139.55,2693.06997,,,,0.363236,0.004278
671,7235.0,"גמול חברה להשקעות בע""מ",520018136,ח.פ.,"גמול אג""ח ב- הסדר",IL0011167553,ISIN,צמוד למדד המחירים לצרכן,ישראל,ישראל,לא סחיר,"נדל""ן מניב בישראל",לא,2009-07-01,NR,NR,NR,ILS,0.01,2021-09-30,0.0001,0.045,החוב לא נחות,,אחר,אי-תלות,2025-09-30,2025-09-30,17.12,1.0,39.0,0.00667,,,,0.0,0.0
671,7235.0,נתיבי הגז הטבעי לישראל,513436394,ח.פ.,נתיבי גז אגח ג 4.80% צמוד 31.12.31,IL0011255093,ISIN,"צמוד למט""ח",ישראל,ישראל,לא סחיר,תשתיות,לא,2012-01-02,Aaa.il,מידרוג Moodys,נייר ערך,ILS,3.03,2031-12-31,0.0312,0.048,החוב לא נחות,,חברת ציטוט,אי-תלות,2025-09-30,2025-09-30,123727.46,1.0,131.46,162.65212,,,,0.021937,0.000257
671,7235.0,"ביטוח ישיר - השקעות פיננסיות בע""מ",520044439,ח.פ.,ביטוח ישיר אגח יא 4.60% שקלי 30.06.28,IL0011388258,ISIN,צמוד למדד המחירים לצרכן,ישראל,ישראל,לא סחיר,השקעה ואחזקות,לא,2016-07-19,A2.il,מידרוג Moodys,נייר ערך,ILS,1.99,2028-06-30,0.0599,0.046,החוב לא נחות,,אחר,אי-תלות,2025-09-30,2025-09-30,32698.89,1.0,99.93,32.676,,,,0.004407,5.1e-05
671,7235.0,"בנק לאומי לישראל בע""מ",520018078,ח.פ.,"בנק לאומי סדרה 4 2.2% ב""י 24.6.29",IL0012219288,ISIN,לא צמוד למדד המחירים לצרכן,ישראל,ישראל,לא סחיר,בנקים,לא,2025-05-22,NR,NR,NR,ILS,3.32,2029-06-24,0.0642,0.112,החוב לא נחות,,חברת ציטוט,אי-תלות,2025-09-30,2025-09-30,256746.7,1.0,99.38,255.15487,,,,0.034414,0.000405
671,7235.0,"רפאל מערכות לחימה מתקדמות בע""מ",520042185,ח.פ.,רפאל אגח ד 3.74% שקלי 15.09.34,IL0011402844,ISIN,צמוד למדד המחירים לצרכן,ישראל,ישראל,לא סחיר,ביטחוניות,לא,2017-03-01,AA+,פנימי,נייר ערך,ILS,4.4,2034-09-15,0.0478,0.0374,החוב לא נחות,,אחר,אי-תלות,2025-09-30,2025-09-30,52186.11,1.0,96.46,50.33872,,,,0.006789,7.9e-05
671,7235.0,"בנק לאומי לישראל בע""מ",520018078,ח.פ.,"בנק לאומי סדרה 2 2.30% ב""י 24.08.30",IL0012058975,ISIN,לא צמוד למדד המחירים לצרכן,ישראל,ישראל,לא סחיר,בנקים,לא,2024-04-17,NR,NR,NR,ILS,4.17,2030-08-24,0.0705,0.113,החוב לא נחות,,חברת ציטוט,אי-תלות,2025-09-30,2025-09-30,201172.53,1.0,101.46,204.10965,,,,0.02753,0.000324
671,7235.0,"מכלול מימון נדל""ן בע""מ",515759777,ח.פ.,מכלול נדלן אגח 1 1.00% פריים 30.11.26,IL0012071416,ISIN,לא צמוד למדד המחירים לצרכן,ישראל,ישראל,לא סחיר,אשראי חוץ בנקאי,לא,2024-06-03,NR,NR,NR,ILS,1.12,2026-11-30,0.0633,0.0816,החוב לא נחות,,חברת ציטוט,אי-תלות,2025-09-30,2025-09-30,49706.3,1.0,103.36,53.55255,,,,0.007222,8.4e-05
671,7235.0,"בנק לאומי לישראל בע""מ",520018078,ח.פ.,בנק לאומי סדרה 3 3.69% צמוד 24.05.35,IL0012150293,ISIN,צמוד למדד המחירים לצרכן,ישראל,ישראל,לא סחיר,בנקים,לא,2024-12-23,NR,NR,NR,ILS,3.73,2035-05-24,0.037,0.0369,החוב לא נחות,,חברת ציטוט,אי-תלות,2025-09-30,2025-09-30,514689.2,1.0,103.39,532.13716,,,,0.071774,0.000845
671,7235.0,"מימון ישיר נדלן ומשכנתאות הנפקות (סד 1) בע""מ",516100153,ח.פ.,מימון ישיר נדלן אגח 1 5.00% צמוד 20.02.54,IL0012152687,ISIN,"צמוד למט""ח",ישראל,ישראל,לא סחיר,אשראי חוץ בנקאי,לא,2024-12-26,Aa1.il,מידרוג Moodys,נייר ערך,ILS,10.61,2054-02-20,0.0456,0.05,החוב לא נחות,,חברת ציטוט,אי-תלות,2025-09-30,2025-09-30,81410.65,1.0,106.71,86.87331,,,,0.011717,0.000138
671,7235.0,אורמת טכנולוגיות אינק,520036716,ח.פ.,אורמת סדרה 4 3.35% שקלי 15.06.31,IL0011672123,ISIN,צמוד למדד המחירים לצרכן,ישראל,ישראל,לא סחיר,אנרגיה מתחדשת,לא,2020-07-01,ilAA-,S&P מעלות,נייר ערך,ILS,2.9457,2031-06-15,0.0518,0.0335,החוב לא נחות,,אחר,אי-תלות,2025-09-30,2025-09-30,56128.08,1.0,95.91,53.83244,,,,0.00726,8.5e-05
671,7235.0,נתיבי הגז הטבעי לישראל,513436394,ח.פ.,נתיבי גז אגח א 5.60% צמוד 29.12.26,IL0011030843,ISIN,"צמוד למט""ח",ישראל,ישראל,לא סחיר,תשתיות,לא,2007-01-02,Aaa.il,מידרוג Moodys,נייר ערך,ILS,0.57,2026-12-29,0.0991,0.056,החוב לא נחות,,חברת ציטוט,אי-תלות,2025-09-30,2025-09-30,120499.79,1.0,147.67,177.94204,,,,0.023999,0.000281
671,7235.0,"מימון ישיר מקבוצת ישיר(2006) בע""מ",513893123,ח.פ.,מימון ישיר אגח 16 4.25% צמוד 12.05.28,IL0011983405,ISIN,"צמוד למט""ח",ישראל,ישראל,לא סחיר,אשראי חוץ בנקאי,לא,2023-07-31,Aa2.il,מידרוג Moodys,נייר ערך,ILS,1.81,2028-05-12,0.0605,0.0425,החוב לא נחות,,חברת ציטוט,אי-תלות,2025-09-30,2025-09-30,54411.34,1.0,108.68,59.13424,,,,0.007975,9.3e-05
671,7235.0,מקורות,520010869,ח.פ.,מקורות אגח 6 4.90% צמוד 25.12.36,1100908,פנימי,צמוד למדד המחירים לצרכן,ישראל,ישראל,לא סחיר,תשתיות,לא,2006-12-25,AA,פנימי,נייר ערך,ILS,4.96,2036-12-25,0.0283,0.049,החוב לא נחות,,חברת ציטוט,אי-תלות,2025-09-30,2025-09-30,677392.9,1.0,164.64,1115.25967,,,,0.150424,0.001772
671,7235.0,כלל תעשיות,520021874,ח.פ.,כלל תעשיות אגח טז 4.47% שקלי 30.06.27,6080238,פנימי,צמוד למדד המחירים לצרכן,ישראל,ישראל,לא סחיר,השקעה ואחזקות,לא,2019-12-29,A2.il,מידרוג Moodys,נייר ערך,ILS,1.45,2027-06-30,0.0535,0.0447,החוב לא נחות,,אחר,אי-תלות,2025-09-30,2025-09-30,36391.75,1.0,100.02,36.39902,,,,0.004909,5.7e-05
671,7235.0,"פרופיט תעשיות בניה בע""מ",520040650,ח.פ.,הפרשי שווי-פרופיט אגח ד' - הסדר חוב,54901234,פנימי,צמוד למדד המחירים לצרכן,ישראל,ישראל,לא סחיר,בנייה,לא,2016-10-19,NR,NR,NR,ILS,0.01,2025-12-31,0.0001,1e-05,החוב לא נחות,,אחר,אי-תלות,2025-09-30,2025-09-30,-873.3,1.0,100.0,-0.8733,,,,-0.000117,-1e-06
671,7235.0,"פרופיט תעשיות בניה בע""מ",520040650,ח.פ.,פרופיט אגח ד' ד-הסדר חוב,54901233,פנימי,צמוד למדד המחירים לצרכן,ישראל,ישראל,לא סחיר,בנייה,לא,2016-10-19,NR,NR,NR,ILS,0.0,2025-12-31,0.0,0.04,החוב לא נחות,,אחר,אי-תלות,2025-09-30,2025-09-30,604.15,1.0,180.769492,1.09211,,,,0.000147,1e-06
671,7235.0,בנק ירושלים בע''מ,520025636,ח.פ.,בנק ירושלים COCO 5.13% צמוד 05.12.32,2004863,פנימי,צמוד למדד המחירים לצרכן,ישראל,ישראל,לא סחיר,בנקים,לא,2022-12-05,ilA-,S&P מעלות,נייר ערך,ILS,6.0943,2032-12-05,0.0443,0.0513,החוב לא נחות,,אחר,אי-תלות,2025-09-30,2025-09-30,73881.07,1.0,114.54,84.62338,,,,0.011413,0.000134
671,7235.0,"מכלול מימון נדל""ן בע""מ",515759777,ח.פ.,מכלול נדלן אגח 2 1% פריים 01.01.28,1215193,פנימי,לא צמוד למדד המחירים לצרכן,ישראל,ישראל,לא סחיר,אשראי חוץ בנקאי,לא,2024-12-25,NR,NR,NR,ILS,2.1,2028-01-01,0.0641,0.07,החוב לא נחות,,חברת ציטוט,אי-תלות,2025-09-30,2025-09-30,179364.47,1.0,101.45,183.70245,,,,0.024777,0.000291
671,7235.0,"בנק הפועלים בע""מ",520000118,ח.פ.,"פועלים אגח 1 2.25% ב""י 30.09.27",1211747,פנימי,לא צמוד למדד המחירים לצרכן,ישראל,ישראל,לא סחיר,בנקים,לא,2024-09-25,NR,NR,NR,ILS,1.9,2027-09-30,0.0689,0.1125,החוב לא נחות,,חברת ציטוט,אי-תלות,2025-09-30,2025-09-30,287042.49,1.0,101.09,290.17125,,,,0.039137,0.000461
671,7235.0,"בנק לאומי לישראל בע""מ",520018078,ח.פ.,"בנק לאומי סדרה 1 2.3% ב""י 24.12.26",1198639,פנימי,לא צמוד למדד המחירים לצרכן,ישראל,ישראל,לא סחיר,בנקים,לא,2023-08-07,NR,NR,NR,ILS,1.18,2026-12-24,0.0715,0.113,החוב לא נחות,,חברת ציטוט,אי-תלות,2025-09-30,2025-09-30,50532.2,1.0,100.51,50.78992,,,,0.00685,8e-05
671,7235.0,"עוגן- אג""ח חברתית 2 בע""מ (חל""צ)",516556545,ח.פ.,"עוגן אג""ח רגילה 2.35% פריים 15.7.27",1196849,פנימי,צמוד למדד המחירים לצרכן,ישראל,ישראל,לא סחיר,שירותים פיננסיים,לא,2023-06-15,NR,NR,NR,ILS,1.15,2027-06-15,0.0901,0.1435,החוב לא נחות,,אחר,אי-תלות,2025-09-30,2025-09-30,22164.32,1.0,101.23,22.43694,,,,0.003026,3.5e-05
671,7235.0,"עוגן- אג""ח חברתית 2 בע""מ (חל""צ)",516556545,ח.פ.,"עוגן אג""ח בכיר 0.5% פריים 15.03.26",1196831,פנימי,צמוד למדד המחירים לצרכן,ישראל,ישראל,לא סחיר,שירותים פיננסיים,לא,2023-06-15,Aa2.il,מידרוג Moodys,נייר ערך,ILS,0.32,2026-03-15,0.0777,0.125,החוב לא נחות,,אחר,אי-תלות,2025-09-30,2025-09-30,2886.0,1.0,100.62,2.90389,,,,0.000391,4e-06
671,7235.0,"איילון חברת לביטוח בע""מ",520030677,ח.פ.,איילון אגח ג 7.75% שקלי 31.12.27,11955771,פנימי,צמוד למדד המחירים לצרכן,ישראל,ישראל,לא סחיר,ביטוח,לא,2022-11-22,A3.il,מידרוג Moodys,נייר ערך,ILS,2.0754,2027-12-31,0.0638,0.0775,החוב לא נחות,,אחר,אי-תלות,2025-09-30,2025-09-30,58051.24,1.0,104.94,60.91897,,,,0.008216,9.6e-05
671,7235.0,"מימון ישיר נדל""ן ומשכנתאות בע""מ",516100153,ח.פ.,מ. ישיר משכנתאות א 4.45% צמוד 31.12.31,1208818,פנימי,"צמוד למט""ח",ישראל,ישראל,לא סחיר,אשראי חוץ בנקאי,לא,2024-07-14,A3.il,מידרוג Moodys,נייר ערך,ILS,2.96,2031-12-31,0.0443,0.0445,החוב לא נחות,,חברת ציטוט,אי-תלות,2025-09-30,2025-09-30,83470.96,1.0,105.78,88.29558,,,,0.011909,0.00014
671,7235.0,י.ח.ק להשקעות- שותפות מוגבלת,550016091,ח.פ.,י.ח.ק השקעות אגח ב 2.86% שקלי 31.12.28,1181783,פנימי,צמוד למדד המחירים לצרכן,ישראל,ישראל,לא סחיר,השקעה ואחזקות,לא,2021-11-14,ilA+,S&P מעלות,נייר ערך,ILS,1.63,2028-12-31,0.068,0.0286,החוב לא נחות,,אחר,אי-תלות,2025-09-30,2025-09-30,13783.05,1.0,98.48,13.57354,,,,0.00183,2.1e-05
671,7235.0,"אגרקסקו חברה ליצוא חקלאי בע""מ",510155625,ח.פ.,אגרקסקו אגח א חש4/12,1126770,פנימי,צמוד למדד המחירים לצרכן,ישראל,ישראל,לא סחיר,מסחר,לא,2007-12-27,NR,NR,NR,ILS,0.0,2017-04-30,0.0,0.0615,החוב לא נחות,,אחר,אי-תלות,2025-09-30,2025-09-30,86.92,1.0,0.0001,0.0,,,,0.0,0.0
671,7235.0,"גדות מסופים לכימיקלים (1985) בע""מ",520040775,ח.פ.,גדות אגח א 4.30% שקלי 30.06.26,11623202,פנימי,צמוד למדד המחירים לצרכן,ישראל,ישראל,לא סחיר,מסחר,לא,2020-05-10,A3.il,מידרוג Moodys,נייר ערך,ILS,0.6561,2026-06-30,0.0539,0.043,החוב לא נחות,,אחר,אי-תלות,2025-09-30,2025-09-30,33376.86,1.0,100.43,33.52038,,,,0.004521,5.3e-05
671,7235.0,"מת""ם - מרכז תעשיות מדע חיפה בע""מ",510687403,ח.פ.,"מת""ם  אגח א 3.10% שקלי 30.06.27",11389991,פנימי,צמוד למדד המחירים לצרכן,ישראל,ישראל,לא סחיר,"נדל""ן מניב בישראל",לא,2016-08-16,Aa2.il,מידרוג Moodys,נייר ערך,ILS,1.2213,2027-06-30,0.0466,0.031,החוב לא נחות,,אחר,אי-תלות,2025-09-30,2025-09-30,58215.64,1.0,98.25,57.19687,,,,0.007714,9e-05
671,7235.0,מקורות,520010869,ח.פ.,מקורות אגח 6 4.90% צמוד 25.12.36,11009081,פנימי,"צמוד למט""ח",ישראל,ישראל,לא סחיר,תשתיות,לא,2010-12-25,ilAAA,S&P מעלות,נייר ערך,ILS,4.9814,2036-12-25,0.0273,0.049,החוב לא נחות,,חברת ציטוט,אי-תלות,2025-09-30,2025-09-30,65644.01,1.0,164.64,108.07631,,,,0.014577,0.000171
671,7235.0,"נתיבים אג""ח בע""מ",513502229,ח.פ.,נתיבים אגח א 7.97% דולרי 04.07.27,10902810,פנימי,"צמוד למט""ח",ישראל,ישראל,לא סחיר,השקעה ואחזקות,כן,2004-03-28,Aa1.il,מידרוג Moodys,נייר ערך,USD,0.9755,2027-07-04,0.045,0.0797,החוב לא נחות,,חברת ציטוט,אי-תלות,2025-09-30,2025-09-30,8483.06,3.306,105.33,29.5398,,,,0.003984,4.6e-05
671,7235.0,מירלנד דיוולופמנט קורפריישן פי אל סי,1502,פנימי,מירלנד שטר הון 1.00% 01.01.2027,1182963,פנימי,צמוד למדד המחירים לצרכן,ישראל,רוסיה,לא סחיר,בנייה,לא,2021-11-26,NR,NR,NR,ILS,0.0,2027-01-01,0.0,0.01,החוב לא נחות,,אחר,אי-תלות,2025-09-30,2025-09-30,32453.6,1.0,0.0,0.0,,,,0.0,0.0
671,7235.0,DEAN FOODS CO,5RGFDMYH829UYJH0KY29,LEI,DF 6.5 03/15/23,US242370AD62,ISIN,צמוד למדד המחירים לצרכן,"חו""ל","ארה""ב",לא סחיר,Food Products,לא,2015-02-20,D,S&P,נייר ערך,USD,0.0,2023-03-15,0.0,0.065,החוב לא נחות,,אחר,אי-תלות,2025-09-30,2025-09-30,1154.14,3.306,0.0883,0.00337,,,,0.0,0.0
671,7235.0,Endo International PLC,549300KK5WR4MGN4YT97,LEI,ENDO 7.5% 04/27,72961956,פנימי,צמוד למדד המחירים לצרכן,"חו""ל","ארה""ב",לא סחיר,Health Care Equipment & Supplies,לא,2019-03-14,D,S&P,נייר ערך,USD,100.0,2027-04-01,2.0,0.075,החוב לא נחות,,אחר,אי-תלות,2025-09-30,2025-09-30,233.29,3.306,1e-06,0.0,,,,0.0,0.0
671,7236.0,מקורות,520010869,ח.פ.,מקורות אגח 8 4.10% צמוד 14.07.48,IL0011243461,ISIN,"צמוד למט""ח",ישראל,ישראל,לא סחיר,תשתיות,לא,2011-07-14,ilAAA,S&P מעלות,נייר ערך,ILS,9.36,2048-07-14,0.0298,0.041,החוב לא נחות,,חברת ציטוט,אי-תלות,2025-09-30,2025-09-30,858425.6,1.0,139.55,1197.93292,,,,0.466725,0.005776
671,7236.0,"מכלול מימון נדל""ן בע""מ",515759777,ח.פ.,מכלול נדלן אגח 1 1.00% פריים 30.11.26,IL0012071416,ISIN,לא צמוד למדד המחירים לצרכן,ישראל,ישראל,לא סחיר,אשראי חוץ בנקאי,לא,2024-06-03,NR,NR,NR,ILS,1.12,2026-11-30,0.0633,0.0816,החוב לא נחות,,חברת ציטוט,אי-תלות,2025-09-30,2025-09-30,5532.39,1.0,103.36,5.96049,,,,0.002321,2.8e-05
671,7236.0,חברת החשמל,520000472,ח.פ.,חברת חשמל 6.00% צמוד 07.05.29,IL0060001869,ISIN,"צמוד למט""ח",ישראל,ישראל,לא סחיר,אנרגיה,לא,2014-05-07,Aaa.il,מידרוג Moodys,נייר ערך,ILS,1.95,2029-05-07,0.0356,0.06,החוב לא נחות,,חברת ציטוט,אי-תלות,2025-09-30,2025-09-30,109198.1,1.0,129.32,141.21498,,,,0.055018,0.00068
671,7236.0,"מימון ישיר מקבוצת ישיר(2006) בע""מ",513893123,ח.פ.,מימון ישיר אגח 16 4.25% צמוד 12.05.28,IL0011983405,ISIN,"צמוד למט""ח",ישראל,ישראל,לא סחיר,אשראי חוץ בנקאי,לא,2023-07-31,Aa2.il,מידרוג Moodys,נייר ערך,ILS,1.81,2028-05-12,0.0605,0.0425,החוב לא נחות,,חברת ציטוט,אי-תלות,2025-09-30,2025-09-30,6056.07,1.0,108.68,6.58174,,,,0.002564,3.1e-05
671,7236.0,"גב-ים נגב בע""מ",514189596,ח.פ.,גב ים אגח ב 3.84% צמוד 31.12.28,IL0012084534,ISIN,"צמוד למט""ח",ישראל,ישראל,לא סחיר,"נדל""ן מניב בישראל",לא,2024-07-11,ilA+,S&P מעלות,נייר ערך,ILS,2.89,2028-12-31,0.0422,0.0384,החוב לא נחות,,חברת ציטוט,אי-תלות,2025-09-30,2025-09-30,18167.99,1.0,106.65,19.37617,,,,0.007549,9.3e-05
671,7236.0,"בנק לאומי לישראל בע""מ",520018078,ח.פ.,"בנק לאומי סדרה 2 2.30% ב""י 24.08.30",IL0012058975,ISIN,לא צמוד למדד המחירים לצרכן,ישראל,ישראל,לא סחיר,בנקים,לא,2024-04-17,NR,NR,NR,ILS,4.17,2030-08-24,0.0705,0.113,החוב לא נחות,,חברת ציטוט,אי-תלות,2025-09-30,2025-09-30,22390.83,1.0,101.46,22.71773,,,,0.008851,0.000109
671,7236.0,נתיבי הגז הטבעי לישראל,513436394,ח.פ.,נתיבי גז אגח ג 4.80% צמוד 31.12.31,IL0011255093,ISIN,"צמוד למט""ח",ישראל,ישראל,לא סחיר,תשתיות,לא,2012-01-02,Aaa.il,מידרוג Moodys,נייר ערך,ILS,3.03,2031-12-31,0.0312,0.048,החוב לא נחות,,חברת ציטוט,אי-תלות,2025-09-30,2025-09-30,65778.43,1.0,131.46,86.47233,,,,0.033689,0.000416
671,7236.0,"בנק לאומי לישראל בע""מ",520018078,ח.פ.,בנק לאומי סדרה 3 3.69% צמוד 24.05.35,IL0012150293,ISIN,צמוד למדד המחירים לצרכן,ישראל,ישראל,לא סחיר,בנקים,לא,2024-12-23,NR,NR,NR,ILS,3.73,2035-05-24,0.037,0.0369,החוב לא נחות,,חברת ציטוט,אי-תלות,2025-09-30,2025-09-30,57285.74,1.0,103.39,59.22772,,,,0.023075,0.000285
671,7236.0,אורמת טכנולוגיות אינק,520036716,ח.פ.,אורמת סדרה 4 3.35% שקלי 15.06.31,IL0011672123,ISIN,צמוד למדד המחירים לצרכן,ישראל,ישראל,לא סחיר,אנרגיה מתחדשת,לא,2020-07-01,ilAA-,S&P מעלות,נייר ערך,ILS,2.9457,2031-06-15,0.0518,0.0335,החוב לא נחות,,אחר,אי-תלות,2025-09-30,2025-09-30,6247.15,1.0,95.91,5.99164,,,,0.002334,2.8e-05
671,7236.0,"ביטוח ישיר - השקעות פיננסיות בע""מ",520044439,ח.פ.,ביטוח ישיר אגח יא 4.60% שקלי 30.06.28,IL0011388258,ISIN,צמוד למדד המחירים לצרכן,ישראל,ישראל,לא סחיר,השקעה ואחזקות,לא,2016-07-19,A2.il,מידרוג Moodys,נייר ערך,ILS,1.99,2028-06-30,0.0599,0.046,החוב לא נחות,,אחר,אי-תלות,2025-09-30,2025-09-30,25075.95,1.0,99.93,25.05839,,,,0.009763,0.00012
671,7236.0,"בנק הפועלים בע""מ",520000118,ח.פ.,"פועלים אגח 2 2.25% ב""י 07.11.28",IL0012275454,ISIN,לא צמוד למדד המחירים לצרכן,ישראל,ישראל,לא סחיר,בנקים,לא,2025-08-27,NR,NR,NR,ILS,2.83,2028-11-07,0.0711,0.0675,החוב לא נחות,,חברת ציטוט,אי-תלות,2025-09-30,2025-09-30,24774.54,1.0,99.52,24.65562,,,,0.009606,0.000118
671,7236.0,"מימון ישיר נדל""ן ומשכנתאות הנפקות (סדרה 2) בע""מ",517112074,ח.פ.,"מימון ישיר נדלן אגח (סדרה 2) 3.3%+ ב""י 20.06.54",IL0012257965,ISIN,צמוד למדד המחירים לצרכן,ישראל,ישראל,לא סחיר,אשראי חוץ בנקאי,לא,2025-07-29,Aa1.il,מידרוג Moodys,נייר ערך,ILS,7.4,2054-06-20,0.0739,0.078,החוב לא נחות,,אחר,אי-תלות,2025-09-30,2025-09-30,7038.9,1.0,100.1,7.04594,,,,0.002745,3.3e-05
671,7236.0,"מימון ישיר נדל""ן ומשכנתאות הנפקות (סדרה 2) בע""מ",517112074,ח.פ.,מימון ישיר נדלן אגח (סדרה 2) 5.25% צמוד 20.06.54,IL0012257882,ISIN,"צמוד למט""ח",ישראל,ישראל,לא סחיר,אשראי חוץ בנקאי,לא,2025-07-29,Aa1.il,מידרוג Moodys,נייר ערך,ILS,10.31,2054-06-20,0.0489,0.0525,החוב לא נחות,,חברת ציטוט,אי-תלות,2025-09-30,2025-09-30,12957.63,1.0,103.96,13.47076,,,,0.005248,6.4e-05
671,7236.0,"בנק לאומי לישראל בע""מ",520018078,ח.פ.,"בנק לאומי סדרה 4 2.2% ב""י 24.6.29",IL0012219288,ISIN,לא צמוד למדד המחירים לצרכן,ישראל,ישראל,לא סחיר,בנקים,לא,2025-05-22,NR,NR,NR,ILS,3.32,2029-06-24,0.0642,0.112,החוב לא נחות,,חברת ציטוט,אי-תלות,2025-09-30,2025-09-30,28576.32,1.0,99.38,28.39915,,,,0.011064,0.000136
671,7236.0,"קרדיטו הנפקות בע""מ",516804499,ח.פ.,קרדיטו אגח ב 10% שקלי 15.03.51,IL0012162744,ISIN,צמוד למדד המחירים לצרכן,ישראל,ישראל,לא סחיר,אשראי חוץ בנקאי,לא,2025-01-12,NR,NR,NR,ILS,9.22,2051-03-13,0.105,0.1,החוב לא נחות,,אחר,אי-תלות,2025-09-30,2025-09-30,9496.91,1.0,93.57,8.88626,,,,0.003462,4.2e-05
671,7236.0,"רפאל מערכות לחימה מתקדמות בע""מ",520042185,ח.פ.,רפאל אגח ד 3.74% שקלי 15.09.34,IL0011402844,ISIN,צמוד למדד המחירים לצרכן,ישראל,ישראל,לא סחיר,ביטחוניות,לא,2017-03-01,AA+,פנימי,נייר ערך,ILS,4.4,2034-09-15,0.0478,0.0374,החוב לא נחות,,אחר,אי-תלות,2025-09-30,2025-09-30,40020.2,1.0,96.46,38.60348,,,,0.01504,0.000186
671,7236.0,"מימון ישיר נדלן ומשכנתאות הנפקות (סד 1) בע""מ",516100153,ח.פ.,מימון ישיר נדלן אגח 1 5.00% צמוד 20.02.54,IL0012152687,ISIN,"צמוד למט""ח",ישראל,ישראל,לא סחיר,אשראי חוץ בנקאי,לא,2024-12-26,Aa1.il,מידרוג Moodys,נייר ערך,ILS,10.61,2054-02-20,0.0456,0.05,החוב לא נחות,,חברת ציטוט,אי-תלות,2025-09-30,2025-09-30,9061.14,1.0,106.71,9.66914,,,,0.003767,4.6e-05
671,7236.0,נתיבי הגז הטבעי לישראל,513436394,ח.פ.,נתיבי גז אגח א 5.60% צמוד 29.12.26,IL0011030843,ISIN,"צמוד למט""ח",ישראל,ישראל,לא סחיר,תשתיות,לא,2007-01-02,Aaa.il,מידרוג Moodys,נייר ערך,ILS,0.57,2026-12-29,0.0991,0.056,החוב לא נחות,,חברת ציטוט,אי-תלות,2025-09-30,2025-09-30,60654.38,1.0,147.67,89.56831,,,,0.034895,0.00043
671,7236.0,"גמול חברה להשקעות בע""מ",520018136,ח.פ.,"גמול אג""ח ב- הסדר",IL0011167553,ISIN,צמוד למדד המחירים לצרכן,ישראל,ישראל,לא סחיר,"נדל""ן מניב בישראל",לא,2009-07-01,NR,NR,NR,ILS,0.01,2021-09-30,0.0001,0.045,החוב לא נחות,,אחר,אי-תלות,2025-09-30,2025-09-30,13.01,1.0,39.0,0.00507,,,,1e-06,0.0
671,7236.0,"עוגן- אג""ח חברתית 2 בע""מ (חל""צ)",516556545,ח.פ.,"עוגן אג""ח רגילה 2.35% פריים 15.7.27",1196849,פנימי,צמוד למדד המחירים לצרכן,ישראל,ישראל,לא סחיר,שירותים פיננסיים,לא,2023-06-15,NR,NR,NR,ILS,1.15,2027-06-15,0.0901,0.1435,החוב לא נחות,,אחר,אי-תלות,2025-09-30,2025-09-30,16997.25,1.0,101.23,17.20632,,,,0.006703,8.2e-05
671,7236.0,"איילון חברת לביטוח בע""מ",520030677,ח.פ.,איילון אגח ג 7.75% שקלי 31.12.27,11955771,פנימי,צמוד למדד המחירים לצרכן,ישראל,ישראל,לא סחיר,ביטוח,לא,2022-11-22,A3.il,מידרוג Moodys,נייר ערך,ILS,2.0754,2027-12-31,0.0638,0.0775,החוב לא נחות,,אחר,אי-תלות,2025-09-30,2025-09-30,6461.2,1.0,104.94,6.78038,,,,0.002641,3.2e-05
671,7236.0,"מכלול מימון נדל""ן בע""מ",515759777,ח.פ.,מכלול נדלן אגח 2 1% פריים 01.01.28,1215193,פנימי,לא צמוד למדד המחירים לצרכן,ישראל,ישראל,לא סחיר,אשראי חוץ בנקאי,לא,2024-12-25,NR,NR,NR,ILS,2.1,2028-01-01,0.0641,0.07,החוב לא נחות,,חברת ציטוט,אי-תלות,2025-09-30,2025-09-30,19963.55,1.0,101.45,20.44638,,,,0.007965,9.7e-05
671,7236.0,"מימון ישיר נדל""ן ומשכנתאות בע""מ",516100153,ח.פ.,מ. ישיר משכנתאות א 4.45% צמוד 31.12.31,1208818,פנימי,"צמוד למט""ח",ישראל,ישראל,לא סחיר,אשראי חוץ בנקאי,לא,2024-07-14,A3.il,מידרוג Moodys,נייר ערך,ILS,2.96,2031-12-31,0.0443,0.0445,החוב לא נחות,,חברת ציטוט,אי-תלות,2025-09-30,2025-09-30,9290.45,1.0,105.78,9.82744,,,,0.003828,4.7e-05
671,7236.0,"בנק הפועלים בע""מ",520000118,ח.פ.,"פועלים אגח 1 2.25% ב""י 30.09.27",1211747,פנימי,לא צמוד למדד המחירים לצרכן,ישראל,ישראל,לא סחיר,בנקים,לא,2024-09-25,NR,NR,NR,ILS,1.9,2027-09-30,0.0689,0.1125,החוב לא נחות,,חברת ציטוט,אי-תלות,2025-09-30,2025-09-30,31948.29,1.0,101.09,32.29653,,,,0.012583,0.000155
671,7236.0,בנק ירושלים בע''מ,520025636,ח.פ.,בנק ירושלים COCO 5.13% צמוד 05.12.32,2004863,פנימי,צמוד למדד המחירים לצרכן,ישראל,ישראל,לא סחיר,בנקים,לא,2022-12-05,ilA-,S&P מעלות,נייר ערך,ILS,6.0943,2032-12-05,0.0443,0.0513,החוב לא נחות,,אחר,אי-תלות,2025-09-30,2025-09-30,56657.51,1.0,114.54,64.89551,,,,0.025283,0.000312
671,7236.0,"פרופיט תעשיות בניה בע""מ",520040650,ח.פ.,פרופיט אגח ד' ד-הסדר חוב,54901233,פנימי,צמוד למדד המחירים לצרכן,ישראל,ישראל,לא סחיר,בנייה,לא,2016-10-19,NR,NR,NR,ILS,0.0,2025-12-31,0.0,0.04,החוב לא נחות,,אחר,אי-תלות,2025-09-30,2025-09-30,604.95,1.0,180.769437,1.09356,,,,0.000426,5e-06
671,7236.0,"פרופיט תעשיות בניה בע""מ",520040650,ח.פ.,הפרשי שווי-פרופיט אגח ד' - הסדר חוב,54901234,פנימי,צמוד למדד המחירים לצרכן,ישראל,ישראל,לא סחיר,בנייה,לא,2016-10-19,NR,NR,NR,ILS,0.01,2025-12-31,0.0001,1e-05,החוב לא נחות,,אחר,אי-תלות,2025-09-30,2025-09-30,-874.45,1.0,100.0,-0.87445,,,,-0.00034,-4e-06
671,7236.0,כלל תעשיות,520021874,ח.פ.,כלל תעשיות אגח טז 4.47% שקלי 30.06.27,6080238,פנימי,צמוד למדד המחירים לצרכן,ישראל,ישראל,לא סחיר,השקעה ואחזקות,לא,2019-12-29,A2.il,מידרוג Moodys,נייר ערך,ILS,1.45,2027-06-30,0.0535,0.0447,החוב לא נחות,,אחר,אי-תלות,2025-09-30,2025-09-30,27907.9,1.0,100.02,27.91348,,,,0.010875,0.000134
671,7236.0,"בנק לאומי לישראל בע""מ",520018078,ח.פ.,"בנק לאומי סדרה 1 2.3% ב""י 24.12.26",1198639,פנימי,לא צמוד למדד המחירים לצרכן,ישראל,ישראל,לא סחיר,בנקים,לא,2023-08-07,NR,NR,NR,ILS,1.18,2026-12-24,0.0715,0.113,החוב לא נחות,,חברת ציטוט,אי-תלות,2025-09-30,2025-09-30,5624.32,1.0,100.51,5.653,,,,0.002202,2.7e-05
671,7236.0,מירלנד דיוולופמנט קורפריישן פי אל סי,1502,פנימי,מירלנד שטר הון 1.00% 01.01.2027,1182963,פנימי,צמוד למדד המחירים לצרכן,ישראל,רוסיה,לא סחיר,בנייה,לא,2021-11-26,NR,NR,NR,ILS,0.0,2027-01-01,0.0,0.01,החוב לא נחות,,אחר,אי-תלות,2025-09-30,2025-09-30,3612.14,1.0,0.0,0.0,,,,0.0,0.0
671,7236.0,"עוגן- אג""ח חברתית 2 בע""מ (חל""צ)",516556545,ח.פ.,"עוגן אג""ח בכיר 0.5% פריים 15.03.26",1196831,פנימי,צמוד למדד המחירים לצרכן,ישראל,ישראל,לא סחיר,שירותים פיננסיים,לא,2023-06-15,Aa2.il,מידרוג Moodys,נייר ערך,ILS,0.32,2026-03-15,0.0777,0.125,החוב לא נחות,,אחר,אי-תלות,2025-09-30,2025-09-30,2213.2,1.0,100.62,2.22692,,,,0.000867,1e-05
671,7236.0,"גדות מסופים לכימיקלים (1985) בע""מ",520040775,ח.פ.,גדות אגח א 4.30% שקלי 30.06.26,11623202,פנימי,צמוד למדד המחירים לצרכן,ישראל,ישראל,לא סחיר,מסחר,לא,2020-05-10,A3.il,מידרוג Moodys,נייר ערך,ILS,0.6561,2026-06-30,0.0539,0.043,החוב לא נחות,,אחר,אי-תלות,2025-09-30,2025-09-30,25595.86,1.0,100.43,25.70593,,,,0.010015,0.000123
671,7236.0,י.ח.ק להשקעות- שותפות מוגבלת,550016091,ח.פ.,י.ח.ק השקעות אגח ב 2.86% שקלי 31.12.28,1181783,פנימי,צמוד למדד המחירים לצרכן,ישראל,ישראל,לא סחיר,השקעה ואחזקות,לא,2021-11-14,ilA+,S&P מעלות,נייר ערך,ILS,1.63,2028-12-31,0.068,0.0286,החוב לא נחות,,אחר,אי-תלות,2025-09-30,2025-09-30,1534.08,1.0,98.48,1.51076,,,,0.000588,7e-06
671,7236.0,מקורות,520010869,ח.פ.,מקורות אגח 6 4.90% צמוד 25.12.36,1100908,פנימי,צמוד למדד המחירים לצרכן,ישראל,ישראל,לא סחיר,תשתיות,לא,2006-12-25,AA,פנימי,נייר ערך,ILS,4.96,2036-12-25,0.0283,0.049,החוב לא נחות,,חברת ציטוט,אי-תלות,2025-09-30,2025-09-30,294648.56,1.0,164.64,485.10939,,,,0.189003,0.002339
671,7236.0,"נתיבים אג""ח בע""מ",513502229,ח.פ.,נתיבים אגח א 7.97% דולרי 04.07.27,10902810,פנימי,"צמוד למט""ח",ישראל,ישראל,לא סחיר,השקעה ואחזקות,כן,2004-03-28,Aa1.il,מידרוג Moodys,נייר ערך,USD,0.9755,2027-07-04,0.045,0.0797,החוב לא נחות,,חברת ציטוט,אי-תלות,2025-09-30,2025-09-30,6505.44,3.306,105.33,22.65332,,,,0.008825,0.000109
671,7236.0,"אגרקסקו חברה ליצוא חקלאי בע""מ",510155625,ח.פ.,אגרקסקו אגח א חש4/12,1126770,פנימי,צמוד למדד המחירים לצרכן,ישראל,ישראל,לא סחיר,מסחר,לא,2007-12-27,NR,NR,NR,ILS,0.0,2017-04-30,0.0,0.0615,החוב לא נחות,,אחר,אי-תלות,2025-09-30,2025-09-30,66.66,1.0,0.0001,0.0,,,,0.0,0.0
671,7236.0,"מת""ם - מרכז תעשיות מדע חיפה בע""מ",510687403,ח.פ.,"מת""ם  אגח א 3.10% שקלי 30.06.27",11389991,פנימי,צמוד למדד המחירים לצרכן,ישראל,ישראל,לא סחיר,"נדל""ן מניב בישראל",לא,2016-08-16,Aa2.il,מידרוג Moodys,נייר ערך,ILS,1.2213,2027-06-30,0.0466,0.031,החוב לא נחות,,אחר,אי-תלות,2025-09-30,2025-09-30,6479.49,1.0,98.25,6.3661,,,,0.00248,3e-05
671,7236.0,מקורות,520010869,ח.פ.,מקורות אגח 6 4.90% צמוד 25.12.36,11009081,פנימי,"צמוד למט""ח",ישראל,ישראל,לא סחיר,תשתיות,לא,2010-12-25,ilAAA,S&P מעלות,נייר ערך,ILS,4.9814,2036-12-25,0.0273,0.049,החוב לא נחות,,חברת ציטוט,אי-תלות,2025-09-30,2025-09-30,28553.46,1.0,164.64,47.01042,,,,0.018314,0.000226
671,7236.0,DEAN FOODS CO,5RGFDMYH829UYJH0KY29,LEI,DF 6.5 03/15/23,US242370AD62,ISIN,צמוד למדד המחירים לצרכן,"חו""ל","ארה""ב",לא סחיר,Food Products,לא,2015-02-20,D,S&P,נייר ערך,USD,0.0,2023-03-15,0.0,0.065,החוב לא נחות,,אחר,אי-תלות,2025-09-30,2025-09-30,2885.74,3.306,0.0883,0.00842,,,,3e-06,0.0
671,7236.0,Endo International PLC,549300KK5WR4MGN4YT97,LEI,ENDO 7.5% 04/27,72961956,פנימי,צמוד למדד המחירים לצרכן,"חו""ל","ארה""ב",לא סחיר,Health Care Equipment & Supplies,לא,2019-03-14,D,S&P,נייר ערך,USD,100.0,2027-04-01,2.0,0.075,החוב לא נחות,,אחר,אי-תלות,2025-09-30,2025-09-30,583.31,3.306,1e-06,0.0,,,,0.0,0.0
671,8318.0,DEAN FOODS CO,5RGFDMYH829UYJH0KY29,LEI,DF 6.5 03/15/23,US242370AD62,ISIN,צמוד למדד המחירים לצרכן,"חו""ל","ארה""ב",לא סחיר,Food Products,לא,2015-02-20,D,S&P,נייר ערך,USD,0.0,2023-03-15,0.0,0.065,החוב לא נחות,,אחר,אי-תלות,2025-09-30,2025-09-30,708.12,3.306,0.0883,0.00207,,,,1.0,0.0
671,8318.0,Endo International PLC,549300KK5WR4MGN4YT97,LEI,ENDO 7.5% 04/27,72961956,פנימי,צמוד למדד המחירים לצרכן,"חו""ל","ארה""ב",לא סחיר,Health Care Equipment & Supplies,לא,2019-03-14,D,S&P,נייר ערך,USD,100.0,2027-04-01,2.0,0.075,החוב לא נחות,,אחר,אי-תלות,2025-09-30,2025-09-30,143.14,3.306,1e-06,0.0,,,,0.0,0.0
671,8319.0,חברת החשמל,520000472,ח.פ.,חברת חשמל 6.00% צמוד 07.05.29,IL0060001869,ISIN,"צמוד למט""ח",ישראל,ישראל,לא סחיר,אנרגיה,לא,2014-05-07,Aaa.il,מידרוג Moodys,נייר ערך,ILS,1.95,2029-05-07,0.0356,0.06,החוב לא נחות,,חברת ציטוט,אי-תלות,2025-09-30,2025-09-30,767.88,1.0,129.32,0.99302,,,,0.005693,0.000111
671,8319.0,"מימון ישיר מקבוצת ישיר(2006) בע""מ",513893123,ח.פ.,מימון ישיר אגח 16 4.25% צמוד 12.05.28,IL0011983405,ISIN,"צמוד למט""ח",ישראל,ישראל,לא סחיר,אשראי חוץ בנקאי,לא,2023-07-31,Aa2.il,מידרוג Moodys,נייר ערך,ILS,1.81,2028-05-12,0.0605,0.0425,החוב לא נחות,,חברת ציטוט,אי-תלות,2025-09-30,2025-09-30,2395.44,1.0,108.68,2.60336,,,,0.014926,0.000292
671,8319.0,נתיבי הגז הטבעי לישראל,513436394,ח.פ.,נתיבי גז אגח א 5.60% צמוד 29.12.26,IL0011030843,ISIN,"צמוד למט""ח",ישראל,ישראל,לא סחיר,תשתיות,לא,2007-01-02,Aaa.il,מידרוג Moodys,נייר ערך,ILS,0.57,2026-12-29,0.0991,0.056,החוב לא נחות,,חברת ציטוט,אי-תלות,2025-09-30,2025-09-30,1325.08,1.0,147.67,1.95673,,,,0.011219,0.000219
671,8319.0,"גמול חברה להשקעות בע""מ",520018136,ח.פ.,"גמול אג""ח ב- הסדר",IL0011167553,ISIN,צמוד למדד המחירים לצרכן,ישראל,ישראל,לא סחיר,"נדל""ן מניב בישראל",לא,2009-07-01,NR,NR,NR,ILS,0.01,2021-09-30,0.0001,0.045,החוב לא נחות,,אחר,אי-תלות,2025-09-30,2025-09-30,2.74,1.0,39.0,0.00106,,,,6e-06,0.0
671,8319.0,מקורות,520010869,ח.פ.,מקורות אגח 8 4.10% צמוד 14.07.48,IL0011243461,ISIN,"צמוד למט""ח",ישראל,ישראל,לא סחיר,תשתיות,לא,2011-07-14,ilAAA,S&P מעלות,נייר ערך,ILS,9.36,2048-07-14,0.0298,0.041,החוב לא נחות,,חברת ציטוט,אי-תלות,2025-09-30,2025-09-30,25935.23,1.0,139.55,36.19261,,,,0.207515,0.004061
671,8319.0,"בנק לאומי לישראל בע""מ",520018078,ח.פ.,"בנק לאומי סדרה 2 2.30% ב""י 24.08.30",IL0012058975,ISIN,לא צמוד למדד המחירים לצרכן,ישראל,ישראל,לא סחיר,בנקים,לא,2024-04-17,NR,NR,NR,ILS,4.17,2030-08-24,0.0705,0.113,החוב לא נחות,,חברת ציטוט,אי-תלות,2025-09-30,2025-09-30,8856.54,1.0,101.46,8.98584,,,,0.051521,0.001008
671,8319.0,"מכלול מימון נדל""ן בע""מ",515759777,ח.פ.,מכלול נדלן אגח 1 1.00% פריים 30.11.26,IL0012071416,ISIN,לא צמוד למדד המחירים לצרכן,ישראל,ישראל,לא סחיר,אשראי חוץ בנקאי,לא,2024-06-03,NR,NR,NR,ILS,1.12,2026-11-30,0.0633,0.0816,החוב לא נחות,,חברת ציטוט,אי-תלות,2025-09-30,2025-09-30,2188.3,1.0,103.36,2.35763,,,,0.013517,0.000263
671,8319.0,"גב-ים נגב בע""מ",514189596,ח.פ.,גב ים אגח ב 3.84% צמוד 31.12.28,IL0012084534,ISIN,"צמוד למט""ח",ישראל,ישראל,לא סחיר,"נדל""ן מניב בישראל",לא,2024-07-11,ilA+,S&P מעלות,נייר ערך,ILS,2.89,2028-12-31,0.0422,0.0384,החוב לא נחות,,חברת ציטוט,אי-תלות,2025-09-30,2025-09-30,7186.23,1.0,106.65,7.66411,,,,0.043943,0.00086
671,8319.0,"מימון ישיר נדלן ומשכנתאות הנפקות (סד 1) בע""מ",516100153,ח.פ.,מימון ישיר נדלן אגח 1 5.00% צמוד 20.02.54,IL0012152687,ISIN,"צמוד למט""ח",ישראל,ישראל,לא סחיר,אשראי חוץ בנקאי,לא,2024-12-26,Aa1.il,מידרוג Moodys,נייר ערך,ILS,10.61,2054-02-20,0.0456,0.05,החוב לא נחות,,חברת ציטוט,אי-תלות,2025-09-30,2025-09-30,3584.07,1.0,106.71,3.82456,,,,0.021928,0.000429
671,8319.0,"בנק הפועלים בע""מ",520000118,ח.פ.,"פועלים אגח 2 2.25% ב""י 07.11.28",IL0012275454,ISIN,לא צמוד למדד המחירים לצרכן,ישראל,ישראל,לא סחיר,בנקים,לא,2025-08-27,NR,NR,NR,ILS,2.83,2028-11-07,0.0711,0.0675,החוב לא נחות,,חברת ציטוט,אי-תלות,2025-09-30,2025-09-30,9799.4,1.0,99.52,9.75236,,,,0.055916,0.001094
671,8319.0,"מימון ישיר נדל""ן ומשכנתאות הנפקות (סדרה 2) בע""מ",517112074,ח.פ.,"מימון ישיר נדלן אגח (סדרה 2) 3.3%+ ב""י 20.06.54",IL0012257965,ISIN,צמוד למדד המחירים לצרכן,ישראל,ישראל,לא סחיר,אשראי חוץ בנקאי,לא,2025-07-29,Aa1.il,מידרוג Moodys,נייר ערך,ILS,7.4,2054-06-20,0.0739,0.078,החוב לא נחות,,אחר,אי-תלות,2025-09-30,2025-09-30,2784.19,1.0,100.1,2.78697,,,,0.015979,0.000312
671,8319.0,"מימון ישיר נדל""ן ומשכנתאות הנפקות (סדרה 2) בע""מ",517112074,ח.פ.,מימון ישיר נדלן אגח (סדרה 2) 5.25% צמוד 20.06.54,IL0012257882,ISIN,"צמוד למט""ח",ישראל,ישראל,לא סחיר,אשראי חוץ בנקאי,לא,2025-07-29,Aa1.il,מידרוג Moodys,נייר ערך,ILS,10.31,2054-06-20,0.0489,0.0525,החוב לא נחות,,חברת ציטוט,אי-תלות,2025-09-30,2025-09-30,5125.3,1.0,103.96,5.32826,,,,0.03055,0.000597
671,8319.0,"בנק לאומי לישראל בע""מ",520018078,ח.פ.,"בנק לאומי סדרה 4 2.2% ב""י 24.6.29",IL0012219288,ISIN,לא צמוד למדד המחירים לצרכן,ישראל,ישראל,לא סחיר,בנקים,לא,2025-05-22,NR,NR,NR,ILS,3.32,2029-06-24,0.0642,0.112,החוב לא נחות,,חברת ציטוט,אי-תלות,2025-09-30,2025-09-30,11303.17,1.0,99.38,11.23309,,,,0.064406,0.00126
671,8319.0,"קרדיטו הנפקות בע""מ",516804499,ח.פ.,קרדיטו אגח ב 10% שקלי 15.03.51,IL0012162744,ISIN,צמוד למדד המחירים לצרכן,ישראל,ישראל,לא סחיר,אשראי חוץ בנקאי,לא,2025-01-12,NR,NR,NR,ILS,9.22,2051-03-13,0.105,0.1,החוב לא נחות,,אחר,אי-תלות,2025-09-30,2025-09-30,3756.44,1.0,93.57,3.5149,,,,0.020153,0.000394
671,8319.0,נתיבי הגז הטבעי לישראל,513436394,ח.פ.,נתיבי גז אגח ג 4.80% צמוד 31.12.31,IL0011255093,ISIN,"צמוד למט""ח",ישראל,ישראל,לא סחיר,תשתיות,לא,2012-01-02,Aaa.il,מידרוג Moodys,נייר ערך,ILS,3.03,2031-12-31,0.0312,0.048,החוב לא נחות,,חברת ציטוט,אי-תלות,2025-09-30,2025-09-30,1214.54,1.0,131.46,1.59664,,,,0.009153,0.000178
671,8319.0,אורמת טכנולוגיות אינק,520036716,ח.פ.,אורמת סדרה 4 3.35% שקלי 15.06.31,IL0011672123,ISIN,צמוד למדד המחירים לצרכן,ישראל,ישראל,לא סחיר,אנרגיה מתחדשת,לא,2020-07-01,ilAA-,S&P מעלות,נייר ערך,ILS,2.9457,2031-06-15,0.0518,0.0335,החוב לא נחות,,אחר,אי-תלות,2025-09-30,2025-09-30,2471.02,1.0,95.91,2.36995,,,,0.013588,0.000265
671,8319.0,"בנק לאומי לישראל בע""מ",520018078,ח.פ.,בנק לאומי סדרה 3 3.69% צמוד 24.05.35,IL0012150293,ISIN,צמוד למדד המחירים לצרכן,ישראל,ישראל,לא סחיר,בנקים,לא,2024-12-23,NR,NR,NR,ILS,3.73,2035-05-24,0.037,0.0369,החוב לא נחות,,חברת ציטוט,אי-תלות,2025-09-30,2025-09-30,22658.98,1.0,103.39,23.42712,,,,0.134322,0.002629
671,8319.0,מירלנד דיוולופמנט קורפריישן פי אל סי,1502,פנימי,מירלנד שטר הון 1.00% 01.01.2027,1182963,פנימי,צמוד למדד המחירים לצרכן,ישראל,רוסיה,לא סחיר,בנייה,לא,2021-11-26,NR,NR,NR,ILS,0.0,2027-01-01,0.0,0.01,החוב לא נחות,,אחר,אי-תלות,2025-09-30,2025-09-30,1428.75,1.0,0.0,0.0,,,,0.0,0.0
671,8319.0,י.ח.ק להשקעות- שותפות מוגבלת,550016091,ח.פ.,י.ח.ק השקעות אגח ב 2.86% שקלי 31.12.28,1181783,פנימי,צמוד למדד המחירים לצרכן,ישראל,ישראל,לא סחיר,השקעה ואחזקות,לא,2021-11-14,ilA+,S&P מעלות,נייר ערך,ILS,1.63,2028-12-31,0.068,0.0286,החוב לא נחות,,אחר,אי-תלות,2025-09-30,2025-09-30,606.79,1.0,98.48,0.59757,,,,0.003426,6.7e-05
671,8319.0,"איילון חברת לביטוח בע""מ",520030677,ח.פ.,איילון אגח ג 7.75% שקלי 31.12.27,11955771,פנימי,צמוד למדד המחירים לצרכן,ישראל,ישראל,לא סחיר,ביטוח,לא,2022-11-22,A3.il,מידרוג Moodys,נייר ערך,ILS,2.0754,2027-12-31,0.0638,0.0775,החוב לא נחות,,אחר,אי-תלות,2025-09-30,2025-09-30,2555.68,1.0,104.94,2.68193,,,,0.015377,0.0003
671,8319.0,"בנק הפועלים בע""מ",520000118,ח.פ.,"פועלים אגח 1 2.25% ב""י 30.09.27",1211747,פנימי,לא צמוד למדד המחירים לצרכן,ישראל,ישראל,לא סחיר,בנקים,לא,2024-09-25,NR,NR,NR,ILS,1.9,2027-09-30,0.0689,0.1125,החוב לא נחות,,חברת ציטוט,אי-תלות,2025-09-30,2025-09-30,12636.93,1.0,101.09,12.77467,,,,0.073245,0.001433
671,8319.0,"בנק לאומי לישראל בע""מ",520018078,ח.פ.,"בנק לאומי סדרה 1 2.3% ב""י 24.12.26",1198639,פנימי,לא צמוד למדד המחירים לצרכן,ישראל,ישראל,לא סחיר,בנקים,לא,2023-08-07,NR,NR,NR,ILS,1.18,2026-12-24,0.0715,0.113,החוב לא נחות,,חברת ציטוט,אי-תלות,2025-09-30,2025-09-30,2224.66,1.0,100.51,2.23601,,,,0.01282,0.00025
671,8319.0,"מכלול מימון נדל""ן בע""מ",515759777,ח.פ.,מכלול נדלן אגח 2 1% פריים 01.01.28,1215193,פנימי,לא צמוד למדד המחירים לצרכן,ישראל,ישראל,לא סחיר,אשראי חוץ בנקאי,לא,2024-12-25,NR,NR,NR,ILS,2.1,2028-01-01,0.0641,0.07,החוב לא נחות,,חברת ציטוט,אי-תלות,2025-09-30,2025-09-30,7896.45,1.0,101.45,8.08742,,,,0.046369,0.000907
671,8319.0,"מימון ישיר נדל""ן ומשכנתאות בע""מ",516100153,ח.פ.,מ. ישיר משכנתאות א 4.45% צמוד 31.12.31,1208818,פנימי,"צמוד למט""ח",ישראל,ישראל,לא סחיר,אשראי חוץ בנקאי,לא,2024-07-14,A3.il,מידרוג Moodys,נייר ערך,ILS,2.96,2031-12-31,0.0443,0.0445,החוב לא נחות,,חברת ציטוט,אי-תלות,2025-09-30,2025-09-30,3674.77,1.0,105.78,3.88718,,,,0.022287,0.000436
671,8319.0,מקורות,520010869,ח.פ.,מקורות אגח 6 4.90% צמוד 25.12.36,1100908,פנימי,צמוד למדד המחירים לצרכן,ישראל,ישראל,לא סחיר,תשתיות,לא,2006-12-25,AA,פנימי,נייר ערך,ILS,4.96,2036-12-25,0.0283,0.049,החוב לא נחות,,חברת ציטוט,אי-תלות,2025-09-30,2025-09-30,9381.92,1.0,164.64,15.4464,,,,0.088564,0.001733
671,8319.0,מקורות,520010869,ח.פ.,מקורות אגח 6 4.90% צמוד 25.12.36,11009081,פנימי,"צמוד למט""ח",ישראל,ישראל,לא סחיר,תשתיות,לא,2010-12-25,ilAAA,S&P מעלות,נייר ערך,ILS,4.9814,2036-12-25,0.0273,0.049,החוב לא נחות,,חברת ציטוט,אי-תלות,2025-09-30,2025-09-30,909.17,1.0,164.64,1.49686,,,,0.008581,0.000167
671,8319.0,"מת""ם - מרכז תעשיות מדע חיפה בע""מ",510687403,ח.פ.,"מת""ם  אגח א 3.10% שקלי 30.06.27",11389991,פנימי,צמוד למדד המחירים לצרכן,ישראל,ישראל,לא סחיר,"נדל""ן מניב בישראל",לא,2016-08-16,Aa2.il,מידרוג Moodys,נייר ערך,ILS,1.2213,2027-06-30,0.0466,0.031,החוב לא נחות,,אחר,אי-תלות,2025-09-30,2025-09-30,2562.92,1.0,98.25,2.51807,,,,0.014437,0.000282
671,8319.0,"פרופיט תעשיות בניה בע""מ",520040650,ח.פ.,פרופיט אגח ד' ד-הסדר חוב,54901233,פנימי,צמוד למדד המחירים לצרכן,ישראל,ישראל,לא סחיר,בנייה,לא,2016-10-19,NR,NR,NR,ILS,0.0,2025-12-31,0.0,0.04,החוב לא נחות,,אחר,אי-תלות,2025-09-30,2025-09-30,233.43,1.0,180.769498,0.42197,,,,0.002419,4.7e-05
671,8319.0,"פרופיט תעשיות בניה בע""מ",520040650,ח.פ.,הפרשי שווי-פרופיט אגח ד' - הסדר חוב,54901234,פנימי,צמוד למדד המחירים לצרכן,ישראל,ישראל,לא סחיר,בנייה,לא,2016-10-19,NR,NR,NR,ILS,0.01,2025-12-31,0.0001,1e-05,החוב לא נחות,,אחר,אי-תלות,2025-09-30,2025-09-30,-337.42,1.0,100.0,-0.33742,,,,-0.001934,-3.7e-05
671,8319.0,DEAN FOODS CO,5RGFDMYH829UYJH0KY29,LEI,DF 6.5 03/15/23,US242370AD62,ISIN,צמוד למדד המחירים לצרכן,"חו""ל","ארה""ב",לא סחיר,Food Products,לא,2015-02-20,D,S&P,נייר ערך,USD,0.0,2023-03-15,0.0,0.065,החוב לא נחות,,אחר,אי-תלות,2025-09-30,2025-09-30,3528.53,3.306,0.0883,0.0103,,,,5.9e-05,1e-06
671,8319.0,Endo International PLC,549300KK5WR4MGN4YT97,LEI,ENDO 7.5% 04/27,72961956,פנימי,צמוד למדד המחירים לצרכן,"חו""ל","ארה""ב",לא סחיר,Health Care Equipment & Supplies,לא,2019-03-14,D,S&P,נייר ערך,USD,100.0,2027-04-01,2.0,0.075,החוב לא נחות,,אחר,אי-תלות,2025-09-30,2025-09-30,713.25,3.306,1e-06,0.0,,,,0.0,0.0
209,13335.0,,,,,,,,,,,,,,,,,,,,,,,,,,,,,,,,,,,,
209,14286.0,,,,,,,,,,,,,,,,,,,,,,,,,,,,,,,,,,,,
209,15218.0,,,,,,,,,,,,,,,,,,,,,,,,,,,,,,,,,,,,
209,15219.0,,,,,,,,,,,,,,,,,,,,,,,,,,,,,,,,,,,,
209,2189.0,,,,,,,,,,,,,,,,,,,,,,,,,,,,,,,,,,,,
209,2201.0,,,,,,,,,,,,,,,,,,,,,,,,,,,,,,,,,,,,
209,9979.0,,,,,,,,,,,,,,,,,,,,,,,,,,,,,,,,,,,,
209,9984.0,,,,,,,,,,,,,,,,,,,,,,,,,,,,,,,,,,,,
209,9987.0,,,,,,,,,,,,,,,,,,,,,,,,,,,,,,,,,,,,
671,13465.0,,,,,,,,,,,,,,,,,,,,,,,,,,,,,,,,,,,,
671,14082.0,,,,,,,,,,,,,,,,,,,,,,,,,,,,,,,,,,,,
671,14287.0,,,,,,,,,,,,,,,,,,,,,,,,,,,,,,,,,,,,
671,15221.0,,,,,,,,,,,,,,,,,,,,,,,,,,,,,,,,,,,,
671,15222.0,,,,,,,,,,,,,,,,,,,,,,,,,,,,,,,,,,,,
671,15223.0,,,,,,,,,,,,,,,,,,,,,,,,,,,,,,,,,,,,
671,2202.0,,,,,,,,,,,,,,,,,,,,,,,,,,,,,,,,,,,,
671,8320.0,,,,,,,,,,,,,,,,,,,,,,,,,,,,,,,,,,,,
סיום מידע טבלה,,,,,,,,,,,,,,,,,,,,,,,,,,,,,,,,,,,,,
