מספר קופה/קרן/ח.פ. עבור חברת ביטוח,מספר מסלול,שם מנפיק,שם נייר ערך,מספר נייר ערך,מאפיין עיקרי,"ישראל/חו""ל",מדינה לפי חשיפה כלכלית,זירת מסחר,דירוג,שם מדרג,מטבע פעילות,"מח""מ",מועד פדיון,שיעור ריבית,תשואה לפדיון,סכום לקבל (במטבע הפעילות),ערך נקוב (יחידות),שער חליפין,שער נייר הערך,"שווי הוגן (באלפי ש""ח)","עלות מופחתת (באלפי ש""ח)",השיטה שיושמה בדוח הכספי,שיעור מערך נקוב מונפק,שיעור מנכסי אפיק ההשקעה,שיעור מסך נכסי ההשקעה
209,12119.0,ממשלת ישראל,ממשלתי צמוד 0527,IL0011408478,צמוד למדד המחירים לצרכן בריבית קבועה,ישראל,ישראל,TASE,RF,פנימי,ILS,1.65,2027-05-31,0.0075,0.0209,,14895016.05,1.0,117.66,17525.47589,,,0.000611,0.03398,0.001563
209,12119.0,ממשלת ישראל,ממשלתי שקלי 0229,IL0011948028,לא צמוד למדד המחירים לצרכן ריבית קבועה,ישראל,ישראל,TASE,RF,פנימי,ILS,3.2,2029-02-28,0.0375,0.0391,,1592677.28,1.0,101.7,1619.75279,,,4.5e-05,0.00314,0.000144
209,12119.0,ממשלת ישראל,ממשל קצרה 02/26,IL0012194689,לא צמוד למדד המחירים לצרכן ריבית קבועה,ישראל,ישראל,TASE,RF,פנימי,ILS,0.4,2026-02-27,0.0,0.0417,,3882037.67,1.0,97.18,3772.56421,,,0.000743,0.007315,0.000336
209,12119.0,ממשלת ישראל,ממשל שקלית 0142,IL0011254005,לא צמוד למדד המחירים לצרכן ריבית קבועה,ישראל,ישראל,TASE,RF,פנימי,ILS,11.17,2042-01-31,0.055,0.0434,,23354328.31,1.0,117.0,27324.56412,,,0.000753,0.052981,0.002437
209,12119.0,ממשלת ישראל,ממשל צמודה 1151,IL0011683013,צמוד למדד המחירים לצרכן בריבית קבועה,ישראל,ישראל,TASE,RF,פנימי,ILS,11.99,2051-11-30,0.005,0.0214,,666.87,1.0,80.45,0.5365,,,0.0,1e-06,0.0
209,12119.0,ממשלת ישראל,ממשלתי צמוד 1131,IL0011722209,צמוד למדד המחירים לצרכן בריבית קבועה,ישראל,ישראל,TASE,RF,פנימי,ILS,6.14,2031-11-30,0.001,0.019,,79083602.52,1.0,106.54,84255.67013,,,0.00231,0.163371,0.007516
209,12119.0,ממשלת ישראל,ממשל שקלית 327,IL0011393449,לא צמוד למדד המחירים לצרכן ריבית קבועה,ישראל,ישראל,TASE,RF,פנימי,ILS,1.47,2027-03-31,0.02,0.0396,,125652.02,1.0,98.22,123.41541,,,4e-06,0.000239,1.1e-05
209,12119.0,ממשלת ישראל,ממשל שקלי 347,IL0011401937,לא צמוד למדד המחירים לצרכן ריבית קבועה,ישראל,ישראל,TASE,RF,פנימי,ILS,14.44,2047-03-31,0.0375,0.0449,,3580587.16,1.0,91.85,3288.76931,,,0.000136,0.006375,0.000292
209,12119.0,ממשלת ישראל,ממשל קצרה 11/25,IL0012153263,לא צמוד למדד המחירים לצרכן ריבית קבועה,ישראל,ישראל,TASE,RF,פנימי,ILS,0.16,2025-11-30,0.0,0.0412,,7958177.23,1.0,99.36,7907.24489,,,0.001254,0.015332,0.000705
209,12119.0,ממשלת ישראל,מ.ק.מ. 616,IL0082606141,לא צמוד למדד המחירים לצרכן ריבית קבועה,ישראל,ישראל,TASE,RF,פנימי,ILS,0.67,2026-06-03,0.0,0.042,,605414.22,1.0,97.3,589.06803,,,3.3e-05,0.001142,5.2e-05
209,12119.0,ממשלת ישראל,מ.ק.מ 316,IL0082603171,לא צמוד למדד המחירים לצרכן ריבית קבועה,ישראל,ישראל,TASE,RF,פנימי,ILS,0.42,2026-03-04,0.0,0.0415,,2663681.21,1.0,98.32,2618.93137,,,0.000147,0.005078,0.000233
209,12119.0,ממשלת ישראל,ממשל צמודה 1033,IL0012043795,צמוד למדד המחירים לצרכן בריבית קבועה,ישראל,ישראל,TASE,RF,פנימי,ILS,7.53,2033-10-31,0.016,0.0195,,78536798.99,1.0,105.4,82777.78614,,,0.002969,0.160506,0.007387
209,12119.0,ממשלת ישראל,ממשל שקלית 335,IL0012023326,לא צמוד למדד המחירים לצרכן ריבית קבועה,ישראל,ישראל,TASE,RF,פנימי,ILS,7.92,2035-03-30,0.04,0.041,,107799.92,1.0,101.25,109.14742,,,3e-06,0.000211,9e-06
209,12119.0,ממשלת ישראל,ממשלתי צמוד 0545,IL0011348658,צמוד למדד המחירים לצרכן בריבית קבועה,ישראל,ישראל,TASE,RF,פנימי,ILS,17.67,2045-05-31,0.01,0.0207,,3055892.3,1.0,99.57,3042.75196,,,0.000133,0.005899,0.000271
209,12119.0,ממשלת ישראל,ממשל שקלית928,IL0011508798,לא צמוד למדד המחירים לצרכן ריבית קבועה,ישראל,ישראל,TASE,RF,פנימי,ILS,2.92,2028-09-28,0.0225,0.0393,,14404058.23,1.0,95.37,13737.15033,,,0.000414,0.026635,0.001225
209,12119.0,ממשלת ישראל,ממשלתי צמוד 0529,IL0011570236,צמוד למדד המחירים לצרכן בריבית קבועה,ישראל,ישראל,TASE,RF,פנימי,ILS,3.63,2029-05-31,0.005,0.0193,,48819426.57,1.0,113.0,55165.95203,,,0.001658,0.106965,0.004922
209,12119.0,ממשלת ישראל,ממשל שקלי 1152,IL0011840761,לא צמוד למדד המחירים לצרכן ריבית קבועה,ישראל,ישראל,TASE,RF,פנימי,ILS,17.24,2052-11-29,0.028,0.0461,,46331893.59,1.0,74.63,34577.49219,,,0.001675,0.067044,0.003084
209,12119.0,ממשלת ישראל,ממשל שקלית 0432,IL0011806606,לא צמוד למדד המחירים לצרכן ריבית קבועה,ישראל,ישראל,TASE,RF,פנימי,ILS,6.28,2032-04-30,0.013,0.0402,,19651.52,1.0,85.09,16.72148,,,0.0,3.2e-05,1e-06
209,12119.0,ממשלת ישראל,ממשל שקלית 330,IL0011609851,לא צמוד למדד המחירים לצרכן ריבית קבועה,ישראל,ישראל,TASE,RF,פנימי,ILS,4.39,2030-03-31,0.01,0.0393,,418325.2,1.0,88.66,370.88713,,,1.1e-05,0.000718,3.2e-05
209,12119.0,ממשלת ישראל,מ.ק.מ. 516,IL0082605150,לא צמוד למדד המחירים לצרכן ריבית קבועה,ישראל,ישראל,TASE,RF,פנימי,ILS,0.59,2026-05-06,0.0,0.0416,,33647561.52,1.0,97.63,32850.11432,,,0.001869,0.063696,0.002931
209,12119.0,ממשלת ישראל,ממשל צמודה 1028,IL0011973265,צמוד למדד המחירים לצרכן בריבית קבועה,ישראל,ישראל,TASE,RF,פנימי,ILS,3.01,2028-10-31,0.011,0.0199,,2878404.79,1.0,105.65,3041.03466,,,8.5e-05,0.005896,0.00027
209,12119.0,ממשלת ישראל,מ.ק.מ 416,IL0082604161,לא צמוד למדד המחירים לצרכן ריבית קבועה,ישראל,ישראל,TASE,RF,פנימי,ILS,0.49,2026-04-01,0.0,0.0418,,16930536.8,1.0,98.0,16591.92606,,,0.00094,0.032171,0.00148
209,12119.0,ממשלת ישראל,ממשל שקלית 927,IL0012035791,לא צמוד למדד המחירים לצרכן ריבית קבועה,ישראל,ישראל,TASE,RF,פנימי,ILS,1.96,2027-09-30,0.0375,0.0397,,3448592.16,1.0,99.62,3435.48752,,,9.5e-05,0.00666,0.000305
209,12119.0,ממשלת ישראל,ממשלתי צמוד 726,IL0011695645,צמוד למדד המחירים לצרכן בריבית קבועה,ישראל,ישראל,TASE,RF,פנימי,ILS,0.82,2026-07-31,0.001,0.0267,,19363093.36,1.0,116.31,22521.21389,,,0.000958,0.043668,0.002009
209,12119.0,ממשלת ישראל,מ.ק.מ 216,IL0082602181,לא צמוד למדד המחירים לצרכן ריבית קבועה,ישראל,ישראל,TASE,RF,פנימי,ILS,0.34,2026-02-04,0.0,0.0424,,3076514.86,1.0,98.6,3033.44365,,,0.00017,0.005881,0.00027
209,12119.0,ממשלת ישראל,מ.ק.מ. 726,IL0082607214,לא צמוד למדד המחירים לצרכן ריבית קבועה,ישראל,ישראל,TASE,RF,פנימי,ILS,0.76,2026-07-08,0.0,0.0414,,13480375.82,1.0,96.96,13070.57239,,,0.000748,0.025343,0.001165
209,12119.0,ממשלת ישראל,ממשל שקלית 537,IL0011661803,לא צמוד למדד המחירים לצרכן ריבית קבועה,ישראל,ישראל,TASE,RF,פנימי,ILS,10.55,2037-05-31,0.015,0.0421,,596060.36,1.0,75.94,452.64824,,,1.4e-05,0.000877,4e-05
209,12119.0,ממשלת ישראל,ממשל שקלית 0226,IL0011746976,לא צמוד למדד המחירים לצרכן ריבית קבועה,ישראל,ישראל,TASE,RF,פנימי,ILS,0.4,2026-02-27,0.005,0.0409,,12626862.34,1.0,98.89,12486.70416,,,0.000509,0.024211,0.001114
209,12119.0,ממשלת ישראל,ממשל שקלית 829,IL0012128935,לא צמוד למדד המחירים לצרכן ריבית קבועה,ישראל,ישראל,TASE,RF,פנימי,ILS,3.66,2029-08-31,0.046,0.0394,,5828959.77,1.0,102.76,5989.83906,,,0.000308,0.011614,0.000533
209,12119.0,ממשלת ישראל,ממשלתי צמוד 841,IL0011205833,צמוד למדד המחירים לצרכן בריבית קבועה,ישראל,ישראל,TASE,RF,פנימי,ILS,13.23,2041-08-30,0.0275,0.0202,,16348.26,1.0,139.93,22.87613,,,0.0,4.3e-05,1e-06
209,12119.0,ממשלת ישראל,ממשל צמודה 0431,IL0012207226,צמוד למדד המחירים לצרכן בריבית קבועה,ישראל,ישראל,TASE,RF,פנימי,ILS,5.29,2031-04-30,0.02,0.0199,,1049413.74,1.0,103.02,1081.10603,,,0.000145,0.002096,9.5e-05
209,12119.0,MEX BONOS DESARR FIX RT,MBONO 7 1/2 05/26/33,MX0MGO0001D6,"נקוב במט""ח","חו""ל",מקסיקו,FOREIGN_GOV_SEC,BBB-,Fitch,MXN,5.8,2033-05-26,0.075,-0.4421,,415362.06,0.1804,9685.8,7257.69732,,,1e-06,0.014072,0.000647
209,12119.0,MEX BONOS DESARR FIX RT,MBONO 8 1/2 11/18/2038,MX0MGO0000J5,"נקוב במט""ח","חו""ל",מקסיקו,FOREIGN_GOV_SEC,BBB-,Fitch,MXN,7.86,2038-11-18,0.085,-0.282,,398398.1,0.1804,9889.2,7107.46867,,,1e-06,0.013781,0.000634
209,12119.0,POLAND GOVERNMENT BOND,POLGB 7 1/2  07/25/2028,PL0000115192,"נקוב במט""ח","חו""ל",פולין,FOREIGN_GOV_SEC,A-,Fitch,PLN,2.6,2028-07-25,0.075,0.0439,,1503909.94,0.9092,109.442,1496.46057,,,3.3e-05,0.002901,0.000133
209,12119.0,AFRICAN DEVELOPMENT BANK,AFDB 0 06/05/34,XS2831196535,"נקוב במט""ח","חו""ל",ברזיל,FOREIGN_GOV_SEC,AAA,S&P,BRL,8.66,2034-06-05,0.0,0.1221,,8264059.57,0.6225,36.768,1891.48457,,,0.015025,0.003667,0.000168
209,12119.0,INTL FINANCE CORP,EBRD 0 02/02/32,XS2438631710,"נקוב במט""ח","חו""ל",ברזיל,FOREIGN_GOV_SEC,AAA,S&P,BRL,6.32,2032-02-02,0.0,0.1199,,4913765.15,0.6225,48.758,1491.41887,,,0.002456,0.002891,0.000133
209,12119.0,INTL BK RECON & DEVELOP,IBRD 10 10/17/29,XS2920414112,"נקוב במט""ח","חו""ל",ברזיל,FOREIGN_GOV_SEC,AAA,S&P,BRL,3.16,2029-10-17,0.1,0.1206,,6104980.94,0.6225,103.44,3931.0827,,,0.009392,0.007622,0.00035
209,12119.0,MEX BONOS DESARR FIX RT,MBONO 7 3/4 29/05/31,MX0MGO0000P2,"נקוב במט""ח","חו""ל",מקסיקו,FOREIGN_GOV_SEC,BBB-,Fitch,MXN,4.59,2031-05-29,0.0775,-0.5479,,300737.32,0.1804,9997.6,5423.99913,,,0.0,0.010517,0.000484
209,12119.0,TREASURY BILL,B 0 10/02/25,US912797MS31,"נקוב במט""ח","חו""ל","ארה""ב",אחר,AA+,Fitch,USD,0.0054,2025-10-02,0.0,0.0203,,208727.42,3.306,99.989,689.97695,,,0.0,0.001337,6.1e-05
209,12119.0,INTL FINANCE CORP,IFC 0 26/05/27,XS1621760302,"נקוב במט""ח","חו""ל",ברזיל,FOREIGN_GOV_SEC,AAA,S&P,BRL,1.63,2027-05-26,0.0,0.1238,,2978039.48,0.6225,82.459,1528.64933,,,0.004107,0.002964,0.000136
209,12119.0,HUNGARY GOVERNMENT BOND,HGB 2 1/4 04/20/33,HU0000404744,"נקוב במט""ח","חו""ל",הונגריה,FOREIGN_GOV_SEC,Baa2,Moodys,HUF,6.82,2033-04-20,0.0225,0.067,,580717699.5,0.009944,75.239,4344.79403,,,0.000466,0.008424,0.000387
209,12119.0,REPUBLIC OF BRAZIL,BRAZIL 10 1/4 01/10/28,US105756BN96,"נקוב במט""ח","חו""ל",ברזיל,FOREIGN_GOV_SEC,BB,S&P,BRL,2.03,2028-01-10,0.1025,0.0993,,3289989.12,0.6225,103.027,2110.01173,,,0.00069,0.00409,0.000188
209,12119.0,TREASURY BILL,B 0 09/03/26,US912797RS85,"נקוב במט""ח","חו""ל","ארה""ב",אחר,AA+,Fitch,USD,0.91,2026-09-03,0.0,0.0365,,1372365.88,3.306,96.738,4389.04328,,,2.6e-05,0.008509,0.000391
209,12119.0,INTL FINANCE CORP,IFC 11 ½ 16/01/30,XS2977993471,"נקוב במט""ח","חו""ל",ברזיל,FOREIGN_GOV_SEC,AAA,S&P,BRL,3.33,2030-01-16,0.115,0.1208,,4615961.2,0.6225,106.39,3057.0484,,,0.004734,0.005927,0.000272
209,12119.0,MEX BONOS DESARR FIX RT,MBONO 7.5 06/03/27,MX0MGO0000D8,"נקוב במט""ח","חו""ל",מקסיקו,FOREIGN_GOV_SEC,BBB-,Fitch,MXN,1.57,2027-03-06,0.075,-0.9602,,80034.81,0.1804,10252.3,1480.25577,,,0.0,0.00287,0.000132
209,12119.0,POLAND GOVERNMENT BOND,POLGB 6 10/25/2033,PL0000115291,"נקוב במט""ח","חו""ל",פולין,FOREIGN_GOV_SEC,A-,Fitch,PLN,6.31,2033-10-25,0.06,0.0524,,4474504.33,0.9092,110.439,4492.90075,,,7.4e-05,0.008711,0.0004
209,12119.0,POLAND GOVERNMENT BOND,POLGB 3 3/4 05/25/27,PL0000114393,"נקוב במט""ח","חו""ל",פולין,FOREIGN_GOV_SEC,A-,Fitch,PLN,1.59,2027-05-25,0.0375,0.1229,,2978039.48,0.9092,100.706,2726.74939,,,9e-05,0.005287,0.000243
209,12119.0,INTL FINANCE CORP,IFC 0 27/08/30,XS1280871259,"נקוב במט""ח","חו""ל",ברזיל,FOREIGN_GOV_SEC,AAA,S&P,BRL,4.89,2030-08-27,0.0,0.1222,,1637921.72,0.6225,56.766,578.78969,,,0.00309,0.001122,5.1e-05
209,12119.0,POLAND GOVERNMENT BOND,POLGB 1 3/4 04/25/32,PL0000113783,"נקוב במט""ח","חו""ל",פולין,FOREIGN_GOV_SEC,A-,Fitch,PLN,6.15,2032-04-24,0.0175,0.048,,7966255.62,0.9092,82.619,5984.02775,,,0.000133,0.011603,0.000534
209,12119.0,POLAND GOVERNMENT BOND,POLGB 5 3/4 04/25/29,PL0000105391,"נקוב במט""ח","חו""ל",פולין,FOREIGN_GOV_SEC,A-,Fitch,PLN,3.24,2029-04-25,0.0575,0.0453,,699839.28,0.9092,106.374,676.85124,,,1.2e-05,0.001312,6e-05
209,12119.0,HUNGARY GOVERNMENT BOND,HGB 7 10/24/35 35/A,HU0000406624,"נקוב במט""ח","חו""ל",הונגריה,FOREIGN_GOV_SEC,Baa2,Moodys,HUF,7.09,2035-10-24,0.07,0.068,,104231381.96,0.009944,107.901,1118.3689,,,7.9e-05,0.002168,9.9e-05
209,12119.0,HUNGARY GOVERNMENT BOND,HGB 6 3/4 07/23/31,HU0000407317,"נקוב במט""ח","חו""ל",הונגריה,FOREIGN_GOV_SEC,Baa2,Moodys,HUF,4.86,2031-07-23,0.0675,0.0644,,52860200.85,0.009944,104.522,549.41136,,,0.00022,0.001065,4.9e-05
209,13335.0,TREASURY BILL,B 0 30/10/25,US912797NA14,"נקוב במט""ח","חו""ל","ארה""ב",אחר,AA+,Fitch,USD,0.07,2025-10-30,0.0,0.0405,,178635361.59,3.306,99.674,588643.2521,,,0.000595,0.503347,0.02725
209,13335.0,TREASURY BILL,B 0 10/02/25,US912797MS31,"נקוב במט""ח","חו""ל","ארה""ב",אחר,AA+,Fitch,USD,0.0054,2025-10-02,0.0,0.0203,,77347269.97,3.306,99.989,255681.94641,,,0.00026,0.218633,0.011837
209,13335.0,TREASURY BILL,B 0 09/03/26,US912797RS85,"נקוב במט""ח","חו""ל","ארה""ב",אחר,AA+,Fitch,USD,0.91,2026-09-03,0.0,0.0365,,99446489.96,3.306,96.738,318045.61529,,,0.001949,0.27196,0.014723
209,13335.0,TREASURY BILL,B 0 08/06/26,US912797RG48,"נקוב במט""ח","חו""ל","ארה""ב",אחר,AA+,Fitch,USD,0.84,2026-08-06,0.0,0.0371,,2209922.0,3.306,96.953,7083.38824,,,4.1e-05,0.006057,0.000327
209,14285.0,ממשלת ישראל,מ.ק.מ. 516,IL0082605150,לא צמוד למדד המחירים לצרכן ריבית קבועה,ישראל,ישראל,TASE,RF,פנימי,ILS,0.59,2026-05-06,0.0,0.0416,,744396.4,1.0,97.63,726.75421,,,4.1e-05,0.18642,0.015837
209,14285.0,ממשלת ישראל,ממשלתי צמוד 0527,IL0011408478,צמוד למדד המחירים לצרכן בריבית קבועה,ישראל,ישראל,TASE,RF,פנימי,ILS,1.65,2027-05-31,0.0075,0.0209,,80001.28,1.0,117.66,94.12951,,,3e-06,0.024144,0.00205
209,14285.0,ממשלת ישראל,ממשל שקלית 0142,IL0011254005,לא צמוד למדד המחירים לצרכן ריבית קבועה,ישראל,ישראל,TASE,RF,פנימי,ILS,11.17,2042-01-31,0.055,0.0434,,125436.33,1.0,117.0,146.76051,,,4e-06,0.037644,0.003197
209,14285.0,ממשלת ישראל,ממשל שקלית 0226,IL0011746976,לא צמוד למדד המחירים לצרכן ריבית קבועה,ישראל,ישראל,TASE,RF,פנימי,ILS,0.4,2026-02-27,0.005,0.0409,,67819.0,1.0,98.89,67.06622,,,2e-06,0.017202,0.00146
209,14285.0,ממשלת ישראל,מ.ק.מ 216,IL0082602181,לא צמוד למדד המחירים לצרכן ריבית קבועה,ישראל,ישראל,TASE,RF,פנימי,ILS,0.34,2026-02-04,0.0,0.0424,,68062.78,1.0,98.6,67.1099,,,3e-06,0.017214,0.001462
209,14285.0,ממשלת ישראל,ממשל שקלית 327,IL0011393449,לא צמוד למדד המחירים לצרכן ריבית קבועה,ישראל,ישראל,TASE,RF,פנימי,ILS,1.47,2027-03-31,0.02,0.0396,,674.88,1.0,98.22,0.66287,,,0.0,0.00017,1.4e-05
209,14285.0,ממשלת ישראל,ממשלתי צמוד 726,IL0011695645,צמוד למדד המחירים לצרכן בריבית קבועה,ישראל,ישראל,TASE,RF,פנימי,ILS,0.82,2026-07-31,0.001,0.0267,,103999.37,1.0,116.31,120.96167,,,5e-06,0.031027,0.002635
209,14285.0,ממשלת ישראל,מ.ק.מ. 726,IL0082607214,לא צמוד למדד המחירים לצרכן ריבית קבועה,ישראל,ישראל,TASE,RF,פנימי,ILS,0.76,2026-07-08,0.0,0.0414,,298230.92,1.0,96.96,289.1647,,,1.6e-05,0.074173,0.006301
209,14285.0,ממשלת ישראל,ממשל קצרה 02/26,IL0012194689,לא צמוד למדד המחירים לצרכן ריבית קבועה,ישראל,ישראל,TASE,RF,פנימי,ILS,0.4,2026-02-27,0.0,0.0417,,85883.63,1.0,97.18,83.46172,,,1.6e-05,0.021408,0.001818
209,14285.0,ממשלת ישראל,ממשל שקלית 335,IL0012023326,לא צמוד למדד המחירים לצרכן ריבית קבועה,ישראל,ישראל,TASE,RF,פנימי,ILS,7.92,2035-03-30,0.04,0.041,,578.99,1.0,101.25,0.58623,,,0.0,0.00015,1.2e-05
209,14285.0,ממשלת ישראל,ממשל צמודה 1151,IL0011683013,צמוד למדד המחירים לצרכן בריבית קבועה,ישראל,ישראל,TASE,RF,פנימי,ILS,11.99,2051-11-30,0.005,0.0214,,3.58,1.0,80.45,0.00288,,,0.0,0.0,0.0
209,14285.0,ממשלת ישראל,ממשל שקלית 330,IL0011609851,לא צמוד למדד המחירים לצרכן ריבית קבועה,ישראל,ישראל,TASE,RF,פנימי,ILS,4.39,2030-03-31,0.01,0.0393,,2246.83,1.0,88.66,1.99203,,,0.0,0.00051,4.3e-05
209,14285.0,ממשלת ישראל,מ.ק.מ 316,IL0082603171,לא צמוד למדד המחירים לצרכן ריבית קבועה,ישראל,ישראל,TASE,RF,פנימי,ILS,0.42,2026-03-04,0.0,0.0415,,18970.54,1.0,98.32,18.65184,,,1e-06,0.004784,0.000406
209,14285.0,ממשלת ישראל,ממשל שקלית 537,IL0011661803,לא צמוד למדד המחירים לצרכן ריבית קבועה,ישראל,ישראל,TASE,RF,פנימי,ILS,10.55,2037-05-31,0.015,0.0421,,3201.45,1.0,75.94,2.43118,,,0.0,0.000623,5.2e-05
209,14285.0,ממשלת ישראל,ממשלתי שקלי 0229,IL0011948028,לא צמוד למדד המחירים לצרכן ריבית קבועה,ישראל,ישראל,TASE,RF,פנימי,ILS,3.2,2029-02-28,0.0375,0.0391,,8554.29,1.0,101.7,8.69971,,,0.0,0.002231,0.000189
209,14285.0,ממשלת ישראל,ממשל שקלית928,IL0011508798,לא צמוד למדד המחירים לצרכן ריבית קבועה,ישראל,ישראל,TASE,RF,פנימי,ILS,2.92,2028-09-28,0.0225,0.0393,,77364.34,1.0,95.37,73.78238,,,2e-06,0.018925,0.001606
209,14285.0,ממשלת ישראל,מ.ק.מ. 616,IL0082606141,לא צמוד למדד המחירים לצרכן ריבית קבועה,ישראל,ישראל,TASE,RF,פנימי,ILS,0.67,2026-06-03,0.0,0.042,,13393.78,1.0,97.3,13.03215,,,0.0,0.003342,0.000284
209,14285.0,ממשלת ישראל,ממשל צמודה 1028,IL0011973265,צמוד למדד המחירים לצרכן בריבית קבועה,ישראל,ישראל,TASE,RF,פנימי,ILS,3.01,2028-10-31,0.011,0.0199,,15459.94,1.0,105.65,16.33343,,,0.0,0.004189,0.000355
209,14285.0,ממשלת ישראל,ממשלתי צמוד 0545,IL0011348658,צמוד למדד המחירים לצרכן בריבית קבועה,ישראל,ישראל,TASE,RF,פנימי,ILS,17.67,2045-05-31,0.01,0.0207,,16413.23,1.0,99.57,16.34265,,,0.0,0.004192,0.000356
209,14285.0,ממשלת ישראל,ממשלתי צמוד 1131,IL0011722209,צמוד למדד המחירים לצרכן בריבית קבועה,ישראל,ישראל,TASE,RF,פנימי,ILS,6.14,2031-11-30,0.001,0.019,,424758.82,1.0,106.54,452.53805,,,1.2e-05,0.116078,0.009859
209,14285.0,ממשלת ישראל,ממשלתי צמוד 841,IL0011205833,צמוד למדד המחירים לצרכן בריבית קבועה,ישראל,ישראל,TASE,RF,פנימי,ILS,13.23,2041-08-30,0.0275,0.0202,,87.81,1.0,139.93,0.12287,,,0.0,3e-05,1e-06
209,14285.0,ממשלת ישראל,ממשל צמודה 0431,IL0012207226,צמוד למדד המחירים לצרכן בריבית קבועה,ישראל,ישראל,TASE,RF,פנימי,ILS,5.29,2031-04-30,0.02,0.0199,,5636.42,1.0,103.02,5.80663,,,0.0,0.001489,0.000126
209,14285.0,ממשלת ישראל,ממשלתי צמוד 0529,IL0011570236,צמוד למדד המחירים לצרכן בריבית קבועה,ישראל,ישראל,TASE,RF,פנימי,ILS,3.63,2029-05-31,0.005,0.0193,,262209.63,1.0,113.0,296.29689,,,8e-06,0.076002,0.006456
209,14285.0,ממשלת ישראל,מ.ק.מ 416,IL0082604161,לא צמוד למדד המחירים לצרכן ריבית קבועה,ישראל,ישראל,TASE,RF,פנימי,ILS,0.49,2026-04-01,0.0,0.0418,,374560.0,1.0,98.0,367.0688,,,2e-05,0.094157,0.007999
209,14285.0,ממשלת ישראל,ממשל קצרה 11/25,IL0012153263,לא צמוד למדד המחירים לצרכן ריבית קבועה,ישראל,ישראל,TASE,RF,פנימי,ILS,0.16,2025-11-30,0.0,0.0412,,176061.45,1.0,99.36,174.93466,,,2.7e-05,0.044872,0.003812
209,14285.0,ממשלת ישראל,ממשל שקלי 1152,IL0011840761,לא צמוד למדד המחירים לצרכן ריבית קבועה,ישראל,ישראל,TASE,RF,פנימי,ILS,17.24,2052-11-29,0.028,0.0461,,248849.07,1.0,74.63,185.71606,,,9e-06,0.047637,0.004046
209,14285.0,ממשלת ישראל,ממשל שקלי 347,IL0011401937,לא צמוד למדד המחירים לצרכן ריבית קבועה,ישראל,ישראל,TASE,RF,פנימי,ILS,14.44,2047-03-31,0.0375,0.0449,,19231.37,1.0,91.85,17.66401,,,0.0,0.004529,0.000383
209,14285.0,ממשלת ישראל,ממשל שקלית 927,IL0012035791,לא צמוד למדד המחירים לצרכן ריבית קבועה,ישראל,ישראל,TASE,RF,פנימי,ILS,1.96,2027-09-30,0.0375,0.0397,,18522.43,1.0,99.62,18.45204,,,0.0,0.004732,0.000401
209,14285.0,ממשלת ישראל,ממשל שקלית 0432,IL0011806606,לא צמוד למדד המחירים לצרכן ריבית קבועה,ישראל,ישראל,TASE,RF,פנימי,ILS,6.28,2032-04-30,0.013,0.0402,,105.55,1.0,85.09,0.08981,,,0.0,2.3e-05,1e-06
209,14285.0,ממשלת ישראל,ממשל צמודה 1033,IL0012043795,צמוד למדד המחירים לצרכן בריבית קבועה,ישראל,ישראל,TASE,RF,פנימי,ILS,7.53,2033-10-31,0.016,0.0195,,421821.94,1.0,105.4,444.60033,,,1.5e-05,0.114044,0.009687
209,14285.0,ממשלת ישראל,ממשל שקלית 829,IL0012128935,לא צמוד למדד המחירים לצרכן ריבית קבועה,ישראל,ישראל,TASE,RF,פנימי,ILS,3.66,2029-08-31,0.046,0.0394,,31307.4,1.0,102.76,32.17148,,,1e-06,0.008252,0.0007
209,14285.0,REPUBLIC OF BRAZIL,BRAZIL 10 1/4 01/10/28,US105756BN96,"נקוב במט""ח","חו""ל",ברזיל,FOREIGN_GOV_SEC,BB,S&P,BRL,2.03,2028-01-10,0.1025,0.0993,,3465.89,0.6225,103.027,2.22283,,,0.0,0.000569,4.8e-05
209,14285.0,HUNGARY GOVERNMENT BOND,HGB 6 3/4 07/23/31,HU0000407317,"נקוב במט""ח","חו""ל",הונגריה,FOREIGN_GOV_SEC,Baa2,Moodys,HUF,4.86,2031-07-23,0.0675,0.0644,,55686.5,0.009944,104.522,0.57879,,,0.0,0.000148,1.2e-05
209,14285.0,INTL FINANCE CORP,IFC 0 26/05/27,XS1621760302,"נקוב במט""ח","חו""ל",ברזיל,FOREIGN_GOV_SEC,AAA,S&P,BRL,1.63,2027-05-26,0.0,0.1238,,3137.27,0.6225,82.459,1.61038,,,4e-06,0.000413,3.5e-05
209,14285.0,INTL FINANCE CORP,IFC 11 ½ 16/01/30,XS2977993471,"נקוב במט""ח","חו""ל",ברזיל,FOREIGN_GOV_SEC,AAA,S&P,BRL,3.33,2030-01-16,0.115,0.1208,,4862.76,0.6225,106.39,3.2205,,,4e-06,0.000826,7e-05
209,14285.0,MEX BONOS DESARR FIX RT,MBONO 8 1/2 11/18/2038,MX0MGO0000J5,"נקוב במט""ח","חו""ל",מקסיקו,FOREIGN_GOV_SEC,BBB-,Fitch,MXN,7.86,2038-11-18,0.085,-0.282,,419.7,0.1804,9889.2,7.48749,,,0.0,0.00192,0.000163
209,14285.0,TREASURY BILL,B 0 09/03/26,US912797RS85,"נקוב במט""ח","חו""ל","ארה""ב",אחר,AA+,Fitch,USD,0.91,2026-09-03,0.0,0.0365,,27287.4,3.306,96.738,87.26942,,,0.0,0.022385,0.001901
209,14285.0,INTL FINANCE CORP,IFC 0 27/08/30,XS1280871259,"נקוב במט""ח","חו""ל",ברזיל,FOREIGN_GOV_SEC,AAA,S&P,BRL,4.89,2030-08-27,0.0,0.1222,,1725.5,0.6225,56.766,0.60974,,,3e-06,0.000156,1.3e-05
209,14285.0,POLAND GOVERNMENT BOND,POLGB 7 1/2  07/25/2028,PL0000115192,"נקוב במט""ח","חו""ל",פולין,FOREIGN_GOV_SEC,A-,Fitch,PLN,2.6,2028-07-25,0.075,0.0439,,1584.32,0.9092,109.442,1.57647,,,0.0,0.000404,3.4e-05
209,14285.0,MEX BONOS DESARR FIX RT,MBONO 7.5 06/03/27,MX0MGO0000D8,"נקוב במט""ח","חו""ל",מקסיקו,FOREIGN_GOV_SEC,BBB-,Fitch,MXN,1.57,2027-03-06,0.075,-0.9602,,84.31,0.1804,10252.3,1.5594,,,0.0,0.0004,3.3e-05
209,14285.0,INTL BK RECON & DEVELOP,IBRD 10 10/17/29,XS2920414112,"נקוב במט""ח","חו""ל",ברזיל,FOREIGN_GOV_SEC,AAA,S&P,BRL,3.16,2029-10-17,0.1,0.1206,,6431.4,0.6225,103.44,4.14127,,,9e-06,0.001062,9e-05
209,14285.0,POLAND GOVERNMENT BOND,POLGB 6 10/25/2033,PL0000115291,"נקוב במט""ח","חו""ל",פולין,FOREIGN_GOV_SEC,A-,Fitch,PLN,6.31,2033-10-25,0.06,0.0524,,4713.74,0.9092,110.439,4.73312,,,0.0,0.001214,0.000103
209,14285.0,HUNGARY GOVERNMENT BOND,HGB 7 10/24/35 35/A,HU0000406624,"נקוב במט""ח","חו""ל",הונגריה,FOREIGN_GOV_SEC,Baa2,Moodys,HUF,7.09,2035-10-24,0.07,0.068,,109804.36,0.009944,107.901,1.17817,,,0.0,0.000302,2.5e-05
209,14285.0,MEX BONOS DESARR FIX RT,MBONO 7 3/4 29/05/31,MX0MGO0000P2,"נקוב במט""ח","חו""ל",מקסיקו,FOREIGN_GOV_SEC,BBB-,Fitch,MXN,4.59,2031-05-29,0.0775,-0.5479,,316.82,0.1804,9997.6,5.71401,,,0.0,0.001465,0.000124
209,14285.0,AFRICAN DEVELOPMENT BANK,AFDB 0 06/05/34,XS2831196535,"נקוב במט""ח","חו""ל",ברזיל,FOREIGN_GOV_SEC,AAA,S&P,BRL,8.66,2034-06-05,0.0,0.1221,,8705.92,0.6225,36.768,1.99262,,,1.5e-05,0.000511,4.3e-05
209,14285.0,INTL FINANCE CORP,EBRD 0 02/02/32,XS2438631710,"נקוב במט""ח","חו""ל",ברזיל,FOREIGN_GOV_SEC,AAA,S&P,BRL,6.32,2032-02-02,0.0,0.1199,,5176.49,0.6225,48.758,1.57116,,,2e-06,0.000403,3.4e-05
209,14285.0,TREASURY BILL,B 0 10/02/25,US912797MS31,"נקוב במט""ח","חו""ל","ארה""ב",אחר,AA+,Fitch,USD,0.0054,2025-10-02,0.0,0.0203,,2264.74,3.306,99.989,7.4864,,,0.0,0.00192,0.000162
209,14285.0,POLAND GOVERNMENT BOND,POLGB 3 3/4 05/25/27,PL0000114393,"נקוב במט""ח","חו""ל",פולין,FOREIGN_GOV_SEC,A-,Fitch,PLN,1.59,2027-05-25,0.0375,0.1229,,3137.27,0.9092,100.706,2.87254,,,0.0,0.000736,6.2e-05
209,14285.0,MEX BONOS DESARR FIX RT,MBONO 7 1/2 05/26/33,MX0MGO0001D6,"נקוב במט""ח","חו""ל",מקסיקו,FOREIGN_GOV_SEC,BBB-,Fitch,MXN,5.8,2033-05-26,0.075,-0.4421,,437.57,0.1804,9685.8,7.64575,,,0.0,0.001961,0.000166
209,14285.0,HUNGARY GOVERNMENT BOND,HGB 2 1/4 04/20/33,HU0000404744,"נקוב במט""ח","חו""ל",הונגריה,FOREIGN_GOV_SEC,Baa2,Moodys,HUF,6.82,2033-04-20,0.0225,0.067,,611767.16,0.009944,75.239,4.5771,,,0.0,0.001174,9.9e-05
209,14285.0,POLAND GOVERNMENT BOND,POLGB 1 3/4 04/25/32,PL0000113783,"נקוב במט""ח","חו""ל",פולין,FOREIGN_GOV_SEC,A-,Fitch,PLN,6.15,2032-04-24,0.0175,0.048,,8392.19,0.9092,82.619,6.30398,,,0.0,0.001617,0.000137
209,14285.0,POLAND GOVERNMENT BOND,POLGB 5 3/4 04/25/29,PL0000105391,"נקוב במט""ח","חו""ל",פולין,FOREIGN_GOV_SEC,A-,Fitch,PLN,3.24,2029-04-25,0.0575,0.0453,,737.26,0.9092,106.374,0.71304,,,0.0,0.000182,1.5e-05
209,14286.0,TREASURY BILL,B 0 08/06/26,US912797RG48,"נקוב במט""ח","חו""ל","ארה""ב",אחר,AA+,Fitch,USD,0.84,2026-08-06,0.0,0.0371,,124913.57,3.306,96.953,400.38123,,,2e-06,0.999999,0.003415
209,15217.0,ממשלת ישראל,ממשל צמודה 1151,IL0011683013,צמוד למדד המחירים לצרכן בריבית קבועה,ישראל,ישראל,TASE,RF,פנימי,ILS,11.99,2051-11-30,0.005,0.0214,,2.04,1.0,80.45,0.00164,,,0.0,1e-06,0.0
209,15217.0,ממשלת ישראל,ממשל שקלית 927,IL0012035791,לא צמוד למדד המחירים לצרכן ריבית קבועה,ישראל,ישראל,TASE,RF,פנימי,ILS,1.96,2027-09-30,0.0375,0.0397,,10533.47,1.0,99.62,10.49344,,,0.0,0.009121,0.000612
209,15217.0,ממשלת ישראל,ממשל שקלית 327,IL0011393449,לא צמוד למדד המחירים לצרכן ריבית קבועה,ישראל,ישראל,TASE,RF,פנימי,ILS,1.47,2027-03-31,0.02,0.0396,,383.79,1.0,98.22,0.37696,,,0.0,0.000327,2.2e-05
209,15217.0,ממשלת ישראל,ממשל שקלית928,IL0011508798,לא צמוד למדד המחירים לצרכן ריבית קבועה,ישראל,ישראל,TASE,RF,פנימי,ILS,2.92,2028-09-28,0.0225,0.0393,,43996.14,1.0,95.37,41.95911,,,1e-06,0.036472,0.002451
209,15217.0,ממשלת ישראל,ממשלתי שקלי 0229,IL0011948028,לא צמוד למדד המחירים לצרכן ריבית קבועה,ישראל,ישראל,TASE,RF,פנימי,ILS,3.2,2029-02-28,0.0375,0.0391,,4864.72,1.0,101.7,4.94742,,,0.0,0.0043,0.000289
209,15217.0,ממשלת ישראל,ממשלתי צמוד 841,IL0011205833,צמוד למדד המחירים לצרכן בריבית קבועה,ישראל,ישראל,TASE,RF,פנימי,ILS,13.23,2041-08-30,0.0275,0.0202,,49.93,1.0,139.93,0.06988,,,0.0,6e-05,3e-06
209,15217.0,ממשלת ישראל,ממשלתי צמוד 1131,IL0011722209,צמוד למדד המחירים לצרכן בריבית קבועה,ישראל,ישראל,TASE,RF,פנימי,ILS,6.14,2031-11-30,0.001,0.019,,241555.03,1.0,106.54,257.35273,,,7e-06,0.223703,0.015036
209,15217.0,ממשלת ישראל,ממשל צמודה 1028,IL0011973265,צמוד למדד המחירים לצרכן בריבית קבועה,ישראל,ישראל,TASE,RF,פנימי,ILS,3.01,2028-10-31,0.011,0.0199,,8791.88,1.0,105.65,9.28861,,,0.0,0.008073,0.000542
209,15217.0,ממשלת ישראל,ממשל שקלית 335,IL0012023326,לא צמוד למדד המחירים לצרכן ריבית קבועה,ישראל,ישראל,TASE,RF,פנימי,ILS,7.92,2035-03-30,0.04,0.041,,329.27,1.0,101.25,0.33338,,,0.0,0.000289,1.9e-05
209,15217.0,ממשלת ישראל,ממשלתי צמוד 0545,IL0011348658,צמוד למדד המחירים לצרכן בריבית קבועה,ישראל,ישראל,TASE,RF,פנימי,ILS,17.67,2045-05-31,0.01,0.0207,,9334.0,1.0,99.57,9.29386,,,0.0,0.008078,0.000543
209,15217.0,ממשלת ישראל,ממשלתי צמוד 0529,IL0011570236,צמוד למדד המחירים לצרכן בריבית קבועה,ישראל,ישראל,TASE,RF,פנימי,ILS,3.63,2029-05-31,0.005,0.0193,,149115.33,1.0,113.0,168.50032,,,5e-06,0.146468,0.009845
209,15217.0,ממשלת ישראל,ממשלתי צמוד 0527,IL0011408478,צמוד למדד המחירים לצרכן בריבית קבועה,ישראל,ישראל,TASE,RF,פנימי,ILS,1.65,2027-05-31,0.0075,0.0209,,45495.72,1.0,117.66,53.53027,,,1e-06,0.04653,0.003126
209,15217.0,ממשלת ישראל,ממשלתי צמוד 726,IL0011695645,צמוד למדד המחירים לצרכן בריבית קבועה,ישראל,ישראל,TASE,RF,פנימי,ILS,0.82,2026-07-31,0.001,0.0267,,59143.14,1.0,116.31,68.78938,,,2e-06,0.059795,0.004018
209,15217.0,ממשלת ישראל,ממשל שקלי 347,IL0011401937,לא צמוד למדד המחירים לצרכן ריבית קבועה,ישראל,ישראל,TASE,RF,פנימי,ILS,14.44,2047-03-31,0.0375,0.0449,,10936.63,1.0,91.85,10.0453,,,0.0,0.00873,0.000586
209,15217.0,ממשלת ישראל,מ.ק.מ 316,IL0082603171,לא צמוד למדד המחירים לצרכן ריבית קבועה,ישראל,ישראל,TASE,RF,פנימי,ILS,0.42,2026-03-04,0.0,0.0415,,9578.71,1.0,98.32,9.41779,,,0.0,0.008186,0.00055
209,15217.0,ממשלת ישראל,ממשל צמודה 1033,IL0012043795,צמוד למדד המחירים לצרכן בריבית קבועה,ישראל,ישראל,TASE,RF,פנימי,ILS,7.53,2033-10-31,0.016,0.0195,,239884.85,1.0,105.4,252.83863,,,9e-06,0.21978,0.014774
209,15217.0,ממשלת ישראל,ממשל שקלית 0142,IL0011254005,לא צמוד למדד המחירים לצרכן ריבית קבועה,ישראל,ישראל,TASE,RF,פנימי,ILS,11.17,2042-01-31,0.055,0.0434,,71334.06,1.0,117.0,83.46086,,,2e-06,0.072548,0.004875
209,15217.0,ממשלת ישראל,ממשל שקלית 330,IL0011609851,לא צמוד למדד המחירים לצרכן ריבית קבועה,ישראל,ישראל,TASE,RF,פנימי,ILS,4.39,2030-03-31,0.01,0.0393,,1277.75,1.0,88.66,1.13285,,,0.0,0.000983,6.6e-05
209,15217.0,ממשלת ישראל,ממשל צמודה 0431,IL0012207226,צמוד למדד המחירים לצרכן בריבית קבועה,ישראל,ישראל,TASE,RF,פנימי,ILS,5.29,2031-04-30,0.02,0.0199,,3205.36,1.0,103.02,3.30216,,,0.0,0.002869,0.000192
209,15217.0,ממשלת ישראל,ממשל שקלית 0432,IL0011806606,לא צמוד למדד המחירים לצרכן ריבית קבועה,ישראל,ישראל,TASE,RF,פנימי,ILS,6.28,2032-04-30,0.013,0.0402,,60.02,1.0,85.09,0.05107,,,0.0,4.4e-05,2e-06
209,15217.0,ממשלת ישראל,ממשל שקלית 0226,IL0011746976,לא צמוד למדד המחירים לצרכן ריבית קבועה,ישראל,ישראל,TASE,RF,פנימי,ILS,0.4,2026-02-27,0.005,0.0409,,38567.82,1.0,98.89,38.13972,,,1e-06,0.033152,0.002228
209,15217.0,ממשלת ישראל,ממשל שקלית 829,IL0012128935,לא צמוד למדד המחירים לצרכן ריבית קבועה,ישראל,ישראל,TASE,RF,פנימי,ILS,3.66,2029-08-31,0.046,0.0394,,17804.13,1.0,102.76,18.29552,,,0.0,0.015902,0.001068
209,15217.0,ממשלת ישראל,ממשל שקלי 1152,IL0011840761,לא צמוד למדד המחירים לצרכן ריבית קבועה,ישראל,ישראל,TASE,RF,פנימי,ILS,17.24,2052-11-29,0.028,0.0461,,141517.35,1.0,74.63,105.61439,,,5e-06,0.091805,0.00617
209,15217.0,ממשלת ישראל,ממשל שקלית 537,IL0011661803,לא צמוד למדד המחירים לצרכן ריבית קבועה,ישראל,ישראל,TASE,RF,פנימי,ILS,10.55,2037-05-31,0.015,0.0421,,1820.62,1.0,75.94,1.38258,,,0.0,0.001201,8e-05
209,15217.0,TREASURY BILL,B 0 09/03/26,US912797RS85,"נקוב במט""ח","חו""ל","ארה""ב",אחר,AA+,Fitch,USD,0.91,2026-09-03,0.0,0.0365,,560.46,3.306,96.738,1.79245,,,0.0,0.001558,0.000104
209,15218.0,ממשלת ישראל,מ.ק.מ 316,IL0082603171,לא צמוד למדד המחירים לצרכן ריבית קבועה,ישראל,ישראל,TASE,RF,פנימי,ILS,0.42,2026-03-04,0.0,0.0415,,1042483.84,1.0,98.32,1024.97011,,,5.7e-05,1.0,0.002016
209,15219.0,TREASURY BILL,B 0 08/06/26,US912797RG48,"נקוב במט""ח","חו""ל","ארה""ב",אחר,AA+,Fitch,USD,0.84,2026-08-06,0.0,0.0371,,1262363.96,3.306,96.953,4046.21251,,,2.3e-05,1.0,0.004705
209,2187.0,ממשלת ישראל,מ.ק.מ. 616,IL0082606141,לא צמוד למדד המחירים לצרכן ריבית קבועה,ישראל,ישראל,TASE,RF,פנימי,ILS,0.67,2026-06-03,0.0,0.042,,4617096.06,1.0,97.3,4492.43447,,,0.000256,0.007064,0.000338
209,2187.0,ממשלת ישראל,מ.ק.מ. 726,IL0082607214,לא צמוד למדד המחירים לצרכן ריבית קבועה,ישראל,ישראל,TASE,RF,פנימי,ILS,0.76,2026-07-08,0.0,0.0414,,102805960.44,1.0,96.96,99680.65924,,,0.005711,0.15676,0.007513
209,2187.0,ממשלת ישראל,ממשל קצרה 02/26,IL0012194689,לא צמוד למדד המחירים לצרכן ריבית קבועה,ישראל,ישראל,TASE,RF,פנימי,ILS,0.4,2026-02-27,0.0,0.0417,,29605748.15,1.0,97.18,28770.86605,,,0.005666,0.045245,0.002168
209,2187.0,ממשלת ישראל,ממשל קצרה 11/25,IL0012153263,לא צמוד למדד המחירים לצרכן ריבית קבועה,ישראל,ישראל,TASE,RF,פנימי,ILS,0.16,2025-11-30,0.0,0.0412,,60691783.7,1.0,99.36,60303.35628,,,0.009567,0.094834,0.004545
209,2187.0,ממשלת ישראל,מ.ק.מ 216,IL0082602181,לא צמוד למדד המחירים לצרכן ריבית קבועה,ישראל,ישראל,TASE,RF,פנימי,ILS,0.34,2026-02-04,0.0,0.0424,,23462555.41,1.0,98.6,23134.07963,,,0.001303,0.036381,0.001743
209,2187.0,ממשלת ישראל,מ.ק.מ. 516,IL0082605150,לא צמוד למדד המחירים לצרכן ריבית קבועה,ישראל,ישראל,TASE,RF,פנימי,ILS,0.59,2026-05-06,0.0,0.0416,,256607822.05,1.0,97.63,250526.21667,,,0.014255,0.393983,0.018884
209,2187.0,ממשלת ישראל,מ.ק.מ 316,IL0082603171,לא צמוד למדד המחירים לצרכן ריבית קבועה,ישראל,ישראל,TASE,RF,פנימי,ILS,0.42,2026-03-04,0.0,0.0415,,11179706.04,1.0,98.32,10991.88698,,,0.000621,0.017286,0.000828
209,2187.0,ממשלת ישראל,מ.ק.מ 416,IL0082604161,לא צמוד למדד המחירים לצרכן ריבית קבועה,ישראל,ישראל,TASE,RF,פנימי,ILS,0.49,2026-04-01,0.0,0.0418,,129118069.1,1.0,98.0,126535.70772,,,0.007173,0.198993,0.009538
209,2187.0,TREASURY BILL,B 0 10/02/25,US912797MS31,"נקוב במט""ח","חו""ל","ארה""ב",אחר,AA+,Fitch,USD,0.0054,2025-10-02,0.0,0.0203,,740143.7,3.306,99.989,2446.64592,,,2e-06,0.003848,0.000185
209,2187.0,TREASURY BILL,B 0 09/03/26,US912797RS85,"נקוב במט""ח","חו""ל","ארה""ב",אחר,AA+,Fitch,USD,0.91,2026-09-03,0.0,0.0365,,9066760.37,3.306,96.738,28996.93475,,,0.000177,0.045601,0.002185
209,2188.0,ממשלת ישראל,מ.ק.מ 416,IL0082604161,לא צמוד למדד המחירים לצרכן ריבית קבועה,ישראל,ישראל,TASE,RF,פנימי,ILS,0.49,2026-04-01,0.0,0.0418,,93244.83,1.0,98.0,91.37993,,,5e-06,0.006156,0.000449
209,2188.0,ממשלת ישראל,מ.ק.מ 216,IL0082602181,לא צמוד למדד המחירים לצרכן ריבית קבועה,ישראל,ישראל,TASE,RF,פנימי,ILS,0.34,2026-02-04,0.0,0.0424,,16943.89,1.0,98.6,16.70667,,,0.0,0.001125,8.2e-05
209,2188.0,ממשלת ישראל,ממשל קצרה 11/25,IL0012153263,לא צמוד למדד המחירים לצרכן ריבית קבועה,ישראל,ישראל,TASE,RF,פנימי,ILS,0.16,2025-11-30,0.0,0.0412,,43829.61,1.0,99.36,43.5491,,,6e-06,0.002933,0.000214
209,2188.0,ממשלת ישראל,ממשל שקלית928,IL0011508798,לא צמוד למדד המחירים לצרכן ריבית קבועה,ישראל,ישראל,TASE,RF,פנימי,ILS,2.92,2028-09-28,0.0225,0.0393,,514393.75,1.0,95.37,490.57733,,,1.4e-05,0.033049,0.00241
209,2188.0,ממשלת ישראל,ממשל שקלי 1152,IL0011840761,לא צמוד למדד המחירים לצרכן ריבית קבועה,ישראל,ישראל,TASE,RF,פנימי,ILS,17.24,2052-11-29,0.028,0.0461,,1654591.8,1.0,74.63,1234.82185,,,5.9e-05,0.08319,0.006069
209,2188.0,ממשלת ישראל,ממשלתי צמוד 0545,IL0011348658,צמוד למדד המחירים לצרכן בריבית קבועה,ישראל,ישראל,TASE,RF,פנימי,ILS,17.67,2045-05-31,0.01,0.0207,,109131.18,1.0,99.57,108.66192,,,4e-06,0.00732,0.000534
209,2188.0,ממשלת ישראל,ממשל צמודה 1033,IL0012043795,צמוד למדד המחירים לצרכן בריבית קבועה,ישראל,ישראל,TASE,RF,פנימי,ILS,7.53,2033-10-31,0.016,0.0195,,2804684.5,1.0,105.4,2956.13747,,,0.000106,0.199158,0.014532
209,2188.0,ממשלת ישראל,ממשל שקלית 927,IL0012035791,לא צמוד למדד המחירים לצרכן ריבית קבועה,ישראל,ישראל,TASE,RF,פנימי,ILS,1.96,2027-09-30,0.0375,0.0397,,123155.17,1.0,99.62,122.68718,,,3e-06,0.008265,0.000602
209,2188.0,ממשלת ישראל,ממשלתי צמוד 0527,IL0011408478,צמוד למדד המחירים לצרכן בריבית קבועה,ישראל,ישראל,TASE,RF,פנימי,ILS,1.65,2027-05-31,0.0075,0.0209,,531926.7,1.0,117.66,625.86497,,,2.1e-05,0.042164,0.003076
209,2188.0,ממשלת ישראל,ממשל צמודה 0431,IL0012207226,צמוד למדד המחירים לצרכן בריבית קבועה,ישראל,ישראל,TASE,RF,פנימי,ILS,5.29,2031-04-30,0.02,0.0199,,37476.38,1.0,103.02,38.60816,,,5e-06,0.0026,0.000189
209,2188.0,ממשלת ישראל,ממשל שקלית 0226,IL0011746976,לא צמוד למדד המחירים לצרכן ריבית קבועה,ישראל,ישראל,TASE,RF,פנימי,ILS,0.4,2026-02-27,0.005,0.0409,,450927.02,1.0,98.89,445.92173,,,1.8e-05,0.030041,0.002192
209,2188.0,ממשלת ישראל,ממשלתי צמוד 841,IL0011205833,צמוד למדד המחירים לצרכן בריבית קבועה,ישראל,ישראל,TASE,RF,פנימי,ILS,13.23,2041-08-30,0.0275,0.0202,,583.82,1.0,139.93,0.81695,,,0.0,5.4e-05,3e-06
209,2188.0,ממשלת ישראל,ממשל שקלית 537,IL0011661803,לא צמוד למדד המחירים לצרכן ריבית קבועה,ישראל,ישראל,TASE,RF,פנימי,ILS,10.55,2037-05-31,0.015,0.0421,,21286.34,1.0,75.94,16.16485,,,0.0,0.001089,7.9e-05
209,2188.0,ממשלת ישראל,ממשלתי צמוד 1131,IL0011722209,צמוד למדד המחירים לצרכן בריבית קבועה,ישראל,ישראל,TASE,RF,פנימי,ILS,6.14,2031-11-30,0.001,0.019,,2824211.81,1.0,106.54,3008.91524,,,8.2e-05,0.202712,0.014791
209,2188.0,ממשלת ישראל,ממשלתי צמוד 726,IL0011695645,צמוד למדד המחירים לצרכן בריבית קבועה,ישראל,ישראל,TASE,RF,פנימי,ILS,0.82,2026-07-31,0.001,0.0267,,691489.45,1.0,116.31,804.27138,,,3.4e-05,0.054184,0.003953
209,2188.0,ממשלת ישראל,ממשל שקלית 330,IL0011609851,לא צמוד למדד המחירים לצרכן ריבית קבועה,ישראל,ישראל,TASE,RF,פנימי,ILS,4.39,2030-03-31,0.01,0.0393,,14939.12,1.0,88.66,13.24502,,,0.0,0.000891,6.5e-05
209,2188.0,ממשלת ישראל,ממשלתי שקלי 0229,IL0011948028,לא צמוד למדד המחירים לצרכן ריבית קבועה,ישראל,ישראל,TASE,RF,פנימי,ILS,3.2,2029-02-28,0.0375,0.0391,,56877.25,1.0,101.7,57.84416,,,1e-06,0.003897,0.000284
209,2188.0,ממשלת ישראל,ממשל שקלית 829,IL0012128935,לא צמוד למדד המחירים לצרכן ריבית קבועה,ישראל,ישראל,TASE,RF,פנימי,ILS,3.66,2029-08-31,0.046,0.0394,,208162.2,1.0,102.76,213.90748,,,1.1e-05,0.014411,0.00105
209,2188.0,ממשלת ישראל,מ.ק.מ. 726,IL0082607214,לא צמוד למדד המחירים לצרכן ריבית קבועה,ישראל,ישראל,TASE,RF,פנימי,ILS,0.76,2026-07-08,0.0,0.0414,,74243.09,1.0,96.96,71.98609,,,4e-06,0.004848,0.000353
209,2188.0,ממשלת ישראל,מ.ק.מ. 616,IL0082606141,לא צמוד למדד המחירים לצרכן ריבית קבועה,ישראל,ישראל,TASE,RF,פנימי,ILS,0.67,2026-06-03,0.0,0.042,,3334.32,1.0,97.3,3.24429,,,0.0,0.000218,1.5e-05
209,2188.0,ממשלת ישראל,ממשל קצרה 02/26,IL0012194689,לא צמוד למדד המחירים לצרכן ריבית קבועה,ישראל,ישראל,TASE,RF,פנימי,ILS,0.4,2026-02-27,0.0,0.0417,,21380.3,1.0,97.18,20.77737,,,4e-06,0.001399,0.000102
209,2188.0,ממשלת ישראל,ממשל שקלית 327,IL0011393449,לא צמוד למדד המחירים לצרכן ריבית קבועה,ישראל,ישראל,TASE,RF,פנימי,ILS,1.47,2027-03-31,0.02,0.0396,,4487.25,1.0,98.22,4.40738,,,0.0,0.000296,2.1e-05
209,2188.0,ממשלת ישראל,ממשל שקלית 0432,IL0011806606,לא צמוד למדד המחירים לצרכן ריבית קבועה,ישראל,ישראל,TASE,RF,פנימי,ILS,6.28,2032-04-30,0.013,0.0402,,701.79,1.0,85.09,0.59715,,,0.0,4e-05,2e-06
209,2188.0,ממשלת ישראל,ממשל שקלית 0142,IL0011254005,לא צמוד למדד המחירים לצרכן ריבית קבועה,ישראל,ישראל,TASE,RF,פנימי,ILS,11.17,2042-01-31,0.055,0.0434,,834023.33,1.0,117.0,975.80729,,,2.6e-05,0.065739,0.004796
209,2188.0,ממשלת ישראל,ממשל שקלית 335,IL0012023326,לא צמוד למדד המחירים לצרכן ריבית קבועה,ישראל,ישראל,TASE,RF,פנימי,ILS,7.92,2035-03-30,0.04,0.041,,3849.72,1.0,101.25,3.89784,,,0.0,0.000262,1.9e-05
209,2188.0,ממשלת ישראל,ממשל שקלי 347,IL0011401937,לא צמוד למדד המחירים לצרכן ריבית קבועה,ישראל,ישראל,TASE,RF,פנימי,ILS,14.44,2047-03-31,0.0375,0.0449,,127868.94,1.0,91.85,117.44762,,,4e-06,0.007911,0.000576
209,2188.0,ממשלת ישראל,ממשלתי צמוד 0529,IL0011570236,צמוד למדד המחירים לצרכן בריבית קבועה,ישראל,ישראל,TASE,RF,פנימי,ILS,3.63,2029-05-31,0.005,0.0193,,1743425.9,1.0,113.0,1970.07126,,,5.9e-05,0.132724,0.009683
209,2188.0,ממשלת ישראל,מ.ק.מ 316,IL0082603171,לא צמוד למדד המחירים לצרכן ריבית קבועה,ישראל,ישראל,TASE,RF,פנימי,ILS,0.42,2026-03-04,0.0,0.0415,,237.57,1.0,98.32,0.23358,,,0.0,1.5e-05,1e-06
209,2188.0,ממשלת ישראל,ממשל צמודה 1151,IL0011683013,צמוד למדד המחירים לצרכן בריבית קבועה,ישראל,ישראל,TASE,RF,פנימי,ILS,11.99,2051-11-30,0.005,0.0214,,23.81,1.0,80.45,0.01916,,,0.0,1e-06,0.0
209,2188.0,ממשלת ישראל,ממשל צמודה 1028,IL0011973265,צמוד למדד המחירים לצרכן בריבית קבועה,ישראל,ישראל,TASE,RF,פנימי,ILS,3.01,2028-10-31,0.011,0.0199,,102792.8,1.0,105.65,108.60059,,,3e-06,0.007315,0.000533
209,2188.0,ממשלת ישראל,מ.ק.מ. 516,IL0082605150,לא צמוד למדד המחירים לצרכן ריבית קבועה,ישראל,ישראל,TASE,RF,פנימי,ILS,0.59,2026-05-06,0.0,0.0416,,185313.74,1.0,97.63,180.9218,,,1e-05,0.012188,0.000889
209,2188.0,REPUBLIC OF BRAZIL,BRAZIL 10 1/4 01/10/28,US105756BN96,"נקוב במט""ח","חו""ל",ברזיל,FOREIGN_GOV_SEC,BB,S&P,BRL,2.03,2028-01-10,0.1025,0.0993,,60035.34,0.6225,103.027,38.50325,,,1.2e-05,0.002593,0.000189
209,2188.0,MEX BONOS DESARR FIX RT,MBONO 7 3/4 29/05/31,MX0MGO0000P2,"נקוב במט""ח","חו""ל",מקסיקו,FOREIGN_GOV_SEC,BBB-,Fitch,MXN,4.59,2031-05-29,0.0775,-0.5479,,5487.82,0.1804,9997.6,98.97652,,,0.0,0.006668,0.000486
209,2188.0,POLAND GOVERNMENT BOND,POLGB 5 3/4 04/25/29,PL0000105391,"נקוב במט""ח","חו""ל",פולין,FOREIGN_GOV_SEC,A-,Fitch,PLN,3.24,2029-04-25,0.0575,0.0453,,12770.59,0.9092,106.374,12.3511,,,0.0,0.000832,6e-05
209,2188.0,POLAND GOVERNMENT BOND,POLGB 1 3/4 04/25/32,PL0000113783,"נקוב במט""ח","חו""ל",פולין,FOREIGN_GOV_SEC,A-,Fitch,PLN,6.15,2032-04-24,0.0175,0.048,,145367.32,0.9092,82.619,109.19586,,,2e-06,0.007356,0.000536
209,2188.0,TREASURY BILL,B 0 10/02/25,US912797MS31,"נקוב במט""ח","חו""ל","ארה""ב",אחר,AA+,Fitch,USD,0.0054,2025-10-02,0.0,0.0203,,2572.37,3.306,99.989,8.50331,,,0.0,0.000572,4.1e-05
209,2188.0,MEX BONOS DESARR FIX RT,MBONO 8 1/2 11/18/2038,MX0MGO0000J5,"נקוב במט""ח","חו""ל",מקסיקו,FOREIGN_GOV_SEC,BBB-,Fitch,MXN,7.86,2038-11-18,0.085,-0.282,,7269.92,0.1804,9889.2,129.69628,,,0.0,0.008737,0.000637
209,2188.0,HUNGARY GOVERNMENT BOND,HGB 6 3/4 07/23/31,HU0000407317,"נקוב במט""ח","חו""ל",הונגריה,FOREIGN_GOV_SEC,Baa2,Moodys,HUF,4.86,2031-07-23,0.0675,0.0644,,964586.91,0.009944,104.522,10.0256,,,4e-06,0.000675,4.9e-05
209,2188.0,INTL FINANCE CORP,IFC 0 27/08/30,XS1280871259,"נקוב במט""ח","חו""ל",ברזיל,FOREIGN_GOV_SEC,AAA,S&P,BRL,4.89,2030-08-27,0.0,0.1222,,29888.61,0.6225,56.766,10.56169,,,5.6e-05,0.000711,5.1e-05
209,2188.0,POLAND GOVERNMENT BOND,POLGB 3 3/4 05/25/27,PL0000114393,"נקוב במט""ח","חו""ל",פולין,FOREIGN_GOV_SEC,A-,Fitch,PLN,1.59,2027-05-25,0.0375,0.1229,,54342.92,0.9092,100.706,49.75741,,,1e-06,0.003352,0.000244
209,2188.0,INTL FINANCE CORP,EBRD 0 02/02/32,XS2438631710,"נקוב במט""ח","חו""ל",ברזיל,FOREIGN_GOV_SEC,AAA,S&P,BRL,6.32,2032-02-02,0.0,0.1199,,89665.83,0.6225,48.758,27.21524,,,4.4e-05,0.001833,0.000133
209,2188.0,TREASURY BILL,B 0 09/03/26,US912797RS85,"נקוב במט""ח","חו""ל","ארה""ב",אחר,AA+,Fitch,USD,0.91,2026-09-03,0.0,0.0365,,13100.53,3.306,96.738,41.89755,,,0.0,0.002821,0.000205
209,2188.0,INTL BK RECON & DEVELOP,IBRD 10 10/17/29,XS2920414112,"נקוב במט""ח","חו""ל",ברזיל,FOREIGN_GOV_SEC,AAA,S&P,BRL,3.16,2029-10-17,0.1,0.1206,,111403.0,0.6225,103.44,71.73395,,,0.000171,0.004832,0.000352
209,2188.0,HUNGARY GOVERNMENT BOND,HGB 2 1/4 04/20/33,HU0000404744,"נקוב במט""ח","חו""ל",הונגריה,FOREIGN_GOV_SEC,Baa2,Moodys,HUF,6.82,2033-04-20,0.0225,0.067,,10596870.3,0.009944,75.239,79.28331,,,8e-06,0.005341,0.000389
209,2188.0,AFRICAN DEVELOPMENT BANK,AFDB 0 06/05/34,XS2831196535,"נקוב במט""ח","חו""ל",ברזיל,FOREIGN_GOV_SEC,AAA,S&P,BRL,8.66,2034-06-05,0.0,0.1221,,150801.62,0.6225,36.768,34.51559,,,0.000274,0.002325,0.000169
209,2188.0,INTL FINANCE CORP,IFC 0 26/05/27,XS1621760302,"נקוב במט""ח","חו""ל",ברזיל,FOREIGN_GOV_SEC,AAA,S&P,BRL,1.63,2027-05-26,0.0,0.1238,,54342.92,0.6225,82.459,27.89462,,,7.4e-05,0.001879,0.000137
209,2188.0,POLAND GOVERNMENT BOND,POLGB 6 10/25/2033,PL0000115291,"נקוב במט""ח","חו""ל",פולין,FOREIGN_GOV_SEC,A-,Fitch,PLN,6.31,2033-10-25,0.06,0.0524,,81650.24,0.9092,110.439,81.98594,,,1e-06,0.005523,0.000403
209,2188.0,POLAND GOVERNMENT BOND,POLGB 7 1/2  07/25/2028,PL0000115192,"נקוב במט""ח","חו""ל",פולין,FOREIGN_GOV_SEC,A-,Fitch,PLN,2.6,2028-07-25,0.075,0.0439,,27443.18,0.9092,109.442,27.30724,,,0.0,0.001839,0.000134
209,2188.0,INTL FINANCE CORP,IFC 11 ½ 16/01/30,XS2977993471,"נקוב במט""ח","חו""ל",ברזיל,FOREIGN_GOV_SEC,AAA,S&P,BRL,3.33,2030-01-16,0.115,0.1208,,84231.53,0.6225,106.39,55.78467,,,8.6e-05,0.003758,0.000274
209,2188.0,MEX BONOS DESARR FIX RT,MBONO 7 1/2 05/26/33,MX0MGO0001D6,"נקוב במט""ח","חו""ל",מקסיקו,FOREIGN_GOV_SEC,BBB-,Fitch,MXN,5.8,2033-05-26,0.075,-0.4421,,7579.48,0.1804,9685.8,132.43763,,,0.0,0.008922,0.000651
209,2188.0,HUNGARY GOVERNMENT BOND,HGB 7 10/24/35 35/A,HU0000406624,"נקוב במט""ח","חו""ל",הונגריה,FOREIGN_GOV_SEC,Baa2,Moodys,HUF,7.09,2035-10-24,0.07,0.068,,1902002.36,0.009944,107.901,20.40787,,,1e-06,0.001374,0.0001
209,2188.0,MEX BONOS DESARR FIX RT,MBONO 7.5 06/03/27,MX0MGO0000D8,"נקוב במט""ח","חו""ל",מקסיקו,FOREIGN_GOV_SEC,BBB-,Fitch,MXN,1.57,2027-03-06,0.075,-0.9602,,1460.47,0.1804,10252.3,27.01154,,,0.0,0.001819,0.000132
209,2189.0,ממשלת ישראל,מ.ק.מ. 516,IL0082605150,לא צמוד למדד המחירים לצרכן ריבית קבועה,ישראל,ישראל,TASE,RF,פנימי,ILS,0.59,2026-05-06,0.0,0.0416,,3382842.84,1.0,97.63,3302.66946,,,0.000187,0.039213,0.021741
209,2189.0,ממשלת ישראל,מ.ק.מ 216,IL0082602181,לא צמוד למדד המחירים לצרכן ריבית קבועה,ישראל,ישראל,TASE,RF,פנימי,ILS,0.34,2026-02-04,0.0,0.0424,,6715502.7,1.0,98.6,6621.48566,,,0.000373,0.078617,0.043588
209,2189.0,ממשלת ישראל,ממשל שקלית 0226,IL0011746976,לא צמוד למדד המחירים לצרכן ריבית קבועה,ישראל,ישראל,TASE,RF,פנימי,ILS,0.4,2026-02-27,0.005,0.0409,,39889902.1,1.0,98.89,39447.12419,,,0.00161,0.468362,0.259677
209,2189.0,ממשלת ישראל,מ.ק.מ 316,IL0082603171,לא צמוד למדד המחירים לצרכן ריבית קבועה,ישראל,ישראל,TASE,RF,פנימי,ILS,0.42,2026-03-04,0.0,0.0415,,10911734.07,1.0,98.32,10728.41694,,,0.000606,0.12738,0.070624
209,2189.0,ממשלת ישראל,מ.ק.מ. 816,IL0082608121,לא צמוד למדד המחירים לצרכן ריבית קבועה,ישראל,ישראל,TASE,RF,פנימי,ILS,0.84,2026-08-05,0.0,0.041,,9873285.25,1.0,96.69,9546.47951,,,0.000548,0.113346,0.062843
209,2189.0,ממשלת ישראל,ממשל שקלית 927,IL0012035791,לא צמוד למדד המחירים לצרכן ריבית קבועה,ישראל,ישראל,TASE,RF,פנימי,ILS,1.96,2027-09-30,0.0375,0.0397,,2275263.82,1.0,99.62,2266.61782,,,6.2e-05,0.026911,0.014921
209,2189.0,ממשלת ישראל,מ.ק.מ. 1016,IL0082610184,לא צמוד למדד המחירים לצרכן ריבית קבועה,ישראל,ישראל,TASE,RF,פנימי,ILS,1.0191,2026-10-07,0.0,0.0412,,742651.31,1.0,95.9726,712.74177,,,4.1e-05,0.008462,0.004691
209,2189.0,ממשלת ישראל,מ.ק.מ. 616,IL0082606141,לא צמוד למדד המחירים לצרכן ריבית קבועה,ישראל,ישראל,TASE,RF,פנימי,ILS,0.67,2026-06-03,0.0,0.042,,263253.1,1.0,97.3,256.14526,,,1.4e-05,0.003041,0.001686
209,2189.0,ממשלת ישראל,ממשל קצרה 11/25,IL0012153263,לא צמוד למדד המחירים לצרכן ריבית קבועה,ישראל,ישראל,TASE,RF,פנימי,ILS,0.16,2025-11-30,0.0,0.0412,,7205991.57,1.0,99.36,7159.87322,,,0.001135,0.08501,0.047132
209,2189.0,ממשלת ישראל,מ.ק.מ. 116,IL0082601191,לא צמוד למדד המחירים לצרכן ריבית קבועה,ישראל,ישראל,TASE,RF,פנימי,ILS,0.26,2026-01-07,0.0,0.0426,,4228100.93,1.0,98.91,4182.01463,,,0.000264,0.049653,0.027529
209,2201.0,ממשלת ישראל,ממשל צמודה 1151,IL0011683013,צמוד למדד המחירים לצרכן בריבית קבועה,ישראל,ישראל,TASE,RF,פנימי,ILS,11.99,2051-11-30,0.005,0.0214,,6676767.0,1.0,80.45,5371.45905,,,0.00021,0.026017,0.009976
209,2201.0,ממשלת ישראל,ממשלתי צמוד 841,IL0011205833,צמוד למדד המחירים לצרכן בריבית קבועה,ישראל,ישראל,TASE,RF,פנימי,ILS,13.23,2041-08-30,0.0275,0.0202,,31019680.0,1.0,139.93,43405.83822,,,0.001537,0.210244,0.08062
209,2201.0,ממשלת ישראל,ממשלתי צמוד 0527,IL0011408478,צמוד למדד המחירים לצרכן בריבית קבועה,ישראל,ישראל,TASE,RF,פנימי,ILS,1.65,2027-05-31,0.0075,0.0209,,15639640.0,1.0,117.66,18401.60042,,,0.000642,0.089131,0.034178
209,2201.0,ממשלת ישראל,ממשל צמודה 1033,IL0012043795,צמוד למדד המחירים לצרכן בריבית קבועה,ישראל,ישראל,TASE,RF,פנימי,ILS,7.53,2033-10-31,0.016,0.0195,,18300000.0,1.0,105.4,19288.2,,,0.000691,0.093425,0.035825
209,2201.0,ממשלת ישראל,ממשלתי צמוד 0529,IL0011570236,צמוד למדד המחירים לצרכן בריבית קבועה,ישראל,ישראל,TASE,RF,פנימי,ILS,3.63,2029-05-31,0.005,0.0193,,13663369.0,1.0,113.0,15439.60697,,,0.000464,0.074784,0.028676
209,2201.0,ממשלת ישראל,ממשלתי צמוד 0545,IL0011348658,צמוד למדד המחירים לצרכן בריבית קבועה,ישראל,ישראל,TASE,RF,פנימי,ILS,17.67,2045-05-31,0.01,0.0207,,63590116.0,1.0,99.57,63316.6785,,,0.002785,0.306686,0.117601
209,2201.0,ממשלת ישראל,ממשלתי צמוד 1131,IL0011722209,צמוד למדד המחירים לצרכן בריבית קבועה,ישראל,ישראל,TASE,RF,פנימי,ILS,6.14,2031-11-30,0.001,0.019,,38700000.0,1.0,106.54,41230.98,,,0.00113,0.199709,0.07658
209,9974.0,ממשלת ישראל,ממשל קצרה 11/25,IL0012153263,לא צמוד למדד המחירים לצרכן ריבית קבועה,ישראל,ישראל,TASE,RF,פנימי,ILS,0.16,2025-11-30,0.0,0.0412,,157900926.47,1.0,99.36,156890.36055,,,0.024891,0.088731,0.002681
209,9974.0,ממשלת ישראל,מ.ק.מ 416,IL0082604161,לא צמוד למדד המחירים לצרכן ריבית קבועה,ישראל,ישראל,TASE,RF,פנימי,ILS,0.49,2026-04-01,0.0,0.0418,,335924592.97,1.0,98.0,329206.10111,,,0.018662,0.186186,0.005627
209,9974.0,ממשלת ישראל,מ.ק.מ. 516,IL0082605150,לא צמוד למדד המחירים לצרכן ריבית קבועה,ישראל,ישראל,TASE,RF,פנימי,ILS,0.59,2026-05-06,0.0,0.0416,,667612819.62,1.0,97.63,651790.3958,,,0.037089,0.368627,0.011141
209,9974.0,ממשלת ישראל,ממשל קצרה 02/26,IL0012194689,לא צמוד למדד המחירים לצרכן ריבית קבועה,ישראל,ישראל,TASE,RF,פנימי,ILS,0.4,2026-02-27,0.0,0.0417,,77024842.18,1.0,97.18,74852.74163,,,0.014742,0.042333,0.001279
209,9974.0,ממשלת ישראל,מ.ק.מ 316,IL0082603171,לא צמוד למדד המחירים לצרכן ריבית קבועה,ישראל,ישראל,TASE,RF,פנימי,ILS,0.42,2026-03-04,0.0,0.0415,,37709213.64,1.0,98.32,37075.69885,,,0.002094,0.020968,0.000633
209,9974.0,ממשלת ישראל,מ.ק.מ 216,IL0082602181,לא צמוד למדד המחירים לצרכן ריבית קבועה,ישראל,ישראל,TASE,RF,פנימי,ILS,0.34,2026-02-04,0.0,0.0424,,61042187.43,1.0,98.6,60187.59681,,,0.003391,0.034039,0.001028
209,9974.0,ממשלת ישראל,מ.ק.מ. 616,IL0082606141,לא צמוד למדד המחירים לצרכן ריבית קבועה,ישראל,ישראל,TASE,RF,פנימי,ILS,0.67,2026-06-03,0.0,0.042,,12012231.34,1.0,97.3,11687.90109,,,0.000667,0.00661,0.000199
209,9974.0,ממשלת ישראל,מ.ק.מ. 726,IL0082607214,לא צמוד למדד המחירים לצרכן ריבית קבועה,ישראל,ישראל,TASE,RF,פנימי,ILS,0.76,2026-07-08,0.0,0.0414,,267468764.48,1.0,96.96,259337.71404,,,0.014859,0.146671,0.004432
209,9974.0,TREASURY BILL,B 0 10/02/25,US912797MS31,"נקוב במט""ח","חו""ל","ארה""ב",אחר,AA+,Fitch,USD,0.0054,2025-10-02,0.0,0.0203,,1925621.06,3.306,99.989,6365.40294,,,6e-06,0.0036,0.000109
209,9974.0,TREASURY BILL,B 0 08/06/26,US912797RG48,"נקוב במט""ח","חו""ל","ארה""ב",אחר,AA+,Fitch,USD,0.84,2026-08-06,0.0,0.0371,,1926291.0,3.306,96.953,6174.27541,,,3.6e-05,0.003491,0.000105
209,9974.0,TREASURY BILL,B 0 09/03/26,US912797RS85,"נקוב במט""ח","חו""ל","ארה""ב",אחר,AA+,Fitch,USD,0.91,2026-09-03,0.0,0.0365,,54588857.92,3.306,96.738,174583.80795,,,0.00107,0.098737,0.002983
209,9975.0,ממשלת ישראל,ממשל צמודה 1033,IL0012043795,צמוד למדד המחירים לצרכן בריבית קבועה,ישראל,ישראל,TASE,RF,פנימי,ILS,7.53,2033-10-31,0.016,0.0195,,33982124.39,1.0,105.4,35817.15911,,,0.001284,0.067683,0.002616
209,9975.0,ממשלת ישראל,ממשל שקלית 829,IL0012128935,לא צמוד למדד המחירים לצרכן ריבית קבועה,ישראל,ישראל,TASE,RF,פנימי,ILS,3.66,2029-08-31,0.046,0.0394,,2522135.34,1.0,102.76,2591.74627,,,0.000133,0.004897,0.000189
209,9975.0,ממשלת ישראל,ממשל שקלי 347,IL0011401937,לא צמוד למדד המחירים לצרכן ריבית קבועה,ישראל,ישראל,TASE,RF,פנימי,ILS,14.44,2047-03-31,0.0375,0.0449,,1549285.94,1.0,91.85,1423.01913,,,5.9e-05,0.002688,0.000103
209,9975.0,ממשלת ישראל,ממשל שקלית 0226,IL0011746976,לא צמוד למדד המחירים לצרכן ריבית קבועה,ישראל,ישראל,TASE,RF,פנימי,ILS,0.4,2026-02-27,0.005,0.0409,,5463522.99,1.0,98.89,5402.87788,,,0.00022,0.010209,0.000394
209,9975.0,ממשלת ישראל,ממשלתי צמוד 0529,IL0011570236,צמוד למדד המחירים לצרכן בריבית קבועה,ישראל,ישראל,TASE,RF,פנימי,ILS,3.63,2029-05-31,0.005,0.0193,,21123700.57,1.0,113.0,23869.78166,,,0.000717,0.045105,0.001742
209,9975.0,ממשלת ישראל,ממשלתי שקלי 0229,IL0011948028,לא צמוד למדד המחירים לצרכן ריבית קבועה,ישראל,ישראל,TASE,RF,פנימי,ILS,3.2,2029-02-28,0.0375,0.0391,,689136.28,1.0,101.7,700.8516,,,1.9e-05,0.001324,5.1e-05
209,9975.0,ממשלת ישראל,ממשל קצרה 11/25,IL0012153263,לא צמוד למדד המחירים לצרכן ריבית קבועה,ישראל,ישראל,TASE,RF,פנימי,ILS,0.16,2025-11-30,0.0,0.0412,,30903568.43,1.0,99.36,30705.78559,,,0.004871,0.058024,0.002243
209,9975.0,ממשלת ישראל,ממשל צמודה 0431,IL0012207226,צמוד למדד המחירים לצרכן בריבית קבועה,ישראל,ישראל,TASE,RF,פנימי,ILS,5.29,2031-04-30,0.02,0.0199,,454071.32,1.0,103.02,467.78427,,,6.2e-05,0.000883,3.3e-05
209,9975.0,ממשלת ישראל,ממשל שקלית 537,IL0011661803,לא צמוד למדד המחירים לצרכן ריבית קבועה,ישראל,ישראל,TASE,RF,פנימי,ILS,10.55,2037-05-31,0.015,0.0421,,257909.64,1.0,75.94,195.85658,,,6e-06,0.00037,1.4e-05
209,9975.0,ממשלת ישראל,מ.ק.מ 316,IL0082603171,לא צמוד למדד המחירים לצרכן ריבית קבועה,ישראל,ישראל,TASE,RF,פנימי,ILS,0.42,2026-03-04,0.0,0.0415,,7494331.5,1.0,98.32,7368.42673,,,0.000416,0.013924,0.000538
209,9975.0,ממשלת ישראל,מ.ק.מ. 516,IL0082605150,לא צמוד למדד המחירים לצרכן ריבית קבועה,ישראל,ישראל,TASE,RF,פנימי,ILS,0.59,2026-05-06,0.0,0.0416,,130661794.82,1.0,97.63,127565.11028,,,0.007258,0.241059,0.009318
209,9975.0,ממשלת ישראל,ממשלתי צמוד 0545,IL0011348658,צמוד למדד המחירים לצרכן בריבית קבועה,ישראל,ישראל,TASE,RF,פנימי,ILS,17.67,2045-05-31,0.01,0.0207,,1322255.47,1.0,99.57,1316.56977,,,5.7e-05,0.002487,9.6e-05
209,9975.0,ממשלת ישראל,ממשל שקלית 335,IL0012023326,לא צמוד למדד המחירים לצרכן ריבית קבועה,ישראל,ישראל,TASE,RF,פנימי,ILS,7.92,2035-03-30,0.04,0.041,,46644.0,1.0,101.25,47.22705,,,1e-06,8.9e-05,3e-06
209,9975.0,ממשלת ישראל,ממשל שקלי 1152,IL0011840761,לא צמוד למדד המחירים לצרכן ריבית קבועה,ישראל,ישראל,TASE,RF,פנימי,ILS,17.24,2052-11-29,0.028,0.0461,,20047368.78,1.0,74.63,14961.35132,,,0.000725,0.028271,0.001092
209,9975.0,ממשלת ישראל,ממשל שקלית 0142,IL0011254005,לא צמוד למדד המחירים לצרכן ריבית קבועה,ישראל,ישראל,TASE,RF,פנימי,ILS,11.17,2042-01-31,0.055,0.0434,,10105195.27,1.0,117.0,11823.07847,,,0.000326,0.022341,0.000862
209,9975.0,ממשלת ישראל,מ.ק.מ 216,IL0082602181,לא צמוד למדד המחירים לצרכן ריבית קבועה,ישראל,ישראל,TASE,RF,פנימי,ILS,0.34,2026-02-04,0.0,0.0424,,11946867.31,1.0,98.6,11779.61117,,,0.000663,0.022259,0.00086
209,9975.0,ממשלת ישראל,מ.ק.מ. 726,IL0082607214,לא צמוד למדד המחירים לצרכן ריבית קבועה,ישראל,ישראל,TASE,RF,פנימי,ILS,0.76,2026-07-08,0.0,0.0414,,52347629.94,1.0,96.96,50756.26199,,,0.002908,0.095913,0.003707
209,9975.0,ממשלת ישראל,ממשל צמודה 1151,IL0011683013,צמוד למדד המחירים לצרכן בריבית קבועה,ישראל,ישראל,TASE,RF,פנימי,ILS,11.99,2051-11-30,0.005,0.0214,,288.55,1.0,80.45,0.23214,,,0.0,0.0,0.0
209,9975.0,ממשלת ישראל,מ.ק.מ 416,IL0082604161,לא צמוד למדד המחירים לצרכן ריבית קבועה,ישראל,ישראל,TASE,RF,פנימי,ILS,0.49,2026-04-01,0.0,0.0418,,65745457.47,1.0,98.0,64430.54832,,,0.003652,0.121754,0.004706
209,9975.0,ממשלת ישראל,ממשל שקלית928,IL0011508798,לא צמוד למדד המחירים לצרכן ריבית קבועה,ישראל,ישראל,TASE,RF,פנימי,ILS,2.92,2028-09-28,0.0225,0.0393,,6232498.71,1.0,95.37,5943.93403,,,0.000179,0.01123,0.000433
209,9975.0,ממשלת ישראל,ממשל קצרה 02/26,IL0012194689,לא צמוד למדד המחירים לצרכן ריבית קבועה,ישראל,ישראל,TASE,RF,פנימי,ILS,0.4,2026-02-27,0.0,0.0417,,15074911.43,1.0,97.18,14649.79893,,,0.002885,0.027683,0.00107
209,9975.0,ממשלת ישראל,ממשלתי צמוד 0527,IL0011408478,צמוד למדד המחירים לצרכן בריבית קבועה,ישראל,ישראל,TASE,RF,פנימי,ILS,1.65,2027-05-31,0.0075,0.0209,,6444931.48,1.0,117.66,7583.10637,,,0.000264,0.014328,0.000552
209,9975.0,ממשלת ישראל,ממשל שקלית 927,IL0012035791,לא צמוד למדד המחירים לצרכן ריבית קבועה,ישראל,ישראל,TASE,RF,פנימי,ILS,1.96,2027-09-30,0.0375,0.0397,,1492172.96,1.0,99.62,1486.5027,,,4.1e-05,0.002808,0.000108
209,9975.0,ממשלת ישראל,מ.ק.מ. 616,IL0082606141,לא צמוד למדד המחירים לצרכן ריבית קבועה,ישראל,ישראל,TASE,RF,פנימי,ILS,0.67,2026-06-03,0.0,0.042,,2350972.99,1.0,97.3,2287.49672,,,0.00013,0.004322,0.000167
209,9975.0,ממשלת ישראל,ממשלתי צמוד 726,IL0011695645,צמוד למדד המחירים לצרכן בריבית קבועה,ישראל,ישראל,TASE,RF,פנימי,ILS,0.82,2026-07-31,0.001,0.0267,,8378225.95,1.0,116.31,9744.7146,,,0.000414,0.018413,0.000711
209,9975.0,ממשלת ישראל,ממשל שקלית 327,IL0011393449,לא צמוד למדד המחירים לצרכן ריבית קבועה,ישראל,ישראל,TASE,RF,פנימי,ILS,1.47,2027-03-31,0.02,0.0396,,54368.43,1.0,98.22,53.40067,,,1e-06,0.0001,3e-06
209,9975.0,ממשלת ישראל,ממשלתי צמוד 1131,IL0011722209,צמוד למדד המחירים לצרכן בריבית קבועה,ישראל,ישראל,TASE,RF,פנימי,ILS,6.14,2031-11-30,0.001,0.019,,34218721.06,1.0,106.54,36456.62543,,,0.000999,0.068891,0.00266
209,9975.0,ממשלת ישראל,ממשל שקלית 0432,IL0011806606,לא צמוד למדד המחירים לצרכן ריבית קבועה,ישראל,ישראל,TASE,RF,פנימי,ILS,6.28,2032-04-30,0.013,0.0402,,8503.02,1.0,85.09,7.23522,,,0.0,1.3e-05,0.0
209,9975.0,ממשלת ישראל,ממשלתי צמוד 841,IL0011205833,צמוד למדד המחירים לצרכן בריבית קבועה,ישראל,ישראל,TASE,RF,פנימי,ILS,13.23,2041-08-30,0.0275,0.0202,,7073.74,1.0,139.93,9.89828,,,0.0,1.8e-05,0.0
209,9975.0,ממשלת ישראל,ממשל צמודה 1028,IL0011973265,צמוד למדד המחירים לצרכן בריבית קבועה,ישראל,ישראל,TASE,RF,פנימי,ILS,3.01,2028-10-31,0.011,0.0199,,1245458.32,1.0,105.65,1315.82671,,,3.6e-05,0.002485,9.5e-05
209,9975.0,ממשלת ישראל,ממשל שקלית 330,IL0011609851,לא צמוד למדד המחירים לצרכן ריבית קבועה,ישראל,ישראל,TASE,RF,פנימי,ILS,4.39,2030-03-31,0.01,0.0393,,181005.33,1.0,88.66,160.47933,,,4e-06,0.000303,1.1e-05
209,9975.0,INTL FINANCE CORP,IFC 0 27/08/30,XS1280871259,"נקוב במט""ח","חו""ל",ברזיל,FOREIGN_GOV_SEC,AAA,S&P,BRL,4.89,2030-08-27,0.0,0.1222,,1104416.43,0.6225,56.766,390.26581,,,0.002083,0.000737,2.8e-05
209,9975.0,TREASURY BILL,B 0 10/02/25,US912797MS31,"נקוב במט""ח","חו""ל","ארה""ב",אחר,AA+,Fitch,USD,0.0054,2025-10-02,0.0,0.0203,,452173.9,3.306,99.989,1494.7225,,,1e-06,0.002824,0.000109
209,9975.0,POLAND GOVERNMENT BOND,POLGB 3 3/4 05/25/27,PL0000114393,"נקוב במט""ח","חו""ל",פולין,FOREIGN_GOV_SEC,A-,Fitch,PLN,1.59,2027-05-25,0.0375,0.1229,,2008029.87,0.9092,100.706,1838.59021,,,6.1e-05,0.003474,0.000134
209,9975.0,POLAND GOVERNMENT BOND,POLGB 1 3/4 04/25/32,PL0000113783,"נקוב במט""ח","חו""ל",פולין,FOREIGN_GOV_SEC,A-,Fitch,PLN,6.15,2032-04-24,0.0175,0.048,,5371479.9,0.9092,82.619,4034.90502,,,9e-05,0.007624,0.000294
209,9975.0,HUNGARY GOVERNMENT BOND,HGB 2 1/4 04/20/33,HU0000404744,"נקוב במט""ח","חו""ל",הונגריה,FOREIGN_GOV_SEC,Baa2,Moodys,HUF,6.82,2033-04-20,0.0225,0.067,,391565824.63,0.009944,75.239,2929.60394,,,0.000314,0.005536,0.000214
209,9975.0,INTL FINANCE CORP,EBRD 0 02/02/32,XS2438631710,"נקוב במט""ח","חו""ל",ברזיל,FOREIGN_GOV_SEC,AAA,S&P,BRL,6.32,2032-02-02,0.0,0.1199,,3313249.29,0.6225,48.758,1005.63262,,,0.001656,0.0019,7.3e-05
209,9975.0,POLAND GOVERNMENT BOND,POLGB 5 3/4 04/25/29,PL0000105391,"נקוב במט""ח","חו""ל",פולין,FOREIGN_GOV_SEC,A-,Fitch,PLN,3.24,2029-04-25,0.0575,0.0453,,471887.02,0.9092,106.374,456.38667,,,8e-06,0.000862,3.3e-05
209,9975.0,MEX BONOS DESARR FIX RT,MBONO 8 1/2 11/18/2038,MX0MGO0000J5,"נקוב במט""ח","חו""ל",מקסיקו,FOREIGN_GOV_SEC,BBB-,Fitch,MXN,7.86,2038-11-18,0.085,-0.282,,268631.53,0.1804,9889.2,4792.41778,,,1e-06,0.009056,0.00035
209,9975.0,MEX BONOS DESARR FIX RT,MBONO 7.5 06/03/27,MX0MGO0000D8,"נקוב במט""ח","חו""ל",מקסיקו,FOREIGN_GOV_SEC,BBB-,Fitch,MXN,1.57,2027-03-06,0.075,-0.9602,,53965.8,0.1804,10252.3,998.10557,,,0.0,0.001886,7.2e-05
209,9975.0,MEX BONOS DESARR FIX RT,MBONO 7 1/2 05/26/33,MX0MGO0001D6,"נקוב במט""ח","חו""ל",מקסיקו,FOREIGN_GOV_SEC,BBB-,Fitch,MXN,5.8,2033-05-26,0.075,-0.4421,,280069.97,0.1804,9685.8,4893.71383,,,0.0,0.009247,0.000357
209,9975.0,TREASURY BILL,B 0 09/03/26,US912797RS85,"נקוב במט""ח","חו""ל","ארה""ב",אחר,AA+,Fitch,USD,0.91,2026-09-03,0.0,0.0365,,4696086.8,3.306,96.738,15018.82887,,,9.2e-05,0.02838,0.001096
209,9975.0,INTL FINANCE CORP,IFC 0 26/05/27,XS1621760302,"נקוב במט""ח","חו""ל",ברזיל,FOREIGN_GOV_SEC,AAA,S&P,BRL,1.63,2027-05-26,0.0,0.1238,,2008029.87,0.6225,82.459,1030.73634,,,0.002769,0.001947,7.5e-05
209,9975.0,HUNGARY GOVERNMENT BOND,HGB 7 10/24/35 35/A,HU0000406624,"נקוב במט""ח","חו""ל",הונגריה,FOREIGN_GOV_SEC,Baa2,Moodys,HUF,7.09,2035-10-24,0.07,0.068,,70281045.45,0.009944,107.901,754.09281,,,5.3e-05,0.001425,5.5e-05
209,9975.0,AFRICAN DEVELOPMENT BANK,AFDB 0 06/05/34,XS2831196535,"נקוב במט""ח","חו""ל",ברזיל,FOREIGN_GOV_SEC,AAA,S&P,BRL,8.66,2034-06-05,0.0,0.1221,,5572282.89,0.6225,36.768,1275.38857,,,0.010131,0.00241,9.3e-05
209,9975.0,TREASURY BILL,B 0 08/06/26,US912797RG48,"נקוב במט""ח","חו""ל","ארה""ב",אחר,AA+,Fitch,USD,0.84,2026-08-06,0.0,0.0371,,982140.0,3.306,96.953,3148.02013,,,1.8e-05,0.005948,0.000229
209,9975.0,INTL FINANCE CORP,IFC 11 ½ 16/01/30,XS2977993471,"נקוב במט""ח","חו""ל",ברזיל,FOREIGN_GOV_SEC,AAA,S&P,BRL,3.33,2030-01-16,0.115,0.1208,,3112446.3,0.6225,106.39,2061.30393,,,0.003192,0.003895,0.00015
209,9975.0,HUNGARY GOVERNMENT BOND,HGB 6 3/4 07/23/31,HU0000407317,"נקוב במט""ח","חו""ל",הונגריה,FOREIGN_GOV_SEC,Baa2,Moodys,HUF,4.86,2031-07-23,0.0675,0.0644,,35642530.19,0.009944,104.522,370.45661,,,0.000148,0.0007,2.7e-05
209,9975.0,POLAND GOVERNMENT BOND,POLGB 6 10/25/2033,PL0000115291,"נקוב במט""ח","חו""ל",פולין,FOREIGN_GOV_SEC,A-,Fitch,PLN,6.31,2033-10-25,0.06,0.0524,,3017064.88,0.9092,110.439,3029.4692,,,5e-05,0.005724,0.000221
209,9975.0,POLAND GOVERNMENT BOND,POLGB 7 1/2  07/25/2028,PL0000115192,"נקוב במט""ח","חו""ל",פולין,FOREIGN_GOV_SEC,A-,Fitch,PLN,2.6,2028-07-25,0.075,0.0439,,1014055.08,0.9092,109.442,1009.03213,,,2.2e-05,0.001906,7.3e-05
209,9975.0,MEX BONOS DESARR FIX RT,MBONO 7 3/4 29/05/31,MX0MGO0000P2,"נקוב במט""ח","חו""ל",מקסיקו,FOREIGN_GOV_SEC,BBB-,Fitch,MXN,4.59,2031-05-29,0.0775,-0.5479,,202780.9,0.1804,9997.6,3657.28941,,,0.0,0.006911,0.000267
209,9975.0,REPUBLIC OF BRAZIL,BRAZIL 10 1/4 01/10/28,US105756BN96,"נקוב במט""ח","חו""ל",ברזיל,FOREIGN_GOV_SEC,BB,S&P,BRL,2.03,2028-01-10,0.1025,0.0993,,2218371.0,0.6225,103.027,1422.73688,,,0.000465,0.002687,0.000103
209,9975.0,INTL BK RECON & DEVELOP,IBRD 10 10/17/29,XS2920414112,"נקוב במט""ח","חו""ל",ברזיל,FOREIGN_GOV_SEC,AAA,S&P,BRL,3.16,2029-10-17,0.1,0.1206,,4116461.23,0.6225,103.44,2650.64702,,,0.006333,0.005008,0.000193
209,9976.0,ממשלת ישראל,ממשל שקלית 335,IL0012023326,לא צמוד למדד המחירים לצרכן ריבית קבועה,ישראל,ישראל,TASE,RF,פנימי,ILS,7.92,2035-03-30,0.04,0.041,,181807.45,1.0,101.25,184.08005,,,5e-06,0.000255,3.2e-05
209,9976.0,ממשלת ישראל,ממשלתי צמוד 1131,IL0011722209,צמוד למדד המחירים לצרכן בריבית קבועה,ישראל,ישראל,TASE,RF,פנימי,ILS,6.14,2031-11-30,0.001,0.019,,133376618.32,1.0,106.54,142099.44916,,,0.003896,0.197077,0.025349
209,9976.0,ממשלת ישראל,ממשל שקלית 327,IL0011393449,לא צמוד למדד המחירים לצרכן ריבית קבועה,ישראל,ישראל,TASE,RF,פנימי,ILS,1.47,2027-03-31,0.02,0.0396,,211915.5,1.0,98.22,208.1434,,,7e-06,0.000288,3.7e-05
209,9976.0,ממשלת ישראל,ממשל קצרה 11/25,IL0012153263,לא צמוד למדד המחירים לצרכן ריבית קבועה,ישראל,ישראל,TASE,RF,פנימי,ILS,0.16,2025-11-30,0.0,0.0412,,6716699.13,1.0,99.36,6673.71226,,,0.001058,0.009255,0.00119
209,9976.0,ממשלת ישראל,ממשל צמודה 1151,IL0011683013,צמוד למדד המחירים לצרכן בריבית קבועה,ישראל,ישראל,TASE,RF,פנימי,ILS,11.99,2051-11-30,0.005,0.0214,,1124.7,1.0,80.45,0.90482,,,0.0,1e-06,0.0
209,9976.0,ממשלת ישראל,מ.ק.מ 416,IL0082604161,לא צמוד למדד המחירים לצרכן ריבית קבועה,ישראל,ישראל,TASE,RF,פנימי,ILS,0.49,2026-04-01,0.0,0.0418,,14289367.85,1.0,98.0,14003.5805,,,0.000793,0.019421,0.002498
209,9976.0,ממשלת ישראל,ממשל שקלית 829,IL0012128935,לא צמוד למדד המחירים לצרכן ריבית קבועה,ישראל,ישראל,TASE,RF,פנימי,ILS,3.66,2029-08-31,0.046,0.0394,,9830697.11,1.0,102.76,10102.02435,,,0.000521,0.01401,0.001802
209,9976.0,ממשלת ישראל,ממשל שקלית928,IL0011508798,לא צמוד למדד המחירים לצרכן ריבית קבועה,ישראל,ישראל,TASE,RF,פנימי,ILS,2.92,2028-09-28,0.0225,0.0393,,24292830.82,1.0,95.37,23168.07275,,,0.000699,0.032131,0.004131
209,9976.0,ממשלת ישראל,ממשל שקלית 330,IL0011609851,לא צמוד למדד המחירים לצרכן ריבית קבועה,ישראל,ישראל,TASE,RF,פנימי,ILS,4.39,2030-03-31,0.01,0.0393,,705516.69,1.0,88.66,625.51109,,,1.8e-05,0.000867,0.000111
209,9976.0,ממשלת ישראל,ממשלתי צמוד 726,IL0011695645,צמוד למדד המחירים לצרכן בריבית קבועה,ישראל,ישראל,TASE,RF,פנימי,ILS,0.82,2026-07-31,0.001,0.0267,,32656376.68,1.0,116.31,37982.63171,,,0.001616,0.052678,0.006775
209,9976.0,ממשלת ישראל,ממשלתי צמוד 0527,IL0011408478,צמוד למדד המחירים לצרכן בריבית קבועה,ישראל,ישראל,TASE,RF,פנימי,ILS,1.65,2027-05-31,0.0075,0.0209,,25120844.35,1.0,117.66,29557.18547,,,0.001031,0.040991,0.005272
209,9976.0,ממשלת ישראל,ממשלתי שקלי 0229,IL0011948028,לא צמוד למדד המחירים לצרכן ריבית קבועה,ישראל,ישראל,TASE,RF,פנימי,ILS,3.2,2029-02-28,0.0375,0.0391,,2686092.98,1.0,101.7,2731.75656,,,7.6e-05,0.003788,0.000487
209,9976.0,ממשלת ישראל,ממשל שקלית 0226,IL0011746976,לא צמוד למדד המחירים לצרכן ריבית קבועה,ישראל,ישראל,TASE,RF,פנימי,ILS,0.4,2026-02-27,0.005,0.0409,,21295542.25,1.0,98.89,21059.16173,,,0.000859,0.029206,0.003756
209,9976.0,ממשלת ישראל,ממשל שקלי 347,IL0011401937,לא צמוד למדד המחירים לצרכן ריבית קבועה,ישראל,ישראל,TASE,RF,פנימי,ILS,14.44,2047-03-31,0.0375,0.0449,,6038756.35,1.0,91.85,5546.59771,,,0.00023,0.007691,0.000988
209,9976.0,ממשלת ישראל,מ.ק.מ 316,IL0082603171,לא צמוד למדד המחירים לצרכן ריבית קבועה,ישראל,ישראל,TASE,RF,פנימי,ILS,0.42,2026-03-04,0.0,0.0415,,1461298.57,1.0,98.32,1436.74875,,,8.1e-05,0.001992,0.000256
209,9976.0,ממשלת ישראל,ממשלתי צמוד 841,IL0011205833,צמוד למדד המחירים לצרכן בריבית קבועה,ישראל,ישראל,TASE,RF,פנימי,ILS,13.23,2041-08-30,0.0275,0.0202,,27571.79,1.0,139.93,38.5812,,,1e-06,5.2e-05,6e-06
209,9976.0,ממשלת ישראל,ממשל שקלית 927,IL0012035791,לא צמוד למדד המחירים לצרכן ריבית קבועה,ישראל,ישראל,TASE,RF,פנימי,ILS,1.96,2027-09-30,0.0375,0.0397,,5816143.25,1.0,99.62,5794.04191,,,0.00016,0.008035,0.001032
209,9976.0,ממשלת ישראל,מ.ק.מ. 726,IL0082607214,לא צמוד למדד המחירים לצרכן ריבית קבועה,ישראל,ישראל,TASE,RF,פנימי,ILS,0.76,2026-07-08,0.0,0.0414,,11377433.05,1.0,96.96,11031.55909,,,0.000632,0.015298,0.001967
209,9976.0,ממשלת ישראל,ממשל קצרה 02/26,IL0012194689,לא צמוד למדד המחירים לצרכן ריבית קבועה,ישראל,ישראל,TASE,RF,פנימי,ILS,0.4,2026-02-27,0.0,0.0417,,3276438.6,1.0,97.18,3184.04303,,,0.000627,0.004415,0.000568
209,9976.0,ממשלת ישראל,מ.ק.מ. 616,IL0082606141,לא צמוד למדד המחירים לצרכן ריבית קבועה,ישראל,ישראל,TASE,RF,פנימי,ILS,0.67,2026-06-03,0.0,0.042,,510969.41,1.0,97.3,497.17324,,,2.8e-05,0.000689,8.8e-05
209,9976.0,ממשלת ישראל,ממשל שקלית 537,IL0011661803,לא צמוד למדד המחירים לצרכן ריבית קבועה,ישראל,ישראל,TASE,RF,פנימי,ILS,10.55,2037-05-31,0.015,0.0421,,1005271.8,1.0,75.94,763.40341,,,2.5e-05,0.001058,0.000136
209,9976.0,ממשלת ישראל,ממשל שקלית 0432,IL0011806606,לא צמוד למדד המחירים לצרכן ריבית קבועה,ישראל,ישראל,TASE,RF,פנימי,ILS,6.28,2032-04-30,0.013,0.0402,,33142.81,1.0,85.09,28.20122,,,0.0,3.9e-05,5e-06
209,9976.0,ממשלת ישראל,מ.ק.מ 216,IL0082602181,לא צמוד למדד המחירים לצרכן ריבית קבועה,ישראל,ישראל,TASE,RF,פנימי,ILS,0.34,2026-02-04,0.0,0.0424,,2596577.59,1.0,98.6,2560.22551,,,0.000144,0.00355,0.000456
209,9976.0,ממשלת ישראל,ממשל שקלית 0142,IL0011254005,לא צמוד למדד המחירים לצרכן ריבית קבועה,ישראל,ישראל,TASE,RF,פנימי,ILS,11.17,2042-01-31,0.055,0.0434,,39387701.54,1.0,117.0,46083.61081,,,0.001271,0.063912,0.008221
209,9976.0,ממשלת ישראל,ממשלתי צמוד 0529,IL0011570236,צמוד למדד המחירים לצרכן בריבית קבועה,ישראל,ישראל,TASE,RF,פנימי,ILS,3.63,2029-05-31,0.005,0.0193,,82335273.25,1.0,113.0,93038.85878,,,0.002797,0.129034,0.016597
209,9976.0,ממשלת ישראל,ממשלתי צמוד 0545,IL0011348658,צמוד למדד המחירים לצרכן בריבית קבועה,ישראל,ישראל,TASE,RF,פנימי,ILS,17.67,2045-05-31,0.01,0.0207,,5153844.38,1.0,99.57,5131.68285,,,0.000225,0.007117,0.000915
209,9976.0,ממשלת ישראל,מ.ק.מ. 516,IL0082605150,לא צמוד למדד המחירים לצרכן ריבית קבועה,ישראל,ישראל,TASE,RF,פנימי,ILS,0.59,2026-05-06,0.0,0.0416,,28398531.59,1.0,97.63,27725.48639,,,0.001577,0.038452,0.004945
209,9976.0,ממשלת ישראל,ממשל צמודה 0431,IL0012207226,צמוד למדד המחירים לצרכן בריבית קבועה,ישראל,ישראל,TASE,RF,פנימי,ILS,5.29,2031-04-30,0.02,0.0199,,1769864.44,1.0,103.02,1823.31435,,,0.000244,0.002528,0.000325
209,9976.0,ממשלת ישראל,ממשל צמודה 1033,IL0012043795,צמוד למדד המחירים לצרכן בריבית קבועה,ישראל,ישראל,TASE,RF,פנימי,ILS,7.53,2033-10-31,0.016,0.0195,,132454419.47,1.0,105.4,139606.95813,,,0.005007,0.193621,0.024905
209,9976.0,ממשלת ישראל,ממשל שקלי 1152,IL0011840761,לא צמוד למדד המחירים לצרכן ריבית קבועה,ישראל,ישראל,TASE,RF,פנימי,ILS,17.24,2052-11-29,0.028,0.0461,,78139982.11,1.0,74.63,58315.86865,,,0.002826,0.080878,0.010402
209,9976.0,ממשלת ישראל,ממשל צמודה 1028,IL0011973265,צמוד למדד המחירים לצרכן בריבית קבועה,ישראל,ישראל,TASE,RF,פנימי,ILS,3.01,2028-10-31,0.011,0.0199,,4854506.94,1.0,105.65,5128.78658,,,0.000144,0.007112,0.000914
209,9976.0,INTL FINANCE CORP,EBRD 0 02/02/32,XS2438631710,"נקוב במט""ח","חו""ל",ברזיל,FOREIGN_GOV_SEC,AAA,S&P,BRL,6.32,2032-02-02,0.0,0.1199,,1652371.58,0.6225,48.758,501.52543,,,0.000826,0.000695,8.9e-05
209,9976.0,POLAND GOVERNMENT BOND,POLGB 1 3/4 04/25/32,PL0000113783,"נקוב במט""ח","חו""ל",פולין,FOREIGN_GOV_SEC,A-,Fitch,PLN,6.15,2032-04-24,0.0175,0.048,,2678844.83,0.9092,82.619,2012.27309,,,4.4e-05,0.00279,0.000359
209,9976.0,MEX BONOS DESARR FIX RT,MBONO 8 1/2 11/18/2038,MX0MGO0000J5,"נקוב במט""ח","חו""ל",מקסיקו,FOREIGN_GOV_SEC,BBB-,Fitch,MXN,7.86,2038-11-18,0.085,-0.282,,133970.93,0.1804,9889.2,2390.05709,,,0.0,0.003314,0.000426
209,9976.0,AFRICAN DEVELOPMENT BANK,AFDB 0 06/05/34,XS2831196535,"נקוב במט""ח","חו""ל",ברזיל,FOREIGN_GOV_SEC,AAA,S&P,BRL,8.66,2034-06-05,0.0,0.1221,,2778988.57,0.6225,36.768,636.05713,,,0.005052,0.000882,0.000113
209,9976.0,INTL BK RECON & DEVELOP,IBRD 10 10/17/29,XS2920414112,"נקוב במט""ח","חו""ל",ברזיל,FOREIGN_GOV_SEC,AAA,S&P,BRL,3.16,2029-10-17,0.1,0.1206,,2052946.51,0.6225,103.44,1321.921,,,0.003158,0.001833,0.000235
209,9976.0,INTL FINANCE CORP,IFC 0 26/05/27,XS1621760302,"נקוב במט""ח","חו""ל",ברזיל,FOREIGN_GOV_SEC,AAA,S&P,BRL,1.63,2027-05-26,0.0,0.1238,,1001437.32,0.6225,82.459,514.04506,,,0.001381,0.000712,9.1e-05
209,9976.0,MEX BONOS DESARR FIX RT,MBONO 7 1/2 05/26/33,MX0MGO0001D6,"נקוב במט""ח","חו""ל",מקסיקו,FOREIGN_GOV_SEC,BBB-,Fitch,MXN,5.8,2033-05-26,0.075,-0.4421,,139675.47,0.1804,9685.8,2440.57508,,,0.0,0.003384,0.000435
209,9976.0,MEX BONOS DESARR FIX RT,MBONO 7.5 06/03/27,MX0MGO0000D8,"נקוב במט""ח","חו""ל",מקסיקו,FOREIGN_GOV_SEC,BBB-,Fitch,MXN,1.57,2027-03-06,0.075,-0.9602,,26913.63,0.1804,10252.3,497.77157,,,0.0,0.00069,8.8e-05
209,9976.0,TREASURY BILL,B 0 08/06/26,US912797RG48,"נקוב במט""ח","חו""ל","ארה""ב",אחר,AA+,Fitch,USD,0.84,2026-08-06,0.0,0.0371,,328719.44,3.306,96.953,1053.63329,,,6e-06,0.00146,0.000187
209,9976.0,POLAND GOVERNMENT BOND,POLGB 7 1/2  07/25/2028,PL0000115192,"נקוב במט""ח","חו""ל",פולין,FOREIGN_GOV_SEC,A-,Fitch,PLN,2.6,2028-07-25,0.075,0.0439,,505725.85,0.9092,109.442,503.22082,,,1.1e-05,0.000697,8.9e-05
209,9976.0,TREASURY BILL,B 0 09/03/26,US912797RS85,"נקוב במט""ח","חו""ל","ארה""ב",אחר,AA+,Fitch,USD,0.91,2026-09-03,0.0,0.0365,,1312873.23,3.306,96.738,4198.77638,,,2.5e-05,0.005822,0.000748
209,9976.0,POLAND GOVERNMENT BOND,POLGB 3 3/4 05/25/27,PL0000114393,"נקוב במט""ח","חו""ל",פולין,FOREIGN_GOV_SEC,A-,Fitch,PLN,1.59,2027-05-25,0.0375,0.1229,,1001437.32,0.9092,100.706,916.93499,,,3e-05,0.001271,0.000163
209,9976.0,TREASURY BILL,B 0 10/02/25,US912797MS31,"נקוב במט""ח","חו""ל","ארה""ב",אחר,AA+,Fitch,USD,0.0054,2025-10-02,0.0,0.0203,,119464.86,3.306,99.989,394.90741,,,0.0,0.000547,7e-05
209,9976.0,INTL FINANCE CORP,IFC 11 ½ 16/01/30,XS2977993471,"נקוב במט""ח","חו""ל",ברזיל,FOREIGN_GOV_SEC,AAA,S&P,BRL,3.33,2030-01-16,0.115,0.1208,,1552227.85,0.6225,106.39,1028.00597,,,0.001592,0.001425,0.000183
209,9976.0,MEX BONOS DESARR FIX RT,MBONO 7 3/4 29/05/31,MX0MGO0000P2,"נקוב במט""ח","חו""ל",מקסיקו,FOREIGN_GOV_SEC,BBB-,Fitch,MXN,4.59,2031-05-29,0.0775,-0.5479,,101130.15,0.1804,9997.6,1823.95001,,,0.0,0.002529,0.000325
209,9976.0,REPUBLIC OF BRAZIL,BRAZIL 10 1/4 01/10/28,US105756BN96,"נקוב במט""ח","חו""ל",ברזיל,FOREIGN_GOV_SEC,BB,S&P,BRL,2.03,2028-01-10,0.1025,0.0993,,1106337.88,0.6225,103.027,709.54214,,,0.000232,0.000983,0.000125
209,9976.0,HUNGARY GOVERNMENT BOND,HGB 2 1/4 04/20/33,HU0000404744,"נקוב במט""ח","חו""ל",הונגריה,FOREIGN_GOV_SEC,Baa2,Moodys,HUF,6.82,2033-04-20,0.0225,0.067,,195280277.64,0.009944,75.239,1461.04137,,,0.000156,0.002026,0.00026
209,9976.0,POLAND GOVERNMENT BOND,POLGB 5 3/4 04/25/29,PL0000105391,"נקוב במט""ח","חו""ל",פולין,FOREIGN_GOV_SEC,A-,Fitch,PLN,3.24,2029-04-25,0.0575,0.0453,,235337.77,0.9092,106.374,227.60749,,,4e-06,0.000315,4e-05
209,9976.0,POLAND GOVERNMENT BOND,POLGB 6 10/25/2033,PL0000115291,"נקוב במט""ח","חו""ל",פולין,FOREIGN_GOV_SEC,A-,Fitch,PLN,6.31,2033-10-25,0.06,0.0524,,1504659.58,0.9092,110.439,1510.84581,,,2.5e-05,0.002095,0.000269
209,9976.0,INTL FINANCE CORP,IFC 0 27/08/30,XS1280871259,"נקוב במט""ח","חו""ל",ברזיל,FOREIGN_GOV_SEC,AAA,S&P,BRL,4.89,2030-08-27,0.0,0.1222,,550790.53,0.6225,56.766,194.63194,,,0.001039,0.000269,3.4e-05
209,9976.0,HUNGARY GOVERNMENT BOND,HGB 7 10/24/35 35/A,HU0000406624,"נקוב במט""ח","חו""ל",הונגריה,FOREIGN_GOV_SEC,Baa2,Moodys,HUF,7.09,2035-10-24,0.07,0.068,,35050306.24,0.009944,107.901,376.07841,,,2.6e-05,0.000521,6.7e-05
209,9976.0,HUNGARY GOVERNMENT BOND,HGB 6 3/4 07/23/31,HU0000407317,"נקוב במט""ח","חו""ל",הונגריה,FOREIGN_GOV_SEC,Baa2,Moodys,HUF,4.86,2031-07-23,0.0675,0.0644,,17775512.45,0.009944,104.522,184.75277,,,7.4e-05,0.000256,3.2e-05
209,9984.0,ממשלת ישראל,ממשל שקלית 330,IL0011609851,לא צמוד למדד המחירים לצרכן ריבית קבועה,ישראל,ישראל,TASE,RF,פנימי,ILS,4.39,2030-03-31,0.01,0.0393,,62382.66,1.0,88.66,55.30847,,,1e-06,0.002692,5.1e-05
209,9984.0,ממשלת ישראל,ממשל שקלית928,IL0011508798,לא צמוד למדד המחירים לצרכן ריבית קבועה,ישראל,ישראל,TASE,RF,פנימי,ILS,2.92,2028-09-28,0.0225,0.0393,,629756.16,1.0,95.37,600.59845,,,1.8e-05,0.029259,0.000577
209,9984.0,ממשלת ישראל,ממשלתי צמוד 0529,IL0011570236,צמוד למדד המחירים לצרכן בריבית קבועה,ישראל,ישראל,TASE,RF,פנימי,ILS,3.63,2029-05-31,0.005,0.0193,,2091550.83,1.0,113.0,2363.45243,,,7.1e-05,0.115149,0.002281
209,9984.0,ממשלת ישראל,ממשלתי צמוד 1131,IL0011722209,צמוד למדד המחירים לצרכן בריבית קבועה,ישראל,ישראל,TASE,RF,פנימי,ILS,6.14,2031-11-30,0.001,0.019,,3350427.04,1.0,106.54,3569.54495,,,9.7e-05,0.173912,0.003446
209,9984.0,ממשלת ישראל,ממשל שקלית 335,IL0012023326,לא צמוד למדד המחירים לצרכן ריבית קבועה,ישראל,ישראל,TASE,RF,פנימי,ILS,7.92,2035-03-30,0.04,0.041,,121543.64,1.0,101.25,123.06295,,,3e-06,0.005994,0.000118
209,9984.0,ממשלת ישראל,ממשל שקלי 1152,IL0011840761,לא צמוד למדד המחירים לצרכן ריבית קבועה,ישראל,ישראל,TASE,RF,פנימי,ILS,17.24,2052-11-29,0.028,0.0461,,2080350.55,1.0,74.63,1552.56563,,,7.5e-05,0.075643,0.001498
209,9984.0,ממשלת ישראל,ממשל צמודה 1033,IL0012043795,צמוד למדד המחירים לצרכן בריבית קבועה,ישראל,ישראל,TASE,RF,פנימי,ILS,7.53,2033-10-31,0.016,0.0195,,3300469.43,1.0,105.4,3478.69477,,,0.000124,0.169488,0.00336
209,9984.0,ממשלת ישראל,ממשל שקלי 347,IL0011401937,לא צמוד למדד המחירים לצרכן ריבית קבועה,ישראל,ישראל,TASE,RF,פנימי,ILS,14.44,2047-03-31,0.0375,0.0449,,325308.92,1.0,91.85,298.79624,,,1.2e-05,0.014555,0.000285
209,9984.0,ממשלת ישראל,ממשלתי צמוד 726,IL0011695645,צמוד למדד המחירים לצרכן בריבית קבועה,ישראל,ישראל,TASE,RF,פנימי,ILS,0.82,2026-07-31,0.001,0.0267,,1085104.32,1.0,116.31,1262.08483,,,5.3e-05,0.061489,0.001217
209,9984.0,ממשלת ישראל,ממשל צמודה 0431,IL0012207226,צמוד למדד המחירים לצרכן בריבית קבועה,ישראל,ישראל,TASE,RF,פנימי,ILS,5.29,2031-04-30,0.02,0.0199,,67090.3,1.0,103.02,69.11642,,,9e-06,0.003365,6.5e-05
209,9984.0,ממשלת ישראל,ממשלתי צמוד 0527,IL0011408478,צמוד למדד המחירים לצרכן בריבית קבועה,ישראל,ישראל,TASE,RF,פנימי,ILS,1.65,2027-05-31,0.0075,0.0209,,963206.47,1.0,117.66,1133.30875,,,3.9e-05,0.055215,0.001092
209,9984.0,ממשלת ישראל,ממשלתי צמוד 841,IL0011205833,צמוד למדד המחירים לצרכן בריבית קבועה,ישראל,ישראל,TASE,RF,פנימי,ILS,13.23,2041-08-30,0.0275,0.0202,,667.48,1.0,139.93,0.934,,,0.0,4.5e-05,0.0
209,9984.0,ממשלת ישראל,ממשל שקלית 0142,IL0011254005,לא צמוד למדד המחירים לצרכן ריבית קבועה,ישראל,ישראל,TASE,RF,פנימי,ILS,11.17,2042-01-31,0.055,0.0434,,1164992.88,1.0,117.0,1363.04168,,,3.7e-05,0.066408,0.001314
209,9984.0,ממשלת ישראל,ממשל שקלית 829,IL0012128935,לא צמוד למדד המחירים לצרכן ריבית קבועה,ישראל,ישראל,TASE,RF,פנימי,ILS,3.66,2029-08-31,0.046,0.0394,,260085.82,1.0,102.76,267.26419,,,1.3e-05,0.013019,0.000256
209,9984.0,ממשלת ישראל,ממשלתי צמוד 0545,IL0011348658,צמוד למדד המחירים לצרכן בריבית קבועה,ישראל,ישראל,TASE,RF,פנימי,ILS,17.67,2045-05-31,0.01,0.0207,,124766.97,1.0,99.57,124.23047,,,5e-06,0.006052,0.00012
209,9984.0,ממשלת ישראל,ממשל שיקלי1026,IL0010994569,לא צמוד למדד המחירים לצרכן ריבית קבועה,ישראל,ישראל,TASE,RF,פנימי,ILS,1.02,2026-10-30,0.0625,0.0387,,158589.04,1.0,108.22,171.62505,,,1e-05,0.00836,0.000164
209,9984.0,ממשלת ישראל,ממשל שקלית 0728,1226240,לא צמוד למדד המחירים לצרכן ריבית קבועה,ישראל,ישראל,TASE,RF,פנימי,ILS,2.71,2028-07-31,0.041,0.0396,,1009.42,1.0,101.02,1.0197,,,0.0,4.8e-05,0.0
209,9984.0,ממשלת ישראל,ממשל שקלית 927,IL0012035791,לא צמוד למדד המחירים לצרכן ריבית קבועה,ישראל,ישראל,TASE,RF,פנימי,ILS,1.96,2027-09-30,0.0375,0.0397,,184306.3,1.0,99.62,183.60594,,,5e-06,0.008944,0.000176
209,9984.0,ממשלת ישראל,ממשל צמודה 1028,IL0011973265,צמוד למדד המחירים לצרכן בריבית קבועה,ישראל,ישראל,TASE,RF,פנימי,ILS,3.01,2028-10-31,0.011,0.0199,,222340.06,1.0,105.65,234.90227,,,6e-06,0.011442,0.000224
209,9984.0,ממשלת ישראל,ממשל שקלית 0432,IL0011806606,לא צמוד למדד המחירים לצרכן ריבית קבועה,ישראל,ישראל,TASE,RF,פנימי,ILS,6.28,2032-04-30,0.013,0.0402,,121151.84,1.0,85.09,103.0881,,,3e-06,0.005022,9.8e-05
209,9984.0,ממשלת ישראל,ממשל צמודה 1151,IL0011683013,צמוד למדד המחירים לצרכן בריבית קבועה,ישראל,ישראל,TASE,RF,פנימי,ILS,11.99,2051-11-30,0.005,0.0214,,27.23,1.0,80.45,0.0219,,,0.0,1e-06,0.0
209,9984.0,ממשלת ישראל,ממשל שקלית 537,IL0011661803,לא צמוד למדד המחירים לצרכן ריבית קבועה,ישראל,ישראל,TASE,RF,פנימי,ILS,10.55,2037-05-31,0.015,0.0421,,291926.27,1.0,75.94,221.68881,,,7e-06,0.0108,0.000213
209,9984.0,ממשלת ישראל,ממשל שקלית 0226,IL0011746976,לא צמוד למדד המחירים לצרכן ריבית קבועה,ישראל,ישראל,TASE,RF,פנימי,ILS,0.4,2026-02-27,0.005,0.0409,,811317.58,1.0,98.89,802.31195,,,3.2e-05,0.039087,0.000772
209,9984.0,ממשלת ישראל,ממשלתי שקלי 0229,IL0011948028,לא צמוד למדד המחירים לצרכן ריבית קבועה,ישראל,ישראל,TASE,RF,פנימי,ILS,3.2,2029-02-28,0.0375,0.0391,,107053.32,1.0,101.7,108.87322,,,3e-06,0.005303,0.000103
209,9984.0,ממשלת ישראל,ממשל שקלית 327,IL0011393449,לא צמוד למדד המחירים לצרכן ריבית קבועה,ישראל,ישראל,TASE,RF,פנימי,ILS,1.47,2027-03-31,0.02,0.0396,,305657.71,1.0,98.22,300.217,,,1e-05,0.014625,0.000288
209,9984.0,TREASURY BILL,B 0 08/06/26,US912797RG48,"נקוב במט""ח","חו""ל","ארה""ב",אחר,AA+,Fitch,USD,0.84,2026-08-06,0.0,0.0371,,658681.95,3.306,96.953,2111.25098,,,1.2e-05,0.102863,0.002039
209,9984.0,TREASURY BILL,B 0 09/03/26,US912797RS85,"נקוב במט""ח","חו""ל","ארה""ב",אחר,AA+,Fitch,USD,0.91,2026-09-03,0.0,0.0365,,7491.66,3.306,96.738,23.95953,,,0.0,0.001167,2.3e-05
209,9987.0,ממשלת ישראל,ממשלתי צמוד 841,IL0011205833,צמוד למדד המחירים לצרכן בריבית קבועה,ישראל,ישראל,TASE,RF,פנימי,ILS,13.23,2041-08-30,0.0275,0.0202,,11739.0,1.0,139.93,16.42638,,,0.0,0.01853,0.003832
209,9987.0,ממשלת ישראל,ממשלתי צמוד 0545,IL0011348658,צמוד למדד המחירים לצרכן בריבית קבועה,ישראל,ישראל,TASE,RF,פנימי,ILS,17.67,2045-05-31,0.01,0.0207,,134868.0,1.0,99.57,134.28806,,,5e-06,0.151489,0.031332
209,9987.0,ממשלת ישראל,ממשלתי צמוד 0529,IL0011570236,צמוד למדד המחירים לצרכן בריבית קבועה,ישראל,ישראל,TASE,RF,פנימי,ILS,3.63,2029-05-31,0.005,0.0193,,130168.0,1.0,113.0,147.08984,,,4e-06,0.16593,0.034319
209,9987.0,ממשלת ישראל,גליל  0536,IL0010977085,צמוד למדד המחירים לצרכן בריבית קבועה,ישראל,ישראל,TASE,RF,פנימי,ILS,8.96,2036-05-30,0.04,0.0194,,67906.0,1.0,170.85,116.0174,,,4e-06,0.130878,0.027069
209,9987.0,ממשלת ישראל,ממשלתי צמוד 0527,IL0011408478,צמוד למדד המחירים לצרכן בריבית קבועה,ישראל,ישראל,TASE,RF,פנימי,ILS,1.65,2027-05-31,0.0075,0.0209,,25476.0,1.0,117.66,29.97506,,,1e-06,0.033814,0.006993
209,9987.0,ממשלת ישראל,ממשל צמודה 1033,IL0012043795,צמוד למדד המחירים לצרכן בריבית קבועה,ישראל,ישראל,TASE,RF,פנימי,ILS,7.53,2033-10-31,0.016,0.0195,,395329.0,1.0,105.4,416.67676,,,1.4e-05,0.470048,0.09722
209,9987.0,ממשלת ישראל,ממשלתי צמוד 1025,IL0011359127,צמוד למדד המחירים לצרכן בריבית קבועה,ישראל,ישראל,TASE,RF,פנימי,ILS,0.08,2025-10-31,0.0075,0.0956,,21783.0,1.0,119.27,25.98058,,,2e-06,0.029308,0.006061
325,325.0,ממשלת ישראל,ממשל צמודה 1028,IL0011973265,צמוד למדד המחירים לצרכן בריבית קבועה,ישראל,ישראל,TASE,RF,פנימי,ILS,3.01,2028-10-31,0.011,0.0199,,948467.98,1.0,105.65,1002.05642,,,2.8e-05,0.007722,0.00176
325,325.0,ממשלת ישראל,ממשל שקלית 0142,IL0011254005,לא צמוד למדד המחירים לצרכן ריבית קבועה,ישראל,ישראל,TASE,RF,פנימי,ILS,11.17,2042-01-31,0.055,0.0434,,7695523.8,1.0,117.0,9003.76286,,,0.000248,0.069392,0.015823
325,325.0,ממשלת ישראל,ממשלתי צמוד 726,IL0011695645,צמוד למדד המחירים לצרכן בריבית קבועה,ישראל,ישראל,TASE,RF,פנימי,ILS,0.82,2026-07-31,0.001,0.0267,,6380365.3,1.0,116.31,7421.00288,,,0.000315,0.057194,0.013042
325,325.0,ממשלת ישראל,ממשל שקלית 829,IL0012128935,לא צמוד למדד המחירים לצרכן ריבית קבועה,ישראל,ישראל,TASE,RF,פנימי,ILS,3.66,2029-08-31,0.046,0.0394,,1920710.29,1.0,102.76,1973.7219,,,0.000101,0.015211,0.003469
325,325.0,ממשלת ישראל,מ.ק.מ 416,IL0082604161,לא צמוד למדד המחירים לצרכן ריבית קבועה,ישראל,ישראל,TASE,RF,פנימי,ILS,0.49,2026-04-01,0.0,0.0418,,1347805.01,1.0,98.0,1320.84891,,,7.4e-05,0.010179,0.002321
325,325.0,ממשלת ישראל,מ.ק.מ 216,IL0082602181,לא צמוד למדד המחירים לצרכן ריבית קבועה,ישראל,ישראל,TASE,RF,פנימי,ILS,0.34,2026-02-04,0.0,0.0424,,244914.98,1.0,98.6,241.48617,,,1.3e-05,0.001861,0.000424
325,325.0,ממשלת ישראל,ממשלתי צמוד 1131,IL0011722209,צמוד למדד המחירים לצרכן בריבית קבועה,ישראל,ישראל,TASE,RF,פנימי,ILS,6.14,2031-11-30,0.001,0.019,,26058970.22,1.0,106.54,27763.22687,,,0.000761,0.213973,0.048795
325,325.0,ממשלת ישראל,מ.ק.מ 316,IL0082603171,לא צמוד למדד המחירים לצרכן ריבית קבועה,ישראל,ישראל,TASE,RF,פנימי,ILS,0.42,2026-03-04,0.0,0.0415,,138688.65,1.0,98.32,136.35868,,,7e-06,0.00105,0.000239
325,325.0,ממשלת ישראל,מ.ק.מ. 516,IL0082605150,לא צמוד למדד המחירים לצרכן ריבית קבועה,ישראל,ישראל,TASE,RF,פנימי,ILS,0.59,2026-05-06,0.0,0.0416,,2678612.77,1.0,97.63,2615.12965,,,0.000148,0.020154,0.004595
325,325.0,ממשלת ישראל,מ.ק.מ. 726,IL0082607214,לא צמוד למדד המחירים לצרכן ריבית קבועה,ישראל,ישראל,TASE,RF,פנימי,ILS,0.76,2026-07-08,0.0,0.0414,,1073144.84,1.0,96.96,1040.52123,,,5.9e-05,0.008019,0.001827
325,325.0,ממשלת ישראל,ממשל שקלית 335,IL0012023326,לא צמוד למדד המחירים לצרכן ריבית קבועה,ישראל,ישראל,TASE,RF,פנימי,ILS,7.92,2035-03-30,0.04,0.041,,35521.33,1.0,101.25,35.96535,,,0.0,0.000277,6.3e-05
325,325.0,ממשלת ישראל,ממשל קצרה 11/25,IL0012153263,לא צמוד למדד המחירים לצרכן ריבית קבועה,ישראל,ישראל,TASE,RF,פנימי,ILS,0.16,2025-11-30,0.0,0.0412,,633534.03,1.0,99.36,629.47941,,,9.9e-05,0.004851,0.001106
325,325.0,ממשלת ישראל,ממשלתי צמוד 841,IL0011205833,צמוד למדד המחירים לצרכן בריבית קבועה,ישראל,ישראל,TASE,RF,פנימי,ILS,13.23,2041-08-30,0.0275,0.0202,,5386.94,1.0,139.93,7.53795,,,0.0,5.7e-05,1.2e-05
325,325.0,ממשלת ישראל,ממשל שקלית 327,IL0011393449,לא צמוד למדד המחירים לצרכן ריבית קבועה,ישראל,ישראל,TASE,RF,פנימי,ILS,1.47,2027-03-31,0.02,0.0396,,41403.81,1.0,98.22,40.66682,,,1e-06,0.000313,7.1e-05
325,325.0,ממשלת ישראל,ממשל שקלי 1152,IL0011840761,לא צמוד למדד המחירים לצרכן ריבית קבועה,ישראל,ישראל,TASE,RF,פנימי,ILS,17.24,2052-11-29,0.028,0.0461,,15266899.8,1.0,74.63,11393.68731,,,0.000552,0.087812,0.020024
325,325.0,ממשלת ישראל,ממשל שקלית928,IL0011508798,לא צמוד למדד המחירים לצרכן ריבית קבועה,ישראל,ישראל,TASE,RF,פנימי,ILS,2.92,2028-09-28,0.0225,0.0393,,4746305.34,1.0,95.37,4526.5514,,,0.000136,0.034886,0.007955
325,325.0,ממשלת ישראל,ממשל שקלית 330,IL0011609851,לא צמוד למדד המחירים לצרכן ריבית קבועה,ישראל,ישראל,TASE,RF,פנימי,ILS,4.39,2030-03-31,0.01,0.0393,,137843.04,1.0,88.66,122.21164,,,3e-06,0.000941,0.000213
325,325.0,ממשלת ישראל,ממשל שקלית 0432,IL0011806606,לא צמוד למדד המחירים לצרכן ריבית קבועה,ישראל,ישראל,TASE,RF,פנימי,ILS,6.28,2032-04-30,0.013,0.0402,,6475.4,1.0,85.09,5.50992,,,0.0,4.2e-05,9e-06
325,325.0,ממשלת ישראל,ממשלתי צמוד 0529,IL0011570236,צמוד למדד המחירים לצרכן בריבית קבועה,ישראל,ישראל,TASE,RF,פנימי,ILS,3.63,2029-05-31,0.005,0.0193,,16086570.94,1.0,113.0,18177.82517,,,0.000546,0.140097,0.031948
325,325.0,ממשלת ישראל,ממשלתי שקלי 0229,IL0011948028,לא צמוד למדד המחירים לצרכן ריבית קבועה,ישראל,ישראל,TASE,RF,פנימי,ILS,3.2,2029-02-28,0.0375,0.0391,,524805.76,1.0,101.7,533.72745,,,1.4e-05,0.004113,0.000938
325,325.0,ממשלת ישראל,ממשלתי צמוד 0527,IL0011408478,צמוד למדד המחירים לצרכן בריבית קבועה,ישראל,ישראל,TASE,RF,פנימי,ILS,1.65,2027-05-31,0.0075,0.0209,,4908081.67,1.0,117.66,5774.84889,,,0.000201,0.044506,0.010149
325,325.0,ממשלת ישראל,ממשל שקלי 347,IL0011401937,לא צמוד למדד המחירים לצרכן ריבית קבועה,ישראל,ישראל,TASE,RF,פנימי,ILS,14.44,2047-03-31,0.0375,0.0449,,1179845.27,1.0,91.85,1083.68788,,,4.4e-05,0.008351,0.001904
325,325.0,ממשלת ישראל,ממשל צמודה 0431,IL0012207226,צמוד למדד המחירים לצרכן בריבית קבועה,ישראל,ישראל,TASE,RF,פנימי,ILS,5.29,2031-04-30,0.02,0.0199,,345794.08,1.0,103.02,356.23706,,,4.7e-05,0.002745,0.000625
325,325.0,ממשלת ישראל,ממשל קצרה 02/26,IL0012194689,לא צמוד למדד המחירים לצרכן ריבית קבועה,ישראל,ישראל,TASE,RF,פנימי,ILS,0.4,2026-02-27,0.0,0.0417,,309040.99,1.0,97.18,300.32603,,,5.9e-05,0.002314,0.000527
325,325.0,ממשלת ישראל,מ.ק.מ. 616,IL0082606141,לא צמוד למדד המחירים לצרכן ריבית קבועה,ישראל,ישראל,TASE,RF,פנימי,ILS,0.67,2026-06-03,0.0,0.042,,48195.77,1.0,97.3,46.89449,,,2e-06,0.000361,8.2e-05
325,325.0,ממשלת ישראל,ממשל צמודה 1033,IL0012043795,צמוד למדד המחירים לצרכן בריבית קבועה,ישראל,ישראל,TASE,RF,פנימי,ILS,7.53,2033-10-31,0.016,0.0195,,25878792.07,1.0,105.4,27276.24684,,,0.000978,0.210222,0.04794
325,325.0,ממשלת ישראל,ממשל שקלית 537,IL0011661803,לא צמוד למדד המחירים לצרכן ריבית קבועה,ישראל,ישראל,TASE,RF,פנימי,ILS,10.55,2037-05-31,0.015,0.0421,,196408.85,1.0,75.94,149.15288,,,4e-06,0.001149,0.000262
325,325.0,ממשלת ישראל,ממשלתי צמוד 0545,IL0011348658,צמוד למדד המחירים לצרכן בריבית קבועה,ישראל,ישראל,TASE,RF,פנימי,ILS,17.67,2045-05-31,0.01,0.0207,,1006952.18,1.0,99.57,1002.62229,,,4.4e-05,0.007727,0.001762
325,325.0,ממשלת ישראל,ממשל שקלית 927,IL0012035791,לא צמוד למדד המחירים לצרכן ריבית קבועה,ישראל,ישראל,TASE,RF,פנימי,ILS,1.96,2027-09-30,0.0375,0.0397,,1136351.37,1.0,99.62,1132.03325,,,3.1e-05,0.008724,0.001989
325,325.0,ממשלת ישראל,ממשל צמודה 1151,IL0011683013,צמוד למדד המחירים לצרכן בריבית קבועה,ישראל,ישראל,TASE,RF,פנימי,ILS,11.99,2051-11-30,0.005,0.0214,,219.75,1.0,80.45,0.17679,,,0.0,1e-06,0.0
325,325.0,ממשלת ישראל,ממשל שקלית 0226,IL0011746976,לא צמוד למדד המחירים לצרכן ריבית קבועה,ישראל,ישראל,TASE,RF,פנימי,ILS,0.4,2026-02-27,0.005,0.0409,,4160698.54,1.0,98.89,4114.51478,,,0.000167,0.03171,0.007231
325,325.0,TREASURY BILL,B 0 10/02/25,US912797MS31,"נקוב במט""ח","חו""ל","ארה""ב",אחר,AA+,Fitch,USD,0.0054,2025-10-02,0.0,0.0203,,7726.02,3.306,99.989,25.53943,,,0.0,0.000197,4.5e-05
325,325.0,TREASURY BILL,B 0 09/03/26,US912797RS85,"נקוב במט""ח","חו""ל","ארה""ב",אחר,AA+,Fitch,USD,0.91,2026-09-03,0.0,0.0365,,155106.5,3.306,96.738,496.05515,,,3e-06,0.003822,0.000871
347,347.0,ממשלת ישראל,ממשל שקלית 330,IL0011609851,לא צמוד למדד המחירים לצרכן ריבית קבועה,ישראל,ישראל,TASE,RF,פנימי,ILS,4.39,2030-03-31,0.01,0.0393,,180364.42,1.0,88.66,159.9111,,,4e-06,0.000836,7.9e-05
347,347.0,ממשלת ישראל,ממשל צמודה 1151,IL0011683013,צמוד למדד המחירים לצרכן בריבית קבועה,ישראל,ישראל,TASE,RF,פנימי,ILS,11.99,2051-11-30,0.005,0.0214,,287.53,1.0,80.45,0.23131,,,0.0,1e-06,0.0
347,347.0,ממשלת ישראל,ממשל שקלית 0226,IL0011746976,לא צמוד למדד המחירים לצרכן ריבית קבועה,ישראל,ישראל,TASE,RF,פנימי,ILS,0.4,2026-02-27,0.005,0.0409,,5444177.47,1.0,98.89,5383.7471,,,0.000219,0.028242,0.002724
347,347.0,ממשלת ישראל,ממשלתי צמוד 0529,IL0011570236,צמוד למדד המחירים לצרכן בריבית קבועה,ישראל,ישראל,TASE,RF,פנימי,ILS,3.63,2029-05-31,0.005,0.0193,,21048904.74,1.0,113.0,23785.26234,,,0.000715,0.124777,0.012036
347,347.0,ממשלת ישראל,ממשלתי צמוד 0527,IL0011408478,צמוד למדד המחירים לצרכן בריבית קבועה,ישראל,ישראל,TASE,RF,פנימי,ILS,1.65,2027-05-31,0.0075,0.0209,,6422110.94,1.0,117.66,7556.25574,,,0.000263,0.039638,0.003822
347,347.0,ממשלת ישראל,ממשל שקלית928,IL0011508798,לא צמוד למדד המחירים לצרכן ריבית קבועה,ישראל,ישראל,TASE,RF,פנימי,ILS,2.92,2028-09-28,0.0225,0.0393,,6210430.38,1.0,95.37,5922.88745,,,0.000178,0.031071,0.002995
347,347.0,ממשלת ישראל,מ.ק.מ 316,IL0082603171,לא צמוד למדד המחירים לצרכן ריבית קבועה,ישראל,ישראל,TASE,RF,פנימי,ILS,0.42,2026-03-04,0.0,0.0415,,504645.88,1.0,98.32,496.16783,,,2.8e-05,0.002602,0.00025
347,347.0,ממשלת ישראל,ממשל שקלית 537,IL0011661803,לא צמוד למדד המחירים לצרכן ריבית קבועה,ישראל,ישראל,TASE,RF,פנימי,ILS,10.55,2037-05-31,0.015,0.0421,,256996.42,1.0,75.94,195.16308,,,6e-06,0.001022,9.8e-05
347,347.0,ממשלת ישראל,מ.ק.מ. 726,IL0082607214,לא צמוד למדד המחירים לצרכן ריבית קבועה,ישראל,ישראל,TASE,RF,פנימי,ILS,0.76,2026-07-08,0.0,0.0414,,3082425.49,1.0,96.96,2988.71975,,,0.000171,0.015677,0.001511
347,347.0,ממשלת ישראל,מ.ק.מ 416,IL0082604161,לא צמוד למדד המחירים לצרכן ריבית קבועה,ישראל,ישראל,TASE,RF,פנימי,ILS,0.49,2026-04-01,0.0,0.0418,,3871340.01,1.0,98.0,3793.91321,,,0.000215,0.019902,0.00192
347,347.0,ממשלת ישראל,ממשל צמודה 1028,IL0011973265,צמוד למדד המחירים לצרכן בריבית קבועה,ישראל,ישראל,TASE,RF,פנימי,ILS,3.01,2028-10-31,0.011,0.0199,,1241048.33,1.0,105.65,1311.16758,,,3.6e-05,0.006877,0.000662
347,347.0,ממשלת ישראל,ממשל שקלית 829,IL0012128935,לא צמוד למדד המחירים לצרכן ריבית קבועה,ישראל,ישראל,TASE,RF,פנימי,ILS,3.66,2029-08-31,0.046,0.0394,,2513204.83,1.0,102.76,2582.56929,,,0.000133,0.013547,0.001305
347,347.0,ממשלת ישראל,ממשלתי צמוד 726,IL0011695645,צמוד למדד המחירים לצרכן בריבית קבועה,ישראל,ישראל,TASE,RF,פנימי,ILS,0.82,2026-07-31,0.001,0.0267,,8348559.91,1.0,116.31,9710.21004,,,0.000413,0.050939,0.004913
347,347.0,ממשלת ישראל,ממשל שקלי 347,IL0011401937,לא צמוד למדד המחירים לצרכן ריבית קבועה,ישראל,ישראל,TASE,RF,פנימי,ILS,14.44,2047-03-31,0.0375,0.0449,,1543800.14,1.0,91.85,1417.98043,,,5.8e-05,0.007437,0.000715
347,347.0,ממשלת ישראל,מ.ק.מ. 616,IL0082606141,לא צמוד למדד המחירים לצרכן ריבית קבועה,ישראל,ישראל,TASE,RF,פנימי,ILS,0.67,2026-06-03,0.0,0.042,,138434.13,1.0,97.3,134.69642,,,7e-06,0.000706,6.8e-05
347,347.0,ממשלת ישראל,ממשלתי צמוד 1131,IL0011722209,צמוד למדד המחירים לצרכן בריבית קבועה,ישראל,ישראל,TASE,RF,פנימי,ILS,6.14,2031-11-30,0.001,0.019,,34097557.73,1.0,106.54,36327.53801,,,0.000996,0.190577,0.018383
347,347.0,ממשלת ישראל,ממשל קצרה 11/25,IL0012153263,לא צמוד למדד המחירים לצרכן ריבית קבועה,ישראל,ישראל,TASE,RF,פנימי,ILS,0.16,2025-11-30,0.0,0.0412,,1819718.43,1.0,99.36,1808.07224,,,0.000286,0.009485,0.000915
347,347.0,ממשלת ישראל,ממשל קצרה 02/26,IL0012194689,לא צמוד למדד המחירים לצרכן ריבית קבועה,ישראל,ישראל,TASE,RF,פנימי,ILS,0.4,2026-02-27,0.0,0.0417,,887667.53,1.0,97.18,862.6353,,,0.000169,0.004524,0.000436
347,347.0,ממשלת ישראל,ממשלתי צמוד 841,IL0011205833,צמוד למדד המחירים לצרכן בריבית קבועה,ישראל,ישראל,TASE,RF,פנימי,ILS,13.23,2041-08-30,0.0275,0.0202,,7048.7,1.0,139.93,9.86323,,,0.0,5e-05,3e-06
347,347.0,ממשלת ישראל,מ.ק.מ. 516,IL0082605150,לא צמוד למדד המחירים לצרכן ריבית קבועה,ישראל,ישראל,TASE,RF,פנימי,ILS,0.59,2026-05-06,0.0,0.0416,,7693858.3,1.0,97.63,7511.51385,,,0.000427,0.039404,0.003801
347,347.0,ממשלת ישראל,ממשל שקלית 0142,IL0011254005,לא צמוד למדד המחירים לצרכן ריבית קבועה,ישראל,ישראל,TASE,RF,פנימי,ILS,11.17,2042-01-31,0.055,0.0434,,10069414.29,1.0,117.0,11781.21473,,,0.000324,0.061803,0.005961
347,347.0,ממשלת ישראל,ממשל צמודה 1033,IL0012043795,צמוד למדד המחירים לצרכן בריבית קבועה,ישראל,ישראל,TASE,RF,פנימי,ILS,7.53,2033-10-31,0.016,0.0195,,33861798.81,1.0,105.4,35690.33594,,,0.00128,0.187236,0.018064
347,347.0,ממשלת ישראל,ממשל שקלית 0432,IL0011806606,לא צמוד למדד המחירים לצרכן ריבית קבועה,ישראל,ישראל,TASE,RF,פנימי,ILS,6.28,2032-04-30,0.013,0.0402,,8472.92,1.0,85.09,7.2096,,,0.0,3.6e-05,3e-06
347,347.0,ממשלת ישראל,ממשל צמודה 0431,IL0012207226,צמוד למדד המחירים לצרכן בריבית קבועה,ישראל,ישראל,TASE,RF,פנימי,ILS,5.29,2031-04-30,0.02,0.0199,,452463.53,1.0,103.02,466.12792,,,6.2e-05,0.002444,0.000234
347,347.0,ממשלת ישראל,מ.ק.מ 216,IL0082602181,לא צמוד למדד המחירים לצרכן ריבית קבועה,ישראל,ישראל,TASE,RF,פנימי,ILS,0.34,2026-02-04,0.0,0.0424,,703476.52,1.0,98.6,693.62785,,,3.9e-05,0.003638,0.00035
347,347.0,ממשלת ישראל,ממשל שקלית 327,IL0011393449,לא צמוד למדד המחירים לצרכן ריבית קבועה,ישראל,ישראל,TASE,RF,פנימי,ILS,1.47,2027-03-31,0.02,0.0396,,54175.92,1.0,98.22,53.21159,,,1e-06,0.000278,2.6e-05
347,347.0,ממשלת ישראל,ממשלתי צמוד 0545,IL0011348658,צמוד למדד המחירים לצרכן בריבית קבועה,ישראל,ישראל,TASE,RF,פנימי,ILS,17.67,2045-05-31,0.01,0.0207,,1317573.57,1.0,99.57,1311.908,,,5.7e-05,0.006881,0.000663
347,347.0,ממשלת ישראל,ממשל שקלית 335,IL0012023326,לא צמוד למדד המחירים לצרכן ריבית קבועה,ישראל,ישראל,TASE,RF,פנימי,ILS,7.92,2035-03-30,0.04,0.041,,46478.84,1.0,101.25,47.05982,,,1e-06,0.000246,2.3e-05
347,347.0,ממשלת ישראל,ממשל שקלי 1152,IL0011840761,לא צמוד למדד המחירים לצרכן ריבית קבועה,ישראל,ישראל,TASE,RF,פנימי,ILS,17.24,2052-11-29,0.028,0.0461,,19976384.06,1.0,74.63,14908.37542,,,0.000722,0.078209,0.007543
347,347.0,ממשלת ישראל,ממשל שקלית 927,IL0012035791,לא צמוד למדד המחירים לצרכן ריבית קבועה,ישראל,ישראל,TASE,RF,פנימי,ILS,1.96,2027-09-30,0.0375,0.0397,,1486889.41,1.0,99.62,1481.23922,,,4.1e-05,0.007768,0.000748
347,347.0,ממשלת ישראל,ממשלתי שקלי 0229,IL0011948028,לא צמוד למדד המחירים לצרכן ריבית קבועה,ישראל,ישראל,TASE,RF,פנימי,ILS,3.2,2029-02-28,0.0375,0.0391,,686696.16,1.0,101.7,698.36999,,,1.9e-05,0.003663,0.000353
347,347.0,POLAND GOVERNMENT BOND,POLGB 6 10/25/2033,PL0000115291,"נקוב במט""ח","חו""ל",פולין,FOREIGN_GOV_SEC,A-,Fitch,PLN,6.31,2033-10-25,0.06,0.0524,,801589.23,0.9092,110.439,804.88488,,,1.3e-05,0.004222,0.000406
347,347.0,INTL FINANCE CORP,IFC 0 27/08/30,XS1280871259,"נקוב במט""ח","חו""ל",ברזיל,FOREIGN_GOV_SEC,AAA,S&P,BRL,4.89,2030-08-27,0.0,0.1222,,293427.0,0.6225,56.766,103.68782,,,0.000553,0.000543,5.2e-05
347,347.0,INTL FINANCE CORP,IFC 0 26/05/27,XS1621760302,"נקוב במט""ח","חו""ל",ברזיל,FOREIGN_GOV_SEC,AAA,S&P,BRL,1.63,2027-05-26,0.0,0.1238,,533503.65,0.6225,82.459,273.85131,,,0.000735,0.001436,0.000138
347,347.0,HUNGARY GOVERNMENT BOND,HGB 6 3/4 07/23/31,HU0000407317,"נקוב במט""ח","חו""ל",הונגריה,FOREIGN_GOV_SEC,Baa2,Moodys,HUF,4.86,2031-07-23,0.0675,0.0644,,9469689.75,0.009944,104.522,98.42481,,,3.9e-05,0.000516,4.9e-05
347,347.0,MEX BONOS DESARR FIX RT,MBONO 8 1/2 11/18/2038,MX0MGO0000J5,"נקוב במט""ח","חו""ל",מקסיקו,FOREIGN_GOV_SEC,BBB-,Fitch,MXN,7.86,2038-11-18,0.085,-0.282,,71371.4,0.1804,9889.2,1273.27407,,,0.0,0.006679,0.000644
347,347.0,INTL FINANCE CORP,IFC 11 ½ 16/01/30,XS2977993471,"נקוב במט""ח","חו""ל",ברזיל,FOREIGN_GOV_SEC,AAA,S&P,BRL,3.33,2030-01-16,0.115,0.1208,,826930.65,0.6225,106.39,547.65777,,,0.000848,0.002872,0.000276
347,347.0,MEX BONOS DESARR FIX RT,MBONO 7 3/4 29/05/31,MX0MGO0000P2,"נקוב במט""ח","חו""ל",מקסיקו,FOREIGN_GOV_SEC,BBB-,Fitch,MXN,4.59,2031-05-29,0.0775,-0.5479,,53875.87,0.1804,9997.6,971.68736,,,0.0,0.005096,0.000491
347,347.0,INTL BK RECON & DEVELOP,IBRD 10 10/17/29,XS2920414112,"נקוב במט""ח","חו""ל",ברזיל,FOREIGN_GOV_SEC,AAA,S&P,BRL,3.16,2029-10-17,0.1,0.1206,,1093682.48,0.6225,103.44,704.23746,,,0.001682,0.003694,0.000355
347,347.0,POLAND GOVERNMENT BOND,POLGB 1 3/4 04/25/32,PL0000113783,"נקוב במט""ח","חו""ל",פולין,FOREIGN_GOV_SEC,A-,Fitch,PLN,6.15,2032-04-24,0.0175,0.048,,1427122.26,0.9092,82.619,1072.01421,,,2.3e-05,0.005623,0.000541
347,347.0,POLAND GOVERNMENT BOND,POLGB 7 1/2  07/25/2028,PL0000115192,"נקוב במט""ח","חו""ל",פולין,FOREIGN_GOV_SEC,A-,Fitch,PLN,2.6,2028-07-25,0.075,0.0439,,269419.34,0.9092,109.442,268.08482,,,5e-06,0.001405,0.000134
347,347.0,AFRICAN DEVELOPMENT BANK,AFDB 0 06/05/34,XS2831196535,"נקוב במט""ח","חו""ל",ברזיל,FOREIGN_GOV_SEC,AAA,S&P,BRL,8.66,2034-06-05,0.0,0.1221,,1480472.63,0.6225,36.768,338.85176,,,0.002691,0.001777,0.000171
347,347.0,INTL FINANCE CORP,EBRD 0 02/02/32,XS2438631710,"נקוב במט""ח","חו""ל",ברזיל,FOREIGN_GOV_SEC,AAA,S&P,BRL,6.32,2032-02-02,0.0,0.1199,,880281.02,0.6225,48.758,267.18162,,,0.00044,0.001401,0.000134
347,347.0,MEX BONOS DESARR FIX RT,MBONO 7 1/2 05/26/33,MX0MGO0001D6,"נקוב במט""ח","חו""ל",מקסיקו,FOREIGN_GOV_SEC,BBB-,Fitch,MXN,5.8,2033-05-26,0.075,-0.4421,,74410.43,0.1804,9685.8,1300.18693,,,0.0,0.00682,0.000657
347,347.0,HUNGARY GOVERNMENT BOND,HGB 2 1/4 04/20/33,HU0000404744,"נקוב במט""ח","חו""ל",הונגריה,FOREIGN_GOV_SEC,Baa2,Moodys,HUF,6.82,2033-04-20,0.0225,0.067,,104033211.38,0.009944,75.239,778.35216,,,8.3e-05,0.004083,0.000393
347,347.0,POLAND GOVERNMENT BOND,POLGB 5 3/4 04/25/29,PL0000105391,"נקוב במט""ח","חו""ל",פולין,FOREIGN_GOV_SEC,A-,Fitch,PLN,3.24,2029-04-25,0.0575,0.0453,,125373.36,0.9092,106.374,121.25514,,,2e-06,0.000635,6.1e-05
347,347.0,TREASURY BILL,B 0 10/02/25,US912797MS31,"נקוב במט""ח","חו""ל","ארה""ב",אחר,AA+,Fitch,USD,0.0054,2025-10-02,0.0,0.0203,,42198.08,3.306,99.989,139.49149,,,0.0,0.000731,7.1e-05
347,347.0,TREASURY BILL,B 0 09/03/26,US912797RS85,"נקוב במט""ח","חו""ל","ארה""ב",אחר,AA+,Fitch,USD,0.91,2026-09-03,0.0,0.0365,,350962.23,3.306,96.738,1122.43274,,,6e-06,0.005886,0.000566
347,347.0,HUNGARY GOVERNMENT BOND,HGB 7 10/24/35 35/A,HU0000406624,"נקוב במט""ח","חו""ל",הונגריה,FOREIGN_GOV_SEC,Baa2,Moodys,HUF,7.09,2035-10-24,0.07,0.068,,18672627.68,0.009944,107.901,200.35124,,,1.4e-05,0.00105,0.0001
347,347.0,REPUBLIC OF BRAZIL,BRAZIL 10 1/4 01/10/28,US105756BN96,"נקוב במט""ח","חו""ל",ברזיל,FOREIGN_GOV_SEC,BB,S&P,BRL,2.03,2028-01-10,0.1025,0.0993,,589388.15,0.6225,103.027,378.00001,,,0.000123,0.00198,0.00019
347,347.0,MEX BONOS DESARR FIX RT,MBONO 7.5 06/03/27,MX0MGO0000D8,"נקוב במט""ח","חו""ל",מקסיקו,FOREIGN_GOV_SEC,BBB-,Fitch,MXN,1.57,2027-03-06,0.075,-0.9602,,14337.91,0.1804,10252.3,265.1818,,,0.0,0.00139,0.000133
347,347.0,POLAND GOVERNMENT BOND,POLGB 3 3/4 05/25/27,PL0000114393,"נקוב במט""ח","חו""ל",פולין,FOREIGN_GOV_SEC,A-,Fitch,PLN,1.59,2027-05-25,0.0375,0.1229,,533503.65,0.9092,100.706,488.48605,,,1.6e-05,0.002561,0.000246
389,389.0,ממשלת ישראל,ממשל צמודה 0431,IL0012207226,צמוד למדד המחירים לצרכן בריבית קבועה,ישראל,ישראל,TASE,RF,פנימי,ILS,5.29,2031-04-30,0.02,0.0199,,582494.35,1.0,103.02,600.08568,,,8e-05,0.002769,0.000766
389,389.0,ממשלת ישראל,ממשל שקלית 537,IL0011661803,לא צמוד למדד המחירים לצרכן ריבית קבועה,ישראל,ישראל,TASE,RF,פנימי,ILS,10.55,2037-05-31,0.015,0.0421,,330853.11,1.0,75.94,251.24985,,,8e-06,0.001159,0.00032
389,389.0,ממשלת ישראל,ממשלתי שקלי 0229,IL0011948028,לא צמוד למדד המחירים לצרכן ריבית קבועה,ישראל,ישראל,TASE,RF,פנימי,ILS,3.2,2029-02-28,0.0375,0.0391,,884041.72,1.0,101.7,899.07043,,,2.5e-05,0.00415,0.001148
389,389.0,ממשלת ישראל,ממשל שקלית 829,IL0012128935,לא צמוד למדד המחירים לצרכן ריבית קבועה,ישראל,ישראל,TASE,RF,פנימי,ILS,3.66,2029-08-31,0.046,0.0394,,3235459.98,1.0,102.76,3324.75868,,,0.000171,0.015349,0.004245
389,389.0,ממשלת ישראל,ממשלתי צמוד 0529,IL0011570236,צמוד למדד המחירים לצרכן בריבית קבועה,ישראל,ישראל,TASE,RF,פנימי,ILS,3.63,2029-05-31,0.005,0.0193,,27098025.58,1.0,113.0,30620.76892,,,0.00092,0.14137,0.039098
389,389.0,ממשלת ישראל,ממשל קצרה 11/25,IL0012153263,לא צמוד למדד המחירים לצרכן ריבית קבועה,ישראל,ישראל,TASE,RF,פנימי,ILS,0.16,2025-11-30,0.0,0.0412,,845101.81,1.0,99.36,839.69316,,,0.000133,0.003876,0.001072
389,389.0,ממשלת ישראל,מ.ק.מ. 726,IL0082607214,לא צמוד למדד המחירים לצרכן ריבית קבועה,ישראל,ישראל,TASE,RF,פנימי,ILS,0.76,2026-07-08,0.0,0.0414,,1431520.02,1.0,96.96,1388.00181,,,7.9e-05,0.006407,0.001772
389,389.0,ממשלת ישראל,ממשל שקלית 0226,IL0011746976,לא צמוד למדד המחירים לצרכן ריבית קבועה,ישראל,ישראל,TASE,RF,פנימי,ILS,0.4,2026-02-27,0.005,0.0409,,7008747.6,1.0,98.89,6930.9505,,,0.000282,0.031998,0.008849
389,389.0,ממשלת ישראל,מ.ק.מ. 616,IL0082606141,לא צמוד למדד המחירים לצרכן ריבית קבועה,ישראל,ישראל,TASE,RF,פנימי,ILS,0.67,2026-06-03,0.0,0.042,,64290.68,1.0,97.3,62.55483,,,3e-06,0.000288,7.9e-05
389,389.0,ממשלת ישראל,ממשל צמודה 1028,IL0011973265,צמוד למדד המחירים לצרכן בריבית קבועה,ישראל,ישראל,TASE,RF,פנימי,ILS,3.01,2028-10-31,0.011,0.0199,,1597705.91,1.0,105.65,1687.9763,,,4.7e-05,0.007792,0.002154
389,389.0,ממשלת ישראל,מ.ק.מ 316,IL0082603171,לא צמוד למדד המחירים לצרכן ריבית קבועה,ישראל,ישראל,TASE,RF,פנימי,ILS,0.42,2026-03-04,0.0,0.0415,,187742.12,1.0,98.32,184.58805,,,1e-05,0.000852,0.000235
389,389.0,ממשלת ישראל,ממשלתי צמוד 1131,IL0011722209,צמוד למדד המחירים לצרכן בריבית קבועה,ישראל,ישראל,TASE,RF,פנימי,ILS,6.14,2031-11-30,0.001,0.019,,43896654.18,1.0,106.54,46767.49535,,,0.001282,0.215917,0.059715
389,389.0,ממשלת ישראל,ממשלתי צמוד 726,IL0011695645,צמוד למדד המחירים לצרכן בריבית קבועה,ישראל,ישראל,TASE,RF,פנימי,ILS,0.82,2026-07-31,0.001,0.0267,,10747803.41,1.0,116.31,12500.77015,,,0.000531,0.057713,0.015961
389,389.0,ממשלת ישראל,ממשל שקלית 927,IL0012035791,לא צמוד למדד המחירים לצרכן ריבית קבועה,ישראל,ישראל,TASE,RF,פנימי,ILS,1.96,2027-09-30,0.0375,0.0397,,1914197.8,1.0,99.62,1906.92385,,,5.2e-05,0.008803,0.002434
389,389.0,ממשלת ישראל,ממשל קצרה 02/26,IL0012194689,לא צמוד למדד המחירים לצרכן ריבית קבועה,ישראל,ישראל,TASE,RF,פנימי,ILS,0.4,2026-02-27,0.0,0.0417,,412244.79,1.0,97.18,400.61948,,,7.8e-05,0.001849,0.000511
389,389.0,ממשלת ישראל,ממשלתי צמוד 0545,IL0011348658,צמוד למדד המחירים לצרכן בריבית קבועה,ישראל,ישראל,TASE,RF,פנימי,ILS,17.67,2045-05-31,0.01,0.0207,,1696223.28,1.0,99.57,1688.92952,,,7.4e-05,0.007797,0.002156
389,389.0,ממשלת ישראל,ממשל שקלית928,IL0011508798,לא צמוד למדד המחירים לצרכן ריבית קבועה,ישראל,ישראל,TASE,RF,פנימי,ILS,2.92,2028-09-28,0.0225,0.0393,,7995209.41,1.0,95.37,7625.03121,,,0.00023,0.035203,0.009735
389,389.0,ממשלת ישראל,ממשל שקלית 330,IL0011609851,לא צמוד למדד המחירים לצרכן ריבית קבועה,ישראל,ישראל,TASE,RF,פנימי,ILS,4.39,2030-03-31,0.01,0.0393,,232198.28,1.0,88.66,205.86699,,,6e-06,0.00095,0.000262
389,389.0,ממשלת ישראל,מ.ק.מ 416,IL0082604161,לא צמוד למדד המחירים לצרכן ריבית קבועה,ישראל,ישראל,TASE,RF,פנימי,ILS,0.49,2026-04-01,0.0,0.0418,,1797902.57,1.0,98.0,1761.94452,,,9.9e-05,0.008134,0.002249
389,389.0,ממשלת ישראל,ממשל צמודה 1033,IL0012043795,צמוד למדד המחירים לצרכן בריבית קבועה,ישראל,ישראל,TASE,RF,פנימי,ILS,7.53,2033-10-31,0.016,0.0195,,43593141.88,1.0,105.4,45947.17154,,,0.001648,0.212131,0.05867
389,389.0,ממשלת ישראל,ממשלתי צמוד 841,IL0011205833,צמוד למדד המחירים לצרכן בריבית קבועה,ישראל,ישראל,TASE,RF,פנימי,ILS,13.23,2041-08-30,0.0275,0.0202,,9074.37,1.0,139.93,12.69777,,,0.0,5.7e-05,1.5e-05
389,389.0,ממשלת ישראל,ממשל צמודה 1151,IL0011683013,צמוד למדד המחירים לצרכן בריבית קבועה,ישראל,ישראל,TASE,RF,פנימי,ILS,11.99,2051-11-30,0.005,0.0214,,370.16,1.0,80.45,0.29779,,,0.0,1e-06,0.0
389,389.0,ממשלת ישראל,ממשל שקלית 0142,IL0011254005,לא צמוד למדד המחירים לצרכן ריבית קבועה,ישראל,ישראל,TASE,RF,פנימי,ILS,11.17,2042-01-31,0.055,0.0434,,12963204.01,1.0,117.0,15166.94869,,,0.000418,0.070022,0.019365
389,389.0,ממשלת ישראל,ממשל שקלית 0432,IL0011806606,לא צמוד למדד המחירים לצרכן ריבית קבועה,ישראל,ישראל,TASE,RF,פנימי,ILS,6.28,2032-04-30,0.013,0.0402,,10907.9,1.0,85.09,9.28153,,,0.0,4.2e-05,1.1e-05
389,389.0,ממשלת ישראל,ממשל שקלית 327,IL0011393449,לא צמוד למדד המחירים לצרכן ריבית קבועה,ישראל,ישראל,TASE,RF,פנימי,ILS,1.47,2027-03-31,0.02,0.0396,,69745.22,1.0,98.22,68.50375,,,2e-06,0.000316,8.7e-05
389,389.0,ממשלת ישראל,מ.ק.מ. 516,IL0082605150,לא צמוד למדד המחירים לצרכן ריבית קבועה,ישראל,ישראל,TASE,RF,פנימי,ILS,0.59,2026-05-06,0.0,0.0416,,3573131.68,1.0,97.63,3488.44846,,,0.000198,0.016104,0.004453
389,389.0,ממשלת ישראל,ממשל שקלי 347,IL0011401937,לא צמוד למדד המחירים לצרכן ריבית קבועה,ישראל,ישראל,TASE,RF,פנימי,ILS,14.44,2047-03-31,0.0375,0.0449,,1987463.79,1.0,91.85,1825.4855,,,7.5e-05,0.008426,0.002329
389,389.0,ממשלת ישראל,ממשל שקלי 1152,IL0011840761,לא צמוד למדד המחירים לצרכן ריבית קבועה,ישראל,ישראל,TASE,RF,פנימי,ILS,17.24,2052-11-29,0.028,0.0461,,25717279.5,1.0,74.63,19192.80568,,,0.00093,0.088609,0.024506
389,389.0,ממשלת ישראל,ממשלתי צמוד 0527,IL0011408478,צמוד למדד המחירים לצרכן בריבית קבועה,ישראל,ישראל,TASE,RF,פנימי,ILS,1.65,2027-05-31,0.0075,0.0209,,8267723.62,1.0,117.66,9727.80361,,,0.000339,0.044911,0.012419
389,389.0,ממשלת ישראל,ממשל שקלית 335,IL0012023326,לא צמוד למדד המחירים לצרכן ריבית קבועה,ישראל,ישראל,TASE,RF,פנימי,ILS,7.92,2035-03-30,0.04,0.041,,59836.12,1.0,101.25,60.58407,,,1e-06,0.000279,7.7e-05
389,389.0,ממשלת ישראל,מ.ק.מ 216,IL0082602181,לא צמוד למדד המחירים לצרכן ריבית קבועה,ישראל,ישראל,TASE,RF,פנימי,ILS,0.34,2026-02-04,0.0,0.0424,,326703.99,1.0,98.6,322.13014,,,1.8e-05,0.001487,0.000411
389,389.0,POLAND GOVERNMENT BOND,POLGB 1 3/4 04/25/32,PL0000113783,"נקוב במט""ח","חו""ל",פולין,FOREIGN_GOV_SEC,A-,Fitch,PLN,6.15,2032-04-24,0.0175,0.048,,50410.79,0.9092,82.619,37.86717,,,0.0,0.000174,4.8e-05
389,389.0,INTL BK RECON & DEVELOP,IBRD 10 10/17/29,XS2920414112,"נקוב במט""ח","חו""ל",ברזיל,FOREIGN_GOV_SEC,AAA,S&P,BRL,3.16,2029-10-17,0.1,0.1206,,38632.57,0.6225,103.44,24.87605,,,5.9e-05,0.000114,3.1e-05
389,389.0,POLAND GOVERNMENT BOND,POLGB 7 1/2  07/25/2028,PL0000115192,"נקוב במט""ח","חו""ל",פולין,FOREIGN_GOV_SEC,A-,Fitch,PLN,2.6,2028-07-25,0.075,0.0439,,9516.8,0.9092,109.442,9.46966,,,0.0,4.3e-05,1.2e-05
389,389.0,INTL FINANCE CORP,IFC 11 ½ 16/01/30,XS2977993471,"נקוב במט""ח","חו""ל",ברזיל,FOREIGN_GOV_SEC,AAA,S&P,BRL,3.33,2030-01-16,0.115,0.1208,,29209.99,0.6225,106.39,19.34513,,,2.9e-05,8.9e-05,2.4e-05
389,389.0,INTL FINANCE CORP,IFC 0 27/08/30,XS1280871259,"נקוב במט""ח","חו""ל",ברזיל,FOREIGN_GOV_SEC,AAA,S&P,BRL,4.89,2030-08-27,0.0,0.1222,,10364.84,0.6225,56.766,3.6626,,,1.9e-05,1.6e-05,4e-06
389,389.0,MEX BONOS DESARR FIX RT,MBONO 7 1/2 05/26/33,MX0MGO0001D6,"נקוב במט""ח","חו""ל",מקסיקו,FOREIGN_GOV_SEC,BBB-,Fitch,MXN,5.8,2033-05-26,0.075,-0.4421,,2628.43,0.1804,9685.8,45.927,,,0.0,0.000212,5.8e-05
389,389.0,TREASURY BILL,B 0 09/03/26,US912797RS85,"נקוב במט""ח","חו""ל","ארה""ב",אחר,AA+,Fitch,USD,0.91,2026-09-03,0.0,0.0365,,228100.13,3.306,96.738,729.50031,,,4e-06,0.003367,0.00093
389,389.0,INTL FINANCE CORP,EBRD 0 02/02/32,XS2438631710,"נקוב במט""ח","חו""ל",ברזיל,FOREIGN_GOV_SEC,AAA,S&P,BRL,6.32,2032-02-02,0.0,0.1199,,31094.51,0.6225,48.758,9.43776,,,1.5e-05,4.3e-05,1.2e-05
389,389.0,TREASURY BILL,B 0 10/02/25,US912797MS31,"נקוב במט""ח","חו""ל","ארה""ב",אחר,AA+,Fitch,USD,0.0054,2025-10-02,0.0,0.0203,,11012.81,3.306,99.989,36.40435,,,0.0,0.000168,4.5e-05
389,389.0,MEX BONOS DESARR FIX RT,MBONO 7.5 06/03/27,MX0MGO0000D8,"נקוב במט""ח","חו""ל",מקסיקו,FOREIGN_GOV_SEC,BBB-,Fitch,MXN,1.57,2027-03-06,0.075,-0.9602,,506.46,0.1804,10252.3,9.36712,,,0.0,4.3e-05,1.1e-05
389,389.0,HUNGARY GOVERNMENT BOND,HGB 2 1/4 04/20/33,HU0000404744,"נקוב במט""ח","חו""ל",הונגריה,FOREIGN_GOV_SEC,Baa2,Moodys,HUF,6.82,2033-04-20,0.0225,0.067,,3674805.28,0.009944,75.239,27.49403,,,2e-06,0.000126,3.5e-05
389,389.0,REPUBLIC OF BRAZIL,BRAZIL 10 1/4 01/10/28,US105756BN96,"נקוב במט""ח","חו""ל",ברזיל,FOREIGN_GOV_SEC,BB,S&P,BRL,2.03,2028-01-10,0.1025,0.0993,,20819.19,0.6225,103.027,13.35225,,,4e-06,6.1e-05,1.6e-05
389,389.0,HUNGARY GOVERNMENT BOND,HGB 7 10/24/35 35/A,HU0000406624,"נקוב במט""ח","חו""ל",הונגריה,FOREIGN_GOV_SEC,Baa2,Moodys,HUF,7.09,2035-10-24,0.07,0.068,,659580.44,0.009944,107.901,7.07708,,,0.0,3.2e-05,9e-06
389,389.0,AFRICAN DEVELOPMENT BANK,AFDB 0 06/05/34,XS2831196535,"נקוב במט""ח","חו""ל",ברזיל,FOREIGN_GOV_SEC,AAA,S&P,BRL,8.66,2034-06-05,0.0,0.1221,,52295.31,0.6225,36.768,11.96939,,,9.5e-05,5.5e-05,1.5e-05
389,389.0,MEX BONOS DESARR FIX RT,MBONO 7 3/4 29/05/31,MX0MGO0000P2,"נקוב במט""ח","חו""ל",מקסיקו,FOREIGN_GOV_SEC,BBB-,Fitch,MXN,4.59,2031-05-29,0.0775,-0.5479,,1903.08,0.1804,9997.6,34.32329,,,0.0,0.000158,4.3e-05
389,389.0,POLAND GOVERNMENT BOND,POLGB 5 3/4 04/25/29,PL0000105391,"נקוב במט""ח","חו""ל",פולין,FOREIGN_GOV_SEC,A-,Fitch,PLN,3.24,2029-04-25,0.0575,0.0453,,4428.61,0.9092,106.374,4.28314,,,0.0,1.9e-05,5e-06
389,389.0,POLAND GOVERNMENT BOND,POLGB 6 10/25/2033,PL0000115291,"נקוב במט""ח","חו""ל",פולין,FOREIGN_GOV_SEC,A-,Fitch,PLN,6.31,2033-10-25,0.06,0.0524,,28314.85,0.9092,110.439,28.43126,,,0.0,0.000131,3.6e-05
389,389.0,POLAND GOVERNMENT BOND,POLGB 3 3/4 05/25/27,PL0000114393,"נקוב במט""ח","חו""ל",פולין,FOREIGN_GOV_SEC,A-,Fitch,PLN,1.59,2027-05-25,0.0375,0.1229,,18845.16,0.9092,100.706,17.25498,,,0.0,7.9e-05,2.2e-05
389,389.0,MEX BONOS DESARR FIX RT,MBONO 8 1/2 11/18/2038,MX0MGO0000J5,"נקוב במט""ח","חו""ל",מקסיקו,FOREIGN_GOV_SEC,BBB-,Fitch,MXN,7.86,2038-11-18,0.085,-0.282,,2521.08,0.1804,9889.2,44.97635,,,0.0,0.000207,5.7e-05
389,389.0,INTL FINANCE CORP,IFC 0 26/05/27,XS1621760302,"נקוב במט""ח","חו""ל",ברזיל,FOREIGN_GOV_SEC,AAA,S&P,BRL,1.63,2027-05-26,0.0,0.1238,,18845.16,0.6225,82.459,9.67336,,,2.5e-05,4.4e-05,1.2e-05
389,389.0,HUNGARY GOVERNMENT BOND,HGB 6 3/4 07/23/31,HU0000407317,"נקוב במט""ח","חו""ל",הונגריה,FOREIGN_GOV_SEC,Baa2,Moodys,HUF,4.86,2031-07-23,0.0675,0.0644,,334501.51,0.009944,104.522,3.4767,,,1e-06,1.6e-05,4e-06
671,12120.0,ממשלת ישראל,ממשל צמודה 1033,IL0012043795,צמוד למדד המחירים לצרכן בריבית קבועה,ישראל,ישראל,TASE,RF,פנימי,ILS,7.53,2033-10-31,0.016,0.0195,,26687409.7,1.0,105.4,28128.52983,,,0.001009,0.211214,0.075015
671,12120.0,ממשלת ישראל,ממשלתי צמוד 0529,IL0011570236,צמוד למדד המחירים לצרכן בריבית קבועה,ישראל,ישראל,TASE,RF,פנימי,ILS,3.63,2029-05-31,0.005,0.0193,,16589217.47,1.0,113.0,18745.81574,,,0.000563,0.140758,0.049992
671,12120.0,ממשלת ישראל,ממשל צמודה 1028,IL0011973265,צמוד למדד המחירים לצרכן בריבית קבועה,ישראל,ישראל,TASE,RF,פנימי,ILS,3.01,2028-10-31,0.011,0.0199,,978104.13,1.0,105.65,1033.36702,,,2.9e-05,0.007759,0.002755
671,12120.0,ממשלת ישראל,ממשל שקלית 537,IL0011661803,לא צמוד למדד המחירים לצרכן ריבית קבועה,ישראל,ישראל,TASE,RF,פנימי,ILS,10.55,2037-05-31,0.015,0.0421,,202545.91,1.0,75.94,153.81336,,,5e-06,0.001154,0.00041
671,12120.0,ממשלת ישראל,מ.ק.מ. 726,IL0082607214,לא צמוד למדד המחירים לצרכן ריבית קבועה,ישראל,ישראל,TASE,RF,פנימי,ILS,0.76,2026-07-08,0.0,0.0414,,705645.78,1.0,96.96,684.19415,,,3.9e-05,0.005137,0.001824
671,12120.0,ממשלת ישראל,ממשל שקלית 829,IL0012128935,לא צמוד למדד המחירים לצרכן ריבית קבועה,ישראל,ישראל,TASE,RF,פנימי,ILS,3.66,2029-08-31,0.046,0.0394,,1980725.46,1.0,102.76,2035.39348,,,0.000104,0.015283,0.005427
671,12120.0,ממשלת ישראל,ממשל שקלית 0432,IL0011806606,לא צמוד למדד המחירים לצרכן ריבית קבועה,ישראל,ישראל,TASE,RF,פנימי,ILS,6.28,2032-04-30,0.013,0.0402,,6677.74,1.0,85.09,5.68209,,,0.0,4.2e-05,1.5e-05
671,12120.0,ממשלת ישראל,ממשל קצרה 11/25,IL0012153263,לא צמוד למדד המחירים לצרכן ריבית קבועה,ישראל,ישראל,TASE,RF,פנימי,ILS,0.16,2025-11-30,0.0,0.0412,,416579.94,1.0,99.36,413.91383,,,6.5e-05,0.003108,0.001103
671,12120.0,ממשלת ישראל,ממשל שקלית 0142,IL0011254005,לא צמוד למדד המחירים לצרכן ריבית קבועה,ישראל,ישראל,TASE,RF,פנימי,ILS,11.17,2042-01-31,0.055,0.0434,,7935980.79,1.0,117.0,9285.09752,,,0.000256,0.069719,0.024761
671,12120.0,ממשלת ישראל,ממשל שקלית 927,IL0012035791,לא צמוד למדד המחירים לצרכן ריבית קבועה,ישראל,ישראל,TASE,RF,פנימי,ILS,1.96,2027-09-30,0.0375,0.0397,,1171858.2,1.0,99.62,1167.40515,,,3.2e-05,0.008765,0.003112
671,12120.0,ממשלת ישראל,ממשלתי צמוד 841,IL0011205833,צמוד למדד המחירים לצרכן בריבית קבועה,ישראל,ישראל,TASE,RF,פנימי,ILS,13.23,2041-08-30,0.0275,0.0202,,5555.27,1.0,139.93,7.77348,,,0.0,5.7e-05,1.9e-05
671,12120.0,ממשלת ישראל,ממשל שקלית928,IL0011508798,לא צמוד למדד המחירים לצרכן ריבית קבועה,ישראל,ישראל,TASE,RF,פנימי,ILS,2.92,2028-09-28,0.0225,0.0393,,4894610.03,1.0,95.37,4667.98957,,,0.00014,0.035051,0.012447
671,12120.0,ממשלת ישראל,ממשל קצרה 02/26,IL0012194689,לא צמוד למדד המחירים לצרכן ריבית קבועה,ישראל,ישראל,TASE,RF,פנימי,ILS,0.4,2026-02-27,0.0,0.0417,,203209.73,1.0,97.18,197.47921,,,3.8e-05,0.001482,0.000526
671,12120.0,ממשלת ישראל,ממשל שקלי 1152,IL0011840761,לא צמוד למדד המחירים לצרכן ריבית קבועה,ישראל,ישראל,TASE,RF,פנימי,ILS,17.24,2052-11-29,0.028,0.0461,,15743934.59,1.0,74.63,11749.69838,,,0.000569,0.088226,0.031334
671,12120.0,ממשלת ישראל,מ.ק.מ 316,IL0082603171,לא צמוד למדד המחירים לצרכן ריבית קבועה,ישראל,ישראל,TASE,RF,פנימי,ILS,0.42,2026-03-04,0.0,0.0415,,82589.56,1.0,98.32,81.20205,,,4e-06,0.000609,0.000216
671,12120.0,ממשלת ישראל,ממשל צמודה 1151,IL0011683013,צמוד למדד המחירים לצרכן בריבית קבועה,ישראל,ישראל,TASE,RF,פנימי,ILS,11.99,2051-11-30,0.005,0.0214,,226.61,1.0,80.45,0.18231,,,0.0,1e-06,0.0
671,12120.0,ממשלת ישראל,ממשל צמודה 0431,IL0012207226,צמוד למדד המחירים לצרכן בריבית קבועה,ישראל,ישראל,TASE,RF,פנימי,ILS,5.29,2031-04-30,0.02,0.0199,,356598.88,1.0,103.02,367.36816,,,4.9e-05,0.002758,0.000979
671,12120.0,ממשלת ישראל,ממשלתי צמוד 1131,IL0011722209,צמוד למדד המחירים לצרכן בריבית קבועה,ישראל,ישראל,TASE,RF,פנימי,ILS,6.14,2031-11-30,0.001,0.019,,26873217.76,1.0,106.54,28630.7262,,,0.000785,0.214984,0.076353
671,12120.0,ממשלת ישראל,ממשל שקלית 327,IL0011393449,לא צמוד למדד המחירים לצרכן ריבית קבועה,ישראל,ישראל,TASE,RF,פנימי,ILS,1.47,2027-03-31,0.02,0.0396,,42697.52,1.0,98.22,41.93751,,,1e-06,0.000314,0.000111
671,12120.0,ממשלת ישראל,ממשל שקלית 330,IL0011609851,לא צמוד למדד המחירים לצרכן ריבית קבועה,ישראל,ישראל,TASE,RF,פנימי,ILS,4.39,2030-03-31,0.01,0.0393,,142150.13,1.0,88.66,126.03031,,,3e-06,0.000945,0.000335
671,12120.0,ממשלת ישראל,ממשלתי צמוד 0527,IL0011408478,צמוד למדד המחירים לצרכן בריבית קבועה,ישראל,ישראל,TASE,RF,פנימי,ILS,1.65,2027-05-31,0.0075,0.0209,,5061441.27,1.0,117.66,5955.2918,,,0.000207,0.044716,0.015881
671,12120.0,ממשלת ישראל,מ.ק.מ. 516,IL0082605150,לא צמוד למדד המחירים לצרכן ריבית קבועה,ישראל,ישראל,TASE,RF,פנימי,ILS,0.59,2026-05-06,0.0,0.0416,,1761320.32,1.0,97.63,1719.57702,,,9.7e-05,0.012911,0.004585
671,12120.0,ממשלת ישראל,ממשל שקלי 347,IL0011401937,לא צמוד למדד המחירים לצרכן ריבית קבועה,ישראל,ישראל,TASE,RF,פנימי,ILS,14.44,2047-03-31,0.0375,0.0449,,1216711.12,1.0,91.85,1117.54916,,,4.6e-05,0.008391,0.002978
671,12120.0,ממשלת ישראל,ממשלתי צמוד 0545,IL0011348658,צמוד למדד המחירים לצרכן בריבית קבועה,ישראל,ישראל,TASE,RF,פנימי,ILS,17.67,2045-05-31,0.01,0.0207,,1038415.76,1.0,99.57,1033.95057,,,4.5e-05,0.007763,0.002757
671,12120.0,ממשלת ישראל,מ.ק.מ. 616,IL0082606141,לא צמוד למדד המחירים לצרכן ריבית קבועה,ישראל,ישראל,TASE,RF,פנימי,ILS,0.67,2026-06-03,0.0,0.042,,31691.1,1.0,97.3,30.83544,,,1e-06,0.000231,8.2e-05
671,12120.0,ממשלת ישראל,מ.ק.מ 216,IL0082602181,לא צמוד למדד המחירים לצרכן ריבית קבועה,ישראל,ישראל,TASE,RF,פנימי,ILS,0.34,2026-02-04,0.0,0.0424,,161043.71,1.0,98.6,158.7891,,,8e-06,0.001192,0.000423
671,12120.0,ממשלת ישראל,ממשלתי שקלי 0229,IL0011948028,לא צמוד למדד המחירים לצרכן ריבית קבועה,ישראל,ישראל,TASE,RF,פנימי,ILS,3.2,2029-02-28,0.0375,0.0391,,541204.02,1.0,101.7,550.40449,,,1.5e-05,0.004132,0.001467
671,12120.0,ממשלת ישראל,ממשל שקלית 0226,IL0011746976,לא צמוד למדד המחירים לצרכן ריבית קבועה,ישראל,ישראל,TASE,RF,פנימי,ILS,0.4,2026-02-27,0.005,0.0409,,4290705.16,1.0,98.89,4243.07833,,,0.000173,0.03186,0.011315
671,12120.0,ממשלת ישראל,ממשל שקלית 335,IL0012023326,לא צמוד למדד המחירים לצרכן ריבית קבועה,ישראל,ישראל,TASE,RF,פנימי,ILS,7.92,2035-03-30,0.04,0.041,,36631.24,1.0,101.25,37.08913,,,1e-06,0.000278,9.8e-05
671,12120.0,ממשלת ישראל,מ.ק.מ 416,IL0082604161,לא צמוד למדד המחירים לצרכן ריבית קבועה,ישראל,ישראל,TASE,RF,פנימי,ILS,0.49,2026-04-01,0.0,0.0418,,886248.42,1.0,98.0,868.52346,,,4.9e-05,0.006521,0.002316
671,12120.0,ממשלת ישראל,ממשלתי צמוד 726,IL0011695645,צמוד למדד המחירים לצרכן בריבית קבועה,ישראל,ישראל,TASE,RF,פנימי,ILS,0.82,2026-07-31,0.001,0.0267,,6579728.39,1.0,116.31,7652.88208,,,0.000325,0.057464,0.020408
671,12120.0,INTL BK RECON & DEVELOP,IBRD 10 10/17/29,XS2920414112,"נקוב במט""ח","חו""ל",ברזיל,FOREIGN_GOV_SEC,AAA,S&P,BRL,3.16,2029-10-17,0.1,0.1206,,197937.49,0.6225,103.44,127.45472,,,0.000304,0.000957,0.000339
671,12120.0,INTL FINANCE CORP,IFC 11 ½ 16/01/30,XS2977993471,"נקוב במט""ח","חו""ל",ברזיל,FOREIGN_GOV_SEC,AAA,S&P,BRL,3.33,2030-01-16,0.115,0.1208,,149660.05,0.6225,106.39,99.11652,,,0.000153,0.000744,0.000264
671,12120.0,HUNGARY GOVERNMENT BOND,HGB 7 10/24/35 35/A,HU0000406624,"נקוב במט""ח","חו""ל",הונגריה,FOREIGN_GOV_SEC,Baa2,Moodys,HUF,7.09,2035-10-24,0.07,0.068,,3379420.51,0.009944,107.901,36.26009,,,2e-06,0.000272,9.6e-05
671,12120.0,POLAND GOVERNMENT BOND,POLGB 1 3/4 04/25/32,PL0000113783,"נקוב במט""ח","חו""ל",פולין,FOREIGN_GOV_SEC,A-,Fitch,PLN,6.15,2032-04-24,0.0175,0.048,,258284.28,0.9092,82.619,194.01591,,,4e-06,0.001456,0.000517
671,12120.0,MEX BONOS DESARR FIX RT,MBONO 7 3/4 29/05/31,MX0MGO0000P2,"נקוב במט""ח","חו""ל",מקסיקו,FOREIGN_GOV_SEC,BBB-,Fitch,MXN,4.59,2031-05-29,0.0775,-0.5479,,9750.59,0.1804,9997.6,175.85849,,,0.0,0.00132,0.000468
671,12120.0,MEX BONOS DESARR FIX RT,MBONO 8 1/2 11/18/2038,MX0MGO0000J5,"נקוב במט""ח","חו""ל",מקסיקו,FOREIGN_GOV_SEC,BBB-,Fitch,MXN,7.86,2038-11-18,0.085,-0.282,,12916.98,0.1804,9889.2,230.44044,,,0.0,0.00173,0.000614
671,12120.0,POLAND GOVERNMENT BOND,POLGB 3 3/4 05/25/27,PL0000114393,"נקוב במט""ח","חו""ל",פולין,FOREIGN_GOV_SEC,A-,Fitch,PLN,1.59,2027-05-25,0.0375,0.1229,,96554.87,0.9092,100.706,88.40747,,,2e-06,0.000663,0.000235
671,12120.0,HUNGARY GOVERNMENT BOND,HGB 6 3/4 07/23/31,HU0000407317,"נקוב במט""ח","חו""ל",הונגריה,FOREIGN_GOV_SEC,Baa2,Moodys,HUF,4.86,2031-07-23,0.0675,0.0644,,1713848.97,0.009944,104.522,17.81318,,,7e-06,0.000133,4.7e-05
671,12120.0,REPUBLIC OF BRAZIL,BRAZIL 10 1/4 01/10/28,US105756BN96,"נקוב במט""ח","חו""ל",ברזיל,FOREIGN_GOV_SEC,BB,S&P,BRL,2.03,2028-01-10,0.1025,0.0993,,106668.99,0.6225,103.027,68.41142,,,2.2e-05,0.000513,0.000182
671,12120.0,INTL FINANCE CORP,IFC 0 27/08/30,XS1280871259,"נקוב במט""ח","חו""ל",ברזיל,FOREIGN_GOV_SEC,AAA,S&P,BRL,4.89,2030-08-27,0.0,0.1222,,53105.18,0.6225,56.766,18.76569,,,0.0001,0.00014,5e-05
671,12120.0,INTL FINANCE CORP,IFC 0 26/05/27,XS1621760302,"נקוב במט""ח","חו""ל",ברזיל,FOREIGN_GOV_SEC,AAA,S&P,BRL,1.63,2027-05-26,0.0,0.1238,,96554.87,0.6225,82.459,49.56232,,,0.000133,0.000372,0.000132
671,12120.0,POLAND GOVERNMENT BOND,POLGB 5 3/4 04/25/29,PL0000105391,"נקוב במט""ח","חו""ל",פולין,FOREIGN_GOV_SEC,A-,Fitch,PLN,3.24,2029-04-25,0.0575,0.0453,,22690.39,0.9092,106.374,21.94507,,,0.0,0.000164,5.8e-05
671,12120.0,MEX BONOS DESARR FIX RT,MBONO 7.5 06/03/27,MX0MGO0000D8,"נקוב במט""ח","חו""ל",מקסיקו,FOREIGN_GOV_SEC,BBB-,Fitch,MXN,1.57,2027-03-06,0.075,-0.9602,,2594.91,0.1804,10252.3,47.99329,,,0.0,0.00036,0.000127
671,12120.0,POLAND GOVERNMENT BOND,POLGB 6 10/25/2033,PL0000115291,"נקוב במט""ח","חו""ל",פולין,FOREIGN_GOV_SEC,A-,Fitch,PLN,6.31,2033-10-25,0.06,0.0524,,145073.69,0.9092,110.439,145.67015,,,2e-06,0.001093,0.000388
671,12120.0,POLAND GOVERNMENT BOND,POLGB 7 1/2  07/25/2028,PL0000115192,"נקוב במט""ח","חו""ל",פולין,FOREIGN_GOV_SEC,A-,Fitch,PLN,2.6,2028-07-25,0.075,0.0439,,48760.21,0.9092,109.442,48.51868,,,1e-06,0.000364,0.000129
671,12120.0,TREASURY BILL,B 0 10/02/25,US912797MS31,"נקוב במט""ח","חו""ל","ארה""ב",אחר,AA+,Fitch,USD,0.0054,2025-10-02,0.0,0.0203,,8701.06,3.306,99.989,28.76251,,,0.0,0.000215,7.5e-05
671,12120.0,TREASURY BILL,B 0 09/03/26,US912797RS85,"נקוב במט""ח","חו""ל","ארה""ב",אחר,AA+,Fitch,USD,0.91,2026-09-03,0.0,0.0365,,124584.92,3.306,96.738,398.44229,,,2e-06,0.002991,0.001061
671,12120.0,HUNGARY GOVERNMENT BOND,HGB 2 1/4 04/20/33,HU0000404744,"נקוב במט""ח","חו""ל",הונגריה,FOREIGN_GOV_SEC,Baa2,Moodys,HUF,6.82,2033-04-20,0.0225,0.067,,18828199.99,0.009944,75.239,140.86819,,,1.5e-05,0.001057,0.000375
671,12120.0,AFRICAN DEVELOPMENT BANK,AFDB 0 06/05/34,XS2831196535,"נקוב במט""ח","חו""ל",ברזיל,FOREIGN_GOV_SEC,AAA,S&P,BRL,8.66,2034-06-05,0.0,0.1221,,267939.77,0.6225,36.768,61.32627,,,0.000487,0.00046,0.000163
671,12120.0,INTL FINANCE CORP,EBRD 0 02/02/32,XS2438631710,"נקוב במט""ח","חו""ל",ברזיל,FOREIGN_GOV_SEC,AAA,S&P,BRL,6.32,2032-02-02,0.0,0.1199,,159315.54,0.6225,48.758,48.35522,,,7.9e-05,0.000363,0.000128
671,12120.0,MEX BONOS DESARR FIX RT,MBONO 7 1/2 05/26/33,MX0MGO0001D6,"נקוב במט""ח","חו""ל",מקסיקו,FOREIGN_GOV_SEC,BBB-,Fitch,MXN,5.8,2033-05-26,0.075,-0.4421,,13466.99,0.1804,9685.8,235.3112,,,0.0,0.001766,0.000627
671,13465.0,TREASURY BILL,B 0 09/03/26,US912797RS85,"נקוב במט""ח","חו""ל","ארה""ב",אחר,AA+,Fitch,USD,0.91,2026-09-03,0.0,0.0365,,14636413.88,3.306,96.738,46809.56822,,,0.000286,0.27196,0.020074
671,13465.0,TREASURY BILL,B 0 08/06/26,US912797RG48,"נקוב במט""ח","חו""ל","ארה""ב",אחר,AA+,Fitch,USD,0.84,2026-08-06,0.0,0.0371,,325253.64,3.306,96.953,1042.5245,,,6e-06,0.006057,0.000447
671,13465.0,TREASURY BILL,B 0 30/10/25,US912797NA14,"נקוב במט""ח","חו""ל","ארה""ב",אחר,AA+,Fitch,USD,0.07,2025-10-30,0.0,0.0405,,26291336.03,3.306,99.674,86635.80047,,,8.7e-05,0.503347,0.037154
671,13465.0,TREASURY BILL,B 0 10/02/25,US912797MS31,"נקוב במט""ח","חו""ל","ארה""ב",אחר,AA+,Fitch,USD,0.0054,2025-10-02,0.0,0.0203,,11383877.46,3.306,99.989,37630.95901,,,3.8e-05,0.218633,0.016138
671,14287.0,TREASURY BILL,B 0 08/06/26,US912797RG48,"נקוב במט""ח","חו""ל","ארה""ב",אחר,AA+,Fitch,USD,0.84,2026-08-06,0.0,0.0371,,9741.47,3.306,96.953,31.224,,,0.0,0.999999,0.003072
671,14288.0,ממשלת ישראל,ממשל צמודה 1033,IL0012043795,צמוד למדד המחירים לצרכן בריבית קבועה,ישראל,ישראל,TASE,RF,פנימי,ILS,7.53,2033-10-31,0.016,0.0195,,146323.33,1.0,105.4,154.22479,,,5e-06,0.192781,0.050508
671,14288.0,ממשלת ישראל,מ.ק.מ 416,IL0082604161,לא צמוד למדד המחירים לצרכן ריבית קבועה,ישראל,ישראל,TASE,RF,פנימי,ILS,0.49,2026-04-01,0.0,0.0418,,18883.42,1.0,98.0,18.50575,,,1e-06,0.023132,0.00606
671,14288.0,ממשלת ישראל,מ.ק.מ 316,IL0082603171,לא צמוד למדד המחירים לצרכן ריבית קבועה,ישראל,ישראל,TASE,RF,פנימי,ILS,0.42,2026-03-04,0.0,0.0415,,1547.85,1.0,98.32,1.52184,,,0.0,0.001902,0.000498
671,14288.0,ממשלת ישראל,ממשלתי צמוד 0545,IL0011348658,צמוד למדד המחירים לצרכן בריבית קבועה,ישראל,ישראל,TASE,RF,פנימי,ILS,17.67,2045-05-31,0.01,0.0207,,5693.49,1.0,99.57,5.66901,,,0.0,0.007086,0.001856
671,14288.0,ממשלת ישראל,ממשל שקלית 829,IL0012128935,לא צמוד למדד המחירים לצרכן ריבית קבועה,ישראל,ישראל,TASE,RF,פנימי,ILS,3.66,2029-08-31,0.046,0.0394,,10860.04,1.0,102.76,11.15978,,,0.0,0.013949,0.003654
671,14288.0,ממשלת ישראל,ממשל קצרה 02/26,IL0012194689,לא צמוד למדד המחירים לצרכן ריבית קבועה,ישראל,ישראל,TASE,RF,פנימי,ILS,0.4,2026-02-27,0.0,0.0417,,4329.82,1.0,97.18,4.20772,,,0.0,0.005259,0.001378
671,14288.0,ממשלת ישראל,ממשל שקלי 347,IL0011401937,לא צמוד למדד המחירים לצרכן ריבית קבועה,ישראל,ישראל,TASE,RF,פנימי,ILS,14.44,2047-03-31,0.0375,0.0449,,6671.06,1.0,91.85,6.12737,,,0.0,0.007657,0.002005
671,14288.0,ממשלת ישראל,ממשלתי צמוד 0527,IL0011408478,צמוד למדד המחירים לצרכן בריבית קבועה,ישראל,ישראל,TASE,RF,פנימי,ILS,1.65,2027-05-31,0.0075,0.0209,,27751.16,1.0,117.66,32.65203,,,1e-06,0.040813,0.010692
671,14288.0,ממשלת ישראל,מ.ק.מ. 516,IL0082605150,לא צמוד למדד המחירים לצרכן ריבית קבועה,ישראל,ישראל,TASE,RF,פנימי,ILS,0.59,2026-05-06,0.0,0.0416,,37528.69,1.0,97.63,36.63926,,,2e-06,0.045799,0.011999
671,14288.0,ממשלת ישראל,ממשלתי שקלי 0229,IL0011948028,לא צמוד למדד המחירים לצרכן ריבית קבועה,ישראל,ישראל,TASE,RF,פנימי,ILS,3.2,2029-02-28,0.0375,0.0391,,2967.35,1.0,101.7,3.01779,,,0.0,0.003772,0.000988
671,14288.0,ממשלת ישראל,ממשל שקלית928,IL0011508798,לא צמוד למדד המחירים לצרכן ריבית קבועה,ישראל,ישראל,TASE,RF,פנימי,ILS,2.92,2028-09-28,0.0225,0.0393,,26836.46,1.0,95.37,25.59393,,,0.0,0.031991,0.008381
671,14288.0,ממשלת ישראל,מ.ק.מ 216,IL0082602181,לא צמוד למדד המחירים לצרכן ריבית קבועה,ישראל,ישראל,TASE,RF,פנימי,ILS,0.34,2026-02-04,0.0,0.0424,,3431.38,1.0,98.6,3.38334,,,0.0,0.004229,0.001108
671,14288.0,ממשלת ישראל,ממשל קצרה 11/25,IL0012153263,לא צמוד למדד המחירים לצרכן ריבית קבועה,ישראל,ישראל,TASE,RF,פנימי,ILS,0.16,2025-11-30,0.0,0.0412,,8876.13,1.0,99.36,8.81932,,,1e-06,0.011024,0.002888
671,14288.0,ממשלת ישראל,ממשל שקלית 927,IL0012035791,לא צמוד למדד המחירים לצרכן ריבית קבועה,ישראל,ישראל,TASE,RF,פנימי,ILS,1.96,2027-09-30,0.0375,0.0397,,6425.13,1.0,99.62,6.40071,,,0.0,0.008,0.002095
671,14288.0,ממשלת ישראל,ממשל צמודה 1151,IL0011683013,צמוד למדד המחירים לצרכן בריבית קבועה,ישראל,ישראל,TASE,RF,פנימי,ILS,11.99,2051-11-30,0.005,0.0214,,1.24,1.0,80.45,0.001,,,0.0,1e-06,0.0
671,14288.0,ממשלת ישראל,ממשל צמודה 0431,IL0012207226,צמוד למדד המחירים לצרכן בריבית קבועה,ישראל,ישראל,TASE,RF,פנימי,ILS,5.29,2031-04-30,0.02,0.0199,,1955.18,1.0,103.02,2.01422,,,0.0,0.002517,0.000658
671,14288.0,ממשלת ישראל,ממשל שקלי 1152,IL0011840761,לא צמוד למדד המחירים לצרכן ריבית קבועה,ישראל,ישראל,TASE,RF,פנימי,ILS,17.24,2052-11-29,0.028,0.0461,,86321.78,1.0,74.63,64.42195,,,3e-06,0.080526,0.021097
671,14288.0,ממשלת ישראל,ממשלתי צמוד 1131,IL0011722209,צמוד למדד המחירים לצרכן בריבית קבועה,ישראל,ישראל,TASE,RF,פנימי,ILS,6.14,2031-11-30,0.001,0.019,,147342.1,1.0,106.54,156.97826,,,4e-06,0.19622,0.051409
671,14288.0,ממשלת ישראל,מ.ק.מ. 726,IL0082607214,לא צמוד למדד המחירים לצרכן ריבית קבועה,ישראל,ישראל,TASE,RF,פנימי,ILS,0.76,2026-07-08,0.0,0.0414,,15035.29,1.0,96.96,14.57822,,,0.0,0.018222,0.004773
671,14288.0,ממשלת ישראל,ממשלתי צמוד 841,IL0011205833,צמוד למדד המחירים לצרכן בריבית קבועה,ישראל,ישראל,TASE,RF,פנימי,ILS,13.23,2041-08-30,0.0275,0.0202,,30.46,1.0,139.93,0.04262,,,0.0,5.2e-05,1.3e-05
671,14288.0,ממשלת ישראל,ממשל שקלית 330,IL0011609851,לא צמוד למדד המחירים לצרכן ריבית קבועה,ישראל,ישראל,TASE,RF,פנימי,ILS,4.39,2030-03-31,0.01,0.0393,,779.39,1.0,88.66,0.69101,,,0.0,0.000863,0.000225
671,14288.0,ממשלת ישראל,ממשל שקלית 0142,IL0011254005,לא צמוד למדד המחירים לצרכן ריבית קבועה,ישראל,ישראל,TASE,RF,פנימי,ILS,11.17,2042-01-31,0.055,0.0434,,43511.87,1.0,117.0,50.90889,,,1e-06,0.063634,0.016672
671,14288.0,ממשלת ישראל,ממשלתי צמוד 726,IL0011695645,צמוד למדד המחירים לצרכן בריבית קבועה,ישראל,ישראל,TASE,RF,פנימי,ILS,0.82,2026-07-31,0.001,0.0267,,36075.73,1.0,116.31,41.95968,,,1e-06,0.052449,0.013741
671,14288.0,ממשלת ישראל,ממשל שקלית 327,IL0011393449,לא צמוד למדד המחירים לצרכן ריבית קבועה,ישראל,ישראל,TASE,RF,פנימי,ILS,1.47,2027-03-31,0.02,0.0396,,234.1,1.0,98.22,0.22994,,,0.0,0.000287,7.5e-05
671,14288.0,ממשלת ישראל,ממשלתי צמוד 0529,IL0011570236,צמוד למדד המחירים לצרכן בריבית קבועה,ישראל,ישראל,TASE,RF,פנימי,ILS,3.63,2029-05-31,0.005,0.0193,,90956.36,1.0,113.0,102.78069,,,3e-06,0.128474,0.03366
671,14288.0,ממשלת ישראל,מ.ק.מ. 616,IL0082606141,לא צמוד למדד המחירים לצרכן ריבית קבועה,ישראל,ישראל,TASE,RF,פנימי,ILS,0.67,2026-06-03,0.0,0.042,,675.25,1.0,97.3,0.65701,,,0.0,0.000821,0.000215
671,14288.0,ממשלת ישראל,ממשל שקלית 0226,IL0011746976,לא צמוד למדד המחירים לצרכן ריבית קבועה,ישראל,ישראל,TASE,RF,פנימי,ILS,0.4,2026-02-27,0.005,0.0409,,23525.34,1.0,98.89,23.26421,,,0.0,0.029079,0.007618
671,14288.0,ממשלת ישראל,ממשל צמודה 1028,IL0011973265,צמוד למדד המחירים לצרכן בריבית קבועה,ישראל,ישראל,TASE,RF,פנימי,ILS,3.01,2028-10-31,0.011,0.0199,,5362.81,1.0,105.65,5.66581,,,0.0,0.007082,0.001855
671,14288.0,ממשלת ישראל,ממשל שקלית 0432,IL0011806606,לא צמוד למדד המחירים לצרכן ריבית קבועה,ישראל,ישראל,TASE,RF,פנימי,ILS,6.28,2032-04-30,0.013,0.0402,,36.61,1.0,85.09,0.03115,,,0.0,3.8e-05,1e-05
671,14288.0,ממשלת ישראל,ממשל שקלית 335,IL0012023326,לא צמוד למדד המחירים לצרכן ריבית קבועה,ישראל,ישראל,TASE,RF,פנימי,ILS,7.92,2035-03-30,0.04,0.041,,200.84,1.0,101.25,0.20335,,,0.0,0.000254,6.6e-05
671,14288.0,ממשלת ישראל,ממשל שקלית 537,IL0011661803,לא צמוד למדד המחירים לצרכן ריבית קבועה,ישראל,ישראל,TASE,RF,פנימי,ILS,10.55,2037-05-31,0.015,0.0421,,1110.53,1.0,75.94,0.84334,,,0.0,0.001054,0.000276
671,14288.0,HUNGARY GOVERNMENT BOND,HGB 7 10/24/35 35/A,HU0000406624,"נקוב במט""ח","חו""ל",הונגריה,FOREIGN_GOV_SEC,Baa2,Moodys,HUF,7.09,2035-10-24,0.07,0.068,,20104.36,0.009944,107.901,0.21571,,,0.0,0.000269,7e-05
671,14288.0,POLAND GOVERNMENT BOND,POLGB 6 10/25/2033,PL0000115291,"נקוב במט""ח","חו""ל",פולין,FOREIGN_GOV_SEC,A-,Fitch,PLN,6.31,2033-10-25,0.06,0.0524,,863.05,0.9092,110.439,0.8666,,,0.0,0.001083,0.000283
671,14288.0,POLAND GOVERNMENT BOND,POLGB 1 3/4 04/25/32,PL0000113783,"נקוב במט""ח","חו""ל",פולין,FOREIGN_GOV_SEC,A-,Fitch,PLN,6.15,2032-04-24,0.0175,0.048,,1536.55,0.9092,82.619,1.15421,,,0.0,0.001442,0.000378
671,14288.0,HUNGARY GOVERNMENT BOND,HGB 6 3/4 07/23/31,HU0000407317,"נקוב במט""ח","חו""ל",הונגריה,FOREIGN_GOV_SEC,Baa2,Moodys,HUF,4.86,2031-07-23,0.0675,0.0644,,10195.78,0.009944,104.522,0.10597,,,0.0,0.000132,3.4e-05
671,14288.0,INTL FINANCE CORP,IFC 0 26/05/27,XS1621760302,"נקוב במט""ח","חו""ל",ברזיל,FOREIGN_GOV_SEC,AAA,S&P,BRL,1.63,2027-05-26,0.0,0.1238,,574.41,0.6225,82.459,0.29485,,,0.0,0.000368,9.6e-05
671,14288.0,MEX BONOS DESARR FIX RT,MBONO 7 1/2 05/26/33,MX0MGO0001D6,"נקוב במט""ח","חו""ל",מקסיקו,FOREIGN_GOV_SEC,BBB-,Fitch,MXN,5.8,2033-05-26,0.075,-0.4421,,80.12,0.1804,9685.8,1.39988,,,0.0,0.001749,0.000458
671,14288.0,POLAND GOVERNMENT BOND,POLGB 7 1/2  07/25/2028,PL0000115192,"נקוב במט""ח","חו""ל",פולין,FOREIGN_GOV_SEC,A-,Fitch,PLN,2.6,2028-07-25,0.075,0.0439,,290.08,0.9092,109.442,0.28864,,,0.0,0.00036,9.4e-05
671,14288.0,AFRICAN DEVELOPMENT BANK,AFDB 0 06/05/34,XS2831196535,"נקוב במט""ח","חו""ל",ברזיל,FOREIGN_GOV_SEC,AAA,S&P,BRL,8.66,2034-06-05,0.0,0.1221,,1593.99,0.6225,36.768,0.36483,,,2e-06,0.000456,0.000119
671,14288.0,TREASURY BILL,B 0 09/03/26,US912797RS85,"נקוב במט""ח","חו""ל","ארה""ב",אחר,AA+,Fitch,USD,0.91,2026-09-03,0.0,0.0365,,1667.88,3.306,96.738,5.33412,,,0.0,0.006666,0.001746
671,14288.0,MEX BONOS DESARR FIX RT,MBONO 7.5 06/03/27,MX0MGO0000D8,"נקוב במט""ח","חו""ל",מקסיקו,FOREIGN_GOV_SEC,BBB-,Fitch,MXN,1.57,2027-03-06,0.075,-0.9602,,15.44,0.1804,10252.3,0.28551,,,0.0,0.000356,9.3e-05
671,14288.0,MEX BONOS DESARR FIX RT,MBONO 8 1/2 11/18/2038,MX0MGO0000J5,"נקוב במט""ח","חו""ל",מקסיקו,FOREIGN_GOV_SEC,BBB-,Fitch,MXN,7.86,2038-11-18,0.085,-0.282,,76.84,0.1804,9889.2,1.3709,,,0.0,0.001713,0.000448
671,14288.0,INTL FINANCE CORP,EBRD 0 02/02/32,XS2438631710,"נקוב במט""ח","חו""ל",ברזיל,FOREIGN_GOV_SEC,AAA,S&P,BRL,6.32,2032-02-02,0.0,0.1199,,947.78,0.6225,48.758,0.28767,,,0.0,0.000359,9.4e-05
671,14288.0,HUNGARY GOVERNMENT BOND,HGB 2 1/4 04/20/33,HU0000404744,"נקוב במט""ח","חו""ל",הונגריה,FOREIGN_GOV_SEC,Baa2,Moodys,HUF,6.82,2033-04-20,0.0225,0.067,,112009.98,0.009944,75.239,0.83803,,,0.0,0.001047,0.000274
671,14288.0,TREASURY BILL,B 0 10/02/25,US912797MS31,"נקוב במט""ח","חו""ל","ארה""ב",אחר,AA+,Fitch,USD,0.0054,2025-10-02,0.0,0.0203,,129.78,3.306,99.989,0.42902,,,0.0,0.000537,0.00014
671,14288.0,MEX BONOS DESARR FIX RT,MBONO 7 3/4 29/05/31,MX0MGO0000P2,"נקוב במט""ח","חו""ל",מקסיקו,FOREIGN_GOV_SEC,BBB-,Fitch,MXN,4.59,2031-05-29,0.0775,-0.5479,,58.01,0.1804,9997.6,1.04619,,,0.0,0.001307,0.000342
671,14288.0,INTL BK RECON & DEVELOP,IBRD 10 10/17/29,XS2920414112,"נקוב במט""ח","חו""ל",ברזיל,FOREIGN_GOV_SEC,AAA,S&P,BRL,3.16,2029-10-17,0.1,0.1206,,1177.54,0.6225,103.44,0.75824,,,1e-06,0.000947,0.000248
671,14288.0,INTL FINANCE CORP,IFC 11 ½ 16/01/30,XS2977993471,"נקוב במט""ח","חו""ל",ברזיל,FOREIGN_GOV_SEC,AAA,S&P,BRL,3.33,2030-01-16,0.115,0.1208,,890.34,0.6225,106.39,0.58965,,,0.0,0.000737,0.000193
671,14288.0,POLAND GOVERNMENT BOND,POLGB 3 3/4 05/25/27,PL0000114393,"נקוב במט""ח","חו""ל",פולין,FOREIGN_GOV_SEC,A-,Fitch,PLN,1.59,2027-05-25,0.0375,0.1229,,574.41,0.9092,100.706,0.52594,,,0.0,0.000657,0.000172
671,14288.0,INTL FINANCE CORP,IFC 0 27/08/30,XS1280871259,"נקוב במט""ח","חו""ל",ברזיל,FOREIGN_GOV_SEC,AAA,S&P,BRL,4.89,2030-08-27,0.0,0.1222,,315.93,0.6225,56.766,0.11164,,,0.0,0.000139,3.6e-05
671,14288.0,REPUBLIC OF BRAZIL,BRAZIL 10 1/4 01/10/28,US105756BN96,"נקוב במט""ח","חו""ל",ברזיל,FOREIGN_GOV_SEC,BB,S&P,BRL,2.03,2028-01-10,0.1025,0.0993,,634.58,0.6225,103.027,0.40698,,,0.0,0.000508,0.000133
671,14288.0,POLAND GOVERNMENT BOND,POLGB 5 3/4 04/25/29,PL0000105391,"נקוב במט""ח","חו""ל",פולין,FOREIGN_GOV_SEC,A-,Fitch,PLN,3.24,2029-04-25,0.0575,0.0453,,134.99,0.9092,106.374,0.13055,,,0.0,0.000163,4.2e-05
671,15220.0,ממשלת ישראל,ממשלתי צמוד 1131,IL0011722209,צמוד למדד המחירים לצרכן בריבית קבועה,ישראל,ישראל,TASE,RF,פנימי,ILS,6.14,2031-11-30,0.001,0.019,,97703.64,1.0,106.54,104.09345,,,2e-06,0.224933,0.043492
671,15220.0,ממשלת ישראל,מ.ק.מ 316,IL0082603171,לא צמוד למדד המחירים לצרכן ריבית קבועה,ישראל,ישראל,TASE,RF,פנימי,ILS,0.42,2026-03-04,0.0,0.0415,,1287.09,1.0,98.32,1.26547,,,0.0,0.002734,0.000528
671,15220.0,ממשלת ישראל,ממשל צמודה 1151,IL0011683013,צמוד למדד המחירים לצרכן בריבית קבועה,ישראל,ישראל,TASE,RF,פנימי,ILS,11.99,2051-11-30,0.005,0.0214,,0.82,1.0,80.45,0.00066,,,0.0,1e-06,0.0
671,15220.0,ממשלת ישראל,ממשל שקלית 330,IL0011609851,לא צמוד למדד המחירים לצרכן ריבית קבועה,ישראל,ישראל,TASE,RF,פנימי,ILS,4.39,2030-03-31,0.01,0.0393,,516.81,1.0,88.66,0.45821,,,0.0,0.000989,0.00019
671,15220.0,ממשלת ישראל,ממשלתי צמוד 726,IL0011695645,צמוד למדד המחירים לצרכן בריבית קבועה,ישראל,ישראל,TASE,RF,פנימי,ILS,0.82,2026-07-31,0.001,0.0267,,23922.08,1.0,116.31,27.82377,,,1e-06,0.060123,0.011625
671,15220.0,ממשלת ישראל,ממשל שקלית 537,IL0011661803,לא צמוד למדד המחירים לצרכן ריבית קבועה,ישראל,ישראל,TASE,RF,פנימי,ILS,10.55,2037-05-31,0.015,0.0421,,736.4,1.0,75.94,0.55922,,,0.0,0.001208,0.000233
671,15220.0,ממשלת ישראל,ממשלתי צמוד 841,IL0011205833,צמוד למדד המחירים לצרכן בריבית קבועה,ישראל,ישראל,TASE,RF,פנימי,ILS,13.23,2041-08-30,0.0275,0.0202,,20.2,1.0,139.93,0.02826,,,0.0,6e-05,1e-05
671,15220.0,ממשלת ישראל,ממשל צמודה 1028,IL0011973265,צמוד למדד המחירים לצרכן בריבית קבועה,ישראל,ישראל,TASE,RF,פנימי,ILS,3.01,2028-10-31,0.011,0.0199,,3556.12,1.0,105.65,3.75704,,,0.0,0.008117,0.001569
671,15220.0,ממשלת ישראל,ממשל שקלית 927,IL0012035791,לא צמוד למדד המחירים לצרכן ריבית קבועה,ישראל,ישראל,TASE,RF,פנימי,ILS,1.96,2027-09-30,0.0375,0.0397,,4260.55,1.0,99.62,4.24437,,,0.0,0.009171,0.001773
671,15220.0,ממשלת ישראל,ממשל שקלית 0142,IL0011254005,לא צמוד למדד המחירים לצרכן ריבית קבועה,ישראל,ישראל,TASE,RF,פנימי,ILS,11.17,2042-01-31,0.055,0.0434,,28853.05,1.0,117.0,33.75807,,,0.0,0.072947,0.014105
671,15220.0,ממשלת ישראל,ממשל צמודה 1033,IL0012043795,צמוד למדד המחירים לצרכן בריבית קבועה,ישראל,ישראל,TASE,RF,פנימי,ILS,7.53,2033-10-31,0.016,0.0195,,97028.09,1.0,105.4,102.26761,,,3e-06,0.220988,0.042731
671,15220.0,ממשלת ישראל,ממשל שקלית 0432,IL0011806606,לא צמוד למדד המחירים לצרכן ריבית קבועה,ישראל,ישראל,TASE,RF,פנימי,ILS,6.28,2032-04-30,0.013,0.0402,,24.28,1.0,85.09,0.02066,,,0.0,4.4e-05,8e-06
671,15220.0,ממשלת ישראל,ממשל שקלי 1152,IL0011840761,לא צמוד למדד המחירים לצרכן ריבית קבועה,ישראל,ישראל,TASE,RF,פנימי,ILS,17.24,2052-11-29,0.028,0.0461,,57240.63,1.0,74.63,42.71867,,,2e-06,0.092309,0.017849
671,15220.0,ממשלת ישראל,ממשל צמודה 0431,IL0012207226,צמוד למדד המחירים לצרכן בריבית קבועה,ישראל,ישראל,TASE,RF,פנימי,ILS,5.29,2031-04-30,0.02,0.0199,,1296.5,1.0,103.02,1.33565,,,0.0,0.002885,0.000557
671,15220.0,ממשלת ישראל,ממשל שקלית928,IL0011508798,לא צמוד למדד המחירים לצרכן ריבית קבועה,ישראל,ישראל,TASE,RF,פנימי,ILS,2.92,2028-09-28,0.0225,0.0393,,17795.47,1.0,95.37,16.97153,,,0.0,0.036672,0.007091
671,15220.0,ממשלת ישראל,ממשל שקלית 335,IL0012023326,לא צמוד למדד המחירים לצרכן ריבית קבועה,ישראל,ישראל,TASE,RF,פנימי,ILS,7.92,2035-03-30,0.04,0.041,,133.18,1.0,101.25,0.13485,,,0.0,0.000291,5.6e-05
671,15220.0,ממשלת ישראל,ממשל שקלית 829,IL0012128935,לא צמוד למדד המחירים לצרכן ריבית קבועה,ישראל,ישראל,TASE,RF,פנימי,ILS,3.66,2029-08-31,0.046,0.0394,,7201.38,1.0,102.76,7.40013,,,0.0,0.01599,0.003091
671,15220.0,ממשלת ישראל,ממשל שקלית 327,IL0011393449,לא צמוד למדד המחירים לצרכן ריבית קבועה,ישראל,ישראל,TASE,RF,פנימי,ILS,1.47,2027-03-31,0.02,0.0396,,155.24,1.0,98.22,0.15247,,,0.0,0.000329,6.3e-05
671,15220.0,ממשלת ישראל,ממשלתי צמוד 0529,IL0011570236,צמוד למדד המחירים לצרכן בריבית קבועה,ישראל,ישראל,TASE,RF,פנימי,ILS,3.63,2029-05-31,0.005,0.0193,,60313.83,1.0,113.0,68.15463,,,2e-06,0.147273,0.028477
671,15220.0,ממשלת ישראל,ממשלתי צמוד 0527,IL0011408478,צמוד למדד המחירים לצרכן בריבית קבועה,ישראל,ישראל,TASE,RF,פנימי,ILS,1.65,2027-05-31,0.0075,0.0209,,18402.01,1.0,117.66,21.65181,,,0.0,0.046786,0.009046
671,15220.0,ממשלת ישראל,ממשלתי צמוד 0545,IL0011348658,צמוד למדד המחירים לצרכן בריבית קבועה,ישראל,ישראל,TASE,RF,פנימי,ILS,17.67,2045-05-31,0.01,0.0207,,3775.39,1.0,99.57,3.75916,,,0.0,0.008123,0.00157
671,15220.0,ממשלת ישראל,ממשלתי שקלי 0229,IL0011948028,לא צמוד למדד המחירים לצרכן ריבית קבועה,ישראל,ישראל,TASE,RF,פנימי,ILS,3.2,2029-02-28,0.0375,0.0391,,1967.67,1.0,101.7,2.00112,,,0.0,0.004324,0.000836
671,15220.0,ממשלת ישראל,ממשל שקלי 347,IL0011401937,לא צמוד למדד המחירים לצרכן ריבית קבועה,ישראל,ישראל,TASE,RF,פנימי,ILS,14.44,2047-03-31,0.0375,0.0449,,4423.62,1.0,91.85,4.0631,,,0.0,0.008779,0.001696
671,15220.0,ממשלת ישראל,ממשל שקלית 0226,IL0011746976,לא צמוד למדד המחירים לצרכן ריבית קבועה,ישראל,ישראל,TASE,RF,פנימי,ILS,0.4,2026-02-27,0.005,0.0409,,15599.82,1.0,98.89,15.42667,,,0.0,0.033334,0.006445
671,15220.0,TREASURY BILL,B 0 09/03/26,US912797RS85,"נקוב במט""ח","חו""ל","ארה""ב",אחר,AA+,Fitch,USD,0.91,2026-09-03,0.0,0.0365,,226.69,3.306,96.738,0.725,,,0.0,0.001566,0.000302
671,15221.0,ממשלת ישראל,מ.ק.מ 316,IL0082603171,לא צמוד למדד המחירים לצרכן ריבית קבועה,ישראל,ישראל,TASE,RF,פנימי,ILS,0.42,2026-03-04,0.0,0.0415,,120549.86,1.0,98.32,118.52462,,,6e-06,1.0,0.00252
671,15223.0,TREASURY BILL,B 0 08/06/26,US912797RG48,"נקוב במט""ח","חו""ל","ארה""ב",אחר,AA+,Fitch,USD,0.84,2026-08-06,0.0,0.0371,,206298.08,3.306,96.953,661.24024,,,3e-06,1.0,0.006382
671,15224.0,ממשלת ישראל,מ.ק.מ. 516,IL0082605150,לא צמוד למדד המחירים לצרכן ריבית קבועה,ישראל,ישראל,TASE,RF,פנימי,ILS,0.59,2026-05-06,0.0,0.0416,,50744.01,1.0,97.63,49.54137,,,2e-06,0.062195,0.01449
671,15224.0,ממשלת ישראל,ממשל שקלית928,IL0011508798,לא צמוד למדד המחירים לצרכן ריבית קבועה,ישראל,ישראל,TASE,RF,פנימי,ILS,2.92,2028-09-28,0.0225,0.0393,,25481.84,1.0,95.37,24.30203,,,0.0,0.030508,0.007107
671,15224.0,ממשלת ישראל,ממשל שקלית 927,IL0012035791,לא צמוד למדד המחירים לצרכן ריבית קבועה,ישראל,ישראל,TASE,RF,פנימי,ILS,1.96,2027-09-30,0.0375,0.0397,,6100.81,1.0,99.62,6.07763,,,0.0,0.007629,0.001777
671,15224.0,ממשלת ישראל,ממשל שקלית 0226,IL0011746976,לא צמוד למדד המחירים לצרכן ריבית קבועה,ישראל,ישראל,TASE,RF,פנימי,ILS,0.4,2026-02-27,0.005,0.0409,,22337.85,1.0,98.89,22.0899,,,0.0,0.027732,0.00646
671,15224.0,ממשלת ישראל,ממשל שקלי 347,IL0011401937,לא צמוד למדד המחירים לצרכן ריבית קבועה,ישראל,ישראל,TASE,RF,פנימי,ILS,14.44,2047-03-31,0.0375,0.0449,,6334.33,1.0,91.85,5.81807,,,0.0,0.007303,0.001699
671,15224.0,ממשלת ישראל,ממשל שקלית 335,IL0012023326,לא צמוד למדד המחירים לצרכן ריבית קבועה,ישראל,ישראל,TASE,RF,פנימי,ILS,7.92,2035-03-30,0.04,0.041,,190.71,1.0,101.25,0.19309,,,0.0,0.000242,5.6e-05
671,15224.0,ממשלת ישראל,ממשל צמודה 1033,IL0012043795,צמוד למדד המחירים לצרכן בריבית קבועה,ישראל,ישראל,TASE,RF,פנימי,ILS,7.53,2033-10-31,0.016,0.0195,,138937.39,1.0,105.4,146.44,,,5e-06,0.183847,0.042834
671,15224.0,ממשלת ישראל,ממשל צמודה 1151,IL0011683013,צמוד למדד המחירים לצרכן בריבית קבועה,ישראל,ישראל,TASE,RF,פנימי,ILS,11.99,2051-11-30,0.005,0.0214,,1.18,1.0,80.45,0.00095,,,0.0,1e-06,0.0
671,15224.0,ממשלת ישראל,ממשל שקלית 327,IL0011393449,לא צמוד למדד המחירים לצרכן ריבית קבועה,ישראל,ישראל,TASE,RF,פנימי,ILS,1.47,2027-03-31,0.02,0.0396,,222.29,1.0,98.22,0.21833,,,0.0,0.000274,6.3e-05
671,15224.0,ממשלת ישראל,מ.ק.מ. 726,IL0082607214,לא צמוד למדד המחירים לצרכן ריבית קבועה,ישראל,ישראל,TASE,RF,פנימי,ILS,0.76,2026-07-08,0.0,0.0414,,20329.8,1.0,96.96,19.71177,,,1e-06,0.024746,0.005765
671,15224.0,ממשלת ישראל,ממשלתי צמוד 0545,IL0011348658,צמוד למדד המחירים לצרכן בריבית קבועה,ישראל,ישראל,TASE,RF,פנימי,ILS,17.67,2045-05-31,0.01,0.0207,,5406.1,1.0,99.57,5.38285,,,0.0,0.006757,0.001574
671,15224.0,ממשלת ישראל,ממשל קצרה 02/26,IL0012194689,לא צמוד למדד המחירים לצרכן ריבית קבועה,ישראל,ישראל,TASE,RF,פנימי,ILS,0.4,2026-02-27,0.0,0.0417,,5854.51,1.0,97.18,5.68942,,,1e-06,0.007142,0.001664
671,15224.0,ממשלת ישראל,מ.ק.מ 416,IL0082604161,לא צמוד למדד המחירים לצרכן ריבית קבועה,ישראל,ישראל,TASE,RF,פנימי,ILS,0.49,2026-04-01,0.0,0.0418,,25533.0,1.0,98.0,25.02234,,,1e-06,0.031414,0.007319
671,15224.0,ממשלת ישראל,ממשלתי צמוד 0527,IL0011408478,צמוד למדד המחירים לצרכן בריבית קבועה,ישראל,ישראל,TASE,RF,פנימי,ILS,1.65,2027-05-31,0.0075,0.0209,,26350.38,1.0,117.66,31.00387,,,1e-06,0.038922,0.009068
671,15224.0,ממשלת ישראל,ממשל שקלי 1152,IL0011840761,לא צמוד למדד המחירים לצרכן ריבית קבועה,ישראל,ישראל,TASE,RF,פנימי,ILS,17.24,2052-11-29,0.028,0.0461,,81964.53,1.0,74.63,61.17013,,,2e-06,0.076794,0.017891
671,15224.0,ממשלת ישראל,ממשלתי צמוד 0529,IL0011570236,צמוד למדד המחירים לצרכן בריבית קבועה,ישראל,ישראל,TASE,RF,פנימי,ILS,3.63,2029-05-31,0.005,0.0193,,86365.16,1.0,113.0,97.59263,,,2e-06,0.122522,0.028546
671,15224.0,ממשלת ישראל,ממשל קצרה 11/25,IL0012153263,לא צמוד למדד המחירים לצרכן ריבית קבועה,ישראל,ישראל,TASE,RF,פנימי,ILS,0.16,2025-11-30,0.0,0.0412,,12001.76,1.0,99.36,11.92494,,,1e-06,0.014971,0.003488
671,15224.0,ממשלת ישראל,ממשל שקלית 537,IL0011661803,לא צמוד למדד המחירים לצרכן ריבית קבועה,ישראל,ישראל,TASE,RF,פנימי,ILS,10.55,2037-05-31,0.015,0.0421,,1054.47,1.0,75.94,0.80077,,,0.0,0.001005,0.000234
671,15224.0,ממשלת ישראל,ממשל שקלית 330,IL0011609851,לא צמוד למדד המחירים לצרכן ריבית קבועה,ישראל,ישראל,TASE,RF,פנימי,ILS,4.39,2030-03-31,0.01,0.0393,,740.05,1.0,88.66,0.65613,,,0.0,0.000823,0.000191
671,15224.0,ממשלת ישראל,ממשל שקלית 0432,IL0011806606,לא צמוד למדד המחירים לצרכן ריבית קבועה,ישראל,ישראל,TASE,RF,פנימי,ILS,6.28,2032-04-30,0.013,0.0402,,34.76,1.0,85.09,0.02958,,,0.0,3.7e-05,8e-06
671,15224.0,ממשלת ישראל,ממשל צמודה 0431,IL0012207226,צמוד למדד המחירים לצרכן בריבית קבועה,ישראל,ישראל,TASE,RF,פנימי,ILS,5.29,2031-04-30,0.02,0.0199,,1856.49,1.0,103.02,1.91256,,,0.0,0.0024,0.000558
671,15224.0,ממשלת ישראל,ממשלתי צמוד 841,IL0011205833,צמוד למדד המחירים לצרכן בריבית קבועה,ישראל,ישראל,TASE,RF,פנימי,ILS,13.23,2041-08-30,0.0275,0.0202,,28.92,1.0,139.93,0.04047,,,0.0,5e-05,1e-05
671,15224.0,ממשלת ישראל,ממשלתי שקלי 0229,IL0011948028,לא צמוד למדד המחירים לצרכן ריבית קבועה,ישראל,ישראל,TASE,RF,פנימי,ILS,3.2,2029-02-28,0.0375,0.0391,,2817.56,1.0,101.7,2.86546,,,0.0,0.003597,0.000838
671,15224.0,ממשלת ישראל,ממשל שקלית 829,IL0012128935,לא צמוד למדד המחירים לצרכן ריבית קבועה,ישראל,ישראל,TASE,RF,פנימי,ILS,3.66,2029-08-31,0.046,0.0394,,10311.86,1.0,102.76,10.59647,,,0.0,0.013303,0.003099
671,15224.0,ממשלת ישראל,ממשלתי צמוד 1131,IL0011722209,צמוד למדד המחירים לצרכן בריבית קבועה,ישראל,ישראל,TASE,RF,פנימי,ILS,6.14,2031-11-30,0.001,0.019,,139904.72,1.0,106.54,149.05448,,,4e-06,0.187127,0.043597
671,15224.0,ממשלת ישראל,ממשלתי צמוד 726,IL0011695645,צמוד למדד המחירים לצרכן בריבית קבועה,ישראל,ישראל,TASE,RF,פנימי,ILS,0.82,2026-07-31,0.001,0.0267,,34254.74,1.0,116.31,39.84168,,,1e-06,0.050018,0.011653
671,15224.0,ממשלת ישראל,מ.ק.מ 316,IL0082603171,לא צמוד למדד המחירים לצרכן ריבית קבועה,ישראל,ישראל,TASE,RF,פנימי,ILS,0.42,2026-03-04,0.0,0.0415,,1647.35,1.0,98.32,1.61968,,,0.0,0.002033,0.000473
671,15224.0,ממשלת ישראל,מ.ק.מ. 616,IL0082606141,לא צמוד למדד המחירים לצרכן ריבית קבועה,ישראל,ישראל,TASE,RF,פנימי,ILS,0.67,2026-06-03,0.0,0.042,,913.03,1.0,97.3,0.88838,,,0.0,0.001115,0.000259
671,15224.0,ממשלת ישראל,ממשל צמודה 1028,IL0011973265,צמוד למדד המחירים לצרכן בריבית קבועה,ישראל,ישראל,TASE,RF,פנימי,ILS,3.01,2028-10-31,0.011,0.0199,,5092.11,1.0,105.65,5.37981,,,0.0,0.006753,0.001572
671,15224.0,ממשלת ישראל,מ.ק.מ 216,IL0082602181,לא צמוד למדד המחירים לצרכן ריבית קבועה,ישראל,ישראל,TASE,RF,פנימי,ILS,0.34,2026-02-04,0.0,0.0424,,4639.7,1.0,98.6,4.57475,,,0.0,0.005743,0.001338
671,15224.0,ממשלת ישראל,ממשל שקלית 0142,IL0011254005,לא צמוד למדד המחירים לצרכן ריבית קבועה,ישראל,ישראל,TASE,RF,פנימי,ILS,11.17,2042-01-31,0.055,0.0434,,41315.52,1.0,117.0,48.33917,,,1e-06,0.060685,0.014138
671,15224.0,MEX BONOS DESARR FIX RT,MBONO 8 1/2 11/18/2038,MX0MGO0000J5,"נקוב במט""ח","חו""ל",מקסיקו,FOREIGN_GOV_SEC,BBB-,Fitch,MXN,7.86,2038-11-18,0.085,-0.282,,72.57,0.1804,9889.2,1.29459,,,0.0,0.001625,0.000378
671,15224.0,HUNGARY GOVERNMENT BOND,HGB 2 1/4 04/20/33,HU0000404744,"נקוב במט""ח","חו""ל",הונגריה,FOREIGN_GOV_SEC,Baa2,Moodys,HUF,6.82,2033-04-20,0.0225,0.067,,105774.86,0.009944,75.239,0.79138,,,0.0,0.000993,0.000231
671,15224.0,INTL FINANCE CORP,EBRD 0 02/02/32,XS2438631710,"נקוב במט""ח","חו""ל",ברזיל,FOREIGN_GOV_SEC,AAA,S&P,BRL,6.32,2032-02-02,0.0,0.1199,,895.02,0.6225,48.758,0.27165,,,0.0,0.000341,7.9e-05
671,15224.0,POLAND GOVERNMENT BOND,POLGB 1 3/4 04/25/32,PL0000113783,"נקוב במט""ח","חו""ל",פולין,FOREIGN_GOV_SEC,A-,Fitch,PLN,6.15,2032-04-24,0.0175,0.048,,1451.01,0.9092,82.619,1.08996,,,0.0,0.001368,0.000318
671,15224.0,INTL FINANCE CORP,IFC 0 26/05/27,XS1621760302,"נקוב במט""ח","חו""ל",ברזיל,FOREIGN_GOV_SEC,AAA,S&P,BRL,1.63,2027-05-26,0.0,0.1238,,542.44,0.6225,82.459,0.27844,,,0.0,0.000349,8.1e-05
671,15224.0,MEX BONOS DESARR FIX RT,MBONO 7 3/4 29/05/31,MX0MGO0000P2,"נקוב במט""ח","חו""ל",מקסיקו,FOREIGN_GOV_SEC,BBB-,Fitch,MXN,4.59,2031-05-29,0.0775,-0.5479,,54.78,0.1804,9997.6,0.98795,,,0.0,0.00124,0.000288
671,15224.0,MEX BONOS DESARR FIX RT,MBONO 7.5 06/03/27,MX0MGO0000D8,"נקוב במט""ח","חו""ל",מקסיקו,FOREIGN_GOV_SEC,BBB-,Fitch,MXN,1.57,2027-03-06,0.075,-0.9602,,14.58,0.1804,10252.3,0.26962,,,0.0,0.000338,7.8e-05
671,15224.0,POLAND GOVERNMENT BOND,POLGB 3 3/4 05/25/27,PL0000114393,"נקוב במט""ח","חו""ל",פולין,FOREIGN_GOV_SEC,A-,Fitch,PLN,1.59,2027-05-25,0.0375,0.1229,,542.44,0.9092,100.706,0.49666,,,0.0,0.000623,0.000145
671,15224.0,POLAND GOVERNMENT BOND,POLGB 5 3/4 04/25/29,PL0000105391,"נקוב במט""ח","חו""ל",פולין,FOREIGN_GOV_SEC,A-,Fitch,PLN,3.24,2029-04-25,0.0575,0.0453,,127.47,0.9092,106.374,0.12329,,,0.0,0.000154,3.6e-05
671,15224.0,INTL FINANCE CORP,IFC 0 27/08/30,XS1280871259,"נקוב במט""ח","חו""ל",ברזיל,FOREIGN_GOV_SEC,AAA,S&P,BRL,4.89,2030-08-27,0.0,0.1222,,298.34,0.6225,56.766,0.10542,,,0.0,0.000132,3e-05
671,15224.0,TREASURY BILL,B 0 10/02/25,US912797MS31,"נקוב במט""ח","חו""ל","ארה""ב",אחר,AA+,Fitch,USD,0.0054,2025-10-02,0.0,0.0203,,166.71,3.306,99.989,0.55107,,,0.0,0.000691,0.00016
671,15224.0,INTL BK RECON & DEVELOP,IBRD 10 10/17/29,XS2920414112,"נקוב במט""ח","חו""ל",ברזיל,FOREIGN_GOV_SEC,AAA,S&P,BRL,3.16,2029-10-17,0.1,0.1206,,1111.99,0.6225,103.44,0.71603,,,1e-06,0.000898,0.000209
671,15224.0,INTL FINANCE CORP,IFC 11 ½ 16/01/30,XS2977993471,"נקוב במט""ח","חו""ל",ברזיל,FOREIGN_GOV_SEC,AAA,S&P,BRL,3.33,2030-01-16,0.115,0.1208,,840.77,0.6225,106.39,0.55683,,,0.0,0.000699,0.000162
671,15224.0,HUNGARY GOVERNMENT BOND,HGB 7 10/24/35 35/A,HU0000406624,"נקוב במט""ח","חו""ל",הונגריה,FOREIGN_GOV_SEC,Baa2,Moodys,HUF,7.09,2035-10-24,0.07,0.068,,18985.23,0.009944,107.901,0.20371,,,0.0,0.000255,5.9e-05
671,15224.0,AFRICAN DEVELOPMENT BANK,AFDB 0 06/05/34,XS2831196535,"נקוב במט""ח","חו""ל",ברזיל,FOREIGN_GOV_SEC,AAA,S&P,BRL,8.66,2034-06-05,0.0,0.1221,,1505.26,0.6225,36.768,0.34452,,,2e-06,0.000432,0.0001
671,15224.0,TREASURY BILL,B 0 09/03/26,US912797RS85,"נקוב במט""ח","חו""ל","ארה""ב",אחר,AA+,Fitch,USD,0.91,2026-09-03,0.0,0.0365,,2117.56,3.306,96.738,6.77228,,,0.0,0.008501,0.00198
671,15224.0,REPUBLIC OF BRAZIL,BRAZIL 10 1/4 01/10/28,US105756BN96,"נקוב במט""ח","חו""ל",ברזיל,FOREIGN_GOV_SEC,BB,S&P,BRL,2.03,2028-01-10,0.1025,0.0993,,599.25,0.6225,103.027,0.38433,,,0.0,0.000481,0.000111
671,15224.0,HUNGARY GOVERNMENT BOND,HGB 6 3/4 07/23/31,HU0000407317,"נקוב במט""ח","חו""ל",הונגריה,FOREIGN_GOV_SEC,Baa2,Moodys,HUF,4.86,2031-07-23,0.0675,0.0644,,9628.22,0.009944,104.522,0.10007,,,0.0,0.000125,2.9e-05
671,15224.0,POLAND GOVERNMENT BOND,POLGB 7 1/2  07/25/2028,PL0000115192,"נקוב במט""ח","חו""ל",פולין,FOREIGN_GOV_SEC,A-,Fitch,PLN,2.6,2028-07-25,0.075,0.0439,,273.93,0.9092,109.442,0.27257,,,0.0,0.000342,7.9e-05
671,15224.0,MEX BONOS DESARR FIX RT,MBONO 7 1/2 05/26/33,MX0MGO0001D6,"נקוב במט""ח","חו""ל",מקסיקו,FOREIGN_GOV_SEC,BBB-,Fitch,MXN,5.8,2033-05-26,0.075,-0.4421,,75.66,0.1804,9685.8,1.32195,,,0.0,0.001659,0.000386
671,15224.0,POLAND GOVERNMENT BOND,POLGB 6 10/25/2033,PL0000115291,"נקוב במט""ח","חו""ל",פולין,FOREIGN_GOV_SEC,A-,Fitch,PLN,6.31,2033-10-25,0.06,0.0524,,815.01,0.9092,110.439,0.81836,,,0.0,0.001027,0.000239
671,2202.0,ממשלת ישראל,ממשלתי צמוד 841,IL0011205833,צמוד למדד המחירים לצרכן בריבית קבועה,ישראל,ישראל,TASE,RF,פנימי,ILS,13.23,2041-08-30,0.0275,0.0202,,7786327.0,1.0,139.93,10895.40737,,,0.000385,0.317934,0.313971
671,2202.0,ממשלת ישראל,ממשל צמודה 1033,IL0012043795,צמוד למדד המחירים לצרכן בריבית קבועה,ישראל,ישראל,TASE,RF,פנימי,ILS,7.53,2033-10-31,0.016,0.0195,,2330487.0,1.0,105.4,2456.33329,,,8.8e-05,0.071677,0.070783
671,2202.0,ממשלת ישראל,ממשל צמודה 1028,IL0011973265,צמוד למדד המחירים לצרכן בריבית קבועה,ישראל,ישראל,TASE,RF,פנימי,ILS,3.01,2028-10-31,0.011,0.0199,,5820265.0,1.0,105.65,6149.10997,,,0.000172,0.179434,0.177198
671,2202.0,ממשלת ישראל,ממשלתי צמוד 0529,IL0011570236,צמוד למדד המחירים לצרכן בריבית קבועה,ישראל,ישראל,TASE,RF,פנימי,ILS,3.63,2029-05-31,0.005,0.0193,,7730242.0,1.0,113.0,8735.17346,,,0.000262,0.254897,0.25172
671,2202.0,ממשלת ישראל,גליל  0536,IL0010977085,צמוד למדד המחירים לצרכן בריבית קבועה,ישראל,ישראל,TASE,RF,פנימי,ILS,8.96,2036-05-30,0.04,0.0194,,1740412.0,1.0,170.85,2973.4939,,,0.000109,0.086768,0.085686
671,2202.0,ממשלת ישראל,ממשלתי צמוד 0545,IL0011348658,צמוד למדד המחירים לצרכן בריבית קבועה,ישראל,ישראל,TASE,RF,פנימי,ILS,17.67,2045-05-31,0.01,0.0207,,3072998.0,1.0,99.57,3059.7841,,,0.000134,0.089286,0.088173
671,7234.0,ממשלת ישראל,ממשלתי צמוד 0527,IL0011408478,צמוד למדד המחירים לצרכן בריבית קבועה,ישראל,ישראל,TASE,RF,פנימי,ILS,1.65,2027-05-31,0.0075,0.0209,,10811990.05,1.0,117.66,12721.3875,,,0.000443,0.033531,0.00451
671,7234.0,ממשלת ישראל,ממשל שקלית 0432,IL0011806606,לא צמוד למדד המחירים לצרכן ריבית קבועה,ישראל,ישראל,TASE,RF,פנימי,ILS,6.28,2032-04-30,0.013,0.0402,,14264.64,1.0,85.09,12.13778,,,0.0,3.1e-05,4e-06
671,7234.0,ממשלת ישראל,מ.ק.מ. 726,IL0082607214,לא צמוד למדד המחירים לצרכן ריבית קבועה,ישראל,ישראל,TASE,RF,פנימי,ILS,0.76,2026-07-08,0.0,0.0414,,15643181.86,1.0,96.96,15167.62913,,,0.000869,0.03998,0.005377
671,7234.0,ממשלת ישראל,ממשל צמודה 1033,IL0012043795,צמוד למדד המחירים לצרכן בריבית קבועה,ישראל,ישראל,TASE,RF,פנימי,ILS,7.53,2033-10-31,0.016,0.0195,,57008269.56,1.0,105.4,60086.71612,,,0.002155,0.158384,0.021307
671,7234.0,ממשלת ישראל,מ.ק.מ 216,IL0082602181,לא צמוד למדד המחירים לצרכן ריבית קבועה,ישראל,ישראל,TASE,RF,פנימי,ILS,0.34,2026-02-04,0.0,0.0424,,3570114.22,1.0,98.6,3520.13262,,,0.000198,0.009278,0.001248
671,7234.0,ממשלת ישראל,ממשל שקלית 327,IL0011393449,לא צמוד למדד המחירים לצרכן ריבית קבועה,ישראל,ישראל,TASE,RF,פנימי,ILS,1.47,2027-03-31,0.02,0.0396,,91208.25,1.0,98.22,89.58474,,,3e-06,0.000236,3.1e-05
671,7234.0,ממשלת ישראל,ממשלתי צמוד 841,IL0011205833,צמוד למדד המחירים לצרכן בריבית קבועה,ישראל,ישראל,TASE,RF,פנימי,ILS,13.23,2041-08-30,0.0275,0.0202,,11866.88,1.0,139.93,16.60532,,,0.0,4.3e-05,4e-06
671,7234.0,ממשלת ישראל,ממשל שקלית 335,IL0012023326,לא צמוד למדד המחירים לצרכן ריבית קבועה,ישראל,ישראל,TASE,RF,פנימי,ILS,7.92,2035-03-30,0.04,0.041,,78249.77,1.0,101.25,79.2279,,,2e-06,0.000208,2.8e-05
671,7234.0,ממשלת ישראל,ממשלתי שקלי 0229,IL0011948028,לא צמוד למדד המחירים לצרכן ריבית קבועה,ישראל,ישראל,TASE,RF,פנימי,ILS,3.2,2029-02-28,0.0375,0.0391,,1156092.14,1.0,101.7,1175.7457,,,3.3e-05,0.003099,0.000416
671,7234.0,ממשלת ישראל,מ.ק.מ 316,IL0082603171,לא צמוד למדד המחירים לצרכן ריבית קבועה,ישראל,ישראל,TASE,RF,פנימי,ILS,0.42,2026-03-04,0.0,0.0415,,1996903.32,1.0,98.32,1963.35534,,,0.00011,0.005175,0.000696
671,7234.0,ממשלת ישראל,מ.ק.מ 416,IL0082604161,לא צמוד למדד המחירים לצרכן ריבית קבועה,ישראל,ישראל,TASE,RF,פנימי,ILS,0.49,2026-04-01,0.0,0.0418,,19646890.39,1.0,98.0,19253.95259,,,0.001091,0.050752,0.006827
671,7234.0,ממשלת ישראל,ממשל צמודה 1151,IL0011683013,צמוד למדד המחירים לצרכן בריבית קבועה,ישראל,ישראל,TASE,RF,פנימי,ILS,11.99,2051-11-30,0.005,0.0214,,484.07,1.0,80.45,0.38943,,,0.0,1e-06,0.0
671,7234.0,ממשלת ישראל,ממשל שקלי 1152,IL0011840761,לא צמוד למדד המחירים לצרכן ריבית קבועה,ישראל,ישראל,TASE,RF,פנימי,ILS,17.24,2052-11-29,0.028,0.0461,,33631381.88,1.0,74.63,25099.1003,,,0.001216,0.066158,0.008898
671,7234.0,ממשלת ישראל,ממשל שקלית 829,IL0012128935,לא צמוד למדד המחירים לצרכן ריבית קבועה,ישראל,ישראל,TASE,RF,פנימי,ILS,3.66,2029-08-31,0.046,0.0394,,4231123.68,1.0,102.76,4347.90269,,,0.000224,0.011459,0.001541
671,7234.0,ממשלת ישראל,מ.ק.מ. 516,IL0082605150,לא צמוד למדד המחירים לצרכן ריבית קבועה,ישראל,ישראל,TASE,RF,פנימי,ILS,0.59,2026-05-06,0.0,0.0416,,39046012.61,1.0,97.63,38120.62212,,,0.002169,0.100482,0.013516
671,7234.0,ממשלת ישראל,ממשל שקלית 0226,IL0011746976,לא צמוד למדד המחירים לצרכן ריבית קבועה,ישראל,ישראל,TASE,RF,פנימי,ILS,0.4,2026-02-27,0.005,0.0409,,9165583.28,1.0,98.89,9063.84531,,,0.000369,0.02389,0.003213
671,7234.0,ממשלת ישראל,ממשל שקלית 927,IL0012035791,לא צמוד למדד המחירים לצרכן ריבית קבועה,ישראל,ישראל,TASE,RF,פנימי,ILS,1.96,2027-09-30,0.0375,0.0397,,2503263.11,1.0,99.62,2493.75071,,,6.9e-05,0.006573,0.000883
671,7234.0,ממשלת ישראל,ממשל שקלית928,IL0011508798,לא צמוד למדד המחירים לצרכן ריבית קבועה,ישראל,ישראל,TASE,RF,פנימי,ILS,2.92,2028-09-28,0.0225,0.0393,,10455613.74,1.0,95.37,9971.51883,,,0.000301,0.026283,0.003535
671,7234.0,ממשלת ישראל,ממשל שקלית 0142,IL0011254005,לא צמוד למדד המחירים לצרכן ריבית קבועה,ישראל,ישראל,TASE,RF,פנימי,ILS,11.17,2042-01-31,0.055,0.0434,,16952433.26,1.0,117.0,19834.34692,,,0.000547,0.05228,0.007033
671,7234.0,ממשלת ישראל,ממשל קצרה 02/26,IL0012194689,לא צמוד למדד המחירים לצרכן ריבית קבועה,ישראל,ישראל,TASE,RF,פנימי,ILS,0.4,2026-02-27,0.0,0.0417,,4504875.99,1.0,97.18,4377.83848,,,0.000862,0.011539,0.001552
671,7234.0,ממשלת ישראל,ממשל שקלית 537,IL0011661803,לא צמוד למדד המחירים לצרכן ריבית קבועה,ישראל,ישראל,TASE,RF,פנימי,ILS,10.55,2037-05-31,0.015,0.0421,,432668.13,1.0,75.94,328.56818,,,1e-05,0.000866,0.000116
671,7234.0,ממשלת ישראל,ממשל שקלית 330,IL0011609851,לא צמוד למדד המחירים לצרכן ריבית קבועה,ישראל,ישראל,TASE,RF,פנימי,ILS,4.39,2030-03-31,0.01,0.0393,,303653.78,1.0,88.66,269.21944,,,8e-06,0.000708,9.5e-05
671,7234.0,ממשלת ישראל,ממשלתי צמוד 726,IL0011695645,צמוד למדד המחירים לצרכן בריבית קבועה,ישראל,ישראל,TASE,RF,פנימי,ILS,0.82,2026-07-31,0.001,0.0267,,14055276.77,1.0,116.31,16347.69241,,,0.000695,0.04309,0.005796
671,7234.0,ממשלת ישראל,ממשל קצרה 11/25,IL0012153263,לא צמוד למדד המחירים לצרכן ריבית קבועה,ישראל,ישראל,TASE,RF,פנימי,ILS,0.16,2025-11-30,0.0,0.0412,,9234995.77,1.0,99.36,9175.8918,,,0.001455,0.024187,0.003253
671,7234.0,ממשלת ישראל,ממשלתי צמוד 0529,IL0011570236,צמוד למדד המחירים לצרכן בריבית קבועה,ישראל,ישראל,TASE,RF,פנימי,ILS,3.63,2029-05-31,0.005,0.0193,,35437031.63,1.0,113.0,40043.84573,,,0.001204,0.105552,0.014198
671,7234.0,ממשלת ישראל,ממשל שקלי 347,IL0011401937,לא צמוד למדד המחירים לצרכן ריבית קבועה,ישראל,ישראל,TASE,RF,פנימי,ILS,14.44,2047-03-31,0.0375,0.0449,,2599075.61,1.0,91.85,2387.25093,,,9.9e-05,0.006291,0.000845
671,7234.0,ממשלת ישראל,ממשלתי צמוד 0545,IL0011348658,צמוד למדד המחירים לצרכן בריבית קבועה,ישראל,ישראל,TASE,RF,פנימי,ILS,17.67,2045-05-31,0.01,0.0207,,2218210.24,1.0,99.57,2208.67194,,,9.7e-05,0.005821,0.000783
671,7234.0,ממשלת ישראל,ממשלתי צמוד 1131,IL0011722209,צמוד למדד המחירים לצרכן בריבית קבועה,ישראל,ישראל,TASE,RF,פנימי,ILS,6.14,2031-11-30,0.001,0.019,,57405183.15,1.0,106.54,61159.48213,,,0.001677,0.16121,0.021685
671,7234.0,ממשלת ישראל,מ.ק.מ. 616,IL0082606141,לא צמוד למדד המחירים לצרכן ריבית קבועה,ישראל,ישראל,TASE,RF,פנימי,ILS,0.67,2026-06-03,0.0,0.042,,702547.53,1.0,97.3,683.57874,,,3.9e-05,0.001801,0.000242
671,7234.0,ממשלת ישראל,ממשל צמודה 1028,IL0011973265,צמוד למדד המחירים לצרכן בריבית קבועה,ישראל,ישראל,TASE,RF,פנימי,ILS,3.01,2028-10-31,0.011,0.0199,,2089375.67,1.0,105.65,2207.42539,,,6.2e-05,0.005817,0.000782
671,7234.0,ממשלת ישראל,ממשל צמודה 0431,IL0012207226,צמוד למדד המחירים לצרכן בריבית קבועה,ישראל,ישראל,TASE,RF,פנימי,ILS,5.29,2031-04-30,0.02,0.0199,,761748.15,1.0,103.02,784.75295,,,0.000105,0.002067,0.000277
671,7234.0,INTL FINANCE CORP,EBRD 0 02/02/32,XS2438631710,"נקוב במט""ח","חו""ל",ברזיל,FOREIGN_GOV_SEC,AAA,S&P,BRL,6.32,2032-02-02,0.0,0.1199,,952515.06,0.6225,48.758,289.10599,,,0.000476,0.000762,0.000102
671,7234.0,MEX BONOS DESARR FIX RT,MBONO 7 1/2 05/26/33,MX0MGO0001D6,"נקוב במט""ח","חו""ל",מקסיקו,FOREIGN_GOV_SEC,BBB-,Fitch,MXN,5.8,2033-05-26,0.075,-0.4421,,80516.39,0.1804,9685.8,1406.87758,,,0.0,0.003708,0.000498
671,7234.0,MEX BONOS DESARR FIX RT,MBONO 7 3/4 29/05/31,MX0MGO0000P2,"נקוב במט""ח","חו""ל",מקסיקו,FOREIGN_GOV_SEC,BBB-,Fitch,MXN,4.59,2031-05-29,0.0775,-0.5479,,58296.81,0.1804,9997.6,1051.42202,,,0.0,0.002771,0.000372
671,7234.0,HUNGARY GOVERNMENT BOND,HGB 6 3/4 07/23/31,HU0000407317,"נקוב במט""ח","חו""ל",הונגריה,FOREIGN_GOV_SEC,Baa2,Moodys,HUF,4.86,2031-07-23,0.0675,0.0644,,10246752.95,0.009944,104.522,106.50134,,,4.2e-05,0.00028,3.7e-05
671,7234.0,POLAND GOVERNMENT BOND,POLGB 1 3/4 04/25/32,PL0000113783,"נקוב במט""ח","חו""ל",פולין,FOREIGN_GOV_SEC,A-,Fitch,PLN,6.15,2032-04-24,0.0175,0.048,,1544228.97,0.9092,82.619,1159.98148,,,2.5e-05,0.003057,0.000411
671,7234.0,INTL FINANCE CORP,IFC 0 27/08/30,XS1280871259,"נקוב במט""ח","חו""ל",ברזיל,FOREIGN_GOV_SEC,AAA,S&P,BRL,4.89,2030-08-27,0.0,0.1222,,317505.02,0.6225,56.766,112.19623,,,0.000599,0.000295,3.9e-05
671,7234.0,HUNGARY GOVERNMENT BOND,HGB 7 10/24/35 35/A,HU0000406624,"נקוב במט""ח","חו""ל",הונגריה,FOREIGN_GOV_SEC,Baa2,Moodys,HUF,7.09,2035-10-24,0.07,0.068,,20204864.97,0.009944,107.901,216.79164,,,1.5e-05,0.000571,7.6e-05
671,7234.0,INTL FINANCE CORP,IFC 11 ½ 16/01/30,XS2977993471,"נקוב במט""ח","חו""ל",ברזיל,FOREIGN_GOV_SEC,AAA,S&P,BRL,3.33,2030-01-16,0.115,0.1208,,894786.88,0.6225,106.39,592.59744,,,0.000917,0.001562,0.00021
671,7234.0,HUNGARY GOVERNMENT BOND,HGB 2 1/4 04/20/33,HU0000404744,"נקוב במט""ח","חו""ל",הונגריה,FOREIGN_GOV_SEC,Baa2,Moodys,HUF,6.82,2033-04-20,0.0225,0.067,,112569961.97,0.009944,75.239,842.22213,,,9e-05,0.00222,0.000298
671,7234.0,TREASURY BILL,B 0 10/02/25,US912797MS31,"נקוב במט""ח","חו""ל","ארה""ב",אחר,AA+,Fitch,USD,0.0054,2025-10-02,0.0,0.0203,,134269.97,3.306,99.989,443.84769,,,0.0,0.00117,0.000157
671,7234.0,REPUBLIC OF BRAZIL,BRAZIL 10 1/4 01/10/28,US105756BN96,"נקוב במט""ח","חו""ל",ברזיל,FOREIGN_GOV_SEC,BB,S&P,BRL,2.03,2028-01-10,0.1025,0.0993,,637752.13,0.6225,103.027,409.01791,,,0.000133,0.001077,0.000144
671,7234.0,INTL FINANCE CORP,IFC 0 26/05/27,XS1621760302,"נקוב במט""ח","חו""ל",ברזיל,FOREIGN_GOV_SEC,AAA,S&P,BRL,1.63,2027-05-26,0.0,0.1238,,577281.86,0.6225,82.459,296.32298,,,0.000796,0.000781,0.000105
671,7234.0,POLAND GOVERNMENT BOND,POLGB 5 3/4 04/25/29,PL0000105391,"נקוב במט""ח","חו""ל",פולין,FOREIGN_GOV_SEC,A-,Fitch,PLN,3.24,2029-04-25,0.0575,0.0453,,135661.24,0.9092,106.374,131.20509,,,2e-06,0.000345,4.6e-05
671,7234.0,INTL BK RECON & DEVELOP,IBRD 10 10/17/29,XS2920414112,"נקוב במט""ח","חו""ל",ברזיל,FOREIGN_GOV_SEC,AAA,S&P,BRL,3.16,2029-10-17,0.1,0.1206,,1183427.81,0.6225,103.44,762.02573,,,0.00182,0.002008,0.00027
671,7234.0,POLAND GOVERNMENT BOND,POLGB 3 3/4 05/25/27,PL0000114393,"נקוב במט""ח","חו""ל",פולין,FOREIGN_GOV_SEC,A-,Fitch,PLN,1.59,2027-05-25,0.0375,0.1229,,577281.86,0.9092,100.706,528.57021,,,1.7e-05,0.001393,0.000187
671,7234.0,POLAND GOVERNMENT BOND,POLGB 7 1/2  07/25/2028,PL0000115192,"נקוב במט""ח","חו""ל",פולין,FOREIGN_GOV_SEC,A-,Fitch,PLN,2.6,2028-07-25,0.075,0.0439,,291527.34,0.9092,109.442,290.0833,,,6e-06,0.000764,0.000102
671,7234.0,TREASURY BILL,B 0 09/03/26,US912797RS85,"נקוב במט""ח","חו""ל","ארה""ב",אחר,AA+,Fitch,USD,0.91,2026-09-03,0.0,0.0365,,1512811.27,3.306,96.738,4838.2099,,,2.9e-05,0.012752,0.001715
671,7234.0,AFRICAN DEVELOPMENT BANK,AFDB 0 06/05/34,XS2831196535,"נקוב במט""ח","חו""ל",ברזיל,FOREIGN_GOV_SEC,AAA,S&P,BRL,8.66,2034-06-05,0.0,0.1221,,1601957.15,0.6225,36.768,366.65723,,,0.002912,0.000966,0.00013
671,7234.0,MEX BONOS DESARR FIX RT,MBONO 8 1/2 11/18/2038,MX0MGO0000J5,"נקוב במט""ח","חו""ל",מקסיקו,FOREIGN_GOV_SEC,BBB-,Fitch,MXN,7.86,2038-11-18,0.085,-0.282,,77227.99,0.1804,9889.2,1377.75632,,,0.0,0.003631,0.000488
671,7234.0,POLAND GOVERNMENT BOND,POLGB 6 10/25/2033,PL0000115291,"נקוב במט""ח","חו""ל",פולין,FOREIGN_GOV_SEC,A-,Fitch,PLN,6.31,2033-10-25,0.06,0.0524,,867365.99,0.9092,110.439,870.93207,,,1.4e-05,0.002295,0.000308
671,7234.0,MEX BONOS DESARR FIX RT,MBONO 7.5 06/03/27,MX0MGO0000D8,"נקוב במט""ח","חו""ל",מקסיקו,FOREIGN_GOV_SEC,BBB-,Fitch,MXN,1.57,2027-03-06,0.075,-0.9602,,15514.45,0.1804,10252.3,286.94207,,,0.0,0.000756,0.000101
671,7235.0,ממשלת ישראל,ממשלתי צמוד 726,IL0011695645,צמוד למדד המחירים לצרכן בריבית קבועה,ישראל,ישראל,TASE,RF,פנימי,ILS,0.82,2026-07-31,0.001,0.0267,,7166781.8,1.0,116.31,8335.68391,,,0.000354,0.052533,0.013246
671,7235.0,ממשלת ישראל,ממשל שקלית 0432,IL0011806606,לא צמוד למדד המחירים לצרכן ריבית קבועה,ישראל,ישראל,TASE,RF,פנימי,ILS,6.28,2032-04-30,0.013,0.0402,,7273.53,1.0,85.09,6.18905,,,0.0,3.9e-05,9e-06
671,7235.0,ממשלת ישראל,מ.ק.מ. 726,IL0082607214,לא צמוד למדד המחירים לצרכן ריבית קבועה,ישראל,ישראל,TASE,RF,פנימי,ILS,0.76,2026-07-08,0.0,0.0414,,2574260.74,1.0,96.96,2496.00322,,,0.000143,0.01573,0.003965
671,7235.0,ממשלת ישראל,ממשל שקלית 335,IL0012023326,לא צמוד למדד המחירים לצרכן ריבית קבועה,ישראל,ישראל,TASE,RF,פנימי,ILS,7.92,2035-03-30,0.04,0.041,,39899.54,1.0,101.25,40.39828,,,1e-06,0.000254,6.4e-05
671,7235.0,ממשלת ישראל,ממשל שקלית 327,IL0011393449,לא צמוד למדד המחירים לצרכן ריבית קבועה,ישראל,ישראל,TASE,RF,פנימי,ILS,1.47,2027-03-31,0.02,0.0396,,46507.06,1.0,98.22,45.67924,,,1e-06,0.000287,7.2e-05
671,7235.0,ממשלת ישראל,ממשל קצרה 11/25,IL0012153263,לא צמוד למדד המחירים לצרכן ריבית קבועה,ישראל,ישראל,TASE,RF,פנימי,ILS,0.16,2025-11-30,0.0,0.0412,,1519721.96,1.0,99.36,1509.99574,,,0.000239,0.009516,0.002399
671,7235.0,ממשלת ישראל,ממשל צמודה 1028,IL0011973265,צמוד למדד המחירים לצרכן בריבית קבועה,ישראל,ישראל,TASE,RF,פנימי,ILS,3.01,2028-10-31,0.011,0.0199,,1065372.08,1.0,105.65,1125.5656,,,3.1e-05,0.007093,0.001788
671,7235.0,ממשלת ישראל,ממשל שקלית 0226,IL0011746976,לא צמוד למדד המחירים לצרכן ריבית קבועה,ישראל,ישראל,TASE,RF,פנימי,ILS,0.4,2026-02-27,0.005,0.0409,,4673528.42,1.0,98.89,4621.65226,,,0.000188,0.029126,0.007344
671,7235.0,ממשלת ישראל,ממשל צמודה 1151,IL0011683013,צמוד למדד המחירים לצרכן בריבית קבועה,ישראל,ישראל,TASE,RF,פנימי,ILS,11.99,2051-11-30,0.005,0.0214,,246.83,1.0,80.45,0.19858,,,0.0,1e-06,0.0
671,7235.0,ממשלת ישראל,ממשל שקלית928,IL0011508798,לא צמוד למדד המחירים לצרכן ריבית קבועה,ישראל,ישראל,TASE,RF,פנימי,ILS,2.92,2028-09-28,0.0225,0.0393,,5331314.61,1.0,95.37,5084.47474,,,0.000153,0.032043,0.008079
671,7235.0,ממשלת ישראל,מ.ק.מ 316,IL0082603171,לא צמוד למדד המחירים לצרכן ריבית קבועה,ישראל,ישראל,TASE,RF,פנימי,ILS,0.42,2026-03-04,0.0,0.0415,,394394.89,1.0,98.32,387.76905,,,2.1e-05,0.002443,0.000616
671,7235.0,ממשלת ישראל,ממשלתי צמוד 0545,IL0011348658,צמוד למדד המחירים לצרכן בריבית קבועה,ישראל,ישראל,TASE,RF,פנימי,ILS,17.67,2045-05-31,0.01,0.0207,,1131064.8,1.0,99.57,1126.20122,,,4.9e-05,0.007097,0.001789
671,7235.0,ממשלת ישראל,ממשל שקלית 0142,IL0011254005,לא צמוד למדד המחירים לצרכן ריבית קבועה,ישראל,ישראל,TASE,RF,פנימי,ILS,11.17,2042-01-31,0.055,0.0434,,8644041.11,1.0,117.0,10113.52809,,,0.000278,0.063737,0.016071
671,7235.0,ממשלת ישראל,מ.ק.מ 416,IL0082604161,לא צמוד למדד המחירים לצרכן ריבית קבועה,ישראל,ישראל,TASE,RF,פנימי,ILS,0.49,2026-04-01,0.0,0.0418,,3233115.81,1.0,98.0,3168.45349,,,0.000179,0.019968,0.005035
671,7235.0,ממשלת ישראל,ממשל שקלית 537,IL0011661803,לא צמוד למדד המחירים לצרכן ריבית קבועה,ישראל,ישראל,TASE,RF,פנימי,ILS,10.55,2037-05-31,0.015,0.0421,,220617.36,1.0,75.94,167.53682,,,5e-06,0.001055,0.000266
671,7235.0,ממשלת ישראל,ממשלתי שקלי 0229,IL0011948028,לא צמוד למדד המחירים לצרכן ריבית קבועה,ישראל,ישראל,TASE,RF,פנימי,ILS,3.2,2029-02-28,0.0375,0.0391,,589491.07,1.0,101.7,599.51241,,,1.6e-05,0.003778,0.000952
671,7235.0,ממשלת ישראל,ממשלתי צמוד 0527,IL0011408478,צמוד למדד המחירים לצרכן בריבית קבועה,ישראל,ישראל,TASE,RF,פנימי,ILS,1.65,2027-05-31,0.0075,0.0209,,5513030.8,1.0,117.66,6486.63204,,,0.000226,0.040879,0.010307
671,7235.0,ממשלת ישראל,ממשל שקלי 347,IL0011401937,לא צמוד למדד המחירים לצרכן ריבית קבועה,ישראל,ישראל,TASE,RF,פנימי,ILS,14.44,2047-03-31,0.0375,0.0449,,1325267.94,1.0,91.85,1217.25861,,,5e-05,0.00767,0.001932
671,7235.0,ממשלת ישראל,ממשלתי צמוד 1131,IL0011722209,צמוד למדד המחירים לצרכן בריבית קבועה,ישראל,ישראל,TASE,RF,פנימי,ILS,6.14,2031-11-30,0.001,0.019,,29270887.28,1.0,106.54,31185.20331,,,0.000855,0.196536,0.049555
671,7235.0,ממשלת ישראל,ממשלתי צמוד 0529,IL0011570236,צמוד למדד המחירים לצרכן בריבית קבועה,ישראל,ישראל,TASE,RF,פנימי,ILS,3.63,2029-05-31,0.005,0.0193,,18069332.79,1.0,113.0,20418.34604,,,0.000613,0.12868,0.032446
671,7235.0,ממשלת ישראל,ממשל שקלית 330,IL0011609851,לא צמוד למדד המחירים לצרכן ריבית קבועה,ישראל,ישראל,TASE,RF,פנימי,ILS,4.39,2030-03-31,0.01,0.0393,,154832.98,1.0,88.66,137.27492,,,4e-06,0.000864,0.000218
671,7235.0,ממשלת ישראל,ממשל שקלית 829,IL0012128935,לא צמוד למדד המחירים לצרכן ריבית קבועה,ישראל,ישראל,TASE,RF,פנימי,ILS,3.66,2029-08-31,0.046,0.0394,,2157448.82,1.0,102.76,2216.9944,,,0.000114,0.013971,0.003523
671,7235.0,ממשלת ישראל,מ.ק.מ. 616,IL0082606141,לא צמוד למדד המחירים לצרכן ריבית קבועה,ישראל,ישראל,TASE,RF,פנימי,ILS,0.67,2026-06-03,0.0,0.042,,115612.06,1.0,97.3,112.49054,,,6e-06,0.000708,0.000178
671,7235.0,ממשלת ישראל,מ.ק.מ. 516,IL0082605150,לא צמוד למדד המחירים לצרכן ריבית קבועה,ישראל,ישראל,TASE,RF,פנימי,ILS,0.59,2026-05-06,0.0,0.0416,,6425458.58,1.0,97.63,6273.17522,,,0.000356,0.039535,0.009968
671,7235.0,ממשלת ישראל,ממשל צמודה 0431,IL0012207226,צמוד למדד המחירים לצרכן בריבית קבועה,ישראל,ישראל,TASE,RF,פנימי,ILS,5.29,2031-04-30,0.02,0.0199,,388415.17,1.0,103.02,400.14531,,,5.3e-05,0.002521,0.000635
671,7235.0,ממשלת ישראל,ממשלתי צמוד 841,IL0011205833,צמוד למדד המחירים לצרכן בריבית קבועה,ישראל,ישראל,TASE,RF,פנימי,ILS,13.23,2041-08-30,0.0275,0.0202,,6050.91,1.0,139.93,8.46705,,,0.0,5.2e-05,1.2e-05
671,7235.0,ממשלת ישראל,ממשל קצרה 02/26,IL0012194689,לא צמוד למדד המחירים לצרכן ריבית קבועה,ישראל,ישראל,TASE,RF,פנימי,ILS,0.4,2026-02-27,0.0,0.0417,,741327.79,1.0,97.18,720.42234,,,0.000141,0.00454,0.001144
671,7235.0,ממשלת ישראל,ממשל שקלי 1152,IL0011840761,לא צמוד למדד המחירים לצרכן ריבית קבועה,ישראל,ישראל,TASE,RF,פנימי,ILS,17.24,2052-11-29,0.028,0.0461,,17148632.48,1.0,74.63,12798.02441,,,0.00062,0.080655,0.020337
671,7235.0,ממשלת ישראל,ממשל צמודה 1033,IL0012043795,צמוד למדד המחירים לצרכן בריבית קבועה,ישראל,ישראל,TASE,RF,פנימי,ILS,7.53,2033-10-31,0.016,0.0195,,29068501.15,1.0,105.4,30638.20021,,,0.001099,0.19309,0.048689
671,7235.0,ממשלת ישראל,ממשל שקלית 927,IL0012035791,לא צמוד למדד המחירים לצרכן ריבית קבועה,ישראל,ישראל,TASE,RF,פנימי,ILS,1.96,2027-09-30,0.0375,0.0397,,1276413.18,1.0,99.62,1271.56281,,,3.5e-05,0.008013,0.00202
671,7235.0,ממשלת ישראל,מ.ק.מ 216,IL0082602181,לא צמוד למדד המחירים לצרכן ריבית קבועה,ישראל,ישראל,TASE,RF,פנימי,ILS,0.34,2026-02-04,0.0,0.0424,,587502.27,1.0,98.6,579.27724,,,3.2e-05,0.00365,0.00092
671,7235.0,MEX BONOS DESARR FIX RT,MBONO 8 1/2 11/18/2038,MX0MGO0000J5,"נקוב במט""ח","חו""ל",מקסיקו,FOREIGN_GOV_SEC,BBB-,Fitch,MXN,7.86,2038-11-18,0.085,-0.282,,30255.81,0.1804,9889.2,539.76711,,,0.0,0.003401,0.000857
671,7235.0,MEX BONOS DESARR FIX RT,MBONO 7.5 06/03/27,MX0MGO0000D8,"נקוב במט""ח","חו""ל",מקסיקו,FOREIGN_GOV_SEC,BBB-,Fitch,MXN,1.57,2027-03-06,0.075,-0.9602,,6078.14,0.1804,10252.3,112.41603,,,0.0,0.000708,0.000178
671,7235.0,INTL FINANCE CORP,IFC 0 26/05/27,XS1621760302,"נקוב במט""ח","חו""ל",ברזיל,FOREIGN_GOV_SEC,AAA,S&P,BRL,1.63,2027-05-26,0.0,0.1238,,226163.19,0.6225,82.459,116.09121,,,0.000311,0.000731,0.000184
671,7235.0,POLAND GOVERNMENT BOND,POLGB 3 3/4 05/25/27,PL0000114393,"נקוב במט""ח","חו""ל",פולין,FOREIGN_GOV_SEC,A-,Fitch,PLN,1.59,2027-05-25,0.0375,0.1229,,226163.19,0.9092,100.706,207.0793,,,6e-06,0.001305,0.000329
671,7235.0,AFRICAN DEVELOPMENT BANK,AFDB 0 06/05/34,XS2831196535,"נקוב במט""ח","חו""ל",ברזיל,FOREIGN_GOV_SEC,AAA,S&P,BRL,8.66,2034-06-05,0.0,0.1221,,627602.85,0.6225,36.768,143.64624,,,0.001141,0.000905,0.000228
671,7235.0,HUNGARY GOVERNMENT BOND,HGB 6 3/4 07/23/31,HU0000407317,"נקוב במט""ח","חו""ל",הונגריה,FOREIGN_GOV_SEC,Baa2,Moodys,HUF,4.86,2031-07-23,0.0675,0.0644,,4014396.59,0.009944,104.522,41.7243,,,1.6e-05,0.000262,6.6e-05
671,7235.0,TREASURY BILL,B 0 10/02/25,US912797MS31,"נקוב במט""ח","חו""ל","ארה""ב",אחר,AA+,Fitch,USD,0.0054,2025-10-02,0.0,0.0203,,27014.32,3.306,99.989,89.2995,,,0.0,0.000562,0.000141
671,7235.0,POLAND GOVERNMENT BOND,POLGB 1 3/4 04/25/32,PL0000113783,"נקוב במט""ח","חו""ל",פולין,FOREIGN_GOV_SEC,A-,Fitch,PLN,6.15,2032-04-24,0.0175,0.048,,604986.53,0.9092,82.619,454.44891,,,1e-05,0.002864,0.000722
671,7235.0,INTL FINANCE CORP,IFC 0 27/08/30,XS1280871259,"נקוב במט""ח","חו""ל",ברזיל,FOREIGN_GOV_SEC,AAA,S&P,BRL,4.89,2030-08-27,0.0,0.1222,,124389.75,0.6225,56.766,43.9554,,,0.000234,0.000277,6.9e-05
671,7235.0,TREASURY BILL,B 0 09/03/26,US912797RS85,"נקוב במט""ח","חו""ל","ארה""ב",אחר,AA+,Fitch,USD,0.91,2026-09-03,0.0,0.0365,,294946.71,3.306,96.738,943.28626,,,5e-06,0.005943,0.001498
671,7235.0,POLAND GOVERNMENT BOND,POLGB 7 1/2  07/25/2028,PL0000115192,"נקוב במט""ח","חו""ל",פולין,FOREIGN_GOV_SEC,A-,Fitch,PLN,2.6,2028-07-25,0.075,0.0439,,114212.41,0.9092,109.442,113.64668,,,2e-06,0.000716,0.00018
671,7235.0,HUNGARY GOVERNMENT BOND,HGB 2 1/4 04/20/33,HU0000404744,"נקוב במט""ח","חו""ל",הונגריה,FOREIGN_GOV_SEC,Baa2,Moodys,HUF,6.82,2033-04-20,0.0225,0.067,,44101821.7,0.009944,75.239,329.95952,,,3.5e-05,0.002079,0.000524
671,7235.0,POLAND GOVERNMENT BOND,POLGB 5 3/4 04/25/29,PL0000105391,"נקוב במט""ח","חו""ל",פולין,FOREIGN_GOV_SEC,A-,Fitch,PLN,3.24,2029-04-25,0.0575,0.0453,,53148.35,0.9092,106.374,51.40255,,,0.0,0.000323,8.1e-05
671,7235.0,MEX BONOS DESARR FIX RT,MBONO 7 1/2 05/26/33,MX0MGO0001D6,"נקוב במט""ח","חו""ל",מקסיקו,FOREIGN_GOV_SEC,BBB-,Fitch,MXN,5.8,2033-05-26,0.075,-0.4421,,31544.11,0.1804,9685.8,551.17602,,,0.0,0.003473,0.000875
671,7235.0,INTL FINANCE CORP,EBRD 0 02/02/32,XS2438631710,"נקוב במט""ח","חו""ל",ברזיל,FOREIGN_GOV_SEC,AAA,S&P,BRL,6.32,2032-02-02,0.0,0.1199,,373169.26,0.6225,48.758,113.26379,,,0.000186,0.000713,0.000179
671,7235.0,INTL BK RECON & DEVELOP,IBRD 10 10/17/29,XS2920414112,"נקוב במט""ח","חו""ל",ברזיל,FOREIGN_GOV_SEC,AAA,S&P,BRL,3.16,2029-10-17,0.1,0.1206,,463634.54,0.6225,103.44,298.54077,,,0.000713,0.001881,0.000474
671,7235.0,POLAND GOVERNMENT BOND,POLGB 6 10/25/2033,PL0000115291,"נקוב במט""ח","חו""ל",פולין,FOREIGN_GOV_SEC,A-,Fitch,PLN,6.31,2033-10-25,0.06,0.0524,,339810.19,0.9092,110.439,341.20728,,,5e-06,0.00215,0.000542
671,7235.0,REPUBLIC OF BRAZIL,BRAZIL 10 1/4 01/10/28,US105756BN96,"נקוב במט""ח","חו""ל",ברזיל,FOREIGN_GOV_SEC,BB,S&P,BRL,2.03,2028-01-10,0.1025,0.0993,,249853.78,0.6225,103.027,160.24199,,,5.2e-05,0.001009,0.000253
671,7235.0,MEX BONOS DESARR FIX RT,MBONO 7 3/4 29/05/31,MX0MGO0000P2,"נקוב במט""ח","חו""ל",מקסיקו,FOREIGN_GOV_SEC,BBB-,Fitch,MXN,4.59,2031-05-29,0.0775,-0.5479,,22839.09,0.1804,9997.6,411.91829,,,0.0,0.002596,0.000654
671,7235.0,HUNGARY GOVERNMENT BOND,HGB 7 10/24/35 35/A,HU0000406624,"נקוב במט""ח","חו""ל",הונגריה,FOREIGN_GOV_SEC,Baa2,Moodys,HUF,7.09,2035-10-24,0.07,0.068,,7915711.59,0.009944,107.901,84.93302,,,6e-06,0.000535,0.000134
671,7235.0,INTL FINANCE CORP,IFC 11 ½ 16/01/30,XS2977993471,"נקוב במט""ח","חו""ל",ברזיל,FOREIGN_GOV_SEC,AAA,S&P,BRL,3.33,2030-01-16,0.115,0.1208,,350552.94,0.6225,106.39,232.16341,,,0.000359,0.001463,0.000368
671,7236.0,ממשלת ישראל,מ.ק.מ 216,IL0082602181,לא צמוד למדד המחירים לצרכן ריבית קבועה,ישראל,ישראל,TASE,RF,פנימי,ILS,0.34,2026-02-04,0.0,0.0424,,116042.19,1.0,98.6,114.4176,,,6e-06,0.001762,0.000551
671,7236.0,ממשלת ישראל,ממשל קצרה 11/25,IL0012153263,לא צמוד למדד המחירים לצרכן ריבית קבועה,ישראל,ישראל,TASE,RF,פנימי,ILS,0.16,2025-11-30,0.0,0.0412,,300172.24,1.0,99.36,298.25114,,,4.7e-05,0.004594,0.001438
671,7236.0,ממשלת ישראל,ממשל שקלית 829,IL0012128935,לא צמוד למדד המחירים לצרכן ריבית קבועה,ישראל,ישראל,TASE,RF,פנימי,ILS,3.66,2029-08-31,0.046,0.0394,,957936.03,1.0,102.76,984.37506,,,5e-05,0.015164,0.004747
671,7236.0,ממשלת ישראל,ממשלתי צמוד 841,IL0011205833,צמוד למדד המחירים לצרכן בריבית קבועה,ישראל,ישראל,TASE,RF,פנימי,ILS,13.23,2041-08-30,0.0275,0.0202,,2686.69,1.0,139.93,3.75948,,,0.0,5.7e-05,1.8e-05
671,7236.0,ממשלת ישראל,ממשלתי צמוד 0527,IL0011408478,צמוד למדד המחירים לצרכן בריבית קבועה,ישראל,ישראל,TASE,RF,פנימי,ILS,1.65,2027-05-31,0.0075,0.0209,,2447859.15,1.0,117.66,2880.15108,,,0.0001,0.044369,0.013888
671,7236.0,ממשלת ישראל,ממשל שקלית 335,IL0012023326,לא צמוד למדד המחירים לצרכן ריבית קבועה,ישראל,ישראל,TASE,RF,פנימי,ILS,7.92,2035-03-30,0.04,0.041,,17715.93,1.0,101.25,17.93738,,,0.0,0.000276,8.6e-05
671,7236.0,ממשלת ישראל,ממשל שקלי 347,IL0011401937,לא צמוד למדד המחירים לצרכן ריבית קבועה,ישראל,ישראל,TASE,RF,פנימי,ILS,14.44,2047-03-31,0.0375,0.0449,,588436.63,1.0,91.85,540.47904,,,2.2e-05,0.008325,0.002605
671,7236.0,ממשלת ישראל,ממשל צמודה 1028,IL0011973265,צמוד למדד המחירים לצרכן בריבית קבועה,ישראל,ישראל,TASE,RF,פנימי,ILS,3.01,2028-10-31,0.011,0.0199,,473039.41,1.0,105.65,499.76613,,,1.4e-05,0.007698,0.00241
671,7236.0,ממשלת ישראל,ממשל צמודה 0431,IL0012207226,צמוד למדד המחירים לצרכן בריבית קבועה,ישראל,ישראל,TASE,RF,פנימי,ILS,5.29,2031-04-30,0.02,0.0199,,172461.52,1.0,103.02,177.66986,,,2.3e-05,0.002737,0.000856
671,7236.0,ממשלת ישראל,מ.ק.מ 316,IL0082603171,לא צמוד למדד המחירים לצרכן ריבית קבועה,ישראל,ישראל,TASE,RF,פנימי,ILS,0.42,2026-03-04,0.0,0.0415,,75658.18,1.0,98.32,74.38712,,,4e-06,0.001145,0.000358
671,7236.0,ממשלת ישראל,ממשל שקלית 330,IL0011609851,לא צמוד למדד המחירים לצרכן ריבית קבועה,ישראל,ישראל,TASE,RF,פנימי,ILS,4.39,2030-03-31,0.01,0.0393,,68747.91,1.0,88.66,60.9519,,,1e-06,0.000938,0.000293
671,7236.0,ממשלת ישראל,ממשל צמודה 1151,IL0011683013,צמוד למדד המחירים לצרכן בריבית קבועה,ישראל,ישראל,TASE,RF,פנימי,ILS,11.99,2051-11-30,0.005,0.0214,,109.59,1.0,80.45,0.08817,,,0.0,1e-06,0.0
671,7236.0,ממשלת ישראל,ממשל שקלית 0142,IL0011254005,לא צמוד למדד המחירים לצרכן ריבית קבועה,ישראל,ישראל,TASE,RF,פנימי,ILS,11.17,2042-01-31,0.055,0.0434,,3838069.46,1.0,117.0,4490.54127,,,0.000123,0.069179,0.021655
671,7236.0,ממשלת ישראל,ממשל שקלית 0226,IL0011746976,לא צמוד למדד המחירים לצרכן ריבית קבועה,ישראל,ישראל,TASE,RF,פנימי,ILS,0.4,2026-02-27,0.005,0.0409,,2075108.91,1.0,98.89,2052.0752,,,8.3e-05,0.031613,0.009896
671,7236.0,ממשלת ישראל,ממשל שקלית 537,IL0011661803,לא צמוד למדד המחירים לצרכן ריבית קבועה,ישראל,ישראל,TASE,RF,פנימי,ILS,10.55,2037-05-31,0.015,0.0421,,97957.05,1.0,75.94,74.38858,,,2e-06,0.001146,0.000358
671,7236.0,ממשלת ישראל,ממשל שקלית 0432,IL0011806606,לא צמוד למדד המחירים לצרכן ריבית קבועה,ישראל,ישראל,TASE,RF,פנימי,ILS,6.28,2032-04-30,0.013,0.0402,,3229.55,1.0,85.09,2.74802,,,0.0,4.2e-05,1.3e-05
671,7236.0,ממשלת ישראל,מ.ק.מ. 516,IL0082605150,לא צמוד למדד המחירים לצרכן ריבית קבועה,ישראל,ישראל,TASE,RF,פנימי,ILS,0.59,2026-05-06,0.0,0.0416,,1269142.87,1.0,97.63,1239.06418,,,7e-05,0.019088,0.005974
671,7236.0,ממשלת ישראל,ממשלתי צמוד 0529,IL0011570236,צמוד למדד המחירים לצרכן בריבית קבועה,ישראל,ישראל,TASE,RF,פנימי,ILS,3.63,2029-05-31,0.005,0.0193,,8023024.59,1.0,113.0,9066.01778,,,0.000272,0.139666,0.04372
671,7236.0,ממשלת ישראל,ממשלתי צמוד 1131,IL0011722209,צמוד למדד המחירים לצרכן בריבית קבועה,ישראל,ישראל,TASE,RF,פנימי,ILS,6.14,2031-11-30,0.001,0.019,,12996664.08,1.0,106.54,13846.64592,,,0.000379,0.213315,0.066774
671,7236.0,ממשלת ישראל,מ.ק.מ 416,IL0082604161,לא צמוד למדד המחירים לצרכן ריבית קבועה,ישראל,ישראל,TASE,RF,פנימי,ILS,0.49,2026-04-01,0.0,0.0418,,638598.13,1.0,98.0,625.82617,,,3.5e-05,0.009641,0.003018
671,7236.0,ממשלת ישראל,מ.ק.מ. 616,IL0082606141,לא צמוד למדד המחירים לצרכן ריבית קבועה,ישראל,ישראל,TASE,RF,פנימי,ILS,0.67,2026-06-03,0.0,0.042,,22835.45,1.0,97.3,22.21889,,,1e-06,0.000342,0.000107
671,7236.0,ממשלת ישראל,מ.ק.מ. 726,IL0082607214,לא צמוד למדד המחירים לצרכן ריבית קבועה,ישראל,ישראל,TASE,RF,פנימי,ILS,0.76,2026-07-08,0.0,0.0414,,508462.49,1.0,96.96,493.00522,,,2.8e-05,0.007594,0.002377
671,7236.0,ממשלת ישראל,ממשל קצרה 02/26,IL0012194689,לא צמוד למדד המחירים לצרכן ריבית קבועה,ישראל,ישראל,TASE,RF,פנימי,ILS,0.4,2026-02-27,0.0,0.0417,,146425.48,1.0,97.18,142.29628,,,2.8e-05,0.002192,0.000686
671,7236.0,ממשלת ישראל,ממשלתי צמוד 726,IL0011695645,צמוד למדד המחירים לצרכן בריבית קבועה,ישראל,ישראל,TASE,RF,פנימי,ILS,0.82,2026-07-31,0.001,0.0267,,3182146.64,1.0,116.31,3701.15476,,,0.000157,0.057018,0.017848
671,7236.0,ממשלת ישראל,ממשלתי שקלי 0229,IL0011948028,לא צמוד למדד המחירים לצרכן ריבית קבועה,ישראל,ישראל,TASE,RF,פנימי,ILS,3.2,2029-02-28,0.0375,0.0391,,261741.89,1.0,101.7,266.1915,,,7e-06,0.0041,0.001283
671,7236.0,ממשלת ישראל,ממשל שקלית 327,IL0011393449,לא צמוד למדד המחירים לצרכן ריבית קבועה,ישראל,ישראל,TASE,RF,פנימי,ILS,1.47,2027-03-31,0.02,0.0396,,20649.76,1.0,98.22,20.28219,,,0.0,0.000312,9.7e-05
671,7236.0,ממשלת ישראל,ממשל צמודה 1033,IL0012043795,צמוד למדד המחירים לצרכן בריבית קבועה,ישראל,ישראל,TASE,RF,פנימי,ILS,7.53,2033-10-31,0.016,0.0195,,12906801.94,1.0,105.4,13603.76925,,,0.000487,0.209575,0.065605
671,7236.0,ממשלת ישראל,ממשל שקלית928,IL0011508798,לא צמוד למדד המחירים לצרכן ריבית קבועה,ישראל,ישראל,TASE,RF,פנימי,ILS,2.92,2028-09-28,0.0225,0.0393,,2367174.74,1.0,95.37,2257.57455,,,6.8e-05,0.034778,0.010885
671,7236.0,ממשלת ישראל,ממשל שקלי 1152,IL0011840761,לא צמוד למדד המחירים לצרכן ריבית קבועה,ישראל,ישראל,TASE,RF,פנימי,ILS,17.24,2052-11-29,0.028,0.0461,,7614221.39,1.0,74.63,5682.49342,,,0.000275,0.087542,0.027403
671,7236.0,ממשלת ישראל,ממשלתי צמוד 0545,IL0011348658,צמוד למדד המחירים לצרכן בריבית קבועה,ישראל,ישראל,TASE,RF,פנימי,ILS,17.67,2045-05-31,0.01,0.0207,,502207.85,1.0,99.57,500.04835,,,2.1e-05,0.007703,0.002411
671,7236.0,ממשלת ישראל,ממשל שקלית 927,IL0012035791,לא צמוד למדד המחירים לצרכן ריבית קבועה,ישראל,ישראל,TASE,RF,פנימי,ILS,1.96,2027-09-30,0.0375,0.0397,,566744.47,1.0,99.62,564.59084,,,1.5e-05,0.008697,0.002722
671,7236.0,MEX BONOS DESARR FIX RT,MBONO 8 1/2 11/18/2038,MX0MGO0000J5,"נקוב במט""ח","חו""ל",מקסיקו,FOREIGN_GOV_SEC,BBB-,Fitch,MXN,7.86,2038-11-18,0.085,-0.282,,2460.22,0.1804,9889.2,43.8907,,,0.0,0.000676,0.000211
671,7236.0,HUNGARY GOVERNMENT BOND,HGB 2 1/4 04/20/33,HU0000404744,"נקוב במט""ח","חו""ל",הונגריה,FOREIGN_GOV_SEC,Baa2,Moodys,HUF,6.82,2033-04-20,0.0225,0.067,,3586101.62,0.009944,75.239,26.83037,,,2e-06,0.000413,0.000129
671,7236.0,POLAND GOVERNMENT BOND,POLGB 7 1/2  07/25/2028,PL0000115192,"נקוב במט""ח","חו""ל",פולין,FOREIGN_GOV_SEC,A-,Fitch,PLN,2.6,2028-07-25,0.075,0.0439,,9287.08,0.9092,109.442,9.24108,,,0.0,0.000142,4.4e-05
671,7236.0,REPUBLIC OF BRAZIL,BRAZIL 10 1/4 01/10/28,US105756BN96,"נקוב במט""ח","חו""ל",ברזיל,FOREIGN_GOV_SEC,BB,S&P,BRL,2.03,2028-01-10,0.1025,0.0993,,20316.65,0.6225,103.027,13.02994,,,4e-06,0.0002,6.2e-05
671,7236.0,TREASURY BILL,B 0 10/02/25,US912797MS31,"נקוב במט""ח","חו""ל","ארה""ב",אחר,AA+,Fitch,USD,0.0054,2025-10-02,0.0,0.0203,,4350.26,3.306,99.989,14.38042,,,0.0,0.000222,6.8e-05
671,7236.0,MEX BONOS DESARR FIX RT,MBONO 7 1/2 05/26/33,MX0MGO0001D6,"נקוב במט""ח","חו""ל",מקסיקו,FOREIGN_GOV_SEC,BBB-,Fitch,MXN,5.8,2033-05-26,0.075,-0.4421,,2564.98,0.1804,9685.8,44.8184,,,0.0,0.00069,0.000216
671,7236.0,MEX BONOS DESARR FIX RT,MBONO 7 3/4 29/05/31,MX0MGO0000P2,"נקוב במט""ח","חו""ל",מקסיקו,FOREIGN_GOV_SEC,BBB-,Fitch,MXN,4.59,2031-05-29,0.0775,-0.5479,,1857.14,0.1804,9997.6,33.49478,,,0.0,0.000516,0.000161
671,7236.0,POLAND GOVERNMENT BOND,POLGB 1 3/4 04/25/32,PL0000113783,"נקוב במט""ח","חו""ל",פולין,FOREIGN_GOV_SEC,A-,Fitch,PLN,6.15,2032-04-24,0.0175,0.048,,49193.96,0.9092,82.619,36.95312,,,0.0,0.000569,0.000178
671,7236.0,POLAND GOVERNMENT BOND,POLGB 6 10/25/2033,PL0000115291,"נקוב במט""ח","חו""ל",פולין,FOREIGN_GOV_SEC,A-,Fitch,PLN,6.31,2033-10-25,0.06,0.0524,,27631.37,0.9092,110.439,27.74498,,,0.0,0.000427,0.000133
671,7236.0,TREASURY BILL,B 0 09/03/26,US912797RS85,"נקוב במט""ח","חו""ל","ארה""ב",אחר,AA+,Fitch,USD,0.91,2026-09-03,0.0,0.0365,,74998.0,3.306,96.738,239.85548,,,1e-06,0.003694,0.001156
671,7236.0,INTL FINANCE CORP,IFC 0 27/08/30,XS1280871259,"נקוב במט""ח","חו""ל",ברזיל,FOREIGN_GOV_SEC,AAA,S&P,BRL,4.89,2030-08-27,0.0,0.1222,,10114.65,0.6225,56.766,3.5742,,,1.9e-05,5.5e-05,1.7e-05
671,7236.0,HUNGARY GOVERNMENT BOND,HGB 6 3/4 07/23/31,HU0000407317,"נקוב במט""ח","חו""ל",הונגריה,FOREIGN_GOV_SEC,Baa2,Moodys,HUF,4.86,2031-07-23,0.0675,0.0644,,326427.2,0.009944,104.522,3.39278,,,1e-06,5.2e-05,1.6e-05
671,7236.0,INTL BK RECON & DEVELOP,IBRD 10 10/17/29,XS2920414112,"נקוב במט""ח","חו""ל",ברזיל,FOREIGN_GOV_SEC,AAA,S&P,BRL,3.16,2029-10-17,0.1,0.1206,,37700.04,0.6225,103.44,24.27559,,,5.8e-05,0.000373,0.000117
671,7236.0,INTL FINANCE CORP,EBRD 0 02/02/32,XS2438631710,"נקוב במט""ח","חו""ל",ברזיל,FOREIGN_GOV_SEC,AAA,S&P,BRL,6.32,2032-02-02,0.0,0.1199,,30343.94,0.6225,48.758,9.20995,,,1.5e-05,0.000141,4.4e-05
671,7236.0,AFRICAN DEVELOPMENT BANK,AFDB 0 06/05/34,XS2831196535,"נקוב במט""ח","חו""ל",ברזיל,FOREIGN_GOV_SEC,AAA,S&P,BRL,8.66,2034-06-05,0.0,0.1221,,51032.98,0.6225,36.768,11.68047,,,9.2e-05,0.000179,5.6e-05
671,7236.0,MEX BONOS DESARR FIX RT,MBONO 7.5 06/03/27,MX0MGO0000D8,"נקוב במט""ח","חו""ל",מקסיקו,FOREIGN_GOV_SEC,BBB-,Fitch,MXN,1.57,2027-03-06,0.075,-0.9602,,494.24,0.1804,10252.3,9.14101,,,0.0,0.00014,4.4e-05
671,7236.0,POLAND GOVERNMENT BOND,POLGB 3 3/4 05/25/27,PL0000114393,"נקוב במט""ח","חו""ל",פולין,FOREIGN_GOV_SEC,A-,Fitch,PLN,1.59,2027-05-25,0.0375,0.1229,,18390.26,0.9092,100.706,16.83847,,,0.0,0.000259,8.1e-05
671,7236.0,HUNGARY GOVERNMENT BOND,HGB 7 10/24/35 35/A,HU0000406624,"נקוב במט""ח","חו""ל",הונגריה,FOREIGN_GOV_SEC,Baa2,Moodys,HUF,7.09,2035-10-24,0.07,0.068,,643659.27,0.009944,107.901,6.90626,,,0.0,0.000106,3.3e-05
671,7236.0,POLAND GOVERNMENT BOND,POLGB 5 3/4 04/25/29,PL0000105391,"נקוב במט""ח","חו""ל",פולין,FOREIGN_GOV_SEC,A-,Fitch,PLN,3.24,2029-04-25,0.0575,0.0453,,4321.71,0.9092,106.374,4.17975,,,0.0,6.4e-05,2e-05
671,7236.0,INTL FINANCE CORP,IFC 0 26/05/27,XS1621760302,"נקוב במט""ח","חו""ל",ברזיל,FOREIGN_GOV_SEC,AAA,S&P,BRL,1.63,2027-05-26,0.0,0.1238,,18390.26,0.6225,82.459,9.43986,,,2.5e-05,0.000145,4.5e-05
671,7236.0,INTL FINANCE CORP,IFC 11 ½ 16/01/30,XS2977993471,"נקוב במט""ח","חו""ל",ברזיל,FOREIGN_GOV_SEC,AAA,S&P,BRL,3.33,2030-01-16,0.115,0.1208,,28504.91,0.6225,106.39,18.87817,,,2.9e-05,0.00029,9.1e-05
671,8318.0,ממשלת ישראל,מ.ק.מ. 616,IL0082606141,לא צמוד למדד המחירים לצרכן ריבית קבועה,ישראל,ישראל,TASE,RF,פנימי,ILS,0.67,2026-06-03,0.0,0.042,,726438.09,1.0,97.3,706.82426,,,4e-05,0.007064,0.000466
671,8318.0,ממשלת ישראל,מ.ק.מ 216,IL0082602181,לא צמוד למדד המחירים לצרכן ריבית קבועה,ישראל,ישראל,TASE,RF,פנימי,ILS,0.34,2026-02-04,0.0,0.0424,,3691518.14,1.0,98.6,3639.83689,,,0.000205,0.036377,0.002404
671,8318.0,ממשלת ישראל,מ.ק.מ 416,IL0082604161,לא צמוד למדד המחירים לצרכן ריבית קבועה,ישראל,ישראל,TASE,RF,פנימי,ILS,0.49,2026-04-01,0.0,0.0418,,20314994.96,1.0,98.0,19908.69506,,,0.001128,0.198972,0.013151
671,8318.0,ממשלת ישראל,מ.ק.מ. 726,IL0082607214,לא צמוד למדד המחירים לצרכן ריבית קבועה,ישראל,ישראל,TASE,RF,פנימי,ILS,0.76,2026-07-08,0.0,0.0414,,16175137.85,1.0,96.96,15683.41367,,,0.000898,0.156742,0.010359
671,8318.0,ממשלת ישראל,מ.ק.מ. 516,IL0082605150,לא צמוד למדד המחירים לצרכן ריבית קבועה,ישראל,ישראל,TASE,RF,פנימי,ILS,0.59,2026-05-06,0.0,0.0416,,40373796.23,1.0,97.63,39416.93725,,,0.002242,0.393941,0.026037
671,8318.0,ממשלת ישראל,מ.ק.מ 316,IL0082603171,לא צמוד למדד המחירים לצרכן ריבית קבועה,ישראל,ישראל,TASE,RF,פנימי,ILS,0.42,2026-03-04,0.0,0.0415,,1769788.1,1.0,98.32,1740.05566,,,9.8e-05,0.01739,0.001149
671,8318.0,ממשלת ישראל,ממשל קצרה 11/25,IL0012153263,לא צמוד למדד המחירים לצרכן ריבית קבועה,ישראל,ישראל,TASE,RF,פנימי,ILS,0.16,2025-11-30,0.0,0.0412,,9549037.47,1.0,99.36,9487.92363,,,0.001505,0.094824,0.006267
671,8318.0,ממשלת ישראל,ממשל קצרה 02/26,IL0012194689,לא צמוד למדד המחירים לצרכן ריבית קבועה,ישראל,ישראל,TASE,RF,פנימי,ILS,0.4,2026-02-27,0.0,0.0417,,4658067.06,1.0,97.18,4526.70957,,,0.000891,0.045241,0.00299
671,8318.0,TREASURY BILL,B 0 09/03/26,US912797RS85,"נקוב במט""ח","חו""ל","ארה""ב",אחר,AA+,Fitch,USD,0.91,2026-09-03,0.0,0.0365,,1426533.04,3.306,96.738,4562.27844,,,2.7e-05,0.045596,0.003013
671,8318.0,TREASURY BILL,B 0 10/02/25,US912797MS31,"נקוב במט""ח","חו""ל","ארה""ב",אחר,AA+,Fitch,USD,0.0054,2025-10-02,0.0,0.0203,,116451.68,3.306,99.989,384.94689,,,0.0,0.003848,0.000254
671,8319.0,ממשלת ישראל,ממשלתי צמוד 726,IL0011695645,צמוד למדד המחירים לצרכן בריבית קבועה,ישראל,ישראל,TASE,RF,פנימי,ILS,0.82,2026-07-31,0.001,0.0267,,188149.19,1.0,116.31,218.83632,,,9e-06,0.058936,0.024559
671,8319.0,ממשלת ישראל,ממשל שקלי 347,IL0011401937,לא צמוד למדד המחירים לצרכן ריבית קבועה,ישראל,ישראל,TASE,RF,פנימי,ILS,14.44,2047-03-31,0.0375,0.0449,,34792.19,1.0,91.85,31.95663,,,1e-06,0.008605,0.003585
671,8319.0,ממשלת ישראל,ממשלתי צמוד 1131,IL0011722209,צמוד למדד המחירים לצרכן בריבית קבועה,ישראל,ישראל,TASE,RF,פנימי,ILS,6.14,2031-11-30,0.001,0.019,,768447.24,1.0,106.54,818.70369,,,2.2e-05,0.22049,0.091878
671,8319.0,ממשלת ישראל,ממשל שקלית 927,IL0012035791,לא צמוד למדד המחירים לצרכן ריבית קבועה,ישראל,ישראל,TASE,RF,פנימי,ILS,1.96,2027-09-30,0.0375,0.0397,,33509.61,1.0,99.62,33.38228,,,0.0,0.008989,0.003746
671,8319.0,ממשלת ישראל,ממשל צמודה 1151,IL0011683013,צמוד למדד המחירים לצרכן בריבית קבועה,ישראל,ישראל,TASE,RF,פנימי,ILS,11.99,2051-11-30,0.005,0.0214,,6.48,1.0,80.45,0.00521,,,0.0,1e-06,0.0
671,8319.0,ממשלת ישראל,ממשל שקלית 335,IL0012023326,לא צמוד למדד המחירים לצרכן ריבית קבועה,ישראל,ישראל,TASE,RF,פנימי,ILS,7.92,2035-03-30,0.04,0.041,,1047.48,1.0,101.25,1.06057,,,0.0,0.000285,0.000119
671,8319.0,ממשלת ישראל,ממשלתי צמוד 841,IL0011205833,צמוד למדד המחירים לצרכן בריבית קבועה,ישראל,ישראל,TASE,RF,פנימי,ILS,13.23,2041-08-30,0.0275,0.0202,,158.85,1.0,139.93,0.22229,,,0.0,5.9e-05,2.4e-05
671,8319.0,ממשלת ישראל,ממשלתי שקלי 0229,IL0011948028,לא צמוד למדד המחירים לצרכן ריבית קבועה,ישראל,ישראל,TASE,RF,פנימי,ILS,3.2,2029-02-28,0.0375,0.0391,,15475.88,1.0,101.7,15.73897,,,0.0,0.004238,0.001766
671,8319.0,ממשלת ישראל,ממשלתי צמוד 0527,IL0011408478,צמוד למדד המחירים לצרכן בריבית קבועה,ישראל,ישראל,TASE,RF,פנימי,ILS,1.65,2027-05-31,0.0075,0.0209,,144733.34,1.0,117.66,170.29325,,,5e-06,0.045862,0.01911
671,8319.0,ממשלת ישראל,ממשלתי צמוד 0545,IL0011348658,צמוד למדד המחירים לצרכן בריבית קבועה,ישראל,ישראל,TASE,RF,פנימי,ILS,17.67,2045-05-31,0.01,0.0207,,29693.79,1.0,99.57,29.56611,,,1e-06,0.007962,0.003318
671,8319.0,ממשלת ישראל,ממשל שקלית 0226,IL0011746976,לא צמוד למדד המחירים לצרכן ריבית קבועה,ישראל,ישראל,TASE,RF,פנימי,ILS,0.4,2026-02-27,0.005,0.0409,,122693.92,1.0,98.89,121.33202,,,4e-06,0.032676,0.013615
671,8319.0,ממשלת ישראל,ממשלתי צמוד 0529,IL0011570236,צמוד למדד המחירים לצרכן בריבית קבועה,ישראל,ישראל,TASE,RF,פנימי,ILS,3.63,2029-05-31,0.005,0.0193,,474373.35,1.0,113.0,536.04188,,,1.6e-05,0.144364,0.060157
671,8319.0,ממשלת ישראל,ממשל שקלית 327,IL0011393449,לא צמוד למדד המחירים לצרכן ריבית קבועה,ישראל,ישראל,TASE,RF,פנימי,ILS,1.47,2027-03-31,0.02,0.0396,,1220.95,1.0,98.22,1.19921,,,0.0,0.000322,0.000134
671,8319.0,ממשלת ישראל,ממשל שקלית 0142,IL0011254005,לא צמוד למדד המחירים לצרכן ריבית קבועה,ישראל,ישראל,TASE,RF,פנימי,ILS,11.17,2042-01-31,0.055,0.0434,,226931.62,1.0,117.0,265.50998,,,7e-06,0.071506,0.029796
671,8319.0,ממשלת ישראל,ממשל שקלית 0432,IL0011806606,לא צמוד למדד המחירים לצרכן ריבית קבועה,ישראל,ישראל,TASE,RF,פנימי,ILS,6.28,2032-04-30,0.013,0.0402,,190.95,1.0,85.09,0.16248,,,0.0,4.3e-05,1.8e-05
671,8319.0,ממשלת ישראל,ממשל שקלית 330,IL0011609851,לא צמוד למדד המחירים לצרכן ריבית קבועה,ישראל,ישראל,TASE,RF,פנימי,ILS,4.39,2030-03-31,0.01,0.0393,,4064.82,1.0,88.66,3.60387,,,0.0,0.00097,0.000403
671,8319.0,ממשלת ישראל,ממשל צמודה 1028,IL0011973265,צמוד למדד המחירים לצרכן בריבית קבועה,ישראל,ישראל,TASE,RF,פנימי,ILS,3.01,2028-10-31,0.011,0.0199,,27969.16,1.0,105.65,29.54942,,,0.0,0.007957,0.003315
671,8319.0,ממשלת ישראל,ממשל שקלית928,IL0011508798,לא צמוד למדד המחירים לצרכן ריבית קבועה,ישראל,ישראל,TASE,RF,פנימי,ILS,2.92,2028-09-28,0.0225,0.0393,,139962.75,1.0,95.37,133.48247,,,4e-06,0.035948,0.014979
671,8319.0,ממשלת ישראל,ממשל שקלית 537,IL0011661803,לא צמוד למדד המחירים לצרכן ריבית קבועה,ישראל,ישראל,TASE,RF,פנימי,ILS,10.55,2037-05-31,0.015,0.0421,,5791.86,1.0,75.94,4.39834,,,0.0,0.001184,0.000493
671,8319.0,ממשלת ישראל,ממשל שקלי 1152,IL0011840761,לא צמוד למדד המחירים לצרכן ריבית קבועה,ישראל,ישראל,TASE,RF,פנימי,ILS,17.24,2052-11-29,0.028,0.0461,,450202.25,1.0,74.63,335.98593,,,1.6e-05,0.090486,0.037706
671,8319.0,ממשלת ישראל,ממשל צמודה 1033,IL0012043795,צמוד למדד המחירים לצרכן בריבית קבועה,ישראל,ישראל,TASE,RF,פנימי,ILS,7.53,2033-10-31,0.016,0.0195,,763134.0,1.0,105.4,804.34323,,,2.8e-05,0.216624,0.090269
671,8319.0,ממשלת ישראל,ממשל שקלית 829,IL0012128935,לא צמוד למדד המחירים לצרכן ריבית קבועה,ישראל,ישראל,TASE,RF,פנימי,ILS,3.66,2029-08-31,0.046,0.0394,,56639.41,1.0,102.76,58.20265,,,3e-06,0.015674,0.006531
671,8319.0,ממשלת ישראל,ממשל צמודה 0431,IL0012207226,צמוד למדד המחירים לצרכן בריבית קבועה,ישראל,ישראל,TASE,RF,פנימי,ILS,5.29,2031-04-30,0.02,0.0199,,10197.04,1.0,103.02,10.50499,,,1e-06,0.002828,0.001178
671,8319.0,INTL FINANCE CORP,IFC 0 27/08/30,XS1280871259,"נקוב במט""ח","חו""ל",ברזיל,FOREIGN_GOV_SEC,AAA,S&P,BRL,4.89,2030-08-27,0.0,0.1222,,2367.31,0.6225,56.766,0.83653,,,4e-06,0.000225,9.3e-05
671,8319.0,POLAND GOVERNMENT BOND,POLGB 5 3/4 04/25/29,PL0000105391,"נקוב במט""ח","חו""ל",פולין,FOREIGN_GOV_SEC,A-,Fitch,PLN,3.24,2029-04-25,0.0575,0.0453,,1011.49,0.9092,106.374,0.97826,,,0.0,0.000263,0.000109
671,8319.0,MEX BONOS DESARR FIX RT,MBONO 8 1/2 11/18/2038,MX0MGO0000J5,"נקוב במט""ח","חו""ל",מקסיקו,FOREIGN_GOV_SEC,BBB-,Fitch,MXN,7.86,2038-11-18,0.085,-0.282,,575.81,0.1804,9889.2,10.27251,,,0.0,0.002766,0.001152
671,8319.0,MEX BONOS DESARR FIX RT,MBONO 7 3/4 29/05/31,MX0MGO0000P2,"נקוב במט""ח","חו""ל",מקסיקו,FOREIGN_GOV_SEC,BBB-,Fitch,MXN,4.59,2031-05-29,0.0775,-0.5479,,434.66,0.1804,9997.6,7.83937,,,0.0,0.002111,0.000879
671,8319.0,TREASURY BILL,B 0 09/03/26,US912797RS85,"נקוב במט""ח","חו""ל","ארה""ב",אחר,AA+,Fitch,USD,0.91,2026-09-03,0.0,0.0365,,1782.97,3.306,96.738,5.70222,,,0.0,0.001535,0.000639
671,8319.0,MEX BONOS DESARR FIX RT,MBONO 7.5 06/03/27,MX0MGO0000D8,"נקוב במט""ח","חו""ל",מקסיקו,FOREIGN_GOV_SEC,BBB-,Fitch,MXN,1.57,2027-03-06,0.075,-0.9602,,115.68,0.1804,10252.3,2.13943,,,0.0,0.000576,0.00024
671,8319.0,REPUBLIC OF BRAZIL,BRAZIL 10 1/4 01/10/28,US105756BN96,"נקוב במט""ח","חו""ל",ברזיל,FOREIGN_GOV_SEC,BB,S&P,BRL,2.03,2028-01-10,0.1025,0.0993,,4755.06,0.6225,103.027,3.04962,,,0.0,0.00082,0.000341
671,8319.0,AFRICAN DEVELOPMENT BANK,AFDB 0 06/05/34,XS2831196535,"נקוב במט""ח","חו""ל",ברזיל,FOREIGN_GOV_SEC,AAA,S&P,BRL,8.66,2034-06-05,0.0,0.1221,,11944.15,0.6225,36.768,2.73379,,,2.1e-05,0.000736,0.000306
671,8319.0,TREASURY BILL,B 0 10/02/25,US912797MS31,"נקוב במט""ח","חו""ל","ארה""ב",אחר,AA+,Fitch,USD,0.0054,2025-10-02,0.0,0.0203,,161.41,3.306,99.989,0.53355,,,0.0,0.000143,5.9e-05
671,8319.0,HUNGARY GOVERNMENT BOND,HGB 2 1/4 04/20/33,HU0000404744,"נקוב במט""ח","חו""ל",הונגריה,FOREIGN_GOV_SEC,Baa2,Moodys,HUF,6.82,2033-04-20,0.0225,0.067,,839318.49,0.009944,75.239,6.27958,,,0.0,0.001691,0.000704
671,8319.0,POLAND GOVERNMENT BOND,POLGB 6 10/25/2033,PL0000115291,"נקוב במט""ח","חו""ל",פולין,FOREIGN_GOV_SEC,A-,Fitch,PLN,6.31,2033-10-25,0.06,0.0524,,6467.06,0.9092,110.439,6.49365,,,0.0,0.001748,0.000728
671,8319.0,INTL FINANCE CORP,EBRD 0 02/02/32,XS2438631710,"נקוב במט""ח","חו""ל",ברזיל,FOREIGN_GOV_SEC,AAA,S&P,BRL,6.32,2032-02-02,0.0,0.1199,,7101.93,0.6225,48.758,2.15557,,,3e-06,0.00058,0.000241
671,8319.0,MEX BONOS DESARR FIX RT,MBONO 7 1/2 05/26/33,MX0MGO0001D6,"נקוב במט""ח","חו""ל",מקסיקו,FOREIGN_GOV_SEC,BBB-,Fitch,MXN,5.8,2033-05-26,0.075,-0.4421,,600.33,0.1804,9685.8,10.48964,,,0.0,0.002825,0.001177
671,8319.0,INTL FINANCE CORP,IFC 0 26/05/27,XS1621760302,"נקוב במט""ח","חו""ל",ברזיל,FOREIGN_GOV_SEC,AAA,S&P,BRL,1.63,2027-05-26,0.0,0.1238,,4304.2,0.6225,82.459,2.20938,,,5e-06,0.000595,0.000247
671,8319.0,INTL BK RECON & DEVELOP,IBRD 10 10/17/29,XS2920414112,"נקוב במט""ח","חו""ל",ברזיל,FOREIGN_GOV_SEC,AAA,S&P,BRL,3.16,2029-10-17,0.1,0.1206,,8823.6,0.6225,103.44,5.68164,,,1.3e-05,0.00153,0.000637
671,8319.0,HUNGARY GOVERNMENT BOND,HGB 7 10/24/35 35/A,HU0000406624,"נקוב במט""ח","חו""ל",הונגריה,FOREIGN_GOV_SEC,Baa2,Moodys,HUF,7.09,2035-10-24,0.07,0.068,,150646.91,0.009944,107.901,1.61639,,,0.0,0.000435,0.000181
671,8319.0,POLAND GOVERNMENT BOND,POLGB 7 1/2  07/25/2028,PL0000115192,"נקוב במט""ח","חו""ל",פולין,FOREIGN_GOV_SEC,A-,Fitch,PLN,2.6,2028-07-25,0.075,0.0439,,2173.62,0.9092,109.442,2.16285,,,0.0,0.000582,0.000242
671,8319.0,INTL FINANCE CORP,IFC 11 ½ 16/01/30,XS2977993471,"נקוב במט""ח","חו""ל",ברזיל,FOREIGN_GOV_SEC,AAA,S&P,BRL,3.33,2030-01-16,0.115,0.1208,,6671.51,0.6225,106.39,4.41839,,,6e-06,0.001189,0.000495
671,8319.0,POLAND GOVERNMENT BOND,POLGB 3 3/4 05/25/27,PL0000114393,"נקוב במט""ח","חו""ל",פולין,FOREIGN_GOV_SEC,A-,Fitch,PLN,1.59,2027-05-25,0.0375,0.1229,,4304.2,0.9092,100.706,3.941,,,0.0,0.001061,0.000442
671,8319.0,HUNGARY GOVERNMENT BOND,HGB 6 3/4 07/23/31,HU0000407317,"נקוב במט""ח","חו""ל",הונגריה,FOREIGN_GOV_SEC,Baa2,Moodys,HUF,4.86,2031-07-23,0.0675,0.0644,,76399.5,0.009944,104.522,0.79407,,,0.0,0.000213,8.9e-05
671,8319.0,POLAND GOVERNMENT BOND,POLGB 1 3/4 04/25/32,PL0000113783,"נקוב במט""ח","חו""ל",פולין,FOREIGN_GOV_SEC,A-,Fitch,PLN,6.15,2032-04-24,0.0175,0.048,,11513.73,0.9092,82.619,8.64879,,,0.0,0.002329,0.00097
671,8320.0,ממשלת ישראל,מ.ק.מ. 516,IL0082605150,לא צמוד למדד המחירים לצרכן ריבית קבועה,ישראל,ישראל,TASE,RF,פנימי,ILS,0.59,2026-05-06,0.0,0.0416,,315898.75,1.0,97.63,308.41195,,,1.7e-05,0.039213,0.02991
671,8320.0,ממשלת ישראל,מ.ק.מ. 1016,IL0082610184,לא צמוד למדד המחירים לצרכן ריבית קבועה,ישראל,ישראל,TASE,RF,פנימי,ILS,1.0191,2026-10-07,0.0,0.0412,,69350.73,1.0,95.9726,66.5577,,,3e-06,0.008462,0.006454
671,8320.0,ממשלת ישראל,מ.ק.מ. 616,IL0082606141,לא צמוד למדד המחירים לצרכן ריבית קבועה,ישראל,ישראל,TASE,RF,פנימי,ILS,0.67,2026-06-03,0.0,0.042,,24583.27,1.0,97.3,23.91952,,,1e-06,0.003041,0.002319
671,8320.0,ממשלת ישראל,ממשל שקלית 0226,IL0011746976,לא צמוד למדד המחירים לצרכן ריבית קבועה,ישראל,ישראל,TASE,RF,פנימי,ILS,0.4,2026-02-27,0.005,0.0409,,3725023.88,1.0,98.89,3683.67611,,,0.00015,0.468362,0.357252
671,8320.0,ממשלת ישראל,מ.ק.מ. 116,IL0082601191,לא צמוד למדד המחירים לצרכן ריבית קבועה,ישראל,ישראל,TASE,RF,פנימי,ILS,0.26,2026-01-07,0.0,0.0426,,394831.18,1.0,98.91,390.52752,,,2.4e-05,0.049653,0.037874
671,8320.0,ממשלת ישראל,מ.ק.מ. 816,IL0082608121,לא צמוד למדד המחירים לצרכן ריבית קבועה,ישראל,ישראל,TASE,RF,פנימי,ILS,0.84,2026-08-05,0.0,0.041,,921993.32,1.0,96.69,891.47534,,,5.1e-05,0.113346,0.086457
671,8320.0,ממשלת ישראל,ממשל קצרה 11/25,IL0012153263,לא צמוד למדד המחירים לצרכן ריבית קבועה,ישראל,ישראל,TASE,RF,פנימי,ILS,0.16,2025-11-30,0.0,0.0412,,672914.43,1.0,99.36,668.60778,,,0.000106,0.08501,0.064843
671,8320.0,ממשלת ישראל,ממשל שקלית 927,IL0012035791,לא צמוד למדד המחירים לצרכן ריבית קבועה,ישראל,ישראל,TASE,RF,פנימי,ILS,1.96,2027-09-30,0.0375,0.0397,,212470.11,1.0,99.62,211.66273,,,5e-06,0.026911,0.020527
671,8320.0,ממשלת ישראל,מ.ק.מ 216,IL0082602181,לא צמוד למדד המחירים לצרכן ריבית קבועה,ישראל,ישראל,TASE,RF,פנימי,ILS,0.34,2026-02-04,0.0,0.0424,,627111.29,1.0,98.6,618.33173,,,3.4e-05,0.078617,0.059967
671,8320.0,ממשלת ישראל,מ.ק.מ 316,IL0082603171,לא צמוד למדד המחירים לצרכן ריבית קבועה,ישראל,ישראל,TASE,RF,פנימי,ILS,0.42,2026-03-04,0.0,0.0415,,1018966.4,1.0,98.32,1001.84777,,,5.6e-05,0.12738,0.097161
209,9979.0,,,,,,,,,,,,,,,,,,,,,,,,
671,14082.0,,,,,,,,,,,,,,,,,,,,,,,,
671,15222.0,,,,,,,,,,,,,,,,,,,,,,,,
סיום מידע טבלה,,,,,,,,,,,,,,,,,,,,,,,,,
