מספר קופה/קרן/ח.פ. עבור חברת ביטוח,מספר מסלול,מאפיין עיקרי,שם נייר ערך,מספר נייר ערך,תאריך רכישה,"מח""מ",סוג הצמדה,מועד פדיון,שיעור ריבית,תשואה לפדיון,ערך נקוב (יחידות),שער נייר הערך,"שווי הוגן (באלפי ש""ח)","עלות מופחתת (באלפי ש""ח)",השיטה שיושמה בדוח הכספי,שיעור מנכסי אפיק ההשקעה,שיעור מסך נכסי ההשקעה,Unnamed: 18,סוף מידע
1328,2196.0,ערד בקרן פנסיה מקיפה חדשה,ערד 8786 01.01.2027,71116487.0,2012-01-01,1.217882540909771,צמוד למדד המחירים לצרכן,2027-01-01,0.048,0.0485,581.57,123.856326,0.72,0.72,עלות מופחתת,9.3e-05,6.1e-05,,
1328,2196.0,ערד בקרן פנסיה מקיפה חדשה,ערד 8783 01.10.2026,71116503.0,2011-10-01,0.9678825409097713,צמוד למדד המחירים לצרכן,2026-10-01,0.048,0.0485,174.57,125.8044,0.22,0.22,עלות מופחתת,2.8e-05,1.8e-05,,
1328,2196.0,ערד בקרן פנסיה מקיפה חדשה,ערד 8782 01.09.2026,71116511.0,2011-09-01,0.9077229004927079,צמוד למדד המחירים לצרכן,2026-09-01,0.048,0.0485,146.98,122.976548,0.181,0.181,עלות מופחתת,2.3e-05,1.5e-05,,
1328,2196.0,ערד בקרן פנסיה מקיפה חדשה,ערד 8821 01.12.2029,71121784.0,2014-12-01,3.769364383776447,צמוד למדד המחירים לצרכן,2029-12-01,0.048,0.0485,2327.35,120.272787,2.799,2.799,עלות מופחתת,0.000365,0.00024,,
1328,2196.0,ערד בקרן פנסיה מקיפה חדשה,ערד 8835 01.02.2031,71123061.0,2016-02-01,4.733970182613099,צמוד למדד המחירים לצרכן,2031-02-01,0.048,0.0485,285.48,120.760879,0.345,0.345,עלות מופחתת,4.4e-05,2.9e-05,,
1328,2196.0,ערד בקרן פנסיה מקיפה חדשה,ערד 8828 01.07.2030,71122550.0,2015-07-01,4.256417817008314,צמוד למדד המחירים לצרכן,2030-07-01,0.048,0.0485,1152.0,120.640651,1.39,1.39,עלות מופחתת,0.000181,0.000119,,
1328,2196.0,ערד בקרן פנסיה מקיפה חדשה,ערד 8840 01.07.2031,71123350.0,2016-07-01,5.035574882157443,צמוד למדד המחירים לצרכן,2031-07-01,0.048,0.0485,1544.14,121.617498,1.878,1.878,עלות מופחתת,0.000244,0.000161,,
1328,2196.0,ערד בקרן פנסיה מקיפה חדשה,ערד 8845 01.12.2031,71123533.0,2016-12-01,5.328113717401077,צמוד למדד המחירים לצרכן,2031-12-01,0.048,0.0485,5644.33,121.476869,6.857,6.857,עלות מופחתת,0.000894,0.00059,,
1328,2196.0,ערד בקרן פנסיה מקיפה חדשה,ערד 8847 01.02.2032,71123665.0,2017-02-01,5.494780384067743,צמוד למדד המחירים לצרכן,2032-02-01,0.048,0.0485,6832.42,121.005087,8.268,8.268,עלות מופחתת,0.001078,0.000711,,
1328,2196.0,ערד בקרן פנסיה מקיפה חדשה,ערד 8857 01.12.2032,71124127.0,2017-12-01,6.053496951908582,צמוד למדד המחירים לצרכן,2032-12-01,0.048,0.0485,14839.13,121.240736,17.991,17.991,עלות מופחתת,0.002347,0.001548,,
1328,2196.0,ערד בקרן פנסיה מקיפה חדשה,ערד 8868 01.11.2033,71124689.0,2018-11-01,6.661746169657317,צמוד למדד המחירים לצרכן,2033-11-01,0.048,0.0485,1362.66,120.647903,1.644,1.644,עלות מופחתת,0.000214,0.000141,,
1328,2196.0,ערד בקרן פנסיה מקיפה חדשה,ערד 8875 01.06.2034,71125231.0,2019-06-01,7.078683819828075,צמוד למדד המחירים לצרכן,2034-06-01,0.048,0.0485,18430.98,119.564926,22.037,22.037,עלות מופחתת,0.002874,0.001896,,
1328,2196.0,ערד בקרן פנסיה מקיפה חדשה,ערד 8784 01.11.2026,71118905.0,2011-11-01,1.0512158742431044,צמוד למדד המחירים לצרכן,2026-11-01,0.048,0.0485,483.4,124.958178,0.604,0.604,עלות מופחתת,7.8e-05,5.1e-05,,
1328,2196.0,ערד בקרן פנסיה מקיפה חדשה,ערד 8787 01.02.2027,71116420.0,2012-02-01,1.3012158742431048,צמוד למדד המחירים לצרכן,2027-02-01,0.048,0.0485,619.77,123.475983,0.765,0.765,עלות מופחתת,9.9e-05,6.5e-05,,
1328,2196.0,ערד בקרן פנסיה מקיפה חדשה,ערד 8794 01.09.2027,71120232.0,2012-09-01,1.85018681996419,צמוד למדד המחירים לצרכן,2027-09-01,0.048,0.0485,769.94,121.689448,0.937,0.937,עלות מופחתת,0.000122,8e-05,,
1328,2196.0,ערד בקרן פנסיה מקיפה חדשה,ערד 8807 01.10.2028,71120950.0,2013-10-01,2.7658487458854006,צמוד למדד המחירים לצרכן,2028-10-01,0.048,0.0485,1729.33,121.459952,2.1,2.1,עלות מופחתת,0.000274,0.00018,,
1328,2196.0,ערד בקרן פנסיה מקיפה חדשה,ערד 8785 01.12.2026,71119127.0,2011-12-01,1.134549207576438,צמוד למדד המחירים לצרכן,2026-12-01,0.048,0.0485,498.26,124.458743,0.62,0.62,עלות מופחתת,8e-05,5.3e-05,,
1328,2196.0,ערד בקרן פנסיה מקיפה חדשה,ערד 8795 01.10.2027,71120356.0,2012-10-01,1.8882267038020435,צמוד למדד המחירים לצרכן,2027-10-01,0.048,0.0485,891.46,122.842903,1.095,1.095,עלות מופחתת,0.000142,9.4e-05,,
1328,2196.0,ערד בקרן פנסיה מקיפה חדשה,ערד 8804 01.07.2028,71121107.0,2013-07-01,2.582254121211065,צמוד למדד המחירים לצרכן,2028-07-01,0.048,0.0485,624.55,121.347772,0.758,0.758,עלות מופחתת,9.8e-05,6.5e-05,,
1328,2196.0,ערד בקרן פנסיה מקיפה חדשה,ערד 8809 01.12.2028,71121305.0,2013-12-01,2.932515412552067,צמוד למדד המחירים לצרכן,2028-12-01,0.048,0.0485,1668.83,119.921112,2.001,2.001,עלות מופחתת,0.000261,0.000172,,
1328,2196.0,ערד בקרן פנסיה מקיפה חדשה,ערד 8796 01.11.2027,71120448.0,2012-11-01,1.971560037135377,צמוד למדד המחירים לצרכן,2027-11-01,0.048,0.0485,913.74,122.369591,1.118,1.118,עלות מופחתת,0.000145,9.6e-05,,
1328,2196.0,ערד בקרן פנסיה מקיפה חדשה,ערד 8797 01.12.2027,71120570.0,2012-12-01,2.0548933704687102,צמוד למדד המחירים לצרכן,2027-12-01,0.048,0.0485,872.89,122.110465,1.066,1.066,עלות מופחתת,0.000139,9.1e-05,,
1328,2196.0,ערד בקרן פנסיה מקיפה חדשה,ערד 8811 01.02.2029,71121578.0,2014-02-01,3.099182079218734,צמוד למדד המחירים לצרכן,2029-02-01,0.048,0.0485,1220.98,119.323081,1.457,1.457,עלות מופחתת,0.00019,0.000125,,
1328,2196.0,ערד בקרן פנסיה מקיפה חדשה,ערד 8819 01.10.2029,71121768.0,2014-10-01,3.6026977171097805,צמוד למדד המחירים לצרכן,2029-10-01,0.048,0.0485,1809.45,121.222494,2.193,2.193,עלות מופחתת,0.000286,0.000188,,
1328,2196.0,ערד בקרן פנסיה מקיפה חדשה,ערד 8824 01.03.2030,71122428.0,2015-03-01,4.0193643837764474,צמוד למדד המחירים לצרכן,2030-03-01,0.048,0.0485,4099.66,120.151183,4.926,4.926,עלות מופחתת,0.000642,0.000423,,
1328,2196.0,ערד בקרן פנסיה מקיפה חדשה,ערד 8829 01.08.2030,71122626.0,2015-08-01,4.339751150341647,צמוד למדד המחירים לצרכן,2030-08-01,0.048,0.0485,3832.22,119.793825,4.591,4.591,עלות מופחתת,0.000598,0.000395,,
1328,2196.0,ערד בקרן פנסיה מקיפה חדשה,ערד 8827 01.06.2030,71122543.0,2015-06-01,4.17308448367498,צמוד למדד המחירים לצרכן,2030-06-01,0.048,0.0485,1651.85,121.354659,2.005,2.005,עלות מופחתת,0.000261,0.000172,,
1328,2196.0,ערד בקרן פנסיה מקיפה חדשה,ערד 8833 01.12.2030,71122774.0,2015-12-01,4.567303515946433,צמוד למדד המחירים לצרכן,2030-12-01,0.048,0.0485,2350.7,121.110975,2.847,2.847,עלות מופחתת,0.000371,0.000245,,
1328,2196.0,ערד בקרן פנסיה מקיפה חדשה,ערד 8836 01.03.2031,71123079.0,2016-03-01,4.817303515946432,צמוד למדד המחירים לצרכן,2031-03-01,0.048,0.0485,572.55,120.882326,0.692,0.692,עלות מופחתת,9e-05,5.9e-05,,
1328,2196.0,ערד בקרן פנסיה מקיפה חדשה,ערד 8838 01.05.2031,71123293.0,2016-05-01,4.868908215490777,צמוד למדד המחירים לצרכן,2031-05-01,0.048,0.0485,4329.42,123.456257,5.345,5.345,עלות מופחתת,0.000697,0.00046,,
1328,2196.0,ערד בקרן פנסיה מקיפה חדשה,ערד 8843 01.10.2031,71123517.0,2016-10-01,5.161447050734411,צמוד למדד המחירים לצרכן,2031-10-01,0.048,0.0485,3444.86,122.559506,4.222,4.222,עלות מופחתת,0.00055,0.000363,,
1328,2196.0,ערד בקרן פנסיה מקיפה חדשה,ערד 8862 01.05.2033,71124473.0,2018-05-01,6.320081206151133,צמוד למדד המחירים לצרכן,2033-05-01,0.048,0.0485,22047.24,122.091348,26.918,26.918,עלות מופחתת,0.003511,0.002316,,
1328,2196.0,ערד בקרן פנסיה מקיפה חדשה,ערד 8878 01.09.2034,71125348.0,2019-09-01,7.3286838198280755,צמוד למדד המחירים לצרכן,2034-09-01,0.048,0.0485,38745.18,118.375418,45.865,45.865,עלות מופחתת,0.005983,0.003947,,
1328,2196.0,ערד בקרן פנסיה מקיפה חדשה,ערד 8889 01.09.2035,71126098.0,2020-09-01,7.972456804478872,צמוד למדד המחירים לצרכן,2035-09-01,0.048,0.0485,183591.9,119.084253,218.629,218.629,עלות מופחתת,0.028522,0.018815,,
1328,2196.0,ערד בקרן פנסיה מקיפה חדשה,ערד 8891 01.11.2035,71126130.0,2020-11-01,7.949654750710344,צמוד למדד המחירים לצרכן,2035-11-01,0.048,0.0485,136682.94,121.124046,165.556,165.556,עלות מופחתת,0.021598,0.014248,,
1328,2196.0,ערד בקרן פנסיה מקיפה חדשה,ערד 8894 01.02.2036,71126288.0,2021-02-01,8.199654750710344,צמוד למדד המחירים לצרכן,2036-02-01,0.048,0.0485,245321.95,119.687329,293.619,293.619,עלות מופחתת,0.038305,0.025269,,
1328,2196.0,ערד בקרן פנסיה מקיפה חדשה,ערד 8896 01.04.2036,71126353.0,2021-04-01,8.169517453559912,צמוד למדד המחירים לצרכן,2036-04-01,0.048,0.0485,212707.17,121.350083,258.12,258.12,עלות מופחתת,0.033674,0.022214,,
1328,2196.0,ערד בקרן פנסיה מקיפה חדשה,ערד 8774 01.01.2026,71116750.0,2011-01-01,0.25277777777777777,צמוד למדד המחירים לצרכן,2026-01-01,0.048,0.0482,309.35,127.137022,0.393,0.393,עלות מופחתת,5.1e-05,3.3e-05,,
1328,2196.0,ערד בקרן פנסיה מקיפה חדשה,ערד 8778 01.05.2026,71118830.0,2011-05-01,0.5743895671593743,צמוד למדד המחירים לצרכן,2026-05-01,0.048,0.0485,144.86,126.786834,0.184,0.184,עלות מופחתת,2.3e-05,1.5e-05,,
1328,2196.0,ערד בקרן פנסיה מקיפה חדשה,ערד 8779 01.06.2026,71118848.0,2011-06-01,0.6577234592804972,צמוד למדד המחירים לצרכן,2026-06-01,0.048,0.0484,249.92,125.545192,0.314,0.314,עלות מופחתת,4e-05,2.7e-05,,
1328,2196.0,ערד בקרן פנסיה מקיפה חדשה,ערד 8780 01.07.2026,71118855.0,2011-07-01,0.7410567926138304,צמוד למדד המחירים לצרכן,2026-07-01,0.048,0.0484,295.03,124.454088,0.367,0.367,עלות מופחתת,4.7e-05,3.1e-05,,
1328,2196.0,ערד בקרן פנסיה מקיפה חדשה,ערד 8791 01.06.2027,71119598.0,2012-06-01,1.6001868199641902,צמוד למדד המחירים לצרכן,2027-06-01,0.048,0.0485,151.23,122.922215,0.186,0.186,עלות מופחתת,2.4e-05,1.5e-05,,
1328,2196.0,ערד בקרן פנסיה מקיפה חדשה,ערד 8805 01.08.2028,71121206.0,2013-08-01,2.665587454544398,צמוד למדד המחירים לצרכן,2028-08-01,0.048,0.0485,1665.65,119.909147,1.997,1.997,עלות מופחתת,0.00026,0.000171,,
1328,2196.0,ערד בקרן פנסיה מקיפה חדשה,ערד 8810 01.01.2029,71121438.0,2014-01-01,3.0158487458854,צמוד למדד המחירים לצרכן,2029-01-01,0.048,0.0485,1622.67,119.922945,1.946,1.946,עלות מופחתת,0.000253,0.000167,,
1328,2196.0,ערד בקרן פנסיה מקיפה חדשה,ערד 8812 01.03.2029,71121651.0,2014-03-01,3.182515412552067,צמוד למדד המחירים לצרכן,2029-03-01,0.048,0.0485,2118.81,119.541567,2.533,2.533,עלות מופחתת,0.00033,0.000217,,
1328,2196.0,ערד בקרן פנסיה מקיפה חדשה,ערד 8831 01.10.2030,71122725.0,2015-10-01,4.400636849279766,צמוד למדד המחירים לצרכן,2030-10-01,0.048,0.0485,529.04,121.700731,0.644,0.644,עלות מופחתת,8.3e-05,5.5e-05,,
1328,2196.0,ערד בקרן פנסיה מקיפה חדשה,ערד 8846 01.01.2032,71123616.0,2017-01-01,5.411447050734412,צמוד למדד המחירים לצרכן,2032-01-01,0.048,0.0485,7416.64,121.494528,9.011,9.011,עלות מופחתת,0.001175,0.000775,,
1328,2196.0,ערד בקרן פנסיה מקיפה חדשה,ערד 8851 01.06.2032,71123772.0,2017-06-01,5.695130326524218,צמוד למדד המחירים לצרכן,2032-06-01,0.048,0.0485,18427.27,121.603371,22.408,22.408,עלות מופחתת,0.002923,0.001928,,
1328,2196.0,ערד בקרן פנסיה מקיפה חדשה,ערד 8870 01.01.2034,71124796.0,2019-01-01,6.8284128363239835,צמוד למדד המחירים לצרכן,2034-01-01,0.048,0.0485,13045.06,119.699042,15.615,15.615,עלות מופחתת,0.002037,0.001343,,
1328,2196.0,ערד בקרן פנסיה מקיפה חדשה,ערד 8871 01.02.2034,71124945.0,2019-02-01,6.9117461696573175,צמוד למדד המחירים לצרכן,2034-02-01,0.048,0.0485,53672.4,119.570244,64.176,64.176,עלות מופחתת,0.008372,0.005523,,
1328,2196.0,ערד בקרן פנסיה מקיפה חדשה,ערד 8885 01.05.2035,71125603.0,2020-05-01,7.63912347114554,צמוד למדד המחירים לצרכן,2035-05-01,0.048,0.0485,69051.19,120.402353,83.139,83.139,עלות מופחתת,0.010846,0.007155,,
1328,2196.0,ערד בקרן פנסיה מקיפה חדשה,ערד 8886 01.06.2035,71125660.0,2020-06-01,7.722456804478874,צמוד למדד המחירים לצרכן,2035-06-01,0.048,0.0485,126049.06,120.279457,151.611,151.611,עלות מופחתת,0.019779,0.013048,,
1328,2196.0,ערד בקרן פנסיה מקיפה חדשה,ערד 8892 01.12.2035,71126163.0,2020-12-01,8.032988084043678,צמוד למדד המחירים לצרכן,2035-12-01,0.048,0.0485,254591.57,120.279457,306.221,306.221,עלות מופחתת,0.039949,0.026354,,
1328,2196.0,ערד בקרן פנסיה מקיפה חדשה,ערד 8904 01.12.2036,71126841.0,2021-12-01,8.632216086765283,צמוד למדד המחירים לצרכן,2036-12-01,0.048,0.0485,90110.39,117.577516,105.95,105.95,עלות מופחתת,0.013822,0.009118,,
1328,2196.0,ערד בקרן פנסיה מקיפה חדשה,ערד 8772 01.11.2025,71116735.0,2010-11-01,0.08611111111111114,צמוד למדד המחירים לצרכן,2025-11-01,0.048,0.048,212.78,128.622996,0.274,0.274,עלות מופחתת,3.5e-05,2.3e-05,,
1328,2196.0,ערד בקרן פנסיה מקיפה חדשה,ערד 8790 01.05.2027,71117162.0,2012-05-01,1.516853486630857,צמוד למדד המחירים לצרכן,2027-05-01,0.048,0.0485,641.0,124.958178,0.801,0.801,עלות מופחתת,0.000104,6.8e-05,,
1328,2196.0,ערד בקרן פנסיה מקיפה חדשה,ערד 8830 01.09.2030,71122717.0,2015-09-01,4.423084483674979,צמוד למדד המחירים לצרכן,2030-09-01,0.048,0.0485,1490.54,119.070903,1.775,1.775,עלות מופחתת,0.000231,0.000152,,
1328,2196.0,ערד בקרן פנסיה מקיפה חדשה,ערד 8837 01.04.2031,71123129.0,2016-04-01,4.785574882157442,צמוד למדד המחירים לצרכן,2031-04-01,0.048,0.0485,4094.35,123.681618,5.064,5.064,עלות מופחתת,0.00066,0.000435,,
1328,2196.0,ערד בקרן פנסיה מקיפה חדשה,ערד 8853 01.08.2032,71123939.0,2017-08-01,5.861796993190884,צמוד למדד המחירים לצרכן,2032-08-01,0.048,0.0485,19051.29,121.005087,23.053,23.053,עלות מופחתת,0.003007,0.001984,,
1328,2196.0,ערד בקרן פנסיה מקיפה חדשה,ערד 8854 01.09.2032,71123947.0,2017-09-01,5.945130326524218,צמוד למדד המחירים לצרכן,2032-09-01,0.048,0.0485,19423.26,120.636282,23.432,23.432,עלות מופחתת,0.003056,0.002016,,
1328,2196.0,ערד בקרן פנסיה מקיפה חדשה,ערד 8872 01.03.2034,71124986.0,2019-03-01,6.99507950299065,צמוד למדד המחירים לצרכן,2034-03-01,0.048,0.0485,38576.44,119.203218,45.984,45.984,עלות מופחתת,0.005999,0.003957,,
1328,2196.0,ערד בקרן פנסיה מקיפה חדשה,ערד 8859 01.02.2033,71124325.0,2018-02-01,6.220163618575248,צמוד למדד המחירים לצרכן,2033-02-01,0.048,0.0485,33496.69,120.522995,40.371,40.371,עלות מופחתת,0.005266,0.003474,,
1328,2196.0,ערד בקרן פנסיה מקיפה חדשה,ערד 8879 01.10.2034,71125389.0,2019-10-01,7.2377484585225185,צמוד למדד המחירים לצרכן,2034-10-01,0.048,0.0485,62900.1,120.509043,75.8,75.8,עלות מופחתת,0.009888,0.006523,,
1328,2196.0,ערד בקרן פנסיה מקיפה חדשה,ערד 8873 01.04.2034,71125108.0,2019-04-01,6.912017153161408,צמוד למדד המחירים לצרכן,2034-04-01,0.048,0.0485,28164.9,121.471191,34.212,34.212,עלות מופחתת,0.004463,0.002944,,
1328,2196.0,ערד בקרן פנסיה מקיפה חדשה,ערד 8882 01.01.2035,71125454.0,2020-01-01,7.48774845852252,צמוד למדד המחירים לצרכן,2035-01-01,0.048,0.0485,98911.99,119.336917,118.039,118.039,עלות מופחתת,0.015399,0.010158,,
1328,2196.0,ערד בקרן פנסיה מקיפה חדשה,ערד 8884 01.03.2035,71125512.0,2020-03-01,7.654415125189185,צמוד למדד המחירים לצרכן,2035-03-01,0.048,0.0485,57501.44,118.847034,68.339,68.339,עלות מופחתת,0.008915,0.005881,,
1328,2196.0,ערד בקרן פנסיה מקיפה חדשה,ערד 8890 01.10.2035,71126106.0,2020-10-01,7.8663214173770095,צמוד למדד המחירים לצרכן,2035-10-01,0.048,0.0485,65814.33,121.471191,79.945,79.945,עלות מופחתת,0.010429,0.00688,,
1328,2196.0,ערד בקרן פנסיה מקיפה חדשה,ערד 8898 01.06.2036,71126445.0,2021-06-01,8.336184120226578,צמוד למדד המחירים לצרכן,2036-06-01,0.048,0.0485,160625.07,119.325448,191.667,191.667,עלות מופחתת,0.025004,0.016495,,
1328,2196.0,ערד בקרן פנסיה מקיפה חדשה,ערד 8905 01.01.2037,71126981.0,2022-01-01,8.715549420098617,צמוד למדד המחירים לצרכן,2037-01-01,0.048,0.0485,109538.97,117.235403,128.418,128.418,עלות מופחתת,0.016753,0.011052,,
1328,2196.0,ערד בקרן פנסיה מקיפה חדשה,ערד 8788 01.03.2027,71116727.0,2012-03-01,1.384549207576438,צמוד למדד המחירים לצרכן,2027-03-01,0.048,0.0485,709.45,122.976548,0.872,0.872,עלות מופחתת,0.000113,7.5e-05,,
1328,2196.0,ערד בקרן פנסיה מקיפה חדשה,ערד 8777 01.04.2026,71118822.0,2011-04-01,0.49105623382604097,צמוד למדד המחירים לצרכן,2026-04-01,0.048,0.0485,376.74,127.526063,0.48,0.48,עלות מופחתת,6.2e-05,4.1e-05,,
1328,2196.0,ערד בקרן פנסיה מקיפה חדשה,ערד 8793 01.08.2027,71119846.0,2012-08-01,1.766853486630857,צמוד למדד המחירים לצרכן,2027-08-01,0.048,0.0485,1017.75,122.300021,1.245,1.245,עלות מופחתת,0.000162,0.000107,,
1328,2196.0,ערד בקרן פנסיה מקיפה חדשה,ערד 8799 01.02.2028,71120612.0,2013-02-01,2.221560037135377,צמוד למדד המחירים לצרכן,2028-02-01,0.048,0.0485,852.19,121.490087,1.035,1.035,עלות מופחתת,0.000135,8.9e-05,,
1328,2196.0,ערד בקרן פנסיה מקיפה חדשה,ערד 8813 01.04.2029,71121669.0,2014-04-01,3.18925144352555,צמוד למדד המחירים לצרכן,2029-04-01,0.048,0.0485,1666.71,122.177942,2.036,2.036,עלות מופחתת,0.000265,0.000175,,
1328,2196.0,ערד בקרן פנסיה מקיפה חדשה,ערד 8802 01.05.2028,71121016.0,2013-05-01,2.415587454544398,צמוד למדד המחירים לצרכן,2028-05-01,0.048,0.0485,1199.75,122.918209,1.475,1.475,עלות מופחתת,0.000192,0.000126,,
1328,2196.0,ערד בקרן פנסיה מקיפה חדשה,ערד 8815 01.06.2029,71121685.0,2014-06-01,3.355918110192216,צמוד למדד המחירים לצרכן,2029-06-01,0.048,0.0485,2525.27,120.744908,3.049,3.049,עלות מופחתת,0.000397,0.000262,,
1328,2196.0,ערד בקרן פנסיה מקיפה חדשה,ערד 8820 01.11.2029,71121776.0,2014-11-01,3.686031050443114,צמוד למדד המחירים לצרכן,2029-11-01,0.048,0.0485,1909.74,121.110588,2.313,2.313,עלות מופחתת,0.000301,0.000199,,
1328,2196.0,ערד בקרן פנסיה מקיפה חדשה,ערד 8823 01.02.2030,71122410.0,2015-02-01,3.9360310504431135,צמוד למדד המחירים לצרכן,2030-02-01,0.048,0.0485,2674.91,119.556818,3.198,3.198,עלות מופחתת,0.000417,0.000275,,
1328,2196.0,ערד בקרן פנסיה מקיפה חדשה,ערד 8825 01.04.2030,71122501.0,2015-04-01,4.006417817008313,צמוד למדד המחירים לצרכן,2030-04-01,0.048,0.0485,3283.55,123.430488,4.053,4.053,עלות מופחתת,0.000528,0.000348,,
1328,2196.0,ערד בקרן פנסיה מקיפה חדשה,ערד 8855 01.10.2032,71124093.0,2017-10-01,5.886830285241915,צמוד למדד המחירים לצרכן,2032-10-01,0.048,0.0485,16780.71,122.685902,20.588,20.588,עלות מופחתת,0.002685,0.001771,,
1328,2196.0,ערד בקרן פנסיה מקיפה חדשה,ערד 8849 01.04.2032,71123731.0,2017-04-01,5.528463659857552,צמוד למדד המחירים לצרכן,2032-04-01,0.048,0.0485,11812.93,123.17763,14.551,14.551,עלות מופחתת,0.001898,0.001252,,
1328,2196.0,ערד בקרן פנסיה מקיפה חדשה,ערד 8863 01.06.2033,71124499.0,2018-06-01,6.4034145394844675,צמוד למדד המחירים לצרכן,2033-06-01,0.048,0.0485,27740.39,121.120338,33.599,33.599,עלות מופחתת,0.004383,0.002891,,
1328,2196.0,ערד בקרן פנסיה מקיפה חדשה,ערד 8874 01.05.2034,71125132.0,2019-05-01,6.995350486494741,צמוד למדד המחירים לצרכן,2034-05-01,0.048,0.0485,48852.13,120.402353,58.819,58.819,עלות מופחתת,0.007673,0.005062,,
1328,2196.0,ערד בקרן פנסיה מקיפה חדשה,ערד 8881 01.12.2034,71125421.0,2019-12-01,7.404415125189185,צמוד למדד המחירים לצרכן,2034-12-01,0.048,0.0485,72681.77,119.328631,86.73,86.73,עלות מופחתת,0.011314,0.007464,,
1328,2196.0,ערד בקרן פנסיה מקיפה חדשה,ערד 8888 01.08.2035,71125702.0,2020-08-01,7.889123471145539,צמוד למדד המחירים לצרכן,2035-08-01,0.048,0.0485,149980.58,119.807017,179.687,179.687,עלות מופחתת,0.023442,0.015464,,
1328,2196.0,ערד בקרן פנסיה מקיפה חדשה,ערד 8897 01.05.2036,71126395.0,2021-05-01,8.252850786893246,צמוד למדד המחירים לצרכן,2036-05-01,0.048,0.0485,264484.68,120.161553,317.809,317.809,עלות מופחתת,0.041461,0.027351,,
1328,2196.0,ערד בקרן פנסיה מקיפה חדשה,ערד 8900 01.08.2036,71126544.0,2021-08-01,8.502850786893246,צמוד למדד המחירים לצרכן,2036-08-01,0.048,0.0485,105561.88,117.799478,124.351,124.351,עלות מופחתת,0.016222,0.010702,,
1328,2196.0,ערד בקרן פנסיה מקיפה חדשה,ערד 8792 01.07.2027,71119747.0,2012-07-01,1.6835201532975237,צמוד למדד המחירים לצרכן,2027-07-01,0.048,0.0485,594.3,122.444858,0.728,0.728,עלות מופחתת,9.4e-05,6.2e-05,,
1328,2196.0,ערד בקרן פנסיה מקיפה חדשה,ערד 8801 01.04.2028,71120935.0,2013-04-01,2.332254121211065,צמוד למדד המחירים לצרכן,2028-04-01,0.048,0.0485,2897.78,123.639692,3.583,3.583,עלות מופחתת,0.000467,0.000308,,
1328,2196.0,ערד בקרן פנסיה מקיפה חדשה,ערד 8816 01.07.2029,71121693.0,2014-07-01,3.4392514435255492,צמוד למדד המחירים לצרכן,2029-07-01,0.048,0.0485,1788.23,120.158088,2.149,2.149,עלות מופחתת,0.00028,0.000184,,
1328,2196.0,ערד בקרן פנסיה מקיפה חדשה,ערד 8822 01.01.2030,71122402.0,2015-01-01,3.85269771710978,צמוד למדד המחירים לצרכן,2030-01-01,0.048,0.0485,1591.89,120.040402,1.911,1.911,עלות מופחתת,0.000249,0.000164,,
1328,2196.0,ערד בקרן פנסיה מקיפה חדשה,ערד 8832 01.11.2030,71122741.0,2015-11-01,4.4839701826131,צמוד למדד המחירים לצרכן,2030-11-01,0.048,0.0485,4893.49,121.719184,5.956,5.956,עלות מופחתת,0.000777,0.000512,,
1328,2196.0,ערד בקרן פנסיה מקיפה חדשה,ערד 8834 01.01.2031,71122931.0,2016-01-01,4.650636849279767,צמוד למדד המחירים לצרכן,2031-01-01,0.048,0.0485,1292.62,121.127105,1.566,1.566,עלות מופחתת,0.000204,0.000134,,
1328,2196.0,ערד בקרן פנסיה מקיפה חדשה,ערד 8841 01.08.2031,71123368.0,2016-08-01,5.118908215490776,צמוד למדד המחירים לצרכן,2031-08-01,0.048,0.0485,6646.17,120.760879,8.026,8.026,עלות מופחתת,0.001047,0.00069,,
1328,2196.0,ערד בקרן פנסיה מקיפה חדשה,ערד 8842 01.09.2031,71123434.0,2016-09-01,5.202241548824109,צמוד למדד המחירים לצרכן,2031-09-01,0.048,0.0485,4009.45,119.788918,4.803,4.803,עלות מופחתת,0.000626,0.000413,,
1328,2196.0,ערד בקרן פנסיה מקיפה חדשה,ערד 8850 01.05.2032,71123749.0,2017-05-01,5.611796993190885,צמוד למדד המחירים לצרכן,2032-05-01,0.048,0.0485,11432.47,122.335286,13.986,13.986,עלות מופחתת,0.001824,0.001203,,
1328,2196.0,ערד בקרן פנסיה מקיפה חדשה,ערד 8852 01.07.2032,71123921.0,2017-07-01,5.778463659857551,צמוד למדד המחירים לצרכן,2032-07-01,0.048,0.0485,12200.83,120.649978,14.72,14.72,עלות מופחתת,0.00192,0.001266,,
1328,2196.0,ערד בקרן פנסיה מקיפה חדשה,ערד 8860 01.03.2033,71124358.0,2018-03-01,6.303496951908582,צמוד למדד המחירים לצרכן,2033-03-01,0.048,0.0485,18096.15,120.636282,21.831,21.831,עלות מופחתת,0.002848,0.001878,,
1328,2196.0,ערד בקרן פנסיה מקיפה חדשה,ערד 8864 01.07.2033,71124556.0,2018-07-01,6.4867478728178005,צמוד למדד המחירים לצרכן,2033-07-01,0.048,0.0485,19563.88,120.053881,23.487,23.487,עלות מופחתת,0.003064,0.002021,,
1328,2196.0,ערד בקרן פנסיה מקיפה חדשה,ערד 8876 01.07.2034,71125272.0,2019-07-01,7.1620171531614085,צמוד למדד המחירים לצרכן,2034-07-01,0.048,0.0485,55701.54,118.280838,65.884,65.884,עלות מופחתת,0.008595,0.00567,,
1328,2196.0,ערד בקרן פנסיה מקיפה חדשה,ערד 8893 01.01.2036,71126239.0,2021-01-01,8.116321417377012,צמוד למדד המחירים לצרכן,2036-01-01,0.048,0.0485,245035.94,120.051509,294.169,294.169,עלות מופחתת,0.038377,0.025317,,
1328,2196.0,ערד בקרן פנסיה מקיפה חדשה,ערד 8895 01.03.2036,71126320.0,2021-03-01,8.282988084043675,צמוד למדד המחירים לצרכן,2036-03-01,0.048,0.0485,169838.44,119.323496,202.657,202.657,עלות מופחתת,0.026438,0.017441,,
1328,2196.0,ערד בקרן פנסיה מקיפה חדשה,ערד 8901 01.09.2036,71126593.0,2021-09-01,8.586184120226578,צמוד למדד המחירים לצרכן,2036-09-01,0.048,0.0485,173591.07,116.86201,202.862,202.862,עלות מופחתת,0.026465,0.017458,,
1328,2196.0,ערד בקרן פנסיה מקיפה חדשה,ערד 8789 01.04.2027,71116701.0,2012-04-01,1.4335201532975232,צמוד למדד המחירים לצרכן,2027-04-01,0.048,0.0485,674.43,125.441503,0.846,0.846,עלות מופחתת,0.00011,7.2e-05,,
1328,2196.0,ערד בקרן פנסיה מקיפה חדשה,ערד 8773 01.12.2025,71116743.0,2010-12-01,0.16944444444444448,צמוד למדד המחירים לצרכן,2025-12-01,0.048,0.0481,149.1,127.7514,0.19,0.19,עלות מופחתת,2.4e-05,1.6e-05,,
1328,2196.0,ערד בקרן פנסיה מקיפה חדשה,ערד 8775 01.02.2026,71116768.0,2011-02-01,0.33611111111111114,צמוד למדד המחירים לצרכן,2026-02-01,0.048,0.0483,174.04,126.155869,0.22,0.22,עלות מופחתת,2.8e-05,1.8e-05,,
1328,2196.0,ערד בקרן פנסיה מקיפה חדשה,ערד 8781 01.08.2026,71118616.0,2011-08-01,0.824390125947164,צמוד למדד המחירים לצרכן,2026-08-01,0.048,0.0484,514.18,123.475983,0.635,0.635,עלות מופחתת,8.2e-05,5.4e-05,,
1328,2196.0,ערד בקרן פנסיה מקיפה חדשה,ערד 8800 01.03.2028,71120687.0,2013-09-01,2.748920787877731,צמוד למדד המחירים לצרכן,2028-09-01,0.048,0.0485,646.31,119.073236,0.77,0.77,עלות מופחתת,0.0001,6.6e-05,,
1328,2196.0,ערד בקרן פנסיה מקיפה חדשה,ערד 8776 01.03.2026,71116776.0,2011-03-01,0.41944444444444445,צמוד למדד המחירים לצרכן,2026-03-01,0.048,0.0484,161.84,125.387852,0.203,0.203,עלות מופחתת,2.6e-05,1.7e-05,,
1328,2196.0,ערד בקרן פנסיה מקיפה חדשה,ערד 8771 01.10.2025,71118814.0,2010-10-01,0.0027777777777777683,צמוד למדד המחירים לצרכן,2025-10-01,0.048,0.0479,183.06,130.091327,0.238,0.238,עלות מופחתת,3.1e-05,2e-05,,
1328,2196.0,ערד בקרן פנסיה מקיפה חדשה,ערד 8814 01.05.2029,71121677.0,2014-05-01,3.2725847768588836,צמוד למדד המחירים לצרכן,2029-05-01,0.048,0.0485,1415.72,121.348526,1.718,1.718,עלות מופחתת,0.000224,0.000147,,
1328,2196.0,ערד בקרן פנסיה מקיפה חדשה,ערד 8817 01.08.2029,71121701.0,2014-08-01,3.5225847768588836,צמוד למדד המחירים לצרכן,2029-08-01,0.048,0.0485,1110.08,119.323081,1.325,1.325,עלות מופחתת,0.000172,0.000113,,
1328,2196.0,ערד בקרן פנסיה מקיפה חדשה,ערד 8798 01.01.2028,71120596.0,2013-01-01,2.1382267038020437,צמוד למדד המחירים לצרכן,2028-01-01,0.048,0.0485,1381.76,122.212735,1.689,1.689,עלות מופחתת,0.00022,0.000145,,
1328,2196.0,ערד בקרן פנסיה מקיפה חדשה,ערד 8803 01.06.2028,71121057.0,2013-06-01,2.498920787877731,צמוד למדד המחירים לצרכן,2028-06-01,0.048,0.0485,1242.74,121.941587,1.515,1.515,עלות מופחתת,0.000197,0.00013,,
1328,2196.0,ערד בקרן פנסיה מקיפה חדשה,ערד 8848 01.03.2032,71123673.0,2017-03-01,5.578113717401076,צמוד למדד המחירים לצרכן,2032-03-01,0.048,0.0485,10732.57,120.75716,12.96,12.96,עלות מופחתת,0.00169,0.001115,,
1328,2196.0,ערד בקרן פנסיה מקיפה חדשה,ערד 8865 01.08.2033,71124580.0,2018-08-01,6.570081206151133,צמוד למדד המחירים לצרכן,2033-08-01,0.048,0.0485,29853.37,119.452208,35.661,35.661,עלות מופחתת,0.004652,0.003069,,
1328,2196.0,ערד בקרן פנסיה מקיפה חדשה,ערד 8808 01.11.2028,71121297.0,2013-11-01,2.8491820792187337,צמוד למדד המחירים לצרכן,2028-11-01,0.048,0.0485,2301.35,120.755425,2.779,2.779,עלות מופחתת,0.000362,0.000239,,
1328,2196.0,ערד בקרן פנסיה מקיפה חדשה,ערד 8880 01.11.2034,71125405.0,2019-11-01,7.3210817918558515,צמוד למדד המחירים לצרכן,2034-11-01,0.048,0.0485,73051.09,120.282907,87.868,87.868,עלות מופחתת,0.011463,0.007562,,
1328,2196.0,ערד בקרן פנסיה מקיפה חדשה,ערד 8899 01.07.2036,71126460.0,2021-07-01,8.419517453559914,צמוד למדד המחירים לצרכן,2036-07-01,0.048,0.0485,223521.45,118.392711,264.633,264.633,עלות מופחתת,0.034524,0.022775,,
1328,2196.0,ערד בקרן פנסיה מקיפה חדשה,ערד 8818 01.09.2029,71121750.0,2014-09-01,3.6059181101922166,צמוד למדד המחירים לצרכן,2029-09-01,0.048,0.0485,2314.08,118.724388,2.747,2.747,עלות מופחתת,0.000358,0.000236,,
1328,2196.0,ערד בקרן פנסיה מקיפה חדשה,ערד 8826 01.05.2030,71122535.0,2015-05-01,4.089751150341647,צמוד למדד המחירים לצרכן,2030-05-01,0.048,0.0485,2153.83,122.581567,2.64,2.64,עלות מופחתת,0.000344,0.000227,,
1328,2196.0,ערד בקרן פנסיה מקיפה חדשה,ערד 8839 01.06.2031,71123301.0,2016-06-01,4.95224154882411,צמוד למדד המחירים לצרכן,2031-06-01,0.048,0.0485,3465.02,122.463483,4.243,4.243,עלות מופחתת,0.000553,0.000365,,
1328,2196.0,ערד בקרן פנסיה מקיפה חדשה,ערד 8844 01.11.2031,71123525.0,2016-11-01,5.244780384067743,צמוד למדד המחירים לצרכן,2031-11-01,0.048,0.0485,4436.61,122.210482,5.422,5.422,עלות מופחתת,0.000707,0.000466,,
1328,2196.0,ערד בקרן פנסיה מקיפה חדשה,ערד 8856 01.11.2032,71124119.0,2017-11-01,5.970163618575247,צמוד למדד המחירים לצרכן,2032-11-01,0.048,0.0485,17629.19,122.091348,21.524,21.524,עלות מופחתת,0.002807,0.001852,,
1328,2196.0,ערד בקרן פנסיה מקיפה חדשה,ערד 8858 01.01.2033,71124267.0,2018-01-01,6.136830285241914,צמוד למדד המחירים לצרכן,2033-01-01,0.048,0.0485,21184.96,121.131135,25.662,25.662,עלות מופחתת,0.003347,0.002208,,
1328,2196.0,ערד בקרן פנסיה מקיפה חדשה,ערד 8861 01.04.2033,71124432.0,2018-04-01,6.2367478728178,צמוד למדד המחירים לצרכן,2033-04-01,0.048,0.0485,17056.11,122.931274,20.967,20.967,עלות מופחתת,0.002735,0.001804,,
1328,2196.0,ערד בקרן פנסיה מקיפה חדשה,ערד 8866 01.09.2033,71124630.0,2018-09-01,6.653414539484467,צמוד למדד המחירים לצרכן,2033-09-01,0.048,0.0485,30620.67,118.969048,36.429,36.429,עלות מופחתת,0.004752,0.003135,,
1328,2196.0,ערד בקרן פנסיה מקיפה חדשה,ערד 8867 01.10.2033,71124648.0,2018-10-01,6.5784128363239835,צמוד למדד המחירים לצרכן,2033-10-01,0.048,0.0485,11011.15,121.233998,13.349,13.349,עלות מופחתת,0.001741,0.001148,,
1328,2196.0,ערד בקרן פנסיה מקיפה חדשה,ערד 8869 01.12.2033,71124697.0,2018-12-01,6.7450795029906505,צמוד למדד המחירים לצרכן,2033-12-01,0.048,0.0485,30134.61,119.811572,36.105,36.105,עלות מופחתת,0.00471,0.003107,,
1328,2196.0,ערד בקרן פנסיה מקיפה חדשה,ערד 8877 01.08.2034,71125314.0,2019-08-01,7.2453504864947424,צמוד למדד המחירים לצרכן,2034-08-01,0.048,0.0485,62980.75,118.503479,74.634,74.634,עלות מופחתת,0.009736,0.006423,,
1328,2196.0,ערד בקרן פנסיה מקיפה חדשה,ערד 8883 01.02.2035,71125488.0,2020-02-01,7.5710817918558515,צמוד למדד המחירים לצרכן,2035-02-01,0.048,0.0485,86047.34,118.856167,102.273,102.273,עלות מופחתת,0.013342,0.008801,,
1328,2196.0,ערד בקרן פנסיה מקיפה חדשה,ערד 8887 01.07.2035,71125678.0,2020-07-01,7.805790137812206,צמוד למדד המחירים לצרכן,2035-07-01,0.048,0.0485,87434.94,120.17144,105.072,105.072,עלות מופחתת,0.013707,0.009042,,
1328,2196.0,ערד בקרן פנסיה מקיפה חדשה,ערד 8903 01.11.2036,71126718.0,2021-11-01,8.548882753431949,צמוד למדד המחירים לצרכן,2036-11-01,0.048,0.0485,235448.48,118.164734,278.217,278.217,עלות מופחתת,0.036296,0.023944,,
1328,9757.0,ערד בקרן פנסיה מקיפה חדשה,ערד 8903 01.11.2036,71126718.0,2021-11-01,8.548882753431949,צמוד למדד המחירים לצרכן,2036-11-01,0.048,0.0485,207387985.44,118.164734,245059.461,245059.461,עלות מופחתת,0.044294,0.012806,,
1328,9757.0,ערד בקרן פנסיה מקיפה חדשה,ערד 8883 01.02.2035,71125488.0,2020-02-01,7.5710817918558515,צמוד למדד המחירים לצרכן,2035-02-01,0.048,0.0485,75792315.57,118.856167,90083.842,90083.842,עלות מופחתת,0.016282,0.004707,,
1328,9757.0,ערד בקרן פנסיה מקיפה חדשה,ערד 8887 01.07.2035,71125678.0,2020-07-01,7.805790137812206,צמוד למדד המחירים לצרכן,2035-07-01,0.048,0.0485,77014546.11,120.17144,92549.49,92549.49,עלות מופחתת,0.016728,0.004836,,
1328,9757.0,ערד בקרן פנסיה מקיפה חדשה,ערד 8869 01.12.2033,71124697.0,2018-12-01,6.7450795029906505,צמוד למדד המחירים לצרכן,2033-12-01,0.048,0.0485,26543201.78,119.811572,31801.827,31801.827,עלות מופחתת,0.005748,0.001661,,
1328,9757.0,ערד בקרן פנסיה מקיפה חדשה,ערד 8877 01.08.2034,71125314.0,2019-08-01,7.2453504864947424,צמוד למדד המחירים לצרכן,2034-08-01,0.048,0.0485,55474777.59,118.503479,65739.541,65739.541,עלות מופחתת,0.011882,0.003435,,
1328,9757.0,ערד בקרן פנסיה מקיפה חדשה,ערד 8866 01.09.2033,71124630.0,2018-09-01,6.653414539484467,צמוד למדד המחירים לצרכן,2033-09-01,0.048,0.0485,26971333.01,118.969048,32087.538,32087.538,עלות מופחתת,0.005799,0.001676,,
1328,9757.0,ערד בקרן פנסיה מקיפה חדשה,ערד 8867 01.10.2033,71124648.0,2018-10-01,6.5784128363239835,צמוד למדד המחירים לצרכן,2033-10-01,0.048,0.0485,9698855.08,121.233998,11758.31,11758.31,עלות מופחתת,0.002125,0.000614,,
1328,9757.0,ערד בקרן פנסיה מקיפה חדשה,ערד 8858 01.01.2033,71124267.0,2018-01-01,6.136830285241914,צמוד למדד המחירים לצרכן,2033-01-01,0.048,0.0485,18660165.31,121.131135,22603.27,22603.27,עלות מופחתת,0.004085,0.001181,,
1328,9757.0,ערד בקרן פנסיה מקיפה חדשה,ערד 8861 01.04.2033,71124432.0,2018-04-01,6.2367478728178,צמוד למדד המחירים לצרכן,2033-04-01,0.048,0.0485,15023386.77,122.931274,18468.441,18468.441,עלות מופחתת,0.003338,0.000965,,
1328,9757.0,ערד בקרן פנסיה מקיפה חדשה,ערד 8844 01.11.2031,71123525.0,2016-11-01,5.244780384067743,צמוד למדד המחירים לצרכן,2031-11-01,0.048,0.0485,3907865.99,122.210482,4775.822,4775.822,עלות מופחתת,0.000863,0.000249,,
1328,9757.0,ערד בקרן פנסיה מקיפה חדשה,ערד 8856 01.11.2032,71124119.0,2017-11-01,5.970163618575247,צמוד למדד המחירים לצרכן,2032-11-01,0.048,0.0485,15528170.32,122.091348,18958.552,18958.552,עלות מופחתת,0.003426,0.00099,,
1328,9757.0,ערד בקרן פנסיה מקיפה חדשה,ערד 8826 01.05.2030,71122535.0,2015-05-01,4.089751150341647,צמוד למדד המחירים לצרכן,2030-05-01,0.048,0.0485,1897144.85,122.581567,2325.55,2325.55,עלות מופחתת,0.00042,0.000121,,
1328,9757.0,ערד בקרן פנסיה מקיפה חדשה,ערד 8839 01.06.2031,71123301.0,2016-06-01,4.95224154882411,צמוד למדד המחירים לצרכן,2031-06-01,0.048,0.0485,3052070.92,122.463483,3737.672,3737.672,עלות מופחתת,0.000675,0.000195,,
1328,9757.0,ערד בקרן פנסיה מקיפה חדשה,ערד 8880 01.11.2034,71125405.0,2019-11-01,7.3210817918558515,צמוד למדד המחירים לצרכן,2034-11-01,0.048,0.0485,64344946.35,120.282907,77395.972,77395.972,עלות מופחתת,0.013989,0.004044,,
1328,9757.0,ערד בקרן פנסיה מקיפה חדשה,ערד 8899 01.07.2036,71126460.0,2021-07-01,8.419517453559914,צמוד למדד המחירים לצרכן,2036-07-01,0.048,0.0485,196882411.46,118.392711,233094.426,233094.426,עלות מופחתת,0.042131,0.012181,,
1328,9757.0,ערד בקרן פנסיה מקיפה חדשה,ערד 8808 01.11.2028,71121297.0,2013-11-01,2.8491820792187337,צמוד למדד המחירים לצרכן,2028-11-01,0.048,0.0485,2027079.87,120.755425,2447.809,2447.809,עלות מופחתת,0.000442,0.000127,,
1328,9757.0,ערד בקרן פנסיה מקיפה חדשה,ערד 8818 01.09.2029,71121750.0,2014-09-01,3.6059181101922166,צמוד למדד המחירים לצרכן,2029-09-01,0.048,0.0485,2038297.28,118.724388,2419.956,2419.956,עלות מופחתת,0.000437,0.000126,,
1328,9757.0,ערד בקרן פנסיה מקיפה חדשה,ערד 8848 01.03.2032,71123673.0,2017-03-01,5.578113717401076,צמוד למדד המחירים לצרכן,2032-03-01,0.048,0.0485,9453474.19,120.75716,11415.747,11415.747,עלות מופחתת,0.002063,0.000596,,
1328,9757.0,ערד בקרן פנסיה מקיפה חדשה,ערד 8865 01.08.2033,71124580.0,2018-08-01,6.570081206151133,צמוד למדד המחירים לצרכן,2033-08-01,0.048,0.0485,26295483.93,119.452208,31410.536,31410.536,עלות מופחתת,0.005677,0.001641,,
1328,9757.0,ערד בקרן פנסיה מקיפה חדשה,ערד 8798 01.01.2028,71120596.0,2013-01-01,2.1382267038020437,צמוד למדד המחירים לצרכן,2028-01-01,0.048,0.0485,1217089.23,122.212735,1487.438,1487.438,עלות מופחתת,0.000268,7.7e-05,,
1328,9757.0,ערד בקרן פנסיה מקיפה חדשה,ערד 8803 01.06.2028,71121057.0,2013-06-01,2.498920787877731,צמוד למדד המחירים לצרכן,2028-06-01,0.048,0.0485,1094632.48,121.941587,1334.812,1334.812,עלות מופחתת,0.000241,6.9e-05,,
1328,9757.0,ערד בקרן פנסיה מקיפה חדשה,ערד 8814 01.05.2029,71121677.0,2014-05-01,3.2725847768588836,צמוד למדד המחירים לצרכן,2029-05-01,0.048,0.0485,1247002.33,121.348526,1513.219,1513.219,עלות מופחתת,0.000273,7.9e-05,,
1328,9757.0,ערד בקרן פנסיה מקיפה חדשה,ערד 8817 01.08.2029,71121701.0,2014-08-01,3.5225847768588836,צמוד למדד המחירים לצרכן,2029-08-01,0.048,0.0485,977784.43,119.323081,1166.723,1166.723,עלות מופחתת,0.00021,6e-05,,
1328,9757.0,ערד בקרן פנסיה מקיפה חדשה,ערד 8776 01.03.2026,71116776.0,2011-03-01,0.41944444444444445,צמוד למדד המחירים לצרכן,2026-03-01,0.048,0.0484,142554.61,125.387852,178.746,178.746,עלות מופחתת,3.2e-05,9e-06,,
1328,9757.0,ערד בקרן פנסיה מקיפה חדשה,ערד 8771 01.10.2025,71118814.0,2010-10-01,0.0027777777777777683,צמוד למדד המחירים לצרכן,2025-10-01,0.048,0.0479,161250.3,130.091327,209.773,209.773,עלות מופחתת,3.7e-05,1e-05,,
1328,9757.0,ערד בקרן פנסיה מקיפה חדשה,ערד 8781 01.08.2026,71118616.0,2011-08-01,0.824390125947164,צמוד למדד המחירים לצרכן,2026-08-01,0.048,0.0484,452903.02,123.475983,559.226,559.226,עלות מופחתת,0.000101,2.9e-05,,
1328,9757.0,ערד בקרן פנסיה מקיפה חדשה,ערד 8800 01.03.2028,71120687.0,2013-09-01,2.748920787877731,צמוד למדד המחירים לצרכן,2028-09-01,0.048,0.0485,569283.67,119.073236,677.864,677.864,עלות מופחתת,0.000122,3.5e-05,,
1328,9757.0,ערד בקרן פנסיה מקיפה חדשה,ערד 8773 01.12.2025,71116743.0,2010-12-01,0.16944444444444448,צמוד למדד המחירים לצרכן,2025-12-01,0.048,0.0481,131337.2,127.7514,167.785,167.785,עלות מופחתת,3e-05,8e-06,,
1328,9757.0,ערד בקרן פנסיה מקיפה חדשה,ערד 8775 01.02.2026,71116768.0,2011-02-01,0.33611111111111114,צמוד למדד המחירים לצרכן,2026-02-01,0.048,0.0483,153304.63,126.155869,193.403,193.403,עלות מופחתת,3.4e-05,1e-05,,
1328,9757.0,ערד בקרן פנסיה מקיפה חדשה,ערד 8901 01.09.2036,71126593.0,2021-09-01,8.586184120226578,צמוד למדד המחירים לצרכן,2036-09-01,0.048,0.0485,152902677.08,116.86201,178685.142,178685.142,עלות מופחתת,0.032297,0.009337,,
1328,9757.0,ערד בקרן פנסיה מקיפה חדשה,ערד 8789 01.04.2027,71116701.0,2012-04-01,1.4335201532975232,צמוד למדד המחירים לצרכן,2027-04-01,0.048,0.0485,594055.45,125.441503,745.192,745.192,עלות מופחתת,0.000134,3.8e-05,,
1328,9757.0,ערד בקרן פנסיה מקיפה חדשה,ערד 8895 01.03.2036,71126320.0,2021-03-01,8.282988084043675,צמוד למדד המחירים לצרכן,2036-03-01,0.048,0.0485,149597279.6,119.323496,178504.704,178504.704,עלות מופחתת,0.032264,0.009328,,
1328,9757.0,ערד בקרן פנסיה מקיפה חדשה,ערד 8876 01.07.2034,71125272.0,2019-07-01,7.1620171531614085,צמוד למדד המחירים לצרכן,2034-07-01,0.048,0.0485,49063091.7,118.280838,58032.236,58032.236,עלות מופחתת,0.010489,0.003032,,
1328,9757.0,ערד בקרן פנסיה מקיפה חדשה,ערד 8893 01.01.2036,71126239.0,2021-01-01,8.116321417377012,צמוד למדד המחירים לצרכן,2036-01-01,0.048,0.0485,215832827.31,120.051509,259110.567,259110.567,עלות מופחתת,0.046834,0.01354,,
1328,9757.0,ערד בקרן פנסיה מקיפה חדשה,ערד 8860 01.03.2033,71124358.0,2018-03-01,6.303496951908582,צמוד למדד המחירים לצרכן,2033-03-01,0.048,0.0485,15939475.44,120.636282,19228.791,19228.791,עלות מופחתת,0.003475,0.001004,,
1328,9757.0,ערד בקרן פנסיה מקיפה חדשה,ערד 8864 01.07.2033,71124556.0,2018-07-01,6.4867478728178005,צמוד למדד המחירים לצרכן,2033-07-01,0.048,0.0485,17232282.2,120.053881,20688.024,20688.024,עלות מופחתת,0.003739,0.001081,,
1328,9757.0,ערד בקרן פנסיה מקיפה חדשה,ערד 8852 01.07.2032,71123921.0,2017-07-01,5.778463659857551,צמוד למדד המחירים לצרכן,2032-07-01,0.048,0.0485,10746748.34,120.649978,12965.95,12965.95,עלות מופחתת,0.002343,0.000677,,
1328,9757.0,ערד בקרן פנסיה מקיפה חדשה,ערד 8842 01.09.2031,71123434.0,2016-09-01,5.202241548824109,צמוד למדד המחירים לצרכן,2031-09-01,0.048,0.0485,3531615.29,119.788918,4230.484,4230.484,עלות מופחתת,0.000764,0.000221,,
1328,9757.0,ערד בקרן פנסיה מקיפה חדשה,ערד 8841 01.08.2031,71123368.0,2016-08-01,5.118908215490776,צמוד למדד המחירים לצרכן,2031-08-01,0.048,0.0485,5854087.02,120.760879,7069.447,7069.447,עלות מופחתת,0.001277,0.000369,,
1328,9757.0,ערד בקרן פנסיה מקיפה חדשה,ערד 8850 01.05.2032,71123749.0,2017-05-01,5.611796993190885,צמוד למדד המחירים לצרכן,2032-05-01,0.048,0.0485,10069964.47,122.335286,12319.12,12319.12,עלות מופחתת,0.002226,0.000643,,
1328,9757.0,ערד בקרן פנסיה מקיפה חדשה,ערד 8832 01.11.2030,71122741.0,2015-11-01,4.4839701826131,צמוד למדד המחירים לצרכן,2030-11-01,0.048,0.0485,4310290.66,121.719184,5246.451,5246.451,עלות מופחתת,0.000948,0.000274,,
1328,9757.0,ערד בקרן פנסיה מקיפה חדשה,ערד 8834 01.01.2031,71122931.0,2016-01-01,4.650636849279767,צמוד למדד המחירים לצרכן,2031-01-01,0.048,0.0485,1138567.34,121.127105,1379.114,1379.114,עלות מופחתת,0.000249,7.2e-05,,
1328,9757.0,ערד בקרן פנסיה מקיפה חדשה,ערד 8822 01.01.2030,71122402.0,2015-01-01,3.85269771710978,צמוד למדד המחירים לצרכן,2030-01-01,0.048,0.0485,1402176.53,120.040402,1683.178,1683.178,עלות מופחתת,0.000304,8.7e-05,,
1328,9757.0,ערד בקרן פנסיה מקיפה חדשה,ערד 8816 01.07.2029,71121693.0,2014-07-01,3.4392514435255492,צמוד למדד המחירים לצרכן,2029-07-01,0.048,0.0485,1575111.63,120.158088,1892.624,1892.624,עלות מופחתת,0.000342,9.8e-05,,
1328,9757.0,ערד בקרן פנסיה מקיפה חדשה,ערד 8801 01.04.2028,71120935.0,2013-04-01,2.332254121211065,צמוד למדד המחירים לצרכן,2028-04-01,0.048,0.0485,2552428.68,123.639692,3155.815,3155.815,עלות מופחתת,0.00057,0.000164,,
1328,9757.0,ערד בקרן פנסיה מקיפה חדשה,ערד 8792 01.07.2027,71119747.0,2012-07-01,1.6835201532975237,צמוד למדד המחירים לצרכן,2027-07-01,0.048,0.0485,523479.23,122.444858,640.973,640.973,עלות מופחתת,0.000115,3.3e-05,,
1328,9757.0,ערד בקרן פנסיה מקיפה חדשה,ערד 8897 01.05.2036,71126395.0,2021-05-01,8.252850786893246,צמוד למדד המחירים לצרכן,2036-05-01,0.048,0.0485,232963685.42,120.161553,279932.784,279932.784,עלות מופחתת,0.050597,0.014628,,
1328,9757.0,ערד בקרן פנסיה מקיפה חדשה,ערד 8900 01.08.2036,71126544.0,2021-08-01,8.502850786893246,צמוד למדד המחירים לצרכן,2036-08-01,0.048,0.0485,92981130.3,117.799478,109531.287,109531.287,עלות מופחתת,0.019797,0.005723,,
1328,9757.0,ערד בקרן פנסיה מקיפה חדשה,ערד 8881 01.12.2034,71125421.0,2019-12-01,7.404415125189185,צמוד למדד המחירים לצרכן,2034-12-01,0.048,0.0485,64019641.39,119.328631,76393.762,76393.762,עלות מופחתת,0.013808,0.003992,,
1328,9757.0,ערד בקרן פנסיה מקיפה חדשה,ערד 8888 01.08.2035,71125702.0,2020-08-01,7.889123471145539,צמוד למדד המחירים לצרכן,2035-08-01,0.048,0.0485,132106062.13,119.807017,158272.333,158272.333,עלות מופחתת,0.028607,0.008271,,
1328,9757.0,ערד בקרן פנסיה מקיפה חדשה,ערד 8863 01.06.2033,71124499.0,2018-06-01,6.4034145394844675,צמוד למדד המחירים לצרכן,2033-06-01,0.048,0.0485,24434328.27,121.120338,29594.941,29594.941,עלות מופחתת,0.005349,0.001546,,
1328,9757.0,ערד בקרן פנסיה מקיפה חדשה,ערד 8874 01.05.2034,71125132.0,2019-05-01,6.995350486494741,צמוד למדד המחירים לצרכן,2034-05-01,0.048,0.0485,43029993.46,120.402353,51809.125,51809.125,עלות מופחתת,0.009364,0.002707,,
1328,9757.0,ערד בקרן פנסיה מקיפה חדשה,ערד 8849 01.04.2032,71123731.0,2017-04-01,5.528463659857552,צמוד למדד המחירים לצרכן,2032-04-01,0.048,0.0485,10405084.66,123.17763,12816.737,12816.737,עלות מופחתת,0.002316,0.000669,,
1328,9757.0,ערד בקרן פנסיה מקיפה חדשה,ערד 8855 01.10.2032,71124093.0,2017-10-01,5.886830285241915,צמוד למדד המחירים לצרכן,2032-10-01,0.048,0.0485,14780810.23,122.685902,18133.971,18133.971,עלות מופחתת,0.003277,0.000947,,
1328,9757.0,ערד בקרן פנסיה מקיפה חדשה,ערד 8823 01.02.2030,71122410.0,2015-02-01,3.9360310504431135,צמוד למדד המחירים לצרכן,2030-02-01,0.048,0.0485,2356123.96,119.556818,2816.907,2816.907,עלות מופחתת,0.000509,0.000147,,
1328,9757.0,ערד בקרן פנסיה מקיפה חדשה,ערד 8825 01.04.2030,71122501.0,2015-04-01,4.006417817008313,צמוד למדד המחירים לצרכן,2030-04-01,0.048,0.0485,2892222.79,123.430488,3569.885,3569.885,עלות מופחתת,0.000645,0.000186,,
1328,9757.0,ערד בקרן פנסיה מקיפה חדשה,ערד 8815 01.06.2029,71121685.0,2014-06-01,3.355918110192216,צמוד למדד המחירים לצרכן,2029-06-01,0.048,0.0485,2224319.37,120.744908,2685.752,2685.752,עלות מופחתת,0.000485,0.00014,,
1328,9757.0,ערד בקרן פנסיה מקיפה חדשה,ערד 8820 01.11.2029,71121776.0,2014-11-01,3.686031050443114,צמוד למדד המחירים לצרכן,2029-11-01,0.048,0.0485,1682144.44,121.110588,2037.255,2037.255,עלות מופחתת,0.000368,0.000106,,
1328,9757.0,ערד בקרן פנסיה מקיפה חדשה,ערד 8802 01.05.2028,71121016.0,2013-05-01,2.415587454544398,צמוד למדד המחירים לצרכן,2028-05-01,0.048,0.0485,1056773.71,122.918209,1298.967,1298.967,עלות מופחתת,0.000234,6.7e-05,,
1328,9757.0,ערד בקרן פנסיה מקיפה חדשה,ערד 8813 01.04.2029,71121669.0,2014-04-01,3.18925144352555,צמוד למדד המחירים לצרכן,2029-04-01,0.048,0.0485,1468078.83,122.177942,1793.669,1793.669,עלות מופחתת,0.000324,9.3e-05,,
1328,9757.0,ערד בקרן פנסיה מקיפה חדשה,ערד 8793 01.08.2027,71119846.0,2012-08-01,1.766853486630857,צמוד למדד המחירים לצרכן,2027-08-01,0.048,0.0485,896458.19,122.300021,1096.369,1096.369,עלות מופחתת,0.000198,5.7e-05,,
1328,9757.0,ערד בקרן פנסיה מקיפה חדשה,ערד 8799 01.02.2028,71120612.0,2013-02-01,2.221560037135377,צמוד למדד המחירים לצרכן,2028-02-01,0.048,0.0485,750631.83,121.490087,911.943,911.943,עלות מופחתת,0.000164,4.7e-05,,
1328,9757.0,ערד בקרן פנסיה מקיפה חדשה,ערד 8788 01.03.2027,71116727.0,2012-03-01,1.384549207576438,צמוד למדד המחירים לצרכן,2027-03-01,0.048,0.0485,624903.34,122.976548,768.485,768.485,עלות מופחתת,0.000138,4e-05,,
1328,9757.0,ערד בקרן פנסיה מקיפה חדשה,ערד 8777 01.04.2026,71118822.0,2011-04-01,0.49105623382604097,צמוד למדד המחירים לצרכן,2026-04-01,0.048,0.0485,331848.44,127.526063,423.193,423.193,עלות מופחתת,7.6e-05,2.2e-05,,
1328,9757.0,ערד בקרן פנסיה מקיפה חדשה,ערד 8905 01.01.2037,71126981.0,2022-01-01,8.715549420098617,צמוד למדד המחירים לצרכן,2037-01-01,0.048,0.0485,96484234.68,117.235403,113113.681,113113.681,עלות מופחתת,0.020445,0.005911,,
1328,9757.0,ערד בקרן פנסיה מקיפה חדשה,ערד 8890 01.10.2035,71126106.0,2020-10-01,7.8663214173770095,צמוד למדד המחירים לצרכן,2035-10-01,0.048,0.0485,57970651.82,121.471191,70417.641,70417.641,עלות מופחתת,0.012727,0.003679,,
1328,9757.0,ערד בקרן פנסיה מקיפה חדשה,ערד 8898 01.06.2036,71126445.0,2021-06-01,8.336184120226578,צמוד למדד המחירים לצרכן,2036-06-01,0.048,0.0485,141481949.22,119.325448,168823.97,168823.97,עלות מופחתת,0.030514,0.008822,,
1328,9757.0,ערד בקרן פנסיה מקיפה חדשה,ערד 8882 01.01.2035,71125454.0,2020-01-01,7.48774845852252,צמוד למדד המחירים לצרכן,2035-01-01,0.048,0.0485,87123771.53,119.336917,103970.823,103970.823,עלות מופחתת,0.018792,0.005433,,
1328,9757.0,ערד בקרן פנסיה מקיפה חדשה,ערד 8884 01.03.2035,71125512.0,2020-03-01,7.654415125189185,צמוד למדד המחירים לצרכן,2035-03-01,0.048,0.0485,50648485.96,118.847034,60194.223,60194.223,עלות מופחתת,0.01088,0.003145,,
1328,9757.0,ערד בקרן פנסיה מקיפה חדשה,ערד 8873 01.04.2034,71125108.0,2019-04-01,6.912017153161408,צמוד למדד המחירים לצרכן,2034-04-01,0.048,0.0485,24808242.02,121.471191,30134.867,30134.867,עלות מופחתת,0.005446,0.001574,,
1328,9757.0,ערד בקרן פנסיה מקיפה חדשה,ערד 8879 01.10.2034,71125389.0,2019-10-01,7.2377484585225185,צמוד למדד המחירים לצרכן,2034-10-01,0.048,0.0485,55403733.98,120.509043,66766.51,66766.51,עלות מופחתת,0.012068,0.003489,,
1328,9757.0,ערד בקרן פנסיה מקיפה חדשה,ערד 8859 01.02.2033,71124325.0,2018-02-01,6.220163618575248,צמוד למדד המחירים לצרכן,2033-02-01,0.048,0.0485,29504598.62,120.522995,35559.826,35559.826,עלות מופחתת,0.006427,0.001858,,
1328,9757.0,ערד בקרן פנסיה מקיפה חדשה,ערד 8872 01.03.2034,71124986.0,2019-03-01,6.99507950299065,צמוד למדד המחירים לצרכן,2034-03-01,0.048,0.0485,33978943.94,119.203218,40503.995,40503.995,עלות מופחתת,0.007321,0.002116,,
1328,9757.0,ערד בקרן פנסיה מקיפה חדשה,ערד 8853 01.08.2032,71123939.0,2017-08-01,5.861796993190884,צמוד למדד המחירים לצרכן,2032-08-01,0.048,0.0485,16780781.36,121.005087,20305.599,20305.599,עלות מופחתת,0.00367,0.001061,,
1328,9757.0,ערד בקרן פנסיה מקיפה חדשה,ערד 8854 01.09.2032,71123947.0,2017-09-01,5.945130326524218,צמוד למדד המחירים לצרכן,2032-09-01,0.048,0.0485,17108423.28,120.636282,20638.966,20638.966,עלות מופחתת,0.00373,0.001078,,
1328,9757.0,ערד בקרן פנסיה מקיפה חדשה,ערד 8830 01.09.2030,71122717.0,2015-09-01,4.423084483674979,צמוד למדד המחירים לצרכן,2030-09-01,0.048,0.0485,1312904.62,119.070903,1563.287,1563.287,עלות מופחתת,0.000282,8.1e-05,,
1328,9757.0,ערד בקרן פנסיה מקיפה חדשה,ערד 8837 01.04.2031,71123129.0,2016-04-01,4.785574882157442,צמוד למדד המחירים לצרכן,2031-04-01,0.048,0.0485,3606398.04,123.681618,4460.451,4460.451,עלות מופחתת,0.000806,0.000233,,
1328,9757.0,ערד בקרן פנסיה מקיפה חדשה,ערד 8790 01.05.2027,71117162.0,2012-05-01,1.516853486630857,צמוד למדד המחירים לצרכן,2027-05-01,0.048,0.0485,564609.75,124.958178,705.526,705.526,עלות מופחתת,0.000127,3.6e-05,,
1328,9757.0,ערד בקרן פנסיה מקיפה חדשה,ערד 8772 01.11.2025,71116735.0,2010-11-01,0.08611111111111114,צמוד למדד המחירים לצרכן,2025-11-01,0.048,0.048,187424.26,128.622996,241.071,241.071,עלות מופחתת,4.3e-05,1.2e-05,,
1328,9757.0,ערד בקרן פנסיה מקיפה חדשה,ערד 8904 01.12.2036,71126841.0,2021-12-01,8.632216086765283,צמוד למדד המחירים לצרכן,2036-12-01,0.048,0.0485,79371137.47,117.577516,93322.613,93322.613,עלות מופחתת,0.016868,0.004876,,
1328,9757.0,ערד בקרן פנסיה מקיפה חדשה,ערד 8892 01.12.2035,71126163.0,2020-12-01,8.032988084043678,צמוד למדד המחירים לצרכן,2035-12-01,0.048,0.0485,224249625.65,120.279457,269726.233,269726.233,עלות מופחתת,0.048752,0.014095,,
1328,9757.0,ערד בקרן פנסיה מקיפה חדשה,ערד 8886 01.06.2035,71125660.0,2020-06-01,7.722456804478874,צמוד למדד המחירים לצרכן,2035-06-01,0.048,0.0485,111026674.9,120.279457,133542.282,133542.282,עלות מופחתת,0.024137,0.006978,,
1328,9757.0,ערד בקרן פנסיה מקיפה חדשה,ערד 8885 01.05.2035,71125603.0,2020-05-01,7.63912347114554,צמוד למדד המחירים לצרכן,2035-05-01,0.048,0.0485,60821744.11,120.402353,73230.812,73230.812,עלות מופחתת,0.013236,0.003826,,
1328,9757.0,ערד בקרן פנסיה מקיפה חדשה,ערד 8871 01.02.2034,71124945.0,2019-02-01,6.9117461696573175,צמוד למדד המחירים לצרכן,2034-02-01,0.048,0.0485,47275784.01,119.570244,56527.771,56527.771,עלות מופחתת,0.010217,0.002954,,
1328,9757.0,ערד בקרן פנסיה מקיפה חדשה,ערד 8870 01.01.2034,71124796.0,2019-01-01,6.8284128363239835,צמוד למדד המחירים לצרכן,2034-01-01,0.048,0.0485,11490369.3,119.699042,13753.862,13753.862,עלות מופחתת,0.002486,0.000718,,
1328,9757.0,ערד בקרן פנסיה מקיפה חדשה,ערד 8851 01.06.2032,71123772.0,2017-06-01,5.695130326524218,צמוד למדד המחירים לצרכן,2032-06-01,0.048,0.0485,16231128.16,121.603371,19737.599,19737.599,עלות מופחתת,0.003567,0.001031,,
1328,9757.0,ערד בקרן פנסיה מקיפה חדשה,ערד 8846 01.01.2032,71123616.0,2017-01-01,5.411447050734412,צמוד למדד המחירים לצרכן,2032-01-01,0.048,0.0485,6532740.47,121.494528,7936.922,7936.922,עלות מופחתת,0.001434,0.000414,,
1328,9757.0,ערד בקרן פנסיה מקיפה חדשה,ערד 8831 01.10.2030,71122725.0,2015-10-01,4.400636849279766,צמוד למדד המחירים לצרכן,2030-10-01,0.048,0.0485,465990.0,121.700731,567.113,567.113,עלות מופחתת,0.000102,2.9e-05,,
1328,9757.0,ערד בקרן פנסיה מקיפה חדשה,ערד 8812 01.03.2029,71121651.0,2014-03-01,3.182515412552067,צמוד למדד המחירים לצרכן,2029-03-01,0.048,0.0485,1866296.96,119.541567,2231.001,2231.001,עלות מופחתת,0.000403,0.000116,,
1328,9757.0,ערד בקרן פנסיה מקיפה חדשה,ערד 8810 01.01.2029,71121438.0,2014-01-01,3.0158487458854,צמוד למדד המחירים לצרכן,2029-01-01,0.048,0.0485,1429285.28,119.922945,1714.041,1714.041,עלות מופחתת,0.000309,8.9e-05,,
1328,9757.0,ערד בקרן פנסיה מקיפה חדשה,ערד 8805 01.08.2028,71121206.0,2013-08-01,2.665587454544398,צמוד למדד המחירים לצרכן,2028-08-01,0.048,0.0485,1467144.04,119.909147,1759.24,1759.24,עלות מופחתת,0.000317,9.1e-05,,
1328,9757.0,ערד בקרן פנסיה מקיפה חדשה,ערד 8780 01.07.2026,71118855.0,2011-07-01,0.7410567926138304,צמוד למדד המחירים לצרכן,2026-07-01,0.048,0.0484,259870.05,124.454088,323.419,323.419,עלות מופחתת,5.8e-05,1.6e-05,,
1328,9757.0,ערד בקרן פנסיה מקיפה חדשה,ערד 8791 01.06.2027,71119598.0,2012-06-01,1.6001868199641902,צמוד למדד המחירים לצרכן,2027-06-01,0.048,0.0485,133206.77,122.922215,163.741,163.741,עלות מופחתת,2.9e-05,8e-06,,
1328,9757.0,ערד בקרן פנסיה מקיפה חדשה,ערד 8779 01.06.2026,71118848.0,2011-06-01,0.6577234592804972,צמוד למדד המחירים לצרכן,2026-06-01,0.048,0.0484,220141.71,125.545192,276.377,276.377,עלות מופחתת,4.9e-05,1.4e-05,,
1328,9757.0,ערד בקרן פנסיה מקיפה חדשה,ערד 8778 01.05.2026,71118830.0,2011-05-01,0.5743895671593743,צמוד למדד המחירים לצרכן,2026-05-01,0.048,0.0485,127598.06,126.786834,161.778,161.778,עלות מופחתת,2.9e-05,8e-06,,
1328,9757.0,ערד בקרן פנסיה מקיפה חדשה,ערד 8774 01.01.2026,71116750.0,2011-01-01,0.25277777777777777,צמוד למדד המחירים לצרכן,2026-01-01,0.048,0.0482,272489.63,127.137022,346.435,346.435,עלות מופחתת,6.2e-05,1.8e-05,,
1328,9757.0,ערד בקרן פנסיה מקיפה חדשה,ערד 8896 01.04.2036,71126353.0,2021-04-01,8.169517453559912,צמוד למדד המחירים לצרכן,2036-04-01,0.048,0.0485,187356958.87,121.350083,227357.827,227357.827,עלות מופחתת,0.041094,0.011881,,
1328,9757.0,ערד בקרן פנסיה מקיפה חדשה,ערד 8891 01.11.2035,71126130.0,2020-11-01,7.949654750710344,צמוד למדד המחירים לצרכן,2035-11-01,0.048,0.0485,120393214.15,121.124046,145825.133,145825.133,עלות מופחתת,0.026357,0.00762,,
1328,9757.0,ערד בקרן פנסיה מקיפה חדשה,ערד 8894 01.02.2036,71126288.0,2021-02-01,8.199654750710344,צמוד למדד המחירים לצרכן,2036-02-01,0.048,0.0485,216084751.7,119.687329,258626.07,258626.07,עלות מופחתת,0.046746,0.013515,,
1328,9757.0,ערד בקרן פנסיה מקיפה חדשה,ערד 8878 01.09.2034,71125348.0,2019-09-01,7.3286838198280755,צמוד למדד המחירים לצרכן,2034-09-01,0.048,0.0485,34127574.65,118.375418,40398.659,40398.659,עלות מופחתת,0.007302,0.002111,,
1328,9757.0,ערד בקרן פנסיה מקיפה חדשה,ערד 8889 01.09.2035,71126098.0,2020-09-01,7.972456804478872,צמוד למדד המחירים לצרכן,2035-09-01,0.048,0.0485,161711617.46,119.084253,192573.073,192573.073,עלות מופחתת,0.034807,0.010063,,
1328,9757.0,ערד בקרן פנסיה מקיפה חדשה,ערד 8862 01.05.2033,71124473.0,2018-05-01,6.320081206151133,צמוד למדד המחירים לצרכן,2033-05-01,0.048,0.0485,19419677.6,122.091348,23709.746,23709.746,עלות מופחתת,0.004285,0.001239,,
1328,9757.0,ערד בקרן פנסיה מקיפה חדשה,ערד 8843 01.10.2031,71123517.0,2016-10-01,5.161447050734411,צמוד למדד המחירים לצרכן,2031-10-01,0.048,0.0485,3034310.01,122.559506,3718.835,3718.835,עלות מופחתת,0.000672,0.000194,,
1328,9757.0,ערד בקרן פנסיה מקיפה חדשה,ערד 8836 01.03.2031,71123079.0,2016-03-01,4.817303515946432,צמוד למדד המחירים לצרכן,2031-03-01,0.048,0.0485,504316.15,120.882326,609.629,609.629,עלות מופחתת,0.00011,3.1e-05,,
1328,9757.0,ערד בקרן פנסיה מקיפה חדשה,ערד 8838 01.05.2031,71123293.0,2016-05-01,4.868908215490777,צמוד למדד המחירים לצרכן,2031-05-01,0.048,0.0485,3813452.77,123.456257,4707.946,4707.946,עלות מופחתת,0.00085,0.000246,,
1328,9757.0,ערד בקרן פנסיה מקיפה חדשה,ערד 8827 01.06.2030,71122543.0,2015-06-01,4.17308448367498,צמוד למדד המחירים לצרכן,2030-06-01,0.048,0.0485,1454991.84,121.354659,1765.7,1765.7,עלות מופחתת,0.000319,9.2e-05,,
1328,9757.0,ערד בקרן פנסיה מקיפה חדשה,ערד 8833 01.12.2030,71122774.0,2015-12-01,4.567303515946433,צמוד למדד המחירים לצרכן,2030-12-01,0.048,0.0485,2070547.34,121.110975,2507.66,2507.66,עלות מופחתת,0.000453,0.000131,,
1328,9757.0,ערד בקרן פנסיה מקיפה חדשה,ערד 8829 01.08.2030,71122626.0,2015-08-01,4.339751150341647,צמוד למדד המחירים לצרכן,2030-08-01,0.048,0.0485,3375506.3,119.793825,4043.648,4043.648,עלות מופחתת,0.00073,0.000211,,
1328,9757.0,ערד בקרן פנסיה מקיפה חדשה,ערד 8824 01.03.2030,71122428.0,2015-03-01,4.0193643837764474,צמוד למדד המחירים לצרכן,2030-03-01,0.048,0.0485,3611071.96,120.151183,4338.746,4338.746,עלות מופחתת,0.000784,0.000226,,
1328,9757.0,ערד בקרן פנסיה מקיפה חדשה,ערד 8811 01.02.2029,71121578.0,2014-02-01,3.099182079218734,צמוד למדד המחירים לצרכן,2029-02-01,0.048,0.0485,1075469.4,119.323081,1283.283,1283.283,עלות מופחתת,0.000231,6.7e-05,,
1328,9757.0,ערד בקרן פנסיה מקיפה חדשה,ערד 8819 01.10.2029,71121768.0,2014-10-01,3.6026977171097805,צמוד למדד המחירים לצרכן,2029-10-01,0.048,0.0485,1593807.32,121.222494,1932.053,1932.053,עלות מופחתת,0.000349,0.0001,,
1328,9757.0,ערד בקרן פנסיה מקיפה חדשה,ערד 8797 01.12.2027,71120570.0,2012-12-01,2.0548933704687102,צמוד למדד המחירים לצרכן,2027-12-01,0.048,0.0485,768860.13,122.110465,938.859,938.859,עלות מופחתת,0.000169,4.9e-05,,
1328,9757.0,ערד בקרן פנסיה מקיפה חדשה,ערד 8796 01.11.2027,71120448.0,2012-11-01,1.971560037135377,צמוד למדד המחירים לצרכן,2027-11-01,0.048,0.0485,804849.33,122.369591,984.891,984.891,עלות מופחתת,0.000178,5.1e-05,,
1328,9757.0,ערד בקרן פנסיה מקיפה חדשה,ערד 8804 01.07.2028,71121107.0,2013-07-01,2.582254121211065,צמוד למדד המחירים לצרכן,2028-07-01,0.048,0.0485,550120.59,121.347772,667.559,667.559,עלות מופחתת,0.00012,3.4e-05,,
1328,9757.0,ערד בקרן פנסיה מקיפה חדשה,ערד 8809 01.12.2028,71121305.0,2013-12-01,2.932515412552067,צמוד למדד המחירים לצרכן,2028-12-01,0.048,0.0485,1469948.39,119.921112,1762.778,1762.778,עלות מופחתת,0.000318,9.2e-05,,
1328,9757.0,ערד בקרן פנסיה מקיפה חדשה,ערד 8795 01.10.2027,71120356.0,2012-10-01,1.8882267038020435,צמוד למדד המחירים לצרכן,2027-10-01,0.048,0.0485,785218.85,122.842903,964.586,964.586,עלות מופחתת,0.000174,5e-05,,
1328,9757.0,ערד בקרן פנסיה מקיפה חדשה,ערד 8785 01.12.2026,71119127.0,2011-12-01,1.134549207576438,צמוד למדד המחירים לצרכן,2026-12-01,0.048,0.0485,438881.25,124.458743,546.226,546.226,עלות מופחתת,9.8e-05,2.8e-05,,
1328,9757.0,ערד בקרן פנסיה מקיפה חדשה,ערד 8794 01.09.2027,71120232.0,2012-09-01,1.85018681996419,צמוד למדד המחירים לצרכן,2027-09-01,0.048,0.0485,678186.05,121.689448,825.281,825.281,עלות מופחתת,0.000149,4.3e-05,,
1328,9757.0,ערד בקרן פנסיה מקיפה חדשה,ערד 8807 01.10.2028,71120950.0,2013-10-01,2.7658487458854006,צמוד למדד המחירים לצרכן,2028-10-01,0.048,0.0485,1523231.1,121.459952,1850.116,1850.116,עלות מופחתת,0.000334,9.6e-05,,
1328,9757.0,ערד בקרן פנסיה מקיפה חדשה,ערד 8787 01.02.2027,71116420.0,2012-02-01,1.3012158742431048,צמוד למדד המחירים לצרכן,2027-02-01,0.048,0.0485,545914.06,123.475983,674.073,674.073,עלות מופחתת,0.000121,3.5e-05,,
1328,9757.0,ערד בקרן פנסיה מקיפה חדשה,ערד 8784 01.11.2026,71118905.0,2011-11-01,1.0512158742431044,צמוד למדד המחירים לצרכן,2026-11-01,0.048,0.0485,425794.27,124.958178,532.065,532.065,עלות מופחתת,9.6e-05,2.7e-05,,
1328,9757.0,ערד בקרן פנסיה מקיפה חדשה,ערד 8875 01.06.2034,71125231.0,2019-06-01,7.078683819828075,צמוד למדד המחירים לצרכן,2034-06-01,0.048,0.0485,16234399.9,119.564926,19410.648,19410.648,עלות מופחתת,0.003508,0.001014,,
1328,9757.0,ערד בקרן פנסיה מקיפה חדשה,ערד 8857 01.12.2032,71124127.0,2017-12-01,6.053496951908582,צמוד למדד המחירים לצרכן,2032-12-01,0.048,0.0485,13070622.25,121.240736,15846.919,15846.919,עלות מופחתת,0.002864,0.000828,,
1328,9757.0,ערד בקרן פנסיה מקיפה חדשה,ערד 8868 01.11.2033,71124689.0,2018-11-01,6.661746169657317,צמוד למדד המחירים לצרכן,2033-11-01,0.048,0.0485,1200263.11,120.647903,1448.092,1448.092,עלות מופחתת,0.000261,7.5e-05,,
1328,9757.0,ערד בקרן פנסיה מקיפה חדשה,ערד 8847 01.02.2032,71123665.0,2017-02-01,5.494780384067743,צמוד למדד המחירים לצרכן,2032-02-01,0.048,0.0485,6018141.68,121.005087,7282.258,7282.258,עלות מופחתת,0.001316,0.00038,,
1328,9757.0,ערד בקרן פנסיה מקיפה חדשה,ערד 8840 01.07.2031,71123350.0,2016-07-01,5.035574882157443,צמוד למדד המחירים לצרכן,2031-07-01,0.048,0.0485,1360111.23,121.617498,1654.133,1654.133,עלות מופחתת,0.000298,8.6e-05,,
1328,9757.0,ערד בקרן פנסיה מקיפה חדשה,ערד 8845 01.12.2031,71123533.0,2016-12-01,5.328113717401077,צמוד למדד המחירים לצרכן,2031-12-01,0.048,0.0485,4971650.59,121.476869,6039.405,6039.405,עלות מופחתת,0.001091,0.000315,,
1328,9757.0,ערד בקרן פנסיה מקיפה חדשה,ערד 8835 01.02.2031,71123061.0,2016-02-01,4.733970182613099,צמוד למדד המחירים לצרכן,2031-02-01,0.048,0.0485,251456.99,120.760879,303.662,303.662,עלות מופחתת,5.4e-05,1.5e-05,,
1328,9757.0,ערד בקרן פנסיה מקיפה חדשה,ערד 8821 01.12.2029,71121784.0,2014-12-01,3.769364383776447,צמוד למדד המחירים לצרכן,2029-12-01,0.048,0.0485,2049982.09,120.272787,2465.571,2465.571,עלות מופחתת,0.000445,0.000128,,
1328,9757.0,ערד בקרן פנסיה מקיפה חדשה,ערד 8782 01.09.2026,71116511.0,2011-09-01,0.9077229004927079,צמוד למדד המחירים לצרכן,2026-09-01,0.048,0.0485,129467.63,122.976548,159.215,159.215,עלות מופחתת,2.8e-05,8e-06,,
1328,9757.0,ערד בקרן פנסיה מקיפה חדשה,ערד 8828 01.07.2030,71122550.0,2015-07-01,4.256417817008314,צמוד למדד המחירים לצרכן,2030-07-01,0.048,0.0485,1014708.41,120.640651,1224.151,1224.151,עלות מופחתת,0.000221,6.3e-05,,
1328,9757.0,ערד בקרן פנסיה מקיפה חדשה,ערד 8783 01.10.2026,71116503.0,2011-10-01,0.9678825409097713,צמוד למדד המחירים לצרכן,2026-10-01,0.048,0.0485,153772.02,125.8044,193.452,193.452,עלות מופחתת,3.4e-05,1e-05,,
1328,9757.0,ערד בקרן פנסיה מקיפה חדשה,ערד 8786 01.01.2027,71116487.0,2012-01-01,1.217882540909771,צמוד למדד המחירים לצרכן,2027-01-01,0.048,0.0485,512261.82,123.856326,634.469,634.469,עלות מופחתת,0.000114,3.3e-05,,
1328,9758.0,ערד בקרן פנסיה מקיפה חדשה,ערד 8786 01.01.2027,71116487.0,2012-01-01,1.217882540909771,צמוד למדד המחירים לצרכן,2027-01-01,0.048,0.0485,138671.95,123.856326,171.754,171.754,עלות מופחתת,0.000122,3.3e-05,,
1328,9758.0,ערד בקרן פנסיה מקיפה חדשה,ערד 8783 01.10.2026,71116503.0,2011-10-01,0.9678825409097713,צמוד למדד המחירים לצרכן,2026-10-01,0.048,0.0485,41626.89,125.8044,52.368,52.368,עלות מופחתת,3.7e-05,1e-05,,
1328,9758.0,ערד בקרן פנסיה מקיפה חדשה,ערד 8782 01.09.2026,71116511.0,2011-09-01,0.9077229004927079,צמוד למדד המחירים לצרכן,2026-09-01,0.048,0.0485,35047.56,122.976548,43.1,43.1,עלות מופחתת,3e-05,8e-06,,
1328,9758.0,ערד בקרן פנסיה מקיפה חדשה,ערד 8821 01.12.2029,71121784.0,2014-12-01,3.769364383776447,צמוד למדד המחירים לצרכן,2029-12-01,0.048,0.0485,554940.86,120.272787,667.443,667.443,עלות מופחתת,0.000475,0.000129,,
1328,9758.0,ערד בקרן פנסיה מקיפה חדשה,ערד 8828 01.07.2030,71122550.0,2015-07-01,4.256417817008314,צמוד למדד המחירים לצרכן,2030-07-01,0.048,0.0485,274686.86,120.640651,331.384,331.384,עלות מופחתת,0.000236,6.4e-05,,
1328,9758.0,ערד בקרן פנסיה מקיפה חדשה,ערד 8835 01.02.2031,71123061.0,2016-02-01,4.733970182613099,צמוד למדד המחירים לצרכן,2031-02-01,0.048,0.0485,68070.72,120.760879,82.203,82.203,עלות מופחתת,5.8e-05,1.5e-05,,
1328,9758.0,ערד בקרן פנסיה מקיפה חדשה,ערד 8840 01.07.2031,71123350.0,2016-07-01,5.035574882157443,צמוד למדד המחירים לצרכן,2031-07-01,0.048,0.0485,368189.21,121.617498,447.783,447.783,עלות מופחתת,0.000318,8.6e-05,,
1328,9758.0,ערד בקרן פנסיה מקיפה חדשה,ערד 8845 01.12.2031,71123533.0,2016-12-01,5.328113717401077,צמוד למדד המחירים לצרכן,2031-12-01,0.048,0.0485,1345851.78,121.476869,1634.899,1634.899,עלות מופחתת,0.001164,0.000316,,
1328,9758.0,ערד בקרן פנסיה מקיפה חדשה,ערד 8847 01.02.2032,71123665.0,2017-02-01,5.494780384067743,צמוד למדד המחירים לצרכן,2032-02-01,0.048,0.0485,1629142.39,121.005087,1971.345,1971.345,עלות מופחתת,0.001404,0.000382,,
1328,9758.0,ערד בקרן פנסיה מקיפה חדשה,ערד 8857 01.12.2032,71124127.0,2017-12-01,6.053496951908582,צמוד למדד המחירים לצרכן,2032-12-01,0.048,0.0485,3538285.72,121.240736,4289.844,4289.844,עלות מופחתת,0.003055,0.000831,,
1328,9758.0,ערד בקרן פנסיה מקיפה חדשה,ערד 8868 01.11.2033,71124689.0,2018-11-01,6.661746169657317,צמוד למדד המחירים לצרכן,2033-11-01,0.048,0.0485,324917.49,120.647903,392.006,392.006,עלות מופחתת,0.000279,7.5e-05,,
1328,9758.0,ערד בקרן פנסיה מקיפה חדשה,ערד 8875 01.06.2034,71125231.0,2019-06-01,7.078683819828075,צמוד למדד המחירים לצרכן,2034-06-01,0.048,0.0485,4394736.86,119.564926,5254.564,5254.564,עלות מופחתת,0.003743,0.001018,,
1328,9758.0,ערד בקרן פנסיה מקיפה חדשה,ערד 8794 01.09.2027,71120232.0,2012-09-01,1.85018681996419,צמוד למדד המחירים לצרכן,2027-09-01,0.048,0.0485,183588.5,121.689448,223.408,223.408,עלות מופחתת,0.000159,4.3e-05,,
1328,9758.0,ערד בקרן פנסיה מקיפה חדשה,ערד 8807 01.10.2028,71120950.0,2013-10-01,2.7658487458854006,צמוד למדד המחירים לצרכן,2028-10-01,0.048,0.0485,412346.61,121.459952,500.836,500.836,עלות מופחתת,0.000356,9.7e-05,,
1328,9758.0,ערד בקרן פנסיה מקיפה חדשה,ערד 8787 01.02.2027,71116420.0,2012-02-01,1.3012158742431048,צמוד למדד המחירים לצרכן,2027-02-01,0.048,0.0485,147781.78,123.475983,182.475,182.475,עלות מופחתת,0.000129,3.5e-05,,
1328,9758.0,ערד בקרן פנסיה מקיפה חדשה,ערד 8784 01.11.2026,71118905.0,2011-11-01,1.0512158742431044,צמוד למדד המחירים לצרכן,2026-11-01,0.048,0.0485,115264.73,124.958178,144.033,144.033,עלות מופחתת,0.000102,2.7e-05,,
1328,9758.0,ערד בקרן פנסיה מקיפה חדשה,ערד 8785 01.12.2026,71119127.0,2011-12-01,1.134549207576438,צמוד למדד המחירים לצרכן,2026-12-01,0.048,0.0485,118807.44,124.458743,147.866,147.866,עלות מופחתת,0.000105,2.8e-05,,
1328,9758.0,ערד בקרן פנסיה מקיפה חדשה,ערד 8795 01.10.2027,71120356.0,2012-10-01,1.8882267038020435,צמוד למדד המחירים לצרכן,2027-10-01,0.048,0.0485,212562.84,122.842903,261.118,261.118,עלות מופחתת,0.000186,5e-05,,
1328,9758.0,ערד בקרן פנסיה מקיפה חדשה,ערד 8804 01.07.2028,71121107.0,2013-07-01,2.582254121211065,צמוד למדד המחירים לצרכן,2028-07-01,0.048,0.0485,148920.51,121.347772,180.712,180.712,עלות מופחתת,0.000128,3.5e-05,,
1328,9758.0,ערד בקרן פנסיה מקיפה חדשה,ערד 8809 01.12.2028,71121305.0,2013-12-01,2.932515412552067,צמוד למדד המחירים לצרכן,2028-12-01,0.048,0.0485,397922.71,119.921112,477.193,477.193,עלות מופחתת,0.000339,9.2e-05,,
1328,9758.0,ערד בקרן פנסיה מקיפה חדשה,ערד 8796 01.11.2027,71120448.0,2012-11-01,1.971560037135377,צמוד למדד המחירים לצרכן,2027-11-01,0.048,0.0485,217876.91,122.369591,266.615,266.615,עלות מופחתת,0.000189,5.1e-05,,
1328,9758.0,ערד בקרן פנסיה מקיפה חדשה,ערד 8797 01.12.2027,71120570.0,2012-12-01,2.0548933704687102,צמוד למדד המחירים לצרכן,2027-12-01,0.048,0.0485,208134.45,122.110465,254.154,254.154,עלות מופחתת,0.000181,4.9e-05,,
1328,9758.0,ערד בקרן פנסיה מקיפה חדשה,ערד 8811 01.02.2029,71121578.0,2014-02-01,3.099182079218734,צמוד למדד המחירים לצרכן,2029-02-01,0.048,0.0485,291135.18,119.323081,347.391,347.391,עלות מופחתת,0.000247,6.7e-05,,
1328,9758.0,ערד בקרן פנסיה מקיפה חדשה,ערד 8819 01.10.2029,71121768.0,2014-10-01,3.6026977171097805,צמוד למדד המחירים לצרכן,2029-10-01,0.048,0.0485,431451.96,121.222494,523.017,523.017,עלות מופחתת,0.000372,0.000101,,
1328,9758.0,ערד בקרן פנסיה מקיפה חדשה,ערד 8824 01.03.2030,71122428.0,2015-03-01,4.0193643837764474,צמוד למדד המחירים לצרכן,2030-03-01,0.048,0.0485,977536.04,120.151183,1174.521,1174.521,עלות מופחתת,0.000836,0.000227,,
1328,9758.0,ערד בקרן פנסיה מקיפה חדשה,ערד 8829 01.08.2030,71122626.0,2015-08-01,4.339751150341647,צמוד למדד המחירים לצרכן,2030-08-01,0.048,0.0485,913767.19,119.793825,1094.637,1094.637,עלות מופחתת,0.000779,0.000212,,
1328,9758.0,ערד בקרן פנסיה מקיפה חדשה,ערד 8827 01.06.2030,71122543.0,2015-06-01,4.17308448367498,צמוד למדד המחירים לצרכן,2030-06-01,0.048,0.0485,393873.89,121.354659,477.984,477.984,עלות מופחתת,0.00034,9.2e-05,,
1328,9758.0,ערד בקרן פנסיה מקיפה חדשה,ערד 8833 01.12.2030,71122774.0,2015-12-01,4.567303515946433,צמוד למדד המחירים לצרכן,2030-12-01,0.048,0.0485,560507.98,121.110975,678.837,678.837,עלות מופחתת,0.000483,0.000131,,
1328,9758.0,ערד בקרן פנסיה מקיפה חדשה,ערד 8836 01.03.2031,71123079.0,2016-03-01,4.817303515946432,צמוד למדד המחירים לצרכן,2031-03-01,0.048,0.0485,136521.01,120.882326,165.03,165.03,עלות מופחתת,0.000117,3.1e-05,,
1328,9758.0,ערד בקרן פנסיה מקיפה חדשה,ערד 8838 01.05.2031,71123293.0,2016-05-01,4.868908215490777,צמוד למדד המחירים לצרכן,2031-05-01,0.048,0.0485,1032321.58,123.456257,1274.466,1274.466,עלות מופחתת,0.000907,0.000246,,
1328,9758.0,ערד בקרן פנסיה מקיפה חדשה,ערד 8862 01.05.2033,71124473.0,2018-05-01,6.320081206151133,צמוד למדד המחירים לצרכן,2033-05-01,0.048,0.0485,5257008.17,122.091348,6418.352,6418.352,עלות מופחתת,0.004572,0.001243,,
1328,9758.0,ערד בקרן פנסיה מקיפה חדשה,ערד 8843 01.10.2031,71123517.0,2016-10-01,5.161447050734411,צמוד למדד המחירים לצרכן,2031-10-01,0.048,0.0485,821403.57,122.559506,1006.708,1006.708,עלות מופחתת,0.000717,0.000195,,
1328,9758.0,ערד בקרן פנסיה מקיפה חדשה,ערד 8878 01.09.2034,71125348.0,2019-09-01,7.3286838198280755,צמוד למדד המחירים לצרכן,2034-09-01,0.048,0.0485,9238512.74,118.375418,10936.128,10936.128,עלות מופחתת,0.00779,0.002119,,
1328,9758.0,ערד בקרן פנסיה מקיפה חדשה,ערד 8889 01.09.2035,71126098.0,2020-09-01,7.972456804478872,צמוד למדד המחירים לצרכן,2035-09-01,0.048,0.0485,43776179.64,119.084253,52130.537,52130.537,עלות מופחתת,0.037134,0.010101,,
1328,9758.0,ערד בקרן פנסיה מקיפה חדשה,ערד 8891 01.11.2035,71126130.0,2020-11-01,7.949654750710344,צמוד למדד המחירים לצרכן,2035-11-01,0.048,0.0485,32591072.01,121.124046,39475.625,39475.625,עלות מופחתת,0.02812,0.007649,,
1328,9758.0,ערד בקרן פנסיה מקיפה חדשה,ערד 8894 01.02.2036,71126288.0,2021-02-01,8.199654750710344,צמוד למדד המחירים לצרכן,2036-02-01,0.048,0.0485,58495271.13,119.687329,70011.428,70011.428,עלות מופחתת,0.049872,0.013566,,
1328,9758.0,ערד בקרן פנסיה מקיפה חדשה,ערד 8896 01.04.2036,71126353.0,2021-04-01,8.169517453559912,צמוד למדד המחירים לצרכן,2036-04-01,0.048,0.0485,50718507.53,121.350083,61546.951,61546.951,עלות מופחתת,0.043842,0.011926,,
1328,9758.0,ערד בקרן פנסיה מקיפה חדשה,ערד 8774 01.01.2026,71116750.0,2011-01-01,0.25277777777777777,צמוד למדד המחירים לצרכן,2026-01-01,0.048,0.0482,73764.36,127.137022,93.782,93.782,עלות מופחתת,6.6e-05,1.8e-05,,
1328,9758.0,ערד בקרן פנסיה מקיפה חדשה,ערד 8779 01.06.2026,71118848.0,2011-06-01,0.6577234592804972,צמוד למדד המחירים לצרכן,2026-06-01,0.048,0.0484,59593.51,125.545192,74.817,74.817,עלות מופחתת,5.3e-05,1.4e-05,,
1328,9758.0,ערד בקרן פנסיה מקיפה חדשה,ערד 8778 01.05.2026,71118830.0,2011-05-01,0.5743895671593743,צמוד למדד המחירים לצרכן,2026-05-01,0.048,0.0485,34541.46,126.786834,43.794,43.794,עלות מופחתת,3.1e-05,8e-06,,
1328,9758.0,ערד בקרן פנסיה מקיפה חדשה,ערד 8780 01.07.2026,71118855.0,2011-07-01,0.7410567926138304,צמוד למדד המחירים לצרכן,2026-07-01,0.048,0.0484,70348.18,124.454088,87.551,87.551,עלות מופחתת,6.2e-05,1.6e-05,,
1328,9758.0,ערד בקרן פנסיה מקיפה חדשה,ערד 8791 01.06.2027,71119598.0,2012-06-01,1.6001868199641902,צמוד למדד המחירים לצרכן,2027-06-01,0.048,0.0485,36059.76,122.922215,44.325,44.325,עלות מופחתת,3.1e-05,8e-06,,
1328,9758.0,ערד בקרן פנסיה מקיפה חדשה,ערד 8810 01.01.2029,71121438.0,2014-01-01,3.0158487458854,צמוד למדד המחירים לצרכן,2029-01-01,0.048,0.0485,386914.99,119.922945,464.0,464.0,עלות מופחתת,0.00033,8.9e-05,,
1328,9758.0,ערד בקרן פנסיה מקיפה חדשה,ערד 8805 01.08.2028,71121206.0,2013-08-01,2.665587454544398,צמוד למדד המחירים לצרכן,2028-08-01,0.048,0.0485,397163.55,119.909147,476.235,476.235,עלות מופחתת,0.000339,9.2e-05,,
1328,9758.0,ערד בקרן פנסיה מקיפה חדשה,ערד 8812 01.03.2029,71121651.0,2014-03-01,3.182515412552067,צמוד למדד המחירים לצרכן,2029-03-01,0.048,0.0485,505216.33,119.541567,603.944,603.944,עלות מופחתת,0.00043,0.000117,,
1328,9758.0,ערד בקרן פנסיה מקיפה חדשה,ערד 8831 01.10.2030,71122725.0,2015-10-01,4.400636849279766,צמוד למדד המחירים לצרכן,2030-10-01,0.048,0.0485,126145.92,121.700731,153.521,153.521,עלות מופחתת,0.000109,2.9e-05,,
1328,9758.0,ערד בקרן פנסיה מקיפה חדשה,ערד 8846 01.01.2032,71123616.0,2017-01-01,5.411447050734412,צמוד למדד המחירים לצרכן,2032-01-01,0.048,0.0485,1768446.97,121.494528,2148.566,2148.566,עלות מופחתת,0.00153,0.000416,,
1328,9758.0,ערד בקרן פנסיה מקיפה חדשה,ערד 8851 01.06.2032,71123772.0,2017-06-01,5.695130326524218,צמוד למדד המחירים לצרכן,2032-06-01,0.048,0.0485,4393851.18,121.603371,5343.071,5343.071,עלות מופחתת,0.003806,0.001035,,
1328,9758.0,ערד בקרן פנסיה מקיפה חדשה,ערד 8870 01.01.2034,71124796.0,2019-01-01,6.8284128363239835,צמוד למדד המחירים לצרכן,2034-01-01,0.048,0.0485,3110502.99,119.699042,3723.242,3723.242,עלות מופחתת,0.002652,0.000721,,
1328,9758.0,ערד בקרן פנסיה מקיפה חדשה,ערד 8871 01.02.2034,71124945.0,2019-02-01,6.9117461696573175,צמוד למדד המחירים לצרכן,2034-02-01,0.048,0.0485,12797801.7,119.570244,15302.363,15302.363,עלות מופחתת,0.0109,0.002965,,
1328,9758.0,ערד בקרן פנסיה מקיפה חדשה,ערד 8885 01.05.2035,71125603.0,2020-05-01,7.63912347114554,צמוד למדד המחירים לצרכן,2035-05-01,0.048,0.0485,16464763.87,120.402353,19823.963,19823.963,עלות מופחתת,0.014121,0.003841,,
1328,9758.0,ערד בקרן פנסיה מקיפה חדשה,ערד 8886 01.06.2035,71125660.0,2020-06-01,7.722456804478874,צמוד למדד המחירים לצרכן,2035-06-01,0.048,0.0485,30055500.91,120.279457,36150.593,36150.593,עלות מופחתת,0.025751,0.007005,,
1328,9758.0,ערד בקרן פנסיה מקיפה חדשה,ערד 8892 01.12.2035,71126163.0,2020-12-01,8.032988084043678,צמוד למדד המחירים לצרכן,2035-12-01,0.048,0.0485,60705545.16,120.279457,73016.3,73016.3,עלות מופחתת,0.052012,0.014149,,
1328,9758.0,ערד בקרן פנסיה מקיפה חדשה,ערד 8904 01.12.2036,71126841.0,2021-12-01,8.632216086765283,צמוד למדד המחירים לצרכן,2036-12-01,0.048,0.0485,21486181.55,117.577516,25262.919,25262.919,עלות מופחתת,0.017995,0.004895,,
1328,9758.0,ערד בקרן פנסיה מקיפה חדשה,ערד 8772 01.11.2025,71116735.0,2010-11-01,0.08611111111111114,צמוד למדד המחירים לצרכן,2025-11-01,0.048,0.048,50736.72,128.622996,65.259,65.259,עלות מופחתת,4.6e-05,1.2e-05,,
1328,9758.0,ערד בקרן פנסיה מקיפה חדשה,ערד 8790 01.05.2027,71117162.0,2012-05-01,1.516853486630857,צמוד למדד המחירים לצרכן,2027-05-01,0.048,0.0485,152842.8,124.958178,190.99,190.99,עלות מופחתת,0.000136,3.7e-05,,
1328,9758.0,ערד בקרן פנסיה מקיפה חדשה,ערד 8830 01.09.2030,71122717.0,2015-09-01,4.423084483674979,צמוד למדד המחירים לצרכן,2030-09-01,0.048,0.0485,355410.14,119.070903,423.19,423.19,עלות מופחתת,0.000301,8.2e-05,,
1328,9758.0,ערד בקרן פנסיה מקיפה חדשה,ערד 8837 01.04.2031,71123129.0,2016-04-01,4.785574882157442,צמוד למדד המחירים לצרכן,2031-04-01,0.048,0.0485,976270.79,123.681618,1207.468,1207.468,עלות מופחתת,0.00086,0.000233,,
1328,9758.0,ערד בקרן פנסיה מקיפה חדשה,ערד 8854 01.09.2032,71123947.0,2017-09-01,5.945130326524218,צמוד למדד המחירים לצרכן,2032-09-01,0.048,0.0485,4631339.55,120.636282,5587.076,5587.076,עלות מופחתת,0.003979,0.001082,,
1328,9758.0,ערד בקרן פנסיה מקיפה חדשה,ערד 8872 01.03.2034,71124986.0,2019-03-01,6.99507950299065,צמוד למדד המחירים לצרכן,2034-03-01,0.048,0.0485,9198277.63,119.203218,10964.643,10964.643,עלות מופחתת,0.00781,0.002124,,
1328,9758.0,ערד בקרן פנסיה מקיפה חדשה,ערד 8853 01.08.2032,71123939.0,2017-08-01,5.861796993190884,צמוד למדד המחירים לצרכן,2032-08-01,0.048,0.0485,4542645.17,121.005087,5496.832,5496.832,עלות מופחתת,0.003915,0.001065,,
1328,9758.0,ערד בקרן פנסיה מקיפה חדשה,ערד 8859 01.02.2033,71124325.0,2018-02-01,6.220163618575248,צמוד למדד המחירים לצרכן,2033-02-01,0.048,0.0485,7987048.98,120.522995,9626.231,9626.231,עלות מופחתת,0.006857,0.001865,,
1328,9758.0,ערד בקרן פנסיה מקיפה חדשה,ערד 8873 01.04.2034,71125108.0,2019-04-01,6.912017153161408,צמוד למדד המחירים לצרכן,2034-04-01,0.048,0.0485,6715720.71,121.471191,8157.666,8157.666,עלות מופחתת,0.005811,0.00158,,
1328,9758.0,ערד בקרן פנסיה מקיפה חדשה,ערד 8879 01.10.2034,71125389.0,2019-10-01,7.2377484585225185,צמוד למדד המחירים לצרכן,2034-10-01,0.048,0.0485,14998080.22,120.509043,18074.043,18074.043,עלות מופחתת,0.012874,0.003502,,
1328,9758.0,ערד בקרן פנסיה מקיפה חדשה,ערד 8884 01.03.2035,71125512.0,2020-03-01,7.654415125189185,צמוד למדד המחירים לצרכן,2035-03-01,0.048,0.0485,13710809.74,118.847034,16294.891,16294.891,עלות מופחתת,0.011607,0.003157,,
1328,9758.0,ערד בקרן פנסיה מקיפה חדשה,ערד 8882 01.01.2035,71125454.0,2020-01-01,7.48774845852252,צמוד למדד המחירים לצרכן,2035-01-01,0.048,0.0485,23584860.09,119.336917,28145.445,28145.445,עלות מופחתת,0.020049,0.005454,,
1328,9758.0,ערד בקרן פנסיה מקיפה חדשה,ערד 8898 01.06.2036,71126445.0,2021-06-01,8.336184120226578,צמוד למדד המחירים לצרכן,2036-06-01,0.048,0.0485,38299902.77,119.325448,45701.531,45701.531,עלות מופחתת,0.032555,0.008856,,
1328,9758.0,ערד בקרן פנסיה מקיפה חדשה,ערד 8890 01.10.2035,71126106.0,2020-10-01,7.8663214173770095,צמוד למדד המחירים לצרכן,2035-10-01,0.048,0.0485,15692958.29,121.471191,19062.423,19062.423,עלות מופחתת,0.013579,0.003693,,
1328,9758.0,ערד בקרן פנסיה מקיפה חדשה,ערד 8905 01.01.2037,71126981.0,2022-01-01,8.715549420098617,צמוד למדד המחירים לצרכן,2037-01-01,0.048,0.0485,26118786.37,117.235403,30620.464,30620.464,עלות מופחתת,0.021812,0.005933,,
1328,9758.0,ערד בקרן פנסיה מקיפה חדשה,ערד 8788 01.03.2027,71116727.0,2012-03-01,1.384549207576438,צמוד למדד המחירים לצרכן,2027-03-01,0.048,0.0485,169164.59,122.976548,208.033,208.033,עלות מופחתת,0.000148,4e-05,,
1328,9758.0,ערד בקרן פנסיה מקיפה חדשה,ערד 8777 01.04.2026,71118822.0,2011-04-01,0.49105623382604097,צמוד למדד המחירים לצרכן,2026-04-01,0.048,0.0485,89833.1,127.526063,114.561,114.561,עלות מופחתת,8.1e-05,2.2e-05,,
1328,9758.0,ערד בקרן פנסיה מקיפה חדשה,ערד 8799 01.02.2028,71120612.0,2013-02-01,2.221560037135377,צמוד למדד המחירים לצרכן,2028-02-01,0.048,0.0485,203199.95,121.490087,246.868,246.868,עלות מופחתת,0.000175,4.7e-05,,
1328,9758.0,ערד בקרן פנסיה מקיפה חדשה,ערד 8793 01.08.2027,71119846.0,2012-08-01,1.766853486630857,צמוד למדד המחירים לצרכן,2027-08-01,0.048,0.0485,242675.91,122.300021,296.793,296.793,עלות מופחתת,0.000211,5.7e-05,,
1328,9758.0,ערד בקרן פנסיה מקיפה חדשה,ערד 8802 01.05.2028,71121016.0,2013-05-01,2.415587454544398,צמוד למדד המחירים לצרכן,2028-05-01,0.048,0.0485,286074.16,122.918209,351.637,351.637,עלות מופחתת,0.00025,6.8e-05,,
1328,9758.0,ערד בקרן פנסיה מקיפה חדשה,ערד 8813 01.04.2029,71121669.0,2014-04-01,3.18925144352555,צמוד למדד המחירים לצרכן,2029-04-01,0.048,0.0485,397416.6,122.177942,485.555,485.555,עלות מופחתת,0.000345,9.4e-05,,
1328,9758.0,ערד בקרן פנסיה מקיפה חדשה,ערד 8820 01.11.2029,71121776.0,2014-11-01,3.686031050443114,צמוד למדד המחירים לצרכן,2029-11-01,0.048,0.0485,455365.28,121.110588,551.496,551.496,עלות מופחתת,0.000392,0.000106,,
1328,9758.0,ערד בקרן פנסיה מקיפה חדשה,ערד 8815 01.06.2029,71121685.0,2014-06-01,3.355918110192216,צמוד למדד המחירים לצרכן,2029-06-01,0.048,0.0485,602134.87,120.744908,727.047,727.047,עלות מופחתת,0.000517,0.00014,,
1328,9758.0,ערד בקרן פנסיה מקיפה חדשה,ערד 8825 01.04.2030,71122501.0,2015-04-01,4.006417817008313,צמוד למדד המחירים לצרכן,2030-04-01,0.048,0.0485,782939.82,123.430488,966.386,966.386,עלות מופחתת,0.000688,0.000187,,
1328,9758.0,ערד בקרן פנסיה מקיפה חדשה,ערד 8855 01.10.2032,71124093.0,2017-10-01,5.886830285241915,צמוד למדד המחירים לצרכן,2032-10-01,0.048,0.0485,4001242.54,122.685902,4908.961,4908.961,עלות מופחתת,0.003496,0.000951,,
1328,9758.0,ערד בקרן פנסיה מקיפה חדשה,ערד 8849 01.04.2032,71123731.0,2017-04-01,5.528463659857552,צמוד למדד המחירים לצרכן,2032-04-01,0.048,0.0485,2816710.77,123.17763,3469.558,3469.558,עלות מופחתת,0.002471,0.000672,,
1328,9758.0,ערד בקרן פנסיה מקיפה חדשה,ערד 8823 01.02.2030,71122410.0,2015-02-01,3.9360310504431135,צמוד למדד המחירים לצרכן,2030-02-01,0.048,0.0485,637815.06,119.556818,762.551,762.551,עלות מופחתת,0.000543,0.000147,,
1328,9758.0,ערד בקרן פנסיה מקיפה חדשה,ערד 8874 01.05.2034,71125132.0,2019-05-01,6.995350486494741,צמוד למדד המחירים לצרכן,2034-05-01,0.048,0.0485,11648444.02,120.402353,14025.001,14025.001,עלות מופחתת,0.00999,0.002717,,
1328,9758.0,ערד בקרן פנסיה מקיפה חדשה,ערד 8863 01.06.2033,71124499.0,2018-06-01,6.4034145394844675,צמוד למדד המחירים לצרכן,2033-06-01,0.048,0.0485,6614500.31,121.120338,8011.505,8011.505,עלות מופחתת,0.005706,0.001552,,
1328,9758.0,ערד בקרן פנסיה מקיפה חדשה,ערד 8888 01.08.2035,71125702.0,2020-08-01,7.889123471145539,צמוד למדד המחירים לצרכן,2035-08-01,0.048,0.0485,35761801.15,119.807017,42845.147,42845.147,עלות מופחתת,0.03052,0.008302,,
1328,9758.0,ערד בקרן פנסיה מקיפה חדשה,ערד 8881 01.12.2034,71125421.0,2019-12-01,7.404415125189185,צמוד למדד המחירים לצרכן,2034-12-01,0.048,0.0485,17330451.37,119.328631,20680.191,20680.191,עלות מופחתת,0.014731,0.004007,,
1328,9758.0,ערד בקרן פנסיה מקיפה חדשה,ערד 8900 01.08.2036,71126544.0,2021-08-01,8.502850786893246,צמוד למדד המחירים לצרכן,2036-08-01,0.048,0.0485,25170477.71,117.799478,29650.692,29650.692,עלות מופחתת,0.021121,0.005745,,
1328,9758.0,ערד בקרן פנסיה מקיפה חדשה,ערד 8897 01.05.2036,71126395.0,2021-05-01,8.252850786893246,צמוד למדד המחירים לצרכן,2036-05-01,0.048,0.0485,63064486.67,120.161553,75779.267,75779.267,עלות מופחתת,0.05398,0.014684,,
1328,9758.0,ערד בקרן פנסיה מקיפה חדשה,ערד 8792 01.07.2027,71119747.0,2012-07-01,1.6835201532975237,צמוד למדד המחירים לצרכן,2027-07-01,0.048,0.0485,141708.56,122.444858,173.515,173.515,עלות מופחתת,0.000123,3.3e-05,,
1328,9758.0,ערד בקרן פנסיה מקיפה חדשה,ערד 8801 01.04.2028,71120935.0,2013-04-01,2.332254121211065,צמוד למדד המחירים לצרכן,2028-04-01,0.048,0.0485,690955.77,123.639692,854.296,854.296,עלות מופחתת,0.000608,0.000165,,
1328,9758.0,ערד בקרן פנסיה מקיפה חדשה,ערד 8816 01.07.2029,71121693.0,2014-07-01,3.4392514435255492,צמוד למדד המחירים לצרכן,2029-07-01,0.048,0.0485,426390.94,120.158088,512.343,512.343,עלות מופחתת,0.000364,9.9e-05,,
1328,9758.0,ערד בקרן פנסיה מקיפה חדשה,ערד 8822 01.01.2030,71122402.0,2015-01-01,3.85269771710978,צמוד למדד המחירים לצרכן,2030-01-01,0.048,0.0485,379576.51,120.040402,455.645,455.645,עלות מופחתת,0.000324,8.8e-05,,
1328,9758.0,ערד בקרן פנסיה מקיפה חדשה,ערד 8832 01.11.2030,71122741.0,2015-11-01,4.4839701826131,צמוד למדד המחירים לצרכן,2030-11-01,0.048,0.0485,1166818.2,121.719184,1420.242,1420.242,עלות מופחתת,0.001011,0.000275,,
1328,9758.0,ערד בקרן פנסיה מקיפה חדשה,ערד 8834 01.01.2031,71122931.0,2016-01-01,4.650636849279767,צמוד למדד המחירים לצרכן,2031-01-01,0.048,0.0485,308216.12,121.127105,373.333,373.333,עלות מופחתת,0.000265,7.2e-05,,
1328,9758.0,ערד בקרן פנסיה מקיפה חדשה,ערד 8850 01.05.2032,71123749.0,2017-05-01,5.611796993190885,צמוד למדד המחירים לצרכן,2032-05-01,0.048,0.0485,2725991.98,122.335286,3334.85,3334.85,עלות מופחתת,0.002375,0.000646,,
1328,9758.0,ערד בקרן פנסיה מקיפה חדשה,ערד 8841 01.08.2031,71123368.0,2016-08-01,5.118908215490776,צמוד למדד המחירים לצרכן,2031-08-01,0.048,0.0485,1584731.94,120.760879,1913.736,1913.736,עלות מופחתת,0.001363,0.00037,,
1328,9758.0,ערד בקרן פנסיה מקיפה חדשה,ערד 8842 01.09.2031,71123434.0,2016-09-01,5.202241548824109,צמוד למדד המחירים לצרכן,2031-09-01,0.048,0.0485,956026.71,119.788918,1145.214,1145.214,עלות מופחתת,0.000815,0.000221,,
1328,9758.0,ערד בקרן פנסיה מקיפה חדשה,ערד 8852 01.07.2032,71123921.0,2017-07-01,5.778463659857551,צמוד למדד המחירים לצרכן,2032-07-01,0.048,0.0485,2909200.91,120.649978,3509.95,3509.95,עלות מופחתת,0.0025,0.00068,,
1328,9758.0,ערד בקרן פנסיה מקיפה חדשה,ערד 8860 01.03.2033,71124358.0,2018-03-01,6.303496951908582,צמוד למדד המחירים לצרכן,2033-03-01,0.048,0.0485,4314899.27,120.636282,5205.334,5205.334,עלות מופחתת,0.003707,0.001008,,
1328,9758.0,ערד בקרן פנסיה מקיפה חדשה,ערד 8864 01.07.2033,71124556.0,2018-07-01,6.4867478728178005,צמוד למדד המחירים לצרכן,2033-07-01,0.048,0.0485,4664868.81,120.053881,5600.356,5600.356,עלות מופחתת,0.003989,0.001085,,
1328,9758.0,ערד בקרן פנסיה מקיפה חדשה,ערד 8893 01.01.2036,71126239.0,2021-01-01,8.116321417377012,צמוד למדד המחירים לצרכן,2036-01-01,0.048,0.0485,58427073.88,120.051509,70142.584,70142.584,עלות מופחתת,0.049965,0.013592,,
1328,9758.0,ערד בקרן פנסיה מקיפה חדשה,ערד 8876 01.07.2034,71125272.0,2019-07-01,7.1620171531614085,צמוד למדד המחירים לצרכן,2034-07-01,0.048,0.0485,13281635.23,118.280838,15709.629,15709.629,עלות מופחתת,0.01119,0.003044,,
1328,9758.0,ערד בקרן פנסיה מקיפה חדשה,ערד 8895 01.03.2036,71126320.0,2021-03-01,8.282988084043675,צמוד למדד המחירים לצרכן,2036-03-01,0.048,0.0485,40496765.1,119.323496,48322.156,48322.156,עלות מופחתת,0.034422,0.009363,,
1328,9758.0,ערד בקרן פנסיה מקיפה חדשה,ערד 8789 01.04.2027,71116701.0,2012-04-01,1.4335201532975232,צמוד למדד המחירים לצרכן,2027-04-01,0.048,0.0485,160813.91,125.441503,201.727,201.727,עלות מופחתת,0.000143,3.9e-05,,
1328,9758.0,ערד בקרן פנסיה מקיפה חדשה,ערד 8901 01.09.2036,71126593.0,2021-09-01,8.586184120226578,צמוד למדד המחירים לצרכן,2036-09-01,0.048,0.0485,41391553.46,116.86201,48371.001,48371.001,עלות מופחתת,0.034456,0.009373,,
1328,9758.0,ערד בקרן פנסיה מקיפה חדשה,ערד 8773 01.12.2025,71116743.0,2010-12-01,0.16944444444444448,צמוד למדד המחירים לצרכן,2025-12-01,0.048,0.0481,35553.66,127.7514,45.42,45.42,עלות מופחתת,3.2e-05,8e-06,,
1328,9758.0,ערד בקרן פנסיה מקיפה חדשה,ערד 8775 01.02.2026,71116768.0,2011-02-01,0.33611111111111114,צמוד למדד המחירים לצרכן,2026-02-01,0.048,0.0483,41500.36,126.155869,52.355,52.355,עלות מופחתת,3.7e-05,1e-05,,
1328,9758.0,ערד בקרן פנסיה מקיפה חדשה,ערד 8800 01.03.2028,71120687.0,2013-09-01,2.748920787877731,צמוד למדד המחירים לצרכן,2028-09-01,0.048,0.0485,154108.06,119.073236,183.501,183.501,עלות מופחתת,0.00013,3.5e-05,,
1328,9758.0,ערד בקרן פנסיה מקיפה חדשה,ערד 8781 01.08.2026,71118616.0,2011-08-01,0.824390125947164,צמוד למדד המחירים לצרכן,2026-08-01,0.048,0.0484,122603.21,123.475983,151.386,151.386,עלות מופחתת,0.000107,2.9e-05,,
1328,9758.0,ערד בקרן פנסיה מקיפה חדשה,ערד 8771 01.10.2025,71118814.0,2010-10-01,0.0027777777777777683,צמוד למדד המחירים לצרכן,2025-10-01,0.048,0.0479,43651.29,130.091327,56.787,56.787,עלות מופחתת,4e-05,1.1e-05,,
1328,9758.0,ערד בקרן פנסיה מקיפה חדשה,ערד 8817 01.08.2029,71121701.0,2014-08-01,3.5225847768588836,צמוד למדד המחירים לצרכן,2029-08-01,0.048,0.0485,264691.35,119.323081,315.838,315.838,עלות מופחתת,0.000224,6.1e-05,,
1328,9758.0,ערד בקרן פנסיה מקיפה חדשה,ערד 8814 01.05.2029,71121677.0,2014-05-01,3.2725847768588836,צמוד למדד המחירים לצרכן,2029-05-01,0.048,0.0485,337570.04,121.348526,409.636,409.636,עלות מופחתת,0.000291,7.9e-05,,
1328,9758.0,ערד בקרן פנסיה מקיפה חדשה,ערד 8776 01.03.2026,71116776.0,2011-03-01,0.41944444444444445,צמוד למדד המחירים לצרכן,2026-03-01,0.048,0.0484,38590.27,125.387852,48.388,48.388,עלות מופחתת,3.4e-05,9e-06,,
1328,9758.0,ערד בקרן פנסיה מקיפה חדשה,ערד 8798 01.01.2028,71120596.0,2013-01-01,2.1382267038020437,צמוד למדד המחירים לצרכן,2028-01-01,0.048,0.0485,329472.41,122.212735,402.657,402.657,עלות מופחתת,0.000286,7.8e-05,,
1328,9758.0,ערד בקרן פנסיה מקיפה חדשה,ערד 8803 01.06.2028,71121057.0,2013-06-01,2.498920787877731,צמוד למדד המחירים לצרכן,2028-06-01,0.048,0.0485,296322.73,121.941587,361.341,361.341,עלות מופחתת,0.000257,7e-05,,
1328,9758.0,ערד בקרן פנסיה מקיפה חדשה,ערד 8865 01.08.2033,71124580.0,2018-08-01,6.570081206151133,צמוד למדד המחירים לצרכן,2033-08-01,0.048,0.0485,7118324.87,119.452208,8502.996,8502.996,עלות מופחתת,0.006057,0.001647,,
1328,9758.0,ערד בקרן פנסיה מקיפה חדשה,ערד 8848 01.03.2032,71123673.0,2017-03-01,5.578113717401076,צמוד למדד המחירים לצרכן,2032-03-01,0.048,0.0485,2559104.84,120.75716,3090.302,3090.302,עלות מופחתת,0.002201,0.000598,,
1328,9758.0,ערד בקרן פנסיה מקיפה חדשה,ערד 8818 01.09.2029,71121750.0,2014-09-01,3.6059181101922166,צמוד למדד המחירים לצרכן,2029-09-01,0.048,0.0485,551777.72,118.724388,655.095,655.095,עלות מופחתת,0.000466,0.000126,,
1328,9758.0,ערד בקרן פנסיה מקיפה חדשה,ערד 8808 01.11.2028,71121297.0,2013-11-01,2.8491820792187337,צמוד למדד המחירים לצרכן,2028-11-01,0.048,0.0485,548741.11,120.755425,662.635,662.635,עלות מופחתת,0.000472,0.000128,,
1328,9758.0,ערד בקרן פנסיה מקיפה חדשה,ערד 8899 01.07.2036,71126460.0,2021-07-01,8.419517453559914,צמוד למדד המחירים לצרכן,2036-07-01,0.048,0.0485,53297097.31,118.392711,63099.879,63099.879,עלות מופחתת,0.044948,0.012227,,
1328,9758.0,ערד בקרן פנסיה מקיפה חדשה,ערד 8880 01.11.2034,71125405.0,2019-11-01,7.3210817918558515,צמוד למדד המחירים לצרכן,2034-11-01,0.048,0.0485,17418513.12,120.282907,20951.494,20951.494,עלות מופחתת,0.014924,0.004059,,
1328,9758.0,ערד בקרן פנסיה מקיפה חדשה,ערד 8839 01.06.2031,71123301.0,2016-06-01,4.95224154882411,צמוד למדד המחירים לצרכן,2031-06-01,0.048,0.0485,826211.54,122.463483,1011.807,1011.807,עלות מופחתת,0.00072,0.000196,,
1328,9758.0,ערד בקרן פנסיה מקיפה חדשה,ערד 8826 01.05.2030,71122535.0,2015-05-01,4.089751150341647,צמוד למדד המחירים לצרכן,2030-05-01,0.048,0.0485,513567.02,122.581567,629.539,629.539,עלות מופחתת,0.000448,0.000121,,
1328,9758.0,ערד בקרן פנסיה מקיפה חדשה,ערד 8856 01.11.2032,71124119.0,2017-11-01,5.970163618575247,צמוד למדד המחירים לצרכן,2032-11-01,0.048,0.0485,4203556.82,122.091348,5132.179,5132.179,עלות מופחתת,0.003655,0.000994,,
1328,9758.0,ערד בקרן פנסיה מקיפה חדשה,ערד 8844 01.11.2031,71123525.0,2016-11-01,5.244780384067743,צמוד למדד המחירים לצרכן,2031-11-01,0.048,0.0485,1057879.74,122.210482,1292.84,1292.84,עלות מופחתת,0.00092,0.00025,,
1328,9758.0,ערד בקרן פנסיה מקיפה חדשה,ערד 8861 01.04.2033,71124432.0,2018-04-01,6.2367478728178,צמוד למדד המחירים לצרכן,2033-04-01,0.048,0.0485,4066909.28,122.931274,4999.503,4999.503,עלות מופחתת,0.003561,0.000968,,
1328,9758.0,ערד בקרן פנסיה מקיפה חדשה,ערד 8858 01.01.2033,71124267.0,2018-01-01,6.136830285241914,צמוד למדד המחירים לצרכן,2033-01-01,0.048,0.0485,5051404.23,121.131135,6118.823,6118.823,עלות מופחתת,0.004358,0.001185,,
1328,9758.0,ערד בקרן פנסיה מקיפה חדשה,ערד 8867 01.10.2033,71124648.0,2018-10-01,6.5784128363239835,צמוד למדד המחירים לצרכן,2033-10-01,0.048,0.0485,2625530.73,121.233998,3183.036,3183.036,עלות מופחתת,0.002267,0.000616,,
1328,9758.0,ערד בקרן פנסיה מקיפה חדשה,ערד 8866 01.09.2033,71124630.0,2018-09-01,6.653414539484467,צמוד למדד המחירים לצרכן,2033-09-01,0.048,0.0485,7301280.74,118.969048,8686.264,8686.264,עלות מופחתת,0.006187,0.001683,,
1328,9758.0,ערד בקרן פנסיה מקיפה חדשה,ערד 8877 01.08.2034,71125314.0,2019-08-01,7.2453504864947424,צמוד למדד המחירים לצרכן,2034-08-01,0.048,0.0485,15017312.1,118.503479,17796.037,17796.037,עלות מופחתת,0.012676,0.003448,,
1328,9758.0,ערד בקרן פנסיה מקיפה חדשה,ערד 8869 01.12.2033,71124697.0,2018-12-01,6.7450795029906505,צמוד למדד המחירים לצרכן,2033-12-01,0.048,0.0485,7185383.38,119.811572,8608.921,8608.921,עלות מופחתת,0.006132,0.001668,,
1328,9758.0,ערד בקרן פנסיה מקיפה חדשה,ערד 8887 01.07.2035,71125678.0,2020-07-01,7.805790137812206,צמוד למדד המחירים לצרכן,2035-07-01,0.048,0.0485,20848239.96,120.17144,25053.63,25053.63,עלות מופחתת,0.017846,0.004854,,
1328,9758.0,ערד בקרן פנסיה מקיפה חדשה,ערד 8883 01.02.2035,71125488.0,2020-02-01,7.5710817918558515,צמוד למדד המחירים לצרכן,2035-02-01,0.048,0.0485,20517375.77,118.856167,24386.167,24386.167,עלות מופחתת,0.017371,0.004725,,
1328,9758.0,ערד בקרן פנסיה מקיפה חדשה,ערד 8903 01.11.2036,71126718.0,2021-11-01,8.548882753431949,צמוד למדד המחירים לצרכן,2036-11-01,0.048,0.0485,56141011.07,118.164734,66338.876,66338.876,עלות מופחתת,0.047256,0.012855,,
1328,9759.0,ערד בקרן פנסיה מקיפה חדשה,ערד 8903 01.11.2036,71126718.0,2021-11-01,8.548882753431949,צמוד למדד המחירים לצרכן,2036-11-01,0.048,0.0485,25082645.35,118.164734,29638.841,29638.841,עלות מופחתת,0.047087,0.01304,,
1328,9759.0,ערד בקרן פנסיה מקיפה חדשה,ערד 8887 01.07.2035,71125678.0,2020-07-01,7.805790137812206,צמוד למדד המחירים לצרכן,2035-07-01,0.048,0.0485,9314563.44,120.17144,11193.445,11193.445,עלות מופחתת,0.017782,0.004924,,
1328,9759.0,ערד בקרן פנסיה מקיפה חדשה,ערד 8883 01.02.2035,71125488.0,2020-02-01,7.5710817918558515,צמוד למדד המחירים לצרכן,2035-02-01,0.048,0.0485,9166740.14,118.856167,10895.236,10895.236,עלות מופחתת,0.017309,0.004793,,
1328,9759.0,ערד בקרן פנסיה מקיפה חדשה,ערד 8869 01.12.2033,71124697.0,2018-12-01,6.7450795029906505,צמוד למדד המחירים לצרכן,2033-12-01,0.048,0.0485,3210281.03,119.811572,3846.288,3846.288,עלות מופחתת,0.00611,0.001692,,
1328,9759.0,ערד בקרן פנסיה מקיפה חדשה,ערד 8877 01.08.2034,71125314.0,2019-08-01,7.2453504864947424,צמוד למדד המחירים לצרכן,2034-08-01,0.048,0.0485,6709425.18,118.503479,7950.902,7950.902,עלות מופחתת,0.012631,0.003498,,
1328,9759.0,ערד בקרן פנסיה מקיפה חדשה,ערד 8866 01.09.2033,71124630.0,2018-09-01,6.653414539484467,צמוד למדד המחירים לצרכן,2033-09-01,0.048,0.0485,3262061.58,118.969048,3880.844,3880.844,עלות מופחתת,0.006165,0.001707,,
1328,9759.0,ערד בקרן פנסיה מקיפה חדשה,ערד 8867 01.10.2033,71124648.0,2018-10-01,6.5784128363239835,צמוד למדד המחירים לצרכן,2033-10-01,0.048,0.0485,1173032.96,121.233998,1422.115,1422.115,עלות מופחתת,0.002259,0.000625,,
1328,9759.0,ערד בקרן פנסיה מקיפה חדשה,ערד 8861 01.04.2033,71124432.0,2018-04-01,6.2367478728178,צמוד למדד המחירים לצרכן,2033-04-01,0.048,0.0485,1817011.15,122.931274,2233.675,2233.675,עלות מופחתת,0.003548,0.000982,,
1328,9759.0,ערד בקרן פנסיה מקיפה חדשה,ערד 8858 01.01.2033,71124267.0,2018-01-01,6.136830285241914,צמוד למדד המחירים לצרכן,2033-01-01,0.048,0.0485,2256863.18,121.131135,2733.764,2733.764,עלות מופחתת,0.004343,0.001202,,
1328,9759.0,ערד בקרן פנסיה מקיפה חדשה,ערד 8856 01.11.2032,71124119.0,2017-11-01,5.970163618575247,צמוד למדד המחירים לצרכן,2032-11-01,0.048,0.0485,1878062.45,122.091348,2292.952,2292.952,עלות מופחתת,0.003642,0.001008,,
1328,9759.0,ערד בקרן פנסיה מקיפה חדשה,ערד 8844 01.11.2031,71123525.0,2016-11-01,5.244780384067743,צמוד למדד המחירים לצרכן,2031-11-01,0.048,0.0485,472638.84,122.210482,577.614,577.614,עלות מופחתת,0.000917,0.000254,,
1328,9759.0,ערד בקרן פנסיה מקיפה חדשה,ערד 8839 01.06.2031,71123301.0,2016-06-01,4.95224154882411,צמוד למדד המחירים לצרכן,2031-06-01,0.048,0.0485,369134.26,122.463483,452.055,452.055,עלות מופחתת,0.000718,0.000198,,
1328,9759.0,ערד בקרן פנסיה מקיפה חדשה,ערד 8880 01.11.2034,71125405.0,2019-11-01,7.3210817918558515,צמוד למדד המחירים לצרכן,2034-11-01,0.048,0.0485,7782232.25,120.282907,9360.695,9360.695,עלות מופחתת,0.014871,0.004118,,
1328,9759.0,ערד בקרן פנסיה מקיפה חדשה,ערד 8899 01.07.2036,71126460.0,2021-07-01,8.419517453559914,צמוד למדד המחירים לצרכן,2036-07-01,0.048,0.0485,23812043.37,118.392711,28191.724,28191.724,עלות מופחתת,0.044788,0.012403,,
1328,9759.0,ערד בקרן פנסיה מקיפה חדשה,ערד 8818 01.09.2029,71121750.0,2014-09-01,3.6059181101922166,צמוד למדד המחירים לצרכן,2029-09-01,0.048,0.0485,246522.9,118.724388,292.683,292.683,עלות מופחתת,0.000464,0.000128,,
1328,9759.0,ערד בקרן פנסיה מקיפה חדשה,ערד 8826 01.05.2030,71122535.0,2015-05-01,4.089751150341647,צמוד למדד המחירים לצרכן,2030-05-01,0.048,0.0485,229451.14,122.581567,281.265,281.265,עלות מופחתת,0.000446,0.000123,,
1328,9759.0,ערד בקרן פנסיה מקיפה חדשה,ערד 8808 01.11.2028,71121297.0,2013-11-01,2.8491820792187337,צמוד למדד המחירים לצרכן,2028-11-01,0.048,0.0485,245166.2,120.755425,296.051,296.051,עלות מופחתת,0.00047,0.00013,,
1328,9759.0,ערד בקרן פנסיה מקיפה חדשה,ערד 8848 01.03.2032,71123673.0,2017-03-01,5.578113717401076,צמוד למדד המחירים לצרכן,2032-03-01,0.048,0.0485,1143355.24,120.75716,1380.683,1380.683,עלות מופחתת,0.002193,0.000607,,
1328,9759.0,ערד בקרן פנסיה מקיפה חדשה,ערד 8865 01.08.2033,71124580.0,2018-08-01,6.570081206151133,צמוד למדד המחירים לצרכן,2033-08-01,0.048,0.0485,3180320.67,119.452208,3798.963,3798.963,עלות מופחתת,0.006035,0.001671,,
1328,9759.0,ערד בקרן פנסיה מקיפה חדשה,ערד 8803 01.06.2028,71121057.0,2013-06-01,2.498920787877731,צמוד למדד המחירים לצרכן,2028-06-01,0.048,0.0485,132390.88,121.941587,161.44,161.44,עלות מופחתת,0.000256,7.1e-05,,
1328,9759.0,ערד בקרן פנסיה מקיפה חדשה,ערד 8798 01.01.2028,71120596.0,2013-01-01,2.1382267038020437,צמוד למדד המחירים לצרכן,2028-01-01,0.048,0.0485,147201.47,122.212735,179.899,179.899,עלות מופחתת,0.000285,7.9e-05,,
1328,9759.0,ערד בקרן פנסיה מקיפה חדשה,ערד 8817 01.08.2029,71121701.0,2014-08-01,3.5225847768588836,צמוד למדד המחירים לצרכן,2029-08-01,0.048,0.0485,118258.63,119.323081,141.11,141.11,עלות מופחתת,0.000224,6.2e-05,,
1328,9759.0,ערד בקרן פנסיה מקיפה חדשה,ערד 8771 01.10.2025,71118814.0,2010-10-01,0.0027777777777777683,צמוד למדד המחירים לצרכן,2025-10-01,0.048,0.0479,19502.49,130.091327,25.371,25.371,עלות מופחתת,4e-05,1.1e-05,,
1328,9759.0,ערד בקרן פנסיה מקיפה חדשה,ערד 8814 01.05.2029,71121677.0,2014-05-01,3.2725847768588836,צמוד למדד המחירים לצרכן,2029-05-01,0.048,0.0485,150819.33,121.348526,183.017,183.017,עלות מופחתת,0.00029,8e-05,,
1328,9759.0,ערד בקרן פנסיה מקיפה חדשה,ערד 8776 01.03.2026,71116776.0,2011-03-01,0.41944444444444445,צמוד למדד המחירים לצרכן,2026-03-01,0.048,0.0484,17241.34,125.387852,21.619,21.619,עלות מופחתת,3.4e-05,9e-06,,
1328,9759.0,ערד בקרן פנסיה מקיפה חדשה,ערד 8781 01.08.2026,71118616.0,2011-08-01,0.824390125947164,צמוד למדד המחירים לצרכן,2026-08-01,0.048,0.0484,54776.58,123.475983,67.636,67.636,עלות מופחתת,0.000107,2.9e-05,,
1328,9759.0,ערד בקרן פנסיה מקיפה חדשה,ערד 8800 01.03.2028,71120687.0,2013-09-01,2.748920787877731,צמוד למדד המחירים לצרכן,2028-09-01,0.048,0.0485,68852.3,119.073236,81.985,81.985,עלות מופחתת,0.00013,3.6e-05,,
1328,9759.0,ערד בקרן פנסיה מקיפה חדשה,ערד 8775 01.02.2026,71116768.0,2011-02-01,0.33611111111111114,צמוד למדד המחירים לצרכן,2026-02-01,0.048,0.0483,18541.5,126.155869,23.391,23.391,עלות מופחתת,3.7e-05,1e-05,,
1328,9759.0,ערד בקרן פנסיה מקיפה חדשה,ערד 8773 01.12.2025,71116743.0,2010-12-01,0.16944444444444448,צמוד למדד המחירים לצרכן,2025-12-01,0.048,0.0481,15884.64,127.7514,20.293,20.293,עלות מופחתת,3.2e-05,8e-06,,
1328,9759.0,ערד בקרן פנסיה מקיפה חדשה,ערד 8789 01.04.2027,71116701.0,2012-04-01,1.4335201532975232,צמוד למדד המחירים לצרכן,2027-04-01,0.048,0.0485,71848.33,125.441503,90.128,90.128,עלות מופחתת,0.000143,3.9e-05,,
1328,9759.0,ערד בקרן פנסיה מקיפה חדשה,ערד 8895 01.03.2036,71126320.0,2021-03-01,8.282988084043675,צמוד למדד המחירים לצרכן,2036-03-01,0.048,0.0485,18093119.05,119.323496,21589.342,21589.342,עלות מופחתת,0.034298,0.009498,,
1328,9759.0,ערד בקרן פנסיה מקיפה חדשה,ערד 8901 01.09.2036,71126593.0,2021-09-01,8.586184120226578,צמוד למדד המחירים לצרכן,2036-09-01,0.048,0.0485,18492892.03,116.86201,21611.165,21611.165,עלות מופחתת,0.034333,0.009508,,
1328,9759.0,ערד בקרן פנסיה מקיפה חדשה,ערד 8876 01.07.2034,71125272.0,2019-07-01,7.1620171531614085,צמוד למדד המחירים לצרכן,2034-07-01,0.048,0.0485,5933960.57,118.280838,7018.738,7018.738,עלות מופחתת,0.01115,0.003088,,
1328,9759.0,ערד בקרן פנסיה מקיפה חדשה,ערד 8893 01.01.2036,71126239.0,2021-01-01,8.116321417377012,צמוד למדד המחירים לצרכן,2036-01-01,0.048,0.0485,26104011.05,120.051509,31338.259,31338.259,עלות מופחתת,0.049786,0.013787,,
1328,9759.0,ערד בקרן פנסיה מקיפה חדשה,ערד 8860 01.03.2033,71124358.0,2018-03-01,6.303496951908582,צמוד למדד המחירים לצרכן,2033-03-01,0.048,0.0485,1927807.96,120.636282,2325.636,2325.636,עלות מופחתת,0.003694,0.001023,,
1328,9759.0,ערד בקרן פנסיה מקיפה חדשה,ערד 8864 01.07.2033,71124556.0,2018-07-01,6.4867478728178005,צמוד למדד המחירים לצרכן,2033-07-01,0.048,0.0485,2084167.13,120.053881,2502.124,2502.124,עלות מופחתת,0.003975,0.0011,,
1328,9759.0,ערד בקרן פנסיה מקיפה חדשה,ערד 8850 01.05.2032,71123749.0,2017-05-01,5.611796993190885,צמוד למדד המחירים לצרכן,2032-05-01,0.048,0.0485,1217916.97,122.335286,1489.942,1489.942,עלות מופחתת,0.002367,0.000655,,
1328,9759.0,ערד בקרן פנסיה מקיפה חדשה,ערד 8852 01.07.2032,71123921.0,2017-07-01,5.778463659857551,צמוד למדד המחירים לצרכן,2032-07-01,0.048,0.0485,1299770.94,120.649978,1568.173,1568.173,עלות מופחתת,0.002491,0.000689,,
1328,9759.0,ערד בקרן פנסיה מקיפה חדשה,ערד 8841 01.08.2031,71123368.0,2016-08-01,5.118908215490776,צמוד למדד המחירים לצרכן,2031-08-01,0.048,0.0485,708025.53,120.760879,855.018,855.018,עלות מופחתת,0.001358,0.000376,,
1328,9759.0,ערד בקרן פנסיה מקיפה חדשה,ערד 8842 01.09.2031,71123434.0,2016-09-01,5.202241548824109,צמוד למדד המחירים לצרכן,2031-09-01,0.048,0.0485,427133.0,119.788918,511.658,511.658,עלות מופחתת,0.000812,0.000225,,
1328,9759.0,ערד בקרן פנסיה מקיפה חדשה,ערד 8832 01.11.2030,71122741.0,2015-11-01,4.4839701826131,צמוד למדד המחירים לצרכן,2030-11-01,0.048,0.0485,521310.29,121.719184,634.535,634.535,עלות מופחתת,0.001008,0.000279,,
1328,9759.0,ערד בקרן פנסיה מקיפה חדשה,ערד 8834 01.01.2031,71122931.0,2016-01-01,4.650636849279767,צמוד למדד המחירים לצרכן,2031-01-01,0.048,0.0485,137704.6,121.127105,166.798,166.798,עלות מופחתת,0.000264,7.3e-05,,
1328,9759.0,ערד בקרן פנסיה מקיפה חדשה,ערד 8816 01.07.2029,71121693.0,2014-07-01,3.4392514435255492,צמוד למדד המחירים לצרכן,2029-07-01,0.048,0.0485,190502.67,120.158088,228.904,228.904,עלות מופחתת,0.000363,0.0001,,
1328,9759.0,ערד בקרן פנסיה מקיפה חדשה,ערד 8822 01.01.2030,71122402.0,2015-01-01,3.85269771710978,צמוד למדד המחירים לצרכן,2030-01-01,0.048,0.0485,169586.95,120.040402,203.573,203.573,עלות מופחתת,0.000323,8.9e-05,,
1328,9759.0,ערד בקרן פנסיה מקיפה חדשה,ערד 8792 01.07.2027,71119747.0,2012-07-01,1.6835201532975237,צמוד למדד המחירים לצרכן,2027-07-01,0.048,0.0485,63312.46,122.444858,77.523,77.523,עלות מופחתת,0.000123,3.4e-05,,
1328,9759.0,ערד בקרן פנסיה מקיפה חדשה,ערד 8801 01.04.2028,71120935.0,2013-04-01,2.332254121211065,צמוד למדד המחירים לצרכן,2028-04-01,0.048,0.0485,308704.78,123.639692,381.682,381.682,עלות מופחתת,0.000606,0.000167,,
1328,9759.0,ערד בקרן פנסיה מקיפה חדשה,ערד 8897 01.05.2036,71126395.0,2021-05-01,8.252850786893246,צמוד למדד המחירים לצרכן,2036-05-01,0.048,0.0485,28175911.39,120.161553,33856.613,33856.613,עלות מופחתת,0.053787,0.014895,,
1328,9759.0,ערד בקרן פנסיה מקיפה חדשה,ערד 8900 01.08.2036,71126544.0,2021-08-01,8.502850786893246,צמוד למדד המחירים לצרכן,2036-08-01,0.048,0.0485,11245650.08,117.799478,13247.317,13247.317,עלות מופחתת,0.021045,0.005828,,
1328,9759.0,ערד בקרן פנסיה מקיפה חדשה,ערד 8881 01.12.2034,71125421.0,2019-12-01,7.404415125189185,צמוד למדד המחירים לצרכן,2034-12-01,0.048,0.0485,7742888.08,119.328631,9239.482,9239.482,עלות מופחתת,0.014678,0.004065,,
1328,9759.0,ערד בקרן פנסיה מקיפה חדשה,ערד 8888 01.08.2035,71125702.0,2020-08-01,7.889123471145539,צמוד למדד המחירים לצרכן,2035-08-01,0.048,0.0485,15977634.86,119.807017,19142.328,19142.328,עלות מופחתת,0.030411,0.008422,,
1328,9759.0,ערד בקרן פנסיה מקיפה חדשה,ערד 8874 01.05.2034,71125132.0,2019-05-01,6.995350486494741,צמוד למדד המחירים לצרכן,2034-05-01,0.048,0.0485,5204284.44,120.402353,6266.081,6266.081,עלות מופחתת,0.009954,0.002756,,
1328,9759.0,ערד בקרן פנסיה מקיפה חדשה,ערד 8863 01.06.2033,71124499.0,2018-06-01,6.4034145394844675,צמוד למדד המחירים לצרכן,2033-06-01,0.048,0.0485,2955222.25,121.120338,3579.375,3579.375,עלות מופחתת,0.005686,0.001574,,
1328,9759.0,ערד בקרן פנסיה מקיפה חדשה,ערד 8823 01.02.2030,71122410.0,2015-02-01,3.9360310504431135,צמוד למדד המחירים לצרכן,2030-02-01,0.048,0.0485,284962.61,119.556818,340.692,340.692,עלות מופחתת,0.000541,0.000149,,
1328,9759.0,ערד בקרן פנסיה מקיפה חדשה,ערד 8849 01.04.2032,71123731.0,2017-04-01,5.528463659857552,צמוד למדד המחירים לצרכן,2032-04-01,0.048,0.0485,1258448.25,123.17763,1550.127,1550.127,עלות מופחתת,0.002462,0.000682,,
1328,9759.0,ערד בקרן פנסיה מקיפה חדשה,ערד 8855 01.10.2032,71124093.0,2017-10-01,5.886830285241915,צמוד למדד המחירים לצרכן,2032-10-01,0.048,0.0485,1787672.6,122.685902,2193.222,2193.222,עלות מופחתת,0.003484,0.000964,,
1328,9759.0,ערד בקרן פנסיה מקיפה חדשה,ערד 8825 01.04.2030,71122501.0,2015-04-01,4.006417817008313,צמוד למדד המחירים לצרכן,2030-04-01,0.048,0.0485,349801.35,123.430488,431.762,431.762,עלות מופחתת,0.000685,0.000189,,
1328,9759.0,ערד בקרן פנסיה מקיפה חדשה,ערד 8815 01.06.2029,71121685.0,2014-06-01,3.355918110192216,צמוד למדד המחירים לצרכן,2029-06-01,0.048,0.0485,269021.43,120.744908,324.83,324.83,עלות מופחתת,0.000516,0.000142,,
1328,9759.0,ערד בקרן פנסיה מקיפה חדשה,ערד 8820 01.11.2029,71121776.0,2014-11-01,3.686031050443114,צמוד למדד המחירים לצרכן,2029-11-01,0.048,0.0485,203447.81,121.110588,246.397,246.397,עלות מופחתת,0.000391,0.000108,,
1328,9759.0,ערד בקרן פנסיה מקיפה חדשה,ערד 8813 01.04.2029,71121669.0,2014-04-01,3.18925144352555,צמוד למדד המחירים לצרכן,2029-04-01,0.048,0.0485,177557.54,122.177942,216.936,216.936,עלות מופחתת,0.000344,9.5e-05,,
1328,9759.0,ערד בקרן פנסיה מקיפה חדשה,ערד 8802 01.05.2028,71121016.0,2013-05-01,2.415587454544398,צמוד למדד המחירים לצרכן,2028-05-01,0.048,0.0485,127812.03,122.918209,157.104,157.104,עלות מופחתת,0.000249,6.9e-05,,
1328,9759.0,ערד בקרן פנסיה מקיפה חדשה,ערד 8793 01.08.2027,71119846.0,2012-08-01,1.766853486630857,צמוד למדד המחירים לצרכן,2027-08-01,0.048,0.0485,108422.59,122.300021,132.601,132.601,עלות מופחתת,0.00021,5.8e-05,,
1328,9759.0,ערד בקרן פנסיה מקיפה חדשה,ערד 8799 01.02.2028,71120612.0,2013-02-01,2.221560037135377,צמוד למדד המחירים לצרכן,2028-02-01,0.048,0.0485,90785.54,121.490087,110.295,110.295,עלות מופחתת,0.000175,4.8e-05,,
1328,9759.0,ערד בקרן פנסיה מקיפה חדשה,ערד 8777 01.04.2026,71118822.0,2011-04-01,0.49105623382604097,צמוד למדד המחירים לצרכן,2026-04-01,0.048,0.0485,40135.57,127.526063,51.183,51.183,עלות מופחתת,8.1e-05,2.2e-05,,
1328,9759.0,ערד בקרן פנסיה מקיפה חדשה,ערד 8788 01.03.2027,71116727.0,2012-03-01,1.384549207576438,צמוד למדד המחירים לצרכן,2027-03-01,0.048,0.0485,75579.25,122.976548,92.945,92.945,עלות מופחתת,0.000147,4e-05,,
1328,9759.0,ערד בקרן פנסיה מקיפה חדשה,ערד 8905 01.01.2037,71126981.0,2022-01-01,8.715549420098617,צמוד למדד המחירים לצרכן,2037-01-01,0.048,0.0485,11669334.82,117.235403,13680.592,13680.592,עלות מופחתת,0.021734,0.006019,,
1328,9759.0,ערד בקרן פנסיה מקיפה חדשה,ערד 8898 01.06.2036,71126445.0,2021-06-01,8.336184120226578,צמוד למדד המחירים לצרכן,2036-06-01,0.048,0.0485,17111606.29,119.325448,20418.501,20418.501,עלות מופחתת,0.032438,0.008983,,
1328,9759.0,ערד בקרן פנסיה מקיפה חדשה,ערד 8890 01.10.2035,71126106.0,2020-10-01,7.8663214173770095,צמוד למדד המחירים לצרכן,2035-10-01,0.048,0.0485,7011289.96,121.471191,8516.697,8516.697,עלות מופחתת,0.01353,0.003747,,
1328,9759.0,ערד בקרן פנסיה מקיפה חדשה,ערד 8884 01.03.2035,71125512.0,2020-03-01,7.654415125189185,צמוד למדד המחירים לצרכן,2035-03-01,0.048,0.0485,6125706.89,118.847034,7280.221,7280.221,עלות מופחתת,0.011566,0.003203,,
1328,9759.0,ערד בקרן פנסיה מקיפה חדשה,ערד 8882 01.01.2035,71125454.0,2020-01-01,7.48774845852252,צמוד למדד המחירים לצרכן,2035-01-01,0.048,0.0485,10537228.85,119.336917,12574.804,12574.804,עלות מופחתת,0.019977,0.005532,,
1328,9759.0,ערד בקרן פנסיה מקיפה חדשה,ערד 8879 01.10.2034,71125389.0,2019-10-01,7.2377484585225185,צמוד למדד המחירים לצרכן,2034-10-01,0.048,0.0485,6700832.78,120.509043,8075.109,8075.109,עלות מופחתת,0.012828,0.003552,,
1328,9759.0,ערד בקרן פנסיה מקיפה חדשה,ערד 8873 01.04.2034,71125108.0,2019-04-01,6.912017153161408,צמוד למדד המחירים לצרכן,2034-04-01,0.048,0.0485,3000445.44,121.471191,3644.677,3644.677,עלות מופחתת,0.00579,0.001603,,
1328,9759.0,ערד בקרן פנסיה מקיפה חדשה,ערד 8859 01.02.2033,71124325.0,2018-02-01,6.220163618575248,צמוד למדד המחירים לצרכן,2033-02-01,0.048,0.0485,3568448.68,120.522995,4300.801,4300.801,עלות מופחתת,0.006832,0.001892,,
1328,9759.0,ערד בקרן פנסיה מקיפה חדשה,ערד 8872 01.03.2034,71124986.0,2019-03-01,6.99507950299065,צמוד למדד המחירים לצרכן,2034-03-01,0.048,0.0485,4109600.65,119.203218,4898.776,4898.776,עלות מופחתת,0.007782,0.002155,,
1328,9759.0,ערד בקרן פנסיה מקיפה חדשה,ערד 8854 01.09.2032,71123947.0,2017-09-01,5.945130326524218,צמוד למדד המחירים לצרכן,2032-09-01,0.048,0.0485,2069186.95,120.636282,2496.19,2496.19,עלות מופחתת,0.003965,0.001098,,
1328,9759.0,ערד בקרן פנסיה מקיפה חדשה,ערד 8853 01.08.2032,71123939.0,2017-08-01,5.861796993190884,צמוד למדד המחירים לצרכן,2032-08-01,0.048,0.0485,2029560.13,121.005087,2455.871,2455.871,עלות מופחתת,0.003901,0.00108,,
1328,9759.0,ערד בקרן פנסיה מקיפה חדשה,ערד 8837 01.04.2031,71123129.0,2016-04-01,4.785574882157442,צמוד למדד המחירים לצרכן,2031-04-01,0.048,0.0485,436177.64,123.681618,539.472,539.472,עלות מופחתת,0.000857,0.000237,,
1328,9759.0,ערד בקרן פנסיה מקיפה חדשה,ערד 8830 01.09.2030,71122717.0,2015-09-01,4.423084483674979,צמוד למדד המחירים לצרכן,2030-09-01,0.048,0.0485,158789.91,119.070903,189.073,189.073,עלות מופחתת,0.0003,8.3e-05,,
1328,9759.0,ערד בקרן פנסיה מקיפה חדשה,ערד 8772 01.11.2025,71116735.0,2010-11-01,0.08611111111111114,צמוד למדד המחירים לצרכן,2025-11-01,0.048,0.048,22668.12,128.622996,29.156,29.156,עלות מופחתת,4.6e-05,1.2e-05,,
1328,9759.0,ערד בקרן פנסיה מקיפה חדשה,ערד 8790 01.05.2027,71117162.0,2012-05-01,1.516853486630857,צמוד למדד המחירים לצרכן,2027-05-01,0.048,0.0485,68287.01,124.958178,85.33,85.33,עלות מופחתת,0.000135,3.7e-05,,
1328,9759.0,ערד בקרן פנסיה מקיפה חדשה,ערד 8904 01.12.2036,71126841.0,2021-12-01,8.632216086765283,צמוד למדד המחירים לצרכן,2036-12-01,0.048,0.0485,9599582.58,117.577516,11286.951,11286.951,עלות מופחתת,0.017931,0.004965,,
1328,9759.0,ערד בקרן פנסיה מקיפה חדשה,ערד 8892 01.12.2035,71126163.0,2020-12-01,8.032988084043678,צמוד למדד המחירים לצרכן,2035-12-01,0.048,0.0485,27121985.0,120.279457,32622.176,32622.176,עלות מופחתת,0.051826,0.014352,,
1328,9759.0,ערד בקרן פנסיה מקיפה חדשה,ערד 8886 01.06.2035,71125660.0,2020-06-01,7.722456804478874,צמוד למדד המחירים לצרכן,2035-06-01,0.048,0.0485,13428177.65,120.279457,16151.339,16151.339,עלות מופחתת,0.025659,0.007106,,
1328,9759.0,ערד בקרן פנסיה מקיפה חדשה,ערד 8885 01.05.2035,71125603.0,2020-05-01,7.63912347114554,צמוד למדד המחירים לצרכן,2035-05-01,0.048,0.0485,7356116.77,120.402353,8856.938,8856.938,עלות מופחתת,0.01407,0.003896,,
1328,9759.0,ערד בקרן פנסיה מקיפה חדשה,ערד 8871 01.02.2034,71124945.0,2019-02-01,6.9117461696573175,צמוד למדד המחירים לצרכן,2034-02-01,0.048,0.0485,5717793.73,119.570244,6836.78,6836.78,עלות מופחתת,0.010861,0.003007,,
1328,9759.0,ערד בקרן פנסיה מקיפה חדשה,ערד 8870 01.01.2034,71124796.0,2019-01-01,6.8284128363239835,צמוד למדד המחירים לצרכן,2034-01-01,0.048,0.0485,1389708.55,119.699042,1663.468,1663.468,עלות מופחתת,0.002642,0.000731,,
1328,9759.0,ערד בקרן פנסיה מקיפה חדשה,ערד 8846 01.01.2032,71123616.0,2017-01-01,5.411447050734412,צמוד למדד המחירים לצרכן,2032-01-01,0.048,0.0485,790105.61,121.494528,959.935,959.935,עלות מופחתת,0.001525,0.000422,,
1328,9759.0,ערד בקרן פנסיה מקיפה חדשה,ערד 8851 01.06.2032,71123772.0,2017-06-01,5.695130326524218,צמוד למדד המחירים לצרכן,2032-06-01,0.048,0.0485,1963082.04,121.603371,2387.174,2387.174,עלות מופחתת,0.003792,0.00105,,
1328,9759.0,ערד בקרן פנסיה מקיפה חדשה,ערד 8812 01.03.2029,71121651.0,2014-03-01,3.182515412552067,צמוד למדד המחירים לצרכן,2029-03-01,0.048,0.0485,225720.23,119.541567,269.83,269.83,עלות מופחתת,0.000428,0.000118,,
1328,9759.0,ערד בקרן פנסיה מקיפה חדשה,ערד 8831 01.10.2030,71122725.0,2015-10-01,4.400636849279766,צמוד למדד המחירים לצרכן,2030-10-01,0.048,0.0485,56359.39,121.700731,68.59,68.59,עלות מופחתת,0.000108,3e-05,,
1328,9759.0,ערד בקרן פנסיה מקיפה חדשה,ערד 8805 01.08.2028,71121206.0,2013-08-01,2.665587454544398,צמוד למדד המחירים לצרכן,2028-08-01,0.048,0.0485,177444.48,119.909147,212.772,212.772,עלות מופחתת,0.000338,9.3e-05,,
1328,9759.0,ערד בקרן פנסיה מקיפה חדשה,ערד 8810 01.01.2029,71121438.0,2014-01-01,3.0158487458854,צמוד למדד המחירים לצרכן,2029-01-01,0.048,0.0485,172865.63,119.922945,207.306,207.306,עלות מופחתת,0.000329,9.1e-05,,
1328,9759.0,ערד בקרן פנסיה מקיפה חדשה,ערד 8780 01.07.2026,71118855.0,2011-07-01,0.7410567926138304,צמוד למדד המחירים לצרכן,2026-07-01,0.048,0.0484,31430.11,124.454088,39.116,39.116,עלות מופחתת,6.2e-05,1.7e-05,,
1328,9759.0,ערד בקרן פנסיה מקיפה חדשה,ערד 8791 01.06.2027,71119598.0,2012-06-01,1.6001868199641902,צמוד למדד המחירים לצרכן,2027-06-01,0.048,0.0485,16110.76,122.922215,19.804,19.804,עלות מופחתת,3.1e-05,8e-06,,
1328,9759.0,ערד בקרן פנסיה מקיפה חדשה,ערד 8778 01.05.2026,71118830.0,2011-05-01,0.5743895671593743,צמוד למדד המחירים לצרכן,2026-05-01,0.048,0.0485,15432.41,126.786834,19.566,19.566,עלות מופחתת,3.1e-05,8e-06,,
1328,9759.0,ערד בקרן פנסיה מקיפה חדשה,ערד 8779 01.06.2026,71118848.0,2011-06-01,0.6577234592804972,צמוד למדד המחירים לצרכן,2026-06-01,0.048,0.0484,26625.15,125.545192,33.427,33.427,עלות מופחתת,5.3e-05,1.4e-05,,
1328,9759.0,ערד בקרן פנסיה מקיפה חדשה,ערד 8774 01.01.2026,71116750.0,2011-01-01,0.25277777777777777,צמוד למדד המחירים לצרכן,2026-01-01,0.048,0.0482,32956.39,127.137022,41.9,41.9,עלות מופחתת,6.6e-05,1.8e-05,,
1328,9759.0,ערד בקרן פנסיה מקיפה חדשה,ערד 8896 01.04.2036,71126353.0,2021-04-01,8.169517453559912,צמוד למדד המחירים לצרכן,2036-04-01,0.048,0.0485,22659982.66,121.350083,27497.908,27497.908,עלות מופחתת,0.043685,0.012098,,
1328,9759.0,ערד בקרן פנסיה מקיפה חדשה,ערד 8894 01.02.2036,71126288.0,2021-02-01,8.199654750710344,צמוד למדד המחירים לצרכן,2036-02-01,0.048,0.0485,26134480.17,119.687329,31279.662,31279.662,עלות מופחתת,0.049693,0.013762,,
1328,9759.0,ערד בקרן פנסיה מקיפה חדשה,ערד 8891 01.11.2035,71126130.0,2020-11-01,7.949654750710344,צמוד למדד המחירים לצרכן,2035-11-01,0.048,0.0485,14561018.5,121.124046,17636.895,17636.895,עלות מופחתת,0.028019,0.007759,,
1328,9759.0,ערד בקרן פנסיה מקיפה חדשה,ערד 8889 01.09.2035,71126098.0,2020-09-01,7.972456804478872,צמוד למדד המחירים לצרכן,2035-09-01,0.048,0.0485,19558293.8,119.084253,23290.848,23290.848,עלות מופחתת,0.037002,0.010247,,
1328,9759.0,ערד בקרן פנסיה מקיפה חדשה,ערד 8878 01.09.2034,71125348.0,2019-09-01,7.3286838198280755,צמוד למדד המחירים לצרכן,2034-09-01,0.048,0.0485,4127576.87,118.375418,4886.036,4886.036,עלות מופחתת,0.007762,0.002149,,
1328,9759.0,ערד בקרן פנסיה מקיפה חדשה,ערד 8862 01.05.2033,71124473.0,2018-05-01,6.320081206151133,צמוד למדד המחירים לצרכן,2033-05-01,0.048,0.0485,2348722.78,122.091348,2867.587,2867.587,עלות מופחתת,0.004555,0.001261,,
1328,9759.0,ערד בקרן פנסיה מקיפה חדשה,ערד 8843 01.10.2031,71123517.0,2016-10-01,5.161447050734411,צמוד למדד המחירים לצרכן,2031-10-01,0.048,0.0485,366986.16,122.559506,449.776,449.776,עלות מופחתת,0.000714,0.000197,,
1328,9759.0,ערד בקרן פנסיה מקיפה חדשה,ערד 8838 01.05.2031,71123293.0,2016-05-01,4.868908215490777,צמוד למדד המחירים לצרכן,2031-05-01,0.048,0.0485,461219.98,123.456257,569.405,569.405,עלות מופחתת,0.000904,0.00025,,
1328,9759.0,ערד בקרן פנסיה מקיפה חדשה,ערד 8836 01.03.2031,71123079.0,2016-03-01,4.817303515946432,צמוד למדד המחירים לצרכן,2031-03-01,0.048,0.0485,60994.77,120.882326,73.732,73.732,עלות מופחתת,0.000117,3.2e-05,,
1328,9759.0,ערד בקרן פנסיה מקיפה חדשה,ערד 8833 01.12.2030,71122774.0,2015-12-01,4.567303515946433,צמוד למדד המחירים לצרכן,2030-12-01,0.048,0.0485,250423.4,121.110975,303.29,303.29,עלות מופחתת,0.000481,0.000133,,
1328,9759.0,ערד בקרן פנסיה מקיפה חדשה,ערד 8827 01.06.2030,71122543.0,2015-06-01,4.17308448367498,צמוד למדד המחירים לצרכן,2030-06-01,0.048,0.0485,175974.72,121.354659,213.554,213.554,עלות מופחתת,0.000339,9.3e-05,,
1328,9759.0,ערד בקרן פנסיה מקיפה חדשה,ערד 8829 01.08.2030,71122626.0,2015-08-01,4.339751150341647,צמוד למדד המחירים לצרכן,2030-08-01,0.048,0.0485,408252.32,119.793825,489.061,489.061,עלות מופחתת,0.000776,0.000215,,
1328,9759.0,ערד בקרן פנסיה מקיפה חדשה,ערד 8824 01.03.2030,71122428.0,2015-03-01,4.0193643837764474,צמוד למדד המחירים לצרכן,2030-03-01,0.048,0.0485,436742.93,120.151183,524.752,524.752,עלות מופחתת,0.000833,0.00023,,
1328,9759.0,ערד בקרן פנסיה מקיפה חדשה,ערד 8819 01.10.2029,71121768.0,2014-10-01,3.6026977171097805,צמוד למדד המחירים לצרכן,2029-10-01,0.048,0.0485,192763.83,121.222494,233.673,233.673,עלות מופחתת,0.000371,0.000102,,
1328,9759.0,ערד בקרן פנסיה מקיפה חדשה,ערד 8811 01.02.2029,71121578.0,2014-02-01,3.099182079218734,צמוד למדד המחירים לצרכן,2029-02-01,0.048,0.0485,130073.19,119.323081,155.207,155.207,עלות מופחתת,0.000246,6.8e-05,,
1328,9759.0,ערד בקרן פנסיה מקיפה חדשה,ערד 8797 01.12.2027,71120570.0,2012-12-01,2.0548933704687102,צמוד למדד המחירים לצרכן,2027-12-01,0.048,0.0485,92990.17,122.110465,113.551,113.551,עלות מופחתת,0.00018,4.9e-05,,
1328,9759.0,ערד בקרן פנסיה מקיפה חדשה,ערד 8809 01.12.2028,71121305.0,2013-12-01,2.932515412552067,צמוד למדד המחירים לצרכן,2028-12-01,0.048,0.0485,177783.65,119.921112,213.2,213.2,עלות מופחתת,0.000338,9.3e-05,,
1328,9759.0,ערד בקרן פנסיה מקיפה חדשה,ערד 8804 01.07.2028,71121107.0,2013-07-01,2.582254121211065,צמוד למדד המחירים לצרכן,2028-07-01,0.048,0.0485,66534.61,121.347772,80.738,80.738,עלות מופחתת,0.000128,3.5e-05,,
1328,9759.0,ערד בקרן פנסיה מקיפה חדשה,ערד 8796 01.11.2027,71120448.0,2012-11-01,1.971560037135377,צמוד למדד המחירים לצרכן,2027-11-01,0.048,0.0485,97342.91,122.369591,119.118,119.118,עלות מופחתת,0.000189,5.2e-05,,
1328,9759.0,ערד בקרן פנסיה מקיפה חדשה,ערד 8795 01.10.2027,71120356.0,2012-10-01,1.8882267038020435,צמוד למדד המחירים לצרכן,2027-10-01,0.048,0.0485,94968.69,122.842903,116.662,116.662,עלות מופחתת,0.000185,5.1e-05,,
1328,9759.0,ערד בקרן פנסיה מקיפה חדשה,ערד 8785 01.12.2026,71119127.0,2011-12-01,1.134549207576438,צמוד למדד המחירים לצרכן,2026-12-01,0.048,0.0485,53080.71,124.458743,66.064,66.064,עלות מופחתת,0.000104,2.9e-05,,
1328,9759.0,ערד בקרן פנסיה מקיפה חדשה,ערד 8787 01.02.2027,71116420.0,2012-02-01,1.3012158742431048,צמוד למדד המחירים לצרכן,2027-02-01,0.048,0.0485,66025.85,123.475983,81.526,81.526,עלות מופחתת,0.000129,3.5e-05,,
1328,9759.0,ערד בקרן פנסיה מקיפה חדשה,ערד 8807 01.10.2028,71120950.0,2013-10-01,2.7658487458854006,צמוד למדד המחירים לצרכן,2028-10-01,0.048,0.0485,184227.96,121.459952,223.763,223.763,עלות מופחתת,0.000355,9.8e-05,,
1328,9759.0,ערד בקרן פנסיה מקיפה חדשה,ערד 8794 01.09.2027,71120232.0,2012-09-01,1.85018681996419,צמוד למדד המחירים לצרכן,2027-09-01,0.048,0.0485,82023.55,121.689448,99.814,99.814,עלות מופחתת,0.000158,4.3e-05,,
1328,9759.0,ערד בקרן פנסיה מקיפה חדשה,ערד 8868 01.11.2033,71124689.0,2018-11-01,6.661746169657317,צמוד למדד המחירים לצרכן,2033-11-01,0.048,0.0485,145166.43,120.647903,175.14,175.14,עלות מופחתת,0.000278,7.7e-05,,
1328,9759.0,ערד בקרן פנסיה מקיפה חדשה,ערד 8875 01.06.2034,71125231.0,2019-06-01,7.078683819828075,צמוד למדד המחירים לצרכן,2034-06-01,0.048,0.0485,1963477.75,119.564926,2347.631,2347.631,עלות מופחתת,0.003729,0.001032,,
1328,9759.0,ערד בקרן פנסיה מקיפה חדשה,ערד 8784 01.11.2026,71118905.0,2011-11-01,1.0512158742431044,צמוד למדד המחירים לצרכן,2026-11-01,0.048,0.0485,51497.9,124.958178,64.351,64.351,עלות מופחתת,0.000102,2.8e-05,,
1328,9759.0,ערד בקרן פנסיה מקיפה חדשה,ערד 8857 01.12.2032,71124127.0,2017-12-01,6.053496951908582,צמוד למדד המחירים לצרכן,2032-12-01,0.048,0.0485,1580833.05,121.240736,1916.614,1916.614,עלות מופחתת,0.003044,0.000843,,
1328,9759.0,ערד בקרן פנסיה מקיפה חדשה,ערד 8847 01.02.2032,71123665.0,2017-02-01,5.494780384067743,צמוד למדד המחירים לצרכן,2032-02-01,0.048,0.0485,727867.2,121.005087,880.756,880.756,עלות מופחתת,0.001399,0.000387,,
1328,9759.0,ערד בקרן פנסיה מקיפה חדשה,ערד 8845 01.12.2031,71123533.0,2016-12-01,5.328113717401077,צמוד למדד המחירים לצרכן,2031-12-01,0.048,0.0485,601298.8,121.476869,730.439,730.439,עלות מופחתת,0.00116,0.000321,,
1328,9759.0,ערד בקרן פנסיה מקיפה חדשה,ערד 8840 01.07.2031,71123350.0,2016-07-01,5.035574882157443,צמוד למדד המחירים לצרכן,2031-07-01,0.048,0.0485,164499.34,121.617498,200.06,200.06,עלות מופחתת,0.000317,8.8e-05,,
1328,9759.0,ערד בקרן פנסיה מקיפה חדשה,ערד 8835 01.02.2031,71123061.0,2016-02-01,4.733970182613099,צמוד למדד המחירים לצרכן,2031-02-01,0.048,0.0485,30412.59,120.760879,36.727,36.727,עלות מופחתת,5.8e-05,1.6e-05,,
1328,9759.0,ערד בקרן פנסיה מקיפה חדשה,ערד 8828 01.07.2030,71122550.0,2015-07-01,4.256417817008314,צמוד למדד המחירים לצרכן,2030-07-01,0.048,0.0485,122724.42,120.640651,148.056,148.056,עלות מופחתת,0.000235,6.5e-05,,
1328,9759.0,ערד בקרן פנסיה מקיפה חדשה,ערד 8821 01.12.2029,71121784.0,2014-12-01,3.769364383776447,צמוד למדד המחירים לצרכן,2029-12-01,0.048,0.0485,247936.12,120.272787,298.2,298.2,עלות מופחתת,0.000473,0.000131,,
1328,9759.0,ערד בקרן פנסיה מקיפה חדשה,ערד 8782 01.09.2026,71116511.0,2011-09-01,0.9077229004927079,צמוד למדד המחירים לצרכן,2026-09-01,0.048,0.0485,15658.52,122.976548,19.256,19.256,עלות מופחתת,3e-05,8e-06,,
1328,9759.0,ערד בקרן פנסיה מקיפה חדשה,ערד 8786 01.01.2027,71116487.0,2012-01-01,1.217882540909771,צמוד למדד המחירים לצרכן,2027-01-01,0.048,0.0485,61955.76,123.856326,76.736,76.736,עלות מופחתת,0.000121,3.3e-05,,
1328,9759.0,ערד בקרן פנסיה מקיפה חדשה,ערד 8783 01.10.2026,71116503.0,2011-10-01,0.9678825409097713,צמוד למדד המחירים לצרכן,2026-10-01,0.048,0.0485,18598.03,125.8044,23.397,23.397,עלות מופחתת,3.7e-05,1e-05,,
1328,9760.0,ערד בקרן פנסיה מקיפה חדשה,ערד 8783 01.10.2026,71116503.0,2011-10-01,0.9678825409097713,צמוד למדד המחירים לצרכן,2026-10-01,0.048,0.0485,2372.74,125.8044,2.985,2.985,עלות מופחתת,3.7e-05,1e-05,,
1328,9760.0,ערד בקרן פנסיה מקיפה חדשה,ערד 8786 01.01.2027,71116487.0,2012-01-01,1.217882540909771,צמוד למדד המחירים לצרכן,2027-01-01,0.048,0.0485,7904.32,123.856326,9.79,9.79,עלות מופחתת,0.000121,3.3e-05,,
1328,9760.0,ערד בקרן פנסיה מקיפה חדשה,ערד 8782 01.09.2026,71116511.0,2011-09-01,0.9077229004927079,צמוד למדד המחירים לצרכן,2026-09-01,0.048,0.0485,1997.71,122.976548,2.457,2.457,עלות מופחתת,3e-05,8e-06,,
1328,9760.0,ערד בקרן פנסיה מקיפה חדשה,ערד 8835 01.02.2031,71123061.0,2016-02-01,4.733970182613099,צמוד למדד המחירים לצרכן,2031-02-01,0.048,0.0485,3880.04,120.760879,4.686,4.686,עלות מופחתת,5.8e-05,1.5e-05,,
1328,9760.0,ערד בקרן פנסיה מקיפה חדשה,ערד 8828 01.07.2030,71122550.0,2015-07-01,4.256417817008314,צמוד למדד המחירים לצרכן,2030-07-01,0.048,0.0485,15657.2,120.640651,18.889,18.889,עלות מופחתת,0.000234,6.4e-05,,
1328,9760.0,ערד בקרן פנסיה מקיפה חדשה,ערד 8821 01.12.2029,71121784.0,2014-12-01,3.769364383776447,צמוד למדד המחירים לצרכן,2029-12-01,0.048,0.0485,31631.73,120.272787,38.044,38.044,עלות מופחתת,0.000472,0.000129,,
1328,9760.0,ערד בקרן פנסיה מקיפה חדשה,ערד 8840 01.07.2031,71123350.0,2016-07-01,5.035574882157443,צמוד למדד המחירים לצרכן,2031-07-01,0.048,0.0485,20986.85,121.617498,25.524,25.524,עלות מופחתת,0.000317,8.6e-05,,
1328,9760.0,ערד בקרן פנסיה מקיפה חדשה,ערד 8845 01.12.2031,71123533.0,2016-12-01,5.328113717401077,צמוד למדד המחירים לצרכן,2031-12-01,0.048,0.0485,76713.8,121.476869,93.19,93.19,עלות מופחתת,0.001158,0.000317,,
1328,9760.0,ערד בקרן פנסיה מקיפה חדשה,ערד 8847 01.02.2032,71123665.0,2017-02-01,5.494780384067743,צמוד למדד המחירים לצרכן,2032-02-01,0.048,0.0485,92861.42,121.005087,112.367,112.367,עלות מופחתת,0.001396,0.000382,,
1328,9760.0,ערד בקרן פנסיה מקיפה חדשה,ערד 8857 01.12.2032,71124127.0,2017-12-01,6.053496951908582,צמוד למדד המחירים לצרכן,2032-12-01,0.048,0.0485,201682.94,121.240736,244.522,244.522,עלות מופחתת,0.003039,0.000832,,
1328,9760.0,ערד בקרן פנסיה מקיפה חדשה,ערד 8784 01.11.2026,71118905.0,2011-11-01,1.0512158742431044,צמוד למדד המחירים לצרכן,2026-11-01,0.048,0.0485,6570.11,124.958178,8.21,8.21,עלות מופחתת,0.000102,2.7e-05,,
1328,9760.0,ערד בקרן פנסיה מקיפה חדשה,ערד 8875 01.06.2034,71125231.0,2019-06-01,7.078683819828075,צמוד למדד המחירים לצרכן,2034-06-01,0.048,0.0485,250500.82,119.564926,299.511,299.511,עלות מופחתת,0.003722,0.00102,,
1328,9760.0,ערד בקרן פנסיה מקיפה חדשה,ערד 8868 01.11.2033,71124689.0,2018-11-01,6.661746169657317,צמוד למדד המחירים לצרכן,2033-11-01,0.048,0.0485,18520.35,120.647903,22.344,22.344,עלות מופחתת,0.000277,7.6e-05,,
1328,9760.0,ערד בקרן פנסיה מקיפה חדשה,ערד 8807 01.10.2028,71120950.0,2013-10-01,2.7658487458854006,צמוד למדד המחירים לצרכן,2028-10-01,0.048,0.0485,23503.83,121.459952,28.548,28.548,עלות מופחתת,0.000354,9.7e-05,,
1328,9760.0,ערד בקרן פנסיה מקיפה חדשה,ערד 8787 01.02.2027,71116420.0,2012-02-01,1.3012158742431048,צמוד למדד המחירים לצרכן,2027-02-01,0.048,0.0485,8423.58,123.475983,10.401,10.401,עלות מופחתת,0.000129,3.5e-05,,
1328,9760.0,ערד בקרן פנסיה מקיפה חדשה,ערד 8794 01.09.2027,71120232.0,2012-09-01,1.85018681996419,צמוד למדד המחירים לצרכן,2027-09-01,0.048,0.0485,10464.57,121.689448,12.734,12.734,עלות מופחתת,0.000158,4.3e-05,,
1328,9760.0,ערד בקרן פנסיה מקיפה חדשה,ערד 8785 01.12.2026,71119127.0,2011-12-01,1.134549207576438,צמוד למדד המחירים לצרכן,2026-12-01,0.048,0.0485,6772.04,124.458743,8.428,8.428,עלות מופחתת,0.000104,2.8e-05,,
1328,9760.0,ערד בקרן פנסיה מקיפה חדשה,ערד 8804 01.07.2028,71121107.0,2013-07-01,2.582254121211065,צמוד למדד המחירים לצרכן,2028-07-01,0.048,0.0485,8488.49,121.347772,10.301,10.301,עלות מופחתת,0.000128,3.5e-05,,
1328,9760.0,ערד בקרן פנסיה מקיפה חדשה,ערד 8795 01.10.2027,71120356.0,2012-10-01,1.8882267038020435,צמוד למדד המחירים לצרכן,2027-10-01,0.048,0.0485,12116.12,122.842903,14.884,14.884,עלות מופחתת,0.000184,5e-05,,
1328,9760.0,ערד בקרן פנסיה מקיפה חדשה,ערד 8796 01.11.2027,71120448.0,2012-11-01,1.971560037135377,צמוד למדד המחירים לצרכן,2027-11-01,0.048,0.0485,12419.02,122.369591,15.197,15.197,עלות מופחתת,0.000188,5.1e-05,,
1328,9760.0,ערד בקרן פנסיה מקיפה חדשה,ערד 8809 01.12.2028,71121305.0,2013-12-01,2.932515412552067,צמוד למדד המחירים לצרכן,2028-12-01,0.048,0.0485,22681.66,119.921112,27.2,27.2,עלות מופחתת,0.000338,9.2e-05,,
1328,9760.0,ערד בקרן פנסיה מקיפה חדשה,ערד 8797 01.12.2027,71120570.0,2012-12-01,2.0548933704687102,צמוד למדד המחירים לצרכן,2027-12-01,0.048,0.0485,11863.7,122.110465,14.487,14.487,עלות מופחתת,0.00018,4.9e-05,,
1328,9760.0,ערד בקרן פנסיה מקיפה חדשה,ערד 8819 01.10.2029,71121768.0,2014-10-01,3.6026977171097805,צמוד למדד המחירים לצרכן,2029-10-01,0.048,0.0485,24592.84,121.222494,29.812,29.812,עלות מופחתת,0.00037,0.000101,,
1328,9760.0,ערד בקרן פנסיה מקיפה חדשה,ערד 8811 01.02.2029,71121578.0,2014-02-01,3.099182079218734,צמוד למדד המחירים לצרכן,2029-02-01,0.048,0.0485,16594.75,119.323081,19.801,19.801,עלות מופחתת,0.000246,6.7e-05,,
1328,9760.0,ערד בקרן פנסיה מקיפה חדשה,ערד 8824 01.03.2030,71122428.0,2015-03-01,4.0193643837764474,צמוד למדד המחירים לצרכן,2030-03-01,0.048,0.0485,55719.73,120.151183,66.948,66.948,עלות מופחתת,0.000832,0.000228,,
1328,9760.0,ערד בקרן פנסיה מקיפה חדשה,ערד 8827 01.06.2030,71122543.0,2015-06-01,4.17308448367498,צמוד למדד המחירים לצרכן,2030-06-01,0.048,0.0485,22450.88,121.354659,27.245,27.245,עלות מופחתת,0.000338,9.2e-05,,
1328,9760.0,ערד בקרן פנסיה מקיפה חדשה,ערד 8829 01.08.2030,71122626.0,2015-08-01,4.339751150341647,צמוד למדד המחירים לצרכן,2030-08-01,0.048,0.0485,52084.9,119.793825,62.394,62.394,עלות מופחתת,0.000775,0.000212,,
1328,9760.0,ערד בקרן פנסיה מקיפה חדשה,ערד 8833 01.12.2030,71122774.0,2015-12-01,4.567303515946433,צמוד למדד המחירים לצרכן,2030-12-01,0.048,0.0485,31949.05,121.110975,38.694,38.694,עלות מופחתת,0.00048,0.000131,,
1328,9760.0,ערד בקרן פנסיה מקיפה חדשה,ערד 8836 01.03.2031,71123079.0,2016-03-01,4.817303515946432,צמוד למדד המחירים לצרכן,2031-03-01,0.048,0.0485,7781.72,120.882326,9.407,9.407,עלות מופחתת,0.000116,3.2e-05,,
1328,9760.0,ערד בקרן פנסיה מקיפה חדשה,ערד 8838 01.05.2031,71123293.0,2016-05-01,4.868908215490777,צמוד למדד המחירים לצרכן,2031-05-01,0.048,0.0485,58842.52,123.456257,72.645,72.645,עלות מופחתת,0.000902,0.000247,,
1328,9760.0,ערד בקרן פנסיה מקיפה חדשה,ערד 8843 01.10.2031,71123517.0,2016-10-01,5.161447050734411,צמוד למדד המחירים לצרכן,2031-10-01,0.048,0.0485,46820.15,122.559506,57.383,57.383,עלות מופחתת,0.000713,0.000195,,
1328,9760.0,ערד בקרן פנסיה מקיפה חדשה,ערד 8862 01.05.2033,71124473.0,2018-05-01,6.320081206151133,צמוד למדד המחירים לצרכן,2033-05-01,0.048,0.0485,299650.44,122.091348,365.847,365.847,עלות מופחתת,0.004547,0.001246,,
1328,9760.0,ערד בקרן פנסיה מקיפה חדשה,ערד 8891 01.11.2035,71126130.0,2020-11-01,7.949654750710344,צמוד למדד המחירים לצרכן,2035-11-01,0.048,0.0485,1857697.19,121.124046,2250.118,2250.118,עלות מופחתת,0.027966,0.007664,,
1328,9760.0,ערד בקרן פנסיה מקיפה חדשה,ערד 8878 01.09.2034,71125348.0,2019-09-01,7.3286838198280755,צמוד למדד המחירים לצרכן,2034-09-01,0.048,0.0485,526596.95,118.375418,623.361,623.361,עלות מופחתת,0.007747,0.002123,,
1328,9760.0,ערד בקרן פנסיה מקיפה חדשה,ערד 8889 01.09.2035,71126098.0,2020-09-01,7.972456804478872,צמוד למדד המחירים לצרכן,2035-09-01,0.048,0.0485,2495250.41,119.084253,2971.45,2971.45,עלות מופחתת,0.036931,0.010121,,
1328,9760.0,ערד בקרן פנסיה מקיפה חדשה,ערד 8894 01.02.2036,71126288.0,2021-02-01,8.199654750710344,צמוד למדד המחירים לצרכן,2036-02-01,0.048,0.0485,3334241.38,119.687329,3990.664,3990.664,עלות מופחתת,0.049599,0.013592,,
1328,9760.0,ערד בקרן פנסיה מקיפה חדשה,ערד 8896 01.04.2036,71126353.0,2021-04-01,8.169517453559912,צמוד למדד המחירים לצרכן,2036-04-01,0.048,0.0485,2890964.4,121.350083,3508.188,3508.188,עלות מופחתת,0.043602,0.011949,,
1328,9760.0,ערד בקרן פנסיה מקיפה חדשה,ערד 8774 01.01.2026,71116750.0,2011-01-01,0.25277777777777777,צמוד למדד המחירים לצרכן,2026-01-01,0.048,0.0482,4204.58,127.137022,5.346,5.346,עלות מופחתת,6.6e-05,1.8e-05,,
1328,9760.0,ערד בקרן פנסיה מקיפה חדשה,ערד 8779 01.06.2026,71118848.0,2011-06-01,0.6577234592804972,צמוד למדד המחירים לצרכן,2026-06-01,0.048,0.0484,3396.84,125.545192,4.265,4.265,עלות מופחתת,5.3e-05,1.4e-05,,
1328,9760.0,ערד בקרן פנסיה מקיפה חדשה,ערד 8778 01.05.2026,71118830.0,2011-05-01,0.5743895671593743,צמוד למדד המחירים לצרכן,2026-05-01,0.048,0.0485,1968.86,126.786834,2.496,2.496,עלות מופחתת,3.1e-05,8e-06,,
1328,9760.0,ערד בקרן פנסיה מקיפה חדשה,ערד 8791 01.06.2027,71119598.0,2012-06-01,1.6001868199641902,צמוד למדד המחירים לצרכן,2027-06-01,0.048,0.0485,2055.41,122.922215,2.527,2.527,עלות מופחתת,3.1e-05,8e-06,,
1328,9760.0,ערד בקרן פנסיה מקיפה חדשה,ערד 8780 01.07.2026,71118855.0,2011-07-01,0.7410567926138304,צמוד למדד המחירים לצרכן,2026-07-01,0.048,0.0484,4009.85,124.454088,4.99,4.99,עלות מופחתת,6.2e-05,1.6e-05,,
1328,9760.0,ערד בקרן פנסיה מקיפה חדשה,ערד 8810 01.01.2029,71121438.0,2014-01-01,3.0158487458854,צמוד למדד המחירים לצרכן,2029-01-01,0.048,0.0485,22054.22,119.922945,26.448,26.448,עלות מופחתת,0.000328,9e-05,,
1328,9760.0,ערד בקרן פנסיה מקיפה חדשה,ערד 8805 01.08.2028,71121206.0,2013-08-01,2.665587454544398,צמוד למדד המחירים לצרכן,2028-08-01,0.048,0.0485,22638.39,119.909147,27.146,27.146,עלות מופחתת,0.000337,9.2e-05,,
1328,9760.0,ערד בקרן פנסיה מקיפה חדשה,ערד 8812 01.03.2029,71121651.0,2014-03-01,3.182515412552067,צמוד למדד המחירים לצרכן,2029-03-01,0.048,0.0485,28797.42,119.541567,34.425,34.425,עלות מופחתת,0.000427,0.000117,,
1328,9760.0,ערד בקרן פנסיה מקיפה חדשה,ערד 8831 01.10.2030,71122725.0,2015-10-01,4.400636849279766,צמוד למדד המחירים לצרכן,2030-10-01,0.048,0.0485,7190.34,121.700731,8.751,8.751,עלות מופחתת,0.000108,2.9e-05,,
1328,9760.0,ערד בקרן פנסיה מקיפה חדשה,ערד 8846 01.01.2032,71123616.0,2017-01-01,5.411447050734412,צמוד למדד המחירים לצרכן,2032-01-01,0.048,0.0485,100801.8,121.494528,122.469,122.469,עלות מופחתת,0.001522,0.000417,,
1328,9760.0,ערד בקרן פנסיה מקיפה חדשה,ערד 8870 01.01.2034,71124796.0,2019-01-01,6.8284128363239835,צמוד למדד המחירים לצרכן,2034-01-01,0.048,0.0485,177299.25,119.699042,212.226,212.226,עלות מופחתת,0.002637,0.000722,,
1328,9760.0,ערד בקרן פנסיה מקיפה חדשה,ערד 8871 01.02.2034,71124945.0,2019-02-01,6.9117461696573175,צמוד למדד המחירים לצרכן,2034-02-01,0.048,0.0485,729477.08,119.570244,872.238,872.238,עלות מופחתת,0.01084,0.00297,,
1328,9760.0,ערד בקרן פנסיה מקיפה חדשה,ערד 8851 01.06.2032,71123772.0,2017-06-01,5.695130326524218,צמוד למדד המחירים לצרכן,2032-06-01,0.048,0.0485,250450.33,121.603371,304.556,304.556,עלות מופחתת,0.003785,0.001037,,
1328,9760.0,ערד בקרן פנסיה מקיפה חדשה,ערד 8886 01.06.2035,71125660.0,2020-06-01,7.722456804478874,צמוד למדד המחירים לצרכן,2035-06-01,0.048,0.0485,1713169.16,120.279457,2060.591,2060.591,עלות מופחתת,0.02561,0.007018,,
1328,9760.0,ערד בקרן פנסיה מקיפה חדשה,ערד 8885 01.05.2035,71125603.0,2020-05-01,7.63912347114554,צמוד למדד המחירים לצרכן,2035-05-01,0.048,0.0485,938494.61,120.402353,1129.97,1129.97,עלות מופחתת,0.014044,0.003848,,
1328,9760.0,ערד בקרן פנסיה מקיפה חדשה,ערד 8904 01.12.2036,71126841.0,2021-12-01,8.632216086765283,צמוד למדד המחירים לצרכן,2036-12-01,0.048,0.0485,1224716.36,117.577516,1439.991,1439.991,עלות מופחתת,0.017897,0.004904,,
1328,9760.0,ערד בקרן פנסיה מקיפה חדשה,ערד 8892 01.12.2035,71126163.0,2020-12-01,8.032988084043678,צמוד למדד המחירים לצרכן,2035-12-01,0.048,0.0485,3460227.41,120.279457,4161.943,4161.943,עלות מופחתת,0.051728,0.014176,,
1328,9760.0,ערד בקרן פנסיה מקיפה חדשה,ערד 8772 01.11.2025,71116735.0,2010-11-01,0.08611111111111114,צמוד למדד המחירים לצרכן,2025-11-01,0.048,0.048,2892.0,128.622996,3.72,3.72,עלות מופחתת,4.6e-05,1.2e-05,,
1328,9760.0,ערד בקרן פנסיה מקיפה חדשה,ערד 8790 01.05.2027,71117162.0,2012-05-01,1.516853486630857,צמוד למדד המחירים לצרכן,2027-05-01,0.048,0.0485,8712.06,124.958178,10.886,10.886,עלות מופחתת,0.000135,3.7e-05,,
1328,9760.0,ערד בקרן פנסיה מקיפה חדשה,ערד 8830 01.09.2030,71122717.0,2015-09-01,4.423084483674979,צמוד למדד המחירים לצרכן,2030-09-01,0.048,0.0485,20258.44,119.070903,24.122,24.122,עלות מופחתת,0.000299,8.2e-05,,
1328,9760.0,ערד בקרן פנסיה מקיפה חדשה,ערד 8837 01.04.2031,71123129.0,2016-04-01,4.785574882157442,צמוד למדד המחירים לצרכן,2031-04-01,0.048,0.0485,55647.61,123.681618,68.826,68.826,עלות מופחתת,0.000855,0.000234,,
1328,9760.0,ערד בקרן פנסיה מקיפה חדשה,ערד 8853 01.08.2032,71123939.0,2017-08-01,5.861796993190884,צמוד למדד המחירים לצרכן,2032-08-01,0.048,0.0485,258931.62,121.005087,313.32,313.32,עלות מופחתת,0.003894,0.001067,,
1328,9760.0,ערד בקרן פנסיה מקיפה חדשה,ערד 8872 01.03.2034,71124986.0,2019-03-01,6.99507950299065,צמוד למדד המחירים לצרכן,2034-03-01,0.048,0.0485,524303.54,119.203218,624.987,624.987,עלות מופחתת,0.007767,0.002128,,
1328,9760.0,ערד בקרן פנסיה מקיפה חדשה,ערד 8873 01.04.2034,71125108.0,2019-04-01,6.912017153161408,צמוד למדד המחירים לצרכן,2034-04-01,0.048,0.0485,382797.33,121.471191,464.988,464.988,עלות מופחתת,0.005779,0.001583,,
1328,9760.0,ערד בקרן פנסיה מקיפה חדשה,ערד 8859 01.02.2033,71124325.0,2018-02-01,6.220163618575248,צמוד למדד המחירים לצרכן,2033-02-01,0.048,0.0485,455263.28,120.522995,548.697,548.697,עלות מופחתת,0.006819,0.001868,,
1328,9760.0,ערד בקרן פנסיה מקיפה חדשה,ערד 8854 01.09.2032,71123947.0,2017-09-01,5.945130326524218,צמוד למדד המחירים לצרכן,2032-09-01,0.048,0.0485,263987.22,120.636282,318.464,318.464,עלות מופחתת,0.003958,0.001084,,
1328,9760.0,ערד בקרן פנסיה מקיפה חדשה,ערד 8879 01.10.2034,71125389.0,2019-10-01,7.2377484585225185,צמוד למדד המחירים לצרכן,2034-10-01,0.048,0.0485,854893.37,120.509043,1030.224,1030.224,עלות מופחתת,0.012804,0.003509,,
1328,9760.0,ערד בקרן פנסיה מקיפה חדשה,ערד 8882 01.01.2035,71125454.0,2020-01-01,7.48774845852252,צמוד למדד המחירים לצרכן,2035-01-01,0.048,0.0485,1344341.43,119.336917,1604.296,1604.296,עלות מופחתת,0.019939,0.005464,,
1328,9760.0,ערד בקרן פנסיה מקיפה חדשה,ערד 8890 01.10.2035,71126106.0,2020-10-01,7.8663214173770095,צמוד למדד המחירים לצרכן,2035-10-01,0.048,0.0485,894501.55,121.471191,1086.562,1086.562,עלות מופחתת,0.013504,0.0037,,
1328,9760.0,ערד בקרן פנסיה מקיפה חדשה,ערד 8884 01.03.2035,71125512.0,2020-03-01,7.654415125189185,צמוד למדד המחירים לצרכן,2035-03-01,0.048,0.0485,781518.71,118.847034,928.812,928.812,עלות מופחתת,0.011544,0.003163,,
1328,9760.0,ערד בקרן פנסיה מקיפה חדשה,ערד 8898 01.06.2036,71126445.0,2021-06-01,8.336184120226578,צמוד למדד המחירים לצרכן,2036-06-01,0.048,0.0485,2183101.61,119.325448,2604.996,2604.996,עלות מופחתת,0.032377,0.008872,,
1328,9760.0,ערד בקרן פנסיה מקיפה חדשה,ערד 8905 01.01.2037,71126981.0,2022-01-01,8.715549420098617,צמוד למדד המחירים לצרכן,2037-01-01,0.048,0.0485,1488775.7,117.235403,1745.372,1745.372,עלות מופחתת,0.021693,0.005944,,
1328,9760.0,ערד בקרן פנסיה מקיפה חדשה,ערד 8788 01.03.2027,71116727.0,2012-03-01,1.384549207576438,צמוד למדד המחירים לצרכן,2027-03-01,0.048,0.0485,9642.41,122.976548,11.858,11.858,עלות מופחתת,0.000147,4e-05,,
1328,9760.0,ערד בקרן פנסיה מקיפה חדשה,ערד 8777 01.04.2026,71118822.0,2011-04-01,0.49105623382604097,צמוד למדד המחירים לצרכן,2026-04-01,0.048,0.0485,5120.5,127.526063,6.53,6.53,עלות מופחתת,8.1e-05,2.2e-05,,
1328,9760.0,ערד בקרן פנסיה מקיפה חדשה,ערד 8793 01.08.2027,71119846.0,2012-08-01,1.766853486630857,צמוד למדד המחירים לצרכן,2027-08-01,0.048,0.0485,13832.57,122.300021,16.917,16.917,עלות מופחתת,0.00021,5.7e-05,,
1328,9760.0,ערד בקרן פנסיה מקיפה חדשה,ערד 8799 01.02.2028,71120612.0,2013-02-01,2.221560037135377,צמוד למדד המחירים לצרכן,2028-02-01,0.048,0.0485,11582.43,121.490087,14.072,14.072,עלות מופחתת,0.000174,4.7e-05,,
1328,9760.0,ערד בקרן פנסיה מקיפה חדשה,ערד 8802 01.05.2028,71121016.0,2013-05-01,2.415587454544398,צמוד למדד המחירים לצרכן,2028-05-01,0.048,0.0485,16306.28,122.918209,20.043,20.043,עלות מופחתת,0.000249,6.8e-05,,
1328,9760.0,ערד בקרן פנסיה מקיפה חדשה,ערד 8813 01.04.2029,71121669.0,2014-04-01,3.18925144352555,צמוד למדד המחירים לצרכן,2029-04-01,0.048,0.0485,22652.82,122.177942,27.677,27.677,עלות מופחתת,0.000343,9.4e-05,,
1328,9760.0,ערד בקרן פנסיה מקיפה חדשה,ערד 8815 01.06.2029,71121685.0,2014-06-01,3.355918110192216,צמוד למדד המחירים לצרכן,2029-06-01,0.048,0.0485,34321.8,120.744908,41.442,41.442,עלות מופחתת,0.000515,0.000141,,
1328,9760.0,ערד בקרן פנסיה מקיפה חדשה,ערד 8823 01.02.2030,71122410.0,2015-02-01,3.9360310504431135,צמוד למדד המחירים לצרכן,2030-02-01,0.048,0.0485,36355.57,119.556818,43.466,43.466,עלות מופחתת,0.00054,0.000148,,
1328,9760.0,ערד בקרן פנסיה מקיפה חדשה,ערד 8825 01.04.2030,71122501.0,2015-04-01,4.006417817008313,צמוד למדד המחירים לצרכן,2030-04-01,0.048,0.0485,44627.71,123.430488,55.084,55.084,עלות מופחתת,0.000684,0.000187,,
1328,9760.0,ערד בקרן פנסיה מקיפה חדשה,ערד 8855 01.10.2032,71124093.0,2017-10-01,5.886830285241915,צמוד למדד המחירים לצרכן,2032-10-01,0.048,0.0485,228071.57,122.685902,279.812,279.812,עלות מופחתת,0.003477,0.000953,,
1328,9760.0,ערד בקרן פנסיה מקיפה חדשה,ערד 8820 01.11.2029,71121776.0,2014-11-01,3.686031050443114,צמוד למדד המחירים לצרכן,2029-11-01,0.048,0.0485,25955.9,121.110588,31.435,31.435,עלות מופחתת,0.00039,0.000107,,
1328,9760.0,ערד בקרן פנסיה מקיפה חדשה,ערד 8849 01.04.2032,71123731.0,2017-04-01,5.528463659857552,צמוד למדד המחירים לצרכן,2032-04-01,0.048,0.0485,160553.04,123.17763,197.765,197.765,עלות מופחתת,0.002458,0.000673,,
1328,9760.0,ערד בקרן פנסיה מקיפה חדשה,ערד 8863 01.06.2033,71124499.0,2018-06-01,6.4034145394844675,צמוד למדד המחירים לצרכן,2033-06-01,0.048,0.0485,377027.75,121.120338,456.657,456.657,עלות מופחתת,0.005675,0.001555,,
1328,9760.0,ערד בקרן פנסיה מקיפה חדשה,ערד 8874 01.05.2034,71125132.0,2019-05-01,6.995350486494741,צמוד למדד המחירים לצרכן,2034-05-01,0.048,0.0485,663963.48,120.402353,799.428,799.428,עלות מופחתת,0.009935,0.002722,,
1328,9760.0,ערד בקרן פנסיה מקיפה חדשה,ערד 8881 01.12.2034,71125421.0,2019-12-01,7.404415125189185,צמוד למדד המחירים לצרכן,2034-12-01,0.048,0.0485,987838.96,119.328631,1178.775,1178.775,עלות מופחתת,0.01465,0.004015,,
1328,9760.0,ערד בקרן פנסיה מקיפה חדשה,ערד 8888 01.08.2035,71125702.0,2020-08-01,7.889123471145539,צמוד למדד המחירים לצרכן,2035-08-01,0.048,0.0485,2038429.34,119.807017,2442.181,2442.181,עלות מופחתת,0.030353,0.008318,,
1328,9760.0,ערד בקרן פנסיה מקיפה חדשה,ערד 8900 01.08.2036,71126544.0,2021-08-01,8.502850786893246,צמוד למדד המחירים לצרכן,2036-08-01,0.048,0.0485,1434721.93,117.799478,1690.095,1690.095,עלות מופחתת,0.021005,0.005756,,
1328,9760.0,ערד בקרן פנסיה מקיפה חדשה,ערד 8897 01.05.2036,71126395.0,2021-05-01,8.252850786893246,צמוד למדד המחירים לצרכן,2036-05-01,0.048,0.0485,3594687.52,120.161553,4319.432,4319.432,עלות מופחתת,0.053685,0.014712,,
1328,9760.0,ערד בקרן פנסיה מקיפה חדשה,ערד 8792 01.07.2027,71119747.0,2012-07-01,1.6835201532975237,צמוד למדד המחירים לצרכן,2027-07-01,0.048,0.0485,8077.41,122.444858,9.89,9.89,עלות מופחתת,0.000122,3.3e-05,,
1328,9760.0,ערד בקרן פנסיה מקיפה חדשה,ערד 8816 01.07.2029,71121693.0,2014-07-01,3.4392514435255492,צמוד למדד המחירים לצרכן,2029-07-01,0.048,0.0485,24304.36,120.158088,29.204,29.204,עלות מופחתת,0.000362,9.9e-05,,
1328,9760.0,ערד בקרן פנסיה מקיפה חדשה,ערד 8801 01.04.2028,71120935.0,2013-04-01,2.332254121211065,צמוד למדד המחירים לצרכן,2028-04-01,0.048,0.0485,39384.6,123.639692,48.695,48.695,עלות מופחתת,0.000605,0.000165,,
1328,9760.0,ערד בקרן פנסיה מקיפה חדשה,ערד 8834 01.01.2031,71122931.0,2016-01-01,4.650636849279767,צמוד למדד המחירים לצרכן,2031-01-01,0.048,0.0485,17568.37,121.127105,21.28,21.28,עלות מופחתת,0.000264,7.2e-05,,
1328,9760.0,ערד בקרן פנסיה מקיפה חדשה,ערד 8822 01.01.2030,71122402.0,2015-01-01,3.85269771710978,צמוד למדד המחירים לצרכן,2030-01-01,0.048,0.0485,21635.93,120.040402,25.972,25.972,עלות מופחתת,0.000322,8.8e-05,,
1328,9760.0,ערד בקרן פנסיה מקיפה חדשה,ערד 8832 01.11.2030,71122741.0,2015-11-01,4.4839701826131,צמוד למדד המחירים לצרכן,2030-11-01,0.048,0.0485,66508.85,121.719184,80.954,80.954,עלות מופחתת,0.001006,0.000275,,
1328,9760.0,ערד בקרן פנסיה מקיפה חדשה,ערד 8841 01.08.2031,71123368.0,2016-08-01,5.118908215490776,צמוד למדד המחירים לצרכן,2031-08-01,0.048,0.0485,90330.01,120.760879,109.083,109.083,עלות מופחתת,0.001355,0.000371,,
1328,9760.0,ערד בקרן פנסיה מקיפה חדשה,ערד 8850 01.05.2032,71123749.0,2017-05-01,5.611796993190885,צמוד למדד המחירים לצרכן,2032-05-01,0.048,0.0485,155382.05,122.335286,190.087,190.087,עלות מופחתת,0.002362,0.000647,,
1328,9760.0,ערד בקרן פנסיה מקיפה חדשה,ערד 8842 01.09.2031,71123434.0,2016-09-01,5.202241548824109,צמוד למדד המחירים לצרכן,2031-09-01,0.048,0.0485,54493.7,119.788918,65.277,65.277,עלות מופחתת,0.000811,0.000222,,
1328,9760.0,ערד בקרן פנסיה מקיפה חדשה,ערד 8852 01.07.2032,71123921.0,2017-07-01,5.778463659857551,צמוד למדד המחירים לצרכן,2032-07-01,0.048,0.0485,165824.99,120.649978,200.068,200.068,עלות מופחתת,0.002486,0.000681,,
1328,9760.0,ערד בקרן פנסיה מקיפה חדשה,ערד 8860 01.03.2033,71124358.0,2018-03-01,6.303496951908582,צמוד למדד המחירים לצרכן,2033-03-01,0.048,0.0485,245950.06,120.636282,296.705,296.705,עלות מופחתת,0.003687,0.00101,,
1328,9760.0,ערד בקרן פנסיה מקיפה חדשה,ערד 8864 01.07.2033,71124556.0,2018-07-01,6.4867478728178005,צמוד למדד המחירים לצרכן,2033-07-01,0.048,0.0485,265898.39,120.053881,319.221,319.221,עלות מופחתת,0.003967,0.001087,,
1328,9760.0,ערד בקרן פנסיה מקיפה חדשה,ערד 8876 01.07.2034,71125272.0,2019-07-01,7.1620171531614085,צמוד למדד המחירים לצרכן,2034-07-01,0.048,0.0485,757055.68,118.280838,895.452,895.452,עלות מופחתת,0.011129,0.00305,,
1328,9760.0,ערד בקרן פנסיה מקיפה חדשה,ערד 8895 01.03.2036,71126320.0,2021-03-01,8.282988084043675,צמוד למדד המחירים לצרכן,2036-03-01,0.048,0.0485,2308323.17,119.323496,2754.372,2754.372,עלות מופחתת,0.034233,0.009381,,
1328,9760.0,ערד בקרן פנסיה מקיפה חדשה,ערד 8893 01.01.2036,71126239.0,2021-01-01,8.116321417377012,צמוד למדד המחירים לצרכן,2036-01-01,0.048,0.0485,3330354.12,120.051509,3998.14,3998.14,עלות מופחתת,0.049692,0.013618,,
1328,9760.0,ערד בקרן פנסיה מקיפה חדשה,ערד 8901 01.09.2036,71126593.0,2021-09-01,8.586184120226578,צמוד למדד המחירים לצרכן,2036-09-01,0.048,0.0485,2359326.28,116.86201,2757.156,2757.156,עלות מופחתת,0.034268,0.009391,,
1328,9760.0,ערד בקרן פנסיה מקיפה חדשה,ערד 8773 01.12.2025,71116743.0,2010-12-01,0.16944444444444448,צמוד למדד המחירים לצרכן,2025-12-01,0.048,0.0481,2026.56,127.7514,2.589,2.589,עלות מופחתת,3.2e-05,8e-06,,
1328,9760.0,ערד בקרן פנסיה מקיפה חדשה,ערד 8789 01.04.2027,71116701.0,2012-04-01,1.4335201532975232,צמוד למדד המחירים לצרכן,2027-04-01,0.048,0.0485,9166.42,125.441503,11.498,11.498,עלות מופחתת,0.000142,3.9e-05,,
1328,9760.0,ערד בקרן פנסיה מקיפה חדשה,ערד 8800 01.03.2028,71120687.0,2013-09-01,2.748920787877731,צמוד למדד המחירים לצרכן,2028-09-01,0.048,0.0485,8784.18,119.073236,10.46,10.46,עלות מופחתת,0.00013,3.5e-05,,
1328,9760.0,ערד בקרן פנסיה מקיפה חדשה,ערד 8781 01.08.2026,71118616.0,2011-08-01,0.824390125947164,צמוד למדד המחירים לצרכן,2026-08-01,0.048,0.0484,6988.4,123.475983,8.629,8.629,עלות מופחתת,0.000107,2.9e-05,,
1328,9760.0,ערד בקרן פנסיה מקיפה חדשה,ערד 8775 01.02.2026,71116768.0,2011-02-01,0.33611111111111114,צמוד למדד המחירים לצרכן,2026-02-01,0.048,0.0483,2365.52,126.155869,2.984,2.984,עלות מופחתת,3.7e-05,1e-05,,
1328,9760.0,ערד בקרן פנסיה מקיפה חדשה,ערד 8776 01.03.2026,71116776.0,2011-03-01,0.41944444444444445,צמוד למדד המחירים לצרכן,2026-03-01,0.048,0.0484,2199.65,125.387852,2.758,2.758,עלות מופחתת,3.4e-05,9e-06,,
1328,9760.0,ערד בקרן פנסיה מקיפה חדשה,ערד 8814 01.05.2029,71121677.0,2014-05-01,3.2725847768588836,צמוד למדד המחירים לצרכן,2029-05-01,0.048,0.0485,19241.55,121.348526,23.349,23.349,עלות מופחתת,0.00029,7.9e-05,,
1328,9760.0,ערד בקרן פנסיה מקיפה חדשה,ערד 8771 01.10.2025,71118814.0,2010-10-01,0.0027777777777777683,צמוד למדד המחירים לצרכן,2025-10-01,0.048,0.0479,2488.13,130.091327,3.237,3.237,עלות מופחתת,4e-05,1.1e-05,,
1328,9760.0,ערד בקרן פנסיה מקיפה חדשה,ערד 8817 01.08.2029,71121701.0,2014-08-01,3.5225847768588836,צמוד למדד המחירים לצרכן,2029-08-01,0.048,0.0485,15087.45,119.323081,18.003,18.003,עלות מופחתת,0.000223,6.1e-05,,
1328,9760.0,ערד בקרן פנסיה מקיפה חדשה,ערד 8798 01.01.2028,71120596.0,2013-01-01,2.1382267038020437,צמוד למדד המחירים לצרכן,2028-01-01,0.048,0.0485,18779.98,122.212735,22.952,22.952,עלות מופחתת,0.000285,7.8e-05,,
1328,9760.0,ערד בקרן פנסיה מקיפה חדשה,ערד 8865 01.08.2033,71124580.0,2018-08-01,6.570081206151133,צמוד למדד המחירים לצרכן,2033-08-01,0.048,0.0485,405745.84,119.452208,484.672,484.672,עלות מופחתת,0.006023,0.00165,,
1328,9760.0,ערד בקרן פנסיה מקיפה חדשה,ערד 8848 01.03.2032,71123673.0,2017-03-01,5.578113717401076,צמוד למדד המחירים לצרכן,2032-03-01,0.048,0.0485,145869.45,120.75716,176.148,176.148,עלות מופחתת,0.002189,0.000599,,
1328,9760.0,ערד בקרן פנסיה מקיפה חדשה,ערד 8803 01.06.2028,71121057.0,2013-06-01,2.498920787877731,צמוד למדד המחירים לצרכן,2028-06-01,0.048,0.0485,16890.45,121.941587,20.596,20.596,עלות מופחתת,0.000255,7e-05,,
1328,9760.0,ערד בקרן פנסיה מקיפה חדשה,ערד 8808 01.11.2028,71121297.0,2013-11-01,2.8491820792187337,צמוד למדד המחירים לצרכן,2028-11-01,0.048,0.0485,31278.34,120.755425,37.77,37.77,עלות מופחתת,0.000469,0.000128,,
1328,9760.0,ערד בקרן פנסיה מקיפה חדשה,ערד 8826 01.05.2030,71122535.0,2015-05-01,4.089751150341647,צמוד למדד המחירים לצרכן,2030-05-01,0.048,0.0485,29273.41,122.581567,35.884,35.884,עלות מופחתת,0.000445,0.000122,,
1328,9760.0,ערד בקרן פנסיה מקיפה חדשה,ערד 8818 01.09.2029,71121750.0,2014-09-01,3.6059181101922166,צמוד למדד המחירים לצרכן,2029-09-01,0.048,0.0485,31451.43,118.724388,37.341,37.341,עלות מופחתת,0.000464,0.000127,,
1328,9760.0,ערד בקרן פנסיה מקיפה חדשה,ערד 8880 01.11.2034,71125405.0,2019-11-01,7.3210817918558515,צמוד למדד המחירים לצרכן,2034-11-01,0.048,0.0485,992858.5,120.282907,1194.239,1194.239,עלות מופחתת,0.014843,0.004067,,
1328,9760.0,ערד בקרן פנסיה מקיפה חדשה,ערד 8899 01.07.2036,71126460.0,2021-07-01,8.419517453559914,צמוד למדד המחירים לצרכן,2036-07-01,0.048,0.0485,3037944.5,118.392711,3596.705,3596.705,עלות מופחתת,0.044703,0.01225,,
1328,9760.0,ערד בקרן פנסיה מקיפה חדשה,ערד 8839 01.06.2031,71123301.0,2016-06-01,4.95224154882411,צמוד למדד המחירים לצרכן,2031-06-01,0.048,0.0485,47094.21,122.463483,57.673,57.673,עלות מופחתת,0.000716,0.000196,,
1328,9760.0,ערד בקרן פנסיה מקיפה חדשה,ערד 8844 01.11.2031,71123525.0,2016-11-01,5.244780384067743,צמוד למדד המחירים לצרכן,2031-11-01,0.048,0.0485,60299.34,122.210482,73.692,73.692,עלות מופחתת,0.000915,0.000251,,
1328,9760.0,ערד בקרן פנסיה מקיפה חדשה,ערד 8856 01.11.2032,71124119.0,2017-11-01,5.970163618575247,צמוד למדד המחירים לצרכן,2032-11-01,0.048,0.0485,239603.52,122.091348,292.535,292.535,עלות מופחתת,0.003635,0.000996,,
1328,9760.0,ערד בקרן פנסיה מקיפה חדשה,ערד 8858 01.01.2033,71124267.0,2018-01-01,6.136830285241914,צמוד למדד המחירים לצרכן,2033-01-01,0.048,0.0485,287930.98,121.131135,348.774,348.774,עלות מופחתת,0.004334,0.001187,,
1328,9760.0,ערד בקרן פנסיה מקיפה חדשה,ערד 8861 01.04.2033,71124432.0,2018-04-01,6.2367478728178,צמוד למדד המחירים לצרכן,2033-04-01,0.048,0.0485,231814.58,122.931274,284.973,284.973,עלות מופחתת,0.003541,0.00097,,
1328,9760.0,ערד בקרן פנסיה מקיפה חדשה,ערד 8866 01.09.2033,71124630.0,2018-09-01,6.653414539484467,צמוד למדד המחירים לצרכן,2033-09-01,0.048,0.0485,416174.36,118.969048,495.119,495.119,עלות מופחתת,0.006153,0.001686,,
1328,9760.0,ערד בקרן פנסיה מקיפה חדשה,ערד 8877 01.08.2034,71125314.0,2019-08-01,7.2453504864947424,צמוד למדד המחירים לצרכן,2034-08-01,0.048,0.0485,855989.59,118.503479,1014.377,1014.377,עלות מופחתת,0.012607,0.003455,,
1328,9760.0,ערד בקרן פנסיה מקיפה חדשה,ערד 8869 01.12.2033,71124697.0,2018-12-01,6.7450795029906505,צמוד למדד המחירים לצרכן,2033-12-01,0.048,0.0485,409568.19,119.811572,490.71,490.71,עלות מופחתת,0.006098,0.001671,,
1328,9760.0,ערד בקרן פנסיה מקיפה חדשה,ערד 8867 01.10.2033,71124648.0,2018-10-01,6.5784128363239835,צמוד למדד המחירים לצרכן,2033-10-01,0.048,0.0485,149655.74,121.233998,181.434,181.434,עלות מופחתת,0.002255,0.000617,,
1328,9760.0,ערד בקרן פנסיה מקיפה חדשה,ערד 8883 01.02.2035,71125488.0,2020-02-01,7.5710817918558515,צמוד למדד המחירים לצרכן,2035-02-01,0.048,0.0485,1169494.25,118.856167,1390.016,1390.016,עלות מופחתת,0.017276,0.004734,,
1328,9760.0,ערד בקרן פנסיה מקיפה חדשה,ערד 8887 01.07.2035,71125678.0,2020-07-01,7.805790137812206,צמוד למדד המחירים לצרכן,2035-07-01,0.048,0.0485,1188353.57,120.17144,1428.062,1428.062,עלות מופחתת,0.017749,0.004864,,
1328,9760.0,ערד בקרן פנסיה מקיפה חדשה,ערד 8903 01.11.2036,71126718.0,2021-11-01,8.548882753431949,צמוד למדד המחירים לצרכן,2036-11-01,0.048,0.0485,3200048.11,118.164734,3781.328,3781.328,עלות מופחתת,0.046997,0.012879,,
1328,12138.0,ערד בקרן פנסיה מקיפה חדשה,ערד 8903 01.11.2036,71126718.0,2021-11-01,8.548882753431949,צמוד למדד המחירים לצרכן,2036-11-01,0.048,0.0485,67526555.4,118.164734,79792.575,79792.575,עלות מופחתת,0.047285,0.028004,,
1328,12138.0,ערד בקרן פנסיה מקיפה חדשה,ערד 8887 01.07.2035,71125678.0,2020-07-01,7.805790137812206,צמוד למדד המחירים לצרכן,2035-07-01,0.048,0.0485,25076317.72,120.17144,30134.572,30134.572,עלות מופחתת,0.017858,0.010576,,
1328,12138.0,ערד בקרן פנסיה מקיפה חדשה,ערד 8883 01.02.2035,71125488.0,2020-02-01,7.5710817918558515,צמוד למדד המחירים לצרכן,2035-02-01,0.048,0.0485,24678353.4,118.856167,29331.745,29331.745,עלות מופחתת,0.017382,0.010294,,
1328,12138.0,ערד בקרן פנסיה מקיפה חדשה,ערד 8867 01.10.2033,71124648.0,2018-10-01,6.5784128363239835,צמוד למדד המחירים לצרכן,2033-10-01,0.048,0.0485,3157995.26,121.233998,3828.564,3828.564,עלות מופחתת,0.002268,0.001343,,
1328,12138.0,ערד בקרן פנסיה מקיפה חדשה,ערד 8869 01.12.2033,71124697.0,2018-12-01,6.7450795029906505,צמוד למדד המחירים לצרכן,2033-12-01,0.048,0.0485,8642597.98,119.811572,10354.833,10354.833,עלות מופחתת,0.006136,0.003634,,
1328,12138.0,ערד בקרן פנסיה מקיפה חדשה,ערד 8877 01.08.2034,71125314.0,2019-08-01,7.2453504864947424,צמוד למדד המחירים לצרכן,2034-08-01,0.048,0.0485,18062862.39,118.503479,21405.12,21405.12,עלות מופחתת,0.012684,0.007512,,
1328,12138.0,ערד בקרן פנסיה מקיפה חדשה,ערד 8866 01.09.2033,71124630.0,2018-09-01,6.653414539484467,צמוד למדד המחירים לצרכן,2033-09-01,0.048,0.0485,8781999.64,118.969048,10447.861,10447.861,עלות מופחתת,0.006191,0.003666,,
1328,12138.0,ערד בקרן פנסיה מקיפה חדשה,ערד 8861 01.04.2033,71124432.0,2018-04-01,6.2367478728178,צמוד למדד המחירים לצרכן,2033-04-01,0.048,0.0485,4891689.15,122.931274,6013.416,6013.416,עלות מופחתת,0.003563,0.00211,,
1328,12138.0,ערד בקרן פנסיה מקיפה חדשה,ערד 8858 01.01.2033,71124267.0,2018-01-01,6.136830285241914,צמוד למדד המחירים לצרכן,2033-01-01,0.048,0.0485,6075842.26,121.131135,7359.737,7359.737,עלות מופחתת,0.004361,0.002582,,
1328,12138.0,ערד בקרן פנסיה מקיפה חדשה,ערד 8856 01.11.2032,71124119.0,2017-11-01,5.970163618575247,צמוד למדד המחירים לצרכן,2032-11-01,0.048,0.0485,5056049.18,122.091348,6172.999,6172.999,עלות מופחתת,0.003658,0.002166,,
1328,12138.0,ערד בקרן פנסיה מקיפה חדשה,ערד 8844 01.11.2031,71123525.0,2016-11-01,5.244780384067743,צמוד למדד המחירים לצרכן,2031-11-01,0.048,0.0485,1272420.52,122.210482,1555.031,1555.031,עלות מופחתת,0.000921,0.000545,,
1328,12138.0,ערד בקרן פנסיה מקיפה חדשה,ערד 8839 01.06.2031,71123301.0,2016-06-01,4.95224154882411,צמוד למדד המחירים לצרכן,2031-06-01,0.048,0.0485,993769.41,122.463483,1217.005,1217.005,עלות מופחתת,0.000721,0.000427,,
1328,12138.0,ערד בקרן פנסיה מקיפה חדשה,ערד 8826 01.05.2030,71122535.0,2015-05-01,4.089751150341647,צמוד למדד המחירים לצרכן,2030-05-01,0.048,0.0485,617719.76,122.581567,757.211,757.211,עלות מופחתת,0.000448,0.000265,,
1328,12138.0,ערד בקרן פנסיה מקיפה חדשה,ערד 8899 01.07.2036,71126460.0,2021-07-01,8.419517453559914,צמוד למדד המחירים לצרכן,2036-07-01,0.048,0.0485,64105888.47,118.392711,75896.7,75896.7,עלות מופחתת,0.044977,0.026636,,
1328,12138.0,ערד בקרן פנסיה מקיפה חדשה,ערד 8818 01.09.2029,71121750.0,2014-09-01,3.6059181101922166,צמוד למדד המחירים לצרכן,2029-09-01,0.048,0.0485,663679.69,118.724388,787.95,787.95,עלות מופחתת,0.000466,0.000276,,
1328,12138.0,ערד בקרן פנסיה מקיפה חדשה,ערד 8880 01.11.2034,71125405.0,2019-11-01,7.3210817918558515,צמוד למדד המחירים לצרכן,2034-11-01,0.048,0.0485,20951033.28,120.282907,25200.512,25200.512,עלות מופחתת,0.014934,0.008844,,
1328,12138.0,ערד בקרן פנסיה מקיפה חדשה,ערד 8808 01.11.2028,71121297.0,2013-11-01,2.8491820792187337,צמוד למדד המחירים לצרכן,2028-11-01,0.048,0.0485,660027.24,120.755425,797.019,797.019,עלות מופחתת,0.000472,0.000279,,
1328,12138.0,ערד בקרן פנסיה מקיפה חדשה,ערד 8865 01.08.2033,71124580.0,2018-08-01,6.570081206151133,צמוד למדד המחירים לצרכן,2033-08-01,0.048,0.0485,8561939.82,119.452208,10227.426,10227.426,עלות מופחתת,0.00606,0.003589,,
1328,12138.0,ערד בקרן פנסיה מקיפה חדשה,ערד 8798 01.01.2028,71120596.0,2013-01-01,2.1382267038020437,צמוד למדד המחירים לצרכן,2028-01-01,0.048,0.0485,396290.28,122.212735,484.317,484.317,עלות מופחתת,0.000287,0.000169,,
1328,12138.0,ערד בקרן פנסיה מקיפה חדשה,ערד 8803 01.06.2028,71121057.0,2013-06-01,2.498920787877731,צמוד למדד המחירים לצרכן,2028-06-01,0.048,0.0485,356417.75,121.941587,434.621,434.621,עלות מופחתת,0.000257,0.000152,,
1328,12138.0,ערד בקרן פנסיה מקיפה חדשה,ערד 8817 01.08.2029,71121701.0,2014-08-01,3.5225847768588836,צמוד למדד המחירים לצרכן,2029-08-01,0.048,0.0485,318371.45,119.323081,379.891,379.891,עלות מופחתת,0.000225,0.000133,,
1328,12138.0,ערד בקרן פנסיה מקיפה חדשה,ערד 8848 01.03.2032,71123673.0,2017-03-01,5.578113717401076,צמוד למדד המחירים לצרכן,2032-03-01,0.048,0.0485,3078098.02,120.75716,3717.024,3717.024,עלות מופחתת,0.002202,0.001304,,
1328,12138.0,ערד בקרן פנסיה מקיפה חדשה,ערד 8771 01.10.2025,71118814.0,2010-10-01,0.0027777777777777683,צמוד למדד המחירים לצרכן,2025-10-01,0.048,0.0479,52503.89,130.091327,68.303,68.303,עלות מופחתת,4e-05,2.3e-05,,
1328,12138.0,ערד בקרן פנסיה מקיפה חדשה,ערד 8776 01.03.2026,71116776.0,2011-03-01,0.41944444444444445,צמוד למדד המחירים לצרכן,2026-03-01,0.048,0.0484,46416.48,125.387852,58.201,58.201,עלות מופחתת,3.4e-05,2e-05,,
1328,12138.0,ערד בקרן פנסיה מקיפה חדשה,ערד 8800 01.03.2028,71120687.0,2013-09-01,2.748920787877731,צמוד למדד המחירים לצרכן,2028-09-01,0.048,0.0485,185361.58,119.073236,220.716,220.716,עלות מופחתת,0.00013,7.7e-05,,
1328,12138.0,ערד בקרן פנסיה מקיפה חדשה,ערד 8814 01.05.2029,71121677.0,2014-05-01,3.2725847768588836,צמוד למדד המחירים לצרכן,2029-05-01,0.048,0.0485,406030.13,121.348526,492.712,492.712,עלות מופחתת,0.000291,0.000172,,
1328,12138.0,ערד בקרן פנסיה מקיפה חדשה,ערד 8775 01.02.2026,71116768.0,2011-02-01,0.33611111111111114,צמוד למדד המחירים לצרכן,2026-02-01,0.048,0.0483,49916.74,126.155869,62.973,62.973,עלות מופחתת,3.7e-05,2.2e-05,,
1328,12138.0,ערד בקרן פנסיה מקיפה חדשה,ערד 8781 01.08.2026,71118616.0,2011-08-01,0.824390125947164,צמוד למדד המחירים לצרכן,2026-08-01,0.048,0.0484,147467.46,123.475983,182.087,182.087,עלות מופחתת,0.000107,6.3e-05,,
1328,12138.0,ערד בקרן פנסיה מקיפה חדשה,ערד 8789 01.04.2027,71116701.0,2012-04-01,1.4335201532975232,צמוד למדד המחירים לצרכן,2027-04-01,0.048,0.0485,193427.39,125.441503,242.638,242.638,עלות מופחתת,0.000143,8.5e-05,,
1328,12138.0,ערד בקרן פנסיה מקיפה חדשה,ערד 8773 01.12.2025,71116743.0,2010-12-01,0.16944444444444448,צמוד למדד המחירים לצרכן,2025-12-01,0.048,0.0481,42764.04,127.7514,54.632,54.632,עלות מופחתת,3.2e-05,1.9e-05,,
1328,12138.0,ערד בקרן פנסיה מקיפה חדשה,ערד 8901 01.09.2036,71126593.0,2021-09-01,8.586184120226578,צמוד למדד המחירים לצרכן,2036-09-01,0.048,0.0485,49785869.1,116.86201,58180.767,58180.767,עלות מופחתת,0.034478,0.020419,,
1328,12138.0,ערד בקרן פנסיה מקיפה חדשה,ערד 8895 01.03.2036,71126320.0,2021-03-01,8.282988084043675,צמוד למדד המחירים לצרכן,2036-03-01,0.048,0.0485,48709615.3,119.323496,58122.016,58122.016,עלות מופחתת,0.034443,0.020398,,
1328,12138.0,ערד בקרן פנסיה מקיפה חדשה,ערד 8876 01.07.2034,71125272.0,2019-07-01,7.1620171531614085,צמוד למדד המחירים לצרכן,2034-07-01,0.048,0.0485,15975185.7,118.280838,18895.584,18895.584,עלות מופחתת,0.011197,0.006631,,
1328,12138.0,ערד בקרן פנסיה מקיפה חדשה,ערד 8893 01.01.2036,71126239.0,2021-01-01,8.116321417377012,צמוד למדד המחירים לצרכן,2036-01-01,0.048,0.0485,70276237.75,120.051509,84367.684,84367.684,עלות מופחתת,0.049997,0.029609,,
1328,12138.0,ערד בקרן פנסיה מקיפה חדשה,ערד 8864 01.07.2033,71124556.0,2018-07-01,6.4867478728178005,צמוד למדד המחירים לצרכן,2033-07-01,0.048,0.0485,5610916.45,120.053881,6736.123,6736.123,עלות מופחתת,0.003991,0.002364,,
1328,12138.0,ערד בקרן פנסיה מקיפה חדשה,ערד 8860 01.03.2033,71124358.0,2018-03-01,6.303496951908582,צמוד למדד המחירים לצרכן,2033-03-01,0.048,0.0485,5189972.16,120.636282,6260.989,6260.989,עלות מופחתת,0.00371,0.002197,,
1328,12138.0,ערד בקרן פנסיה מקיפה חדשה,ערד 8852 01.07.2032,71123921.0,2017-07-01,5.778463659857551,צמוד למדד המחירים לצרכן,2032-07-01,0.048,0.0485,3499194.49,120.649978,4221.777,4221.777,עלות מופחתת,0.002501,0.001481,,
1328,12138.0,ערד בקרן פנסיה מקיפה חדשה,ערד 8842 01.09.2031,71123434.0,2016-09-01,5.202241548824109,צמוד למדד המחירים לצרכן,2031-09-01,0.048,0.0485,1149911.43,119.788918,1377.466,1377.466,עלות מופחתת,0.000816,0.000483,,
1328,12138.0,ערד בקרן פנסיה מקיפה חדשה,ערד 8850 01.05.2032,71123749.0,2017-05-01,5.611796993190885,צמוד למדד המחירים לצרכן,2032-05-01,0.048,0.0485,3278830.31,122.335286,4011.166,4011.166,עלות מופחתת,0.002377,0.001407,,
1328,12138.0,ערד בקרן פנסיה מקיפה חדשה,ערד 8841 01.08.2031,71123368.0,2016-08-01,5.118908215490776,צמוד למדד המחירים לצרכן,2031-08-01,0.048,0.0485,1906119.73,120.760879,2301.847,2301.847,עלות מופחתת,0.001364,0.000807,,
1328,12138.0,ערד בקרן פנסיה מקיפה חדשה,ערד 8822 01.01.2030,71122402.0,2015-01-01,3.85269771710978,צמוד למדד המחירים לצרכן,2030-01-01,0.048,0.0485,456555.62,120.040402,548.051,548.051,עלות מופחתת,0.000324,0.000192,,
1328,12138.0,ערד בקרן פנסיה מקיפה חדשה,ערד 8816 01.07.2029,71121693.0,2014-07-01,3.4392514435255492,צמוד למדד המחירים לצרכן,2029-07-01,0.048,0.0485,512864.15,120.158088,616.248,616.248,עלות מופחתת,0.000365,0.000216,,
1328,12138.0,ערד בקרן פנסיה מקיפה חדשה,ערד 8832 01.11.2030,71122741.0,2015-11-01,4.4839701826131,צמוד למדד המחירים לצרכן,2030-11-01,0.048,0.0485,1403451.99,121.719184,1708.27,1708.27,עלות מופחתת,0.001012,0.000599,,
1328,12138.0,ערד בקרן פנסיה מקיפה חדשה,ערד 8834 01.01.2031,71122931.0,2016-01-01,4.650636849279767,צמוד למדד המחירים לצרכן,2031-01-01,0.048,0.0485,370723.16,121.127105,449.046,449.046,עלות מופחתת,0.000266,0.000157,,
1328,12138.0,ערד בקרן פנסיה מקיפה חדשה,ערד 8801 01.04.2028,71120935.0,2013-04-01,2.332254121211065,צמוד למדד המחירים לצרכן,2028-04-01,0.048,0.0485,831083.42,123.639692,1027.549,1027.549,עלות מופחתת,0.000608,0.00036,,
1328,12138.0,ערד בקרן פנסיה מקיפה חדשה,ערד 8792 01.07.2027,71119747.0,2012-07-01,1.6835201532975237,צמוד למדד המחירים לצרכן,2027-07-01,0.048,0.0485,170447.43,122.444858,208.704,208.704,עלות מופחתת,0.000123,7.3e-05,,
1328,12138.0,ערד בקרן פנסיה מקיפה חדשה,ערד 8897 01.05.2036,71126395.0,2021-05-01,8.252850786893246,צמוד למדד המחירים לצרכן,2036-05-01,0.048,0.0485,75854130.01,120.161553,91147.501,91147.501,עלות מופחתת,0.054015,0.031989,,
1328,12138.0,ערד בקרן פנסיה מקיפה חדשה,ערד 8900 01.08.2036,71126544.0,2021-08-01,8.502850786893246,צמוד למדד המחירים לצרכן,2036-08-01,0.048,0.0485,30275116.63,117.799478,35663.93,35663.93,עלות מופחתת,0.021134,0.012516,,
1328,12138.0,ערד בקרן פנסיה מקיפה חדשה,ערד 8888 01.08.2035,71125702.0,2020-08-01,7.889123471145539,צמוד למדד המחירים לצרכן,2035-08-01,0.048,0.0485,43014388.24,119.807017,51534.256,51534.256,עלות מופחתת,0.030539,0.018086,,
1328,12138.0,ערד בקרן פנסיה מקיפה חדשה,ערד 8881 01.12.2034,71125421.0,2019-12-01,7.404415125189185,צמוד למדד המחירים לצרכן,2034-12-01,0.048,0.0485,20845112.37,119.328631,24874.187,24874.187,עלות מופחתת,0.01474,0.008729,,
1328,12138.0,ערד בקרן פנסיה מקיפה חדשה,ערד 8874 01.05.2034,71125132.0,2019-05-01,6.995350486494741,צמוד למדד המחירים לצרכן,2034-05-01,0.048,0.0485,14010779.03,120.402353,16869.308,16869.308,עלות מופחתת,0.009996,0.00592,,
1328,12138.0,ערד בקרן פנסיה מקיפה חדשה,ערד 8863 01.06.2033,71124499.0,2018-06-01,6.4034145394844675,צמוד למדד המחירים לצרכן,2033-06-01,0.048,0.0485,7955938.32,121.120338,9636.259,9636.259,עלות מופחתת,0.00571,0.003381,,
1328,12138.0,ערד בקרן פנסיה מקיפה חדשה,ערד 8825 01.04.2030,71122501.0,2015-04-01,4.006417817008313,צמוד למדד המחירים לצרכן,2030-04-01,0.048,0.0485,941722.07,123.430488,1162.372,1162.372,עלות מופחתת,0.000688,0.000407,,
1328,12138.0,ערד בקרן פנסיה מקיפה חדשה,ערד 8849 01.04.2032,71123731.0,2017-04-01,5.528463659857552,צמוד למדד המחירים לצרכן,2032-04-01,0.048,0.0485,3387947.11,123.17763,4173.193,4173.193,עלות מופחתת,0.002473,0.001464,,
1328,12138.0,ערד בקרן פנסיה מקיפה חדשה,ערד 8855 01.10.2032,71124093.0,2017-10-01,5.886830285241915,צמוד למדד המחירים לצרכן,2032-10-01,0.048,0.0485,4812705.03,122.685902,5904.511,5904.511,עלות מופחתת,0.003499,0.002072,,
1328,12138.0,ערד בקרן פנסיה מקיפה חדשה,ערד 8823 01.02.2030,71122410.0,2015-02-01,3.9360310504431135,צמוד למדד המחירים לצרכן,2030-02-01,0.048,0.0485,767165.63,119.556818,917.199,917.199,עלות מופחתת,0.000543,0.000321,,
1328,12138.0,ערד בקרן פנסיה מקיפה חדשה,ערד 8815 01.06.2029,71121685.0,2014-06-01,3.355918110192216,צמוד למדד המחירים לצרכן,2029-06-01,0.048,0.0485,724249.4,120.744908,874.494,874.494,עלות מופחתת,0.000518,0.000306,,
1328,12138.0,ערד בקרן פנסיה מקיפה חדשה,ערד 8820 01.11.2029,71121776.0,2014-11-01,3.686031050443114,צמוד למדד המחירים לצרכן,2029-11-01,0.048,0.0485,547714.56,121.110588,663.34,663.34,עלות מופחתת,0.000393,0.000232,,
1328,12138.0,ערד בקרן פנסיה מקיפה חדשה,ערד 8813 01.04.2029,71121669.0,2014-04-01,3.18925144352555,צמוד למדד המחירים לצרכן,2029-04-01,0.048,0.0485,478013.73,122.177942,584.027,584.027,עלות מופחתת,0.000346,0.000204,,
1328,12138.0,ערד בקרן פנסיה מקיפה חדשה,ערד 8802 01.05.2028,71121016.0,2013-05-01,2.415587454544398,צמוד למדד המחירים לצרכן,2028-05-01,0.048,0.0485,344090.75,122.918209,422.95,422.95,עלות מופחתת,0.00025,0.000148,,
1328,12138.0,ערד בקרן פנסיה מקיפה חדשה,ערד 8799 01.02.2028,71120612.0,2013-02-01,2.221560037135377,צמוד למדד המחירים לצרכן,2028-02-01,0.048,0.0485,244409.44,121.490087,296.933,296.933,עלות מופחתת,0.000175,0.000104,,
1328,12138.0,ערד בקרן פנסיה מקיפה חדשה,ערד 8793 01.08.2027,71119846.0,2012-08-01,1.766853486630857,צמוד למדד המחירים לצרכן,2027-08-01,0.048,0.0485,291891.22,122.300021,356.983,356.983,עלות מופחתת,0.000211,0.000125,,
1328,12138.0,ערד בקרן פנסיה מקיפה חדשה,ערד 8777 01.04.2026,71118822.0,2011-04-01,0.49105623382604097,צמוד למדד המחירים לצרכן,2026-04-01,0.048,0.0485,108051.49,127.526063,137.794,137.794,עלות מופחתת,8.1e-05,4.8e-05,,
1328,12138.0,ערד בקרן פנסיה מקיפה חדשה,ערד 8788 01.03.2027,71116727.0,2012-03-01,1.384549207576438,צמוד למדד המחירים לצרכן,2027-03-01,0.048,0.0485,203471.62,122.976548,250.222,250.222,עלות מופחתת,0.000148,8.7e-05,,
1328,12138.0,ערד בקרן פנסיה מקיפה חדשה,ערד 8905 01.01.2037,71126981.0,2022-01-01,8.715549420098617,צמוד למדד המחירים לצרכן,2037-01-01,0.048,0.0485,31415744.77,117.235403,36830.375,36830.375,עלות מופחתת,0.021826,0.012926,,
1328,12138.0,ערד בקרן פנסיה מקיפה חדשה,ערד 8898 01.06.2036,71126445.0,2021-06-01,8.336184120226578,צמוד למדד המחירים לצרכן,2036-06-01,0.048,0.0485,46067223.53,119.325448,54969.921,54969.921,עלות מופחתת,0.032575,0.019292,,
1328,12138.0,ערד בקרן פנסיה מקיפה חדשה,ערד 8884 01.03.2035,71125512.0,2020-03-01,7.654415125189185,צמוד למדד המחירים לצרכן,2035-03-01,0.048,0.0485,16491397.93,118.847034,19599.537,19599.537,עלות מופחתת,0.011614,0.006878,,
1328,12138.0,ערד בקרן פנסיה מקיפה חדשה,ערד 8890 01.10.2035,71126106.0,2020-10-01,7.8663214173770095,צמוד למדד המחירים לצרכן,2035-10-01,0.048,0.0485,18875531.4,121.471191,22928.333,22928.333,עלות מופחתת,0.013587,0.008046,,
1328,12138.0,ערד בקרן פנסיה מקיפה חדשה,ערד 8882 01.01.2035,71125454.0,2020-01-01,7.48774845852252,צמוד למדד המחירים לצרכן,2035-01-01,0.048,0.0485,28367931.6,119.336917,33853.415,33853.415,עלות מופחתת,0.020061,0.011881,,
1328,12138.0,ערד בקרן פנסיה מקיפה חדשה,ערד 8879 01.10.2034,71125389.0,2019-10-01,7.2377484585225185,צמוד למדד המחירים לצרכן,2034-10-01,0.048,0.0485,18039730.24,120.509043,21739.506,21739.506,עלות מופחתת,0.012883,0.007629,,
1328,12138.0,ערד בקרן פנסיה מקיפה חדשה,ערד 8854 01.09.2032,71123947.0,2017-09-01,5.945130326524218,צמוד למדד המחירים לצרכן,2032-09-01,0.048,0.0485,5570587.37,120.636282,6720.15,6720.15,עלות מופחתת,0.003982,0.002358,,
1328,12138.0,ערד בקרן פנסיה מקיפה חדשה,ערד 8859 01.02.2033,71124325.0,2018-02-01,6.220163618575248,צמוד למדד המחירים לצרכן,2033-02-01,0.048,0.0485,9606843.47,120.522995,11578.456,11578.456,עלות מופחתת,0.006861,0.004063,,
1328,12138.0,ערד בקרן פנסיה מקיפה חדשה,ערד 8873 01.04.2034,71125108.0,2019-04-01,6.912017153161408,צמוד למדד המחירים לצרכן,2034-04-01,0.048,0.0485,8077686.49,121.471191,9812.062,9812.062,עלות מופחתת,0.005814,0.003443,,
1328,12138.0,ערד בקרן פנסיה מקיפה חדשה,ערד 8872 01.03.2034,71124986.0,2019-03-01,6.99507950299065,צמוד למדד המחירים לצרכן,2034-03-01,0.048,0.0485,11063712.47,119.203218,13188.301,13188.301,עלות מופחתת,0.007815,0.004628,,
1328,12138.0,ערד בקרן פנסיה מקיפה חדשה,ערד 8853 01.08.2032,71123939.0,2017-08-01,5.861796993190884,צמוד למדד המחירים לצרכן,2032-08-01,0.048,0.0485,5463905.53,121.005087,6611.604,6611.604,עלות מופחתת,0.003918,0.00232,,
1328,12138.0,ערד בקרן פנסיה מקיפה חדשה,ערד 8837 01.04.2031,71123129.0,2016-04-01,4.785574882157442,צמוד למדד המחירים לצרכן,2031-04-01,0.048,0.0485,1174261.06,123.681618,1452.345,1452.345,עלות מופחתת,0.00086,0.000509,,
1328,12138.0,ערד בקרן פנסיה מקיפה חדשה,ערד 8830 01.09.2030,71122717.0,2015-09-01,4.423084483674979,צמוד למדד המחירים לצרכן,2030-09-01,0.048,0.0485,427488.25,119.070903,509.014,509.014,עלות מופחתת,0.000301,0.000178,,
1328,12138.0,ערד בקרן פנסיה מקיפה חדשה,ערד 8790 01.05.2027,71117162.0,2012-05-01,1.516853486630857,צמוד למדד המחירים לצרכן,2027-05-01,0.048,0.0485,183839.73,124.958178,229.723,229.723,עלות מופחתת,0.000136,8e-05,,
1328,12138.0,ערד בקרן פנסיה מקיפה חדשה,ערד 8772 01.11.2025,71116735.0,2010-11-01,0.08611111111111114,צמוד למדד המחירים לצרכן,2025-11-01,0.048,0.048,61026.26,128.622996,78.494,78.494,עלות מופחתת,4.6e-05,2.7e-05,,
1328,12138.0,ערד בקרן פנסיה מקיפה חדשה,ערד 8904 01.12.2036,71126841.0,2021-12-01,8.632216086765283,צמוד למדד המחירים לצרכן,2036-12-01,0.048,0.0485,25843635.54,117.577516,30386.305,30386.305,עלות מופחתת,0.018007,0.010664,,
1328,12138.0,ערד בקרן פנסיה מקיפה חדשה,ערד 8886 01.06.2035,71125660.0,2020-06-01,7.722456804478874,צמוד למדד המחירים לצרכן,2035-06-01,0.048,0.0485,36150835.34,120.279457,43482.029,43482.029,עלות מופחתת,0.025767,0.01526,,
1328,12138.0,ערד בקרן פנסיה מקיפה חדשה,ערד 8892 01.12.2035,71126163.0,2020-12-01,8.032988084043678,צמוד למדד המחירים לצרכן,2035-12-01,0.048,0.0485,73016788.98,120.279457,87824.198,87824.198,עלות מופחתת,0.052045,0.030822,,
1328,12138.0,ערד בקרן פנסיה מקיפה חדשה,ערד 8885 01.05.2035,71125603.0,2020-05-01,7.63912347114554,צמוד למדד המחירים לצרכן,2035-05-01,0.048,0.0485,19803861.17,120.402353,23844.315,23844.315,עלות מופחתת,0.01413,0.008368,,
1328,12138.0,ערד בקרן פנסיה מקיפה חדשה,ערד 8851 01.06.2032,71123772.0,2017-06-01,5.695130326524218,צמוד למדד המחירים לצרכן,2032-06-01,0.048,0.0485,5284935.73,121.603371,6426.66,6426.66,עלות מופחתת,0.003808,0.002255,,
1328,12138.0,ערד בקרן פנסיה מקיפה חדשה,ערד 8870 01.01.2034,71124796.0,2019-01-01,6.8284128363239835,צמוד למדד המחירים לצרכן,2034-01-01,0.048,0.0485,3741321.16,119.699042,4478.326,4478.326,עלות מופחתת,0.002653,0.001571,,
1328,12138.0,ערד בקרן פנסיה מקיפה חדשה,ערד 8871 01.02.2034,71124945.0,2019-02-01,6.9117461696573175,צמוד למדד המחירים לצרכן,2034-02-01,0.048,0.0485,15393229.46,119.570244,18405.722,18405.722,עלות מופחתת,0.010907,0.006459,,
1328,12138.0,ערד בקרן פנסיה מקיפה חדשה,ערד 8846 01.01.2032,71123616.0,2017-01-01,5.411447050734412,צמוד למדד המחירים לצרכן,2032-01-01,0.048,0.0485,2127092.65,121.494528,2584.301,2584.301,עלות מופחתת,0.001531,0.000906,,
1328,12138.0,ערד בקרן פנסיה מקיפה חדשה,ערד 8831 01.10.2030,71122725.0,2015-10-01,4.400636849279766,צמוד למדד המחירים לצרכן,2030-10-01,0.048,0.0485,151728.65,121.700731,184.655,184.655,עלות מופחתת,0.000109,6.4e-05,,
1328,12138.0,ערד בקרן פנסיה מקיפה חדשה,ערד 8812 01.03.2029,71121651.0,2014-03-01,3.182515412552067,צמוד למדד המחירים לצרכן,2029-03-01,0.048,0.0485,607675.53,119.541567,726.425,726.425,עלות מופחתת,0.00043,0.000254,,
1328,12138.0,ערד בקרן פנסיה מקיפה חדשה,ערד 8805 01.08.2028,71121206.0,2013-08-01,2.665587454544398,צמוד למדד המחירים לצרכן,2028-08-01,0.048,0.0485,477709.36,119.909147,572.817,572.817,עלות מופחתת,0.000339,0.000201,,
1328,12138.0,ערד בקרן פנסיה מקיפה חדשה,ערד 8791 01.06.2027,71119598.0,2012-06-01,1.6001868199641902,צמוד למדד המחירים לצרכן,2027-06-01,0.048,0.0485,43372.78,122.922215,53.315,53.315,עלות מופחתת,3.1e-05,1.8e-05,,
1328,12138.0,ערד בקרן פנסיה מקיפה חדשה,ערד 8810 01.01.2029,71121438.0,2014-01-01,3.0158487458854,צמוד למדד המחירים לצרכן,2029-01-01,0.048,0.0485,465382.36,119.922945,558.1,558.1,עלות מופחתת,0.00033,0.000195,,
1328,12138.0,ערד בקרן פנסיה מקיפה חדשה,ערד 8779 01.06.2026,71118848.0,2011-06-01,0.6577234592804972,צמוד למדד המחירים לצרכן,2026-06-01,0.048,0.0484,71679.23,125.545192,89.99,89.99,עלות מופחתת,5.3e-05,3.1e-05,,
1328,12138.0,ערד בקרן פנסיה מקיפה חדשה,ערד 8780 01.07.2026,71118855.0,2011-07-01,0.7410567926138304,צמוד למדד המחירים לצרכן,2026-07-01,0.048,0.0484,84614.97,124.454088,105.307,105.307,עלות מופחתת,6.2e-05,3.6e-05,,
1328,12138.0,ערד בקרן פנסיה מקיפה חדשה,ערד 8778 01.05.2026,71118830.0,2011-05-01,0.5743895671593743,צמוד למדד המחירים לצרכן,2026-05-01,0.048,0.0485,41546.56,126.786834,52.676,52.676,עלות מופחתת,3.1e-05,1.8e-05,,
1328,12138.0,ערד בקרן פנסיה מקיפה חדשה,ערד 8774 01.01.2026,71116750.0,2011-01-01,0.25277777777777777,צמוד למדד המחירים לצרכן,2026-01-01,0.048,0.0482,88723.97,127.137022,112.801,112.801,עלות מופחתת,6.6e-05,3.9e-05,,
1328,12138.0,ערד בקרן פנסיה מקיפה חדשה,ערד 8896 01.04.2036,71126353.0,2021-04-01,8.169517453559912,צמוד למדד המחירים לצרכן,2036-04-01,0.048,0.0485,61004353.92,121.350083,74028.835,74028.835,עלות מופחתת,0.04387,0.025981,,
1328,12138.0,ערד בקרן פנסיה מקיפה חדשה,ערד 8894 01.02.2036,71126288.0,2021-02-01,8.199654750710344,צמוד למדד המחירים לצרכן,2036-02-01,0.048,0.0485,70358265.58,119.687329,84209.929,84209.929,עלות מופחתת,0.049903,0.029554,,
1328,12138.0,ערד בקרן פנסיה מקיפה חדשה,ערד 8889 01.09.2035,71126098.0,2020-09-01,7.972456804478872,צמוד למדד המחירים לצרכן,2035-09-01,0.048,0.0485,52654103.72,119.084253,62702.746,62702.746,עלות מופחתת,0.037158,0.022006,,
1328,12138.0,ערד בקרן פנסיה מקיפה חדשה,ערד 8891 01.11.2035,71126130.0,2020-11-01,7.949654750710344,צמוד למדד המחירים לצרכן,2035-11-01,0.048,0.0485,39200626.92,121.124046,47481.386,47481.386,עלות מופחתת,0.028138,0.016664,,
1328,12138.0,ערד בקרן פנסיה מקיפה חדשה,ערד 8862 01.05.2033,71124473.0,2018-05-01,6.320081206151133,צמוד למדד המחירים לצרכן,2033-05-01,0.048,0.0485,6323143.22,122.091348,7720.011,7720.011,עלות מופחתת,0.004574,0.002709,,
1328,12138.0,ערד בקרן פנסיה מקיפה חדשה,ערד 8878 01.09.2034,71125348.0,2019-09-01,7.3286838198280755,צמוד למדד המחירים לצרכן,2034-09-01,0.048,0.0485,11112107.36,118.375418,13154.004,13154.004,עלות מופחתת,0.007795,0.004616,,
1328,12138.0,ערד בקרן פנסיה מקיפה חדשה,ערד 8843 01.10.2031,71123517.0,2016-10-01,5.161447050734411,צמוד למדד המחירים לצרכן,2031-10-01,0.048,0.0485,987986.37,122.559506,1210.871,1210.871,עלות מופחתת,0.000717,0.000424,,
1328,12138.0,ערד בקרן פנסיה מקיפה חדשה,ערד 8838 01.05.2031,71123293.0,2016-05-01,4.868908215490777,צמוד למדד המחירים לצרכן,2031-05-01,0.048,0.0485,1241679.11,123.456257,1532.931,1532.931,עלות מופחתת,0.000908,0.000538,,
1328,12138.0,ערד בקרן פנסיה מקיפה חדשה,ערד 8836 01.03.2031,71123079.0,2016-03-01,4.817303515946432,צמוד למדד המחירים לצרכן,2031-03-01,0.048,0.0485,164207.83,120.882326,198.498,198.498,עלות מופחתת,0.000117,6.9e-05,,
1328,12138.0,ערד בקרן פנסיה מקיפה חדשה,ערד 8833 01.12.2030,71122774.0,2015-12-01,4.567303515946433,צמוד למדד המחירים לצרכן,2030-12-01,0.048,0.0485,674180.47,121.110975,816.507,816.507,עלות מופחתת,0.000483,0.000286,,
1328,12138.0,ערד בקרן פנסיה מקיפה חדשה,ערד 8829 01.08.2030,71122626.0,2015-08-01,4.339751150341647,צמוד למדד המחירים לצרכן,2030-08-01,0.048,0.0485,1099081.57,119.793825,1316.632,1316.632,עלות מופחתת,0.00078,0.000462,,
1328,12138.0,ערד בקרן פנסיה מקיפה חדשה,ערד 8827 01.06.2030,71122543.0,2015-06-01,4.17308448367498,צמוד למדד המחירים לצרכן,2030-06-01,0.048,0.0485,473752.55,121.354659,574.921,574.921,עלות מופחתת,0.00034,0.000201,,
1328,12138.0,ערד בקרן פנסיה מקיפה חדשה,ערד 8824 01.03.2030,71122428.0,2015-03-01,4.0193643837764474,צמוד למדד המחירים לצרכן,2030-03-01,0.048,0.0485,1175782.92,120.151183,1412.717,1412.717,עלות מופחתת,0.000837,0.000495,,
1328,12138.0,ערד בקרן פנסיה מקיפה חדשה,ערד 8819 01.10.2029,71121768.0,2014-10-01,3.6026977171097805,צמוד למדד המחירים לצרכן,2029-10-01,0.048,0.0485,518951.56,121.222494,629.086,629.086,עלות מופחתת,0.000372,0.00022,,
1328,12138.0,ערד בקרן פנסיה מקיפה חדשה,ערד 8797 01.12.2027,71120570.0,2012-12-01,2.0548933704687102,צמוד למדד המחירים לצרכן,2027-12-01,0.048,0.0485,250344.66,122.110465,305.697,305.697,עלות מופחתת,0.000181,0.000107,,
1328,12138.0,ערד בקרן פנסיה מקיפה חדשה,ערד 8811 01.02.2029,71121578.0,2014-02-01,3.099182079218734,צמוד למדד המחירים לצרכן,2029-02-01,0.048,0.0485,350178.16,119.323081,417.843,417.843,עלות מופחתת,0.000247,0.000146,,
1328,12138.0,ערד בקרן פנסיה מקיפה חדשה,ערד 8809 01.12.2028,71121305.0,2013-12-01,2.932515412552067,צמוד למדד המחירים לצרכן,2028-12-01,0.048,0.0485,478622.48,119.921112,573.969,573.969,עלות מופחתת,0.00034,0.000201,,
1328,12138.0,ערד בקרן פנסיה מקיפה חדשה,ערד 8796 01.11.2027,71120448.0,2012-11-01,1.971560037135377,צמוד למדד המחירים לצרכן,2027-11-01,0.048,0.0485,262062.92,122.369591,320.685,320.685,עלות מופחתת,0.00019,0.000112,,
1328,12138.0,ערד בקרן פנסיה מקיפה חדשה,ערד 8795 01.10.2027,71120356.0,2012-10-01,1.8882267038020435,צמוד למדד המחירים לצרכן,2027-10-01,0.048,0.0485,255671.15,122.842903,314.074,314.074,עלות מופחתת,0.000186,0.00011,,
1328,12138.0,ערד בקרן פנסיה מקיפה חדשה,ערד 8804 01.07.2028,71121107.0,2013-07-01,2.582254121211065,צמוד למדד המחירים לצרכן,2028-07-01,0.048,0.0485,179121.99,121.347772,217.361,217.361,עלות מופחתת,0.000128,7.6e-05,,
1328,12138.0,ערד בקרן פנסיה מקיפה חדשה,ערד 8785 01.12.2026,71119127.0,2011-12-01,1.134549207576438,צמוד למדד המחירים לצרכן,2026-12-01,0.048,0.0485,142901.91,124.458743,177.854,177.854,עלות מופחתת,0.000105,6.2e-05,,
1328,12138.0,ערד בקרן פנסיה מקיפה חדשה,ערד 8787 01.02.2027,71116420.0,2012-02-01,1.3012158742431048,צמוד למדד המחירים לצרכן,2027-02-01,0.048,0.0485,177752.32,123.475983,219.481,219.481,עלות מופחתת,0.00013,7.7e-05,,
1328,12138.0,ערד בקרן פנסיה מקיפה חדשה,ערד 8794 01.09.2027,71120232.0,2012-09-01,1.85018681996419,צמוד למדד המחירים לצרכן,2027-09-01,0.048,0.0485,220820.73,121.689448,268.716,268.716,עלות מופחתת,0.000159,9.4e-05,,
1328,12138.0,ערד בקרן פנסיה מקיפה חדשה,ערד 8807 01.10.2028,71120950.0,2013-10-01,2.7658487458854006,צמוד למדד המחירים לצרכן,2028-10-01,0.048,0.0485,495971.59,121.459952,602.407,602.407,עלות מופחתת,0.000356,0.000211,,
1328,12138.0,ערד בקרן פנסיה מקיפה חדשה,ערד 8868 01.11.2033,71124689.0,2018-11-01,6.661746169657317,צמוד למדד המחירים לצרכן,2033-11-01,0.048,0.0485,390811.61,120.647903,471.506,471.506,עלות מופחתת,0.000279,0.000165,,
1328,12138.0,ערד בקרן פנסיה מקיפה חדשה,ערד 8857 01.12.2032,71124127.0,2017-12-01,6.053496951908582,צמוד למדד המחירים לצרכן,2032-12-01,0.048,0.0485,4255859.35,121.240736,5159.835,5159.835,עלות מופחתת,0.003057,0.00181,,
1328,12138.0,ערד בקרן פנסיה מקיפה חדשה,ערד 8875 01.06.2034,71125231.0,2019-06-01,7.078683819828075,צמוד למדד המחירים לצרכן,2034-06-01,0.048,0.0485,5286001.03,119.564926,6320.203,6320.203,עלות מופחתת,0.003745,0.002218,,
1328,12138.0,ערד בקרן פנסיה מקיפה חדשה,ערד 8784 01.11.2026,71118905.0,2011-11-01,1.0512158742431044,צמוד למדד המחירים לצרכן,2026-11-01,0.048,0.0485,138640.72,124.958178,173.243,173.243,עלות מופחתת,0.000102,6e-05,,
1328,12138.0,ערד בקרן פנסיה מקיפה חדשה,ערד 8847 01.02.2032,71123665.0,2017-02-01,5.494780384067743,צמוד למדד המחירים לצרכן,2032-02-01,0.048,0.0485,1959536.74,121.005087,2371.139,2371.139,עלות מופחתת,0.001405,0.000832,,
1328,12138.0,ערד בקרן פנסיה מקיפה חדשה,ערד 8845 01.12.2031,71123533.0,2016-12-01,5.328113717401077,צמוד למדד המחירים לצרכן,2031-12-01,0.048,0.0485,1618794.06,121.476869,1966.46,1966.46,עלות מופחתת,0.001165,0.00069,,
1328,12138.0,ערד בקרן פנסיה מקיפה חדשה,ערד 8840 01.07.2031,71123350.0,2016-07-01,5.035574882157443,צמוד למדד המחירים לצרכן,2031-07-01,0.048,0.0485,442858.95,121.617498,538.594,538.594,עלות מופחתת,0.000319,0.000189,,
1328,12138.0,ערד בקרן פנסיה מקיפה חדשה,ערד 8828 01.07.2030,71122550.0,2015-07-01,4.256417817008314,צמוד למדד המחירים לצרכן,2030-07-01,0.048,0.0485,330394.08,120.640651,398.59,398.59,עלות מופחתת,0.000236,0.000139,,
1328,12138.0,ערד בקרן פנסיה מקיפה חדשה,ערד 8835 01.02.2031,71123061.0,2016-02-01,4.733970182613099,צמוד למדד המחירים לצרכן,2031-02-01,0.048,0.0485,81875.64,120.760879,98.874,98.874,עלות מופחתת,5.8e-05,3.4e-05,,
1328,12138.0,ערד בקרן פנסיה מקיפה חדשה,ערד 8821 01.12.2029,71121784.0,2014-12-01,3.769364383776447,צמוד למדד המחירים לצרכן,2029-12-01,0.048,0.0485,667484.32,120.272787,802.802,802.802,עלות מופחתת,0.000475,0.000281,,
1328,12138.0,ערד בקרן פנסיה מקיפה חדשה,ערד 8783 01.10.2026,71116503.0,2011-10-01,0.9678825409097713,צמוד למדד המחירים לצרכן,2026-10-01,0.048,0.0485,50068.93,125.8044,62.989,62.989,עלות מופחתת,3.7e-05,2.2e-05,,
1328,12138.0,ערד בקרן פנסיה מקיפה חדשה,ערד 8782 01.09.2026,71116511.0,2011-09-01,0.9077229004927079,צמוד למדד המחירים לצרכן,2026-09-01,0.048,0.0485,42155.3,122.976548,51.841,51.841,עלות מופחתת,3e-05,1.8e-05,,
1328,12138.0,ערד בקרן פנסיה מקיפה חדשה,ערד 8786 01.01.2027,71116487.0,2012-01-01,1.217882540909771,צמוד למדד המחירים לצרכן,2027-01-01,0.048,0.0485,166794.98,123.856326,206.586,206.586,עלות מופחתת,0.000122,7.2e-05,,
1328,12419.0,ערד בקרן פנסיה מקיפה חדשה,ערד 8786 01.01.2027,71116487.0,2012-01-01,1.217882540909771,צמוד למדד המחירים לצרכן,2027-01-01,0.048,0.0485,110431.31,123.856326,136.776,136.776,עלות מופחתת,0.000121,3.3e-05,,
1328,12419.0,ערד בקרן פנסיה מקיפה חדשה,ערד 8782 01.09.2026,71116511.0,2011-09-01,0.9077229004927079,צמוד למדד המחירים לצרכן,2026-09-01,0.048,0.0485,27910.1,122.976548,34.323,34.323,עלות מופחתת,3e-05,8e-06,,
1328,12419.0,ערד בקרן פנסיה מקיפה חדשה,ערד 8783 01.10.2026,71116503.0,2011-10-01,0.9678825409097713,צמוד למדד המחירים לצרכן,2026-10-01,0.048,0.0485,33149.54,125.8044,41.704,41.704,עלות מופחתת,3.7e-05,1e-05,,
1328,12419.0,ערד בקרן פנסיה מקיפה חדשה,ערד 8835 01.02.2031,71123061.0,2016-02-01,4.733970182613099,צמוד למדד המחירים לצרכן,2031-02-01,0.048,0.0485,54208.07,120.760879,65.462,65.462,עלות מופחתת,5.8e-05,1.5e-05,,
1328,12419.0,ערד בקרן פנסיה מקיפה חדשה,ערד 8840 01.07.2031,71123350.0,2016-07-01,5.035574882157443,צמוד למדד המחירים לצרכן,2031-07-01,0.048,0.0485,293207.23,121.617498,356.591,356.591,עלות מופחתת,0.000316,8.6e-05,,
1328,12419.0,ערד בקרן פנסיה מקיפה חדשה,ערד 8828 01.07.2030,71122550.0,2015-07-01,4.256417817008314,צמוד למדד המחירים לצרכן,2030-07-01,0.048,0.0485,218746.7,120.640651,263.897,263.897,עלות מופחתת,0.000234,6.4e-05,,
1328,12419.0,ערד בקרן פנסיה מקיפה חדשה,ערד 8821 01.12.2029,71121784.0,2014-12-01,3.769364383776447,צמוד למדד המחירים לצרכן,2029-12-01,0.048,0.0485,441926.77,120.272787,531.518,531.518,עלות מופחתת,0.000471,0.000129,,
1328,12419.0,ערד בקרן פנסיה מקיפה חדשה,ערד 8845 01.12.2031,71123533.0,2016-12-01,5.328113717401077,צמוד למדד המחירים לצרכן,2031-12-01,0.048,0.0485,1071768.14,121.476869,1301.95,1301.95,עלות מופחתת,0.001155,0.000317,,
1328,12419.0,ערד בקרן פנסיה מקיפה חדשה,ערד 8847 01.02.2032,71123665.0,2017-02-01,5.494780384067743,צמוד למדד המחירים לצרכן,2032-02-01,0.048,0.0485,1297366.42,121.005087,1569.879,1569.879,עלות מופחתת,0.001393,0.000382,,
1328,12419.0,ערד בקרן פנסיה מקיפה חדשה,ערד 8875 01.06.2034,71125231.0,2019-06-01,7.078683819828075,צמוד למדד המחירים לצרכן,2034-06-01,0.048,0.0485,3499745.68,119.564926,4184.468,4184.468,עלות מופחתת,0.003714,0.001019,,
1328,12419.0,ערד בקרן פנסיה מקיפה חדשה,ערד 8857 01.12.2032,71124127.0,2017-12-01,6.053496951908582,צמוד למדד המחירים לצרכן,2032-12-01,0.048,0.0485,2817711.41,121.240736,3416.214,3416.214,עלות מופחתת,0.003032,0.000832,,
1328,12419.0,ערד בקרן פנסיה מקיפה חדשה,ערד 8868 01.11.2033,71124689.0,2018-11-01,6.661746169657317,צמוד למדד המחירים לצרכן,2033-11-01,0.048,0.0485,258747.82,120.647903,312.174,312.174,עלות מופחתת,0.000277,7.6e-05,,
1328,12419.0,ערד בקרן פנסיה מקיפה חדשה,ערד 8787 01.02.2027,71116420.0,2012-02-01,1.3012158742431048,צמוד למדד המחירים לצרכן,2027-02-01,0.048,0.0485,117685.92,123.475983,145.314,145.314,עלות מופחתת,0.000129,3.5e-05,,
1328,12419.0,ערד בקרן פנסיה מקיפה חדשה,ערד 8794 01.09.2027,71120232.0,2012-09-01,1.85018681996419,צמוד למדד המחירים לצרכן,2027-09-01,0.048,0.0485,146200.58,121.689448,177.911,177.911,עלות מופחתת,0.000157,4.3e-05,,
1328,12419.0,ערד בקרן פנסיה מקיפה חדשה,ערד 8784 01.11.2026,71118905.0,2011-11-01,1.0512158742431044,צמוד למדד המחירים לצרכן,2026-11-01,0.048,0.0485,91790.99,124.958178,114.7,114.7,עלות מופחתת,0.000101,2.7e-05,,
1328,12419.0,ערד בקרן פנסיה מקיפה חדשה,ערד 8785 01.12.2026,71119127.0,2011-12-01,1.134549207576438,צמוד למדד המחירים לצרכן,2026-12-01,0.048,0.0485,94612.23,124.458743,117.753,117.753,עלות מופחתת,0.000104,2.8e-05,,
1328,12419.0,ערד בקרן פנסיה מקיפה חדשה,ערד 8807 01.10.2028,71120950.0,2013-10-01,2.7658487458854006,צמוד למדד המחירים לצרכן,2028-10-01,0.048,0.0485,328371.94,121.459952,398.84,398.84,עלות מופחתת,0.000354,9.7e-05,,
1328,12419.0,ערד בקרן פנסיה מקיפה חדשה,ערד 8804 01.07.2028,71121107.0,2013-07-01,2.582254121211065,צמוד למדד המחירים לצרכן,2028-07-01,0.048,0.0485,118592.75,121.347772,143.91,143.91,עלות מופחתת,0.000127,3.5e-05,,
1328,12419.0,ערד בקרן פנסיה מקיפה חדשה,ערד 8795 01.10.2027,71120356.0,2012-10-01,1.8882267038020435,צמוד למדד המחירים לצרכן,2027-10-01,0.048,0.0485,169274.27,122.842903,207.941,207.941,עלות מופחתת,0.000184,5e-05,,
1328,12419.0,ערד בקרן פנסיה מקיפה חדשה,ערד 8796 01.11.2027,71120448.0,2012-11-01,1.971560037135377,צמוד למדד המחירים לצרכן,2027-11-01,0.048,0.0485,173506.13,122.369591,212.319,212.319,עלות מופחתת,0.000188,5.1e-05,,
1328,12419.0,ערד בקרן פנסיה מקיפה חדשה,ערד 8809 01.12.2028,71121305.0,2013-12-01,2.932515412552067,צמוד למדד המחירים לצרכן,2028-12-01,0.048,0.0485,316885.47,119.921112,380.013,380.013,עלות מופחתת,0.000337,9.2e-05,,
1328,12419.0,ערד בקרן פנסיה מקיפה חדשה,ערד 8811 01.02.2029,71121578.0,2014-02-01,3.099182079218734,צמוד למדד המחירים לצרכן,2029-02-01,0.048,0.0485,231845.3,119.323081,276.645,276.645,עלות מופחתת,0.000245,6.7e-05,,
1328,12419.0,ערד בקרן פנסיה מקיפה חדשה,ערד 8797 01.12.2027,71120570.0,2012-12-01,2.0548933704687102,צמוד למדד המחירים לצרכן,2027-12-01,0.048,0.0485,165747.73,122.110465,202.395,202.395,עלות מופחתת,0.000179,4.9e-05,,
1328,12419.0,ערד בקרן פנסיה מקיפה חדשה,ערד 8824 01.03.2030,71122428.0,2015-03-01,4.0193643837764474,צמוד למדד המחירים לצרכן,2030-03-01,0.048,0.0485,778460.15,120.151183,935.329,935.329,עלות מופחתת,0.00083,0.000227,,
1328,12419.0,ערד בקרן פנסיה מקיפה חדשה,ערד 8819 01.10.2029,71121768.0,2014-10-01,3.6026977171097805,צמוד למדד המחירים לצרכן,2029-10-01,0.048,0.0485,343586.48,121.222494,416.504,416.504,עלות מופחתת,0.000369,0.000101,,
1328,12419.0,ערד בקרן פנסיה מקיפה חדשה,ערד 8827 01.06.2030,71122543.0,2015-06-01,4.17308448367498,צמוד למדד המחירים לצרכן,2030-06-01,0.048,0.0485,313661.2,121.354659,380.642,380.642,עלות מופחתת,0.000337,9.2e-05,,
1328,12419.0,ערד בקרן פנסיה מקיפה חדשה,ערד 8829 01.08.2030,71122626.0,2015-08-01,4.339751150341647,צמוד למדד המחירים לצרכן,2030-08-01,0.048,0.0485,727677.87,119.793825,871.713,871.713,עלות מופחתת,0.000773,0.000212,,
1328,12419.0,ערד בקרן פנסיה מקיפה חדשה,ערד 8833 01.12.2030,71122774.0,2015-12-01,4.567303515946433,צמוד למדד המחירים לצרכן,2030-12-01,0.048,0.0485,446360.14,121.110975,540.591,540.591,עלות מופחתת,0.000479,0.000131,,
1328,12419.0,ערד בקרן פנסיה מקיפה חדשה,ערד 8836 01.03.2031,71123079.0,2016-03-01,4.817303515946432,צמוד למדד המחירים לצרכן,2031-03-01,0.048,0.0485,108718.41,120.882326,131.421,131.421,עלות מופחתת,0.000116,3.2e-05,,
1328,12419.0,ערד בקרן פנסיה מקיפה חדשה,ערד 8838 01.05.2031,71123293.0,2016-05-01,4.868908215490777,צמוד למדד המחירים לצרכן,2031-05-01,0.048,0.0485,822088.58,123.456257,1014.92,1014.92,עלות מופחתת,0.000901,0.000247,,
1328,12419.0,ערד בקרן פנסיה מקיפה חדשה,ערד 8843 01.10.2031,71123517.0,2016-10-01,5.161447050734411,צמוד למדד המחירים לצרכן,2031-10-01,0.048,0.0485,654124.17,122.559506,801.691,801.691,עלות מופחתת,0.000711,0.000195,,
1328,12419.0,ערד בקרן פנסיה מקיפה חדשה,ערד 8862 01.05.2033,71124473.0,2018-05-01,6.320081206151133,צמוד למדד המחירים לצרכן,2033-05-01,0.048,0.0485,4186414.85,122.091348,5111.25,5111.25,עלות מופחתת,0.004537,0.001245,,
1328,12419.0,ערד בקרן פנסיה מקיפה חדשה,ערד 8878 01.09.2034,71125348.0,2019-09-01,7.3286838198280755,צמוד למדד המחירים לצרכן,2034-09-01,0.048,0.0485,7357083.28,118.375418,8708.978,8708.978,עלות מופחתת,0.007731,0.002121,,
1328,12419.0,ערד בקרן פנסיה מקיפה חדשה,ערד 8891 01.11.2035,71126130.0,2020-11-01,7.949654750710344,צמוד למדד המחירים לצרכן,2035-11-01,0.048,0.0485,25953877.84,121.124046,31436.387,31436.387,עלות מופחתת,0.027909,0.007658,,
1328,12419.0,ערד בקרן פנסיה מקיפה חדשה,ערד 8889 01.09.2035,71126098.0,2020-09-01,7.972456804478872,צמוד למדד המחירים לצרכן,2035-09-01,0.048,0.0485,34861130.63,119.084253,41514.117,41514.117,עלות מופחתת,0.036856,0.010113,,
1328,12419.0,ערד בקרן פנסיה מקיפה חדשה,ערד 8894 01.02.2036,71126288.0,2021-02-01,8.199654750710344,צמוד למדד המחירים לצרכן,2036-02-01,0.048,0.0485,46582669.04,119.687329,55753.553,55753.553,עלות מופחתת,0.049497,0.013582,,
1328,12419.0,ערד בקרן פנסיה מקיפה חדשה,ערד 8896 01.04.2036,71126353.0,2021-04-01,8.169517453559912,צמוד למדד המחירים לצרכן,2036-04-01,0.048,0.0485,40389648.69,121.350083,49012.873,49012.873,עלות מופחתת,0.043513,0.01194,,
1328,12419.0,ערד בקרן פנסיה מקיפה חדשה,ערד 8774 01.01.2026,71116750.0,2011-01-01,0.25277777777777777,צמוד למדד המחירים לצרכן,2026-01-01,0.048,0.0482,58742.2,127.137022,74.683,74.683,עלות מופחתת,6.6e-05,1.8e-05,,
1328,12419.0,ערד בקרן פנסיה מקיפה חדשה,ערד 8778 01.05.2026,71118830.0,2011-05-01,0.5743895671593743,צמוד למדד המחירים לצרכן,2026-05-01,0.048,0.0485,27507.07,126.786834,34.875,34.875,עלות מופחתת,3e-05,8e-06,,
1328,12419.0,ערד בקרן פנסיה מקיפה חדשה,ערד 8779 01.06.2026,71118848.0,2011-06-01,0.6577234592804972,צמוד למדד המחירים לצרכן,2026-06-01,0.048,0.0484,47457.25,125.545192,59.58,59.58,עלות מופחתת,5.2e-05,1.4e-05,,
1328,12419.0,ערד בקרן פנסיה מקיפה חדשה,ערד 8780 01.07.2026,71118855.0,2011-07-01,0.7410567926138304,צמוד למדד המחירים לצרכן,2026-07-01,0.048,0.0484,56021.72,124.454088,69.721,69.721,עלות מופחתת,6.1e-05,1.6e-05,,
1328,12419.0,ערד בקרן פנסיה מקיפה חדשה,ערד 8810 01.01.2029,71121438.0,2014-01-01,3.0158487458854,צמוד למדד המחירים לצרכן,2029-01-01,0.048,0.0485,308119.48,119.922945,369.506,369.506,עלות מופחתת,0.000328,9e-05,,
1328,12419.0,ערד בקרן פנסיה מקיפה חדשה,ערד 8812 01.03.2029,71121651.0,2014-03-01,3.182515412552067,צמוד למדד המחירים לצרכן,2029-03-01,0.048,0.0485,402328.68,119.541567,480.95,480.95,עלות מופחתת,0.000426,0.000117,,
1328,12419.0,ערד בקרן פנסיה מקיפה חדשה,ערד 8791 01.06.2027,71119598.0,2012-06-01,1.6001868199641902,צמוד למדד המחירים לצרכן,2027-06-01,0.048,0.0485,28716.17,122.922215,35.299,35.299,עלות מופחתת,3.1e-05,8e-06,,
1328,12419.0,ערד בקרן פנסיה מקיפה חדשה,ערד 8805 01.08.2028,71121206.0,2013-08-01,2.665587454544398,צמוד למדד המחירים לצרכן,2028-08-01,0.048,0.0485,316280.92,119.909147,379.25,379.25,עלות מופחתת,0.000336,9.2e-05,,
1328,12419.0,ערד בקרן פנסיה מקיפה חדשה,ערד 8831 01.10.2030,71122725.0,2015-10-01,4.400636849279766,צמוד למדד המחירים לצרכן,2030-10-01,0.048,0.0485,100456.22,121.700731,122.256,122.256,עלות מופחתת,0.000108,2.9e-05,,
1328,12419.0,ערד בקרן פנסיה מקיפה חדשה,ערד 8846 01.01.2032,71123616.0,2017-01-01,5.411447050734412,צמוד למדד המחירים לצרכן,2032-01-01,0.048,0.0485,1408301.53,121.494528,1711.009,1711.009,עלות מופחתת,0.001519,0.000416,,
1328,12419.0,ערד בקרן פנסיה מקיפה חדשה,ערד 8871 01.02.2034,71124945.0,2019-02-01,6.9117461696573175,צמוד למדד המחירים לצרכן,2034-02-01,0.048,0.0485,10191520.61,119.570244,12186.026,12186.026,עלות מופחתת,0.010818,0.002968,,
1328,12419.0,ערד בקרן פנסיה מקיפה חדשה,ערד 8885 01.05.2035,71125603.0,2020-05-01,7.63912347114554,צמוד למדד המחירים לצרכן,2035-05-01,0.048,0.0485,13111703.41,120.402353,15786.8,15786.8,עלות מופחתת,0.014015,0.003846,,
1328,12419.0,ערד בקרן פנסיה מקיפה חדשה,ערד 8851 01.06.2032,71123772.0,2017-06-01,5.695130326524218,צמוד למדד המחירים לצרכן,2032-06-01,0.048,0.0485,3499040.37,121.603371,4254.951,4254.951,עלות מופחתת,0.003777,0.001036,,
1328,12419.0,ערד בקרן פנסיה מקיפה חדשה,ערד 8870 01.01.2034,71124796.0,2019-01-01,6.8284128363239835,צמוד למדד המחירים לצרכן,2034-01-01,0.048,0.0485,2477046.92,119.699042,2965.001,2965.001,עלות מופחתת,0.002632,0.000722,,
1328,12419.0,ערד בקרן פנסיה מקיפה חדשה,ערד 8886 01.06.2035,71125660.0,2020-06-01,7.722456804478874,צמוד למדד המחירים לצרכן,2035-06-01,0.048,0.0485,23934677.53,120.279457,28788.5,28788.5,עלות מופחתת,0.025558,0.007013,,
1328,12419.0,ערד בקרן פנסיה מקיפה חדשה,ערד 8892 01.12.2035,71126163.0,2020-12-01,8.032988084043678,צמוד למדד המחירים לצרכן,2035-12-01,0.048,0.0485,48342819.25,120.279457,58146.481,58146.481,עלות מופחתת,0.051622,0.014165,,
1328,12419.0,ערד בקרן פנסיה מקיפה חדשה,ערד 8904 01.12.2036,71126841.0,2021-12-01,8.632216086765283,צמוד למדד המחירים לצרכן,2036-12-01,0.048,0.0485,17110505.94,117.577516,20118.108,20118.108,עלות מופחתת,0.01786,0.004901,,
1328,12419.0,ערד בקרן פנסיה מקיפה חדשה,ערד 8772 01.11.2025,71116735.0,2010-11-01,0.08611111111111114,צמוד למדד המחירים לצרכן,2025-11-01,0.048,0.048,40404.15,128.622996,51.969,51.969,עלות מופחתת,4.6e-05,1.2e-05,,
1328,12419.0,ערד בקרן פנסיה מקיפה חדשה,ערד 8790 01.05.2027,71117162.0,2012-05-01,1.516853486630857,צמוד למדד המחירים לצרכן,2027-05-01,0.048,0.0485,121716.26,124.958178,152.094,152.094,עלות מופחתת,0.000135,3.7e-05,,
1328,12419.0,ערד בקרן פנסיה מקיפה חדשה,ערד 8830 01.09.2030,71122717.0,2015-09-01,4.423084483674979,צמוד למדד המחירים לצרכן,2030-09-01,0.048,0.0485,283030.62,119.070903,337.007,337.007,עלות מופחתת,0.000299,8.2e-05,,
1328,12419.0,ערד בקרן פנסיה מקיפה חדשה,ערד 8837 01.04.2031,71123129.0,2016-04-01,4.785574882157442,צמוד למדד המחירים לצרכן,2031-04-01,0.048,0.0485,777452.57,123.681618,961.566,961.566,עלות מופחתת,0.000853,0.000234,,
1328,12419.0,ערד בקרן פנסיה מקיפה חדשה,ערד 8853 01.08.2032,71123939.0,2017-08-01,5.861796993190884,צמוד למדד המחירים לצרכן,2032-08-01,0.048,0.0485,3617532.37,121.005087,4377.398,4377.398,עלות מופחתת,0.003886,0.001066,,
1328,12419.0,ערד בקרן פנסיה מקיפה חדשה,ערד 8872 01.03.2034,71124986.0,2019-03-01,6.99507950299065,צמוד למדד המחירים לצרכן,2034-03-01,0.048,0.0485,7325042.08,119.203218,8731.686,8731.686,עלות מופחתת,0.007751,0.002127,,
1328,12419.0,ערד בקרן פנסיה מקיפה חדשה,ערד 8873 01.04.2034,71125108.0,2019-04-01,6.912017153161408,צמוד למדד המחירים לצרכן,2034-04-01,0.048,0.0485,5348059.58,121.471191,6496.352,6496.352,עלות מופחתת,0.005767,0.001582,,
1328,12419.0,ערד בקרן פנסיה מקיפה חדשה,ערד 8854 01.09.2032,71123947.0,2017-09-01,5.945130326524218,צמוד למדד המחירים לצרכן,2032-09-01,0.048,0.0485,3688164.08,120.636282,4449.264,4449.264,עלות מופחתת,0.00395,0.001083,,
1328,12419.0,ערד בקרן פנסיה מקיפה חדשה,ערד 8859 01.02.2033,71124325.0,2018-02-01,6.220163618575248,צמוד למדד המחירים לצרכן,2033-02-01,0.048,0.0485,6360480.97,120.522995,7665.842,7665.842,עלות מופחתת,0.006805,0.001867,,
1328,12419.0,ערד בקרן פנסיה מקיפה חדשה,ערד 8879 01.10.2034,71125389.0,2019-10-01,7.2377484585225185,צמוד למדד המחירים לצרכן,2034-10-01,0.048,0.0485,11943710.9,120.509043,14393.252,14393.252,עלות מופחתת,0.012778,0.003506,,
1328,12419.0,ערד בקרן פנסיה מקיפה חדשה,ערד 8882 01.01.2035,71125454.0,2020-01-01,7.48774845852252,צמוד למדד המחירים לצרכן,2035-01-01,0.048,0.0485,18781787.16,119.336917,22413.606,22413.606,עלות מופחתת,0.019898,0.00546,,
1328,12419.0,ערד בקרן פנסיה מקיפה חדשה,ערד 8884 01.03.2035,71125512.0,2020-03-01,7.654415125189185,צמוד למדד המחירים לצרכן,2035-03-01,0.048,0.0485,10918593.93,118.847034,12976.425,12976.425,עלות מופחתת,0.01152,0.003161,,
1328,12419.0,ערד בקרן פנסיה מקיפה חדשה,ערד 8890 01.10.2035,71126106.0,2020-10-01,7.8663214173770095,צמוד למדד המחירים לצרכן,2035-10-01,0.048,0.0485,12497076.57,121.471191,15180.348,15180.348,עלות מופחתת,0.013477,0.003698,,
1328,12419.0,ערד בקרן פנסיה מקיפה חדשה,ערד 8898 01.06.2036,71126445.0,2021-06-01,8.336184120226578,צמוד למדד המחירים לצרכן,2036-06-01,0.048,0.0485,30500101.3,119.325448,36394.383,36394.383,עלות מופחתת,0.03231,0.008866,,
1328,12419.0,ערד בקרן פנסיה מקיפה חדשה,ערד 8905 01.01.2037,71126981.0,2022-01-01,8.715549420098617,צמוד למדד המחירים לצרכן,2037-01-01,0.048,0.0485,20799677.61,117.235403,24384.586,24384.586,עלות מופחתת,0.021648,0.00594,,
1328,12419.0,ערד בקרן פנסיה מקיפה חדשה,ערד 8788 01.03.2027,71116727.0,2012-03-01,1.384549207576438,צמוד למדד המחירים לצרכן,2027-03-01,0.048,0.0485,134714.11,122.976548,165.667,165.667,עלות מופחתת,0.000147,4e-05,,
1328,12419.0,ערד בקרן פנסיה מקיפה חדשה,ערד 8777 01.04.2026,71118822.0,2011-04-01,0.49105623382604097,צמוד למדד המחירים לצרכן,2026-04-01,0.048,0.0485,71538.53,127.526063,91.23,91.23,עלות מופחתת,8e-05,2.2e-05,,
1328,12419.0,ערד בקרן פנסיה מקיפה חדשה,ערד 8793 01.08.2027,71119846.0,2012-08-01,1.766853486630857,צמוד למדד המחירים לצרכן,2027-08-01,0.048,0.0485,193254.8,122.300021,236.351,236.351,עלות מופחתת,0.000209,5.7e-05,,
1328,12419.0,ערד בקרן פנסיה מקיפה חדשה,ערד 8799 01.02.2028,71120612.0,2013-02-01,2.221560037135377,צמוד למדד המחירים לצרכן,2028-02-01,0.048,0.0485,161818.14,121.490087,196.593,196.593,עלות מופחתת,0.000174,4.7e-05,,
1328,12419.0,ערד בקרן פנסיה מקיפה חדשה,ערד 8802 01.05.2028,71121016.0,2013-05-01,2.415587454544398,צמוד למדד המחירים לצרכן,2028-05-01,0.048,0.0485,227814.96,122.918209,280.026,280.026,עלות מופחתת,0.000248,6.8e-05,,
1328,12419.0,ערד בקרן פנסיה מקיפה חדשה,ערד 8813 01.04.2029,71121669.0,2014-04-01,3.18925144352555,צמוד למדד המחירים לצרכן,2029-04-01,0.048,0.0485,316482.44,122.177942,386.672,386.672,עלות מופחתת,0.000343,9.4e-05,,
1328,12419.0,ערד בקרן פנסיה מקיפה חדשה,ערד 8820 01.11.2029,71121776.0,2014-11-01,3.686031050443114,צמוד למדד המחירים לצרכן,2029-11-01,0.048,0.0485,362629.83,121.110588,439.183,439.183,עלות מופחתת,0.000389,0.000106,,
1328,12419.0,ערד בקרן פנסיה מקיפה חדשה,ערד 8815 01.06.2029,71121685.0,2014-06-01,3.355918110192216,צמוד למדד המחירים לצרכן,2029-06-01,0.048,0.0485,479509.69,120.744908,578.984,578.984,עלות מופחתת,0.000514,0.000141,,
1328,12419.0,ערד בקרן פנסיה מקיפה חדשה,ערד 8823 01.02.2030,71122410.0,2015-02-01,3.9360310504431135,צמוד למדד המחירים לצרכן,2030-02-01,0.048,0.0485,507923.59,119.556818,607.257,607.257,עלות מופחתת,0.000539,0.000147,,
1328,12419.0,ערד בקרן פנסיה מקיפה חדשה,ערד 8825 01.04.2030,71122501.0,2015-04-01,4.006417817008313,צמוד למדד המחירים לצרכן,2030-04-01,0.048,0.0485,623493.58,123.430488,769.581,769.581,עלות מופחתת,0.000683,0.000187,,
1328,12419.0,ערד בקרן פנסיה מקיפה חדשה,ערד 8855 01.10.2032,71124093.0,2017-10-01,5.886830285241915,צמוד למדד המחירים לצרכן,2032-10-01,0.048,0.0485,3186386.75,122.685902,3909.247,3909.247,עלות מופחתת,0.00347,0.000952,,
1328,12419.0,ערד בקרן פנסיה מקיפה חדשה,ערד 8849 01.04.2032,71123731.0,2017-04-01,5.528463659857552,צמוד למדד המחירים לצרכן,2032-04-01,0.048,0.0485,2243085.69,123.17763,2762.98,2762.98,עלות מופחתת,0.002452,0.000673,,
1328,12419.0,ערד בקרן פנסיה מקיפה חדשה,ערד 8863 01.06.2033,71124499.0,2018-06-01,6.4034145394844675,צמוד למדד המחירים לצרכן,2033-06-01,0.048,0.0485,5267452.78,121.120338,6379.957,6379.957,עלות מופחתת,0.005664,0.001554,,
1328,12419.0,ערד בקרן פנסיה מקיפה חדשה,ערד 8874 01.05.2034,71125132.0,2019-05-01,6.995350486494741,צמוד למדד המחירים לצרכן,2034-05-01,0.048,0.0485,9276230.4,120.402353,11168.8,11168.8,עלות מופחתת,0.009915,0.00272,,
1328,12419.0,ערד בקרן פנסיה מקיפה חדשה,ערד 8881 01.12.2034,71125421.0,2019-12-01,7.404415125189185,צמוד למדד המחירים לצרכן,2034-12-01,0.048,0.0485,13801093.06,119.328631,16468.656,16468.656,עלות מופחתת,0.01462,0.004012,,
1328,12419.0,ערד בקרן פנסיה מקיפה חדשה,ערד 8888 01.08.2035,71125702.0,2020-08-01,7.889123471145539,צמוד למדד המחירים לצרכן,2035-08-01,0.048,0.0485,28478885.82,119.807017,34119.704,34119.704,עלות מופחתת,0.030291,0.008312,,
1328,12419.0,ערד בקרן פנסיה מקיפה חדשה,ערד 8900 01.08.2036,71126544.0,2021-08-01,8.502850786893246,צמוד למדד המחירים לצרכן,2036-08-01,0.048,0.0485,20044492.66,117.799478,23612.308,23612.308,עלות מופחתת,0.020962,0.005752,,
1328,12419.0,ערד בקרן פנסיה מקיפה חדשה,ערד 8897 01.05.2036,71126395.0,2021-05-01,8.252850786893246,צמוד למדד המחירים לצרכן,2036-05-01,0.048,0.0485,50221360.7,120.161553,60346.767,60346.767,עלות מופחתת,0.053575,0.014701,,
1328,12419.0,ערד בקרן פנסיה מקיפה חדשה,ערד 8792 01.07.2027,71119747.0,2012-07-01,1.6835201532975237,צמוד למדד המחירים לצרכן,2027-07-01,0.048,0.0485,112849.51,122.444858,138.178,138.178,עלות מופחתת,0.000122,3.3e-05,,
1328,12419.0,ערד בקרן פנסיה מקיפה חדשה,ערד 8801 01.04.2028,71120935.0,2013-04-01,2.332254121211065,צמוד למדד המחירים לצרכן,2028-04-01,0.048,0.0485,550242.16,123.639692,680.318,680.318,עלות מופחתת,0.000603,0.000165,,
1328,12419.0,ערד בקרן פנסיה מקיפה חדשה,ערד 8816 01.07.2029,71121693.0,2014-07-01,3.4392514435255492,צמוד למדד המחירים לצרכן,2029-07-01,0.048,0.0485,339556.14,120.158088,408.004,408.004,עלות מופחתת,0.000362,9.9e-05,,
1328,12419.0,ערד בקרן פנסיה מקיפה חדשה,ערד 8834 01.01.2031,71122931.0,2016-01-01,4.650636849279767,צמוד למדד המחירים לצרכן,2031-01-01,0.048,0.0485,245447.7,121.127105,297.304,297.304,עלות מופחתת,0.000263,7.2e-05,,
1328,12419.0,ערד בקרן פנסיה מקיפה חדשה,ערד 8832 01.11.2030,71122741.0,2015-11-01,4.4839701826131,צמוד למדד המחירים לצרכן,2030-11-01,0.048,0.0485,929194.87,121.719184,1131.008,1131.008,עלות מופחתת,0.001004,0.000275,,
1328,12419.0,ערד בקרן פנסיה מקיפה חדשה,ערד 8822 01.01.2030,71122402.0,2015-01-01,3.85269771710978,צמוד למדד המחירים לצרכן,2030-01-01,0.048,0.0485,302275.49,120.040402,362.853,362.853,עלות מופחתת,0.000322,8.8e-05,,
1328,12419.0,ערד בקרן פנסיה מקיפה חדשה,ערד 8841 01.08.2031,71123368.0,2016-08-01,5.118908215490776,צמוד למדד המחירים לצרכן,2031-08-01,0.048,0.0485,1262000.19,120.760879,1524.003,1524.003,עלות מופחתת,0.001353,0.000371,,
1328,12419.0,ערד בקרן פנסיה מקיפה חדשה,ערד 8842 01.09.2031,71123434.0,2016-09-01,5.202241548824109,צמוד למדד המחירים לצרכן,2031-09-01,0.048,0.0485,761331.21,119.788918,911.99,911.99,עלות מופחתת,0.000809,0.000222,,
1328,12419.0,ערד בקרן פנסיה מקיפה חדשה,ערד 8850 01.05.2032,71123749.0,2017-05-01,5.611796993190885,צמוד למדד המחירים לצרכן,2032-05-01,0.048,0.0485,2170841.85,122.335286,2655.706,2655.706,עלות מופחתת,0.002357,0.000646,,
1328,12419.0,ערד בקרן פנסיה מקיפה חדשה,ערד 8852 01.07.2032,71123921.0,2017-07-01,5.778463659857551,צמוד למדד המחירים לצרכן,2032-07-01,0.048,0.0485,2316740.15,120.649978,2795.147,2795.147,עלות מופחתת,0.002481,0.00068,,
1328,12419.0,ערד בקרן פנסיה מקיפה חדשה,ערד 8860 01.03.2033,71124358.0,2018-03-01,6.303496951908582,צמוד למדד המחירים לצרכן,2033-03-01,0.048,0.0485,3436167.07,120.636282,4145.264,4145.264,עלות מופחתת,0.00368,0.001009,,
1328,12419.0,ערד בקרן פנסיה מקיפה חדשה,ערד 8864 01.07.2033,71124556.0,2018-07-01,6.4867478728178005,צמוד למדד המחירים לצרכן,2033-07-01,0.048,0.0485,3714865.08,120.053881,4459.84,4459.84,עלות מופחתת,0.003959,0.001086,,
1328,12419.0,ערד בקרן פנסיה מקיפה חדשה,ערד 8893 01.01.2036,71126239.0,2021-01-01,8.116321417377012,צמוד למדד המחירים לצרכן,2036-01-01,0.048,0.0485,46528360.21,120.051509,55857.999,55857.999,עלות מופחתת,0.04959,0.013608,,
1328,12419.0,ערד בקרן פנסיה מקיפה חדשה,ערד 8876 01.07.2034,71125272.0,2019-07-01,7.1620171531614085,צמוד למדד המחירים לצרכן,2034-07-01,0.048,0.0485,10576821.1,118.280838,12510.353,12510.353,עלות מופחתת,0.011106,0.003047,,
1328,12419.0,ערד בקרן פנסיה מקיפה חדשה,ערד 8895 01.03.2036,71126320.0,2021-03-01,8.282988084043675,צמוד למדד המחירים לצרכן,2036-03-01,0.048,0.0485,32249571.11,119.323496,38481.316,38481.316,עלות מופחתת,0.034163,0.009374,,
1328,12419.0,ערד בקרן פנסיה מקיפה חדשה,ערד 8901 01.09.2036,71126593.0,2021-09-01,8.586184120226578,צמוד למדד המחירים לצרכן,2036-09-01,0.048,0.0485,32962135.21,116.86201,38520.214,38520.214,עלות מופחתת,0.034198,0.009384,,
1328,12419.0,ערד בקרן פנסיה מקיפה חדשה,ערד 8789 01.04.2027,71116701.0,2012-04-01,1.4335201532975232,צמוד למדד המחירים לצרכן,2027-04-01,0.048,0.0485,128064.05,125.441503,160.645,160.645,עלות מופחתת,0.000142,3.9e-05,,
1328,12419.0,ערד בקרן פנסיה מקיפה חדשה,ערד 8773 01.12.2025,71116743.0,2010-12-01,0.16944444444444448,צמוד למדד המחירים לצרכן,2025-12-01,0.048,0.0481,28313.13,127.7514,36.17,36.17,עלות מופחתת,3.2e-05,8e-06,,
1328,12419.0,ערד בקרן פנסיה מקיפה חדשה,ערד 8781 01.08.2026,71118616.0,2011-08-01,0.824390125947164,צמוד למדד המחירים לצרכן,2026-08-01,0.048,0.0484,97634.98,123.475983,120.556,120.556,עלות מופחתת,0.000107,2.9e-05,,
1328,12419.0,ערד בקרן פנסיה מקיפה חדשה,ערד 8775 01.02.2026,71116768.0,2011-02-01,0.33611111111111114,צמוד למדד המחירים לצרכן,2026-02-01,0.048,0.0483,33048.78,126.155869,41.693,41.693,עלות מופחתת,3.7e-05,1e-05,,
1328,12419.0,ערד בקרן פנסיה מקיפה חדשה,ערד 8800 01.03.2028,71120687.0,2013-09-01,2.748920787877731,צמוד למדד המחירים לצרכן,2028-09-01,0.048,0.0485,122723.85,119.073236,146.131,146.131,עלות מופחתת,0.000129,3.5e-05,,
1328,12419.0,ערד בקרן פנסיה מקיפה חדשה,ערד 8814 01.05.2029,71121677.0,2014-05-01,3.2725847768588836,צמוד למדד המחירים לצרכן,2029-05-01,0.048,0.0485,268823.67,121.348526,326.214,326.214,עלות מופחתת,0.000289,7.9e-05,,
1328,12419.0,ערד בקרן פנסיה מקיפה חדשה,ערד 8776 01.03.2026,71116776.0,2011-03-01,0.41944444444444445,צמוד למדד המחירים לצרכן,2026-03-01,0.048,0.0484,30731.34,125.387852,38.533,38.533,עלות מופחתת,3.4e-05,9e-06,,
1328,12419.0,ערד בקרן פנסיה מקיפה חדשה,ערד 8771 01.10.2025,71118814.0,2010-10-01,0.0027777777777777683,צמוד למדד המחירים לצרכן,2025-10-01,0.048,0.0479,34761.68,130.091327,45.222,45.222,עלות מופחתת,4e-05,1.1e-05,,
1328,12419.0,ערד בקרן פנסיה מקיפה חדשה,ערד 8817 01.08.2029,71121701.0,2014-08-01,3.5225847768588836,צמוד למדד המחירים לצרכן,2029-08-01,0.048,0.0485,210786.77,119.323081,251.517,251.517,עלות מופחתת,0.000223,6.1e-05,,
1328,12419.0,ערד בקרן פנסיה מקיפה חדשה,ערד 8848 01.03.2032,71123673.0,2017-03-01,5.578113717401076,צמוד למדד המחירים לצרכן,2032-03-01,0.048,0.0485,2037941.39,120.75716,2460.96,2460.96,עלות מופחתת,0.002184,0.000599,,
1328,12419.0,ערד בקרן פנסיה מקיפה חדשה,ערד 8803 01.06.2028,71121057.0,2013-06-01,2.498920787877731,צמוד למדד המחירים לצרכן,2028-06-01,0.048,0.0485,235976.4,121.941587,287.753,287.753,עלות מופחתת,0.000255,7e-05,,
1328,12419.0,ערד בקרן פנסיה מקיפה חדשה,ערד 8798 01.01.2028,71120596.0,2013-01-01,2.1382267038020437,צמוד למדד המחירים לצרכן,2028-01-01,0.048,0.0485,262375.13,122.212735,320.656,320.656,עלות מופחתת,0.000284,7.8e-05,,
1328,12419.0,ערד בקרן פנסיה מקיפה חדשה,ערד 8865 01.08.2033,71124580.0,2018-08-01,6.570081206151133,צמוד למדד המחירים לצרכן,2033-08-01,0.048,0.0485,5668673.12,119.452208,6771.355,6771.355,עלות מופחתת,0.006011,0.001649,,
1328,12419.0,ערד בקרן פנסיה מקיפה חדשה,ערד 8880 01.11.2034,71125405.0,2019-11-01,7.3210817918558515,צמוד למדד המחירים לצרכן,2034-11-01,0.048,0.0485,13871220.97,120.282907,16684.708,16684.708,עלות מופחתת,0.014812,0.004064,,
1328,12419.0,ערד בקרן פנסיה מקיפה חדשה,ערד 8808 01.11.2028,71121297.0,2013-11-01,2.8491820792187337,צמוד למדד המחירים לצרכן,2028-11-01,0.048,0.0485,436989.6,120.755425,527.689,527.689,עלות מופחתת,0.000468,0.000128,,
1328,12419.0,ערד בקרן פנסיה מקיפה חדשה,ערד 8899 01.07.2036,71126460.0,2021-07-01,8.419517453559914,צמוד למדד המחירים לצרכן,2036-07-01,0.048,0.0485,42443106.89,118.392711,50249.545,50249.545,עלות מופחתת,0.044611,0.012241,,
1328,12419.0,ערד בקרן פנסיה מקיפה חדשה,ערד 8826 01.05.2030,71122535.0,2015-05-01,4.089751150341647,צמוד למדד המחירים לצרכן,2030-05-01,0.048,0.0485,408978.74,122.581567,501.333,501.333,עלות מופחתת,0.000445,0.000122,,
1328,12419.0,ערד בקרן פנסיה מקיפה חדשה,ערד 8818 01.09.2029,71121750.0,2014-09-01,3.6059181101922166,צמוד למדד המחירים לצרכן,2029-09-01,0.048,0.0485,439407.81,118.724388,521.684,521.684,עלות מופחתת,0.000463,0.000127,,
1328,12419.0,ערד בקרן פנסיה מקיפה חדשה,ערד 8839 01.06.2031,71123301.0,2016-06-01,4.95224154882411,צמוד למדד המחירים לצרכן,2031-06-01,0.048,0.0485,657952.99,122.463483,805.752,805.752,עלות מופחתת,0.000715,0.000196,,
1328,12419.0,ערד בקרן פנסיה מקיפה חדשה,ערד 8844 01.11.2031,71123525.0,2016-11-01,5.244780384067743,צמוד למדד המחירים לצרכן,2031-11-01,0.048,0.0485,842441.8,122.210482,1029.552,1029.552,עלות מופחתת,0.000914,0.00025,,
1328,12419.0,ערד בקרן פנסיה מקיפה חדשה,ערד 8856 01.11.2032,71124119.0,2017-11-01,5.970163618575247,צמוד למדד המחירים לצרכן,2032-11-01,0.048,0.0485,3347499.59,122.091348,4087.007,4087.007,עלות מופחתת,0.003628,0.000995,,
1328,12419.0,ערד בקרן פנסיה מקיפה חדשה,ערד 8858 01.01.2033,71124267.0,2018-01-01,6.136830285241914,צמוד למדד המחירים לצרכן,2033-01-01,0.048,0.0485,4022682.29,121.131135,4872.721,4872.721,עלות מופחתת,0.004325,0.001187,,
1328,12419.0,ערד בקרן פנסיה מקיפה חדשה,ערד 8861 01.04.2033,71124432.0,2018-04-01,6.2367478728178,צמוד למדד המחירים לצרכן,2033-04-01,0.048,0.0485,3238680.41,122.931274,3981.351,3981.351,עלות מופחתת,0.003534,0.000969,,
1328,12419.0,ערד בקרן פנסיה מקיפה חדשה,ערד 8866 01.09.2033,71124630.0,2018-09-01,6.653414539484467,צמוד למדד המחירים לצרכן,2033-09-01,0.048,0.0485,5814369.91,118.969048,6917.301,6917.301,עלות מופחתת,0.006141,0.001685,,
1328,12419.0,ערד בקרן פנסיה מקיפה חדשה,ערד 8867 01.10.2033,71124648.0,2018-10-01,6.5784128363239835,צמוד למדד המחירים לצרכן,2033-10-01,0.048,0.0485,2090839.6,121.233998,2534.808,2534.808,עלות מופחתת,0.00225,0.000617,,
1328,12419.0,ערד בקרן פנסיה מקיפה חדשה,ערד 8877 01.08.2034,71125314.0,2019-08-01,7.2453504864947424,צמוד למדד המחירים לצרכן,2034-08-01,0.048,0.0485,11959026.19,118.503479,14171.862,14171.862,עלות מופחתת,0.012581,0.003452,,
1328,12419.0,ערד בקרן פנסיה מקיפה חדשה,ערד 8869 01.12.2033,71124697.0,2018-12-01,6.7450795029906505,צמוד למדד המחירים לצרכן,2033-12-01,0.048,0.0485,5722075.13,119.811572,6855.708,6855.708,עלות מופחתת,0.006086,0.00167,,
1328,12419.0,ערד בקרן פנסיה מקיפה חדשה,ערד 8883 01.02.2035,71125488.0,2020-02-01,7.5710817918558515,צמוד למדד המחירים לצרכן,2035-02-01,0.048,0.0485,16338998.12,118.856167,19419.907,19419.907,עלות מופחתת,0.01724,0.004731,,
1328,12419.0,ערד בקרן פנסיה מקיפה חדשה,ערד 8887 01.07.2035,71125678.0,2020-07-01,7.805790137812206,צמוד למדד המחירים לצרכן,2035-07-01,0.048,0.0485,16602481.59,120.17144,19951.441,19951.441,עלות מופחתת,0.017712,0.00486,,
1328,12419.0,ערד בקרן פנסיה מקיפה חדשה,ערד 8903 01.11.2036,71126718.0,2021-11-01,8.548882753431949,צמוד למדד המחירים לצרכן,2036-11-01,0.048,0.0485,44707855.66,118.164734,52828.919,52828.919,עלות מופחתת,0.046901,0.01287,,
1328,13819.0,ערד בקרן פנסיה מקיפה חדשה,ערד 8903 01.11.2036,71126718.0,2021-11-01,8.548882753431949,צמוד למדד המחירים לצרכן,2036-11-01,0.048,0.0485,14056937.79,118.164734,16610.343,16610.343,עלות מופחתת,0.046978,0.012958,,
1328,13819.0,ערד בקרן פנסיה מקיפה חדשה,ערד 8887 01.07.2035,71125678.0,2020-07-01,7.805790137812206,צמוד למדד המחירים לצרכן,2035-07-01,0.048,0.0485,5220112.83,120.17144,6273.085,6273.085,עלות מופחתת,0.017741,0.004893,,
1328,13819.0,ערד בקרן פנסיה מקיפה חדשה,ערד 8869 01.12.2033,71124697.0,2018-12-01,6.7450795029906505,צמוד למדד המחירים לצרכן,2033-12-01,0.048,0.0485,1799121.27,119.811572,2155.555,2155.555,עלות מופחתת,0.006096,0.001681,,
1328,13819.0,ערד בקרן פנסיה מקיפה חדשה,ערד 8867 01.10.2033,71124648.0,2018-10-01,6.5784128363239835,צמוד למדד המחירים לצרכן,2033-10-01,0.048,0.0485,657396.82,121.233998,796.988,796.988,עלות מופחתת,0.002254,0.000621,,
1328,13819.0,ערד בקרן פנסיה מקיפה חדשה,ערד 8877 01.08.2034,71125314.0,2019-08-01,7.2453504864947424,צמוד למדד המחירים לצרכן,2034-08-01,0.048,0.0485,3760128.61,118.503479,4455.883,4455.883,עלות מופחתת,0.012602,0.003476,,
1328,13819.0,ערד בקרן פנסיה מקיפה חדשה,ערד 8883 01.02.2035,71125488.0,2020-02-01,7.5710817918558515,צמוד למדד המחירים לצרכן,2035-02-01,0.048,0.0485,5137268.98,118.856167,6105.961,6105.961,עלות מופחתת,0.017269,0.004763,,
1328,13819.0,ערד בקרן פנסיה מקיפה חדשה,ערד 8866 01.09.2033,71124630.0,2018-09-01,6.653414539484467,צמוד למדד המחירים לצרכן,2033-09-01,0.048,0.0485,1828140.38,118.969048,2174.921,2174.921,עלות מופחתת,0.006151,0.001696,,
1328,13819.0,ערד בקרן פנסיה מקיפה חדשה,ערד 8861 01.04.2033,71124432.0,2018-04-01,6.2367478728178,צמוד למדד המחירים לצרכן,2033-04-01,0.048,0.0485,1018298.2,122.931274,1251.807,1251.807,עלות מופחתת,0.00354,0.000976,,
1328,13819.0,ערד בקרן פנסיה מקיפה חדשה,ערד 8858 01.01.2033,71124267.0,2018-01-01,6.136830285241914,צמוד למדד המחירים לצרכן,2033-01-01,0.048,0.0485,1264802.21,121.131135,1532.069,1532.069,עלות מופחתת,0.004333,0.001195,,
1328,13819.0,ערד בקרן פנסיה מקיפה חדשה,ערד 8856 01.11.2032,71124119.0,2017-11-01,5.970163618575247,צמוד למדד המחירים לצרכן,2032-11-01,0.048,0.0485,1052512.87,122.091348,1285.027,1285.027,עלות מופחתת,0.003634,0.001002,,
1328,13819.0,ערד בקרן פנסיה מקיפה חדשה,ערד 8839 01.06.2031,71123301.0,2016-06-01,4.95224154882411,צמוד למדד המחירים לצרכן,2031-06-01,0.048,0.0485,206872.01,122.463483,253.343,253.343,עלות מופחתת,0.000716,0.000197,,
1328,13819.0,ערד בקרן פנסיה מקיפה חדשה,ערד 8844 01.11.2031,71123525.0,2016-11-01,5.244780384067743,צמוד למדד המחירים לצרכן,2031-11-01,0.048,0.0485,264878.55,122.210482,323.709,323.709,עלות מופחתת,0.000915,0.000252,,
1328,13819.0,ערד בקרן פנסיה מקיפה חדשה,ערד 8818 01.09.2029,71121750.0,2014-09-01,3.6059181101922166,צמוד למדד המחירים לצרכן,2029-09-01,0.048,0.0485,138157.56,118.724388,164.027,164.027,עלות מופחתת,0.000463,0.000127,,
1328,13819.0,ערד בקרן פנסיה מקיפה חדשה,ערד 8826 01.05.2030,71122535.0,2015-05-01,4.089751150341647,צמוד למדד המחירים לצרכן,2030-05-01,0.048,0.0485,128590.12,122.581567,157.628,157.628,עלות מופחתת,0.000445,0.000122,,
1328,13819.0,ערד בקרן פנסיה מקיפה חדשה,ערד 8899 01.07.2036,71126460.0,2021-07-01,8.419517453559914,צמוד למדד המחירים לצרכן,2036-07-01,0.048,0.0485,13344860.86,118.392711,15799.343,15799.343,עלות מופחתת,0.044684,0.012325,,
1328,13819.0,ערד בקרן פנסיה מקיפה חדשה,ערד 8880 01.11.2034,71125405.0,2019-11-01,7.3210817918558515,צמוד למדד המחירים לצרכן,2034-11-01,0.048,0.0485,4361356.35,120.282907,5245.966,5245.966,עלות מופחתת,0.014836,0.004092,,
1328,13819.0,ערד בקרן פנסיה מקיפה חדשה,ערד 8808 01.11.2028,71121297.0,2013-11-01,2.8491820792187337,צמוד למדד המחירים לצרכן,2028-11-01,0.048,0.0485,137397.23,120.755425,165.915,165.915,עלות מופחתת,0.000469,0.000129,,
1328,13819.0,ערד בקרן פנסיה מקיפה חדשה,ערד 8865 01.08.2033,71124580.0,2018-08-01,6.570081206151133,צמוד למדד המחירים לצרכן,2033-08-01,0.048,0.0485,1782330.74,119.452208,2129.033,2129.033,עלות מופחתת,0.006021,0.00166,,
1328,13819.0,ערד בקרן פנסיה מקיפה חדשה,ערד 8798 01.01.2028,71120596.0,2013-01-01,2.1382267038020437,צמוד למדד המחירים לצרכן,2028-01-01,0.048,0.0485,82495.36,122.212735,100.82,100.82,עלות מופחתת,0.000285,7.8e-05,,
1328,13819.0,ערד בקרן פנסיה מקיפה חדשה,ערד 8803 01.06.2028,71121057.0,2013-06-01,2.498920787877731,צמוד למדד המחירים לצרכן,2028-06-01,0.048,0.0485,74195.14,121.941587,90.475,90.475,עלות מופחתת,0.000255,7e-05,,
1328,13819.0,ערד בקרן פנסיה מקיפה חדשה,ערד 8817 01.08.2029,71121701.0,2014-08-01,3.5225847768588836,צמוד למדד המחירים לצרכן,2029-08-01,0.048,0.0485,66275.07,119.323081,79.081,79.081,עלות מופחתת,0.000223,6.1e-05,,
1328,13819.0,ערד בקרן פנסיה מקיפה חדשה,ערד 8848 01.03.2032,71123673.0,2017-03-01,5.578113717401076,צמוד למדד המחירים לצרכן,2032-03-01,0.048,0.0485,640764.69,120.75716,773.769,773.769,עלות מופחתת,0.002188,0.000603,,
1328,13819.0,ערד בקרן פנסיה מקיפה חדשה,ערד 8771 01.10.2025,71118814.0,2010-10-01,0.0027777777777777683,צמוד למדד המחירים לצרכן,2025-10-01,0.048,0.0479,10929.68,130.091327,14.219,14.219,עלות מופחתת,4e-05,1.1e-05,,
1328,13819.0,ערד בקרן פנסיה מקיפה חדשה,ערד 8800 01.03.2028,71120687.0,2013-09-01,2.748920787877731,צמוד למדד המחירים לצרכן,2028-09-01,0.048,0.0485,38586.54,119.073236,45.946,45.946,עלות מופחתת,0.000129,3.5e-05,,
1328,13819.0,ערד בקרן פנסיה מקיפה חדשה,ערד 8814 01.05.2029,71121677.0,2014-05-01,3.2725847768588836,צמוד למדד המחירים לצרכן,2029-05-01,0.048,0.0485,84522.9,121.348526,102.567,102.567,עלות מופחתת,0.00029,8e-05,,
1328,13819.0,ערד בקרן פנסיה מקיפה חדשה,ערד 8775 01.02.2026,71116768.0,2011-02-01,0.33611111111111114,צמוד למדד המחירים לצרכן,2026-02-01,0.048,0.0483,10391.12,126.155869,13.109,13.109,עלות מופחתת,3.7e-05,1e-05,,
1328,13819.0,ערד בקרן פנסיה מקיפה חדשה,ערד 8781 01.08.2026,71118616.0,2011-08-01,0.824390125947164,צמוד למדד המחירים לצרכן,2026-08-01,0.048,0.0484,30698.16,123.475983,37.905,37.905,עלות מופחתת,0.000107,2.9e-05,,
1328,13819.0,ערד בקרן פנסיה מקיפה חדשה,ערד 8776 01.03.2026,71116776.0,2011-03-01,0.41944444444444445,צמוד למדד המחירים לצרכן,2026-03-01,0.048,0.0484,9662.47,125.387852,12.116,12.116,עלות מופחתת,3.4e-05,9e-06,,
1328,13819.0,ערד בקרן פנסיה מקיפה חדשה,ערד 8773 01.12.2025,71116743.0,2010-12-01,0.16944444444444448,צמוד למדד המחירים לצרכן,2025-12-01,0.048,0.0481,8902.14,127.7514,11.373,11.373,עלות מופחתת,3.2e-05,8e-06,,
1328,13819.0,ערד בקרן פנסיה מקיפה חדשה,ערד 8789 01.04.2027,71116701.0,2012-04-01,1.4335201532975232,צמוד למדד המחירים לצרכן,2027-04-01,0.048,0.0485,40265.59,125.441503,50.51,50.51,עלות מופחתת,0.000142,3.9e-05,,
1328,13819.0,ערד בקרן פנסיה מקיפה חדשה,ערד 8901 01.09.2036,71126593.0,2021-09-01,8.586184120226578,צמוד למדד המחירים לצרכן,2036-09-01,0.048,0.0485,10363876.27,116.86201,12111.434,12111.434,עלות מופחתת,0.034254,0.009448,,
1328,13819.0,ערד בקרן פנסיה מקיפה חדשה,ערד 8895 01.03.2036,71126320.0,2021-03-01,8.282988084043675,צמוד למדד המחירים לצרכן,2036-03-01,0.048,0.0485,10139833.55,119.323496,12099.204,12099.204,עלות מופחתת,0.034219,0.009439,,
1328,13819.0,ערד בקרן פנסיה מקיפה חדשה,ערד 8893 01.01.2036,71126239.0,2021-01-01,8.116321417377012,צמוד למדד המחירים לצרכן,2036-01-01,0.048,0.0485,14629336.51,120.051509,17562.739,17562.739,עלות מופחתת,0.049671,0.013701,,
1328,13819.0,ערד בקרן פנסיה מקיפה חדשה,ערד 8876 01.07.2034,71125272.0,2019-07-01,7.1620171531614085,צמוד למדד המחירים לצרכן,2034-07-01,0.048,0.0485,3325538.97,118.280838,3933.475,3933.475,עלות מופחתת,0.011124,0.003068,,
1328,13819.0,ערד בקרן פנסיה מקיפה חדשה,ערד 8864 01.07.2033,71124556.0,2018-07-01,6.4867478728178005,צמוד למדד המחירים לצרכן,2033-07-01,0.048,0.0485,1168019.05,120.053881,1402.252,1402.252,עלות מופחתת,0.003965,0.001093,,
1328,13819.0,ערד בקרן פנסיה מקיפה חדשה,ערד 8852 01.07.2032,71123921.0,2017-07-01,5.778463659857551,צמוד למדד המחירים לצרכן,2032-07-01,0.048,0.0485,728423.93,120.649978,878.843,878.843,עלות מופחתת,0.002485,0.000685,,
1328,13819.0,ערד בקרן פנסיה מקיפה חדשה,ערד 8860 01.03.2033,71124358.0,2018-03-01,6.303496951908582,צמוד למדד המחירים לצרכן,2033-03-01,0.048,0.0485,1080391.49,120.636282,1303.344,1303.344,עלות מופחתת,0.003686,0.001016,,
1328,13819.0,ערד בקרן פנסיה מקיפה חדשה,ערד 8850 01.05.2032,71123749.0,2017-05-01,5.611796993190885,צמוד למדד המחירים לצרכן,2032-05-01,0.048,0.0485,682550.93,122.335286,835.001,835.001,עלות מופחתת,0.002361,0.000651,,
1328,13819.0,ערד בקרן פנסיה מקיפה חדשה,ערד 8842 01.09.2031,71123434.0,2016-09-01,5.202241548824109,צמוד למדד המחירים לצרכן,2031-09-01,0.048,0.0485,239375.95,119.788918,286.746,286.746,עלות מופחתת,0.00081,0.000223,,
1328,13819.0,ערד בקרן פנסיה מקיפה חדשה,ערד 8841 01.08.2031,71123368.0,2016-08-01,5.118908215490776,צמוד למדד המחירים לצרכן,2031-08-01,0.048,0.0485,396795.1,120.760879,479.173,479.173,עלות מופחתת,0.001355,0.000373,,
1328,13819.0,ערד בקרן פנסיה מקיפה חדשה,ערד 8832 01.11.2030,71122741.0,2015-11-01,4.4839701826131,צמוד למדד המחירים לצרכן,2030-11-01,0.048,0.0485,292155.24,121.719184,355.609,355.609,עלות מופחתת,0.001005,0.000277,,
1328,13819.0,ערד בקרן פנסיה מקיפה חדשה,ערד 8822 01.01.2030,71122402.0,2015-01-01,3.85269771710978,צמוד למדד המחירים לצרכן,2030-01-01,0.048,0.0485,95040.74,120.040402,114.087,114.087,עלות מופחתת,0.000322,8.9e-05,,
1328,13819.0,ערד בקרן פנסיה מקיפה חדשה,ערד 8834 01.01.2031,71122931.0,2016-01-01,4.650636849279767,צמוד למדד המחירים לצרכן,2031-01-01,0.048,0.0485,77173.08,121.127105,93.478,93.478,עלות מופחתת,0.000264,7.2e-05,,
1328,13819.0,ערד בקרן פנסיה מקיפה חדשה,ערד 8816 01.07.2029,71121693.0,2014-07-01,3.4392514435255492,צמוד למדד המחירים לצרכן,2029-07-01,0.048,0.0485,106762.43,120.158088,128.284,128.284,עלות מופחתת,0.000362,0.0001,,
1328,13819.0,ערד בקרן פנסיה מקיפה חדשה,ערד 8801 01.04.2028,71120935.0,2013-04-01,2.332254121211065,צמוד למדד המחירים לצרכן,2028-04-01,0.048,0.0485,173005.83,123.639692,213.904,213.904,עלות מופחתת,0.000604,0.000166,,
1328,13819.0,ערד בקרן פנסיה מקיפה חדשה,ערד 8900 01.08.2036,71126544.0,2021-08-01,8.502850786893246,צמוד למדד המחירים לצרכן,2036-08-01,0.048,0.0485,6302341.77,117.799478,7424.126,7424.126,עלות מופחתת,0.020997,0.005791,,
1328,13819.0,ערד בקרן פנסיה מקיפה חדשה,ערד 8888 01.08.2035,71125702.0,2020-08-01,7.889123471145539,צמוד למדד המחירים לצרכן,2035-08-01,0.048,0.0485,8954263.64,119.807017,10727.836,10727.836,עלות מופחתת,0.030341,0.008369,,
1328,13819.0,ערד בקרן פנסיה מקיפה חדשה,ערד 8897 01.05.2036,71126395.0,2021-05-01,8.252850786893246,צמוד למדד המחירים לצרכן,2036-05-01,0.048,0.0485,15790480.96,120.161553,18974.087,18974.087,עלות מופחתת,0.053663,0.014802,,
1328,13819.0,ערד בקרן פנסיה מקיפה חדשה,ערד 8874 01.05.2034,71125132.0,2019-05-01,6.995350486494741,צמוד למדד המחירים לצרכן,2034-05-01,0.048,0.0485,2916610.33,120.402353,3511.668,3511.668,עלות מופחתת,0.009931,0.002739,,
1328,13819.0,ערד בקרן פנסיה מקיפה חדשה,ערד 8881 01.12.2034,71125421.0,2019-12-01,7.404415125189185,צמוד למדד המחירים לצרכן,2034-12-01,0.048,0.0485,4339306.9,119.328631,5178.036,5178.036,עלות מופחתת,0.014644,0.004039,,
1328,13819.0,ערד בקרן פנסיה מקיפה חדשה,ערד 8863 01.06.2033,71124499.0,2018-06-01,6.4034145394844675,צמוד למדד המחירים לצרכן,2033-06-01,0.048,0.0485,1656179.99,121.120338,2005.971,2005.971,עלות מופחתת,0.005673,0.001564,,
1328,13819.0,ערד בקרן פנסיה מקיפה חדשה,ערד 8825 01.04.2030,71122501.0,2015-04-01,4.006417817008313,צמוד למדד המחירים לצרכן,2030-04-01,0.048,0.0485,196037.37,123.430488,241.97,241.97,עלות מופחתת,0.000684,0.000188,,
1328,13819.0,ערד בקרן פנסיה מקיפה חדשה,ערד 8849 01.04.2032,71123731.0,2017-04-01,5.528463659857552,צמוד למדד המחירים לצרכן,2032-04-01,0.048,0.0485,705265.67,123.17763,868.73,868.73,עלות מופחתת,0.002456,0.000677,,
1328,13819.0,ערד בקרן פנסיה מקיפה חדשה,ערד 8855 01.10.2032,71124093.0,2017-10-01,5.886830285241915,צמוד למדד המחירים לצרכן,2032-10-01,0.048,0.0485,1001856.15,122.685902,1229.136,1229.136,עלות מופחתת,0.003476,0.000958,,
1328,13819.0,ערד בקרן פנסיה מקיפה חדשה,ערד 8820 01.11.2029,71121776.0,2014-11-01,3.686031050443114,צמוד למדד המחירים לצרכן,2029-11-01,0.048,0.0485,114017.21,121.110588,138.087,138.087,עלות מופחתת,0.00039,0.000107,,
1328,13819.0,ערד בקרן פנסיה מקיפה חדשה,ערד 8823 01.02.2030,71122410.0,2015-02-01,3.9360310504431135,צמוד למדד המחירים לצרכן,2030-02-01,0.048,0.0485,159700.12,119.556818,190.932,190.932,עלות מופחתת,0.00054,0.000148,,
1328,13819.0,ערד בקרן פנסיה מקיפה חדשה,ערד 8813 01.04.2029,71121669.0,2014-04-01,3.18925144352555,צמוד למדד המחירים לצרכן,2029-04-01,0.048,0.0485,99507.65,122.177942,121.576,121.576,עלות מופחתת,0.000343,9.4e-05,,
1328,13819.0,ערד בקרן פנסיה מקיפה חדשה,ערד 8815 01.06.2029,71121685.0,2014-06-01,3.355918110192216,צמוד למדד המחירים לצרכן,2029-06-01,0.048,0.0485,150766.29,120.744908,182.043,182.043,עלות מופחתת,0.000514,0.000142,,
1328,13819.0,ערד בקרן פנסיה מקיפה חדשה,ערד 8799 01.02.2028,71120612.0,2013-02-01,2.221560037135377,צמוד למדד המחירים לצרכן,2028-02-01,0.048,0.0485,50878.47,121.490087,61.812,61.812,עלות מופחתת,0.000174,4.8e-05,,
1328,13819.0,ערד בקרן פנסיה מקיפה חדשה,ערד 8802 01.05.2028,71121016.0,2013-05-01,2.415587454544398,צמוד למדד המחירים לצרכן,2028-05-01,0.048,0.0485,71629.04,122.918209,88.045,88.045,עלות מופחתת,0.000249,6.8e-05,,
1328,13819.0,ערד בקרן פנסיה מקיפה חדשה,ערד 8793 01.08.2027,71119846.0,2012-08-01,1.766853486630857,צמוד למדד המחירים לצרכן,2027-08-01,0.048,0.0485,60762.71,122.300021,74.313,74.313,עלות מופחתת,0.00021,5.7e-05,,
1328,13819.0,ערד בקרן פנסיה מקיפה חדשה,ערד 8777 01.04.2026,71118822.0,2011-04-01,0.49105623382604097,צמוד למדד המחירים לצרכן,2026-04-01,0.048,0.0485,22492.97,127.526063,28.684,28.684,עלות מופחתת,8.1e-05,2.2e-05,,
1328,13819.0,ערד בקרן פנסיה מקיפה חדשה,ערד 8905 01.01.2037,71126981.0,2022-01-01,8.715549420098617,צמוד למדד המחירים לצרכן,2037-01-01,0.048,0.0485,6539785.23,117.235403,7666.944,7666.944,עלות מופחתת,0.021684,0.005981,,
1328,13819.0,ערד בקרן פנסיה מקיפה חדשה,ערד 8788 01.03.2027,71116727.0,2012-03-01,1.384549207576438,צמוד למדד המחירים לצרכן,2027-03-01,0.048,0.0485,42356.49,122.976548,52.089,52.089,עלות מופחתת,0.000147,4e-05,,
1328,13819.0,ערד בקרן פנסיה מקיפה חדשה,ערד 8898 01.06.2036,71126445.0,2021-06-01,8.336184120226578,צמוד למדד המחירים לצרכן,2036-06-01,0.048,0.0485,9589769.41,119.325448,11443.035,11443.035,עלות מופחתת,0.032363,0.008927,,
1328,13819.0,ערד בקרן פנסיה מקיפה חדשה,ערד 8884 01.03.2035,71125512.0,2020-03-01,7.654415125189185,צמוד למדד המחירים לצרכן,2035-03-01,0.048,0.0485,3432998.37,118.847034,4080.017,4080.017,עלות מופחתת,0.011539,0.003183,,
1328,13819.0,ערד בקרן פנסיה מקיפה חדשה,ערד 8890 01.10.2035,71126106.0,2020-10-01,7.8663214173770095,צמוד למדד המחירים לצרכן,2035-10-01,0.048,0.0485,3929301.13,121.471191,4772.969,4772.969,עלות מופחתת,0.013499,0.003723,,
1328,13819.0,ערד בקרן פנסיה מקיפה חדשה,ערד 8873 01.04.2034,71125108.0,2019-04-01,6.912017153161408,צמוד למדד המחירים לצרכן,2034-04-01,0.048,0.0485,1681524.19,121.471191,2042.567,2042.567,עלות מופחתת,0.005776,0.001593,,
1328,13819.0,ערד בקרן פנסיה מקיפה חדשה,ערד 8879 01.10.2034,71125389.0,2019-10-01,7.2377484585225185,צמוד למדד המחירים לצרכן,2034-10-01,0.048,0.0485,3755313.21,120.509043,4525.492,4525.492,עלות מופחתת,0.012799,0.00353,,
1328,13819.0,ערד בקרן פנסיה מקיפה חדשה,ערד 8882 01.01.2035,71125454.0,2020-01-01,7.48774845852252,צמוד למדד המחירים לצרכן,2035-01-01,0.048,0.0485,5905324.91,119.336917,7047.233,7047.233,עלות מופחתת,0.019931,0.005497,,
1328,13819.0,ערד בקרן פנסיה מקיפה חדשה,ערד 8854 01.09.2032,71123947.0,2017-09-01,5.945130326524218,צמוד למדד המחירים לצרכן,2032-09-01,0.048,0.0485,1159623.79,120.636282,1398.927,1398.927,עלות מופחתת,0.003956,0.001091,,
1328,13819.0,ערד בקרן פנסיה מקיפה חדשה,ערד 8859 01.02.2033,71124325.0,2018-02-01,6.220163618575248,צמוד למדד המחירים לצרכן,2033-02-01,0.048,0.0485,1999847.32,120.522995,2410.276,2410.276,עלות מופחתת,0.006816,0.00188,,
1328,13819.0,ערד בקרן פנסיה מקיפה חדשה,ערד 8872 01.03.2034,71124986.0,2019-03-01,6.99507950299065,צמוד למדד המחירים לצרכן,2034-03-01,0.048,0.0485,2303122.33,119.203218,2745.396,2745.396,עלות מופחתת,0.007764,0.002141,,
1328,13819.0,ערד בקרן פנסיה מקיפה חדשה,ערד 8830 01.09.2030,71122717.0,2015-09-01,4.423084483674979,צמוד למדד המחירים לצרכן,2030-09-01,0.048,0.0485,88989.81,119.070903,105.961,105.961,עלות מופחתת,0.000299,8.2e-05,,
1328,13819.0,ערד בקרן פנסיה מקיפה חדשה,ערד 8837 01.04.2031,71123129.0,2016-04-01,4.785574882157442,צמוד למדד המחירים לצרכן,2031-04-01,0.048,0.0485,244444.79,123.681618,302.333,302.333,עלות מופחתת,0.000855,0.000235,,
1328,13819.0,ערד בקרן פנסיה מקיפה חדשה,ערד 8853 01.08.2032,71123939.0,2017-08-01,5.861796993190884,צמוד למדד המחירים לצרכן,2032-08-01,0.048,0.0485,1137415.93,121.005087,1376.331,1376.331,עלות מופחתת,0.003892,0.001073,,
1328,13819.0,ערד בקרן פנסיה מקיפה חדשה,ערד 8790 01.05.2027,71117162.0,2012-05-01,1.516853486630857,צמוד למדד המחירים לצרכן,2027-05-01,0.048,0.0485,38269.73,124.958178,47.821,47.821,עלות מופחתת,0.000135,3.7e-05,,
1328,13819.0,ערד בקרן פנסיה מקיפה חדשה,ערד 8792 01.07.2027,71119747.0,2012-07-01,1.6835201532975237,צמוד למדד המחירים לצרכן,2027-07-01,0.048,0.0485,35481.87,122.444858,43.446,43.446,עלות מופחתת,0.000122,3.3e-05,,
1328,13819.0,ערד בקרן פנסיה מקיפה חדשה,ערד 8772 01.11.2025,71116735.0,2010-11-01,0.08611111111111114,צמוד למדד המחירים לצרכן,2025-11-01,0.048,0.048,12703.77,128.622996,16.34,16.34,עלות מופחתת,4.6e-05,1.2e-05,,
1328,13819.0,ערד בקרן פנסיה מקיפה חדשה,ערד 8904 01.12.2036,71126841.0,2021-12-01,8.632216086765283,צמוד למדד המחירים לצרכן,2036-12-01,0.048,0.0485,5379844.64,117.577516,6325.488,6325.488,עלות מופחתת,0.01789,0.004934,,
1328,13819.0,ערד בקרן פנסיה מקיפה חדשה,ערד 8886 01.06.2035,71125660.0,2020-06-01,7.722456804478874,צמוד למדד המחירים לצרכן,2035-06-01,0.048,0.0485,7525484.46,120.279457,9051.612,9051.612,עלות מופחתת,0.0256,0.007061,,
1328,13819.0,ערד בקרן פנסיה מקיפה חדשה,ערד 8892 01.12.2035,71126163.0,2020-12-01,8.032988084043678,צמוד למדד המחירים לצרכן,2035-12-01,0.048,0.0485,15199834.42,120.279457,18282.278,18282.278,עלות מופחתת,0.051707,0.014263,,
1328,13819.0,ערד בקרן פנסיה מקיפה חדשה,ערד 8885 01.05.2035,71125603.0,2020-05-01,7.63912347114554,צמוד למדד המחירים לצרכן,2035-05-01,0.048,0.0485,4122550.64,120.402353,4963.648,4963.648,עלות מופחתת,0.014038,0.003872,,
1328,13819.0,ערד בקרן פנסיה מקיפה חדשה,ערד 8870 01.01.2034,71124796.0,2019-01-01,6.8284128363239835,צמוד למדד המחירים לצרכן,2034-01-01,0.048,0.0485,778827.21,119.699042,932.249,932.249,עלות מופחתת,0.002636,0.000727,,
1328,13819.0,ערד בקרן פנסיה מקיפה חדשה,ערד 8851 01.06.2032,71123772.0,2017-06-01,5.695130326524218,צמוד למדד המחירים לצרכן,2032-06-01,0.048,0.0485,1100159.96,121.603371,1337.832,1337.832,עלות מופחתת,0.003783,0.001043,,
1328,13819.0,ערד בקרן פנסיה מקיפה חדשה,ערד 8871 01.02.2034,71124945.0,2019-02-01,6.9117461696573175,צמוד למדד המחירים לצרכן,2034-02-01,0.048,0.0485,3204393.7,119.570244,3831.501,3831.501,עלות מופחתת,0.010836,0.002989,,
1328,13819.0,ערד בקרן פנסיה מקיפה חדשה,ערד 8846 01.01.2032,71123616.0,2017-01-01,5.411447050734412,צמוד למדד המחירים לצרכן,2032-01-01,0.048,0.0485,442794.82,121.494528,537.971,537.971,עלות מופחתת,0.001521,0.000419,,
1328,13819.0,ערד בקרן פנסיה מקיפה חדשה,ערד 8831 01.10.2030,71122725.0,2015-10-01,4.400636849279766,צמוד למדד המחירים לצרכן,2030-10-01,0.048,0.0485,31585.2,121.700731,38.439,38.439,עלות מופחתת,0.000108,2.9e-05,,
1328,13819.0,ערד בקרן פנסיה מקיפה חדשה,ערד 8791 01.06.2027,71119598.0,2012-06-01,1.6001868199641902,צמוד למדד המחירים לצרכן,2027-06-01,0.048,0.0485,9028.87,122.922215,11.098,11.098,עלות מופחתת,3.1e-05,8e-06,,
1328,13819.0,ערד בקרן פנסיה מקיפה חדשה,ערד 8805 01.08.2028,71121206.0,2013-08-01,2.665587454544398,צמוד למדד המחירים לצרכן,2028-08-01,0.048,0.0485,99444.29,119.909147,119.243,119.243,עלות מופחתת,0.000337,9.3e-05,,
1328,13819.0,ערד בקרן פנסיה מקיפה חדשה,ערד 8810 01.01.2029,71121438.0,2014-01-01,3.0158487458854,צמוד למדד המחירים לצרכן,2029-01-01,0.048,0.0485,96878.19,119.922945,116.179,116.179,עלות מופחתת,0.000328,9e-05,,
1328,13819.0,ערד בקרן פנסיה מקיפה חדשה,ערד 8812 01.03.2029,71121651.0,2014-03-01,3.182515412552067,צמוד למדד המחירים לצרכן,2029-03-01,0.048,0.0485,126499.22,119.541567,151.219,151.219,עלות מופחתת,0.000427,0.000117,,
1328,13819.0,ערד בקרן פנסיה מקיפה חדשה,ערד 8779 01.06.2026,71118848.0,2011-06-01,0.6577234592804972,צמוד למדד המחירים לצרכן,2026-06-01,0.048,0.0484,14921.39,125.545192,18.733,18.733,עלות מופחתת,5.2e-05,1.4e-05,,
1328,13819.0,ערד בקרן פנסיה מקיפה חדשה,ערד 8780 01.07.2026,71118855.0,2011-07-01,0.7410567926138304,צמוד למדד המחירים לצרכן,2026-07-01,0.048,0.0484,17614.21,124.454088,21.922,21.922,עלות מופחתת,6.1e-05,1.7e-05,,
1328,13819.0,ערד בקרן פנסיה מקיפה חדשה,ערד 8778 01.05.2026,71118830.0,2011-05-01,0.5743895671593743,צמוד למדד המחירים לצרכן,2026-05-01,0.048,0.0485,8648.7,126.786834,10.965,10.965,עלות מופחתת,3.1e-05,8e-06,,
1328,13819.0,ערד בקרן פנסיה מקיפה חדשה,ערד 8774 01.01.2026,71116750.0,2011-01-01,0.25277777777777777,צמוד למדד המחירים לצרכן,2026-01-01,0.048,0.0482,18469.58,127.137022,23.482,23.482,עלות מופחתת,6.6e-05,1.8e-05,,
1328,13819.0,ערד בקרן פנסיה מקיפה חדשה,ערד 8896 01.04.2036,71126353.0,2021-04-01,8.169517453559912,צמוד למדד המחירים לצרכן,2036-04-01,0.048,0.0485,12699217.41,121.350083,15410.511,15410.511,עלות מופחתת,0.043584,0.012022,,
1328,13819.0,ערד בקרן פנסיה מקיפה חדשה,ערד 8894 01.02.2036,71126288.0,2021-02-01,8.199654750710344,צמוד למדד המחירים לצרכן,2036-02-01,0.048,0.0485,14646412.17,119.687329,17529.9,17529.9,עלות מופחתת,0.049579,0.013676,,
1328,13819.0,ערד בקרן פנסיה מקיפה חדשה,ערד 8889 01.09.2035,71126098.0,2020-09-01,7.972456804478872,צמוד למדד המחירים לצרכן,2035-09-01,0.048,0.0485,10960953.9,119.084253,13052.77,13052.77,עלות מופחתת,0.036916,0.010183,,
1328,13819.0,ערד בקרן פנסיה מקיפה חדשה,ערד 8891 01.11.2035,71126130.0,2020-11-01,7.949654750710344,צמוד למדד המחירים לצרכן,2035-11-01,0.048,0.0485,8160356.63,121.124046,9884.154,9884.154,עלות מופחתת,0.027954,0.007711,,
1328,13819.0,ערד בקרן פנסיה מקיפה חדשה,ערד 8878 01.09.2034,71125348.0,2019-09-01,7.3286838198280755,צמוד למדד המחירים לצרכן,2034-09-01,0.048,0.0485,2313196.65,118.375418,2738.256,2738.256,עלות מופחתת,0.007744,0.002136,,
1328,13819.0,ערד בקרן פנסיה מקיפה חדשה,ערד 8843 01.10.2031,71123517.0,2016-10-01,5.161447050734411,צמוד למדד המחירים לצרכן,2031-10-01,0.048,0.0485,205668.16,122.559506,252.066,252.066,עלות מופחתת,0.000712,0.000196,,
1328,13819.0,ערד בקרן פנסיה מקיפה חדשה,ערד 8862 01.05.2033,71124473.0,2018-05-01,6.320081206151133,צמוד למדד המחירים לצרכן,2033-05-01,0.048,0.0485,1316282.61,122.091348,1607.067,1607.067,עלות מופחתת,0.004545,0.001253,,
1328,13819.0,ערד בקרן פנסיה מקיפה חדשה,ערד 8838 01.05.2031,71123293.0,2016-05-01,4.868908215490777,צמוד למדד המחירים לצרכן,2031-05-01,0.048,0.0485,258479.14,123.456257,319.109,319.109,עלות מופחתת,0.000902,0.000248,,
1328,13819.0,ערד בקרן פנסיה מקיפה חדשה,ערד 8836 01.03.2031,71123079.0,2016-03-01,4.817303515946432,צמוד למדד המחירים לצרכן,2031-03-01,0.048,0.0485,34182.98,120.882326,41.321,41.321,עלות מופחתת,0.000116,3.2e-05,,
1328,13819.0,ערד בקרן פנסיה מקיפה חדשה,ערד 8833 01.12.2030,71122774.0,2015-12-01,4.567303515946433,צמוד למדד המחירים לצרכן,2030-12-01,0.048,0.0485,140343.49,121.110975,169.971,169.971,עלות מופחתת,0.00048,0.000132,,
1328,13819.0,ערד בקרן פנסיה מקיפה חדשה,ערד 8829 01.08.2030,71122626.0,2015-08-01,4.339751150341647,צמוד למדד המחירים לצרכן,2030-08-01,0.048,0.0485,228794.74,119.793825,274.082,274.082,עלות מופחתת,0.000775,0.000213,,
1328,13819.0,ערד בקרן פנסיה מקיפה חדשה,ערד 8827 01.06.2030,71122543.0,2015-06-01,4.17308448367498,צמוד למדד המחירים לצרכן,2030-06-01,0.048,0.0485,98620.61,121.354659,119.681,119.681,עלות מופחתת,0.000338,9.3e-05,,
1328,13819.0,ערד בקרן פנסיה מקיפה חדשה,ערד 8824 01.03.2030,71122428.0,2015-03-01,4.0193643837764474,צמוד למדד המחירים לצרכן,2030-03-01,0.048,0.0485,244761.59,120.151183,294.084,294.084,עלות מופחתת,0.000831,0.000229,,
1328,13819.0,ערד בקרן פנסיה מקיפה חדשה,ערד 8819 01.10.2029,71121768.0,2014-10-01,3.6026977171097805,צמוד למדד המחירים לצרכן,2029-10-01,0.048,0.0485,108029.64,121.222494,130.956,130.956,עלות מופחתת,0.00037,0.000102,,
1328,13819.0,ערד בקרן פנסיה מקיפה חדשה,ערד 8811 01.02.2029,71121578.0,2014-02-01,3.099182079218734,צמוד למדד המחירים לצרכן,2029-02-01,0.048,0.0485,72896.25,119.323081,86.982,86.982,עלות מופחתת,0.000246,6.7e-05,,
1328,13819.0,ערד בקרן פנסיה מקיפה חדשה,ערד 8797 01.12.2027,71120570.0,2012-12-01,2.0548933704687102,צמוד למדד המחירים לצרכן,2027-12-01,0.048,0.0485,52114.0,122.110465,63.637,63.637,עלות מופחתת,0.000179,4.9e-05,,
1328,13819.0,ערד בקרן פנסיה מקיפה חדשה,ערד 8796 01.11.2027,71120448.0,2012-11-01,1.971560037135377,צמוד למדד המחירים לצרכן,2027-11-01,0.048,0.0485,54553.38,122.369591,66.757,66.757,עלות מופחתת,0.000188,5.2e-05,,
1328,13819.0,ערד בקרן פנסיה מקיפה חדשה,ערד 8809 01.12.2028,71121305.0,2013-12-01,2.932515412552067,צמוד למדד המחירים לצרכן,2028-12-01,0.048,0.0485,99634.37,119.921112,119.483,119.483,עלות מופחתת,0.000337,9.3e-05,,
1328,13819.0,ערד בקרן פנסיה מקיפה חדשה,ערד 8795 01.10.2027,71120356.0,2012-10-01,1.8882267038020435,צמוד למדד המחירים לצרכן,2027-10-01,0.048,0.0485,53222.81,122.842903,65.38,65.38,עלות מופחתת,0.000184,5.1e-05,,
1328,13819.0,ערד בקרן פנסיה מקיפה חדשה,ערד 8804 01.07.2028,71121107.0,2013-07-01,2.582254121211065,צמוד למדד המחירים לצרכן,2028-07-01,0.048,0.0485,37287.65,121.347772,45.248,45.248,עלות מופחתת,0.000127,3.5e-05,,
1328,13819.0,ערד בקרן פנסיה מקיפה חדשה,ערד 8785 01.12.2026,71119127.0,2011-12-01,1.134549207576438,צמוד למדד המחירים לצרכן,2026-12-01,0.048,0.0485,29747.75,124.458743,37.024,37.024,עלות מופחתת,0.000104,2.8e-05,,
1328,13819.0,ערד בקרן פנסיה מקיפה חדשה,ערד 8784 01.11.2026,71118905.0,2011-11-01,1.0512158742431044,צמוד למדד המחירים לצרכן,2026-11-01,0.048,0.0485,28860.7,124.958178,36.064,36.064,עלות מופחתת,0.000101,2.8e-05,,
1328,13819.0,ערד בקרן פנסיה מקיפה חדשה,ערד 8794 01.09.2027,71120232.0,2012-09-01,1.85018681996419,צמוד למדד המחירים לצרכן,2027-09-01,0.048,0.0485,45968.03,121.689448,55.938,55.938,עלות מופחתת,0.000158,4.3e-05,,
1328,13819.0,ערד בקרן פנסיה מקיפה חדשה,ערד 8787 01.02.2027,71116420.0,2012-02-01,1.3012158742431048,צמוד למדד המחירים לצרכן,2027-02-01,0.048,0.0485,37002.52,123.475983,45.689,45.689,עלות מופחתת,0.000129,3.5e-05,,
1328,13819.0,ערד בקרן פנסיה מקיפה חדשה,ערד 8807 01.10.2028,71120950.0,2013-10-01,2.7658487458854006,צמוד למדד המחירים לצרכן,2028-10-01,0.048,0.0485,103245.92,121.459952,125.402,125.402,עלות מופחתת,0.000354,9.7e-05,,
1328,13819.0,ערד בקרן פנסיה מקיפה חדשה,ערד 8868 01.11.2033,71124689.0,2018-11-01,6.661746169657317,צמוד למדד המחירים לצרכן,2033-11-01,0.048,0.0485,81354.87,120.647903,98.153,98.153,עלות מופחתת,0.000277,7.6e-05,,
1328,13819.0,ערד בקרן פנסיה מקיפה חדשה,ערד 8857 01.12.2032,71124127.0,2017-12-01,6.053496951908582,צמוד למדד המחירים לצרכן,2032-12-01,0.048,0.0485,885938.13,121.240736,1074.118,1074.118,עלות מופחתת,0.003037,0.000837,,
1328,13819.0,ערד בקרן פנסיה מקיפה חדשה,ערד 8875 01.06.2034,71125231.0,2019-06-01,7.078683819828075,צמוד למדד המחירים לצרכן,2034-06-01,0.048,0.0485,1100381.72,119.564926,1315.671,1315.671,עלות מופחתת,0.003721,0.001026,,
1328,13819.0,ערד בקרן פנסיה מקיפה חדשה,ערד 8847 01.02.2032,71123665.0,2017-02-01,5.494780384067743,צמוד למדד המחירים לצרכן,2032-02-01,0.048,0.0485,407914.87,121.005087,493.598,493.598,עלות מופחתת,0.001396,0.000385,,
1328,13819.0,ערד בקרן פנסיה מקיפה חדשה,ערד 8840 01.07.2031,71123350.0,2016-07-01,5.035574882157443,צמוד למדד המחירים לצרכן,2031-07-01,0.048,0.0485,92189.52,121.617498,112.119,112.119,עלות מופחתת,0.000317,8.7e-05,,
1328,13819.0,ערד בקרן פנסיה מקיפה חדשה,ערד 8845 01.12.2031,71123533.0,2016-12-01,5.328113717401077,צמוד למדד המחירים לצרכן,2031-12-01,0.048,0.0485,336982.79,121.476869,409.356,409.356,עלות מופחתת,0.001157,0.000319,,
1328,13819.0,ערד בקרן פנסיה מקיפה חדשה,ערד 8821 01.12.2029,71121784.0,2014-12-01,3.769364383776447,צמוד למדד המחירים לצרכן,2029-12-01,0.048,0.0485,138949.56,120.272787,167.119,167.119,עלות מופחתת,0.000472,0.00013,,
1328,13819.0,ערד בקרן פנסיה מקיפה חדשה,ערד 8828 01.07.2030,71122550.0,2015-07-01,4.256417817008314,צמוד למדד המחירים לצרכן,2030-07-01,0.048,0.0485,68777.81,120.640651,82.974,82.974,עלות מופחתת,0.000234,6.4e-05,,
1328,13819.0,ערד בקרן פנסיה מקיפה חדשה,ערד 8835 01.02.2031,71123061.0,2016-02-01,4.733970182613099,צמוד למדד המחירים לצרכן,2031-02-01,0.048,0.0485,17043.97,120.760879,20.582,20.582,עלות מופחתת,5.8e-05,1.6e-05,,
1328,13819.0,ערד בקרן פנסיה מקיפה חדשה,ערד 8782 01.09.2026,71116511.0,2011-09-01,0.9077229004927079,צמוד למדד המחירים לצרכן,2026-09-01,0.048,0.0485,8775.42,122.976548,10.792,10.792,עלות מופחתת,3e-05,8e-06,,
1328,13819.0,ערד בקרן פנסיה מקיפה חדשה,ערד 8786 01.01.2027,71116487.0,2012-01-01,1.217882540909771,צמוד למדד המחירים לצרכן,2027-01-01,0.048,0.0485,34721.55,123.856326,43.005,43.005,עלות מופחתת,0.000121,3.3e-05,,
1328,13819.0,ערד בקרן פנסיה מקיפה חדשה,ערד 8783 01.10.2026,71116503.0,2011-10-01,0.9678825409097713,צמוד למדד המחירים לצרכן,2026-10-01,0.048,0.0485,10422.8,125.8044,13.112,13.112,עלות מופחתת,3.7e-05,1e-05,,
1328,14302.0,ערד בקרן פנסיה מקיפה חדשה,ערד 8783 01.10.2026,71116503.0,2011-10-01,0.9678825409097713,צמוד למדד המחירים לצרכן,2026-10-01,0.048,0.0485,159.24,125.8044,0.2,0.2,עלות מופחתת,3.7e-05,1e-05,,
1328,14302.0,ערד בקרן פנסיה מקיפה חדשה,ערד 8786 01.01.2027,71116487.0,2012-01-01,1.217882540909771,צמוד למדד המחירים לצרכן,2027-01-01,0.048,0.0485,530.48,123.856326,0.657,0.657,עלות מופחתת,0.000121,3.3e-05,,
1328,14302.0,ערד בקרן פנסיה מקיפה חדשה,ערד 8782 01.09.2026,71116511.0,2011-09-01,0.9077229004927079,צמוד למדד המחירים לצרכן,2026-09-01,0.048,0.0485,134.07,122.976548,0.165,0.165,עלות מופחתת,3e-05,8e-06,,
1328,14302.0,ערד בקרן פנסיה מקיפה חדשה,ערד 8835 01.02.2031,71123061.0,2016-02-01,4.733970182613099,צמוד למדד המחירים לצרכן,2031-02-01,0.048,0.0485,260.4,120.760879,0.314,0.314,עלות מופחתת,5.8e-05,1.5e-05,,
1328,14302.0,ערד בקרן פנסיה מקיפה חדשה,ערד 8821 01.12.2029,71121784.0,2014-12-01,3.769364383776447,צמוד למדד המחירים לצרכן,2029-12-01,0.048,0.0485,2122.91,120.272787,2.553,2.553,עלות מופחתת,0.000473,0.000128,,
1328,14302.0,ערד בקרן פנסיה מקיפה חדשה,ערד 8828 01.07.2030,71122550.0,2015-07-01,4.256417817008314,צמוד למדד המחירים לצרכן,2030-07-01,0.048,0.0485,1050.8,120.640651,1.268,1.268,עלות מופחתת,0.000235,6.3e-05,,
1328,14302.0,ערד בקרן פנסיה מקיפה חדשה,ערד 8845 01.12.2031,71123533.0,2016-12-01,5.328113717401077,צמוד למדד המחירים לצרכן,2031-12-01,0.048,0.0485,5148.52,121.476869,6.254,6.254,עלות מופחתת,0.00116,0.000314,,
1328,14302.0,ערד בקרן פנסיה מקיפה חדשה,ערד 8840 01.07.2031,71123350.0,2016-07-01,5.035574882157443,צמוד למדד המחירים לצרכן,2031-07-01,0.048,0.0485,1408.5,121.617498,1.713,1.713,עלות מופחתת,0.000317,8.6e-05,,
1328,14302.0,ערד בקרן פנסיה מקיפה חדשה,ערד 8847 01.02.2032,71123665.0,2017-02-01,5.494780384067743,צמוד למדד המחירים לצרכן,2032-02-01,0.048,0.0485,6232.24,121.005087,7.541,7.541,עלות מופחתת,0.001399,0.000378,,
1328,14302.0,ערד בקרן פנסיה מקיפה חדשה,ערד 8875 01.06.2034,71125231.0,2019-06-01,7.078683819828075,צמוד למדד המחירים לצרכן,2034-06-01,0.048,0.0485,16811.97,119.564926,20.101,20.101,עלות מופחתת,0.00373,0.00101,,
1328,14302.0,ערד בקרן פנסיה מקיפה חדשה,ערד 8857 01.12.2032,71124127.0,2017-12-01,6.053496951908582,צמוד למדד המחירים לצרכן,2032-12-01,0.048,0.0485,13535.63,121.240736,16.411,16.411,עלות מופחתת,0.003045,0.000824,,
1328,14302.0,ערד בקרן פנסיה מקיפה חדשה,ערד 8868 01.11.2033,71124689.0,2018-11-01,6.661746169657317,צמוד למדד המחירים לצרכן,2033-11-01,0.048,0.0485,1242.96,120.647903,1.5,1.5,עלות מופחתת,0.000278,7.5e-05,,
1328,14302.0,ערד בקרן פנסיה מקיפה חדשה,ערד 8807 01.10.2028,71120950.0,2013-10-01,2.7658487458854006,צמוד למדד המחירים לצרכן,2028-10-01,0.048,0.0485,1577.42,121.459952,1.916,1.916,עלות מופחתת,0.000355,9.6e-05,,
1328,14302.0,ערד בקרן פנסיה מקיפה חדשה,ערד 8787 01.02.2027,71116420.0,2012-02-01,1.3012158742431048,צמוד למדד המחירים לצרכן,2027-02-01,0.048,0.0485,565.33,123.475983,0.698,0.698,עלות מופחתת,0.000129,3.5e-05,,
1328,14302.0,ערד בקרן פנסיה מקיפה חדשה,ערד 8794 01.09.2027,71120232.0,2012-09-01,1.85018681996419,צמוד למדד המחירים לצרכן,2027-09-01,0.048,0.0485,702.31,121.689448,0.855,0.855,עלות מופחתת,0.000158,4.2e-05,,
1328,14302.0,ערד בקרן פנסיה מקיפה חדשה,ערד 8784 01.11.2026,71118905.0,2011-11-01,1.0512158742431044,צמוד למדד המחירים לצרכן,2026-11-01,0.048,0.0485,440.94,124.958178,0.551,0.551,עלות מופחתת,0.000102,2.7e-05,,
1328,14302.0,ערד בקרן פנסיה מקיפה חדשה,ערד 8785 01.12.2026,71119127.0,2011-12-01,1.134549207576438,צמוד למדד המחירים לצרכן,2026-12-01,0.048,0.0485,454.49,124.458743,0.566,0.566,עלות מופחתת,0.000104,2.8e-05,,
1328,14302.0,ערד בקרן פנסיה מקיפה חדשה,ערד 8804 01.07.2028,71121107.0,2013-07-01,2.582254121211065,צמוד למדד המחירים לצרכן,2028-07-01,0.048,0.0485,569.69,121.347772,0.691,0.691,עלות מופחתת,0.000128,3.4e-05,,
1328,14302.0,ערד בקרן פנסיה מקיפה חדשה,ערד 8795 01.10.2027,71120356.0,2012-10-01,1.8882267038020435,צמוד למדד המחירים לצרכן,2027-10-01,0.048,0.0485,813.15,122.842903,0.999,0.999,עלות מופחתת,0.000185,5e-05,,
1328,14302.0,ערד בקרן פנסיה מקיפה חדשה,ערד 8809 01.12.2028,71121305.0,2013-12-01,2.932515412552067,צמוד למדד המחירים לצרכן,2028-12-01,0.048,0.0485,1522.24,119.921112,1.825,1.825,עלות מופחתת,0.000338,9.1e-05,,
1328,14302.0,ערד בקרן פנסיה מקיפה חדשה,ערד 8796 01.11.2027,71120448.0,2012-11-01,1.971560037135377,צמוד למדד המחירים לצרכן,2027-11-01,0.048,0.0485,833.48,122.369591,1.02,1.02,עלות מופחתת,0.000189,5.1e-05,,
1328,14302.0,ערד בקרן פנסיה מקיפה חדשה,ערד 8797 01.12.2027,71120570.0,2012-12-01,2.0548933704687102,צמוד למדד המחירים לצרכן,2027-12-01,0.048,0.0485,796.21,122.110465,0.972,0.972,עלות מופחתת,0.00018,4.8e-05,,
1328,14302.0,ערד בקרן פנסיה מקיפה חדשה,ערד 8811 01.02.2029,71121578.0,2014-02-01,3.099182079218734,צמוד למדד המחירים לצרכן,2029-02-01,0.048,0.0485,1113.73,119.323081,1.329,1.329,עלות מופחתת,0.000246,6.6e-05,,
1328,14302.0,ערד בקרן פנסיה מקיפה חדשה,ערד 8819 01.10.2029,71121768.0,2014-10-01,3.6026977171097805,צמוד למדד המחירים לצרכן,2029-10-01,0.048,0.0485,1650.51,121.222494,2.001,2.001,עלות מופחתת,0.000371,0.0001,,
1328,14302.0,ערד בקרן פנסיה מקיפה חדשה,ערד 8824 01.03.2030,71122428.0,2015-03-01,4.0193643837764474,צמוד למדד המחירים לצרכן,2030-03-01,0.048,0.0485,3739.54,120.151183,4.493,4.493,עלות מופחתת,0.000833,0.000225,,
1328,14302.0,ערד בקרן פנסיה מקיפה חדשה,ערד 8827 01.06.2030,71122543.0,2015-06-01,4.17308448367498,צמוד למדד המחירים לצרכן,2030-06-01,0.048,0.0485,1506.75,121.354659,1.829,1.829,עלות מופחתת,0.000339,9.1e-05,,
1328,14302.0,ערד בקרן פנסיה מקיפה חדשה,ערד 8829 01.08.2030,71122626.0,2015-08-01,4.339751150341647,צמוד למדד המחירים לצרכן,2030-08-01,0.048,0.0485,3495.59,119.793825,4.188,4.188,עלות מופחתת,0.000777,0.00021,,
1328,14302.0,ערד בקרן פנסיה מקיפה חדשה,ערד 8833 01.12.2030,71122774.0,2015-12-01,4.567303515946433,צמוד למדד המחירים לצרכן,2030-12-01,0.048,0.0485,2144.21,121.110975,2.597,2.597,עלות מופחתת,0.000481,0.00013,,
1328,14302.0,ערד בקרן פנסיה מקיפה חדשה,ערד 8836 01.03.2031,71123079.0,2016-03-01,4.817303515946432,צמוד למדד המחירים לצרכן,2031-03-01,0.048,0.0485,522.25,120.882326,0.631,0.631,עלות מופחתת,0.000117,3.1e-05,,
1328,14302.0,ערד בקרן פנסיה מקיפה חדשה,ערד 8838 01.05.2031,71123293.0,2016-05-01,4.868908215490777,צמוד למדד המחירים לצרכן,2031-05-01,0.048,0.0485,3949.12,123.456257,4.875,4.875,עלות מופחתת,0.000904,0.000244,,
1328,14302.0,ערד בקרן פנסיה מקיפה חדשה,ערד 8862 01.05.2033,71124473.0,2018-05-01,6.320081206151133,צמוד למדד המחירים לצרכן,2033-05-01,0.048,0.0485,20110.57,122.091348,24.553,24.553,עלות מופחתת,0.004556,0.001233,,
1328,14302.0,ערד בקרן פנסיה מקיפה חדשה,ערד 8843 01.10.2031,71123517.0,2016-10-01,5.161447050734411,צמוד למדד המחירים לצרכן,2031-10-01,0.048,0.0485,3142.26,122.559506,3.851,3.851,עלות מופחתת,0.000714,0.000193,,
1328,14302.0,ערד בקרן פנסיה מקיפה חדשה,ערד 8878 01.09.2034,71125348.0,2019-09-01,7.3286838198280755,צמוד למדד המחירים לצרכן,2034-09-01,0.048,0.0485,35341.73,118.375418,41.836,41.836,עלות מופחתת,0.007764,0.002102,,
1328,14302.0,ערד בקרן פנסיה מקיפה חדשה,ערד 8891 01.11.2035,71126130.0,2020-11-01,7.949654750710344,צמוד למדד המחירים לצרכן,2035-11-01,0.048,0.0485,124676.45,121.124046,151.013,151.013,עלות מופחתת,0.028025,0.007588,,
1328,14302.0,ערד בקרן פנסיה מקיפה חדשה,ערד 8889 01.09.2035,71126098.0,2020-09-01,7.972456804478872,צמוד למדד המחירים לצרכן,2035-09-01,0.048,0.0485,167464.84,119.084253,199.424,199.424,עלות מופחתת,0.037009,0.010021,,
1328,14302.0,ערד בקרן פנסיה מקיפה חדשה,ערד 8896 01.04.2036,71126353.0,2021-04-01,8.169517453559912,צמוד למדד המחירים לצרכן,2036-04-01,0.048,0.0485,194022.57,121.350083,235.447,235.447,עלות מופחתת,0.043694,0.011831,,
1328,14302.0,ערד בקרן פנסיה מקיפה חדשה,ערד 8894 01.02.2036,71126288.0,2021-02-01,8.199654750710344,צמוד למדד המחירים לצרכן,2036-02-01,0.048,0.0485,223772.41,119.687329,267.827,267.827,עלות מופחתת,0.049704,0.013458,,
1328,14302.0,ערד בקרן פנסיה מקיפה חדשה,ערד 8774 01.01.2026,71116750.0,2011-01-01,0.25277777777777777,צמוד למדד המחירים לצרכן,2026-01-01,0.048,0.0482,282.18,127.137022,0.359,0.359,עלות מופחתת,6.6e-05,1.8e-05,,
1328,14302.0,ערד בקרן פנסיה מקיפה חדשה,ערד 8778 01.05.2026,71118830.0,2011-05-01,0.5743895671593743,צמוד למדד המחירים לצרכן,2026-05-01,0.048,0.0485,132.13,126.786834,0.168,0.168,עלות מופחתת,3.1e-05,8e-06,,
1328,14302.0,ערד בקרן פנסיה מקיפה חדשה,ערד 8779 01.06.2026,71118848.0,2011-06-01,0.6577234592804972,צמוד למדד המחירים לצרכן,2026-06-01,0.048,0.0484,227.97,125.545192,0.286,0.286,עלות מופחתת,5.3e-05,1.4e-05,,
1328,14302.0,ערד בקרן פנסיה מקיפה חדשה,ערד 8780 01.07.2026,71118855.0,2011-07-01,0.7410567926138304,צמוד למדד המחירים לצרכן,2026-07-01,0.048,0.0484,269.11,124.454088,0.335,0.335,עלות מופחתת,6.2e-05,1.6e-05,,
1328,14302.0,ערד בקרן פנסיה מקיפה חדשה,ערד 8812 01.03.2029,71121651.0,2014-03-01,3.182515412552067,צמוד למדד המחירים לצרכן,2029-03-01,0.048,0.0485,1932.69,119.541567,2.31,2.31,עלות מופחתת,0.000428,0.000116,,
1328,14302.0,ערד בקרן פנסיה מקיפה חדשה,ערד 8810 01.01.2029,71121438.0,2014-01-01,3.0158487458854,צמוד למדד המחירים לצרכן,2029-01-01,0.048,0.0485,1480.13,119.922945,1.775,1.775,עלות מופחתת,0.000329,8.9e-05,,
1328,14302.0,ערד בקרן פנסיה מקיפה חדשה,ערד 8805 01.08.2028,71121206.0,2013-08-01,2.665587454544398,צמוד למדד המחירים לצרכן,2028-08-01,0.048,0.0485,1519.34,119.909147,1.822,1.822,עלות מופחתת,0.000338,9.1e-05,,
1328,14302.0,ערד בקרן פנסיה מקיפה חדשה,ערד 8791 01.06.2027,71119598.0,2012-06-01,1.6001868199641902,צמוד למדד המחירים לצרכן,2027-06-01,0.048,0.0485,137.94,122.922215,0.17,0.17,עלות מופחתת,3.1e-05,8e-06,,
1328,14302.0,ערד בקרן פנסיה מקיפה חדשה,ערד 8846 01.01.2032,71123616.0,2017-01-01,5.411447050734412,צמוד למדד המחירים לצרכן,2032-01-01,0.048,0.0485,6765.15,121.494528,8.219,8.219,עלות מופחתת,0.001525,0.000413,,
1328,14302.0,ערד בקרן פנסיה מקיפה חדשה,ערד 8831 01.10.2030,71122725.0,2015-10-01,4.400636849279766,צמוד למדד המחירים לצרכן,2030-10-01,0.048,0.0485,482.56,121.700731,0.587,0.587,עלות מופחתת,0.000108,2.9e-05,,
1328,14302.0,ערד בקרן פנסיה מקיפה חדשה,ערד 8851 01.06.2032,71123772.0,2017-06-01,5.695130326524218,צמוד למדד המחירים לצרכן,2032-06-01,0.048,0.0485,16808.58,121.603371,20.44,20.44,עלות מופחתת,0.003793,0.001027,,
1328,14302.0,ערד בקרן פנסיה מקיפה חדשה,ערד 8870 01.01.2034,71124796.0,2019-01-01,6.8284128363239835,צמוד למדד המחירים לצרכן,2034-01-01,0.048,0.0485,11899.16,119.699042,14.243,14.243,עלות מופחתת,0.002643,0.000715,,
1328,14302.0,ערד בקרן פנסיה מקיפה חדשה,ערד 8871 01.02.2034,71124945.0,2019-02-01,6.9117461696573175,צמוד למדד המחירים לצרכן,2034-02-01,0.048,0.0485,48957.71,119.570244,58.539,58.539,עלות מופחתת,0.010863,0.002941,,
1328,14302.0,ערד בקרן פנסיה מקיפה חדשה,ערד 8885 01.05.2035,71125603.0,2020-05-01,7.63912347114554,צמוד למדד המחירים לצרכן,2035-05-01,0.048,0.0485,62985.6,120.402353,75.836,75.836,עלות מופחתת,0.014073,0.00381,,
1328,14302.0,ערד בקרן פנסיה מקיפה חדשה,ערד 8886 01.06.2035,71125660.0,2020-06-01,7.722456804478874,צמוד למדד המחירים לצרכן,2035-06-01,0.048,0.0485,114976.67,120.279457,138.293,138.293,עלות מופחתת,0.025664,0.006949,,
1328,14302.0,ערד בקרן פנסיה מקיפה חדשה,ערד 8892 01.12.2035,71126163.0,2020-12-01,8.032988084043678,צמוד למדד המחירים לצרכן,2035-12-01,0.048,0.0485,232227.76,120.279457,279.322,279.322,עלות מופחתת,0.051837,0.014036,,
1328,14302.0,ערד בקרן פנסיה מקיפה חדשה,ערד 8904 01.12.2036,71126841.0,2021-12-01,8.632216086765283,צמוד למדד המחירים לצרכן,2036-12-01,0.048,0.0485,82194.92,117.577516,96.643,96.643,עלות מופחתת,0.017935,0.004856,,
1328,14302.0,ערד בקרן פנסיה מקיפה חדשה,ערד 8772 01.11.2025,71116735.0,2010-11-01,0.08611111111111114,צמוד למדד המחירים לצרכן,2025-11-01,0.048,0.048,194.09,128.622996,0.25,0.25,עלות מופחתת,4.6e-05,1.2e-05,,
1328,14302.0,ערד בקרן פנסיה מקיפה חדשה,ערד 8792 01.07.2027,71119747.0,2012-07-01,1.6835201532975237,צמוד למדד המחירים לצרכן,2027-07-01,0.048,0.0485,542.1,122.444858,0.664,0.664,עלות מופחתת,0.000123,3.3e-05,,
1328,14302.0,ערד בקרן פנסיה מקיפה חדשה,ערד 8790 01.05.2027,71117162.0,2012-05-01,1.516853486630857,צמוד למדד המחירים לצרכן,2027-05-01,0.048,0.0485,584.69,124.958178,0.731,0.731,עלות מופחתת,0.000135,3.6e-05,,
1328,14302.0,ערד בקרן פנסיה מקיפה חדשה,ערד 8837 01.04.2031,71123129.0,2016-04-01,4.785574882157442,צמוד למדד המחירים לצרכן,2031-04-01,0.048,0.0485,3734.7,123.681618,4.619,4.619,עלות מופחתת,0.000857,0.000232,,
1328,14302.0,ערד בקרן פנסיה מקיפה חדשה,ערד 8853 01.08.2032,71123939.0,2017-08-01,5.861796993190884,צמוד למדד המחירים לצרכן,2032-08-01,0.048,0.0485,17377.79,121.005087,21.028,21.028,עלות מופחתת,0.003902,0.001056,,
1328,14302.0,ערד בקרן פנסיה מקיפה חדשה,ערד 8830 01.09.2030,71122717.0,2015-09-01,4.423084483674979,צמוד למדד המחירים לצרכן,2030-09-01,0.048,0.0485,1359.61,119.070903,1.619,1.619,עלות מופחתת,0.0003,8.1e-05,,
1328,14302.0,ערד בקרן פנסיה מקיפה חדשה,ערד 8872 01.03.2034,71124986.0,2019-03-01,6.99507950299065,צמוד למדד המחירים לצרכן,2034-03-01,0.048,0.0485,35187.81,119.203218,41.945,41.945,עלות מופחתת,0.007784,0.002107,,
1328,14302.0,ערד בקרן פנסיה מקיפה חדשה,ערד 8859 01.02.2033,71124325.0,2018-02-01,6.220163618575248,צמוד למדד המחירים לצרכן,2033-02-01,0.048,0.0485,30554.28,120.522995,36.825,36.825,עלות מופחתת,0.006834,0.00185,,
1328,14302.0,ערד בקרן פנסיה מקיפה חדשה,ערד 8854 01.09.2032,71123947.0,2017-09-01,5.945130326524218,צמוד למדד המחירים לצרכן,2032-09-01,0.048,0.0485,17717.09,120.636282,21.373,21.373,עלות מופחתת,0.003966,0.001074,,
1328,14302.0,ערד בקרן פנסיה מקיפה חדשה,ערד 8882 01.01.2035,71125454.0,2020-01-01,7.48774845852252,צמוד למדד המחירים לצרכן,2035-01-01,0.048,0.0485,90223.37,119.336917,107.67,107.67,עלות מופחתת,0.019981,0.00541,,
1328,14302.0,ערד בקרן פנסיה מקיפה חדשה,ערד 8873 01.04.2034,71125108.0,2019-04-01,6.912017153161408,צמוד למדד המחירים לצרכן,2034-04-01,0.048,0.0485,25690.84,121.471191,31.207,31.207,עלות מופחתת,0.005791,0.001568,,
1328,14302.0,ערד בקרן פנסיה מקיפה חדשה,ערד 8879 01.10.2034,71125389.0,2019-10-01,7.2377484585225185,צמוד למדד המחירים לצרכן,2034-10-01,0.048,0.0485,57374.83,120.509043,69.142,69.142,עלות מופחתת,0.012831,0.003474,,
1328,14302.0,ערד בקרן פנסיה מקיפה חדשה,ערד 8890 01.10.2035,71126106.0,2020-10-01,7.8663214173770095,צמוד למדד המחירים לצרכן,2035-10-01,0.048,0.0485,60033.07,121.471191,72.923,72.923,עלות מופחתת,0.013533,0.003664,,
1328,14302.0,ערד בקרן פנסיה מקיפה חדשה,ערד 8884 01.03.2035,71125512.0,2020-03-01,7.654415125189185,צמוד למדד המחירים לצרכן,2035-03-01,0.048,0.0485,52450.41,118.847034,62.336,62.336,עלות מופחתת,0.011568,0.003132,,
1328,14302.0,ערד בקרן פנסיה מקיפה חדשה,ערד 8898 01.06.2036,71126445.0,2021-06-01,8.336184120226578,צמוד למדד המחירים לצרכן,2036-06-01,0.048,0.0485,146515.46,119.325448,174.83,174.83,עלות מופחתת,0.032445,0.008785,,
1328,14302.0,ערד בקרן פנסיה מקיפה חדשה,ערד 8788 01.03.2027,71116727.0,2012-03-01,1.384549207576438,צמוד למדד המחירים לצרכן,2027-03-01,0.048,0.0485,647.13,122.976548,0.796,0.796,עלות מופחתת,0.000147,3.9e-05,,
1328,14302.0,ערד בקרן פנסיה מקיפה חדשה,ערד 8905 01.01.2037,71126981.0,2022-01-01,8.715549420098617,צמוד למדד המחירים לצרכן,2037-01-01,0.048,0.0485,99916.86,117.235403,117.138,117.138,עלות מופחתת,0.021738,0.005886,,
1328,14302.0,ערד בקרן פנסיה מקיפה חדשה,ערד 8777 01.04.2026,71118822.0,2011-04-01,0.49105623382604097,צמוד למדד המחירים לצרכן,2026-04-01,0.048,0.0485,343.65,127.526063,0.438,0.438,עלות מופחתת,8.1e-05,2.2e-05,,
1328,14302.0,ערד בקרן פנסיה מקיפה חדשה,ערד 8793 01.08.2027,71119846.0,2012-08-01,1.766853486630857,צמוד למדד המחירים לצרכן,2027-08-01,0.048,0.0485,928.35,122.300021,1.135,1.135,עלות מופחתת,0.00021,5.7e-05,,
1328,14302.0,ערד בקרן פנסיה מקיפה חדשה,ערד 8799 01.02.2028,71120612.0,2013-02-01,2.221560037135377,צמוד למדד המחירים לצרכן,2028-02-01,0.048,0.0485,777.33,121.490087,0.944,0.944,עלות מופחתת,0.000175,4.7e-05,,
1328,14302.0,ערד בקרן פנסיה מקיפה חדשה,ערד 8802 01.05.2028,71121016.0,2013-05-01,2.415587454544398,צמוד למדד המחירים לצרכן,2028-05-01,0.048,0.0485,1094.37,122.918209,1.345,1.345,עלות מופחתת,0.000249,6.7e-05,,
1328,14302.0,ערד בקרן פנסיה מקיפה חדשה,ערד 8815 01.06.2029,71121685.0,2014-06-01,3.355918110192216,צמוד למדד המחירים לצרכן,2029-06-01,0.048,0.0485,2303.45,120.744908,2.781,2.781,עלות מופחתת,0.000516,0.000139,,
1328,14302.0,ערד בקרן פנסיה מקיפה חדשה,ערד 8813 01.04.2029,71121669.0,2014-04-01,3.18925144352555,צמוד למדד המחירים לצרכן,2029-04-01,0.048,0.0485,1520.3,122.177942,1.857,1.857,עלות מופחתת,0.000344,9.3e-05,,
1328,14302.0,ערד בקרן פנסיה מקיפה חדשה,ערד 8820 01.11.2029,71121776.0,2014-11-01,3.686031050443114,צמוד למדד המחירים לצרכן,2029-11-01,0.048,0.0485,1741.99,121.110588,2.11,2.11,עלות מופחתת,0.000391,0.000106,,
1328,14302.0,ערד בקרן פנסיה מקיפה חדשה,ערד 8823 01.02.2030,71122410.0,2015-02-01,3.9360310504431135,צמוד למדד המחירים לצרכן,2030-02-01,0.048,0.0485,2439.94,119.556818,2.917,2.917,עלות מופחתת,0.000541,0.000146,,
1328,14302.0,ערד בקרן פנסיה מקיפה חדשה,ערד 8863 01.06.2033,71124499.0,2018-06-01,6.4034145394844675,צמוד למדד המחירים לצרכן,2033-06-01,0.048,0.0485,25303.63,121.120338,30.648,30.648,עלות מופחתת,0.005687,0.00154,,
1328,14302.0,ערד בקרן פנסיה מקיפה חדשה,ערד 8849 01.04.2032,71123731.0,2017-04-01,5.528463659857552,צמוד למדד המחירים לצרכן,2032-04-01,0.048,0.0485,10775.26,123.17763,13.273,13.273,עלות מופחתת,0.002463,0.000666,,
1328,14302.0,ערד בקרן פנסיה מקיפה חדשה,ערד 8825 01.04.2030,71122501.0,2015-04-01,4.006417817008313,צמוד למדד המחירים לצרכן,2030-04-01,0.048,0.0485,2995.11,123.430488,3.697,3.697,עלות מופחתת,0.000686,0.000185,,
1328,14302.0,ערד בקרן פנסיה מקיפה חדשה,ערד 8855 01.10.2032,71124093.0,2017-10-01,5.886830285241915,צמוד למדד המחירים לצרכן,2032-10-01,0.048,0.0485,15306.66,122.685902,18.779,18.779,עלות מופחתת,0.003485,0.000943,,
1328,14302.0,ערד בקרן פנסיה מקיפה חדשה,ערד 8881 01.12.2034,71125421.0,2019-12-01,7.404415125189185,צמוד למדד המחירים לצרכן,2034-12-01,0.048,0.0485,66297.27,119.328631,79.112,79.112,עלות מופחתת,0.014681,0.003975,,
1328,14302.0,ערד בקרן פנסיה מקיפה חדשה,ערד 8874 01.05.2034,71125132.0,2019-05-01,6.995350486494741,צמוד למדד המחירים לצרכן,2034-05-01,0.048,0.0485,44560.87,120.402353,53.652,53.652,עלות מופחתת,0.009956,0.002696,,
1328,14302.0,ערד בקרן פנסיה מקיפה חדשה,ערד 8897 01.05.2036,71126395.0,2021-05-01,8.252850786893246,צמוד למדד המחירים לצרכן,2036-05-01,0.048,0.0485,241251.85,120.161553,289.892,289.892,עלות מופחתת,0.053799,0.014567,,
1328,14302.0,ערד בקרן פנסיה מקיפה חדשה,ערד 8888 01.08.2035,71125702.0,2020-08-01,7.889123471145539,צמוד למדד המחירים לצרכן,2035-08-01,0.048,0.0485,136806.0,119.807017,163.903,163.903,עלות מופחתת,0.030417,0.008236,,
1328,14302.0,ערד בקרן פנסיה מקיפה חדשה,ערד 8900 01.08.2036,71126544.0,2021-08-01,8.502850786893246,צמוד למדד המחירים לצרכן,2036-08-01,0.048,0.0485,96289.12,117.799478,113.428,113.428,עלות מופחתת,0.02105,0.005699,,
1328,14302.0,ערד בקרן פנסיה מקיפה חדשה,ערד 8801 01.04.2028,71120935.0,2013-04-01,2.332254121211065,צמוד למדד המחירים לצרכן,2028-04-01,0.048,0.0485,2643.23,123.639692,3.268,3.268,עלות מופחתת,0.000606,0.000164,,
1328,14302.0,ערד בקרן פנסיה מקיפה חדשה,ערד 8816 01.07.2029,71121693.0,2014-07-01,3.4392514435255492,צמוד למדד המחירים לצרכן,2029-07-01,0.048,0.0485,1631.14,120.158088,1.96,1.96,עלות מופחתת,0.000363,9.8e-05,,
1328,14302.0,ערד בקרן פנסיה מקיפה חדשה,ערד 8832 01.11.2030,71122741.0,2015-11-01,4.4839701826131,צמוד למדד המחירים לצרכן,2030-11-01,0.048,0.0485,4463.63,121.719184,5.433,5.433,עלות מופחתת,0.001008,0.000273,,
1328,14302.0,ערד בקרן פנסיה מקיפה חדשה,ערד 8822 01.01.2030,71122402.0,2015-01-01,3.85269771710978,צמוד למדד המחירים לצרכן,2030-01-01,0.048,0.0485,1452.06,120.040402,1.743,1.743,עלות מופחתת,0.000323,8.7e-05,,
1328,14302.0,ערד בקרן פנסיה מקיפה חדשה,ערד 8841 01.08.2031,71123368.0,2016-08-01,5.118908215490776,צמוד למדד המחירים לצרכן,2031-08-01,0.048,0.0485,6062.35,120.760879,7.321,7.321,עלות מופחתת,0.001358,0.000367,,
1328,14302.0,ערד בקרן פנסיה מקיפה חדשה,ערד 8834 01.01.2031,71122931.0,2016-01-01,4.650636849279767,צמוד למדד המחירים לצרכן,2031-01-01,0.048,0.0485,1179.07,121.127105,1.428,1.428,עלות מופחתת,0.000265,7.1e-05,,
1328,14302.0,ערד בקרן פנסיה מקיפה חדשה,ערד 8842 01.09.2031,71123434.0,2016-09-01,5.202241548824109,צמוד למדד המחירים לצרכן,2031-09-01,0.048,0.0485,3657.25,119.788918,4.381,4.381,עלות מופחתת,0.000813,0.00022,,
1328,14302.0,ערד בקרן פנסיה מקיפה חדשה,ערד 8850 01.05.2032,71123749.0,2017-05-01,5.611796993190885,צמוד למדד המחירים לצרכן,2032-05-01,0.048,0.0485,10428.22,122.335286,12.757,12.757,עלות מופחתת,0.002367,0.000641,,
1328,14302.0,ערד בקרן פנסיה מקיפה חדשה,ערד 8860 01.03.2033,71124358.0,2018-03-01,6.303496951908582,צמוד למדד המחירים לצרכן,2033-03-01,0.048,0.0485,16506.55,120.636282,19.913,19.913,עלות מופחתת,0.003695,0.001,,
1328,14302.0,ערד בקרן פנסיה מקיפה חדשה,ערד 8852 01.07.2032,71123921.0,2017-07-01,5.778463659857551,צמוד למדד המחירים לצרכן,2032-07-01,0.048,0.0485,11129.08,120.649978,13.427,13.427,עלות מופחתת,0.002491,0.000674,,
1328,14302.0,ערד בקרן פנסיה מקיפה חדשה,ערד 8864 01.07.2033,71124556.0,2018-07-01,6.4867478728178005,צמוד למדד המחירים לצרכן,2033-07-01,0.048,0.0485,17845.35,120.053881,21.424,21.424,עלות מופחתת,0.003975,0.001076,,
1328,14302.0,ערד בקרן פנסיה מקיפה חדשה,ערד 8876 01.07.2034,71125272.0,2019-07-01,7.1620171531614085,צמוד למדד המחירים לצרכן,2034-07-01,0.048,0.0485,50808.61,118.280838,60.097,60.097,עלות מופחתת,0.011152,0.003019,,
1328,14302.0,ערד בקרן פנסיה מקיפה חדשה,ערד 8895 01.03.2036,71126320.0,2021-03-01,8.282988084043675,צמוד למדד המחירים לצרכן,2036-03-01,0.048,0.0485,154919.51,119.323496,184.855,184.855,עלות מופחתת,0.034306,0.009289,,
1328,14302.0,ערד בקרן פנסיה מקיפה חדשה,ערד 8901 01.09.2036,71126593.0,2021-09-01,8.586184120226578,צמוד למדד המחירים לצרכן,2036-09-01,0.048,0.0485,158342.5,116.86201,185.042,185.042,עלות מופחתת,0.03434,0.009298,,
1328,14302.0,ערד בקרן פנסיה מקיפה חדשה,ערד 8893 01.01.2036,71126239.0,2021-01-01,8.116321417377012,צמוד למדד המחירים לצרכן,2036-01-01,0.048,0.0485,223511.52,120.051509,268.329,268.329,עלות מופחתת,0.049797,0.013483,,
1328,14302.0,ערד בקרן פנסיה מקיפה חדשה,ערד 8789 01.04.2027,71116701.0,2012-04-01,1.4335201532975232,צמוד למדד המחירים לצרכן,2027-04-01,0.048,0.0485,615.19,125.441503,0.772,0.772,עלות מופחתת,0.000143,3.8e-05,,
1328,14302.0,ערד בקרן פנסיה מקיפה חדשה,ערד 8773 01.12.2025,71116743.0,2010-12-01,0.16944444444444448,צמוד למדד המחירים לצרכן,2025-12-01,0.048,0.0481,136.0,127.7514,0.174,0.174,עלות מופחתת,3.2e-05,8e-06,,
1328,14302.0,ערד בקרן פנסיה מקיפה חדשה,ערד 8776 01.03.2026,71116776.0,2011-03-01,0.41944444444444445,צמוד למדד המחירים לצרכן,2026-03-01,0.048,0.0484,147.62,125.387852,0.185,0.185,עלות מופחתת,3.4e-05,9e-06,,
1328,14302.0,ערד בקרן פנסיה מקיפה חדשה,ערד 8781 01.08.2026,71118616.0,2011-08-01,0.824390125947164,צמוד למדד המחירים לצרכן,2026-08-01,0.048,0.0484,469.01,123.475983,0.579,0.579,עלות מופחתת,0.000107,2.9e-05,,
1328,14302.0,ערד בקרן פנסיה מקיפה חדשה,ערד 8775 01.02.2026,71116768.0,2011-02-01,0.33611111111111114,צמוד למדד המחירים לצרכן,2026-02-01,0.048,0.0483,158.75,126.155869,0.2,0.2,עלות מופחתת,3.7e-05,1e-05,,
1328,14302.0,ערד בקרן פנסיה מקיפה חדשה,ערד 8814 01.05.2029,71121677.0,2014-05-01,3.2725847768588836,צמוד למדד המחירים לצרכן,2029-05-01,0.048,0.0485,1291.36,121.348526,1.567,1.567,עלות מופחתת,0.00029,7.8e-05,,
1328,14302.0,ערד בקרן פנסיה מקיפה חדשה,ערד 8800 01.03.2028,71120687.0,2013-09-01,2.748920787877731,צמוד למדד המחירים לצרכן,2028-09-01,0.048,0.0485,589.53,119.073236,0.702,0.702,עלות מופחתת,0.00013,3.5e-05,,
1328,14302.0,ערד בקרן פנסיה מקיפה חדשה,ערד 8771 01.10.2025,71118814.0,2010-10-01,0.0027777777777777683,צמוד למדד המחירים לצרכן,2025-10-01,0.048,0.0479,166.98,130.091327,0.217,0.217,עלות מופחתת,4e-05,1e-05,,
1328,14302.0,ערד בקרן פנסיה מקיפה חדשה,ערד 8848 01.03.2032,71123673.0,2017-03-01,5.578113717401076,צמוד למדד המחירים לצרכן,2032-03-01,0.048,0.0485,9789.8,120.75716,11.822,11.822,עלות מופחתת,0.002193,0.000594,,
1328,14302.0,ערד בקרן פנסיה מקיפה חדשה,ערד 8803 01.06.2028,71121057.0,2013-06-01,2.498920787877731,צמוד למדד המחירים לצרכן,2028-06-01,0.048,0.0485,1133.57,121.941587,1.382,1.382,עלות מופחתת,0.000256,6.9e-05,,
1328,14302.0,ערד בקרן פנסיה מקיפה חדשה,ערד 8798 01.01.2028,71120596.0,2013-01-01,2.1382267038020437,צמוד למדד המחירים לצרכן,2028-01-01,0.048,0.0485,1260.38,122.212735,1.54,1.54,עלות מופחתת,0.000285,7.7e-05,,
1328,14302.0,ערד בקרן פנסיה מקיפה חדשה,ערד 8817 01.08.2029,71121701.0,2014-08-01,3.5225847768588836,צמוד למדד המחירים לצרכן,2029-08-01,0.048,0.0485,1012.57,119.323081,1.208,1.208,עלות מופחתת,0.000224,6e-05,,
1328,14302.0,ערד בקרן פנסיה מקיפה חדשה,ערד 8865 01.08.2033,71124580.0,2018-08-01,6.570081206151133,צמוד למדד המחירים לצרכן,2033-08-01,0.048,0.0485,27231.0,119.452208,32.528,32.528,עלות מופחתת,0.006036,0.001634,,
1328,14302.0,ערד בקרן פנסיה מקיפה חדשה,ערד 8880 01.11.2034,71125405.0,2019-11-01,7.3210817918558515,צמוד למדד המחירים לצרכן,2034-11-01,0.048,0.0485,66634.15,120.282907,80.149,80.149,עלות מופחתת,0.014874,0.004027,,
1328,14302.0,ערד בקרן פנסיה מקיפה חדשה,ערד 8808 01.11.2028,71121297.0,2013-11-01,2.8491820792187337,צמוד למדד המחירים לצרכן,2028-11-01,0.048,0.0485,2099.19,120.755425,2.535,2.535,עלות מופחתת,0.00047,0.000127,,
1328,14302.0,ערד בקרן פנסיה מקיפה חדשה,ערד 8899 01.07.2036,71126460.0,2021-07-01,8.419517453559914,צמוד למדד המחירים לצרכן,2036-07-01,0.048,0.0485,203886.91,118.392711,241.387,241.387,עלות מופחתת,0.044797,0.012129,,
1328,14302.0,ערד בקרן פנסיה מקיפה חדשה,ערד 8826 01.05.2030,71122535.0,2015-05-01,4.089751150341647,צמוד למדד המחירים לצרכן,2030-05-01,0.048,0.0485,1964.63,122.581567,2.408,2.408,עלות מופחתת,0.000446,0.000121,,
1328,14302.0,ערד בקרן פנסיה מקיפה חדשה,ערד 8818 01.09.2029,71121750.0,2014-09-01,3.6059181101922166,צמוד למדד המחירים לצרכן,2029-09-01,0.048,0.0485,2110.81,118.724388,2.506,2.506,עלות מופחתת,0.000465,0.000125,,
1328,14302.0,ערד בקרן פנסיה מקיפה חדשה,ערד 8839 01.06.2031,71123301.0,2016-06-01,4.95224154882411,צמוד למדד המחירים לצרכן,2031-06-01,0.048,0.0485,3160.65,122.463483,3.871,3.871,עלות מופחתת,0.000718,0.000194,,
1328,14302.0,ערד בקרן פנסיה מקיפה חדשה,ערד 8844 01.11.2031,71123525.0,2016-11-01,5.244780384067743,צמוד למדד המחירים לצרכן,2031-11-01,0.048,0.0485,4046.89,122.210482,4.946,4.946,עלות מופחתת,0.000917,0.000248,,
1328,14302.0,ערד בקרן פנסיה מקיפה חדשה,ערד 8856 01.11.2032,71124119.0,2017-11-01,5.970163618575247,צמוד למדד המחירים לצרכן,2032-11-01,0.048,0.0485,16080.61,122.091348,19.633,19.633,עלות מופחתת,0.003643,0.000986,,
1328,14302.0,ערד בקרן פנסיה מקיפה חדשה,ערד 8858 01.01.2033,71124267.0,2018-01-01,6.136830285241914,צמוד למדד המחירים לצרכן,2033-01-01,0.048,0.0485,19324.03,121.131135,23.407,23.407,עלות מופחתת,0.004344,0.001176,,
1328,14302.0,ערד בקרן פנסיה מקיפה חדשה,ערד 8866 01.09.2033,71124630.0,2018-09-01,6.653414539484467,צמוד למדד המחירים לצרכן,2033-09-01,0.048,0.0485,27930.89,118.969048,33.229,33.229,עלות מופחתת,0.006166,0.001669,,
1328,14302.0,ערד בקרן פנסיה מקיפה חדשה,ערד 8861 01.04.2033,71124432.0,2018-04-01,6.2367478728178,צמוד למדד המחירים לצרכן,2033-04-01,0.048,0.0485,15557.87,122.931274,19.125,19.125,עלות מופחתת,0.003549,0.000961,,
1328,14302.0,ערד בקרן פנסיה מקיפה חדשה,ערד 8883 01.02.2035,71125488.0,2020-02-01,7.5710817918558515,צמוד למדד המחירים לצרכן,2035-02-01,0.048,0.0485,78488.78,118.856167,93.289,93.289,עלות מופחתת,0.017312,0.004687,,
1328,14302.0,ערד בקרן פנסיה מקיפה חדשה,ערד 8877 01.08.2034,71125314.0,2019-08-01,7.2453504864947424,צמוד למדד המחירים לצרכן,2034-08-01,0.048,0.0485,57448.4,118.503479,68.078,68.078,עלות מופחתת,0.012634,0.00342,,
1328,14302.0,ערד בקרן פנסיה מקיפה חדשה,ערד 8867 01.10.2033,71124648.0,2018-10-01,6.5784128363239835,צמוד למדד המחירים לצרכן,2033-10-01,0.048,0.0485,10043.91,121.233998,12.177,12.177,עלות מופחתת,0.002259,0.000611,,
1328,14302.0,ערד בקרן פנסיה מקיפה חדשה,ערד 8869 01.12.2033,71124697.0,2018-12-01,6.7450795029906505,צמוד למדד המחירים לצרכן,2033-12-01,0.048,0.0485,27487.53,119.811572,32.933,32.933,עלות מופחתת,0.006111,0.001654,,
1328,14302.0,ערד בקרן פנסיה מקיפה חדשה,ערד 8887 01.07.2035,71125678.0,2020-07-01,7.805790137812206,צמוד למדד המחירים לצרכן,2035-07-01,0.048,0.0485,79754.49,120.17144,95.842,95.842,עלות מופחתת,0.017786,0.004816,,
1328,14302.0,ערד בקרן פנסיה מקיפה חדשה,ערד 8903 01.11.2036,71126718.0,2021-11-01,8.548882753431949,צמוד למדד המחירים לצרכן,2036-11-01,0.048,0.0485,214766.24,118.164734,253.778,253.778,עלות מופחתת,0.047096,0.012752,,
1328,14303.0,ערד בקרן פנסיה מקיפה חדשה,ערד 8887 01.07.2035,71125678.0,2020-07-01,7.805790137812206,צמוד למדד המחירים לצרכן,2035-07-01,0.048,0.0485,223531.41,120.17144,268.621,268.621,עלות מופחתת,0.017774,0.004869,,
1328,14303.0,ערד בקרן פנסיה מקיפה חדשה,ערד 8903 01.11.2036,71126718.0,2021-11-01,8.548882753431949,צמוד למדד המחירים לצרכן,2036-11-01,0.048,0.0485,601934.74,118.164734,711.275,711.275,עלות מופחתת,0.047065,0.012894,,
1328,14303.0,ערד בקרן פנסיה מקיפה חדשה,ערד 8867 01.10.2033,71124648.0,2018-10-01,6.5784128363239835,צמוד למדד המחירים לצרכן,2033-10-01,0.048,0.0485,28150.51,121.233998,34.128,34.128,עלות מופחתת,0.002258,0.000618,,
1328,14303.0,ערד בקרן פנסיה מקיפה חדשה,ערד 8869 01.12.2033,71124697.0,2018-12-01,6.7450795029906505,צמוד למדד המחירים לצרכן,2033-12-01,0.048,0.0485,77040.5,119.811572,92.303,92.303,עלות מופחתת,0.006107,0.001673,,
1328,14303.0,ערד בקרן פנסיה מקיפה חדשה,ערד 8877 01.08.2034,71125314.0,2019-08-01,7.2453504864947424,צמוד למדד המחירים לצרכן,2034-08-01,0.048,0.0485,161013.16,118.503479,190.806,190.806,עלות מופחתת,0.012625,0.003459,,
1328,14303.0,ערד בקרן פנסיה מקיפה חדשה,ערד 8883 01.02.2035,71125488.0,2020-02-01,7.5710817918558515,צמוד למדד המחירים לצרכן,2035-02-01,0.048,0.0485,219983.94,118.856167,261.464,261.464,עלות מופחתת,0.017301,0.004739,,
1328,14303.0,ערד בקרן פנסיה מקיפה חדשה,ערד 8861 01.04.2033,71124432.0,2018-04-01,6.2367478728178,צמוד למדד המחירים לצרכן,2033-04-01,0.048,0.0485,43604.73,122.931274,53.604,53.604,עלות מופחתת,0.003547,0.000971,,
1328,14303.0,ערד בקרן פנסיה מקיפה חדשה,ערד 8866 01.09.2033,71124630.0,2018-09-01,6.653414539484467,צמוד למדד המחירים לצרכן,2033-09-01,0.048,0.0485,78283.13,118.969048,93.133,93.133,עלות מופחתת,0.006162,0.001688,,
1328,14303.0,ערד בקרן פנסיה מקיפה חדשה,ערד 8858 01.01.2033,71124267.0,2018-01-01,6.136830285241914,צמוד למדד המחירים לצרכן,2033-01-01,0.048,0.0485,54160.33,121.131135,65.605,65.605,עלות מופחתת,0.004341,0.001189,,
1328,14303.0,ערד בקרן פנסיה מקיפה חדשה,ערד 8856 01.11.2032,71124119.0,2017-11-01,5.970163618575247,צמוד למדד המחירים לצרכן,2032-11-01,0.048,0.0485,45069.84,122.091348,55.026,55.026,עלות מופחתת,0.003641,0.000997,,
1328,14303.0,ערד בקרן פנסיה מקיפה חדשה,ערד 8839 01.06.2031,71123301.0,2016-06-01,4.95224154882411,צמוד למדד המחירים לצרכן,2031-06-01,0.048,0.0485,8858.5,122.463483,10.848,10.848,עלות מופחתת,0.000717,0.000196,,
1328,14303.0,ערד בקרן פנסיה מקיפה חדשה,ערד 8844 01.11.2031,71123525.0,2016-11-01,5.244780384067743,צמוד למדד המחירים לצרכן,2031-11-01,0.048,0.0485,11342.41,122.210482,13.862,13.862,עלות מופחתת,0.000917,0.000251,,
1328,14303.0,ערד בקרן פנסיה מקיפה חדשה,ערד 8899 01.07.2036,71126460.0,2021-07-01,8.419517453559914,צמוד למדד המחירים לצרכן,2036-07-01,0.048,0.0485,571442.76,118.392711,676.547,676.547,עלות מופחתת,0.044767,0.012264,,
1328,14303.0,ערד בקרן פנסיה מקיפה חדשה,ערד 8818 01.09.2029,71121750.0,2014-09-01,3.6059181101922166,צמוד למדד המחירים לצרכן,2029-09-01,0.048,0.0485,5916.07,118.724388,7.024,7.024,עלות מופחתת,0.000464,0.000127,,
1328,14303.0,ערד בקרן פנסיה מקיפה חדשה,ערד 8826 01.05.2030,71122535.0,2015-05-01,4.089751150341647,צמוד למדד המחירים לצרכן,2030-05-01,0.048,0.0485,5506.38,122.581567,6.75,6.75,עלות מופחתת,0.000446,0.000122,,
1328,14303.0,ערד בקרן פנסיה מקיפה חדשה,ערד 8880 01.11.2034,71125405.0,2019-11-01,7.3210817918558515,צמוד למדד המחירים לצרכן,2034-11-01,0.048,0.0485,186758.44,120.282907,224.638,224.638,עלות מופחתת,0.014864,0.004072,,
1328,14303.0,ערד בקרן פנסיה מקיפה חדשה,ערד 8808 01.11.2028,71121297.0,2013-11-01,2.8491820792187337,צמוד למדד המחירים לצרכן,2028-11-01,0.048,0.0485,5883.51,120.755425,7.105,7.105,עלות מופחתת,0.00047,0.000128,,
1328,14303.0,ערד בקרן פנסיה מקיפה חדשה,ערד 8865 01.08.2033,71124580.0,2018-08-01,6.570081206151133,צמוד למדד המחירים לצרכן,2033-08-01,0.048,0.0485,76321.51,119.452208,91.168,91.168,עלות מופחתת,0.006032,0.001652,,
1328,14303.0,ערד בקרן פנסיה מקיפה חדשה,ערד 8803 01.06.2028,71121057.0,2013-06-01,2.498920787877731,צמוד למדד המחירים לצרכן,2028-06-01,0.048,0.0485,3177.12,121.941587,3.874,3.874,עלות מופחתת,0.000256,7e-05,,
1328,14303.0,ערד בקרן פנסיה מקיפה חדשה,ערד 8848 01.03.2032,71123673.0,2017-03-01,5.578113717401076,צמוד למדד המחירים לצרכן,2032-03-01,0.048,0.0485,27438.3,120.75716,33.134,33.134,עלות מופחתת,0.002192,0.0006,,
1328,14303.0,ערד בקרן פנסיה מקיפה חדשה,ערד 8817 01.08.2029,71121701.0,2014-08-01,3.5225847768588836,צמוד למדד המחירים לצרכן,2029-08-01,0.048,0.0485,2837.97,119.323081,3.386,3.386,עלות מופחתת,0.000224,6.1e-05,,
1328,14303.0,ערד בקרן פנסיה מקיפה חדשה,ערד 8771 01.10.2025,71118814.0,2010-10-01,0.0027777777777777683,צמוד למדד המחירים לצרכן,2025-10-01,0.048,0.0479,468.02,130.091327,0.609,0.609,עלות מופחתת,4e-05,1.1e-05,,
1328,14303.0,ערד בקרן פנסיה מקיפה חדשה,ערד 8798 01.01.2028,71120596.0,2013-01-01,2.1382267038020437,צמוד למדד המחירים לצרכן,2028-01-01,0.048,0.0485,3532.54,122.212735,4.317,4.317,עלות מופחתת,0.000285,7.8e-05,,
1328,14303.0,ערד בקרן פנסיה מקיפה חדשה,ערד 8814 01.05.2029,71121677.0,2014-05-01,3.2725847768588836,צמוד למדד המחירים לצרכן,2029-05-01,0.048,0.0485,3619.37,121.348526,4.392,4.392,עלות מופחתת,0.00029,7.9e-05,,
1328,14303.0,ערד בקרן פנסיה מקיפה חדשה,ערד 8800 01.03.2028,71120687.0,2013-09-01,2.748920787877731,צמוד למדד המחירים לצרכן,2028-09-01,0.048,0.0485,1652.32,119.073236,1.967,1.967,עלות מופחתת,0.00013,3.5e-05,,
1328,14303.0,ערד בקרן פנסיה מקיפה חדשה,ערד 8781 01.08.2026,71118616.0,2011-08-01,0.824390125947164,צמוד למדד המחירים לצרכן,2026-08-01,0.048,0.0484,1314.53,123.475983,1.623,1.623,עלות מופחתת,0.000107,2.9e-05,,
1328,14303.0,ערד בקרן פנסיה מקיפה חדשה,ערד 8775 01.02.2026,71116768.0,2011-02-01,0.33611111111111114,צמוד למדד המחירים לצרכן,2026-02-01,0.048,0.0483,444.96,126.155869,0.561,0.561,עלות מופחתת,3.7e-05,1e-05,,
1328,14303.0,ערד בקרן פנסיה מקיפה חדשה,ערד 8776 01.03.2026,71116776.0,2011-03-01,0.41944444444444445,צמוד למדד המחירים לצרכן,2026-03-01,0.048,0.0484,413.75,125.387852,0.519,0.519,עלות מופחתת,3.4e-05,9e-06,,
1328,14303.0,ערד בקרן פנסיה מקיפה חדשה,ערד 8773 01.12.2025,71116743.0,2010-12-01,0.16944444444444448,צמוד למדד המחירים לצרכן,2025-12-01,0.048,0.0481,381.2,127.7514,0.487,0.487,עלות מופחתת,3.2e-05,8e-06,,
1328,14303.0,ערד בקרן פנסיה מקיפה חדשה,ערד 8789 01.04.2027,71116701.0,2012-04-01,1.4335201532975232,צמוד למדד המחירים לצרכן,2027-04-01,0.048,0.0485,1724.22,125.441503,2.163,2.163,עלות מופחתת,0.000143,3.9e-05,,
1328,14303.0,ערד בקרן פנסיה מקיפה חדשה,ערד 8901 01.09.2036,71126593.0,2021-09-01,8.586184120226578,צמוד למדד המחירים לצרכן,2036-09-01,0.048,0.0485,443793.46,116.86201,518.626,518.626,עלות מופחתת,0.034317,0.009401,,
1328,14303.0,ערד בקרן פנסיה מקיפה חדשה,ערד 8893 01.01.2036,71126239.0,2021-01-01,8.116321417377012,צמוד למדד המחירים לצרכן,2036-01-01,0.048,0.0485,626445.53,120.051509,752.057,752.057,עלות מופחתת,0.049764,0.013633,,
1328,14303.0,ערד בקרן פנסיה מקיפה חדשה,ערד 8895 01.03.2036,71126320.0,2021-03-01,8.282988084043675,צמוד למדד המחירים לצרכן,2036-03-01,0.048,0.0485,434199.69,119.323496,518.102,518.102,עלות מופחתת,0.034283,0.009392,,
1328,14303.0,ערד בקרן פנסיה מקיפה חדשה,ערד 8864 01.07.2033,71124556.0,2018-07-01,6.4867478728178005,צמוד למדד המחירים לצרכן,2033-07-01,0.048,0.0485,50015.96,120.053881,60.046,60.046,עלות מופחתת,0.003973,0.001088,,
1328,14303.0,ערד בקרן פנסיה מקיפה חדשה,ערד 8876 01.07.2034,71125272.0,2019-07-01,7.1620171531614085,צמוד למדד המחירים לצרכן,2034-07-01,0.048,0.0485,142403.52,118.280838,168.436,168.436,עלות מופחתת,0.011145,0.003053,,
1328,14303.0,ערד בקרן פנסיה מקיפה חדשה,ערד 8860 01.03.2033,71124358.0,2018-03-01,6.303496951908582,צמוד למדד המחירים לצרכן,2033-03-01,0.048,0.0485,46263.64,120.636282,55.811,55.811,עלות מופחתת,0.003693,0.001011,,
1328,14303.0,ערד בקרן פנסיה מקיפה חדשה,ערד 8852 01.07.2032,71123921.0,2017-07-01,5.778463659857551,צמוד למדד המחירים לצרכן,2032-07-01,0.048,0.0485,31191.97,120.649978,37.633,37.633,עלות מופחתת,0.00249,0.000682,,
1328,14303.0,ערד בקרן פנסיה מקיפה חדשה,ערד 8842 01.09.2031,71123434.0,2016-09-01,5.202241548824109,צמוד למדד המחירים לצרכן,2031-09-01,0.048,0.0485,10250.36,119.788918,12.279,12.279,עלות מופחתת,0.000812,0.000222,,
1328,14303.0,ערד בקרן פנסיה מקיפה חדשה,ערד 8850 01.05.2032,71123749.0,2017-05-01,5.611796993190885,צמוד למדד המחירים לצרכן,2032-05-01,0.048,0.0485,29227.64,122.335286,35.756,35.756,עלות מופחתת,0.002365,0.000648,,
1328,14303.0,ערד בקרן פנסיה מקיפה חדשה,ערד 8832 01.11.2030,71122741.0,2015-11-01,4.4839701826131,צמוד למדד המחירים לצרכן,2030-11-01,0.048,0.0485,12510.43,121.719184,15.228,15.228,עלות מופחתת,0.001007,0.000276,,
1328,14303.0,ערד בקרן פנסיה מקיפה חדשה,ערד 8822 01.01.2030,71122402.0,2015-01-01,3.85269771710978,צמוד למדד המחירים לצרכן,2030-01-01,0.048,0.0485,4069.75,120.040402,4.885,4.885,עלות מופחתת,0.000323,8.8e-05,,
1328,14303.0,ערד בקרן פנסיה מקיפה חדשה,ערד 8834 01.01.2031,71122931.0,2016-01-01,4.650636849279767,צמוד למדד המחירים לצרכן,2031-01-01,0.048,0.0485,3304.64,121.127105,4.003,4.003,עלות מופחתת,0.000264,7.2e-05,,
1328,14303.0,ערד בקרן פנסיה מקיפה חדשה,ערד 8841 01.08.2031,71123368.0,2016-08-01,5.118908215490776,צמוד למדד המחירים לצרכן,2031-08-01,0.048,0.0485,16991.23,120.760879,20.519,20.519,עלות מופחתת,0.001357,0.000371,,
1328,14303.0,ערד בקרן פנסיה מקיפה חדשה,ערד 8816 01.07.2029,71121693.0,2014-07-01,3.4392514435255492,צמוד למדד המחירים לצרכן,2029-07-01,0.048,0.0485,4571.69,120.158088,5.493,5.493,עלות מופחתת,0.000363,9.9e-05,,
1328,14303.0,ערד בקרן פנסיה מקיפה חדשה,ערד 8801 01.04.2028,71120935.0,2013-04-01,2.332254121211065,צמוד למדד המחירים לצרכן,2028-04-01,0.048,0.0485,7408.31,123.639692,9.16,9.16,עלות מופחתת,0.000606,0.000166,,
1328,14303.0,ערד בקרן פנסיה מקיפה חדשה,ערד 8900 01.08.2036,71126544.0,2021-08-01,8.502850786893246,צמוד למדד המחירים לצרכן,2036-08-01,0.048,0.0485,269873.74,117.799478,317.91,317.91,עלות מופחתת,0.021036,0.005763,,
1328,14303.0,ערד בקרן פנסיה מקיפה חדשה,ערד 8888 01.08.2035,71125702.0,2020-08-01,7.889123471145539,צמוד למדד המחירים לצרכן,2035-08-01,0.048,0.0485,383432.18,119.807017,459.379,459.379,עלות מופחתת,0.030397,0.008327,,
1328,14303.0,ערד בקרן פנסיה מקיפה חדשה,ערד 8897 01.05.2036,71126395.0,2021-05-01,8.252850786893246,צמוד למדד המחירים לצרכן,2036-05-01,0.048,0.0485,676167.11,120.161553,812.493,812.493,עלות מופחתת,0.053763,0.014729,,
1328,14303.0,ערד בקרן פנסיה מקיפה חדשה,ערד 8874 01.05.2034,71125132.0,2019-05-01,6.995350486494741,צמוד למדד המחירים לצרכן,2034-05-01,0.048,0.0485,124892.71,120.402353,150.374,150.374,עלות מופחתת,0.00995,0.002726,,
1328,14303.0,ערד בקרן פנסיה מקיפה חדשה,ערד 8881 01.12.2034,71125421.0,2019-12-01,7.404415125189185,צמוד למדד המחירים לצרכן,2034-12-01,0.048,0.0485,185814.26,119.328631,221.73,221.73,עלות מופחתת,0.014672,0.004019,,
1328,14303.0,ערד בקרן פנסיה מקיפה חדשה,ערד 8863 01.06.2033,71124499.0,2018-06-01,6.4034145394844675,צמוד למדד המחירים לצרכן,2033-06-01,0.048,0.0485,70919.59,121.120338,85.898,85.898,עלות מופחתת,0.005683,0.001557,,
1328,14303.0,ערד בקרן פנסיה מקיפה חדשה,ערד 8849 01.04.2032,71123731.0,2017-04-01,5.528463659857552,צמוד למדד המחירים לצרכן,2032-04-01,0.048,0.0485,30200.31,123.17763,37.2,37.2,עלות מופחתת,0.002461,0.000674,,
1328,14303.0,ערד בקרן פנסיה מקיפה חדשה,ערד 8825 01.04.2030,71122501.0,2015-04-01,4.006417817008313,צמוד למדד המחירים לצרכן,2030-04-01,0.048,0.0485,8394.55,123.430488,10.361,10.361,עלות מופחתת,0.000685,0.000187,,
1328,14303.0,ערד בקרן פנסיה מקיפה חדשה,ערד 8855 01.10.2032,71124093.0,2017-10-01,5.886830285241915,צמוד למדד המחירים לצרכן,2032-10-01,0.048,0.0485,42900.66,122.685902,52.633,52.633,עלות מופחתת,0.003482,0.000954,,
1328,14303.0,ערד בקרן פנסיה מקיפה חדשה,ערד 8820 01.11.2029,71121776.0,2014-11-01,3.686031050443114,צמוד למדד המחירים לצרכן,2029-11-01,0.048,0.0485,4882.35,121.110588,5.913,5.913,עלות מופחתת,0.000391,0.000107,,
1328,14303.0,ערד בקרן פנסיה מקיפה חדשה,ערד 8823 01.02.2030,71122410.0,2015-02-01,3.9360310504431135,צמוד למדד המחירים לצרכן,2030-02-01,0.048,0.0485,6838.54,119.556818,8.176,8.176,עלות מופחתת,0.000541,0.000148,,
1328,14303.0,ערד בקרן פנסיה מקיפה חדשה,ערד 8815 01.06.2029,71121685.0,2014-06-01,3.355918110192216,צמוד למדד המחירים לצרכן,2029-06-01,0.048,0.0485,6455.99,120.744908,7.795,7.795,עלות מופחתת,0.000515,0.000141,,
1328,14303.0,ערד בקרן פנסיה מקיפה חדשה,ערד 8802 01.05.2028,71121016.0,2013-05-01,2.415587454544398,צמוד למדד המחירים לצרכן,2028-05-01,0.048,0.0485,3067.24,122.918209,3.77,3.77,עלות מופחתת,0.000249,6.8e-05,,
1328,14303.0,ערד בקרן פנסיה מקיפה חדשה,ערד 8799 01.02.2028,71120612.0,2013-02-01,2.221560037135377,צמוד למדד המחירים לצרכן,2028-02-01,0.048,0.0485,2178.67,121.490087,2.647,2.647,עלות מופחתת,0.000175,4.7e-05,,
1328,14303.0,ערד בקרן פנסיה מקיפה חדשה,ערד 8813 01.04.2029,71121669.0,2014-04-01,3.18925144352555,צמוד למדד המחירים לצרכן,2029-04-01,0.048,0.0485,4261.03,122.177942,5.206,5.206,עלות מופחתת,0.000344,9.4e-05,,
1328,14303.0,ערד בקרן פנסיה מקיפה חדשה,ערד 8777 01.04.2026,71118822.0,2011-04-01,0.49105623382604097,צמוד למדד המחירים לצרכן,2026-04-01,0.048,0.0485,963.17,127.526063,1.228,1.228,עלות מופחתת,8.1e-05,2.2e-05,,
1328,14303.0,ערד בקרן פנסיה מקיפה חדשה,ערד 8793 01.08.2027,71119846.0,2012-08-01,1.766853486630857,צמוד למדד המחירים לצרכן,2027-08-01,0.048,0.0485,2601.93,122.300021,3.182,3.182,עלות מופחתת,0.00021,5.7e-05,,
1328,14303.0,ערד בקרן פנסיה מקיפה חדשה,ערד 8788 01.03.2027,71116727.0,2012-03-01,1.384549207576438,צמוד למדד המחירים לצרכן,2027-03-01,0.048,0.0485,1813.75,122.976548,2.23,2.23,עלות מופחתת,0.000147,4e-05,,
1328,14303.0,ערד בקרן פנסיה מקיפה חדשה,ערד 8898 01.06.2036,71126445.0,2021-06-01,8.336184120226578,צמוד למדד המחירים לצרכן,2036-06-01,0.048,0.0485,410645.29,119.325448,490.004,490.004,עלות מופחתת,0.032424,0.008882,,
1328,14303.0,ערד בקרן פנסיה מקיפה חדשה,ערד 8905 01.01.2037,71126981.0,2022-01-01,8.715549420098617,צמוד למדד המחירים לצרכן,2037-01-01,0.048,0.0485,280041.35,117.235403,328.308,328.308,עלות מופחתת,0.021724,0.005951,,
1328,14303.0,ערד בקרן פנסיה מקיפה חדשה,ערד 8884 01.03.2035,71125512.0,2020-03-01,7.654415125189185,צמוד למדד המחירים לצרכן,2035-03-01,0.048,0.0485,147005.06,118.847034,174.711,174.711,עלות מופחתת,0.01156,0.003167,,
1328,14303.0,ערד בקרן פנסיה מקיפה חדשה,ערד 8890 01.10.2035,71126106.0,2020-10-01,7.8663214173770095,צמוד למדד המחירים לצרכן,2035-10-01,0.048,0.0485,168257.33,121.471191,204.384,204.384,עלות מופחתת,0.013524,0.003705,,
1328,14303.0,ערד בקרן פנסיה מקיפה חדשה,ערד 8882 01.01.2035,71125454.0,2020-01-01,7.48774845852252,צמוד למדד המחירים לצרכן,2035-01-01,0.048,0.0485,252873.01,119.336917,301.771,301.771,עלות מופחתת,0.019968,0.00547,,
1328,14303.0,ערד בקרן פנסיה מקיפה חדשה,ערד 8879 01.10.2034,71125389.0,2019-10-01,7.2377484585225185,צמוד למדד המחירים לצרכן,2034-10-01,0.048,0.0485,160806.96,120.509043,193.787,193.787,עלות מופחתת,0.012823,0.003513,,
1328,14303.0,ערד בקרן פנסיה מקיפה חדשה,ערד 8854 01.09.2032,71123947.0,2017-09-01,5.945130326524218,צמוד למדד המחירים לצרכן,2032-09-01,0.048,0.0485,49656.46,120.636282,59.904,59.904,עלות מופחתת,0.003963,0.001085,,
1328,14303.0,ערד בקרן פנסיה מקיפה חדשה,ערד 8859 01.02.2033,71124325.0,2018-02-01,6.220163618575248,צמוד למדד המחירים לצרכן,2033-02-01,0.048,0.0485,85635.83,120.522995,103.211,103.211,עלות מופחתת,0.006829,0.001871,,
1328,14303.0,ערד בקרן פנסיה מקיפה חדשה,ערד 8872 01.03.2034,71124986.0,2019-03-01,6.99507950299065,צמוד למדד המחירים לצרכן,2034-03-01,0.048,0.0485,98622.42,119.203218,117.561,117.561,עלות מופחתת,0.007779,0.002131,,
1328,14303.0,ערד בקרן פנסיה מקיפה חדשה,ערד 8873 01.04.2034,71125108.0,2019-04-01,6.912017153161408,צמוד למדד המחירים לצרכן,2034-04-01,0.048,0.0485,72004.85,121.471191,87.465,87.465,עלות מופחתת,0.005787,0.001585,,
1328,14303.0,ערד בקרן פנסיה מקיפה חדשה,ערד 8837 01.04.2031,71123129.0,2016-04-01,4.785574882157442,צמוד למדד המחירים לצרכן,2031-04-01,0.048,0.0485,10467.41,123.681618,12.946,12.946,עלות מופחתת,0.000856,0.000234,,
1328,14303.0,ערד בקרן פנסיה מקיפה חדשה,ערד 8853 01.08.2032,71123939.0,2017-08-01,5.861796993190884,צמוד למדד המחירים לצרכן,2032-08-01,0.048,0.0485,48705.49,121.005087,58.936,58.936,עלות מופחתת,0.003899,0.001068,,
1328,14303.0,ערד בקרן פנסיה מקיפה חדשה,ערד 8790 01.05.2027,71117162.0,2012-05-01,1.516853486630857,צמוד למדד המחירים לצרכן,2027-05-01,0.048,0.0485,1638.75,124.958178,2.048,2.048,עלות מופחתת,0.000135,3.7e-05,,
1328,14303.0,ערד בקרן פנסיה מקיפה חדשה,ערד 8792 01.07.2027,71119747.0,2012-07-01,1.6835201532975237,צמוד למדד המחירים לצרכן,2027-07-01,0.048,0.0485,1519.37,122.444858,1.86,1.86,עלות מופחתת,0.000123,3.3e-05,,
1328,14303.0,ערד בקרן פנסיה מקיפה חדשה,ערד 8830 01.09.2030,71122717.0,2015-09-01,4.423084483674979,צמוד למדד המחירים לצרכן,2030-09-01,0.048,0.0485,3810.64,119.070903,4.537,4.537,עלות מופחתת,0.0003,8.2e-05,,
1328,14303.0,ערד בקרן פנסיה מקיפה חדשה,ערד 8904 01.12.2036,71126841.0,2021-12-01,8.632216086765283,צמוד למדד המחירים לצרכן,2036-12-01,0.048,0.0485,230371.32,117.577516,270.865,270.865,עלות מופחתת,0.017923,0.00491,,
1328,14303.0,ערד בקרן פנסיה מקיפה חדשה,ערד 8772 01.11.2025,71116735.0,2010-11-01,0.08611111111111114,צמוד למדד המחירים לצרכן,2025-11-01,0.048,0.048,543.99,128.622996,0.7,0.7,עלות מופחתת,4.6e-05,1.2e-05,,
1328,14303.0,ערד בקרן פנסיה מקיפה חדשה,ערד 8892 01.12.2035,71126163.0,2020-12-01,8.032988084043678,צמוד למדד המחירים לצרכן,2035-12-01,0.048,0.0485,650874.92,120.279457,782.869,782.869,עלות מופחתת,0.051803,0.014192,,
1328,14303.0,ערד בקרן פנסיה מקיפה חדשה,ערד 8885 01.05.2035,71125603.0,2020-05-01,7.63912347114554,צמוד למדד המחירים לצרכן,2035-05-01,0.048,0.0485,176532.5,120.402353,212.549,212.549,עלות מופחתת,0.014064,0.003853,,
1328,14303.0,ערד בקרן פנסיה מקיפה חדשה,ערד 8886 01.06.2035,71125660.0,2020-06-01,7.722456804478874,צמוד למדד המחירים לצרכן,2035-06-01,0.048,0.0485,322250.16,120.279457,387.601,387.601,עלות מופחתת,0.025647,0.007026,,
1328,14303.0,ערד בקרן פנסיה מקיפה חדשה,ערד 8870 01.01.2034,71124796.0,2019-01-01,6.8284128363239835,צמוד למדד המחירים לצרכן,2034-01-01,0.048,0.0485,33350.3,119.699042,39.92,39.92,עלות מופחתת,0.002641,0.000723,,
1328,14303.0,ערד בקרן פנסיה מקיפה חדשה,ערד 8851 01.06.2032,71123772.0,2017-06-01,5.695130326524218,צמוד למדד המחירים לצרכן,2032-06-01,0.048,0.0485,47110.15,121.603371,57.288,57.288,עלות מופחתת,0.00379,0.001038,,
1328,14303.0,ערד בקרן פנסיה מקיפה חדשה,ערד 8871 01.02.2034,71124945.0,2019-02-01,6.9117461696573175,צמוד למדד המחירים לצרכן,2034-02-01,0.048,0.0485,137215.93,119.570244,164.069,164.069,עלות מופחתת,0.010856,0.002974,,
1328,14303.0,ערד בקרן פנסיה מקיפה חדשה,ערד 8846 01.01.2032,71123616.0,2017-01-01,5.411447050734412,צמוד למדד המחירים לצרכן,2032-01-01,0.048,0.0485,18960.99,121.494528,23.037,23.037,עלות מופחתת,0.001524,0.000417,,
1328,14303.0,ערד בקרן פנסיה מקיפה חדשה,ערד 8831 01.10.2030,71122725.0,2015-10-01,4.400636849279766,צמוד למדד המחירים לצרכן,2030-10-01,0.048,0.0485,1352.51,121.700731,1.646,1.646,עלות מופחתת,0.000108,2.9e-05,,
1328,14303.0,ערד בקרן פנסיה מקיפה חדשה,ערד 8791 01.06.2027,71119598.0,2012-06-01,1.6001868199641902,צמוד למדד המחירים לצרכן,2027-06-01,0.048,0.0485,386.62,122.922215,0.475,0.475,עלות מופחתת,3.1e-05,8e-06,,
1328,14303.0,ערד בקרן פנסיה מקיפה חדשה,ערד 8805 01.08.2028,71121206.0,2013-08-01,2.665587454544398,צמוד למדד המחירים לצרכן,2028-08-01,0.048,0.0485,4258.32,119.909147,5.106,5.106,עלות מופחתת,0.000337,9.2e-05,,
1328,14303.0,ערד בקרן פנסיה מקיפה חדשה,ערד 8812 01.03.2029,71121651.0,2014-03-01,3.182515412552067,צמוד למדד המחירים לצרכן,2029-03-01,0.048,0.0485,5416.84,119.541567,6.475,6.475,עלות מופחתת,0.000428,0.000117,,
1328,14303.0,ערד בקרן פנסיה מקיפה חדשה,ערד 8810 01.01.2029,71121438.0,2014-01-01,3.0158487458854,צמוד למדד המחירים לצרכן,2029-01-01,0.048,0.0485,4148.43,119.922945,4.975,4.975,עלות מופחתת,0.000329,9e-05,,
1328,14303.0,ערד בקרן פנסיה מקיפה חדשה,ערד 8780 01.07.2026,71118855.0,2011-07-01,0.7410567926138304,צמוד למדד המחירים לצרכן,2026-07-01,0.048,0.0484,754.26,124.454088,0.939,0.939,עלות מופחתת,6.2e-05,1.7e-05,,
1328,14303.0,ערד בקרן פנסיה מקיפה חדשה,ערד 8778 01.05.2026,71118830.0,2011-05-01,0.5743895671593743,צמוד למדד המחירים לצרכן,2026-05-01,0.048,0.0485,370.34,126.786834,0.47,0.47,עלות מופחתת,3.1e-05,8e-06,,
1328,14303.0,ערד בקרן פנסיה מקיפה חדשה,ערד 8779 01.06.2026,71118848.0,2011-06-01,0.6577234592804972,צמוד למדד המחירים לצרכן,2026-06-01,0.048,0.0484,638.95,125.545192,0.802,0.802,עלות מופחתת,5.3e-05,1.4e-05,,
1328,14303.0,ערד בקרן פנסיה מקיפה חדשה,ערד 8774 01.01.2026,71116750.0,2011-01-01,0.25277777777777777,צמוד למדד המחירים לצרכן,2026-01-01,0.048,0.0482,790.88,127.137022,1.006,1.006,עלות מופחתת,6.6e-05,1.8e-05,,
1328,14303.0,ערד בקרן פנסיה מקיפה חדשה,ערד 8894 01.02.2036,71126288.0,2021-02-01,8.199654750710344,צמוד למדד המחירים לצרכן,2036-02-01,0.048,0.0485,627176.73,119.687329,750.651,750.651,עלות מופחתת,0.049671,0.013608,,
1328,14303.0,ערד בקרן פנסיה מקיפה חדשה,ערד 8896 01.04.2036,71126353.0,2021-04-01,8.169517453559912,צמוד למדד המחירים לצרכן,2036-04-01,0.048,0.0485,543795.54,121.350083,659.896,659.896,עלות מופחתת,0.043665,0.011962,,
1328,14303.0,ערד בקרן פנסיה מקיפה חדשה,ערד 8889 01.09.2035,71126098.0,2020-09-01,7.972456804478872,צמוד למדד המחירים לצרכן,2035-09-01,0.048,0.0485,469361.04,119.084253,558.935,558.935,עלות מופחתת,0.036985,0.010132,,
1328,14303.0,ערד בקרן פנסיה מקיפה חדשה,ערד 8891 01.11.2035,71126130.0,2020-11-01,7.949654750710344,צמוד למדד המחירים לצרכן,2035-11-01,0.048,0.0485,349436.14,121.124046,423.251,423.251,עלות מופחתת,0.028006,0.007672,,
1328,14303.0,ערד בקרן פנסיה מקיפה חדשה,ערד 8878 01.09.2034,71125348.0,2019-09-01,7.3286838198280755,צמוד למדד המחירים לצרכן,2034-09-01,0.048,0.0485,99053.82,118.375418,117.255,117.255,עלות מופחתת,0.007758,0.002125,,
1328,14303.0,ערד בקרן פנסיה מקיפה חדשה,ערד 8838 01.05.2031,71123293.0,2016-05-01,4.868908215490777,צמוד למדד המחירים לצרכן,2031-05-01,0.048,0.0485,11068.38,123.456257,13.665,13.665,עלות מופחתת,0.000904,0.000247,,
1328,14303.0,ערד בקרן פנסיה מקיפה חדשה,ערד 8843 01.10.2031,71123517.0,2016-10-01,5.161447050734411,צמוד למדד המחירים לצרכן,2031-10-01,0.048,0.0485,8806.95,122.559506,10.794,10.794,עלות מופחתת,0.000714,0.000195,,
1328,14303.0,ערד בקרן פנסיה מקיפה חדשה,ערד 8862 01.05.2033,71124473.0,2018-05-01,6.320081206151133,צמוד למדד המחירים לצרכן,2033-05-01,0.048,0.0485,56364.78,122.091348,68.817,68.817,עלות מופחתת,0.004553,0.001247,,
1328,14303.0,ערד בקרן פנסיה מקיפה חדשה,ערד 8833 01.12.2030,71122774.0,2015-12-01,4.567303515946433,צמוד למדד המחירים לצרכן,2030-12-01,0.048,0.0485,6009.67,121.110975,7.278,7.278,עלות מופחתת,0.000481,0.000131,,
1328,14303.0,ערד בקרן פנסיה מקיפה חדשה,ערד 8836 01.03.2031,71123079.0,2016-03-01,4.817303515946432,צמוד למדד המחירים לצרכן,2031-03-01,0.048,0.0485,1463.75,120.882326,1.769,1.769,עלות מופחתת,0.000117,3.2e-05,,
1328,14303.0,ערד בקרן פנסיה מקיפה חדשה,ערד 8829 01.08.2030,71122626.0,2015-08-01,4.339751150341647,צמוד למדד המחירים לצרכן,2030-08-01,0.048,0.0485,9797.26,119.793825,11.737,11.737,עלות מופחתת,0.000776,0.000212,,
1328,14303.0,ערד בקרן פנסיה מקיפה חדשה,ערד 8824 01.03.2030,71122428.0,2015-03-01,4.0193643837764474,צמוד למדד המחירים לצרכן,2030-03-01,0.048,0.0485,10480.98,120.151183,12.593,12.593,עלות מופחתת,0.000833,0.000228,,
1328,14303.0,ערד בקרן פנסיה מקיפה חדשה,ערד 8819 01.10.2029,71121768.0,2014-10-01,3.6026977171097805,צמוד למדד המחירים לצרכן,2029-10-01,0.048,0.0485,4625.95,121.222494,5.608,5.608,עלות מופחתת,0.000371,0.000101,,
1328,14303.0,ערד בקרן פנסיה מקיפה חדשה,ערד 8827 01.06.2030,71122543.0,2015-06-01,4.17308448367498,צמוד למדד המחירים לצרכן,2030-06-01,0.048,0.0485,4223.05,121.354659,5.125,5.125,עלות מופחתת,0.000339,9.2e-05,,
1328,14303.0,ערד בקרן פנסיה מקיפה חדשה,ערד 8797 01.12.2027,71120570.0,2012-12-01,2.0548933704687102,צמוד למדד המחירים לצרכן,2027-12-01,0.048,0.0485,2231.58,122.110465,2.725,2.725,עלות מופחתת,0.00018,4.9e-05,,
1328,14303.0,ערד בקרן פנסיה מקיפה חדשה,ערד 8811 01.02.2029,71121578.0,2014-02-01,3.099182079218734,צמוד למדד המחירים לצרכן,2029-02-01,0.048,0.0485,3121.5,119.323081,3.725,3.725,עלות מופחתת,0.000246,6.7e-05,,
1328,14303.0,ערד בקרן פנסיה מקיפה חדשה,ערד 8809 01.12.2028,71121305.0,2013-12-01,2.932515412552067,צמוד למדד המחירים לצרכן,2028-12-01,0.048,0.0485,4266.46,119.921112,5.116,5.116,עלות מופחתת,0.000338,9.2e-05,,
1328,14303.0,ערד בקרן פנסיה מקיפה חדשה,ערד 8796 01.11.2027,71120448.0,2012-11-01,1.971560037135377,צמוד למדד המחירים לצרכן,2027-11-01,0.048,0.0485,2336.04,122.369591,2.859,2.859,עלות מופחתת,0.000189,5.1e-05,,
1328,14303.0,ערד בקרן פנסיה מקיפה חדשה,ערד 8795 01.10.2027,71120356.0,2012-10-01,1.8882267038020435,צמוד למדד המחירים לצרכן,2027-10-01,0.048,0.0485,2279.06,122.842903,2.8,2.8,עלות מופחתת,0.000185,5e-05,,
1328,14303.0,ערד בקרן פנסיה מקיפה חדשה,ערד 8807 01.10.2028,71120950.0,2013-10-01,2.7658487458854006,צמוד למדד המחירים לצרכן,2028-10-01,0.048,0.0485,4421.11,121.459952,5.37,5.37,עלות מופחתת,0.000355,9.7e-05,,
1328,14303.0,ערד בקרן פנסיה מקיפה חדשה,ערד 8785 01.12.2026,71119127.0,2011-12-01,1.134549207576438,צמוד למדד המחירים לצרכן,2026-12-01,0.048,0.0485,1273.83,124.458743,1.585,1.585,עלות מופחתת,0.000104,2.8e-05,,
1328,14303.0,ערד בקרן פנסיה מקיפה חדשה,ערד 8804 01.07.2028,71121107.0,2013-07-01,2.582254121211065,צמוד למדד המחירים לצרכן,2028-07-01,0.048,0.0485,1596.7,121.347772,1.938,1.938,עלות מופחתת,0.000128,3.5e-05,,
1328,14303.0,ערד בקרן פנסיה מקיפה חדשה,ערד 8868 01.11.2033,71124689.0,2018-11-01,6.661746169657317,צמוד למדד המחירים לצרכן,2033-11-01,0.048,0.0485,3483.71,120.647903,4.203,4.203,עלות מופחתת,0.000278,7.6e-05,,
1328,14303.0,ערד בקרן פנסיה מקיפה חדשה,ערד 8784 01.11.2026,71118905.0,2011-11-01,1.0512158742431044,צמוד למדד המחירים לצרכן,2026-11-01,0.048,0.0485,1235.84,124.958178,1.544,1.544,עלות מופחתת,0.000102,2.7e-05,,
1328,14303.0,ערד בקרן פנסיה מקיפה חדשה,ערד 8794 01.09.2027,71120232.0,2012-09-01,1.85018681996419,צמוד למדד המחירים לצרכן,2027-09-01,0.048,0.0485,1968.4,121.689448,2.395,2.395,עלות מופחתת,0.000158,4.3e-05,,
1328,14303.0,ערד בקרן פנסיה מקיפה חדשה,ערד 8787 01.02.2027,71116420.0,2012-02-01,1.3012158742431048,צמוד למדד המחירים לצרכן,2027-02-01,0.048,0.0485,1584.49,123.475983,1.956,1.956,עלות מופחתת,0.000129,3.5e-05,,
1328,14303.0,ערד בקרן פנסיה מקיפה חדשה,ערד 8847 01.02.2032,71123665.0,2017-02-01,5.494780384067743,צמוד למדד המחירים לצרכן,2032-02-01,0.048,0.0485,17467.39,121.005087,21.136,21.136,עלות מופחתת,0.001398,0.000383,,
1328,14303.0,ערד בקרן פנסיה מקיפה חדשה,ערד 8857 01.12.2032,71124127.0,2017-12-01,6.053496951908582,צמוד למדד המחירים לצרכן,2032-12-01,0.048,0.0485,37936.92,121.240736,45.995,45.995,עלות מופחתת,0.003043,0.000833,,
1328,14303.0,ערד בקרן פנסיה מקיפה חדשה,ערד 8875 01.06.2034,71125231.0,2019-06-01,7.078683819828075,צמוד למדד המחירים לצרכן,2034-06-01,0.048,0.0485,47119.65,119.564926,56.339,56.339,עלות מופחתת,0.003727,0.001021,,
1328,14303.0,ערד בקרן פנסיה מקיפה חדשה,ערד 8840 01.07.2031,71123350.0,2016-07-01,5.035574882157443,צמוד למדד המחירים לצרכן,2031-07-01,0.048,0.0485,3947.66,121.617498,4.801,4.801,עלות מופחתת,0.000317,8.7e-05,,
1328,14303.0,ערד בקרן פנסיה מקיפה חדשה,ערד 8845 01.12.2031,71123533.0,2016-12-01,5.328113717401077,צמוד למדד המחירים לצרכן,2031-12-01,0.048,0.0485,14430.0,121.476869,17.529,17.529,עלות מופחתת,0.001159,0.000317,,
1328,14303.0,ערד בקרן פנסיה מקיפה חדשה,ערד 8828 01.07.2030,71122550.0,2015-07-01,4.256417817008314,צמוד למדד המחירים לצרכן,2030-07-01,0.048,0.0485,2945.14,120.640651,3.553,3.553,עלות מופחתת,0.000235,6.4e-05,,
1328,14303.0,ערד בקרן פנסיה מקיפה חדשה,ערד 8821 01.12.2029,71121784.0,2014-12-01,3.769364383776447,צמוד למדד המחירים לצרכן,2029-12-01,0.048,0.0485,5949.98,120.272787,7.156,7.156,עלות מופחתת,0.000473,0.000129,,
1328,14303.0,ערד בקרן פנסיה מקיפה חדשה,ערד 8835 01.02.2031,71123061.0,2016-02-01,4.733970182613099,צמוד למדד המחירים לצרכן,2031-02-01,0.048,0.0485,729.84,120.760879,0.881,0.881,עלות מופחתת,5.8e-05,1.5e-05,,
1328,14303.0,ערד בקרן פנסיה מקיפה חדשה,ערד 8782 01.09.2026,71116511.0,2011-09-01,0.9077229004927079,צמוד למדד המחירים לצרכן,2026-09-01,0.048,0.0485,375.77,122.976548,0.462,0.462,עלות מופחתת,3e-05,8e-06,,
1328,14303.0,ערד בקרן פנסיה מקיפה חדשה,ערד 8786 01.01.2027,71116487.0,2012-01-01,1.217882540909771,צמוד למדד המחירים לצרכן,2027-01-01,0.048,0.0485,1486.81,123.856326,1.842,1.842,עלות מופחתת,0.000121,3.3e-05,,
1328,14303.0,ערד בקרן פנסיה מקיפה חדשה,ערד 8783 01.10.2026,71116503.0,2011-10-01,0.9678825409097713,צמוד למדד המחירים לצרכן,2026-10-01,0.048,0.0485,446.31,125.8044,0.561,0.561,עלות מופחתת,3.7e-05,1e-05,,
1328,14850.0,ערד בקרן פנסיה מקיפה חדשה,ערד 8786 01.01.2027,71116487.0,2012-01-01,1.217882540909771,צמוד למדד המחירים לצרכן,2027-01-01,0.048,0.0485,59914.6,123.856326,74.208,74.208,עלות מופחתת,0.000121,3.3e-05,,
1328,14850.0,ערד בקרן פנסיה מקיפה חדשה,ערד 8783 01.10.2026,71116503.0,2011-10-01,0.9678825409097713,צמוד למדד המחירים לצרכן,2026-10-01,0.048,0.0485,17985.31,125.8044,22.626,22.626,עלות מופחתת,3.7e-05,1e-05,,
1328,14850.0,ערד בקרן פנסיה מקיפה חדשה,ערד 8782 01.09.2026,71116511.0,2011-09-01,0.9077229004927079,צמוד למדד המחירים לצרכן,2026-09-01,0.048,0.0485,15142.65,122.976548,18.622,18.622,עלות מופחתת,3e-05,8e-06,,
1328,14850.0,ערד בקרן פנסיה מקיפה חדשה,ערד 8835 01.02.2031,71123061.0,2016-02-01,4.733970182613099,צמוד למדד המחירים לצרכן,2031-02-01,0.048,0.0485,29410.63,120.760879,35.517,35.517,עלות מופחתת,5.8e-05,1.6e-05,,
1328,14850.0,ערד בקרן פנסיה מקיפה חדשה,ערד 8840 01.07.2031,71123350.0,2016-07-01,5.035574882157443,צמוד למדד המחירים לצרכן,2031-07-01,0.048,0.0485,159079.82,121.617498,193.469,193.469,עלות מופחתת,0.000316,8.7e-05,,
1328,14850.0,ערד בקרן פנסיה מקיפה חדשה,ערד 8821 01.12.2029,71121784.0,2014-12-01,3.769364383776447,צמוד למדד המחירים לצרכן,2029-12-01,0.048,0.0485,239767.74,120.272787,288.375,288.375,עלות מופחתת,0.000472,0.00013,,
1328,14850.0,ערד בקרן פנסיה מקיפה חדשה,ערד 8828 01.07.2030,71122550.0,2015-07-01,4.256417817008314,צמוד למדד המחירים לצרכן,2030-07-01,0.048,0.0485,118681.2,120.640651,143.178,143.178,עלות מופחתת,0.000234,6.4e-05,,
1328,14850.0,ערד בקרן פנסיה מקיפה חדשה,ערד 8845 01.12.2031,71123533.0,2016-12-01,5.328113717401077,צמוד למדד המחירים לצרכן,2031-12-01,0.048,0.0485,581488.7,121.476869,706.374,706.374,עלות מופחתת,0.001157,0.000319,,
1328,14850.0,ערד בקרן פנסיה מקיפה חדשה,ערד 8847 01.02.2032,71123665.0,2017-02-01,5.494780384067743,צמוד למדד המחירים לצרכן,2032-02-01,0.048,0.0485,703887.24,121.005087,851.739,851.739,עלות מופחתת,0.001395,0.000385,,
1328,14850.0,ערד בקרן פנסיה מקיפה חדשה,ערד 8875 01.06.2034,71125231.0,2019-06-01,7.078683819828075,צמוד למדד המחירים לצרכן,2034-06-01,0.048,0.0485,1898789.95,119.564926,2270.287,2270.287,עלות מופחתת,0.003718,0.001028,,
1328,14850.0,ערד בקרן פנסיה מקיפה חדשה,ערד 8857 01.12.2032,71124127.0,2017-12-01,6.053496951908582,צמוד למדד המחירים לצרכן,2032-12-01,0.048,0.0485,1528751.68,121.240736,1853.47,1853.47,עלות מופחתת,0.003036,0.000839,,
1328,14850.0,ערד בקרן פנסיה מקיפה חדשה,ערד 8868 01.11.2033,71124689.0,2018-11-01,6.661746169657317,צמוד למדד המחירים לצרכן,2033-11-01,0.048,0.0485,140383.84,120.647903,169.37,169.37,עלות מופחתת,0.000277,7.6e-05,,
1328,14850.0,ערד בקרן פנסיה מקיפה חדשה,ערד 8787 01.02.2027,71116420.0,2012-02-01,1.3012158742431048,צמוד למדד המחירים לצרכן,2027-02-01,0.048,0.0485,63850.59,123.475983,78.84,78.84,עלות מופחתת,0.000129,3.5e-05,,
1328,14850.0,ערד בקרן פנסיה מקיפה חדשה,ערד 8784 01.11.2026,71118905.0,2011-11-01,1.0512158742431044,צמוד למדד המחירים לצרכן,2026-11-01,0.048,0.0485,49801.27,124.958178,62.231,62.231,עלות מופחתת,0.000101,2.8e-05,,
1328,14850.0,ערד בקרן פנסיה מקיפה חדשה,ערד 8794 01.09.2027,71120232.0,2012-09-01,1.85018681996419,צמוד למדד המחירים לצרכן,2027-09-01,0.048,0.0485,79321.24,121.689448,96.526,96.526,עלות מופחתת,0.000158,4.3e-05,,
1328,14850.0,ערד בקרן פנסיה מקיפה חדשה,ערד 8807 01.10.2028,71120950.0,2013-10-01,2.7658487458854006,צמוד למדד המחירים לצרכן,2028-10-01,0.048,0.0485,178158.47,121.459952,216.391,216.391,עלות מופחתת,0.000354,9.8e-05,,
1328,14850.0,ערד בקרן פנסיה מקיפה חדשה,ערד 8804 01.07.2028,71121107.0,2013-07-01,2.582254121211065,צמוד למדד המחירים לצרכן,2028-07-01,0.048,0.0485,64342.59,121.347772,78.078,78.078,עלות מופחתת,0.000127,3.5e-05,,
1328,14850.0,ערד בקרן פנסיה מקיפה חדשה,ערד 8785 01.12.2026,71119127.0,2011-12-01,1.134549207576438,צמוד למדד המחירים לצרכן,2026-12-01,0.048,0.0485,51331.94,124.458743,63.887,63.887,עלות מופחתת,0.000104,2.8e-05,,
1328,14850.0,ערד בקרן פנסיה מקיפה חדשה,ערד 8795 01.10.2027,71120356.0,2012-10-01,1.8882267038020435,צמוד למדד המחירים לצרכן,2027-10-01,0.048,0.0485,91839.9,122.842903,112.819,112.819,עלות מופחתת,0.000184,5.1e-05,,
1328,14850.0,ערד בקרן פנסיה מקיפה חדשה,ערד 8796 01.11.2027,71120448.0,2012-11-01,1.971560037135377,צמוד למדד המחירים לצרכן,2027-11-01,0.048,0.0485,94135.89,122.369591,115.194,115.194,עלות מופחתת,0.000188,5.2e-05,,
1328,14850.0,ערד בקרן פנסיה מקיפה חדשה,ערד 8809 01.12.2028,71121305.0,2013-12-01,2.932515412552067,צמוד למדד המחירים לצרכן,2028-12-01,0.048,0.0485,171926.48,119.921112,206.176,206.176,עלות מופחתת,0.000337,9.3e-05,,
1328,14850.0,ערד בקרן פנסיה מקיפה חדשה,ערד 8811 01.02.2029,71121578.0,2014-02-01,3.099182079218734,צמוד למדד המחירים לצרכן,2029-02-01,0.048,0.0485,125787.86,119.323081,150.094,150.094,עלות מופחתת,0.000245,6.7e-05,,
1328,14850.0,ערד בקרן פנסיה מקיפה חדשה,ערד 8797 01.12.2027,71120570.0,2012-12-01,2.0548933704687102,צמוד למדד המחירים לצרכן,2027-12-01,0.048,0.0485,89926.56,122.110465,109.81,109.81,עלות מופחתת,0.000179,4.9e-05,,
1328,14850.0,ערד בקרן פנסיה מקיפה חדשה,ערד 8819 01.10.2029,71121768.0,2014-10-01,3.6026977171097805,צמוד למדד המחירים לצרכן,2029-10-01,0.048,0.0485,186413.13,121.222494,225.975,225.975,עלות מופחתת,0.00037,0.000102,,
1328,14850.0,ערד בקרן פנסיה מקיפה חדשה,ערד 8827 01.06.2030,71122543.0,2015-06-01,4.17308448367498,צמוד למדד המחירים לצרכן,2030-06-01,0.048,0.0485,170177.15,121.354659,206.518,206.518,עלות מופחתת,0.000338,9.3e-05,,
1328,14850.0,ערד בקרן פנסיה מקיפה חדשה,ערד 8824 01.03.2030,71122428.0,2015-03-01,4.0193643837764474,צמוד למדד המחירים לצרכן,2030-03-01,0.048,0.0485,422354.21,120.151183,507.464,507.464,עלות מופחתת,0.000831,0.000229,,
1328,14850.0,ערד בקרן פנסיה מקיפה חדשה,ערד 8829 01.08.2030,71122626.0,2015-08-01,4.339751150341647,צמוד למדד המחירים לצרכן,2030-08-01,0.048,0.0485,394802.24,119.793825,472.949,472.949,עלות מופחתת,0.000774,0.000214,,
1328,14850.0,ערד בקרן פנסיה מקיפה חדשה,ערד 8833 01.12.2030,71122774.0,2015-12-01,4.567303515946433,צמוד למדד המחירים לצרכן,2030-12-01,0.048,0.0485,242173.07,121.110975,293.298,293.298,עלות מופחתת,0.00048,0.000132,,
1328,14850.0,ערד בקרן פנסיה מקיפה חדשה,ערד 8836 01.03.2031,71123079.0,2016-03-01,4.817303515946432,צמוד למדד המחירים לצרכן,2031-03-01,0.048,0.0485,58985.26,120.882326,71.303,71.303,עלות מופחתת,0.000116,3.2e-05,,
1328,14850.0,ערד בקרן פנסיה מקיפה חדשה,ערד 8838 01.05.2031,71123293.0,2016-05-01,4.868908215490777,צמוד למדד המחירים לצרכן,2031-05-01,0.048,0.0485,446024.85,123.456257,550.646,550.646,עלות מופחתת,0.000901,0.000249,,
1328,14850.0,ערד בקרן פנסיה מקיפה חדשה,ערד 8843 01.10.2031,71123517.0,2016-10-01,5.161447050734411,צמוד למדד המחירים לצרכן,2031-10-01,0.048,0.0485,354895.61,122.559506,434.958,434.958,עלות מופחתת,0.000712,0.000197,,
1328,14850.0,ערד בקרן פנסיה מקיפה חדשה,ערד 8862 01.05.2033,71124473.0,2018-05-01,6.320081206151133,צמוד למדד המחירים לצרכן,2033-05-01,0.048,0.0485,2271342.88,122.091348,2773.113,2773.113,עלות מופחתת,0.004542,0.001256,,
1328,14850.0,ערד בקרן פנסיה מקיפה חדשה,ערד 8878 01.09.2034,71125348.0,2019-09-01,7.3286838198280755,צמוד למדד המחירים לצרכן,2034-09-01,0.048,0.0485,3991591.7,118.375418,4725.063,4725.063,עלות מופחתת,0.007739,0.00214,,
1328,14850.0,ערד בקרן פנסיה מקיפה חדשה,ערד 8889 01.09.2035,71126098.0,2020-09-01,7.972456804478872,צמוד למדד המחירים לצרכן,2035-09-01,0.048,0.0485,18913935.64,119.084253,22523.519,22523.519,עלות מופחתת,0.036894,0.010201,,
1328,14850.0,ערד בקרן פנסיה מקיפה חדשה,ערד 8891 01.11.2035,71126130.0,2020-11-01,7.949654750710344,צמוד למדד המחירים לצרכן,2035-11-01,0.048,0.0485,14081298.17,121.124046,17055.838,17055.838,עלות מופחתת,0.027938,0.007725,,
1328,14850.0,ערד בקרן פנסיה מקיפה חדשה,ערד 8894 01.02.2036,71126288.0,2021-02-01,8.199654750710344,צמוד למדד המחירים לצרכן,2036-02-01,0.048,0.0485,25273466.13,119.687329,30249.137,30249.137,עלות מופחתת,0.049549,0.0137,,
1328,14850.0,ערד בקרן פנסיה מקיפה חדשה,ערד 8896 01.04.2036,71126353.0,2021-04-01,8.169517453559912,צמוד למדד המחירים לצרכן,2036-04-01,0.048,0.0485,21913437.75,121.350083,26591.975,26591.975,עלות מופחתת,0.043559,0.012044,,
1328,14850.0,ערד בקרן פנסיה מקיפה חדשה,ערד 8774 01.01.2026,71116750.0,2011-01-01,0.25277777777777777,צמוד למדד המחירים לצרכן,2026-01-01,0.048,0.0482,31870.63,127.137022,40.519,40.519,עלות מופחתת,6.6e-05,1.8e-05,,
1328,14850.0,ערד בקרן פנסיה מקיפה חדשה,ערד 8778 01.05.2026,71118830.0,2011-05-01,0.5743895671593743,צמוד למדד המחירים לצרכן,2026-05-01,0.048,0.0485,14923.98,126.786834,18.922,18.922,עלות מופחתת,3e-05,8e-06,,
1328,14850.0,ערד בקרן פנסיה מקיפה חדשה,ערד 8779 01.06.2026,71118848.0,2011-06-01,0.6577234592804972,צמוד למדד המחירים לצרכן,2026-06-01,0.048,0.0484,25747.97,125.545192,32.325,32.325,עלות מופחתת,5.2e-05,1.4e-05,,
1328,14850.0,ערד בקרן פנסיה מקיפה חדשה,ערד 8780 01.07.2026,71118855.0,2011-07-01,0.7410567926138304,צמוד למדד המחירים לצרכן,2026-07-01,0.048,0.0484,30394.63,124.454088,37.827,37.827,עלות מופחתת,6.1e-05,1.7e-05,,
1328,14850.0,ערד בקרן פנסיה מקיפה חדשה,ערד 8805 01.08.2028,71121206.0,2013-08-01,2.665587454544398,צמוד למדד המחירים לצרכן,2028-08-01,0.048,0.0485,171598.48,119.909147,205.762,205.762,עלות מופחתת,0.000337,9.3e-05,,
1328,14850.0,ערד בקרן פנסיה מקיפה חדשה,ערד 8791 01.06.2027,71119598.0,2012-06-01,1.6001868199641902,צמוד למדד המחירים לצרכן,2027-06-01,0.048,0.0485,15579.98,122.922215,19.151,19.151,עלות מופחתת,3.1e-05,8e-06,,
1328,14850.0,ערד בקרן פנסיה מקיפה חדשה,ערד 8810 01.01.2029,71121438.0,2014-01-01,3.0158487458854,צמוד למדד המחירים לצרכן,2029-01-01,0.048,0.0485,167170.48,119.922945,200.476,200.476,עלות מופחתת,0.000328,9e-05,,
1328,14850.0,ערד בקרן פנסיה מקיפה חדשה,ערד 8812 01.03.2029,71121651.0,2014-03-01,3.182515412552067,צמוד למדד המחירים לצרכן,2029-03-01,0.048,0.0485,218283.76,119.541567,260.94,260.94,עלות מופחתת,0.000427,0.000118,,
1328,14850.0,ערד בקרן פנסיה מקיפה חדשה,ערד 8831 01.10.2030,71122725.0,2015-10-01,4.400636849279766,צמוד למדד המחירים לצרכן,2030-10-01,0.048,0.0485,54502.6,121.700731,66.33,66.33,עלות מופחתת,0.000108,3e-05,,
1328,14850.0,ערד בקרן פנסיה מקיפה חדשה,ערד 8846 01.01.2032,71123616.0,2017-01-01,5.411447050734412,צמוד למדד המחירים לצרכן,2032-01-01,0.048,0.0485,764075.17,121.494528,928.31,928.31,עלות מופחתת,0.00152,0.00042,,
1328,14850.0,ערד בקרן פנסיה מקיפה חדשה,ערד 8851 01.06.2032,71123772.0,2017-06-01,5.695130326524218,צמוד למדד המחירים לצרכן,2032-06-01,0.048,0.0485,1898407.29,121.603371,2308.527,2308.527,עלות מופחתת,0.003781,0.001045,,
1328,14850.0,ערד בקרן פנסיה מקיפה חדשה,ערד 8871 01.02.2034,71124945.0,2019-02-01,6.9117461696573175,צמוד למדד המחירים לצרכן,2034-02-01,0.048,0.0485,5529418.04,119.570244,6611.539,6611.539,עלות מופחתת,0.01083,0.002994,,
1328,14850.0,ערד בקרן פנסיה מקיפה חדשה,ערד 8870 01.01.2034,71124796.0,2019-01-01,6.8284128363239835,צמוד למדד המחירים לצרכן,2034-01-01,0.048,0.0485,1343923.88,119.699042,1608.664,1608.664,עלות מופחתת,0.002635,0.000728,,
1328,14850.0,ערד בקרן פנסיה מקיפה חדשה,ערד 8885 01.05.2035,71125603.0,2020-05-01,7.63912347114554,צמוד למדד המחירים לצרכן,2035-05-01,0.048,0.0485,7113765.67,120.402353,8565.141,8565.141,עלות מופחתת,0.01403,0.003879,,
1328,14850.0,ערד בקרן פנסיה מקיפה חדשה,ערד 8892 01.12.2035,71126163.0,2020-12-01,8.032988084043678,צמוד למדד המחירים לצרכן,2035-12-01,0.048,0.0485,26228437.1,120.279457,31547.422,31547.422,עלות מופחתת,0.051676,0.014288,,
1328,14850.0,ערד בקרן פנסיה מקיפה חדשה,ערד 8886 01.06.2035,71125660.0,2020-06-01,7.722456804478874,צמוד למדד המחירים לצרכן,2035-06-01,0.048,0.0485,12985779.35,120.279457,15619.225,15619.225,עלות מופחתת,0.025585,0.007074,,
1328,14850.0,ערד בקרן פנסיה מקיפה חדשה,ערד 8904 01.12.2036,71126841.0,2021-12-01,8.632216086765283,צמוד למדד המחירים לצרכן,2036-12-01,0.048,0.0485,9283319.34,117.577516,10915.096,10915.096,עלות מופחתת,0.017879,0.004943,,
1328,14850.0,ערד בקרן פנסיה מקיפה חדשה,ערד 8772 01.11.2025,71116735.0,2010-11-01,0.08611111111111114,צמוד למדד המחירים לצרכן,2025-11-01,0.048,0.048,21921.3,128.622996,28.196,28.196,עלות מופחתת,4.6e-05,1.2e-05,,
1328,14850.0,ערד בקרן פנסיה מקיפה חדשה,ערד 8790 01.05.2027,71117162.0,2012-05-01,1.516853486630857,צמוד למדד המחירים לצרכן,2027-05-01,0.048,0.0485,66037.26,124.958178,82.519,82.519,עלות מופחתת,0.000135,3.7e-05,,
1328,14850.0,ערד בקרן פנסיה מקיפה חדשה,ערד 8853 01.08.2032,71123939.0,2017-08-01,5.861796993190884,צמוד למדד המחירים לצרכן,2032-08-01,0.048,0.0485,1962695.22,121.005087,2374.961,2374.961,עלות מופחתת,0.00389,0.001075,,
1328,14850.0,ערד בקרן פנסיה מקיפה חדשה,ערד 8854 01.09.2032,71123947.0,2017-09-01,5.945130326524218,צמוד למדד המחירים לצרכן,2032-09-01,0.048,0.0485,2001016.51,120.636282,2413.952,2413.952,עלות מופחתת,0.003954,0.001093,,
1328,14850.0,ערד בקרן פנסיה מקיפה חדשה,ערד 8830 01.09.2030,71122717.0,2015-09-01,4.423084483674979,צמוד למדד המחירים לצרכן,2030-09-01,0.048,0.0485,153558.5,119.070903,182.843,182.843,עלות מופחתת,0.000299,8.2e-05,,
1328,14850.0,ערד בקרן פנסיה מקיפה חדשה,ערד 8837 01.04.2031,71123129.0,2016-04-01,4.785574882157442,צמוד למדד המחירים לצרכן,2031-04-01,0.048,0.0485,421807.54,123.681618,521.698,521.698,עלות מופחתת,0.000854,0.000236,,
1328,14850.0,ערד בקרן פנסיה מקיפה חדשה,ערד 8872 01.03.2034,71124986.0,2019-03-01,6.99507950299065,צמוד למדד המחירים לצרכן,2034-03-01,0.048,0.0485,3974207.72,119.203218,4737.384,4737.384,עלות מופחתת,0.00776,0.002145,,
1328,14850.0,ערד בקרן פנסיה מקיפה חדשה,ערד 8859 01.02.2033,71124325.0,2018-02-01,6.220163618575248,צמוד למדד המחירים לצרכן,2033-02-01,0.048,0.0485,3450884.28,120.522995,4159.109,4159.109,עלות מופחתת,0.006812,0.001883,,
1328,14850.0,ערד בקרן פנסיה מקיפה חדשה,ערד 8882 01.01.2035,71125454.0,2020-01-01,7.48774845852252,צמוד למדד המחירים לצרכן,2035-01-01,0.048,0.0485,10190074.36,119.336917,12160.521,12160.521,עלות מופחתת,0.019919,0.005507,,
1328,14850.0,ערד בקרן פנסיה מקיפה חדשה,ערד 8884 01.03.2035,71125512.0,2020-03-01,7.654415125189185,צמוד למדד המחירים לצרכן,2035-03-01,0.048,0.0485,5923892.29,118.847034,7040.37,7040.37,עלות מופחתת,0.011532,0.003188,,
1328,14850.0,ערד בקרן פנסיה מקיפה חדשה,ערד 8873 01.04.2034,71125108.0,2019-04-01,6.912017153161408,צמוד למדד המחירים לצרכן,2034-04-01,0.048,0.0485,2901594.21,121.471191,3524.601,3524.601,עלות מופחתת,0.005773,0.001596,,
1328,14850.0,ערד בקרן פנסיה מקיפה חדשה,ערד 8879 01.10.2034,71125389.0,2019-10-01,7.2377484585225185,צמוד למדד המחירים לצרכן,2034-10-01,0.048,0.0485,6480070.35,120.509043,7809.071,7809.071,עלות מופחתת,0.012791,0.003537,,
1328,14850.0,ערד בקרן פנסיה מקיפה חדשה,ערד 8890 01.10.2035,71126106.0,2020-10-01,7.8663214173770095,צמוד למדד המחירים לצרכן,2035-10-01,0.048,0.0485,6780299.36,121.471191,8236.11,8236.11,עלות מופחתת,0.013491,0.00373,,
1328,14850.0,ערד בקרן פנסיה מקיפה חדשה,ערד 8898 01.06.2036,71126445.0,2021-06-01,8.336184120226578,צמוד למדד המחירים לצרכן,2036-06-01,0.048,0.0485,16547855.52,119.325448,19745.803,19745.803,עלות מופחתת,0.032344,0.008943,,
1328,14850.0,ערד בקרן פנסיה מקיפה חדשה,ערד 8788 01.03.2027,71116727.0,2012-03-01,1.384549207576438,צמוד למדד המחירים לצרכן,2027-03-01,0.048,0.0485,73089.25,122.976548,89.883,89.883,עלות מופחתת,0.000147,4e-05,,
1328,14850.0,ערד בקרן פנסיה מקיפה חדשה,ערד 8905 01.01.2037,71126981.0,2022-01-01,8.715549420098617,צמוד למדד המחירים לצרכן,2037-01-01,0.048,0.0485,11284882.52,117.235403,13229.878,13229.878,עלות מופחתת,0.021671,0.005992,,
1328,14850.0,ערד בקרן פנסיה מקיפה חדשה,ערד 8777 01.04.2026,71118822.0,2011-04-01,0.49105623382604097,צמוד למדד המחירים לצרכן,2026-04-01,0.048,0.0485,38813.29,127.526063,49.497,49.497,עלות מופחתת,8.1e-05,2.2e-05,,
1328,14850.0,ערד בקרן פנסיה מקיפה חדשה,ערד 8813 01.04.2029,71121669.0,2014-04-01,3.18925144352555,צמוד למדד המחירים לצרכן,2029-04-01,0.048,0.0485,171707.81,122.177942,209.789,209.789,עלות מופחתת,0.000343,9.5e-05,,
1328,14850.0,ערד בקרן פנסיה מקיפה חדשה,ערד 8802 01.05.2028,71121016.0,2013-05-01,2.415587454544398,צמוד למדד המחירים לצרכן,2028-05-01,0.048,0.0485,123601.2,122.918209,151.928,151.928,עלות מופחתת,0.000248,6.8e-05,,
1328,14850.0,ערד בקרן פנסיה מקיפה חדשה,ערד 8799 01.02.2028,71120612.0,2013-02-01,2.221560037135377,צמוד למדד המחירים לצרכן,2028-02-01,0.048,0.0485,87794.57,121.490087,106.662,106.662,עלות מופחתת,0.000174,4.8e-05,,
1328,14850.0,ערד בקרן פנסיה מקיפה חדשה,ערד 8793 01.08.2027,71119846.0,2012-08-01,1.766853486630857,צמוד למדד המחירים לצרכן,2027-08-01,0.048,0.0485,104850.55,122.300021,128.232,128.232,עלות מופחתת,0.00021,5.8e-05,,
1328,14850.0,ערד בקרן פנסיה מקיפה חדשה,ערד 8815 01.06.2029,71121685.0,2014-06-01,3.355918110192216,צמוד למדד המחירים לצרכן,2029-06-01,0.048,0.0485,260158.38,120.744908,314.128,314.128,עלות מופחתת,0.000514,0.000142,,
1328,14850.0,ערד בקרן פנסיה מקיפה חדשה,ערד 8823 01.02.2030,71122410.0,2015-02-01,3.9360310504431135,צמוד למדד המחירים לצרכן,2030-02-01,0.048,0.0485,275574.37,119.556818,329.468,329.468,עלות מופחתת,0.000539,0.000149,,
1328,14850.0,ערד בקרן פנסיה מקיפה חדשה,ערד 8820 01.11.2029,71121776.0,2014-11-01,3.686031050443114,צמוד למדד המחירים לצרכן,2029-11-01,0.048,0.0485,196745.12,121.110588,238.279,238.279,עלות מופחתת,0.00039,0.000107,,
1328,14850.0,ערד בקרן פנסיה מקיפה חדשה,ערד 8855 01.10.2032,71124093.0,2017-10-01,5.886830285241915,צמוד למדד המחירים לצרכן,2032-10-01,0.048,0.0485,1728776.8,122.685902,2120.965,2120.965,עלות מופחתת,0.003474,0.00096,,
1328,14850.0,ערד בקרן פנסיה מקיפה חדשה,ערד 8825 01.04.2030,71122501.0,2015-04-01,4.006417817008313,צמוד למדד המחירים לצרכן,2030-04-01,0.048,0.0485,338276.96,123.430488,417.537,417.537,עלות מופחתת,0.000683,0.000189,,
1328,14850.0,ערד בקרן פנסיה מקיפה חדשה,ערד 8849 01.04.2032,71123731.0,2017-04-01,5.528463659857552,צמוד למדד המחירים לצרכן,2032-04-01,0.048,0.0485,1216988.02,123.17763,1499.057,1499.057,עלות מופחתת,0.002455,0.000678,,
1328,14850.0,ערד בקרן פנסיה מקיפה חדשה,ערד 8863 01.06.2033,71124499.0,2018-06-01,6.4034145394844675,צמוד למדד המחירים לצרכן,2033-06-01,0.048,0.0485,2857860.92,121.120338,3461.451,3461.451,עלות מופחתת,0.00567,0.001567,,
1328,14850.0,ערד בקרן פנסיה מקיפה חדשה,ערד 8881 01.12.2034,71125421.0,2019-12-01,7.404415125189185,צמוד למדד המחירים לצרכן,2034-12-01,0.048,0.0485,7487794.6,119.328631,8935.083,8935.083,עלות מופחתת,0.014636,0.004047,,
1328,14850.0,ערד בקרן פנסיה מקיפה חדשה,ערד 8874 01.05.2034,71125132.0,2019-05-01,6.995350486494741,צמוד למדד המחירים לצרכן,2034-05-01,0.048,0.0485,5032826.58,120.402353,6059.642,6059.642,עלות מופחתת,0.009926,0.002744,,
1328,14850.0,ערד בקרן פנסיה מקיפה חדשה,ערד 8897 01.05.2036,71126395.0,2021-05-01,8.252850786893246,צמוד למדד המחירים לצרכן,2036-05-01,0.048,0.0485,27247641.34,120.161553,32741.189,32741.189,עלות מופחתת,0.053632,0.014829,,
1328,14850.0,ערד בקרן פנסיה מקיפה חדשה,ערד 8900 01.08.2036,71126544.0,2021-08-01,8.502850786893246,צמוד למדד המחירים לצרכן,2036-08-01,0.048,0.0485,10875156.29,117.799478,12810.877,12810.877,עלות מופחתת,0.020984,0.005802,,
1328,14850.0,ערד בקרן פנסיה מקיפה חדשה,ערד 8888 01.08.2035,71125702.0,2020-08-01,7.889123471145539,צמוד למדד המחירים לצרכן,2035-08-01,0.048,0.0485,15451243.37,119.807017,18511.674,18511.674,עלות מופחתת,0.030323,0.008384,,
1328,14850.0,ערד בקרן פנסיה מקיפה חדשה,ערד 8792 01.07.2027,71119747.0,2012-07-01,1.6835201532975237,צמוד למדד המחירים לצרכן,2027-07-01,0.048,0.0485,61226.6,122.444858,74.969,74.969,עלות מופחתת,0.000122,3.3e-05,,
1328,14850.0,ערד בקרן פנסיה מקיפה חדשה,ערד 8801 01.04.2028,71120935.0,2013-04-01,2.332254121211065,צמוד למדד המחירים לצרכן,2028-04-01,0.048,0.0485,298534.34,123.639692,369.107,369.107,עלות מופחתת,0.000604,0.000167,,
1328,14850.0,ערד בקרן פנסיה מקיפה חדשה,ערד 8816 01.07.2029,71121693.0,2014-07-01,3.4392514435255492,צמוד למדד המחירים לצרכן,2029-07-01,0.048,0.0485,184226.46,120.158088,221.363,221.363,עלות מופחתת,0.000362,0.0001,,
1328,14850.0,ערד בקרן פנסיה מקיפה חדשה,ערד 8832 01.11.2030,71122741.0,2015-11-01,4.4839701826131,צמוד למדד המחירים לצרכן,2030-11-01,0.048,0.0485,504135.45,121.719184,613.63,613.63,עלות מופחתת,0.001005,0.000277,,
1328,14850.0,ערד בקרן פנסיה מקיפה חדשה,ערד 8822 01.01.2030,71122402.0,2015-01-01,3.85269771710978,צמוד למדד המחירים לצרכן,2030-01-01,0.048,0.0485,163999.82,120.040402,196.866,196.866,עלות מופחתת,0.000322,8.9e-05,,
1328,14850.0,ערד בקרן פנסיה מקיפה חדשה,ערד 8842 01.09.2031,71123434.0,2016-09-01,5.202241548824109,צמוד למדד המחירים לצרכן,2031-09-01,0.048,0.0485,413060.88,119.788918,494.801,494.801,עלות מופחתת,0.00081,0.000224,,
1328,14850.0,ערד בקרן פנסיה מקיפה חדשה,ערד 8850 01.05.2032,71123749.0,2017-05-01,5.611796993190885,צמוד למדד המחירים לצרכן,2032-05-01,0.048,0.0485,1177792.06,122.335286,1440.855,1440.855,עלות מופחתת,0.00236,0.000652,,
1328,14850.0,ערד בקרן פנסיה מקיפה חדשה,ערד 8841 01.08.2031,71123368.0,2016-08-01,5.118908215490776,צמוד למדד המחירים לצרכן,2031-08-01,0.048,0.0485,684699.26,120.760879,826.849,826.849,עלות מופחתת,0.001354,0.000374,,
1328,14850.0,ערד בקרן פנסיה מקיפה חדשה,ערד 8834 01.01.2031,71122931.0,2016-01-01,4.650636849279767,צמוד למדד המחירים לצרכן,2031-01-01,0.048,0.0485,133167.85,121.127105,161.302,161.302,עלות מופחתת,0.000264,7.3e-05,,
1328,14850.0,ערד בקרן פנסיה מקיפה חדשה,ערד 8860 01.03.2033,71124358.0,2018-03-01,6.303496951908582,צמוד למדד המחירים לצרכן,2033-03-01,0.048,0.0485,1864295.32,120.636282,2249.017,2249.017,עלות מופחתת,0.003684,0.001018,,
1328,14850.0,ערד בקרן פנסיה מקיפה חדשה,ערד 8852 01.07.2032,71123921.0,2017-07-01,5.778463659857551,צמוד למדד המחירים לצרכן,2032-07-01,0.048,0.0485,1256949.31,120.649978,1516.509,1516.509,עלות מופחתת,0.002484,0.000686,,
1328,14850.0,ערד בקרן פנסיה מקיפה חדשה,ערד 8864 01.07.2033,71124556.0,2018-07-01,6.4867478728178005,צמוד למדד המחירים לצרכן,2033-07-01,0.048,0.0485,2015503.16,120.053881,2419.69,2419.69,עלות מופחתת,0.003963,0.001095,,
1328,14850.0,ערד בקרן פנסיה מקיפה חדשה,ערד 8876 01.07.2034,71125272.0,2019-07-01,7.1620171531614085,צמוד למדד המחירים לצרכן,2034-07-01,0.048,0.0485,5738463.15,118.280838,6787.502,6787.502,עלות מופחתת,0.011118,0.003074,,
1328,14850.0,ערד בקרן פנסיה מקיפה חדשה,ערד 8893 01.01.2036,71126239.0,2021-01-01,8.116321417377012,צמוד למדד המחירים לצרכן,2036-01-01,0.048,0.0485,25244000.83,120.051509,30305.804,30305.804,עלות מופחתת,0.049642,0.013726,,
1328,14850.0,ערד בקרן פנסיה מקיפה חדשה,ערד 8895 01.03.2036,71126320.0,2021-03-01,8.282988084043675,צמוד למדד המחירים לצרכן,2036-03-01,0.048,0.0485,17497031.83,119.323496,20878.07,20878.07,עלות מופחתת,0.034199,0.009456,,
1328,14850.0,ערד בקרן פנסיה מקיפה חדשה,ערד 8901 01.09.2036,71126593.0,2021-09-01,8.586184120226578,צמוד למדד המחירים לצרכן,2036-09-01,0.048,0.0485,17883634.08,116.86201,20899.174,20899.174,עלות מופחתת,0.034234,0.009465,,
1328,14850.0,ערד בקרן פנסיה מקיפה חדשה,ערד 8789 01.04.2027,71116701.0,2012-04-01,1.4335201532975232,צמוד למדד המחירים לצרכן,2027-04-01,0.048,0.0485,69481.25,125.441503,87.158,87.158,עלות מופחתת,0.000142,3.9e-05,,
1328,14850.0,ערד בקרן פנסיה מקיפה חדשה,ערד 8773 01.12.2025,71116743.0,2010-12-01,0.16944444444444448,צמוד למדד המחירים לצרכן,2025-12-01,0.048,0.0481,15361.31,127.7514,19.624,19.624,עלות מופחתת,3.2e-05,8e-06,,
1328,14850.0,ערד בקרן פנסיה מקיפה חדשה,ערד 8776 01.03.2026,71116776.0,2011-03-01,0.41944444444444445,צמוד למדד המחירים לצרכן,2026-03-01,0.048,0.0484,16673.31,125.387852,20.906,20.906,עלות מופחתת,3.4e-05,9e-06,,
1328,14850.0,ערד בקרן פנסיה מקיפה חדשה,ערד 8800 01.03.2028,71120687.0,2013-09-01,2.748920787877731,צמוד למדד המחירים לצרכן,2028-09-01,0.048,0.0485,66583.92,119.073236,79.284,79.284,עלות מופחתת,0.000129,3.5e-05,,
1328,14850.0,ערד בקרן פנסיה מקיפה חדשה,ערד 8775 01.02.2026,71116768.0,2011-02-01,0.33611111111111114,צמוד למדד המחירים לצרכן,2026-02-01,0.048,0.0483,17930.64,126.155869,22.621,22.621,עלות מופחתת,3.7e-05,1e-05,,
1328,14850.0,ערד בקרן פנסיה מקיפה חדשה,ערד 8781 01.08.2026,71118616.0,2011-08-01,0.824390125947164,צמוד למדד המחירים לצרכן,2026-08-01,0.048,0.0484,52971.94,123.475983,65.408,65.408,עלות מופחתת,0.000107,2.9e-05,,
1328,14850.0,ערד בקרן פנסיה מקיפה חדשה,ערד 8771 01.10.2025,71118814.0,2010-10-01,0.0027777777777777683,צמוד למדד המחירים לצרכן,2025-10-01,0.048,0.0479,18859.97,130.091327,24.535,24.535,עלות מופחתת,4e-05,1.1e-05,,
1328,14850.0,ערד בקרן פנסיה מקיפה חדשה,ערד 8848 01.03.2032,71123673.0,2017-03-01,5.578113717401076,צמוד למדד המחירים לצרכן,2032-03-01,0.048,0.0485,1105686.81,120.75716,1335.196,1335.196,עלות מופחתת,0.002187,0.000604,,
1328,14850.0,ערד בקרן פנסיה מקיפה חדשה,ערד 8814 01.05.2029,71121677.0,2014-05-01,3.2725847768588836,צמוד למדד המחירים לצרכן,2029-05-01,0.048,0.0485,145850.5,121.348526,176.987,176.987,עלות מופחתת,0.000289,8e-05,,
1328,14850.0,ערד בקרן פנסיה מקיפה חדשה,ערד 8798 01.01.2028,71120596.0,2013-01-01,2.1382267038020437,צמוד למדד המחירים לצרכן,2028-01-01,0.048,0.0485,142351.84,122.212735,173.972,173.972,עלות מופחתת,0.000284,7.8e-05,,
1328,14850.0,ערד בקרן פנסיה מקיפה חדשה,ערד 8817 01.08.2029,71121701.0,2014-08-01,3.5225847768588836,צמוד למדד המחירים לצרכן,2029-08-01,0.048,0.0485,114362.54,119.323081,136.461,136.461,עלות מופחתת,0.000223,6.1e-05,,
1328,14850.0,ערד בקרן פנסיה מקיפה חדשה,ערד 8865 01.08.2033,71124580.0,2018-08-01,6.570081206151133,צמוד למדד המחירים לצרכן,2033-08-01,0.048,0.0485,3075543.35,119.452208,3673.804,3673.804,עלות מופחתת,0.006017,0.001663,,
1328,14850.0,ערד בקרן פנסיה מקיפה חדשה,ערד 8803 01.06.2028,71121057.0,2013-06-01,2.498920787877731,צמוד למדד המחירים לצרכן,2028-06-01,0.048,0.0485,128029.19,121.941587,156.121,156.121,עלות מופחתת,0.000255,7e-05,,
1328,14850.0,ערד בקרן פנסיה מקיפה חדשה,ערד 8808 01.11.2028,71121297.0,2013-11-01,2.8491820792187337,צמוד למדד המחירים לצרכן,2028-11-01,0.048,0.0485,237089.07,120.755425,286.298,286.298,עלות מופחתת,0.000468,0.000129,,
1328,14850.0,ערד בקרן פנסיה מקיפה חדשה,ערד 8880 01.11.2034,71125405.0,2019-11-01,7.3210817918558515,צמוד למדד המחירים לצרכן,2034-11-01,0.048,0.0485,7525842.56,120.282907,9052.302,9052.302,עלות מופחתת,0.014828,0.0041,,
1328,14850.0,ערד בקרן פנסיה מקיפה חדשה,ערד 8826 01.05.2030,71122535.0,2015-05-01,4.089751150341647,צמוד למדד המחירים לצרכן,2030-05-01,0.048,0.0485,221891.76,122.581567,271.998,271.998,עלות מופחתת,0.000445,0.000123,,
1328,14850.0,ערד בקרן פנסיה מקיפה חדשה,ערד 8818 01.09.2029,71121750.0,2014-09-01,3.6059181101922166,צמוד למדד המחירים לצרכן,2029-09-01,0.048,0.0485,238401.07,118.724388,283.04,283.04,עלות מופחתת,0.000463,0.000128,,
1328,14850.0,ערד בקרן פנסיה מקיפה חדשה,ערד 8899 01.07.2036,71126460.0,2021-07-01,8.419517453559914,צמוד למדד המחירים לצרכן,2036-07-01,0.048,0.0485,23027543.21,118.392711,27262.933,27262.933,עלות מופחתת,0.044658,0.012348,,
1328,14850.0,ערד בקרן פנסיה מקיפה חדשה,ערד 8844 01.11.2031,71123525.0,2016-11-01,5.244780384067743,צמוד למדד המחירים לצרכן,2031-11-01,0.048,0.0485,457067.5,122.210482,558.584,558.584,עלות מופחתת,0.000914,0.000253,,
1328,14850.0,ערד בקרן פנסיה מקיפה חדשה,ערד 8839 01.06.2031,71123301.0,2016-06-01,4.95224154882411,צמוד למדד המחירים לצרכן,2031-06-01,0.048,0.0485,356972.94,122.463483,437.162,437.162,עלות מופחתת,0.000716,0.000198,,
1328,14850.0,ערד בקרן פנסיה מקיפה חדשה,ערד 8856 01.11.2032,71124119.0,2017-11-01,5.970163618575247,צמוד למדד המחירים לצרכן,2032-11-01,0.048,0.0485,1816188.71,122.091348,2217.409,2217.409,עלות מופחתת,0.003632,0.001004,,
1328,14850.0,ערד בקרן פנסיה מקיפה חדשה,ערד 8858 01.01.2033,71124267.0,2018-01-01,6.136830285241914,צמוד למדד המחירים לצרכן,2033-01-01,0.048,0.0485,2182509.65,121.131135,2643.699,2643.699,עלות מופחתת,0.00433,0.001197,,
1328,14850.0,ערד בקרן פנסיה מקיפה חדשה,ערד 8861 01.04.2033,71124432.0,2018-04-01,6.2367478728178,צמוד למדד המחירים לצרכן,2033-04-01,0.048,0.0485,1757148.77,122.931274,2160.085,2160.085,עלות מופחתת,0.003538,0.000978,,
1328,14850.0,ערד בקרן פנסיה מקיפה חדשה,ערד 8866 01.09.2033,71124630.0,2018-09-01,6.653414539484467,צמוד למדד המחירים לצרכן,2033-09-01,0.048,0.0485,3154591.27,118.969048,3752.987,3752.987,עלות מופחתת,0.006147,0.001699,,
1328,14850.0,ערד בקרן פנסיה מקיפה חדשה,ערד 8877 01.08.2034,71125314.0,2019-08-01,7.2453504864947424,צמוד למדד המחירים לצרכן,2034-08-01,0.048,0.0485,6488379.68,118.503479,7688.956,7688.956,עלות מופחתת,0.012594,0.003482,,
1328,14850.0,ערד בקרן פנסיה מקיפה חדשה,ערד 8883 01.02.2035,71125488.0,2020-02-01,7.5710817918558515,צמוד למדד המחירים לצרכן,2035-02-01,0.048,0.0485,8864737.12,118.856167,10536.287,10536.287,עלות מופחתת,0.017259,0.004772,,
1328,14850.0,ערד בקרן פנסיה מקיפה חדשה,ערד 8867 01.10.2033,71124648.0,2018-10-01,6.5784128363239835,צמוד למדד המחירים לצרכן,2033-10-01,0.048,0.0485,1134386.77,121.233998,1375.262,1375.262,עלות מופחתת,0.002252,0.000622,,
1328,14850.0,ערד בקרן פנסיה מקיפה חדשה,ערד 8869 01.12.2033,71124697.0,2018-12-01,6.7450795029906505,צמוד למדד המחירים לצרכן,2033-12-01,0.048,0.0485,3104516.65,119.811572,3719.57,3719.57,עלות מופחתת,0.006092,0.001684,,
1328,14850.0,ערד בקרן פנסיה מקיפה חדשה,ערד 8887 01.07.2035,71125678.0,2020-07-01,7.805790137812206,צמוד למדד המחירים לצרכן,2035-07-01,0.048,0.0485,9007690.3,120.17144,10824.671,10824.671,עלות מופחתת,0.017731,0.004902,,
1328,14850.0,ערד בקרן פנסיה מקיפה חדשה,ערד 8903 01.11.2036,71126718.0,2021-11-01,8.548882753431949,צמוד למדד המחירים לצרכן,2036-11-01,0.048,0.0485,24256284.56,118.164734,28662.374,28662.374,עלות מופחתת,0.04695,0.012982,,
1328,15314.0,ערד בקרן פנסיה מקיפה חדשה,ערד 8903 01.11.2036,71126718.0,2021-11-01,8.548882753431949,צמוד למדד המחירים לצרכן,2036-11-01,0.048,0.0485,301527.09,118.164734,356.299,356.299,עלות מופחתת,0.047133,0.026466,,
1328,15314.0,ערד בקרן פנסיה מקיפה חדשה,ערד 8887 01.07.2035,71125678.0,2020-07-01,7.805790137812206,צמוד למדד המחירים לצרכן,2035-07-01,0.048,0.0485,111973.56,120.17144,134.56,134.56,עלות מופחתת,0.0178,0.009995,,
1328,15314.0,ערד בקרן פנסיה מקיפה חדשה,ערד 8869 01.12.2033,71124697.0,2018-12-01,6.7450795029906505,צמוד למדד המחירים לצרכן,2033-12-01,0.048,0.0485,38591.89,119.811572,46.238,46.238,עלות מופחתת,0.006116,0.003434,,
1328,15314.0,ערד בקרן פנסיה מקיפה חדשה,ערד 8867 01.10.2033,71124648.0,2018-10-01,6.5784128363239835,צמוד למדד המחירים לצרכן,2033-10-01,0.048,0.0485,14101.43,121.233998,17.096,17.096,עלות מופחתת,0.002261,0.001269,,
1328,15314.0,ערד בקרן פנסיה מקיפה חדשה,ערד 8883 01.02.2035,71125488.0,2020-02-01,7.5710817918558515,צמוד למדד המחירים לצרכן,2035-02-01,0.048,0.0485,110196.53,118.856167,130.975,130.975,עלות מופחתת,0.017326,0.009729,,
1328,15314.0,ערד בקרן פנסיה מקיפה חדשה,ערד 8877 01.08.2034,71125314.0,2019-08-01,7.2453504864947424,צמוד למדד המחירים לצרכן,2034-08-01,0.048,0.0485,80656.3,118.503479,95.581,95.581,עלות מופחתת,0.012643,0.007099,,
1328,15314.0,ערד בקרן פנסיה מקיפה חדשה,ערד 8866 01.09.2033,71124630.0,2018-09-01,6.653414539484467,צמוד למדד המחירים לצרכן,2033-09-01,0.048,0.0485,39214.36,118.969048,46.653,46.653,עלות מופחתת,0.006171,0.003465,,
1328,15314.0,ערד בקרן פנסיה מקיפה חדשה,ערד 8861 01.04.2033,71124432.0,2018-04-01,6.2367478728178,צמוד למדד המחירים לצרכן,2033-04-01,0.048,0.0485,21842.91,122.931274,26.852,26.852,עלות מופחתת,0.003552,0.001994,,
1328,15314.0,ערד בקרן פנסיה מקיפה חדשה,ערד 8858 01.01.2033,71124267.0,2018-01-01,6.136830285241914,צמוד למדד המחירים לצרכן,2033-01-01,0.048,0.0485,27130.52,121.131135,32.864,32.864,עלות מופחתת,0.004347,0.002441,,
1328,15314.0,ערד בקרן פנסיה מקיפה חדשה,ערד 8856 01.11.2032,71124119.0,2017-11-01,5.970163618575247,צמוד למדד המחירים לצרכן,2032-11-01,0.048,0.0485,22576.83,122.091348,27.564,27.564,עלות מופחתת,0.003646,0.002047,,
1328,15314.0,ערד בקרן פנסיה מקיפה חדשה,ערד 8844 01.11.2031,71123525.0,2016-11-01,5.244780384067743,צמוד למדד המחירים לצרכן,2031-11-01,0.048,0.0485,5681.75,122.210482,6.944,6.944,עלות מופחתת,0.000918,0.000515,,
1328,15314.0,ערד בקרן פנסיה מקיפה חדשה,ערד 8839 01.06.2031,71123301.0,2016-06-01,4.95224154882411,צמוד למדד המחירים לצרכן,2031-06-01,0.048,0.0485,4437.48,122.463483,5.434,5.434,עלות מופחתת,0.000718,0.000403,,
1328,15314.0,ערד בקרן פנסיה מקיפה חדשה,ערד 8818 01.09.2029,71121750.0,2014-09-01,3.6059181101922166,צמוד למדד המחירים לצרכן,2029-09-01,0.048,0.0485,2963.53,118.724388,3.518,3.518,עלות מופחתת,0.000465,0.000261,,
1328,15314.0,ערד בקרן פנסיה מקיפה חדשה,ערד 8826 01.05.2030,71122535.0,2015-05-01,4.089751150341647,צמוד למדד המחירים לצרכן,2030-05-01,0.048,0.0485,2758.31,122.581567,3.381,3.381,עלות מופחתת,0.000447,0.000251,,
1328,15314.0,ערד בקרן פנסיה מקיפה חדשה,ערד 8899 01.07.2036,71126460.0,2021-07-01,8.419517453559914,צמוד למדד המחירים לצרכן,2036-07-01,0.048,0.0485,286252.75,118.392711,338.902,338.902,עלות מופחתת,0.044831,0.025174,,
1328,15314.0,ערד בקרן פנסיה מקיפה חדשה,ערד 8880 01.11.2034,71125405.0,2019-11-01,7.3210817918558515,צמוד למדד המחירים לצרכן,2034-11-01,0.048,0.0485,93552.88,120.282907,112.528,112.528,עלות מופחתת,0.014885,0.008358,,
1328,15314.0,ערד בקרן פנסיה מקיפה חדשה,ערד 8865 01.08.2033,71124580.0,2018-08-01,6.570081206151133,צמוד למדד המחירים לצרכן,2033-08-01,0.048,0.0485,38231.72,119.452208,45.669,45.669,עלות מופחתת,0.006041,0.003392,,
1328,15314.0,ערד בקרן פנסיה מקיפה חדשה,ערד 8817 01.08.2029,71121701.0,2014-08-01,3.5225847768588836,צמוד למדד המחירים לצרכן,2029-08-01,0.048,0.0485,1421.62,119.323081,1.696,1.696,עלות מופחתת,0.000224,0.000126,,
1328,15314.0,ערד בקרן פנסיה מקיפה חדשה,ערד 8803 01.06.2028,71121057.0,2013-06-01,2.498920787877731,צמוד למדד המחירים לצרכן,2028-06-01,0.048,0.0485,1591.51,121.941587,1.941,1.941,עלות מופחתת,0.000256,0.000144,,
1328,15314.0,ערד בקרן פנסיה מקיפה חדשה,ערד 8808 01.11.2028,71121297.0,2013-11-01,2.8491820792187337,צמוד למדד המחירים לצרכן,2028-11-01,0.048,0.0485,2947.22,120.755425,3.559,3.559,עלות מופחתת,0.00047,0.000264,,
1328,15314.0,ערד בקרן פנסיה מקיפה חדשה,ערד 8848 01.03.2032,71123673.0,2017-03-01,5.578113717401076,צמוד למדד המחירים לצרכן,2032-03-01,0.048,0.0485,13744.66,120.75716,16.598,16.598,עלות מופחתת,0.002195,0.001232,,
1328,15314.0,ערד בקרן פנסיה מקיפה חדשה,ערד 8771 01.10.2025,71118814.0,2010-10-01,0.0027777777777777683,צמוד למדד המחירים לצרכן,2025-10-01,0.048,0.0479,234.44,130.091327,0.305,0.305,עלות מופחתת,4e-05,2.2e-05,,
1328,15314.0,ערד בקרן פנסיה מקיפה חדשה,ערד 8798 01.01.2028,71120596.0,2013-01-01,2.1382267038020437,צמוד למדד המחירים לצרכן,2028-01-01,0.048,0.0485,1769.55,122.212735,2.163,2.163,עלות מופחתת,0.000286,0.00016,,
1328,15314.0,ערד בקרן פנסיה מקיפה חדשה,ערד 8814 01.05.2029,71121677.0,2014-05-01,3.2725847768588836,צמוד למדד המחירים לצרכן,2029-05-01,0.048,0.0485,1813.05,121.348526,2.2,2.2,עלות מופחתת,0.000291,0.000163,,
1328,15314.0,ערד בקרן פנסיה מקיפה חדשה,ערד 8775 01.02.2026,71116768.0,2011-02-01,0.33611111111111114,צמוד למדד המחירים לצרכן,2026-02-01,0.048,0.0483,222.89,126.155869,0.281,0.281,עלות מופחתת,3.7e-05,2e-05,,
1328,15314.0,ערד בקרן פנסיה מקיפה חדשה,ערד 8776 01.03.2026,71116776.0,2011-03-01,0.41944444444444445,צמוד למדד המחירים לצרכן,2026-03-01,0.048,0.0484,207.26,125.387852,0.26,0.26,עלות מופחתת,3.4e-05,1.9e-05,,
1328,15314.0,ערד בקרן פנסיה מקיפה חדשה,ערד 8781 01.08.2026,71118616.0,2011-08-01,0.824390125947164,צמוד למדד המחירים לצרכן,2026-08-01,0.048,0.0484,658.48,123.475983,0.813,0.813,עלות מופחתת,0.000107,6e-05,,
1328,15314.0,ערד בקרן פנסיה מקיפה חדשה,ערד 8800 01.03.2028,71120687.0,2013-09-01,2.748920787877731,צמוד למדד המחירים לצרכן,2028-09-01,0.048,0.0485,827.69,119.073236,0.986,0.986,עלות מופחתת,0.00013,7.3e-05,,
1328,15314.0,ערד בקרן פנסיה מקיפה חדשה,ערד 8773 01.12.2025,71116743.0,2010-12-01,0.16944444444444448,צמוד למדד המחירים לצרכן,2025-12-01,0.048,0.0481,190.95,127.7514,0.244,0.244,עלות מופחתת,3.2e-05,1.8e-05,,
1328,15314.0,ערד בקרן פנסיה מקיפה חדשה,ערד 8789 01.04.2027,71116701.0,2012-04-01,1.4335201532975232,צמוד למדד המחירים לצרכן,2027-04-01,0.048,0.0485,863.71,125.441503,1.083,1.083,עלות מופחתת,0.000143,8e-05,,
1328,15314.0,ערד בקרן פנסיה מקיפה חדשה,ערד 8901 01.09.2036,71126593.0,2021-09-01,8.586184120226578,צמוד למדד המחירים לצרכן,2036-09-01,0.048,0.0485,222309.4,116.86201,259.795,259.795,עלות מופחתת,0.034367,0.019297,,
1328,15314.0,ערד בקרן פנסיה מקיפה חדשה,ערד 8893 01.01.2036,71126239.0,2021-01-01,8.116321417377012,צמוד למדד המחירים לצרכן,2036-01-01,0.048,0.0485,313805.28,120.051509,376.728,376.728,עלות מופחתת,0.049835,0.027983,,
1328,15314.0,ערד בקרן פנסיה מקיפה חדשה,ערד 8895 01.03.2036,71126320.0,2021-03-01,8.282988084043675,צמוד למדד המחירים לצרכן,2036-03-01,0.048,0.0485,217503.6,119.323496,259.533,259.533,עלות מופחתת,0.034332,0.019278,,
1328,15314.0,ערד בקרן פנסיה מקיפה חדשה,ערד 8876 01.07.2034,71125272.0,2019-07-01,7.1620171531614085,צמוד למדד המחירים לצרכן,2034-07-01,0.048,0.0485,71334.17,118.280838,84.375,84.375,עלות מופחתת,0.011161,0.006267,,
1328,15314.0,ערד בקרן פנסיה מקיפה חדשה,ערד 8864 01.07.2033,71124556.0,2018-07-01,6.4867478728178005,צמוד למדד המחירים לצרכן,2033-07-01,0.048,0.0485,25054.48,120.053881,30.079,30.079,עלות מופחתת,0.003978,0.002234,,
1328,15314.0,ערד בקרן פנסיה מקיפה חדשה,ערד 8860 01.03.2033,71124358.0,2018-03-01,6.303496951908582,צמוד למדד המחירים לצרכן,2033-03-01,0.048,0.0485,23174.84,120.636282,27.957,27.957,עלות מופחתת,0.003698,0.002076,,
1328,15314.0,ערד בקרן פנסיה מקיפה חדשה,ערד 8852 01.07.2032,71123921.0,2017-07-01,5.778463659857551,צמוד למדד המחירים לצרכן,2032-07-01,0.048,0.0485,15624.99,120.649978,18.852,18.852,עלות מופחתת,0.002493,0.0014,,
1328,15314.0,ערד בקרן פנסיה מקיפה חדשה,ערד 8850 01.05.2032,71123749.0,2017-05-01,5.611796993190885,צמוד למדד המחירים לצרכן,2032-05-01,0.048,0.0485,14640.99,122.335286,17.911,17.911,עלות מופחתת,0.002369,0.00133,,
1328,15314.0,ערד בקרן פנסיה מקיפה חדשה,ערד 8842 01.09.2031,71123434.0,2016-09-01,5.202241548824109,צמוד למדד המחירים לצרכן,2031-09-01,0.048,0.0485,5134.71,119.788918,6.151,6.151,עלות מופחתת,0.000813,0.000456,,
1328,15314.0,ערד בקרן פנסיה מקיפה חדשה,ערד 8822 01.01.2030,71122402.0,2015-01-01,3.85269771710978,צמוד למדד המחירים לצרכן,2030-01-01,0.048,0.0485,2038.66,120.040402,2.447,2.447,עלות מופחתת,0.000323,0.000181,,
1328,15314.0,ערד בקרן פנסיה מקיפה חדשה,ערד 8832 01.11.2030,71122741.0,2015-11-01,4.4839701826131,צמוד למדד המחירים לצרכן,2030-11-01,0.048,0.0485,6266.85,121.719184,7.628,7.628,עלות מופחתת,0.001009,0.000566,,
1328,15314.0,ערד בקרן פנסיה מקיפה חדשה,ערד 8841 01.08.2031,71123368.0,2016-08-01,5.118908215490776,צמוד למדד המחירים לצרכן,2031-08-01,0.048,0.0485,8511.41,120.760879,10.278,10.278,עלות מופחתת,0.001359,0.000763,,
1328,15314.0,ערד בקרן פנסיה מקיפה חדשה,ערד 8834 01.01.2031,71122931.0,2016-01-01,4.650636849279767,צמוד למדד המחירים לצרכן,2031-01-01,0.048,0.0485,1655.39,121.127105,2.005,2.005,עלות מופחתת,0.000265,0.000148,,
1328,15314.0,ערד בקרן פנסיה מקיפה חדשה,ערד 8801 01.04.2028,71120935.0,2013-04-01,2.332254121211065,צמוד למדד המחירים לצרכן,2028-04-01,0.048,0.0485,3711.04,123.639692,4.588,4.588,עלות מופחתת,0.000606,0.00034,,
1328,15314.0,ערד בקרן פנסיה מקיפה חדשה,ערד 8816 01.07.2029,71121693.0,2014-07-01,3.4392514435255492,צמוד למדד המחירים לצרכן,2029-07-01,0.048,0.0485,2290.09,120.158088,2.752,2.752,עלות מופחתת,0.000364,0.000204,,
1328,15314.0,ערד בקרן פנסיה מקיפה חדשה,ערד 8900 01.08.2036,71126544.0,2021-08-01,8.502850786893246,צמוד למדד המחירים לצרכן,2036-08-01,0.048,0.0485,135187.82,117.799478,159.251,159.251,עלות מופחתת,0.021066,0.011829,,
1328,15314.0,ערד בקרן פנסיה מקיפה חדשה,ערד 8888 01.08.2035,71125702.0,2020-08-01,7.889123471145539,צמוד למדד המחירים לצרכן,2035-08-01,0.048,0.0485,192072.63,119.807017,230.117,230.117,עלות מופחתת,0.030441,0.017093,,
1328,15314.0,ערד בקרן פנסיה מקיפה חדשה,ערד 8897 01.05.2036,71126395.0,2021-05-01,8.252850786893246,צמוד למדד המחירים לצרכן,2036-05-01,0.048,0.0485,338712.31,120.161553,407.002,407.002,עלות מופחתת,0.05384,0.030232,,
1328,15314.0,ערד בקרן פנסיה מקיפה חדשה,ערד 8881 01.12.2034,71125421.0,2019-12-01,7.404415125189185,צמוד למדד המחירים לצרכן,2034-12-01,0.048,0.0485,93079.91,119.328631,111.071,111.071,עלות מופחתת,0.014693,0.00825,,
1328,15314.0,ערד בקרן פנסיה מקיפה חדשה,ערד 8874 01.05.2034,71125132.0,2019-05-01,6.995350486494741,צמוד למדד המחירים לצרכן,2034-05-01,0.048,0.0485,62562.49,120.402353,75.327,75.327,עלות מופחתת,0.009964,0.005595,,
1328,15314.0,ערד בקרן פנסיה מקיפה חדשה,ערד 8863 01.06.2033,71124499.0,2018-06-01,6.4034145394844675,צמוד למדד המחירים לצרכן,2033-06-01,0.048,0.0485,35525.74,121.120338,43.029,43.029,עלות מופחתת,0.005692,0.003196,,
1328,15314.0,ערד בקרן פנסיה מקיפה חדשה,ערד 8849 01.04.2032,71123731.0,2017-04-01,5.528463659857552,צמוד למדד המחירים לצרכן,2032-04-01,0.048,0.0485,15128.23,123.17763,18.635,18.635,עלות מופחתת,0.002465,0.001384,,
1328,15314.0,ערד בקרן פנסיה מקיפה חדשה,ערד 8825 01.04.2030,71122501.0,2015-04-01,4.006417817008313,צמוד למדד המחירים לצרכן,2030-04-01,0.048,0.0485,4205.08,123.430488,5.19,5.19,עלות מופחתת,0.000686,0.000385,,
1328,15314.0,ערד בקרן פנסיה מקיפה חדשה,ערד 8855 01.10.2032,71124093.0,2017-10-01,5.886830285241915,צמוד למדד המחירים לצרכן,2032-10-01,0.048,0.0485,21490.22,122.685902,26.365,26.365,עלות מופחתת,0.003487,0.001958,,
1328,15314.0,ערד בקרן פנסיה מקיפה חדשה,ערד 8820 01.11.2029,71121776.0,2014-11-01,3.686031050443114,צמוד למדד המחירים לצרכן,2029-11-01,0.048,0.0485,2445.71,121.110588,2.962,2.962,עלות מופחתת,0.000391,0.00022,,
1328,15314.0,ערד בקרן פנסיה מקיפה חדשה,ערד 8823 01.02.2030,71122410.0,2015-02-01,3.9360310504431135,צמוד למדד המחירים לצרכן,2030-02-01,0.048,0.0485,3425.63,119.556818,4.096,4.096,עלות מופחתת,0.000541,0.000304,,
1328,15314.0,ערד בקרן פנסיה מקיפה חדשה,ערד 8815 01.06.2029,71121685.0,2014-06-01,3.355918110192216,צמוד למדד המחירים לצרכן,2029-06-01,0.048,0.0485,3233.99,120.744908,3.905,3.905,עלות מופחתת,0.000516,0.00029,,
1328,15314.0,ערד בקרן פנסיה מקיפה חדשה,ערד 8799 01.02.2028,71120612.0,2013-02-01,2.221560037135377,צמוד למדד המחירים לצרכן,2028-02-01,0.048,0.0485,1091.36,121.490087,1.326,1.326,עלות מופחתת,0.000175,9.8e-05,,
1328,15314.0,ערד בקרן פנסיה מקיפה חדשה,ערד 8802 01.05.2028,71121016.0,2013-05-01,2.415587454544398,צמוד למדד המחירים לצרכן,2028-05-01,0.048,0.0485,1536.47,122.918209,1.889,1.889,עלות מופחתת,0.000249,0.00014,,
1328,15314.0,ערד בקרן פנסיה מקיפה חדשה,ערד 8813 01.04.2029,71121669.0,2014-04-01,3.18925144352555,צמוד למדד המחירים לצרכן,2029-04-01,0.048,0.0485,2134.48,122.177942,2.608,2.608,עלות מופחתת,0.000344,0.000193,,
1328,15314.0,ערד בקרן פנסיה מקיפה חדשה,ערד 8793 01.08.2027,71119846.0,2012-08-01,1.766853486630857,צמוד למדד המחירים לצרכן,2027-08-01,0.048,0.0485,1303.38,122.300021,1.594,1.594,עלות מופחתת,0.00021,0.000118,,
1328,15314.0,ערד בקרן פנסיה מקיפה חדשה,ערד 8777 01.04.2026,71118822.0,2011-04-01,0.49105623382604097,צמוד למדד המחירים לצרכן,2026-04-01,0.048,0.0485,482.48,127.526063,0.615,0.615,עלות מופחתת,8.1e-05,4.5e-05,,
1328,15314.0,ערד בקרן פנסיה מקיפה חדשה,ערד 8788 01.03.2027,71116727.0,2012-03-01,1.384549207576438,צמוד למדד המחירים לצרכן,2027-03-01,0.048,0.0485,908.56,122.976548,1.117,1.117,עלות מופחתת,0.000147,8.2e-05,,
1328,15314.0,ערד בקרן פנסיה מקיפה חדשה,ערד 8898 01.06.2036,71126445.0,2021-06-01,8.336184120226578,צמוד למדד המחירים לצרכן,2036-06-01,0.048,0.0485,205704.49,119.325448,245.458,245.458,עלות מופחתת,0.03247,0.018232,,
1328,15314.0,ערד בקרן פנסיה מקיפה חדשה,ערד 8905 01.01.2037,71126981.0,2022-01-01,8.715549420098617,צמוד למדד המחירים לצרכן,2037-01-01,0.048,0.0485,140281.08,117.235403,164.459,164.459,עלות מופחתת,0.021755,0.012216,,
1328,15314.0,ערד בקרן פנסיה מקיפה חדשה,ערד 8890 01.10.2035,71126106.0,2020-10-01,7.8663214173770095,צמוד למדד המחירים לצרכן,2035-10-01,0.048,0.0485,84285.12,121.471191,102.382,102.382,עלות מופחתת,0.013543,0.007605,,
1328,15314.0,ערד בקרן פנסיה מקיפה חדשה,ערד 8884 01.03.2035,71125512.0,2020-03-01,7.654415125189185,צמוד למדד המחירים לצרכן,2035-03-01,0.048,0.0485,73639.22,118.847034,87.518,87.518,עלות מופחתת,0.011577,0.0065,,
1328,15314.0,ערד בקרן פנסיה מקיפה חדשה,ערד 8882 01.01.2035,71125454.0,2020-01-01,7.48774845852252,צמוד למדד המחירים לצרכן,2035-01-01,0.048,0.0485,126671.64,119.336917,151.166,151.166,עלות מופחתת,0.019997,0.011228,,
1328,15314.0,ערד בקרן פנסיה מקיפה חדשה,ערד 8879 01.10.2034,71125389.0,2019-10-01,7.2377484585225185,צמוד למדד המחירים לצרכן,2034-10-01,0.048,0.0485,80553.01,120.509043,97.074,97.074,עלות מופחתת,0.012841,0.00721,,
1328,15314.0,ערד בקרן פנסיה מקיפה חדשה,ערד 8859 01.02.2033,71124325.0,2018-02-01,6.220163618575248,צמוד למדד המחירים לצרכן,2033-02-01,0.048,0.0485,42897.54,120.522995,51.701,51.701,עלות מופחתת,0.006839,0.00384,,
1328,15314.0,ערד בקרן פנסיה מקיפה חדשה,ערד 8854 01.09.2032,71123947.0,2017-09-01,5.945130326524218,צמוד למדד המחירים לצרכן,2032-09-01,0.048,0.0485,24874.4,120.636282,30.008,30.008,עלות מופחתת,0.003969,0.002229,,
1328,15314.0,ערד בקרן פנסיה מקיפה חדשה,ערד 8872 01.03.2034,71124986.0,2019-03-01,6.99507950299065,צמוד למדד המחירים לצרכן,2034-03-01,0.048,0.0485,49402.92,119.203218,58.89,58.89,עלות מופחתת,0.00779,0.004374,,
1328,15314.0,ערד בקרן פנסיה מקיפה חדשה,ערד 8873 01.04.2034,71125108.0,2019-04-01,6.912017153161408,צמוד למדד המחירים לצרכן,2034-04-01,0.048,0.0485,36069.38,121.471191,43.814,43.814,עלות מופחתת,0.005795,0.003254,,
1328,15314.0,ערד בקרן פנסיה מקיפה חדשה,ערד 8853 01.08.2032,71123939.0,2017-08-01,5.861796993190884,צמוד למדד המחירים לצרכן,2032-08-01,0.048,0.0485,24398.03,121.005087,29.523,29.523,עלות מופחתת,0.003905,0.002193,,
1328,15314.0,ערד בקרן פנסיה מקיפה חדשה,ערד 8837 01.04.2031,71123129.0,2016-04-01,4.785574882157442,צמוד למדד המחירים לצרכן,2031-04-01,0.048,0.0485,5243.44,123.681618,6.485,6.485,עלות מופחתת,0.000857,0.000481,,
1328,15314.0,ערד בקרן פנסיה מקיפה חדשה,ערד 8830 01.09.2030,71122717.0,2015-09-01,4.423084483674979,צמוד למדד המחירים לצרכן,2030-09-01,0.048,0.0485,1908.86,119.070903,2.273,2.273,עלות מופחתת,0.0003,0.000168,,
1328,15314.0,ערד בקרן פנסיה מקיפה חדשה,ערד 8790 01.05.2027,71117162.0,2012-05-01,1.516853486630857,צמוד למדד המחירים לצרכן,2027-05-01,0.048,0.0485,820.9,124.958178,1.026,1.026,עלות מופחתת,0.000135,7.6e-05,,
1328,15314.0,ערד בקרן פנסיה מקיפה חדשה,ערד 8792 01.07.2027,71119747.0,2012-07-01,1.6835201532975237,צמוד למדד המחירים לצרכן,2027-07-01,0.048,0.0485,761.1,122.444858,0.932,0.932,עלות מופחתת,0.000123,6.9e-05,,
1328,15314.0,ערד בקרן פנסיה מקיפה חדשה,ערד 8772 01.11.2025,71116735.0,2010-11-01,0.08611111111111114,צמוד למדד המחירים לצרכן,2025-11-01,0.048,0.048,272.5,128.622996,0.35,0.35,עלות מופחתת,4.6e-05,2.6e-05,,
1328,15314.0,ערד בקרן פנסיה מקיפה חדשה,ערד 8904 01.12.2036,71126841.0,2021-12-01,8.632216086765283,צמוד למדד המחירים לצרכן,2036-12-01,0.048,0.0485,115399.88,117.577516,135.684,135.684,עלות מופחתת,0.017949,0.010078,,
1328,15314.0,ערד בקרן פנסיה מקיפה חדשה,ערד 8892 01.12.2035,71126163.0,2020-12-01,8.032988084043678,צמוד למדד המחירים לצרכן,2035-12-01,0.048,0.0485,326042.7,120.279457,392.162,392.162,עלות מופחתת,0.051877,0.02913,,
1328,15314.0,ערד בקרן פנסיה מקיפה חדשה,ערד 8885 01.05.2035,71125603.0,2020-05-01,7.63912347114554,צמוד למדד המחירים לצרכן,2035-05-01,0.048,0.0485,88430.4,120.402353,106.472,106.472,עלות מופחתת,0.014084,0.007908,,
1328,15314.0,ערד בקרן פנסיה מקיפה חדשה,ערד 8886 01.06.2035,71125660.0,2020-06-01,7.722456804478874,צמוד למדד המחירים לצרכן,2035-06-01,0.048,0.0485,161424.73,120.279457,194.161,194.161,עלות מופחתת,0.025684,0.014422,,
1328,15314.0,ערד בקרן פנסיה מקיפה חדשה,ערד 8870 01.01.2034,71124796.0,2019-01-01,6.8284128363239835,צמוד למדד המחירים לצרכן,2034-01-01,0.048,0.0485,16706.16,119.699042,19.997,19.997,עלות מופחתת,0.002645,0.001485,,
1328,15314.0,ערד בקרן פנסיה מקיפה חדשה,ערד 8851 01.06.2032,71123772.0,2017-06-01,5.695130326524218,צמוד למדד המחירים לצרכן,2032-06-01,0.048,0.0485,23598.88,121.603371,28.697,28.697,עלות מופחתת,0.003796,0.002131,,
1328,15314.0,ערד בקרן פנסיה מקיפה חדשה,ערד 8871 01.02.2034,71124945.0,2019-02-01,6.9117461696573175,צמוד למדד המחירים לצרכן,2034-02-01,0.048,0.0485,68735.56,119.570244,82.187,82.187,עלות מופחתת,0.010872,0.006104,,
1328,15314.0,ערד בקרן פנסיה מקיפה חדשה,ערד 8846 01.01.2032,71123616.0,2017-01-01,5.411447050734412,צמוד למדד המחירים לצרכן,2032-01-01,0.048,0.0485,9498.13,121.494528,11.54,11.54,עלות מופחתת,0.001526,0.000857,,
1328,15314.0,ערד בקרן פנסיה מקיפה חדשה,ערד 8831 01.10.2030,71122725.0,2015-10-01,4.400636849279766,צמוד למדד המחירים לצרכן,2030-10-01,0.048,0.0485,677.51,121.700731,0.825,0.825,עלות מופחתת,0.000109,6.1e-05,,
1328,15314.0,ערד בקרן פנסיה מקיפה חדשה,ערד 8791 01.06.2027,71119598.0,2012-06-01,1.6001868199641902,צמוד למדד המחירים לצרכן,2027-06-01,0.048,0.0485,193.67,122.922215,0.238,0.238,עלות מופחתת,3.1e-05,1.7e-05,,
1328,15314.0,ערד בקרן פנסיה מקיפה חדשה,ערד 8805 01.08.2028,71121206.0,2013-08-01,2.665587454544398,צמוד למדד המחירים לצרכן,2028-08-01,0.048,0.0485,2133.12,119.909147,2.558,2.558,עלות מופחתת,0.000338,0.000189,,
1328,15314.0,ערד בקרן פנסיה מקיפה חדשה,ערד 8812 01.03.2029,71121651.0,2014-03-01,3.182515412552067,צמוד למדד המחירים לצרכן,2029-03-01,0.048,0.0485,2713.46,119.541567,3.244,3.244,עלות מופחתת,0.000429,0.00024,,
1328,15314.0,ערד בקרן פנסיה מקיפה חדשה,ערד 8810 01.01.2029,71121438.0,2014-01-01,3.0158487458854,צמוד למדד המחירים לצרכן,2029-01-01,0.048,0.0485,2078.07,119.922945,2.492,2.492,עלות מופחתת,0.000329,0.000185,,
1328,15314.0,ערד בקרן פנסיה מקיפה חדשה,ערד 8780 01.07.2026,71118855.0,2011-07-01,0.7410567926138304,צמוד למדד המחירים לצרכן,2026-07-01,0.048,0.0484,377.83,124.454088,0.47,0.47,עלות מופחתת,6.2e-05,3.4e-05,,
1328,15314.0,ערד בקרן פנסיה מקיפה חדשה,ערד 8779 01.06.2026,71118848.0,2011-06-01,0.6577234592804972,צמוד למדד המחירים לצרכן,2026-06-01,0.048,0.0484,320.07,125.545192,0.402,0.402,עלות מופחתת,5.3e-05,2.9e-05,,
1328,15314.0,ערד בקרן פנסיה מקיפה חדשה,ערד 8778 01.05.2026,71118830.0,2011-05-01,0.5743895671593743,צמוד למדד המחירים לצרכן,2026-05-01,0.048,0.0485,185.51,126.786834,0.235,0.235,עלות מופחתת,3.1e-05,1.7e-05,,
1328,15314.0,ערד בקרן פנסיה מקיפה חדשה,ערד 8894 01.02.2036,71126288.0,2021-02-01,8.199654750710344,צמוד למדד המחירים לצרכן,2036-02-01,0.048,0.0485,314171.56,119.687329,376.024,376.024,עלות מופחתת,0.049742,0.027931,,
1328,15314.0,ערד בקרן פנסיה מקיפה חדשה,ערד 8896 01.04.2036,71126353.0,2021-04-01,8.169517453559912,צמוד למדד המחירים לצרכן,2036-04-01,0.048,0.0485,272403.43,121.350083,330.562,330.562,עלות מופחתת,0.043728,0.024554,,
1328,15314.0,ערד בקרן פנסיה מקיפה חדשה,ערד 8774 01.01.2026,71116750.0,2011-01-01,0.25277777777777777,צמוד למדד המחירים לצרכן,2026-01-01,0.048,0.0482,396.18,127.137022,0.504,0.504,עלות מופחתת,6.6e-05,3.7e-05,,
1328,15314.0,ערד בקרן פנסיה מקיפה חדשה,ערד 8889 01.09.2035,71126098.0,2020-09-01,7.972456804478872,צמוד למדד המחירים לצרכן,2035-09-01,0.048,0.0485,235116.97,119.084253,279.987,279.987,עלות מופחתת,0.037038,0.020797,,
1328,15314.0,ערד בקרן פנסיה מקיפה חדשה,ערד 8891 01.11.2035,71126130.0,2020-11-01,7.949654750710344,צמוד למדד המחירים לצרכן,2035-11-01,0.048,0.0485,175043.0,121.124046,212.019,212.019,עלות מופחתת,0.028047,0.015749,,
1328,15314.0,ערד בקרן פנסיה מקיפה חדשה,ערד 8878 01.09.2034,71125348.0,2019-09-01,7.3286838198280755,צמוד למדד המחירים לצרכן,2034-09-01,0.048,0.0485,49619.01,118.375418,58.737,58.737,עלות מופחתת,0.00777,0.004363,,
1328,15314.0,ערד בקרן פנסיה מקיפה חדשה,ערד 8838 01.05.2031,71123293.0,2016-05-01,4.868908215490777,צמוד למדד המחירים לצרכן,2031-05-01,0.048,0.0485,5544.48,123.456257,6.845,6.845,עלות מופחתת,0.000905,0.000508,,
1328,15314.0,ערד בקרן פנסיה מקיפה חדשה,ערד 8862 01.05.2033,71124473.0,2018-05-01,6.320081206151133,צמוד למדד המחירים לצרכן,2033-05-01,0.048,0.0485,28234.8,122.091348,34.472,34.472,עלות מופחתת,0.00456,0.00256,,
1328,15314.0,ערד בקרן פנסיה מקיפה חדשה,ערד 8843 01.10.2031,71123517.0,2016-10-01,5.161447050734411,צמוד למדד המחירים לצרכן,2031-10-01,0.048,0.0485,4411.66,122.559506,5.407,5.407,עלות מופחתת,0.000715,0.000401,,
1328,15314.0,ערד בקרן פנסיה מקיפה חדשה,ערד 8836 01.03.2031,71123079.0,2016-03-01,4.817303515946432,צמוד למדד המחירים לצרכן,2031-03-01,0.048,0.0485,733.23,120.882326,0.886,0.886,עלות מופחתת,0.000117,6.5e-05,,
1328,15314.0,ערד בקרן פנסיה מקיפה חדשה,ערד 8833 01.12.2030,71122774.0,2015-12-01,4.567303515946433,צמוד למדד המחירים לצרכן,2030-12-01,0.048,0.0485,3010.42,121.110975,3.646,3.646,עלות מופחתת,0.000482,0.00027,,
1328,15314.0,ערד בקרן פנסיה מקיפה חדשה,ערד 8829 01.08.2030,71122626.0,2015-08-01,4.339751150341647,צמוד למדד המחירים לצרכן,2030-08-01,0.048,0.0485,4907.74,119.793825,5.879,5.879,עלות מופחתת,0.000777,0.000436,,
1328,15314.0,ערד בקרן פנסיה מקיפה חדשה,ערד 8824 01.03.2030,71122428.0,2015-03-01,4.0193643837764474,צמוד למדד המחירים לצרכן,2030-03-01,0.048,0.0485,5250.23,120.151183,6.308,6.308,עלות מופחתת,0.000834,0.000468,,
1328,15314.0,ערד בקרן פנסיה מקיפה חדשה,ערד 8819 01.10.2029,71121768.0,2014-10-01,3.6026977171097805,צמוד למדד המחירים לצרכן,2029-10-01,0.048,0.0485,2317.28,121.222494,2.809,2.809,עלות מופחתת,0.000371,0.000208,,
1328,15314.0,ערד בקרן פנסיה מקיפה חדשה,ערד 8827 01.06.2030,71122543.0,2015-06-01,4.17308448367498,צמוד למדד המחירים לצרכן,2030-06-01,0.048,0.0485,2115.45,121.354659,2.567,2.567,עלות מופחתת,0.000339,0.00019,,
1328,15314.0,ערד בקרן פנסיה מקיפה חדשה,ערד 8797 01.12.2027,71120570.0,2012-12-01,2.0548933704687102,צמוד למדד המחירים לצרכן,2027-12-01,0.048,0.0485,1117.86,122.110465,1.365,1.365,עלות מופחתת,0.00018,0.000101,,
1328,15314.0,ערד בקרן פנסיה מקיפה חדשה,ערד 8811 01.02.2029,71121578.0,2014-02-01,3.099182079218734,צמוד למדד המחירים לצרכן,2029-02-01,0.048,0.0485,1563.65,119.323081,1.866,1.866,עלות מופחתת,0.000246,0.000138,,
1328,15314.0,ערד בקרן פנסיה מקיפה חדשה,ערד 8809 01.12.2028,71121305.0,2013-12-01,2.932515412552067,צמוד למדד המחירים לצרכן,2028-12-01,0.048,0.0485,2137.19,119.921112,2.563,2.563,עלות מופחתת,0.000339,0.00019,,
1328,15314.0,ערד בקרן פנסיה מקיפה חדשה,ערד 8796 01.11.2027,71120448.0,2012-11-01,1.971560037135377,צמוד למדד המחירים לצרכן,2027-11-01,0.048,0.0485,1170.19,122.369591,1.432,1.432,עלות מופחתת,0.000189,0.000106,,
1328,15314.0,ערד בקרן פנסיה מקיפה חדשה,ערד 8795 01.10.2027,71120356.0,2012-10-01,1.8882267038020435,צמוד למדד המחירים לצרכן,2027-10-01,0.048,0.0485,1141.65,122.842903,1.402,1.402,עלות מופחתת,0.000185,0.000104,,
1328,15314.0,ערד בקרן פנסיה מקיפה חדשה,ערד 8785 01.12.2026,71119127.0,2011-12-01,1.134549207576438,צמוד למדד המחירים לצרכן,2026-12-01,0.048,0.0485,638.1,124.458743,0.794,0.794,עלות מופחתת,0.000105,5.8e-05,,
1328,15314.0,ערד בקרן פנסיה מקיפה חדשה,ערד 8804 01.07.2028,71121107.0,2013-07-01,2.582254121211065,צמוד למדד המחירים לצרכן,2028-07-01,0.048,0.0485,799.83,121.347772,0.971,0.971,עלות מופחתת,0.000128,7.2e-05,,
1328,15314.0,ערד בקרן פנסיה מקיפה חדשה,ערד 8807 01.10.2028,71120950.0,2013-10-01,2.7658487458854006,צמוד למדד המחירים לצרכן,2028-10-01,0.048,0.0485,2214.66,121.459952,2.69,2.69,עלות מופחתת,0.000355,0.000199,,
1328,15314.0,ערד בקרן פנסיה מקיפה חדשה,ערד 8784 01.11.2026,71118905.0,2011-11-01,1.0512158742431044,צמוד למדד המחירים לצרכן,2026-11-01,0.048,0.0485,619.07,124.958178,0.774,0.774,עלות מופחתת,0.000102,5.7e-05,,
1328,15314.0,ערד בקרן פנסיה מקיפה חדשה,ערד 8794 01.09.2027,71120232.0,2012-09-01,1.85018681996419,צמוד למדד המחירים לצרכן,2027-09-01,0.048,0.0485,986.03,121.689448,1.2,1.2,עלות מופחתת,0.000158,8.9e-05,,
1328,15314.0,ערד בקרן פנסיה מקיפה חדשה,ערד 8787 01.02.2027,71116420.0,2012-02-01,1.3012158742431048,צמוד למדד המחירים לצרכן,2027-02-01,0.048,0.0485,793.71,123.475983,0.98,0.98,עלות מופחתת,0.000129,7.2e-05,,
1328,15314.0,ערד בקרן פנסיה מקיפה חדשה,ערד 8857 01.12.2032,71124127.0,2017-12-01,6.053496951908582,צמוד למדד המחירים לצרכן,2032-12-01,0.048,0.0485,19003.73,121.240736,23.04,23.04,עלות מופחתת,0.003047,0.001711,,
1328,15314.0,ערד בקרן פנסיה מקיפה חדשה,ערד 8868 01.11.2033,71124689.0,2018-11-01,6.661746169657317,צמוד למדד המחירים לצרכן,2033-11-01,0.048,0.0485,1745.09,120.647903,2.105,2.105,עלות מופחתת,0.000278,0.000156,,
1328,15314.0,ערד בקרן פנסיה מקיפה חדשה,ערד 8875 01.06.2034,71125231.0,2019-06-01,7.078683819828075,צמוד למדד המחירים לצרכן,2034-06-01,0.048,0.0485,23603.64,119.564926,28.222,28.222,עלות מופחתת,0.003733,0.002096,,
1328,15314.0,ערד בקרן פנסיה מקיפה חדשה,ערד 8847 01.02.2032,71123665.0,2017-02-01,5.494780384067743,צמוד למדד המחירים לצרכן,2032-02-01,0.048,0.0485,8749.94,121.005087,10.588,10.588,עלות מופחתת,0.0014,0.000786,,
1328,15314.0,ערד בקרן פנסיה מקיפה חדשה,ערד 8845 01.12.2031,71123533.0,2016-12-01,5.328113717401077,צמוד למדד המחירים לצרכן,2031-12-01,0.048,0.0485,7228.41,121.476869,8.781,8.781,עלות מופחתת,0.001161,0.000652,,
1328,15314.0,ערד בקרן פנסיה מקיפה חדשה,ערד 8840 01.07.2031,71123350.0,2016-07-01,5.035574882157443,צמוד למדד המחירים לצרכן,2031-07-01,0.048,0.0485,1977.5,121.617498,2.405,2.405,עלות מופחתת,0.000318,0.000178,,
1328,15314.0,ערד בקרן פנסיה מקיפה חדשה,ערד 8821 01.12.2029,71121784.0,2014-12-01,3.769364383776447,צמוד למדד המחירים לצרכן,2029-12-01,0.048,0.0485,2980.52,120.272787,3.585,3.585,עלות מופחתת,0.000474,0.000266,,
1328,15314.0,ערד בקרן פנסיה מקיפה חדשה,ערד 8828 01.07.2030,71122550.0,2015-07-01,4.256417817008314,צמוד למדד המחירים לצרכן,2030-07-01,0.048,0.0485,1475.31,120.640651,1.78,1.78,עלות מופחתת,0.000235,0.000132,,
1328,15314.0,ערד בקרן פנסיה מקיפה חדשה,ערד 8835 01.02.2031,71123061.0,2016-02-01,4.733970182613099,צמוד למדד המחירים לצרכן,2031-02-01,0.048,0.0485,365.6,120.760879,0.442,0.442,עלות מופחתת,5.8e-05,3.2e-05,,
1328,15314.0,ערד בקרן פנסיה מקיפה חדשה,ערד 8782 01.09.2026,71116511.0,2011-09-01,0.9077229004927079,צמוד למדד המחירים לצרכן,2026-09-01,0.048,0.0485,188.23,122.976548,0.231,0.231,עלות מופחתת,3e-05,1.7e-05,,
1328,15314.0,ערד בקרן פנסיה מקיפה חדשה,ערד 8786 01.01.2027,71116487.0,2012-01-01,1.217882540909771,צמוד למדד המחירים לצרכן,2027-01-01,0.048,0.0485,744.79,123.856326,0.922,0.922,עלות מופחתת,0.000122,6.8e-05,,
1328,15314.0,ערד בקרן פנסיה מקיפה חדשה,ערד 8783 01.10.2026,71116503.0,2011-10-01,0.9678825409097713,צמוד למדד המחירים לצרכן,2026-10-01,0.048,0.0485,223.57,125.8044,0.281,0.281,עלות מופחתת,3.7e-05,2e-05,,
1329,9761.0,,,,,,,,,,,,,,,,,,
1329,9762.0,,,,,,,,,,,,,,,,,,
1329,9763.0,,,,,,,,,,,,,,,,,,
1329,8580.0,,,,,,,,,,,,,,,,,,
1329,12139.0,,,,,,,,,,,,,,,,,,
1329,13212.0,,,,,,,,,,,,,,,,,,
1329,13211.0,,,,,,,,,,,,,,,,,,
1329,13820.0,,,,,,,,,,,,,,,,,,
1329,14304.0,,,,,,,,,,,,,,,,,,
1329,14305.0,,,,,,,,,,,,,,,,,,
1329,14854.0,,,,,,,,,,,,,,,,,,
1329,15313.0,,,,,,,,,,,,,,,,,,
סוף מידע,,,,,,,,,,,,,,,,,,,
