מספר קופה/קרן/ח.פ. עבור חברת ביטוח,מספר מסלול,שם מנפיק,מספר מנפיק,סוג מספר מזהה מנפיק,שם נייר ערך,מספר נייר ערך,סוג מספר נייר ערך,מאפיין עיקרי,"ישראל/חו""ל",מדינה לפי חשיפה כלכלית,ענף מסחר,נכס בסיס,תאריך פקיעה,בעל עניין/צד קשור,תאריך רכישה,מטבע פעילות,סוג גורם משערך,תלות/אי-תלות המשערך,תאריך שערוך אחרון,שער מימוש,יחס המרה,ערך נקוב (יחידות),שער נייר הערך,שער חליפין,"שווי הוגן (בש""ח)",שיעור מנכסי אפיק ההשקעה,שיעור מסך נכסי ההשקעה,Unnamed: 28,סוף מידע
1328,2196.0,Goldman Sachs Group Inc,11778.0,פנימי,אופציה לס אירו שקל GS P3.9 03/10/25,750000011.0,פנימי,"מט""ח","חו""ל",אירופה,Financial Services,"מט""ח",2025-10-03,לא,2025-04-03,EUR,גורם תלוי/פנימי,קיימת תלות,2025-09-30,3.9,1.0,4539.05,0.6786,3.8807,0.12,-0.078077,1e-05,,
1328,2196.0,Goldman Sachs Group Inc,11778.0,פנימי,אופציה לס אירו שקל GS P3.7 03/10/25,750000012.0,פנימי,"מט""ח","חו""ל",אירופה,Financial Services,"מט""ח",2025-10-03,לא,2025-04-03,EUR,גורם תלוי/פנימי,קיימת תלות,2025-09-30,3.7,1.0,-4539.05,0.0001,3.8807,0.0,2e-06,0.0,,
1328,2196.0,"בנק דיסקונט לישראל בע""מ",520007030.0,ח.פ.,אופציה לס דולר שקל DISCOUNT P3.65 08/10/25 SELL,750000045.0,פנימי,"מט""ח",ישראל,"ארה""ב",שירותים פיננסיים,"מט""ח",2025-10-08,לא,2025-05-21,USD,גורם תלוי/פנימי,קיימת תלות,2025-09-30,3.65,1.0,-10878.48,10.391,3.306,-3.737,2.440987,-0.000321,,
1328,2196.0,"בנק הפועלים בע""מ",520000118.0,ח.פ.,אופציה לס דולר שקל POALIM P3.5 06/10/25 BUY,750000057.0,פנימי,"מט""ח",ישראל,"ארה""ב",שירותים פיננסיים,"מט""ח",2025-10-06,לא,2025-06-04,USD,גורם תלוי/פנימי,קיימת תלות,2025-09-30,3.5,1.0,5439.27,5.8625,3.306,1.054,-0.688558,9e-05,,
1328,2196.0,Goldman Sachs Group Inc,11778.0,פנימי,אופציה לס אירו שקל GS C4.2 03/10/25,750000010.0,פנימי,"מט""ח","חו""ל",אירופה,Financial Services,"מט""ח",2025-10-03,לא,2025-04-03,EUR,גורם תלוי/פנימי,קיימת תלות,2025-09-30,4.2,1.0,-1815.62,0.0001,3.8807,0.0,4e-06,0.0,,
1328,2196.0,"בנק לאומי לישראל בע""מ",520018078.0,ח.פ.,אופציה לס דולר שקל LEUMI P3.6 13/10/25 S,750000027.0,פנימי,"מט""ח",ישראל,"ארה""ב",שירותים פיננסיים,"מט""ח",2025-10-13,לא,2025-04-09,USD,גורם תלוי/פנימי,קיימת תלות,2025-09-30,3.6,1.0,-5439.06,8.8731,3.306,-1.596,1.042109,-0.000137,,
1328,2196.0,"בנק הפועלים בע""מ",520000118.0,ח.פ.,אופציה לס דולר שקל POALIM P3.6 06/10/25 SELL,750000056.0,פנימי,"מט""ח",ישראל,"ארה""ב",שירותים פיננסיים,"מט""ח",2025-10-06,לא,2025-06-04,USD,גורם תלוי/פנימי,קיימת תלות,2025-09-30,3.6,1.0,-5439.27,8.8822,3.306,-1.597,1.043224,-0.000137,,
1328,2196.0,"בנק דיסקונט לישראל בע""מ",520007030.0,ח.פ.,אופציה לס דולר שקל DISCOUNT C3.58 23/12/25 BUY,750000076.0,פנימי,"מט""ח",ישראל,"ארה""ב",שירותים פיננסיים,"מט""ח",2025-12-23,לא,2025-06-26,USD,גורם תלוי/פנימי,קיימת תלות,2025-09-30,3.58,1.0,2719.71,0.1439,3.306,0.013,-0.008448,1e-06,,
1328,2196.0,"בנק לאומי לישראל בע""מ",520018078.0,ח.פ.,אופציה לס דולר שקל Leumi P3.6 13/10/25 L,750000041.0,פנימי,"מט""ח",ישראל,"ארה""ב",שירותים פיננסיים,"מט""ח",2025-10-13,לא,2025-05-08,USD,גורם תלוי/פנימי,קיימת תלות,2025-09-30,3.6,1.0,5439.06,8.8777,3.306,1.596,-1.042649,0.000137,,
1328,2196.0,"בנק דיסקונט לישראל בע""מ",520007030.0,ח.פ.,אופציה לס דולר שקל DISCOUNT P3.55 08/10/25 BUY,750000046.0,פנימי,"מט""ח",ישראל,"ארה""ב",שירותים פיננסיים,"מט""ח",2025-10-08,לא,2025-05-21,USD,גורם תלוי/פנימי,קיימת תלות,2025-09-30,3.55,1.0,10878.48,7.3726,3.306,2.652,-1.731831,0.000228,,
1328,2196.0,"בנק לאומי לישראל בע""מ",520018078.0,ח.פ.,אופציה לס דולר שקל LEUMI C3.73 01/12/25 BUY,750000053.0,פנימי,"מט""ח",ישראל,"ארה""ב",שירותים פיננסיים,"מט""ח",2025-12-01,לא,2025-05-29,USD,גורם תלוי/פנימי,קיימת תלות,2025-09-30,3.73,1.0,5421.08,0.004,3.306,0.001,-0.00047,0.0,,
1328,2196.0,"בנק הפועלים בע""מ",520000118.0,ח.פ.,אופציה לס דולר שקל POALIM C3.70 05/12/25 BUY,750000059.0,פנימי,"מט""ח",ישראל,"ארה""ב",שירותים פיננסיים,"מט""ח",2025-12-05,לא,2025-06-06,USD,גורם תלוי/פנימי,קיימת תלות,2025-09-30,3.7,1.0,5439.27,0.0091,3.306,0.002,-0.001065,0.0,,
1328,2196.0,"בנק הפועלים בע""מ",520000118.0,ח.פ.,אופציה לס דולר שקל POALIM C3.6 05/12/25 BUY,750000099.0,פנימי,"מט""ח",ישראל,"ארה""ב",שירותים פיננסיים,"מט""ח",2025-12-05,לא,2025-05-14,USD,גורם תלוי/פנימי,קיימת תלות,2025-09-30,3.6,1.0,5439.27,0.0815,3.306,0.015,-0.00957,1e-06,,
1328,2196.0,"בנק דיסקונט לישראל בע""מ",520007030.0,ח.פ.,אופציה לס דולר שקל DISCOUNT P3.29 23/12/25 SELL,750000077.0,פנימי,"מט""ח",ישראל,"ארה""ב",שירותים פיננסיים,"מט""ח",2025-12-23,לא,2025-06-26,USD,גורם תלוי/פנימי,קיימת תלות,2025-09-30,3.29,1.0,-2719.71,1.4861,3.306,-0.134,0.087273,-1.1e-05,,
1328,2196.0,"בנק לאומי לישראל בע""מ",520018078.0,ח.פ.,אופציה לס דולר שקל LEUMI C3.6 01/12/25 BUY,750000098.0,פנימי,"מט""ח",ישראל,"ארה""ב",שירותים פיננסיים,"מט""ח",2025-12-01,לא,2025-07-10,USD,גורם תלוי/פנימי,קיימת תלות,2025-09-30,3.6,1.0,5421.08,0.0679,3.306,0.012,-0.007949,1e-06,,
1328,2196.0,"בנק לאומי לישראל בע""מ",520018078.0,ח.פ.,אופציה לס דולר שקל LEUMI C3.60 07/01/26 BUY,750000121.0,פנימי,"מט""ח",ישראל,"ארה""ב",שירותים פיננסיים,"מט""ח",2026-01-07,לא,2025-08-25,USD,גורם תלוי/פנימי,קיימת תלות,2025-09-30,3.6,1.0,8131.62,0.1624,3.306,0.044,-0.02852,3e-06,,
1328,2196.0,"בנק דיסקונט לישראל בע""מ",520007030.0,ח.פ.,אופציה לס דולר שקל DISCOUNT C3.55 13/01/26 BUY,750000117.0,פנימי,"מט""ח",ישראל,"ארה""ב",שירותים פיננסיים,"מט""ח",2026-01-13,לא,2025-08-13,USD,גורם תלוי/פנימי,קיימת תלות,2025-09-30,3.55,1.0,5421.08,0.2679,3.306,0.048,-0.031364,4e-06,,
1328,2196.0,"בנק דיסקונט לישראל בע""מ",520007030.0,ח.פ.,אופציה לס דולר שקל DISCOUNT C3.575 12/03/26 BUY,750000132.0,פנימי,"מט""ח",ישראל,"ארה""ב",שירותים פיננסיים,"מט""ח",2026-03-12,לא,2025-09-12,USD,גורם תלוי/פנימי,קיימת תלות,2025-09-30,3.575,1.0,5439.6,0.5282,3.306,0.095,-0.062043,8e-06,,
1328,2196.0,"בנק הפועלים בע""מ",520000118.0,ח.פ.,אופציה לס דולר שקל POALIM P3.5 06/10/25,750000016.0,פנימי,"מט""ח",ישראל,"ארה""ב",שירותים פיננסיים,"מט""ח",2025-10-06,לא,2025-04-04,USD,גורם תלוי/פנימי,קיימת תלות,2025-09-30,3.5,1.0,-5439.27,5.8612,3.306,-1.054,0.688405,-9e-05,,
1328,2196.0,"בנק הפועלים בע""מ",520000118.0,ח.פ.,אופציה לס דולר שקל POALIM C3.59 26/03/26 BUY,750000145.0,פנימי,"מט""ח",ישראל,"ארה""ב",שירותים פיננסיים,"מט""ח",2026-03-26,לא,2025-09-26,USD,גורם תלוי/פנימי,קיימת תלות,2025-09-30,3.59,1.0,5439.6,0.5462,3.306,0.098,-0.064154,8e-06,,
1328,2196.0,"בנק דיסקונט לישראל בע""מ",520007030.0,ח.פ.,אופציה לס דולר שקל DISCOUNT P3.65 08/10/25,750000019.0,פנימי,"מט""ח",ישראל,"ארה""ב",שירותים פיננסיים,"מט""ח",2025-10-08,לא,2025-04-08,USD,גורם תלוי/פנימי,קיימת תלות,2025-09-30,3.65,1.0,10878.48,10.394,3.306,3.738,-2.441655,0.000321,,
1328,2196.0,"בנק דיסקונט לישראל בע""מ",520007030.0,ח.פ.,אופציה לס דולר שקל DISCOUNT C3.29 23/12/25 SELL,750000094.0,פנימי,"מט""ח",ישראל,"ארה""ב",שירותים פיננסיים,"מט""ח",2025-12-23,לא,2025-07-10,USD,גורם תלוי/פנימי,קיימת תלות,2025-09-30,3.29,1.0,-2719.71,2.0174,3.306,-0.181,0.118473,-1.5e-05,,
1328,2196.0,"בנק הפועלים בע""מ",520000118.0,ח.פ.,אופציה לס דולר שקל POALIM C3.5 05/12/25 BUY,750000095.0,פנימי,"מט""ח",ישראל,"ארה""ב",שירותים פיננסיים,"מט""ח",2025-12-05,לא,2025-07-10,USD,גורם תלוי/פנימי,קיימת תלות,2025-09-30,3.5,1.0,5439.27,0.2323,3.306,0.042,-0.02728,3e-06,,
1328,2196.0,"בנק לאומי לישראל בע""מ",520018078.0,ח.פ.,אופציה לס דולר שקל LEUMI C3.73 01/12/25 SELL,750000097.0,פנימי,"מט""ח",ישראל,"ארה""ב",שירותים פיננסיים,"מט""ח",2025-12-01,לא,2025-07-10,USD,גורם תלוי/פנימי,קיימת תלות,2025-09-30,3.73,1.0,-5421.08,0.0145,3.306,-0.003,0.001696,0.0,,
1328,2196.0,"בנק הפועלים בע""מ",520000118.0,ח.פ.,אופציה לס דולר שקל POALIM C3.7 05/12/25 SELL 15/07,750000100.0,פנימי,"מט""ח",ישראל,"ארה""ב",שירותים פיננסיים,"מט""ח",2025-12-05,לא,2025-05-14,USD,גורם תלוי/פנימי,קיימת תלות,2025-09-30,3.7,1.0,-5439.27,0.0277,3.306,-0.005,0.003254,0.0,,
1328,2196.0,"בנק הפועלים בע""מ",520000118.0,ח.פ.,אופציה לס דולר שקל POALIM P3.25 26/03/26 SELL,750000146.0,פנימי,"מט""ח",ישראל,"ארה""ב",שירותים פיננסיים,"מט""ח",2026-03-26,לא,2025-09-26,USD,גורם תלוי/פנימי,קיימת תלות,2025-09-30,3.25,1.0,-2719.8,1.582,3.306,-0.142,0.092907,-1.2e-05,,
1328,2196.0,"בנק דיסקונט לישראל בע""מ",520007030.0,ח.פ.,אופציה לס דולר שקל DISCOUNT C3.4 26/11/25 SELL,750000116.0,פנימי,"מט""ח",ישראל,"ארה""ב",שירותים פיננסיים,"מט""ח",2025-11-26,לא,2025-08-13,USD,גורם תלוי/פנימי,קיימת תלות,2025-09-30,3.4,1.0,-2710.54,0.4649,3.306,-0.042,0.027212,-3e-06,,
1328,2196.0,"בנק לאומי לישראל בע""מ",520018078.0,ח.פ.,אופציה לס דולר שקל LEUMI P3.7 13/10/25 L,750000029.0,פנימי,"מט""ח",ישראל,"ארה""ב",שירותים פיננסיים,"מט""ח",2025-10-13,לא,2025-04-09,USD,גורם תלוי/פנימי,קיימת תלות,2025-09-30,3.7,1.0,5439.06,11.897,3.306,2.139,-1.397332,0.000184,,
1328,2196.0,"בנק דיסקונט לישראל בע""מ",520007030.0,ח.פ.,אופציה לס דולר שקל DISCOUNT C3.75 26/11/25 BUY,750000049.0,פנימי,"מט""ח",ישראל,"ארה""ב",שירותים פיננסיים,"מט""ח",2025-11-26,לא,2025-05-28,USD,גורם תלוי/פנימי,קיימת תלות,2025-09-30,3.75,1.0,5421.08,0.0018,3.306,0.0,-0.000215,0.0,,
1328,2196.0,Goldman Sachs Group Inc,11778.0,פנימי,"אופציה לס GS C1,637.14 ESLT.TA 15/10/25 SELL",750000115.0,פנימי,מניה,ישראל,ישראל,Financial Services,מניות לרבות מדדי מניות,2025-10-15,לא,2025-08-12,ILS,גורם תלוי/פנימי,קיימת תלות,2025-09-30,1637.14,1.0,-0.81,7692.5,1.0,-0.062,0.040766,-5e-06,,
1328,2196.0,"בנק לאומי לישראל בע""מ",520018078.0,ח.פ.,אופציה לס דולר שקל LEUMI C3.38 01/12/25 SELL,750000120.0,פנימי,"מט""ח",ישראל,"ארה""ב",שירותים פיננסיים,"מט""ח",2025-12-01,לא,2025-08-25,USD,גורם תלוי/פנימי,קיימת תלות,2025-09-30,3.38,1.0,-2710.54,0.636,3.306,-0.057,0.037222,-4e-06,,
1328,2196.0,"בנק לאומי לישראל בע""מ",520018078.0,ח.פ.,אופציה לס דולר שקל LEUMI C3.39 05/12/25 SELL,750000124.0,פנימי,"מט""ח",ישראל,"ארה""ב",שירותים פיננסיים,"מט""ח",2025-12-05,לא,2025-09-02,USD,גורם תלוי/פנימי,קיימת תלות,2025-09-30,3.39,1.0,-2719.63,0.6353,3.306,-0.057,0.037306,-4e-06,,
1328,2196.0,"בנק דיסקונט לישראל בע""מ",520007030.0,ח.פ.,אופציה לס דולר שקל DISCOUNT C3.6 24/03/26 BUY,750000141.0,פנימי,"מט""ח",ישראל,"ארה""ב",שירותים פיננסיים,"מט""ח",2026-03-24,לא,2025-09-22,USD,גורם תלוי/פנימי,קיימת תלות,2025-09-30,3.6,1.0,5439.6,0.4815,3.306,0.087,-0.056551,7e-06,,
1328,2196.0,"בנק דיסקונט לישראל בע""מ",520007030.0,ח.פ.,אופציה לס דולר שקל DISCOUNT P3.55 08/10/25,750000020.0,פנימי,"מט""ח",ישראל,"ארה""ב",שירותים פיננסיים,"מט""ח",2025-10-08,לא,2025-04-08,USD,גורם תלוי/פנימי,קיימת תלות,2025-09-30,3.55,1.0,-10878.48,7.3698,3.306,-2.65,1.73117,-0.000228,,
1328,2196.0,"בנק לאומי לישראל בע""מ",520018078.0,ח.פ.,אופציה לס דולר שקל Leumi P3.7 13/10/25 S,750000040.0,פנימי,"מט""ח",ישראל,"ארה""ב",שירותים פיננסיים,"מט""ח",2025-10-13,לא,2025-05-08,USD,גורם תלוי/פנימי,קיימת תלות,2025-09-30,3.7,1.0,-5439.06,11.893,3.306,-2.139,1.396785,-0.000184,,
1328,2196.0,"בנק דיסקונט לישראל בע""מ",520007030.0,ח.פ.,אופציה לס דולר שקל DISCOUNT P3.4 26/11/25 SELL,750000048.0,פנימי,"מט""ח",ישראל,"ארה""ב",שירותים פיננסיים,"מט""ח",2025-11-26,לא,2025-05-28,USD,גורם תלוי/פנימי,קיימת תלות,2025-09-30,3.4,1.0,-2710.54,3.267,3.306,-0.293,0.191216,-2.5e-05,,
1328,2196.0,"בנק לאומי לישראל בע""מ",520018078.0,ח.פ.,אופציה לס דולר שקל LEUMI P3.38 01/12/25 SELL,750000052.0,פנימי,"מט""ח",ישראל,"ארה""ב",שירותים פיננסיים,"מט""ח",2025-12-01,לא,2025-05-29,USD,גורם תלוי/פנימי,קיימת תלות,2025-09-30,3.38,1.0,-2710.54,2.8466,3.306,-0.255,0.166609,-2.1e-05,,
1328,2196.0,"בנק לאומי לישראל בע""מ",520018078.0,ח.פ.,אופציה לס דולר שקל LEUMI C3.59 06/01/26 BUY,750000125.0,פנימי,"מט""ח",ישראל,"ארה""ב",שירותים פיננסיים,"מט""ח",2026-01-05,לא,2025-09-02,USD,גורם תלוי/פנימי,קיימת תלות,2025-09-30,3.59,1.0,8158.91,0.1726,3.306,0.047,-0.030401,4e-06,,
1328,2196.0,"בנק דיסקונט לישראל בע""מ",520007030.0,ח.פ.,אופציה לס דולר שקל DISCOUNT P3.21 12/03/26 SELL,750000133.0,פנימי,"מט""ח",ישראל,"ארה""ב",שירותים פיננסיים,"מט""ח",2026-03-12,לא,2025-09-12,USD,גורם תלוי/פנימי,קיימת תלות,2025-09-30,3.21,1.0,-2719.8,1.0491,3.306,-0.094,0.06161,-8e-06,,
1328,2196.0,"בנק הפועלים בע""מ",520000118.0,ח.פ.,אופציה לס דולר שקל POALIM P3.6 06/10/25,750000017.0,פנימי,"מט""ח",ישראל,"ארה""ב",שירותים פיננסיים,"מט""ח",2025-10-06,לא,2025-04-04,USD,גורם תלוי/פנימי,קיימת תלות,2025-09-30,3.6,1.0,5439.27,8.8859,3.306,1.598,-1.043654,0.000137,,
1328,2196.0,"בנק הפועלים בע""מ",520000118.0,ח.פ.,אופציה לס דולר שקל POALIM P3.39 05/12/25 SELL,750000058.0,פנימי,"מט""ח",ישראל,"ארה""ב",שירותים פיננסיים,"מט""ח",2025-12-05,לא,2025-06-06,USD,גורם תלוי/פנימי,קיימת תלות,2025-09-30,3.39,1.0,-2719.63,3.1116,3.306,-0.28,0.182731,-2.4e-05,,
1328,2196.0,"בנק דיסקונט לישראל בע""מ",520007030.0,ח.פ.,אופציה לס דולר שקל DISCOUNT P3.25 24/03/26 SELL,750000142.0,פנימי,"מט""ח",ישראל,"ארה""ב",שירותים פיננסיים,"מט""ח",2026-03-24,לא,2025-09-22,USD,גורם תלוי/פנימי,קיימת תלות,2025-09-30,3.25,1.0,-2719.8,1.5316,3.306,-0.138,0.089951,-1.1e-05,,
1328,2196.0,"בנק הפועלים בע""מ",520000118.0,ח.פ.,אופציה לס דולר שקל POALIM C3.7 05/12/25 SELL,750000096.0,פנימי,"מט""ח",ישראל,"ארה""ב",שירותים פיננסיים,"מט""ח",2025-12-05,לא,2025-07-10,USD,גורם תלוי/פנימי,קיימת תלות,2025-09-30,3.7,1.0,-5439.27,0.0268,3.306,-0.005,0.003144,0.0,,
1328,2196.0,"Citibank, NA",70652.0,פנימי,אופציה לס דולר שקל CITI C3.38 18/12/25 SELL,750000091.0,פנימי,"מט""ח","חו""ל","ארה""ב",Financial Services,"מט""ח",2025-12-18,לא,2025-07-03,USD,גורם תלוי/פנימי,קיימת תלות,2025-09-30,3.38,1.0,-2357.04,0.8985,3.306,-0.07,0.045727,-6e-06,,
1328,2196.0,"Citibank, NA",70652.0,פנימי,אופציה לס דולר שקל CITI P3.22 06/03/26 SELL,750000129.0,פנימי,"מט""ח","חו""ל","ארה""ב",Financial Services,"מט""ח",2026-03-06,לא,2025-09-09,USD,גורם תלוי/פנימי,קיימת תלות,2025-09-30,3.22,1.0,-2719.66,1.1426,3.306,-0.103,0.067103,-8e-06,,
1328,2196.0,Goldman Sachs Group Inc,11778.0,פנימי,אופציה לס אירו שקל GS P3.9 03/10/25 SELL,750000085.0,פנימי,"מט""ח","חו""ל",אירופה,Financial Services,"מט""ח",2025-10-03,לא,2025-07-07,EUR,גורם תלוי/פנימי,קיימת תלות,2025-09-30,3.9,1.0,-906.54,0.6576,3.8807,-0.023,0.015109,-1e-06,,
1328,2196.0,Goldman Sachs Group Inc,11778.0,פנימי,אופציה לס אירו שקל GS P3.7 03/10/25 BUY,750000086.0,פנימי,"מט""ח","חו""ל",אירופה,Financial Services,"מט""ח",2025-10-03,לא,2025-07-01,EUR,גורם תלוי/פנימי,קיימת תלות,2025-09-30,3.7,1.0,4532.7,0.0001,3.8807,0.0,-2e-06,0.0,,
1328,2196.0,"Citibank, NA",70652.0,פנימי,אופציה לס דולר שקל CITI C3.62 18/12/25 BUY,750000092.0,פנימי,"מט""ח","חו""ל","ארה""ב",Financial Services,"מט""ח",2025-12-18,לא,2025-07-03,USD,גורם תלוי/פנימי,קיימת תלות,2025-09-30,3.62,1.0,7071.12,0.0949,3.306,0.022,-0.014483,1e-06,,
1328,2196.0,"Citibank, NA",70652.0,פנימי,אופציה לס דולר שקל CITI C3.60 18/12/25 BUY,750000103.0,פנימי,"מט""ח","חו""ל","ארה""ב",Financial Services,"מט""ח",2025-12-18,לא,2025-07-16,USD,גורם תלוי/פנימי,קיימת תלות,2025-09-30,3.6,1.0,3988.83,0.1201,3.306,0.016,-0.010348,1e-06,,
1328,2196.0,"Citibank, NA",70652.0,פנימי,אופציה לס דולר שקל CITI C3.575 06/03/26 BUY,750000128.0,פנימי,"מט""ח","חו""ל","ארה""ב",Financial Services,"מט""ח",2026-03-06,לא,2025-09-09,USD,גורם תלוי/פנימי,קיימת תלות,2025-09-30,3.575,1.0,5439.33,0.5176,3.306,0.093,-0.06079,8e-06,,
1328,2196.0,Goldman Sachs Group Inc,11778.0,פנימי,אופציה לס אירו שקל GS C4.2 03/10/25 BUY,750000122.0,פנימי,"מט""ח","חו""ל",אירופה,Financial Services,"מט""ח",2025-10-03,לא,2025-08-27,EUR,גורם תלוי/פנימי,קיימת תלות,2025-09-30,4.2,1.0,1815.62,0.0001,3.8807,0.0,-3e-06,0.0,,
1328,2196.0,"Citibank, NA",70652.0,פנימי,אופציה לס דולר שקל CITI C3.75 18/12/25 SELL,750000102.0,פנימי,"מט""ח","חו""ל","ארה""ב",Financial Services,"מט""ח",2025-12-18,לא,2025-07-16,USD,גורם תלוי/פנימי,קיימת תלות,2025-09-30,3.75,1.0,-3988.83,0.0287,3.306,-0.004,0.002472,0.0,,
1328,2196.0,"Citibank, NA",70652.0,פנימי,אופציה לס דולר שקל CITI C3.75 18/12/25 BUY,750000067.0,פנימי,"מט""ח","חו""ל","ארה""ב",Financial Services,"מט""ח",2025-12-18,לא,2025-06-17,USD,גורם תלוי/פנימי,קיימת תלות,2025-09-30,3.75,1.0,3988.83,0.0299,3.306,0.004,-0.002574,0.0,,
1328,2196.0,"Citibank, NA",70652.0,פנימי,אופציה לס דולר שקל CITI P3.38 18/12/25 SELL,750000066.0,פנימי,"מט""ח","חו""ל","ארה""ב",Financial Services,"מט""ח",2025-12-18,לא,2025-06-17,USD,גורם תלוי/פנימי,קיימת תלות,2025-09-30,3.38,1.0,-2357.04,3.2367,3.306,-0.252,0.164732,-2.1e-05,,
1328,2196.0,Goldman Sachs Group Inc,11778.0,פנימי,אופציה לס אירו שקל GS P3.9 03/10/25 SELL,750000093.0,פנימי,"מט""ח","חו""ל",אירופה,Financial Services,"מט""ח",2025-10-03,לא,2025-07-01,EUR,גורם תלוי/פנימי,קיימת תלות,2025-09-30,3.9,1.0,-3631.24,0.6604,3.8807,-0.093,0.060787,-8e-06,,
1328,9757.0,Goldman Sachs Group Inc,11778.0,פנימי,אופציה לס אירו שקל GS C4.2 03/10/25,750000010.0,פנימי,"מט""ח","חו""ל",אירופה,Financial Services,"מט""ח",2025-10-03,לא,2025-04-03,EUR,גורם תלוי/פנימי,קיימת תלות,2025-09-30,4.2,1.0,-12214037.56,0.0001,3.8807,-0.049,4e-06,0.0,,
1328,9757.0,"בנק לאומי לישראל בע""מ",520018078.0,ח.פ.,אופציה לס דולר שקל LEUMI P3.6 13/10/25 S,750000027.0,פנימי,"מט""ח",ישראל,"ארה""ב",שירותים פיננסיים,"מט""ח",2025-10-13,לא,2025-04-09,USD,גורם תלוי/פנימי,קיימת תלות,2025-09-30,3.6,1.0,-36589592.32,8.8731,3.306,-10733.337,1.042109,-0.00056,,
1328,9757.0,"בנק הפועלים בע""מ",520000118.0,ח.פ.,אופציה לס דולר שקל POALIM P3.5 06/10/25 BUY,750000057.0,פנימי,"מט""ח",ישראל,"ארה""ב",שירותים פיננסיים,"מט""ח",2025-10-06,לא,2025-06-04,USD,גורם תלוי/פנימי,קיימת תלות,2025-09-30,3.5,1.0,36591058.01,5.8625,3.306,7091.896,-0.688558,0.00037,,
1328,9757.0,"בנק דיסקונט לישראל בע""מ",520007030.0,ח.פ.,אופציה לס דולר שקל DISCOUNT P3.65 08/10/25 SELL,750000045.0,פנימי,"מט""ח",ישראל,"ארה""ב",שירותים פיננסיים,"מט""ח",2025-10-08,לא,2025-05-21,USD,גורם תלוי/פנימי,קיימת תלות,2025-09-30,3.65,1.0,-73181627.46,10.391,3.306,-25141.255,2.440987,-0.001313,,
1328,9757.0,Goldman Sachs Group Inc,11778.0,פנימי,אופציה לס אירו שקל GS P3.7 03/10/25,750000012.0,פנימי,"מט""ח","חו""ל",אירופה,Financial Services,"מט""ח",2025-10-03,לא,2025-04-03,EUR,גורם תלוי/פנימי,קיימת תלות,2025-09-30,3.7,1.0,-30535093.9,0.0001,3.8807,-0.031,2e-06,0.0,,
1328,9757.0,Goldman Sachs Group Inc,11778.0,פנימי,אופציה לס אירו שקל GS P3.9 03/10/25,750000011.0,פנימי,"מט""ח","חו""ל",אירופה,Financial Services,"מט""ח",2025-10-03,לא,2025-04-03,EUR,גורם תלוי/פנימי,קיימת תלות,2025-09-30,3.9,1.0,30535093.9,0.6786,3.8807,804.172,-0.078077,4.2e-05,,
1328,9757.0,"בנק הפועלים בע""מ",520000118.0,ח.פ.,אופציה לס דולר שקל POALIM P3.6 06/10/25 SELL,750000056.0,פנימי,"מט""ח",ישראל,"ארה""ב",שירותים פיננסיים,"מט""ח",2025-10-06,לא,2025-06-04,USD,גורם תלוי/פנימי,קיימת תלות,2025-09-30,3.6,1.0,-36591058.01,8.8822,3.306,-10744.818,1.043224,-0.000561,,
1328,9757.0,"בנק לאומי לישראל בע""מ",520018078.0,ח.פ.,אופציה לס דולר שקל Leumi P3.6 13/10/25 L,750000041.0,פנימי,"מט""ח",ישראל,"ארה""ב",שירותים פיננסיים,"מט""ח",2025-10-13,לא,2025-05-08,USD,גורם תלוי/פנימי,קיימת תלות,2025-09-30,3.6,1.0,36589592.32,8.8777,3.306,10738.899,-1.042649,0.000561,,
1328,9757.0,"בנק דיסקונט לישראל בע""מ",520007030.0,ח.פ.,אופציה לס דולר שקל DISCOUNT P3.55 08/10/25 BUY,750000046.0,פנימי,"מט""ח",ישראל,"ארה""ב",שירותים פיננסיים,"מט""ח",2025-10-08,לא,2025-05-21,USD,גורם תלוי/פנימי,קיימת תלות,2025-09-30,3.55,1.0,73181627.46,7.3726,3.306,17837.217,-1.731831,0.000932,,
1328,9757.0,"בנק דיסקונט לישראל בע""מ",520007030.0,ח.פ.,אופציה לס דולר שקל DISCOUNT C3.58 23/12/25 BUY,750000076.0,פנימי,"מט""ח",ישראל,"ארה""ב",שירותים פיננסיים,"מט""ח",2025-12-23,לא,2025-06-26,USD,גורם תלוי/פנימי,קיימת תלות,2025-09-30,3.58,1.0,18296017.56,0.1439,3.306,87.016,-0.008448,4e-06,,
1328,9757.0,"בנק הפועלים בע""מ",520000118.0,ח.פ.,אופציה לס דולר שקל POALIM C3.70 05/12/25 BUY,750000059.0,פנימי,"מט""ח",ישראל,"ארה""ב",שירותים פיננסיים,"מט""ח",2025-12-05,לא,2025-06-06,USD,גורם תלוי/פנימי,קיימת תלות,2025-09-30,3.7,1.0,36591058.01,0.0091,3.306,10.977,-0.001065,0.0,,
1328,9757.0,"בנק הפועלים בע""מ",520000118.0,ח.פ.,אופציה לס דולר שקל POALIM C3.6 05/12/25 BUY,750000099.0,פנימי,"מט""ח",ישראל,"ארה""ב",שירותים פיננסיים,"מט""ח",2025-12-05,לא,2025-05-14,USD,גורם תלוי/פנימי,קיימת תלות,2025-09-30,3.6,1.0,36591058.01,0.0815,3.306,98.576,-0.00957,5e-06,,
1328,9757.0,"בנק לאומי לישראל בע""מ",520018078.0,ח.פ.,אופציה לס דולר שקל LEUMI C3.73 01/12/25 BUY,750000053.0,פנימי,"מט""ח",ישראל,"ארה""ב",שירותים פיננסיים,"מט""ח",2025-12-01,לא,2025-05-29,USD,גורם תלוי/פנימי,קיימת תלות,2025-09-30,3.73,1.0,36468673.35,0.004,3.306,4.85,-0.00047,0.0,,
1328,9757.0,"בנק דיסקונט לישראל בע""מ",520007030.0,ח.פ.,אופציה לס דולר שקל DISCOUNT P3.29 23/12/25 SELL,750000077.0,פנימי,"מט""ח",ישראל,"ארה""ב",שירותים פיננסיים,"מט""ח",2025-12-23,לא,2025-06-26,USD,גורם תלוי/פנימי,קיימת תלות,2025-09-30,3.29,1.0,-18296017.56,1.4861,3.306,-898.883,0.087273,-4.6e-05,,
1328,9757.0,"בנק לאומי לישראל בע""מ",520018078.0,ח.פ.,אופציה לס דולר שקל LEUMI C3.6 01/12/25 BUY,750000098.0,פנימי,"מט""ח",ישראל,"ארה""ב",שירותים פיננסיים,"מט""ח",2025-12-01,לא,2025-07-10,USD,גורם תלוי/פנימי,קיימת תלות,2025-09-30,3.6,1.0,36468673.35,0.0679,3.306,81.872,-0.007949,4e-06,,
1328,9757.0,"בנק לאומי לישראל בע""מ",520018078.0,ח.פ.,אופציה לס דולר שקל LEUMI C3.60 07/01/26 BUY,750000121.0,פנימי,"מט""ח",ישראל,"ארה""ב",שירותים פיננסיים,"מט""ח",2026-01-07,לא,2025-08-25,USD,גורם תלוי/פנימי,קיימת תלות,2025-09-30,3.6,1.0,54703010.03,0.1624,3.306,293.755,-0.02852,1.5e-05,,
1328,9757.0,"בנק דיסקונט לישראל בע""מ",520007030.0,ח.פ.,אופציה לס דולר שקל DISCOUNT C3.575 12/03/26 BUY,750000132.0,פנימי,"מט""ח",ישראל,"ארה""ב",שירותים פיננסיים,"מט""ח",2026-03-12,לא,2025-09-12,USD,גורם תלוי/פנימי,קיימת תלות,2025-09-30,3.575,1.0,36593256.54,0.5282,3.306,639.028,-0.062043,3.3e-05,,
1328,9757.0,"בנק הפועלים בע""מ",520000118.0,ח.פ.,אופציה לס דולר שקל POALIM C3.59 26/03/26 BUY,750000145.0,פנימי,"מט""ח",ישראל,"ארה""ב",שירותים פיננסיים,"מט""ח",2026-03-26,לא,2025-09-26,USD,גורם תלוי/פנימי,קיימת תלות,2025-09-30,3.59,1.0,36593256.54,0.5462,3.306,660.764,-0.064154,3.4e-05,,
1328,9757.0,"בנק דיסקונט לישראל בע""מ",520007030.0,ח.פ.,אופציה לס דולר שקל DISCOUNT C3.55 13/01/26 BUY,750000117.0,פנימי,"מט""ח",ישראל,"ארה""ב",שירותים פיננסיים,"מט""ח",2026-01-13,לא,2025-08-13,USD,גורם תלוי/פנימי,קיימת תלות,2025-09-30,3.55,1.0,36468673.35,0.2679,3.306,323.04,-0.031364,1.6e-05,,
1328,9757.0,"בנק דיסקונט לישראל בע""מ",520007030.0,ח.פ.,אופציה לס דולר שקל DISCOUNT C3.4 26/11/25 SELL,750000116.0,פנימי,"מט""ח",ישראל,"ארה""ב",שירותים פיננסיים,"מט""ח",2025-11-26,לא,2025-08-13,USD,גורם תלוי/פנימי,קיימת תלות,2025-09-30,3.4,1.0,-18234336.67,0.4649,3.306,-280.28,0.027212,-1.4e-05,,
1328,9757.0,"בנק הפועלים בע""מ",520000118.0,ח.פ.,אופציה לס דולר שקל POALIM P3.25 26/03/26 SELL,750000146.0,פנימי,"מט""ח",ישראל,"ארה""ב",שירותים פיננסיים,"מט""ח",2026-03-26,לא,2025-09-26,USD,גורם תלוי/פנימי,קיימת תלות,2025-09-30,3.25,1.0,-18296628.27,1.582,3.306,-956.914,0.092907,-5e-05,,
1328,9757.0,"בנק לאומי לישראל בע""מ",520018078.0,ח.פ.,אופציה לס דולר שקל LEUMI C3.73 01/12/25 SELL,750000097.0,פנימי,"מט""ח",ישראל,"ארה""ב",שירותים פיננסיים,"מט""ח",2025-12-01,לא,2025-07-10,USD,גורם תלוי/פנימי,קיימת תלות,2025-09-30,3.73,1.0,-36468673.35,0.0145,3.306,-17.468,0.001696,0.0,,
1328,9757.0,"בנק הפועלים בע""מ",520000118.0,ח.פ.,אופציה לס דולר שקל POALIM C3.7 05/12/25 SELL 15/07,750000100.0,פנימי,"מט""ח",ישראל,"ארה""ב",שירותים פיננסיים,"מט""ח",2025-12-05,לא,2025-05-14,USD,גורם תלוי/פנימי,קיימת תלות,2025-09-30,3.7,1.0,-36591058.01,0.0277,3.306,-33.517,0.003254,-1e-06,,
1328,9757.0,"בנק הפועלים בע""מ",520000118.0,ח.פ.,אופציה לס דולר שקל POALIM C3.5 05/12/25 BUY,750000095.0,פנימי,"מט""ח",ישראל,"ארה""ב",שירותים פיננסיים,"מט""ח",2025-12-05,לא,2025-07-10,USD,גורם תלוי/פנימי,קיימת תלות,2025-09-30,3.5,1.0,36591058.01,0.2323,3.306,280.983,-0.02728,1.4e-05,,
1328,9757.0,"בנק דיסקונט לישראל בע""מ",520007030.0,ח.פ.,אופציה לס דולר שקל DISCOUNT C3.29 23/12/25 SELL,750000094.0,פנימי,"מט""ח",ישראל,"ארה""ב",שירותים פיננסיים,"מט""ח",2025-12-23,לא,2025-07-10,USD,גורם תלוי/פנימי,קיימת תלות,2025-09-30,3.29,1.0,-18296017.56,2.0174,3.306,-1220.235,0.118473,-6.3e-05,,
1328,9757.0,"בנק הפועלים בע""מ",520000118.0,ח.פ.,אופציה לס דולר שקל POALIM P3.5 06/10/25,750000016.0,פנימי,"מט""ח",ישראל,"ארה""ב",שירותים פיננסיים,"מט""ח",2025-10-06,לא,2025-04-04,USD,גורם תלוי/פנימי,קיימת תלות,2025-09-30,3.5,1.0,-36591058.01,5.8612,3.306,-7090.322,0.688405,-0.00037,,
1328,9757.0,"בנק דיסקונט לישראל בע""מ",520007030.0,ח.פ.,אופציה לס דולר שקל DISCOUNT P3.65 08/10/25,750000019.0,פנימי,"מט""ח",ישראל,"ארה""ב",שירותים פיננסיים,"מט""ח",2025-10-08,לא,2025-04-08,USD,גורם תלוי/פנימי,קיימת תלות,2025-09-30,3.65,1.0,73181627.46,10.394,3.306,25148.134,-2.441655,0.001314,,
1328,9757.0,"בנק דיסקונט לישראל בע""מ",520007030.0,ח.פ.,אופציה לס דולר שקל DISCOUNT C3.75 26/11/25 BUY,750000049.0,פנימי,"מט""ח",ישראל,"ארה""ב",שירותים פיננסיים,"מט""ח",2025-11-26,לא,2025-05-28,USD,גורם תלוי/פנימי,קיימת תלות,2025-09-30,3.75,1.0,36468673.35,0.0018,3.306,2.225,-0.000215,0.0,,
1328,9757.0,"בנק לאומי לישראל בע""מ",520018078.0,ח.פ.,אופציה לס דולר שקל LEUMI P3.7 13/10/25 L,750000029.0,פנימי,"מט""ח",ישראל,"ארה""ב",שירותים פיננסיים,"מט""ח",2025-10-13,לא,2025-04-09,USD,גורם תלוי/פנימי,קיימת תלות,2025-09-30,3.7,1.0,36589592.32,11.897,3.306,14392.004,-1.397332,0.000752,,
1328,9757.0,"בנק דיסקונט לישראל בע""מ",520007030.0,ח.פ.,אופציה לס דולר שקל DISCOUNT C3.6 24/03/26 BUY,750000141.0,פנימי,"מט""ח",ישראל,"ארה""ב",שירותים פיננסיים,"מט""ח",2026-03-24,לא,2025-09-22,USD,גורם תלוי/פנימי,קיימת תלות,2025-09-30,3.6,1.0,36593256.54,0.4815,3.306,582.455,-0.056551,3e-05,,
1328,9757.0,"בנק לאומי לישראל בע""מ",520018078.0,ח.פ.,אופציה לס דולר שקל LEUMI C3.39 05/12/25 SELL,750000124.0,פנימי,"מט""ח",ישראל,"ארה""ב",שירותים פיננסיים,"מט""ח",2025-12-05,לא,2025-09-02,USD,גורם תלוי/פנימי,קיימת תלות,2025-09-30,3.39,1.0,-18295529.0,0.6353,3.306,-384.243,0.037306,-2e-05,,
1328,9757.0,"בנק לאומי לישראל בע""מ",520018078.0,ח.פ.,אופציה לס דולר שקל LEUMI C3.38 01/12/25 SELL,750000120.0,פנימי,"מט""ח",ישראל,"ארה""ב",שירותים פיננסיים,"מט""ח",2025-12-01,לא,2025-08-25,USD,גורם תלוי/פנימי,קיימת תלות,2025-09-30,3.38,1.0,-18234336.67,0.636,3.306,-383.377,0.037222,-2e-05,,
1328,9757.0,Goldman Sachs Group Inc,11778.0,פנימי,"אופציה לס GS C1,637.14 ESLT.TA 15/10/25 SELL",750000115.0,פנימי,מניה,ישראל,ישראל,Financial Services,מניות לרבות מדדי מניות,2025-10-15,לא,2025-08-12,ILS,גורם תלוי/פנימי,קיימת תלות,2025-09-30,1637.14,1.0,-5458.2,7692.5,1.0,-419.876,0.040766,-2.1e-05,,
1328,9757.0,"בנק לאומי לישראל בע""מ",520018078.0,ח.פ.,אופציה לס דולר שקל LEUMI P3.38 01/12/25 SELL,750000052.0,פנימי,"מט""ח",ישראל,"ארה""ב",שירותים פיננסיים,"מט""ח",2025-12-01,לא,2025-05-29,USD,גורם תלוי/פנימי,קיימת תלות,2025-09-30,3.38,1.0,-18234336.67,2.8466,3.306,-1716.015,0.166609,-8.9e-05,,
1328,9757.0,"בנק דיסקונט לישראל בע""מ",520007030.0,ח.פ.,אופציה לס דולר שקל DISCOUNT P3.4 26/11/25 SELL,750000048.0,פנימי,"מט""ח",ישראל,"ארה""ב",שירותים פיננסיים,"מט""ח",2025-11-26,לא,2025-05-28,USD,גורם תלוי/פנימי,קיימת תלות,2025-09-30,3.4,1.0,-18234336.67,3.267,3.306,-1969.454,0.191216,-0.000102,,
1328,9757.0,"בנק לאומי לישראל בע""מ",520018078.0,ח.פ.,אופציה לס דולר שקל Leumi P3.7 13/10/25 S,750000040.0,פנימי,"מט""ח",ישראל,"ארה""ב",שירותים פיננסיים,"מט""ח",2025-10-13,לא,2025-05-08,USD,גורם תלוי/פנימי,קיימת תלות,2025-09-30,3.7,1.0,-36589592.32,11.893,3.306,-14386.369,1.396785,-0.000751,,
1328,9757.0,"בנק דיסקונט לישראל בע""מ",520007030.0,ח.פ.,אופציה לס דולר שקל DISCOUNT P3.55 08/10/25,750000020.0,פנימי,"מט""ח",ישראל,"ארה""ב",שירותים פיננסיים,"מט""ח",2025-10-08,לא,2025-04-08,USD,גורם תלוי/פנימי,קיימת תלות,2025-09-30,3.55,1.0,-73181627.46,7.3698,3.306,-17830.411,1.73117,-0.000931,,
1328,9757.0,"בנק לאומי לישראל בע""מ",520018078.0,ח.פ.,אופציה לס דולר שקל LEUMI C3.59 06/01/26 BUY,750000125.0,פנימי,"מט""ח",ישראל,"ארה""ב",שירותים פיננסיים,"מט""ח",2026-01-05,לא,2025-09-02,USD,גורם תלוי/פנימי,קיימת תלות,2025-09-30,3.59,1.0,54886587.02,0.1726,3.306,313.128,-0.030401,1.6e-05,,
1328,9757.0,"בנק דיסקונט לישראל בע""מ",520007030.0,ח.פ.,אופציה לס דולר שקל DISCOUNT P3.21 12/03/26 SELL,750000133.0,פנימי,"מט""ח",ישראל,"ארה""ב",שירותים פיננסיים,"מט""ח",2026-03-12,לא,2025-09-12,USD,גורם תלוי/פנימי,קיימת תלות,2025-09-30,3.21,1.0,-18296628.27,1.0491,3.306,-634.564,0.06161,-3.3e-05,,
1328,9757.0,"בנק הפועלים בע""מ",520000118.0,ח.פ.,אופציה לס דולר שקל POALIM P3.6 06/10/25,750000017.0,פנימי,"מט""ח",ישראל,"ארה""ב",שירותים פיננסיים,"מט""ח",2025-10-06,לא,2025-04-04,USD,גורם תלוי/פנימי,קיימת תלות,2025-09-30,3.6,1.0,36591058.01,8.8859,3.306,10749.245,-1.043654,0.000561,,
1328,9757.0,"בנק הפועלים בע""מ",520000118.0,ח.פ.,אופציה לס דולר שקל POALIM P3.39 05/12/25 SELL,750000058.0,פנימי,"מט""ח",ישראל,"ארה""ב",שירותים פיננסיים,"מט""ח",2025-12-05,לא,2025-06-06,USD,גורם תלוי/פנימי,קיימת תלות,2025-09-30,3.39,1.0,-18295529.0,3.1116,3.306,-1882.061,0.182731,-9.8e-05,,
1328,9757.0,"בנק דיסקונט לישראל בע""מ",520007030.0,ח.פ.,אופציה לס דולר שקל DISCOUNT P3.25 24/03/26 SELL,750000142.0,פנימי,"מט""ח",ישראל,"ארה""ב",שירותים פיננסיים,"מט""ח",2026-03-24,לא,2025-09-22,USD,גורם תלוי/פנימי,קיימת תלות,2025-09-30,3.25,1.0,-18296628.27,1.5316,3.306,-926.468,0.089951,-4.8e-05,,
1328,9757.0,"בנק הפועלים בע""מ",520000118.0,ח.פ.,אופציה לס דולר שקל POALIM C3.7 05/12/25 SELL,750000096.0,פנימי,"מט""ח",ישראל,"ארה""ב",שירותים פיננסיים,"מט""ח",2025-12-05,לא,2025-07-10,USD,גורם תלוי/פנימי,קיימת תלות,2025-09-30,3.7,1.0,-36591058.01,0.0268,3.306,-32.383,0.003144,-1e-06,,
1328,9757.0,"Citibank, NA",70652.0,פנימי,אופציה לס דולר שקל CITI C3.38 18/12/25 SELL,750000091.0,פנימי,"מט""ח","חו""ל","ארה""ב",Financial Services,"מט""ח",2025-12-18,לא,2025-07-03,USD,גורם תלוי/פנימי,קיימת תלות,2025-09-30,3.38,1.0,-15856263.56,0.8985,3.306,-470.979,0.045727,-2.4e-05,,
1328,9757.0,"Citibank, NA",70652.0,פנימי,אופציה לס דולר שקל CITI P3.22 06/03/26 SELL,750000129.0,פנימי,"מט""ח","חו""ל","ארה""ב",Financial Services,"מט""ח",2026-03-06,לא,2025-09-09,USD,גורם תלוי/פנימי,קיימת תלות,2025-09-30,3.22,1.0,-18295712.21,1.1426,3.306,-691.139,0.067103,-3.6e-05,,
1328,9757.0,"Citibank, NA",70652.0,פנימי,אופציה לס דולר שקל CITI C3.60 18/12/25 BUY,750000103.0,פנימי,"מט""ח","חו""ל","ארה""ב",Financial Services,"מט""ח",2025-12-18,לא,2025-07-16,USD,גורם תלוי/פנימי,קיימת תלות,2025-09-30,3.6,1.0,26833629.82,0.1201,3.306,106.583,-0.010348,5e-06,,
1328,9757.0,Goldman Sachs Group Inc,11778.0,פנימי,אופציה לס אירו שקל GS P3.7 03/10/25 BUY,750000086.0,פנימי,"מט""ח","חו""ל",אירופה,Financial Services,"מט""ח",2025-10-03,לא,2025-07-01,EUR,גורם תלוי/פנימי,קיימת תלות,2025-09-30,3.7,1.0,30492344.77,0.0001,3.8807,0.03,-2e-06,0.0,,
1328,9757.0,"Citibank, NA",70652.0,פנימי,אופציה לס דולר שקל CITI C3.62 18/12/25 BUY,750000092.0,פנימי,"מט""ח","חו""ל","ארה""ב",Financial Services,"מט""ח",2025-12-18,לא,2025-07-03,USD,גורם תלוי/פנימי,קיימת תלות,2025-09-30,3.62,1.0,47568790.69,0.0949,3.306,149.176,-0.014483,7e-06,,
1328,9757.0,Goldman Sachs Group Inc,11778.0,פנימי,אופציה לס אירו שקל GS P3.9 03/10/25 SELL,750000085.0,פנימי,"מט""ח","חו""ל",אירופה,Financial Services,"מט""ח",2025-10-03,לא,2025-07-07,EUR,גורם תלוי/פנימי,קיימת תלות,2025-09-30,3.9,1.0,-6098468.95,0.6576,3.8807,-155.627,0.015109,-8e-06,,
1328,9757.0,"Citibank, NA",70652.0,פנימי,אופציה לס דולר שקל CITI C3.575 06/03/26 BUY,750000128.0,פנימי,"מט""ח","חו""ל","ארה""ב",Financial Services,"מט""ח",2026-03-06,לא,2025-09-09,USD,גורם תלוי/פנימי,קיימת תלות,2025-09-30,3.575,1.0,36591424.43,0.5176,3.306,626.116,-0.06079,3.2e-05,,
1328,9757.0,Goldman Sachs Group Inc,11778.0,פנימי,אופציה לס אירו שקל GS C4.2 03/10/25 BUY,750000122.0,פנימי,"מט""ח","חו""ל",אירופה,Financial Services,"מט""ח",2025-10-03,לא,2025-08-27,EUR,גורם תלוי/פנימי,קיימת תלות,2025-09-30,4.2,1.0,12214037.56,0.0001,3.8807,0.037,-3e-06,0.0,,
1328,9757.0,"Citibank, NA",70652.0,פנימי,אופציה לס דולר שקל CITI C3.75 18/12/25 SELL,750000102.0,פנימי,"מט""ח","חו""ל","ארה""ב",Financial Services,"מט""ח",2025-12-18,לא,2025-07-16,USD,גורם תלוי/פנימי,קיימת תלות,2025-09-30,3.75,1.0,-26833629.82,0.0287,3.306,-25.465,0.002472,-1e-06,,
1328,9757.0,"Citibank, NA",70652.0,פנימי,אופציה לס דולר שקל CITI C3.75 18/12/25 BUY,750000067.0,פנימי,"מט""ח","חו""ל","ארה""ב",Financial Services,"מט""ח",2025-12-18,לא,2025-06-17,USD,גורם תלוי/פנימי,קיימת תלות,2025-09-30,3.75,1.0,26833629.82,0.0299,3.306,26.512,-0.002574,1e-06,,
1328,9757.0,"Citibank, NA",70652.0,פנימי,אופציה לס דולר שקל CITI P3.38 18/12/25 SELL,750000066.0,פנימי,"מט""ח","חו""ל","ארה""ב",Financial Services,"מט""ח",2025-12-18,לא,2025-06-17,USD,גורם תלוי/פנימי,קיימת תלות,2025-09-30,3.38,1.0,-15856263.56,3.2367,3.306,-1696.684,0.164732,-8.8e-05,,
1328,9757.0,Goldman Sachs Group Inc,11778.0,פנימי,אופציה לס אירו שקל GS P3.9 03/10/25 SELL,750000093.0,פנימי,"מט""ח","חו""ל",אירופה,Financial Services,"מט""ח",2025-10-03,לא,2025-07-01,EUR,גורם תלוי/פנימי,קיימת תלות,2025-09-30,3.9,1.0,-24428075.12,0.6604,3.8807,-626.092,0.060787,-3.2e-05,,
1328,9758.0,Goldman Sachs Group Inc,11778.0,פנימי,אופציה לס אירו שקל GS C4.2 03/10/25,750000010.0,פנימי,"מט""ח","חו""ל",אירופה,Financial Services,"מט""ח",2025-10-03,לא,2025-04-03,EUR,גורם תלוי/פנימי,קיימת תלות,2025-09-30,4.2,1.0,-3112619.32,0.0001,3.8807,-0.012,4e-06,0.0,,
1328,9758.0,"בנק הפועלים בע""מ",520000118.0,ח.פ.,אופציה לס דולר שקל POALIM P3.6 06/10/25 SELL,750000056.0,פנימי,"מט""ח",ישראל,"ארה""ב",שירותים פיננסיים,"מט""ח",2025-10-06,לא,2025-06-04,USD,גורם תלוי/פנימי,קיימת תלות,2025-09-30,3.6,1.0,-9324847.23,8.8822,3.306,-2738.204,1.043224,-0.00053,,
1328,9758.0,"בנק לאומי לישראל בע""מ",520018078.0,ח.פ.,אופציה לס דולר שקל LEUMI P3.6 13/10/25 S,750000027.0,פנימי,"מט""ח",ישראל,"ארה""ב",שירותים פיננסיים,"מט""ח",2025-10-13,לא,2025-04-09,USD,גורם תלוי/פנימי,קיימת תלות,2025-09-30,3.6,1.0,-9324473.71,8.8731,3.306,-2735.278,1.042109,-0.00053,,
1328,9758.0,Goldman Sachs Group Inc,11778.0,פנימי,אופציה לס אירו שקל GS P3.9 03/10/25,750000011.0,פנימי,"מט""ח","חו""ל",אירופה,Financial Services,"מט""ח",2025-10-03,לא,2025-04-03,EUR,גורם תלוי/פנימי,קיימת תלות,2025-09-30,3.9,1.0,7781548.31,0.6786,3.8807,204.935,-0.078077,3.9e-05,,
1328,9758.0,Goldman Sachs Group Inc,11778.0,פנימי,אופציה לס אירו שקל GS P3.7 03/10/25,750000012.0,פנימי,"מט""ח","חו""ל",אירופה,Financial Services,"מט""ח",2025-10-03,לא,2025-04-03,EUR,גורם תלוי/פנימי,קיימת תלות,2025-09-30,3.7,1.0,-7781548.31,0.0001,3.8807,-0.008,2e-06,0.0,,
1328,9758.0,"בנק הפועלים בע""מ",520000118.0,ח.פ.,אופציה לס דולר שקל POALIM P3.5 06/10/25 BUY,750000057.0,פנימי,"מט""ח",ישראל,"ארה""ב",שירותים פיננסיים,"מט""ח",2025-10-06,לא,2025-06-04,USD,גורם תלוי/פנימי,קיימת תלות,2025-09-30,3.5,1.0,9324847.23,5.8625,3.306,1807.295,-0.688558,0.00035,,
1328,9758.0,"בנק דיסקונט לישראל בע""מ",520007030.0,ח.פ.,אופציה לס דולר שקל DISCOUNT P3.65 08/10/25 SELL,750000045.0,פנימי,"מט""ח",ישראל,"ארה""ב",שירותים פיננסיים,"מט""ח",2025-10-08,לא,2025-05-21,USD,גורם תלוי/פנימי,קיימת תלות,2025-09-30,3.65,1.0,-18649569.95,10.391,3.306,-6406.985,2.440987,-0.001241,,
1328,9758.0,"בנק דיסקונט לישראל בע""מ",520007030.0,ח.פ.,אופציה לס דולר שקל DISCOUNT C3.58 23/12/25 BUY,750000076.0,פנימי,"מט""ח",ישראל,"ארה""ב",שירותים פיננסיים,"מט""ח",2025-12-23,לא,2025-06-26,USD,גורם תלוי/פנימי,קיימת תלות,2025-09-30,3.58,1.0,4662548.12,0.1439,3.306,22.175,-0.008448,4e-06,,
1328,9758.0,"בנק לאומי לישראל בע""מ",520018078.0,ח.פ.,אופציה לס דולר שקל Leumi P3.6 13/10/25 L,750000041.0,פנימי,"מט""ח",ישראל,"ארה""ב",שירותים פיננסיים,"מט""ח",2025-10-13,לא,2025-05-08,USD,גורם תלוי/פנימי,קיימת תלות,2025-09-30,3.6,1.0,9324473.71,8.8777,3.306,2736.696,-1.042649,0.00053,,
1328,9758.0,"בנק הפועלים בע""מ",520000118.0,ח.פ.,אופציה לס דולר שקל POALIM C3.70 05/12/25 BUY,750000059.0,פנימי,"מט""ח",ישראל,"ארה""ב",שירותים פיננסיים,"מט""ח",2025-12-05,לא,2025-06-06,USD,גורם תלוי/פנימי,קיימת תלות,2025-09-30,3.7,1.0,9324847.23,0.0091,3.306,2.797,-0.001065,0.0,,
1328,9758.0,"בנק הפועלים בע""מ",520000118.0,ח.פ.,אופציה לס דולר שקל POALIM C3.6 05/12/25 BUY,750000099.0,פנימי,"מט""ח",ישראל,"ארה""ב",שירותים פיננסיים,"מט""ח",2025-12-05,לא,2025-05-14,USD,גורם תלוי/פנימי,קיימת תלות,2025-09-30,3.6,1.0,9324847.23,0.0815,3.306,25.121,-0.00957,4e-06,,
1328,9758.0,"בנק לאומי לישראל בע""מ",520018078.0,ח.פ.,אופציה לס דולר שקל LEUMI C3.73 01/12/25 BUY,750000053.0,פנימי,"מט""ח",ישראל,"ארה""ב",שירותים פיננסיים,"מט""ח",2025-12-01,לא,2025-05-29,USD,גורם תלוי/פנימי,קיימת תלות,2025-09-30,3.73,1.0,9293658.78,0.004,3.306,1.236,-0.00047,0.0,,
1328,9758.0,"בנק דיסקונט לישראל בע""מ",520007030.0,ח.פ.,אופציה לס דולר שקל DISCOUNT P3.55 08/10/25 BUY,750000046.0,פנימי,"מט""ח",ישראל,"ארה""ב",שירותים פיננסיים,"מט""ח",2025-10-08,לא,2025-05-21,USD,גורם תלוי/פנימי,קיימת תלות,2025-09-30,3.55,1.0,18649569.95,7.3726,3.306,4545.628,-1.731831,0.00088,,
1328,9758.0,"בנק לאומי לישראל בע""מ",520018078.0,ח.פ.,אופציה לס דולר שקל LEUMI C3.60 07/01/26 BUY,750000121.0,פנימי,"מט""ח",ישראל,"ארה""ב",שירותים פיננסיים,"מט""ח",2026-01-07,לא,2025-08-25,USD,גורם תלוי/פנימי,קיימת תלות,2025-09-30,3.6,1.0,13940488.18,0.1624,3.306,74.86,-0.02852,1.4e-05,,
1328,9758.0,"בנק לאומי לישראל בע""מ",520018078.0,ח.פ.,אופציה לס דולר שקל LEUMI C3.6 01/12/25 BUY,750000098.0,פנימי,"מט""ח",ישראל,"ארה""ב",שירותים פיננסיים,"מט""ח",2025-12-01,לא,2025-07-10,USD,גורם תלוי/פנימי,קיימת תלות,2025-09-30,3.6,1.0,9293658.78,0.0679,3.306,20.864,-0.007949,4e-06,,
1328,9758.0,"בנק דיסקונט לישראל בע""מ",520007030.0,ח.פ.,אופציה לס דולר שקל DISCOUNT P3.29 23/12/25 SELL,750000077.0,פנימי,"מט""ח",ישראל,"ארה""ב",שירותים פיננסיים,"מט""ח",2025-12-23,לא,2025-06-26,USD,גורם תלוי/פנימי,קיימת תלות,2025-09-30,3.29,1.0,-4662548.12,1.4861,3.306,-229.071,0.087273,-4.4e-05,,
1328,9758.0,"בנק דיסקונט לישראל בע""מ",520007030.0,ח.פ.,אופציה לס דולר שקל DISCOUNT C3.575 12/03/26 BUY,750000132.0,פנימי,"מט""ח",ישראל,"ארה""ב",שירותים פיננסיים,"מט""ח",2026-03-12,לא,2025-09-12,USD,גורם תלוי/פנימי,קיימת תלות,2025-09-30,3.575,1.0,9325407.5,0.5282,3.306,162.85,-0.062043,3.1e-05,,
1328,9758.0,"בנק דיסקונט לישראל בע""מ",520007030.0,ח.פ.,אופציה לס דולר שקל DISCOUNT C3.55 13/01/26 BUY,750000117.0,פנימי,"מט""ח",ישראל,"ארה""ב",שירותים פיננסיים,"מט""ח",2026-01-13,לא,2025-08-13,USD,גורם תלוי/פנימי,קיימת תלות,2025-09-30,3.55,1.0,9293658.78,0.2679,3.306,82.323,-0.031364,1.5e-05,,
1328,9758.0,"בנק דיסקונט לישראל בע""מ",520007030.0,ח.פ.,אופציה לס דולר שקל DISCOUNT P3.65 08/10/25,750000019.0,פנימי,"מט""ח",ישראל,"ארה""ב",שירותים פיננסיים,"מט""ח",2025-10-08,לא,2025-04-08,USD,גורם תלוי/פנימי,קיימת תלות,2025-09-30,3.65,1.0,18649569.95,10.394,3.306,6408.738,-2.441655,0.001241,,
1328,9758.0,"בנק הפועלים בע""מ",520000118.0,ח.פ.,אופציה לס דולר שקל POALIM P3.5 06/10/25,750000016.0,פנימי,"מט""ח",ישראל,"ארה""ב",שירותים פיננסיים,"מט""ח",2025-10-06,לא,2025-04-04,USD,גורם תלוי/פנימי,קיימת תלות,2025-09-30,3.5,1.0,-9324847.23,5.8612,3.306,-1806.894,0.688405,-0.00035,,
1328,9758.0,"בנק הפועלים בע""מ",520000118.0,ח.פ.,אופציה לס דולר שקל POALIM C3.59 26/03/26 BUY,750000145.0,פנימי,"מט""ח",ישראל,"ארה""ב",שירותים פיננסיים,"מט""ח",2026-03-26,לא,2025-09-26,USD,גורם תלוי/פנימי,קיימת תלות,2025-09-30,3.59,1.0,9325407.5,0.5462,3.306,168.389,-0.064154,3.2e-05,,
1328,9758.0,"בנק הפועלים בע""מ",520000118.0,ח.פ.,אופציה לס דולר שקל POALIM C3.5 05/12/25 BUY,750000095.0,פנימי,"מט""ח",ישראל,"ארה""ב",שירותים פיננסיים,"מט""ח",2025-12-05,לא,2025-07-10,USD,גורם תלוי/פנימי,קיימת תלות,2025-09-30,3.5,1.0,9324847.23,0.2323,3.306,71.606,-0.02728,1.3e-05,,
1328,9758.0,"בנק דיסקונט לישראל בע""מ",520007030.0,ח.פ.,אופציה לס דולר שקל DISCOUNT C3.29 23/12/25 SELL,750000094.0,פנימי,"מט""ח",ישראל,"ארה""ב",שירותים פיננסיים,"מט""ח",2025-12-23,לא,2025-07-10,USD,גורם תלוי/פנימי,קיימת תלות,2025-09-30,3.29,1.0,-4662548.12,2.0174,3.306,-310.964,0.118473,-6e-05,,
1328,9758.0,"בנק לאומי לישראל בע""מ",520018078.0,ח.פ.,אופציה לס דולר שקל LEUMI C3.73 01/12/25 SELL,750000097.0,פנימי,"מט""ח",ישראל,"ארה""ב",שירותים פיננסיים,"מט""ח",2025-12-01,לא,2025-07-10,USD,גורם תלוי/פנימי,קיימת תלות,2025-09-30,3.73,1.0,-9293658.78,0.0145,3.306,-4.452,0.001696,0.0,,
1328,9758.0,"בנק הפועלים בע""מ",520000118.0,ח.פ.,אופציה לס דולר שקל POALIM C3.7 05/12/25 SELL 15/07,750000100.0,פנימי,"מט""ח",ישראל,"ארה""ב",שירותים פיננסיים,"מט""ח",2025-12-05,לא,2025-05-14,USD,גורם תלוי/פנימי,קיימת תלות,2025-09-30,3.7,1.0,-9324847.23,0.0277,3.306,-8.542,0.003254,-1e-06,,
1328,9758.0,"בנק הפועלים בע""מ",520000118.0,ח.פ.,אופציה לס דולר שקל POALIM P3.25 26/03/26 SELL,750000146.0,פנימי,"מט""ח",ישראל,"ארה""ב",שירותים פיננסיים,"מט""ח",2026-03-26,לא,2025-09-26,USD,גורם תלוי/פנימי,קיימת תלות,2025-09-30,3.25,1.0,-4662703.75,1.582,3.306,-243.859,0.092907,-4.7e-05,,
1328,9758.0,"בנק דיסקונט לישראל בע""מ",520007030.0,ח.פ.,אופציה לס דולר שקל DISCOUNT C3.75 26/11/25 BUY,750000049.0,פנימי,"מט""ח",ישראל,"ארה""ב",שירותים פיננסיים,"מט""ח",2025-11-26,לא,2025-05-28,USD,גורם תלוי/פנימי,קיימת תלות,2025-09-30,3.75,1.0,9293658.78,0.0018,3.306,0.567,-0.000215,0.0,,
1328,9758.0,"בנק לאומי לישראל בע""מ",520018078.0,ח.פ.,אופציה לס דולר שקל LEUMI P3.7 13/10/25 L,750000029.0,פנימי,"מט""ח",ישראל,"ארה""ב",שירותים פיננסיים,"מט""ח",2025-10-13,לא,2025-04-09,USD,גורם תלוי/פנימי,קיימת תלות,2025-09-30,3.7,1.0,9324473.71,11.897,3.306,3667.651,-1.397332,0.00071,,
1328,9758.0,"בנק דיסקונט לישראל בע""מ",520007030.0,ח.פ.,אופציה לס דולר שקל DISCOUNT C3.4 26/11/25 SELL,750000116.0,פנימי,"מט""ח",ישראל,"ארה""ב",שירותים פיננסיים,"מט""ח",2025-11-26,לא,2025-08-13,USD,גורם תלוי/פנימי,קיימת תלות,2025-09-30,3.4,1.0,-4646829.39,0.4649,3.306,-71.426,0.027212,-1.3e-05,,
1328,9758.0,Goldman Sachs Group Inc,11778.0,פנימי,"אופציה לס GS C1,637.14 ESLT.TA 15/10/25 SELL",750000115.0,פנימי,מניה,ישראל,ישראל,Financial Services,מניות לרבות מדדי מניות,2025-10-15,לא,2025-08-12,ILS,גורם תלוי/פנימי,קיימת תלות,2025-09-30,1637.14,1.0,-1390.96,7692.5,1.0,-107.001,0.040766,-2e-05,,
1328,9758.0,"בנק לאומי לישראל בע""מ",520018078.0,ח.פ.,אופציה לס דולר שקל LEUMI C3.38 01/12/25 SELL,750000120.0,פנימי,"מט""ח",ישראל,"ארה""ב",שירותים פיננסיים,"מט""ח",2025-12-01,לא,2025-08-25,USD,גורם תלוי/פנימי,קיימת תלות,2025-09-30,3.38,1.0,-4646829.39,0.636,3.306,-97.7,0.037222,-1.8e-05,,
1328,9758.0,"בנק לאומי לישראל בע""מ",520018078.0,ח.פ.,אופציה לס דולר שקל LEUMI C3.39 05/12/25 SELL,750000124.0,פנימי,"מט""ח",ישראל,"ארה""ב",שירותים פיננסיים,"מט""ח",2025-12-05,לא,2025-09-02,USD,גורם תלוי/פנימי,קיימת תלות,2025-09-30,3.39,1.0,-4662423.61,0.6353,3.306,-97.92,0.037306,-1.8e-05,,
1328,9758.0,"בנק דיסקונט לישראל בע""מ",520007030.0,ח.פ.,אופציה לס דולר שקל DISCOUNT C3.6 24/03/26 BUY,750000141.0,פנימי,"מט""ח",ישראל,"ארה""ב",שירותים פיננסיים,"מט""ח",2026-03-24,לא,2025-09-22,USD,גורם תלוי/פנימי,קיימת תלות,2025-09-30,3.6,1.0,9325407.5,0.4815,3.306,148.433,-0.056551,2.8e-05,,
1328,9758.0,"בנק דיסקונט לישראל בע""מ",520007030.0,ח.פ.,אופציה לס דולר שקל DISCOUNT P3.55 08/10/25,750000020.0,פנימי,"מט""ח",ישראל,"ארה""ב",שירותים פיננסיים,"מט""ח",2025-10-08,לא,2025-04-08,USD,גורם תלוי/פנימי,קיימת תלות,2025-09-30,3.55,1.0,-18649569.95,7.3698,3.306,-4543.893,1.73117,-0.00088,,
1328,9758.0,"בנק לאומי לישראל בע""מ",520018078.0,ח.פ.,אופציה לס דולר שקל Leumi P3.7 13/10/25 S,750000040.0,פנימי,"מט""ח",ישראל,"ארה""ב",שירותים פיננסיים,"מט""ח",2025-10-13,לא,2025-05-08,USD,גורם תלוי/פנימי,קיימת תלות,2025-09-30,3.7,1.0,-9324473.71,11.893,3.306,-3666.215,1.396785,-0.00071,,
1328,9758.0,"בנק דיסקונט לישראל בע""מ",520007030.0,ח.פ.,אופציה לס דולר שקל DISCOUNT P3.4 26/11/25 SELL,750000048.0,פנימי,"מט""ח",ישראל,"ארה""ב",שירותים פיננסיים,"מט""ח",2025-11-26,לא,2025-05-28,USD,גורם תלוי/פנימי,קיימת תלות,2025-09-30,3.4,1.0,-4646829.39,3.267,3.306,-501.895,0.191216,-9.7e-05,,
1328,9758.0,"בנק לאומי לישראל בע""מ",520018078.0,ח.פ.,אופציה לס דולר שקל LEUMI P3.38 01/12/25 SELL,750000052.0,פנימי,"מט""ח",ישראל,"ארה""ב",שירותים פיננסיים,"מט""ח",2025-12-01,לא,2025-05-29,USD,גורם תלוי/פנימי,קיימת תלות,2025-09-30,3.38,1.0,-4646829.39,2.8466,3.306,-437.308,0.166609,-8.4e-05,,
1328,9758.0,"בנק לאומי לישראל בע""מ",520018078.0,ח.פ.,אופציה לס דולר שקל LEUMI C3.59 06/01/26 BUY,750000125.0,פנימי,"מט""ח",ישראל,"ארה""ב",שירותים פיננסיים,"מט""ח",2026-01-05,לא,2025-09-02,USD,גורם תלוי/פנימי,קיימת תלות,2025-09-30,3.59,1.0,13987270.84,0.1726,3.306,79.797,-0.030401,1.5e-05,,
1328,9758.0,"בנק הפועלים בע""מ",520000118.0,ח.פ.,אופציה לס דולר שקל POALIM P3.6 06/10/25,750000017.0,פנימי,"מט""ח",ישראל,"ארה""ב",שירותים פיננסיים,"מט""ח",2025-10-06,לא,2025-04-04,USD,גורם תלוי/פנימי,קיימת תלות,2025-09-30,3.6,1.0,9324847.23,8.8859,3.306,2739.332,-1.043654,0.00053,,
1328,9758.0,"בנק דיסקונט לישראל בע""מ",520007030.0,ח.פ.,אופציה לס דולר שקל DISCOUNT P3.21 12/03/26 SELL,750000133.0,פנימי,"מט""ח",ישראל,"ארה""ב",שירותים פיננסיים,"מט""ח",2026-03-12,לא,2025-09-12,USD,גורם תלוי/פנימי,קיימת תלות,2025-09-30,3.21,1.0,-4662703.75,1.0491,3.306,-161.712,0.06161,-3.1e-05,,
1328,9758.0,"בנק הפועלים בע""מ",520000118.0,ח.פ.,אופציה לס דולר שקל POALIM P3.39 05/12/25 SELL,750000058.0,פנימי,"מט""ח",ישראל,"ארה""ב",שירותים פיננסיים,"מט""ח",2025-12-05,לא,2025-06-06,USD,גורם תלוי/פנימי,קיימת תלות,2025-09-30,3.39,1.0,-4662423.61,3.1116,3.306,-479.624,0.182731,-9.2e-05,,
1328,9758.0,"בנק דיסקונט לישראל בע""מ",520007030.0,ח.פ.,אופציה לס דולר שקל DISCOUNT P3.25 24/03/26 SELL,750000142.0,פנימי,"מט""ח",ישראל,"ארה""ב",שירותים פיננסיים,"מט""ח",2026-03-24,לא,2025-09-22,USD,גורם תלוי/פנימי,קיימת תלות,2025-09-30,3.25,1.0,-4662703.75,1.5316,3.306,-236.101,0.089951,-4.5e-05,,
1328,9758.0,"בנק הפועלים בע""מ",520000118.0,ח.פ.,אופציה לס דולר שקל POALIM C3.7 05/12/25 SELL,750000096.0,פנימי,"מט""ח",ישראל,"ארה""ב",שירותים פיננסיים,"מט""ח",2025-12-05,לא,2025-07-10,USD,גורם תלוי/פנימי,קיימת תלות,2025-09-30,3.7,1.0,-9324847.23,0.0268,3.306,-8.252,0.003144,-1e-06,,
1328,9758.0,"Citibank, NA",70652.0,פנימי,אופציה לס דולר שקל CITI C3.38 18/12/25 SELL,750000091.0,פנימי,"מט""ח","חו""ל","ארה""ב",Financial Services,"מט""ח",2025-12-18,לא,2025-07-03,USD,גורם תלוי/פנימי,קיימת תלות,2025-09-30,3.38,1.0,-4040802.41,0.8985,3.306,-120.024,0.045727,-2.3e-05,,
1328,9758.0,"Citibank, NA",70652.0,פנימי,אופציה לס דולר שקל CITI P3.22 06/03/26 SELL,750000129.0,פנימי,"מט""ח","חו""ל","ארה""ב",Financial Services,"מט""ח",2026-03-06,לא,2025-09-09,USD,גורם תלוי/פנימי,קיימת תלות,2025-09-30,3.22,1.0,-4662470.3,1.1426,3.306,-176.129,0.067103,-3.4e-05,,
1328,9758.0,Goldman Sachs Group Inc,11778.0,פנימי,אופציה לס אירו שקל GS P3.9 03/10/25 SELL,750000085.0,פנימי,"מט""ח","חו""ל",אירופה,Financial Services,"מט""ח",2025-10-03,לא,2025-07-07,EUR,גורם תלוי/פנימי,קיימת תלות,2025-09-30,3.9,1.0,-1554130.82,0.6576,3.8807,-39.66,0.015109,-7e-06,,
1328,9758.0,Goldman Sachs Group Inc,11778.0,פנימי,אופציה לס אירו שקל GS P3.7 03/10/25 BUY,750000086.0,פנימי,"מט""ח","חו""ל",אירופה,Financial Services,"מט""ח",2025-10-03,לא,2025-07-01,EUR,גורם תלוי/פנימי,קיימת תלות,2025-09-30,3.7,1.0,7770654.14,0.0001,3.8807,0.008,-2e-06,0.0,,
1328,9758.0,"Citibank, NA",70652.0,פנימי,אופציה לס דולר שקל CITI C3.60 18/12/25 BUY,750000103.0,פנימי,"מט""ח","חו""ל","ארה""ב",Financial Services,"מט""ח",2025-12-18,לא,2025-07-16,USD,גורם תלוי/פנימי,קיימת תלות,2025-09-30,3.6,1.0,6838269.03,0.1201,3.306,27.162,-0.010348,5e-06,,
1328,9758.0,"Citibank, NA",70652.0,פנימי,אופציה לס דולר שקל CITI C3.62 18/12/25 BUY,750000092.0,פנימי,"מט""ח","חו""ל","ארה""ב",Financial Services,"מט""ח",2025-12-18,לא,2025-07-03,USD,גורם תלוי/פנימי,קיימת תלות,2025-09-30,3.62,1.0,12122407.23,0.0949,3.306,38.016,-0.014483,7e-06,,
1328,9758.0,"Citibank, NA",70652.0,פנימי,אופציה לס דולר שקל CITI C3.575 06/03/26 BUY,750000128.0,פנימי,"מט""ח","חו""ל","ארה""ב",Financial Services,"מט""ח",2026-03-06,לא,2025-09-09,USD,גורם תלוי/פנימי,קיימת תלות,2025-09-30,3.575,1.0,9324940.61,0.5176,3.306,159.559,-0.06079,3e-05,,
1328,9758.0,Goldman Sachs Group Inc,11778.0,פנימי,אופציה לס אירו שקל GS C4.2 03/10/25 BUY,750000122.0,פנימי,"מט""ח","חו""ל",אירופה,Financial Services,"מט""ח",2025-10-03,לא,2025-08-27,EUR,גורם תלוי/פנימי,קיימת תלות,2025-09-30,4.2,1.0,3112619.32,0.0001,3.8807,0.009,-3e-06,0.0,,
1328,9758.0,"Citibank, NA",70652.0,פנימי,אופציה לס דולר שקל CITI C3.75 18/12/25 SELL,750000102.0,פנימי,"מט""ח","חו""ל","ארה""ב",Financial Services,"מט""ח",2025-12-18,לא,2025-07-16,USD,גורם תלוי/פנימי,קיימת תלות,2025-09-30,3.75,1.0,-6838269.03,0.0287,3.306,-6.49,0.002472,-1e-06,,
1328,9758.0,"Citibank, NA",70652.0,פנימי,אופציה לס דולר שקל CITI C3.75 18/12/25 BUY,750000067.0,פנימי,"מט""ח","חו""ל","ארה""ב",Financial Services,"מט""ח",2025-12-18,לא,2025-06-17,USD,גורם תלוי/פנימי,קיימת תלות,2025-09-30,3.75,1.0,6838269.03,0.0299,3.306,6.756,-0.002574,1e-06,,
1328,9758.0,"Citibank, NA",70652.0,פנימי,אופציה לס דולר שקל CITI P3.38 18/12/25 SELL,750000066.0,פנימי,"מט""ח","חו""ל","ארה""ב",Financial Services,"מט""ח",2025-12-18,לא,2025-06-17,USD,גורם תלוי/פנימי,קיימת תלות,2025-09-30,3.38,1.0,-4040802.41,3.2367,3.306,-432.382,0.164732,-8.3e-05,,
1328,9758.0,Goldman Sachs Group Inc,11778.0,פנימי,אופציה לס אירו שקל GS P3.9 03/10/25 SELL,750000093.0,פנימי,"מט""ח","חו""ל",אירופה,Financial Services,"מט""ח",2025-10-03,לא,2025-07-01,EUR,גורם תלוי/פנימי,קיימת תלות,2025-09-30,3.9,1.0,-6225238.65,0.6604,3.8807,-159.553,0.060787,-3e-05,,
1328,9759.0,Goldman Sachs Group Inc,11778.0,פנימי,אופציה לס אירו שקל GS C4.2 03/10/25,750000010.0,פנימי,"מט""ח","חו""ל",אירופה,Financial Services,"מט""ח",2025-10-03,לא,2025-04-03,EUR,גורם תלוי/פנימי,קיימת תלות,2025-09-30,4.2,1.0,-678894.8,0.0001,3.8807,-0.003,4e-06,0.0,,
1328,9759.0,"בנק לאומי לישראל בע""מ",520018078.0,ח.פ.,אופציה לס דולר שקל LEUMI P3.6 13/10/25 S,750000027.0,פנימי,"מט""ח",ישראל,"ארה""ב",שירותים פיננסיים,"מט""ח",2025-10-13,לא,2025-04-09,USD,גורם תלוי/פנימי,קיימת תלות,2025-09-30,3.6,1.0,-2033765.17,8.8731,3.306,-596.593,1.042109,-0.000262,,
1328,9759.0,"בנק הפועלים בע""מ",520000118.0,ח.פ.,אופציה לס דולר שקל POALIM P3.6 06/10/25 SELL,750000056.0,פנימי,"מט""ח",ישראל,"ארה""ב",שירותים פיננסיים,"מט""ח",2025-10-06,לא,2025-06-04,USD,גורם תלוי/פנימי,קיימת תלות,2025-09-30,3.6,1.0,-2033846.64,8.8822,3.306,-597.231,1.043224,-0.000262,,
1328,9759.0,"בנק הפועלים בע""מ",520000118.0,ח.פ.,אופציה לס דולר שקל POALIM P3.5 06/10/25 BUY,750000057.0,פנימי,"מט""ח",ישראל,"ארה""ב",שירותים פיננסיים,"מט""ח",2025-10-06,לא,2025-06-04,USD,גורם תלוי/פנימי,קיימת תלות,2025-09-30,3.5,1.0,2033846.64,5.8625,3.306,394.19,-0.688558,0.000173,,
1328,9759.0,"בנק דיסקונט לישראל בע""מ",520007030.0,ח.פ.,אופציה לס דולר שקל DISCOUNT P3.65 08/10/25 SELL,750000045.0,פנימי,"מט""ח",ישראל,"ארה""ב",שירותים פיננסיים,"מט""ח",2025-10-08,לא,2025-05-21,USD,גורם תלוי/פנימי,קיימת תלות,2025-09-30,3.65,1.0,-4067666.13,10.391,3.306,-1397.43,2.440987,-0.000614,,
1328,9759.0,Goldman Sachs Group Inc,11778.0,פנימי,אופציה לס אירו שקל GS P3.7 03/10/25,750000012.0,פנימי,"מט""ח","חו""ל",אירופה,Financial Services,"מט""ח",2025-10-03,לא,2025-04-03,EUR,גורם תלוי/פנימי,קיימת תלות,2025-09-30,3.7,1.0,-1697237.01,0.0001,3.8807,-0.002,2e-06,0.0,,
1328,9759.0,Goldman Sachs Group Inc,11778.0,פנימי,אופציה לס אירו שקל GS P3.9 03/10/25,750000011.0,פנימי,"מט""ח","חו""ל",אירופה,Financial Services,"מט""ח",2025-10-03,לא,2025-04-03,EUR,גורם תלוי/פנימי,קיימת תלות,2025-09-30,3.9,1.0,1697237.01,0.6786,3.8807,44.698,-0.078077,1.9e-05,,
1328,9759.0,"בנק דיסקונט לישראל בע""מ",520007030.0,ח.פ.,אופציה לס דולר שקל DISCOUNT C3.58 23/12/25 BUY,750000076.0,פנימי,"מט""ח",ישראל,"ארה""ב",שירותים פיננסיים,"מט""ח",2025-12-23,לא,2025-06-26,USD,גורם תלוי/פנימי,קיימת תלות,2025-09-30,3.58,1.0,1016950.47,0.1439,3.306,4.837,-0.008448,2e-06,,
1328,9759.0,"בנק לאומי לישראל בע""מ",520018078.0,ח.פ.,אופציה לס דולר שקל Leumi P3.6 13/10/25 L,750000041.0,פנימי,"מט""ח",ישראל,"ארה""ב",שירותים פיננסיים,"מט""ח",2025-10-13,לא,2025-05-08,USD,גורם תלוי/פנימי,קיימת תלות,2025-09-30,3.6,1.0,2033765.17,8.8777,3.306,596.902,-1.042649,0.000262,,
1328,9759.0,"בנק דיסקונט לישראל בע""מ",520007030.0,ח.פ.,אופציה לס דולר שקל DISCOUNT P3.55 08/10/25 BUY,750000046.0,פנימי,"מט""ח",ישראל,"ארה""ב",שירותים פיננסיים,"מט""ח",2025-10-08,לא,2025-05-21,USD,גורם תלוי/פנימי,קיימת תלות,2025-09-30,3.55,1.0,4067666.13,7.3726,3.306,991.449,-1.731831,0.000436,,
1328,9759.0,"בנק הפועלים בע""מ",520000118.0,ח.פ.,אופציה לס דולר שקל POALIM C3.70 05/12/25 BUY,750000059.0,פנימי,"מט""ח",ישראל,"ארה""ב",שירותים פיננסיים,"מט""ח",2025-12-05,לא,2025-06-06,USD,גורם תלוי/פנימי,קיימת תלות,2025-09-30,3.7,1.0,2033846.64,0.0091,3.306,0.61,-0.001065,0.0,,
1328,9759.0,"בנק הפועלים בע""מ",520000118.0,ח.פ.,אופציה לס דולר שקל POALIM C3.6 05/12/25 BUY,750000099.0,פנימי,"מט""ח",ישראל,"ארה""ב",שירותים פיננסיים,"מט""ח",2025-12-05,לא,2025-05-14,USD,גורם תלוי/פנימי,קיימת תלות,2025-09-30,3.6,1.0,2033846.64,0.0815,3.306,5.479,-0.00957,2e-06,,
1328,9759.0,"בנק לאומי לישראל בע""מ",520018078.0,ח.פ.,אופציה לס דולר שקל LEUMI C3.73 01/12/25 BUY,750000053.0,פנימי,"מט""ח",ישראל,"ארה""ב",שירותים פיננסיים,"מט""ח",2025-12-01,לא,2025-05-29,USD,גורם תלוי/פנימי,קיימת תלות,2025-09-30,3.73,1.0,2027044.11,0.004,3.306,0.27,-0.00047,0.0,,
1328,9759.0,"בנק לאומי לישראל בע""מ",520018078.0,ח.פ.,אופציה לס דולר שקל LEUMI C3.6 01/12/25 BUY,750000098.0,פנימי,"מט""ח",ישראל,"ארה""ב",שירותים פיננסיים,"מט""ח",2025-12-01,לא,2025-07-10,USD,גורם תלוי/פנימי,קיימת תלות,2025-09-30,3.6,1.0,2027044.11,0.0679,3.306,4.551,-0.007949,2e-06,,
1328,9759.0,"בנק דיסקונט לישראל בע""מ",520007030.0,ח.פ.,אופציה לס דולר שקל DISCOUNT P3.29 23/12/25 SELL,750000077.0,פנימי,"מט""ח",ישראל,"ארה""ב",שירותים פיננסיים,"מט""ח",2025-12-23,לא,2025-06-26,USD,גורם תלוי/פנימי,קיימת תלות,2025-09-30,3.29,1.0,-1016950.47,1.4861,3.306,-49.963,0.087273,-2.1e-05,,
1328,9759.0,"בנק דיסקונט לישראל בע""מ",520007030.0,ח.פ.,אופציה לס דולר שקל DISCOUNT C3.575 12/03/26 BUY,750000132.0,פנימי,"מט""ח",ישראל,"ארה""ב",שירותים פיננסיים,"מט""ח",2026-03-12,לא,2025-09-12,USD,גורם תלוי/פנימי,קיימת תלות,2025-09-30,3.575,1.0,2033968.84,0.5282,3.306,35.519,-0.062043,1.5e-05,,
1328,9759.0,"בנק הפועלים בע""מ",520000118.0,ח.פ.,אופציה לס דולר שקל POALIM C3.59 26/03/26 BUY,750000145.0,פנימי,"מט""ח",ישראל,"ארה""ב",שירותים פיננסיים,"מט""ח",2026-03-26,לא,2025-09-26,USD,גורם תלוי/פנימי,קיימת תלות,2025-09-30,3.59,1.0,2033968.84,0.5462,3.306,36.727,-0.064154,1.6e-05,,
1328,9759.0,"בנק דיסקונט לישראל בע""מ",520007030.0,ח.פ.,אופציה לס דולר שקל DISCOUNT C3.55 13/01/26 BUY,750000117.0,פנימי,"מט""ח",ישראל,"ארה""ב",שירותים פיננסיים,"מט""ח",2026-01-13,לא,2025-08-13,USD,גורם תלוי/פנימי,קיימת תלות,2025-09-30,3.55,1.0,2027044.11,0.2679,3.306,17.956,-0.031364,7e-06,,
1328,9759.0,"בנק לאומי לישראל בע""מ",520018078.0,ח.פ.,אופציה לס דולר שקל LEUMI C3.60 07/01/26 BUY,750000121.0,פנימי,"מט""ח",ישראל,"ארה""ב",שירותים פיננסיים,"מט""ח",2026-01-07,לא,2025-08-25,USD,גורם תלוי/פנימי,קיימת תלות,2025-09-30,3.6,1.0,3040566.17,0.1624,3.306,16.328,-0.02852,7e-06,,
1328,9759.0,"בנק הפועלים בע""מ",520000118.0,ח.פ.,אופציה לס דולר שקל POALIM P3.25 26/03/26 SELL,750000146.0,פנימי,"מט""ח",ישראל,"ארה""ב",שירותים פיננסיים,"מט""ח",2026-03-26,לא,2025-09-26,USD,גורם תלוי/פנימי,קיימת תלות,2025-09-30,3.25,1.0,-1016984.42,1.582,3.306,-53.188,0.092907,-2.3e-05,,
1328,9759.0,"בנק לאומי לישראל בע""מ",520018078.0,ח.פ.,אופציה לס דולר שקל LEUMI C3.73 01/12/25 SELL,750000097.0,פנימי,"מט""ח",ישראל,"ארה""ב",שירותים פיננסיים,"מט""ח",2025-12-01,לא,2025-07-10,USD,גורם תלוי/פנימי,קיימת תלות,2025-09-30,3.73,1.0,-2027044.11,0.0145,3.306,-0.971,0.001696,0.0,,
1328,9759.0,"בנק הפועלים בע""מ",520000118.0,ח.פ.,אופציה לס דולר שקל POALIM C3.7 05/12/25 SELL 15/07,750000100.0,פנימי,"מט""ח",ישראל,"ארה""ב",שירותים פיננסיים,"מט""ח",2025-12-05,לא,2025-05-14,USD,גורם תלוי/פנימי,קיימת תלות,2025-09-30,3.7,1.0,-2033846.64,0.0277,3.306,-1.863,0.003254,0.0,,
1328,9759.0,"בנק דיסקונט לישראל בע""מ",520007030.0,ח.פ.,אופציה לס דולר שקל DISCOUNT C3.29 23/12/25 SELL,750000094.0,פנימי,"מט""ח",ישראל,"ארה""ב",שירותים פיננסיים,"מט""ח",2025-12-23,לא,2025-07-10,USD,גורם תלוי/פנימי,קיימת תלות,2025-09-30,3.29,1.0,-1016950.47,2.0174,3.306,-67.824,0.118473,-2.9e-05,,
1328,9759.0,"בנק הפועלים בע""מ",520000118.0,ח.פ.,אופציה לס דולר שקל POALIM C3.5 05/12/25 BUY,750000095.0,פנימי,"מט""ח",ישראל,"ארה""ב",שירותים פיננסיים,"מט""ח",2025-12-05,לא,2025-07-10,USD,גורם תלוי/פנימי,קיימת תלות,2025-09-30,3.5,1.0,2033846.64,0.2323,3.306,15.618,-0.02728,6e-06,,
1328,9759.0,"בנק הפועלים בע""מ",520000118.0,ח.פ.,אופציה לס דולר שקל POALIM P3.5 06/10/25,750000016.0,פנימי,"מט""ח",ישראל,"ארה""ב",שירותים פיננסיים,"מט""ח",2025-10-06,לא,2025-04-04,USD,גורם תלוי/פנימי,קיימת תלות,2025-09-30,3.5,1.0,-2033846.64,5.8612,3.306,-394.103,0.688405,-0.000173,,
1328,9759.0,"בנק דיסקונט לישראל בע""מ",520007030.0,ח.פ.,אופציה לס דולר שקל DISCOUNT P3.65 08/10/25,750000019.0,פנימי,"מט""ח",ישראל,"ארה""ב",שירותים פיננסיים,"מט""ח",2025-10-08,לא,2025-04-08,USD,גורם תלוי/פנימי,קיימת תלות,2025-09-30,3.65,1.0,4067666.13,10.394,3.306,1397.813,-2.441655,0.000614,,
1328,9759.0,"בנק לאומי לישראל בע""מ",520018078.0,ח.פ.,אופציה לס דולר שקל LEUMI P3.7 13/10/25 L,750000029.0,פנימי,"מט""ח",ישראל,"ארה""ב",שירותים פיננסיים,"מט""ח",2025-10-13,לא,2025-04-09,USD,גורם תלוי/פנימי,קיימת תלות,2025-09-30,3.7,1.0,2033765.17,11.897,3.306,799.953,-1.397332,0.000351,,
1328,9759.0,"בנק דיסקונט לישראל בע""מ",520007030.0,ח.פ.,אופציה לס דולר שקל DISCOUNT C3.4 26/11/25 SELL,750000116.0,פנימי,"מט""ח",ישראל,"ארה""ב",שירותים פיננסיים,"מט""ח",2025-11-26,לא,2025-08-13,USD,גורם תלוי/פנימי,קיימת תלות,2025-09-30,3.4,1.0,-1013522.05,0.4649,3.306,-15.579,0.027212,-6e-06,,
1328,9759.0,"בנק דיסקונט לישראל בע""מ",520007030.0,ח.פ.,אופציה לס דולר שקל DISCOUNT C3.75 26/11/25 BUY,750000049.0,פנימי,"מט""ח",ישראל,"ארה""ב",שירותים פיננסיים,"מט""ח",2025-11-26,לא,2025-05-28,USD,גורם תלוי/פנימי,קיימת תלות,2025-09-30,3.75,1.0,2027044.11,0.0018,3.306,0.124,-0.000215,0.0,,
1328,9759.0,"בנק דיסקונט לישראל בע""מ",520007030.0,ח.פ.,אופציה לס דולר שקל DISCOUNT C3.6 24/03/26 BUY,750000141.0,פנימי,"מט""ח",ישראל,"ארה""ב",שירותים פיננסיים,"מט""ח",2026-03-24,לא,2025-09-22,USD,גורם תלוי/פנימי,קיימת תלות,2025-09-30,3.6,1.0,2033968.84,0.4815,3.306,32.375,-0.056551,1.4e-05,,
1328,9759.0,"בנק לאומי לישראל בע""מ",520018078.0,ח.פ.,אופציה לס דולר שקל LEUMI C3.39 05/12/25 SELL,750000124.0,פנימי,"מט""ח",ישראל,"ארה""ב",שירותים פיננסיים,"מט""ח",2025-12-05,לא,2025-09-02,USD,גורם תלוי/פנימי,קיימת תלות,2025-09-30,3.39,1.0,-1016923.32,0.6353,3.306,-21.357,0.037306,-9e-06,,
1328,9759.0,"בנק לאומי לישראל בע""מ",520018078.0,ח.פ.,אופציה לס דולר שקל LEUMI C3.38 01/12/25 SELL,750000120.0,פנימי,"מט""ח",ישראל,"ארה""ב",שירותים פיננסיים,"מט""ח",2025-12-01,לא,2025-08-25,USD,גורם תלוי/פנימי,קיימת תלות,2025-09-30,3.38,1.0,-1013522.05,0.636,3.306,-21.309,0.037222,-9e-06,,
1328,9759.0,Goldman Sachs Group Inc,11778.0,פנימי,"אופציה לס GS C1,637.14 ESLT.TA 15/10/25 SELL",750000115.0,פנימי,מניה,ישראל,ישראל,Financial Services,מניות לרבות מדדי מניות,2025-10-15,לא,2025-08-12,ILS,גורם תלוי/פנימי,קיימת תלות,2025-09-30,1637.14,1.0,-303.38,7692.5,1.0,-23.338,0.040766,-1e-05,,
1328,9759.0,"בנק לאומי לישראל בע""מ",520018078.0,ח.פ.,אופציה לס דולר שקל LEUMI C3.59 06/01/26 BUY,750000125.0,פנימי,"מט""ח",ישראל,"ארה""ב",שירותים פיננסיים,"מט""ח",2026-01-05,לא,2025-09-02,USD,גורם תלוי/פנימי,קיימת תלות,2025-09-30,3.59,1.0,3050769.96,0.1726,3.306,17.405,-0.030401,7e-06,,
1328,9759.0,"בנק דיסקונט לישראל בע""מ",520007030.0,ח.פ.,אופציה לס דולר שקל DISCOUNT P3.4 26/11/25 SELL,750000048.0,פנימי,"מט""ח",ישראל,"ארה""ב",שירותים פיננסיים,"מט""ח",2025-11-26,לא,2025-05-28,USD,גורם תלוי/פנימי,קיימת תלות,2025-09-30,3.4,1.0,-1013522.05,3.267,3.306,-109.468,0.191216,-4.8e-05,,
1328,9759.0,"בנק לאומי לישראל בע""מ",520018078.0,ח.פ.,אופציה לס דולר שקל LEUMI P3.38 01/12/25 SELL,750000052.0,פנימי,"מט""ח",ישראל,"ארה""ב",שירותים פיננסיים,"מט""ח",2025-12-01,לא,2025-05-29,USD,גורם תלוי/פנימי,קיימת תלות,2025-09-30,3.38,1.0,-1013522.05,2.8466,3.306,-95.382,0.166609,-4.1e-05,,
1328,9759.0,"בנק דיסקונט לישראל בע""מ",520007030.0,ח.פ.,אופציה לס דולר שקל DISCOUNT P3.55 08/10/25,750000020.0,פנימי,"מט""ח",ישראל,"ארה""ב",שירותים פיננסיים,"מט""ח",2025-10-08,לא,2025-04-08,USD,גורם תלוי/פנימי,קיימת תלות,2025-09-30,3.55,1.0,-4067666.13,7.3698,3.306,-991.071,1.73117,-0.000436,,
1328,9759.0,"בנק לאומי לישראל בע""מ",520018078.0,ח.פ.,אופציה לס דולר שקל Leumi P3.7 13/10/25 S,750000040.0,פנימי,"מט""ח",ישראל,"ארה""ב",שירותים פיננסיים,"מט""ח",2025-10-13,לא,2025-05-08,USD,גורם תלוי/פנימי,קיימת תלות,2025-09-30,3.7,1.0,-2033765.17,11.893,3.306,-799.64,1.396785,-0.000351,,
1328,9759.0,"בנק דיסקונט לישראל בע""מ",520007030.0,ח.פ.,אופציה לס דולר שקל DISCOUNT P3.21 12/03/26 SELL,750000133.0,פנימי,"מט""ח",ישראל,"ארה""ב",שירותים פיננסיים,"מט""ח",2026-03-12,לא,2025-09-12,USD,גורם תלוי/פנימי,קיימת תלות,2025-09-30,3.21,1.0,-1016984.42,1.0491,3.306,-35.271,0.06161,-1.5e-05,,
1328,9759.0,"בנק הפועלים בע""מ",520000118.0,ח.פ.,אופציה לס דולר שקל POALIM P3.6 06/10/25,750000017.0,פנימי,"מט""ח",ישראל,"ארה""ב",שירותים פיננסיים,"מט""ח",2025-10-06,לא,2025-04-04,USD,גורם תלוי/פנימי,קיימת תלות,2025-09-30,3.6,1.0,2033846.64,8.8859,3.306,597.477,-1.043654,0.000262,,
1328,9759.0,"בנק דיסקונט לישראל בע""מ",520007030.0,ח.פ.,אופציה לס דולר שקל DISCOUNT P3.25 24/03/26 SELL,750000142.0,פנימי,"מט""ח",ישראל,"ארה""ב",שירותים פיננסיים,"מט""ח",2026-03-24,לא,2025-09-22,USD,גורם תלוי/פנימי,קיימת תלות,2025-09-30,3.25,1.0,-1016984.42,1.5316,3.306,-51.496,0.089951,-2.2e-05,,
1328,9759.0,"בנק הפועלים בע""מ",520000118.0,ח.פ.,אופציה לס דולר שקל POALIM C3.7 05/12/25 SELL,750000096.0,פנימי,"מט""ח",ישראל,"ארה""ב",שירותים פיננסיים,"מט""ח",2025-12-05,לא,2025-07-10,USD,גורם תלוי/פנימי,קיימת תלות,2025-09-30,3.7,1.0,-2033846.64,0.0268,3.306,-1.8,0.003144,0.0,,
1328,9759.0,"בנק הפועלים בע""מ",520000118.0,ח.פ.,אופציה לס דולר שקל POALIM P3.39 05/12/25 SELL,750000058.0,פנימי,"מט""ח",ישראל,"ארה""ב",שירותים פיננסיים,"מט""ח",2025-12-05,לא,2025-06-06,USD,גורם תלוי/פנימי,קיימת תלות,2025-09-30,3.39,1.0,-1016923.32,3.1116,3.306,-104.611,0.182731,-4.6e-05,,
1328,9759.0,"Citibank, NA",70652.0,פנימי,אופציה לס דולר שקל CITI C3.38 18/12/25 SELL,750000091.0,פנימי,"מט""ח","חו""ל","ארה""ב",Financial Services,"מט""ח",2025-12-18,לא,2025-07-03,USD,גורם תלוי/פנימי,קיימת תלות,2025-09-30,3.38,1.0,-881341.23,0.8985,3.306,-26.178,0.045727,-1.1e-05,,
1328,9759.0,"Citibank, NA",70652.0,פנימי,אופציה לס דולר שקל CITI P3.22 06/03/26 SELL,750000129.0,פנימי,"מט""ח","חו""ל","ארה""ב",Financial Services,"מט""ח",2026-03-06,לא,2025-09-09,USD,גורם תלוי/פנימי,קיימת תלות,2025-09-30,3.22,1.0,-1016933.5,1.1426,3.306,-38.416,0.067103,-1.6e-05,,
1328,9759.0,"Citibank, NA",70652.0,פנימי,אופציה לס דולר שקל CITI C3.60 18/12/25 BUY,750000103.0,פנימי,"מט""ח","חו""ל","ארה""ב",Financial Services,"מט""ח",2025-12-18,לא,2025-07-16,USD,גורם תלוי/פנימי,קיימת תלות,2025-09-30,3.6,1.0,1491497.94,0.1201,3.306,5.924,-0.010348,2e-06,,
1328,9759.0,Goldman Sachs Group Inc,11778.0,פנימי,אופציה לס אירו שקל GS P3.7 03/10/25 BUY,750000086.0,פנימי,"מט""ח","חו""ל",אירופה,Financial Services,"מט""ח",2025-10-03,לא,2025-07-01,EUR,גורם תלוי/פנימי,קיימת תלות,2025-09-30,3.7,1.0,1694860.88,0.0001,3.8807,0.002,-2e-06,0.0,,
1328,9759.0,"Citibank, NA",70652.0,פנימי,אופציה לס דולר שקל CITI C3.62 18/12/25 BUY,750000092.0,פנימי,"מט""ח","חו""ל","ארה""ב",Financial Services,"מט""ח",2025-12-18,לא,2025-07-03,USD,גורם תלוי/פנימי,קיימת תלות,2025-09-30,3.62,1.0,2644023.71,0.0949,3.306,8.292,-0.014483,3e-06,,
1328,9759.0,Goldman Sachs Group Inc,11778.0,פנימי,אופציה לס אירו שקל GS P3.9 03/10/25 SELL,750000085.0,פנימי,"מט""ח","חו""ל",אירופה,Financial Services,"מט""ח",2025-10-03,לא,2025-07-07,EUR,גורם תלוי/פנימי,קיימת תלות,2025-09-30,3.9,1.0,-338972.17,0.6576,3.8807,-8.65,0.015109,-3e-06,,
1328,9759.0,"Citibank, NA",70652.0,פנימי,אופציה לס דולר שקל CITI C3.575 06/03/26 BUY,750000128.0,פנימי,"מט""ח","חו""ל","ארה""ב",Financial Services,"מט""ח",2026-03-06,לא,2025-09-09,USD,גורם תלוי/פנימי,קיימת תלות,2025-09-30,3.575,1.0,2033867.0,0.5176,3.306,34.801,-0.06079,1.5e-05,,
1328,9759.0,Goldman Sachs Group Inc,11778.0,פנימי,אופציה לס אירו שקל GS C4.2 03/10/25 BUY,750000122.0,פנימי,"מט""ח","חו""ל",אירופה,Financial Services,"מט""ח",2025-10-03,לא,2025-08-27,EUR,גורם תלוי/פנימי,קיימת תלות,2025-09-30,4.2,1.0,678894.8,0.0001,3.8807,0.002,-3e-06,0.0,,
1328,9759.0,"Citibank, NA",70652.0,פנימי,אופציה לס דולר שקל CITI C3.75 18/12/25 SELL,750000102.0,פנימי,"מט""ח","חו""ל","ארה""ב",Financial Services,"מט""ח",2025-12-18,לא,2025-07-16,USD,גורם תלוי/פנימי,קיימת תלות,2025-09-30,3.75,1.0,-1491497.94,0.0287,3.306,-1.415,0.002472,0.0,,
1328,9759.0,Goldman Sachs Group Inc,11778.0,פנימי,אופציה לס אירו שקל GS P3.9 03/10/25 SELL,750000093.0,פנימי,"מט""ח","חו""ל",אירופה,Financial Services,"מט""ח",2025-10-03,לא,2025-07-01,EUR,גורם תלוי/פנימי,קיימת תלות,2025-09-30,3.9,1.0,-1357789.61,0.6604,3.8807,-34.8,0.060787,-1.5e-05,,
1328,9759.0,"Citibank, NA",70652.0,פנימי,אופציה לס דולר שקל CITI C3.75 18/12/25 BUY,750000067.0,פנימי,"מט""ח","חו""ל","ארה""ב",Financial Services,"מט""ח",2025-12-18,לא,2025-06-17,USD,גורם תלוי/פנימי,קיימת תלות,2025-09-30,3.75,1.0,1491497.94,0.0299,3.306,1.474,-0.002574,0.0,,
1328,9759.0,"Citibank, NA",70652.0,פנימי,אופציה לס דולר שקל CITI P3.38 18/12/25 SELL,750000066.0,פנימי,"מט""ח","חו""ל","ארה""ב",Financial Services,"מט""ח",2025-12-18,לא,2025-06-17,USD,גורם תלוי/פנימי,קיימת תלות,2025-09-30,3.38,1.0,-881341.23,3.2367,3.306,-94.307,0.164732,-4.1e-05,,
1328,9760.0,"בנק הפועלים בע""מ",520000118.0,ח.פ.,אופציה לס דולר שקל POALIM P3.6 06/10/25 SELL,750000056.0,פנימי,"מט""ח",ישראל,"ארה""ב",שירותים פיננסיים,"מט""ח",2025-10-06,לא,2025-06-04,USD,גורם תלוי/פנימי,קיימת תלות,2025-09-30,3.6,1.0,-528015.76,8.8822,3.306,-155.05,1.043224,-0.000528,,
1328,9760.0,"בנק דיסקונט לישראל בע""מ",520007030.0,ח.פ.,אופציה לס דולר שקל DISCOUNT P3.55 08/10/25 BUY,750000046.0,פנימי,"מט""ח",ישראל,"ארה""ב",שירותים פיננסיים,"מט""ח",2025-10-08,לא,2025-05-21,USD,גורם תלוי/פנימי,קיימת תלות,2025-09-30,3.55,1.0,1056024.47,7.3726,3.306,257.394,-1.731831,0.000876,,
1328,9760.0,"בנק לאומי לישראל בע""מ",520018078.0,ח.פ.,אופציה לס דולר שקל Leumi P3.6 13/10/25 L,750000041.0,פנימי,"מט""ח",ישראל,"ארה""ב",שירותים פיננסיים,"מט""ח",2025-10-13,לא,2025-05-08,USD,גורם תלוי/פנימי,קיימת תלות,2025-09-30,3.6,1.0,527994.61,8.8777,3.306,154.964,-1.042649,0.000527,,
1328,9760.0,"בנק דיסקונט לישראל בע""מ",520007030.0,ח.פ.,אופציה לס דולר שקל DISCOUNT C3.58 23/12/25 BUY,750000076.0,פנימי,"מט""ח",ישראל,"ארה""ב",שירותים פיננסיים,"מט""ח",2025-12-23,לא,2025-06-26,USD,גורם תלוי/פנימי,קיימת תלות,2025-09-30,3.58,1.0,264014.93,0.1439,3.306,1.256,-0.008448,4e-06,,
1328,9760.0,"בנק הפועלים בע""מ",520000118.0,ח.פ.,אופציה לס דולר שקל POALIM C3.6 05/12/25 BUY,750000099.0,פנימי,"מט""ח",ישראל,"ארה""ב",שירותים פיננסיים,"מט""ח",2025-12-05,לא,2025-05-14,USD,גורם תלוי/פנימי,קיימת תלות,2025-09-30,3.6,1.0,528015.76,0.0815,3.306,1.422,-0.00957,4e-06,,
1328,9760.0,"בנק לאומי לישראל בע""מ",520018078.0,ח.פ.,אופציה לס דולר שקל LEUMI C3.73 01/12/25 BUY,750000053.0,פנימי,"מט""ח",ישראל,"ארה""ב",שירותים פיננסיים,"מט""ח",2025-12-01,לא,2025-05-29,USD,גורם תלוי/פנימי,קיימת תלות,2025-09-30,3.73,1.0,526249.73,0.004,3.306,0.07,-0.00047,0.0,,
1328,9760.0,"בנק הפועלים בע""מ",520000118.0,ח.פ.,אופציה לס דולר שקל POALIM C3.70 05/12/25 BUY,750000059.0,פנימי,"מט""ח",ישראל,"ארה""ב",שירותים פיננסיים,"מט""ח",2025-12-05,לא,2025-06-06,USD,גורם תלוי/פנימי,קיימת תלות,2025-09-30,3.7,1.0,528015.76,0.0091,3.306,0.158,-0.001065,0.0,,
1328,9760.0,Goldman Sachs Group Inc,11778.0,פנימי,אופציה לס אירו שקל GS P3.9 03/10/25,750000011.0,פנימי,"מט""ח","חו""ל",אירופה,Financial Services,"מט""ח",2025-10-03,לא,2025-04-03,EUR,גורם תלוי/פנימי,קיימת תלות,2025-09-30,3.9,1.0,440627.07,0.6786,3.8807,11.604,-0.078077,3.9e-05,,
1328,9760.0,Goldman Sachs Group Inc,11778.0,פנימי,אופציה לס אירו שקל GS P3.7 03/10/25,750000012.0,פנימי,"מט""ח","חו""ל",אירופה,Financial Services,"מט""ח",2025-10-03,לא,2025-04-03,EUR,גורם תלוי/פנימי,קיימת תלות,2025-09-30,3.7,1.0,-440627.07,0.0001,3.8807,0.0,2e-06,0.0,,
1328,9760.0,"בנק דיסקונט לישראל בע""מ",520007030.0,ח.פ.,אופציה לס דולר שקל DISCOUNT P3.65 08/10/25 SELL,750000045.0,פנימי,"מט""ח",ישראל,"ארה""ב",שירותים פיננסיים,"מט""ח",2025-10-08,לא,2025-05-21,USD,גורם תלוי/פנימי,קיימת תלות,2025-09-30,3.65,1.0,-1056024.47,10.391,3.306,-362.793,2.440987,-0.001235,,
1328,9760.0,"בנק הפועלים בע""מ",520000118.0,ח.פ.,אופציה לס דולר שקל POALIM P3.5 06/10/25 BUY,750000057.0,פנימי,"מט""ח",ישראל,"ארה""ב",שירותים פיננסיים,"מט""ח",2025-10-06,לא,2025-06-04,USD,גורם תלוי/פנימי,קיימת תלות,2025-09-30,3.5,1.0,528015.76,5.8625,3.306,102.337,-0.688558,0.000348,,
1328,9760.0,"בנק לאומי לישראל בע""מ",520018078.0,ח.פ.,אופציה לס דולר שקל LEUMI P3.6 13/10/25 S,750000027.0,פנימי,"מט""ח",ישראל,"ארה""ב",שירותים פיננסיים,"מט""ח",2025-10-13,לא,2025-04-09,USD,גורם תלוי/פנימי,קיימת תלות,2025-09-30,3.6,1.0,-527994.61,8.8731,3.306,-154.884,1.042109,-0.000527,,
1328,9760.0,Goldman Sachs Group Inc,11778.0,פנימי,אופציה לס אירו שקל GS C4.2 03/10/25,750000010.0,פנימי,"מט""ח","חו""ל",אירופה,Financial Services,"מט""ח",2025-10-03,לא,2025-04-03,EUR,גורם תלוי/פנימי,קיימת תלות,2025-09-30,4.2,1.0,-176250.83,0.0001,3.8807,-0.001,4e-06,0.0,,
1328,9760.0,"בנק לאומי לישראל בע""מ",520018078.0,ח.פ.,אופציה לס דולר שקל LEUMI C3.6 01/12/25 BUY,750000098.0,פנימי,"מט""ח",ישראל,"ארה""ב",שירותים פיננסיים,"מט""ח",2025-12-01,לא,2025-07-10,USD,גורם תלוי/פנימי,קיימת תלות,2025-09-30,3.6,1.0,526249.73,0.0679,3.306,1.181,-0.007949,4e-06,,
1328,9760.0,"בנק לאומי לישראל בע""מ",520018078.0,ח.פ.,אופציה לס דולר שקל LEUMI C3.60 07/01/26 BUY,750000121.0,פנימי,"מט""ח",ישראל,"ארה""ב",שירותים פיננסיים,"מט""ח",2026-01-07,לא,2025-08-25,USD,גורם תלוי/פנימי,קיימת תלות,2025-09-30,3.6,1.0,789374.59,0.1624,3.306,4.239,-0.02852,1.4e-05,,
1328,9760.0,"בנק דיסקונט לישראל בע""מ",520007030.0,ח.פ.,אופציה לס דולר שקל DISCOUNT P3.29 23/12/25 SELL,750000077.0,פנימי,"מט""ח",ישראל,"ארה""ב",שירותים פיננסיים,"מט""ח",2025-12-23,לא,2025-06-26,USD,גורם תלוי/פנימי,קיימת תלות,2025-09-30,3.29,1.0,-264014.93,1.4861,3.306,-12.971,0.087273,-4.4e-05,,
1328,9760.0,"בנק דיסקונט לישראל בע""מ",520007030.0,ח.פ.,אופציה לס דולר שקל DISCOUNT C3.575 12/03/26 BUY,750000132.0,פנימי,"מט""ח",ישראל,"ארה""ב",שירותים פיננסיים,"מט""ח",2026-03-12,לא,2025-09-12,USD,גורם תלוי/פנימי,קיימת תלות,2025-09-30,3.575,1.0,528047.48,0.5282,3.306,9.221,-0.062043,3.1e-05,,
1328,9760.0,"בנק הפועלים בע""מ",520000118.0,ח.פ.,אופציה לס דולר שקל POALIM P3.5 06/10/25,750000016.0,פנימי,"מט""ח",ישראל,"ארה""ב",שירותים פיננסיים,"מט""ח",2025-10-06,לא,2025-04-04,USD,גורם תלוי/פנימי,קיימת תלות,2025-09-30,3.5,1.0,-528015.76,5.8612,3.306,-102.315,0.688405,-0.000348,,
1328,9760.0,"בנק דיסקונט לישראל בע""מ",520007030.0,ח.פ.,אופציה לס דולר שקל DISCOUNT C3.55 13/01/26 BUY,750000117.0,פנימי,"מט""ח",ישראל,"ארה""ב",שירותים פיננסיים,"מט""ח",2026-01-13,לא,2025-08-13,USD,גורם תלוי/פנימי,קיימת תלות,2025-09-30,3.55,1.0,526249.73,0.2679,3.306,4.662,-0.031364,1.5e-05,,
1328,9760.0,"בנק הפועלים בע""מ",520000118.0,ח.פ.,אופציה לס דולר שקל POALIM C3.59 26/03/26 BUY,750000145.0,פנימי,"מט""ח",ישראל,"ארה""ב",שירותים פיננסיים,"מט""ח",2026-03-26,לא,2025-09-26,USD,גורם תלוי/פנימי,קיימת תלות,2025-09-30,3.59,1.0,528047.48,0.5462,3.306,9.535,-0.064154,3.2e-05,,
1328,9760.0,"בנק דיסקונט לישראל בע""מ",520007030.0,ח.פ.,אופציה לס דולר שקל DISCOUNT C3.29 23/12/25 SELL,750000094.0,פנימי,"מט""ח",ישראל,"ארה""ב",שירותים פיננסיים,"מט""ח",2025-12-23,לא,2025-07-10,USD,גורם תלוי/פנימי,קיימת תלות,2025-09-30,3.29,1.0,-264014.93,2.0174,3.306,-17.608,0.118473,-5.9e-05,,
1328,9760.0,"בנק דיסקונט לישראל בע""מ",520007030.0,ח.פ.,אופציה לס דולר שקל DISCOUNT P3.65 08/10/25,750000019.0,פנימי,"מט""ח",ישראל,"ארה""ב",שירותים פיננסיים,"מט""ח",2025-10-08,לא,2025-04-08,USD,גורם תלוי/פנימי,קיימת תלות,2025-09-30,3.65,1.0,1056024.47,10.394,3.306,362.892,-2.441655,0.001236,,
1328,9760.0,"בנק הפועלים בע""מ",520000118.0,ח.פ.,אופציה לס דולר שקל POALIM C3.5 05/12/25 BUY,750000095.0,פנימי,"מט""ח",ישראל,"ארה""ב",שירותים פיננסיים,"מט""ח",2025-12-05,לא,2025-07-10,USD,גורם תלוי/פנימי,קיימת תלות,2025-09-30,3.5,1.0,528015.76,0.2323,3.306,4.055,-0.02728,1.3e-05,,
1328,9760.0,"בנק לאומי לישראל בע""מ",520018078.0,ח.פ.,אופציה לס דולר שקל LEUMI C3.73 01/12/25 SELL,750000097.0,פנימי,"מט""ח",ישראל,"ארה""ב",שירותים פיננסיים,"מט""ח",2025-12-01,לא,2025-07-10,USD,גורם תלוי/פנימי,קיימת תלות,2025-09-30,3.73,1.0,-526249.73,0.0145,3.306,-0.252,0.001696,0.0,,
1328,9760.0,"בנק הפועלים בע""מ",520000118.0,ח.פ.,אופציה לס דולר שקל POALIM C3.7 05/12/25 SELL 15/07,750000100.0,פנימי,"מט""ח",ישראל,"ארה""ב",שירותים פיננסיים,"מט""ח",2025-12-05,לא,2025-05-14,USD,גורם תלוי/פנימי,קיימת תלות,2025-09-30,3.7,1.0,-528015.76,0.0277,3.306,-0.484,0.003254,-1e-06,,
1328,9760.0,"בנק הפועלים בע""מ",520000118.0,ח.פ.,אופציה לס דולר שקל POALIM P3.25 26/03/26 SELL,750000146.0,פנימי,"מט""ח",ישראל,"ארה""ב",שירותים פיננסיים,"מט""ח",2026-03-26,לא,2025-09-26,USD,גורם תלוי/פנימי,קיימת תלות,2025-09-30,3.25,1.0,-264023.74,1.582,3.306,-13.808,0.092907,-4.7e-05,,
1328,9760.0,"בנק דיסקונט לישראל בע""מ",520007030.0,ח.פ.,אופציה לס דולר שקל DISCOUNT C3.4 26/11/25 SELL,750000116.0,פנימי,"מט""ח",ישראל,"ארה""ב",שירותים פיננסיים,"מט""ח",2025-11-26,לא,2025-08-13,USD,גורם תלוי/פנימי,קיימת תלות,2025-09-30,3.4,1.0,-263124.86,0.4649,3.306,-4.044,0.027212,-1.3e-05,,
1328,9760.0,"בנק דיסקונט לישראל בע""מ",520007030.0,ח.פ.,אופציה לס דולר שקל DISCOUNT C3.75 26/11/25 BUY,750000049.0,פנימי,"מט""ח",ישראל,"ארה""ב",שירותים פיננסיים,"מט""ח",2025-11-26,לא,2025-05-28,USD,גורם תלוי/פנימי,קיימת תלות,2025-09-30,3.75,1.0,526249.73,0.0018,3.306,0.032,-0.000215,0.0,,
1328,9760.0,"בנק לאומי לישראל בע""מ",520018078.0,ח.פ.,אופציה לס דולר שקל LEUMI P3.7 13/10/25 L,750000029.0,פנימי,"מט""ח",ישראל,"ארה""ב",שירותים פיננסיים,"מט""ח",2025-10-13,לא,2025-04-09,USD,גורם תלוי/פנימי,קיימת תלות,2025-09-30,3.7,1.0,527994.61,11.897,3.306,207.679,-1.397332,0.000707,,
1328,9760.0,Goldman Sachs Group Inc,11778.0,פנימי,"אופציה לס GS C1,637.14 ESLT.TA 15/10/25 SELL",750000115.0,פנימי,מניה,ישראל,ישראל,Financial Services,מניות לרבות מדדי מניות,2025-10-15,לא,2025-08-12,ILS,גורם תלוי/פנימי,קיימת תלות,2025-09-30,1637.14,1.0,-78.76,7692.5,1.0,-6.059,0.040766,-2e-05,,
1328,9760.0,"בנק לאומי לישראל בע""מ",520018078.0,ח.פ.,אופציה לס דולר שקל LEUMI C3.38 01/12/25 SELL,750000120.0,פנימי,"מט""ח",ישראל,"ארה""ב",שירותים פיננסיים,"מט""ח",2025-12-01,לא,2025-08-25,USD,גורם תלוי/פנימי,קיימת תלות,2025-09-30,3.38,1.0,-263124.86,0.636,3.306,-5.532,0.037222,-1.8e-05,,
1328,9760.0,"בנק לאומי לישראל בע""מ",520018078.0,ח.פ.,אופציה לס דולר שקל LEUMI C3.39 05/12/25 SELL,750000124.0,פנימי,"מט""ח",ישראל,"ארה""ב",שירותים פיננסיים,"מט""ח",2025-12-05,לא,2025-09-02,USD,גורם תלוי/פנימי,קיימת תלות,2025-09-30,3.39,1.0,-264007.88,0.6353,3.306,-5.545,0.037306,-1.8e-05,,
1328,9760.0,"בנק דיסקונט לישראל בע""מ",520007030.0,ח.פ.,אופציה לס דולר שקל DISCOUNT C3.6 24/03/26 BUY,750000141.0,פנימי,"מט""ח",ישראל,"ארה""ב",שירותים פיננסיים,"מט""ח",2026-03-24,לא,2025-09-22,USD,גורם תלוי/פנימי,קיימת תלות,2025-09-30,3.6,1.0,528047.48,0.4815,3.306,8.405,-0.056551,2.8e-05,,
1328,9760.0,"בנק דיסקונט לישראל בע""מ",520007030.0,ח.פ.,אופציה לס דולר שקל DISCOUNT P3.55 08/10/25,750000020.0,פנימי,"מט""ח",ישראל,"ארה""ב",שירותים פיננסיים,"מט""ח",2025-10-08,לא,2025-04-08,USD,גורם תלוי/פנימי,קיימת תלות,2025-09-30,3.55,1.0,-1056024.47,7.3698,3.306,-257.296,1.73117,-0.000876,,
1328,9760.0,"בנק לאומי לישראל בע""מ",520018078.0,ח.פ.,אופציה לס דולר שקל Leumi P3.7 13/10/25 S,750000040.0,פנימי,"מט""ח",ישראל,"ארה""ב",שירותים פיננסיים,"מט""ח",2025-10-13,לא,2025-05-08,USD,גורם תלוי/פנימי,קיימת תלות,2025-09-30,3.7,1.0,-527994.61,11.893,3.306,-207.598,1.396785,-0.000707,,
1328,9760.0,"בנק דיסקונט לישראל בע""מ",520007030.0,ח.פ.,אופציה לס דולר שקל DISCOUNT P3.4 26/11/25 SELL,750000048.0,פנימי,"מט""ח",ישראל,"ארה""ב",שירותים פיננסיים,"מט""ח",2025-11-26,לא,2025-05-28,USD,גורם תלוי/פנימי,קיימת תלות,2025-09-30,3.4,1.0,-263124.86,3.267,3.306,-28.42,0.191216,-9.6e-05,,
1328,9760.0,"בנק לאומי לישראל בע""מ",520018078.0,ח.פ.,אופציה לס דולר שקל LEUMI P3.38 01/12/25 SELL,750000052.0,פנימי,"מט""ח",ישראל,"ארה""ב",שירותים פיננסיים,"מט""ח",2025-12-01,לא,2025-05-29,USD,גורם תלוי/פנימי,קיימת תלות,2025-09-30,3.38,1.0,-263124.86,2.8466,3.306,-24.762,0.166609,-8.4e-05,,
1328,9760.0,"בנק לאומי לישראל בע""מ",520018078.0,ח.פ.,אופציה לס דולר שקל LEUMI C3.59 06/01/26 BUY,750000125.0,פנימי,"מט""ח",ישראל,"ארה""ב",שירותים פיננסיים,"מט""ח",2026-01-05,לא,2025-09-02,USD,גורם תלוי/פנימי,קיימת תלות,2025-09-30,3.59,1.0,792023.64,0.1726,3.306,4.518,-0.030401,1.5e-05,,
1328,9760.0,"בנק הפועלים בע""מ",520000118.0,ח.פ.,אופציה לס דולר שקל POALIM P3.6 06/10/25,750000017.0,פנימי,"מט""ח",ישראל,"ארה""ב",שירותים פיננסיים,"מט""ח",2025-10-06,לא,2025-04-04,USD,גורם תלוי/פנימי,קיימת תלות,2025-09-30,3.6,1.0,528015.76,8.8859,3.306,155.114,-1.043654,0.000528,,
1328,9760.0,"בנק דיסקונט לישראל בע""מ",520007030.0,ח.פ.,אופציה לס דולר שקל DISCOUNT P3.21 12/03/26 SELL,750000133.0,פנימי,"מט""ח",ישראל,"ארה""ב",שירותים פיננסיים,"מט""ח",2026-03-12,לא,2025-09-12,USD,גורם תלוי/פנימי,קיימת תלות,2025-09-30,3.21,1.0,-264023.74,1.0491,3.306,-9.157,0.06161,-3.1e-05,,
1328,9760.0,"בנק הפועלים בע""מ",520000118.0,ח.פ.,אופציה לס דולר שקל POALIM C3.7 05/12/25 SELL,750000096.0,פנימי,"מט""ח",ישראל,"ארה""ב",שירותים פיננסיים,"מט""ח",2025-12-05,לא,2025-07-10,USD,גורם תלוי/פנימי,קיימת תלות,2025-09-30,3.7,1.0,-528015.76,0.0268,3.306,-0.467,0.003144,-1e-06,,
1328,9760.0,"בנק דיסקונט לישראל בע""מ",520007030.0,ח.פ.,אופציה לס דולר שקל DISCOUNT P3.25 24/03/26 SELL,750000142.0,פנימי,"מט""ח",ישראל,"ארה""ב",שירותים פיננסיים,"מט""ח",2026-03-24,לא,2025-09-22,USD,גורם תלוי/פנימי,קיימת תלות,2025-09-30,3.25,1.0,-264023.74,1.5316,3.306,-13.369,0.089951,-4.5e-05,,
1328,9760.0,"בנק הפועלים בע""מ",520000118.0,ח.פ.,אופציה לס דולר שקל POALIM P3.39 05/12/25 SELL,750000058.0,פנימי,"מט""ח",ישראל,"ארה""ב",שירותים פיננסיים,"מט""ח",2025-12-05,לא,2025-06-06,USD,גורם תלוי/פנימי,קיימת תלות,2025-09-30,3.39,1.0,-264007.88,3.1116,3.306,-27.158,0.182731,-9.2e-05,,
1328,9760.0,"Citibank, NA",70652.0,פנימי,אופציה לס דולר שקל CITI C3.38 18/12/25 SELL,750000091.0,פנימי,"מט""ח","חו""ל","ארה""ב",Financial Services,"מט""ח",2025-12-18,לא,2025-07-03,USD,גורם תלוי/פנימי,קיימת תלות,2025-09-30,3.38,1.0,-228808.82,0.8985,3.306,-6.796,0.045727,-2.3e-05,,
1328,9760.0,"Citibank, NA",70652.0,פנימי,אופציה לס דולר שקל CITI P3.22 06/03/26 SELL,750000129.0,פנימי,"מט""ח","חו""ל","ארה""ב",Financial Services,"מט""ח",2026-03-06,לא,2025-09-09,USD,גורם תלוי/פנימי,קיימת תלות,2025-09-30,3.22,1.0,-264010.52,1.1426,3.306,-9.973,0.067103,-3.3e-05,,
1328,9760.0,"Citibank, NA",70652.0,פנימי,אופציה לס דולר שקל CITI C3.60 18/12/25 BUY,750000103.0,פנימי,"מט""ח","חו""ל","ארה""ב",Financial Services,"מט""ח",2025-12-18,לא,2025-07-16,USD,גורם תלוי/פנימי,קיימת תלות,2025-09-30,3.6,1.0,387214.26,0.1201,3.306,1.538,-0.010348,5e-06,,
1328,9760.0,Goldman Sachs Group Inc,11778.0,פנימי,אופציה לס אירו שקל GS P3.9 03/10/25 SELL,750000085.0,פנימי,"מט""ח","חו""ל",אירופה,Financial Services,"מט""ח",2025-10-03,לא,2025-07-07,EUR,גורם תלוי/פנימי,קיימת תלות,2025-09-30,3.9,1.0,-88002.03,0.6576,3.8807,-2.246,0.015109,-7e-06,,
1328,9760.0,Goldman Sachs Group Inc,11778.0,פנימי,אופציה לס אירו שקל GS P3.7 03/10/25 BUY,750000086.0,פנימי,"מט""ח","חו""ל",אירופה,Financial Services,"מט""ח",2025-10-03,לא,2025-07-01,EUR,גורם תלוי/פנימי,קיימת תלות,2025-09-30,3.7,1.0,440010.19,0.0001,3.8807,0.0,-2e-06,0.0,,
1328,9760.0,"Citibank, NA",70652.0,פנימי,אופציה לס דולר שקל CITI C3.62 18/12/25 BUY,750000092.0,פנימי,"מט""ח","חו""ל","ארה""ב",Financial Services,"מט""ח",2025-12-18,לא,2025-07-03,USD,גורם תלוי/פנימי,קיימת תלות,2025-09-30,3.62,1.0,686426.48,0.0949,3.306,2.153,-0.014483,7e-06,,
1328,9760.0,"Citibank, NA",70652.0,פנימי,אופציה לס דולר שקל CITI C3.575 06/03/26 BUY,750000128.0,פנימי,"מט""ח","חו""ל","ארה""ב",Financial Services,"מט""ח",2026-03-06,לא,2025-09-09,USD,גורם תלוי/פנימי,קיימת תלות,2025-09-30,3.575,1.0,528021.05,0.5176,3.306,9.035,-0.06079,3e-05,,
1328,9760.0,Goldman Sachs Group Inc,11778.0,פנימי,אופציה לס אירו שקל GS C4.2 03/10/25 BUY,750000122.0,פנימי,"מט""ח","חו""ל",אירופה,Financial Services,"מט""ח",2025-10-03,לא,2025-08-27,EUR,גורם תלוי/פנימי,קיימת תלות,2025-09-30,4.2,1.0,176250.83,0.0001,3.8807,0.001,-3e-06,0.0,,
1328,9760.0,"Citibank, NA",70652.0,פנימי,אופציה לס דולר שקל CITI C3.75 18/12/25 SELL,750000102.0,פנימי,"מט""ח","חו""ל","ארה""ב",Financial Services,"מט""ח",2025-12-18,לא,2025-07-16,USD,גורם תלוי/פנימי,קיימת תלות,2025-09-30,3.75,1.0,-387214.26,0.0287,3.306,-0.367,0.002472,-1e-06,,
1328,9760.0,Goldman Sachs Group Inc,11778.0,פנימי,אופציה לס אירו שקל GS P3.9 03/10/25 SELL,750000093.0,פנימי,"מט""ח","חו""ל",אירופה,Financial Services,"מט""ח",2025-10-03,לא,2025-07-01,EUR,גורם תלוי/פנימי,קיימת תלות,2025-09-30,3.9,1.0,-352501.66,0.6604,3.8807,-9.035,0.060787,-3e-05,,
1328,9760.0,"Citibank, NA",70652.0,פנימי,אופציה לס דולר שקל CITI C3.75 18/12/25 BUY,750000067.0,פנימי,"מט""ח","חו""ל","ארה""ב",Financial Services,"מט""ח",2025-12-18,לא,2025-06-17,USD,גורם תלוי/פנימי,קיימת תלות,2025-09-30,3.75,1.0,387214.26,0.0299,3.306,0.383,-0.002574,1e-06,,
1328,9760.0,"Citibank, NA",70652.0,פנימי,אופציה לס דולר שקל CITI P3.38 18/12/25 SELL,750000066.0,פנימי,"מט""ח","חו""ל","ארה""ב",Financial Services,"מט""ח",2025-12-18,לא,2025-06-17,USD,גורם תלוי/פנימי,קיימת תלות,2025-09-30,3.38,1.0,-228808.82,3.2367,3.306,-24.483,0.164732,-8.3e-05,,
1328,12138.0,"בנק דיסקונט לישראל בע""מ",520007030.0,ח.פ.,אופציה לס דולר שקל DISCOUNT C3.58 23/12/25 BUY,750000076.0,פנימי,"מט""ח",ישראל,"ארה""ב",שירותים פיננסיים,"מט""ח",2025-12-23,לא,2025-06-26,USD,גורם תלוי/פנימי,קיימת תלות,2025-09-30,3.58,1.0,765575.11,0.1439,3.306,3.641,-0.008448,1e-06,,
1328,12138.0,"בנק לאומי לישראל בע""מ",520018078.0,ח.פ.,אופציה לס דולר שקל Leumi P3.6 13/10/25 L,750000041.0,פנימי,"מט""ח",ישראל,"ארה""ב",שירותים פיננסיים,"מט""ח",2025-10-13,לא,2025-05-08,USD,גורם תלוי/פנימי,קיימת תלות,2025-09-30,3.6,1.0,1531048.01,8.8777,3.306,449.356,-1.042649,0.000157,,
1328,12138.0,"בנק הפועלים בע""מ",520000118.0,ח.פ.,אופציה לס דולר שקל POALIM C3.70 05/12/25 BUY,750000059.0,פנימי,"מט""ח",ישראל,"ארה""ב",שירותים פיננסיים,"מט""ח",2025-12-05,לא,2025-06-06,USD,גורם תלוי/פנימי,קיימת תלות,2025-09-30,3.7,1.0,1531109.34,0.0091,3.306,0.459,-0.001065,0.0,,
1328,12138.0,"בנק לאומי לישראל בע""מ",520018078.0,ח.פ.,אופציה לס דולר שקל LEUMI C3.73 01/12/25 BUY,750000053.0,פנימי,"מט""ח",ישראל,"ארה""ב",שירותים פיננסיים,"מט""ח",2025-12-01,לא,2025-05-29,USD,גורם תלוי/פנימי,קיימת תלות,2025-09-30,3.73,1.0,1525988.3,0.004,3.306,0.203,-0.00047,0.0,,
1328,12138.0,"בנק דיסקונט לישראל בע""מ",520007030.0,ח.פ.,אופציה לס דולר שקל DISCOUNT P3.55 08/10/25 BUY,750000046.0,פנימי,"מט""ח",ישראל,"ארה""ב",שירותים פיננסיים,"מט""ח",2025-10-08,לא,2025-05-21,USD,גורם תלוי/פנימי,קיימת תלות,2025-09-30,3.55,1.0,3062198.24,7.3726,3.306,746.377,-1.731831,0.000261,,
1328,12138.0,Goldman Sachs Group Inc,11778.0,פנימי,אופציה לס אירו שקל GS C4.2 03/10/25,750000010.0,פנימי,"מט""ח","חו""ל",אירופה,Financial Services,"מט""ח",2025-10-03,לא,2025-04-03,EUR,גורם תלוי/פנימי,קיימת תלות,2025-09-30,4.2,1.0,-511081.88,0.0001,3.8807,-0.002,4e-06,0.0,,
1328,12138.0,"בנק לאומי לישראל בע""מ",520018078.0,ח.פ.,אופציה לס דולר שקל LEUMI P3.6 13/10/25 S,750000027.0,פנימי,"מט""ח",ישראל,"ארה""ב",שירותים פיננסיים,"מט""ח",2025-10-13,לא,2025-04-09,USD,גורם תלוי/פנימי,קיימת תלות,2025-09-30,3.6,1.0,-1531048.01,8.8731,3.306,-449.124,1.042109,-0.000157,,
1328,12138.0,"בנק הפועלים בע""מ",520000118.0,ח.פ.,אופציה לס דולר שקל POALIM P3.6 06/10/25 SELL,750000056.0,פנימי,"מט""ח",ישראל,"ארה""ב",שירותים פיננסיים,"מט""ח",2025-10-06,לא,2025-06-04,USD,גורם תלוי/פנימי,קיימת תלות,2025-09-30,3.6,1.0,-1531109.34,8.8822,3.306,-449.604,1.043224,-0.000157,,
1328,12138.0,"בנק הפועלים בע""מ",520000118.0,ח.פ.,אופציה לס דולר שקל POALIM P3.5 06/10/25 BUY,750000057.0,פנימי,"מט""ח",ישראל,"ארה""ב",שירותים פיננסיים,"מט""ח",2025-10-06,לא,2025-06-04,USD,גורם תלוי/פנימי,קיימת תלות,2025-09-30,3.5,1.0,1531109.34,5.8625,3.306,296.752,-0.688558,0.000104,,
1328,12138.0,"בנק דיסקונט לישראל בע""מ",520007030.0,ח.פ.,אופציה לס דולר שקל DISCOUNT P3.65 08/10/25 SELL,750000045.0,פנימי,"מט""ח",ישראל,"ארה""ב",שירותים פיננסיים,"מט""ח",2025-10-08,לא,2025-05-21,USD,גורם תלוי/פנימי,קיימת תלות,2025-09-30,3.65,1.0,-3062198.24,10.391,3.306,-1052.006,2.440987,-0.000369,,
1328,12138.0,Goldman Sachs Group Inc,11778.0,פנימי,אופציה לס אירו שקל GS P3.7 03/10/25,750000012.0,פנימי,"מט""ח","חו""ל",אירופה,Financial Services,"מט""ח",2025-10-03,לא,2025-04-03,EUR,גורם תלוי/פנימי,קיימת תלות,2025-09-30,3.7,1.0,-1277704.72,0.0001,3.8807,-0.001,2e-06,0.0,,
1328,12138.0,Goldman Sachs Group Inc,11778.0,פנימי,אופציה לס אירו שקל GS P3.9 03/10/25,750000011.0,פנימי,"מט""ח","חו""ל",אירופה,Financial Services,"מט""ח",2025-10-03,לא,2025-04-03,EUR,גורם תלוי/פנימי,קיימת תלות,2025-09-30,3.9,1.0,1277704.72,0.6786,3.8807,33.65,-0.078077,1.1e-05,,
1328,12138.0,"בנק לאומי לישראל בע""מ",520018078.0,ח.פ.,אופציה לס דולר שקל LEUMI C3.60 07/01/26 BUY,750000121.0,פנימי,"מט""ח",ישראל,"ארה""ב",שירותים פיננסיים,"מט""ח",2026-01-07,לא,2025-08-25,USD,גורם תלוי/פנימי,קיימת תלות,2025-09-30,3.6,1.0,2288982.45,0.1624,3.306,12.292,-0.02852,4e-06,,
1328,12138.0,"בנק לאומי לישראל בע""מ",520018078.0,ח.פ.,אופציה לס דולר שקל LEUMI C3.6 01/12/25 BUY,750000098.0,פנימי,"מט""ח",ישראל,"ארה""ב",שירותים פיננסיים,"מט""ח",2025-12-01,לא,2025-07-10,USD,גורם תלוי/פנימי,קיימת תלות,2025-09-30,3.6,1.0,1525988.3,0.0679,3.306,3.426,-0.007949,1e-06,,
1328,12138.0,"בנק הפועלים בע""מ",520000118.0,ח.פ.,אופציה לס דולר שקל POALIM C3.6 05/12/25 BUY,750000099.0,פנימי,"מט""ח",ישראל,"ארה""ב",שירותים פיננסיים,"מט""ח",2025-12-05,לא,2025-05-14,USD,גורם תלוי/פנימי,קיימת תלות,2025-09-30,3.6,1.0,1531109.34,0.0815,3.306,4.125,-0.00957,1e-06,,
1328,12138.0,"בנק דיסקונט לישראל בע""מ",520007030.0,ח.פ.,אופציה לס דולר שקל DISCOUNT P3.29 23/12/25 SELL,750000077.0,פנימי,"מט""ח",ישראל,"ארה""ב",שירותים פיננסיים,"מט""ח",2025-12-23,לא,2025-06-26,USD,גורם תלוי/פנימי,קיימת תלות,2025-09-30,3.29,1.0,-765575.11,1.4861,3.306,-37.613,0.087273,-1.3e-05,,
1328,12138.0,"בנק דיסקונט לישראל בע""מ",520007030.0,ח.פ.,אופציה לס דולר שקל DISCOUNT C3.575 12/03/26 BUY,750000132.0,פנימי,"מט""ח",ישראל,"ארה""ב",שירותים פיננסיים,"מט""ח",2026-03-12,לא,2025-09-12,USD,גורם תלוי/פנימי,קיימת תלות,2025-09-30,3.575,1.0,1531201.33,0.5282,3.306,26.739,-0.062043,9e-06,,
1328,12138.0,"בנק דיסקונט לישראל בע""מ",520007030.0,ח.פ.,אופציה לס דולר שקל DISCOUNT C3.55 13/01/26 BUY,750000117.0,פנימי,"מט""ח",ישראל,"ארה""ב",שירותים פיננסיים,"מט""ח",2026-01-13,לא,2025-08-13,USD,גורם תלוי/פנימי,קיימת תלות,2025-09-30,3.55,1.0,1525988.3,0.2679,3.306,13.517,-0.031364,4e-06,,
1328,12138.0,"בנק לאומי לישראל בע""מ",520018078.0,ח.פ.,אופציה לס דולר שקל LEUMI P3.7 13/10/25 L,750000029.0,פנימי,"מט""ח",ישראל,"ארה""ב",שירותים פיננסיים,"מט""ח",2025-10-13,לא,2025-04-09,USD,גורם תלוי/פנימי,קיימת תלות,2025-09-30,3.7,1.0,1531048.01,11.897,3.306,602.216,-1.397332,0.000211,,
1328,12138.0,"בנק דיסקונט לישראל בע""מ",520007030.0,ח.פ.,אופציה לס דולר שקל DISCOUNT C3.4 26/11/25 SELL,750000116.0,פנימי,"מט""ח",ישראל,"ארה""ב",שירותים פיננסיים,"מט""ח",2025-11-26,לא,2025-08-13,USD,גורם תלוי/פנימי,קיימת תלות,2025-09-30,3.4,1.0,-762994.15,0.4649,3.306,-11.728,0.027212,-4e-06,,
1328,12138.0,"בנק הפועלים בע""מ",520000118.0,ח.פ.,אופציה לס דולר שקל POALIM P3.25 26/03/26 SELL,750000146.0,פנימי,"מט""ח",ישראל,"ארה""ב",שירותים פיננסיים,"מט""ח",2026-03-26,לא,2025-09-26,USD,גורם תלוי/פנימי,קיימת תלות,2025-09-30,3.25,1.0,-765600.66,1.582,3.306,-40.041,0.092907,-1.4e-05,,
1328,12138.0,"בנק לאומי לישראל בע""מ",520018078.0,ח.פ.,אופציה לס דולר שקל LEUMI C3.73 01/12/25 SELL,750000097.0,פנימי,"מט""ח",ישראל,"ארה""ב",שירותים פיננסיים,"מט""ח",2025-12-01,לא,2025-07-10,USD,גורם תלוי/פנימי,קיימת תלות,2025-09-30,3.73,1.0,-1525988.3,0.0145,3.306,-0.731,0.001696,0.0,,
1328,12138.0,"בנק הפועלים בע""מ",520000118.0,ח.פ.,אופציה לס דולר שקל POALIM C3.7 05/12/25 SELL 15/07,750000100.0,פנימי,"מט""ח",ישראל,"ארה""ב",שירותים פיננסיים,"מט""ח",2025-12-05,לא,2025-05-14,USD,גורם תלוי/פנימי,קיימת תלות,2025-09-30,3.7,1.0,-1531109.34,0.0277,3.306,-1.402,0.003254,0.0,,
1328,12138.0,"בנק דיסקונט לישראל בע""מ",520007030.0,ח.פ.,אופציה לס דולר שקל DISCOUNT P3.65 08/10/25,750000019.0,פנימי,"מט""ח",ישראל,"ארה""ב",שירותים פיננסיים,"מט""ח",2025-10-08,לא,2025-04-08,USD,גורם תלוי/פנימי,קיימת תלות,2025-09-30,3.65,1.0,3062198.24,10.394,3.306,1052.294,-2.441655,0.000369,,
1328,12138.0,"בנק דיסקונט לישראל בע""מ",520007030.0,ח.פ.,אופציה לס דולר שקל DISCOUNT C3.29 23/12/25 SELL,750000094.0,פנימי,"מט""ח",ישראל,"ארה""ב",שירותים פיננסיים,"מט""ח",2025-12-23,לא,2025-07-10,USD,גורם תלוי/פנימי,קיימת תלות,2025-09-30,3.29,1.0,-765575.11,2.0174,3.306,-51.059,0.118473,-1.7e-05,,
1328,12138.0,"בנק הפועלים בע""מ",520000118.0,ח.פ.,אופציה לס דולר שקל POALIM C3.5 05/12/25 BUY,750000095.0,פנימי,"מט""ח",ישראל,"ארה""ב",שירותים פיננסיים,"מט""ח",2025-12-05,לא,2025-07-10,USD,גורם תלוי/פנימי,קיימת תלות,2025-09-30,3.5,1.0,1531109.34,0.2323,3.306,11.757,-0.02728,4e-06,,
1328,12138.0,"בנק הפועלים בע""מ",520000118.0,ח.פ.,אופציה לס דולר שקל POALIM P3.5 06/10/25,750000016.0,פנימי,"מט""ח",ישראל,"ארה""ב",שירותים פיננסיים,"מט""ח",2025-10-06,לא,2025-04-04,USD,גורם תלוי/פנימי,קיימת תלות,2025-09-30,3.5,1.0,-1531109.34,5.8612,3.306,-296.686,0.688405,-0.000104,,
1328,12138.0,"בנק הפועלים בע""מ",520000118.0,ח.פ.,אופציה לס דולר שקל POALIM C3.59 26/03/26 BUY,750000145.0,פנימי,"מט""ח",ישראל,"ארה""ב",שירותים פיננסיים,"מט""ח",2026-03-26,לא,2025-09-26,USD,גורם תלוי/פנימי,קיימת תלות,2025-09-30,3.59,1.0,1531201.33,0.5462,3.306,27.649,-0.064154,9e-06,,
1328,12138.0,"בנק דיסקונט לישראל בע""מ",520007030.0,ח.פ.,אופציה לס דולר שקל DISCOUNT C3.75 26/11/25 BUY,750000049.0,פנימי,"מט""ח",ישראל,"ארה""ב",שירותים פיננסיים,"מט""ח",2025-11-26,לא,2025-05-28,USD,גורם תלוי/פנימי,קיימת תלות,2025-09-30,3.75,1.0,1525988.3,0.0018,3.306,0.093,-0.000215,0.0,,
1328,12138.0,Goldman Sachs Group Inc,11778.0,פנימי,"אופציה לס GS C1,637.14 ESLT.TA 15/10/25 SELL",750000115.0,פנימי,מניה,ישראל,ישראל,Financial Services,מניות לרבות מדדי מניות,2025-10-15,לא,2025-08-12,ILS,גורם תלוי/פנימי,קיימת תלות,2025-09-30,1637.14,1.0,-228.39,7692.5,1.0,-17.569,0.040766,-6e-06,,
1328,12138.0,"בנק דיסקונט לישראל בע""מ",520007030.0,ח.פ.,אופציה לס דולר שקל DISCOUNT C3.6 24/03/26 BUY,750000141.0,פנימי,"מט""ח",ישראל,"ארה""ב",שירותים פיננסיים,"מט""ח",2026-03-24,לא,2025-09-22,USD,גורם תלוי/פנימי,קיימת תלות,2025-09-30,3.6,1.0,1531201.33,0.4815,3.306,24.372,-0.056551,8e-06,,
1328,12138.0,"בנק לאומי לישראל בע""מ",520018078.0,ח.פ.,אופציה לס דולר שקל LEUMI C3.38 01/12/25 SELL,750000120.0,פנימי,"מט""ח",ישראל,"ארה""ב",שירותים פיננסיים,"מט""ח",2025-12-01,לא,2025-08-25,USD,גורם תלוי/פנימי,קיימת תלות,2025-09-30,3.38,1.0,-762994.15,0.636,3.306,-16.042,0.037222,-5e-06,,
1328,12138.0,"בנק לאומי לישראל בע""מ",520018078.0,ח.פ.,אופציה לס דולר שקל LEUMI C3.39 05/12/25 SELL,750000124.0,פנימי,"מט""ח",ישראל,"ארה""ב",שירותים פיננסיים,"מט""ח",2025-12-05,לא,2025-09-02,USD,גורם תלוי/פנימי,קיימת תלות,2025-09-30,3.39,1.0,-765554.67,0.6353,3.306,-16.078,0.037306,-5e-06,,
1328,12138.0,"בנק לאומי לישראל בע""מ",520018078.0,ח.פ.,אופציה לס דולר שקל LEUMI P3.38 01/12/25 SELL,750000052.0,פנימי,"מט""ח",ישראל,"ארה""ב",שירותים פיננסיים,"מט""ח",2025-12-01,לא,2025-05-29,USD,גורם תלוי/פנימי,קיימת תלות,2025-09-30,3.38,1.0,-762994.15,2.8466,3.306,-71.805,0.166609,-2.5e-05,,
1328,12138.0,"בנק דיסקונט לישראל בע""מ",520007030.0,ח.פ.,אופציה לס דולר שקל DISCOUNT P3.4 26/11/25 SELL,750000048.0,פנימי,"מט""ח",ישראל,"ארה""ב",שירותים פיננסיים,"מט""ח",2025-11-26,לא,2025-05-28,USD,גורם תלוי/פנימי,קיימת תלות,2025-09-30,3.4,1.0,-762994.15,3.267,3.306,-82.409,0.191216,-2.8e-05,,
1328,12138.0,"בנק לאומי לישראל בע""מ",520018078.0,ח.פ.,אופציה לס דולר שקל Leumi P3.7 13/10/25 S,750000040.0,פנימי,"מט""ח",ישראל,"ארה""ב",שירותים פיננסיים,"מט""ח",2025-10-13,לא,2025-05-08,USD,גורם תלוי/פנימי,קיימת תלות,2025-09-30,3.7,1.0,-1531048.01,11.893,3.306,-601.981,1.396785,-0.000211,,
1328,12138.0,"בנק דיסקונט לישראל בע""מ",520007030.0,ח.פ.,אופציה לס דולר שקל DISCOUNT P3.55 08/10/25,750000020.0,פנימי,"מט""ח",ישראל,"ארה""ב",שירותים פיננסיים,"מט""ח",2025-10-08,לא,2025-04-08,USD,גורם תלוי/פנימי,קיימת תלות,2025-09-30,3.55,1.0,-3062198.24,7.3698,3.306,-746.092,1.73117,-0.000261,,
1328,12138.0,"בנק לאומי לישראל בע""מ",520018078.0,ח.פ.,אופציה לס דולר שקל LEUMI C3.59 06/01/26 BUY,750000125.0,פנימי,"מט""ח",ישראל,"ארה""ב",שירותים פיננסיים,"מט""ח",2026-01-05,לא,2025-09-02,USD,גורם תלוי/פנימי,קיימת תלות,2025-09-30,3.59,1.0,2296664.01,0.1726,3.306,13.102,-0.030401,4e-06,,
1328,12138.0,"בנק דיסקונט לישראל בע""מ",520007030.0,ח.פ.,אופציה לס דולר שקל DISCOUNT P3.21 12/03/26 SELL,750000133.0,פנימי,"מט""ח",ישראל,"ארה""ב",שירותים פיננסיים,"מט""ח",2026-03-12,לא,2025-09-12,USD,גורם תלוי/פנימי,קיימת תלות,2025-09-30,3.21,1.0,-765600.66,1.0491,3.306,-26.553,0.06161,-9e-06,,
1328,12138.0,"בנק הפועלים בע""מ",520000118.0,ח.פ.,אופציה לס דולר שקל POALIM P3.6 06/10/25,750000017.0,פנימי,"מט""ח",ישראל,"ארה""ב",שירותים פיננסיים,"מט""ח",2025-10-06,לא,2025-04-04,USD,גורם תלוי/פנימי,קיימת תלות,2025-09-30,3.6,1.0,1531109.34,8.8859,3.306,449.789,-1.043654,0.000157,,
1328,12138.0,"בנק הפועלים בע""מ",520000118.0,ח.פ.,אופציה לס דולר שקל POALIM C3.7 05/12/25 SELL,750000096.0,פנימי,"מט""ח",ישראל,"ארה""ב",שירותים פיננסיים,"מט""ח",2025-12-05,לא,2025-07-10,USD,גורם תלוי/פנימי,קיימת תלות,2025-09-30,3.7,1.0,-1531109.34,0.0268,3.306,-1.355,0.003144,0.0,,
1328,12138.0,"בנק הפועלים בע""מ",520000118.0,ח.פ.,אופציה לס דולר שקל POALIM P3.39 05/12/25 SELL,750000058.0,פנימי,"מט""ח",ישראל,"ארה""ב",שירותים פיננסיים,"מט""ח",2025-12-05,לא,2025-06-06,USD,גורם תלוי/פנימי,קיימת תלות,2025-09-30,3.39,1.0,-765554.67,3.1116,3.306,-78.753,0.182731,-2.7e-05,,
1328,12138.0,"בנק דיסקונט לישראל בע""מ",520007030.0,ח.פ.,אופציה לס דולר שקל DISCOUNT P3.25 24/03/26 SELL,750000142.0,פנימי,"מט""ח",ישראל,"ארה""ב",שירותים פיננסיים,"מט""ח",2026-03-24,לא,2025-09-22,USD,גורם תלוי/פנימי,קיימת תלות,2025-09-30,3.25,1.0,-765600.66,1.5316,3.306,-38.767,0.089951,-1.3e-05,,
1328,12138.0,"Citibank, NA",70652.0,פנימי,אופציה לס דולר שקל CITI C3.38 18/12/25 SELL,750000091.0,פנימי,"מט""ח","חו""ל","ארה""ב",Financial Services,"מט""ח",2025-12-18,לא,2025-07-03,USD,גורם תלוי/פנימי,קיימת תלות,2025-09-30,3.38,1.0,-663486.5,0.8985,3.306,-19.708,0.045727,-6e-06,,
1328,12138.0,"Citibank, NA",70652.0,פנימי,אופציה לס דולר שקל CITI P3.22 06/03/26 SELL,750000129.0,פנימי,"מט""ח","חו""ל","ארה""ב",Financial Services,"מט""ח",2026-03-06,לא,2025-09-09,USD,גורם תלוי/פנימי,קיימת תלות,2025-09-30,3.22,1.0,-765562.33,1.1426,3.306,-28.92,0.067103,-1e-05,,
1328,12138.0,"Citibank, NA",70652.0,פנימי,אופציה לס דולר שקל CITI C3.60 18/12/25 BUY,750000103.0,פנימי,"מט""ח","חו""ל","ארה""ב",Financial Services,"מט""ח",2025-12-18,לא,2025-07-16,USD,גורם תלוי/פנימי,קיימת תלות,2025-09-30,3.6,1.0,1122821.35,0.1201,3.306,4.46,-0.010348,1e-06,,
1328,12138.0,"Citibank, NA",70652.0,פנימי,אופציה לס דולר שקל CITI C3.62 18/12/25 BUY,750000092.0,פנימי,"מט""ח","חו""ל","ארה""ב",Financial Services,"מט""ח",2025-12-18,לא,2025-07-03,USD,גורם תלוי/פנימי,קיימת תלות,2025-09-30,3.62,1.0,1990459.52,0.0949,3.306,6.242,-0.014483,2e-06,,
1328,12138.0,Goldman Sachs Group Inc,11778.0,פנימי,אופציה לס אירו שקל GS P3.9 03/10/25 SELL,750000085.0,פנימי,"מט""ח","חו""ל",אירופה,Financial Services,"מט""ח",2025-10-03,לא,2025-07-07,EUR,גורם תלוי/פנימי,קיימת תלות,2025-09-30,3.9,1.0,-255183.18,0.6576,3.8807,-6.512,0.015109,-2e-06,,
1328,12138.0,Goldman Sachs Group Inc,11778.0,פנימי,אופציה לס אירו שקל GS P3.7 03/10/25 BUY,750000086.0,פנימי,"מט""ח","חו""ל",אירופה,Financial Services,"מט""ח",2025-10-03,לא,2025-07-01,EUR,גורם תלוי/פנימי,קיימת תלות,2025-09-30,3.7,1.0,1275915.93,0.0001,3.8807,0.001,-2e-06,0.0,,
1328,12138.0,"Citibank, NA",70652.0,פנימי,אופציה לס דולר שקל CITI C3.575 06/03/26 BUY,750000128.0,פנימי,"מט""ח","חו""ל","ארה""ב",Financial Services,"מט""ח",2026-03-06,לא,2025-09-09,USD,גורם תלוי/פנימי,קיימת תלות,2025-09-30,3.575,1.0,1531124.67,0.5176,3.306,26.199,-0.06079,9e-06,,
1328,12138.0,Goldman Sachs Group Inc,11778.0,פנימי,אופציה לס אירו שקל GS C4.2 03/10/25 BUY,750000122.0,פנימי,"מט""ח","חו""ל",אירופה,Financial Services,"מט""ח",2025-10-03,לא,2025-08-27,EUR,גורם תלוי/פנימי,קיימת תלות,2025-09-30,4.2,1.0,511081.88,0.0001,3.8807,0.002,-3e-06,0.0,,
1328,12138.0,"Citibank, NA",70652.0,פנימי,אופציה לס דולר שקל CITI C3.75 18/12/25 SELL,750000102.0,פנימי,"מט""ח","חו""ל","ארה""ב",Financial Services,"מט""ח",2025-12-18,לא,2025-07-16,USD,גורם תלוי/פנימי,קיימת תלות,2025-09-30,3.75,1.0,-1122821.35,0.0287,3.306,-1.066,0.002472,0.0,,
1328,12138.0,Goldman Sachs Group Inc,11778.0,פנימי,אופציה לס אירו שקל GS P3.9 03/10/25 SELL,750000093.0,פנימי,"מט""ח","חו""ל",אירופה,Financial Services,"מט""ח",2025-10-03,לא,2025-07-01,EUR,גורם תלוי/פנימי,קיימת תלות,2025-09-30,3.9,1.0,-1022163.77,0.6604,3.8807,-26.198,0.060787,-9e-06,,
1328,12138.0,"Citibank, NA",70652.0,פנימי,אופציה לס דולר שקל CITI C3.75 18/12/25 BUY,750000067.0,פנימי,"מט""ח","חו""ל","ארה""ב",Financial Services,"מט""ח",2025-12-18,לא,2025-06-17,USD,גורם תלוי/פנימי,קיימת תלות,2025-09-30,3.75,1.0,1122821.35,0.0299,3.306,1.109,-0.002574,0.0,,
1328,12138.0,"Citibank, NA",70652.0,פנימי,אופציה לס דולר שקל CITI P3.38 18/12/25 SELL,750000066.0,פנימי,"מט""ח","חו""ל","ארה""ב",Financial Services,"מט""ח",2025-12-18,לא,2025-06-17,USD,גורם תלוי/פנימי,קיימת תלות,2025-09-30,3.38,1.0,-663486.5,3.2367,3.306,-70.996,0.164732,-2.4e-05,,
1328,12419.0,"בנק דיסקונט לישראל בע""מ",520007030.0,ח.פ.,אופציה לס דולר שקל DISCOUNT C3.58 23/12/25 BUY,750000076.0,פנימי,"מט""ח",ישראל,"ארה""ב",שירותים פיננסיים,"מט""ח",2025-12-23,לא,2025-06-26,USD,גורם תלוי/פנימי,קיימת תלות,2025-09-30,3.58,1.0,5377754.95,0.1439,3.306,25.577,-0.008448,6e-06,,
1328,12419.0,"בנק לאומי לישראל בע""מ",520018078.0,ח.פ.,אופציה לס דולר שקל Leumi P3.6 13/10/25 L,750000041.0,פנימי,"מט""ח",ישראל,"ארה""ב",שירותים פיננסיים,"מט""ח",2025-10-13,לא,2025-05-08,USD,גורם תלוי/פנימי,קיימת תלות,2025-09-30,3.6,1.0,10754791.89,8.8777,3.306,3156.488,-1.042649,0.000768,,
1328,12419.0,"בנק דיסקונט לישראל בע""מ",520007030.0,ח.פ.,אופציה לס דולר שקל DISCOUNT P3.55 08/10/25 BUY,750000046.0,פנימי,"מט""ח",ישראל,"ארה""ב",שירותים פיננסיים,"מט""ח",2025-10-08,לא,2025-05-21,USD,גורם תלוי/פנימי,קיימת תלות,2025-09-30,3.55,1.0,21510301.8,7.3726,3.306,5242.899,-1.731831,0.001277,,
1328,12419.0,"בנק לאומי לישראל בע""מ",520018078.0,ח.פ.,אופציה לס דולר שקל LEUMI C3.73 01/12/25 BUY,750000053.0,פנימי,"מט""ח",ישראל,"ארה""ב",שירותים פיננסיים,"מט""ח",2025-12-01,לא,2025-05-29,USD,גורם תלוי/פנימי,קיימת תלות,2025-09-30,3.73,1.0,10719250.14,0.004,3.306,1.426,-0.00047,0.0,,
1328,12419.0,"בנק הפועלים בע""מ",520000118.0,ח.פ.,אופציה לס דולר שקל POALIM C3.70 05/12/25 BUY,750000059.0,פנימי,"מט""ח",ישראל,"ארה""ב",שירותים פיננסיים,"מט""ח",2025-12-05,לא,2025-06-06,USD,גורם תלוי/פנימי,קיימת תלות,2025-09-30,3.7,1.0,10755222.7,0.0091,3.306,3.227,-0.001065,0.0,,
1328,12419.0,"בנק הפועלים בע""מ",520000118.0,ח.פ.,אופציה לס דולר שקל POALIM P3.5 06/10/25 BUY,750000057.0,פנימי,"מט""ח",ישראל,"ארה""ב",שירותים פיננסיים,"מט""ח",2025-10-06,לא,2025-06-04,USD,גורם תלוי/פנימי,קיימת תלות,2025-09-30,3.5,1.0,10755222.7,5.8625,3.306,2084.523,-0.688558,0.000507,,
1328,12419.0,"בנק הפועלים בע""מ",520000118.0,ח.פ.,אופציה לס דולר שקל POALIM P3.6 06/10/25 SELL,750000056.0,פנימי,"מט""ח",ישראל,"ארה""ב",שירותים פיננסיים,"מט""ח",2025-10-06,לא,2025-06-04,USD,גורם תלוי/פנימי,קיימת תלות,2025-09-30,3.6,1.0,-10755222.7,8.8822,3.306,-3158.228,1.043224,-0.000769,,
1328,12419.0,Goldman Sachs Group Inc,11778.0,פנימי,אופציה לס אירו שקל GS C4.2 03/10/25,750000010.0,פנימי,"מט""ח","חו""ל",אירופה,Financial Services,"מט""ח",2025-10-03,לא,2025-04-03,EUR,גורם תלוי/פנימי,קיימת תלות,2025-09-30,4.2,1.0,-3590076.4,0.0001,3.8807,-0.014,4e-06,0.0,,
1328,12419.0,"בנק לאומי לישראל בע""מ",520018078.0,ח.פ.,אופציה לס דולר שקל LEUMI P3.6 13/10/25 S,750000027.0,פנימי,"מט""ח",ישראל,"ארה""ב",שירותים פיננסיים,"מט""ח",2025-10-13,לא,2025-04-09,USD,גורם תלוי/פנימי,קיימת תלות,2025-09-30,3.6,1.0,-10754791.89,8.8731,3.306,-3154.854,1.042109,-0.000768,,
1328,12419.0,Goldman Sachs Group Inc,11778.0,פנימי,אופציה לס אירו שקל GS P3.9 03/10/25,750000011.0,פנימי,"מט""ח","חו""ל",אירופה,Financial Services,"מט""ח",2025-10-03,לא,2025-04-03,EUR,גורם תלוי/פנימי,קיימת תלות,2025-09-30,3.9,1.0,8975191.02,0.6786,3.8807,236.371,-0.078077,5.7e-05,,
1328,12419.0,Goldman Sachs Group Inc,11778.0,פנימי,אופציה לס אירו שקל GS P3.7 03/10/25,750000012.0,פנימי,"מט""ח","חו""ל",אירופה,Financial Services,"מט""ח",2025-10-03,לא,2025-04-03,EUR,גורם תלוי/פנימי,קיימת תלות,2025-09-30,3.7,1.0,-8975191.02,0.0001,3.8807,-0.009,2e-06,0.0,,
1328,12419.0,"בנק דיסקונט לישראל בע""מ",520007030.0,ח.פ.,אופציה לס דולר שקל DISCOUNT P3.65 08/10/25 SELL,750000045.0,פנימי,"מט""ח",ישראל,"ארה""ב",שירותים פיננסיים,"מט""ח",2025-10-08,לא,2025-05-21,USD,גורם תלוי/פנימי,קיימת תלות,2025-09-30,3.65,1.0,-21510301.8,10.391,3.306,-7389.778,2.440987,-0.0018,,
1328,12419.0,"בנק הפועלים בע""מ",520000118.0,ח.פ.,אופציה לס דולר שקל POALIM C3.6 05/12/25 BUY,750000099.0,פנימי,"מט""ח",ישראל,"ארה""ב",שירותים פיננסיים,"מט""ח",2025-12-05,לא,2025-05-14,USD,גורם תלוי/פנימי,קיימת תלות,2025-09-30,3.6,1.0,10755222.7,0.0815,3.306,28.975,-0.00957,7e-06,,
1328,12419.0,"בנק דיסקונט לישראל בע""מ",520007030.0,ח.פ.,אופציה לס דולר שקל DISCOUNT P3.29 23/12/25 SELL,750000077.0,פנימי,"מט""ח",ישראל,"ארה""ב",שירותים פיננסיים,"מט""ח",2025-12-23,לא,2025-06-26,USD,גורם תלוי/פנימי,קיימת תלות,2025-09-30,3.29,1.0,-5377754.95,1.4861,3.306,-264.209,0.087273,-6.4e-05,,
1328,12419.0,"בנק לאומי לישראל בע""מ",520018078.0,ח.פ.,אופציה לס דולר שקל LEUMI C3.6 01/12/25 BUY,750000098.0,פנימי,"מט""ח",ישראל,"ארה""ב",שירותים פיננסיים,"מט""ח",2025-12-01,לא,2025-07-10,USD,גורם תלוי/פנימי,קיימת תלות,2025-09-30,3.6,1.0,10719250.14,0.0679,3.306,24.065,-0.007949,5e-06,,
1328,12419.0,"בנק דיסקונט לישראל בע""מ",520007030.0,ח.פ.,אופציה לס דולר שקל DISCOUNT C3.55 13/01/26 BUY,750000117.0,פנימי,"מט""ח",ישראל,"ארה""ב",שירותים פיננסיים,"מט""ח",2026-01-13,לא,2025-08-13,USD,גורם תלוי/פנימי,קיימת תלות,2025-09-30,3.55,1.0,10719250.14,0.2679,3.306,94.951,-0.031364,2.3e-05,,
1328,12419.0,"בנק לאומי לישראל בע""מ",520018078.0,ח.פ.,אופציה לס דולר שקל LEUMI C3.60 07/01/26 BUY,750000121.0,פנימי,"מט""ח",ישראל,"ארה""ב",שירותים פיננסיים,"מט""ח",2026-01-07,לא,2025-08-25,USD,גורם תלוי/פנימי,קיימת תלות,2025-09-30,3.6,1.0,16078875.21,0.1624,3.306,86.344,-0.02852,2.1e-05,,
1328,12419.0,"בנק דיסקונט לישראל בע""מ",520007030.0,ח.פ.,אופציה לס דולר שקל DISCOUNT C3.575 12/03/26 BUY,750000132.0,פנימי,"מט""ח",ישראל,"ארה""ב",שירותים פיננסיים,"מט""ח",2026-03-12,לא,2025-09-12,USD,גורם תלוי/פנימי,קיימת תלות,2025-09-30,3.575,1.0,10755868.92,0.5282,3.306,187.83,-0.062043,4.5e-05,,
1328,12419.0,"בנק הפועלים בע""מ",520000118.0,ח.פ.,אופציה לס דולר שקל POALIM P3.5 06/10/25,750000016.0,פנימי,"מט""ח",ישראל,"ארה""ב",שירותים פיננסיים,"מט""ח",2025-10-06,לא,2025-04-04,USD,גורם תלוי/פנימי,קיימת תלות,2025-09-30,3.5,1.0,-10755222.7,5.8612,3.306,-2084.061,0.688405,-0.000507,,
1328,12419.0,"בנק הפועלים בע""מ",520000118.0,ח.פ.,אופציה לס דולר שקל POALIM C3.59 26/03/26 BUY,750000145.0,פנימי,"מט""ח",ישראל,"ארה""ב",שירותים פיננסיים,"מט""ח",2026-03-26,לא,2025-09-26,USD,גורם תלוי/פנימי,קיימת תלות,2025-09-30,3.59,1.0,10755868.92,0.5462,3.306,194.219,-0.064154,4.7e-05,,
1328,12419.0,"בנק הפועלים בע""מ",520000118.0,ח.פ.,אופציה לס דולר שקל POALIM C3.5 05/12/25 BUY,750000095.0,פנימי,"מט""ח",ישראל,"ארה""ב",שירותים פיננסיים,"מט""ח",2025-12-05,לא,2025-07-10,USD,גורם תלוי/פנימי,קיימת תלות,2025-09-30,3.5,1.0,10755222.7,0.2323,3.306,82.589,-0.02728,2e-05,,
1328,12419.0,"בנק דיסקונט לישראל בע""מ",520007030.0,ח.פ.,אופציה לס דולר שקל DISCOUNT P3.65 08/10/25,750000019.0,פנימי,"מט""ח",ישראל,"ארה""ב",שירותים פיננסיים,"מט""ח",2025-10-08,לא,2025-04-08,USD,גורם תלוי/פנימי,קיימת תלות,2025-09-30,3.65,1.0,21510301.8,10.394,3.306,7391.8,-2.441655,0.0018,,
1328,12419.0,"בנק דיסקונט לישראל בע""מ",520007030.0,ח.פ.,אופציה לס דולר שקל DISCOUNT C3.29 23/12/25 SELL,750000094.0,פנימי,"מט""ח",ישראל,"ארה""ב",שירותים פיננסיים,"מט""ח",2025-12-23,לא,2025-07-10,USD,גורם תלוי/פנימי,קיימת תלות,2025-09-30,3.29,1.0,-5377754.95,2.0174,3.306,-358.664,0.118473,-8.7e-05,,
1328,12419.0,"בנק הפועלים בע""מ",520000118.0,ח.פ.,אופציה לס דולר שקל POALIM C3.7 05/12/25 SELL 15/07,750000100.0,פנימי,"מט""ח",ישראל,"ארה""ב",שירותים פיננסיים,"מט""ח",2025-12-05,לא,2025-05-14,USD,גורם תלוי/פנימי,קיימת תלות,2025-09-30,3.7,1.0,-10755222.7,0.0277,3.306,-9.852,0.003254,-2e-06,,
1328,12419.0,"בנק לאומי לישראל בע""מ",520018078.0,ח.פ.,אופציה לס דולר שקל LEUMI C3.73 01/12/25 SELL,750000097.0,פנימי,"מט""ח",ישראל,"ארה""ב",שירותים פיננסיים,"מט""ח",2025-12-01,לא,2025-07-10,USD,גורם תלוי/פנימי,קיימת תלות,2025-09-30,3.73,1.0,-10719250.14,0.0145,3.306,-5.135,0.001696,-1e-06,,
1328,12419.0,"בנק הפועלים בע""מ",520000118.0,ח.פ.,אופציה לס דולר שקל POALIM P3.25 26/03/26 SELL,750000146.0,פנימי,"מט""ח",ישראל,"ארה""ב",שירותים פיננסיים,"מט""ח",2026-03-26,לא,2025-09-26,USD,גורם תלוי/פנימי,קיימת תלות,2025-09-30,3.25,1.0,-5377934.46,1.582,3.306,-281.266,0.092907,-6.8e-05,,
1328,12419.0,"בנק לאומי לישראל בע""מ",520018078.0,ח.פ.,אופציה לס דולר שקל LEUMI P3.7 13/10/25 L,750000029.0,פנימי,"מט""ח",ישראל,"ארה""ב",שירותים פיננסיים,"מט""ח",2025-10-13,לא,2025-04-09,USD,גורם תלוי/פנימי,קיימת תלות,2025-09-30,3.7,1.0,10754791.89,11.897,3.306,4230.247,-1.397332,0.00103,,
1328,12419.0,Goldman Sachs Group Inc,11778.0,פנימי,"אופציה לס GS C1,637.14 ESLT.TA 15/10/25 SELL",750000115.0,פנימי,מניה,ישראל,ישראל,Financial Services,מניות לרבות מדדי מניות,2025-10-15,לא,2025-08-12,ILS,גורם תלוי/פנימי,קיימת תלות,2025-09-30,1637.14,1.0,-1604.33,7692.5,1.0,-123.414,0.040766,-3e-05,,
1328,12419.0,"בנק דיסקונט לישראל בע""מ",520007030.0,ח.פ.,אופציה לס דולר שקל DISCOUNT C3.75 26/11/25 BUY,750000049.0,פנימי,"מט""ח",ישראל,"ארה""ב",שירותים פיננסיים,"מט""ח",2025-11-26,לא,2025-05-28,USD,גורם תלוי/פנימי,קיימת תלות,2025-09-30,3.75,1.0,10719250.14,0.0018,3.306,0.654,-0.000215,0.0,,
1328,12419.0,"בנק דיסקונט לישראל בע""מ",520007030.0,ח.פ.,אופציה לס דולר שקל DISCOUNT C3.4 26/11/25 SELL,750000116.0,פנימי,"מט""ח",ישראל,"ארה""ב",שירותים פיננסיים,"מט""ח",2025-11-26,לא,2025-08-13,USD,גורם תלוי/פנימי,קיימת תלות,2025-09-30,3.4,1.0,-5359625.07,0.4649,3.306,-82.383,0.027212,-2e-05,,
1328,12419.0,"בנק לאומי לישראל בע""מ",520018078.0,ח.פ.,אופציה לס דולר שקל LEUMI C3.38 01/12/25 SELL,750000120.0,פנימי,"מט""ח",ישראל,"ארה""ב",שירותים פיננסיים,"מט""ח",2025-12-01,לא,2025-08-25,USD,גורם תלוי/פנימי,קיימת תלות,2025-09-30,3.38,1.0,-5359625.07,0.636,3.306,-112.686,0.037222,-2.7e-05,,
1328,12419.0,"בנק לאומי לישראל בע""מ",520018078.0,ח.פ.,אופציה לס דולר שקל LEUMI C3.39 05/12/25 SELL,750000124.0,פנימי,"מט""ח",ישראל,"ארה""ב",שירותים פיננסיים,"מט""ח",2025-12-05,לא,2025-09-02,USD,גורם תלוי/פנימי,קיימת תלות,2025-09-30,3.39,1.0,-5377611.35,0.6353,3.306,-112.941,0.037306,-2.7e-05,,
1328,12419.0,"בנק דיסקונט לישראל בע""מ",520007030.0,ח.פ.,אופציה לס דולר שקל DISCOUNT C3.6 24/03/26 BUY,750000141.0,פנימי,"מט""ח",ישראל,"ארה""ב",שירותים פיננסיים,"מט""ח",2026-03-24,לא,2025-09-22,USD,גורם תלוי/פנימי,קיימת תלות,2025-09-30,3.6,1.0,10755868.92,0.4815,3.306,171.201,-0.056551,4.1e-05,,
1328,12419.0,"בנק דיסקונט לישראל בע""מ",520007030.0,ח.פ.,אופציה לס דולר שקל DISCOUNT P3.55 08/10/25,750000020.0,פנימי,"מט""ח",ישראל,"ארה""ב",שירותים פיננסיים,"מט""ח",2025-10-08,לא,2025-04-08,USD,גורם תלוי/פנימי,קיימת תלות,2025-09-30,3.55,1.0,-21510301.8,7.3698,3.306,-5240.899,1.73117,-0.001276,,
1328,12419.0,"בנק לאומי לישראל בע""מ",520018078.0,ח.פ.,אופציה לס דולר שקל Leumi P3.7 13/10/25 S,750000040.0,פנימי,"מט""ח",ישראל,"ארה""ב",שירותים פיננסיים,"מט""ח",2025-10-13,לא,2025-05-08,USD,גורם תלוי/פנימי,קיימת תלות,2025-09-30,3.7,1.0,-10754791.89,11.893,3.306,-4228.591,1.396785,-0.00103,,
1328,12419.0,"בנק דיסקונט לישראל בע""מ",520007030.0,ח.פ.,אופציה לס דולר שקל DISCOUNT P3.4 26/11/25 SELL,750000048.0,פנימי,"מט""ח",ישראל,"ארה""ב",שירותים פיננסיים,"מט""ח",2025-11-26,לא,2025-05-28,USD,גורם תלוי/פנימי,קיימת תלות,2025-09-30,3.4,1.0,-5359625.07,3.267,3.306,-578.882,0.191216,-0.000141,,
1328,12419.0,"בנק לאומי לישראל בע""מ",520018078.0,ח.פ.,אופציה לס דולר שקל LEUMI P3.38 01/12/25 SELL,750000052.0,פנימי,"מט""ח",ישראל,"ארה""ב",שירותים פיננסיים,"מט""ח",2025-12-01,לא,2025-05-29,USD,גורם תלוי/פנימי,קיימת תלות,2025-09-30,3.38,1.0,-5359625.07,2.8466,3.306,-504.389,0.166609,-0.000122,,
1328,12419.0,"בנק לאומי לישראל בע""מ",520018078.0,ח.פ.,אופציה לס דולר שקל LEUMI C3.59 06/01/26 BUY,750000125.0,פנימי,"מט""ח",ישראל,"ארה""ב",שירותים פיננסיים,"מט""ח",2026-01-05,לא,2025-09-02,USD,גורם תלוי/פנימי,קיימת תלות,2025-09-30,3.59,1.0,16132834.05,0.1726,3.306,92.038,-0.030401,2.2e-05,,
1328,12419.0,"בנק הפועלים בע""מ",520000118.0,ח.פ.,אופציה לס דולר שקל POALIM P3.6 06/10/25,750000017.0,פנימי,"מט""ח",ישראל,"ארה""ב",שירותים פיננסיים,"מט""ח",2025-10-06,לא,2025-04-04,USD,גורם תלוי/פנימי,קיימת תלות,2025-09-30,3.6,1.0,10755222.7,8.8859,3.306,3159.53,-1.043654,0.000769,,
1328,12419.0,"בנק דיסקונט לישראל בע""מ",520007030.0,ח.פ.,אופציה לס דולר שקל DISCOUNT P3.21 12/03/26 SELL,750000133.0,פנימי,"מט""ח",ישראל,"ארה""ב",שירותים פיננסיים,"מט""ח",2026-03-12,לא,2025-09-12,USD,גורם תלוי/פנימי,קיימת תלות,2025-09-30,3.21,1.0,-5377934.46,1.0491,3.306,-186.518,0.06161,-4.5e-05,,
1328,12419.0,"בנק הפועלים בע""מ",520000118.0,ח.פ.,אופציה לס דולר שקל POALIM C3.7 05/12/25 SELL,750000096.0,פנימי,"מט""ח",ישראל,"ארה""ב",שירותים פיננסיים,"מט""ח",2025-12-05,לא,2025-07-10,USD,גורם תלוי/פנימי,קיימת תלות,2025-09-30,3.7,1.0,-10755222.7,0.0268,3.306,-9.518,0.003144,-2e-06,,
1328,12419.0,"בנק דיסקונט לישראל בע""מ",520007030.0,ח.פ.,אופציה לס דולר שקל DISCOUNT P3.25 24/03/26 SELL,750000142.0,פנימי,"מט""ח",ישראל,"ארה""ב",שירותים פיננסיים,"מט""ח",2026-03-24,לא,2025-09-22,USD,גורם תלוי/פנימי,קיימת תלות,2025-09-30,3.25,1.0,-5377934.46,1.5316,3.306,-272.317,0.089951,-6.6e-05,,
1328,12419.0,"בנק הפועלים בע""מ",520000118.0,ח.פ.,אופציה לס דולר שקל POALIM P3.39 05/12/25 SELL,750000058.0,פנימי,"מט""ח",ישראל,"ארה""ב",שירותים פיננסיים,"מט""ח",2025-12-05,לא,2025-06-06,USD,גורם תלוי/פנימי,קיימת תלות,2025-09-30,3.39,1.0,-5377611.35,3.1116,3.306,-553.195,0.182731,-0.000134,,
1328,12419.0,"Citibank, NA",70652.0,פנימי,אופציה לס דולר שקל CITI C3.38 18/12/25 SELL,750000091.0,פנימי,"מט""ח","חו""ל","ארה""ב",Financial Services,"מט""ח",2025-12-18,לא,2025-07-03,USD,גורם תלוי/פנימי,קיימת תלות,2025-09-30,3.38,1.0,-4660637.19,0.8985,3.306,-138.435,0.045727,-3.3e-05,,
1328,12419.0,"Citibank, NA",70652.0,פנימי,אופציה לס דולר שקל CITI P3.22 06/03/26 SELL,750000129.0,פנימי,"מט""ח","חו""ל","ארה""ב",Financial Services,"מט""ח",2026-03-06,לא,2025-09-09,USD,גורם תלוי/פנימי,קיימת תלות,2025-09-30,3.22,1.0,-5377665.2,1.1426,3.306,-203.147,0.067103,-4.9e-05,,
1328,12419.0,Goldman Sachs Group Inc,11778.0,פנימי,אופציה לס אירו שקל GS P3.7 03/10/25 BUY,750000086.0,פנימי,"מט""ח","חו""ל",אירופה,Financial Services,"מט""ח",2025-10-03,לא,2025-07-01,EUR,גורם תלוי/פנימי,קיימת תלות,2025-09-30,3.7,1.0,8962625.75,0.0001,3.8807,0.009,-2e-06,0.0,,
1328,12419.0,Goldman Sachs Group Inc,11778.0,פנימי,אופציה לס אירו שקל GS P3.9 03/10/25 SELL,750000085.0,פנימי,"מט""ח","חו""ל",אירופה,Financial Services,"מט""ח",2025-10-03,לא,2025-07-07,EUR,גורם תלוי/פנימי,קיימת תלות,2025-09-30,3.9,1.0,-1792525.15,0.6576,3.8807,-45.743,0.015109,-1.1e-05,,
1328,12419.0,"Citibank, NA",70652.0,פנימי,אופציה לס דולר שקל CITI C3.62 18/12/25 BUY,750000092.0,פנימי,"מט""ח","חו""ל","ארה""ב",Financial Services,"מט""ח",2025-12-18,לא,2025-07-03,USD,גורם תלוי/פנימי,קיימת תלות,2025-09-30,3.62,1.0,13981911.58,0.0949,3.306,43.847,-0.014483,1e-05,,
1328,12419.0,"Citibank, NA",70652.0,פנימי,אופציה לס דולר שקל CITI C3.60 18/12/25 BUY,750000103.0,פנימי,"מט""ח","חו""ל","ארה""ב",Financial Services,"מט""ח",2025-12-18,לא,2025-07-16,USD,גורם תלוי/פנימי,קיימת תלות,2025-09-30,3.6,1.0,7887218.36,0.1201,3.306,31.328,-0.010348,7e-06,,
1328,12419.0,"Citibank, NA",70652.0,פנימי,אופציה לס דולר שקל CITI C3.575 06/03/26 BUY,750000128.0,פנימי,"מט""ח","חו""ל","ארה""ב",Financial Services,"מט""ח",2026-03-06,לא,2025-09-09,USD,גורם תלוי/פנימי,קיימת תלות,2025-09-30,3.575,1.0,10755330.4,0.5176,3.306,184.034,-0.06079,4.4e-05,,
1328,12419.0,Goldman Sachs Group Inc,11778.0,פנימי,אופציה לס אירו שקל GS C4.2 03/10/25 BUY,750000122.0,פנימי,"מט""ח","חו""ל",אירופה,Financial Services,"מט""ח",2025-10-03,לא,2025-08-27,EUR,גורם תלוי/פנימי,קיימת תלות,2025-09-30,4.2,1.0,3590076.4,0.0001,3.8807,0.011,-3e-06,0.0,,
1328,12419.0,"Citibank, NA",70652.0,פנימי,אופציה לס דולר שקל CITI C3.75 18/12/25 SELL,750000102.0,פנימי,"מט""ח","חו""ל","ארה""ב",Financial Services,"מט""ח",2025-12-18,לא,2025-07-16,USD,גורם תלוי/פנימי,קיימת תלות,2025-09-30,3.75,1.0,-7887218.36,0.0287,3.306,-7.485,0.002472,-1e-06,,
1328,12419.0,Goldman Sachs Group Inc,11778.0,פנימי,אופציה לס אירו שקל GS P3.9 03/10/25 SELL,750000093.0,פנימי,"מט""ח","חו""ל",אירופה,Financial Services,"מט""ח",2025-10-03,לא,2025-07-01,EUR,גורם תלוי/פנימי,קיימת תלות,2025-09-30,3.9,1.0,-7180152.81,0.6604,3.8807,-184.027,0.060787,-4.4e-05,,
1328,12419.0,"Citibank, NA",70652.0,פנימי,אופציה לס דולר שקל CITI C3.75 18/12/25 BUY,750000067.0,פנימי,"מט""ח","חו""ל","ארה""ב",Financial Services,"מט""ח",2025-12-18,לא,2025-06-17,USD,גורם תלוי/פנימי,קיימת תלות,2025-09-30,3.75,1.0,7887218.36,0.0299,3.306,7.793,-0.002574,1e-06,,
1328,12419.0,"Citibank, NA",70652.0,פנימי,אופציה לס דולר שקל CITI P3.38 18/12/25 SELL,750000066.0,פנימי,"מט""ח","חו""ל","ארה""ב",Financial Services,"מט""ח",2025-12-18,לא,2025-06-17,USD,גורם תלוי/פנימי,קיימת תלות,2025-09-30,3.38,1.0,-4660637.19,3.2367,3.306,-498.707,0.164732,-0.000121,,
1328,14302.0,"בנק דיסקונט לישראל בע""מ",520007030.0,ח.פ.,אופציה לס דולר שקל DISCOUNT C3.58 23/12/25 BUY,750000076.0,פנימי,"מט""ח",ישראל,"ארה""ב",שירותים פיננסיים,"מט""ח",2025-12-23,לא,2025-06-26,USD,גורם תלוי/פנימי,קיימת תלות,2025-09-30,3.58,1.0,18604.18,0.1439,3.306,0.088,-0.008448,4e-06,,
1328,14302.0,"בנק לאומי לישראל בע""מ",520018078.0,ח.פ.,אופציה לס דולר שקל Leumi P3.6 13/10/25 L,750000041.0,פנימי,"מט""ח",ישראל,"ארה""ב",שירותים פיננסיים,"מט""ח",2025-10-13,לא,2025-05-08,USD,גורם תלוי/פנימי,קיימת תלות,2025-09-30,3.6,1.0,37205.87,8.8777,3.306,10.92,-1.042649,0.000548,,
1328,14302.0,"בנק דיסקונט לישראל בע""מ",520007030.0,ח.פ.,אופציה לס דולר שקל DISCOUNT P3.29 23/12/25 SELL,750000077.0,פנימי,"מט""ח",ישראל,"ארה""ב",שירותים פיננסיים,"מט""ח",2025-12-23,לא,2025-06-26,USD,גורם תלוי/פנימי,קיימת תלות,2025-09-30,3.29,1.0,-18604.18,1.4861,3.306,-0.914,0.087273,-4.5e-05,,
1328,14302.0,"בנק לאומי לישראל בע""מ",520018078.0,ח.פ.,אופציה לס דולר שקל LEUMI C3.73 01/12/25 BUY,750000053.0,פנימי,"מט""ח",ישראל,"ארה""ב",שירותים פיננסיים,"מט""ח",2025-12-01,לא,2025-05-29,USD,גורם תלוי/פנימי,קיימת תלות,2025-09-30,3.73,1.0,37082.92,0.004,3.306,0.005,-0.00047,0.0,,
1328,14302.0,"בנק הפועלים בע""מ",520000118.0,ח.פ.,אופציה לס דולר שקל POALIM C3.70 05/12/25 BUY,750000059.0,פנימי,"מט""ח",ישראל,"ארה""ב",שירותים פיננסיים,"מט""ח",2025-12-05,לא,2025-06-06,USD,גורם תלוי/פנימי,קיימת תלות,2025-09-30,3.7,1.0,37207.36,0.0091,3.306,0.011,-0.001065,0.0,,
1328,14302.0,"בנק דיסקונט לישראל בע""מ",520007030.0,ח.פ.,אופציה לס דולר שקל DISCOUNT P3.55 08/10/25 BUY,750000046.0,פנימי,"מט""ח",ישראל,"ארה""ב",שירותים פיננסיים,"מט""ח",2025-10-08,לא,2025-05-21,USD,גורם תלוי/פנימי,קיימת תלות,2025-09-30,3.55,1.0,74414.23,7.3726,3.306,18.138,-1.731831,0.000911,,
1328,14302.0,"בנק הפועלים בע""מ",520000118.0,ח.פ.,אופציה לס דולר שקל POALIM P3.5 06/10/25 BUY,750000057.0,פנימי,"מט""ח",ישראל,"ארה""ב",שירותים פיננסיים,"מט""ח",2025-10-06,לא,2025-06-04,USD,גורם תלוי/פנימי,קיימת תלות,2025-09-30,3.5,1.0,37207.36,5.8625,3.306,7.211,-0.688558,0.000362,,
1328,14302.0,Goldman Sachs Group Inc,11778.0,פנימי,אופציה לס אירו שקל GS C4.2 03/10/25,750000010.0,פנימי,"מט""ח","חו""ל",אירופה,Financial Services,"מט""ח",2025-10-03,לא,2025-04-03,EUR,גורם תלוי/פנימי,קיימת תלות,2025-09-30,4.2,1.0,-12419.76,0.0001,3.8807,0.0,4e-06,0.0,,
1328,14302.0,"בנק לאומי לישראל בע""מ",520018078.0,ח.פ.,אופציה לס דולר שקל LEUMI P3.6 13/10/25 S,750000027.0,פנימי,"מט""ח",ישראל,"ארה""ב",שירותים פיננסיים,"מט""ח",2025-10-13,לא,2025-04-09,USD,גורם תלוי/פנימי,קיימת תלות,2025-09-30,3.6,1.0,-37205.87,8.8731,3.306,-10.914,1.042109,-0.000548,,
1328,14302.0,"בנק הפועלים בע""מ",520000118.0,ח.פ.,אופציה לס דולר שקל POALIM P3.6 06/10/25 SELL,750000056.0,פנימי,"מט""ח",ישראל,"ארה""ב",שירותים פיננסיים,"מט""ח",2025-10-06,לא,2025-06-04,USD,גורם תלוי/פנימי,קיימת תלות,2025-09-30,3.6,1.0,-37207.36,8.8822,3.306,-10.926,1.043224,-0.000549,,
1328,14302.0,"בנק דיסקונט לישראל בע""מ",520007030.0,ח.פ.,אופציה לס דולר שקל DISCOUNT P3.65 08/10/25 SELL,750000045.0,פנימי,"מט""ח",ישראל,"ארה""ב",שירותים פיננסיים,"מט""ח",2025-10-08,לא,2025-05-21,USD,גורם תלוי/פנימי,קיימת תלות,2025-09-30,3.65,1.0,-74414.23,10.391,3.306,-25.565,2.440987,-0.001284,,
1328,14302.0,Goldman Sachs Group Inc,11778.0,פנימי,אופציה לס אירו שקל GS P3.9 03/10/25,750000011.0,פנימי,"מט""ח","חו""ל",אירופה,Financial Services,"מט""ח",2025-10-03,לא,2025-04-03,EUR,גורם תלוי/פנימי,קיימת תלות,2025-09-30,3.9,1.0,31049.4,0.6786,3.8807,0.818,-0.078077,4.1e-05,,
1328,14302.0,Goldman Sachs Group Inc,11778.0,פנימי,אופציה לס אירו שקל GS P3.7 03/10/25,750000012.0,פנימי,"מט""ח","חו""ל",אירופה,Financial Services,"מט""ח",2025-10-03,לא,2025-04-03,EUR,גורם תלוי/פנימי,קיימת תלות,2025-09-30,3.7,1.0,-31049.4,0.0001,3.8807,0.0,2e-06,0.0,,
1328,14302.0,"בנק הפועלים בע""מ",520000118.0,ח.פ.,אופציה לס דולר שקל POALIM C3.6 05/12/25 BUY,750000099.0,פנימי,"מט""ח",ישראל,"ארה""ב",שירותים פיננסיים,"מט""ח",2025-12-05,לא,2025-05-14,USD,גורם תלוי/פנימי,קיימת תלות,2025-09-30,3.6,1.0,37207.36,0.0815,3.306,0.1,-0.00957,5e-06,,
1328,14302.0,"בנק לאומי לישראל בע""מ",520018078.0,ח.פ.,אופציה לס דולר שקל LEUMI C3.6 01/12/25 BUY,750000098.0,פנימי,"מט""ח",ישראל,"ארה""ב",שירותים פיננסיים,"מט""ח",2025-12-01,לא,2025-07-10,USD,גורם תלוי/פנימי,קיימת תלות,2025-09-30,3.6,1.0,37082.92,0.0679,3.306,0.083,-0.007949,4e-06,,
1328,14302.0,"בנק דיסקונט לישראל בע""מ",520007030.0,ח.פ.,אופציה לס דולר שקל DISCOUNT C3.55 13/01/26 BUY,750000117.0,פנימי,"מט""ח",ישראל,"ארה""ב",שירותים פיננסיים,"מט""ח",2026-01-13,לא,2025-08-13,USD,גורם תלוי/פנימי,קיימת תלות,2025-09-30,3.55,1.0,37082.92,0.2679,3.306,0.328,-0.031364,1.6e-05,,
1328,14302.0,"בנק לאומי לישראל בע""מ",520018078.0,ח.פ.,אופציה לס דולר שקל LEUMI C3.60 07/01/26 BUY,750000121.0,פנימי,"מט""ח",ישראל,"ארה""ב",שירותים פיננסיים,"מט""ח",2026-01-07,לא,2025-08-25,USD,גורם תלוי/פנימי,קיימת תלות,2025-09-30,3.6,1.0,55624.38,0.1624,3.306,0.299,-0.02852,1.5e-05,,
1328,14302.0,"בנק דיסקונט לישראל בע""מ",520007030.0,ח.פ.,אופציה לס דולר שקל DISCOUNT C3.575 12/03/26 BUY,750000132.0,פנימי,"מט""ח",ישראל,"ארה""ב",שירותים פיננסיים,"מט""ח",2026-03-12,לא,2025-09-12,USD,גורם תלוי/פנימי,קיימת תלות,2025-09-30,3.575,1.0,37209.6,0.5282,3.306,0.65,-0.062043,3.2e-05,,
1328,14302.0,"בנק הפועלים בע""מ",520000118.0,ח.פ.,אופציה לס דולר שקל POALIM P3.25 26/03/26 SELL,750000146.0,פנימי,"מט""ח",ישראל,"ארה""ב",שירותים פיננסיים,"מט""ח",2026-03-26,לא,2025-09-26,USD,גורם תלוי/פנימי,קיימת תלות,2025-09-30,3.25,1.0,-18604.8,1.582,3.306,-0.973,0.092907,-4.8e-05,,
1328,14302.0,"בנק הפועלים בע""מ",520000118.0,ח.פ.,אופציה לס דולר שקל POALIM C3.7 05/12/25 SELL 15/07,750000100.0,פנימי,"מט""ח",ישראל,"ארה""ב",שירותים פיננסיים,"מט""ח",2025-12-05,לא,2025-05-14,USD,גורם תלוי/פנימי,קיימת תלות,2025-09-30,3.7,1.0,-37207.36,0.0277,3.306,-0.034,0.003254,-1e-06,,
1328,14302.0,"בנק הפועלים בע""מ",520000118.0,ח.פ.,אופציה לס דולר שקל POALIM C3.5 05/12/25 BUY,750000095.0,פנימי,"מט""ח",ישראל,"ארה""ב",שירותים פיננסיים,"מט""ח",2025-12-05,לא,2025-07-10,USD,גורם תלוי/פנימי,קיימת תלות,2025-09-30,3.5,1.0,37207.36,0.2323,3.306,0.286,-0.02728,1.4e-05,,
1328,14302.0,"בנק לאומי לישראל בע""מ",520018078.0,ח.פ.,אופציה לס דולר שקל LEUMI C3.73 01/12/25 SELL,750000097.0,פנימי,"מט""ח",ישראל,"ארה""ב",שירותים פיננסיים,"מט""ח",2025-12-01,לא,2025-07-10,USD,גורם תלוי/פנימי,קיימת תלות,2025-09-30,3.73,1.0,-37082.92,0.0145,3.306,-0.018,0.001696,0.0,,
1328,14302.0,"בנק דיסקונט לישראל בע""מ",520007030.0,ח.פ.,אופציה לס דולר שקל DISCOUNT C3.29 23/12/25 SELL,750000094.0,פנימי,"מט""ח",ישראל,"ארה""ב",שירותים פיננסיים,"מט""ח",2025-12-23,לא,2025-07-10,USD,גורם תלוי/פנימי,קיימת תלות,2025-09-30,3.29,1.0,-18604.18,2.0174,3.306,-1.241,0.118473,-6.2e-05,,
1328,14302.0,"בנק הפועלים בע""מ",520000118.0,ח.פ.,אופציה לס דולר שקל POALIM C3.59 26/03/26 BUY,750000145.0,פנימי,"מט""ח",ישראל,"ארה""ב",שירותים פיננסיים,"מט""ח",2026-03-26,לא,2025-09-26,USD,גורם תלוי/פנימי,קיימת תלות,2025-09-30,3.59,1.0,37209.6,0.5462,3.306,0.672,-0.064154,3.3e-05,,
1328,14302.0,"בנק דיסקונט לישראל בע""מ",520007030.0,ח.פ.,אופציה לס דולר שקל DISCOUNT P3.65 08/10/25,750000019.0,פנימי,"מט""ח",ישראל,"ארה""ב",שירותים פיננסיים,"מט""ח",2025-10-08,לא,2025-04-08,USD,גורם תלוי/פנימי,קיימת תלות,2025-09-30,3.65,1.0,74414.23,10.394,3.306,25.572,-2.441655,0.001284,,
1328,14302.0,"בנק הפועלים בע""מ",520000118.0,ח.פ.,אופציה לס דולר שקל POALIM P3.5 06/10/25,750000016.0,פנימי,"מט""ח",ישראל,"ארה""ב",שירותים פיננסיים,"מט""ח",2025-10-06,לא,2025-04-04,USD,גורם תלוי/פנימי,קיימת תלות,2025-09-30,3.5,1.0,-37207.36,5.8612,3.306,-7.21,0.688405,-0.000362,,
1328,14302.0,"בנק לאומי לישראל בע""מ",520018078.0,ח.פ.,אופציה לס דולר שקל LEUMI P3.7 13/10/25 L,750000029.0,פנימי,"מט""ח",ישראל,"ארה""ב",שירותים פיננסיים,"מט""ח",2025-10-13,לא,2025-04-09,USD,גורם תלוי/פנימי,קיימת תלות,2025-09-30,3.7,1.0,37205.87,11.897,3.306,14.634,-1.397332,0.000735,,
1328,14302.0,"בנק דיסקונט לישראל בע""מ",520007030.0,ח.פ.,אופציה לס דולר שקל DISCOUNT C3.4 26/11/25 SELL,750000116.0,פנימי,"מט""ח",ישראל,"ארה""ב",שירותים פיננסיים,"מט""ח",2025-11-26,לא,2025-08-13,USD,גורם תלוי/פנימי,קיימת תלות,2025-09-30,3.4,1.0,-18541.46,0.4649,3.306,-0.285,0.027212,-1.4e-05,,
1328,14302.0,Goldman Sachs Group Inc,11778.0,פנימי,"אופציה לס GS C1,637.14 ESLT.TA 15/10/25 SELL",750000115.0,פנימי,מניה,ישראל,ישראל,Financial Services,מניות לרבות מדדי מניות,2025-10-15,לא,2025-08-12,ILS,גורם תלוי/פנימי,קיימת תלות,2025-09-30,1637.14,1.0,-5.55,7692.5,1.0,-0.427,0.040766,-2.1e-05,,
1328,14302.0,"בנק דיסקונט לישראל בע""מ",520007030.0,ח.פ.,אופציה לס דולר שקל DISCOUNT C3.75 26/11/25 BUY,750000049.0,פנימי,"מט""ח",ישראל,"ארה""ב",שירותים פיננסיים,"מט""ח",2025-11-26,לא,2025-05-28,USD,גורם תלוי/פנימי,קיימת תלות,2025-09-30,3.75,1.0,37082.92,0.0018,3.306,0.002,-0.000215,0.0,,
1328,14302.0,"בנק דיסקונט לישראל בע""מ",520007030.0,ח.פ.,אופציה לס דולר שקל DISCOUNT C3.6 24/03/26 BUY,750000141.0,פנימי,"מט""ח",ישראל,"ארה""ב",שירותים פיננסיים,"מט""ח",2026-03-24,לא,2025-09-22,USD,גורם תלוי/פנימי,קיימת תלות,2025-09-30,3.6,1.0,37209.6,0.4815,3.306,0.592,-0.056551,2.9e-05,,
1328,14302.0,"בנק דיסקונט לישראל בע""מ",520007030.0,ח.פ.,אופציה לס דולר שקל DISCOUNT P3.55 08/10/25,750000020.0,פנימי,"מט""ח",ישראל,"ארה""ב",שירותים פיננסיים,"מט""ח",2025-10-08,לא,2025-04-08,USD,גורם תלוי/פנימי,קיימת תלות,2025-09-30,3.55,1.0,-74414.23,7.3698,3.306,-18.131,1.73117,-0.000911,,
1328,14302.0,"בנק לאומי לישראל בע""מ",520018078.0,ח.פ.,אופציה לס דולר שקל LEUMI C3.39 05/12/25 SELL,750000124.0,פנימי,"מט""ח",ישראל,"ארה""ב",שירותים פיננסיים,"מט""ח",2025-12-05,לא,2025-09-02,USD,גורם תלוי/פנימי,קיימת תלות,2025-09-30,3.39,1.0,-18603.68,0.6353,3.306,-0.391,0.037306,-1.9e-05,,
1328,14302.0,"בנק לאומי לישראל בע""מ",520018078.0,ח.פ.,אופציה לס דולר שקל LEUMI C3.38 01/12/25 SELL,750000120.0,פנימי,"מט""ח",ישראל,"ארה""ב",שירותים פיננסיים,"מט""ח",2025-12-01,לא,2025-08-25,USD,גורם תלוי/פנימי,קיימת תלות,2025-09-30,3.38,1.0,-18541.46,0.636,3.306,-0.39,0.037222,-1.9e-05,,
1328,14302.0,"בנק לאומי לישראל בע""מ",520018078.0,ח.פ.,אופציה לס דולר שקל LEUMI P3.38 01/12/25 SELL,750000052.0,פנימי,"מט""ח",ישראל,"ארה""ב",שירותים פיננסיים,"מט""ח",2025-12-01,לא,2025-05-29,USD,גורם תלוי/פנימי,קיימת תלות,2025-09-30,3.38,1.0,-18541.46,2.8466,3.306,-1.745,0.166609,-8.7e-05,,
1328,14302.0,"בנק לאומי לישראל בע""מ",520018078.0,ח.פ.,אופציה לס דולר שקל Leumi P3.7 13/10/25 S,750000040.0,פנימי,"מט""ח",ישראל,"ארה""ב",שירותים פיננסיים,"מט""ח",2025-10-13,לא,2025-05-08,USD,גורם תלוי/פנימי,קיימת תלות,2025-09-30,3.7,1.0,-37205.87,11.893,3.306,-14.629,1.396785,-0.000735,,
1328,14302.0,"בנק דיסקונט לישראל בע""מ",520007030.0,ח.פ.,אופציה לס דולר שקל DISCOUNT P3.4 26/11/25 SELL,750000048.0,פנימי,"מט""ח",ישראל,"ארה""ב",שירותים פיננסיים,"מט""ח",2025-11-26,לא,2025-05-28,USD,גורם תלוי/פנימי,קיימת תלות,2025-09-30,3.4,1.0,-18541.46,3.267,3.306,-2.003,0.191216,-0.0001,,
1328,14302.0,"בנק לאומי לישראל בע""מ",520018078.0,ח.פ.,אופציה לס דולר שקל LEUMI C3.59 06/01/26 BUY,750000125.0,פנימי,"מט""ח",ישראל,"ארה""ב",שירותים פיננסיים,"מט""ח",2026-01-05,לא,2025-09-02,USD,גורם תלוי/פנימי,קיימת תלות,2025-09-30,3.59,1.0,55811.05,0.1726,3.306,0.318,-0.030401,1.5e-05,,
1328,14302.0,"בנק דיסקונט לישראל בע""מ",520007030.0,ח.פ.,אופציה לס דולר שקל DISCOUNT P3.21 12/03/26 SELL,750000133.0,פנימי,"מט""ח",ישראל,"ארה""ב",שירותים פיננסיים,"מט""ח",2026-03-12,לא,2025-09-12,USD,גורם תלוי/פנימי,קיימת תלות,2025-09-30,3.21,1.0,-18604.8,1.0491,3.306,-0.645,0.06161,-3.2e-05,,
1328,14302.0,"בנק הפועלים בע""מ",520000118.0,ח.פ.,אופציה לס דולר שקל POALIM C3.7 05/12/25 SELL,750000096.0,פנימי,"מט""ח",ישראל,"ארה""ב",שירותים פיננסיים,"מט""ח",2025-12-05,לא,2025-07-10,USD,גורם תלוי/פנימי,קיימת תלות,2025-09-30,3.7,1.0,-37207.36,0.0268,3.306,-0.033,0.003144,-1e-06,,
1328,14302.0,"בנק הפועלים בע""מ",520000118.0,ח.פ.,אופציה לס דולר שקל POALIM P3.6 06/10/25,750000017.0,פנימי,"מט""ח",ישראל,"ארה""ב",שירותים פיננסיים,"מט""ח",2025-10-06,לא,2025-04-04,USD,גורם תלוי/פנימי,קיימת תלות,2025-09-30,3.6,1.0,37207.36,8.8859,3.306,10.93,-1.043654,0.000549,,
1328,14302.0,"בנק הפועלים בע""מ",520000118.0,ח.פ.,אופציה לס דולר שקל POALIM P3.39 05/12/25 SELL,750000058.0,פנימי,"מט""ח",ישראל,"ארה""ב",שירותים פיננסיים,"מט""ח",2025-12-05,לא,2025-06-06,USD,גורם תלוי/פנימי,קיימת תלות,2025-09-30,3.39,1.0,-18603.68,3.1116,3.306,-1.914,0.182731,-9.6e-05,,
1328,14302.0,"בנק דיסקונט לישראל בע""מ",520007030.0,ח.פ.,אופציה לס דולר שקל DISCOUNT P3.25 24/03/26 SELL,750000142.0,פנימי,"מט""ח",ישראל,"ארה""ב",שירותים פיננסיים,"מט""ח",2026-03-24,לא,2025-09-22,USD,גורם תלוי/פנימי,קיימת תלות,2025-09-30,3.25,1.0,-18604.8,1.5316,3.306,-0.942,0.089951,-4.7e-05,,
1328,14302.0,"Citibank, NA",70652.0,פנימי,אופציה לס דולר שקל CITI C3.38 18/12/25 SELL,750000091.0,פנימי,"מט""ח","חו""ל","ארה""ב",Financial Services,"מט""ח",2025-12-18,לא,2025-07-03,USD,גורם תלוי/פנימי,קיימת תלות,2025-09-30,3.38,1.0,-16123.33,0.8985,3.306,-0.479,0.045727,-2.4e-05,,
1328,14302.0,"Citibank, NA",70652.0,פנימי,אופציה לס דולר שקל CITI P3.22 06/03/26 SELL,750000129.0,פנימי,"מט""ח","חו""ל","ארה""ב",Financial Services,"מט""ח",2026-03-06,לא,2025-09-09,USD,גורם תלוי/פנימי,קיימת תלות,2025-09-30,3.22,1.0,-18603.86,1.1426,3.306,-0.703,0.067103,-3.5e-05,,
1328,14302.0,"Citibank, NA",70652.0,פנימי,אופציה לס דולר שקל CITI C3.60 18/12/25 BUY,750000103.0,פנימי,"מט""ח","חו""ל","ארה""ב",Financial Services,"מט""ח",2025-12-18,לא,2025-07-16,USD,גורם תלוי/פנימי,קיימת תלות,2025-09-30,3.6,1.0,27285.59,0.1201,3.306,0.108,-0.010348,5e-06,,
1328,14302.0,"Citibank, NA",70652.0,פנימי,אופציה לס דולר שקל CITI C3.62 18/12/25 BUY,750000092.0,פנימי,"מט""ח","חו""ל","ארה""ב",Financial Services,"מט""ח",2025-12-18,לא,2025-07-03,USD,גורם תלוי/פנימי,קיימת תלות,2025-09-30,3.62,1.0,48369.99,0.0949,3.306,0.152,-0.014483,7e-06,,
1328,14302.0,Goldman Sachs Group Inc,11778.0,פנימי,אופציה לס אירו שקל GS P3.9 03/10/25 SELL,750000085.0,פנימי,"מט""ח","חו""ל",אירופה,Financial Services,"מט""ח",2025-10-03,לא,2025-07-07,EUR,גורם תלוי/פנימי,קיימת תלות,2025-09-30,3.9,1.0,-6201.18,0.6576,3.8807,-0.158,0.015109,-7e-06,,
1328,14302.0,Goldman Sachs Group Inc,11778.0,פנימי,אופציה לס אירו שקל GS P3.7 03/10/25 BUY,750000086.0,פנימי,"מט""ח","חו""ל",אירופה,Financial Services,"מט""ח",2025-10-03,לא,2025-07-01,EUR,גורם תלוי/פנימי,קיימת תלות,2025-09-30,3.7,1.0,31005.93,0.0001,3.8807,0.0,-2e-06,0.0,,
1328,14302.0,"Citibank, NA",70652.0,פנימי,אופציה לס דולר שקל CITI C3.575 06/03/26 BUY,750000128.0,פנימי,"מט""ח","חו""ל","ארה""ב",Financial Services,"מט""ח",2026-03-06,לא,2025-09-09,USD,גורם תלוי/פנימי,קיימת תלות,2025-09-30,3.575,1.0,37207.73,0.5176,3.306,0.637,-0.06079,3.1e-05,,
1328,14302.0,Goldman Sachs Group Inc,11778.0,פנימי,אופציה לס אירו שקל GS C4.2 03/10/25 BUY,750000122.0,פנימי,"מט""ח","חו""ל",אירופה,Financial Services,"מט""ח",2025-10-03,לא,2025-08-27,EUR,גורם תלוי/פנימי,קיימת תלות,2025-09-30,4.2,1.0,12419.76,0.0001,3.8807,0.0,-3e-06,0.0,,
1328,14302.0,"Citibank, NA",70652.0,פנימי,אופציה לס דולר שקל CITI C3.75 18/12/25 SELL,750000102.0,פנימי,"מט""ח","חו""ל","ארה""ב",Financial Services,"מט""ח",2025-12-18,לא,2025-07-16,USD,גורם תלוי/פנימי,קיימת תלות,2025-09-30,3.75,1.0,-27285.59,0.0287,3.306,-0.026,0.002472,-1e-06,,
1328,14302.0,Goldman Sachs Group Inc,11778.0,פנימי,אופציה לס אירו שקל GS P3.9 03/10/25 SELL,750000093.0,פנימי,"מט""ח","חו""ל",אירופה,Financial Services,"מט""ח",2025-10-03,לא,2025-07-01,EUR,גורם תלוי/פנימי,קיימת תלות,2025-09-30,3.9,1.0,-24839.52,0.6604,3.8807,-0.637,0.060787,-3.1e-05,,
1328,14302.0,"Citibank, NA",70652.0,פנימי,אופציה לס דולר שקל CITI C3.75 18/12/25 BUY,750000067.0,פנימי,"מט""ח","חו""ל","ארה""ב",Financial Services,"מט""ח",2025-12-18,לא,2025-06-17,USD,גורם תלוי/פנימי,קיימת תלות,2025-09-30,3.75,1.0,27285.59,0.0299,3.306,0.027,-0.002574,1e-06,,
1328,14302.0,"Citibank, NA",70652.0,פנימי,אופציה לס דולר שקל CITI P3.38 18/12/25 SELL,750000066.0,פנימי,"מט""ח","חו""ל","ארה""ב",Financial Services,"מט""ח",2025-12-18,לא,2025-06-17,USD,גורם תלוי/פנימי,קיימת תלות,2025-09-30,3.38,1.0,-16123.33,3.2367,3.306,-1.725,0.164732,-8.6e-05,,
1328,15314.0,"בנק דיסקונט לישראל בע""מ",520007030.0,ח.פ.,אופציה לס דולר שקל DISCOUNT C3.58 23/12/25 BUY,750000076.0,פנימי,"מט""ח",ישראל,"ארה""ב",שירותים פיננסיים,"מט""ח",2025-12-23,לא,2025-06-26,USD,גורם תלוי/פנימי,קיימת תלות,2025-09-30,3.58,1.0,3401.9,0.1439,3.306,0.016,-0.008448,1e-06,,
1328,15314.0,"בנק לאומי לישראל בע""מ",520018078.0,ח.פ.,אופציה לס דולר שקל Leumi P3.6 13/10/25 L,750000041.0,פנימי,"מט""ח",ישראל,"ארה""ב",שירותים פיננסיים,"מט""ח",2025-10-13,לא,2025-05-08,USD,גורם תלוי/פנימי,קיימת תלות,2025-09-30,3.6,1.0,6803.36,8.8777,3.306,1.997,-1.042649,0.000148,,
1328,15314.0,"בנק דיסקונט לישראל בע""מ",520007030.0,ח.פ.,אופציה לס דולר שקל DISCOUNT P3.55 08/10/25 BUY,750000046.0,פנימי,"מט""ח",ישראל,"ארה""ב",שירותים פיננסיים,"מט""ח",2025-10-08,לא,2025-05-21,USD,גורם תלוי/פנימי,קיימת תלות,2025-09-30,3.55,1.0,13607.18,7.3726,3.306,3.317,-1.731831,0.000246,,
1328,15314.0,"בנק לאומי לישראל בע""מ",520018078.0,ח.פ.,אופציה לס דולר שקל LEUMI C3.73 01/12/25 BUY,750000053.0,פנימי,"מט""ח",ישראל,"ארה""ב",שירותים פיננסיים,"מט""ח",2025-12-01,לא,2025-05-29,USD,גורם תלוי/פנימי,קיימת תלות,2025-09-30,3.73,1.0,6780.87,0.004,3.306,0.001,-0.00047,0.0,,
1328,15314.0,"בנק הפועלים בע""מ",520000118.0,ח.פ.,אופציה לס דולר שקל POALIM C3.70 05/12/25 BUY,750000059.0,פנימי,"מט""ח",ישראל,"ארה""ב",שירותים פיננסיים,"מט""ח",2025-12-05,לא,2025-06-06,USD,גורם תלוי/פנימי,קיימת תלות,2025-09-30,3.7,1.0,6803.63,0.0091,3.306,0.002,-0.001065,0.0,,
1328,15314.0,"בנק הפועלים בע""מ",520000118.0,ח.פ.,אופציה לס דולר שקל POALIM P3.5 06/10/25 BUY,750000057.0,פנימי,"מט""ח",ישראל,"ארה""ב",שירותים פיננסיים,"מט""ח",2025-10-06,לא,2025-06-04,USD,גורם תלוי/פנימי,קיימת תלות,2025-09-30,3.5,1.0,6803.63,5.8625,3.306,1.319,-0.688558,9.7e-05,,
1328,15314.0,"בנק הפועלים בע""מ",520000118.0,ח.פ.,אופציה לס דולר שקל POALIM P3.6 06/10/25 SELL,750000056.0,פנימי,"מט""ח",ישראל,"ארה""ב",שירותים פיננסיים,"מט""ח",2025-10-06,לא,2025-06-04,USD,גורם תלוי/פנימי,קיימת תלות,2025-09-30,3.6,1.0,-6803.63,8.8822,3.306,-1.998,1.043224,-0.000148,,
1328,15314.0,Goldman Sachs Group Inc,11778.0,פנימי,אופציה לס אירו שקל GS C4.2 03/10/25,750000010.0,פנימי,"מט""ח","חו""ל",אירופה,Financial Services,"מט""ח",2025-10-03,לא,2025-04-03,EUR,גורם תלוי/פנימי,קיימת תלות,2025-09-30,4.2,1.0,-2271.04,0.0001,3.8807,0.0,4e-06,0.0,,
1328,15314.0,"בנק לאומי לישראל בע""מ",520018078.0,ח.פ.,אופציה לס דולר שקל LEUMI P3.6 13/10/25 S,750000027.0,פנימי,"מט""ח",ישראל,"ארה""ב",שירותים פיננסיים,"מט""ח",2025-10-13,לא,2025-04-09,USD,גורם תלוי/פנימי,קיימת תלות,2025-09-30,3.6,1.0,-6803.36,8.8731,3.306,-1.996,1.042109,-0.000148,,
1328,15314.0,Goldman Sachs Group Inc,11778.0,פנימי,אופציה לס אירו שקל GS P3.7 03/10/25,750000012.0,פנימי,"מט""ח","חו""ל",אירופה,Financial Services,"מט""ח",2025-10-03,לא,2025-04-03,EUR,גורם תלוי/פנימי,קיימת תלות,2025-09-30,3.7,1.0,-5677.6,0.0001,3.8807,0.0,2e-06,0.0,,
1328,15314.0,Goldman Sachs Group Inc,11778.0,פנימי,אופציה לס אירו שקל GS P3.9 03/10/25,750000011.0,פנימי,"מט""ח","חו""ל",אירופה,Financial Services,"מט""ח",2025-10-03,לא,2025-04-03,EUR,גורם תלוי/פנימי,קיימת תלות,2025-09-30,3.9,1.0,5677.6,0.6786,3.8807,0.15,-0.078077,1.1e-05,,
1328,15314.0,"בנק דיסקונט לישראל בע""מ",520007030.0,ח.פ.,אופציה לס דולר שקל DISCOUNT P3.65 08/10/25 SELL,750000045.0,פנימי,"מט""ח",ישראל,"ארה""ב",שירותים פיננסיים,"מט""ח",2025-10-08,לא,2025-05-21,USD,גורם תלוי/פנימי,קיימת תלות,2025-09-30,3.65,1.0,-13607.18,10.391,3.306,-4.675,2.440987,-0.000347,,
1328,15314.0,"בנק הפועלים בע""מ",520000118.0,ח.פ.,אופציה לס דולר שקל POALIM C3.6 05/12/25 BUY,750000099.0,פנימי,"מט""ח",ישראל,"ארה""ב",שירותים פיננסיים,"מט""ח",2025-12-05,לא,2025-05-14,USD,גורם תלוי/פנימי,קיימת תלות,2025-09-30,3.6,1.0,6803.63,0.0815,3.306,0.018,-0.00957,1e-06,,
1328,15314.0,"בנק דיסקונט לישראל בע""מ",520007030.0,ח.פ.,אופציה לס דולר שקל DISCOUNT P3.29 23/12/25 SELL,750000077.0,פנימי,"מט""ח",ישראל,"ארה""ב",שירותים פיננסיים,"מט""ח",2025-12-23,לא,2025-06-26,USD,גורם תלוי/פנימי,קיימת תלות,2025-09-30,3.29,1.0,-3401.9,1.4861,3.306,-0.167,0.087273,-1.2e-05,,
1328,15314.0,"בנק לאומי לישראל בע""מ",520018078.0,ח.פ.,אופציה לס דולר שקל LEUMI C3.6 01/12/25 BUY,750000098.0,פנימי,"מט""ח",ישראל,"ארה""ב",שירותים פיננסיים,"מט""ח",2025-12-01,לא,2025-07-10,USD,גורם תלוי/פנימי,קיימת תלות,2025-09-30,3.6,1.0,6780.87,0.0679,3.306,0.015,-0.007949,1e-06,,
1328,15314.0,"בנק דיסקונט לישראל בע""מ",520007030.0,ח.פ.,אופציה לס דולר שקל DISCOUNT C3.55 13/01/26 BUY,750000117.0,פנימי,"מט""ח",ישראל,"ארה""ב",שירותים פיננסיים,"מט""ח",2026-01-13,לא,2025-08-13,USD,גורם תלוי/פנימי,קיימת תלות,2025-09-30,3.55,1.0,6780.87,0.2679,3.306,0.06,-0.031364,4e-06,,
1328,15314.0,"בנק לאומי לישראל בע""מ",520018078.0,ח.פ.,אופציה לס דולר שקל LEUMI C3.60 07/01/26 BUY,750000121.0,פנימי,"מט""ח",ישראל,"ארה""ב",שירותים פיננסיים,"מט""ח",2026-01-07,לא,2025-08-25,USD,גורם תלוי/פנימי,קיימת תלות,2025-09-30,3.6,1.0,10171.31,0.1624,3.306,0.055,-0.02852,4e-06,,
1328,15314.0,"בנק דיסקונט לישראל בע""מ",520007030.0,ח.פ.,אופציה לס דולר שקל DISCOUNT C3.575 12/03/26 BUY,750000132.0,פנימי,"מט""ח",ישראל,"ארה""ב",שירותים פיננסיים,"מט""ח",2026-03-12,לא,2025-09-12,USD,גורם תלוי/פנימי,קיימת תלות,2025-09-30,3.575,1.0,6804.04,0.5282,3.306,0.119,-0.062043,8e-06,,
1328,15314.0,"בנק הפועלים בע""מ",520000118.0,ח.פ.,אופציה לס דולר שקל POALIM P3.5 06/10/25,750000016.0,פנימי,"מט""ח",ישראל,"ארה""ב",שירותים פיננסיים,"מט""ח",2025-10-06,לא,2025-04-04,USD,גורם תלוי/פנימי,קיימת תלות,2025-09-30,3.5,1.0,-6803.63,5.8612,3.306,-1.318,0.688405,-9.7e-05,,
1328,15314.0,"בנק הפועלים בע""מ",520000118.0,ח.פ.,אופציה לס דולר שקל POALIM C3.59 26/03/26 BUY,750000145.0,פנימי,"מט""ח",ישראל,"ארה""ב",שירותים פיננסיים,"מט""ח",2026-03-26,לא,2025-09-26,USD,גורם תלוי/פנימי,קיימת תלות,2025-09-30,3.59,1.0,6804.04,0.5462,3.306,0.123,-0.064154,9e-06,,
1328,15314.0,"בנק דיסקונט לישראל בע""מ",520007030.0,ח.פ.,אופציה לס דולר שקל DISCOUNT P3.65 08/10/25,750000019.0,פנימי,"מט""ח",ישראל,"ארה""ב",שירותים פיננסיים,"מט""ח",2025-10-08,לא,2025-04-08,USD,גורם תלוי/פנימי,קיימת תלות,2025-09-30,3.65,1.0,13607.18,10.394,3.306,4.676,-2.441655,0.000347,,
1328,15314.0,"בנק דיסקונט לישראל בע""מ",520007030.0,ח.פ.,אופציה לס דולר שקל DISCOUNT C3.29 23/12/25 SELL,750000094.0,פנימי,"מט""ח",ישראל,"ארה""ב",שירותים פיננסיים,"מט""ח",2025-12-23,לא,2025-07-10,USD,גורם תלוי/פנימי,קיימת תלות,2025-09-30,3.29,1.0,-3401.9,2.0174,3.306,-0.227,0.118473,-1.6e-05,,
1328,15314.0,"בנק הפועלים בע""מ",520000118.0,ח.פ.,אופציה לס דולר שקל POALIM C3.5 05/12/25 BUY,750000095.0,פנימי,"מט""ח",ישראל,"ארה""ב",שירותים פיננסיים,"מט""ח",2025-12-05,לא,2025-07-10,USD,גורם תלוי/פנימי,קיימת תלות,2025-09-30,3.5,1.0,6803.63,0.2323,3.306,0.052,-0.02728,3e-06,,
1328,15314.0,"בנק לאומי לישראל בע""מ",520018078.0,ח.פ.,אופציה לס דולר שקל LEUMI C3.73 01/12/25 SELL,750000097.0,פנימי,"מט""ח",ישראל,"ארה""ב",שירותים פיננסיים,"מט""ח",2025-12-01,לא,2025-07-10,USD,גורם תלוי/פנימי,קיימת תלות,2025-09-30,3.73,1.0,-6780.87,0.0145,3.306,-0.003,0.001696,0.0,,
1328,15314.0,"בנק הפועלים בע""מ",520000118.0,ח.פ.,אופציה לס דולר שקל POALIM C3.7 05/12/25 SELL 15/07,750000100.0,פנימי,"מט""ח",ישראל,"ארה""ב",שירותים פיננסיים,"מט""ח",2025-12-05,לא,2025-05-14,USD,גורם תלוי/פנימי,קיימת תלות,2025-09-30,3.7,1.0,-6803.63,0.0277,3.306,-0.006,0.003254,0.0,,
1328,15314.0,"בנק הפועלים בע""מ",520000118.0,ח.פ.,אופציה לס דולר שקל POALIM P3.25 26/03/26 SELL,750000146.0,פנימי,"מט""ח",ישראל,"ארה""ב",שירותים פיננסיים,"מט""ח",2026-03-26,לא,2025-09-26,USD,גורם תלוי/פנימי,קיימת תלות,2025-09-30,3.25,1.0,-3402.02,1.582,3.306,-0.178,0.092907,-1.3e-05,,
1328,15314.0,"בנק דיסקונט לישראל בע""מ",520007030.0,ח.פ.,אופציה לס דולר שקל DISCOUNT C3.75 26/11/25 BUY,750000049.0,פנימי,"מט""ח",ישראל,"ארה""ב",שירותים פיננסיים,"מט""ח",2025-11-26,לא,2025-05-28,USD,גורם תלוי/פנימי,קיימת תלות,2025-09-30,3.75,1.0,6780.87,0.0018,3.306,0.0,-0.000215,0.0,,
1328,15314.0,"בנק דיסקונט לישראל בע""מ",520007030.0,ח.פ.,אופציה לס דולר שקל DISCOUNT C3.4 26/11/25 SELL,750000116.0,פנימי,"מט""ח",ישראל,"ארה""ב",שירותים פיננסיים,"מט""ח",2025-11-26,לא,2025-08-13,USD,גורם תלוי/פנימי,קיימת תלות,2025-09-30,3.4,1.0,-3390.43,0.4649,3.306,-0.052,0.027212,-3e-06,,
1328,15314.0,"בנק לאומי לישראל בע""מ",520018078.0,ח.פ.,אופציה לס דולר שקל LEUMI P3.7 13/10/25 L,750000029.0,פנימי,"מט""ח",ישראל,"ארה""ב",שירותים פיננסיים,"מט""ח",2025-10-13,לא,2025-04-09,USD,גורם תלוי/פנימי,קיימת תלות,2025-09-30,3.7,1.0,6803.36,11.897,3.306,2.676,-1.397332,0.000198,,
1328,15314.0,"בנק לאומי לישראל בע""מ",520018078.0,ח.פ.,אופציה לס דולר שקל LEUMI C3.38 01/12/25 SELL,750000120.0,פנימי,"מט""ח",ישראל,"ארה""ב",שירותים פיננסיים,"מט""ח",2025-12-01,לא,2025-08-25,USD,גורם תלוי/פנימי,קיימת תלות,2025-09-30,3.38,1.0,-3390.43,0.636,3.306,-0.071,0.037222,-5e-06,,
1328,15314.0,Goldman Sachs Group Inc,11778.0,פנימי,"אופציה לס GS C1,637.14 ESLT.TA 15/10/25 SELL",750000115.0,פנימי,מניה,ישראל,ישראל,Financial Services,מניות לרבות מדדי מניות,2025-10-15,לא,2025-08-12,ILS,גורם תלוי/פנימי,קיימת תלות,2025-09-30,1637.14,1.0,-1.01,7692.5,1.0,-0.078,0.040766,-5e-06,,
1328,15314.0,"בנק לאומי לישראל בע""מ",520018078.0,ח.פ.,אופציה לס דולר שקל LEUMI C3.39 05/12/25 SELL,750000124.0,פנימי,"מט""ח",ישראל,"ארה""ב",שירותים פיננסיים,"מט""ח",2025-12-05,לא,2025-09-02,USD,גורם תלוי/פנימי,קיימת תלות,2025-09-30,3.39,1.0,-3401.81,0.6353,3.306,-0.071,0.037306,-5e-06,,
1328,15314.0,"בנק דיסקונט לישראל בע""מ",520007030.0,ח.פ.,אופציה לס דולר שקל DISCOUNT P3.55 08/10/25,750000020.0,פנימי,"מט""ח",ישראל,"ארה""ב",שירותים פיננסיים,"מט""ח",2025-10-08,לא,2025-04-08,USD,גורם תלוי/פנימי,קיימת תלות,2025-09-30,3.55,1.0,-13607.18,7.3698,3.306,-3.315,1.73117,-0.000246,,
1328,15314.0,"בנק דיסקונט לישראל בע""מ",520007030.0,ח.פ.,אופציה לס דולר שקל DISCOUNT C3.6 24/03/26 BUY,750000141.0,פנימי,"מט""ח",ישראל,"ארה""ב",שירותים פיננסיים,"מט""ח",2026-03-24,לא,2025-09-22,USD,גורם תלוי/פנימי,קיימת תלות,2025-09-30,3.6,1.0,6804.04,0.4815,3.306,0.108,-0.056551,8e-06,,
1328,15314.0,"בנק לאומי לישראל בע""מ",520018078.0,ח.פ.,אופציה לס דולר שקל Leumi P3.7 13/10/25 S,750000040.0,פנימי,"מט""ח",ישראל,"ארה""ב",שירותים פיננסיים,"מט""ח",2025-10-13,לא,2025-05-08,USD,גורם תלוי/פנימי,קיימת תלות,2025-09-30,3.7,1.0,-6803.36,11.893,3.306,-2.675,1.396785,-0.000198,,
1328,15314.0,"בנק דיסקונט לישראל בע""מ",520007030.0,ח.פ.,אופציה לס דולר שקל DISCOUNT P3.4 26/11/25 SELL,750000048.0,פנימי,"מט""ח",ישראל,"ארה""ב",שירותים פיננסיים,"מט""ח",2025-11-26,לא,2025-05-28,USD,גורם תלוי/פנימי,קיימת תלות,2025-09-30,3.4,1.0,-3390.43,3.267,3.306,-0.366,0.191216,-2.7e-05,,
1328,15314.0,"בנק לאומי לישראל בע""מ",520018078.0,ח.פ.,אופציה לס דולר שקל LEUMI P3.38 01/12/25 SELL,750000052.0,פנימי,"מט""ח",ישראל,"ארה""ב",שירותים פיננסיים,"מט""ח",2025-12-01,לא,2025-05-29,USD,גורם תלוי/פנימי,קיימת תלות,2025-09-30,3.38,1.0,-3390.43,2.8466,3.306,-0.319,0.166609,-2.3e-05,,
1328,15314.0,"בנק לאומי לישראל בע""מ",520018078.0,ח.פ.,אופציה לס דולר שקל LEUMI C3.59 06/01/26 BUY,750000125.0,פנימי,"מט""ח",ישראל,"ארה""ב",שירותים פיננסיים,"מט""ח",2026-01-05,לא,2025-09-02,USD,גורם תלוי/פנימי,קיימת תלות,2025-09-30,3.59,1.0,10205.45,0.1726,3.306,0.058,-0.030401,4e-06,,
1328,15314.0,"בנק דיסקונט לישראל בע""מ",520007030.0,ח.פ.,אופציה לס דולר שקל DISCOUNT P3.21 12/03/26 SELL,750000133.0,פנימי,"מט""ח",ישראל,"ארה""ב",שירותים פיננסיים,"מט""ח",2026-03-12,לא,2025-09-12,USD,גורם תלוי/פנימי,קיימת תלות,2025-09-30,3.21,1.0,-3402.02,1.0491,3.306,-0.118,0.06161,-8e-06,,
1328,15314.0,"בנק הפועלים בע""מ",520000118.0,ח.פ.,אופציה לס דולר שקל POALIM C3.7 05/12/25 SELL,750000096.0,פנימי,"מט""ח",ישראל,"ארה""ב",שירותים פיננסיים,"מט""ח",2025-12-05,לא,2025-07-10,USD,גורם תלוי/פנימי,קיימת תלות,2025-09-30,3.7,1.0,-6803.63,0.0268,3.306,-0.006,0.003144,0.0,,
1328,15314.0,"בנק הפועלים בע""מ",520000118.0,ח.פ.,אופציה לס דולר שקל POALIM P3.6 06/10/25,750000017.0,פנימי,"מט""ח",ישראל,"ארה""ב",שירותים פיננסיים,"מט""ח",2025-10-06,לא,2025-04-04,USD,גורם תלוי/פנימי,קיימת תלות,2025-09-30,3.6,1.0,6803.63,8.8859,3.306,1.999,-1.043654,0.000148,,
1328,15314.0,"בנק הפועלים בע""מ",520000118.0,ח.פ.,אופציה לס דולר שקל POALIM P3.39 05/12/25 SELL,750000058.0,פנימי,"מט""ח",ישראל,"ארה""ב",שירותים פיננסיים,"מט""ח",2025-12-05,לא,2025-06-06,USD,גורם תלוי/פנימי,קיימת תלות,2025-09-30,3.39,1.0,-3401.81,3.1116,3.306,-0.35,0.182731,-2.5e-05,,
1328,15314.0,"בנק דיסקונט לישראל בע""מ",520007030.0,ח.פ.,אופציה לס דולר שקל DISCOUNT P3.25 24/03/26 SELL,750000142.0,פנימי,"מט""ח",ישראל,"ארה""ב",שירותים פיננסיים,"מט""ח",2026-03-24,לא,2025-09-22,USD,גורם תלוי/פנימי,קיימת תלות,2025-09-30,3.25,1.0,-3402.02,1.5316,3.306,-0.172,0.089951,-1.2e-05,,
1328,15314.0,"Citibank, NA",70652.0,פנימי,אופציה לס דולר שקל CITI C3.38 18/12/25 SELL,750000091.0,פנימי,"מט""ח","חו""ל","ארה""ב",Financial Services,"מט""ח",2025-12-18,לא,2025-07-03,USD,גורם תלוי/פנימי,קיימת תלות,2025-09-30,3.38,1.0,-2948.26,0.8985,3.306,-0.088,0.045727,-6e-06,,
1328,15314.0,"Citibank, NA",70652.0,פנימי,אופציה לס דולר שקל CITI P3.22 06/03/26 SELL,750000129.0,פנימי,"מט""ח","חו""ל","ארה""ב",Financial Services,"מט""ח",2026-03-06,לא,2025-09-09,USD,גורם תלוי/פנימי,קיימת תלות,2025-09-30,3.22,1.0,-3401.85,1.1426,3.306,-0.129,0.067103,-9e-06,,
1328,15314.0,Goldman Sachs Group Inc,11778.0,פנימי,אופציה לס אירו שקל GS P3.9 03/10/25 SELL,750000085.0,פנימי,"מט""ח","חו""ל",אירופה,Financial Services,"מט""ח",2025-10-03,לא,2025-07-07,EUR,גורם תלוי/פנימי,קיימת תלות,2025-09-30,3.9,1.0,-1133.93,0.6576,3.8807,-0.029,0.015109,-2e-06,,
1328,15314.0,Goldman Sachs Group Inc,11778.0,פנימי,אופציה לס אירו שקל GS P3.7 03/10/25 BUY,750000086.0,פנימי,"מט""ח","חו""ל",אירופה,Financial Services,"מט""ח",2025-10-03,לא,2025-07-01,EUR,גורם תלוי/פנימי,קיימת תלות,2025-09-30,3.7,1.0,5669.65,0.0001,3.8807,0.0,-2e-06,0.0,,
1328,15314.0,"Citibank, NA",70652.0,פנימי,אופציה לס דולר שקל CITI C3.62 18/12/25 BUY,750000092.0,פנימי,"מט""ח","חו""ל","ארה""ב",Financial Services,"מט""ח",2025-12-18,לא,2025-07-03,USD,גורם תלוי/פנימי,קיימת תלות,2025-09-30,3.62,1.0,8844.8,0.0949,3.306,0.028,-0.014483,2e-06,,
1328,15314.0,"Citibank, NA",70652.0,פנימי,אופציה לס דולר שקל CITI C3.60 18/12/25 BUY,750000103.0,פנימי,"מט""ח","חו""ל","ארה""ב",Financial Services,"מט""ח",2025-12-18,לא,2025-07-16,USD,גורם תלוי/פנימי,קיימת תלות,2025-09-30,3.6,1.0,4989.36,0.1201,3.306,0.02,-0.010348,1e-06,,
1328,15314.0,"Citibank, NA",70652.0,פנימי,אופציה לס דולר שקל CITI C3.575 06/03/26 BUY,750000128.0,פנימי,"מט""ח","חו""ל","ארה""ב",Financial Services,"מט""ח",2026-03-06,לא,2025-09-09,USD,גורם תלוי/פנימי,קיימת תלות,2025-09-30,3.575,1.0,6803.7,0.5176,3.306,0.116,-0.06079,8e-06,,
1328,15314.0,Goldman Sachs Group Inc,11778.0,פנימי,אופציה לס אירו שקל GS C4.2 03/10/25 BUY,750000122.0,פנימי,"מט""ח","חו""ל",אירופה,Financial Services,"מט""ח",2025-10-03,לא,2025-08-27,EUR,גורם תלוי/פנימי,קיימת תלות,2025-09-30,4.2,1.0,2271.04,0.0001,3.8807,0.0,-3e-06,0.0,,
1328,15314.0,"Citibank, NA",70652.0,פנימי,אופציה לס דולר שקל CITI C3.75 18/12/25 SELL,750000102.0,פנימי,"מט""ח","חו""ל","ארה""ב",Financial Services,"מט""ח",2025-12-18,לא,2025-07-16,USD,גורם תלוי/פנימי,קיימת תלות,2025-09-30,3.75,1.0,-4989.36,0.0287,3.306,-0.005,0.002472,0.0,,
1328,15314.0,Goldman Sachs Group Inc,11778.0,פנימי,אופציה לס אירו שקל GS P3.9 03/10/25 SELL,750000093.0,פנימי,"מט""ח","חו""ל",אירופה,Financial Services,"מט""ח",2025-10-03,לא,2025-07-01,EUR,גורם תלוי/פנימי,קיימת תלות,2025-09-30,3.9,1.0,-4542.08,0.6604,3.8807,-0.116,0.060787,-8e-06,,
1328,15314.0,"Citibank, NA",70652.0,פנימי,אופציה לס דולר שקל CITI C3.75 18/12/25 BUY,750000067.0,פנימי,"מט""ח","חו""ל","ארה""ב",Financial Services,"מט""ח",2025-12-18,לא,2025-06-17,USD,גורם תלוי/פנימי,קיימת תלות,2025-09-30,3.75,1.0,4989.36,0.0299,3.306,0.005,-0.002574,0.0,,
1328,15314.0,"Citibank, NA",70652.0,פנימי,אופציה לס דולר שקל CITI P3.38 18/12/25 SELL,750000066.0,פנימי,"מט""ח","חו""ל","ארה""ב",Financial Services,"מט""ח",2025-12-18,לא,2025-06-17,USD,גורם תלוי/פנימי,קיימת תלות,2025-09-30,3.38,1.0,-2948.26,3.2367,3.306,-0.315,0.164732,-2.3e-05,,
1329,8580.0,"בנק הפועלים בע""מ",520000118.0,ח.פ.,אופציה לס דולר שקל POALIM P3.6 06/10/25 SELL,750000056.0,פנימי,"מט""ח",ישראל,"ארה""ב",שירותים פיננסיים,"מט""ח",2025-10-06,לא,2025-06-04,USD,גורם תלוי/פנימי,קיימת תלות,2025-09-30,3.6,1.0,-268.23,8.8822,3.306,-0.079,1.043224,-0.000312,,
1329,8580.0,"בנק דיסקונט לישראל בע""מ",520007030.0,ח.פ.,אופציה לס דולר שקל DISCOUNT C3.58 23/12/25 BUY,750000076.0,פנימי,"מט""ח",ישראל,"ארה""ב",שירותים פיננסיים,"מט""ח",2025-12-23,לא,2025-06-26,USD,גורם תלוי/פנימי,קיימת תלות,2025-09-30,3.58,1.0,134.12,0.1439,3.306,0.001,-0.008448,2e-06,,
1329,8580.0,"בנק לאומי לישראל בע""מ",520018078.0,ח.פ.,אופציה לס דולר שקל Leumi P3.6 13/10/25 L,750000041.0,פנימי,"מט""ח",ישראל,"ארה""ב",שירותים פיננסיים,"מט""ח",2025-10-13,לא,2025-05-08,USD,גורם תלוי/פנימי,קיימת תלות,2025-09-30,3.6,1.0,268.22,8.8777,3.306,0.079,-1.042649,0.000312,,
1329,8580.0,"בנק דיסקונט לישראל בע""מ",520007030.0,ח.פ.,אופציה לס דולר שקל DISCOUNT P3.55 08/10/25 BUY,750000046.0,פנימי,"מט""ח",ישראל,"ארה""ב",שירותים פיננסיים,"מט""ח",2025-10-08,לא,2025-05-21,USD,גורם תלוי/פנימי,קיימת תלות,2025-09-30,3.55,1.0,536.46,7.3726,3.306,0.131,-1.731831,0.000518,,
1329,8580.0,"בנק הפועלים בע""מ",520000118.0,ח.פ.,אופציה לס דולר שקל POALIM C3.6 05/12/25 BUY,750000099.0,פנימי,"מט""ח",ישראל,"ארה""ב",שירותים פיננסיים,"מט""ח",2025-12-05,לא,2025-05-14,USD,גורם תלוי/פנימי,קיימת תלות,2025-09-30,3.6,1.0,268.23,0.0815,3.306,0.001,-0.00957,2e-06,,
1329,8580.0,"בנק הפועלים בע""מ",520000118.0,ח.פ.,אופציה לס דולר שקל POALIM C3.70 05/12/25 BUY,750000059.0,פנימי,"מט""ח",ישראל,"ארה""ב",שירותים פיננסיים,"מט""ח",2025-12-05,לא,2025-06-06,USD,גורם תלוי/פנימי,קיימת תלות,2025-09-30,3.7,1.0,268.23,0.0091,3.306,0.0,-0.001065,0.0,,
1329,8580.0,"בנק לאומי לישראל בע""מ",520018078.0,ח.פ.,אופציה לס דולר שקל LEUMI C3.73 01/12/25 BUY,750000053.0,פנימי,"מט""ח",ישראל,"ארה""ב",שירותים פיננסיים,"מט""ח",2025-12-01,לא,2025-05-29,USD,גורם תלוי/פנימי,קיימת תלות,2025-09-30,3.73,1.0,267.33,0.004,3.306,0.0,-0.00047,0.0,,
1329,8580.0,Goldman Sachs Group Inc,11778.0,פנימי,אופציה לס אירו שקל GS C4.2 03/10/25,750000010.0,פנימי,"מט""ח","חו""ל",אירופה,Financial Services,"מט""ח",2025-10-03,לא,2025-04-03,EUR,גורם תלוי/פנימי,קיימת תלות,2025-09-30,4.2,1.0,-89.53,0.0001,3.8807,0.0,4e-06,0.0,,
1329,8580.0,"בנק לאומי לישראל בע""מ",520018078.0,ח.פ.,אופציה לס דולר שקל LEUMI P3.6 13/10/25 S,750000027.0,פנימי,"מט""ח",ישראל,"ארה""ב",שירותים פיננסיים,"מט""ח",2025-10-13,לא,2025-04-09,USD,גורם תלוי/פנימי,קיימת תלות,2025-09-30,3.6,1.0,-268.22,8.8731,3.306,-0.079,1.042109,-0.000312,,
1329,8580.0,"בנק דיסקונט לישראל בע""מ",520007030.0,ח.פ.,אופציה לס דולר שקל DISCOUNT P3.65 08/10/25 SELL,750000045.0,פנימי,"מט""ח",ישראל,"ארה""ב",שירותים פיננסיים,"מט""ח",2025-10-08,לא,2025-05-21,USD,גורם תלוי/פנימי,קיימת תלות,2025-09-30,3.65,1.0,-536.46,10.391,3.306,-0.184,2.440987,-0.00073,,
1329,8580.0,"בנק הפועלים בע""מ",520000118.0,ח.פ.,אופציה לס דולר שקל POALIM P3.5 06/10/25 BUY,750000057.0,פנימי,"מט""ח",ישראל,"ארה""ב",שירותים פיננסיים,"מט""ח",2025-10-06,לא,2025-06-04,USD,גורם תלוי/פנימי,קיימת תלות,2025-09-30,3.5,1.0,268.23,5.8625,3.306,0.052,-0.688558,0.000206,,
1329,8580.0,Goldman Sachs Group Inc,11778.0,פנימי,אופציה לס אירו שקל GS P3.9 03/10/25,750000011.0,פנימי,"מט""ח","חו""ל",אירופה,Financial Services,"מט""ח",2025-10-03,לא,2025-04-03,EUR,גורם תלוי/פנימי,קיימת תלות,2025-09-30,3.9,1.0,223.84,0.6786,3.8807,0.006,-0.078077,2.3e-05,,
1329,8580.0,Goldman Sachs Group Inc,11778.0,פנימי,אופציה לס אירו שקל GS P3.7 03/10/25,750000012.0,פנימי,"מט""ח","חו""ל",אירופה,Financial Services,"מט""ח",2025-10-03,לא,2025-04-03,EUR,גורם תלוי/פנימי,קיימת תלות,2025-09-30,3.7,1.0,-223.84,0.0001,3.8807,0.0,2e-06,0.0,,
1329,8580.0,"בנק דיסקונט לישראל בע""מ",520007030.0,ח.פ.,אופציה לס דולר שקל DISCOUNT P3.29 23/12/25 SELL,750000077.0,פנימי,"מט""ח",ישראל,"ארה""ב",שירותים פיננסיים,"מט""ח",2025-12-23,לא,2025-06-26,USD,גורם תלוי/פנימי,קיימת תלות,2025-09-30,3.29,1.0,-134.12,1.4861,3.306,-0.007,0.087273,-2.6e-05,,
1329,8580.0,"בנק לאומי לישראל בע""מ",520018078.0,ח.פ.,אופציה לס דולר שקל LEUMI C3.60 07/01/26 BUY,750000121.0,פנימי,"מט""ח",ישראל,"ארה""ב",שירותים פיננסיים,"מט""ח",2026-01-07,לא,2025-08-25,USD,גורם תלוי/פנימי,קיימת תלות,2025-09-30,3.6,1.0,401.0,0.1624,3.306,0.002,-0.02852,8e-06,,
1329,8580.0,"בנק לאומי לישראל בע""מ",520018078.0,ח.פ.,אופציה לס דולר שקל LEUMI C3.6 01/12/25 BUY,750000098.0,פנימי,"מט""ח",ישראל,"ארה""ב",שירותים פיננסיים,"מט""ח",2025-12-01,לא,2025-07-10,USD,גורם תלוי/פנימי,קיימת תלות,2025-09-30,3.6,1.0,267.33,0.0679,3.306,0.001,-0.007949,2e-06,,
1329,8580.0,"בנק דיסקונט לישראל בע""מ",520007030.0,ח.פ.,אופציה לס דולר שקל DISCOUNT C3.55 13/01/26 BUY,750000117.0,פנימי,"מט""ח",ישראל,"ארה""ב",שירותים פיננסיים,"מט""ח",2026-01-13,לא,2025-08-13,USD,גורם תלוי/פנימי,קיימת תלות,2025-09-30,3.55,1.0,267.33,0.2679,3.306,0.002,-0.031364,9e-06,,
1329,8580.0,"בנק הפועלים בע""מ",520000118.0,ח.פ.,אופציה לס דולר שקל POALIM P3.5 06/10/25,750000016.0,פנימי,"מט""ח",ישראל,"ארה""ב",שירותים פיננסיים,"מט""ח",2025-10-06,לא,2025-04-04,USD,גורם תלוי/פנימי,קיימת תלות,2025-09-30,3.5,1.0,-268.23,5.8612,3.306,-0.052,0.688405,-0.000206,,
1329,8580.0,"בנק דיסקונט לישראל בע""מ",520007030.0,ח.פ.,אופציה לס דולר שקל DISCOUNT C3.575 12/03/26 BUY,750000132.0,פנימי,"מט""ח",ישראל,"ארה""ב",שירותים פיננסיים,"מט""ח",2026-03-12,לא,2025-09-12,USD,גורם תלוי/פנימי,קיימת תלות,2025-09-30,3.575,1.0,268.25,0.5282,3.306,0.005,-0.062043,1.8e-05,,
1329,8580.0,"בנק הפועלים בע""מ",520000118.0,ח.פ.,אופציה לס דולר שקל POALIM P3.25 26/03/26 SELL,750000146.0,פנימי,"מט""ח",ישראל,"ארה""ב",שירותים פיננסיים,"מט""ח",2026-03-26,לא,2025-09-26,USD,גורם תלוי/פנימי,קיימת תלות,2025-09-30,3.25,1.0,-134.12,1.582,3.306,-0.007,0.092907,-2.7e-05,,
1329,8580.0,"בנק דיסקונט לישראל בע""מ",520007030.0,ח.פ.,אופציה לס דולר שקל DISCOUNT C3.4 26/11/25 SELL,750000116.0,פנימי,"מט""ח",ישראל,"ארה""ב",שירותים פיננסיים,"מט""ח",2025-11-26,לא,2025-08-13,USD,גורם תלוי/פנימי,קיימת תלות,2025-09-30,3.4,1.0,-133.66,0.4649,3.306,-0.002,0.027212,-8e-06,,
1329,8580.0,"בנק לאומי לישראל בע""מ",520018078.0,ח.פ.,אופציה לס דולר שקל LEUMI C3.73 01/12/25 SELL,750000097.0,פנימי,"מט""ח",ישראל,"ארה""ב",שירותים פיננסיים,"מט""ח",2025-12-01,לא,2025-07-10,USD,גורם תלוי/פנימי,קיימת תלות,2025-09-30,3.73,1.0,-267.33,0.0145,3.306,0.0,0.001696,0.0,,
1329,8580.0,"בנק הפועלים בע""מ",520000118.0,ח.פ.,אופציה לס דולר שקל POALIM C3.7 05/12/25 SELL 15/07,750000100.0,פנימי,"מט""ח",ישראל,"ארה""ב",שירותים פיננסיים,"מט""ח",2025-12-05,לא,2025-05-14,USD,גורם תלוי/פנימי,קיימת תלות,2025-09-30,3.7,1.0,-268.23,0.0277,3.306,0.0,0.003254,0.0,,
1329,8580.0,"בנק דיסקונט לישראל בע""מ",520007030.0,ח.פ.,אופציה לס דולר שקל DISCOUNT C3.29 23/12/25 SELL,750000094.0,פנימי,"מט""ח",ישראל,"ארה""ב",שירותים פיננסיים,"מט""ח",2025-12-23,לא,2025-07-10,USD,גורם תלוי/פנימי,קיימת תלות,2025-09-30,3.29,1.0,-134.12,2.0174,3.306,-0.009,0.118473,-3.5e-05,,
1329,8580.0,"בנק דיסקונט לישראל בע""מ",520007030.0,ח.פ.,אופציה לס דולר שקל DISCOUNT P3.65 08/10/25,750000019.0,פנימי,"מט""ח",ישראל,"ארה""ב",שירותים פיננסיים,"מט""ח",2025-10-08,לא,2025-04-08,USD,גורם תלוי/פנימי,קיימת תלות,2025-09-30,3.65,1.0,536.46,10.394,3.306,0.184,-2.441655,0.000731,,
1329,8580.0,"בנק הפועלים בע""מ",520000118.0,ח.פ.,אופציה לס דולר שקל POALIM C3.5 05/12/25 BUY,750000095.0,פנימי,"מט""ח",ישראל,"ארה""ב",שירותים פיננסיים,"מט""ח",2025-12-05,לא,2025-07-10,USD,גורם תלוי/פנימי,קיימת תלות,2025-09-30,3.5,1.0,268.23,0.2323,3.306,0.002,-0.02728,8e-06,,
1329,8580.0,"בנק הפועלים בע""מ",520000118.0,ח.פ.,אופציה לס דולר שקל POALIM C3.59 26/03/26 BUY,750000145.0,פנימי,"מט""ח",ישראל,"ארה""ב",שירותים פיננסיים,"מט""ח",2026-03-26,לא,2025-09-26,USD,גורם תלוי/פנימי,קיימת תלות,2025-09-30,3.59,1.0,268.25,0.5462,3.306,0.005,-0.064154,1.9e-05,,
1329,8580.0,Goldman Sachs Group Inc,11778.0,פנימי,"אופציה לס GS C1,637.14 ESLT.TA 15/10/25 SELL",750000115.0,פנימי,מניה,ישראל,ישראל,Financial Services,מניות לרבות מדדי מניות,2025-10-15,לא,2025-08-12,ILS,גורם תלוי/פנימי,קיימת תלות,2025-09-30,1637.14,1.0,-0.04,7692.5,1.0,-0.003,0.040766,-1.2e-05,,
1329,8580.0,"בנק דיסקונט לישראל בע""מ",520007030.0,ח.פ.,אופציה לס דולר שקל DISCOUNT C3.75 26/11/25 BUY,750000049.0,פנימי,"מט""ח",ישראל,"ארה""ב",שירותים פיננסיים,"מט""ח",2025-11-26,לא,2025-05-28,USD,גורם תלוי/פנימי,קיימת תלות,2025-09-30,3.75,1.0,267.33,0.0018,3.306,0.0,-0.000215,0.0,,
1329,8580.0,"בנק לאומי לישראל בע""מ",520018078.0,ח.פ.,אופציה לס דולר שקל LEUMI P3.7 13/10/25 L,750000029.0,פנימי,"מט""ח",ישראל,"ארה""ב",שירותים פיננסיים,"מט""ח",2025-10-13,לא,2025-04-09,USD,גורם תלוי/פנימי,קיימת תלות,2025-09-30,3.7,1.0,268.22,11.897,3.306,0.106,-1.397332,0.000418,,
1329,8580.0,"בנק דיסקונט לישראל בע""מ",520007030.0,ח.פ.,אופציה לס דולר שקל DISCOUNT C3.6 24/03/26 BUY,750000141.0,פנימי,"מט""ח",ישראל,"ארה""ב",שירותים פיננסיים,"מט""ח",2026-03-24,לא,2025-09-22,USD,גורם תלוי/פנימי,קיימת תלות,2025-09-30,3.6,1.0,268.25,0.4815,3.306,0.004,-0.056551,1.6e-05,,
1329,8580.0,"בנק לאומי לישראל בע""מ",520018078.0,ח.פ.,אופציה לס דולר שקל LEUMI C3.39 05/12/25 SELL,750000124.0,פנימי,"מט""ח",ישראל,"ארה""ב",שירותים פיננסיים,"מט""ח",2025-12-05,לא,2025-09-02,USD,גורם תלוי/פנימי,קיימת תלות,2025-09-30,3.39,1.0,-134.11,0.6353,3.306,-0.003,0.037306,-1.1e-05,,
1329,8580.0,"בנק לאומי לישראל בע""מ",520018078.0,ח.פ.,אופציה לס דולר שקל LEUMI C3.38 01/12/25 SELL,750000120.0,פנימי,"מט""ח",ישראל,"ארה""ב",שירותים פיננסיים,"מט""ח",2025-12-01,לא,2025-08-25,USD,גורם תלוי/פנימי,קיימת תלות,2025-09-30,3.38,1.0,-133.66,0.636,3.306,-0.003,0.037222,-1.1e-05,,
1329,8580.0,"בנק לאומי לישראל בע""מ",520018078.0,ח.פ.,אופציה לס דולר שקל LEUMI P3.38 01/12/25 SELL,750000052.0,פנימי,"מט""ח",ישראל,"ארה""ב",שירותים פיננסיים,"מט""ח",2025-12-01,לא,2025-05-29,USD,גורם תלוי/פנימי,קיימת תלות,2025-09-30,3.38,1.0,-133.66,2.8466,3.306,-0.013,0.166609,-4.9e-05,,
1329,8580.0,"בנק דיסקונט לישראל בע""מ",520007030.0,ח.פ.,אופציה לס דולר שקל DISCOUNT P3.4 26/11/25 SELL,750000048.0,פנימי,"מט""ח",ישראל,"ארה""ב",שירותים פיננסיים,"מט""ח",2025-11-26,לא,2025-05-28,USD,גורם תלוי/פנימי,קיימת תלות,2025-09-30,3.4,1.0,-133.66,3.267,3.306,-0.014,0.191216,-5.7e-05,,
1329,8580.0,"בנק לאומי לישראל בע""מ",520018078.0,ח.פ.,אופציה לס דולר שקל Leumi P3.7 13/10/25 S,750000040.0,פנימי,"מט""ח",ישראל,"ארה""ב",שירותים פיננסיים,"מט""ח",2025-10-13,לא,2025-05-08,USD,גורם תלוי/פנימי,קיימת תלות,2025-09-30,3.7,1.0,-268.22,11.893,3.306,-0.105,1.396785,-0.000418,,
1329,8580.0,"בנק דיסקונט לישראל בע""מ",520007030.0,ח.פ.,אופציה לס דולר שקל DISCOUNT P3.55 08/10/25,750000020.0,פנימי,"מט""ח",ישראל,"ארה""ב",שירותים פיננסיים,"מט""ח",2025-10-08,לא,2025-04-08,USD,גורם תלוי/פנימי,קיימת תלות,2025-09-30,3.55,1.0,-536.46,7.3698,3.306,-0.131,1.73117,-0.000518,,
1329,8580.0,"בנק לאומי לישראל בע""מ",520018078.0,ח.פ.,אופציה לס דולר שקל LEUMI C3.59 06/01/26 BUY,750000125.0,פנימי,"מט""ח",ישראל,"ארה""ב",שירותים פיננסיים,"מט""ח",2026-01-05,לא,2025-09-02,USD,גורם תלוי/פנימי,קיימת תלות,2025-09-30,3.59,1.0,402.35,0.1726,3.306,0.002,-0.030401,9e-06,,
1329,8580.0,"בנק דיסקונט לישראל בע""מ",520007030.0,ח.פ.,אופציה לס דולר שקל DISCOUNT P3.21 12/03/26 SELL,750000133.0,פנימי,"מט""ח",ישראל,"ארה""ב",שירותים פיננסיים,"מט""ח",2026-03-12,לא,2025-09-12,USD,גורם תלוי/פנימי,קיימת תלות,2025-09-30,3.21,1.0,-134.12,1.0491,3.306,-0.005,0.06161,-1.8e-05,,
1329,8580.0,"בנק הפועלים בע""מ",520000118.0,ח.פ.,אופציה לס דולר שקל POALIM P3.6 06/10/25,750000017.0,פנימי,"מט""ח",ישראל,"ארה""ב",שירותים פיננסיים,"מט""ח",2025-10-06,לא,2025-04-04,USD,גורם תלוי/פנימי,קיימת תלות,2025-09-30,3.6,1.0,268.23,8.8859,3.306,0.079,-1.043654,0.000312,,
1329,8580.0,"בנק הפועלים בע""מ",520000118.0,ח.פ.,אופציה לס דולר שקל POALIM P3.39 05/12/25 SELL,750000058.0,פנימי,"מט""ח",ישראל,"ארה""ב",שירותים פיננסיים,"מט""ח",2025-12-05,לא,2025-06-06,USD,גורם תלוי/פנימי,קיימת תלות,2025-09-30,3.39,1.0,-134.11,3.1116,3.306,-0.014,0.182731,-5.4e-05,,
1329,8580.0,"בנק דיסקונט לישראל בע""מ",520007030.0,ח.פ.,אופציה לס דולר שקל DISCOUNT P3.25 24/03/26 SELL,750000142.0,פנימי,"מט""ח",ישראל,"ארה""ב",שירותים פיננסיים,"מט""ח",2026-03-24,לא,2025-09-22,USD,גורם תלוי/פנימי,קיימת תלות,2025-09-30,3.25,1.0,-134.12,1.5316,3.306,-0.007,0.089951,-2.6e-05,,
1329,8580.0,"בנק הפועלים בע""מ",520000118.0,ח.פ.,אופציה לס דולר שקל POALIM C3.7 05/12/25 SELL,750000096.0,פנימי,"מט""ח",ישראל,"ארה""ב",שירותים פיננסיים,"מט""ח",2025-12-05,לא,2025-07-10,USD,גורם תלוי/פנימי,קיימת תלות,2025-09-30,3.7,1.0,-268.23,0.0268,3.306,0.0,0.003144,0.0,,
1329,8580.0,"Citibank, NA",70652.0,פנימי,אופציה לס דולר שקל CITI C3.38 18/12/25 SELL,750000091.0,פנימי,"מט""ח","חו""ל","ארה""ב",Financial Services,"מט""ח",2025-12-18,לא,2025-07-03,USD,גורם תלוי/פנימי,קיימת תלות,2025-09-30,3.38,1.0,-116.23,0.8985,3.306,-0.003,0.045727,-1.3e-05,,
1329,8580.0,"Citibank, NA",70652.0,פנימי,אופציה לס דולר שקל CITI P3.22 06/03/26 SELL,750000129.0,פנימי,"מט""ח","חו""ל","ארה""ב",Financial Services,"מט""ח",2026-03-06,לא,2025-09-09,USD,גורם תלוי/פנימי,קיימת תלות,2025-09-30,3.22,1.0,-134.11,1.1426,3.306,-0.005,0.067103,-2e-05,,
1329,8580.0,"Citibank, NA",70652.0,פנימי,אופציה לס דולר שקל CITI C3.60 18/12/25 BUY,750000103.0,פנימי,"מט""ח","חו""ל","ארה""ב",Financial Services,"מט""ח",2025-12-18,לא,2025-07-16,USD,גורם תלוי/פנימי,קיימת תלות,2025-09-30,3.6,1.0,196.7,0.1201,3.306,0.001,-0.010348,3e-06,,
1329,8580.0,"Citibank, NA",70652.0,פנימי,אופציה לס דולר שקל CITI C3.62 18/12/25 BUY,750000092.0,פנימי,"מט""ח","חו""ל","ארה""ב",Financial Services,"מט""ח",2025-12-18,לא,2025-07-03,USD,גורם תלוי/פנימי,קיימת תלות,2025-09-30,3.62,1.0,348.7,0.0949,3.306,0.001,-0.014483,4e-06,,
1329,8580.0,Goldman Sachs Group Inc,11778.0,פנימי,אופציה לס אירו שקל GS P3.9 03/10/25 SELL,750000085.0,פנימי,"מט""ח","חו""ל",אירופה,Financial Services,"מט""ח",2025-10-03,לא,2025-07-07,EUR,גורם תלוי/פנימי,קיימת תלות,2025-09-30,3.9,1.0,-44.7,0.6576,3.8807,-0.001,0.015109,-4e-06,,
1329,8580.0,Goldman Sachs Group Inc,11778.0,פנימי,אופציה לס אירו שקל GS P3.7 03/10/25 BUY,750000086.0,פנימי,"מט""ח","חו""ל",אירופה,Financial Services,"מט""ח",2025-10-03,לא,2025-07-01,EUR,גורם תלוי/פנימי,קיימת תלות,2025-09-30,3.7,1.0,223.52,0.0001,3.8807,0.0,-2e-06,0.0,,
1329,8580.0,"Citibank, NA",70652.0,פנימי,אופציה לס דולר שקל CITI C3.575 06/03/26 BUY,750000128.0,פנימי,"מט""ח","חו""ל","ארה""ב",Financial Services,"מט""ח",2026-03-06,לא,2025-09-09,USD,גורם תלוי/פנימי,קיימת תלות,2025-09-30,3.575,1.0,268.23,0.5176,3.306,0.005,-0.06079,1.8e-05,,
1329,8580.0,Goldman Sachs Group Inc,11778.0,פנימי,אופציה לס אירו שקל GS C4.2 03/10/25 BUY,750000122.0,פנימי,"מט""ח","חו""ל",אירופה,Financial Services,"מט""ח",2025-10-03,לא,2025-08-27,EUR,גורם תלוי/פנימי,קיימת תלות,2025-09-30,4.2,1.0,89.53,0.0001,3.8807,0.0,-3e-06,0.0,,
1329,8580.0,"Citibank, NA",70652.0,פנימי,אופציה לס דולר שקל CITI C3.75 18/12/25 SELL,750000102.0,פנימי,"מט""ח","חו""ל","ארה""ב",Financial Services,"מט""ח",2025-12-18,לא,2025-07-16,USD,גורם תלוי/פנימי,קיימת תלות,2025-09-30,3.75,1.0,-196.7,0.0287,3.306,0.0,0.002472,0.0,,
1329,8580.0,Goldman Sachs Group Inc,11778.0,פנימי,אופציה לס אירו שקל GS P3.9 03/10/25 SELL,750000093.0,פנימי,"מט""ח","חו""ל",אירופה,Financial Services,"מט""ח",2025-10-03,לא,2025-07-01,EUR,גורם תלוי/פנימי,קיימת תלות,2025-09-30,3.9,1.0,-179.07,0.6604,3.8807,-0.005,0.060787,-1.8e-05,,
1329,8580.0,"Citibank, NA",70652.0,פנימי,אופציה לס דולר שקל CITI C3.75 18/12/25 BUY,750000067.0,פנימי,"מט""ח","חו""ל","ארה""ב",Financial Services,"מט""ח",2025-12-18,לא,2025-06-17,USD,גורם תלוי/פנימי,קיימת תלות,2025-09-30,3.75,1.0,196.7,0.0299,3.306,0.0,-0.002574,0.0,,
1329,8580.0,"Citibank, NA",70652.0,פנימי,אופציה לס דולר שקל CITI P3.38 18/12/25 SELL,750000066.0,פנימי,"מט""ח","חו""ל","ארה""ב",Financial Services,"מט""ח",2025-12-18,לא,2025-06-17,USD,גורם תלוי/פנימי,קיימת תלות,2025-09-30,3.38,1.0,-116.23,3.2367,3.306,-0.012,0.164732,-4.9e-05,,
1329,9761.0,"בנק הפועלים בע""מ",520000118.0,ח.פ.,אופציה לס דולר שקל POALIM P3.6 06/10/25 SELL,750000056.0,פנימי,"מט""ח",ישראל,"ארה""ב",שירותים פיננסיים,"מט""ח",2025-10-06,לא,2025-06-04,USD,גורם תלוי/פנימי,קיימת תלות,2025-09-30,3.6,1.0,-1006183.83,8.8822,3.306,-295.462,1.043224,-0.000628,,
1329,9761.0,"בנק דיסקונט לישראל בע""מ",520007030.0,ח.פ.,אופציה לס דולר שקל DISCOUNT P3.55 08/10/25 BUY,750000046.0,פנימי,"מט""ח",ישראל,"ארה""ב",שירותים פיננסיים,"מט""ח",2025-10-08,לא,2025-05-21,USD,גורם תלוי/פנימי,קיימת תלות,2025-09-30,3.55,1.0,2012354.23,7.3726,3.306,490.489,-1.731831,0.001042,,
1329,9761.0,"בנק לאומי לישראל בע""מ",520018078.0,ח.פ.,אופציה לס דולר שקל Leumi P3.6 13/10/25 L,750000041.0,פנימי,"מט""ח",ישראל,"ארה""ב",שירותים פיננסיים,"מט""ח",2025-10-13,לא,2025-05-08,USD,גורם תלוי/פנימי,קיימת תלות,2025-09-30,3.6,1.0,1006143.53,8.8777,3.306,295.299,-1.042649,0.000627,,
1329,9761.0,"בנק דיסקונט לישראל בע""מ",520007030.0,ח.פ.,אופציה לס דולר שקל DISCOUNT C3.58 23/12/25 BUY,750000076.0,פנימי,"מט""ח",ישראל,"ארה""ב",שירותים פיננסיים,"מט""ח",2025-12-23,לא,2025-06-26,USD,גורם תלוי/פנימי,קיימת תלות,2025-09-30,3.58,1.0,503105.35,0.1439,3.306,2.393,-0.008448,5e-06,,
1329,9761.0,"בנק הפועלים בע""מ",520000118.0,ח.פ.,אופציה לס דולר שקל POALIM C3.70 05/12/25 BUY,750000059.0,פנימי,"מט""ח",ישראל,"ארה""ב",שירותים פיננסיים,"מט""ח",2025-12-05,לא,2025-06-06,USD,גורם תלוי/פנימי,קיימת תלות,2025-09-30,3.7,1.0,1006183.83,0.0091,3.306,0.302,-0.001065,0.0,,
1329,9761.0,"בנק לאומי לישראל בע""מ",520018078.0,ח.פ.,אופציה לס דולר שקל LEUMI C3.73 01/12/25 BUY,750000053.0,פנימי,"מט""ח",ישראל,"ארה""ב",שירותים פיננסיים,"מט""ח",2025-12-01,לא,2025-05-29,USD,גורם תלוי/פנימי,קיימת תלות,2025-09-30,3.73,1.0,1002818.49,0.004,3.306,0.133,-0.00047,0.0,,
1329,9761.0,Goldman Sachs Group Inc,11778.0,פנימי,אופציה לס אירו שקל GS C4.2 03/10/25,750000010.0,פנימי,"מט""ח","חו""ל",אירופה,Financial Services,"מט""ח",2025-10-03,לא,2025-04-03,EUR,גורם תלוי/פנימי,קיימת תלות,2025-09-30,4.2,1.0,-335862.57,0.0001,3.8807,-0.001,4e-06,0.0,,
1329,9761.0,"בנק לאומי לישראל בע""מ",520018078.0,ח.פ.,אופציה לס דולר שקל LEUMI P3.6 13/10/25 S,750000027.0,פנימי,"מט""ח",ישראל,"ארה""ב",שירותים פיננסיים,"מט""ח",2025-10-13,לא,2025-04-09,USD,גורם תלוי/פנימי,קיימת תלות,2025-09-30,3.6,1.0,-1006143.53,8.8731,3.306,-295.146,1.042109,-0.000627,,
1329,9761.0,Goldman Sachs Group Inc,11778.0,פנימי,אופציה לס אירו שקל GS P3.7 03/10/25,750000012.0,פנימי,"מט""ח","חו""ל",אירופה,Financial Services,"מט""ח",2025-10-03,לא,2025-04-03,EUR,גורם תלוי/פנימי,קיימת תלות,2025-09-30,3.7,1.0,-839656.44,0.0001,3.8807,-0.001,2e-06,0.0,,
1329,9761.0,Goldman Sachs Group Inc,11778.0,פנימי,אופציה לס אירו שקל GS P3.9 03/10/25,750000011.0,פנימי,"מט""ח","חו""ל",אירופה,Financial Services,"מט""ח",2025-10-03,לא,2025-04-03,EUR,גורם תלוי/פנימי,קיימת תלות,2025-09-30,3.9,1.0,839656.44,0.6786,3.8807,22.113,-0.078077,4.7e-05,,
1329,9761.0,"בנק הפועלים בע""מ",520000118.0,ח.פ.,אופציה לס דולר שקל POALIM P3.5 06/10/25 BUY,750000057.0,פנימי,"מט""ח",ישראל,"ארה""ב",שירותים פיננסיים,"מט""ח",2025-10-06,לא,2025-06-04,USD,גורם תלוי/פנימי,קיימת תלות,2025-09-30,3.5,1.0,1006183.83,5.8625,3.306,195.014,-0.688558,0.000414,,
1329,9761.0,"בנק דיסקונט לישראל בע""מ",520007030.0,ח.פ.,אופציה לס דולר שקל DISCOUNT P3.65 08/10/25 SELL,750000045.0,פנימי,"מט""ח",ישראל,"ארה""ב",שירותים פיננסיים,"מט""ח",2025-10-08,לא,2025-05-21,USD,גורם תלוי/פנימי,קיימת תלות,2025-09-30,3.65,1.0,-2012354.23,10.391,3.306,-691.336,2.440987,-0.00147,,
1329,9761.0,"בנק לאומי לישראל בע""מ",520018078.0,ח.פ.,אופציה לס דולר שקל LEUMI C3.6 01/12/25 BUY,750000098.0,פנימי,"מט""ח",ישראל,"ארה""ב",שירותים פיננסיים,"מט""ח",2025-12-01,לא,2025-07-10,USD,גורם תלוי/פנימי,קיימת תלות,2025-09-30,3.6,1.0,1002818.49,0.0679,3.306,2.251,-0.007949,4e-06,,
1329,9761.0,"בנק לאומי לישראל בע""מ",520018078.0,ח.פ.,אופציה לס דולר שקל LEUMI C3.60 07/01/26 BUY,750000121.0,פנימי,"מט""ח",ישראל,"ארה""ב",שירותים פיננסיים,"מט""ח",2026-01-07,לא,2025-08-25,USD,גורם תלוי/פנימי,קיימת תלות,2025-09-30,3.6,1.0,1504227.73,0.1624,3.306,8.078,-0.02852,1.7e-05,,
1329,9761.0,"בנק דיסקונט לישראל בע""מ",520007030.0,ח.פ.,אופציה לס דולר שקל DISCOUNT P3.29 23/12/25 SELL,750000077.0,פנימי,"מט""ח",ישראל,"ארה""ב",שירותים פיננסיים,"מט""ח",2025-12-23,לא,2025-06-26,USD,גורם תלוי/פנימי,קיימת תלות,2025-09-30,3.29,1.0,-503105.35,1.4861,3.306,-24.718,0.087273,-5.2e-05,,
1329,9761.0,"בנק הפועלים בע""מ",520000118.0,ח.פ.,אופציה לס דולר שקל POALIM C3.6 05/12/25 BUY,750000099.0,פנימי,"מט""ח",ישראל,"ארה""ב",שירותים פיננסיים,"מט""ח",2025-12-05,לא,2025-05-14,USD,גורם תלוי/פנימי,קיימת תלות,2025-09-30,3.6,1.0,1006183.83,0.0815,3.306,2.711,-0.00957,5e-06,,
1329,9761.0,"בנק דיסקונט לישראל בע""מ",520007030.0,ח.פ.,אופציה לס דולר שקל DISCOUNT C3.575 12/03/26 BUY,750000132.0,פנימי,"מט""ח",ישראל,"ארה""ב",שירותים פיננסיים,"מט""ח",2026-03-12,לא,2025-09-12,USD,גורם תלוי/פנימי,קיימת תלות,2025-09-30,3.575,1.0,1006244.28,0.5282,3.306,17.572,-0.062043,3.7e-05,,
1329,9761.0,"בנק דיסקונט לישראל בע""מ",520007030.0,ח.פ.,אופציה לס דולר שקל DISCOUNT C3.55 13/01/26 BUY,750000117.0,פנימי,"מט""ח",ישראל,"ארה""ב",שירותים פיננסיים,"מט""ח",2026-01-13,לא,2025-08-13,USD,גורם תלוי/פנימי,קיימת תלות,2025-09-30,3.55,1.0,1002818.49,0.2679,3.306,8.883,-0.031364,1.8e-05,,
1329,9761.0,"בנק הפועלים בע""מ",520000118.0,ח.פ.,אופציה לס דולר שקל POALIM C3.59 26/03/26 BUY,750000145.0,פנימי,"מט""ח",ישראל,"ארה""ב",שירותים פיננסיים,"מט""ח",2026-03-26,לא,2025-09-26,USD,גורם תלוי/פנימי,קיימת תלות,2025-09-30,3.59,1.0,1006244.28,0.5462,3.306,18.17,-0.064154,3.8e-05,,
1329,9761.0,"בנק הפועלים בע""מ",520000118.0,ח.פ.,אופציה לס דולר שקל POALIM P3.5 06/10/25,750000016.0,פנימי,"מט""ח",ישראל,"ארה""ב",שירותים פיננסיים,"מט""ח",2025-10-06,לא,2025-04-04,USD,גורם תלוי/פנימי,קיימת תלות,2025-09-30,3.5,1.0,-1006183.83,5.8612,3.306,-194.97,0.688405,-0.000414,,
1329,9761.0,"בנק דיסקונט לישראל בע""מ",520007030.0,ח.פ.,אופציה לס דולר שקל DISCOUNT P3.65 08/10/25,750000019.0,פנימי,"מט""ח",ישראל,"ארה""ב",שירותים פיננסיים,"מט""ח",2025-10-08,לא,2025-04-08,USD,גורם תלוי/פנימי,קיימת תלות,2025-09-30,3.65,1.0,2012354.23,10.394,3.306,691.525,-2.441655,0.00147,,
1329,9761.0,"בנק דיסקונט לישראל בע""מ",520007030.0,ח.פ.,אופציה לס דולר שקל DISCOUNT C3.29 23/12/25 SELL,750000094.0,פנימי,"מט""ח",ישראל,"ארה""ב",שירותים פיננסיים,"מט""ח",2025-12-23,לא,2025-07-10,USD,גורם תלוי/פנימי,קיימת תלות,2025-09-30,3.29,1.0,-503105.35,2.0174,3.306,-33.554,0.118473,-7.1e-05,,
1329,9761.0,"בנק הפועלים בע""מ",520000118.0,ח.פ.,אופציה לס דולר שקל POALIM C3.5 05/12/25 BUY,750000095.0,פנימי,"מט""ח",ישראל,"ארה""ב",שירותים פיננסיים,"מט""ח",2025-12-05,לא,2025-07-10,USD,גורם תלוי/פנימי,קיימת תלות,2025-09-30,3.5,1.0,1006183.83,0.2323,3.306,7.726,-0.02728,1.6e-05,,
1329,9761.0,"בנק לאומי לישראל בע""מ",520018078.0,ח.פ.,אופציה לס דולר שקל LEUMI C3.73 01/12/25 SELL,750000097.0,פנימי,"מט""ח",ישראל,"ארה""ב",שירותים פיננסיים,"מט""ח",2025-12-01,לא,2025-07-10,USD,גורם תלוי/פנימי,קיימת תלות,2025-09-30,3.73,1.0,-1002818.49,0.0145,3.306,-0.48,0.001696,-1e-06,,
1329,9761.0,"בנק הפועלים בע""מ",520000118.0,ח.פ.,אופציה לס דולר שקל POALIM C3.7 05/12/25 SELL 15/07,750000100.0,פנימי,"מט""ח",ישראל,"ארה""ב",שירותים פיננסיים,"מט""ח",2025-12-05,לא,2025-05-14,USD,גורם תלוי/פנימי,קיימת תלות,2025-09-30,3.7,1.0,-1006183.83,0.0277,3.306,-0.922,0.003254,-1e-06,,
1329,9761.0,"בנק דיסקונט לישראל בע""מ",520007030.0,ח.פ.,אופציה לס דולר שקל DISCOUNT C3.4 26/11/25 SELL,750000116.0,פנימי,"מט""ח",ישראל,"ארה""ב",שירותים פיננסיים,"מט""ח",2025-11-26,לא,2025-08-13,USD,גורם תלוי/פנימי,קיימת תלות,2025-09-30,3.4,1.0,-501409.24,0.4649,3.306,-7.707,0.027212,-1.6e-05,,
1329,9761.0,"בנק הפועלים בע""מ",520000118.0,ח.פ.,אופציה לס דולר שקל POALIM P3.25 26/03/26 SELL,750000146.0,פנימי,"מט""ח",ישראל,"ארה""ב",שירותים פיננסיים,"מט""ח",2026-03-26,לא,2025-09-26,USD,גורם תלוי/פנימי,קיימת תלות,2025-09-30,3.25,1.0,-503122.14,1.582,3.306,-26.313,0.092907,-5.5e-05,,
1329,9761.0,"בנק דיסקונט לישראל בע""מ",520007030.0,ח.פ.,אופציה לס דולר שקל DISCOUNT C3.75 26/11/25 BUY,750000049.0,פנימי,"מט""ח",ישראל,"ארה""ב",שירותים פיננסיים,"מט""ח",2025-11-26,לא,2025-05-28,USD,גורם תלוי/פנימי,קיימת תלות,2025-09-30,3.75,1.0,1002818.49,0.0018,3.306,0.061,-0.000215,0.0,,
1329,9761.0,"בנק לאומי לישראל בע""מ",520018078.0,ח.פ.,אופציה לס דולר שקל LEUMI P3.7 13/10/25 L,750000029.0,פנימי,"מט""ח",ישראל,"ארה""ב",שירותים פיננסיים,"מט""ח",2025-10-13,לא,2025-04-09,USD,גורם תלוי/פנימי,קיימת תלות,2025-09-30,3.7,1.0,1006143.53,11.897,3.306,395.752,-1.397332,0.000841,,
1329,9761.0,Goldman Sachs Group Inc,11778.0,פנימי,"אופציה לס GS C1,637.14 ESLT.TA 15/10/25 SELL",750000115.0,פנימי,מניה,ישראל,ישראל,Financial Services,מניות לרבות מדדי מניות,2025-10-15,לא,2025-08-12,ILS,גורם תלוי/פנימי,קיימת תלות,2025-09-30,1637.14,1.0,-150.09,7692.5,1.0,-11.546,0.040766,-2.4e-05,,
1329,9761.0,"בנק לאומי לישראל בע""מ",520018078.0,ח.פ.,אופציה לס דולר שקל LEUMI C3.38 01/12/25 SELL,750000120.0,פנימי,"מט""ח",ישראל,"ארה""ב",שירותים פיננסיים,"מט""ח",2025-12-01,לא,2025-08-25,USD,גורם תלוי/פנימי,קיימת תלות,2025-09-30,3.38,1.0,-501409.24,0.636,3.306,-10.542,0.037222,-2.2e-05,,
1329,9761.0,"בנק לאומי לישראל בע""מ",520018078.0,ח.פ.,אופציה לס דולר שקל LEUMI C3.39 05/12/25 SELL,750000124.0,פנימי,"מט""ח",ישראל,"ארה""ב",שירותים פיננסיים,"מט""ח",2025-12-05,לא,2025-09-02,USD,גורם תלוי/פנימי,קיימת תלות,2025-09-30,3.39,1.0,-503091.91,0.6353,3.306,-10.566,0.037306,-2.2e-05,,
1329,9761.0,"בנק דיסקונט לישראל בע""מ",520007030.0,ח.פ.,אופציה לס דולר שקל DISCOUNT C3.6 24/03/26 BUY,750000141.0,פנימי,"מט""ח",ישראל,"ארה""ב",שירותים פיננסיים,"מט""ח",2026-03-24,לא,2025-09-22,USD,גורם תלוי/פנימי,קיימת תלות,2025-09-30,3.6,1.0,1006244.28,0.4815,3.306,16.016,-0.056551,3.4e-05,,
1329,9761.0,"בנק דיסקונט לישראל בע""מ",520007030.0,ח.פ.,אופציה לס דולר שקל DISCOUNT P3.55 08/10/25,750000020.0,פנימי,"מט""ח",ישראל,"ארה""ב",שירותים פיננסיים,"מט""ח",2025-10-08,לא,2025-04-08,USD,גורם תלוי/פנימי,קיימת תלות,2025-09-30,3.55,1.0,-2012354.23,7.3698,3.306,-490.302,1.73117,-0.001042,,
1329,9761.0,"בנק לאומי לישראל בע""מ",520018078.0,ח.פ.,אופציה לס דולר שקל Leumi P3.7 13/10/25 S,750000040.0,פנימי,"מט""ח",ישראל,"ארה""ב",שירותים פיננסיים,"מט""ח",2025-10-13,לא,2025-05-08,USD,גורם תלוי/פנימי,קיימת תלות,2025-09-30,3.7,1.0,-1006143.53,11.893,3.306,-395.598,1.396785,-0.000841,,
1329,9761.0,"בנק דיסקונט לישראל בע""מ",520007030.0,ח.פ.,אופציה לס דולר שקל DISCOUNT P3.4 26/11/25 SELL,750000048.0,פנימי,"מט""ח",ישראל,"ארה""ב",שירותים פיננסיים,"מט""ח",2025-11-26,לא,2025-05-28,USD,גורם תלוי/פנימי,קיימת תלות,2025-09-30,3.4,1.0,-501409.24,3.267,3.306,-54.156,0.191216,-0.000115,,
1329,9761.0,"בנק לאומי לישראל בע""מ",520018078.0,ח.פ.,אופציה לס דולר שקל LEUMI P3.38 01/12/25 SELL,750000052.0,פנימי,"מט""ח",ישראל,"ארה""ב",שירותים פיננסיים,"מט""ח",2025-12-01,לא,2025-05-29,USD,גורם תלוי/פנימי,קיימת תלות,2025-09-30,3.38,1.0,-501409.24,2.8466,3.306,-47.187,0.166609,-0.0001,,
1329,9761.0,"בנק הפועלים בע""מ",520000118.0,ח.פ.,אופציה לס דולר שקל POALIM P3.6 06/10/25,750000017.0,פנימי,"מט""ח",ישראל,"ארה""ב",שירותים פיננסיים,"מט""ח",2025-10-06,לא,2025-04-04,USD,גורם תלוי/פנימי,קיימת תלות,2025-09-30,3.6,1.0,1006183.83,8.8859,3.306,295.584,-1.043654,0.000628,,
1329,9761.0,"בנק דיסקונט לישראל בע""מ",520007030.0,ח.פ.,אופציה לס דולר שקל DISCOUNT P3.21 12/03/26 SELL,750000133.0,פנימי,"מט""ח",ישראל,"ארה""ב",שירותים פיננסיים,"מט""ח",2026-03-12,לא,2025-09-12,USD,גורם תלוי/פנימי,קיימת תלות,2025-09-30,3.21,1.0,-503122.14,1.0491,3.306,-17.449,0.06161,-3.7e-05,,
1329,9761.0,"בנק לאומי לישראל בע""מ",520018078.0,ח.פ.,אופציה לס דולר שקל LEUMI C3.59 06/01/26 BUY,750000125.0,פנימי,"מט""ח",ישראל,"ארה""ב",שירותים פיננסיים,"מט""ח",2026-01-05,לא,2025-09-02,USD,גורם תלוי/פנימי,קיימת תלות,2025-09-30,3.59,1.0,1509275.75,0.1726,3.306,8.61,-0.030401,1.8e-05,,
1329,9761.0,"בנק הפועלים בע""מ",520000118.0,ח.פ.,אופציה לס דולר שקל POALIM P3.39 05/12/25 SELL,750000058.0,פנימי,"מט""ח",ישראל,"ארה""ב",שירותים פיננסיים,"מט""ח",2025-12-05,לא,2025-06-06,USD,גורם תלוי/פנימי,קיימת תלות,2025-09-30,3.39,1.0,-503091.91,3.1116,3.306,-51.753,0.182731,-0.00011,,
1329,9761.0,"בנק דיסקונט לישראל בע""מ",520007030.0,ח.פ.,אופציה לס דולר שקל DISCOUNT P3.25 24/03/26 SELL,750000142.0,פנימי,"מט""ח",ישראל,"ארה""ב",שירותים פיננסיים,"מט""ח",2026-03-24,לא,2025-09-22,USD,גורם תלוי/פנימי,קיימת תלות,2025-09-30,3.25,1.0,-503122.14,1.5316,3.306,-25.476,0.089951,-5.4e-05,,
1329,9761.0,"בנק הפועלים בע""מ",520000118.0,ח.פ.,אופציה לס דולר שקל POALIM C3.7 05/12/25 SELL,750000096.0,פנימי,"מט""ח",ישראל,"ארה""ב",שירותים פיננסיים,"מט""ח",2025-12-05,לא,2025-07-10,USD,גורם תלוי/פנימי,קיימת תלות,2025-09-30,3.7,1.0,-1006183.83,0.0268,3.306,-0.89,0.003144,-1e-06,,
1329,9761.0,"Citibank, NA",70652.0,פנימי,אופציה לס דולר שקל CITI C3.38 18/12/25 SELL,750000091.0,פנימי,"מט""ח","חו""ל","ארה""ב",Financial Services,"מט""ח",2025-12-18,לא,2025-07-03,USD,גורם תלוי/פנימי,קיימת תלות,2025-09-30,3.38,1.0,-436016.8,0.8985,3.306,-12.951,0.045727,-2.7e-05,,
1329,9761.0,"Citibank, NA",70652.0,פנימי,אופציה לס דולר שקל CITI P3.22 06/03/26 SELL,750000129.0,פנימי,"מט""ח","חו""ל","ארה""ב",Financial Services,"מט""ח",2026-03-06,לא,2025-09-09,USD,גורם תלוי/פנימי,קיימת תלות,2025-09-30,3.22,1.0,-503096.95,1.1426,3.306,-19.005,0.067103,-4e-05,,
1329,9761.0,Goldman Sachs Group Inc,11778.0,פנימי,אופציה לס אירו שקל GS P3.9 03/10/25 SELL,750000085.0,פנימי,"מט""ח","חו""ל",אירופה,Financial Services,"מט""ח",2025-10-03,לא,2025-07-07,EUR,גורם תלוי/פנימי,קיימת תלות,2025-09-30,3.9,1.0,-167696.18,0.6576,3.8807,-4.279,0.015109,-9e-06,,
1329,9761.0,"Citibank, NA",70652.0,פנימי,אופציה לס דולר שקל CITI C3.62 18/12/25 BUY,750000092.0,פנימי,"מט""ח","חו""ל","ארה""ב",Financial Services,"מט""ח",2025-12-18,לא,2025-07-03,USD,גורם תלוי/פנימי,קיימת תלות,2025-09-30,3.62,1.0,1308050.4,0.0949,3.306,4.102,-0.014483,8e-06,,
1329,9761.0,Goldman Sachs Group Inc,11778.0,פנימי,אופציה לס אירו שקל GS P3.7 03/10/25 BUY,750000086.0,פנימי,"מט""ח","חו""ל",אירופה,Financial Services,"מט""ח",2025-10-03,לא,2025-07-01,EUR,גורם תלוי/פנימי,קיימת תלות,2025-09-30,3.7,1.0,838480.93,0.0001,3.8807,0.001,-2e-06,0.0,,
1329,9761.0,"Citibank, NA",70652.0,פנימי,אופציה לס דולר שקל CITI C3.60 18/12/25 BUY,750000103.0,פנימי,"מט""ח","חו""ל","ארה""ב",Financial Services,"מט""ח",2025-12-18,לא,2025-07-16,USD,גורם תלוי/פנימי,קיימת תלות,2025-09-30,3.6,1.0,737873.29,0.1201,3.306,2.931,-0.010348,6e-06,,
1329,9761.0,"Citibank, NA",70652.0,פנימי,אופציה לס דולר שקל CITI C3.575 06/03/26 BUY,750000128.0,פנימי,"מט""ח","חו""ל","ארה""ב",Financial Services,"מט""ח",2026-03-06,לא,2025-09-09,USD,גורם תלוי/פנימי,קיימת תלות,2025-09-30,3.575,1.0,1006193.9,0.5176,3.306,17.217,-0.06079,3.6e-05,,
1329,9761.0,Goldman Sachs Group Inc,11778.0,פנימי,אופציה לס אירו שקל GS C4.2 03/10/25 BUY,750000122.0,פנימי,"מט""ח","חו""ל",אירופה,Financial Services,"מט""ח",2025-10-03,לא,2025-08-27,EUR,גורם תלוי/פנימי,קיימת תלות,2025-09-30,4.2,1.0,335862.57,0.0001,3.8807,0.001,-3e-06,0.0,,
1329,9761.0,"Citibank, NA",70652.0,פנימי,אופציה לס דולר שקל CITI C3.75 18/12/25 SELL,750000102.0,פנימי,"מט""ח","חו""ל","ארה""ב",Financial Services,"מט""ח",2025-12-18,לא,2025-07-16,USD,גורם תלוי/פנימי,קיימת תלות,2025-09-30,3.75,1.0,-737873.29,0.0287,3.306,-0.7,0.002472,-1e-06,,
1329,9761.0,Goldman Sachs Group Inc,11778.0,פנימי,אופציה לס אירו שקל GS P3.9 03/10/25 SELL,750000093.0,פנימי,"מט""ח","חו""ל",אירופה,Financial Services,"מט""ח",2025-10-03,לא,2025-07-01,EUR,גורם תלוי/פנימי,קיימת תלות,2025-09-30,3.9,1.0,-671725.15,0.6604,3.8807,-17.216,0.060787,-3.6e-05,,
1329,9761.0,"Citibank, NA",70652.0,פנימי,אופציה לס דולר שקל CITI C3.75 18/12/25 BUY,750000067.0,פנימי,"מט""ח","חו""ל","ארה""ב",Financial Services,"מט""ח",2025-12-18,לא,2025-06-17,USD,גורם תלוי/פנימי,קיימת תלות,2025-09-30,3.75,1.0,737873.29,0.0299,3.306,0.729,-0.002574,1e-06,,
1329,9761.0,"Citibank, NA",70652.0,פנימי,אופציה לס דולר שקל CITI P3.38 18/12/25 SELL,750000066.0,פנימי,"מט""ח","חו""ל","ארה""ב",Financial Services,"מט""ח",2025-12-18,לא,2025-06-17,USD,גורם תלוי/פנימי,קיימת תלות,2025-09-30,3.38,1.0,-436016.8,3.2367,3.306,-46.656,0.164732,-9.9e-05,,
1329,9762.0,"בנק הפועלים בע""מ",520000118.0,ח.פ.,אופציה לס דולר שקל POALIM P3.6 06/10/25 SELL,750000056.0,פנימי,"מט""ח",ישראל,"ארה""ב",שירותים פיננסיים,"מט""ח",2025-10-06,לא,2025-06-04,USD,גורם תלוי/פנימי,קיימת תלות,2025-09-30,3.6,1.0,-320784.55,8.8822,3.306,-94.197,1.043224,-0.00052,,
1329,9762.0,"בנק דיסקונט לישראל בע""מ",520007030.0,ח.פ.,אופציה לס דולר שקל DISCOUNT C3.58 23/12/25 BUY,750000076.0,פנימי,"מט""ח",ישראל,"ארה""ב",שירותים פיננסיים,"מט""ח",2025-12-23,לא,2025-06-26,USD,גורם תלוי/פנימי,קיימת תלות,2025-09-30,3.58,1.0,160396.55,0.1439,3.306,0.763,-0.008448,4e-06,,
1329,9762.0,"בנק לאומי לישראל בע""מ",520018078.0,ח.פ.,אופציה לס דולר שקל Leumi P3.6 13/10/25 L,750000041.0,פנימי,"מט""ח",ישראל,"ארה""ב",שירותים פיננסיים,"מט""ח",2025-10-13,לא,2025-05-08,USD,גורם תלוי/פנימי,קיימת תלות,2025-09-30,3.6,1.0,320771.7,8.8777,3.306,94.145,-1.042649,0.00052,,
1329,9762.0,"בנק דיסקונט לישראל בע""מ",520007030.0,ח.פ.,אופציה לס דולר שקל DISCOUNT P3.55 08/10/25 BUY,750000046.0,פנימי,"מט""ח",ישראל,"ארה""ב",שירותים פיננסיים,"מט""ח",2025-10-08,לא,2025-05-21,USD,גורם תלוי/פנימי,קיימת תלות,2025-09-30,3.55,1.0,641564.82,7.3726,3.306,156.374,-1.731831,0.000864,,
1329,9762.0,"בנק הפועלים בע""מ",520000118.0,ח.פ.,אופציה לס דולר שקל POALIM C3.70 05/12/25 BUY,750000059.0,פנימי,"מט""ח",ישראל,"ארה""ב",שירותים פיננסיים,"מט""ח",2025-12-05,לא,2025-06-06,USD,גורם תלוי/פנימי,קיימת תלות,2025-09-30,3.7,1.0,320784.55,0.0091,3.306,0.096,-0.001065,0.0,,
1329,9762.0,"בנק הפועלים בע""מ",520000118.0,ח.פ.,אופציה לס דולר שקל POALIM C3.6 05/12/25 BUY,750000099.0,פנימי,"מט""ח",ישראל,"ארה""ב",שירותים פיננסיים,"מט""ח",2025-12-05,לא,2025-05-14,USD,גורם תלוי/פנימי,קיימת תלות,2025-09-30,3.6,1.0,320784.55,0.0815,3.306,0.864,-0.00957,4e-06,,
1329,9762.0,"בנק לאומי לישראל בע""מ",520018078.0,ח.פ.,אופציה לס דולר שקל LEUMI C3.73 01/12/25 BUY,750000053.0,פנימי,"מט""ח",ישראל,"ארה""ב",שירותים פיננסיים,"מט""ח",2025-12-01,לא,2025-05-29,USD,גורם תלוי/פנימי,קיימת תלות,2025-09-30,3.73,1.0,319711.63,0.004,3.306,0.043,-0.00047,0.0,,
1329,9762.0,Goldman Sachs Group Inc,11778.0,פנימי,אופציה לס אירו שקל GS C4.2 03/10/25,750000010.0,פנימי,"מט""ח","חו""ל",אירופה,Financial Services,"מט""ח",2025-10-03,לא,2025-04-03,EUR,גורם תלוי/פנימי,קיימת תלות,2025-09-30,4.2,1.0,-107077.37,0.0001,3.8807,0.0,4e-06,0.0,,
1329,9762.0,"בנק לאומי לישראל בע""מ",520018078.0,ח.פ.,אופציה לס דולר שקל LEUMI P3.6 13/10/25 S,750000027.0,פנימי,"מט""ח",ישראל,"ארה""ב",שירותים פיננסיים,"מט""ח",2025-10-13,לא,2025-04-09,USD,גורם תלוי/פנימי,קיימת תלות,2025-09-30,3.6,1.0,-320771.7,8.8731,3.306,-94.096,1.042109,-0.00052,,
1329,9762.0,"בנק הפועלים בע""מ",520000118.0,ח.פ.,אופציה לס דולר שקל POALIM P3.5 06/10/25 BUY,750000057.0,פנימי,"מט""ח",ישראל,"ארה""ב",שירותים פיננסיים,"מט""ח",2025-10-06,לא,2025-06-04,USD,גורם תלוי/פנימי,קיימת תלות,2025-09-30,3.5,1.0,320784.55,5.8625,3.306,62.173,-0.688558,0.000343,,
1329,9762.0,"בנק דיסקונט לישראל בע""מ",520007030.0,ח.פ.,אופציה לס דולר שקל DISCOUNT P3.65 08/10/25 SELL,750000045.0,פנימי,"מט""ח",ישראל,"ארה""ב",שירותים פיננסיים,"מט""ח",2025-10-08,לא,2025-05-21,USD,גורם תלוי/פנימי,קיימת תלות,2025-09-30,3.65,1.0,-641564.82,10.391,3.306,-220.407,2.440987,-0.001218,,
1329,9762.0,Goldman Sachs Group Inc,11778.0,פנימי,אופציה לס אירו שקל GS P3.9 03/10/25,750000011.0,פנימי,"מט""ח","חו""ל",אירופה,Financial Services,"מט""ח",2025-10-03,לא,2025-04-03,EUR,גורם תלוי/פנימי,קיימת תלות,2025-09-30,3.9,1.0,267693.44,0.6786,3.8807,7.05,-0.078077,3.8e-05,,
1329,9762.0,Goldman Sachs Group Inc,11778.0,פנימי,אופציה לס אירו שקל GS P3.7 03/10/25,750000012.0,פנימי,"מט""ח","חו""ל",אירופה,Financial Services,"מט""ח",2025-10-03,לא,2025-04-03,EUR,גורם תלוי/פנימי,קיימת תלות,2025-09-30,3.7,1.0,-267693.44,0.0001,3.8807,0.0,2e-06,0.0,,
1329,9762.0,"בנק דיסקונט לישראל בע""מ",520007030.0,ח.פ.,אופציה לס דולר שקל DISCOUNT P3.29 23/12/25 SELL,750000077.0,פנימי,"מט""ח",ישראל,"ארה""ב",שירותים פיננסיים,"מט""ח",2025-12-23,לא,2025-06-26,USD,גורם תלוי/פנימי,קיימת תלות,2025-09-30,3.29,1.0,-160396.55,1.4861,3.306,-7.88,0.087273,-4.3e-05,,
1329,9762.0,"בנק לאומי לישראל בע""מ",520018078.0,ח.פ.,אופציה לס דולר שקל LEUMI C3.60 07/01/26 BUY,750000121.0,פנימי,"מט""ח",ישראל,"ארה""ב",שירותים פיננסיים,"מט""ח",2026-01-07,לא,2025-08-25,USD,גורם תלוי/פנימי,קיימת תלות,2025-09-30,3.6,1.0,479567.45,0.1624,3.306,2.575,-0.02852,1.4e-05,,
1329,9762.0,"בנק לאומי לישראל בע""מ",520018078.0,ח.פ.,אופציה לס דולר שקל LEUMI C3.6 01/12/25 BUY,750000098.0,פנימי,"מט""ח",ישראל,"ארה""ב",שירותים פיננסיים,"מט""ח",2025-12-01,לא,2025-07-10,USD,גורם תלוי/פנימי,קיימת תלות,2025-09-30,3.6,1.0,319711.63,0.0679,3.306,0.718,-0.007949,3e-06,,
1329,9762.0,"בנק הפועלים בע""מ",520000118.0,ח.פ.,אופציה לס דולר שקל POALIM C3.59 26/03/26 BUY,750000145.0,פנימי,"מט""ח",ישראל,"ארה""ב",שירותים פיננסיים,"מט""ח",2026-03-26,לא,2025-09-26,USD,גורם תלוי/פנימי,קיימת תלות,2025-09-30,3.59,1.0,320803.82,0.5462,3.306,5.793,-0.064154,3.2e-05,,
1329,9762.0,"בנק דיסקונט לישראל בע""מ",520007030.0,ח.פ.,אופציה לס דולר שקל DISCOUNT C3.575 12/03/26 BUY,750000132.0,פנימי,"מט""ח",ישראל,"ארה""ב",שירותים פיננסיים,"מט""ח",2026-03-12,לא,2025-09-12,USD,גורם תלוי/פנימי,קיימת תלות,2025-09-30,3.575,1.0,320803.82,0.5282,3.306,5.602,-0.062043,3e-05,,
1329,9762.0,"בנק דיסקונט לישראל בע""מ",520007030.0,ח.פ.,אופציה לס דולר שקל DISCOUNT C3.55 13/01/26 BUY,750000117.0,פנימי,"מט""ח",ישראל,"ארה""ב",שירותים פיננסיים,"מט""ח",2026-01-13,לא,2025-08-13,USD,גורם תלוי/פנימי,קיימת תלות,2025-09-30,3.55,1.0,319711.63,0.2679,3.306,2.832,-0.031364,1.5e-05,,
1329,9762.0,"בנק הפועלים בע""מ",520000118.0,ח.פ.,אופציה לס דולר שקל POALIM P3.25 26/03/26 SELL,750000146.0,פנימי,"מט""ח",ישראל,"ארה""ב",שירותים פיננסיים,"מט""ח",2026-03-26,לא,2025-09-26,USD,גורם תלוי/פנימי,קיימת תלות,2025-09-30,3.25,1.0,-160401.91,1.582,3.306,-8.389,0.092907,-4.6e-05,,
1329,9762.0,"בנק דיסקונט לישראל בע""מ",520007030.0,ח.פ.,אופציה לס דולר שקל DISCOUNT C3.4 26/11/25 SELL,750000116.0,פנימי,"מט""ח",ישראל,"ארה""ב",שירותים פיננסיים,"מט""ח",2025-11-26,לא,2025-08-13,USD,גורם תלוי/פנימי,קיימת תלות,2025-09-30,3.4,1.0,-159855.81,0.4649,3.306,-2.457,0.027212,-1.3e-05,,
1329,9762.0,"בנק לאומי לישראל בע""מ",520018078.0,ח.פ.,אופציה לס דולר שקל LEUMI C3.73 01/12/25 SELL,750000097.0,פנימי,"מט""ח",ישראל,"ארה""ב",שירותים פיננסיים,"מט""ח",2025-12-01,לא,2025-07-10,USD,גורם תלוי/פנימי,קיימת תלות,2025-09-30,3.73,1.0,-319711.63,0.0145,3.306,-0.153,0.001696,0.0,,
1329,9762.0,"בנק הפועלים בע""מ",520000118.0,ח.פ.,אופציה לס דולר שקל POALIM C3.7 05/12/25 SELL 15/07,750000100.0,פנימי,"מט""ח",ישראל,"ארה""ב",שירותים פיננסיים,"מט""ח",2025-12-05,לא,2025-05-14,USD,גורם תלוי/פנימי,קיימת תלות,2025-09-30,3.7,1.0,-320784.55,0.0277,3.306,-0.294,0.003254,-1e-06,,
1329,9762.0,"בנק דיסקונט לישראל בע""מ",520007030.0,ח.פ.,אופציה לס דולר שקל DISCOUNT C3.29 23/12/25 SELL,750000094.0,פנימי,"מט""ח",ישראל,"ארה""ב",שירותים פיננסיים,"מט""ח",2025-12-23,לא,2025-07-10,USD,גורם תלוי/פנימי,קיימת תלות,2025-09-30,3.29,1.0,-160396.55,2.0174,3.306,-10.697,0.118473,-5.9e-05,,
1329,9762.0,"בנק הפועלים בע""מ",520000118.0,ח.פ.,אופציה לס דולר שקל POALIM C3.5 05/12/25 BUY,750000095.0,פנימי,"מט""ח",ישראל,"ארה""ב",שירותים פיננסיים,"מט""ח",2025-12-05,לא,2025-07-10,USD,גורם תלוי/פנימי,קיימת תלות,2025-09-30,3.5,1.0,320784.55,0.2323,3.306,2.463,-0.02728,1.3e-05,,
1329,9762.0,"בנק דיסקונט לישראל בע""מ",520007030.0,ח.פ.,אופציה לס דולר שקל DISCOUNT P3.65 08/10/25,750000019.0,פנימי,"מט""ח",ישראל,"ארה""ב",שירותים פיננסיים,"מט""ח",2025-10-08,לא,2025-04-08,USD,גורם תלוי/פנימי,קיימת תלות,2025-09-30,3.65,1.0,641564.82,10.394,3.306,220.467,-2.441655,0.001218,,
1329,9762.0,"בנק הפועלים בע""מ",520000118.0,ח.פ.,אופציה לס דולר שקל POALIM P3.5 06/10/25,750000016.0,פנימי,"מט""ח",ישראל,"ארה""ב",שירותים פיננסיים,"מט""ח",2025-10-06,לא,2025-04-04,USD,גורם תלוי/פנימי,קיימת תלות,2025-09-30,3.5,1.0,-320784.55,5.8612,3.306,-62.159,0.688405,-0.000343,,
1329,9762.0,"בנק לאומי לישראל בע""מ",520018078.0,ח.פ.,אופציה לס דולר שקל LEUMI P3.7 13/10/25 L,750000029.0,פנימי,"מט""ח",ישראל,"ארה""ב",שירותים פיננסיים,"מט""ח",2025-10-13,לא,2025-04-09,USD,גורם תלוי/פנימי,קיימת תלות,2025-09-30,3.7,1.0,320771.7,11.897,3.306,126.171,-1.397332,0.000697,,
1329,9762.0,"בנק דיסקונט לישראל בע""מ",520007030.0,ח.פ.,אופציה לס דולר שקל DISCOUNT C3.75 26/11/25 BUY,750000049.0,פנימי,"מט""ח",ישראל,"ארה""ב",שירותים פיננסיים,"מט""ח",2025-11-26,לא,2025-05-28,USD,גורם תלוי/פנימי,קיימת תלות,2025-09-30,3.75,1.0,319711.63,0.0018,3.306,0.02,-0.000215,0.0,,
1329,9762.0,"בנק דיסקונט לישראל בע""מ",520007030.0,ח.פ.,אופציה לס דולר שקל DISCOUNT C3.6 24/03/26 BUY,750000141.0,פנימי,"מט""ח",ישראל,"ארה""ב",שירותים פיננסיים,"מט""ח",2026-03-24,לא,2025-09-22,USD,גורם תלוי/פנימי,קיימת תלות,2025-09-30,3.6,1.0,320803.82,0.4815,3.306,5.106,-0.056551,2.8e-05,,
1329,9762.0,"בנק לאומי לישראל בע""מ",520018078.0,ח.פ.,אופציה לס דולר שקל LEUMI C3.39 05/12/25 SELL,750000124.0,פנימי,"מט""ח",ישראל,"ארה""ב",שירותים פיננסיים,"מט""ח",2025-12-05,לא,2025-09-02,USD,גורם תלוי/פנימי,קיימת תלות,2025-09-30,3.39,1.0,-160392.27,0.6353,3.306,-3.369,0.037306,-1.8e-05,,
1329,9762.0,"בנק לאומי לישראל בע""מ",520018078.0,ח.פ.,אופציה לס דולר שקל LEUMI C3.38 01/12/25 SELL,750000120.0,פנימי,"מט""ח",ישראל,"ארה""ב",שירותים פיננסיים,"מט""ח",2025-12-01,לא,2025-08-25,USD,גורם תלוי/פנימי,קיימת תלות,2025-09-30,3.38,1.0,-159855.81,0.636,3.306,-3.361,0.037222,-1.8e-05,,
1329,9762.0,Goldman Sachs Group Inc,11778.0,פנימי,"אופציה לס GS C1,637.14 ESLT.TA 15/10/25 SELL",750000115.0,פנימי,מניה,ישראל,ישראל,Financial Services,מניות לרבות מדדי מניות,2025-10-15,לא,2025-08-12,ILS,גורם תלוי/פנימי,קיימת תלות,2025-09-30,1637.14,1.0,-47.85,7692.5,1.0,-3.681,0.040766,-2e-05,,
1329,9762.0,"בנק לאומי לישראל בע""מ",520018078.0,ח.פ.,אופציה לס דולר שקל LEUMI C3.59 06/01/26 BUY,750000125.0,פנימי,"מט""ח",ישראל,"ארה""ב",שירותים פיננסיים,"מט""ח",2026-01-05,לא,2025-09-02,USD,גורם תלוי/פנימי,קיימת תלות,2025-09-30,3.59,1.0,481176.82,0.1726,3.306,2.745,-0.030401,1.5e-05,,
1329,9762.0,"בנק לאומי לישראל בע""מ",520018078.0,ח.פ.,אופציה לס דולר שקל LEUMI P3.38 01/12/25 SELL,750000052.0,פנימי,"מט""ח",ישראל,"ארה""ב",שירותים פיננסיים,"מט""ח",2025-12-01,לא,2025-05-29,USD,גורם תלוי/פנימי,קיימת תלות,2025-09-30,3.38,1.0,-159855.81,2.8466,3.306,-15.044,0.166609,-8.3e-05,,
1329,9762.0,"בנק דיסקונט לישראל בע""מ",520007030.0,ח.פ.,אופציה לס דולר שקל DISCOUNT P3.4 26/11/25 SELL,750000048.0,פנימי,"מט""ח",ישראל,"ארה""ב",שירותים פיננסיים,"מט""ח",2025-11-26,לא,2025-05-28,USD,גורם תלוי/פנימי,קיימת תלות,2025-09-30,3.4,1.0,-159855.81,3.267,3.306,-17.266,0.191216,-9.5e-05,,
1329,9762.0,"בנק דיסקונט לישראל בע""מ",520007030.0,ח.פ.,אופציה לס דולר שקל DISCOUNT P3.55 08/10/25,750000020.0,פנימי,"מט""ח",ישראל,"ארה""ב",שירותים פיננסיים,"מט""ח",2025-10-08,לא,2025-04-08,USD,גורם תלוי/פנימי,קיימת תלות,2025-09-30,3.55,1.0,-641564.82,7.3698,3.306,-156.315,1.73117,-0.000863,,
1329,9762.0,"בנק לאומי לישראל בע""מ",520018078.0,ח.פ.,אופציה לס דולר שקל Leumi P3.7 13/10/25 S,750000040.0,פנימי,"מט""ח",ישראל,"ארה""ב",שירותים פיננסיים,"מט""ח",2025-10-13,לא,2025-05-08,USD,גורם תלוי/פנימי,קיימת תלות,2025-09-30,3.7,1.0,-320771.7,11.893,3.306,-126.122,1.396785,-0.000697,,
1329,9762.0,"בנק דיסקונט לישראל בע""מ",520007030.0,ח.פ.,אופציה לס דולר שקל DISCOUNT P3.21 12/03/26 SELL,750000133.0,פנימי,"מט""ח",ישראל,"ארה""ב",שירותים פיננסיים,"מט""ח",2026-03-12,לא,2025-09-12,USD,גורם תלוי/פנימי,קיימת תלות,2025-09-30,3.21,1.0,-160401.91,1.0491,3.306,-5.563,0.06161,-3e-05,,
1329,9762.0,"בנק הפועלים בע""מ",520000118.0,ח.פ.,אופציה לס דולר שקל POALIM P3.6 06/10/25,750000017.0,פנימי,"מט""ח",ישראל,"ארה""ב",שירותים פיננסיים,"מט""ח",2025-10-06,לא,2025-04-04,USD,גורם תלוי/פנימי,קיימת תלות,2025-09-30,3.6,1.0,320784.55,8.8859,3.306,94.236,-1.043654,0.00052,,
1329,9762.0,"בנק הפועלים בע""מ",520000118.0,ח.פ.,אופציה לס דולר שקל POALIM P3.39 05/12/25 SELL,750000058.0,פנימי,"מט""ח",ישראל,"ארה""ב",שירותים פיננסיים,"מט""ח",2025-12-05,לא,2025-06-06,USD,גורם תלוי/פנימי,קיימת תלות,2025-09-30,3.39,1.0,-160392.27,3.1116,3.306,-16.5,0.182731,-9.1e-05,,
1329,9762.0,"בנק דיסקונט לישראל בע""מ",520007030.0,ח.פ.,אופציה לס דולר שקל DISCOUNT P3.25 24/03/26 SELL,750000142.0,פנימי,"מט""ח",ישראל,"ארה""ב",שירותים פיננסיים,"מט""ח",2026-03-24,לא,2025-09-22,USD,גורם תלוי/פנימי,קיימת תלות,2025-09-30,3.25,1.0,-160401.91,1.5316,3.306,-8.122,0.089951,-4.4e-05,,
1329,9762.0,"בנק הפועלים בע""מ",520000118.0,ח.פ.,אופציה לס דולר שקל POALIM C3.7 05/12/25 SELL,750000096.0,פנימי,"מט""ח",ישראל,"ארה""ב",שירותים פיננסיים,"מט""ח",2025-12-05,לא,2025-07-10,USD,גורם תלוי/פנימי,קיימת תלות,2025-09-30,3.7,1.0,-320784.55,0.0268,3.306,-0.284,0.003144,-1e-06,,
1329,9762.0,"Citibank, NA",70652.0,פנימי,אופציה לס דולר שקל CITI C3.38 18/12/25 SELL,750000091.0,פנימי,"מט""ח","חו""ל","ארה""ב",Financial Services,"מט""ח",2025-12-18,לא,2025-07-03,USD,גורם תלוי/פנימי,קיימת תלות,2025-09-30,3.38,1.0,-139007.85,0.8985,3.306,-4.129,0.045727,-2.2e-05,,
1329,9762.0,"Citibank, NA",70652.0,פנימי,אופציה לס דולר שקל CITI P3.22 06/03/26 SELL,750000129.0,פנימי,"מט""ח","חו""ל","ארה""ב",Financial Services,"מט""ח",2026-03-06,לא,2025-09-09,USD,גורם תלוי/פנימי,קיימת תלות,2025-09-30,3.22,1.0,-160393.88,1.1426,3.306,-6.059,0.067103,-3.3e-05,,
1329,9762.0,"Citibank, NA",70652.0,פנימי,אופציה לס דולר שקל CITI C3.60 18/12/25 BUY,750000103.0,פנימי,"מט""ח","חו""ל","ארה""ב",Financial Services,"מט""ח",2025-12-18,לא,2025-07-16,USD,גורם תלוי/פנימי,קיימת תלות,2025-09-30,3.6,1.0,235243.64,0.1201,3.306,0.934,-0.010348,5e-06,,
1329,9762.0,"Citibank, NA",70652.0,פנימי,אופציה לס דולר שקל CITI C3.62 18/12/25 BUY,750000092.0,פנימי,"מט""ח","חו""ל","ארה""ב",Financial Services,"מט""ח",2025-12-18,לא,2025-07-03,USD,גורם תלוי/פנימי,קיימת תלות,2025-09-30,3.62,1.0,417023.55,0.0949,3.306,1.308,-0.014483,7e-06,,
1329,9762.0,Goldman Sachs Group Inc,11778.0,פנימי,אופציה לס אירו שקל GS P3.7 03/10/25 BUY,750000086.0,פנימי,"מט""ח","חו""ל",אירופה,Financial Services,"מט""ח",2025-10-03,לא,2025-07-01,EUR,גורם תלוי/פנימי,קיימת תלות,2025-09-30,3.7,1.0,267318.67,0.0001,3.8807,0.0,-2e-06,0.0,,
1329,9762.0,Goldman Sachs Group Inc,11778.0,פנימי,אופציה לס אירו שקל GS P3.9 03/10/25 SELL,750000085.0,פנימי,"מט""ח","חו""ל",אירופה,Financial Services,"מט""ח",2025-10-03,לא,2025-07-07,EUR,גורם תלוי/פנימי,קיימת תלות,2025-09-30,3.9,1.0,-53463.73,0.6576,3.8807,-1.364,0.015109,-7e-06,,
1329,9762.0,"Citibank, NA",70652.0,פנימי,אופציה לס דולר שקל CITI C3.575 06/03/26 BUY,750000128.0,פנימי,"מט""ח","חו""ל","ארה""ב",Financial Services,"מט""ח",2026-03-06,לא,2025-09-09,USD,גורם תלוי/פנימי,קיימת תלות,2025-09-30,3.575,1.0,320787.76,0.5176,3.306,5.489,-0.06079,3e-05,,
1329,9762.0,Goldman Sachs Group Inc,11778.0,פנימי,אופציה לס אירו שקל GS C4.2 03/10/25 BUY,750000122.0,פנימי,"מט""ח","חו""ל",אירופה,Financial Services,"מט""ח",2025-10-03,לא,2025-08-27,EUR,גורם תלוי/פנימי,קיימת תלות,2025-09-30,4.2,1.0,107077.37,0.0001,3.8807,0.0,-3e-06,0.0,,
1329,9762.0,"Citibank, NA",70652.0,פנימי,אופציה לס דולר שקל CITI C3.75 18/12/25 SELL,750000102.0,פנימי,"מט""ח","חו""ל","ארה""ב",Financial Services,"מט""ח",2025-12-18,לא,2025-07-16,USD,גורם תלוי/פנימי,קיימת תלות,2025-09-30,3.75,1.0,-235243.64,0.0287,3.306,-0.223,0.002472,-1e-06,,
1329,9762.0,Goldman Sachs Group Inc,11778.0,פנימי,אופציה לס אירו שקל GS P3.9 03/10/25 SELL,750000093.0,פנימי,"מט""ח","חו""ל",אירופה,Financial Services,"מט""ח",2025-10-03,לא,2025-07-01,EUR,גורם תלוי/פנימי,קיימת תלות,2025-09-30,3.9,1.0,-214154.75,0.6604,3.8807,-5.489,0.060787,-3e-05,,
1329,9762.0,"Citibank, NA",70652.0,פנימי,אופציה לס דולר שקל CITI C3.75 18/12/25 BUY,750000067.0,פנימי,"מט""ח","חו""ל","ארה""ב",Financial Services,"מט""ח",2025-12-18,לא,2025-06-17,USD,גורם תלוי/פנימי,קיימת תלות,2025-09-30,3.75,1.0,235243.64,0.0299,3.306,0.232,-0.002574,1e-06,,
1329,9762.0,"Citibank, NA",70652.0,פנימי,אופציה לס דולר שקל CITI P3.38 18/12/25 SELL,750000066.0,פנימי,"מט""ח","חו""ל","ארה""ב",Financial Services,"מט""ח",2025-12-18,לא,2025-06-17,USD,גורם תלוי/פנימי,קיימת תלות,2025-09-30,3.38,1.0,-139007.85,3.2367,3.306,-14.874,0.164732,-8.2e-05,,
1329,9763.0,"בנק דיסקונט לישראל בע""מ",520007030.0,ח.פ.,אופציה לס דולר שקל DISCOUNT C3.58 23/12/25 BUY,750000076.0,פנימי,"מט""ח",ישראל,"ארה""ב",שירותים פיננסיים,"מט""ח",2025-12-23,לא,2025-06-26,USD,גורם תלוי/פנימי,קיימת תלות,2025-09-30,3.58,1.0,29498.91,0.1439,3.306,0.14,-0.008448,2e-06,,
1329,9763.0,"בנק דיסקונט לישראל בע""מ",520007030.0,ח.פ.,אופציה לס דולר שקל DISCOUNT P3.55 08/10/25 BUY,750000046.0,פנימי,"מט""ח",ישראל,"ארה""ב",שירותים פיננסיים,"מט""ח",2025-10-08,לא,2025-05-21,USD,גורם תלוי/פנימי,קיימת תלות,2025-09-30,3.55,1.0,117991.72,7.3726,3.306,28.759,-1.731831,0.000436,,
1329,9763.0,"בנק לאומי לישראל בע""מ",520018078.0,ח.פ.,אופציה לס דולר שקל Leumi P3.6 13/10/25 L,750000041.0,פנימי,"מט""ח",ישראל,"ארה""ב",שירותים פיננסיים,"מט""ח",2025-10-13,לא,2025-05-08,USD,גורם תלוי/פנימי,קיימת תלות,2025-09-30,3.6,1.0,58993.89,8.8777,3.306,17.314,-1.042649,0.000262,,
1329,9763.0,"בנק הפועלים בע""מ",520000118.0,ח.פ.,אופציה לס דולר שקל POALIM C3.70 05/12/25 BUY,750000059.0,פנימי,"מט""ח",ישראל,"ארה""ב",שירותים פיננסיים,"מט""ח",2025-12-05,לא,2025-06-06,USD,גורם תלוי/פנימי,קיימת תלות,2025-09-30,3.7,1.0,58996.25,0.0091,3.306,0.018,-0.001065,0.0,,
1329,9763.0,"בנק הפועלים בע""מ",520000118.0,ח.פ.,אופציה לס דולר שקל POALIM C3.6 05/12/25 BUY,750000099.0,פנימי,"מט""ח",ישראל,"ארה""ב",שירותים פיננסיים,"מט""ח",2025-12-05,לא,2025-05-14,USD,גורם תלוי/פנימי,קיימת תלות,2025-09-30,3.6,1.0,58996.25,0.0815,3.306,0.159,-0.00957,2e-06,,
1329,9763.0,"בנק לאומי לישראל בע""מ",520018078.0,ח.פ.,אופציה לס דולר שקל LEUMI C3.73 01/12/25 BUY,750000053.0,פנימי,"מט""ח",ישראל,"ארה""ב",שירותים פיננסיים,"מט""ח",2025-12-01,לא,2025-05-29,USD,גורם תלוי/פנימי,קיימת תלות,2025-09-30,3.73,1.0,58798.93,0.004,3.306,0.008,-0.00047,0.0,,
1329,9763.0,Goldman Sachs Group Inc,11778.0,פנימי,אופציה לס אירו שקל GS C4.2 03/10/25,750000010.0,פנימי,"מט""ח","חו""ל",אירופה,Financial Services,"מט""ח",2025-10-03,לא,2025-04-03,EUR,גורם תלוי/פנימי,קיימת תלות,2025-09-30,4.2,1.0,-19692.85,0.0001,3.8807,0.0,4e-06,0.0,,
1329,9763.0,"בנק לאומי לישראל בע""מ",520018078.0,ח.פ.,אופציה לס דולר שקל LEUMI P3.6 13/10/25 S,750000027.0,פנימי,"מט""ח",ישראל,"ארה""ב",שירותים פיננסיים,"מט""ח",2025-10-13,לא,2025-04-09,USD,גורם תלוי/פנימי,קיימת תלות,2025-09-30,3.6,1.0,-58993.89,8.8731,3.306,-17.306,1.042109,-0.000262,,
1329,9763.0,"בנק הפועלים בע""מ",520000118.0,ח.פ.,אופציה לס דולר שקל POALIM P3.6 06/10/25 SELL,750000056.0,פנימי,"מט""ח",ישראל,"ארה""ב",שירותים פיננסיים,"מט""ח",2025-10-06,לא,2025-06-04,USD,גורם תלוי/פנימי,קיימת תלות,2025-09-30,3.6,1.0,-58996.25,8.8822,3.306,-17.324,1.043224,-0.000262,,
1329,9763.0,Goldman Sachs Group Inc,11778.0,פנימי,אופציה לס אירו שקל GS P3.7 03/10/25,750000012.0,פנימי,"מט""ח","חו""ל",אירופה,Financial Services,"מט""ח",2025-10-03,לא,2025-04-03,EUR,גורם תלוי/פנימי,קיימת תלות,2025-09-30,3.7,1.0,-49232.14,0.0001,3.8807,0.0,2e-06,0.0,,
1329,9763.0,Goldman Sachs Group Inc,11778.0,פנימי,אופציה לס אירו שקל GS P3.9 03/10/25,750000011.0,פנימי,"מט""ח","חו""ל",אירופה,Financial Services,"מט""ח",2025-10-03,לא,2025-04-03,EUR,גורם תלוי/פנימי,קיימת תלות,2025-09-30,3.9,1.0,49232.14,0.6786,3.8807,1.297,-0.078077,1.9e-05,,
1329,9763.0,"בנק הפועלים בע""מ",520000118.0,ח.פ.,אופציה לס דולר שקל POALIM P3.5 06/10/25 BUY,750000057.0,פנימי,"מט""ח",ישראל,"ארה""ב",שירותים פיננסיים,"מט""ח",2025-10-06,לא,2025-06-04,USD,גורם תלוי/פנימי,קיימת תלות,2025-09-30,3.5,1.0,58996.25,5.8625,3.306,11.434,-0.688558,0.000173,,
1329,9763.0,"בנק דיסקונט לישראל בע""מ",520007030.0,ח.פ.,אופציה לס דולר שקל DISCOUNT P3.65 08/10/25 SELL,750000045.0,פנימי,"מט""ח",ישראל,"ארה""ב",שירותים פיננסיים,"מט""ח",2025-10-08,לא,2025-05-21,USD,גורם תלוי/פנימי,קיימת תלות,2025-09-30,3.65,1.0,-117991.72,10.391,3.306,-40.536,2.440987,-0.000614,,
1329,9763.0,"בנק לאומי לישראל בע""מ",520018078.0,ח.פ.,אופציה לס דולר שקל LEUMI C3.60 07/01/26 BUY,750000121.0,פנימי,"מט""ח",ישראל,"ארה""ב",שירותים פיננסיים,"מט""ח",2026-01-07,לא,2025-08-25,USD,גורם תלוי/פנימי,קיימת תלות,2025-09-30,3.6,1.0,88198.39,0.1624,3.306,0.474,-0.02852,7e-06,,
1329,9763.0,"בנק לאומי לישראל בע""מ",520018078.0,ח.פ.,אופציה לס דולר שקל LEUMI C3.6 01/12/25 BUY,750000098.0,פנימי,"מט""ח",ישראל,"ארה""ב",שירותים פיננסיים,"מט""ח",2025-12-01,לא,2025-07-10,USD,גורם תלוי/פנימי,קיימת תלות,2025-09-30,3.6,1.0,58798.93,0.0679,3.306,0.132,-0.007949,2e-06,,
1329,9763.0,"בנק דיסקונט לישראל בע""מ",520007030.0,ח.פ.,אופציה לס דולר שקל DISCOUNT P3.29 23/12/25 SELL,750000077.0,פנימי,"מט""ח",ישראל,"ארה""ב",שירותים פיננסיים,"מט""ח",2025-12-23,לא,2025-06-26,USD,גורם תלוי/פנימי,קיימת תלות,2025-09-30,3.29,1.0,-29498.91,1.4861,3.306,-1.449,0.087273,-2.1e-05,,
1329,9763.0,"בנק דיסקונט לישראל בע""מ",520007030.0,ח.פ.,אופציה לס דולר שקל DISCOUNT C3.575 12/03/26 BUY,750000132.0,פנימי,"מט""ח",ישראל,"ארה""ב",שירותים פיננסיים,"מט""ח",2026-03-12,לא,2025-09-12,USD,גורם תלוי/פנימי,קיימת תלות,2025-09-30,3.575,1.0,58999.79,0.5282,3.306,1.03,-0.062043,1.5e-05,,
1329,9763.0,"בנק הפועלים בע""מ",520000118.0,ח.פ.,אופציה לס דולר שקל POALIM C3.59 26/03/26 BUY,750000145.0,פנימי,"מט""ח",ישראל,"ארה""ב",שירותים פיננסיים,"מט""ח",2026-03-26,לא,2025-09-26,USD,גורם תלוי/פנימי,קיימת תלות,2025-09-30,3.59,1.0,58999.79,0.5462,3.306,1.065,-0.064154,1.6e-05,,
1329,9763.0,"בנק דיסקונט לישראל בע""מ",520007030.0,ח.פ.,אופציה לס דולר שקל DISCOUNT C3.55 13/01/26 BUY,750000117.0,פנימי,"מט""ח",ישראל,"ארה""ב",שירותים פיננסיים,"מט""ח",2026-01-13,לא,2025-08-13,USD,גורם תלוי/פנימי,קיימת תלות,2025-09-30,3.55,1.0,58798.93,0.2679,3.306,0.521,-0.031364,7e-06,,
1329,9763.0,"בנק הפועלים בע""מ",520000118.0,ח.פ.,אופציה לס דולר שקל POALIM P3.5 06/10/25,750000016.0,פנימי,"מט""ח",ישראל,"ארה""ב",שירותים פיננסיים,"מט""ח",2025-10-06,לא,2025-04-04,USD,גורם תלוי/פנימי,קיימת תלות,2025-09-30,3.5,1.0,-58996.25,5.8612,3.306,-11.432,0.688405,-0.000173,,
1329,9763.0,"בנק דיסקונט לישראל בע""מ",520007030.0,ח.פ.,אופציה לס דולר שקל DISCOUNT P3.65 08/10/25,750000019.0,פנימי,"מט""ח",ישראל,"ארה""ב",שירותים פיננסיים,"מט""ח",2025-10-08,לא,2025-04-08,USD,גורם תלוי/פנימי,קיימת תלות,2025-09-30,3.65,1.0,117991.72,10.394,3.306,40.547,-2.441655,0.000615,,
1329,9763.0,"בנק הפועלים בע""מ",520000118.0,ח.פ.,אופציה לס דולר שקל POALIM C3.5 05/12/25 BUY,750000095.0,פנימי,"מט""ח",ישראל,"ארה""ב",שירותים פיננסיים,"מט""ח",2025-12-05,לא,2025-07-10,USD,גורם תלוי/פנימי,קיימת תלות,2025-09-30,3.5,1.0,58996.25,0.2323,3.306,0.453,-0.02728,6e-06,,
1329,9763.0,"בנק דיסקונט לישראל בע""מ",520007030.0,ח.פ.,אופציה לס דולר שקל DISCOUNT C3.29 23/12/25 SELL,750000094.0,פנימי,"מט""ח",ישראל,"ארה""ב",שירותים פיננסיים,"מט""ח",2025-12-23,לא,2025-07-10,USD,גורם תלוי/פנימי,קיימת תלות,2025-09-30,3.29,1.0,-29498.91,2.0174,3.306,-1.967,0.118473,-2.9e-05,,
1329,9763.0,"בנק לאומי לישראל בע""מ",520018078.0,ח.פ.,אופציה לס דולר שקל LEUMI C3.73 01/12/25 SELL,750000097.0,פנימי,"מט""ח",ישראל,"ארה""ב",שירותים פיננסיים,"מט""ח",2025-12-01,לא,2025-07-10,USD,גורם תלוי/פנימי,קיימת תלות,2025-09-30,3.73,1.0,-58798.93,0.0145,3.306,-0.028,0.001696,0.0,,
1329,9763.0,"בנק הפועלים בע""מ",520000118.0,ח.פ.,אופציה לס דולר שקל POALIM C3.7 05/12/25 SELL 15/07,750000100.0,פנימי,"מט""ח",ישראל,"ארה""ב",שירותים פיננסיים,"מט""ח",2025-12-05,לא,2025-05-14,USD,גורם תלוי/פנימי,קיימת תלות,2025-09-30,3.7,1.0,-58996.25,0.0277,3.306,-0.054,0.003254,0.0,,
1329,9763.0,"בנק דיסקונט לישראל בע""מ",520007030.0,ח.פ.,אופציה לס דולר שקל DISCOUNT C3.4 26/11/25 SELL,750000116.0,פנימי,"מט""ח",ישראל,"ארה""ב",שירותים פיננסיים,"מט""ח",2025-11-26,לא,2025-08-13,USD,גורם תלוי/פנימי,קיימת תלות,2025-09-30,3.4,1.0,-29399.46,0.4649,3.306,-0.452,0.027212,-6e-06,,
1329,9763.0,"בנק הפועלים בע""מ",520000118.0,ח.פ.,אופציה לס דולר שקל POALIM P3.25 26/03/26 SELL,750000146.0,פנימי,"מט""ח",ישראל,"ארה""ב",שירותים פיננסיים,"מט""ח",2026-03-26,לא,2025-09-26,USD,גורם תלוי/פנימי,קיימת תלות,2025-09-30,3.25,1.0,-29499.89,1.582,3.306,-1.543,0.092907,-2.3e-05,,
1329,9763.0,"בנק דיסקונט לישראל בע""מ",520007030.0,ח.פ.,אופציה לס דולר שקל DISCOUNT C3.75 26/11/25 BUY,750000049.0,פנימי,"מט""ח",ישראל,"ארה""ב",שירותים פיננסיים,"מט""ח",2025-11-26,לא,2025-05-28,USD,גורם תלוי/פנימי,קיימת תלות,2025-09-30,3.75,1.0,58798.93,0.0018,3.306,0.004,-0.000215,0.0,,
1329,9763.0,"בנק לאומי לישראל בע""מ",520018078.0,ח.פ.,אופציה לס דולר שקל LEUMI P3.7 13/10/25 L,750000029.0,פנימי,"מט""ח",ישראל,"ארה""ב",שירותים פיננסיים,"מט""ח",2025-10-13,לא,2025-04-09,USD,גורם תלוי/פנימי,קיימת תלות,2025-09-30,3.7,1.0,58993.89,11.897,3.306,23.204,-1.397332,0.000351,,
1329,9763.0,Goldman Sachs Group Inc,11778.0,פנימי,"אופציה לס GS C1,637.14 ESLT.TA 15/10/25 SELL",750000115.0,פנימי,מניה,ישראל,ישראל,Financial Services,מניות לרבות מדדי מניות,2025-10-15,לא,2025-08-12,ILS,גורם תלוי/פנימי,קיימת תלות,2025-09-30,1637.14,1.0,-8.8,7692.5,1.0,-0.677,0.040766,-1e-05,,
1329,9763.0,"בנק לאומי לישראל בע""מ",520018078.0,ח.פ.,אופציה לס דולר שקל LEUMI C3.38 01/12/25 SELL,750000120.0,פנימי,"מט""ח",ישראל,"ארה""ב",שירותים פיננסיים,"מט""ח",2025-12-01,לא,2025-08-25,USD,גורם תלוי/פנימי,קיימת תלות,2025-09-30,3.38,1.0,-29399.46,0.636,3.306,-0.618,0.037222,-9e-06,,
1329,9763.0,"בנק לאומי לישראל בע""מ",520018078.0,ח.פ.,אופציה לס דולר שקל LEUMI C3.39 05/12/25 SELL,750000124.0,פנימי,"מט""ח",ישראל,"ארה""ב",שירותים פיננסיים,"מט""ח",2025-12-05,לא,2025-09-02,USD,גורם תלוי/פנימי,קיימת תלות,2025-09-30,3.39,1.0,-29498.12,0.6353,3.306,-0.62,0.037306,-9e-06,,
1329,9763.0,"בנק דיסקונט לישראל בע""מ",520007030.0,ח.פ.,אופציה לס דולר שקל DISCOUNT C3.6 24/03/26 BUY,750000141.0,פנימי,"מט""ח",ישראל,"ארה""ב",שירותים פיננסיים,"מט""ח",2026-03-24,לא,2025-09-22,USD,גורם תלוי/פנימי,קיימת תלות,2025-09-30,3.6,1.0,58999.79,0.4815,3.306,0.939,-0.056551,1.4e-05,,
1329,9763.0,"בנק לאומי לישראל בע""מ",520018078.0,ח.פ.,אופציה לס דולר שקל LEUMI C3.59 06/01/26 BUY,750000125.0,פנימי,"מט""ח",ישראל,"ארה""ב",שירותים פיננסיים,"מט""ח",2026-01-05,לא,2025-09-02,USD,גורם תלוי/פנימי,קיימת תלות,2025-09-30,3.59,1.0,88494.38,0.1726,3.306,0.505,-0.030401,7e-06,,
1329,9763.0,"בנק לאומי לישראל בע""מ",520018078.0,ח.פ.,אופציה לס דולר שקל Leumi P3.7 13/10/25 S,750000040.0,פנימי,"מט""ח",ישראל,"ארה""ב",שירותים פיננסיים,"מט""ח",2025-10-13,לא,2025-05-08,USD,גורם תלוי/פנימי,קיימת תלות,2025-09-30,3.7,1.0,-58993.89,11.893,3.306,-23.195,1.396785,-0.000351,,
1329,9763.0,"בנק דיסקונט לישראל בע""מ",520007030.0,ח.פ.,אופציה לס דולר שקל DISCOUNT P3.55 08/10/25,750000020.0,פנימי,"מט""ח",ישראל,"ארה""ב",שירותים פיננסיים,"מט""ח",2025-10-08,לא,2025-04-08,USD,גורם תלוי/פנימי,קיימת תלות,2025-09-30,3.55,1.0,-117991.72,7.3698,3.306,-28.748,1.73117,-0.000436,,
1329,9763.0,"בנק דיסקונט לישראל בע""מ",520007030.0,ח.פ.,אופציה לס דולר שקל DISCOUNT P3.4 26/11/25 SELL,750000048.0,פנימי,"מט""ח",ישראל,"ארה""ב",שירותים פיננסיים,"מט""ח",2025-11-26,לא,2025-05-28,USD,גורם תלוי/פנימי,קיימת תלות,2025-09-30,3.4,1.0,-29399.46,3.267,3.306,-3.175,0.191216,-4.8e-05,,
1329,9763.0,"בנק לאומי לישראל בע""מ",520018078.0,ח.פ.,אופציה לס דולר שקל LEUMI P3.38 01/12/25 SELL,750000052.0,פנימי,"מט""ח",ישראל,"ארה""ב",שירותים פיננסיים,"מט""ח",2025-12-01,לא,2025-05-29,USD,גורם תלוי/פנימי,קיימת תלות,2025-09-30,3.38,1.0,-29399.46,2.8466,3.306,-2.767,0.166609,-4.1e-05,,
1329,9763.0,"בנק הפועלים בע""מ",520000118.0,ח.פ.,אופציה לס דולר שקל POALIM P3.6 06/10/25,750000017.0,פנימי,"מט""ח",ישראל,"ארה""ב",שירותים פיננסיים,"מט""ח",2025-10-06,לא,2025-04-04,USD,גורם תלוי/פנימי,קיימת תלות,2025-09-30,3.6,1.0,58996.25,8.8859,3.306,17.331,-1.043654,0.000262,,
1329,9763.0,"בנק דיסקונט לישראל בע""מ",520007030.0,ח.פ.,אופציה לס דולר שקל DISCOUNT P3.21 12/03/26 SELL,750000133.0,פנימי,"מט""ח",ישראל,"ארה""ב",שירותים פיננסיים,"מט""ח",2026-03-12,לא,2025-09-12,USD,גורם תלוי/פנימי,קיימת תלות,2025-09-30,3.21,1.0,-29499.89,1.0491,3.306,-1.023,0.06161,-1.5e-05,,
1329,9763.0,"בנק דיסקונט לישראל בע""מ",520007030.0,ח.פ.,אופציה לס דולר שקל DISCOUNT P3.25 24/03/26 SELL,750000142.0,פנימי,"מט""ח",ישראל,"ארה""ב",שירותים פיננסיים,"מט""ח",2026-03-24,לא,2025-09-22,USD,גורם תלוי/פנימי,קיימת תלות,2025-09-30,3.25,1.0,-29499.89,1.5316,3.306,-1.494,0.089951,-2.2e-05,,
1329,9763.0,"בנק הפועלים בע""מ",520000118.0,ח.פ.,אופציה לס דולר שקל POALIM C3.7 05/12/25 SELL,750000096.0,פנימי,"מט""ח",ישראל,"ארה""ב",שירותים פיננסיים,"מט""ח",2025-12-05,לא,2025-07-10,USD,גורם תלוי/פנימי,קיימת תלות,2025-09-30,3.7,1.0,-58996.25,0.0268,3.306,-0.052,0.003144,0.0,,
1329,9763.0,"בנק הפועלים בע""מ",520000118.0,ח.פ.,אופציה לס דולר שקל POALIM P3.39 05/12/25 SELL,750000058.0,פנימי,"מט""ח",ישראל,"ארה""ב",שירותים פיננסיים,"מט""ח",2025-12-05,לא,2025-06-06,USD,גורם תלוי/פנימי,קיימת תלות,2025-09-30,3.39,1.0,-29498.12,3.1116,3.306,-3.034,0.182731,-4.6e-05,,
1329,9763.0,"Citibank, NA",70652.0,פנימי,אופציה לס דולר שקל CITI C3.38 18/12/25 SELL,750000091.0,פנימי,"מט""ח","חו""ל","ארה""ב",Financial Services,"מט""ח",2025-12-18,לא,2025-07-03,USD,גורם תלוי/פנימי,קיימת תלות,2025-09-30,3.38,1.0,-25565.26,0.8985,3.306,-0.759,0.045727,-1.1e-05,,
1329,9763.0,"Citibank, NA",70652.0,פנימי,אופציה לס דולר שקל CITI P3.22 06/03/26 SELL,750000129.0,פנימי,"מט""ח","חו""ל","ארה""ב",Financial Services,"מט""ח",2026-03-06,לא,2025-09-09,USD,גורם תלוי/פנימי,קיימת תלות,2025-09-30,3.22,1.0,-29498.42,1.1426,3.306,-1.114,0.067103,-1.6e-05,,
1329,9763.0,"Citibank, NA",70652.0,פנימי,אופציה לס דולר שקל CITI C3.60 18/12/25 BUY,750000103.0,פנימי,"מט""ח","חו""ל","ארה""ב",Financial Services,"מט""ח",2025-12-18,לא,2025-07-16,USD,גורם תלוי/פנימי,קיימת תלות,2025-09-30,3.6,1.0,43264.22,0.1201,3.306,0.172,-0.010348,2e-06,,
1329,9763.0,"Citibank, NA",70652.0,פנימי,אופציה לס דולר שקל CITI C3.62 18/12/25 BUY,750000092.0,פנימי,"מט""ח","חו""ל","ארה""ב",Financial Services,"מט""ח",2025-12-18,לא,2025-07-03,USD,גורם תלוי/פנימי,קיימת תלות,2025-09-30,3.62,1.0,76695.8,0.0949,3.306,0.241,-0.014483,3e-06,,
1329,9763.0,Goldman Sachs Group Inc,11778.0,פנימי,אופציה לס אירו שקל GS P3.9 03/10/25 SELL,750000085.0,פנימי,"מט""ח","חו""ל",אירופה,Financial Services,"מט""ח",2025-10-03,לא,2025-07-07,EUR,גורם תלוי/פנימי,קיימת תלות,2025-09-30,3.9,1.0,-9832.64,0.6576,3.8807,-0.251,0.015109,-3e-06,,
1329,9763.0,Goldman Sachs Group Inc,11778.0,פנימי,אופציה לס אירו שקל GS P3.7 03/10/25 BUY,750000086.0,פנימי,"מט""ח","חו""ל",אירופה,Financial Services,"מט""ח",2025-10-03,לא,2025-07-01,EUR,גורם תלוי/פנימי,קיימת תלות,2025-09-30,3.7,1.0,49163.21,0.0001,3.8807,0.0,-2e-06,0.0,,
1329,9763.0,"Citibank, NA",70652.0,פנימי,אופציה לס דולר שקל CITI C3.575 06/03/26 BUY,750000128.0,פנימי,"מט""ח","חו""ל","ארה""ב",Financial Services,"מט""ח",2026-03-06,לא,2025-09-09,USD,גורם תלוי/פנימי,קיימת תלות,2025-09-30,3.575,1.0,58996.84,0.5176,3.306,1.009,-0.06079,1.5e-05,,
1329,9763.0,Goldman Sachs Group Inc,11778.0,פנימי,אופציה לס אירו שקל GS C4.2 03/10/25 BUY,750000122.0,פנימי,"מט""ח","חו""ל",אירופה,Financial Services,"מט""ח",2025-10-03,לא,2025-08-27,EUR,גורם תלוי/פנימי,קיימת תלות,2025-09-30,4.2,1.0,19692.85,0.0001,3.8807,0.0,-3e-06,0.0,,
1329,9763.0,"Citibank, NA",70652.0,פנימי,אופציה לס דולר שקל CITI C3.75 18/12/25 SELL,750000102.0,פנימי,"מט""ח","חו""ל","ארה""ב",Financial Services,"מט""ח",2025-12-18,לא,2025-07-16,USD,גורם תלוי/פנימי,קיימת תלות,2025-09-30,3.75,1.0,-43264.22,0.0287,3.306,-0.041,0.002472,0.0,,
1329,9763.0,Goldman Sachs Group Inc,11778.0,פנימי,אופציה לס אירו שקל GS P3.9 03/10/25 SELL,750000093.0,פנימי,"מט""ח","חו""ל",אירופה,Financial Services,"מט""ח",2025-10-03,לא,2025-07-01,EUR,גורם תלוי/פנימי,קיימת תלות,2025-09-30,3.9,1.0,-39385.71,0.6604,3.8807,-1.009,0.060787,-1.5e-05,,
1329,9763.0,"Citibank, NA",70652.0,פנימי,אופציה לס דולר שקל CITI C3.75 18/12/25 BUY,750000067.0,פנימי,"מט""ח","חו""ל","ארה""ב",Financial Services,"מט""ח",2025-12-18,לא,2025-06-17,USD,גורם תלוי/פנימי,קיימת תלות,2025-09-30,3.75,1.0,43264.22,0.0299,3.306,0.043,-0.002574,0.0,,
1329,9763.0,"Citibank, NA",70652.0,פנימי,אופציה לס דולר שקל CITI P3.38 18/12/25 SELL,750000066.0,פנימי,"מט""ח","חו""ל","ארה""ב",Financial Services,"מט""ח",2025-12-18,לא,2025-06-17,USD,גורם תלוי/פנימי,קיימת תלות,2025-09-30,3.38,1.0,-25565.26,3.2367,3.306,-2.736,0.164732,-4.1e-05,,
1329,12139.0,"בנק דיסקונט לישראל בע""מ",520007030.0,ח.פ.,אופציה לס דולר שקל DISCOUNT C3.58 23/12/25 BUY,750000076.0,פנימי,"מט""ח",ישראל,"ארה""ב",שירותים פיננסיים,"מט""ח",2025-12-23,לא,2025-06-26,USD,גורם תלוי/פנימי,קיימת תלות,2025-09-30,3.58,1.0,50634.7,0.1439,3.306,0.241,-0.008448,2e-06,,
1329,12139.0,"בנק לאומי לישראל בע""מ",520018078.0,ח.פ.,אופציה לס דולר שקל Leumi P3.6 13/10/25 L,750000041.0,פנימי,"מט""ח",ישראל,"ארה""ב",שירותים פיננסיים,"מט""ח",2025-10-13,לא,2025-05-08,USD,גורם תלוי/פנימי,קיימת תלות,2025-09-30,3.6,1.0,101262.65,8.8777,3.306,29.72,-1.042649,0.000263,,
1329,12139.0,"בנק לאומי לישראל בע""מ",520018078.0,ח.פ.,אופציה לס דולר שקל LEUMI C3.73 01/12/25 BUY,750000053.0,פנימי,"מט""ח",ישראל,"ארה""ב",שירותים פיננסיים,"מט""ח",2025-12-01,לא,2025-05-29,USD,גורם תלוי/פנימי,קיימת תלות,2025-09-30,3.73,1.0,100928.0,0.004,3.306,0.013,-0.00047,0.0,,
1329,12139.0,"בנק דיסקונט לישראל בע""מ",520007030.0,ח.פ.,אופציה לס דולר שקל DISCOUNT P3.55 08/10/25 BUY,750000046.0,פנימי,"מט""ח",ישראל,"ארה""ב",שירותים פיננסיים,"מט""ח",2025-10-08,לא,2025-05-21,USD,גורם תלוי/פנימי,קיימת תלות,2025-09-30,3.55,1.0,202532.06,7.3726,3.306,49.365,-1.731831,0.000437,,
1329,12139.0,"בנק הפועלים בע""מ",520000118.0,ח.פ.,אופציה לס דולר שקל POALIM C3.70 05/12/25 BUY,750000059.0,פנימי,"מט""ח",ישראל,"ארה""ב",שירותים פיננסיים,"מט""ח",2025-12-05,לא,2025-06-06,USD,גורם תלוי/פנימי,קיימת תלות,2025-09-30,3.7,1.0,101266.71,0.0091,3.306,0.03,-0.001065,0.0,,
1329,12139.0,"בנק הפועלים בע""מ",520000118.0,ח.פ.,אופציה לס דולר שקל POALIM P3.6 06/10/25 SELL,750000056.0,פנימי,"מט""ח",ישראל,"ארה""ב",שירותים פיננסיים,"מט""ח",2025-10-06,לא,2025-06-04,USD,גורם תלוי/פנימי,קיימת תלות,2025-09-30,3.6,1.0,-101266.71,8.8822,3.306,-29.737,1.043224,-0.000263,,
1329,12139.0,"בנק לאומי לישראל בע""מ",520018078.0,ח.פ.,אופציה לס דולר שקל LEUMI P3.6 13/10/25 S,750000027.0,פנימי,"מט""ח",ישראל,"ארה""ב",שירותים פיננסיים,"מט""ח",2025-10-13,לא,2025-04-09,USD,גורם תלוי/פנימי,קיימת תלות,2025-09-30,3.6,1.0,-101262.65,8.8731,3.306,-29.705,1.042109,-0.000263,,
1329,12139.0,Goldman Sachs Group Inc,11778.0,פנימי,אופציה לס אירו שקל GS C4.2 03/10/25,750000010.0,פנימי,"מט""ח","חו""ל",אירופה,Financial Services,"מט""ח",2025-10-03,לא,2025-04-03,EUR,גורם תלוי/פנימי,קיימת תלות,2025-09-30,4.2,1.0,-33802.66,0.0001,3.8807,0.0,4e-06,0.0,,
1329,12139.0,"בנק הפועלים בע""מ",520000118.0,ח.פ.,אופציה לס דולר שקל POALIM P3.5 06/10/25 BUY,750000057.0,פנימי,"מט""ח",ישראל,"ארה""ב",שירותים פיננסיים,"מט""ח",2025-10-06,לא,2025-06-04,USD,גורם תלוי/פנימי,קיימת תלות,2025-09-30,3.5,1.0,101266.71,5.8625,3.306,19.627,-0.688558,0.000173,,
1329,12139.0,Goldman Sachs Group Inc,11778.0,פנימי,אופציה לס אירו שקל GS P3.7 03/10/25,750000012.0,פנימי,"מט""ח","חו""ל",אירופה,Financial Services,"מט""ח",2025-10-03,לא,2025-04-03,EUR,גורם תלוי/פנימי,קיימת תלות,2025-09-30,3.7,1.0,-84506.67,0.0001,3.8807,0.0,2e-06,0.0,,
1329,12139.0,"בנק דיסקונט לישראל בע""מ",520007030.0,ח.פ.,אופציה לס דולר שקל DISCOUNT P3.65 08/10/25 SELL,750000045.0,פנימי,"מט""ח",ישראל,"ארה""ב",שירותים פיננסיים,"מט""ח",2025-10-08,לא,2025-05-21,USD,גורם תלוי/פנימי,קיימת תלות,2025-09-30,3.65,1.0,-202532.06,10.391,3.306,-69.579,2.440987,-0.000616,,
1329,12139.0,Goldman Sachs Group Inc,11778.0,פנימי,אופציה לס אירו שקל GS P3.9 03/10/25,750000011.0,פנימי,"מט""ח","חו""ל",אירופה,Financial Services,"מט""ח",2025-10-03,לא,2025-04-03,EUR,גורם תלוי/פנימי,קיימת תלות,2025-09-30,3.9,1.0,84506.67,0.6786,3.8807,2.226,-0.078077,1.9e-05,,
1329,12139.0,"בנק לאומי לישראל בע""מ",520018078.0,ח.פ.,אופציה לס דולר שקל LEUMI C3.6 01/12/25 BUY,750000098.0,פנימי,"מט""ח",ישראל,"ארה""ב",שירותים פיננסיים,"מט""ח",2025-12-01,לא,2025-07-10,USD,גורם תלוי/פנימי,קיימת תלות,2025-09-30,3.6,1.0,100928.0,0.0679,3.306,0.227,-0.007949,2e-06,,
1329,12139.0,"בנק לאומי לישראל בע""מ",520018078.0,ח.פ.,אופציה לס דולר שקל LEUMI C3.60 07/01/26 BUY,750000121.0,פנימי,"מט""ח",ישראל,"ארה""ב",שירותים פיננסיים,"מט""ח",2026-01-07,לא,2025-08-25,USD,גורם תלוי/פנימי,קיימת תלות,2025-09-30,3.6,1.0,151392.01,0.1624,3.306,0.813,-0.02852,7e-06,,
1329,12139.0,"בנק דיסקונט לישראל בע""מ",520007030.0,ח.פ.,אופציה לס דולר שקל DISCOUNT P3.29 23/12/25 SELL,750000077.0,פנימי,"מט""ח",ישראל,"ארה""ב",שירותים פיננסיים,"מט""ח",2025-12-23,לא,2025-06-26,USD,גורם תלוי/פנימי,קיימת תלות,2025-09-30,3.29,1.0,-50634.7,1.4861,3.306,-2.488,0.087273,-2.2e-05,,
1329,12139.0,"בנק הפועלים בע""מ",520000118.0,ח.פ.,אופציה לס דולר שקל POALIM C3.6 05/12/25 BUY,750000099.0,פנימי,"מט""ח",ישראל,"ארה""ב",שירותים פיננסיים,"מט""ח",2025-12-05,לא,2025-05-14,USD,גורם תלוי/פנימי,קיימת תלות,2025-09-30,3.6,1.0,101266.71,0.0815,3.306,0.273,-0.00957,2e-06,,
1329,12139.0,"בנק דיסקונט לישראל בע""מ",520007030.0,ח.פ.,אופציה לס דולר שקל DISCOUNT C3.575 12/03/26 BUY,750000132.0,פנימי,"מט""ח",ישראל,"ארה""ב",שירותים פיננסיים,"מט""ח",2026-03-12,לא,2025-09-12,USD,גורם תלוי/פנימי,קיימת תלות,2025-09-30,3.575,1.0,101272.79,0.5282,3.306,1.769,-0.062043,1.5e-05,,
1329,12139.0,"בנק דיסקונט לישראל בע""מ",520007030.0,ח.פ.,אופציה לס דולר שקל DISCOUNT C3.55 13/01/26 BUY,750000117.0,פנימי,"מט""ח",ישראל,"ארה""ב",שירותים פיננסיים,"מט""ח",2026-01-13,לא,2025-08-13,USD,גורם תלוי/פנימי,קיימת תלות,2025-09-30,3.55,1.0,100928.0,0.2679,3.306,0.894,-0.031364,7e-06,,
1329,12139.0,"בנק הפועלים בע""מ",520000118.0,ח.פ.,אופציה לס דולר שקל POALIM P3.25 26/03/26 SELL,750000146.0,פנימי,"מט""ח",ישראל,"ארה""ב",שירותים פיננסיים,"מט""ח",2026-03-26,לא,2025-09-26,USD,גורם תלוי/פנימי,קיימת תלות,2025-09-30,3.25,1.0,-50636.39,1.582,3.306,-2.648,0.092907,-2.3e-05,,
1329,12139.0,"בנק לאומי לישראל בע""מ",520018078.0,ח.פ.,אופציה לס דולר שקל LEUMI P3.7 13/10/25 L,750000029.0,פנימי,"מט""ח",ישראל,"ארה""ב",שירותים פיננסיים,"מט""ח",2025-10-13,לא,2025-04-09,USD,גורם תלוי/פנימי,קיימת תלות,2025-09-30,3.7,1.0,101262.65,11.897,3.306,39.83,-1.397332,0.000352,,
1329,12139.0,"בנק לאומי לישראל בע""מ",520018078.0,ח.פ.,אופציה לס דולר שקל LEUMI C3.73 01/12/25 SELL,750000097.0,פנימי,"מט""ח",ישראל,"ארה""ב",שירותים פיננסיים,"מט""ח",2025-12-01,לא,2025-07-10,USD,גורם תלוי/פנימי,קיימת תלות,2025-09-30,3.73,1.0,-100928.0,0.0145,3.306,-0.048,0.001696,0.0,,
1329,12139.0,"בנק הפועלים בע""מ",520000118.0,ח.פ.,אופציה לס דולר שקל POALIM C3.7 05/12/25 SELL 15/07,750000100.0,פנימי,"מט""ח",ישראל,"ארה""ב",שירותים פיננסיים,"מט""ח",2025-12-05,לא,2025-05-14,USD,גורם תלוי/פנימי,קיימת תלות,2025-09-30,3.7,1.0,-101266.71,0.0277,3.306,-0.093,0.003254,0.0,,
1329,12139.0,"בנק הפועלים בע""מ",520000118.0,ח.פ.,אופציה לס דולר שקל POALIM C3.5 05/12/25 BUY,750000095.0,פנימי,"מט""ח",ישראל,"ארה""ב",שירותים פיננסיים,"מט""ח",2025-12-05,לא,2025-07-10,USD,גורם תלוי/פנימי,קיימת תלות,2025-09-30,3.5,1.0,101266.71,0.2323,3.306,0.778,-0.02728,6e-06,,
1329,12139.0,"בנק דיסקונט לישראל בע""מ",520007030.0,ח.פ.,אופציה לס דולר שקל DISCOUNT C3.29 23/12/25 SELL,750000094.0,פנימי,"מט""ח",ישראל,"ארה""ב",שירותים פיננסיים,"מט""ח",2025-12-23,לא,2025-07-10,USD,גורם תלוי/פנימי,קיימת תלות,2025-09-30,3.29,1.0,-50634.7,2.0174,3.306,-3.377,0.118473,-2.9e-05,,
1329,12139.0,"בנק דיסקונט לישראל בע""מ",520007030.0,ח.פ.,אופציה לס דולר שקל DISCOUNT P3.65 08/10/25,750000019.0,פנימי,"מט""ח",ישראל,"ארה""ב",שירותים פיננסיים,"מט""ח",2025-10-08,לא,2025-04-08,USD,גורם תלוי/פנימי,קיימת תלות,2025-09-30,3.65,1.0,202532.06,10.394,3.306,69.598,-2.441655,0.000616,,
1329,12139.0,"בנק הפועלים בע""מ",520000118.0,ח.פ.,אופציה לס דולר שקל POALIM C3.59 26/03/26 BUY,750000145.0,פנימי,"מט""ח",ישראל,"ארה""ב",שירותים פיננסיים,"מט""ח",2026-03-26,לא,2025-09-26,USD,גורם תלוי/פנימי,קיימת תלות,2025-09-30,3.59,1.0,101272.79,0.5462,3.306,1.829,-0.064154,1.6e-05,,
1329,12139.0,"בנק הפועלים בע""מ",520000118.0,ח.פ.,אופציה לס דולר שקל POALIM P3.5 06/10/25,750000016.0,פנימי,"מט""ח",ישראל,"ארה""ב",שירותים פיננסיים,"מט""ח",2025-10-06,לא,2025-04-04,USD,גורם תלוי/פנימי,קיימת תלות,2025-09-30,3.5,1.0,-101266.71,5.8612,3.306,-19.623,0.688405,-0.000173,,
1329,12139.0,"בנק דיסקונט לישראל בע""מ",520007030.0,ח.פ.,אופציה לס דולר שקל DISCOUNT C3.75 26/11/25 BUY,750000049.0,פנימי,"מט""ח",ישראל,"ארה""ב",שירותים פיננסיים,"מט""ח",2025-11-26,לא,2025-05-28,USD,גורם תלוי/פנימי,קיימת תלות,2025-09-30,3.75,1.0,100928.0,0.0018,3.306,0.006,-0.000215,0.0,,
1329,12139.0,Goldman Sachs Group Inc,11778.0,פנימי,"אופציה לס GS C1,637.14 ESLT.TA 15/10/25 SELL",750000115.0,פנימי,מניה,ישראל,ישראל,Financial Services,מניות לרבות מדדי מניות,2025-10-15,לא,2025-08-12,ILS,גורם תלוי/פנימי,קיימת תלות,2025-09-30,1637.14,1.0,-15.1,7692.5,1.0,-1.162,0.040766,-1e-05,,
1329,12139.0,"בנק דיסקונט לישראל בע""מ",520007030.0,ח.פ.,אופציה לס דולר שקל DISCOUNT C3.4 26/11/25 SELL,750000116.0,פנימי,"מט""ח",ישראל,"ארה""ב",שירותים פיננסיים,"מט""ח",2025-11-26,לא,2025-08-13,USD,גורם תלוי/פנימי,קיימת תלות,2025-09-30,3.4,1.0,-50464.0,0.4649,3.306,-0.776,0.027212,-6e-06,,
1329,12139.0,"בנק דיסקונט לישראל בע""מ",520007030.0,ח.פ.,אופציה לס דולר שקל DISCOUNT C3.6 24/03/26 BUY,750000141.0,פנימי,"מט""ח",ישראל,"ארה""ב",שירותים פיננסיים,"מט""ח",2026-03-24,לא,2025-09-22,USD,גורם תלוי/פנימי,קיימת תלות,2025-09-30,3.6,1.0,101272.79,0.4815,3.306,1.612,-0.056551,1.4e-05,,
1329,12139.0,"בנק לאומי לישראל בע""מ",520018078.0,ח.פ.,אופציה לס דולר שקל LEUMI C3.38 01/12/25 SELL,750000120.0,פנימי,"מט""ח",ישראל,"ארה""ב",שירותים פיננסיים,"מט""ח",2025-12-01,לא,2025-08-25,USD,גורם תלוי/פנימי,קיימת תלות,2025-09-30,3.38,1.0,-50464.0,0.636,3.306,-1.061,0.037222,-9e-06,,
1329,12139.0,"בנק לאומי לישראל בע""מ",520018078.0,ח.פ.,אופציה לס דולר שקל LEUMI C3.39 05/12/25 SELL,750000124.0,פנימי,"מט""ח",ישראל,"ארה""ב",שירותים פיננסיים,"מט""ח",2025-12-05,לא,2025-09-02,USD,גורם תלוי/פנימי,קיימת תלות,2025-09-30,3.39,1.0,-50633.35,0.6353,3.306,-1.063,0.037306,-9e-06,,
1329,12139.0,"בנק דיסקונט לישראל בע""מ",520007030.0,ח.פ.,אופציה לס דולר שקל DISCOUNT P3.4 26/11/25 SELL,750000048.0,פנימי,"מט""ח",ישראל,"ארה""ב",שירותים פיננסיים,"מט""ח",2025-11-26,לא,2025-05-28,USD,גורם תלוי/פנימי,קיימת תלות,2025-09-30,3.4,1.0,-50464.0,3.267,3.306,-5.451,0.191216,-4.8e-05,,
1329,12139.0,"בנק לאומי לישראל בע""מ",520018078.0,ח.פ.,אופציה לס דולר שקל LEUMI P3.38 01/12/25 SELL,750000052.0,פנימי,"מט""ח",ישראל,"ארה""ב",שירותים פיננסיים,"מט""ח",2025-12-01,לא,2025-05-29,USD,גורם תלוי/פנימי,קיימת תלות,2025-09-30,3.38,1.0,-50464.0,2.8466,3.306,-4.749,0.166609,-4.2e-05,,
1329,12139.0,"בנק דיסקונט לישראל בע""מ",520007030.0,ח.פ.,אופציה לס דולר שקל DISCOUNT P3.55 08/10/25,750000020.0,פנימי,"מט""ח",ישראל,"ארה""ב",שירותים פיננסיים,"מט""ח",2025-10-08,לא,2025-04-08,USD,גורם תלוי/פנימי,קיימת תלות,2025-09-30,3.55,1.0,-202532.06,7.3698,3.306,-49.346,1.73117,-0.000436,,
1329,12139.0,"בנק לאומי לישראל בע""מ",520018078.0,ח.פ.,אופציה לס דולר שקל Leumi P3.7 13/10/25 S,750000040.0,פנימי,"מט""ח",ישראל,"ארה""ב",שירותים פיננסיים,"מט""ח",2025-10-13,לא,2025-05-08,USD,גורם תלוי/פנימי,קיימת תלות,2025-09-30,3.7,1.0,-101262.65,11.893,3.306,-39.815,1.396785,-0.000352,,
1329,12139.0,"בנק לאומי לישראל בע""מ",520018078.0,ח.פ.,אופציה לס דולר שקל LEUMI C3.59 06/01/26 BUY,750000125.0,פנימי,"מט""ח",ישראל,"ארה""ב",שירותים פיננסיים,"מט""ח",2026-01-05,לא,2025-09-02,USD,גורם תלוי/פנימי,קיימת תלות,2025-09-30,3.59,1.0,151900.06,0.1726,3.306,0.867,-0.030401,7e-06,,
1329,12139.0,"בנק הפועלים בע""מ",520000118.0,ח.פ.,אופציה לס דולר שקל POALIM P3.6 06/10/25,750000017.0,פנימי,"מט""ח",ישראל,"ארה""ב",שירותים פיננסיים,"מט""ח",2025-10-06,לא,2025-04-04,USD,גורם תלוי/פנימי,קיימת תלות,2025-09-30,3.6,1.0,101266.71,8.8859,3.306,29.749,-1.043654,0.000263,,
1329,12139.0,"בנק דיסקונט לישראל בע""מ",520007030.0,ח.פ.,אופציה לס דולר שקל DISCOUNT P3.21 12/03/26 SELL,750000133.0,פנימי,"מט""ח",ישראל,"ארה""ב",שירותים פיננסיים,"מט""ח",2026-03-12,לא,2025-09-12,USD,גורם תלוי/פנימי,קיימת תלות,2025-09-30,3.21,1.0,-50636.39,1.0491,3.306,-1.756,0.06161,-1.5e-05,,
1329,12139.0,"בנק דיסקונט לישראל בע""מ",520007030.0,ח.פ.,אופציה לס דולר שקל DISCOUNT P3.25 24/03/26 SELL,750000142.0,פנימי,"מט""ח",ישראל,"ארה""ב",שירותים פיננסיים,"מט""ח",2026-03-24,לא,2025-09-22,USD,גורם תלוי/פנימי,קיימת תלות,2025-09-30,3.25,1.0,-50636.39,1.5316,3.306,-2.564,0.089951,-2.2e-05,,
1329,12139.0,"בנק הפועלים בע""מ",520000118.0,ח.פ.,אופציה לס דולר שקל POALIM C3.7 05/12/25 SELL,750000096.0,פנימי,"מט""ח",ישראל,"ארה""ב",שירותים פיננסיים,"מט""ח",2025-12-05,לא,2025-07-10,USD,גורם תלוי/פנימי,קיימת תלות,2025-09-30,3.7,1.0,-101266.71,0.0268,3.306,-0.09,0.003144,0.0,,
1329,12139.0,"בנק הפועלים בע""מ",520000118.0,ח.פ.,אופציה לס דולר שקל POALIM P3.39 05/12/25 SELL,750000058.0,פנימי,"מט""ח",ישראל,"ארה""ב",שירותים פיננסיים,"מט""ח",2025-12-05,לא,2025-06-06,USD,גורם תלוי/פנימי,קיימת תלות,2025-09-30,3.39,1.0,-50633.35,3.1116,3.306,-5.209,0.182731,-4.6e-05,,
1329,12139.0,"Citibank, NA",70652.0,פנימי,אופציה לס דולר שקל CITI C3.38 18/12/25 SELL,750000091.0,פנימי,"מט""ח","חו""ל","ארה""ב",Financial Services,"מט""ח",2025-12-18,לא,2025-07-03,USD,גורם תלוי/פנימי,קיימת תלות,2025-09-30,3.38,1.0,-43882.62,0.8985,3.306,-1.303,0.045727,-1.1e-05,,
1329,12139.0,"Citibank, NA",70652.0,פנימי,אופציה לס דולר שקל CITI P3.22 06/03/26 SELL,750000129.0,פנימי,"מט""ח","חו""ל","ארה""ב",Financial Services,"מט""ח",2026-03-06,לא,2025-09-09,USD,גורם תלוי/פנימי,קיימת תלות,2025-09-30,3.22,1.0,-50633.86,1.1426,3.306,-1.913,0.067103,-1.6e-05,,
1329,12139.0,Goldman Sachs Group Inc,11778.0,פנימי,אופציה לס אירו שקל GS P3.7 03/10/25 BUY,750000086.0,פנימי,"מט""ח","חו""ל",אירופה,Financial Services,"מט""ח",2025-10-03,לא,2025-07-01,EUR,גורם תלוי/פנימי,קיימת תלות,2025-09-30,3.7,1.0,84388.36,0.0001,3.8807,0.0,-2e-06,0.0,,
1329,12139.0,Goldman Sachs Group Inc,11778.0,פנימי,אופציה לס אירו שקל GS P3.9 03/10/25 SELL,750000085.0,פנימי,"מט""ח","חו""ל",אירופה,Financial Services,"מט""ח",2025-10-03,לא,2025-07-07,EUR,גורם תלוי/פנימי,קיימת תלות,2025-09-30,3.9,1.0,-16877.67,0.6576,3.8807,-0.431,0.015109,-3e-06,,
1329,12139.0,"Citibank, NA",70652.0,פנימי,אופציה לס דולר שקל CITI C3.62 18/12/25 BUY,750000092.0,פנימי,"מט""ח","חו""ל","ארה""ב",Financial Services,"מט""ח",2025-12-18,לא,2025-07-03,USD,גורם תלוי/פנימי,קיימת תלות,2025-09-30,3.62,1.0,131647.87,0.0949,3.306,0.413,-0.014483,3e-06,,
1329,12139.0,"Citibank, NA",70652.0,פנימי,אופציה לס דולר שקל CITI C3.60 18/12/25 BUY,750000103.0,פנימי,"מט""ח","חו""ל","ארה""ב",Financial Services,"מט""ח",2025-12-18,לא,2025-07-16,USD,גורם תלוי/פנימי,קיימת תלות,2025-09-30,3.6,1.0,74262.77,0.1201,3.306,0.295,-0.010348,2e-06,,
1329,12139.0,"Citibank, NA",70652.0,פנימי,אופציה לס דולר שקל CITI C3.575 06/03/26 BUY,750000128.0,פנימי,"מט""ח","חו""ל","ארה""ב",Financial Services,"מט""ח",2026-03-06,לא,2025-09-09,USD,גורם תלוי/פנימי,קיימת תלות,2025-09-30,3.575,1.0,101267.72,0.5176,3.306,1.733,-0.06079,1.5e-05,,
1329,12139.0,Goldman Sachs Group Inc,11778.0,פנימי,אופציה לס אירו שקל GS C4.2 03/10/25 BUY,750000122.0,פנימי,"מט""ח","חו""ל",אירופה,Financial Services,"מט""ח",2025-10-03,לא,2025-08-27,EUR,גורם תלוי/פנימי,קיימת תלות,2025-09-30,4.2,1.0,33802.66,0.0001,3.8807,0.0,-3e-06,0.0,,
1329,12139.0,"Citibank, NA",70652.0,פנימי,אופציה לס דולר שקל CITI C3.75 18/12/25 SELL,750000102.0,פנימי,"מט""ח","חו""ל","ארה""ב",Financial Services,"מט""ח",2025-12-18,לא,2025-07-16,USD,גורם תלוי/פנימי,קיימת תלות,2025-09-30,3.75,1.0,-74262.77,0.0287,3.306,-0.07,0.002472,0.0,,
1329,12139.0,Goldman Sachs Group Inc,11778.0,פנימי,אופציה לס אירו שקל GS P3.9 03/10/25 SELL,750000093.0,פנימי,"מט""ח","חו""ל",אירופה,Financial Services,"מט""ח",2025-10-03,לא,2025-07-01,EUR,גורם תלוי/פנימי,קיימת תלות,2025-09-30,3.9,1.0,-67605.33,0.6604,3.8807,-1.733,0.060787,-1.5e-05,,
1329,12139.0,"Citibank, NA",70652.0,פנימי,אופציה לס דולר שקל CITI C3.75 18/12/25 BUY,750000067.0,פנימי,"מט""ח","חו""ל","ארה""ב",Financial Services,"מט""ח",2025-12-18,לא,2025-06-17,USD,גורם תלוי/פנימי,קיימת תלות,2025-09-30,3.75,1.0,74262.77,0.0299,3.306,0.073,-0.002574,0.0,,
1329,12139.0,"Citibank, NA",70652.0,פנימי,אופציה לס דולר שקל CITI P3.38 18/12/25 SELL,750000066.0,פנימי,"מט""ח","חו""ל","ארה""ב",Financial Services,"מט""ח",2025-12-18,לא,2025-06-17,USD,גורם תלוי/פנימי,קיימת תלות,2025-09-30,3.38,1.0,-43882.62,3.2367,3.306,-4.696,0.164732,-4.1e-05,,
1329,13211.0,"בנק דיסקונט לישראל בע""מ",520007030.0,ח.פ.,אופציה לס דולר שקל DISCOUNT C3.58 23/12/25 BUY,750000076.0,פנימי,"מט""ח",ישראל,"ארה""ב",שירותים פיננסיים,"מט""ח",2025-12-23,לא,2025-06-26,USD,גורם תלוי/פנימי,קיימת תלות,2025-09-30,3.58,1.0,364436.54,0.1439,3.306,1.733,-0.008448,8e-06,,
1329,13211.0,"בנק לאומי לישראל בע""מ",520018078.0,ח.פ.,אופציה לס דולר שקל Leumi P3.6 13/10/25 L,750000041.0,פנימי,"מט""ח",ישראל,"ארה""ב",שירותים פיננסיים,"מט""ח",2025-10-13,לא,2025-05-08,USD,גורם תלוי/פנימי,קיימת תלות,2025-09-30,3.6,1.0,728824.43,8.8777,3.306,213.907,-1.042649,0.001061,,
1329,13211.0,"בנק הפועלים בע""מ",520000118.0,ח.פ.,אופציה לס דולר שקל POALIM C3.70 05/12/25 BUY,750000059.0,פנימי,"מט""ח",ישראל,"ארה""ב",שירותים פיננסיים,"מט""ח",2025-12-05,לא,2025-06-06,USD,גורם תלוי/פנימי,קיימת תלות,2025-09-30,3.7,1.0,728853.62,0.0091,3.306,0.219,-0.001065,1e-06,,
1329,13211.0,"בנק דיסקונט לישראל בע""מ",520007030.0,ח.פ.,אופציה לס דולר שקל DISCOUNT P3.55 08/10/25 BUY,750000046.0,פנימי,"מט""ח",ישראל,"ארה""ב",שירותים פיננסיים,"מט""ח",2025-10-08,לא,2025-05-21,USD,גורם תלוי/פנימי,קיימת תלות,2025-09-30,3.55,1.0,1457697.51,7.3726,3.306,355.298,-1.731831,0.001763,,
1329,13211.0,"בנק לאומי לישראל בע""מ",520018078.0,ח.פ.,אופציה לס דולר שקל LEUMI C3.73 01/12/25 BUY,750000053.0,פנימי,"מט""ח",ישראל,"ארה""ב",שירותים פיננסיים,"מט""ח",2025-12-01,לא,2025-05-29,USD,גורם תלוי/פנימי,קיימת תלות,2025-09-30,3.73,1.0,726415.85,0.004,3.306,0.097,-0.00047,0.0,,
1329,13211.0,Goldman Sachs Group Inc,11778.0,פנימי,אופציה לס אירו שקל GS C4.2 03/10/25,750000010.0,פנימי,"מט""ח","חו""ל",אירופה,Financial Services,"מט""ח",2025-10-03,לא,2025-04-03,EUR,גורם תלוי/פנימי,קיימת תלות,2025-09-30,4.2,1.0,-243290.19,0.0001,3.8807,-0.001,4e-06,0.0,,
1329,13211.0,"בנק לאומי לישראל בע""מ",520018078.0,ח.פ.,אופציה לס דולר שקל LEUMI P3.6 13/10/25 S,750000027.0,פנימי,"מט""ח",ישראל,"ארה""ב",שירותים פיננסיים,"מט""ח",2025-10-13,לא,2025-04-09,USD,גורם תלוי/פנימי,קיימת תלות,2025-09-30,3.6,1.0,-728824.43,8.8731,3.306,-213.796,1.042109,-0.001061,,
1329,13211.0,"בנק הפועלים בע""מ",520000118.0,ח.פ.,אופציה לס דולר שקל POALIM P3.6 06/10/25 SELL,750000056.0,פנימי,"מט""ח",ישראל,"ארה""ב",שירותים פיננסיים,"מט""ח",2025-10-06,לא,2025-06-04,USD,גורם תלוי/פנימי,קיימת תלות,2025-09-30,3.6,1.0,-728853.62,8.8822,3.306,-214.025,1.043224,-0.001062,,
1329,13211.0,Goldman Sachs Group Inc,11778.0,פנימי,אופציה לס אירו שקל GS P3.9 03/10/25,750000011.0,פנימי,"מט""ח","חו""ל",אירופה,Financial Services,"מט""ח",2025-10-03,לא,2025-04-03,EUR,גורם תלוי/פנימי,קיימת תלות,2025-09-30,3.9,1.0,608225.48,0.6786,3.8807,16.018,-0.078077,7.9e-05,,
1329,13211.0,Goldman Sachs Group Inc,11778.0,פנימי,אופציה לס אירו שקל GS P3.7 03/10/25,750000012.0,פנימי,"מט""ח","חו""ל",אירופה,Financial Services,"מט""ח",2025-10-03,לא,2025-04-03,EUR,גורם תלוי/פנימי,קיימת תלות,2025-09-30,3.7,1.0,-608225.48,0.0001,3.8807,-0.001,2e-06,0.0,,
1329,13211.0,"בנק דיסקונט לישראל בע""מ",520007030.0,ח.פ.,אופציה לס דולר שקל DISCOUNT P3.65 08/10/25 SELL,750000045.0,פנימי,"מט""ח",ישראל,"ארה""ב",שירותים פיננסיים,"מט""ח",2025-10-08,לא,2025-05-21,USD,גורם תלוי/פנימי,קיימת תלות,2025-09-30,3.65,1.0,-1457697.51,10.391,3.306,-500.786,2.440987,-0.002485,,
1329,13211.0,"בנק הפועלים בע""מ",520000118.0,ח.פ.,אופציה לס דולר שקל POALIM P3.5 06/10/25 BUY,750000057.0,פנימי,"מט""ח",ישראל,"ארה""ב",שירותים פיננסיים,"מט""ח",2025-10-06,לא,2025-06-04,USD,גורם תלוי/פנימי,קיימת תלות,2025-09-30,3.5,1.0,728853.62,5.8625,3.306,141.263,-0.688558,0.000701,,
1329,13211.0,"בנק הפועלים בע""מ",520000118.0,ח.פ.,אופציה לס דולר שקל POALIM C3.6 05/12/25 BUY,750000099.0,פנימי,"מט""ח",ישראל,"ארה""ב",שירותים פיננסיים,"מט""ח",2025-12-05,לא,2025-05-14,USD,גורם תלוי/פנימי,קיימת תלות,2025-09-30,3.6,1.0,728853.62,0.0815,3.306,1.964,-0.00957,9e-06,,
1329,13211.0,"בנק דיסקונט לישראל בע""מ",520007030.0,ח.פ.,אופציה לס דולר שקל DISCOUNT P3.29 23/12/25 SELL,750000077.0,פנימי,"מט""ח",ישראל,"ארה""ב",שירותים פיננסיים,"מט""ח",2025-12-23,לא,2025-06-26,USD,גורם תלוי/פנימי,קיימת תלות,2025-09-30,3.29,1.0,-364436.54,1.4861,3.306,-17.905,0.087273,-8.8e-05,,
1329,13211.0,"בנק לאומי לישראל בע""מ",520018078.0,ח.פ.,אופציה לס דולר שקל LEUMI C3.6 01/12/25 BUY,750000098.0,פנימי,"מט""ח",ישראל,"ארה""ב",שירותים פיננסיים,"מט""ח",2025-12-01,לא,2025-07-10,USD,גורם תלוי/פנימי,קיימת תלות,2025-09-30,3.6,1.0,726415.85,0.0679,3.306,1.631,-0.007949,8e-06,,
1329,13211.0,"בנק דיסקונט לישראל בע""מ",520007030.0,ח.פ.,אופציה לס דולר שקל DISCOUNT C3.55 13/01/26 BUY,750000117.0,פנימי,"מט""ח",ישראל,"ארה""ב",שירותים פיננסיים,"מט""ח",2026-01-13,לא,2025-08-13,USD,גורם תלוי/פנימי,קיימת תלות,2025-09-30,3.55,1.0,726415.85,0.2679,3.306,6.435,-0.031364,3.1e-05,,
1329,13211.0,"בנק לאומי לישראל בע""מ",520018078.0,ח.פ.,אופציה לס דולר שקל LEUMI C3.60 07/01/26 BUY,750000121.0,פנימי,"מט""ח",ישראל,"ארה""ב",שירותים פיננסיים,"מט""ח",2026-01-07,לא,2025-08-25,USD,גורם תלוי/פנימי,קיימת תלות,2025-09-30,3.6,1.0,1089623.78,0.1624,3.306,5.851,-0.02852,2.9e-05,,
1329,13211.0,"בנק דיסקונט לישראל בע""מ",520007030.0,ח.פ.,אופציה לס דולר שקל DISCOUNT C3.575 12/03/26 BUY,750000132.0,פנימי,"מט""ח",ישראל,"ארה""ב",שירותים פיננסיים,"מט""ח",2026-03-12,לא,2025-09-12,USD,גורם תלוי/פנימי,קיימת תלות,2025-09-30,3.575,1.0,728897.41,0.5282,3.306,12.729,-0.062043,6.3e-05,,
1329,13211.0,"בנק הפועלים בע""מ",520000118.0,ח.פ.,אופציה לס דולר שקל POALIM P3.5 06/10/25,750000016.0,פנימי,"מט""ח",ישראל,"ארה""ב",שירותים פיננסיים,"מט""ח",2025-10-06,לא,2025-04-04,USD,גורם תלוי/פנימי,קיימת תלות,2025-09-30,3.5,1.0,-728853.62,5.8612,3.306,-141.231,0.688405,-0.000701,,
1329,13211.0,"בנק הפועלים בע""מ",520000118.0,ח.פ.,אופציה לס דולר שקל POALIM C3.59 26/03/26 BUY,750000145.0,פנימי,"מט""ח",ישראל,"ארה""ב",שירותים פיננסיים,"מט""ח",2026-03-26,לא,2025-09-26,USD,גורם תלוי/פנימי,קיימת תלות,2025-09-30,3.59,1.0,728897.41,0.5462,3.306,13.162,-0.064154,6.5e-05,,
1329,13211.0,"בנק דיסקונט לישראל בע""מ",520007030.0,ח.פ.,אופציה לס דולר שקל DISCOUNT P3.65 08/10/25,750000019.0,פנימי,"מט""ח",ישראל,"ארה""ב",שירותים פיננסיים,"מט""ח",2025-10-08,לא,2025-04-08,USD,גורם תלוי/פנימי,קיימת תלות,2025-09-30,3.65,1.0,1457697.51,10.394,3.306,500.923,-2.441655,0.002486,,
1329,13211.0,"בנק דיסקונט לישראל בע""מ",520007030.0,ח.פ.,אופציה לס דולר שקל DISCOUNT C3.29 23/12/25 SELL,750000094.0,פנימי,"מט""ח",ישראל,"ארה""ב",שירותים פיננסיים,"מט""ח",2025-12-23,לא,2025-07-10,USD,גורם תלוי/פנימי,קיימת תלות,2025-09-30,3.29,1.0,-364436.54,2.0174,3.306,-24.306,0.118473,-0.00012,,
1329,13211.0,"בנק הפועלים בע""מ",520000118.0,ח.פ.,אופציה לס דולר שקל POALIM C3.5 05/12/25 BUY,750000095.0,פנימי,"מט""ח",ישראל,"ארה""ב",שירותים פיננסיים,"מט""ח",2025-12-05,לא,2025-07-10,USD,גורם תלוי/פנימי,קיימת תלות,2025-09-30,3.5,1.0,728853.62,0.2323,3.306,5.597,-0.02728,2.7e-05,,
1329,13211.0,"בנק לאומי לישראל בע""מ",520018078.0,ח.פ.,אופציה לס דולר שקל LEUMI C3.73 01/12/25 SELL,750000097.0,פנימי,"מט""ח",ישראל,"ארה""ב",שירותים פיננסיים,"מט""ח",2025-12-01,לא,2025-07-10,USD,גורם תלוי/פנימי,קיימת תלות,2025-09-30,3.73,1.0,-726415.85,0.0145,3.306,-0.348,0.001696,-1e-06,,
1329,13211.0,"בנק לאומי לישראל בע""מ",520018078.0,ח.פ.,אופציה לס דולר שקל LEUMI P3.7 13/10/25 L,750000029.0,פנימי,"מט""ח",ישראל,"ארה""ב",שירותים פיננסיים,"מט""ח",2025-10-13,לא,2025-04-09,USD,גורם תלוי/פנימי,קיימת תלות,2025-09-30,3.7,1.0,728824.43,11.897,3.306,286.673,-1.397332,0.001423,,
1329,13211.0,"בנק הפועלים בע""מ",520000118.0,ח.פ.,אופציה לס דולר שקל POALIM P3.25 26/03/26 SELL,750000146.0,פנימי,"מט""ח",ישראל,"ארה""ב",שירותים פיננסיים,"מט""ח",2026-03-26,לא,2025-09-26,USD,גורם תלוי/פנימי,קיימת תלות,2025-09-30,3.25,1.0,-364448.7,1.582,3.306,-19.061,0.092907,-9.4e-05,,
1329,13211.0,"בנק הפועלים בע""מ",520000118.0,ח.פ.,אופציה לס דולר שקל POALIM C3.7 05/12/25 SELL 15/07,750000100.0,פנימי,"מט""ח",ישראל,"ארה""ב",שירותים פיננסיים,"מט""ח",2025-12-05,לא,2025-05-14,USD,גורם תלוי/פנימי,קיימת תלות,2025-09-30,3.7,1.0,-728853.62,0.0277,3.306,-0.668,0.003254,-3e-06,,
1329,13211.0,"בנק דיסקונט לישראל בע""מ",520007030.0,ח.פ.,אופציה לס דולר שקל DISCOUNT C3.4 26/11/25 SELL,750000116.0,פנימי,"מט""ח",ישראל,"ארה""ב",שירותים פיננסיים,"מט""ח",2025-11-26,לא,2025-08-13,USD,גורם תלוי/פנימי,קיימת תלות,2025-09-30,3.4,1.0,-363207.92,0.4649,3.306,-5.583,0.027212,-2.7e-05,,
1329,13211.0,Goldman Sachs Group Inc,11778.0,פנימי,"אופציה לס GS C1,637.14 ESLT.TA 15/10/25 SELL",750000115.0,פנימי,מניה,ישראל,ישראל,Financial Services,מניות לרבות מדדי מניות,2025-10-15,לא,2025-08-12,ILS,גורם תלוי/פנימי,קיימת תלות,2025-09-30,1637.14,1.0,-108.72,7692.5,1.0,-8.363,0.040766,-4.1e-05,,
1329,13211.0,"בנק דיסקונט לישראל בע""מ",520007030.0,ח.פ.,אופציה לס דולר שקל DISCOUNT C3.75 26/11/25 BUY,750000049.0,פנימי,"מט""ח",ישראל,"ארה""ב",שירותים פיננסיים,"מט""ח",2025-11-26,לא,2025-05-28,USD,גורם תלוי/פנימי,קיימת תלות,2025-09-30,3.75,1.0,726415.85,0.0018,3.306,0.044,-0.000215,0.0,,
1329,13211.0,"בנק לאומי לישראל בע""מ",520018078.0,ח.פ.,אופציה לס דולר שקל LEUMI C3.39 05/12/25 SELL,750000124.0,פנימי,"מט""ח",ישראל,"ארה""ב",שירותים פיננסיים,"מט""ח",2025-12-05,לא,2025-09-02,USD,גורם תלוי/פנימי,קיימת תלות,2025-09-30,3.39,1.0,-364426.81,0.6353,3.306,-7.654,0.037306,-3.7e-05,,
1329,13211.0,"בנק לאומי לישראל בע""מ",520018078.0,ח.פ.,אופציה לס דולר שקל LEUMI C3.38 01/12/25 SELL,750000120.0,פנימי,"מט""ח",ישראל,"ארה""ב",שירותים פיננסיים,"מט""ח",2025-12-01,לא,2025-08-25,USD,גורם תלוי/פנימי,קיימת תלות,2025-09-30,3.38,1.0,-363207.92,0.636,3.306,-7.636,0.037222,-3.7e-05,,
1329,13211.0,"בנק דיסקונט לישראל בע""מ",520007030.0,ח.פ.,אופציה לס דולר שקל DISCOUNT C3.6 24/03/26 BUY,750000141.0,פנימי,"מט""ח",ישראל,"ארה""ב",שירותים פיננסיים,"מט""ח",2026-03-24,לא,2025-09-22,USD,גורם תלוי/פנימי,קיימת תלות,2025-09-30,3.6,1.0,728897.41,0.4815,3.306,11.602,-0.056551,5.7e-05,,
1329,13211.0,"בנק לאומי לישראל בע""מ",520018078.0,ח.פ.,אופציה לס דולר שקל Leumi P3.7 13/10/25 S,750000040.0,פנימי,"מט""ח",ישראל,"ארה""ב",שירותים פיננסיים,"מט""ח",2025-10-13,לא,2025-05-08,USD,גורם תלוי/פנימי,קיימת תלות,2025-09-30,3.7,1.0,-728824.43,11.893,3.306,-286.561,1.396785,-0.001422,,
1329,13211.0,"בנק דיסקונט לישראל בע""מ",520007030.0,ח.פ.,אופציה לס דולר שקל DISCOUNT P3.55 08/10/25,750000020.0,פנימי,"מט""ח",ישראל,"ארה""ב",שירותים פיננסיים,"מט""ח",2025-10-08,לא,2025-04-08,USD,גורם תלוי/פנימי,קיימת תלות,2025-09-30,3.55,1.0,-1457697.51,7.3698,3.306,-355.162,1.73117,-0.001762,,
1329,13211.0,"בנק לאומי לישראל בע""מ",520018078.0,ח.פ.,אופציה לס דולר שקל LEUMI P3.38 01/12/25 SELL,750000052.0,פנימי,"מט""ח",ישראל,"ארה""ב",שירותים פיננסיים,"מט""ח",2025-12-01,לא,2025-05-29,USD,גורם תלוי/פנימי,קיימת תלות,2025-09-30,3.38,1.0,-363207.92,2.8466,3.306,-34.181,0.166609,-0.000169,,
1329,13211.0,"בנק דיסקונט לישראל בע""מ",520007030.0,ח.פ.,אופציה לס דולר שקל DISCOUNT P3.4 26/11/25 SELL,750000048.0,פנימי,"מט""ח",ישראל,"ארה""ב",שירותים פיננסיים,"מט""ח",2025-11-26,לא,2025-05-28,USD,גורם תלוי/פנימי,קיימת תלות,2025-09-30,3.4,1.0,-363207.92,3.267,3.306,-39.229,0.191216,-0.000194,,
1329,13211.0,"בנק לאומי לישראל בע""מ",520018078.0,ח.פ.,אופציה לס דולר שקל LEUMI C3.59 06/01/26 BUY,750000125.0,פנימי,"מט""ח",ישראל,"ארה""ב",שירותים פיננסיים,"מט""ח",2026-01-05,לא,2025-09-02,USD,גורם תלוי/פנימי,קיימת תלות,2025-09-30,3.59,1.0,1093280.43,0.1726,3.306,6.237,-0.030401,3e-05,,
1329,13211.0,"בנק דיסקונט לישראל בע""מ",520007030.0,ח.פ.,אופציה לס דולר שקל DISCOUNT P3.21 12/03/26 SELL,750000133.0,פנימי,"מט""ח",ישראל,"ארה""ב",שירותים פיננסיים,"מט""ח",2026-03-12,לא,2025-09-12,USD,גורם תלוי/פנימי,קיימת תלות,2025-09-30,3.21,1.0,-364448.7,1.0491,3.306,-12.64,0.06161,-6.2e-05,,
1329,13211.0,"בנק הפועלים בע""מ",520000118.0,ח.פ.,אופציה לס דולר שקל POALIM P3.6 06/10/25,750000017.0,פנימי,"מט""ח",ישראל,"ארה""ב",שירותים פיננסיים,"מט""ח",2025-10-06,לא,2025-04-04,USD,גורם תלוי/פנימי,קיימת תלות,2025-09-30,3.6,1.0,728853.62,8.8859,3.306,214.113,-1.043654,0.001062,,
1329,13211.0,"בנק הפועלים בע""מ",520000118.0,ח.פ.,אופציה לס דולר שקל POALIM C3.7 05/12/25 SELL,750000096.0,פנימי,"מט""ח",ישראל,"ארה""ב",שירותים פיננסיים,"מט""ח",2025-12-05,לא,2025-07-10,USD,גורם תלוי/פנימי,קיימת תלות,2025-09-30,3.7,1.0,-728853.62,0.0268,3.306,-0.645,0.003144,-3e-06,,
1329,13211.0,"בנק הפועלים בע""מ",520000118.0,ח.פ.,אופציה לס דולר שקל POALIM P3.39 05/12/25 SELL,750000058.0,פנימי,"מט""ח",ישראל,"ארה""ב",שירותים פיננסיים,"מט""ח",2025-12-05,לא,2025-06-06,USD,גורם תלוי/פנימי,קיימת תלות,2025-09-30,3.39,1.0,-364426.81,3.1116,3.306,-37.489,0.182731,-0.000186,,
1329,13211.0,"בנק דיסקונט לישראל בע""מ",520007030.0,ח.פ.,אופציה לס דולר שקל DISCOUNT P3.25 24/03/26 SELL,750000142.0,פנימי,"מט""ח",ישראל,"ארה""ב",שירותים פיננסיים,"מט""ח",2026-03-24,לא,2025-09-22,USD,גורם תלוי/פנימי,קיימת תלות,2025-09-30,3.25,1.0,-364448.7,1.5316,3.306,-18.454,0.089951,-9.1e-05,,
1329,13211.0,"Citibank, NA",70652.0,פנימי,אופציה לס דולר שקל CITI C3.38 18/12/25 SELL,750000091.0,פנימי,"מט""ח","חו""ל","ארה""ב",Financial Services,"מט""ח",2025-12-18,לא,2025-07-03,USD,גורם תלוי/פנימי,קיימת תלות,2025-09-30,3.38,1.0,-315839.32,0.8985,3.306,-9.381,0.045727,-4.6e-05,,
1329,13211.0,"Citibank, NA",70652.0,פנימי,אופציה לס דולר שקל CITI P3.22 06/03/26 SELL,750000129.0,פנימי,"מט""ח","חו""ל","ארה""ב",Financial Services,"מט""ח",2026-03-06,לא,2025-09-09,USD,גורם תלוי/פנימי,קיימת תלות,2025-09-30,3.22,1.0,-364430.46,1.1426,3.306,-13.767,0.067103,-6.8e-05,,
1329,13211.0,"Citibank, NA",70652.0,פנימי,אופציה לס דולר שקל CITI C3.62 18/12/25 BUY,750000092.0,פנימי,"מט""ח","חו""ל","ארה""ב",Financial Services,"מט""ח",2025-12-18,לא,2025-07-03,USD,גורם תלוי/פנימי,קיימת תלות,2025-09-30,3.62,1.0,947517.98,0.0949,3.306,2.971,-0.014483,1.4e-05,,
1329,13211.0,"Citibank, NA",70652.0,פנימי,אופציה לס דולר שקל CITI C3.60 18/12/25 BUY,750000103.0,פנימי,"מט""ח","חו""ל","ארה""ב",Financial Services,"מט""ח",2025-12-18,לא,2025-07-16,USD,גורם תלוי/פנימי,קיימת תלות,2025-09-30,3.6,1.0,534496.38,0.1201,3.306,2.123,-0.010348,1e-05,,
1329,13211.0,Goldman Sachs Group Inc,11778.0,פנימי,אופציה לס אירו שקל GS P3.9 03/10/25 SELL,750000085.0,פנימי,"מט""ח","חו""ל",אירופה,Financial Services,"מט""ח",2025-10-03,לא,2025-07-07,EUR,גורם תלוי/פנימי,קיימת תלות,2025-09-30,3.9,1.0,-121474.79,0.6576,3.8807,-3.1,0.015109,-1.5e-05,,
1329,13211.0,Goldman Sachs Group Inc,11778.0,פנימי,אופציה לס אירו שקל GS P3.7 03/10/25 BUY,750000086.0,פנימי,"מט""ח","חו""ל",אירופה,Financial Services,"מט""ח",2025-10-03,לא,2025-07-01,EUR,גורם תלוי/פנימי,קיימת תלות,2025-09-30,3.7,1.0,607373.96,0.0001,3.8807,0.001,-2e-06,0.0,,
1329,13211.0,"Citibank, NA",70652.0,פנימי,אופציה לס דולר שקל CITI C3.575 06/03/26 BUY,750000128.0,פנימי,"מט""ח","חו""ל","ארה""ב",Financial Services,"מט""ח",2026-03-06,לא,2025-09-09,USD,גורם תלוי/פנימי,קיימת תלות,2025-09-30,3.575,1.0,728860.92,0.5176,3.306,12.472,-0.06079,6.1e-05,,
1329,13211.0,Goldman Sachs Group Inc,11778.0,פנימי,אופציה לס אירו שקל GS C4.2 03/10/25 BUY,750000122.0,פנימי,"מט""ח","חו""ל",אירופה,Financial Services,"מט""ח",2025-10-03,לא,2025-08-27,EUR,גורם תלוי/פנימי,קיימת תלות,2025-09-30,4.2,1.0,243290.19,0.0001,3.8807,0.001,-3e-06,0.0,,
1329,13211.0,"Citibank, NA",70652.0,פנימי,אופציה לס דולר שקל CITI C3.75 18/12/25 SELL,750000102.0,פנימי,"מט""ח","חו""ל","ארה""ב",Financial Services,"מט""ח",2025-12-18,לא,2025-07-16,USD,גורם תלוי/פנימי,קיימת תלות,2025-09-30,3.75,1.0,-534496.38,0.0287,3.306,-0.507,0.002472,-2e-06,,
1329,13211.0,Goldman Sachs Group Inc,11778.0,פנימי,אופציה לס אירו שקל GS P3.9 03/10/25 SELL,750000093.0,פנימי,"מט""ח","חו""ל",אירופה,Financial Services,"מט""ח",2025-10-03,לא,2025-07-01,EUR,גורם תלוי/פנימי,קיימת תלות,2025-09-30,3.9,1.0,-486580.38,0.6604,3.8807,-12.471,0.060787,-6.1e-05,,
1329,13211.0,"Citibank, NA",70652.0,פנימי,אופציה לס דולר שקל CITI C3.75 18/12/25 BUY,750000067.0,פנימי,"מט""ח","חו""ל","ארה""ב",Financial Services,"מט""ח",2025-12-18,לא,2025-06-17,USD,גורם תלוי/פנימי,קיימת תלות,2025-09-30,3.75,1.0,534496.38,0.0299,3.306,0.528,-0.002574,2e-06,,
1329,13211.0,"Citibank, NA",70652.0,פנימי,אופציה לס דולר שקל CITI P3.38 18/12/25 SELL,750000066.0,פנימי,"מט""ח","חו""ל","ארה""ב",Financial Services,"מט""ח",2025-12-18,לא,2025-06-17,USD,גורם תלוי/פנימי,קיימת תלות,2025-09-30,3.38,1.0,-315839.32,3.2367,3.306,-33.796,0.164732,-0.000167,,
1329,13212.0,"בנק לאומי לישראל בע""מ",520018078.0,ח.פ.,אופציה לס דולר שקל Leumi P3.6 13/10/25 L,750000041.0,פנימי,"מט""ח",ישראל,"ארה""ב",שירותים פיננסיים,"מט""ח",2025-10-13,לא,2025-05-08,USD,גורם תלוי/פנימי,קיימת תלות,2025-09-30,3.6,1.0,6186.3,8.8777,3.306,1.816,-1.042649,0.000549,,
1329,13212.0,"בנק דיסקונט לישראל בע""מ",520007030.0,ח.פ.,אופציה לס דולר שקל DISCOUNT C3.58 23/12/25 BUY,750000076.0,פנימי,"מט""ח",ישראל,"ארה""ב",שירותים פיננסיים,"מט""ח",2025-12-23,לא,2025-06-26,USD,גורם תלוי/פנימי,קיימת תלות,2025-09-30,3.58,1.0,3093.35,0.1439,3.306,0.015,-0.008448,4e-06,,
1329,13212.0,"בנק דיסקונט לישראל בע""מ",520007030.0,ח.פ.,אופציה לס דולר שקל DISCOUNT P3.55 08/10/25 BUY,750000046.0,פנימי,"מט""ח",ישראל,"ארה""ב",שירותים פיננסיים,"מט""ח",2025-10-08,לא,2025-05-21,USD,גורם תלוי/פנימי,קיימת תלות,2025-09-30,3.55,1.0,12373.02,7.3726,3.306,3.016,-1.731831,0.000912,,
1329,13212.0,"בנק הפועלים בע""מ",520000118.0,ח.פ.,אופציה לס דולר שקל POALIM C3.70 05/12/25 BUY,750000059.0,פנימי,"מט""ח",ישראל,"ארה""ב",שירותים פיננסיים,"מט""ח",2025-12-05,לא,2025-06-06,USD,גורם תלוי/פנימי,קיימת תלות,2025-09-30,3.7,1.0,6186.55,0.0091,3.306,0.002,-0.001065,0.0,,
1329,13212.0,"בנק לאומי לישראל בע""מ",520018078.0,ח.פ.,אופציה לס דולר שקל LEUMI C3.73 01/12/25 BUY,750000053.0,פנימי,"מט""ח",ישראל,"ארה""ב",שירותים פיננסיים,"מט""ח",2025-12-01,לא,2025-05-29,USD,גורם תלוי/פנימי,קיימת תלות,2025-09-30,3.73,1.0,6165.86,0.004,3.306,0.001,-0.00047,0.0,,
1329,13212.0,Goldman Sachs Group Inc,11778.0,פנימי,אופציה לס אירו שקל GS C4.2 03/10/25,750000010.0,פנימי,"מט""ח","חו""ל",אירופה,Financial Services,"מט""ח",2025-10-03,לא,2025-04-03,EUR,גורם תלוי/פנימי,קיימת תלות,2025-09-30,4.2,1.0,-2065.06,0.0001,3.8807,0.0,4e-06,0.0,,
1329,13212.0,"בנק הפועלים בע""מ",520000118.0,ח.פ.,אופציה לס דולר שקל POALIM P3.6 06/10/25 SELL,750000056.0,פנימי,"מט""ח",ישראל,"ארה""ב",שירותים פיננסיים,"מט""ח",2025-10-06,לא,2025-06-04,USD,גורם תלוי/פנימי,קיימת תלות,2025-09-30,3.6,1.0,-6186.55,8.8822,3.306,-1.817,1.043224,-0.000549,,
1329,13212.0,"בנק לאומי לישראל בע""מ",520018078.0,ח.פ.,אופציה לס דולר שקל LEUMI P3.6 13/10/25 S,750000027.0,פנימי,"מט""ח",ישראל,"ארה""ב",שירותים פיננסיים,"מט""ח",2025-10-13,לא,2025-04-09,USD,גורם תלוי/פנימי,קיימת תלות,2025-09-30,3.6,1.0,-6186.3,8.8731,3.306,-1.815,1.042109,-0.000548,,
1329,13212.0,"בנק הפועלים בע""מ",520000118.0,ח.פ.,אופציה לס דולר שקל POALIM P3.5 06/10/25 BUY,750000057.0,פנימי,"מט""ח",ישראל,"ארה""ב",שירותים פיננסיים,"מט""ח",2025-10-06,לא,2025-06-04,USD,גורם תלוי/פנימי,קיימת תלות,2025-09-30,3.5,1.0,6186.55,5.8625,3.306,1.199,-0.688558,0.000362,,
1329,13212.0,"בנק דיסקונט לישראל בע""מ",520007030.0,ח.פ.,אופציה לס דולר שקל DISCOUNT P3.65 08/10/25 SELL,750000045.0,פנימי,"מט""ח",ישראל,"ארה""ב",שירותים פיננסיים,"מט""ח",2025-10-08,לא,2025-05-21,USD,גורם תלוי/פנימי,קיימת תלות,2025-09-30,3.65,1.0,-12373.02,10.391,3.306,-4.251,2.440987,-0.001285,,
1329,13212.0,Goldman Sachs Group Inc,11778.0,פנימי,אופציה לס אירו שקל GS P3.7 03/10/25,750000012.0,פנימי,"מט""ח","חו""ל",אירופה,Financial Services,"מט""ח",2025-10-03,לא,2025-04-03,EUR,גורם תלוי/פנימי,קיימת תלות,2025-09-30,3.7,1.0,-5162.65,0.0001,3.8807,0.0,2e-06,0.0,,
1329,13212.0,Goldman Sachs Group Inc,11778.0,פנימי,אופציה לס אירו שקל GS P3.9 03/10/25,750000011.0,פנימי,"מט""ח","חו""ל",אירופה,Financial Services,"מט""ח",2025-10-03,לא,2025-04-03,EUR,גורם תלוי/פנימי,קיימת תלות,2025-09-30,3.9,1.0,5162.65,0.6786,3.8807,0.136,-0.078077,4.1e-05,,
1329,13212.0,"בנק דיסקונט לישראל בע""מ",520007030.0,ח.פ.,אופציה לס דולר שקל DISCOUNT P3.29 23/12/25 SELL,750000077.0,פנימי,"מט""ח",ישראל,"ארה""ב",שירותים פיננסיים,"מט""ח",2025-12-23,לא,2025-06-26,USD,גורם תלוי/פנימי,קיימת תלות,2025-09-30,3.29,1.0,-3093.35,1.4861,3.306,-0.152,0.087273,-4.5e-05,,
1329,13212.0,"בנק הפועלים בע""מ",520000118.0,ח.פ.,אופציה לס דולר שקל POALIM C3.6 05/12/25 BUY,750000099.0,פנימי,"מט""ח",ישראל,"ארה""ב",שירותים פיננסיים,"מט""ח",2025-12-05,לא,2025-05-14,USD,גורם תלוי/פנימי,קיימת תלות,2025-09-30,3.6,1.0,6186.55,0.0815,3.306,0.017,-0.00957,5e-06,,
1329,13212.0,"בנק לאומי לישראל בע""מ",520018078.0,ח.פ.,אופציה לס דולר שקל LEUMI C3.60 07/01/26 BUY,750000121.0,פנימי,"מט""ח",ישראל,"ארה""ב",שירותים פיננסיים,"מט""ח",2026-01-07,לא,2025-08-25,USD,גורם תלוי/פנימי,קיימת תלות,2025-09-30,3.6,1.0,9248.79,0.1624,3.306,0.05,-0.02852,1.5e-05,,
1329,13212.0,"בנק לאומי לישראל בע""מ",520018078.0,ח.פ.,אופציה לס דולר שקל LEUMI C3.6 01/12/25 BUY,750000098.0,פנימי,"מט""ח",ישראל,"ארה""ב",שירותים פיננסיים,"מט""ח",2025-12-01,לא,2025-07-10,USD,גורם תלוי/פנימי,קיימת תלות,2025-09-30,3.6,1.0,6165.86,0.0679,3.306,0.014,-0.007949,4e-06,,
1329,13212.0,"בנק דיסקונט לישראל בע""מ",520007030.0,ח.פ.,אופציה לס דולר שקל DISCOUNT C3.55 13/01/26 BUY,750000117.0,פנימי,"מט""ח",ישראל,"ארה""ב",שירותים פיננסיים,"מט""ח",2026-01-13,לא,2025-08-13,USD,גורם תלוי/פנימי,קיימת תלות,2025-09-30,3.55,1.0,6165.86,0.2679,3.306,0.055,-0.031364,1.6e-05,,
1329,13212.0,"בנק דיסקונט לישראל בע""מ",520007030.0,ח.פ.,אופציה לס דולר שקל DISCOUNT C3.575 12/03/26 BUY,750000132.0,פנימי,"מט""ח",ישראל,"ארה""ב",שירותים פיננסיים,"מט""ח",2026-03-12,לא,2025-09-12,USD,גורם תלוי/פנימי,קיימת תלות,2025-09-30,3.575,1.0,6186.92,0.5282,3.306,0.108,-0.062043,3.2e-05,,
1329,13212.0,"בנק הפועלים בע""מ",520000118.0,ח.פ.,אופציה לס דולר שקל POALIM P3.5 06/10/25,750000016.0,פנימי,"מט""ח",ישראל,"ארה""ב",שירותים פיננסיים,"מט""ח",2025-10-06,לא,2025-04-04,USD,גורם תלוי/פנימי,קיימת תלות,2025-09-30,3.5,1.0,-6186.55,5.8612,3.306,-1.199,0.688405,-0.000362,,
1329,13212.0,"בנק הפועלים בע""מ",520000118.0,ח.פ.,אופציה לס דולר שקל POALIM P3.25 26/03/26 SELL,750000146.0,פנימי,"מט""ח",ישראל,"ארה""ב",שירותים פיננסיים,"מט""ח",2026-03-26,לא,2025-09-26,USD,גורם תלוי/פנימי,קיימת תלות,2025-09-30,3.25,1.0,-3093.46,1.582,3.306,-0.162,0.092907,-4.8e-05,,
1329,13212.0,"בנק לאומי לישראל בע""מ",520018078.0,ח.פ.,אופציה לס דולר שקל LEUMI C3.73 01/12/25 SELL,750000097.0,פנימי,"מט""ח",ישראל,"ארה""ב",שירותים פיננסיים,"מט""ח",2025-12-01,לא,2025-07-10,USD,גורם תלוי/פנימי,קיימת תלות,2025-09-30,3.73,1.0,-6165.86,0.0145,3.306,-0.003,0.001696,0.0,,
1329,13212.0,"בנק הפועלים בע""מ",520000118.0,ח.פ.,אופציה לס דולר שקל POALIM C3.7 05/12/25 SELL 15/07,750000100.0,פנימי,"מט""ח",ישראל,"ארה""ב",שירותים פיננסיים,"מט""ח",2025-12-05,לא,2025-05-14,USD,גורם תלוי/פנימי,קיימת תלות,2025-09-30,3.7,1.0,-6186.55,0.0277,3.306,-0.006,0.003254,-1e-06,,
1329,13212.0,"בנק הפועלים בע""מ",520000118.0,ח.פ.,אופציה לס דולר שקל POALIM C3.5 05/12/25 BUY,750000095.0,פנימי,"מט""ח",ישראל,"ארה""ב",שירותים פיננסיים,"מט""ח",2025-12-05,לא,2025-07-10,USD,גורם תלוי/פנימי,קיימת תלות,2025-09-30,3.5,1.0,6186.55,0.2323,3.306,0.048,-0.02728,1.4e-05,,
1329,13212.0,"בנק דיסקונט לישראל בע""מ",520007030.0,ח.פ.,אופציה לס דולר שקל DISCOUNT C3.29 23/12/25 SELL,750000094.0,פנימי,"מט""ח",ישראל,"ארה""ב",שירותים פיננסיים,"מט""ח",2025-12-23,לא,2025-07-10,USD,גורם תלוי/פנימי,קיימת תלות,2025-09-30,3.29,1.0,-3093.35,2.0174,3.306,-0.206,0.118473,-6.2e-05,,
1329,13212.0,"בנק דיסקונט לישראל בע""מ",520007030.0,ח.פ.,אופציה לס דולר שקל DISCOUNT P3.65 08/10/25,750000019.0,פנימי,"מט""ח",ישראל,"ארה""ב",שירותים פיננסיים,"מט""ח",2025-10-08,לא,2025-04-08,USD,גורם תלוי/פנימי,קיימת תלות,2025-09-30,3.65,1.0,12373.02,10.394,3.306,4.252,-2.441655,0.001286,,
1329,13212.0,"בנק הפועלים בע""מ",520000118.0,ח.פ.,אופציה לס דולר שקל POALIM C3.59 26/03/26 BUY,750000145.0,פנימי,"מט""ח",ישראל,"ארה""ב",שירותים פיננסיים,"מט""ח",2026-03-26,לא,2025-09-26,USD,גורם תלוי/פנימי,קיימת תלות,2025-09-30,3.59,1.0,6186.92,0.5462,3.306,0.112,-0.064154,3.3e-05,,
1329,13212.0,"בנק לאומי לישראל בע""מ",520018078.0,ח.פ.,אופציה לס דולר שקל LEUMI P3.7 13/10/25 L,750000029.0,פנימי,"מט""ח",ישראל,"ארה""ב",שירותים פיננסיים,"מט""ח",2025-10-13,לא,2025-04-09,USD,גורם תלוי/פנימי,קיימת תלות,2025-09-30,3.7,1.0,6186.3,11.897,3.306,2.433,-1.397332,0.000736,,
1329,13212.0,"בנק דיסקונט לישראל בע""מ",520007030.0,ח.פ.,אופציה לס דולר שקל DISCOUNT C3.4 26/11/25 SELL,750000116.0,פנימי,"מט""ח",ישראל,"ארה""ב",שירותים פיננסיים,"מט""ח",2025-11-26,לא,2025-08-13,USD,גורם תלוי/פנימי,קיימת תלות,2025-09-30,3.4,1.0,-3082.93,0.4649,3.306,-0.047,0.027212,-1.4e-05,,
1329,13212.0,"בנק דיסקונט לישראל בע""מ",520007030.0,ח.פ.,אופציה לס דולר שקל DISCOUNT C3.75 26/11/25 BUY,750000049.0,פנימי,"מט""ח",ישראל,"ארה""ב",שירותים פיננסיים,"מט""ח",2025-11-26,לא,2025-05-28,USD,גורם תלוי/פנימי,קיימת תלות,2025-09-30,3.75,1.0,6165.86,0.0018,3.306,0.0,-0.000215,0.0,,
1329,13212.0,Goldman Sachs Group Inc,11778.0,פנימי,"אופציה לס GS C1,637.14 ESLT.TA 15/10/25 SELL",750000115.0,פנימי,מניה,ישראל,ישראל,Financial Services,מניות לרבות מדדי מניות,2025-10-15,לא,2025-08-12,ILS,גורם תלוי/פנימי,קיימת תלות,2025-09-30,1637.14,1.0,-0.92,7692.5,1.0,-0.071,0.040766,-2.1e-05,,
1329,13212.0,"בנק דיסקונט לישראל בע""מ",520007030.0,ח.פ.,אופציה לס דולר שקל DISCOUNT C3.6 24/03/26 BUY,750000141.0,פנימי,"מט""ח",ישראל,"ארה""ב",שירותים פיננסיים,"מט""ח",2026-03-24,לא,2025-09-22,USD,גורם תלוי/פנימי,קיימת תלות,2025-09-30,3.6,1.0,6186.92,0.4815,3.306,0.098,-0.056551,2.9e-05,,
1329,13212.0,"בנק לאומי לישראל בע""מ",520018078.0,ח.פ.,אופציה לס דולר שקל LEUMI C3.39 05/12/25 SELL,750000124.0,פנימי,"מט""ח",ישראל,"ארה""ב",שירותים פיננסיים,"מט""ח",2025-12-05,לא,2025-09-02,USD,גורם תלוי/פנימי,קיימת תלות,2025-09-30,3.39,1.0,-3093.27,0.6353,3.306,-0.065,0.037306,-1.9e-05,,
1329,13212.0,"בנק לאומי לישראל בע""מ",520018078.0,ח.פ.,אופציה לס דולר שקל LEUMI C3.38 01/12/25 SELL,750000120.0,פנימי,"מט""ח",ישראל,"ארה""ב",שירותים פיננסיים,"מט""ח",2025-12-01,לא,2025-08-25,USD,גורם תלוי/פנימי,קיימת תלות,2025-09-30,3.38,1.0,-3082.93,0.636,3.306,-0.065,0.037222,-1.9e-05,,
1329,13212.0,"בנק דיסקונט לישראל בע""מ",520007030.0,ח.פ.,אופציה לס דולר שקל DISCOUNT P3.4 26/11/25 SELL,750000048.0,פנימי,"מט""ח",ישראל,"ארה""ב",שירותים פיננסיים,"מט""ח",2025-11-26,לא,2025-05-28,USD,גורם תלוי/פנימי,קיימת תלות,2025-09-30,3.4,1.0,-3082.93,3.267,3.306,-0.333,0.191216,-0.0001,,
1329,13212.0,"בנק לאומי לישראל בע""מ",520018078.0,ח.פ.,אופציה לס דולר שקל LEUMI P3.38 01/12/25 SELL,750000052.0,פנימי,"מט""ח",ישראל,"ארה""ב",שירותים פיננסיים,"מט""ח",2025-12-01,לא,2025-05-29,USD,גורם תלוי/פנימי,קיימת תלות,2025-09-30,3.38,1.0,-3082.93,2.8466,3.306,-0.29,0.166609,-8.7e-05,,
1329,13212.0,"בנק דיסקונט לישראל בע""מ",520007030.0,ח.פ.,אופציה לס דולר שקל DISCOUNT P3.55 08/10/25,750000020.0,פנימי,"מט""ח",ישראל,"ארה""ב",שירותים פיננסיים,"מט""ח",2025-10-08,לא,2025-04-08,USD,גורם תלוי/פנימי,קיימת תלות,2025-09-30,3.55,1.0,-12373.02,7.3698,3.306,-3.015,1.73117,-0.000911,,
1329,13212.0,"בנק לאומי לישראל בע""מ",520018078.0,ח.פ.,אופציה לס דולר שקל Leumi P3.7 13/10/25 S,750000040.0,פנימי,"מט""ח",ישראל,"ארה""ב",שירותים פיננסיים,"מט""ח",2025-10-13,לא,2025-05-08,USD,גורם תלוי/פנימי,קיימת תלות,2025-09-30,3.7,1.0,-6186.3,11.893,3.306,-2.432,1.396785,-0.000735,,
1329,13212.0,"בנק לאומי לישראל בע""מ",520018078.0,ח.פ.,אופציה לס דולר שקל LEUMI C3.59 06/01/26 BUY,750000125.0,פנימי,"מט""ח",ישראל,"ארה""ב",שירותים פיננסיים,"מט""ח",2026-01-05,לא,2025-09-02,USD,גורם תלוי/פנימי,קיימת תלות,2025-09-30,3.59,1.0,9279.82,0.1726,3.306,0.053,-0.030401,1.6e-05,,
1329,13212.0,"בנק הפועלים בע""מ",520000118.0,ח.פ.,אופציה לס דולר שקל POALIM P3.6 06/10/25,750000017.0,פנימי,"מט""ח",ישראל,"ארה""ב",שירותים פיננסיים,"מט""ח",2025-10-06,לא,2025-04-04,USD,גורם תלוי/פנימי,קיימת תלות,2025-09-30,3.6,1.0,6186.55,8.8859,3.306,1.817,-1.043654,0.000549,,
1329,13212.0,"בנק דיסקונט לישראל בע""מ",520007030.0,ח.פ.,אופציה לס דולר שקל DISCOUNT P3.21 12/03/26 SELL,750000133.0,פנימי,"מט""ח",ישראל,"ארה""ב",שירותים פיננסיים,"מט""ח",2026-03-12,לא,2025-09-12,USD,גורם תלוי/פנימי,קיימת תלות,2025-09-30,3.21,1.0,-3093.46,1.0491,3.306,-0.107,0.06161,-3.2e-05,,
1329,13212.0,"בנק הפועלים בע""מ",520000118.0,ח.פ.,אופציה לס דולר שקל POALIM C3.7 05/12/25 SELL,750000096.0,פנימי,"מט""ח",ישראל,"ארה""ב",שירותים פיננסיים,"מט""ח",2025-12-05,לא,2025-07-10,USD,גורם תלוי/פנימי,קיימת תלות,2025-09-30,3.7,1.0,-6186.55,0.0268,3.306,-0.005,0.003144,-1e-06,,
1329,13212.0,"בנק דיסקונט לישראל בע""מ",520007030.0,ח.פ.,אופציה לס דולר שקל DISCOUNT P3.25 24/03/26 SELL,750000142.0,פנימי,"מט""ח",ישראל,"ארה""ב",שירותים פיננסיים,"מט""ח",2026-03-24,לא,2025-09-22,USD,גורם תלוי/פנימי,קיימת תלות,2025-09-30,3.25,1.0,-3093.46,1.5316,3.306,-0.157,0.089951,-4.7e-05,,
1329,13212.0,"בנק הפועלים בע""מ",520000118.0,ח.פ.,אופציה לס דולר שקל POALIM P3.39 05/12/25 SELL,750000058.0,פנימי,"מט""ח",ישראל,"ארה""ב",שירותים פיננסיים,"מט""ח",2025-12-05,לא,2025-06-06,USD,גורם תלוי/פנימי,קיימת תלות,2025-09-30,3.39,1.0,-3093.27,3.1116,3.306,-0.318,0.182731,-9.6e-05,,
1329,13212.0,"Citibank, NA",70652.0,פנימי,אופציה לס דולר שקל CITI C3.38 18/12/25 SELL,750000091.0,פנימי,"מט""ח","חו""ל","ארה""ב",Financial Services,"מט""ח",2025-12-18,לא,2025-07-03,USD,גורם תלוי/פנימי,קיימת תלות,2025-09-30,3.38,1.0,-2680.86,0.8985,3.306,-0.08,0.045727,-2.4e-05,,
1329,13212.0,"Citibank, NA",70652.0,פנימי,אופציה לס דולר שקל CITI P3.22 06/03/26 SELL,750000129.0,פנימי,"מט""ח","חו""ל","ארה""ב",Financial Services,"מט""ח",2026-03-06,לא,2025-09-09,USD,גורם תלוי/פנימי,קיימת תלות,2025-09-30,3.22,1.0,-3093.3,1.1426,3.306,-0.117,0.067103,-3.5e-05,,
1329,13212.0,Goldman Sachs Group Inc,11778.0,פנימי,אופציה לס אירו שקל GS P3.9 03/10/25 SELL,750000085.0,פנימי,"מט""ח","חו""ל",אירופה,Financial Services,"מט""ח",2025-10-03,לא,2025-07-07,EUR,גורם תלוי/פנימי,קיימת תלות,2025-09-30,3.9,1.0,-1031.08,0.6576,3.8807,-0.026,0.015109,-7e-06,,
1329,13212.0,Goldman Sachs Group Inc,11778.0,פנימי,אופציה לס אירו שקל GS P3.7 03/10/25 BUY,750000086.0,פנימי,"מט""ח","חו""ל",אירופה,Financial Services,"מט""ח",2025-10-03,לא,2025-07-01,EUR,גורם תלוי/פנימי,קיימת תלות,2025-09-30,3.7,1.0,5155.42,0.0001,3.8807,0.0,-2e-06,0.0,,
1329,13212.0,"Citibank, NA",70652.0,פנימי,אופציה לס דולר שקל CITI C3.60 18/12/25 BUY,750000103.0,פנימי,"מט""ח","חו""ל","ארה""ב",Financial Services,"מט""ח",2025-12-18,לא,2025-07-16,USD,גורם תלוי/פנימי,קיימת תלות,2025-09-30,3.6,1.0,4536.83,0.1201,3.306,0.018,-0.010348,5e-06,,
1329,13212.0,"Citibank, NA",70652.0,פנימי,אופציה לס דולר שקל CITI C3.62 18/12/25 BUY,750000092.0,פנימי,"מט""ח","חו""ל","ארה""ב",Financial Services,"מט""ח",2025-12-18,לא,2025-07-03,USD,גורם תלוי/פנימי,קיימת תלות,2025-09-30,3.62,1.0,8042.58,0.0949,3.306,0.025,-0.014483,7e-06,,
1329,13212.0,"Citibank, NA",70652.0,פנימי,אופציה לס דולר שקל CITI C3.575 06/03/26 BUY,750000128.0,פנימי,"מט""ח","חו""ל","ארה""ב",Financial Services,"מט""ח",2026-03-06,לא,2025-09-09,USD,גורם תלוי/פנימי,קיימת תלות,2025-09-30,3.575,1.0,6186.61,0.5176,3.306,0.106,-0.06079,3.2e-05,,
1329,13212.0,Goldman Sachs Group Inc,11778.0,פנימי,אופציה לס אירו שקל GS C4.2 03/10/25 BUY,750000122.0,פנימי,"מט""ח","חו""ל",אירופה,Financial Services,"מט""ח",2025-10-03,לא,2025-08-27,EUR,גורם תלוי/פנימי,קיימת תלות,2025-09-30,4.2,1.0,2065.06,0.0001,3.8807,0.0,-3e-06,0.0,,
1329,13212.0,"Citibank, NA",70652.0,פנימי,אופציה לס דולר שקל CITI C3.75 18/12/25 SELL,750000102.0,פנימי,"מט""ח","חו""ל","ארה""ב",Financial Services,"מט""ח",2025-12-18,לא,2025-07-16,USD,גורם תלוי/פנימי,קיימת תלות,2025-09-30,3.75,1.0,-4536.83,0.0287,3.306,-0.004,0.002472,-1e-06,,
1329,13212.0,Goldman Sachs Group Inc,11778.0,פנימי,אופציה לס אירו שקל GS P3.9 03/10/25 SELL,750000093.0,פנימי,"מט""ח","חו""ל",אירופה,Financial Services,"מט""ח",2025-10-03,לא,2025-07-01,EUR,גורם תלוי/פנימי,קיימת תלות,2025-09-30,3.9,1.0,-4130.12,0.6604,3.8807,-0.106,0.060787,-3.2e-05,,
1329,13212.0,"Citibank, NA",70652.0,פנימי,אופציה לס דולר שקל CITI C3.75 18/12/25 BUY,750000067.0,פנימי,"מט""ח","חו""ל","ארה""ב",Financial Services,"מט""ח",2025-12-18,לא,2025-06-17,USD,גורם תלוי/פנימי,קיימת תלות,2025-09-30,3.75,1.0,4536.83,0.0299,3.306,0.004,-0.002574,1e-06,,
1329,13212.0,"Citibank, NA",70652.0,פנימי,אופציה לס דולר שקל CITI P3.38 18/12/25 SELL,750000066.0,פנימי,"מט""ח","חו""ל","ארה""ב",Financial Services,"מט""ח",2025-12-18,לא,2025-06-17,USD,גורם תלוי/פנימי,קיימת תלות,2025-09-30,3.38,1.0,-2680.86,3.2367,3.306,-0.287,0.164732,-8.6e-05,,
1329,14304.0,"בנק דיסקונט לישראל בע""מ",520007030.0,ח.פ.,אופציה לס דולר שקל DISCOUNT C3.58 23/12/25 BUY,750000076.0,פנימי,"מט""ח",ישראל,"ארה""ב",שירותים פיננסיים,"מט""ח",2025-12-23,לא,2025-06-26,USD,גורם תלוי/פנימי,קיימת תלות,2025-09-30,3.58,1.0,416.91,0.1439,3.306,0.002,-0.008448,4e-06,,
1329,14304.0,"בנק לאומי לישראל בע""מ",520018078.0,ח.פ.,אופציה לס דולר שקל Leumi P3.6 13/10/25 L,750000041.0,פנימי,"מט""ח",ישראל,"ארה""ב",שירותים פיננסיים,"מט""ח",2025-10-13,לא,2025-05-08,USD,גורם תלוי/פנימי,קיימת תלות,2025-09-30,3.6,1.0,833.77,8.8777,3.306,0.245,-1.042649,0.000537,,
1329,14304.0,"בנק דיסקונט לישראל בע""מ",520007030.0,ח.פ.,אופציה לס דולר שקל DISCOUNT P3.29 23/12/25 SELL,750000077.0,פנימי,"מט""ח",ישראל,"ארה""ב",שירותים פיננסיים,"מט""ח",2025-12-23,לא,2025-06-26,USD,גורם תלוי/פנימי,קיימת תלות,2025-09-30,3.29,1.0,-416.91,1.4861,3.306,-0.02,0.087273,-4.4e-05,,
1329,14304.0,"בנק לאומי לישראל בע""מ",520018078.0,ח.פ.,אופציה לס דולר שקל LEUMI C3.73 01/12/25 BUY,750000053.0,פנימי,"מט""ח",ישראל,"ארה""ב",שירותים פיננסיים,"מט""ח",2025-12-01,לא,2025-05-29,USD,גורם תלוי/פנימי,קיימת תלות,2025-09-30,3.73,1.0,831.01,0.004,3.306,0.0,-0.00047,0.0,,
1329,14304.0,"בנק הפועלים בע""מ",520000118.0,ח.פ.,אופציה לס דולר שקל POALIM C3.70 05/12/25 BUY,750000059.0,פנימי,"מט""ח",ישראל,"ארה""ב",שירותים פיננסיים,"מט""ח",2025-12-05,לא,2025-06-06,USD,גורם תלוי/פנימי,קיימת תלות,2025-09-30,3.7,1.0,833.8,0.0091,3.306,0.0,-0.001065,0.0,,
1329,14304.0,"בנק דיסקונט לישראל בע""מ",520007030.0,ח.פ.,אופציה לס דולר שקל DISCOUNT P3.55 08/10/25 BUY,750000046.0,פנימי,"מט""ח",ישראל,"ארה""ב",שירותים פיננסיים,"מט""ח",2025-10-08,לא,2025-05-21,USD,גורם תלוי/פנימי,קיימת תלות,2025-09-30,3.55,1.0,1667.59,7.3726,3.306,0.406,-1.731831,0.000892,,
1329,14304.0,"בנק הפועלים בע""מ",520000118.0,ח.פ.,אופציה לס דולר שקל POALIM P3.5 06/10/25 BUY,750000057.0,פנימי,"מט""ח",ישראל,"ארה""ב",שירותים פיננסיים,"מט""ח",2025-10-06,לא,2025-06-04,USD,גורם תלוי/פנימי,קיימת תלות,2025-09-30,3.5,1.0,833.8,5.8625,3.306,0.162,-0.688558,0.000354,,
1329,14304.0,Goldman Sachs Group Inc,11778.0,פנימי,אופציה לס אירו שקל GS C4.2 03/10/25,750000010.0,פנימי,"מט""ח","חו""ל",אירופה,Financial Services,"מט""ח",2025-10-03,לא,2025-04-03,EUR,גורם תלוי/פנימי,קיימת תלות,2025-09-30,4.2,1.0,-278.32,0.0001,3.8807,0.0,4e-06,0.0,,
1329,14304.0,"בנק לאומי לישראל בע""מ",520018078.0,ח.פ.,אופציה לס דולר שקל LEUMI P3.6 13/10/25 S,750000027.0,פנימי,"מט""ח",ישראל,"ארה""ב",שירותים פיננסיים,"מט""ח",2025-10-13,לא,2025-04-09,USD,גורם תלוי/פנימי,קיימת תלות,2025-09-30,3.6,1.0,-833.77,8.8731,3.306,-0.245,1.042109,-0.000537,,
1329,14304.0,"בנק הפועלים בע""מ",520000118.0,ח.פ.,אופציה לס דולר שקל POALIM P3.6 06/10/25 SELL,750000056.0,פנימי,"מט""ח",ישראל,"ארה""ב",שירותים פיננסיים,"מט""ח",2025-10-06,לא,2025-06-04,USD,גורם תלוי/פנימי,קיימת תלות,2025-09-30,3.6,1.0,-833.8,8.8822,3.306,-0.245,1.043224,-0.000537,,
1329,14304.0,Goldman Sachs Group Inc,11778.0,פנימי,אופציה לס אירו שקל GS P3.9 03/10/25,750000011.0,פנימי,"מט""ח","חו""ל",אירופה,Financial Services,"מט""ח",2025-10-03,לא,2025-04-03,EUR,גורם תלוי/פנימי,קיימת תלות,2025-09-30,3.9,1.0,695.8,0.6786,3.8807,0.018,-0.078077,4e-05,,
1329,14304.0,"בנק דיסקונט לישראל בע""מ",520007030.0,ח.פ.,אופציה לס דולר שקל DISCOUNT P3.65 08/10/25 SELL,750000045.0,פנימי,"מט""ח",ישראל,"ארה""ב",שירותים פיננסיים,"מט""ח",2025-10-08,לא,2025-05-21,USD,גורם תלוי/פנימי,קיימת תלות,2025-09-30,3.65,1.0,-1667.59,10.391,3.306,-0.573,2.440987,-0.001258,,
1329,14304.0,Goldman Sachs Group Inc,11778.0,פנימי,אופציה לס אירו שקל GS P3.7 03/10/25,750000012.0,פנימי,"מט""ח","חו""ל",אירופה,Financial Services,"מט""ח",2025-10-03,לא,2025-04-03,EUR,גורם תלוי/פנימי,קיימת תלות,2025-09-30,3.7,1.0,-695.8,0.0001,3.8807,0.0,2e-06,0.0,,
1329,14304.0,"בנק הפועלים בע""מ",520000118.0,ח.פ.,אופציה לס דולר שקל POALIM C3.6 05/12/25 BUY,750000099.0,פנימי,"מט""ח",ישראל,"ארה""ב",שירותים פיננסיים,"מט""ח",2025-12-05,לא,2025-05-14,USD,גורם תלוי/פנימי,קיימת תלות,2025-09-30,3.6,1.0,833.8,0.0815,3.306,0.002,-0.00957,4e-06,,
1329,14304.0,"בנק לאומי לישראל בע""מ",520018078.0,ח.פ.,אופציה לס דולר שקל LEUMI C3.6 01/12/25 BUY,750000098.0,פנימי,"מט""ח",ישראל,"ארה""ב",שירותים פיננסיים,"מט""ח",2025-12-01,לא,2025-07-10,USD,גורם תלוי/פנימי,קיימת תלות,2025-09-30,3.6,1.0,831.01,0.0679,3.306,0.002,-0.007949,4e-06,,
1329,14304.0,"בנק דיסקונט לישראל בע""מ",520007030.0,ח.פ.,אופציה לס דולר שקל DISCOUNT C3.55 13/01/26 BUY,750000117.0,פנימי,"מט""ח",ישראל,"ארה""ב",שירותים פיננסיים,"מט""ח",2026-01-13,לא,2025-08-13,USD,גורם תלוי/פנימי,קיימת תלות,2025-09-30,3.55,1.0,831.01,0.2679,3.306,0.007,-0.031364,1.6e-05,,
1329,14304.0,"בנק לאומי לישראל בע""מ",520018078.0,ח.פ.,אופציה לס דולר שקל LEUMI C3.60 07/01/26 BUY,750000121.0,פנימי,"מט""ח",ישראל,"ארה""ב",שירותים פיננסיים,"מט""ח",2026-01-07,לא,2025-08-25,USD,גורם תלוי/פנימי,קיימת תלות,2025-09-30,3.6,1.0,1246.52,0.1624,3.306,0.007,-0.02852,1.4e-05,,
1329,14304.0,"בנק דיסקונט לישראל בע""מ",520007030.0,ח.פ.,אופציה לס דולר שקל DISCOUNT C3.575 12/03/26 BUY,750000132.0,פנימי,"מט""ח",ישראל,"ארה""ב",שירותים פיננסיים,"מט""ח",2026-03-12,לא,2025-09-12,USD,גורם תלוי/פנימי,קיימת תלות,2025-09-30,3.575,1.0,833.85,0.5282,3.306,0.015,-0.062043,3.1e-05,,
1329,14304.0,"בנק הפועלים בע""מ",520000118.0,ח.פ.,אופציה לס דולר שקל POALIM P3.5 06/10/25,750000016.0,פנימי,"מט""ח",ישראל,"ארה""ב",שירותים פיננסיים,"מט""ח",2025-10-06,לא,2025-04-04,USD,גורם תלוי/פנימי,קיימת תלות,2025-09-30,3.5,1.0,-833.8,5.8612,3.306,-0.162,0.688405,-0.000354,,
1329,14304.0,"בנק הפועלים בע""מ",520000118.0,ח.פ.,אופציה לס דולר שקל POALIM C3.59 26/03/26 BUY,750000145.0,פנימי,"מט""ח",ישראל,"ארה""ב",שירותים פיננסיים,"מט""ח",2026-03-26,לא,2025-09-26,USD,גורם תלוי/פנימי,קיימת תלות,2025-09-30,3.59,1.0,833.85,0.5462,3.306,0.015,-0.064154,3.3e-05,,
1329,14304.0,"בנק דיסקונט לישראל בע""מ",520007030.0,ח.פ.,אופציה לס דולר שקל DISCOUNT C3.29 23/12/25 SELL,750000094.0,פנימי,"מט""ח",ישראל,"ארה""ב",שירותים פיננסיים,"מט""ח",2025-12-23,לא,2025-07-10,USD,גורם תלוי/פנימי,קיימת תלות,2025-09-30,3.29,1.0,-416.91,2.0174,3.306,-0.028,0.118473,-6.1e-05,,
1329,14304.0,"בנק דיסקונט לישראל בע""מ",520007030.0,ח.פ.,אופציה לס דולר שקל DISCOUNT P3.65 08/10/25,750000019.0,פנימי,"מט""ח",ישראל,"ארה""ב",שירותים פיננסיים,"מט""ח",2025-10-08,לא,2025-04-08,USD,גורם תלוי/פנימי,קיימת תלות,2025-09-30,3.65,1.0,1667.59,10.394,3.306,0.573,-2.441655,0.001258,,
1329,14304.0,"בנק הפועלים בע""מ",520000118.0,ח.פ.,אופציה לס דולר שקל POALIM C3.5 05/12/25 BUY,750000095.0,פנימי,"מט""ח",ישראל,"ארה""ב",שירותים פיננסיים,"מט""ח",2025-12-05,לא,2025-07-10,USD,גורם תלוי/פנימי,קיימת תלות,2025-09-30,3.5,1.0,833.8,0.2323,3.306,0.006,-0.02728,1.4e-05,,
1329,14304.0,"בנק לאומי לישראל בע""מ",520018078.0,ח.פ.,אופציה לס דולר שקל LEUMI C3.73 01/12/25 SELL,750000097.0,פנימי,"מט""ח",ישראל,"ארה""ב",שירותים פיננסיים,"מט""ח",2025-12-01,לא,2025-07-10,USD,גורם תלוי/פנימי,קיימת תלות,2025-09-30,3.73,1.0,-831.01,0.0145,3.306,0.0,0.001696,0.0,,
1329,14304.0,"בנק הפועלים בע""מ",520000118.0,ח.פ.,אופציה לס דולר שקל POALIM C3.7 05/12/25 SELL 15/07,750000100.0,פנימי,"מט""ח",ישראל,"ארה""ב",שירותים פיננסיים,"מט""ח",2025-12-05,לא,2025-05-14,USD,גורם תלוי/פנימי,קיימת תלות,2025-09-30,3.7,1.0,-833.8,0.0277,3.306,-0.001,0.003254,-1e-06,,
1329,14304.0,"בנק הפועלים בע""מ",520000118.0,ח.פ.,אופציה לס דולר שקל POALIM P3.25 26/03/26 SELL,750000146.0,פנימי,"מט""ח",ישראל,"ארה""ב",שירותים פיננסיים,"מט""ח",2026-03-26,לא,2025-09-26,USD,גורם תלוי/פנימי,קיימת תלות,2025-09-30,3.25,1.0,-416.92,1.582,3.306,-0.022,0.092907,-4.7e-05,,
1329,14304.0,"בנק דיסקונט לישראל בע""מ",520007030.0,ח.פ.,אופציה לס דולר שקל DISCOUNT C3.75 26/11/25 BUY,750000049.0,פנימי,"מט""ח",ישראל,"ארה""ב",שירותים פיננסיים,"מט""ח",2025-11-26,לא,2025-05-28,USD,גורם תלוי/פנימי,קיימת תלות,2025-09-30,3.75,1.0,831.01,0.0018,3.306,0.0,-0.000215,0.0,,
1329,14304.0,Goldman Sachs Group Inc,11778.0,פנימי,"אופציה לס GS C1,637.14 ESLT.TA 15/10/25 SELL",750000115.0,פנימי,מניה,ישראל,ישראל,Financial Services,מניות לרבות מדדי מניות,2025-10-15,לא,2025-08-12,ILS,גורם תלוי/פנימי,קיימת תלות,2025-09-30,1637.14,1.0,-0.12,7692.5,1.0,-0.01,0.040766,-2.1e-05,,
1329,14304.0,"בנק לאומי לישראל בע""מ",520018078.0,ח.פ.,אופציה לס דולר שקל LEUMI P3.7 13/10/25 L,750000029.0,פנימי,"מט""ח",ישראל,"ארה""ב",שירותים פיננסיים,"מט""ח",2025-10-13,לא,2025-04-09,USD,גורם תלוי/פנימי,קיימת תלות,2025-09-30,3.7,1.0,833.77,11.897,3.306,0.328,-1.397332,0.00072,,
1329,14304.0,"בנק דיסקונט לישראל בע""מ",520007030.0,ח.פ.,אופציה לס דולר שקל DISCOUNT C3.4 26/11/25 SELL,750000116.0,פנימי,"מט""ח",ישראל,"ארה""ב",שירותים פיננסיים,"מט""ח",2025-11-26,לא,2025-08-13,USD,גורם תלוי/פנימי,קיימת תלות,2025-09-30,3.4,1.0,-415.5,0.4649,3.306,-0.006,0.027212,-1.4e-05,,
1329,14304.0,"בנק לאומי לישראל בע""מ",520018078.0,ח.פ.,אופציה לס דולר שקל LEUMI C3.39 05/12/25 SELL,750000124.0,פנימי,"מט""ח",ישראל,"ארה""ב",שירותים פיננסיים,"מט""ח",2025-12-05,לא,2025-09-02,USD,גורם תלוי/פנימי,קיימת תלות,2025-09-30,3.39,1.0,-416.9,0.6353,3.306,-0.009,0.037306,-1.9e-05,,
1329,14304.0,"בנק לאומי לישראל בע""מ",520018078.0,ח.פ.,אופציה לס דולר שקל LEUMI C3.38 01/12/25 SELL,750000120.0,פנימי,"מט""ח",ישראל,"ארה""ב",שירותים פיננסיים,"מט""ח",2025-12-01,לא,2025-08-25,USD,גורם תלוי/פנימי,קיימת תלות,2025-09-30,3.38,1.0,-415.5,0.636,3.306,-0.009,0.037222,-1.9e-05,,
1329,14304.0,"בנק דיסקונט לישראל בע""מ",520007030.0,ח.פ.,אופציה לס דולר שקל DISCOUNT C3.6 24/03/26 BUY,750000141.0,פנימי,"מט""ח",ישראל,"ארה""ב",שירותים פיננסיים,"מט""ח",2026-03-24,לא,2025-09-22,USD,גורם תלוי/פנימי,קיימת תלות,2025-09-30,3.6,1.0,833.85,0.4815,3.306,0.013,-0.056551,2.9e-05,,
1329,14304.0,"בנק דיסקונט לישראל בע""מ",520007030.0,ח.פ.,אופציה לס דולר שקל DISCOUNT P3.55 08/10/25,750000020.0,פנימי,"מט""ח",ישראל,"ארה""ב",שירותים פיננסיים,"מט""ח",2025-10-08,לא,2025-04-08,USD,גורם תלוי/פנימי,קיימת תלות,2025-09-30,3.55,1.0,-1667.59,7.3698,3.306,-0.406,1.73117,-0.000892,,
1329,14304.0,"בנק לאומי לישראל בע""מ",520018078.0,ח.פ.,אופציה לס דולר שקל Leumi P3.7 13/10/25 S,750000040.0,פנימי,"מט""ח",ישראל,"ארה""ב",שירותים פיננסיים,"מט""ח",2025-10-13,לא,2025-05-08,USD,גורם תלוי/פנימי,קיימת תלות,2025-09-30,3.7,1.0,-833.77,11.893,3.306,-0.328,1.396785,-0.000719,,
1329,14304.0,"בנק דיסקונט לישראל בע""מ",520007030.0,ח.פ.,אופציה לס דולר שקל DISCOUNT P3.4 26/11/25 SELL,750000048.0,פנימי,"מט""ח",ישראל,"ארה""ב",שירותים פיננסיים,"מט""ח",2025-11-26,לא,2025-05-28,USD,גורם תלוי/פנימי,קיימת תלות,2025-09-30,3.4,1.0,-415.5,3.267,3.306,-0.045,0.191216,-9.8e-05,,
1329,14304.0,"בנק לאומי לישראל בע""מ",520018078.0,ח.פ.,אופציה לס דולר שקל LEUMI P3.38 01/12/25 SELL,750000052.0,פנימי,"מט""ח",ישראל,"ארה""ב",שירותים פיננסיים,"מט""ח",2025-12-01,לא,2025-05-29,USD,גורם תלוי/פנימי,קיימת תלות,2025-09-30,3.38,1.0,-415.5,2.8466,3.306,-0.039,0.166609,-8.5e-05,,
1329,14304.0,"בנק לאומי לישראל בע""מ",520018078.0,ח.פ.,אופציה לס דולר שקל LEUMI C3.59 06/01/26 BUY,750000125.0,פנימי,"מט""ח",ישראל,"ארה""ב",שירותים פיננסיים,"מט""ח",2026-01-05,לא,2025-09-02,USD,גורם תלוי/פנימי,קיימת תלות,2025-09-30,3.59,1.0,1250.7,0.1726,3.306,0.007,-0.030401,1.5e-05,,
1329,14304.0,"בנק דיסקונט לישראל בע""מ",520007030.0,ח.פ.,אופציה לס דולר שקל DISCOUNT P3.21 12/03/26 SELL,750000133.0,פנימי,"מט""ח",ישראל,"ארה""ב",שירותים פיננסיים,"מט""ח",2026-03-12,לא,2025-09-12,USD,גורם תלוי/פנימי,קיימת תלות,2025-09-30,3.21,1.0,-416.92,1.0491,3.306,-0.014,0.06161,-3.1e-05,,
1329,14304.0,"בנק הפועלים בע""מ",520000118.0,ח.פ.,אופציה לס דולר שקל POALIM P3.6 06/10/25,750000017.0,פנימי,"מט""ח",ישראל,"ארה""ב",שירותים פיננסיים,"מט""ח",2025-10-06,לא,2025-04-04,USD,גורם תלוי/פנימי,קיימת תלות,2025-09-30,3.6,1.0,833.8,8.8859,3.306,0.245,-1.043654,0.000537,,
1329,14304.0,"בנק הפועלים בע""מ",520000118.0,ח.פ.,אופציה לס דולר שקל POALIM C3.7 05/12/25 SELL,750000096.0,פנימי,"מט""ח",ישראל,"ארה""ב",שירותים פיננסיים,"מט""ח",2025-12-05,לא,2025-07-10,USD,גורם תלוי/פנימי,קיימת תלות,2025-09-30,3.7,1.0,-833.8,0.0268,3.306,-0.001,0.003144,-1e-06,,
1329,14304.0,"בנק הפועלים בע""מ",520000118.0,ח.פ.,אופציה לס דולר שקל POALIM P3.39 05/12/25 SELL,750000058.0,פנימי,"מט""ח",ישראל,"ארה""ב",שירותים פיננסיים,"מט""ח",2025-12-05,לא,2025-06-06,USD,גורם תלוי/פנימי,קיימת תלות,2025-09-30,3.39,1.0,-416.9,3.1116,3.306,-0.043,0.182731,-9.4e-05,,
1329,14304.0,"בנק דיסקונט לישראל בע""מ",520007030.0,ח.פ.,אופציה לס דולר שקל DISCOUNT P3.25 24/03/26 SELL,750000142.0,פנימי,"מט""ח",ישראל,"ארה""ב",שירותים פיננסיים,"מט""ח",2026-03-24,לא,2025-09-22,USD,גורם תלוי/פנימי,קיימת תלות,2025-09-30,3.25,1.0,-416.92,1.5316,3.306,-0.021,0.089951,-4.6e-05,,
1329,14304.0,"Citibank, NA",70652.0,פנימי,אופציה לס דולר שקל CITI C3.38 18/12/25 SELL,750000091.0,פנימי,"מט""ח","חו""ל","ארה""ב",Financial Services,"מט""ח",2025-12-18,לא,2025-07-03,USD,גורם תלוי/פנימי,קיימת תלות,2025-09-30,3.38,1.0,-361.31,0.8985,3.306,-0.011,0.045727,-2.3e-05,,
1329,14304.0,"Citibank, NA",70652.0,פנימי,אופציה לס דולר שקל CITI P3.22 06/03/26 SELL,750000129.0,פנימי,"מט""ח","חו""ל","ארה""ב",Financial Services,"מט""ח",2026-03-06,לא,2025-09-09,USD,גורם תלוי/פנימי,קיימת תלות,2025-09-30,3.22,1.0,-416.9,1.1426,3.306,-0.016,0.067103,-3.4e-05,,
1329,14304.0,"Citibank, NA",70652.0,פנימי,אופציה לס דולר שקל CITI C3.62 18/12/25 BUY,750000092.0,פנימי,"מט""ח","חו""ל","ארה""ב",Financial Services,"מט""ח",2025-12-18,לא,2025-07-03,USD,גורם תלוי/פנימי,קיימת תלות,2025-09-30,3.62,1.0,1083.95,0.0949,3.306,0.003,-0.014483,7e-06,,
1329,14304.0,"Citibank, NA",70652.0,פנימי,אופציה לס דולר שקל CITI C3.60 18/12/25 BUY,750000103.0,פנימי,"מט""ח","חו""ל","ארה""ב",Financial Services,"מט""ח",2025-12-18,לא,2025-07-16,USD,גורם תלוי/פנימי,קיימת תלות,2025-09-30,3.6,1.0,611.46,0.1201,3.306,0.002,-0.010348,5e-06,,
1329,14304.0,Goldman Sachs Group Inc,11778.0,פנימי,אופציה לס אירו שקל GS P3.9 03/10/25 SELL,750000085.0,פנימי,"מט""ח","חו""ל",אירופה,Financial Services,"מט""ח",2025-10-03,לא,2025-07-07,EUR,גורם תלוי/פנימי,קיימת תלות,2025-09-30,3.9,1.0,-138.96,0.6576,3.8807,-0.004,0.015109,-7e-06,,
1329,14304.0,Goldman Sachs Group Inc,11778.0,פנימי,אופציה לס אירו שקל GS P3.7 03/10/25 BUY,750000086.0,פנימי,"מט""ח","חו""ל",אירופה,Financial Services,"מט""ח",2025-10-03,לא,2025-07-01,EUR,גורם תלוי/פנימי,קיימת תלות,2025-09-30,3.7,1.0,694.83,0.0001,3.8807,0.0,-2e-06,0.0,,
1329,14304.0,"Citibank, NA",70652.0,פנימי,אופציה לס דולר שקל CITI C3.575 06/03/26 BUY,750000128.0,פנימי,"מט""ח","חו""ל","ארה""ב",Financial Services,"מט""ח",2026-03-06,לא,2025-09-09,USD,גורם תלוי/פנימי,קיימת תלות,2025-09-30,3.575,1.0,833.81,0.5176,3.306,0.014,-0.06079,3.1e-05,,
1329,14304.0,Goldman Sachs Group Inc,11778.0,פנימי,אופציה לס אירו שקל GS C4.2 03/10/25 BUY,750000122.0,פנימי,"מט""ח","חו""ל",אירופה,Financial Services,"מט""ח",2025-10-03,לא,2025-08-27,EUR,גורם תלוי/פנימי,קיימת תלות,2025-09-30,4.2,1.0,278.32,0.0001,3.8807,0.0,-3e-06,0.0,,
1329,14304.0,"Citibank, NA",70652.0,פנימי,אופציה לס דולר שקל CITI C3.75 18/12/25 SELL,750000102.0,פנימי,"מט""ח","חו""ל","ארה""ב",Financial Services,"מט""ח",2025-12-18,לא,2025-07-16,USD,גורם תלוי/פנימי,קיימת תלות,2025-09-30,3.75,1.0,-611.46,0.0287,3.306,-0.001,0.002472,-1e-06,,
1329,14304.0,Goldman Sachs Group Inc,11778.0,פנימי,אופציה לס אירו שקל GS P3.9 03/10/25 SELL,750000093.0,פנימי,"מט""ח","חו""ל",אירופה,Financial Services,"מט""ח",2025-10-03,לא,2025-07-01,EUR,גורם תלוי/פנימי,קיימת תלות,2025-09-30,3.9,1.0,-556.64,0.6604,3.8807,-0.014,0.060787,-3.1e-05,,
1329,14304.0,"Citibank, NA",70652.0,פנימי,אופציה לס דולר שקל CITI C3.75 18/12/25 BUY,750000067.0,פנימי,"מט""ח","חו""ל","ארה""ב",Financial Services,"מט""ח",2025-12-18,לא,2025-06-17,USD,גורם תלוי/פנימי,קיימת תלות,2025-09-30,3.75,1.0,611.46,0.0299,3.306,0.001,-0.002574,1e-06,,
1329,14304.0,"Citibank, NA",70652.0,פנימי,אופציה לס דולר שקל CITI P3.38 18/12/25 SELL,750000066.0,פנימי,"מט""ח","חו""ל","ארה""ב",Financial Services,"מט""ח",2025-12-18,לא,2025-06-17,USD,גורם תלוי/פנימי,קיימת תלות,2025-09-30,3.38,1.0,-361.31,3.2367,3.306,-0.039,0.164732,-8.4e-05,,
1329,15313.0,"בנק דיסקונט לישראל בע""מ",520007030.0,ח.פ.,אופציה לס דולר שקל DISCOUNT C3.58 23/12/25 BUY,750000076.0,פנימי,"מט""ח",ישראל,"ארה""ב",שירותים פיננסיים,"מט""ח",2025-12-23,לא,2025-06-26,USD,גורם תלוי/פנימי,קיימת תלות,2025-09-30,3.58,1.0,257.18,0.1439,3.306,0.001,-0.008448,2e-06,,
1329,15313.0,"בנק לאומי לישראל בע""מ",520018078.0,ח.פ.,אופציה לס דולר שקל Leumi P3.6 13/10/25 L,750000041.0,פנימי,"מט""ח",ישראל,"ארה""ב",שירותים פיננסיים,"מט""ח",2025-10-13,לא,2025-05-08,USD,גורם תלוי/פנימי,קיימת תלות,2025-09-30,3.6,1.0,514.33,8.8777,3.306,0.151,-1.042649,0.000262,,
1329,15313.0,"בנק דיסקונט לישראל בע""מ",520007030.0,ח.פ.,אופציה לס דולר שקל DISCOUNT P3.29 23/12/25 SELL,750000077.0,פנימי,"מט""ח",ישראל,"ארה""ב",שירותים פיננסיים,"מט""ח",2025-12-23,לא,2025-06-26,USD,גורם תלוי/פנימי,קיימת תלות,2025-09-30,3.29,1.0,-257.18,1.4861,3.306,-0.013,0.087273,-2.1e-05,,
1329,15313.0,"בנק דיסקונט לישראל בע""מ",520007030.0,ח.פ.,אופציה לס דולר שקל DISCOUNT P3.55 08/10/25 BUY,750000046.0,פנימי,"מט""ח",ישראל,"ארה""ב",שירותים פיננסיים,"מט""ח",2025-10-08,לא,2025-05-21,USD,גורם תלוי/פנימי,קיימת תלות,2025-09-30,3.55,1.0,1028.69,7.3726,3.306,0.251,-1.731831,0.000435,,
1329,15313.0,"בנק הפועלים בע""מ",520000118.0,ח.פ.,אופציה לס דולר שקל POALIM C3.70 05/12/25 BUY,750000059.0,פנימי,"מט""ח",ישראל,"ארה""ב",שירותים פיננסיים,"מט""ח",2025-12-05,לא,2025-06-06,USD,גורם תלוי/פנימי,קיימת תלות,2025-09-30,3.7,1.0,514.35,0.0091,3.306,0.0,-0.001065,0.0,,
1329,15313.0,"בנק לאומי לישראל בע""מ",520018078.0,ח.פ.,אופציה לס דולר שקל LEUMI C3.73 01/12/25 BUY,750000053.0,פנימי,"מט""ח",ישראל,"ארה""ב",שירותים פיננסיים,"מט""ח",2025-12-01,לא,2025-05-29,USD,גורם תלוי/פנימי,קיימת תלות,2025-09-30,3.73,1.0,512.63,0.004,3.306,0.0,-0.00047,0.0,,
1329,15313.0,"בנק הפועלים בע""מ",520000118.0,ח.פ.,אופציה לס דולר שקל POALIM P3.5 06/10/25 BUY,750000057.0,פנימי,"מט""ח",ישראל,"ארה""ב",שירותים פיננסיים,"מט""ח",2025-10-06,לא,2025-06-04,USD,גורם תלוי/פנימי,קיימת תלות,2025-09-30,3.5,1.0,514.35,5.8625,3.306,0.1,-0.688558,0.000173,,
1329,15313.0,Goldman Sachs Group Inc,11778.0,פנימי,אופציה לס אירו שקל GS C4.2 03/10/25,750000010.0,פנימי,"מט""ח","חו""ל",אירופה,Financial Services,"מט""ח",2025-10-03,לא,2025-04-03,EUR,גורם תלוי/פנימי,קיימת תלות,2025-09-30,4.2,1.0,-171.69,0.0001,3.8807,0.0,4e-06,0.0,,
1329,15313.0,"בנק הפועלים בע""מ",520000118.0,ח.פ.,אופציה לס דולר שקל POALIM P3.6 06/10/25 SELL,750000056.0,פנימי,"מט""ח",ישראל,"ארה""ב",שירותים פיננסיים,"מט""ח",2025-10-06,לא,2025-06-04,USD,גורם תלוי/פנימי,קיימת תלות,2025-09-30,3.6,1.0,-514.35,8.8822,3.306,-0.151,1.043224,-0.000262,,
1329,15313.0,"בנק לאומי לישראל בע""מ",520018078.0,ח.פ.,אופציה לס דולר שקל LEUMI P3.6 13/10/25 S,750000027.0,פנימי,"מט""ח",ישראל,"ארה""ב",שירותים פיננסיים,"מט""ח",2025-10-13,לא,2025-04-09,USD,גורם תלוי/פנימי,קיימת תלות,2025-09-30,3.6,1.0,-514.33,8.8731,3.306,-0.151,1.042109,-0.000261,,
1329,15313.0,"בנק דיסקונט לישראל בע""מ",520007030.0,ח.פ.,אופציה לס דולר שקל DISCOUNT P3.65 08/10/25 SELL,750000045.0,פנימי,"מט""ח",ישראל,"ארה""ב",שירותים פיננסיים,"מט""ח",2025-10-08,לא,2025-05-21,USD,גורם תלוי/פנימי,קיימת תלות,2025-09-30,3.65,1.0,-1028.69,10.391,3.306,-0.353,2.440987,-0.000613,,
1329,15313.0,Goldman Sachs Group Inc,11778.0,פנימי,אופציה לס אירו שקל GS P3.9 03/10/25,750000011.0,פנימי,"מט""ח","חו""ל",אירופה,Financial Services,"מט""ח",2025-10-03,לא,2025-04-03,EUR,גורם תלוי/פנימי,קיימת תלות,2025-09-30,3.9,1.0,429.22,0.6786,3.8807,0.011,-0.078077,1.9e-05,,
1329,15313.0,Goldman Sachs Group Inc,11778.0,פנימי,אופציה לס אירו שקל GS P3.7 03/10/25,750000012.0,פנימי,"מט""ח","חו""ל",אירופה,Financial Services,"מט""ח",2025-10-03,לא,2025-04-03,EUR,גורם תלוי/פנימי,קיימת תלות,2025-09-30,3.7,1.0,-429.22,0.0001,3.8807,0.0,2e-06,0.0,,
1329,15313.0,"בנק הפועלים בע""מ",520000118.0,ח.פ.,אופציה לס דולר שקל POALIM C3.6 05/12/25 BUY,750000099.0,פנימי,"מט""ח",ישראל,"ארה""ב",שירותים פיננסיים,"מט""ח",2025-12-05,לא,2025-05-14,USD,גורם תלוי/פנימי,קיימת תלות,2025-09-30,3.6,1.0,514.35,0.0815,3.306,0.001,-0.00957,2e-06,,
1329,15313.0,"בנק לאומי לישראל בע""מ",520018078.0,ח.פ.,אופציה לס דולר שקל LEUMI C3.6 01/12/25 BUY,750000098.0,פנימי,"מט""ח",ישראל,"ארה""ב",שירותים פיננסיים,"מט""ח",2025-12-01,לא,2025-07-10,USD,גורם תלוי/פנימי,קיימת תלות,2025-09-30,3.6,1.0,512.63,0.0679,3.306,0.001,-0.007949,1e-06,,
1329,15313.0,"בנק דיסקונט לישראל בע""מ",520007030.0,ח.פ.,אופציה לס דולר שקל DISCOUNT C3.55 13/01/26 BUY,750000117.0,פנימי,"מט""ח",ישראל,"ארה""ב",שירותים פיננסיים,"מט""ח",2026-01-13,לא,2025-08-13,USD,גורם תלוי/פנימי,קיימת תלות,2025-09-30,3.55,1.0,512.63,0.2679,3.306,0.005,-0.031364,7e-06,,
1329,15313.0,"בנק לאומי לישראל בע""מ",520018078.0,ח.פ.,אופציה לס דולר שקל LEUMI C3.60 07/01/26 BUY,750000121.0,פנימי,"מט""ח",ישראל,"ארה""ב",שירותים פיננסיים,"מט""ח",2026-01-07,לא,2025-08-25,USD,גורם תלוי/פנימי,קיימת תלות,2025-09-30,3.6,1.0,768.94,0.1624,3.306,0.004,-0.02852,7e-06,,
1329,15313.0,"בנק דיסקונט לישראל בע""מ",520007030.0,ח.פ.,אופציה לס דולר שקל DISCOUNT C3.575 12/03/26 BUY,750000132.0,פנימי,"מט""ח",ישראל,"ארה""ב",שירותים פיננסיים,"מט""ח",2026-03-12,לא,2025-09-12,USD,גורם תלוי/פנימי,קיימת תלות,2025-09-30,3.575,1.0,514.38,0.5282,3.306,0.009,-0.062043,1.5e-05,,
1329,15313.0,"בנק הפועלים בע""מ",520000118.0,ח.פ.,אופציה לס דולר שקל POALIM P3.25 26/03/26 SELL,750000146.0,פנימי,"מט""ח",ישראל,"ארה""ב",שירותים פיננסיים,"מט""ח",2026-03-26,לא,2025-09-26,USD,גורם תלוי/פנימי,קיימת תלות,2025-09-30,3.25,1.0,-257.19,1.582,3.306,-0.013,0.092907,-2.3e-05,,
1329,15313.0,"בנק הפועלים בע""מ",520000118.0,ח.פ.,אופציה לס דולר שקל POALIM C3.7 05/12/25 SELL 15/07,750000100.0,פנימי,"מט""ח",ישראל,"ארה""ב",שירותים פיננסיים,"מט""ח",2025-12-05,לא,2025-05-14,USD,גורם תלוי/פנימי,קיימת תלות,2025-09-30,3.7,1.0,-514.35,0.0277,3.306,0.0,0.003254,0.0,,
1329,15313.0,"בנק הפועלים בע""מ",520000118.0,ח.פ.,אופציה לס דולר שקל POALIM C3.5 05/12/25 BUY,750000095.0,פנימי,"מט""ח",ישראל,"ארה""ב",שירותים פיננסיים,"מט""ח",2025-12-05,לא,2025-07-10,USD,גורם תלוי/פנימי,קיימת תלות,2025-09-30,3.5,1.0,514.35,0.2323,3.306,0.004,-0.02728,6e-06,,
1329,15313.0,"בנק לאומי לישראל בע""מ",520018078.0,ח.פ.,אופציה לס דולר שקל LEUMI C3.73 01/12/25 SELL,750000097.0,פנימי,"מט""ח",ישראל,"ארה""ב",שירותים פיננסיים,"מט""ח",2025-12-01,לא,2025-07-10,USD,גורם תלוי/פנימי,קיימת תלות,2025-09-30,3.73,1.0,-512.63,0.0145,3.306,0.0,0.001696,0.0,,
1329,15313.0,"בנק דיסקונט לישראל בע""מ",520007030.0,ח.פ.,אופציה לס דולר שקל DISCOUNT C3.29 23/12/25 SELL,750000094.0,פנימי,"מט""ח",ישראל,"ארה""ב",שירותים פיננסיים,"מט""ח",2025-12-23,לא,2025-07-10,USD,גורם תלוי/פנימי,קיימת תלות,2025-09-30,3.29,1.0,-257.18,2.0174,3.306,-0.017,0.118473,-2.9e-05,,
1329,15313.0,"בנק דיסקונט לישראל בע""מ",520007030.0,ח.פ.,אופציה לס דולר שקל DISCOUNT P3.65 08/10/25,750000019.0,פנימי,"מט""ח",ישראל,"ארה""ב",שירותים פיננסיים,"מט""ח",2025-10-08,לא,2025-04-08,USD,גורם תלוי/פנימי,קיימת תלות,2025-09-30,3.65,1.0,1028.69,10.394,3.306,0.354,-2.441655,0.000613,,
1329,15313.0,"בנק הפועלים בע""מ",520000118.0,ח.פ.,אופציה לס דולר שקל POALIM C3.59 26/03/26 BUY,750000145.0,פנימי,"מט""ח",ישראל,"ארה""ב",שירותים פיננסיים,"מט""ח",2026-03-26,לא,2025-09-26,USD,גורם תלוי/פנימי,קיימת תלות,2025-09-30,3.59,1.0,514.38,0.5462,3.306,0.009,-0.064154,1.6e-05,,
1329,15313.0,"בנק הפועלים בע""מ",520000118.0,ח.פ.,אופציה לס דולר שקל POALIM P3.5 06/10/25,750000016.0,פנימי,"מט""ח",ישראל,"ארה""ב",שירותים פיננסיים,"מט""ח",2025-10-06,לא,2025-04-04,USD,גורם תלוי/פנימי,קיימת תלות,2025-09-30,3.5,1.0,-514.35,5.8612,3.306,-0.1,0.688405,-0.000173,,
1329,15313.0,"בנק לאומי לישראל בע""מ",520018078.0,ח.פ.,אופציה לס דולר שקל LEUMI P3.7 13/10/25 L,750000029.0,פנימי,"מט""ח",ישראל,"ארה""ב",שירותים פיננסיים,"מט""ח",2025-10-13,לא,2025-04-09,USD,גורם תלוי/פנימי,קיימת תלות,2025-09-30,3.7,1.0,514.33,11.897,3.306,0.202,-1.397332,0.000351,,
1329,15313.0,"בנק דיסקונט לישראל בע""מ",520007030.0,ח.פ.,אופציה לס דולר שקל DISCOUNT C3.4 26/11/25 SELL,750000116.0,פנימי,"מט""ח",ישראל,"ארה""ב",שירותים פיננסיים,"מט""ח",2025-11-26,לא,2025-08-13,USD,גורם תלוי/פנימי,קיימת תלות,2025-09-30,3.4,1.0,-256.31,0.4649,3.306,-0.004,0.027212,-6e-06,,
1329,15313.0,Goldman Sachs Group Inc,11778.0,פנימי,"אופציה לס GS C1,637.14 ESLT.TA 15/10/25 SELL",750000115.0,פנימי,מניה,ישראל,ישראל,Financial Services,מניות לרבות מדדי מניות,2025-10-15,לא,2025-08-12,ILS,גורם תלוי/פנימי,קיימת תלות,2025-09-30,1637.14,1.0,-0.07,7692.5,1.0,-0.006,0.040766,-1e-05,,
1329,15313.0,"בנק דיסקונט לישראל בע""מ",520007030.0,ח.פ.,אופציה לס דולר שקל DISCOUNT C3.75 26/11/25 BUY,750000049.0,פנימי,"מט""ח",ישראל,"ארה""ב",שירותים פיננסיים,"מט""ח",2025-11-26,לא,2025-05-28,USD,גורם תלוי/פנימי,קיימת תלות,2025-09-30,3.75,1.0,512.63,0.0018,3.306,0.0,-0.000215,0.0,,
1329,15313.0,"בנק דיסקונט לישראל בע""מ",520007030.0,ח.פ.,אופציה לס דולר שקל DISCOUNT P3.55 08/10/25,750000020.0,פנימי,"מט""ח",ישראל,"ארה""ב",שירותים פיננסיים,"מט""ח",2025-10-08,לא,2025-04-08,USD,גורם תלוי/פנימי,קיימת תלות,2025-09-30,3.55,1.0,-1028.69,7.3698,3.306,-0.251,1.73117,-0.000435,,
1329,15313.0,"בנק דיסקונט לישראל בע""מ",520007030.0,ח.פ.,אופציה לס דולר שקל DISCOUNT C3.6 24/03/26 BUY,750000141.0,פנימי,"מט""ח",ישראל,"ארה""ב",שירותים פיננסיים,"מט""ח",2026-03-24,לא,2025-09-22,USD,גורם תלוי/פנימי,קיימת תלות,2025-09-30,3.6,1.0,514.38,0.4815,3.306,0.008,-0.056551,1.4e-05,,
1329,15313.0,"בנק לאומי לישראל בע""מ",520018078.0,ח.פ.,אופציה לס דולר שקל LEUMI C3.38 01/12/25 SELL,750000120.0,פנימי,"מט""ח",ישראל,"ארה""ב",שירותים פיננסיים,"מט""ח",2025-12-01,לא,2025-08-25,USD,גורם תלוי/פנימי,קיימת תלות,2025-09-30,3.38,1.0,-256.31,0.636,3.306,-0.005,0.037222,-9e-06,,
1329,15313.0,"בנק לאומי לישראל בע""מ",520018078.0,ח.פ.,אופציה לס דולר שקל LEUMI C3.39 05/12/25 SELL,750000124.0,פנימי,"מט""ח",ישראל,"ארה""ב",שירותים פיננסיים,"מט""ח",2025-12-05,לא,2025-09-02,USD,גורם תלוי/פנימי,קיימת תלות,2025-09-30,3.39,1.0,-257.17,0.6353,3.306,-0.005,0.037306,-9e-06,,
1329,15313.0,"בנק לאומי לישראל בע""מ",520018078.0,ח.פ.,אופציה לס דולר שקל LEUMI P3.38 01/12/25 SELL,750000052.0,פנימי,"מט""ח",ישראל,"ארה""ב",שירותים פיננסיים,"מט""ח",2025-12-01,לא,2025-05-29,USD,גורם תלוי/פנימי,קיימת תלות,2025-09-30,3.38,1.0,-256.31,2.8466,3.306,-0.024,0.166609,-4.1e-05,,
1329,15313.0,"בנק דיסקונט לישראל בע""מ",520007030.0,ח.פ.,אופציה לס דולר שקל DISCOUNT P3.4 26/11/25 SELL,750000048.0,פנימי,"מט""ח",ישראל,"ארה""ב",שירותים פיננסיים,"מט""ח",2025-11-26,לא,2025-05-28,USD,גורם תלוי/פנימי,קיימת תלות,2025-09-30,3.4,1.0,-256.31,3.267,3.306,-0.028,0.191216,-4.8e-05,,
1329,15313.0,"בנק לאומי לישראל בע""מ",520018078.0,ח.פ.,אופציה לס דולר שקל Leumi P3.7 13/10/25 S,750000040.0,פנימי,"מט""ח",ישראל,"ארה""ב",שירותים פיננסיים,"מט""ח",2025-10-13,לא,2025-05-08,USD,גורם תלוי/פנימי,קיימת תלות,2025-09-30,3.7,1.0,-514.33,11.893,3.306,-0.202,1.396785,-0.000351,,
1329,15313.0,"בנק לאומי לישראל בע""מ",520018078.0,ח.פ.,אופציה לס דולר שקל LEUMI C3.59 06/01/26 BUY,750000125.0,פנימי,"מט""ח",ישראל,"ארה""ב",שירותים פיננסיים,"מט""ח",2026-01-05,לא,2025-09-02,USD,גורם תלוי/פנימי,קיימת תלות,2025-09-30,3.59,1.0,771.53,0.1726,3.306,0.004,-0.030401,7e-06,,
1329,15313.0,"בנק דיסקונט לישראל בע""מ",520007030.0,ח.פ.,אופציה לס דולר שקל DISCOUNT P3.21 12/03/26 SELL,750000133.0,פנימי,"מט""ח",ישראל,"ארה""ב",שירותים פיננסיים,"מט""ח",2026-03-12,לא,2025-09-12,USD,גורם תלוי/פנימי,קיימת תלות,2025-09-30,3.21,1.0,-257.19,1.0491,3.306,-0.009,0.06161,-1.5e-05,,
1329,15313.0,"בנק הפועלים בע""מ",520000118.0,ח.פ.,אופציה לס דולר שקל POALIM C3.7 05/12/25 SELL,750000096.0,פנימי,"מט""ח",ישראל,"ארה""ב",שירותים פיננסיים,"מט""ח",2025-12-05,לא,2025-07-10,USD,גורם תלוי/פנימי,קיימת תלות,2025-09-30,3.7,1.0,-514.35,0.0268,3.306,0.0,0.003144,0.0,,
1329,15313.0,"בנק הפועלים בע""מ",520000118.0,ח.פ.,אופציה לס דולר שקל POALIM P3.6 06/10/25,750000017.0,פנימי,"מט""ח",ישראל,"ארה""ב",שירותים פיננסיים,"מט""ח",2025-10-06,לא,2025-04-04,USD,גורם תלוי/פנימי,קיימת תלות,2025-09-30,3.6,1.0,514.35,8.8859,3.306,0.151,-1.043654,0.000262,,
1329,15313.0,"בנק הפועלים בע""מ",520000118.0,ח.פ.,אופציה לס דולר שקל POALIM P3.39 05/12/25 SELL,750000058.0,פנימי,"מט""ח",ישראל,"ארה""ב",שירותים פיננסיים,"מט""ח",2025-12-05,לא,2025-06-06,USD,גורם תלוי/פנימי,קיימת תלות,2025-09-30,3.39,1.0,-257.17,3.1116,3.306,-0.026,0.182731,-4.5e-05,,
1329,15313.0,"בנק דיסקונט לישראל בע""מ",520007030.0,ח.פ.,אופציה לס דולר שקל DISCOUNT P3.25 24/03/26 SELL,750000142.0,פנימי,"מט""ח",ישראל,"ארה""ב",שירותים פיננסיים,"מט""ח",2026-03-24,לא,2025-09-22,USD,גורם תלוי/פנימי,קיימת תלות,2025-09-30,3.25,1.0,-257.19,1.5316,3.306,-0.013,0.089951,-2.2e-05,,
1329,15313.0,"Citibank, NA",70652.0,פנימי,אופציה לס דולר שקל CITI C3.38 18/12/25 SELL,750000091.0,פנימי,"מט""ח","חו""ל","ארה""ב",Financial Services,"מט""ח",2025-12-18,לא,2025-07-03,USD,גורם תלוי/פנימי,קיימת תלות,2025-09-30,3.38,1.0,-222.88,0.8985,3.306,-0.007,0.045727,-1.1e-05,,
1329,15313.0,"Citibank, NA",70652.0,פנימי,אופציה לס דולר שקל CITI P3.22 06/03/26 SELL,750000129.0,פנימי,"מט""ח","חו""ל","ארה""ב",Financial Services,"מט""ח",2026-03-06,לא,2025-09-09,USD,גורם תלוי/פנימי,קיימת תלות,2025-09-30,3.22,1.0,-257.17,1.1426,3.306,-0.01,0.067103,-1.6e-05,,
1329,15313.0,Goldman Sachs Group Inc,11778.0,פנימי,אופציה לס אירו שקל GS P3.9 03/10/25 SELL,750000085.0,פנימי,"מט""ח","חו""ל",אירופה,Financial Services,"מט""ח",2025-10-03,לא,2025-07-07,EUR,גורם תלוי/פנימי,קיימת תלות,2025-09-30,3.9,1.0,-85.72,0.6576,3.8807,-0.002,0.015109,-3e-06,,
1329,15313.0,Goldman Sachs Group Inc,11778.0,פנימי,אופציה לס אירו שקל GS P3.7 03/10/25 BUY,750000086.0,פנימי,"מט""ח","חו""ל",אירופה,Financial Services,"מט""ח",2025-10-03,לא,2025-07-01,EUR,גורם תלוי/פנימי,קיימת תלות,2025-09-30,3.7,1.0,428.62,0.0001,3.8807,0.0,-2e-06,0.0,,
1329,15313.0,"Citibank, NA",70652.0,פנימי,אופציה לס דולר שקל CITI C3.60 18/12/25 BUY,750000103.0,פנימי,"מט""ח","חו""ל","ארה""ב",Financial Services,"מט""ח",2025-12-18,לא,2025-07-16,USD,גורם תלוי/פנימי,קיימת תלות,2025-09-30,3.6,1.0,377.19,0.1201,3.306,0.001,-0.010348,2e-06,,
1329,15313.0,"Citibank, NA",70652.0,פנימי,אופציה לס דולר שקל CITI C3.62 18/12/25 BUY,750000092.0,פנימי,"מט""ח","חו""ל","ארה""ב",Financial Services,"מט""ח",2025-12-18,לא,2025-07-03,USD,גורם תלוי/פנימי,קיימת תלות,2025-09-30,3.62,1.0,668.66,0.0949,3.306,0.002,-0.014483,3e-06,,
1329,15313.0,"Citibank, NA",70652.0,פנימי,אופציה לס דולר שקל CITI C3.575 06/03/26 BUY,750000128.0,פנימי,"מט""ח","חו""ל","ארה""ב",Financial Services,"מט""ח",2026-03-06,לא,2025-09-09,USD,גורם תלוי/פנימי,קיימת תלות,2025-09-30,3.575,1.0,514.35,0.5176,3.306,0.009,-0.06079,1.5e-05,,
1329,15313.0,Goldman Sachs Group Inc,11778.0,פנימי,אופציה לס אירו שקל GS C4.2 03/10/25 BUY,750000122.0,פנימי,"מט""ח","חו""ל",אירופה,Financial Services,"מט""ח",2025-10-03,לא,2025-08-27,EUR,גורם תלוי/פנימי,קיימת תלות,2025-09-30,4.2,1.0,171.69,0.0001,3.8807,0.0,-3e-06,0.0,,
1329,15313.0,"Citibank, NA",70652.0,פנימי,אופציה לס דולר שקל CITI C3.75 18/12/25 SELL,750000102.0,פנימי,"מט""ח","חו""ל","ארה""ב",Financial Services,"מט""ח",2025-12-18,לא,2025-07-16,USD,גורם תלוי/פנימי,קיימת תלות,2025-09-30,3.75,1.0,-377.19,0.0287,3.306,0.0,0.002472,0.0,,
1329,15313.0,Goldman Sachs Group Inc,11778.0,פנימי,אופציה לס אירו שקל GS P3.9 03/10/25 SELL,750000093.0,פנימי,"מט""ח","חו""ל",אירופה,Financial Services,"מט""ח",2025-10-03,לא,2025-07-01,EUR,גורם תלוי/פנימי,קיימת תלות,2025-09-30,3.9,1.0,-343.38,0.6604,3.8807,-0.009,0.060787,-1.5e-05,,
1329,15313.0,"Citibank, NA",70652.0,פנימי,אופציה לס דולר שקל CITI C3.75 18/12/25 BUY,750000067.0,פנימי,"מט""ח","חו""ל","ארה""ב",Financial Services,"מט""ח",2025-12-18,לא,2025-06-17,USD,גורם תלוי/פנימי,קיימת תלות,2025-09-30,3.75,1.0,377.19,0.0299,3.306,0.0,-0.002574,0.0,,
1329,15313.0,"Citibank, NA",70652.0,פנימי,אופציה לס דולר שקל CITI P3.38 18/12/25 SELL,750000066.0,פנימי,"מט""ח","חו""ל","ארה""ב",Financial Services,"מט""ח",2025-12-18,לא,2025-06-17,USD,גורם תלוי/פנימי,קיימת תלות,2025-09-30,3.38,1.0,-222.88,3.2367,3.306,-0.024,0.164732,-4.1e-05,,
1328,13819.0,,,,,,,,,,,,,,,,,,,,,,,,,,,,
1329,13820.0,,,,,,,,,,,,,,,,,,,,,,,,,,,,
1329,14305.0,,,,,,,,,,,,,,,,,,,,,,,,,,,,
1328,14303.0,,,,,,,,,,,,,,,,,,,,,,,,,,,,
1329,14854.0,,,,,,,,,,,,,,,,,,,,,,,,,,,,
1328,14850.0,,,,,,,,,,,,,,,,,,,,,,,,,,,,
סוף מידע,,,,,,,,,,,,,,,,,,,,,,,,,,,,,
